ID	UPCEAN	Name	CategoryID	CategoryName	BrandID	BrandName
387938	3253581084427	L'occitane маска-пилинг для лица лаванда 084427	5586	Косметика (folder)/Косметика	308056	L'Occitane
387834	3253581021156	L'occitane маска-скраб для рук 150мл 021156	5586	Косметика (folder)/Косметика	308056	L'Occitane
388062	3253581107171	L'occitane маска-скраб смягч для рук 50мл 107171	5586	Косметика (folder)/Косметика	308056	L'Occitane
387974	3253581086926	L'occitane масло карите вербена 086926	5586	Косметика (folder)/Косметика	308056	L'Occitane
387973	3253581086919	L'occitane масло карите лаванда 086919	5586	Косметика (folder)/Косметика	308056	L'Occitane
388102	3253581113837	L'occitane массажер тонизирующий 113837	5586	Косметика (folder)/Косметика	308056	L'Occitane
1043509	3253581145678	L'occitane мед мыло фигурное мед и лимон 100г	24286	Продукты питания (folder)/Мед	308056	L'Occitane
388006	3253581095973	L'occitane медовая вода 100мл 095973	5586	Косметика (folder)/Косметика	308056	L'Occitane
388095	3253581112564	L'occitane мерцающая Пудра 4 королевы 112564	272015	Косметика (folder)/Пудра	308056	L'Occitane
1043512	3253581137437	L'occitane миндаль бархатный гель для кожи вокруг глаз 15мл	5586	Косметика (folder)/Косметика	308056	L'Occitane
1043513	3253581137413	L'occitane миндаль бархатный флюид для лица миндаль-яблоко 50мл	5586	Косметика (folder)/Косметика	308056	L'Occitane
1043514	3253581163139	L'occitane миндаль гель для тела восхитительный силуэт 200мл	5586	Косметика (folder)/Косметика	308056	L'Occitane
1043515	3253581210871	L'occitane миндаль гель для тела восхитительный силуэт 200мл #2	5586	Косметика (folder)/Косметика	308056	L'Occitane
1043516	3253581163153	L'occitane миндаль Крем для лица миндаль-яблоко 50мл	664	Косметика (folder)/Крем для лица	308056	L'Occitane
1043517	3253581210857	L'occitane миндаль моделирующий гель для тела миндаль 200мл	5586	Косметика (folder)/Косметика	308056	L'Occitane
1043519	3253581210864	L'occitane миндаль скраб для душа миндаль 200мл	5586	Косметика (folder)/Косметика	308056	L'Occitane
1043520	3253581137062	L'occitane миндаль скраб для лица миндаль-яблоко 100мл	5586	Косметика (folder)/Косметика	308056	L'Occitane
2164855	3253581288153	L'occitane миндальное дерево гель-Крем для ног против усталости миндаль 75мл	1	Неклассифицированные/default	308056	L'Occitane
619794	3253581107812	L'occitane миндальное дерево масло для душа увлажняющее 250мл	32377	Косметика (folder)/Уход за кожей	308056	L'Occitane
2617359	3253581359259	L'occitane миндальное дерево масло для душа увлажняющее 250мл #2	1	Неклассифицированные/default	308056	L'Occitane
2617360	3253581288023	L'occitane миндальное дерево масло для тела миндальное смягчающее 100мл	1	Неклассифицированные/default	308056	L'Occitane
2164856	3253581247235	L'occitane миндальное дерево моделирующий гель для тела 200мл	1	Неклассифицированные/default	308056	L'Occitane
388124	3253581119181	L'occitane мини-помандер 119181	5586	Косметика (folder)/Косметика	308056	L'Occitane
1043529	3253581181782	L'occitane молочко красоты для тела пион 250мл	897047	Косметика (folder)/Уход за телом	308056	L'Occitane
387987	3253581088364	L'occitane молочко очищающее бессмертник 088364	5586	Косметика (folder)/Косметика	308056	L'Occitane
1043530	3253581147658	L'occitane молочко очищающее ультра-комфорт 200мл	1	Неклассифицированные/default	308056	L'Occitane
388037	3253581106310	L'occitane молочко увлажняющее мимоза 106310	5586	Косметика (folder)/Косметика	308056	L'Occitane
387889	3253581075012	L'occitane молочко увлажняющее оливки 075012	5586	Косметика (folder)/Косметика	308056	L'Occitane
388039	3253581106464	L'occitane молочко увлажняющее розовое 106464	5586	Косметика (folder)/Косметика	308056	L'Occitane
2164857	3253581234648	L'occitane мужская линия гель для ванн и душа ветивер 250мл	1	Неклассифицированные/default	308056	L'Occitane
2164858	3253581279502	L'occitane мужская линия гель для душа кедр и апельсиновое дерево 175мл	1	Неклассифицированные/default	308056	L'Occitane
388059	3253581107096	L'occitane мусс для рук очищ молоко 107096	5586	Косметика (folder)/Косметика	308056	L'Occitane
387908	3253581075913	L'occitane мусс для рук очищ оливки 075913	5586	Косметика (folder)/Косметика	308056	L'Occitane
1525759	3253581256381	L'occitane набор (Крем для бритья 200мл + бальзам после бритья. 75мл) 2предм	1105	Гигиена (folder)/Средства для бритья	308056	L'Occitane
388114	3253581115664	L'occitane набор лучшее от карите 115664	5586	Косметика (folder)/Косметика	308056	L'Occitane
2012271	3253581320471	L'occitane набор нежное карите	1	Неклассифицированные/default	308056	L'Occitane
388123	3253581119143	L'occitane набор свечей ассорти №6 119143	5586	Косметика (folder)/Косметика	308056	L'Occitane
1043532	3253581053034	L'occitane нежный Крем для тела вишневый цвет 250мл	331154	Косметика (folder)/Крем для тела	308056	L'Occitane
388078	3253581111550	L'occitane нектар для мас-жа медов 250мл 111550	5586	Косметика (folder)/Косметика	308056	L'Occitane
387975	3253581087206	L'occitane ночной Крем 75мл 087206	5586	Косметика (folder)/Косметика	308056	L'Occitane
1043535	3253581144367	L'occitane олива молочко очищающее олива органик 150мл	1	Неклассифицированные/default	308056	L'Occitane
388096	3253581113141	L'occitane осв-ль воздуха конц зеленый чай 113141	5586	Косметика (folder)/Косметика	308056	L'Occitane
1043536	3253581164587	L'occitane освежающий дезодорант вердон муж 75г	1	Неклассифицированные/default	308056	L'Occitane
1043537	3253581164549	L'occitane освежающий лосьон после бритья вердон 150мл	130	Гигиена (folder)/После бритья	308056	L'Occitane
387945	3253581085806	L'occitane палочки аром амбра 085806	5586	Косметика (folder)/Косметика	308056	L'Occitane
388127	3253581119464	L'occitane палочки аром амбра 119464	343163	Хозяйственные товары (folder)/Ароматизатор	308056	L'Occitane
388017	3253581104453	L'occitane палочки аром апельс цвет №40 104453	5586	Косметика (folder)/Косметика	308056	L'Occitane
387958	3253581086520	L'occitane палочки аром ваниль №40 086520	5586	Косметика (folder)/Косметика	308056	L'Occitane
387947	3253581085820	L'occitane палочки аром зимний лес 085820	5586	Косметика (folder)/Косметика	308056	L'Occitane
387948	3253581085844	L'occitane палочки аром кедр-ветивер 085844	5586	Косметика (folder)/Косметика	308056	L'Occitane
387863	3253581039861	L'occitane палочки аром лаванда №40 039861	5586	Косметика (folder)/Косметика	308056	L'Occitane
387845	3253581028209	L'occitane палочки аром мадаг ваниль №40 028209	5586	Косметика (folder)/Косметика	308056	L'Occitane
388003	3253581095799	L'occitane палочки аром медовые №40 095799	5586	Косметика (folder)/Косметика	308056	L'Occitane
387954	3253581086476	L'occitane палочки аром роза №40 086476	5586	Косметика (folder)/Косметика	308056	L'Occitane
387946	3253581085813	L'occitane палочки аром цукаты 085813	5586	Косметика (folder)/Косметика	308056	L'Occitane
388128	3253581119471	L'occitane палочки аром цукаты 119471	343163	Хозяйственные товары (folder)/Ароматизатор	308056	L'Occitane
387900	3253581075548	L'occitane паста оливковая для волос 075548	5586	Косметика (folder)/Косметика	308056	L'Occitane
388068	3253581107515	L'occitane паста-скраб для тела миндальн 107515	5586	Косметика (folder)/Косметика	308056	L'Occitane
1043539	3253581197844	L'occitane пион Крем для душа пион 250мл	1	Неклассифицированные/default	308056	L'Occitane
1043540	3253581244661	L'occitane пион молочко красоты для тела пион 250мл	897047	Косметика (folder)/Уход за телом	308056	L'Occitane
388014	3253581104262	L'occitane подставка для благовоний-помандер 104262	5586	Косметика (folder)/Косметика	308056	L'Occitane
387887	3253581071717	L'occitane подставка для палочек парфюмер 071717	5586	Косметика (folder)/Косметика	308056	L'Occitane
387936	3253581084229	L'occitane раствор лаванды 50мл 084229	5586	Косметика (folder)/Косметика	308056	L'Occitane
388021	3253581105337	L'occitane салф освеж вербена №15 105337	5586	Косметика (folder)/Косметика	308056	L'Occitane
388092	3253581112397	L'occitane салф освеж зеленый чай №15 112397	5586	Косметика (folder)/Косметика	308056	L'Occitane
1043541	3253581145647	L'occitane сахар-скраб для тела мед и лимон 250мл	897047	Косметика (folder)/Уход за телом	308056	L'Occitane
388025	3253581105412	L'occitane саше вербена 35г 105412	5586	Косметика (folder)/Косметика	308056	L'Occitane
387928	3253581083239	L'occitane саше лаванда 083239	5586	Косметика (folder)/Косметика	308056	L'Occitane
388030	3253581105924	L'occitane саше лаванда 105924	5586	Косметика (folder)/Косметика	308056	L'Occitane
387927	3253581083222	L'occitane саше роза 083222	5586	Косметика (folder)/Косметика	308056	L'Occitane
387950	3253581086414	L'occitane саше роза 086414	5586	Косметика (folder)/Косметика	308056	L'Occitane
387949	3253581086377	L'occitane свеча амбра 200г 086377	5586	Косметика (folder)/Косметика	308056	L'Occitane
388015	3253581104279	L'occitane свеча апельсин 200г 104279	5586	Косметика (folder)/Косметика	308056	L'Occitane
388120	3253581119037	L'occitane свеча аром аромат леса 119037	5586	Косметика (folder)/Косметика	308056	L'Occitane
387957	3253581086513	L'occitane свеча аром ваниль 100г 086513	5586	Косметика (folder)/Косметика	308056	L'Occitane
388119	3253581119013	L'occitane свеча аром имбирн пряник 119013	5586	Косметика (folder)/Косметика	308056	L'Occitane
388122	3253581119129	L'occitane свеча аром каштан и тыква 119129	5586	Косметика (folder)/Косметика	308056	L'Occitane
388121	3253581119044	L'occitane свеча аром Крем-карамель 119044	5586	Косметика (folder)/Косметика	308056	L'Occitane
387951	3253581086445	L'occitane свеча аром магнолия 100г 086445	5586	Косметика (folder)/Косметика	308056	L'Occitane
387961	3253581086575	L'occitane свеча аром мимоза 100г 086575	5586	Косметика (folder)/Косметика	308056	L'Occitane
388118	3253581119006	L'occitane свеча аром осенний инжир 119006	5586	Косметика (folder)/Косметика	308056	L'Occitane
387953	3253581086469	L'occitane свеча аром роза 100г 086469	5586	Косметика (folder)/Косметика	308056	L'Occitane
387855	3253581031803	L'occitane свеча вербена 031803	5586	Косметика (folder)/Косметика	308056	L'Occitane
387862	3253581039854	L'occitane свеча лаванда 039854	5586	Косметика (folder)/Косметика	308056	L'Occitane
388028	3253581105610	L'occitane свеча летняя ночь 105610	5586	Косметика (folder)/Косметика	308056	L'Occitane
388002	3253581095782	L'occitane свеча медовая 100г 095782	5586	Косметика (folder)/Косметика	308056	L'Occitane
387942	3253581085516	L'occitane свеча морской Бриз 100г 085516	5586	Косметика (folder)/Косметика	308056	L'Occitane
387911	3253581081983	L'occitane свеча очищающая 081983	5586	Косметика (folder)/Косметика	308056	L'Occitane
387912	3253581081990	L'occitane свеча расслабляющая 081990	5586	Косметика (folder)/Косметика	308056	L'Occitane
1043542	3253581167519	L'occitane скраб выравнивающий для лица иммортель 75мл	16248	Косметика (folder)/Скраб	308056	L'Occitane
387894	3253581075210	L'occitane скраб для лица оливки 075210	5586	Косметика (folder)/Косметика	308056	L'Occitane
387980	3253581087442	L'occitane скраб для ног 087442	5586	Косметика (folder)/Косметика	308056	L'Occitane
387971	3253581086827	L'occitane скраб мягкий для лица 086827	5586	Косметика (folder)/Косметика	308056	L'Occitane
387937	3253581084410	L'occitane скраб нежный для тела лаванда 084410	5586	Косметика (folder)/Косметика	308056	L'Occitane
1043544	3253581051818	L'occitane скраб разглаживающий бессмертник 75мл	5586	Косметика (folder)/Косметика	308056	L'Occitane
388052	3253581106716	L'occitane смесь для ванн ванильн молоко 106716	5586	Косметика (folder)/Косметика	308056	L'Occitane
387899	3253581075531	L'occitane смесь оливковая для ванн 075531	5586	Косметика (folder)/Косметика	308056	L'Occitane
387865	3253581039892	L'occitane соль для ванн лаванда 039892	5586	Косметика (folder)/Косметика	308056	L'Occitane
387851	3253581031490	L'occitane соль-скраб для тела вербена 031490	5586	Косметика (folder)/Косметика	308056	L'Occitane
2012156	3253581253939	L'occitane спрей для объема волос 100мл	1	Неклассифицированные/default	308056	L'Occitane
387870	3253581047217	L'occitane спрей расслабляющий 047217	5586	Косметика (folder)/Косметика	308056	L'Occitane
387993	3253581089071	L'occitane сыворотка для губ 15мл 089071	5586	Косметика (folder)/Косметика	308056	L'Occitane
1043546	3253581051719	L'occitane сыворотка для кожи вокруг глаз 15мл	5586	Косметика (folder)/Косметика	308056	L'Occitane
387994	3253581089088	L'occitane сыворотка для лица 30мл 089088	5586	Косметика (folder)/Косметика	308056	L'Occitane
388112	3253581115121	L'occitane сыворотка для лица анти-пигм 30мл 115121	5586	Косметика (folder)/Косметика	308056	L'Occitane
387991	3253581088456	L'occitane сыворотка для тела 088456	5586	Косметика (folder)/Косметика	308056	L'Occitane
1043548	3253581111086	L'occitane тонизирующая вода вербена-цитрус 150мл	1	Неклассифицированные/default	308056	L'Occitane
619806	3253581164556	L'occitane тонизирующий увлажняющий гель для лица вердон 50мл	32377	Косметика (folder)/Уход за кожей	308056	L'Occitane
2617361	3253581296462	L'occitane увлажняющий Крем ангелика 50мл	1	Неклассифицированные/default	308056	L'Occitane
388107	3253581115008	L'occitane флюид very precoius fluid 30мл 115008	5586	Косметика (folder)/Косметика	308056	L'Occitane
1043557	3253581197356	L'occitane флюид для лица увлажняющий spf15 ангелика 30мл	1	Неклассифицированные/default	308056	L'Occitane
388035	3253581106112	L'occitane флюид матирующий лаванда 106112	5586	Косметика (folder)/Косметика	308056	L'Occitane
388070	3253581107539	L'occitane флюид миндальный цвет 100мл 107539	5586	Косметика (folder)/Косметика	308056	L'Occitane
387983	3253581088319	L'occitane флюид эфирный 30мл 088319	5586	Косметика (folder)/Косметика	308056	L'Occitane
387986	3253581088340	L'occitane флюид эфирный spf15 088340	5586	Косметика (folder)/Косметика	308056	L'Occitane
388079	3253581111567	L'occitane флюид-комф очищ медовый 111567	5586	Косметика (folder)/Косметика	308056	L'Occitane
2012157	3253581306208	L'occitane шампунь вербена 250мл	1412	Уход за волосами (folder)/Шампунь	308056	L'Occitane
542173	3253581096963	L'occitane шампунь и тела тонизирующий 250мл	1412	Уход за волосами (folder)/Шампунь	308056	L'Occitane
387903	3253581075869	L'occitane Экспресс-маска улучш цвет 075869	5586	Косметика (folder)/Косметика	308056	L'Occitane
1043558	3253581150740	L'occitane эксфолиант рисовые хлопья 50г	1	Неклассифицированные/default	308056	L'Occitane
387982	3253581088302	L'occitane эликсир бессмертник 088302	5586	Косметика (folder)/Косметика	308056	L'Occitane
388111	3253581115107	L'occitane эликсир для лица бессмертник 30мл 115108	5586	Косметика (folder)/Косметика	308056	L'Occitane
387989	3253581088418	L'occitane эликсир для тела бессмертник 088418	5586	Косметика (folder)/Косметика	308056	L'Occitane
387906	3253581075890	L'occitane эмульсия очищающая оливки 075890	5586	Косметика (folder)/Косметика	308056	L'Occitane
1043559	3253581147757	L'occitane эмульсия очищающая ультра-питание 125мл	1	Неклассифицированные/default	308056	L'Occitane
2164835	3253581263594	L'occitane эссенция совершенство ангелика-ирис 30мл	1	Неклассифицированные/default	308056	L'Occitane
1043560	3253581167205	L'occitane эфирный флюид 30мл	5586	Косметика (folder)/Косметика	308056	L'Occitane
387825	3253581004609	L'occitanebody Lotion for Dry Skin 8.4floz	5586	Косметика (folder)/Косметика	308056	L'Occitane
4489230	3253581109847	L'occtiane brosse ? barbe de voyage (travel shaving brush)	1	Неклассифицированные/default	308056	L'Occitane
388011	3253581096901	L'occtiane crayon de rasage (shaving Stick) 0.35oz	5586	Косметика (folder)/Косметика	308056	L'Occitane
388010	3253581096857	L'occtiane savon ? barbe (shaving soap) 3.5oz	1105	Гигиена (folder)/Средства для бритья	308056	L'Occitane
4489890	044003947320	L'oiseau lyre 2 CD various artists One shot '80 volume 15 (disco&dance italia)	1	Неклассифицированные/default	0	
4489891	044003912427	L'oiseau lyre best of cher vol 2 20th Century masters Mill coll	1	Неклассифицированные/default	0	
4489892	044003828025	L'oiseau lyre camp: music from the motion picture CD	1	Неклассифицированные/default	0	
4489893	044003829725	L'oiseau lyre CD the androids - self titled album 2003	1	Неклассифицированные/default	0	
1044054	062067032042	L'olmaia christmas duck glass 25.4oz	1	Неклассифицированные/default	0	
388219	062067031618	L'olmaia La cinque glass 11.2oz	1	Неклассифицированные/default	0	
388220	062067031625	L'olmaia La nove glass 11.2oz	1	Неклассифицированные/default	0	
388221	062067031649	L'olmaia pvk glass 11.2oz	1	Неклассифицированные/default	0	
2883582	4607001777984	L'or crema absolu classique b crema 0.23kg s	19716	Продукты питания (folder)/Чай и кофе/Кофе	3693200	L'or
4490887	087000550728	L'or de martell 750ml	1	Неклассифицированные/default	0	
4490888	3348900849730	L'or de vie gift set	1	Неклассифицированные/default	0	
3693202	8711000360477	L'or delizioso g espresso 10s 0.052kg caps s	19716	Продукты питания (folder)/Чай и кофе/Кофе	3693200	L'or
3693203	8711000360514	L'or forza g espresso 10s 0.052kg caps s	19716	Продукты питания (folder)/Чай и кофе/Кофе	3693200	L'or
3693205	047510067536	L'or gialuron.kislota i kollagen anti-age g 0.015l bo	961989	Косметика (folder)/Уход за лицом	3693204	L'OR (DNC KOSMETIKA)
3693206	8711000331385	L'or lungo profondo g espresso 10s 0.052kg caps s	19716	Продукты питания (folder)/Чай и кофе/Кофе	3693200	L'or
3693207	8711000360569	L'or lungo profondo g espresso 10s 0.052kg caps s #2	19716	Продукты питания (folder)/Чай и кофе/Кофе	3693200	L'or
3693209	4607001777656	L'or Original i f 26 servings 0.0468kg tg	19716	Продукты питания (folder)/Чай и кофе/Кофе	3693200	L'or
3693210	8711000360576	L'or ristretto g espresso 10s 0.052kg caps s	19716	Продукты питания (folder)/Чай и кофе/Кофе	3693200	L'or
3693211	8711000331545	L'or splendente g espresso 10s 0.052kg caps s	19716	Продукты питания (folder)/Чай и кофе/Кофе	3693200	L'or
3693212	8711000360491	L'or splendente g espresso 10s 0.052kg caps s #2	19716	Продукты питания (folder)/Чай и кофе/Кофе	3693200	L'or
3693208	4607001778523	L'or кофе Original раст.субл.95г+кружка	19716	Продукты питания (folder)/Чай и кофе/Кофе	3693200	L'or
3372514	4607001777595	L'or кофе Riche нат.раст.субл+жар.мол.95г	19716	Продукты питания (folder)/Чай и кофе/Кофе	3693200	L'or
4490889	8024417112691	L'or?Al elvive Shampoo anti-dandruff Normal Hair 250ml	1	Неклассифицированные/default	0	
1045915	071249030059	L'or?Al jet set quick Dry Nail polish 0.5oz	1053	Косметика (folder)/Маникюр и педикюр (folder)/Лак для ногтей	2506313	L'Oreal Jet Set
217617	3600520297262	L'or?Al men expert - anti-fatigue moisturising Lotion 50ml	5586	Косметика (folder)/Косметика	2626	L'Oreal
4490890	3600520296760	L'or?Al Paris men expert - 24h hydrating balm 100ml	1	Неклассифицированные/default	0	
620052	3454781506126	L'orangeraie vin de pays d'oc Rose* 750ml	22133	Продукты питания (folder)/Алкогольные напитки/Вино (folder)/Вино	0	
1044428	3454781500490	L'orangerie de pennautier Rouge 2006	22133	Продукты питания (folder)/Алкогольные напитки/Вино (folder)/Вино	0	
2168180	3600520236315	L'oreal	1	Неклассифицированные/default	2626	L'Oreal
4490983	071249012024	L'oreal #10	1	Неклассифицированные/default	2626	L'Oreal
4490984	071249012031	L'oreal #11	1	Неклассифицированные/default	2626	L'Oreal
4490985	071249013816	L'oreal #12	1	Неклассифицированные/default	2626	L'Oreal
4490986	071249018446	L'oreal #13	1	Неклассифицированные/default	2626	L'Oreal
4490987	071249018460	L'oreal #14	1	Неклассифицированные/default	2626	L'Oreal
4490988	071249024409	L'oreal #15	1	Неклассифицированные/default	2626	L'Oreal
4490989	071249024416	L'oreal #16	1	Неклассифицированные/default	2626	L'Oreal
4490990	071249024423	L'oreal #17	1	Неклассифицированные/default	2626	L'Oreal
