ID	UPCEAN	Name	CategoryID	CategoryName	BrandID	BrandName
357669	043000021088	Crystal Light focus Natural citrus splash plastic 16oz	17371	Продукты питания (folder)/Напитки безалкогольные/Напитки	583037	Crystal Light
959139	066188058226	Crystal Light Fruit punch 500ml sgl pet btl	1	Неклассифицированные/default	583037	Crystal Light
1430174	043000011331	Crystal Light Fruit punch drink Mix-8 ct	1	Неклассифицированные/default	583037	Crystal Light
4278896	043000005248	Crystal Light Green tea - rasberry flavor 0.09oz	1	Неклассифицированные/default	583037	Crystal Light
4278897	043000012895	Crystal Light Green tea otg-Honey Lemon 1.34oz	1	Неклассифицированные/default	0	
4278898	043000012901	Crystal Light Green tea otg-Raspberry-14ct 1.34oz	1	Неклассифицированные/default	0	
4278899	075660331757	Crystal Light hard candy 24oz	1	Неклассифицированные/default	583037	Crystal Light
357670	043000939154	Crystal Light hydration pink lemonade pet 16oz	17371	Продукты питания (folder)/Напитки безалкогольные/Напитки	583037	Crystal Light
4278900	043000950128	Crystal Light Ice tea * 1oz 12ct	1	Неклассифицированные/default	583037	Crystal Light
4278901	043000945124	Crystal Light Ice tea otg 12 0.98oz	1	Неклассифицированные/default	583037	Crystal Light
357671	043000939093	Crystal Light Ice tea plastic 16oz	186980	Продукты питания (folder)/Напитки безалкогольные/Холодный чай	583037	Crystal Light
4278902	043000005293	Crystal Light Ice tea. (peech)	1	Неклассифицированные/default	583037	Crystal Light
4278903	060229000083	Crystal Light immunity	1	Неклассифицированные/default	583037	Crystal Light
357672	043000017524	Crystal Light immunity berry pomegranate pet 16oz	17371	Продукты питания (folder)/Напитки безалкогольные/Напитки	583037	Crystal Light
1430181	043000022597	Crystal Light immunity drink Mix (Natural Cherry pomegranate) 2.2oz	1	Неклассифицированные/default	583037	Crystal Light
959140	066188058233	Crystal Light kiwi strawberry 500ml sgl pet btl	1	Неклассифицированные/default	583037	Crystal Light
4278904	043000949511	Crystal Light lemnade 16qt bns do 4.2oz	1	Неклассифицированные/default	583037	Crystal Light
959141	066188058240	Crystal Light lemonade 500ml sgl pet btl	1	Неклассифицированные/default	583037	Crystal Light
4278905	043000950111	Crystal Light lemonade 8qt 2.1oz	1	Неклассифицированные/default	583037	Crystal Light
357673	043000939086	Crystal Light lemonade plastic 16oz	17371	Продукты питания (folder)/Напитки безалкогольные/Напитки	583037	Crystal Light
583041	075660331023	Crystal Light lemonade&pink lemonade peg bag 3oz	1	Неклассифицированные/default	583037	Crystal Light
2791123	043000006672	Crystal Light Liquid blk Cherry Lime 1.62oz	1	Неклассифицированные/default	0	
2560880	043000005989	Crystal Light Liquid drink Mix berry sangria	1	Неклассифицированные/default	583037	Crystal Light
2560881	043000006191	Crystal Light Liquid drink Mix blackberry lemonade flavor	1	Неклассифицированные/default	583037	Crystal Light
2560882	043000005590	Crystal Light Liquid drink Mix Blueberry Raspberry	1	Неклассифицированные/default	583037	Crystal Light
2560883	043000006375	Crystal Light Liquid drink Mix Blueberry Raspberry flavor	1	Неклассифицированные/default	583037	Crystal Light
2560884	043000005583	Crystal Light Liquid drink Mix Ice tea	1	Неклассифицированные/default	583037	Crystal Light
2560885	043000005620	Crystal Light Liquid drink Mix mango passionfruit	1	Неклассифицированные/default	583037	Crystal Light
2560886	043000006283	Crystal Light Liquid drink Mix mango passionfruit flavor	1	Неклассифицированные/default	583037	Crystal Light
2560887	043000005613	Crystal Light Liquid drink Mix Peach bellini	1	Неклассифицированные/default	583037	Crystal Light
2560888	043000006276	Crystal Light Liquid drink Mix Peach bellini flavor	1	Неклассифицированные/default	583037	Crystal Light
2560889	043000006290	Crystal Light Liquid drink Mix pomegranate martini flavor	1	Неклассифицированные/default	583037	Crystal Light
2560890	043000005606	Crystal Light Liquid drink Mix pomtini	1	Неклассифицированные/default	583037	Crystal Light
2560891	043000006177	Crystal Light Liquid drink Mix strawberry Green tea	1	Неклассифицированные/default	583037	Crystal Light
2560892	043000005637	Crystal Light Liquid drink Mix strawberry lemonade	1	Неклассифицированные/default	583037	Crystal Light
2560893	043000006351	Crystal Light Liquid drink Mix strawberry lemonade flavor	1	Неклассифицированные/default	583037	Crystal Light
2560894	043000006160	Crystal Light Liquid Ice tea drink Mix Mandarin Orange flavor	1	Неклассифицированные/default	583037	Crystal Light
2560895	043000005996	Crystal Light Liquid Lemon Ice tea	1	Неклассифицированные/default	583037	Crystal Light
2560896	043000006368	Crystal Light Liquid tea drink Mix Ice tea flavor	1	Неклассифицированные/default	583037	Crystal Light
2560897	043000006184	Crystal Light Liquid Tropical Coconut	1	Неклассифицированные/default	583037	Crystal Light
187112	043000022726	Crystal Light live act mxd bry 2.36oz	1827197	Продукты питания (folder)/Сухие напитки	583037	Crystal Light
4278906	043000012192	Crystal Light live active	1	Неклассифицированные/default	583037	Crystal Light
1430242	043000041581	Crystal Light margarita flavored drink Mix	1	Неклассифицированные/default	583037	Crystal Light
357675	043000021071	Crystal Light metabolism Peach mango Green tea plastic 16oz	17371	Продукты питания (folder)/Напитки безалкогольные/Напитки	583037	Crystal Light
1430243	043000041567	Crystal Light mojito 1.41	1	Неклассифицированные/default	583037	Crystal Light
2560898	043000028889	Crystal Light Natural cranberry Apple drink Mix-6 ct	1	Неклассифицированные/default	583037	Crystal Light
1430180	043000950647	Crystal Light Natural Lemon Ice tea drink Mix-6 ct	1	Неклассифицированные/default	583037	Crystal Light
1430179	043000950258	Crystal Light Natural Lemon Ice tea drink Mix-8 ct	1	Неклассифицированные/default	583037	Crystal Light
1430183	043000950654	Crystal Light Natural lemonade drink Mix-6 ct	1	Неклассифицированные/default	583037	Crystal Light
217103	043000950234	Crystal Light Natural lemonade drink Mix-8ct	17371	Продукты питания (folder)/Напитки безалкогольные/Напитки	583037	Crystal Light
4278907	043000005170	Crystal Light Natural lemonade packets	1	Неклассифицированные/default	583037	Crystal Light
1430215	043000950517	Crystal Light Natural pink lemonade drink Mix-6 pk	1	Неклассифицированные/default	583037	Crystal Light
217102	043000950197	Crystal Light Natural pink lemonade drink Mix-8ct	17371	Продукты питания (folder)/Напитки безалкогольные/Напитки	583037	Crystal Light
2560899	043000030240	Crystal Light Natural strawberry banana hunger satisfaction drink Mix on the go-7 ct	1	Неклассифицированные/default	583037	Crystal Light
1430278	043000009826	Crystal Light oj	1	Неклассифицированные/default	583037	Crystal Light
1430279	043000009864	Crystal Light oj #2	1	Неклассифицированные/default	583037	Crystal Light
4278908	43524082	Crystal Light on the go	1	Неклассифицированные/default	583037	Crystal Light
2069916	043000040935	Crystal Light on the go asst w/rack + 2oz	1	Неклассифицированные/default	0	
1430259	043000003633	Crystal Light on the go chry pom	1	Неклассифицированные/default	0	
1430244	043000000069	Crystal Light on the go Fruit punch	1	Неклассифицированные/default	583037	Crystal Light
1430187	043000012864	Crystal Light on the go Honey Lemon Green tea drink Mix-10 ct	1	Неклассифицированные/default	583037	Crystal Light
2069917	043000840771	Crystal Light on the go Ice tea 00757 + 2.4oz	1	Неклассифицированные/default	0	
1430193	043000017289	Crystal Light on the go Natural Cherry pomegranate immunity drink Mix-10 ct	1	Неклассифицированные/default	583037	Crystal Light
1430205	043000021903	Crystal Light on the go Natural citrus splash drink Mix 1oz	1	Неклассифицированные/default	583037	Crystal Light
959142	043000945025	Crystal Light on the go Natural lemonade drink Mix-10 ct	1	Неклассифицированные/default	2309551	GENERAL FO
2560900	043000028865	Crystal Light on the go Natural pink lemonade drink Mix - 10 ct	1	Неклассифицированные/default	583037	Crystal Light
4278909	043000971833	Crystal Light on the go Orange 1.8oz	1	Неклассифицированные/default	583037	Crystal Light
2069918	043000023419	Crystal Light on the go Peach tea 00797 + 2oz	1	Неклассифицированные/default	583037	Crystal Light
1430246	043000007983	Crystal Light on the go rasp Ice	17371	Продукты питания (folder)/Напитки безалкогольные/Напитки	0	
1430245	043000000151	Crystal Light on the go rasp Lemon	1	Неклассифицированные/default	583037	Crystal Light
4278910	043000000892	Crystal Light on the go rasp/lem 1.1oz	1	Неклассифицированные/default	583037	Crystal Light
2069919	043000014400	Crystal Light on the go rasp/lemonade 00015 2oz	1	Неклассифицированные/default	0	
1430198	043000012871	Crystal Light on the go Raspberry Green tea drink Mix-10 ct	1	Неклассифицированные/default	583037	Crystal Light
1430200	043000945094	Crystal Light on the go Raspberry Ice drink Mix-10 ct	1	Неклассифицированные/default	583037	Crystal Light
1430201	043000011201	Crystal Light on the go Raspberry lemonade drink Mix-10 ct	1	Неклассифицированные/default	583037	Crystal Light
1430260	043000003626	Crystal Light on the go single - rasp Green tea 0.12oz	1	Неклассифицированные/default	583037	Crystal Light
1430262	043000009260	Crystal Light on the go strawberry Energy	1	Неклассифицированные/default	583037	Crystal Light
1430261	043000005040	Crystal Light on the go sunr/org	1	Неклассифицированные/default	0	
4278911	043000036853	Crystal Light on the go variety pack 44ct	1	Неклассифицированные/default	583037	Crystal Light
2791124	043000028803	Crystal Light on the go w/tea pch skne 0.49oz	1	Неклассифицированные/default	0	
4278912	043000023389	Crystal Light on the go White grape drink Mix 0.81oz	1	Неклассифицированные/default	0	
1430211	043000023372	Crystal Light on the go White grape drink Mix-10 ct	1	Неклассифицированные/default	583037	Crystal Light
1430185	043000017296	Crystal Light on the go Wild strawberry Energy drink Mix-10 ct	1	Неклассифицированные/default	583037	Crystal Light
4278913	043000000731	Crystal Light on/the/go rasb/lmn 0.80oz 12ct	1	Неклассифицированные/default	583037	Crystal Light
2309550	04351700	Crystal Light Orange flavor	1	Неклассифицированные/default	0	
959143	066188058271	Crystal Light org/stw/ban 500ml sgl pet btl	1	Неклассифицированные/default	583037	Crystal Light
4278914	043000971970	Crystal Light otg lem chmy ds* 1.40oz 24ct	1	Неклассифицированные/default	583037	Crystal Light
4278915	043000000953	Crystal Light otg punch 1.26oz 12ct	1	Неклассифицированные/default	583037	Crystal Light
4278916	043000011218	Crystal Light otg Raspberry 1.1oz	1	Неклассифицированные/default	583037	Crystal Light
4278917	043000971956	Crystal Light otg shpr 48 units * 1.40oz 48ct	1	Неклассифицированные/default	583037	Crystal Light
4278918	043000950609	Crystal Light pass Tropical Fruit 2.56oz 24ct	1	Неклассифицированные/default	0	
959144	066188058264	Crystal Light passionfruit pineapple 500ml sgl pet btl	1	Неклассифицированные/default	583037	Crystal Light
1430192	043000945209	Crystal Light Peach flavor Ice tea on the go drink Mix - 10 ct	1	Неклассифицированные/default	583037	Crystal Light
1430212	043000950807	Crystal Light Peach Ice tea drink Mix-6 ct	1	Неклассифицированные/default	583037	Crystal Light
208314	043000950777	Crystal Light Peach Ice tea drink Mix-8ct	186980	Продукты питания (folder)/Напитки безалкогольные/Холодный чай	583037	Crystal Light
2560901	043000028858	Crystal Light Peach mango Green tea drink Mix-5 ct	1	Неклассифицированные/default	583037	Crystal Light
959145	043000945216	Crystal Light Peach tea cs12	1	Неклассифицированные/default	583037	Crystal Light
959146	066188058288	Crystal Light pink Grapefruit 500ml sgl pet btl	1	Неклассифицированные/default	583037	Crystal Light
959147	043000028872	Crystal Light pink lem 14 cs12	1	Неклассифицированные/default	583037	Crystal Light
4278919	066188058707	Crystal Light pink lemonade 3l	1	Неклассифицированные/default	0	
1430247	043000939161	Crystal Light pink lemonade hydration Beverage Water	1	Неклассифицированные/default	583037	Crystal Light
357676	043000025208	Crystal Light pink lemonade pet 16oz	17371	Продукты питания (folder)/Напитки безалкогольные/Напитки	583037	Crystal Light
2560902	043000033593	Crystal Light Pure fitness on the go strawberry kiwi naturally sweetened drink Mix-7 ct	1	Неклассифицированные/default	583037	Crystal Light
2560903	043000040287	Crystal Light Pure lemonade naturally sweetened drink Mix - 7 ct	1	Неклассифицированные/default	583037	Crystal Light
2560904	043000040294	Crystal Light Pure mixed berry naturally sweetened drink Mix - 7 ct	1	Неклассифицированные/default	583037	Crystal Light
2560905	043000040300	Crystal Light Pure Tropical Blend naturally sweetened drink Mix - 7 ct	1	Неклассифицированные/default	583037	Crystal Light
2560906	043000033586	Crystal Light Pure truvia drink Mix grape	1	Неклассифицированные/default	583037	Crystal Light
1430248	043000950715	Crystal Light r/Red Grapefruit	1	Неклассифицированные/default	583037	Crystal Light
1430176	043000012918	Crystal Light Raspberry Green tea drink Mix-5 ct	1	Неклассифицированные/default	583037	Crystal Light
959138	066188058219	Crystal Light Raspberry Ice 500ml sgl pet btl	1	Неклассифицированные/default	583037	Crystal Light
1430219	043000950289	Crystal Light Raspberry Ice drink Mix-8 ct	1	Неклассифицированные/default	583037	Crystal Light
1430249	043000950685	Crystal Light Raspberry Ice flavor drink Mix - 6 ct	1	Неклассифицированные/default	583037	Crystal Light
357677	043000939109	Crystal Light Raspberry Ice plastic 16oz	17371	Продукты питания (folder)/Напитки безалкогольные/Напитки	583037	Crystal Light
357678	043000971864	Crystal Light Raspberry Ice plastic 64oz	17371	Продукты питания (folder)/Напитки безалкогольные/Напитки	583037	Crystal Light
1430221	043000949634	Crystal Light Raspberry lemonade drink Mix-8 ct	1	Неклассифицированные/default	583037	Crystal Light
210572	043000950852	Crystal Light Raspberry tea 8qt 1.1oz	186980	Продукты питания (folder)/Напитки безалкогольные/Холодный чай	583037	Crystal Light
1592730	043000007914	Crystal Light rsbry	1	Неклассифицированные/default	0	
357674	043000971857	Crystal Light rtd-lemonade 64floz	17371	Продукты питания (folder)/Напитки безалкогольные/Напитки	583037	Crystal Light
1430251	043000950708	Crystal Light ruby grpf	1	Неклассифицированные/default	583037	Crystal Light
1430252	043000983003	Crystal Light Soft drink	1	Неклассифицированные/default	583037	Crystal Light
1430253	043000983010	Crystal Light Soft drink #2	1	Неклассифицированные/default	583037	Crystal Light
1430254	043000983034	Crystal Light Soft drink #3	1	Неклассифицированные/default	583037	Crystal Light
1430255	043000983058	Crystal Light Soft drink #4	1	Неклассифицированные/default	583037	Crystal Light
1430256	043000983065	Crystal Light Soft drink #5	1	Неклассифицированные/default	583037	Crystal Light
4278920	043000005231	Crystal Light strawberry Energy drink	1	Неклассифицированные/default	0	
357679	043000939116	Crystal Light strawberry kiwi plastic 16oz	17371	Продукты питания (folder)/Напитки безалкогольные/Напитки	583037	Crystal Light
1430228	043000950548	Crystal Light strawberry Orange banana drink Mix-6 ct	1	Неклассифицированные/default	583037	Crystal Light
2791125	043000064849	Crystal Light strawberry watermelon 1.96oz	1	Неклассифицированные/default	0	
4278921	043000939031	Crystal Light strawberry/kiwi 64floz	1	Неклассифицированные/default	583037	Crystal Light
4278922	043000945148	Crystal Light sunrise 1.5oz	1	Неклассифицированные/default	0	
4278923	043000945131	Crystal Light sunrise 2.5oz 60ct	1	Неклассифицированные/default	0	
1430165	043000945421	Crystal Light sunrise Classic Orange drink Mix-5 ct	1	Неклассифицированные/default	583037	Crystal Light
357680	043000945889	Crystal Light sunrise Classic Orange plastic 16oz	17371	Продукты питания (folder)/Напитки безалкогольные/Напитки	583037	Crystal Light
357681	043000971840	Crystal Light sunrise Classic Orange plastic 64oz	17371	Продукты питания (folder)/Напитки безалкогольные/Напитки	583037	Crystal Light
4278924	068100068566	Crystal Light tea blends Original Ice tea singles	1	Неклассифицированные/default	583037	Crystal Light
1430190	043000945117	Crystal Light tea drink Mix Natural Lemon Ice tea - 10 ct	1	Неклассифицированные/default	583037	Crystal Light
1430239	043000022221	Crystal Light tea drink Mix packets Peach mango Green tea - 10 ct	1	Неклассифицированные/default	583037	Crystal Light
2069920	043000014394	Crystal Light tgo Fruit punch wvtx 30/2.4oz	1	Неклассифицированные/default	0	
2069921	043000023044	Crystal Light tgo Wild strawberry wvtx 30/2.4oz	1	Неклассифицированные/default	0	
4278925	043000011324	Crystal Light tngrn strawberry 2.8oz	1	Неклассифицированные/default	583037	Crystal Light
1430257	043000950104	Crystal Light Tropical passions - 8 qt	1	Неклассифицированные/default	583037	Crystal Light
4278926	043000013861	Crystal Light variety pk 4ct 6ct	1	Неклассифицированные/default	583037	Crystal Light
583042	075660331085	Crystal Light Wild strawberry peg bag 3oz	1	Неклассифицированные/default	583037	Crystal Light
3043984	04366702	Crystal Light, drink Mix, Black Cherry Lime	330591	Продукты питания (folder)/Продукты питания	0	
3043985	20689971	Crystal Light, strawberry Orange banana drink Mix	330591	Продукты питания (folder)/Продукты питания	0	
3043986	492031306150	Crystal Light, truvia, naturally sweetened drink Mix, tangerine mango	330591	Продукты питания (folder)/Продукты питания	0	
4278927	043000111208	Crystal lite otg rasp/lemnad* 0.8oz	1	Неклассифицированные/default	583037	Crystal Light
1612171	4809010165114	Crystal local sotanghon 70g/50	1419731	Продукты питания (folder)/SOTANGHON	0	
1430161	048400000046	Crystal louisiana's Pure Hot sauce	1	Неклассифицированные/default	583043	CRYSTAL
4278928	070910000513	Crystal low fat chocolate Milk 64floz	1	Неклассифицированные/default	0	
4278929	043000971888	Crystal lt sunrise-12qt * 1ct	1	Неклассифицированные/default	0	
1994047	657447090035	Crystal medium purple	363351	Adult/Sex-Shop	0	
1888418	024500313293	Crystal mens pls twin bld 10's	1	Неклассифицированные/default	2292935	AMERICAN S
2791126	070910000100	Crystal Milk 1	1	Неклассифицированные/default	0	
2791127	070910000827	Crystal Milk 1 choc p	1	Неклассифицированные/default	0	
2791131	070910000162	Crystal Milk 128floz	1	Неклассифицированные/default	0	
2791128	070910000643	Crystal Milk 2	1	Неклассифицированные/default	0	
2791129	070910000483	Crystal Milk 2 p	1	Неклассифицированные/default	0	
2791130	070910000780	Crystal Milk 2 p #2	1	Неклассифицированные/default	0	
2791132	070910000650	Crystal Milk chocolate 1 l	1	Неклассифицированные/default	0	
2791133	070910000667	Crystal Milk strawberry 1	1	Неклассифицированные/default	0	
2791134	070910006300	Crystal Milk whole	1	Неклассифицированные/default	0	
2791135	070910000438	Crystal Milk whole p	1	Неклассифицированные/default	0	
2791136	070910000803	Crystal Milk whole p #2	1	Неклассифицированные/default	0	
2791137	070910000148	Crystal Milk whole pl	1	Неклассифицированные/default	0	
2791138	086449416619	Crystal mineral Deo roll on vanilla jasmine 2.25oz	1	Неклассифицированные/default	0	
2309552	9555031003410	Crystal Mirror	1	Неклассифицированные/default	0	
1430263	061354031201	Crystal Mist deodora	1	Неклассифицированные/default	0	
1430264	1480901016505	Crystal misua 400g	1376611	Продукты питания (folder)/BIHON, CANTON & MISUA	0	
1430265	4809010165053	Crystal misua 400g #2	1376611	Продукты питания (folder)/BIHON, CANTON & MISUA	0	
4278930	064528010071	Crystal mountain 100% Natural Spring Water 1l	1	Неклассифицированные/default	0	
1430277	041670457053	Crystal mouthwash	19414	Гигиена (folder)/Уход за зубами и ртом (folder)/Ополаскиватель для рта	0	
4278931	079765033721	Crystal mt 03372 spr Water 0.5 l 6ct 4ct	1	Неклассифицированные/default	0	
3210988	186190000010	Crystal Noodle mushroom soup 1.98oz	3210952	Продукты питания (folder)/Суп	0	
4278932	186190000034	Crystal Noodle mushrooms soup 1.98oz	1	Неклассифицированные/default	0	
2309553	186190000324	Crystal Noodle soup 6 kind of mush	1	Неклассифицированные/default	0	
2309554	186190000348	Crystal Noodle soup spicy tofu	1	Неклассифицированные/default	0	
2309555	186190000317	Crystal Noodle spicy sesame paste	1	Неклассифицированные/default	0	
2309556	186190000331	Crystal Noodle vegetable egg	1	Неклассифицированные/default	0	
1888394	4809012592307	Crystal Oil blk ssme 240ml/12	1	Неклассифицированные/default	0	
1888395	4809012592215	Crystal Oil blk ssme 520ml/12	1	Неклассифицированные/default	0	
1888396	4809012592291	Crystal Oil wht ssme 240ml/12	1	Неклассифицированные/default	0	
1888397	4809012592222	Crystal Oil wht ssme 520ml/12	1	Неклассифицированные/default	0	
4278933	021331370242	Crystal optics 55mm uv multi coated high resolution Filter	1	Неклассифицированные/default	0	
2560907	021165112506	Crystal optische muis USB2.0 auberginekleurig	1	Неклассифицированные/default	0	
2791139	070910002869	Crystal Orange Juice	1	Неклассифицированные/default	0	
2791140	070910602885	Crystal Orange Juice #2	1	Неклассифицированные/default	0	
2791141	070910002821	Crystal Orange Juice 6	1	Неклассифицированные/default	0	
357683	089540135113	Crystal palace gin 1.75l	78617	Продукты питания (folder)/Алкогольные напитки/Алкоголь	0	
4278935	806604240336	Crystal palace gin 1000ml	1	Неклассифицированные/default	4278934	Crystal palace
4278936	806604240190	Crystal palace gin 1750ml	1	Неклассифицированные/default	4278934	Crystal palace
357684	089540135120	Crystal palace gin 1l	78617	Продукты питания (folder)/Алкогольные напитки/Алкоголь	0	
