ID	UPCEAN	Name	CategoryID	CategoryName	BrandID	BrandName
836018	4607159361622	Сушилка для белья 5 вер 1.4м	527924	Хозяйственные товары (folder)/Сушилка бытовая	69656	Квинта
836019	4607159361202	Сушилка для белья 5 вер 1.6м	527924	Хозяйственные товары (folder)/Сушилка бытовая	0	
836017	4607159361226	Сушилка для белья 5 вер 1.8 м	527924	Хозяйственные товары (folder)/Сушилка бытовая	0	
527928	4710694548318	Сушилка для белья 5 линий jh87-65 мультидом Китай минимум	527924	Хозяйственные товары (folder)/Сушилка бытовая	448622	МультиДом
166518	8023797005029	Сушилка для белья 5x3.66 м	527924	Хозяйственные товары (folder)/Сушилка бытовая	0	
527929	4710694548325	Сушилка для белья 6 линий jh87-66 мультидом Китай	527924	Хозяйственные товары (folder)/Сушилка бытовая	448622	МультиДом
527930	8007633800122	Сушилка для белья 80012 на батарею	527924	Хозяйственные товары (folder)/Сушилка бытовая	0	
1976472	6932000123806	Сушилка для белья 80x40 x 85см	1	Неклассифицированные/default	0	
3544508	4620754173346	Сушилка для белья ala на ванну 70x 60см	527924	Хозяйственные товары (folder)/Сушилка бытовая	0	
836025	8001244100602	Сушилка для белья alablock, длина суш. пов. 10м	527924	Хозяйственные товары (folder)/Сушилка бытовая	278863	GIMI
3544509	4600089800001	Сушилка для белья apl напольная 18м	527924	Хозяйственные товары (folder)/Сушилка бытовая	0	
3544511	6946208423040	Сушилка для белья bian wan jia	527924	Хозяйственные товары (folder)/Сушилка бытовая	0	
3544512	6937893229178	Сушилка для белья brio Super настенная вытяжная 100см	527924	Хозяйственные товары (folder)/Сушилка бытовая	0	
3544513	6937893229185	Сушилка для белья brio Super настенная вытяжная 120см	527924	Хозяйственные товары (folder)/Сушилка бытовая	0	
3544514	6937893229161	Сушилка для белья brio Super настенная вытяжная 80см	527924	Хозяйственные товары (folder)/Сушилка бытовая	0	
3544515	8697435181026	Сушилка для белья carino 18м, 160x 55см 18102	527924	Хозяйственные товары (folder)/Сушилка бытовая	0	
2758681	4690408020333	Сушилка для белья CD-8 (8м напольная), материал: окраш. металл	3536	Хозяйственные товары (folder)/Хозяйственные товары	0	
3544516	4650058952712	Сушилка для белья centek 18м	527924	Хозяйственные товары (folder)/Сушилка бытовая	0	
3544517	6946208423088	Сушилка для белья coat hanger	527924	Хозяйственные товары (folder)/Сушилка бытовая	0	
836020	8001244001282	Сушилка для белья dinamik, длина суш. пов. 20м	527924	Хозяйственные товары (folder)/Сушилка бытовая	0	
3544518	8697435181088	Сушилка для белья ege на балкон 10м	527924	Хозяйственные товары (folder)/Сушилка бытовая	0	
1460086	7640114035616	Сушилка для белья eurogold 0503 sez	1	Неклассифицированные/default	1460076	Eurogold
3544519	6934257301464	Сушилка для белья Fashion	527924	Хозяйственные товары (folder)/Сушилка бытовая	0	
3544520	4627075860955	Сушилка для белья frau hellen bingo	527924	Хозяйственные товары (folder)/Сушилка бытовая	0	
3544521	8001244001626	Сушилка для белья g modular напольная 30м cda	527924	Хозяйственные товары (folder)/Сушилка бытовая	0	
836022	8001244002555	Сушилка для белья gimi jolly 18 Silver	527924	Хозяйственные товары (folder)/Сушилка бытовая	278863	GIMI
836023	8001244108554	Сушилка для белья gimi tempo 20 алюминий	527924	Хозяйственные товары (folder)/Сушилка бытовая	278863	GIMI
124624	8001244850002	Сушилка для белья gimi веревочная раздвижная 14м rotor 4	527924	Хозяйственные товары (folder)/Сушилка бытовая	278863	GIMI
124625	8001244860001	Сушилка для белья gimi веревочная раздвижная 21м rotor 6	527924	Хозяйственные товары (folder)/Сушилка бытовая	278863	GIMI
836024	8001244103160	Сушилка для белья gimi многофункциональная 22м Leader	527924	Хозяйственные товары (folder)/Сушилка бытовая	278863	GIMI
836026	8001244123007	Сушилка для белья gimi напольная 30м modular 3	527924	Хозяйственные товары (folder)/Сушилка бытовая	278863	GIMI
836027	8001244004290	Сушилка для белья gimi напольная dinamik 30	527924	Хозяйственные товары (folder)/Сушилка бытовая	278863	GIMI
836028	8001244106109	Сушилка для белья gimi напольная plast 10	527924	Хозяйственные товары (folder)/Сушилка бытовая	278863	GIMI
278864	8001244863408	Сушилка для белья gimi настенная 5м telepack 70	527924	Хозяйственные товары (folder)/Сушилка бытовая	278863	GIMI
278865	8001244863453	Сушилка для белья gimi настенная 7м telepack 100	527924	Хозяйственные товары (folder)/Сушилка бытовая	278863	GIMI
278866	8001244073104	Сушилка для белья gimi настенная brio 100 Super	527924	Хозяйственные товары (folder)/Сушилка бытовая	278863	GIMI
527931	8001244107052	Сушилка для белья gimi подвесная 2.5м lampo	527924	Хозяйственные товары (folder)/Сушилка бытовая	278863	GIMI
836033	8001244001879	Сушилка для белья gimi подвесная 3м airy	527924	Хозяйственные товары (folder)/Сушилка бытовая	278863	GIMI
278867	8001244460140	Сушилка для белья gimi потолочная 8.5 м lift 140	527924	Хозяйственные товары (folder)/Сушилка бытовая	278863	GIMI
278868	8001244460164	Сушилка для белья gimi потолочная 9.5 м lift 160	527924	Хозяйственные товары (folder)/Сушилка бытовая	278863	GIMI
836034	8001244870000	Сушилка для белья gimi универсальная 10м unix	527924	Хозяйственные товары (folder)/Сушилка бытовая	278863	GIMI
836035	8001244460126	Сушилка для белья gimi универсальная 7м lift 120	527924	Хозяйственные товары (folder)/Сушилка бытовая	278863	GIMI
3544522	6937893225767	Сушилка для белья gini jolly Silver напольная 18м	527924	Хозяйственные товары (folder)/Сушилка бытовая	0	
3544523	6937893227983	Сушилка для белья gini jolly напольная 18м	527924	Хозяйственные товары (folder)/Сушилка бытовая	0	
3544524	6941366004193	Сушилка для белья gs s18s	527924	Хозяйственные товары (folder)/Сушилка бытовая	0	
375946	4620001679515	Сушилка для белья haus frau навесная	527924	Хозяйственные товары (folder)/Сушилка бытовая	375915	Haus Frau
3544525	4650001012920	Сушилка для белья irit сталь с полиэт покрыт,пластикird-02	527924	Хозяйственные товары (folder)/Сушилка бытовая	1749375	Irit Home
3544526	4650001012944	Сушилка для белья irit сталь с полиэт покрыт,пластикird-04	527924	Хозяйственные товары (folder)/Сушилка бытовая	1749375	Irit Home
3544527	4607112288294	Сушилка для белья jarkoff напольная металлическая 20м м/у	527924	Хозяйственные товары (folder)/Сушилка бытовая	0	
3544528	4607112281424	Сушилка для белья jarkoff серебро	527924	Хозяйственные товары (folder)/Сушилка бытовая	0	
836063	4603299114524	Сушилка для белья lakmet лиана-5 потолочная 5 линий 1.3м м/у	527924	Хозяйственные товары (folder)/Сушилка бытовая	0	
1840740	4006501727022	Сушилка для белья Leifheit capri8 н	3536	Хозяйственные товары (folder)/Хозяйственные товары	2229189	Leifheit
1840741	4006501815101	Сушилка для белья Leifheit peg180 нап	3536	Хозяйственные товары (folder)/Хозяйственные товары	2229189	Leifheit
3689808	4006501815002	Сушилка для белья Leifheit pegas. 10м	527924	Хозяйственные товары (folder)/Сушилка бытовая	2229189	Leifheit
836002	4006501817044	Сушилка для белья Leifheit pegasus 120 comp.	527924	Хозяйственные товары (folder)/Сушилка бытовая	2229189	Leifheit
836006	4006501830067	Сушилка для белья Leifheit rollauick до 4.2м	527924	Хозяйственные товары (folder)/Сушилка бытовая	2229189	Leifheit
3544529	8697713710405	Сушилка для белья libero	527924	Хозяйственные товары (folder)/Сушилка бытовая	0	
836036	4820053314864	Сушилка для белья lift, длина суш. пов. 1.2 м	527924	Хозяйственные товары (folder)/Сушилка бытовая	0	
836038	4820053314871	Сушилка для белья lift, длина суш. пов. 1.4м	527924	Хозяйственные товары (folder)/Сушилка бытовая	0	
836039	4820053314888	Сушилка для белья lift, длина суш. пов. 1.6м	527924	Хозяйственные товары (folder)/Сушилка бытовая	0	
836037	4820053314895	Сушилка для белья lift, длина суш. пов. 1.8 м	527924	Хозяйственные товары (folder)/Сушилка бытовая	0	
836040	4820053314901	Сушилка для белья lift, длина суш. пов. 2м	527924	Хозяйственные товары (folder)/Сушилка бытовая	0	
3544530	6907347910006	Сушилка для белья lotheshors круглая с 6 прищепками	527924	Хозяйственные товары (folder)/Сушилка бытовая	0	
3544531	4650062511431	Сушилка для белья Lucky напольная 18м	527924	Хозяйственные товары (folder)/Сушилка бытовая	0	
1316895	5060240302482	Сушилка для белья Lumme lu-1380	3536	Хозяйственные товары (folder)/Хозяйственные товары	89275	Lumme
1316896	5060240302437	Сушилка для белья Marta mt-dr180	3536	Хозяйственные товары (folder)/Хозяйственные товары	39114	Marta
2758682	5060240305940	Сушилка для белья Marta mt-dr181 Золото	33491	Хозяйственные товары (folder)/Доска гладильная	39114	Marta
3544532	4627108600497	Сушилка для белья master house металлическая 18м м/уп	527924	Хозяйственные товары (folder)/Сушилка бытовая	0	
3544533	4627108600503	Сушилка для белья master house напольная 20м м/уп	527924	Хозяйственные товары (folder)/Сушилка бытовая	0	
3544534	8006023055432	Сушилка для белья Miss stendy напольная с крыл 18м	527924	Хозяйственные товары (folder)/Сушилка бытовая	3704444	MELICONI
3544535	6939883080134	Сушилка для белья mito 18м рм 8023а	527924	Хозяйственные товары (folder)/Сушилка бытовая	0	
1316900	4607075832558	Сушилка для белья nika металлическая напольная складная 180x55 x 96см 18м м/у	1	Неклассифицированные/default	0	
3544536	4607075836860	Сушилка для белья nika металлическая напольная складная 180x55 x 96см 18м м/у #2	527924	Хозяйственные товары (folder)/Сушилка бытовая	0	
3544537	4607075832619	Сушилка для белья nika металлическая напольная складная 18м мяг/уп	527924	Хозяйственные товары (folder)/Сушилка бытовая	0	
3544538	4607075836877	Сушилка для белья nika металлическая напольная складная 200x55 x 96см 20м м/у	527924	Хозяйственные товары (folder)/Сушилка бытовая	0	
3544539	4607075834637	Сушилка для белья nika на батарею 45x23.5см 2.1м 5кг м/у	527924	Хозяйственные товары (folder)/Сушилка бытовая	0	
3544540	6900000101001	Сушилка для белья nika напольная 180x50 x 108см	527924	Хозяйственные товары (folder)/Сушилка бытовая	0	
637977	4006501811004	Сушилка для белья peg easyhang нап	3536	Хозяйственные товары (folder)/Хозяйственные товары	0	
836175	4006501817037	Сушилка для белья pegasus150 81703	3536	Хозяйственные товары (folder)/Хозяйственные товары	0	
836053	8001244106208	Сушилка для белья Plus, длина суш. пов. 20м	527924	Хозяйственные товары (folder)/Сушилка бытовая	278863	GIMI
124626	8412955000233	Сушилка для белья rayen 0023	527924	Хозяйственные товары (folder)/Сушилка бытовая	407808	RAYEN
3544541	6294009920573	Сушилка для белья rf2600-ib	527924	Хозяйственные товары (folder)/Сушилка бытовая	0	
3544542	6294009950617	Сушилка для белья rf368CD	527924	Хозяйственные товары (folder)/Сушилка бытовая	0	
836041	8001244107632	Сушилка для белья rocky, длина суш. пов. 20м	527924	Хозяйственные товары (folder)/Сушилка бытовая	278863	GIMI
3544543	4620755464573	Сушилка для белья sakura sa-8111 напольная 180x55 x 105см	527924	Хозяйственные товары (folder)/Сушилка бытовая	0	
3544544	4620755464337	Сушилка для белья sakura sa-8113 напольная 180x48 x 105см	527924	Хозяйственные товары (folder)/Сушилка бытовая	0	
3544545	4627089533937	Сушилка для белья sakura sa-8119 напольная 133x50 x 97см	527924	Хозяйственные товары (folder)/Сушилка бытовая	0	
3544546	4607144897938	Сушилка для белья sanmari напольная 205x55 x 115см	527924	Хозяйственные товары (folder)/Сушилка бытовая	0	
3544547	8695849003033	Сушилка для белья sarayli gapitol хром 304с	527924	Хозяйственные товары (folder)/Сушилка бытовая	0	
650434	4006501811509	Сушилка для белья Sensitive s5 нап 1	3536	Хозяйственные товары (folder)/Хозяйственные товары	0	
836042	7640114035111	Сушилка для белья smart 11 м smart, длина суш. пов. 11м	527924	Хозяйственные товары (folder)/Сушилка бытовая	1460076	Eurogold
3544548	5908309892126	Сушилка для белья standart zawaiasem 3/103	527924	Хозяйственные товары (folder)/Сушилка бытовая	0	
836176	4006501832054	Сушилка для белья telegant 70 leif	3536	Хозяйственные товары (folder)/Хозяйственные товары	0	
836029	8001244108639	Сушилка для белья top 20м напольная (131x55 x 5см)	527924	Хозяйственные товары (folder)/Сушилка бытовая	278863	GIMI
3544549	8001244002104	Сушилка для белья top Silver 20м напольная	527924	Хозяйственные товары (folder)/Сушилка бытовая	0	
3544550	4607174083158	Сушилка для белья Victoria напольная 100x50 x 84см 10м	527924	Хозяйственные товары (folder)/Сушилка бытовая	0	
2758683	4690408103876	Сушилка для белья wcd-20 (3.66 м, настенная, выдвижная, 4 веревки), пластик	3536	Хозяйственные товары (folder)/Хозяйственные товары	0	
3544551	8591177034827	Сушилка для белья zalel барабанная 5 веревок т/у	527924	Хозяйственные товары (folder)/Сушилка бытовая	0	
3544552	8591177034810	Сушилка для белья zalel барабанная 5-ть веревек т/у	527924	Хозяйственные товары (folder)/Сушилка бытовая	0	
527932	4811244000628	Сушилка для белья а14001 снежно-белая	527924	Хозяйственные товары (folder)/Сушилка бытовая	0	
527933	4811244000642	Сушилка для белья а14004 белый мрамор	527924	Хозяйственные товары (folder)/Сушилка бытовая	0	
527934	4811244000659	Сушилка для белья а14008 светло-голубая	527924	Хозяйственные товары (folder)/Сушилка бытовая	0	
3544553	4627122721918	Сушилка для белья альтернатива на радиатор 435x 200мм	527924	Хозяйственные товары (folder)/Сушилка бытовая	0	
3544554	4600108067965	Сушилка для белья ам 25	527924	Хозяйственные товары (folder)/Сушилка бытовая	0	
3544555	4600109220017	Сушилка для белья ам 44	527924	Хозяйственные товары (folder)/Сушилка бытовая	0	
3544556	4680259295639	Сушилка для белья ам 44 #2	527924	Хозяйственные товары (folder)/Сушилка бытовая	0	
3544557	4600109230016	Сушилка для белья ам 44с	527924	Хозяйственные товары (folder)/Сушилка бытовая	0	
3544558	4680259295646	Сушилка для белья ам 44с #2	527924	Хозяйственные товары (folder)/Сушилка бытовая	0	
3544559	207430731614	Сушилка для белья арка	527924	Хозяйственные товары (folder)/Сушилка бытовая	0	
3544560	8001244003408	Сушилка для белья арка #2	527924	Хозяйственные товары (folder)/Сушилка бытовая	0	
527935	6294002906802	Сушилка для белья балкон	527924	Хозяйственные товары (folder)/Сушилка бытовая	0	
3544561	4640011873666	Сушилка для белья Бриз настенная 120x45 x 16см	527924	Хозяйственные товары (folder)/Сушилка бытовая	0	
3544562	4640011873642	Сушилка для белья Бриз настенная 5 линий м/уп	527924	Хозяйственные товары (folder)/Сушилка бытовая	0	
836031	8001244073067	Сушилка для белья брио настенная эмаль 0.6x 3м 09768	527924	Хозяйственные товары (folder)/Сушилка бытовая	278863	GIMI
836032	8001244073081	Сушилка для белья брио настенная эмаль 0.8x 4м 07811	527924	Хозяйственные товары (folder)/Сушилка бытовая	278863	GIMI
3544563	4680003991114	Сушилка для белья волжаночка сказка напольная 18м цвет серый	527924	Хозяйственные товары (folder)/Сушилка бытовая	0	
3544564	4680003991169	Сушилка для белья волжаночка сказка напольная 20м цвет серый	527924	Хозяйственные товары (folder)/Сушилка бытовая	0	
3544565	4607813060014	Сушилка для белья вт импортная	527924	Хозяйственные товары (folder)/Сушилка бытовая	3672188	HITT
3544566	4680259295653	Сушилка для белья вт импортная #2	527924	Хозяйственные товары (folder)/Сушилка бытовая	0	
3544567	5904134968500	Сушилка для белья вт импортная #3	527924	Хозяйственные товары (folder)/Сушилка бытовая	0	
2932575	4006501814104	Сушилка для белья для радиатора квартет 81410. Leifheit	1	Неклассифицированные/default	0	
3917912	4640011874250	Сушилка для белья дуэт	527924	Хозяйственные товары (folder)/Сушилка бытовая	0	
710082	4607159361110	Сушилка для белья залел Прима веревочная 5 веревок	527924	Хозяйственные товары (folder)/Сушилка бытовая	710077	ЗАЛЕЛ
1316897	4814940014524	Сушилка для белья из корр.стали 09	3536	Хозяйственные товары (folder)/Хозяйственные товары	0	
3544568	4607001700005	Сушилка для белья катунь 18м арт кт-100а мяг/уп	527924	Хозяйственные товары (folder)/Сушилка бытовая	0	
3544569	4607144890649	Сушилка для белья комфорт 180x54 x 99см нагрузка 5кг м/уп	527924	Хозяйственные товары (folder)/Сушилка бытовая	0	
3544570	6939501780019	Сушилка для белья круг подвесная с прищепками мяг/уп	527924	Хозяйственные товары (folder)/Сушилка бытовая	0	
124594	6410411838958	Сушилка для белья круглая 183895	527924	Хозяйственные товары (folder)/Сушилка бытовая	0	
836043	4603299114470	Сушилка для белья лагуна 0.6 хром	527924	Хозяйственные товары (folder)/Сушилка бытовая	0	
836044	4603299114500	Сушилка для белья лагуна 0.8 белая	527924	Хозяйственные товары (folder)/Сушилка бытовая	0	
836045	4603299114517	Сушилка для белья лагуна 0.8 хром	527924	Хозяйственные товары (folder)/Сушилка бытовая	0	
3544571	4603299114654	Сушилка для белья лиана 5 линий	527924	Хозяйственные товары (folder)/Сушилка бытовая	0	
836047	4607159363244	Сушилка для белья лиана 6вер2.8m	527924	Хозяйственные товары (folder)/Сушилка бытовая	0	
3544572	1969020756047	Сушилка для белья лиана Люкс потолочная 1.5м	527924	Хозяйственные товары (folder)/Сушилка бытовая	0	
3544573	1969020756115	Сушилка для белья лиана Люкс потолочная 1м	527924	Хозяйственные товары (folder)/Сушилка бытовая	0	
3544574	4607165522505	Сушилка для белья лиана потолочная 1.2м	527924	Хозяйственные товары (folder)/Сушилка бытовая	0	
3544575	4607165522437	Сушилка для белья лиана потолочная 1.2м арт. с-015	527924	Хозяйственные товары (folder)/Сушилка бытовая	0	
710081	4603299114555	Сушилка для белья лиана потолочная 1.5м 5 линий	527924	Хозяйственные товары (folder)/Сушилка бытовая	710077	ЗАЛЕЛ
3544576	4607165522819	Сушилка для белья лиана потолочная 1.5м тв/уп	527924	Хозяйственные товары (folder)/Сушилка бытовая	0	
2758713	4607165522550	Сушилка для белья лиана потолочная 1.7м м/уп	1	Неклассифицированные/default	0	
