ID	UPCEAN	Name	CategoryID	CategoryName	BrandID	BrandName
28794	4607001831464	Кофейный напиток тонус с эхинацеей 100г	94151	Продукты питания (folder)/Чай и кофе/Кофейный напиток	3761907	TONUS (VOKRUG SVETA)
3373796	4607001833451	Кофейный напиток тонус эхинацея и злаки, раств 100г м/у	94151	Продукты питания (folder)/Чай и кофе/Кофейный напиток	3761907	TONUS (VOKRUG SVETA)
1033618	8996001414002	Кофейный напиток торабика каппучино с сахаром 25г	94151	Продукты питания (folder)/Чай и кофе/Кофейный напиток	3762135	TORA BIKA (P.T.MAYORA INDAX/INDONEZIYA
3373797	4607043010780	Кофейный напиток успех быстрорастворимый 100г мяг/уп	94151	Продукты питания (folder)/Чай и кофе/Кофейный напиток	0	
24548	4811043000027	Кофейный напиток утренний 0.1кг	94151	Продукты питания (folder)/Чай и кофе/Кофейный напиток	0	
3373798	4670008707223	Кофейный напиток утренний дуэт 16г	94151	Продукты питания (folder)/Чай и кофе/Кофейный напиток	0	
1239178	4811043000096	Кофейный напиток утро 100г*60 нерастворимый содержание кофе 15% Беларусь	94151	Продукты питания (folder)/Чай и кофе/Кофейный напиток	0	
3373799	4607049400066	Кофейный напиток утро 200г тв/уп	94151	Продукты питания (folder)/Чай и кофе/Кофейный напиток	0	
94166	4602026001557	Кофейный напиток утро лпк жб 90г	94151	Продукты питания (folder)/Чай и кофе/Кофейный напиток	39704	ЛПК
3373800	4610009002033	Кофейный напиток фитодар курземе растворимый с цикорием 150г м/уп	94151	Продукты питания (folder)/Чай и кофе/Кофейный напиток	0	
477182	8804751705014	Кофейный напиток Французский вынильный капучино, sees coffee, 30г корея, республика	94151	Продукты питания (folder)/Чай и кофе/Кофейный напиток	0	
29132	4606855980007	Кофейный напиток цикорий 330г ст/б	279339	Продукты питания (folder)/Диетические продукты	28449	РУССКИЙ ЦИКОРИЙ
1239179	4813785000457	Кофейный напиток цикорий растворимый торговая марка столетов,100г женьшень клюква (изг-ль ООО авд продакшен) Беларусь ип карава	94151	Продукты питания (folder)/Чай и кофе/Кофейный напиток	0	
1239180	4813785000433	Кофейный напиток цикорий растворимый торговая марка столетов,100г оригинальный (изг-ль ООО авд продакшен) Беларусь ип караван	94151	Продукты питания (folder)/Чай и кофе/Кофейный напиток	0	
1239181	4820046680273	Кофейный напиток цикоринка раств. с корнем женьшеня 200г	94151	Продукты питания (folder)/Чай и кофе/Кофейный напиток	0	
26299	4820046680235	Кофейный напиток цикоринка с шиповником 200г	94151	Продукты питания (folder)/Чай и кофе/Кофейный напиток	0	
26295	4820046680228	Кофейный напиток цикоринка цыкорий с боярышником 200г	94151	Продукты питания (folder)/Чай и кофе/Кофейный напиток	0	
1239182	4820046680297	Кофейный напиток цикоринка цыкорий с мятой 200г	94151	Продукты питания (folder)/Чай и кофе/Кофейный напиток	0	
740797	4607081900357	Кофейный напиток цикорич капучино с цикорием и фруктозой zip 200г 1/20	94151	Продукты питания (folder)/Чай и кофе/Кофейный напиток	860194	Цикорич
3373801	4670015821240	Кофейный напиток челтрейд солнечный колос быстрорастворимый 100г тв/уп	94151	Продукты питания (folder)/Чай и кофе/Кофейный напиток	0	
3373802	4603607002130	Кофейный напиток экстра-продукт растворимый	94151	Продукты питания (folder)/Чай и кофе/Кофейный напиток	3742907	S ORLOM (EXTRA-PRODUKT)
3373803	4610009001593	Кофейный напиток энергия дня, с цикорием и женьшенем, раств 100г м\у	94151	Продукты питания (folder)/Чай и кофе/Кофейный напиток	0	
24546	4811043000089	Кофейный напиток янтарный 100г*60 нерастворимый содержание кофе 30% Беларусь	94151	Продукты питания (folder)/Чай и кофе/Кофейный напиток	0	
3373804	4610009001630	Кофейный напиток ясный взгляд, с цикорием и черникой, раств 100г м\у	94151	Продукты питания (folder)/Чай и кофе/Кофейный напиток	0	
1239183	4811043000065	Кофейный напиток ячменно-любительский 100г*60 нерастворимый без кофе Беларусь	94151	Продукты питания (folder)/Чай и кофе/Кофейный напиток	0	
23911	4607001831440	Кофейный напиток ячменный колос 100г 1/32 18 мес.	94151	Продукты питания (folder)/Чай и кофе/Кофейный напиток	3773882	YACHMENNIY KOLOS (VOKRUG SVETA)
3373805	4607001833437	Кофейный напиток ячменный колос растворимый 100г мяг/уп	94151	Продукты питания (folder)/Чай и кофе/Кофейный напиток	3773882	YACHMENNIY KOLOS (VOKRUG SVETA)
3373806	4601117000158	Кофейный ренесанс напиток раствор 100г кор	94151	Продукты питания (folder)/Чай и кофе/Кофейный напиток	0	
3373807	6945883005022	Кофейня girls Club тв/уп	1	Неклассифицированные/default	0	
477183	8902006044021	Кофекс сироп 60мл	1	Неклассифицированные/default	0	
1848840	4009847095770	Кофемашина bosch 9577 (красная)/Klein	477163	Посуда (folder)/Кофеварка	0	
3373808	4242002703718	Кофемашина bosch tca5309, объем 1.8л, мощн.1400w,дав 15 бар,емк для зерен 250г пластик, черная	1	Неклассифицированные/default	39110	Bosch
2734325	4242002812519	Кофемашина bosch tes 51523RW 1600w,15 бар,проточн.нагрев-ль с сенсорами,авто-каппуч. пластик,серый графит	477163	Посуда (folder)/Кофеварка	39110	Bosch
1674934	4242002669113	Кофемашина bosch tes50129RW, объем 1.7л, мощн.1600w, дав.15бар, емк.зерен 300г, пластик, черная	477163	Посуда (folder)/Кофеварка	39110	Bosch
1674935	4242002640778	Кофемашина bosch tes50328RW, объем 1.7л, мощн.1600w, дав.15бар, емк.зерен 300г, пластик, коричн	477163	Посуда (folder)/Кофеварка	39110	Bosch
1674936	4242002640839	Кофемашина bosch tes50621RW, объем 1.7л, мощн.1600w, дав.15бар, емк.зерен 300г, пластик, серебро	477163	Посуда (folder)/Кофеварка	39110	Bosch
1674937	4242002703299	Кофемашина bosch tes71129RW, объем 2.1л, мощн.1700w, дав.15бар, емк.зерен 300г, пластик, черная	477163	Посуда (folder)/Кофеварка	39110	Bosch
3373809	4242002777245	Кофемашина bosch tes71221RW,объем 2.1л, мощн.1600w,дав 15 бар,емк для зерен 300г,пластик, серебр	1	Неклассифицированные/default	39110	Bosch
1674938	4242002703510	Кофемашина bosch tes71321RW, объем 2.1л, мощн.1700w, дав.19бар, емк.зерен 300г, пластик, серебро	477163	Посуда (folder)/Кофеварка	39110	Bosch
3373810	8004399325944	Кофемашина Delonghi ecam 22.360.s, объем 1.8л, мощн.1450w, дав.15бар,емк.зерен 250г,пластик, серебр	1	Неклассифицированные/default	455163	DeLonghi
1674939	8004399324404	Кофемашина Delonghi ecam 23.210.в, объем 1.8л,мощн.1450w, дав.15бар, емк.зерен 125г, пластик,черная	477163	Посуда (folder)/Кофеварка	455163	DeLonghi
3373811	8004399328334	Кофемашина Delonghi ecam 44.620.s, объем 2л, мощн.1450w, дав. 15бар,емк.зерен 400г,пластик серебро	1	Неклассифицированные/default	455163	DeLonghi
1674940	8004399323872	Кофемашина Delonghi esam 04.110b,объем 1.8л, мощн.1450w, дав.15бар, емк.зерен 200г,пластик, черн	477163	Посуда (folder)/Кофеварка	455163	DeLonghi
1674941	8004399324985	Кофемашина Delonghi esam 04.350s,объем 1.8л, мощн.1350w, дав.15бар, емк.зерен 200г,пластик, сереб	477163	Посуда (folder)/Кофеварка	455163	DeLonghi
2734326	8004399324619	Кофемашина Delonghi esam 2600 мощность 1350w, давление помпы 15бар, регулировка степени помола, тип кофе-молотый/зерновой, само	477163	Посуда (folder)/Кофеварка	455163	DeLonghi
1674942	8004399325685	Кофемашина Delonghi esam 2800.sb мощность 1450w, давление помпы 15бар, регулировка степени помола, тип кофе-молотый/зерновой, с	477163	Посуда (folder)/Кофеварка	455163	DeLonghi
1674943	8004399322622	Кофемашина Delonghi esam 3500,объем 1.8л, мощн.1350w, дав.15бар, емк.зерен 200г,пластик, сереб	477163	Посуда (folder)/Кофеварка	455163	DeLonghi
1674944	8004399324657	Кофемашина Delonghi esam 4000, объем 1.8л, мощ 1350w, дав.15бар, емк.зерен 200г, пластик, черная	477163	Посуда (folder)/Кофеварка	455163	DeLonghi
1674945	8004399323551	Кофемашина Delonghi esam 6620,объем 1.8л, мощн.1350w, дав.15бар, емк.зерен 250г,металл, сереб	477163	Посуда (folder)/Кофеварка	455163	DeLonghi
3373812	8004399325050	Кофемашина Delonghi eсam 22.110.b, объем 1.8л, мощн.1450w, дав. 15бар,емк.зерен 250г,пластик черн	1	Неклассифицированные/default	455163	DeLonghi
3373813	8004399325067	Кофемашина Delonghi eсam 22.110.sb, объем 1.8л, мощн.1450w, дав. 15бар,емк.зерен 250г платик, черн	1	Неклассифицированные/default	455163	DeLonghi
2883802	8027785070488	Кофемашина illy капсульная x7.1 ipso красная	1	Неклассифицированные/default	0	
2883803	8027785070525	Кофемашина illy капсульная x7.1 ipso красная #2	1	Неклассифицированные/default	0	
2883804	8027785070471	Кофемашина illy капсульная x7.1 ipso черная	1	Неклассифицированные/default	0	
2883805	8003753972251	Кофемашина illy капсульная y3 ipso белая	1	Неклассифицированные/default	0	
2883806	8027785131745	Кофемашина illy капсульная y3 ipso белая #2	1	Неклассифицированные/default	0	
2883807	8027785131752	Кофемашина illy капсульная y3 ipso красная	1	Неклассифицированные/default	0	
2883808	8027785986826	Кофемашина illy капсульная y3 ipso красная #2	1	Неклассифицированные/default	0	
2883809	8027785986840	Кофемашина illy капсульная y3 ipso красная #3	1	Неклассифицированные/default	0	
2883810	8027785131738	Кофемашина illy капсульная y3 ipso черная	1	Неклассифицированные/default	0	
2883811	8027785974496	Кофемашина illy капсульная y3 ipso черная #2	1	Неклассифицированные/default	0	
1674947	4620001917051	Кофемашина jura ena 9 metallic, объем 1.1л,мощн.1450w,дав.15бар, емк.зерен 125г, пластик,сереб 13526	477163	Посуда (folder)/Кофеварка	1674946	JURA
1674948	7610917136025	Кофемашина jura impressa c5 Black,объем 1.9л,мощн.1450w,дав.15бар, емк.зерен 200г,пластик,черн 13602	477163	Посуда (folder)/Кофеварка	1674946	JURA
1674949	7610917136612	Кофемашина jura impressa f50 Classic eu,об.1.9л, мощ.1450w, дав.15бар,емк.зер.200г,пласт,черн 13661	477163	Посуда (folder)/Кофеварка	1674946	JURA
1674950	4620001925827	Кофемашина jura impressa f7 piano Black eu,об.1.9л,мощ 1450w, дав.15бар,емк.зер 310г,пласт,черн 13639	477163	Посуда (folder)/Кофеварка	1674946	JURA
1674951	4620001925643	Кофемашина jura impressa s9 Classic eu,об.2.7л,мощн.1450w, дав.15бар,емк.зер.280г,пласт, черн 13659	477163	Посуда (folder)/Кофеварка	1674946	JURA
1239185	010942207788	Кофемашина krups 1200w 1л красн xn700610	203752	Техника (folder)/Бытовая техника	1239184	Крупс
1239186	010942208327	Кофемашина krups 1260w 1л черн.xn212010	203752	Техника (folder)/Бытовая техника	1239184	Крупс
1239187	010942212553	Кофемашина krups 1500w 1л красн kp150610     	203752	Техника (folder)/Бытовая техника	1239184	Крупс
1674952	010942206644	Кофемашина krups ea8010pe, объем 1.8л, мощн.1450w, дав.15бар, емк.зерен 275г, металл, сереб/черная	477163	Посуда (folder)/Кофеварка	740798	Krups
1674953	010942206637	Кофемашина krups ea8050, объем 1.8л, мощн.1450w, дав.15бар, емк.зерен 275г, металл, серебро	477163	Посуда (folder)/Кофеварка	740798	Krups
3373814	4006508195978	Кофемашина melitta caffeo solo е 950-103, объем 1.2л, мощ.1400w,дав 15 бар, емк для зерен 125г	1	Неклассифицированные/default	392167	Melitta
3373815	4006508202881	Кофемашина melitta caffeo solo&Milk е 953-102,объем 1.2л,мощн.1400w,15 бар,емк для зерен 125г	1	Неклассифицированные/default	392167	Melitta
1674954	8710103524526	Кофемашина Philips saeco hd8743/19, об.1л, мощн.1400w, дав.15бар, емк.зерен 180г, пластик, черная	477163	Посуда (folder)/Кофеварка	39898	PHILIPS
1674955	8710103524533	Кофемашина Philips saeco hd8745/09, об.1л, мощн.1400w, дав.15бар, емк.зерен 180г, пластик, сереб	477163	Посуда (folder)/Кофеварка	39898	PHILIPS
1674956	8710103575177	Кофемашина Philips saeco hd8752/89, об.1.5л, мощн.1850w, дав.15бар, емк.зерен 300г, пластик,сереб	477163	Посуда (folder)/Кофеварка	39898	PHILIPS
1674957	8710103524601	Кофемашина Philips saeco hd8838/09, об.1.2л,мощ 1400w, дав.15бар, емк.зерен 250г, металл, сереб	477163	Посуда (folder)/Кофеварка	39898	PHILIPS
1674958	8710103524649	Кофемашина Philips saeco hd8943/29, об.1.6л,мощ 1500w, дав.15 бар, емк.зерен 350г, металл, сереб	477163	Посуда (folder)/Кофеварка	39898	PHILIPS
1239189	8710103533207	Кофемашина Philips syntia focus techno hd8833/31	203752	Техника (folder)/Бытовая техника	39898	PHILIPS
477184	4242003480854	Кофемашина Siemens tk73201RW	477163	Посуда (folder)/Кофеварка	74863	Siemens
3373816	4607001776970	Кофемашина капсульная bosch tassimo 1252, 1300w, 0.7л черная+капсулы на 24 чашки в комплекте!	1	Неклассифицированные/default	39110	Bosch
3373817	4607001776987	Кофемашина капсульная bosch tassimo 1253, 1300w, 0.7л красная+капсулы на 24 чашки в комплекте!	1	Неклассифицированные/default	39110	Bosch
3373818	8004399326477	Кофемашина капсульная Delonghi nespresso en 110.b, 1260w, объем 0.7л черн+капсулы на 16 чашек	1	Неклассифицированные/default	455163	DeLonghi
3373819	8004399327610	Кофемашина капсульная Delonghi nespresso en 210.bae, 1260w, объем 0.7л,черн+капсулы на 16 чашек	1	Неклассифицированные/default	455163	DeLonghi
3373820	8004399327917	Кофемашина капсульная Delonghi nespresso en 80.o, 1260w, объем 0.8л, оранж+ капсулы на 16 чашек	1	Неклассифицированные/default	455163	DeLonghi
740799	010942209423	Кофемашина капсульная krups 15бар kp500025	477163	Посуда (folder)/Кофеварка	740798	Krups
740800	010942209454	Кофемашина капсульная krups 15бар kp500625	477163	Посуда (folder)/Кофеварка	740798	Krups
1674959	010942212812	Кофемашина капсульная krups Dolce gusto circolo kp510t10, мощ 1500w, дав15бар, об 1.3л, пластик,титан	477163	Посуда (folder)/Кофеварка	740798	Krups
1674960	010942213543	Кофемашина капсульная krups Dolce gusto melody 3 kp220810, мощ 1500w, дав.15бар,об 1.3л, пласт,черная	477163	Посуда (folder)/Кофеварка	740798	Krups
1674961	010942210979	Кофемашина капсульная krups Dolce gusto piccolo kp1006e1, мощ 1500w, дав.15бар,об 0.6л, пласт,красная	477163	Посуда (folder)/Кофеварка	740798	Krups
740801	010942207955	Кофемашина капсульная krups melody2 красн kp210625	477163	Посуда (folder)/Кофеварка	740798	Krups
740802	010942207931	Кофемашина капсульная krups melody2 черн.kp210025	477163	Посуда (folder)/Кофеварка	740798	Krups
1674962	010942213017	Кофемашина капсульная krups nespresso xn214010, мощ.1260w, дав.19 бар, объем 1л, пластик, серая	477163	Посуда (folder)/Кофеварка	740798	Krups
1674963	010942214007	Кофемашина капсульная krups nespresso xn250a10, мощ.1260w, дав.19 бар, объем 0.7л, пластик, титан	477163	Посуда (folder)/Кофеварка	740798	Krups
1674964	010942207856	Кофемашина капсульная krups nespresso xn710610, мощ.1260w, дав.19 бар, объем 1л, пластик, красная	477163	Посуда (folder)/Кофеварка	740798	Krups
1674965	010942212614	Кофемашина капсульная krups nespresso xn800610, мощ.1200w, дав.19 бар, объем 1.4л, пластик,красная	477163	Посуда (folder)/Кофеварка	740798	Krups
1674966	4043002697775	Кофемашина капсульная Tchibo cafissimo Black and steel, мощн 1050w,объем 1.5л,капучинатор, 269777	477163	Посуда (folder)/Кофеварка	19737	Tchibo
3373821	4043002958579	Кофемашина капсульная Tchibo cafissimo compact Black,мощ 950w,объем 1.1л,черная	1	Неклассифицированные/default	19737	Tchibo
1674967	4043002958586	Кофемашина капсульная Tchibo cafissimo compact Red, мощ 950w, об. 1.1л, 295858	477163	Посуда (folder)/Кофеварка	19737	Tchibo
3373822	4043002958562	Кофемашина капсульная Tchibo cafissimo compact White, мощность 950w,объем 1.1л, белая	1	Неклассифицированные/default	19737	Tchibo
1674968	4640011510080	Кофемашина капсульная брилль Cafe rc-1802, мощ.1400w, дав15-20бар, об.1.2л,пластик,красн,кфм000015	477163	Посуда (folder)/Кофеварка	1669998	БРИЛЛЬ CAFE
1239190	5060240302512	Кофемейкер Lumme lu-421 бронза/серебро	2420630	Посуда (folder)/Посуда кухонная	89275	Lumme
1239191	5060240302598	Кофемейкер Lumme lu-429	2420630	Посуда (folder)/Посуда кухонная	89275	Lumme
1239193	5060145825345	Кофемейкер Lumme-414	2420630	Посуда (folder)/Посуда кухонная	89275	Lumme
74931	5060102714811	Кофемейкер Marta mt-3700	2420630	Посуда (folder)/Посуда кухонная	39114	Marta
74932	5060102714828	Кофемейкер Marta mt-3701	2420630	Посуда (folder)/Посуда кухонная	39114	Marta
74933	5060102714910	Кофемейкер Marta mt-3704	2420630	Посуда (folder)/Посуда кухонная	39114	Marta
3373823	5060145825499	Кофемейкер Marta мт-3705 600мл	1	Неклассифицированные/default	0	
1239194	5060145825383	Кофемейкер марта мт-3712 0.6	2420630	Посуда (folder)/Посуда кухонная	0	
1239195	5060145825390	Кофемейкер марта мт-3714.3713	2420630	Посуда (folder)/Посуда кухонная	0	
1239196	5060145825406	Кофемейкер марта мт-3714.3713 #2	2420630	Посуда (folder)/Посуда кухонная	0	
1239197	5060145825420	Кофемейкер марта мт-3716	2420630	Посуда (folder)/Посуда кухонная	0	
1239198	5060145825468	Кофемейкер марта мт-3720	2420630	Посуда (folder)/Посуда кухонная	0	
3373824	9012345005009	Кофемолка 120w vitek vt-1540	477185	Посуда (folder)/Кофемолка	150037	Vitek
810941	6951119651444	Кофемолка 16см,чаша нжс,керам.корпус,вместимость 85г,упаковка:картон	477185	Посуда (folder)/Кофемолка	723582	Роялтон Групп
3373826	9120048690818	Кофемолка 220w vitek vt-1547	477185	Посуда (folder)/Кофемолка	0	
316445	5027713825268	Кофемолка Bekker ручная	477185	Посуда (folder)/Кофемолка	1207002	Bekker
2969380	5027713825169	Кофемолка Bekker ручная #2	477185	Посуда (folder)/Кофемолка	1207002	Bekker
2969383	5027713825190	Кофемолка Bekker ручная #5	477185	Посуда (folder)/Кофемолка	1207002	Bekker
2969384	5027713825206	Кофемолка Bekker ручная #6	477185	Посуда (folder)/Кофемолка	1207002	Bekker
2969385	5027713825213	Кофемолка Bekker ручная #7	477185	Посуда (folder)/Кофемолка	1207002	Bekker
2969386	5027713825220	Кофемолка Bekker ручная #8	477185	Посуда (folder)/Кофемолка	1207002	Bekker
2969382	5027713825183	Кофемолка Bekker ручная вк-2518	477185	Посуда (folder)/Кофемолка	1207002	Bekker
2969381	5027713825176	Кофемолка Bekker ручная керамика дерево вк-2517	477185	Посуда (folder)/Кофемолка	1207002	Bekker
74934	4893114113119	Кофемолка Binatone 150 154907	477185	Посуда (folder)/Кофемолка	41379	Binatone
157035	4893114113126	Кофемолка Binatone сg 250	477185	Посуда (folder)/Кофемолка	41379	Binatone
3373827	6920346350253	Кофемолка biotech эл нерж/сталь cg-8207	477185	Посуда (folder)/Кофемолка	0	
740808	699965033163	Кофемолка bodum бистро элект.ножевая лимонн.11160-565Euro	477185	Посуда (folder)/Кофемолка	38182	Bodum
740809	699965033200	Кофемолка bodum бистро элект.ножевая оранж 11160-106Euro	477185	Посуда (folder)/Кофемолка	38182	Bodum
740810	699965033187	Кофемолка bodum бистро элект.ножевая фиолетов 11160-278Euro	477185	Посуда (folder)/Кофемолка	38182	Bodum
157036	4242002002002	Кофемолка bosch mkm6000, мощность 180w, вместимость 75г, пластик, белая	477185	Посуда (folder)/Кофемолка	39110	Bosch
157037	4242002068244	Кофемолка bosch mkm6003, мощность 180w, вместимость 75г, пластик, черная	477185	Посуда (folder)/Кофемолка	39110	Bosch
