ID	UPCEAN	Name	CategoryID	CategoryName	BrandID	BrandName
1209053	46082404	Жевательная резинка mentos пюр вайт 50шт 100г	19141	Продукты питания (folder)/Жевательная резинка	20357	Mentos
1209055	80746713	Жевательная резинка mentos пюр фреш 30г #2	19141	Продукты питания (folder)/Жевательная резинка	20357	Mentos
2740382	46168528	Жевательная резинка mentos свежая мята 16г мяг/уп	77	Продукты питания (folder)/Кондитерские изделия (folder)/Кондитерские изделия	20357	Mentos
312702	4602606006194	Жевательная резинка mentos свежесть в кубе 54г 30шт пл.банка /ассорт./	19141	Продукты питания (folder)/Жевательная резинка	20357	Mentos
1209142	80948582	Жевательная резинка mentos фрут краш 56г бан.	19141	Продукты питания (folder)/Жевательная резинка	20357	Mentos
3316004	4602606009072	Жевательная резинка mentos яблочный пирог, 82г, м/у	19141	Продукты питания (folder)/Жевательная резинка	20357	Mentos
3316005	6961256300501	Жевательная резинка Mini 12г	19141	Продукты питания (folder)/Жевательная резинка	0	
3316006	8697423123342	Жевательная резинка minidots подушечки 12г	19141	Продукты питания (folder)/Жевательная резинка	0	
3316007	6954302913336	Жевательная резинка Miss Orange самолет 12г м/у	19141	Продукты питания (folder)/Жевательная резинка	0	
3316008	4627075733112	Жевательная резинка mozzavr со вкусом апельсина 15г	19141	Продукты питания (folder)/Жевательная резинка	0	
3316009	4627075732597	Жевательная резинка mozzi клубника татау 25г м/у	19141	Продукты питания (folder)/Жевательная резинка	0	
3316010	4627075731514	Жевательная резинка mozzy фруктовая лента 15г	19141	Продукты питания (folder)/Жевательная резинка	0	
3316011	46104526	Жевательная резинка nano, виноград малина арбуз, 25.5г, кор	19141	Продукты питания (folder)/Жевательная резинка	0	
1353679	3574660589436	Жевательная резинка nicorette 0.002 n 15x2 морозная мята	1	Неклассифицированные/default	632191	Nicorette
3316012	8693323692209	Жевательная резинка o Fresh tutti frutti 4г мяг/уп	19141	Продукты питания (folder)/Жевательная резинка	0	
3316013	8693323694012	Жевательная резинка o'fresh tutti frutti 5г м/уп	19141	Продукты питания (folder)/Жевательная резинка	0	
3316014	8693323346102	Жевательная резинка o'fresh абрикос 12г	19141	Продукты питания (folder)/Жевательная резинка	0	
3316015	8693323347109	Жевательная резинка o'fresh ежевика 12г	19141	Продукты питания (folder)/Жевательная резинка	0	
3316016	8693323343101	Жевательная резинка o'fresh клубника 15г м/у	19141	Продукты питания (folder)/Жевательная резинка	0	
548543	4600815108906	Жевательная резинка olips арбуз.свежесть б/сах. 24x30 x13.5г	19141	Продукты питания (folder)/Жевательная резинка	0	
548711	4600815108890	Жевательная резинка olips клубн.свежесть б/сах. 24x30 x13.5г	19141	Продукты питания (folder)/Жевательная резинка	0	
548710	4600815108883	Жевательная резинка olips мороз.свежесть (переч.мята) б/сах. 24x30 x13.5г	19141	Продукты питания (folder)/Жевательная резинка	0	
1209077	8690515903815	Жевательная резинка olips фруктовый вкус 25г	19141	Продукты питания (folder)/Жевательная резинка	0	
3316017	4620003670053	Жевательная резинка pink panther tutti frutti 3г мяг/уп	19141	Продукты питания (folder)/Жевательная резинка	0	
3316018	7891118011063	Жевательная резинка plutonita 180г	19141	Продукты питания (folder)/Жевательная резинка	0	
2512594	7891118011070	Жевательная резинка plutonita вкус апельсина с кислой начинкой 5г м/у	1	Неклассифицированные/default	0	
3316019	8690146645818	Жевательная резинка pompito	19141	Продукты питания (folder)/Жевательная резинка	0	
3316020	8690146077510	Жевательная резинка pompito 6шт 20г мяг/уп	19141	Продукты питания (folder)/Жевательная резинка	0	
3316021	75031480	Жевательная резинка poosh 5.3г	19141	Продукты питания (folder)/Жевательная резинка	0	
3316022	7891118008131	Жевательная резинка poosh tutti frutti 40шт м/у	19141	Продукты питания (folder)/Жевательная резинка	0	
3316023	7891118008179	Жевательная резинка poosh виноград 40шт м/у	19141	Продукты питания (folder)/Жевательная резинка	0	
3316024	7891118008155	Жевательная резинка poosh клубника 40шт м/у	19141	Продукты питания (folder)/Жевательная резинка	0	
3316025	7891118011322	Жевательная резинка poosh клубника-мята 40шт м/у	19141	Продукты питания (folder)/Жевательная резинка	0	
3316026	7891118008148	Жевательная резинка poosh мята 40шт м/у	19141	Продукты питания (folder)/Жевательная резинка	0	
3316027	78927995	Жевательная резинка poosh с начинкой 5г м/уп	19141	Продукты питания (folder)/Жевательная резинка	0	
3316028	6921815304579	Жевательная резинка roll на ленте	19141	Продукты питания (folder)/Жевательная резинка	0	
3316029	4620746470224	Жевательная резинка rusgum neon big ассорти 8.5г	19141	Продукты питания (folder)/Жевательная резинка	0	
3316030	4620746470569	Жевательная резинка rusgum сочный арбуз ассорти 5г	19141	Продукты питания (folder)/Жевательная резинка	0	
3316031	4620746470248	Жевательная резинка rusgum фруктовая фантазия ассорти 6г	19141	Продукты питания (folder)/Жевательная резинка	0	
3316032	8693323315108	Жевательная резинка saadet океан шрэш черника 17г пачка	19141	Продукты питания (folder)/Жевательная резинка	0	
3316033	6926293432004	Жевательная резинка shantou yuanda Foods CD ltd ледяной балабол со вкусом арбуза 15.6г м/у	19141	Продукты питания (folder)/Жевательная резинка	0	
3316034	6926293432035	Жевательная резинка shantou yuanda Foods CD ltd ледяной балабол со вкусом клубники 15.6г м/у	19141	Продукты питания (folder)/Жевательная резинка	0	
1526988	8801062118090	Жевательная резинка spearmint 14г	1	Неклассифицированные/default	620656	Lotte
2862040	6925368723702	Жевательная резинка Sport ball 13г 20/50 ux-bg-145	19141	Продукты питания (folder)/Жевательная резинка	0	
549124	4600815109408	Жевательная резинка stimorol (виноград.лед) б/сах. 24x30 x13.6г	19141	Продукты питания (folder)/Жевательная резинка	53788	Stimorol
549125	4600815109439	Жевательная резинка stimorol (вишн.лед) б/сах. 24x30 x13.6г	19141	Продукты питания (folder)/Жевательная резинка	53788	Stimorol
549126	4600815109446	Жевательная резинка stimorol (мятный мороз) б/сах. 24x30 x13.6г	19141	Продукты питания (folder)/Жевательная резинка	53788	Stimorol
1209060	46088796	Жевательная резинка stimorol 13г виноградный лед	19141	Продукты питания (folder)/Жевательная резинка	53788	Stimorol
153826	3538280012286	Жевательная резинка stimorol 2d клубника 0.014x20	19141	Продукты питания (folder)/Жевательная резинка	53788	Stimorol
111156	30064027	Жевательная резинка stimorol 2d клубника 12.8г	19141	Продукты питания (folder)/Жевательная резинка	53788	Stimorol
153827	3538280012316	Жевательная резинка stimorol 2d мята 0.014x20	19141	Продукты питания (folder)/Жевательная резинка	53788	Stimorol
111157	30064041	Жевательная резинка stimorol 2d мята 12.8г	19141	Продукты питания (folder)/Жевательная резинка	53788	Stimorol
111158	30064034	Жевательная резинка stimorol 2d св.энергия 12.8г	19141	Продукты питания (folder)/Жевательная резинка	53788	Stimorol
548537	4600815109026	Жевательная резинка stimorol Ice (виноград.лед) б/сах. 14x20 x12.2г	19141	Продукты питания (folder)/Жевательная резинка	53788	Stimorol
548536	4600815109019	Жевательная резинка stimorol Ice (вишн.лед) б/сах. 14x20 x12.2г	19141	Продукты питания (folder)/Жевательная резинка	53788	Stimorol
548704	4600815109255	Жевательная резинка stimorol Ice (клюкв.лед) б/сах. 14x20 x12.2г	19141	Продукты питания (folder)/Жевательная резинка	53788	Stimorol
548534	4600815108982	Жевательная резинка stimorol Ice (мятный мороз) б/сах. 14x20 x12.2г	19141	Продукты питания (folder)/Жевательная резинка	53788	Stimorol
548535	4600815108999	Жевательная резинка stimorol Ice (мятный холод) б/сах. 14x20 x12.2г	19141	Продукты питания (folder)/Жевательная резинка	53788	Stimorol
548703	4600815109002	Жевательная резинка stimorol Ice (цитрус.лед) б/сах. 14x20 x12.2г	19141	Продукты питания (folder)/Жевательная резинка	53788	Stimorol
1664819	46082374	Жевательная резинка stimorol Ice виноград 9x12.2г	19141	Продукты питания (folder)/Жевательная резинка	53788	Stimorol
419640	46069962	Жевательная резинка stimorol Ice виноградный лед 14г м/у	19141	Продукты питания (folder)/Жевательная резинка	53788	Stimorol
1664818	46082367	Жевательная резинка stimorol Ice вишневый лед 14г м/у	19141	Продукты питания (folder)/Жевательная резинка	53788	Stimorol
111160	46057884	Жевательная резинка stimorol Ice мятная свежесть 14г м/у	19141	Продукты питания (folder)/Жевательная резинка	53788	Stimorol
419638	46067104	Жевательная резинка stimorol Ice похолодание	19141	Продукты питания (folder)/Жевательная резинка	53788	Stimorol
111170	46047403	Жевательная резинка stimorol Ice цитрусовый лед 14г м/у	19141	Продукты питания (folder)/Жевательная резинка	53788	Stimorol
461523	42188858	Жевательная резинка stimorol Pro-z Lemon breeze подушечки №12	19141	Продукты питания (folder)/Жевательная резинка	53788	Stimorol
461524	42189237	Жевательная резинка stimorol Pro-z spearmint подушечки №12	19141	Продукты питания (folder)/Жевательная резинка	53788	Stimorol
461525	42189220	Жевательная резинка stimorol Pro-z ягодный Бриз подушечки №12	19141	Продукты питания (folder)/Жевательная резинка	53788	Stimorol
153828	46047410	Жевательная резинка stimorol айс арктический лед 0.014	19141	Продукты питания (folder)/Жевательная резинка	53788	Stimorol
317568	46082336	Жевательная резинка stimorol айс асс	19856	Продукты питания (folder)/Кондитерские изделия (folder)/Леденцы	0	
2862041	46082343	Жевательная резинка stimorol айс асс #2	19141	Продукты питания (folder)/Жевательная резинка	0	
111159	46057877	Жевательная резинка stimorol айс вишневый лед 0.014	19141	Продукты питания (folder)/Жевательная резинка	53788	Stimorol
312706	46088826	Жевательная резинка stimorol айс вишневый лед 13.6г	19141	Продукты питания (folder)/Жевательная резинка	53788	Stimorol
111162	46047397	Жевательная резинка stimorol айс мятная свежесть 0.014	19141	Продукты питания (folder)/Жевательная резинка	53788	Stimorol
111161	57107158	Жевательная резинка stimorol вайт 0.014	19141	Продукты питания (folder)/Жевательная резинка	53788	Stimorol
153829	5700626161059	Жевательная резинка stimorol вайт 0.014x30	19141	Продукты питания (folder)/Жевательная резинка	53788	Stimorol
111168	57625454	Жевательная резинка stimorol вайт сл мята 0.007	19141	Продукты питания (folder)/Жевательная резинка	53788	Stimorol
419639	46063359	Жевательная резинка stimorol ванильный лед 14г м/у	19141	Продукты питания (folder)/Жевательная резинка	53788	Stimorol
71482	57626475	Жевательная резинка stimorol кисс кул лимон 0.021	19141	Продукты питания (folder)/Жевательная резинка	53788	Stimorol
71483	57047935	Жевательная резинка stimorol кисс кул черная смородина 0.021	19141	Продукты питания (folder)/Жевательная резинка	53788	Stimorol
547573	5700626162452	Жевательная резинка stimorol кисс кул экстра стронг	19141	Продукты питания (folder)/Жевательная резинка	53788	Stimorol
71484	57626505	Жевательная резинка stimorol кисс кул экстра стронг, 0.021	19141	Продукты питания (folder)/Жевательная резинка	53788	Stimorol
71485	57627069	Жевательная резинка stimorol кисс кул яблоко 0.021	19141	Продукты питания (folder)/Жевательная резинка	53788	Stimorol
53790	57626390	Жевательная резинка stimorol мини кисс кул 0.014	19141	Продукты питания (folder)/Жевательная резинка	53788	Stimorol
53789	57626413	Жевательная резинка stimorol мини кисс кул эвкалипт 0.014	19141	Продукты питания (folder)/Жевательная резинка	53788	Stimorol
419637	46067111	Жевательная резинка stimorol мятн обледен 13.2г	19141	Продукты питания (folder)/Жевательная резинка	53788	Stimorol
1209061	46088833	Жевательная резинка stimorol мятный мороз 13.6г м/у	19141	Продукты питания (folder)/Жевательная резинка	53788	Stimorol
111163	57030784	Жевательная резинка stimorol освеж.мята 6под	19141	Продукты питания (folder)/Жевательная резинка	53788	Stimorol
111164	57107516	Жевательная резинка stimorol про-z 12шт	19141	Продукты питания (folder)/Жевательная резинка	53788	Stimorol
2962185	57626185	Жевательная резинка stimorol про-z 12шт #2	19141	Продукты питания (folder)/Жевательная резинка	53788	Stimorol
2433249	57030739	Жевательная резинка stimorol про-z асс 0.014 #2	19141	Продукты питания (folder)/Жевательная резинка	0	
2433250	57042381	Жевательная резинка stimorol про-z асс 0.014 #3	19141	Продукты питания (folder)/Жевательная резинка	0	
2433251	57103563	Жевательная резинка stimorol про-z асс 0.014 #4	19141	Продукты питания (folder)/Жевательная резинка	0	
111165	57030722	Жевательная резинка stimorol про-z мен 12	19141	Продукты питания (folder)/Жевательная резинка	53788	Stimorol
111166	57626192	Жевательная резинка stimorol про-z ментол 12шт	19141	Продукты питания (folder)/Жевательная резинка	53788	Stimorol
111167	57626246	Жевательная резинка stimorol про-z пеперминт 0.014	19141	Продукты питания (folder)/Жевательная резинка	53788	Stimorol
153830	5700626161370	Жевательная резинка stimorol про-z пеперминт.014x30	19141	Продукты питания (folder)/Жевательная резинка	53788	Stimorol
153831	57626123	Жевательная резинка stimorol про-z фрешминт.014	19141	Продукты питания (folder)/Жевательная резинка	53788	Stimorol
111169	57107653	Жевательная резинка stimorol сплэш елоу 7г	19141	Продукты питания (folder)/Жевательная резинка	53788	Stimorol
2433252	57107493	Жевательная резинка stimorol фрут флэш 0.014	19141	Продукты питания (folder)/Жевательная резинка	0	
111171	57030807	Жевательная резинка stimorol экстрим асс 0.014	19141	Продукты питания (folder)/Жевательная резинка	53788	Stimorol
153832	57626765	Жевательная резинка stimorol экстрим эвкалипт	19141	Продукты питания (folder)/Жевательная резинка	53788	Stimorol
419641	46079541	Жевательная резинка stimorol ягодный лед	19141	Продукты питания (folder)/Жевательная резинка	53788	Stimorol
3316035	6921666621160	Жевательная резинка sugar фруктовая 16г пл/уп	19141	Продукты питания (folder)/Жевательная резинка	0	
1664810	460706277654	Жевательная резинка sweet ball	19141	Продукты питания (folder)/Жевательная резинка	0	
3316036	4607062776575	Жевательная резинка sweet ball апельсин 4.5г	19141	Продукты питания (folder)/Жевательная резинка	0	
3316037	4607062776551	Жевательная резинка sweet ball дражированная с ароматом мяты	19141	Продукты питания (folder)/Жевательная резинка	0	
3316038	4607062776513	Жевательная резинка sweet ball дыня-арбуз 4.5г	19141	Продукты питания (folder)/Жевательная резинка	0	
3316039	4607062776520	Жевательная резинка sweet ball клубника	19141	Продукты питания (folder)/Жевательная резинка	0	
3316040	4607062776537	Жевательная резинка sweet ball клубника #2	19141	Продукты питания (folder)/Жевательная резинка	0	
3316041	6922915930903	Жевательная резинка tattoo gum	19141	Продукты питания (folder)/Жевательная резинка	0	
3316042	6922915930910	Жевательная резинка tattoo gum #2	19141	Продукты питания (folder)/Жевательная резинка	0	
3316043	6922915930934	Жевательная резинка tattoo gum #3	19141	Продукты питания (folder)/Жевательная резинка	0	
3316044	6934335007837	Жевательная резинка tatuaga rally 12.5г	19141	Продукты питания (folder)/Жевательная резинка	0	
3316045	4627075733211	Жевательная резинка transformers со вкусом колы 25г мяг/уп	19141	Продукты питания (folder)/Жевательная резинка	0	
3316046	4627075733228	Жевательная резинка transformers со вкусом колы 25г мяг/уп #2	19141	Продукты питания (folder)/Жевательная резинка	0	
3316047	4627075733150	Жевательная резинка transformers со вкусом тропик 3.5г мяг/уп	19141	Продукты питания (folder)/Жевательная резинка	0	
3316048	6921248708142	Жевательная резинка trolls со вкусом клубники 2.2г м/уп	19141	Продукты питания (folder)/Жевательная резинка	0	
3316049	8680861069365	Жевательная резинка Turbo 4.5г	19141	Продукты питания (folder)/Жевательная резинка	0	
3316050	8680861069983	Жевательная резинка Turbo 4.5г #2	19141	Продукты питания (folder)/Жевательная резинка	0	
3316051	4607024264492	Жевательная резинка Turbo gum дражированная со вкусом мяты 40г т/уп	19141	Продукты питания (folder)/Жевательная резинка	0	
2725547	8680861069075	Жевательная резинка Turbo Soft bubble gum 4.5г м/уп	19141	Продукты питания (folder)/Жевательная резинка	0	
3316052	4606157002063	Жевательная резинка Turbo клубника м/у	19141	Продукты питания (folder)/Жевательная резинка	0	
3316053	46196583	Жевательная резинка Turbo персик 14г м/у	19141	Продукты питания (folder)/Жевательная резинка	0	
3316054	6904234800723	Жевательная резинка Turbo с джемом 15г м/у	19141	Продукты питания (folder)/Жевательная резинка	0	
3316055	4627112750720	Жевательная резинка tutti frutti в подушечках 12г м/у	19141	Продукты питания (folder)/Жевательная резинка	0	
1766557	75030650	Жевательная резинка tutti frutti с фруктовыми вкусами 2.7г	19141	Продукты питания (folder)/Жевательная резинка	0	
3316056	4680003370131	Жевательная резинка tutti frutti собери коллекцию подарков 5г мяг/уп Смешарики	19141	Продукты питания (folder)/Жевательная резинка	0	
3316057	4650060000593	Жевательная резинка tutti frutti фрашкуша 2г	19141	Продукты питания (folder)/Жевательная резинка	0	
2862042	4696309050745	Жевательная резинка upgum adrenaline со вкусом энергетика	19141	Продукты питания (folder)/Жевательная резинка	0	
2862043	4696309050769	Жевательная резинка upgum exotic tornado вкус ананаса и грейпфрут	19141	Продукты питания (folder)/Жевательная резинка	0	
3316058	4696309050738	Жевательная резинка upgum Lime Fresh вкус лимона и лайм	19141	Продукты питания (folder)/Жевательная резинка	0	
3316059	4650069880882	Жевательная резинка vip карта модный клуб 5г мяг/уп	19141	Продукты питания (folder)/Жевательная резинка	0	
