ID	UPCEAN	Name	CategoryID	CategoryName	BrandID	BrandName
845118	4810344035332	Алтай трактор с прицепом №1, 4шт арт. 35332	980	Игрушки (folder)/Игрушки	0	
1215811	4810344035387	Алтай трактор-погрузчик, 8шт арт. 35387	980	Игрушки (folder)/Игрушки	41335	Полесье
2846280	4607077091847	Алтай-селигор бальзам для памяти 200мл	1	Неклассифицированные/default	0	
2846281	4607077092004	Алтай-селигор сироп шиповника листья олепих/земляники 200мл	1	Неклассифицированные/default	0	
3295990	4607005204660	Алтайская (teysi/barnaul) s pantgmtgn pantohematogen vd 0.25l	22581	Продукты питания (folder)/Алкогольные напитки/Водка	3778244	алтайская (TEYSI/BARNAUL)
3295989	4607005202505	Алтайская (teysi/barnaul) s pantgmtgn pantohematogen vd 0.5l	22581	Продукты питания (folder)/Алкогольные напитки/Водка	3778244	алтайская (TEYSI/BARNAUL)
3778246	4603710143485	Алтайская (torgobespech.kp/bi) sunflower peanuts s 0.2kg	329006	Продукты питания (folder)/Халва	3778245	алтайская (TORGOBESPECHENIE KP/BIYSK)
3778247	4607124860181	Алтайская (torgobespech.kp/bi) sunflower peanuts s 0.2kg #2	329006	Продукты питания (folder)/Халва	3778245	алтайская (TORGOBESPECHENIE KP/BIYSK)
3778249	4607048410011	Алтайская ptichka souffle 0.3kg k a	3607409	Продукты питания (folder)/Кондитерские изделия (folder)/Конфеты шоколадные	3778248	алтайская PTICHKA (BARNAULSKAYA KONDITERSKAYA F-KA/BARNAU
3778250	4680018700060	Алтайская ptichka souffle 0.3kg k a #2	3607409	Продукты питания (folder)/Кондитерские изделия (folder)/Конфеты шоколадные	3778248	алтайская PTICHKA (BARNAULSKAYA KONDITERSKAYA F-KA/BARNAU
3778251	4607048410035	Алтайская ptichka souffle 0.7kg k a	3607409	Продукты питания (folder)/Кондитерские изделия (folder)/Конфеты шоколадные	3778248	алтайская PTICHKA (BARNAULSKAYA KONDITERSKAYA F-KA/BARNAU
3778252	4680018700077	Алтайская ptichka souffle 0.7kg k a #2	3607409	Продукты питания (folder)/Кондитерские изделия (folder)/Конфеты шоколадные	3778248	алтайская PTICHKA (BARNAULSKAYA KONDITERSKAYA F-KA/BARNAU
3418198	4607077200379	Алтайская slavnaya Wheat high.srt. s 1kg	24378	Продукты питания (folder)/Мука	3778253	алтайская SLAVNAYA (KLYUCHEVSKOY ELEVATOR/ALTAYSKIY KRAY)
3418197	4607077200102	Алтайская slavnaya Wheat high.srt. s 5kg	24378	Продукты питания (folder)/Мука	3778253	алтайская SLAVNAYA (KLYUCHEVSKOY ELEVATOR/ALTAYSKIY KRAY)
3778256	4607112811591	Алтайская буренка Apricot yn 0.4l p r bo b 1.5%f	144938	Продукты питания (folder)/Молочные продукты (folder)/Молочные продукты	3778255	алтайская буренка
2866520	4607112813045	Алтайская буренка banana yn 0.29kg p r bo b 1.5%f	23326	Продукты питания (folder)/Молочные продукты (folder)/Йогурт	3778255	алтайская буренка
3331236	4607112812017	Алтайская буренка banana yn 0.4l p r bo b 1.5%f	23326	Продукты питания (folder)/Молочные продукты (folder)/Йогурт	3778255	алтайская буренка
2866527	4607112813052	Алтайская буренка bilberry yn 0.29kg p r bo b 1.5%f	23326	Продукты питания (folder)/Молочные продукты (folder)/Йогурт	3778255	алтайская буренка
3331242	4607112811775	Алтайская буренка bilberry yn 0.4l p r bo b 1.5%f	23326	Продукты питания (folder)/Молочные продукты (folder)/Йогурт	3778255	алтайская буренка
2866528	4607112813106	Алтайская буренка cereal yn 0.29kg p r bo b 1.5%f	23326	Продукты питания (folder)/Молочные продукты (folder)/Йогурт	3778255	алтайская буренка
3331238	4607112811645	Алтайская буренка cereal yn 0.4l p r bo b 1.5%f	23326	Продукты питания (folder)/Молочные продукты (folder)/Йогурт	3778255	алтайская буренка
2866521	4607112813878	Алтайская буренка cher&sw.cher yn 0.29kg p r bo b 1.5%f	23326	Продукты питания (folder)/Молочные продукты (folder)/Йогурт	3778255	алтайская буренка
2866523	4607112813069	Алтайская буренка Lime&mint yn 0.29kg p r bo b 1.5%f	23326	Продукты питания (folder)/Молочные продукты (folder)/Йогурт	3778255	алтайская буренка
3778257	4607112814004	Алтайская буренка mp 0.85kg r p bo 2.5%	3605828	Продукты питания (folder)/Молочные продукты (folder)/Молоко пастеризованное	3778255	алтайская буренка
2866525	4607112813083	Алтайская буренка Peach yn 0.29kg p r bo b 1.5%f	23326	Продукты питания (folder)/Молочные продукты (folder)/Йогурт	3778255	алтайская буренка
3331241	4607112811614	Алтайская буренка Peach yn 0.4l p r bo b 1.5%f	23326	Продукты питания (folder)/Молочные продукты (folder)/Йогурт	3778255	алтайская буренка
3778258	4607112810372	Алтайская буренка Peach yn 0.5l a zu 2.5%f	144938	Продукты питания (folder)/Молочные продукты (folder)/Молочные продукты	3778255	алтайская буренка
3778259	4607112810716	Алтайская буренка Raspberry yn 0.45l a zu 2.5%f	144938	Продукты питания (folder)/Молочные продукты (folder)/Молочные продукты	3778255	алтайская буренка
2866524	4607112813076	Алтайская буренка sea buckthorn yn 0.29kg p r bo b 1.5%f	23326	Продукты питания (folder)/Молочные продукты (folder)/Йогурт	3778255	алтайская буренка
3331240	4607112811935	Алтайская буренка sea buckthorn yn 0.4l p r bo b 1.5%f	23326	Продукты питания (folder)/Молочные продукты (folder)/Йогурт	3778255	алтайская буренка
2891152	4607112813779	Алтайская буренка sliv.-rastit. spr y 0.18kg f wp 72.5%	1240988	Продукты питания (folder)/Масложировая продукция (folder)/Масложировая продукция	3778255	алтайская буренка
2866522	4607112813090	Алтайская буренка wil.strawberry yn 0.29kg p r bo b 1.5%f	23326	Продукты питания (folder)/Молочные продукты (folder)/Йогурт	3778255	алтайская буренка
3331237	4607112811607	Алтайская буренка wil.strawberry yn 0.4l p r bo b 1.5%f	23326	Продукты питания (folder)/Молочные продукты (folder)/Йогурт	3778255	алтайская буренка
2846282	4631137722938	Алтайская вареная Премиум класса	1	Неклассифицированные/default	0	
2846283	4650055438592	Алтайская п/к (фиброуз) ма 280г (вакуум.упак) 1шт	1	Неклассифицированные/default	0	
3580959	4607097077999	Алтайская сказка brl&bckw&oat&rye&whe sug.fr i s 0.4kg	1	Неклассифицированные/default	3611350	АЛТАЙСКАЯ СКАЗКА
3778262	7607827077999	Алтайская сказка brl&bckw&oat&rye&whe sug.fr i s 0.4kg #2	24389	Продукты питания (folder)/Каши, хлопья	3611350	АЛТАЙСКАЯ СКАЗКА
3778263	4201097076435	Алтайская сказка grebeshki whfl h 0.4kg s	24086	Продукты питания (folder)/Макароны	3611350	АЛТАЙСКАЯ СКАЗКА
3778264	4102097076299	Алтайская сказка kolechki whfl h 0.4kg s	24086	Продукты питания (folder)/Макароны	3611350	АЛТАЙСКАЯ СКАЗКА
3778265	4607097074370	Алтайская сказка lentil 0.4kg k por	22067	Продукты питания (folder)/Крупа и бобовые	3611350	АЛТАЙСКАЯ СКАЗКА
2735197	4607097074820	Алтайская сказка millet polished 0.8kg s	22067	Продукты питания (folder)/Крупа и бобовые	3611350	АЛТАЙСКАЯ СКАЗКА
2738696	4607097076473	Алтайская сказка pautinka whfl h 0.4kg s	24086	Продукты питания (folder)/Макароны	3611350	АЛТАЙСКАЯ СКАЗКА
3778266	4607097072918	Алтайская сказка polished Long g. k a 0.4kg por	23967	Продукты питания (folder)/Рис	3611350	АЛТАЙСКАЯ СКАЗКА
3778267	4607097077852	Алтайская сказка spelt chop. 0.4kg k por	22067	Продукты питания (folder)/Крупа и бобовые	3611350	АЛТАЙСКАЯ СКАЗКА
1979096	4607097072581	Алтайская сказка алтайская lentil 0.8kg s	1	Неклассифицированные/default	3611350	АЛТАЙСКАЯ СКАЗКА
2735168	4607097070457	Алтайская сказка крупа овсяная недроб.в/с 700г	22067	Продукты питания (folder)/Крупа и бобовые	3611350	АЛТАЙСКАЯ СКАЗКА
3778268	4397097076374	Алтайская сказка лапша uzkaya whfl h 0.4kg s	24086	Продукты питания (folder)/Макароны	3611350	АЛТАЙСКАЯ СКАЗКА
3778269	5601087076398	Алтайская сказка ракушки whfl h 0.4kg s	24086	Продукты питания (folder)/Макароны	3611350	АЛТАЙСКАЯ СКАЗКА
3778270	4297397076350	Алтайская сказка рожки whfl h 0.4kg s	24086	Продукты питания (folder)/Макароны	3611350	АЛТАЙСКАЯ СКАЗКА
3778271	4617097376350	Алтайская сказка рожки whfl h 0.4kg s #2	24086	Продукты питания (folder)/Макароны	3611350	АЛТАЙСКАЯ СКАЗКА
3778272	4607097073663	Алтайская сказка рожки whfl h 5kg s	24086	Продукты питания (folder)/Макароны	3611350	АЛТАЙСКАЯ СКАЗКА
1955710	4607097075933	Алтайская сказка смесь круп 400г рис + пшеничная	1	Неклассифицированные/default	0	
2885447	4607097074806	Алтайская сказка экстра buckwheat 0.4kg k por	1	Неклассифицированные/default	3611350	АЛТАЙСКАЯ СКАЗКА
3778273	4607097070037	Алтайская сказка экстра buckwheat 0.8kg s	22067	Продукты питания (folder)/Крупа и бобовые	3611350	АЛТАЙСКАЯ СКАЗКА
3778274	4607097074981	Алтайская сказка экстра buckwheat 0.8kg s #2	22067	Продукты питания (folder)/Крупа и бобовые	3611350	АЛТАЙСКАЯ СКАЗКА
3778275	4607097076176	Алтайская сказка экстра buckwheat 0.8kg s #3	22067	Продукты питания (folder)/Крупа и бобовые	3611350	АЛТАЙСКАЯ СКАЗКА
3778276	4680032561814	Алтайская сказка экстра buckwheat 0.8kg s nab	22067	Продукты питания (folder)/Крупа и бобовые	3611350	АЛТАЙСКАЯ СКАЗКА
3778279	4620768222207	Алтайские (barkanoff/biysk) гренки rye-Wheat fl aspic&horserad h scd p k 0.155kg #2	3605724	солёные закуски (снеки)	3778277	алтайские (BARKANOFF/BIYSK)
3778281	4620768221989	Алтайские (barkanoff/biysk) гренки rye-Wheat fl garlic h p k 0.07kg #2	3605724	солёные закуски (снеки)	3778277	алтайские (BARKANOFF/BIYSK)
3778283	4620768222184	Алтайские (barkanoff/biysk) гренки rye-Wheat fl garlic h scd p k 0.155kg #2	3605724	солёные закуски (снеки)	3778277	алтайские (BARKANOFF/BIYSK)
3778285	4620768222320	Алтайские (barkanoff/biysk) гренки rye-Wheat fl hunt.sausages h scd p k 0.155kg #2	3605724	солёные закуски (снеки)	3778277	алтайские (BARKANOFF/BIYSK)
3778287	4620768222221	Алтайские (barkanoff/biysk) гренки rye-Wheat fl mexican sauce h scd p k 0.155kg #2	3605724	солёные закуски (снеки)	3778277	алтайские (BARKANOFF/BIYSK)
3778278	4620768221408	Алтайские (barkanoff/biysk) гренки rye-Wheat flo aspic&horserad h scd p k 0.155kg	3605724	солёные закуски (снеки)	3778277	алтайские (BARKANOFF/BIYSK)
3778280	4620768221262	Алтайские (barkanoff/biysk) гренки rye-Wheat flo garlic h p k 0.07kg	3605724	солёные закуски (снеки)	3778277	алтайские (BARKANOFF/BIYSK)
3778282	4620768221361	Алтайские (barkanoff/biysk) гренки rye-Wheat flo garlic h scd p k 0.155kg	3605724	солёные закуски (снеки)	3778277	алтайские (BARKANOFF/BIYSK)
3778284	4620768222047	Алтайские (barkanoff/biysk) гренки rye-Wheat flo hunt.sausages h scd p k 0.155kg	3605724	солёные закуски (снеки)	3778277	алтайские (BARKANOFF/BIYSK)
3778286	4620768221385	Алтайские (barkanoff/biysk) гренки rye-Wheat flo mexican sauce h scd p k 0.155kg	3605724	солёные закуски (снеки)	3778277	алтайские (BARKANOFF/BIYSK)
3778289	4650070920263	Алтайские semechki sunflow.seeds z s 0.09kg	1305382	Продукты питания (folder)/Семечки	3778288	алтайские SEMECHKI (алтайские SEMECHKI/BARNAUL)
3778290	4650070920249	Алтайские semechki sunflow.seeds z s 0.3kg	1305382	Продукты питания (folder)/Семечки	3778288	алтайские SEMECHKI (алтайские SEMECHKI/BARNAUL)
3778292	4607047798929	Алтайские zakroma bedr-s-kozhy thighs chicken 1kg	3607704	мясо(фарш, части говядины, свинины, курицы, и тд) фиксированные вес	3778291	алтайские ZAKROMA
3778293	4607047798950	Алтайские zakroma fil-grudk pieces chicken 1kg	3607704	мясо(фарш, части говядины, свинины, курицы, и тд) фиксированные вес	3778291	алтайские ZAKROMA
3778294	4607047798967	Алтайские zakroma golen' drumstcks chicken 1kg	3607704	мясо(фарш, части говядины, свинины, курицы, и тд) фиксированные вес	3778291	алтайские ZAKROMA
3778295	4607047798943	Алтайские zakroma grud-s-kozhy pieces chicken 1kg	3607704	мясо(фарш, части говядины, свинины, курицы, и тд) фиксированные вес	3778291	алтайские ZAKROMA
3778296	4607047798936	Алтайские zakroma krylo wings chicken 1kg	3607704	мясо(фарш, части говядины, свинины, курицы, и тд) фиксированные вес	3778291	алтайские ZAKROMA
3778297	4607047798066	Алтайские zakroma nabr-supovy pieces chicken 1kg	3607704	мясо(фарш, части говядины, свинины, курицы, и тд) фиксированные вес	3778291	алтайские ZAKROMA
3778298	4607047798011	Алтайские zakroma okorchyk legs chicken 1kg	3607704	мясо(фарш, части говядины, свинины, курицы, и тд) фиксированные вес	3778291	алтайские ZAKROMA
2846284	4607135632722	Алтайские вареники с картофелем и куриными потрошками 800г	1	Неклассифицированные/default	0	
2846285	4607135632692	Алтайские вареники с картофелем и курочкой 800г	1	Неклассифицированные/default	0	
2846286	4607135632753	Алтайские вареники с картофелем и шкварками 800г	1	Неклассифицированные/default	0	
3778300	4650070500151	Алтайские просторы spr y 0.5kg f wp 72.5%	1240988	Продукты питания (folder)/Масложировая продукция (folder)/Масложировая продукция	3778299	алтайские просторы (ELUNINSKIY PISH. KOMB./BARNAUL)
3546438	4607057210992	Алтайский (kholod/zar.) chchl y br&sm tw.s. p s 0.1kg	142810	Продукты питания (folder)/Молочные продукты (folder)/Сыр	3778301	алтайский (KHOLOD/ZARINSK ALTAY)
3778303	4602055700032	Алтайский (sib.k.mol.pr./ir) but 0.2kg f wp 72.5%	1240988	Продукты питания (folder)/Масложировая продукция (folder)/Масложировая продукция	3778302	алтайский (SIBIRSKAYA компания MOL.PRODUK./IRKUTSK)
3778305	4607053000030	Алтайский (sib.maslo/novos) but 0.18kg f wp 72.5%	1240988	Продукты питания (folder)/Масложировая продукция (folder)/Масложировая продукция	3778304	алтайский (SIBIRSKOE MASLO/NOVOSIB.OBL.)
3778307	4605738006469	Алтайский buket iv-ch Rose-Bay pk 0.05kg lft	21794	Продукты питания (folder)/Чай и кофе/Чай	3778306	АЛТАЙСКИЙ БУКЕТ
3778308	4605738006483	Алтайский buket iv-ch Rose-Bay pk 0.05kg lft #2	21794	Продукты питания (folder)/Чай и кофе/Чай	3778306	АЛТАЙСКИЙ БУКЕТ
3778310	4610017830154	Алтайский karavay Wheat 1 srt. s 2kg	3610168	Продукты питания (folder)/Мука и смеси для выпечки	3778309	алтайский KARAVAY (BLAGOVETSHENSKIY MEL'KOMBINAT/ALTAYS.KR
3778312	4607069768269	Алтайский kolos нефильтрованное 1l nf l z x	22186	Продукты питания (folder)/Алкогольные напитки/Пиво	3778311	алтайский KOLOS (BOCHKARYOVSKIY PIVZD/S.BOCHKARI ALTA)
3778313	4607069767033	Алтайский kolos светлое 1l nf l x	22186	Продукты питания (folder)/Алкогольные напитки/Пиво	3778311	алтайский KOLOS (BOCHKARYOVSKIY PIVZD/S.BOCHKARI ALTA)
3778314	4607069767040	Алтайский kolos светлое 1l nf l x #2	22186	Продукты питания (folder)/Алкогольные напитки/Пиво	3778311	алтайский KOLOS (BOCHKARYOVSKIY PIVZD/S.BOCHKARI ALTA)
3778315	4607069767422	Алтайский kolos светлое 1l nf l x #3	22186	Продукты питания (folder)/Алкогольные напитки/Пиво	3778311	алтайский KOLOS (BOCHKARYOVSKIY PIVZD/S.BOCHKARI ALTA)
3778317	4620016771037	Алтайский konditer kofeyniy aromat coffee sb Dark gl/coat 0.25kg fw p	21865	Продукты питания (folder)/Кондитерские изделия (folder)/Печенье	3778316	алтайский KONDITER (VESTER/BARNAUL)
3778318	4670010320960	Алтайский konditer kofeyniy aromat coffee sb Dark gl/coat 0.25kg fw p #2	21865	Продукты питания (folder)/Кондитерские изделия (folder)/Печенье	3778316	алтайский KONDITER (VESTER/BARNAUL)
3778319	4620016770900	Алтайский konditer korzin.s orekh. nut bwf Dark gl/coat 0.25kg fw p	21865	Продукты питания (folder)/Кондитерские изделия (folder)/Печенье	3778316	алтайский KONDITER (VESTER/BARNAUL)
3778320	4620016771143	Алтайский konditer korzin.s orekh. nut bwf Dark gl/coat 0.25kg fw p #2	21865	Продукты питания (folder)/Кондитерские изделия (folder)/Печенье	3778316	алтайский KONDITER (VESTER/BARNAUL)
3778322	4650077730230	Алтайский lyon flax k 0.3kg	3610168	Продукты питания (folder)/Мука и смеси для выпечки	3778321	алтайский LYON
3778323	4650077730223	Алтайский lyon vysshiy sort linseed nr p bo 0.5l	24963	Продукты питания (folder)/Масложировая продукция (folder)/Масло растительное	3778321	алтайский LYON
3778324	4605738006476	Алтайский бук.чай Иван-ч.трав.ферм.с обл.50г	3606697	Чаи травяные	3778306	АЛТАЙСКИЙ БУКЕТ
3778325	4605738006490	Алтайский бук.чай Иван-ч.трав.ферм.с чабр.50г	3606697	Чаи травяные	3778306	АЛТАЙСКИЙ БУКЕТ
3778326	4605738006506	Алтайский бук.чай Иван-ч.трав.ферм.со смор.50г	3606697	Чаи травяные	3778306	АЛТАЙСКИЙ БУКЕТ
2846287	4605738002928	Алтайский букет бальзам друг сердечный для сердца и сосудов 200мл	1	Неклассифицированные/default	0	
2846288	4605738001778	Алтайский букет бальзам очищающий 250мл	1	Неклассифицированные/default	0	
3778328	4607072770501	Алтайский мед горный 240г	24286	Продукты питания (folder)/Мед	0	
2846289	4620003862076	Алтайский мед натур с преобладанием донника ст/б 500г (Алтай-медовый край) :10	1	Неклассифицированные/default	0	
2846290	4620003862090	Алтайский мед натур с преобладанием дягиля ст/б 500г (Алтай-медовый край) :10	1	Неклассифицированные/default	0	
2846291	4620003861437	Алтайский мед полевые просторы нат ст/б 500г (Алтай-медовый край) :5	1	Неклассифицированные/default	0	
2846292	4620003862113	Алтайский мед таежный дар натур ст/б 500г (Алтай-медовый край) :10	1	Неклассифицированные/default	0	
2846293	4680014342028	Алтайский сыр 300г 50%(алтайские сыровары)	1	Неклассифицированные/default	0	
2846294	4602959000313	Алтайский эликсир 100мл №1	1	Неклассифицированные/default	0	
2846295	4607004430077	Алтайский эликсир 250мл	1	Неклассифицированные/default	0	
1750807	4602957000049	Алтайский эликсир 250мл х1	241824	Лекарственные средства (folder)/Аптека	0	
309203	4602959000030	Алтайский эликсир 250мл №1, мелиген фармацевтическое предприятие ЗАО	439957	Лекарственные средства (folder)/Иммуномодуляторы и адаптогены	0	
3778331	4620016330524	Алтайское (almaz/astrakhan) крестьянское but 0.18kg f wp 72.5%	1240988	Продукты питания (folder)/Масложировая продукция (folder)/Масложировая продукция	3778330	алтайское (ALMAZ/ASTRAKHAN)
3778332	4640013690308	Алтайское (almaz/astrakhan) крестьянское but 0.18kg f wp 72.5% #2	1240988	Продукты питания (folder)/Масложировая продукция (folder)/Масложировая продукция	3778330	алтайское (ALMAZ/ASTRAKHAN)
3403040	4640002770707	Алтайское (dary maslenitsy/lif) sliv.-rastit. spr y 0.18kg f wp 72.5%	1	Неклассифицированные/default	3778333	алтайское (DARY MASLENITSY/LIFANOV IP/CHELYABINSK)
3404761	4607075070028	Алтайское (stol.mol./alt) крестьянское but 0.18kg f wp 70%	81649	Продукты питания (folder)/Масложировая продукция (folder)/Масло сливочное	3778334	алтайское (STOLITSA MOLOKA/ALTAY)
3778336	4697165965440	Алтайское maslo solyonoe but 0.17kg f wp 72.5%	1240988	Продукты питания (folder)/Масложировая продукция (folder)/Масложировая продукция	3778335	алтайское MASLO (алтайское MASLO/BIYSK)
3469494	4600685200458	Алтайское yantarnoe классическое алтайское 1.5l p bo l x	22186	Продукты питания (folder)/Алкогольные напитки/Пиво	3778337	YANTARNOE (BARNAULSKIY PIV.Z-D)
3778338	4600685300776	Алтайское yantarnoe классическое алтайское 1l nf l x	22186	Продукты питания (folder)/Алкогольные напитки/Пиво	3778337	YANTARNOE (BARNAULSKIY PIV.Z-D)
3778339	4600685400032	Алтайское yantarnoe классическое алтайское 1l nf l x #2	22186	Продукты питания (folder)/Алкогольные напитки/Пиво	3778337	YANTARNOE (BARNAULSKIY PIV.Z-D)
