ID	UPCEAN	Name	CategoryID	CategoryName	BrandID	BrandName
379515	5000101991646	Cussons imperial leather Shower Gel Ocean ?1.29 24x 250ml (4x6)	401	Гигиена (folder)/Гель для душа	215284	Cussons Imperial Leather
1910182	5000101991721	Cussons imperial leather Shower Gel Ocean Fresh 300ml+66% 6x 500ml	1	Неклассифицированные/default	215284	Cussons Imperial Leather
1910183	5000101991561	Cussons imperial leather Shower Gel Ocean Fresh 6x 300ml	1	Неклассифицированные/default	215284	Cussons Imperial Leather
2606079	5000101120251	Cussons imperial leather Shower Gel refreshing 250ml (inner)	401	Гигиена (folder)/Гель для душа	215284	Cussons Imperial Leather
608405	5000101833670	Cussons imperial leather Shower Gel refreshing pm1.00 250ml	401	Гигиена (folder)/Гель для душа	215284	Cussons Imperial Leather
2343936	5000101131226	Cussons imperial leather Shower Gel refreshing pmp ?1 250ml	1	Неклассифицированные/default	215284	Cussons Imperial Leather
2343937	5000101131240	Cussons imperial leather Shower Gel refreshing pmp ?1 250ml #2	1	Неклассифицированные/default	215284	Cussons Imperial Leather
1021873	5000101838859	Cussons imperial leather Shower Gel relaxing pm1.00 250ml	401	Гигиена (folder)/Гель для душа	215284	Cussons Imperial Leather
2606080	5000101131325	Cussons imperial leather Shower Gel revitalising 250m	401	Гигиена (folder)/Гель для душа	215284	Cussons Imperial Leather
1021826	5000101986703	Cussons imperial leather Shower Gel sensuous silk 250ml	401	Гигиена (folder)/Гель для душа	215284	Cussons Imperial Leather
1910200	5000101986765	Cussons imperial leather Shower Gel sensuous silk 250ml #2	1	Неклассифицированные/default	215284	Cussons Imperial Leather
379526	5000101987663	Cussons imperial leather Shower Gel skinkind restore 250ml	401	Гигиена (folder)/Гель для душа	215284	Cussons Imperial Leather
1910201	5000101992186	Cussons imperial leather Shower Gel Soft Touch 250ml	1	Неклассифицированные/default	215284	Cussons Imperial Leather
1910184	5000101992285	Cussons imperial leather Shower Gel Soft Touch 300ml+66% Extra free 6x 500ml	1	Неклассифицированные/default	215284	Cussons Imperial Leather
1910185	5000101991974	Cussons imperial leather Shower Gel Soft Touch 6x 300ml	1	Неклассифицированные/default	215284	Cussons Imperial Leather
379529	5000101992100	Cussons imperial leather Shower Gel Soft Touch ?1.29 24x 250ml (4x6)	401	Гигиена (folder)/Гель для душа	215284	Cussons Imperial Leather
2606078	5000101120336	Cussons imperial leather Shower Gel soothing 250ml (inner)	401	Гигиена (folder)/Гель для душа	215284	Cussons Imperial Leather
2343938	5000101130915	Cussons imperial leather Shower Gel soothing pmp ?1 250ml	1	Неклассифицированные/default	215284	Cussons Imperial Leather
2343939	5000101130939	Cussons imperial leather Shower Gel soothing pmp ?1 250ml #2	1	Неклассифицированные/default	215284	Cussons Imperial Leather
1021874	5000101986611	Cussons imperial leather Shower Gel sumptuous Satin 250ml	401	Гигиена (folder)/Гель для душа	215284	Cussons Imperial Leather
1910202	5000101986680	Cussons imperial leather Shower Gel sumptuous Satin 250ml #2	1	Неклассифицированные/default	215284	Cussons Imperial Leather
1021869	5000101949395	Cussons imperial leather Shower Gel tahitian retreat 250ml	401	Гигиена (folder)/Гель для душа	215284	Cussons Imperial Leather
192371	5000101898884	Cussons imperial leather Shower men 100%ef 500ml	330591	Продукты питания (folder)/Продукты питания	215284	Cussons Imperial Leather
379522	5000101988462	Cussons imperial leather Shower men enrg 100% 500ml	336078	Гигиена (folder)/Personal Hygiene	215284	Cussons Imperial Leather
2605910	5000101131066	Cussons imperial leather Shower nourish pma?1 250ml	336078	Гигиена (folder)/Personal Hygiene	215284	Cussons Imperial Leather
2605911	5000101131080	Cussons imperial leather Shower nourish pma?1 250ml #2	336078	Гигиена (folder)/Personal Hygiene	215284	Cussons Imperial Leather
2605912	5000101168826	Cussons imperial leather Shower revitalise pma?1 250ml	336078	Гигиена (folder)/Personal Hygiene	215284	Cussons Imperial Leather
2605913	5000101168895	Cussons imperial leather Shower revitalise pma?1 250ml #2	336078	Гигиена (folder)/Personal Hygiene	215284	Cussons Imperial Leather
192372	5000101817755	Cussons imperial leather Shower softly 100%ef 500ml	330591	Продукты питания (folder)/Продукты питания	215284	Cussons Imperial Leather
379524	5000101987588	Cussons imperial leather skinkind hydrate Body wash 250ml	336078	Гигиена (folder)/Personal Hygiene	215284	Cussons Imperial Leather
379525	5000101988547	Cussons imperial leather skinkind refreshing Body wash 250ml	336078	Гигиена (folder)/Personal Hygiene	215284	Cussons Imperial Leather
1910204	5000101082153	Cussons imperial leather soap 3x 100g active (?1)	1	Неклассифицированные/default	215284	Cussons Imperial Leather
1910205	5000101082405	Cussons imperial leather soap 3x 100g Gentle (?1)	1	Неклассифицированные/default	215284	Cussons Imperial Leather
1910206	5000101132452	Cussons imperial leather soap 3x 100g moisturising (Milk&Honey)	1	Неклассифицированные/default	215284	Cussons Imperial Leather
1910207	5000101082993	Cussons imperial leather soap 3x 100g orig (?1)	1	Неклассифицированные/default	215284	Cussons Imperial Leather
1910208	5000101132537	Cussons imperial leather soap 3x 100g revitalising (Grapefruit)	1	Неклассифицированные/default	215284	Cussons Imperial Leather
1021875	5000101804281	Cussons imperial leather soap active 4for3 4x 125g	1	Неклассифицированные/default	215284	Cussons Imperial Leather
1910209	5000101082054	Cussons imperial leather soap active for men 6for4 72x 100g (12x6)	1	Неклассифицированные/default	215284	Cussons Imperial Leather
1021877	5000101961700	Cussons imperial leather soap active pm1.00 4x 125g	1	Неклассифицированные/default	215284	Cussons Imperial Leather
1021876	5000101082139	Cussons imperial leather soap for men active 3pk ?1 pmp 100g	1	Неклассифицированные/default	215284	Cussons Imperial Leather
1910210	5000101095641	Cussons imperial leather soap for men active 3pk ?1 pmp 100g #2	1	Неклассифицированные/default	215284	Cussons Imperial Leather
379527	5000101082481	Cussons imperial leather soap Gentle 3pk ?1 3pk	146	Гигиена (folder)/Мыло	215284	Cussons Imperial Leather
1021879	5000101095795	Cussons imperial leather soap Gentle Care 3pack ?1 pmp 100g	1	Неклассифицированные/default	215284	Cussons Imperial Leather
1910211	5000101095726	Cussons imperial leather soap Gentle Care 3pack ?1 pmp 100g #2	1	Неклассифицированные/default	215284	Cussons Imperial Leather
1021880	5000101961960	Cussons imperial leather soap Gentle Care pm1.00 4x 125g	1	Неклассифицированные/default	215284	Cussons Imperial Leather
608409	5000101033575	Cussons imperial leather soap orig 4spm	146	Гигиена (folder)/Мыло	215284	Cussons Imperial Leather
2157996	5000101118548	Cussons imperial leather soap Original 3 pk	1	Неклассифицированные/default	215284	Cussons Imperial Leather
379528	5000101082979	Cussons imperial leather soap Original 3pack ?1 pmp 100g	146	Гигиена (folder)/Мыло	215284	Cussons Imperial Leather
1910212	5000101095566	Cussons imperial leather soap Original 3pack ?1 pmp 100g #2	1	Неклассифицированные/default	215284	Cussons Imperial Leather
1910213	5000101082726	Cussons imperial leather soap Original 6for4 72x 100g (12x6)	1	Неклассифицированные/default	215284	Cussons Imperial Leather
379517	5000101282300	Cussons imperial leather soap Original Bath 4pack 125g	336078	Гигиена (folder)/Personal Hygiene	215284	Cussons Imperial Leather
608410	5000101962073	Cussons imperial leather soap Original Bath pm1.00 4x 125g	146	Гигиена (folder)/Мыло	215284	Cussons Imperial Leather
1021881	5000101363740	Cussons imperial leather soap Original Family 200g	1	Неклассифицированные/default	215284	Cussons Imperial Leather
1021882	5000101282645	Cussons imperial leather soap Original Family 2pack 200g	1	Неклассифицированные/default	215284	Cussons Imperial Leather
379497	5000101282218	Cussons imperial leather soap Original twin pack 125g	146	Гигиена (folder)/Мыло	215284	Cussons Imperial Leather
1910214	5000101362927	Cussons imperial leather soap Original twin pack 125g #2	1	Неклассифицированные/default	215284	Cussons Imperial Leather
379530	5000101833007	Cussons imperial leather softly moisture Bath 500ml	336078	Гигиена (folder)/Personal Hygiene	215284	Cussons Imperial Leather
379531	5000101989759	Cussons imperial leather softly Shower Cream 750ml	336078	Гигиена (folder)/Personal Hygiene	215284	Cussons Imperial Leather
379532	5000101817670	Cussons imperial leather softly softly Shower Gel 500ml	401	Гигиена (folder)/Гель для душа	215284	Cussons Imperial Leather
379533	5000101832383	Cussons imperial leather stressless Bath calming 500ml	336078	Гигиена (folder)/Personal Hygiene	215284	Cussons Imperial Leather
1502818	5000101016035	Cussons imperial leather talc 150g	1	Неклассифицированные/default	215284	Cussons Imperial Leather
379536	5000101019432	Cussons imperial leather talc 300g Original	336078	Гигиена (folder)/Personal Hygiene	215284	Cussons Imperial Leather
608412	5000101805240	Cussons imperial leather talc Original 150g	1	Неклассифицированные/default	215284	Cussons Imperial Leather
1910215	5000101018138	Cussons imperial leather talc Original 300g #2	1	Неклассифицированные/default	215284	Cussons Imperial Leather
608413	5000101805653	Cussons imperial leather talc pink 150g	1	Неклассифицированные/default	215284	Cussons Imperial Leather
379535	5000101018145	Cussons imperial leather talcum Powder Original 6x 300g	336078	Гигиена (folder)/Personal Hygiene	215284	Cussons Imperial Leather
379537	5000101058363	Cussons imperial leather tempting Bath 500ml	336078	Гигиена (folder)/Personal Hygiene	215284	Cussons Imperial Leather
379538	5000101057977	Cussons imperial leather tempting Shower Gel 250ml	401	Гигиена (folder)/Гель для душа	215284	Cussons Imperial Leather
379539	5000101029714	Cussons imperial leather wake up foamburst 200ml	336078	Гигиена (folder)/Personal Hygiene	215284	Cussons Imperial Leather
1888713	5000101035432	Cussons Mild Cream soap 4x 100g	1	Неклассифицированные/default	265815	Cussons
959712	5000101283017	Cussons Mild Cream soap 4x 125g	1	Неклассифицированные/default	0	
2309805	5000101095894	Cussons Mild Cream soap 4x 90g	1	Неклассифицированные/default	265815	Cussons
1888714	5000101095870	Cussons Mild Cream soap 9x4 x 90g	1	Неклассифицированные/default	265815	Cussons
357877	5000101035401	Cussons Mild Cream soap Original 4x 100g	1	Неклассифицированные/default	265815	Cussons
1063313	5000101076657	Cussons morning Fresh Conditioner Mandarin	1	Неклассифицированные/default	265815	Cussons
2635885	5000101163418	Cussons morning Fresh fabric Conditioner jasmine 1 litre	163	Хозяйственные товары (folder)/Бытовая химия (folder)/Средство для стирки	265815	Cussons
1063312	5000101076572	Cussons morning Fresh fabric Conditioner jasmine&Lime 6x1	1	Неклассифицированные/default	265815	Cussons
2635882	5000101163500	Cussons morning Fresh fabric Conditioner Mandarin&Peach	163	Хозяйственные товары (folder)/Бытовая химия (folder)/Средство для стирки	265815	Cussons
195009	5000101967412	Cussons morning Fresh liq Original pm85p 500ml	330591	Продукты питания (folder)/Продукты питания	265815	Cussons
195010	5000101841385	Cussons morning Fresh liq oxygen pm85p 500ml	330591	Продукты питания (folder)/Продукты питания	265815	Cussons
1063314	5000101732928	Cussons morning Fresh Original dishwashing Liquid 750ml	1	Неклассифицированные/default	265815	Cussons
627574	5000101066887	Cussons morning Fresh Powder mand&Lemon blos 6x 750g	1	Неклассифицированные/default	265815	Cussons
627573	5000101066962	Cussons morning Fresh Powder Water Lily&jasm 6x 750g	1	Неклассифицированные/default	265815	Cussons
1063315	5000101740411	Cussons morning Fresh wash up Lemon 675ml	1	Неклассифицированные/default	265815	Cussons
1923201	5000101989490	Cussons morning Fresh wash up Lemon 675ml #2	1	Неклассифицированные/default	265815	Cussons
394381	5000101989346	Cussons morning Fresh wash up Liquid Lemon 450ml	336078	Гигиена (folder)/Personal Hygiene	265815	Cussons
1063316	5000101988790	Cussons morning Fresh wash up Liquid origin 675ml	1	Неклассифицированные/default	265815	Cussons
1923202	5000101988776	Cussons morning Fresh wash up Liquid origin 675ml #2	1	Неклассифицированные/default	265815	Cussons
394382	5000101988622	Cussons morning Fresh wash up Liquid Original 450ml	336078	Гигиена (folder)/Personal Hygiene	265815	Cussons
389332	5000101989186	Cussons morning Fresh wash up meadow Fresh 450ml	336078	Гигиена (folder)/Personal Hygiene	265815	Cussons
1063317	5000101989261	Cussons morning Fresh wash up meadow Fresh 450ml+50%	1	Неклассифицированные/default	265815	Cussons
1923203	5000101989247	Cussons morning Fresh wash up meadow Fresh 675ml	1	Неклассифицированные/default	265815	Cussons
4280935	5000101832208	Cussons morning Fresh washing up Liquid 500ml	1	Неклассифицированные/default	0	
1544345	5000101989599	Cussons morning Fresh washup liq Original pm89p 450ml	1	Неклассифицированные/default	265815	Cussons
1919168	5000101989421	Cussons morning Fresh wul lemnfrsh 450ml+50% 16x 675ml	1	Неклассифицированные/default	265815	Cussons
2626227	5000101989322	Cussons morning Fresh wul Lemon Fresh 450ml	25023	Хозяйственные товары (folder)/Бытовая химия (folder)/Бытовая химия	265815	Cussons
2626228	5000101989162	Cussons morning Fresh wul meadow Fresh 450ml	25023	Хозяйственные товары (folder)/Бытовая химия (folder)/Бытовая химия	265815	Cussons
627572	5000101988950	Cussons morning Fresh wul orig Fresh 16x 675ml	1	Неклассифицированные/default	265815	Cussons
2626229	5000101988691	Cussons morning Fresh wul orig Fresh 450ml	25023	Хозяйственные товары (folder)/Бытовая химия (folder)/Бытовая химия	265815	Cussons
2912	5900998021252	Cussons morning Fresh спрей для окон 500	25023	Хозяйственные товары (folder)/Бытовая химия (folder)/Бытовая химия	0	
399873	5000101023774	Cussons Original source almond and Coconut Bath Milk 500ml	1	Неклассифицированные/default	265815	Cussons
399874	5000101045479	Cussons Original source antibacterial hand wash 250ml	366	Гигиена (folder)/Мыло жидкое	265815	Cussons
399875	5000101056369	Cussons Original source cassis&cranberry Shower pouch 250ml	1	Неклассифицированные/default	265815	Cussons
399876	5000101023859	Cussons Original source Lavender and tea tree Bath Foam 500ml	1	Неклассифицированные/default	265815	Cussons
399877	5000101030895	Cussons Original source Lime and Eucalyptus Shower Gel 250ml	401	Гигиена (folder)/Гель для душа	265815	Cussons
399878	5000101844997	Cussons Original source Lime Shower Gel 250ml	401	Гигиена (folder)/Гель для душа	265815	Cussons
399879	5000101839658	Cussons Original source limited edition Shower Gel 250ml	401	Гигиена (folder)/Гель для душа	265815	Cussons
399881	5000101045639	Cussons Original source moisturising hand wash	366	Гигиена (folder)/Мыло жидкое	265815	Cussons
399882	5000101030727	Cussons Original source Orange and ginger Shower Gel 250ml	401	Гигиена (folder)/Гель для душа	265815	Cussons
399883	5000101030642	Cussons Original source sea kelp and Rock salt Shower Gel 250ml	401	Гигиена (folder)/Гель для душа	265815	Cussons
399884	5000101037801	Cussons Original source shea Butter 250ml	1	Неклассифицированные/default	265815	Cussons
1083217	5000101076466	Cussons Original source Shower Gel Black pepper+salt 250ml	1	Неклассифицированные/default	265815	Cussons
1083218	5000101080692	Cussons Original source Shower Gel chocolate 250ml	401	Гигиена (folder)/Гель для душа	265815	Cussons
1083219	5000101845031	Cussons Original source Shower Gel Lavender 250ml	1	Неклассифицированные/default	265815	Cussons
1083210	5000101845116	Cussons Original source Shower Gel Lemon+tt 250ml	401	Гигиена (folder)/Гель для душа	265815	Cussons
399885	5000101045714	Cussons Original source Shower Gel men Black mint 250ml	401	Гигиена (folder)/Гель для душа	265815	Cussons
1928073	5000101076428	Cussons Original source Shower Gel men blk peppe 250ml	1	Неклассифицированные/default	265815	Cussons
1083220	5000101779886	Cussons Original source Shower Gel mint&tea tree 250ml	1	Неклассифицированные/default	265815	Cussons
399880	5000101845208	Cussons Original source Shower Gel mint+tt 250ml	401	Гигиена (folder)/Гель для душа	265815	Cussons
1928151	5000101077005	Cussons Original source Shower rasp&van Milk 6x 250ml	1	Неклассифицированные/default	265815	Cussons
399886	5000101028007	Cussons Original source tea tree and mint pouch 500ml	1	Неклассифицированные/default	265815	Cussons
399887	5000101044267	Cussons Original source White pear 250ml	1	Неклассифицированные/default	265815	Cussons
1091240	5000101095467	Cussons pearl bar soap 9 x (4x 90g)	146	Гигиена (folder)/Мыло	3640141	CUSSONS (PZ CUSSONS)
959713	5000101034121	Cussons pearl soap 90g White 4's	1	Неклассифицированные/default	265815	Cussons
1091239	5000101646362	Cussons pearl soap pink 4for3 4x 125g	1	Неклассифицированные/default	0	
1930136	5000101095481	Cussons pearl soap White 4 pk 90g	1	Неклассифицированные/default	0	
220425	5000101646287	Cussons pearl soap White 4for3 4x 125g	146	Гигиена (folder)/Мыло	0	
959714	5000101993169	Cussons Pure Bath moisturising 18x 500ml (3x6)	1	Неклассифицированные/default	265815	Cussons
2561534	5000101993145	Cussons Pure Bath moisturising 500ml	336078	Гигиена (folder)/Personal Hygiene	265815	Cussons
959715	5000101993084	Cussons Pure Bath muscle therapy 18x 500ml (3x6)	1	Неклассифицированные/default	265815	Cussons
2561535	5000101117893	Cussons Pure burst refresh Shower 500ml	336078	Гигиена (folder)/Personal Hygiene	265815	Cussons
1888716	5000101117824	Cussons Pure burst refresh Shower pmp?1 18x1 (3x6)	1	Неклассифицированные/default	265815	Cussons
1888722	5000101118036	Cussons Pure burst Shower Super zingy 500ml 3 x (6x 500ml)	1	Неклассифицированные/default	265815	Cussons
1888715	5000101117749	Cussons Pure burst Shower wld Fruit pmp?1 18x1 (3x6)	1	Неклассифицированные/default	265815	Cussons
1888723	5000101117992	Cussons Pure burst Shower zesty Lemon 500ml 3 x (6x 500ml)	1	Неклассифицированные/default	265815	Cussons
1888721	5000101117589	Cussons Pure creamy Shower caring 500ml 3 x (6x 500ml)	1	Неклассифицированные/default	265815	Cussons
1888717	5000101117664	Cussons Pure creamy Shower hydrate pmp?1 18x1 (3x6)	1	Неклассифицированные/default	265815	Cussons
959716	5000101993497	Cussons Pure hand wash antibacterial 18x 500ml (3x6)	1	Неклассифицированные/default	265815	Cussons
1888718	5000101993473	Cussons Pure hand wash antibacterial 500ml	1	Неклассифицированные/default	265815	Cussons
2663398	5000101144479	Cussons Pure hand wash Fruit salad 500ml	366	Гигиена (folder)/Мыло жидкое	0	
2188765	5000101144394	Cussons Pure hand wash jellybeans 500ml	1	Неклассифицированные/default	0	
959717	5000101993244	Cussons Pure hand wash moisture 18x 500ml (3x6)	1	Неклассифицированные/default	265815	Cussons
1888719	5000101993220	Cussons Pure hand wash moisturising 500ml	1	Неклассифицированные/default	265815	Cussons
959718	5000101091773	Cussons Pure hand wash soothing 500ml	1	Неклассифицированные/default	265815	Cussons
1888720	5000101091759	Cussons Pure hand wash soothing 500ml #2	1	Неклассифицированные/default	265815	Cussons
959719	5000101091698	Cussons Pure Shower Gel 500ml mens energise	401	Гигиена (folder)/Гель для душа	265815	Cussons
1888724	5000101117565	Cussons Pure Shower Gel caring 500ml	1	Неклассифицированные/default	265815	Cussons
1888725	5000101091674	Cussons Pure Shower Gel energising 500ml	1	Неклассифицированные/default	265815	Cussons
1888726	5000101117640	Cussons Pure Shower Gel hydrating 500ml	1	Неклассифицированные/default	265815	Cussons
1888727	5000101964121	Cussons Pure Shower Gel moisturise 500ml #2	1	Неклассифицированные/default	265815	Cussons
357879	5000101964008	Cussons Pure Shower Gel refreshing 500ml	337649	Уход за детьми (folder)/Уход за детьми	265815	Cussons
1888728	5000101964046	Cussons Pure Shower Gel refreshing 500ml #2	1	Неклассифицированные/default	265815	Cussons
1888729	5000101963902	Cussons Pure Shower Gel soothing 500ml	1	Неклассифицированные/default	265815	Cussons
357878	5000101964183	Cussons Pure Shower moisturising 18x 500ml (3x6)	337649	Уход за детьми (folder)/Уход за детьми	265815	Cussons
357880	5000101963957	Cussons Pure Shower soothing 18x 500ml (3x6)	337649	Уход за детьми (folder)/Уход за детьми	265815	Cussons
2070309	8998103001517	Cussons roll on 35ml active	1	Неклассифицированные/default	0	
2070310	8888103005793	Cussons roll on 35ml Cool Blue	1	Неклассифицированные/default	265815	Cussons
2070311	8888103005779	Cussons roll on 35ml Elegance	1	Неклассифицированные/default	265815	Cussons
2070312	8998103001524	Cussons roll on 35ml enriched	1	Неклассифицированные/default	0	
1430818	8998103004075	Cussons sweet seventeen Body talc rom	272015	Косметика (folder)/Пудра	0	
1430819	8998103003603	Cussons sweet seventeen cologne Romantic	4835	Парфюмерия (folder)/Одеколон	0	
1430820	8998103003573	Cussons sweet seventeen cologne trql	4835	Парфюмерия (folder)/Одеколон	0	
4280936	080047441868	Cust bs latex enamel 44-28805 1g	1	Неклассифицированные/default	0	
1131381	029069020859	Cust park only hd pdmd hy-ko 700	1714427	Строительные и отделочные материалы (folder)/Таблички и вывески	1714426	Hy-Ko
4280937	092928000255	Cust promo coolie 1ct	1	Неклассифицированные/default	0	
4280938	099999420821	Cust svc&flr supv schedule 100ct	1	Неклассифицированные/default	0	
4280939	092928004970	Cust zipper jacket 1ct	1	Неклассифицированные/default	0	
4280940	09662575	Cust.appreciation card 1/50 * 50ct	1	Неклассифицированные/default	0	
3044452	783963001450	Custard	330591	Продукты питания (folder)/Продукты питания	0	
3044453	854217005002	Custard #2	330591	Продукты питания (folder)/Продукты питания	0	
1430821	8961014184181	Custard banana 300g	1	Неклассифицированные/default	0	
357881	90010545	Custard bread	1	Неклассифицированные/default	0	
2309806	4809012474078	Custard cake	1	Неклассифицированные/default	0	
2309807	9556352202865	Custard cake 2pcs x 18g	1	Неклассифицированные/default	0	
4280941	076440815917	Custard cblt 4pcs 1ct	1	Неклассифицированные/default	0	
2791390	833302007336	Custard Chardonnay north Coast metal 19.5 l	22133	Продукты питания (folder)/Алкогольные напитки/Вино (folder)/Вино	0	
2070313	833302005356	Custard Chardonnay sonoma Valley 750ml	22133	Продукты питания (folder)/Алкогольные напитки/Вино (folder)/Вино	0	
3044454	684903001175	Custard chocolate cake	330591	Продукты питания (folder)/Продукты питания	0	
3044455	728119432009	Custard Cream filled panettone	330591	Продукты питания (folder)/Продукты питания	0	
