ID	UPCEAN	Name	CategoryID	CategoryName	BrandID	BrandName
2426961	460705601559	Вино столовое Изабелла красн полусладк алк 10-12% с:30-40г/дм3 1.000	22133	Продукты питания (folder)/Алкогольные напитки/Вино (folder)/Вино	0	
2426963	460713613308	Вино столовое Изабелла красн/полусладк 10-12% 3.000	22133	Продукты питания (folder)/Алкогольные напитки/Вино (folder)/Вино	0	
1818405	4607086672389	Вино столовое Изабелла красное п/с 10-12% 1л легенда кубани	688533	Продукты питания (folder)/Алкогольные напитки/Вино (folder)/Вина России и ближнего зарубежья	0	
2426964	460713613155	Вино столовое Изабелла полусладк красн 10-12% 1.000	22133	Продукты питания (folder)/Алкогольные напитки/Вино (folder)/Вино	0	
2720823	4699301725260	Вино столовое Изабелла полусладк красн 1л 11% бахус	22133	Продукты питания (folder)/Алкогольные напитки/Вино (folder)/Вино	0	
3291340	4840635003283	Вино столовое Изабелла славный винодел 700мл	22133	Продукты питания (folder)/Алкогольные напитки/Вино (folder)/Вино	0	
43794	8002083747751	Вино столовое ка де монте б/полусладк 11% 750мл	22470	Продукты питания (folder)/Алкогольные напитки/Вино (folder)/Вина Италии	43793	Ка Де Монте
2426965	800208374770	Вино столовое ка де монте красн сух 11% 750мл	22133	Продукты питания (folder)/Алкогольные напитки/Вино (folder)/Вино	0	
43795	8002083747850	Вино столовое ка де монте красн/полусладк 11% 750мл	22470	Продукты питания (folder)/Алкогольные напитки/Вино (folder)/Вина Италии	43793	Ка Де Монте
2720464	4600632056220	Вино столовое каберне барокко красное полусладк 12% 700мл	22133	Продукты питания (folder)/Алкогольные напитки/Вино (folder)/Вино	0	
2720487	4620015670461	Вино столовое каберне дом солнца красн сух 11%алк. 700мл	22133	Продукты питания (folder)/Алкогольные напитки/Вино (folder)/Вино	0	
2720750	8003030887780	Вино столовое каберне крас сух 750мл 12.5% Италия	22133	Продукты питания (folder)/Алкогольные напитки/Вино (folder)/Вино	0	
690902	4600446002772	Вино столовое каберне красн полусладк (мвз) 700мл	22133	Продукты питания (folder)/Алкогольные напитки/Вино (folder)/Вино	3790335	КАБЕРНЕ
2426966	460705032247	Вино столовое каберне красн полусладк 10-12% 1.000	22133	Продукты питания (folder)/Алкогольные напитки/Вино (folder)/Вино	0	
2426967	460714075549	Вино столовое каберне красн полусладк 10-12% 1.000 #2	22133	Продукты питания (folder)/Алкогольные напитки/Вино (folder)/Вино	0	
2426968	4607050325723	Вино столовое каберне красн полусладк 10-12% 1.000....	22133	Продукты питания (folder)/Алкогольные напитки/Вино (folder)/Вино	0	
151626	3800012910222	Вино столовое каберне красн полусладк 10-12% 700мл	22133	Продукты питания (folder)/Алкогольные напитки/Вино (folder)/Вино	0	
2720470	4670015950315	Вино столовое каберне красн полусладк 750мл 13% фотисаль	22133	Продукты питания (folder)/Алкогольные напитки/Вино (folder)/Вино	0	
2426969	4607056015550	Вино столовое каберне красн полусладк алк 10-12% 1.000	22133	Продукты питания (folder)/Алкогольные напитки/Вино (folder)/Вино	0	
2426970	4607132733378	Вино столовое каберне красн сух 10-12% 2.000	22133	Продукты питания (folder)/Алкогольные напитки/Вино (folder)/Вино	0	
2720830	460703013972	Вино столовое каберне красн сух 12%алк. 1.0л тэт	22133	Продукты питания (folder)/Алкогольные напитки/Вино (folder)/Вино	0	
1759574	4607136130432	Вино столовое каберне красное п\сл 10-12% 1л т\пак ООО Союз-вино	688533	Продукты питания (folder)/Алкогольные напитки/Вино (folder)/Вина России и ближнего зарубежья	0	
2720831	460112940395	Вино столовое каберне красное полусладк 10-12% 1л	22133	Продукты питания (folder)/Алкогольные напитки/Вино (folder)/Вино	0	
1818408	4670007930165	Вино столовое каберне красное полусладк 10-12% 1л лазурный курорт	688533	Продукты питания (folder)/Алкогольные напитки/Вино (folder)/Вина России и ближнего зарубежья	0	
2720833	4601129402735	Вино столовое каберне красное сух 10-12% 700мл	22133	Продукты питания (folder)/Алкогольные напитки/Вино (folder)/Вино	0	
2720754	4620016482544	Вино столовое каберне крымское крас сух 750мл 11% стражи крыма	22133	Продукты питания (folder)/Алкогольные напитки/Вино (folder)/Вино	0	
2720834	4699301725277	Вино столовое каберне полусладк красн 1л 11%	22133	Продукты питания (folder)/Алкогольные напитки/Вино (folder)/Вино	0	
3291341	4841451000128	Вино столовое каберне полусладк красное 10% 750мл стекло	22133	Продукты питания (folder)/Алкогольные напитки/Вино (folder)/Вино	0	
3291342	3800214141455	Вино столовое каберне полусладк красное 750мл 10-12%	22133	Продукты питания (folder)/Алкогольные напитки/Вино (folder)/Вино	0	
2426972	4607140756598	Вино столовое каберне полусладк/ красн 10-12% 2.000	22133	Продукты питания (folder)/Алкогольные напитки/Вино (folder)/Вино	0	
2720497	4660013283799	Вино столовое кагор 2008 красн полусладк 750мл 10-12%	22133	Продукты питания (folder)/Алкогольные напитки/Вино (folder)/Вино	0	
2426974	4600785001238	Вино столовое кагор православный сл красн 13-15% 700мл	22133	Продукты питания (folder)/Алкогольные напитки/Вино (folder)/Вино	0	
2426975	4600785001795	Вино столовое кагор соборный сл красн 13-15% 700мл	22133	Продукты питания (folder)/Алкогольные напитки/Вино (folder)/Вино	0	
2426977	4600785000118	Вино столовое кагор соборный сл/ красн 11% 0.7 #2	22133	Продукты питания (folder)/Алкогольные напитки/Вино (folder)/Вино	0	
2426976	460078500183	Вино столовое кагор соборный сл/ красн 11% 700мл	22133	Продукты питания (folder)/Алкогольные напитки/Вино (folder)/Вино	0	
151634	4840182001947	Вино столовое кадарка красн полусладк (басвинекс) 10-12% 750мл	22133	Продукты питания (folder)/Алкогольные напитки/Вино (folder)/Вино	0	
151635	4840526003118	Вино столовое кадарка красн полусладк 10-12% 1.0 суворов-вин	22133	Продукты питания (folder)/Алкогольные напитки/Вино (folder)/Вино	0	
1818412	4670007930493	Вино столовое кадарка красн полусладк 10-12% 2л	688533	Продукты питания (folder)/Алкогольные напитки/Вино (folder)/Вина России и ближнего зарубежья	0	
2425771	4660003840230	Вино столовое кадарка красн полусладк 1л 10-12% /винный торговый дом/	22133	Продукты питания (folder)/Алкогольные напитки/Вино (folder)/Вино	0	
2425778	4620015670126	Вино столовое кадарка ливадия красн полусладк 11%алк. 1.0л тэт	22133	Продукты питания (folder)/Алкогольные напитки/Вино (folder)/Вино	0	
2426979	4620015672977	Вино столовое кадарка ливдия красн/полусладк 10-12% 700мл	22133	Продукты питания (folder)/Алкогольные напитки/Вино (folder)/Вино	0	
3291343	3800016680336	Вино столовое кадарка полусладк красное 11% 750мл стекло	22133	Продукты питания (folder)/Алкогольные напитки/Вино (folder)/Вино	0	
690903	8429531004394	Вино столовое капа и эспада красн сух 11% 0.75 (Испания) 750мл	22133	Продукты питания (folder)/Алкогольные напитки/Вино (folder)/Вино	0	
282861	7808726900641	Вино столовое кокоро бел/полусладк 12.5% 750мл стбут	22133	Продукты питания (folder)/Алкогольные напитки/Вино (folder)/Вино	0	
2720758	8421825900184	Вино столовое конде отинано росадо сух розов 750мл 12.5%	22133	Продукты питания (folder)/Алкогольные напитки/Вино (folder)/Вино	0	
1193826	800962081242	Вино столовое кордеро 750мл красн полусладк	22133	Продукты питания (folder)/Алкогольные напитки/Вино (folder)/Вино	0	
3291344	3800024951923	Вино столовое красн п сл каберне 1.5л 9-11% лятен Сад	22133	Продукты питания (folder)/Алкогольные напитки/Вино (folder)/Вино	0	
690905	8437001914234	Вино столовое красн полусладк bodega camporro/бодега кампорросо 750мл	22133	Продукты питания (folder)/Алкогольные напитки/Вино (folder)/Вино	0	
690906	8437000044291	Вино столовое красн полусладк botella de vino (ботелла де вино) (Испания) 750мл	22133	Продукты питания (folder)/Алкогольные напитки/Вино (folder)/Вино	0	
1659772	4607002225828	Вино столовое красн полусладк gusto vino (густо вино) 1л	22133	Продукты питания (folder)/Алкогольные напитки/Вино (folder)/Вино	0	
1660128	4607002224371	Вино столовое красн полусладк gusto vino (густо вино) 3л	22133	Продукты питания (folder)/Алкогольные напитки/Вино (folder)/Вино	0	
1660129	4607002226849	Вино столовое красн полусладк gusto vino 12% (густо вино) 750мл	22133	Продукты питания (folder)/Алкогольные напитки/Вино (folder)/Вино	0	
150261	4600446001898	Вино столовое красн полусладк арбатское 3л	22133	Продукты питания (folder)/Алкогольные напитки/Вино (folder)/Вино	0	
1192724	4605649250623	Вино столовое красн полусладк дар судьбы.Изабелла 0.7л 12 %	22133	Продукты питания (folder)/Алкогольные напитки/Вино (folder)/Вино	0	
1816249	4605649250630	Вино столовое красн полусладк дар судьбы.каберне 0.7л 12 %	22133	Продукты питания (folder)/Алкогольные напитки/Вино (folder)/Вино	0	
43711	4820003750322	Вино столовое красн полусладк древний херсонес инкерман (украина) 750мл	22133	Продукты питания (folder)/Алкогольные напитки/Вино (folder)/Вино	43708	Инкерман
690951	4840403001305	Вино столовое красн полусладк душа монаха (молдова) 2л	22133	Продукты питания (folder)/Алкогольные напитки/Вино (folder)/Вино	43229	Душа Монаха
690952	4600632015944	Вино столовое красн полусладк душа монаха (сувенирное) (рф) 700мл	22133	Продукты питания (folder)/Алкогольные напитки/Вино (folder)/Вино	43229	Душа Монаха
150610	4840403000124	Вино столовое красн полусладк душа монаха с деревянной этикеткой (молдова) 700мл	22133	Продукты питания (folder)/Алкогольные напитки/Вино (folder)/Вино	0	
690953	4600632042032	Вино столовое красн полусладк Изабелла (игристые вина) 750мл	22133	Продукты питания (folder)/Алкогольные напитки/Вино (folder)/Вино	0	
1660134	4607059263460	Вино столовое красн полусладк Изабелла 11% пэтф (ЗАО славпром) 1л	22133	Продукты питания (folder)/Алкогольные напитки/Вино (folder)/Вино	0	
1660135	4607059262395	Вино столовое красн полусладк Изабелла 11% пэтф (ЗАО славпром) 2л	22133	Продукты питания (folder)/Алкогольные напитки/Вино (folder)/Вино	0	
690892	4601897006265	Вино столовое красн полусладк Изабелла Lady fleur 1.5л	22133	Продукты питания (folder)/Алкогольные напитки/Вино (folder)/Вино	0	
690954	4600446002260	Вино столовое красн полусладк исповедь грешницы 3л	22133	Продукты питания (folder)/Алкогольные напитки/Вино (folder)/Вино	0	
690955	4600632041950	Вино столовое красн полусладк каберне (игристые вина) 750мл	22133	Продукты питания (folder)/Алкогольные напитки/Вино (folder)/Вино	0	
1660136	4607154481479	Вино столовое красн полусладк каберне (ппк северский) 1л	22133	Продукты питания (folder)/Алкогольные напитки/Вино (folder)/Вино	3794777	ЮЖНЫЙ ВИНОДЕЛ
1816254	4600870114270	Вино столовое красн полусладк каберне ариант 0.7л 12 %	22133	Продукты питания (folder)/Алкогольные напитки/Вино (folder)/Вино	0	
690956	4601129402834	Вино столовое красн полусладк каберне бут (крымский винный завод) 700мл	22133	Продукты питания (folder)/Алкогольные напитки/Вино (folder)/Вино	0	
451662	4601129403954	Вино столовое красн полусладк каберне пак. (крымский винный завод) 1л	22133	Продукты питания (folder)/Алкогольные напитки/Вино (folder)/Вино	0	
1816255	4600870114546	Вино столовое красн полусладк кадарка ариант 0.7л 11 %	22133	Продукты питания (folder)/Алкогольные напитки/Вино (folder)/Вино	0	
1660137	4620008912431	Вино столовое красн полусладк кодекс мастера столов красное полусладк 12% 750мл	22133	Продукты питания (folder)/Алкогольные напитки/Вино (folder)/Вино	0	
1799280	4607086670088	Вино столовое красн полусладк красный лотос 0.5л 12%	688533	Продукты питания (folder)/Алкогольные напитки/Вино (folder)/Вина России и ближнего зарубежья	0	
1799281	4607086671740	Вино столовое красн полусладк красный лотос 3л 12%	688533	Продукты питания (folder)/Алкогольные напитки/Вино (folder)/Вина России и ближнего зарубежья	0	
690957	4601129402933	Вино столовое красн полусладк крымское бут (крымский винный завод) 700мл	22133	Продукты питания (folder)/Алкогольные напитки/Вино (folder)/Вино	0	
282943	4820037850685	Вино столовое красн полусладк легенда крыма легенда крыма (украина) 750мл	22133	Продукты питания (folder)/Алкогольные напитки/Вино (folder)/Вино	3793335	ЛЕГЕНДА КРЫМА
151642	4607092130262	Вино столовое красн полусладк леди шарм 10-12% 1.0 т/п	22133	Продукты питания (folder)/Алкогольные напитки/Вино (folder)/Вино	150518	СВАРОГ ВИНО 248
690958	4600632041974	Вино столовое красн полусладк мерло (игристые вина) 750мл	22133	Продукты питания (folder)/Алкогольные напитки/Вино (folder)/Вино	0	
690960	4607140751234	Вино столовое красн полусладк мускатное славянское tetrapak (славянский рпк) 1л	22133	Продукты питания (folder)/Алкогольные напитки/Вино (folder)/Вино	72669	Славянский
1660139	4650055694394	Вино столовое красн полусладк пшада (pshada) 0.7л #2	22133	Продукты питания (folder)/Алкогольные напитки/Вино (folder)/Вино	3769013	VINNIKOFF
1660138	4607159663641	Вино столовое красн полусладк пшада (pshada) 700мл	22133	Продукты питания (folder)/Алкогольные напитки/Вино (folder)/Вино	3769013	VINNIKOFF
690907	4760022400528	Вино столовое красн полусладк сарван 700мл	22133	Продукты питания (folder)/Алкогольные напитки/Вино (folder)/Вино	0	
690962	8410702024914	Вино столовое красн полусладк суерте (Испания) 750мл	41484	Продукты питания (folder)/Алкогольные напитки/Вино (folder)/Вина Испании	0	
1759268	4011869004333	Вино столовое красн полусладк шварце витве 750мл 8.5 % коричн бут	1759241	Продукты питания (folder)/Алкогольные напитки/Вино (folder)/Вина Германии	0	
1759648	4603040009628	Вино столовое красн полусладк эйфория 750мл 12%	688533	Продукты питания (folder)/Алкогольные напитки/Вино (folder)/Вина России и ближнего зарубежья	0	
690904	4760022400511	Вино столовое красн полусухое сарван 700мл	22133	Продукты питания (folder)/Алкогольные напитки/Вино (folder)/Вино	0	
151627	7790036001197	Вино столовое красн псух ла вид 10-13% 1.0	22133	Продукты питания (folder)/Алкогольные напитки/Вино (folder)/Вино	0	
1195454	3077054005203	Вино столовое красн сух тамине 11% 750мл	22133	Продукты питания (folder)/Алкогольные напитки/Вино (folder)/Вино	48961	Ладога
1193956	8436536180664	Вино столовое красн сухое 11% 0.5л стбут крус де плата	22133	Продукты питания (folder)/Алкогольные напитки/Вино (folder)/Вино	0	
690908	8437001914227	Вино столовое красн сухое bodega camporro/бодега кампорросо 0.5л	22133	Продукты питания (folder)/Алкогольные напитки/Вино (folder)/Вино	0	
2767620	8410415050729	Вино столовое красн сухое иль сотилло 11% 750мл	22133	Продукты питания (folder)/Алкогольные напитки/Вино (folder)/Вино	0	
1660110	3389983285213	Вино столовое красн сухое кюве де шарль 11% (Франция) 750мл	22133	Продукты питания (folder)/Алкогольные напитки/Вино (folder)/Вино	0	
3291345	3120581422262	Вино столовое красн сухое кюве пьер винсент 750мл 10.5%	22133	Продукты питания (folder)/Алкогольные напитки/Вино (folder)/Вино	0	
1660111	3176480306516	Вино столовое красн сухое мерло пьер шанов 13%, региона бордо 13% (Франция) 750мл	22133	Продукты питания (folder)/Алкогольные напитки/Вино (folder)/Вино	0	
690909	4760022400504	Вино столовое красн сухое сарван 700мл	22133	Продукты питания (folder)/Алкогольные напитки/Вино (folder)/Вино	0	
3291346	4620016190135	Вино столовое красное полусладк 11.5% 750мл ст/б	22133	Продукты питания (folder)/Алкогольные напитки/Вино (folder)/Вино	0	
3289521	4623721737992	Вино столовое красное полусладк виногр. нат. полусладк крас. 750мл г.у. 2015 750мл	22133	Продукты питания (folder)/Алкогольные напитки/Вино (folder)/Вино	0	
2720841	4600264894535	Вино столовое красное полусухое красн п/сух 1.0	22133	Продукты питания (folder)/Алкогольные напитки/Вино (folder)/Вино	0	
3291349	4820155131383	Вино столовое красное сух 1л 10-12% стело	22133	Продукты питания (folder)/Алкогольные напитки/Вино (folder)/Вино	0	
1193953	8436536180657	Вино столовое крус де плата б/полусладк 11% 750мл	22133	Продукты питания (folder)/Алкогольные напитки/Вино (folder)/Вино	0	
1193954	8436536180671	Вино столовое крус де плата бел/сух 11% 750мл	22133	Продукты питания (folder)/Алкогольные напитки/Вино (folder)/Вино	0	
1193955	8436536180640	Вино столовое крус де плата красн/полусладк 11% 750мл	22133	Продукты питания (folder)/Алкогольные напитки/Вино (folder)/Вино	0	
2426983	461001649153	Вино столовое Крым/лоза бел/полусладк 9-13% 700мл	22133	Продукты питания (folder)/Алкогольные напитки/Вино (folder)/Вино	0	
2426984	4610016491479	Вино столовое Крым/лоза каберне сух/ красн 10-12% 700мл	22133	Продукты питания (folder)/Алкогольные напитки/Вино (folder)/Вино	0	
2426986	4610016491554	Вино столовое Крым/лоза красн/полусладк 9-11% 700мл	22133	Продукты питания (folder)/Алкогольные напитки/Вино (folder)/Вино	0	
2720549	4601129600223	Вино столовое крымская Коллекция крас полусладк 750мл 13%	22133	Продукты питания (folder)/Алкогольные напитки/Вино (folder)/Вино	0	
2720842	460112940425	Вино столовое крымское белое полусладк 9-11% 1л	22133	Продукты питания (folder)/Алкогольные напитки/Вино (folder)/Вино	0	
2720545	4601129600193	Вино столовое крымское белое полусладк 9-11% 700мл	22133	Продукты питания (folder)/Алкогольные напитки/Вино (folder)/Вино	0	
2720844	460112940807	Вино столовое крымское белое сух 9-11% 1л	22133	Продукты питания (folder)/Алкогольные напитки/Вино (folder)/Вино	0	
