ID	UPCEAN	Name	CategoryID	CategoryName	BrandID	BrandName
789098	90364044	Патиссоны ди кайземахер фарш свеж.сыром в раст.масле 250г с/б	65	Продукты питания (folder)/Консервы (folder)/Консервы овощные	672091	Ди Кайземахер
789099	9003454084603	Патиссоны ди кайземахер фарш тунцом в раст.масле 250г с/б	65	Продукты питания (folder)/Консервы (folder)/Консервы овощные	672091	Ди Кайземахер
2732475	4607084416329	Патиссоны еко маринованные целые 660г ст/б	1229537	Продукты питания (folder)/Консервы (folder)/Консервы	22216	EKO
3460658	4607079280881	Патиссоны Золотая осень маринованные 700г с/б	1	Неклассифицированные/default	0	
3460659	4640006281346	Патиссоны история маринованные 670г ст/б	1	Неклассифицированные/default	0	
2908078	4840340000621	Патиссоны кадушка консервир 0.700	1	Неклассифицированные/default	0	
3460660	4840021000643	Патиссоны кадушка консервированные 700мл ст/б	1	Неклассифицированные/default	0	
2466642	5902005002100	Патиссоны конс агрофрукт с/б 0.900	1229537	Продукты питания (folder)/Консервы (folder)/Консервы	0	
99726	4840475000206	Патиссоны консерв.900г бокша	65	Продукты питания (folder)/Консервы (folder)/Консервы овощные	0	
1280299	4607145720334	Патиссоны консервированные 720г мелень	65	Продукты питания (folder)/Консервы (folder)/Консервы овощные	0	
1280300	4620752681034	Патиссоны консервированные 720г натура	65	Продукты питания (folder)/Консервы (folder)/Консервы овощные	0	
3460661	4260099277837	Патиссоны консервированные 840г тещины Рецепты	1	Неклассифицированные/default	3922549	ТЕЩИНЫ РЕЦЕПТЫ
3460662	4607049935926	Патиссоны луговица маринованные 680г ст/б	1	Неклассифицированные/default	0	
3460663	4607049937722	Патиссоны луговица мини консервированные с зеленью 720г ст/б	1	Неклассифицированные/default	0	
2252019	4607145725179	Патиссоны лукашинские с яблоками и сладким перцем 670г ст/б	65	Продукты питания (folder)/Консервы (folder)/Консервы овощные	1689029	Лукашинские
3460664	4870001902001	Патиссоны лучшие Рецепты маринованные 670мл ст/б	1	Неклассифицированные/default	0	
1280301	4607173830197	Патиссоны люб/дача консерв с зеленью с/б 0.500	65	Продукты питания (folder)/Консервы (folder)/Консервы овощные	0	
162194	5999007819089	Патиссоны мар рез грин рей с/б 0.68	65	Продукты питания (folder)/Консервы (folder)/Консервы овощные	0	
1280302	4607043452023	Патиссоны маринованные 680г казачьи разносолы	65	Продукты питания (folder)/Консервы (folder)/Консервы овощные	0	
1690680	4607002997497	Патиссоны маринованные дядя Ваня 680г ст/б	1229537	Продукты питания (folder)/Консервы (folder)/Консервы	36983	Дядя Ваня
3460665	4260099277899	Патиссоны марис консервированные 860г стекло-винт	1	Неклассифицированные/default	0	
1775804	4607145725797	Патиссоны мелен маринованные с яблоками и сладким перцем 670г ст/б	1229537	Продукты питания (folder)/Консервы (folder)/Консервы	3781037	МЕЛЕНЪ
99732	5900907000965	Патиссоны метро марин.860г стбан	65	Продукты питания (folder)/Консервы (folder)/Консервы овощные	0	
1280298	4840312000529	Патиссоны минжир агро конс цел с/б 0.700	65	Продукты питания (folder)/Консервы (folder)/Консервы овощные	0	
99733	8717662020964	Патиссоны мини 1уп	37462	Продукты питания (folder)/Овощи свежие	0	
2960701	6006166000070	Патиссоны мини 1уп #2	37462	Продукты питания (folder)/Овощи свежие	0	
2960702	6009813320026	Патиссоны мини 1уп #3	37462	Продукты питания (folder)/Овощи свежие	0	
2960703	6009665700243	Патиссоны мини 1уп #4	37462	Продукты питания (folder)/Овощи свежие	0	
1798211	6009665700038	Патиссоны мини желтые 200г	37462	Продукты питания (folder)/Овощи свежие	0	
3876771	6009811070060	Патиссоны мини желтые 200г #2	37462	Продукты питания (folder)/Овощи свежие	0	
1798212	6009811070077	Патиссоны мини зеленые 200г	37462	Продукты питания (folder)/Овощи свежие	0	
99734	4840312000277	Патиссоны молдаванка консерв.680г стбан	65	Продукты питания (folder)/Консервы (folder)/Консервы овощные	37465	Молдаванка
2960704	4840669000555	Патиссоны молдаванка консерв.680г стбан #2	65	Продукты питания (folder)/Консервы (folder)/Консервы овощные	37465	Молдаванка
3460666	4840748002173	Патиссоны натур браво маринованные слабокислые 720мл ст/б	1	Неклассифицированные/default	0	
2466643	590601300260	Патиссоны ожех конс с/б 0.680	1229537	Продукты питания (folder)/Консервы (folder)/Консервы	0	
99735	5906013002602	Патиссоны ожех марин.680г	65	Продукты питания (folder)/Консервы (folder)/Консервы овощные	0	
3460667	4680287562918	Патиссоны по-княжески с зеленью 670г ст/б	1	Неклассифицированные/default	0	
3460668	4607029232250	Патиссоны с зеленью 550г	1	Неклассифицированные/default	0	
3460669	4660019364133	Патиссоны с зеленью консервированные 950г ст/б	1	Неклассифицированные/default	0	
1690681	3800066183979	Патиссоны сапори де монастери слад.фарш.сыром 235г с/б	65	Продукты питания (folder)/Консервы (folder)/Консервы овощные	1181855	Сапори де Монастери
2466644	4607114763072	Патиссоны соленые 550г уральский разносол	1229537	Продукты питания (folder)/Консервы (folder)/Консервы	0	
2908080	4610011182495	Патиссоны спело зрело дачные белые 720мл ст/б	1	Неклассифицированные/default	2419076	Спело Зрело
2746171	4610011182488	Патиссоны спело зрело солнечные 720г ст/б	1229537	Продукты питания (folder)/Консервы (folder)/Консервы	2419076	Спело Зрело
3460670	4260099273129	Патиссоны тещины Рецепты по херсонски консервированые 860г с/б	1	Неклассифицированные/default	0	
3460671	4260099278339	Патиссоны тещины Рецепты по-херсонски 900мл ст/б	1	Неклассифицированные/default	0	
99736	4840156000327	Патиссоны фаб.молдова консерв.650г стбан	65	Продукты питания (folder)/Консервы (folder)/Консервы овощные	0	
3876772	9003454081404	Патиссоны фаршированн.свежим сыром 1.5кг	37536	Продукты питания (folder)/Овощи соленые и квашеные	0	
2252020	4602009245060	Патока Колобок мальтозная ржаная 140г	622408	Продукты питания (folder)/Бакалея	50146	Колобок
1971469	4810158024300	Паторн е2о-001	1	Неклассифицированные/default	0	
3876774	4603059000968	Патра пиво советник бут 0.5л	22186	Продукты питания (folder)/Алкогольные напитки/Пиво	3876773	ПАТРА
2466645	4870144903729	Патриарх белый 750мл	1	Неклассифицированные/default	0	
2466646	4870144902005	Патриарх красный 750мл	1	Неклассифицированные/default	0	
789100	4892493190216	Патрик - юный механик (19121) k's kids	1	Неклассифицированные/default	0	
4851108	4631141471747	Патрисм духи жен с феромонами 10мл иланг и цитрус	4806371	Лекарственные средства (folder)/Парафармацевтика	0	
4851109	4631141471808	Патрисм духи жен с феромонами 10мл кофе/ваниль	4806371	Лекарственные средства (folder)/Парафармацевтика	0	
4851110	4631141471761	Патрисм духи жен с феромонами 10мл цветущий оазис	4806371	Лекарственные средства (folder)/Парафармацевтика	0	
4851111	4606666021517	Патрисм духи жен с феромонами 2мл ванильный миндаль	4806371	Лекарственные средства (folder)/Парафармацевтика	0	
4851112	4606666021531	Патрисм духи жен с феромонами 2мл восточный мускус	5586	Косметика (folder)/Косметика	0	
4851113	4606666021500	Патрисм духи жен с феромонами 2мл райское дерево	5586	Косметика (folder)/Косметика	0	
4851114	4606666021548	Патрисм духи жен с феромонами 2мл роза и амбра	5586	Косметика (folder)/Косметика	0	
4851115	4606666021494	Патрисм духи жен с феромонами 2мл цветы и специи	5586	Косметика (folder)/Косметика	0	
2746172	8777031024238	Патрон 2108/s423 (пер. газ) 2шт hola	300445	Эксплуатация и ремонт автомобилей/Автомобильные принадлежности	0	
3460675	4690626037809	Патрон ASD настенный карболитовый #2	1	Неклассифицированные/default	0	
789101	4011209031005	Патрон ba9s 24v лампа накаливания	1	Неклассифицированные/default	74863	Siemens
789102	3606485003252	Патрон c лампочкой для подсветки mtn396502	1	Неклассифицированные/default	672565	Schneider Electric WD MERTEN
573612	4895117850497	Патрон Camelion lx-451 e27 с датчиком движения 60w 360" белый	1	Неклассифицированные/default	226050	Camelion
504915	4603787000629	Патрон e14 н-020 подвесной [белый пластик]	1	Неклассифицированные/default	0	
789103	4603787000681	Патрон e14 н-021 люстровый с 1 прижимным кольцом [белый пластик]	278327	Техника (folder)/Электротехника/Электротовары	0	
789104	4603787000704	Патрон e27 н-059 (н-068) подвесной универсальный с крышкой м 10x1 [белый пластик]	278327	Техника (folder)/Электротехника/Электротовары	0	
504918	4603787000711	Патрон e27 н-061 (н-069) люстровый с 1 прижимным кольцом [белый пластик]	1	Неклассифицированные/default	0	
504916	4606400400431	Патрон e27 подвесной керамический неразборный	1	Неклассифицированные/default	0	
3231119	4690259205965	Патрон Electric sq0335-0023 подвесной с клемной колодкой е27 белый	3224028	Техника (folder)/Электротехника/Комплектующие для светотехники	2691873	Tdm
3460678	4603299300781	Патрон forza подвесной е27 4а 250в	1	Неклассифицированные/default	0	
3460679	4603299300774	Патрон forza подвесной прямой е27 4а 250в	1	Неклассифицированные/default	0	
3460680	4606056361780	Патрон iek настенный резьбовой фланцевый материал карболит е27 4а/250в м/у	1	Неклассифицированные/default	0	
1280304	4607177997865	Патрон ln-01 с колодкой для ламп с цоколем g4,gz4,gu5.3 ASD	1	Неклассифицированные/default	0	
3460682	6944312032127	Патрон matrix для дрели 16813	1	Неклассифицированные/default	0	
3460683	6944312032141	Патрон matrix ключевой для дрели 1.5-10мм-3/8	1	Неклассифицированные/default	0	
3460684	4670004716137	Патрон Navigator е27 пластиковый подвесной б/уп	1	Неклассифицированные/default	0	
3460685	4670004719879	Патрон Navigator подвесной карболитовый м10 250в 4а е27	1	Неклассифицированные/default	0	
3460687	4607135565280	Патрон universal е-27 карболит настенный наклонный	1	Неклассифицированные/default	0	
3460686	4607107941531	Патрон universal е14 люстровый электрический термопластик 250в м/у	1	Неклассифицированные/default	0	
3460688	4607107941517	Патрон universal люстровый термопластик е14 2а 250в	1	Неклассифицированные/default	0	
3460689	4607135566126	Патрон universal подвесной е 27м10м/у	1	Неклассифицированные/default	0	
3460690	4607135565228	Патрон universal подвесной карболитовый е 27м 10 4а 250 в	1	Неклассифицированные/default	0	
3460691	4607107944297	Патрон universal подвесной керамический е27	1	Неклассифицированные/default	0	
3460692	4607135565341	Патрон universal подвесной керамический е27 #2	1	Неклассифицированные/default	0	
3460693	4606400013129	Патрон аргос-м керамический е27	1	Неклассифицированные/default	0	
3460694	4690612003177	Патрон асд с кольцом пластик е14-ппк	1	Неклассифицированные/default	0	
789105	4011209030992	Патрон ва 9s винтовые зажимы	1	Неклассифицированные/default	74863	Siemens
789106	4607045330268	Патрон для дрели бесключ.1-10мм-3/8	1	Неклассифицированные/default	0	
1971473	6944312022968	Патрон для дрели быстрозаж.matrix 1/2 10мм 16805	1	Неклассифицированные/default	0	
1971474	6944312022982	Патрон для дрели быстрозажимной c lock 2-13мм - 1/2inch// matrix 16807	1	Неклассифицированные/default	0	
1280305	6944312022951	Патрон для дрели быстрозажимной matrix 2-13мм 1/2inch	1	Неклассифицированные/default	0	
1280306	6944312023002	Патрон для дрели ключевой 1.5-10мм - м 12x1.25// matrix	1	Неклассифицированные/default	0	
1280307	6944312023026	Патрон для дрели ключевой 1.5-13мм - м 12x1.25// matrix	1	Неклассифицированные/default	0	
1971475	6944312023019	Патрон для дрели с ключом 1.5-13мм 1/2 matrix 16817	1	Неклассифицированные/default	0	
1971476	6944312032158	Патрон для дрели с ключом 13мм 3/8 matrix 16818	1	Неклассифицированные/default	0	
1971477	6953888503313	Патрон для дрели с ключом 16мм в16 матрикс 16819	1	Неклассифицированные/default	0	
1971478	6953888503320	Патрон для дрели с ключом 16мм в18 матрикс 16820	1	Неклассифицированные/default	0	
789107	3606485003276	Патрон для лампы светодиодной mtn396576	686230	Техника (folder)/Электротехника/Электронные компоненты	672565	Schneider Electric WD MERTEN
3460697	4607107941494	Патрон е-14 подвесной термопластик	1	Неклассифицированные/default	0	
2466647	4810293000306	Патрон е14	1	Неклассифицированные/default	0	
789108	4680000457507	Патрон е14 кер.	278327	Техника (folder)/Электротехника/Электротовары	0	
3876775	4690612000817	Патрон е14 керамический миньон, шт	1	Неклассифицированные/default	0	
3460674	4680005958993	Патрон е14 н10п-09 е14 карболитовый миньон, шт	1	Неклассифицированные/default	0	
290910	4606400400394	Патрон е14 неразборный керамический [ef 14a]	278327	Техника (folder)/Электротехника/Электротовары	0	
3460695	4690216076317	Патрон е14 подвесной карболитовый наклонный черный	1	Неклассифицированные/default	0	
2466648	1300000093217	Патрон е14 подвесной пластик белый 50шт	1	Неклассифицированные/default	0	
3460696	4690216076331	Патрон е14 подвесной пластиковый белый	1	Неклассифицированные/default	0	
290911	4606400400349	Патрон е14 подвесной, 250в 2а (черный)	278327	Техника (folder)/Электротехника/Электротовары	0	
290912	4606400401926	Патрон е14 резьбовой с прижимным кольцом (люстровый), 250в 2а (черный)	278327	Техника (folder)/Электротехника/Электротовары	0	
3460698	4690216076294	Патрон е14 с кольцом карболитовый черный	1	Неклассифицированные/default	0	
3876776	4690612002446	Патрон е14-пп пластиковый миньон, шт	1	Неклассифицированные/default	0	
3460677	4690612002460	Патрон е14-ппк пластиковый с прижимным кольцом, шт	1	Неклассифицированные/default	0	
2466649	1300000119672	Патрон е14н10п-09 гладкий	1	Неклассифицированные/default	0	
2466650	1300000014571	Патрон е14н10рп-01 резьбовой	1	Неклассифицированные/default	0	
2466651	4810158027943	Патрон е14рк-006	1	Неклассифицированные/default	0	
3460699	4640017284602	Патрон е27 карболитовый подвесной черный	1	Неклассифицированные/default	0	
3460700	4690216076232	Патрон е27 карболитовый подвесной черный #2	1	Неклассифицированные/default	0	
789109	4680000457514	Патрон е27 керам	278327	Техника (folder)/Электротехника/Электротовары	0	
1280308	4680005951123	Патрон е27 керамический подвесной, шт	1	Неклассифицированные/default	0	
3460701	4607107941395	Патрон е27 люстровый термопласт 4а	1	Неклассифицированные/default	0	
3460702	4690216076218	Патрон е27 настенный карболитовый наклонный черный	1	Неклассифицированные/default	0	
290913	4606400400417	Патрон е27 настенный, 250в 4а (черный)	278327	Техника (folder)/Электротехника/Электротовары	0	
3460703	4607135565204	Патрон е27 подвесной м12	1	Неклассифицированные/default	0	
3460704	4607135565211	Патрон е27 подвесной м12 #2	1	Неклассифицированные/default	0	
2466652	1300000093231	Патрон е27 подвесной пластик белый 50шт	1	Неклассифицированные/default	0	
3460705	4690216076379	Патрон е27 подвесной пластиковый белый	1	Неклассифицированные/default	0	
290914	4606400400356	Патрон е27 подвесной, 250в 4а (черный)	278327	Техника (folder)/Электротехника/Электротовары	0	
504917	4606400400455	Патрон е27 потолоч. т071 4а250в (черн)	1	Неклассифицированные/default	0	
290915	4606400400400	Патрон е27 резьбовой с прижимным кольцом (люстровый), 250в 4а (черный)	278327	Техника (folder)/Электротехника/Электротовары	0	
3876777	4690612008684	Патрон е27 силиконовый со шнуром 1м белый in Home, шт	1	Неклассифицированные/default	0	
3876778	4690612008721	Патрон е27 силиконовый со шнуром 1м желтый in Home, шт	1	Неклассифицированные/default	0	
3876779	4690612008592	Патрон е27 силиконовый со шнуром 1м зеленый in Home, шт	1	Неклассифицированные/default	0	
3876780	4690612008707	Патрон е27 силиконовый со шнуром 1м красный in Home, шт	1	Неклассифицированные/default	0	
3876781	4690612008714	Патрон е27 силиконовый со шнуром 1м синий in Home, шт	1	Неклассифицированные/default	0	
3876782	4690612008691	Патрон е27 силиконовый со шнуром 1м черный in Home, шт	1	Неклассифицированные/default	0	
3460681	4690612002453	Патрон е27-пп пластиковый подвесной, шт	1	Неклассифицированные/default	0	
3460676	4690612002477	Патрон е27-ппк пластиковый с прижимным кольцом, шт	1	Неклассифицированные/default	0	
1690686	4810222001701	Патрон е27н-007	1	Неклассифицированные/default	0	
2466653	1300000036306	Патрон е27н12п-01 гладкий	1	Неклассифицированные/default	0	
1280310	4680005958054	Патрон е27н12п-01 е27 карболитовый подвесной, шт	1	Неклассифицированные/default	0	
1280314	4680005958078	Патрон е27н12рп-01 е27 карболитовый с прижимным кольцом, шт	1	Неклассифицированные/default	0	
2746173	4810158024294	Патрон е27р-002	1	Неклассифицированные/default	0	
2466654	1308326038967	Патрон е27ук-02	1	Неклассифицированные/default	0	
1280311	4680005958085	Патрон е27ф п-01 е27 карболитовый потолочный, шт	1	Неклассифицированные/default	0	
1280309	4680005958061	Патрон е27ф п-02 е27 карболитовый настенный, шт	1	Неклассифицированные/default	0	
1280315	4810158027929	Патрон е27ф-004	278327	Техника (folder)/Электротехника/Электротовары	0	
2466655	1308326038950	Патрон е27фк-04	1	Неклассифицированные/default	0	
2466656	1308326040670	Патрон е27флп-01 фланцевый	1	Неклассифицированные/default	0	
2466657	1300000085427	Патрон е27флп-03 наклонный фланцевый	1	Неклассифицированные/default	0	
1280312	4680005951130	Патрон е40 керамический голиаф, шт	1	Неклассифицированные/default	0	
789110	4607072670108	Патрон зап.к родн.	1	Неклассифицированные/default	0	
2252021	4690491021859	Патрон кафе хо 750мл 35.0%, крепкий	1	Неклассифицированные/default	190999	PATRON
2466658	5905339534163	Патрон керам канлюкс holder e-27 250v	1	Неклассифицированные/default	0	
1280317	4690259151330	Патрон керамический е40	278327	Техника (folder)/Электротехника/Электротовары	0	
99737	4026700434408	Патрон клеевой уху для пист.в блист.434540/44183/44180	2	Канцелярские товары (folder)/Канцелярские товары	39155	Уху
