ID	UPCEAN	Name	CategoryID	CategoryName	BrandID	BrandName
1933794	0737052564739	Puma Green man гель для душа 150мл	401	Гигиена (folder)/Гель для душа	18511	PUMA
1933795	0737052564821	Puma Green man дезодорант спрей 150мл	1	Неклассифицированные/default	18511	PUMA
1816217	027201000790	Puma Green man лосьон после бритья 60мл	1	Неклассифицированные/default	909121	P&G PP (Элитка)
1582279	737052619835	Puma Green man м набор туалетная вода 25мл + гель для душа 50мл	401	Гигиена (folder)/Гель для душа	18511	PUMA
1582280	737052564739	Puma Green man м товар гель для душа 150мл	401	Гигиена (folder)/Гель для душа	18511	PUMA
1582281	737052564821	Puma Green man м товар дезодорант спрей 150мл	1	Неклассифицированные/default	18511	PUMA
1105420	737052564708	Puma Green man м товар лосьон после бритья 60мл	1	Неклассифицированные/default	18511	PUMA
1105416	737052564586	Puma Green man м товар туалетная вода 25мл	1039	Парфюмерия (folder)/Туалетная вода	18511	PUMA
1105417	737052564616	Puma Green man м товар туалетная вода 40мл	1039	Парфюмерия (folder)/Туалетная вода	18511	PUMA
1105414	737052564647	Puma Green man м товар туалетная вода 60мл	1039	Парфюмерия (folder)/Туалетная вода	18511	PUMA
1816218	027201000745	Puma Green man туалетная вода 25мл	3068	Парфюмерия (folder)/Парфюмерия	909121	P&G PP (Элитка)
1933797	0737052564586	Puma Green man туалетная вода 25мл #2	3068	Парфюмерия (folder)/Парфюмерия	18511	PUMA
1816219	027201000752	Puma Green man туалетная вода 40мл	3068	Парфюмерия (folder)/Парфюмерия	909121	P&G PP (Элитка)
1933798	0737052564616	Puma Green man туалетная вода 40мл #2	3068	Парфюмерия (folder)/Парфюмерия	18511	PUMA
1816220	027201000769	Puma Green man туалетная вода 60мл	3068	Парфюмерия (folder)/Парфюмерия	909121	P&G PP (Элитка)
1933799	0737052564647	Puma Green man туалетная вода 60мл #2	3068	Парфюмерия (folder)/Парфюмерия	18511	PUMA
1746140	886377940091	Puma h-mesh v sneaker (toddler/Little kid/big kid),twilight Blue/Aurora/malibu Blue,9 m us toddler	15348	Одежда и обувь (folder)/Обувь (folder)/Обувь	0	
1105423	737052108339	Puma i'm going man гель для душа 200мл	401	Гигиена (folder)/Гель для душа	18511	PUMA
1105425	737052108391	Puma i'm going man дезодорант 75мл нат. спрей	407	Парфюмерия (folder)/Дезодорант	18511	PUMA
1105424	737052108414	Puma i'm going man дезодорант спрей 150мл	407	Парфюмерия (folder)/Дезодорант	18511	PUMA
1105421	737052108438	Puma i'm going man лосьон после бритья 60мл	130	Гигиена (folder)/После бритья	18511	PUMA
1105426	737052108407	Puma i'm going man твердый дезодорант 75мл	407	Парфюмерия (folder)/Дезодорант	18511	PUMA
535545	737052116303	Puma i'm going man туалетная вода муж спрей 25мл	1039	Парфюмерия (folder)/Туалетная вода	18511	PUMA
406811	737052108445	Puma i'm going man туалетная вода муж спрей 40мл	1039	Парфюмерия (folder)/Туалетная вода	18511	PUMA
18517	737052108230	Puma i'm going man туалетная вода муж спрей 60мл	1039	Парфюмерия (folder)/Туалетная вода	18511	PUMA
642521	737052108247	Puma i'm going man туалетная вода муж спрей 90мл	1039	Парфюмерия (folder)/Туалетная вода	18511	PUMA
1105427	737052108643	Puma i'm going woman гель для душа 200мл	401	Гигиена (folder)/Гель для душа	18511	PUMA
1105428	737052108490	Puma i'm going woman дезодорант 150мл	407	Парфюмерия (folder)/Дезодорант	18511	PUMA
406813	737052108506	Puma i'm going woman дезодорант нат. спрей 75мл	3068	Парфюмерия (folder)/Парфюмерия	18511	PUMA
1105429	737052108483	Puma i'm going woman лосьон для тела 200мл	486634	Косметика (folder)/Лосьон для тела	18511	PUMA
1105422	737052108605	Puma i'm going woman туалетная вода жен 90мл српей	1039	Парфюмерия (folder)/Туалетная вода	18511	PUMA
406812	737052108179	Puma i'm going woman туалетная вода жен спрей 20мл	1039	Парфюмерия (folder)/Туалетная вода	18511	PUMA
18518	737052108568	Puma i'm going woman туалетная вода жен спрей 40мл	1039	Парфюмерия (folder)/Туалетная вода	18511	PUMA
848477	737052108599	Puma i'm going woman туалетная вода жен спрей 60мл	1039	Парфюмерия (folder)/Туалетная вода	18511	PUMA
642523	737052435602	Puma jam 3oz EDT sp for women	1039	Парфюмерия (folder)/Туалетная вода	18511	PUMA
1105432	737052619927	Puma jam m reboot gs1213 т/в 25мл+г/д 50мл	360621	Сувениры и подарки (folder)/Подарочный набор	18511	PUMA
1812631	025495055366	Puma jam m reboot gs1213 т/в 25мл+г/д 50мл #2	360621	Сувениры и подарки (folder)/Подарочный набор	909121	P&G PP (Элитка)
1105433	737052434131	Puma jam man Deo spray 75ml	1	Неклассифицированные/default	18511	PUMA
1105435	737052433936	Puma jam man лосьон после бритья 60мл	130	Гигиена (folder)/После бритья	18511	PUMA
1582283	737052433998	Puma jam man м товар дезодорант спрей 150мл	1	Неклассифицированные/default	18511	PUMA
1933801	0737052434285	Puma jam man туалетная вода 25мл	3068	Парфюмерия (folder)/Парфюмерия	18511	PUMA
1933802	0737052434322	Puma jam man туалетная вода 40мл	3068	Парфюмерия (folder)/Парфюмерия	18511	PUMA
1933803	0737052434490	Puma jam man туалетная вода 60мл	3068	Парфюмерия (folder)/Парфюмерия	18511	PUMA
2822815	073705243454	Puma jam men 3.4 EDT sp	3068	Парфюмерия (folder)/Парфюмерия	0	
1828721	737052434391	Puma jam men EDT tester 60ml	1802896	Парфюмерия (folder)/Парфюмерия homme	18511	PUMA
1812626	025495055373	Puma jam w reboot gs1213 т/в 20мл+г/д 50мл	360621	Сувениры и подарки (folder)/Подарочный набор	909121	P&G PP (Элитка)
1105438	737052520209	Puma jam woman EDT femme 40ml set: EDT 40ml + 50ml Shower Gel + 50ml Deo	1039	Парфюмерия (folder)/Туалетная вода	18511	PUMA
1105436	737052619958	Puma jam woman ж набор туалетная вода 20мл + гель для душа 50мл	360621	Сувениры и подарки (folder)/Подарочный набор	18511	PUMA
1582284	737052434803	Puma jam woman ж товар дезодорант спрей 150мл	1	Неклассифицированные/default	18511	PUMA
1933805	0737052435459	Puma jam woman туалетная вода 40мл	3068	Парфюмерия (folder)/Парфюмерия	18511	PUMA
1933806	0737052435497	Puma jam woman туалетная вода 60мл	3068	Парфюмерия (folder)/Парфюмерия	18511	PUMA
535551	737052435459	Puma jam woman туалетная вода жен спрей 40мл	1039	Парфюмерия (folder)/Туалетная вода	18511	PUMA
1105437	737052435497	Puma jam woman туалетная вода жен спрей 60мл	1039	Парфюмерия (folder)/Туалетная вода	18511	PUMA
1828690	737052435534	Puma jam women EDT tester 60ml	1802797	Парфюмерия (folder)/Парфюмерия femme	18511	PUMA
1105440	4004711800832	Puma jamaica 2 after shave homme 50ml	130	Гигиена (folder)/После бритья	18511	PUMA
1105441	8595562286846	Puma jamaica 2 EDT homme 50ml	1039	Парфюмерия (folder)/Туалетная вода	18511	PUMA
1105442	4004711801365	Puma jamaica ii man твердый дезодорант 75мл	407	Парфюмерия (folder)/Дезодорант	18511	PUMA
257390	4004711800467	Puma jamaica ii man туалетная вода муж спрей 100мл	1039	Парфюмерия (folder)/Туалетная вода	18511	PUMA
535553	4004711801501	Puma jamaica ii man туалетная вода муж спрей 30мл	1039	Парфюмерия (folder)/Туалетная вода	18511	PUMA
535554	4004711800504	Puma jamaica ii man туалетная вода муж спрей 50мл	1039	Парфюмерия (folder)/Туалетная вода	18511	PUMA
535556	737052205847	Puma jamaica ii woman туалетная вода жен спрей 20мл	1039	Парфюмерия (folder)/Туалетная вода	18511	PUMA
535557	737052205885	Puma jamaica ii woman туалетная вода жен спрей 30мл	1039	Парфюмерия (folder)/Туалетная вода	18511	PUMA
535558	737052205953	Puma jamaica ii woman туалетная вода жен спрей 50мл	1039	Парфюмерия (folder)/Туалетная вода	18511	PUMA
2378729	4004711801600	Puma jamaica man coffret 30v/Shower Gel	1	Неклассифицированные/default	0	
1105443	8595562295886	Puma jamaica man EDT homme 50ml tester	1039	Парфюмерия (folder)/Туалетная вода	18511	PUMA
1105444	4004711850844	Puma jamaica wom. Body Lotion 200ml	486634	Косметика (folder)/Лосьон для тела	18511	PUMA
1105446	4004711851643	Puma jamaica wom. EDT 20ml vapo	1039	Парфюмерия (folder)/Туалетная вода	18511	PUMA
1105447	4004711850240	Puma jamaica wom. EDT 30ml vapo	1039	Парфюмерия (folder)/Туалетная вода	18511	PUMA
1105448	4004711850141	Puma jamaica wom. EDT 50ml vapo	1039	Парфюмерия (folder)/Туалетная вода	18511	PUMA
1105449	4004711850448	Puma jamaica wom. Shower Gel 200ml	401	Гигиена (folder)/Гель для душа	18511	PUMA
1105445	4004711851001	Puma jamaica woman дезодорант жен спрей 150мл	407	Парфюмерия (folder)/Дезодорант	18511	PUMA
257391	4004711850011	Puma jamaica woman туалетная вода жен спрей 100мл	1039	Парфюмерия (folder)/Туалетная вода	18511	PUMA
257392	4004711884306	Puma man after shave splash 100ml	130	Гигиена (folder)/После бритья	0	
1105450	4004711880216	Puma man Deo spray 150ml	1	Неклассифицированные/default	18511	PUMA
257393	4004711886515	Puma man Deo spray 75ml	407	Парфюмерия (folder)/Дезодорант	0	
257394	4004711884245	Puma man EDT 100ml vapo	1039	Парфюмерия (folder)/Туалетная вода	0	
257395	4045434260572	Puma man EDT 100ml vapo+bolsa juvenil	1039	Парфюмерия (folder)/Туалетная вода	0	
257396	4082800197209	Puma man EDT 100ml vapo+camiseta	1039	Парфюмерия (folder)/Туалетная вода	0	
257397	4004711880049	Puma man EDT 50ml vapo	1039	Парфюмерия (folder)/Туалетная вода	0	
1105451	4004711880179	Puma man Shower Gel 200ml	401	Гигиена (folder)/Гель для душа	18511	PUMA
1746141	886377792171	Puma men's bioweb elite running shoe,Black aged Silver,11.5 d us	15348	Одежда и обувь (folder)/Обувь (folder)/Обувь	0	
1746142	886375631052	Puma men's bolt evospeed sprint ltd track shoe,Black/fluorescent Green,6.5 d us	15348	Одежда и обувь (folder)/Обувь (folder)/Обувь	0	
1582286	841772012552	Puma men's cotton lounge pants, gray large (p/n lm100bt-020)	1	Неклассифицированные/default	0	
1746143	886377737394	Puma men's King fg soccer cleat,Black/Black/puma Silver,11 d us	15348	Одежда и обувь (folder)/Обувь (folder)/Обувь	0	
1582287	841772012637	Puma men's lounge pants - large - navy (p/n lm100bt-410)	1	Неклассифицированные/default	0	
1582288	841772012644	Puma men's lounge pants - navy - size: xl (p/n lm100bt-410)	1	Неклассифицированные/default	0	
1582289	841772012682	Puma men's lounge pants xl (Black) (p/n lm100bt-001)	1	Неклассифицированные/default	0	
1746144	886375540675	Puma men's Super cell Fusion Ice golf shoe,White/Silver metallic/surf the web,10.5 d us	15348	Одежда и обувь (folder)/Обувь (folder)/Обувь	0	
1746145	886377798814	Puma men's Super elevate 2 running shoe,Black/puma Silver,9.5 d us	15348	Одежда и обувь (folder)/Обувь (folder)/Обувь	0	
1746146	886375835054	Puma men's tergament Sport sneaker,Black/gray violet,10 d us	15348	Одежда и обувь (folder)/Обувь (folder)/Обувь	0	
1746147	886375766563	Puma men's ventnor sneaker,White/Black,10.5 d us	15348	Одежда и обувь (folder)/Обувь (folder)/Обувь	0	
1746148	886377534009	Puma men's whirlwind Classic lace-up Fashion sneaker,snorkel Blue/White,9 d us	15348	Одежда и обувь (folder)/Обувь (folder)/Обувь	0	
1582285	841772003574	Puma mena? s athletic socks (Black and purple) (p/n p79138-015)	1	Неклассифицированные/default	0	
1746149	886375664173	Puma mostro mesh Fashion sneaker,Black/spectrum Blue,10.5 us men's/12 d us women's	15348	Одежда и обувь (folder)/Обувь (folder)/Обувь	0	
2822816	883563242533	Puma north america burmei xc wns Green 10 18256917	1	Неклассифицированные/default	0	
2822817	883561499724	Puma north america cell cerae wns Silver 11 18271501	1	Неклассифицированные/default	0	
2822818	883561671663	Puma north america elye wns beige 6 18294204	1	Неклассифицированные/default	0	
2822819	883561671724	Puma north america elye wns beige 9 18294204	1	Неклассифицированные/default	0	
2822820	883561637829	Puma north america espera White 8 30098314	1	Неклассифицированные/default	0	
2822821	883561637836	Puma north america espera White 8.5 30098314	1	Неклассифицированные/default	0	
2822822	883561637843	Puma north america espera White 9 30098314	1	Неклассифицированные/default	0	
2822823	883376424997	Puma north america flurry wns Black 8.5 34444701	1	Неклассифицированные/default	0	
2822824	883376425086	Puma north america flurry wns brown 7 34444704	1	Неклассифицированные/default	0	
2822825	883563112751	Puma north america glam flip jamin wns gray 34621501	1	Неклассифицированные/default	0	
2822826	883563112768	Puma north america glam flip jamin wns gray 34621501 #2	1	Неклассифицированные/default	0	
2822827	883563112775	Puma north america glam flip jamin wns gray 34621501 #3	1	Неклассифицированные/default	0	
2822828	883563112782	Puma north america glam flip jamin wns gray 34621501 #4	1	Неклассифицированные/default	0	
2822829	883563113093	Puma north america glam flip sunahama w Black 34621701	1	Неклассифицированные/default	0	
2822830	883563114885	Puma north america glam flip whack wns pink 34626101	1	Неклассифицированные/default	0	
2822831	883563114892	Puma north america glam flip whack wns pink 34626101 #2	1	Неклассифицированные/default	0	
2822832	883563114908	Puma north america glam flip whack wns pink 34626101 #3	1	Неклассифицированные/default	0	
2822833	883365440960	Puma north america gv Special wns ext White 10 34491403	1	Неклассифицированные/default	0	
2822834	883365440892	Puma north america gv Special wns ext White 6.5 34491403	1	Неклассифицированные/default	0	
2822835	883365440908	Puma north america gv Special wns ext White 7 34491403	1	Неклассифицированные/default	0	
2822836	883365440915	Puma north america gv Special wns ext White 7.5 34491403	1	Неклассифицированные/default	0	
2822837	883365440939	Puma north america gv Special wns ext White 8.5 34491403	1	Неклассифицированные/default	0	
2822838	883365440823	Puma north america gv Special wns ext White 9.5 34491402	1	Неклассифицированные/default	0	
2822839	883365440953	Puma north america gv Special wns ext White 9.5 34491403	1	Неклассифицированные/default	0	
2822840	883365915512	Puma north america jasmine track wns Black 6 18263503	1	Неклассифицированные/default	0	
2822841	883365915529	Puma north america jasmine track wns Black 6.5 18263503	1	Неклассифицированные/default	0	
2822842	883365915536	Puma north america jasmine track wns Black 7 18263503	1	Неклассифицированные/default	0	
2822843	883365394843	Puma north america La bamba xcs wns Green 6.5 18166810	1	Неклассифицированные/default	0	
2822844	883376426502	Puma north america London trail wns Black 6 18262801	1	Неклассифицированные/default	0	
2822845	883376426519	Puma north america London trail wns Black 6.5 18262801	1	Неклассифицированные/default	0	
2822846	883561348022	Puma north america narabota xc wns gray 7 18255310	1	Неклассифицированные/default	0	
2822847	883561348060	Puma north america narabota xc wns gray 9 18255310	1	Неклассифицированные/default	0	
2822848	883561000999	Puma north america repli Cat ii us wns Black 7.5 30151002	1	Неклассифицированные/default	0	
2822849	884862298313	Puma north america roma wns ext White 9 34289318	1	Неклассифицированные/default	0	
2822850	883563161377	Puma north america speeder m wns beige 10 34564001	1	Неклассифицированные/default	0	
2822851	883563161292	Puma north america speeder m wns beige 6 34564001	1	Неклассифицированные/default	0	
2822852	883563161308	Puma north america speeder m wns beige 6.5 34564001	1	Неклассифицированные/default	0	
2822853	883563161339	Puma north america speeder m wns beige 8 34564001	1	Неклассифицированные/default	0	
2822854	883563161346	Puma north america speeder m wns beige 8.5 34564001	1	Неклассифицированные/default	0	
2822855	883563161353	Puma north america speeder m wns beige 9 34564001	1	Неклассифицированные/default	0	
2822856	883563161360	Puma north america speeder m wns beige 9.5 34564001	1	Неклассифицированные/default	0	
2822857	883561690152	Puma north america usan wns White 8.5 18296301	1	Неклассифицированные/default	0	
2822858	883561632985	Puma north america wheelspin wns brown 10 30136712	1	Неклассифицированные/default	0	
2822859	883365956096	Puma north america wheelspin wns Silver 10 30136705	1	Неклассифицированные/default	0	
642522	737052434544	Puma puma jam - 3oz sp EDT - men	1039	Парфюмерия (folder)/Туалетная вода	18511	PUMA
535548	737052434285	Puma puma jam man м товар туалетная вода спрей 25мл	1039	Парфюмерия (folder)/Туалетная вода	18511	PUMA
535549	737052434322	Puma puma jam man м товар туалетная вода спрей 40мл	1039	Парфюмерия (folder)/Туалетная вода	18511	PUMA
1105431	737052434490	Puma puma jam man м товар туалетная вода спрей 60мл	1039	Парфюмерия (folder)/Туалетная вода	18511	PUMA
535550	737052434988	Puma puma jam woman ж товар туалетная вода спрей 20мл	1039	Парфюмерия (folder)/Туалетная вода	18511	PUMA
1105452	4004711090806	Puma Red woman Body Lotion 200ml	486634	Косметика (folder)/Лосьон для тела	18511	PUMA
2378730	737052051857	Puma Red woman coffret 30v/bag	1	Неклассифицированные/default	0	
1105454	4004711090905	Puma Red woman Shower Gel 200ml	401	Гигиена (folder)/Гель для душа	18511	PUMA
1105453	4004711091209	Puma Red woman дезодорант жен спрей 150мл	407	Парфюмерия (folder)/Дезодорант	18511	PUMA
535562	4004711091100	Puma Red woman туалетная вода жен спрей 20мл	1039	Парфюмерия (folder)/Туалетная вода	18511	PUMA
848478	4004711090707	Puma Red woman туалетная вода жен спрей 30мл	1039	Парфюмерия (folder)/Туалетная вода	18511	PUMA
535563	4004711090509	Puma Red woman туалетная вода жен спрей 50мл	1039	Парфюмерия (folder)/Туалетная вода	18511	PUMA
1746150	886375352971	Puma roma basic jr lace-up sneaker (Little kid/big kid),Black/White/puma Silver,5.5 m us big kid	15348	Одежда и обувь (folder)/Обувь (folder)/Обувь	0	
1746151	886375912700	Puma snts leather nm sneaker,White/amazon,8 d us	15348	Одежда и обувь (folder)/Обувь (folder)/Обувь	0	
2378731	4004711001512	Puma soccer man Deo 150ml vapo	1	Неклассифицированные/default	0	
2378732	4004711001437	Puma soccer man EDT 30ml vapo	3068	Парфюмерия (folder)/Парфюмерия	0	
1105455	4004711001482	Puma soccer man Shower Gel 200ml	401	Гигиена (folder)/Гель для душа	18511	PUMA
2378733	4004711003677	Puma soccer woman Body Lotion 200ml	1	Неклассифицированные/default	0	
2378734	4004711003714	Puma soccer woman Deo 150ml vapo	1	Неклассифицированные/default	0	
2378735	4004711003363	Puma soccer woman EDT 20ml vapo	3068	Парфюмерия (folder)/Парфюмерия	0	
2378736	4004711003158	Puma soccer woman EDT 50ml vapo	3068	Парфюмерия (folder)/Парфюмерия	0	
2378737	4004711003592	Puma soccer woman Shower Gel 200ml	1	Неклассифицированные/default	0	
1105456	4004711020124	Puma soccer туалетная вода муж 50мл спрей огр вып 2006	1039	Парфюмерия (folder)/Туалетная вода	18511	PUMA
1933807	737052694627	Puma sync Deo femme 75ml	1	Неклассифицированные/default	18511	PUMA
2378738	737052694559	Puma sync EDT femme 90ml	1039	Парфюмерия (folder)/Туалетная вода	18511	PUMA
1836585	8595562242026	Puma sync EDT men 60ml	1039	Парфюмерия (folder)/Туалетная вода	18511	PUMA
1747956	737052694931	Puma sync for men EDT 40ml spray	1039	Парфюмерия (folder)/Туалетная вода	18511	PUMA
1747957	737052694979	Puma sync for men EDT 60ml spray	1039	Парфюмерия (folder)/Туалетная вода	18511	PUMA
1582290	737052694436	Puma sync for women EDT 20ml spray	3068	Парфюмерия (folder)/Парфюмерия	18511	PUMA
1747959	737052694474	Puma sync for women EDT 40ml spray	1039	Парфюмерия (folder)/Туалетная вода	18511	PUMA
1933808	737052695204	Puma sync m дезодорант спрей 150мл	1	Неклассифицированные/default	0	
1933809	0737052695204	Puma sync m дезодорант спрей 150мл #2	1	Неклассифицированные/default	18511	PUMA
1933810	0737052694894	Puma sync m туалетная вода 25мл	3068	Парфюмерия (folder)/Парфюмерия	18511	PUMA
1933811	0737052694931	Puma sync m туалетная вода 40мл	3068	Парфюмерия (folder)/Парфюмерия	18511	PUMA
1933812	0737052694979	Puma sync m туалетная вода 60мл	3068	Парфюмерия (folder)/Парфюмерия	18511	PUMA
2378739	737052695013	Puma sync man EDT homme 90ml	1039	Парфюмерия (folder)/Туалетная вода	18511	PUMA
1802933	737052695273	Puma sync men EDT 60ml tester	1802896	Парфюмерия (folder)/Парфюмерия homme	18511	PUMA
1933813	0737052694436	Puma sync w туалетная вода 20мл	3068	Парфюмерия (folder)/Парфюмерия	18511	PUMA
1933814	0737052694474	Puma sync w туалетная вода 40мл	3068	Парфюмерия (folder)/Парфюмерия	18511	PUMA
1802876	737052694511	Puma sync w туалетная вода 60мл	1039	Парфюмерия (folder)/Туалетная вода	18511	PUMA
1933815	0737052694511	Puma sync w туалетная вода 60мл #2	3068	Парфюмерия (folder)/Парфюмерия	18511	PUMA
1802877	737052694733	Puma sync women EDT 60ml tester	1802797	Парфюмерия (folder)/Парфюмерия femme	18511	PUMA
1748089	737052810683	Puma time to Play for men EDT 40ml spray	1039	Парфюмерия (folder)/Туалетная вода	0	
1748091	737052810669	Puma time to Play for women EDT 20ml spray	1039	Парфюмерия (folder)/Туалетная вода	0	
1748092	737052810676	Puma time to Play for women EDT 40ml spray	1039	Парфюмерия (folder)/Туалетная вода	0	
1748093	737052808659	Puma time to Play for women EDT 60ml spray	1039	Парфюмерия (folder)/Туалетная вода	18511	PUMA
2378740	737052880372	Puma time to Play man EDT homme 40ml set EDT 40ml + cosmetic bag	1039	Парфюмерия (folder)/Туалетная вода	18511	PUMA
