ID	UPCEAN	Name	CategoryID	CategoryName	BrandID	BrandName
1939722	037000204626	Secret exp i/s 2.7oz vava vanla	1	Неклассифицированные/default	6297	Secret
2662913	4019863202786	Secret filtro de pantalla de seguridad	1	Неклассифицированные/default	0	
2009541	051021440368	Secret finger vibe Crystal	1980172	Adult/All Novelties	0	
2009542	051021440467	Secret finger vibe lilac	1980172	Adult/All Novelties	0	
1127809	056100036647	Secret flawl t/olay cond sol refr flora 45g	1	Неклассифицированные/default	0	
1127810	056100036692	Secret flawl t/olay cond sol sat trop 45g	1	Неклассифицированные/default	0	
1127811	056100036685	Secret flawl t/olay cond sol silky b 73g	1	Неклассифицированные/default	0	
1127812	056100036715	Secret flawl t/olay cond sol silky bot 45g	1	Неклассифицированные/default	0	
1127813	056100036678	Secret flawl t/olay cond sol smooth Powder 73g	1	Неклассифицированные/default	0	
1127814	056100036654	Secret flawl t/olay cond sol unsc 45g	1	Неклассифицированные/default	0	
1127815	056100036661	Secret flawl t/olay cond sol wildflw fr 45g	1	Неклассифицированные/default	0	
1127816	056100036722	Secret flawl Touch/olay cond sol smth p 45g	1	Неклассифицированные/default	0	
650223	037000149224	Secret flawless Floral 1.6oz	1	Неклассифицированные/default	6297	Secret
1127817	056100036562	Secret flawless inv sol compl clean 45g	1	Неклассифицированные/default	0	
1127818	056100036579	Secret flawless inv sol prot Powder 45g	1	Неклассифицированные/default	0	
1127819	056100036586	Secret flawless inv sol prot Powder 73g	1	Неклассифицированные/default	0	
1127820	056100036531	Secret flawless inv sol refr Floral 45g	1	Неклассифицированные/default	0	
1127821	056100036555	Secret flawless inv sol satiny Tropical 45g	1	Неклассифицированные/default	0	
1127822	056100036623	Secret flawless inv sol totally Fresh 45g	1	Неклассифицированные/default	0	
1127823	056100036593	Secret flawless inv sol unscented 73g	1	Неклассифицированные/default	0	
1127824	063023129165	Secret fncy/rb blk	1	Неклассифицированные/default	0	
2677285	7332752000438	Secret for 15.4' wide	1	Неклассифицированные/default	0	
2677286	7332752000490	Secret for 15.6' wide	1	Неклассифицированные/default	0	
2677287	7332752000452	Secret for 17.3' wide	1	Неклассифицированные/default	0	
1599524	632474331658	Secret fortune	1	Неклассифицированные/default	0	
2677288	037000272960	Secret Fresh effects Fresh Water orchid scent antiperspirant Deo twin pack - 2 ct	1	Неклассифицированные/default	6297	Secret
2677289	037000810407	Secret Fresh effects Spring cotton solid antiperspirant Deo	1	Неклассифицированные/default	6297	Secret
1127825	056100024286	Secret g/c lt Powder	1	Неклассифицированные/default	0	
1127826	056100024293	Secret g/c lt s/b	1	Неклассифицированные/default	0	
1127827	056100024279	Secret g/c unscent	1	Неклассифицированные/default	0	
2391332	9555411002453	Secret Garden b.wash himalaya 220ml	1	Неклассифицированные/default	0	
2391333	9555411002439	Secret Garden b.wash himalaya 600ml	1	Неклассифицированные/default	0	
2391334	9555411002170	Secret Garden b.wash mediterranean 650ml	1	Неклассифицированные/default	0	
2391335	9555411002354	Secret Garden b.wash nusantara 220ml	1	Неклассифицированные/default	0	
2391336	9555411002330	Secret Garden b.wash nusantara 600ml	1	Неклассифицированные/default	0	
2391337	9555411002255	Secret Garden b.wash orient 220ml	1	Неклассифицированные/default	0	
2391338	9555411002231	Secret Garden b.wash orient 600ml	1	Неклассифицированные/default	0	
2391339	9555411002903	Secret Garden Body scrub 150ml	1	Неклассифицированные/default	0	
2391340	9555411002477	Secret Garden Body wash himalaya 650ml	1	Неклассифицированные/default	0	
2391341	9555411002378	Secret Garden Body wash nusantara 650ml	1	Неклассифицированные/default	0	
2391342	9555411002279	Secret Garden Body wash orient 650ml	1	Неклассифицированные/default	0	
2391343	9555411002514	Secret Garden h&b wash men calm 200ml	1	Неклассифицированные/default	0	
2391344	9555411002613	Secret Garden h&b wash men rush 200ml	1	Неклассифицированные/default	0	
2391345	9555411001487	Secret Garden Shampoo himalaya 200ml	1	Неклассифицированные/default	0	
2391346	9555411001494	Secret Garden Shampoo himalaya 400ml	1	Неклассифицированные/default	0	
2391347	9555411001395	Secret Garden Shampoo nusantara 400ml	1	Неклассифицированные/default	0	
2391348	9555411001289	Secret Garden Shampoo orient 200ml	1	Неклассифицированные/default	0	
2391349	9555411001296	Secret Garden Shampoo orient 400ml	1	Неклассифицированные/default	0	
2391350	9555411001180	Secret Garden shp mediterranean 200ml	1	Неклассифицированные/default	0	
2391351	9555411001197	Secret Garden shp mediterranean 400ml	1	Неклассифицированные/default	0	
2391352	9555411001388	Secret Garden shp nusantara 200ml	1	Неклассифицированные/default	0	
1127830	063023127376	Secret her choice	1	Неклассифицированные/default	0	
1127839	063023369233	Secret her choice #10	1	Неклассифицированные/default	0	
1127840	063023369271	Secret her choice #11	1	Неклассифицированные/default	0	
1127841	063023369318	Secret her choice #12	1	Неклассифицированные/default	0	
1127842	063023369356	Secret her choice #13	1	Неклассифицированные/default	0	
1127843	063023369905	Secret her choice #14	1	Неклассифицированные/default	0	
1127844	063023370543	Secret her choice #15	1	Неклассифицированные/default	0	
1127845	770986660238	Secret her choice #16	1	Неклассифицированные/default	0	
1127846	770986660245	Secret her choice #17	1	Неклассифицированные/default	0	
1127847	770986660252	Secret her choice #18	1	Неклассифицированные/default	0	
1127848	770986660269	Secret her choice #19	1	Неклассифицированные/default	0	
1127831	063023128038	Secret her choice #2	1	Неклассифицированные/default	0	
1127849	770986660276	Secret her choice #20	1	Неклассифицированные/default	0	
1127850	770986660283	Secret her choice #21	1	Неклассифицированные/default	0	
1127851	770986660788	Secret her choice #22	1	Неклассифицированные/default	0	
1127832	063023368960	Secret her choice #3	1	Неклассифицированные/default	0	
1127833	063023369004	Secret her choice #4	1	Неклассифицированные/default	0	
1127834	063023369073	Secret her choice #5	1	Неклассифицированные/default	0	
1127835	063023369110	Secret her choice #6	1	Неклассифицированные/default	0	
1127836	063023369158	Secret her choice #7	1	Неклассифицированные/default	0	
1127837	063023369196	Secret her choice #8	1	Неклассифицированные/default	0	
1127838	063023369202	Secret her choice #9	1	Неклассифицированные/default	0	
1127852	063023368847	Secret her choice c/t	1	Неклассифицированные/default	0	
1127853	063023368885	Secret her choice c/t #2	1	Неклассифицированные/default	0	
1127854	063023368922	Secret her choice c/t #3	1	Неклассифицированные/default	0	
1127828	063023537366	Secret her choice rib b nvy	1	Неклассифицированные/default	0	
1127829	063023537380	Secret her choice rib d nvy	1	Неклассифицированные/default	0	
1127855	037000149545	Secret i/sld flwls silky 2.6oz	1	Неклассифицированные/default	6297	Secret
414017	5055002555824	Secret in their eyes DVD	1	Неклассифицированные/default	0	
1127857	056100035190	Secret inv. Baby Powder 45g	1	Неклассифицированные/default	0	
1127858	056100035183	Secret inv. sheer clean 45g	1	Неклассифицированные/default	0	
1127859	056100035206	Secret inv. Spring breeze 45g	1	Неклассифицированные/default	0	
1127860	056100035213	Secret inv. unscented 45g	1	Неклассифицированные/default	0	
1128114	037000123354	Secret Invisible solid Deo sheer clean	1	Неклассифицированные/default	6297	Secret
2677290	037000124344	Secret Invisible solid Deo Spring breeze - 2 pk	1	Неклассифицированные/default	6297	Secret
1127861	063023530879	Secret k/h qn bge	1	Неклассифицированные/default	0	
2677298	8809305993664	Secret key Angel Крем для рук с ароматом болгар. розы Angel christmas collection hand cream_bulgarian Rose 30г	5586	Косметика (folder)/Косметика	2677291	Secret Key
2677292	8809305993893	Secret key Angel Крем №1 многофункц. с аром. болгарск. розы Angel moist wrap steam Cream no.1_bulgarian Rose 80г	5586	Косметика (folder)/Косметика	2677291	Secret Key
2677293	8809305993909	Secret key Angel Крем №2 многофункц. с ароматом жасмина Angel moist wrap steam Cream no. 2_jasmine 80г	5586	Косметика (folder)/Косметика	2677291	Secret Key
2677294	8809305992513	Secret key Angel Крем №3 многофункц. (аргана, болгарская роза) argan Angel moisture steam Cream no.3 80г	5586	Косметика (folder)/Косметика	2677291	Secret Key
2677295	8809305992698	Secret key Angel Крем №4 многофункц. (аргана, болгарская роза) argan Angel moisture steam Cream no.4 80г	5586	Косметика (folder)/Косметика	2677291	Secret Key
2677296	8809305994753	Secret key Angel Крем №5 многофункц. (аргана, болгарская роза) argan Angel moisture steam Cream no.5 80г	5586	Косметика (folder)/Косметика	2677291	Secret Key
2677297	8809305994760	Secret key Angel Крем №6 многофункц. (аргана, лаванда) argan Angel moisture steam Cream no.6 80г	5586	Косметика (folder)/Косметика	2677291	Secret Key
2677299	8809305992889	Secret key Angel тоник слезы ангела лилия Angel tears essence toner_lily 250мл	5586	Косметика (folder)/Косметика	2677291	Secret Key
2677300	8809305993930	Secret key Black out маска с древесным углем для очищения и сужения пор Black out pore minimizing pack 100г	5586	Косметика (folder)/Косметика	2677291	Secret Key
2677301	8809305994272	Secret key Black out средство для очищения пор Black out pore clean remover 100мл	5586	Косметика (folder)/Косметика	2677291	Secret Key
2677302	8809305994524	Secret key Black out тонер с древесным углем для очищения и сужения пор Black out pore clean toner 250мл	5586	Косметика (folder)/Косметика	2677291	Secret Key
2677303	8809305993466	Secret key Color recipe Крем для лица голубой для сухой кожи Color recipe the Blue Cream 55г	5586	Косметика (folder)/Косметика	2677291	Secret Key
2677304	8809305993459	Secret key Color recipe Крем для лица желтый для тусклой кожи Color recipe the Yellow Cream 55г	5586	Косметика (folder)/Косметика	2677291	Secret Key
2677305	8809305993442	Secret key Color recipe Крем для лица розовый увлаж. для упругости кожи Color recipe the pink Cream 55г	5586	Косметика (folder)/Косметика	2677291	Secret Key
2677306	8809305993077	Secret key glam romance гель для душа glam 1 glam romance perfume Body wash glam 1 1000мл	5586	Косметика (folder)/Косметика	2677291	Secret Key
2677307	8809305993213	Secret key glam romance гель для душа glam 3 glam romance perfume Body wash glam 3 1000мл	5586	Косметика (folder)/Косметика	2677291	Secret Key
2677308	8809305993961	Secret key glam romance гель для душа glam 4 glam romance perfume Body wash glam 4 1000мл	5586	Косметика (folder)/Косметика	2677291	Secret Key
2677309	8809305993978	Secret key glam romance гель для душа glam 5 glam romance perfume Body wash glam 5 1000мл	5586	Косметика (folder)/Косметика	2677291	Secret Key
2677310	8809305994012	Secret key glam romance гель для душа glam 6 glam romance perfume Body wash glam 6 1000мл	5586	Косметика (folder)/Косметика	2677291	Secret Key
2677311	8809305993046	Secret key glam romance гель для душа romance 1 glam romance perfume Body wash romance 1 1000мл	5586	Косметика (folder)/Косметика	2677291	Secret Key
2677312	8809305993060	Secret key glam romance гель для душа romance 2 glam romance perfume Body wash romance 2 1000мл	5586	Косметика (folder)/Косметика	2677291	Secret Key
2677313	8809305993220	Secret key glam romance гель для душа romance 3 glam romance perfume Body wash romance 3 1000г	5586	Косметика (folder)/Косметика	2677291	Secret Key
2677314	8809305993688	Secret key glam romance гель для душа romance 4 glam romance perfume Body wash romance 4 1000мл	5586	Косметика (folder)/Косметика	2677291	Secret Key
2677315	8809305993718	Secret key glam romance гель для душа romance 5 glam romance perfume Body wash romance 5 1000мл	5586	Косметика (folder)/Косметика	2677291	Secret Key
3747545	8809305995194	Secret key Gold racoony sens y mz 90pcs j	961989	Косметика (folder)/Уход за лицом	0	
2677316	8809305994623	Secret key gung solution маска /лица (10шт + Крем) лифтинг gung solution doctor's lifting mask pack_10p 10шт	5586	Косметика (folder)/Косметика	2677291	Secret Key
2677317	8809305994630	Secret key gung solution маска /лица (10шт + Крем) осветл. gung solution doctor's brightening mask pack_10p 10шт	5586	Косметика (folder)/Косметика	2677291	Secret Key
2677318	8809305994654	Secret key gung solution маска /лица (10шт + Крем) увлажнение gung solution doctor's aquafill mask pack_10p 10шт	5586	Косметика (folder)/Косметика	2677291	Secret Key
2677319	8809305994647	Secret key gung solution маска /лица (10шт + Крем) успокаив. gung solution doctor's calming mask pack_10p 10шт	5586	Косметика (folder)/Косметика	2677291	Secret Key
2677320	8809305994531	Secret key gung solution маска для лица ткан. лифтинг gung solution doctor's lifting mask pack 20г	5586	Косметика (folder)/Косметика	2677291	Secret Key
2677321	8809305994548	Secret key gung solution маска для лица ткан. осветляющая gung solution doctor's brightening mask pack 20г	5586	Косметика (folder)/Косметика	2677291	Secret Key
2677322	8809305994562	Secret key gung solution маска для лица ткан. увлажняющая gung solution doctor's aquafill mask pack 20г	5586	Косметика (folder)/Косметика	2677291	Secret Key
2677323	8809305994555	Secret key gung solution маска для лица ткан. успокаивающая gung solution doctor's calming mask pack 20г	5586	Косметика (folder)/Косметика	2677291	Secret Key
1031268	029069751456	Secret key holder large ddm hy-ko kc164	1714427	Строительные и отделочные материалы (folder)/Таблички и вывески	1714426	Hy-Ko
2677324	8809305993237	Secret key Honey гель для проблемной кожи лица, заживл. акне Honey bee's ac control spot remover 15мл	5586	Косметика (folder)/Косметика	2677291	Secret Key
2677325	8809305992575	Secret key Honey мыло космет. при акне Honey bee ac control soap 100г	5586	Косметика (folder)/Косметика	2677291	Secret Key
2677326	8809305993015	Secret key Honey пенка очищ. для проблемной кожи Honey bee ac control foaming cleanser 150мл	5586	Косметика (folder)/Косметика	2677291	Secret Key
2677327	8809305993022	Secret key Honey спрей для лица при акне Honey bee ac control Mist 100мл	5586	Косметика (folder)/Косметика	2677291	Secret Key
2677328	8809305994111	Secret key intense интенсивно увлажн.ночная маска с гиалуроновой кислотой intense Ice sleeping pack 100г	5586	Косметика (folder)/Косметика	2677291	Secret Key
2677329	8809305994029	Secret key intense Крем интенс.увлажн. для комбин. и жирной кожи intense moisture cream_combination to oily 50г	5586	Косметика (folder)/Косметика	2677291	Secret Key
2677330	8809305994036	Secret key intense Крем увлажняющий для нормальной и сухой кожи intense moisture cream_normal to Dry 50г	5586	Косметика (folder)/Косметика	2677291	Secret Key
2677331	8809305994807	Secret key mayu Крем для лица лечебный mayu healing facial Cream 50г	5586	Косметика (folder)/Косметика	2677291	Secret Key
2677332	8809305994180	Secret key mayu шампунь лечебный mayu healing Shampoo 240мл	5586	Косметика (folder)/Косметика	2677291	Secret Key
2677333	8809305994203	Secret key mayu эссенция для волос лечебная mayu healing Hair essence 100мл	5586	Косметика (folder)/Косметика	2677291	Secret Key
2677334	8809305992643	Secret key Milk Крем для рук с протеинами молока Milk whipping hand Cream 60мл	5586	Косметика (folder)/Косметика	2677291	Secret Key
2677335	8809305994142	Secret key Milk пенка для умывания c протеинами ослиного молока и гиалур.кисл. Milk whipping cleansing Foam 80г	5586	Косметика (folder)/Косметика	2677291	Secret Key
2677336	8809305993558	Secret key multi cell Крем для глаз ночной восстан. multi cell Night repair Eye Cream 15г	5586	Косметика (folder)/Косметика	2677291	Secret Key
2677337	8809305991813	Secret key multi cell сыворотка для лица ночн. восстан. multi cell Night repair ampoule 50мл	5586	Косметика (folder)/Косметика	2677291	Secret Key
2677338	8809305994043	Secret key Power тонер интенсивно увлажняющий мужской Power Extreme moisture toner 150мл	5586	Косметика (folder)/Косметика	2677291	Secret Key
2677339	8809305994050	Secret key Power эмульсия мощная увлажняющая мужская Power Extreme moisture emulsion 150мл	5586	Косметика (folder)/Косметика	2677291	Secret Key
2677340	8809305990984	Secret key Prestige snail Крем Престиж с муцином улитки Prestige snail + egf repairing Cream 50г	5586	Косметика (folder)/Косметика	2677291	Secret Key
2677341	8809305991257	Secret key Prestige snail сыворотка Престиж в ампуле с муцином улитки Prestige snail + egf repairing ampoule 30мл	5586	Косметика (folder)/Косметика	2677291	Secret Key
2677342	8809305993848	Secret key Prestige snail тоник-бустер Престиж с муцином улитки Prestige snail + egf repairing booster 150мл	5586	Косметика (folder)/Косметика	2677291	Secret Key
2677343	8809305992940	Secret key renew эссенция для лица со стволов. клетками renew stem cell essence 30мл	5586	Косметика (folder)/Косметика	2677291	Secret Key
2677344	8809305990601	Secret key snail Крем бб интенс. обновл. с муцином улитки snail + egf repairing b.b Cream 50мл	5586	Косметика (folder)/Косметика	2677291	Secret Key
2677345	8809305992636	Secret key snail Крем для глаз с муцином улитки snail + egf repairing Eye Cream 30г	5586	Косметика (folder)/Косметика	2677291	Secret Key
2677346	8809305990403	Secret key snail Крем для лица с муцином улитки snail + egf repairing Cream 50г	5586	Косметика (folder)/Косметика	2677291	Secret Key
2677347	8809305990793	Secret key snail Крем-гель для лица с муцином улитки snail + egf repairing Gel Cream 50г	5586	Косметика (folder)/Косметика	2677291	Secret Key
2677348	8809305990434	Secret key snail маска для лица гелевая с муцином улитки snail + egf repairing hydrogel mask 1p 30г	5586	Косметика (folder)/Косметика	2677291	Secret Key
2677349	8809305991349	Secret key snail маска для лица с муцином улитки snail+egf repairing mask pack 1 p (sheet) 20г	5586	Косметика (folder)/Косметика	2677291	Secret Key
2677350	8809305992421	Secret key snail мыло с муцином улитки snail + egf repairing soap 100г	5586	Косметика (folder)/Косметика	2677291	Secret Key
2677351	8809305991394	Secret key snail пенка для умывания с муцином улитки snail + egf repairing Foam cleanser 100мл	5586	Косметика (folder)/Косметика	2677291	Secret Key
2677352	8809305990540	Secret key snail тоник для лица с муцином улитки и egf snail + egf repairing toner 150мл	5586	Косметика (folder)/Косметика	2677291	Secret Key
2677353	8809305993510	Secret key snail эмульсия для лица с муцином улитки с egf snail + egf repairing emulsion 150мл	5586	Косметика (folder)/Косметика	2677291	Secret Key
2677354	8809242272792	Secret key snail эссенция для лица с муцином улитки snail + egf repairing essence 50мл	5586	Косметика (folder)/Косметика	2677291	Secret Key
2677355	8809305993831	Secret key snow White гель для лица и тела отбелив. snow White spot Gel 65г	5586	Косметика (folder)/Косметика	2677291	Secret Key
2677356	8809305992360	Secret key snow White Крем для лица увлаж. отбелив. snow White Cream 50г	5586	Косметика (folder)/Косметика	2677291	Secret Key
2677357	8809305994593	Secret key snow White Крем для лица увлаж. отбелив. snow White moisture Cream 50г	5586	Косметика (folder)/Косметика	2677291	Secret Key
2677358	8809305994616	Secret key snow White лосьон для тела осветляющий snow White milky Lotion	5586	Косметика (folder)/Косметика	2677291	Secret Key
2677359	8809305992377	Secret key snow White маска для лица и тела отбелив. snow White milky pack 200г	5586	Косметика (folder)/Косметика	2677291	Secret Key
2677360	8809305994579	Secret key snow White осветляющий бустер snow White Skin booster 152мл	5586	Косметика (folder)/Косметика	2677291	Secret Key
2677361	8809305994586	Secret key snow White эссенция осветляющая для лица snow White essence 30мл	5586	Косметика (folder)/Косметика	2677291	Secret Key
2677362	8809305994241	Secret key so fast бальзам для быстрого роста волос so fast Hair booster treatment 360мл	5586	Косметика (folder)/Косметика	2677291	Secret Key
2677363	8809305991714	Secret key so fast бальзам для лечения волос Премиум premium so fast treatment 250мл	5586	Косметика (folder)/Косметика	2677291	Secret Key
2677364	8809305994227	Secret key so fast маска для роста волос so fast Hair booster pack 150мл	5586	Косметика (folder)/Косметика	2677291	Secret Key
2677365	8809305994715	Secret key so fast тушь для роста и укрепления ресниц so fast lash expert mascara 7мл	5586	Косметика (folder)/Косметика	2677291	Secret Key
2677366	8809305994234	Secret key so fast шампунь для быстрого роста волос so fast Hair booster Shampoo 360мл	5586	Косметика (folder)/Косметика	2677291	Secret Key
2677367	8809305991707	Secret key so fast шампунь Премиум premium so fast Shampoo 250мл	5586	Косметика (folder)/Косметика	2677291	Secret Key
