ID	UPCEAN	Name	CategoryID	CategoryName	BrandID	BrandName
3372903	4607185660393	Кофе растворимый aura сублимированный 95г мяг/уп	19729	Продукты питания (folder)/Чай и кофе/Кофе растворимый	0	
3372904	4670016470638	Кофе растворимый barclay espresso сублимированный 100г ст/б	19729	Продукты питания (folder)/Чай и кофе/Кофе растворимый	3619902	BARCLAY'S (INTERGROUP/ MOSKVA)
3372905	4607141339738	Кофе растворимый barclay Original сублимированный 100г ст/б	19729	Продукты питания (folder)/Чай и кофе/Кофе растворимый	3619902	BARCLAY'S (INTERGROUP/ MOSKVA)
3372906	8809363800119	Кофе растворимый barista 3в1 12г м/у	19729	Продукты питания (folder)/Чай и кофе/Кофе растворимый	0	
3372907	8809363800171	Кофе растворимый barista 3в1 12г м/у #2	19729	Продукты питания (folder)/Чай и кофе/Кофе растворимый	0	
3372908	8809363800058	Кофе растворимый barista arabica натуральный сублимированный 500г мяг/уп	19729	Продукты питания (folder)/Чай и кофе/Кофе растворимый	0	
3372909	8809363800003	Кофе растворимый barista premium натуральный сублимированный 150г мяг/у	19729	Продукты питания (folder)/Чай и кофе/Кофе растворимый	0	
3372910	8809363800027	Кофе растворимый barista premium натуральный сублимированный 270г мяг/уп	19729	Продукты питания (folder)/Чай и кофе/Кофе растворимый	3620065	BARISTA(A-JIN CO./SOUTH KOREA)
3372911	8809363800010	Кофе растворимый barista premium сублимированный 40г м/у	19729	Продукты питания (folder)/Чай и кофе/Кофе растворимый	3620065	BARISTA(A-JIN CO./SOUTH KOREA)
3372912	8809363800317	Кофе растворимый barista Special 100г мяг/уп	19729	Продукты питания (folder)/Чай и кофе/Кофе растворимый	0	
2883434	4606323091679	Кофе растворимый bean great 100г ст/б	19716	Продукты питания (folder)/Чай и кофе/Кофе	3667650	GREAT BEAN
2883238	4630007982212	Кофе растворимый bean great Gold сублимиированный 100г ст/б	19716	Продукты питания (folder)/Чай и кофе/Кофе	3667650	GREAT BEAN
2883432	4630007982151	Кофе растворимый bean great сублимированный 95г мяг/уп	19716	Продукты питания (folder)/Чай и кофе/Кофе	3667650	GREAT BEAN
2883242	4630007984872	Кофе растворимый bean Rich сублимированный 95г ст/б	19716	Продукты питания (folder)/Чай и кофе/Кофе	3667650	GREAT BEAN
3372913	4607035200243	Кофе растворимый best Foods 2в1 с сахаром 12г м/у	19729	Продукты питания (folder)/Чай и кофе/Кофе растворимый	0	
3372914	4607031792780	Кофе растворимый beta caffito classico 100г ст/б	19729	Продукты питания (folder)/Чай и кофе/Кофе растворимый	135656	Beta Tea
3372915	4607031792742	Кофе растворимый beta caffito Gold 100г ст/б	19729	Продукты питания (folder)/Чай и кофе/Кофе растворимый	135656	Beta Tea
3372916	4660013685562	Кофе растворимый bizarre Gold сублимированный 95г ст/б	19729	Продукты питания (folder)/Чай и кофе/Кофе растворимый	3625124	BIZARRE (INSTANTA RUS/STRUNINO)
740526	4901201035036	Кофе растворимый Blend 114 натуральный 50г ст/б	19729	Продукты питания (folder)/Чай и кофе/Кофе растворимый	740521	UCC
3372917	4901201103858	Кофе растворимый Blend 114 натуральный 70г м/у	19729	Продукты питания (folder)/Чай и кофе/Кофе растворимый	740521	UCC
740528	4901201035043	Кофе растворимый Blend 117 натуральный 50г ст/б	19729	Продукты питания (folder)/Чай и кофе/Кофе растворимый	740521	UCC
3372918	4901201103865	Кофе растворимый Blend 117 натуральный 70г м/у	19729	Продукты питания (folder)/Чай и кофе/Кофе растворимый	740521	UCC
3372919	4901111275997	Кофе растворимый blendy мока натуральный 90г мяг/уп	19729	Продукты питания (folder)/Чай и кофе/Кофе растворимый	3372258	blendy
3372920	4901111276147	Кофе растворимый blendy натуральный 90г мяг/уп	19729	Продукты питания (folder)/Чай и кофе/Кофе растворимый	3372258	blendy
1238103	5904277113966	Кофе растворимый bon Aroma Classic ст/б 100	19729	Продукты питания (folder)/Чай и кофе/Кофе растворимый	0	
1238104	5904277114437	Кофе растворимый bon Aroma Classic ст/б 200г	19729	Продукты питания (folder)/Чай и кофе/Кофе растворимый	0	
1238105	5904277117032	Кофе растворимый bon Aroma Classic ст/б 50г	19729	Продукты питания (folder)/Чай и кофе/Кофе растворимый	0	
1238106	5904277117605	Кофе растворимый bon Aroma Gold м/у 150г	19729	Продукты питания (folder)/Чай и кофе/Кофе растворимый	3626657	BON AROMA (INSTANTA/POLAND)
1238107	5904277117599	Кофе растворимый bon Aroma Gold м/у 75г	19729	Продукты питания (folder)/Чай и кофе/Кофе растворимый	0	
1238108	5904277114444	Кофе растворимый bon Aroma Gold ст/б 100	19729	Продукты питания (folder)/Чай и кофе/Кофе растворимый	3626657	BON AROMA (INSTANTA/POLAND)
1238109	5904277113973	Кофе растворимый bon Aroma Gold ст/б 200г	19729	Продукты питания (folder)/Чай и кофе/Кофе растворимый	3626657	BON AROMA (INSTANTA/POLAND)
1238110	5904277117063	Кофе растворимый bon Aroma Gold ст/б 50г	19729	Продукты питания (folder)/Чай и кофе/Кофе растворимый	0	
2734241	4670016472182	Кофе растворимый Bourbon arabica Gold сублимированный 100г ст/б	19716	Продукты питания (folder)/Чай и кофе/Кофе	3627878	BOURBON (INTERGROUP/ MOSKVA)
3372921	4607141337383	Кофе растворимый Bourbon kenya натуральный сублимированный 100г с/б	19729	Продукты питания (folder)/Чай и кофе/Кофе растворимый	3627877	BOURBON
2883402	4607141337406	Кофе растворимый Bourbon madagascar натуральный, сублимированный 100г ст/б	19716	Продукты питания (folder)/Чай и кофе/Кофе	3627878	BOURBON (INTERGROUP/ MOSKVA)
1674787	4607141335525	Кофе растворимый Bourbon the Original натуральный 100г ст/б	19729	Продукты питания (folder)/Чай и кофе/Кофе растворимый	1674786	Бурбон
2883401	4607141336737	Кофе растворимый Bourbon Yellow Label натуральный 100г ст/б	19716	Продукты питания (folder)/Чай и кофе/Кофе	3627878	BOURBON (INTERGROUP/ MOSKVA)
3372922	5060195750826	Кофе растворимый breakfast time гранулированный 300г ст/б	19729	Продукты питания (folder)/Чай и кофе/Кофе растворимый	0	
3372923	8901030083143	Кофе растворимый brooke Bond bon Classic порошкообразный жб 100г	19729	Продукты питания (folder)/Чай и кофе/Кофе растворимый	0	
156896	8901030080777	Кофе растворимый brooke Bond bon сlassic гранулированный жб 100г	19716	Продукты питания (folder)/Чай и кофе/Кофе	31642	Brooke Bond
3372924	4670016472359	Кофе растворимый buba порошкообразный жб 95г	19729	Продукты питания (folder)/Чай и кофе/Кофе растворимый	3629085	BUBA (INTERGROUP/ MOSKVA)
30246	7610121710349	Кофе растворимый bushido Black katana натуральный сублимированный 50г ст/б	19729	Продукты питания (folder)/Чай и кофе/Кофе растворимый	30244	BUSHIDO
30247	7610121710363	Кофе растворимый bushido Light katana натуральный сублимированный 50г ст/б	19729	Продукты питания (folder)/Чай и кофе/Кофе растворимый	30244	BUSHIDO
30248	7610121710318	Кофе растворимый bushido Original натуральный 100г швейцария	19729	Продукты питания (folder)/Чай и кофе/Кофе растворимый	30244	BUSHIDO
30249	7610121710356	Кофе растворимый bushido Original натуральный сублимрованный 50г ст/б	19729	Продукты питания (folder)/Чай и кофе/Кофе растворимый	30244	BUSHIDO
3372925	5060367340251	Кофе растворимый bushido Original натуральный сублимрованный 75г мяг/уп	19729	Продукты питания (folder)/Чай и кофе/Кофе растворимый	30244	BUSHIDO
30250	7610121710295	Кофе растворимый bushido Red katana натуральный 100г швейцария	19729	Продукты питания (folder)/Чай и кофе/Кофе растворимый	30244	BUSHIDO
3372926	5060367340237	Кофе растворимый bushido Red katana натуральный сублимированный 75г мяг/уп	19729	Продукты питания (folder)/Чай и кофе/Кофе растворимый	30244	BUSHIDO
1238701	7610121710387	Кофе растворимый bushido Red katana натуральный сублимированный 85г мяг/уп	19716	Продукты питания (folder)/Чай и кофе/Кофе	30244	BUSHIDO
74101	7610121710486	Кофе растворимый bushido катана Золото натуральный 100г ст/б	19729	Продукты питания (folder)/Чай и кофе/Кофе растворимый	30244	BUSHIDO
3372927	4607141336713	Кофе растворимый Cafe creame натуральный сублимированный жб 50г	19729	Продукты питания (folder)/Чай и кофе/Кофе растворимый	3674658	intergroup Cafe creme
2734274	4607141337017	Кофе растворимый Cafe crem tanzania сублимированный 100г ст/б	19716	Продукты питания (folder)/Чай и кофе/Кофе	3674658	intergroup Cafe creme
2447926	4607141336461	Кофе растворимый Cafe creme grande reserva 100г ст/б	19716	Продукты питания (folder)/Чай и кофе/Кофе	3674658	intergroup Cafe creme
3372928	4607141337567	Кофе растворимый Cafe creme без кофеина сублимированный 100г ст/бан	19729	Продукты питания (folder)/Чай и кофе/Кофе растворимый	3674658	intergroup Cafe creme
3372929	4607141333675	Кофе растворимый Cafe creme завтрак по-бразильски натуральный сублимированный 95г	19729	Продукты питания (folder)/Чай и кофе/Кофе растворимый	3674658	intergroup Cafe creme
1238790	4607141332173	Кофе растворимый Cafe creme натуральный сублимированный 100г ст/б	19716	Продукты питания (folder)/Чай и кофе/Кофе	1238789	Кафе Крем
1780419	4607141332166	Кофе растворимый Cafe creme натуральный сублимированный 50г ст/б	19716	Продукты питания (folder)/Чай и кофе/Кофе	2734211	Биг-Торг(Маккофе)
3372930	4670016471871	Кофе растворимый Cafe creme сублимированный 45г ст/б	19729	Продукты питания (folder)/Чай и кофе/Кофе растворимый	3674658	intergroup Cafe creme
2734275	4670016471857	Кофе растворимый Cafe creme сублимированный 90г ст/б	19716	Продукты питания (folder)/Чай и кофе/Кофе	3674658	intergroup Cafe creme
2883552	8057288870148	Кофе растворимый Cafe italo esclusivo 100г ст/б	19716	Продукты питания (folder)/Чай и кофе/Кофе	0	
3372931	8809300145051	Кофе растворимый Cafe maxpresso сублимированный 50г м/уп	19729	Продукты питания (folder)/Чай и кофе/Кофе растворимый	0	
3372932	7892222910761	Кофе растворимый Cafe pele premium натуральный жб 100г	19729	Продукты питания (folder)/Чай и кофе/Кофе растворимый	3630199	CAFE PELE
3372933	7892222913243	Кофе растворимый Cafe pele premium натуральный жб 190г	19729	Продукты питания (folder)/Чай и кофе/Кофе растворимый	3630199	CAFE PELE
3372934	7892222914264	Кофе растворимый Cafe pele premium натуральный жб 47.5г	19729	Продукты питания (folder)/Чай и кофе/Кофе растворимый	3630199	CAFE PELE
30474	7892222500092	Кофе растворимый Cafe pele натуральный жб 100г	19729	Продукты питания (folder)/Чай и кофе/Кофе растворимый	30470	ПЕЛЕ
30476	7892222110024	Кофе растворимый Cafe pele порошкообразный жб 50г	19729	Продукты питания (folder)/Чай и кофе/Кофе растворимый	30470	ПЕЛЕ
3372935	8809300143958	Кофе растворимый Cafe Riche arabika 100 95г ст/б	19729	Продукты питания (folder)/Чай и кофе/Кофе растворимый	3630213	CAFE RICH
3372936	4631111188828	Кофе растворимый Cafe teria 2г м/у	19729	Продукты питания (folder)/Чай и кофе/Кофе растворимый	0	
3372937	5904277113553	Кофе растворимый cafed,or гранулированный 300г ст/б	19729	Продукты питания (folder)/Чай и кофе/Кофе растворимый	0	
1238792	4751009700014	Кофе растворимый cafemania сублимированный 100г ст/бан	19716	Продукты питания (folder)/Чай и кофе/Кофе	3630237	CAFEMANIA
3372938	5060195750741	Кофе растворимый canelly Gold натуральный 100г ст/б	19729	Продукты питания (folder)/Чай и кофе/Кофе растворимый	0	
3372939	5060195751342	Кофе растворимый canelly Gold натуральный 200г ст/б	19729	Продукты питания (folder)/Чай и кофе/Кофе растворимый	0	
3372940	5060195750765	Кофе растворимый canelly Gold натуральный гранулированный 100г ст/б	19729	Продукты питания (folder)/Чай и кофе/Кофе растворимый	0	
3372941	5060195751359	Кофе растворимый canelly Gold натуральный гранулированный 200г ст/б	19729	Продукты питания (folder)/Чай и кофе/Кофе растворимый	0	
2734159	4607001776628	Кофе растворимый cart noire натуральный сублимированный 1.8г мяг/уп	19716	Продукты питания (folder)/Чай и кофе/Кофе	19709	Carte Noire
3372942	8714599516966	Кофе растворимый cart noire натуральный сублимированный 1.8г мяг/уп #2	19729	Продукты питания (folder)/Чай и кофе/Кофе растворимый	19709	Carte Noire
1238128	7622210037503	Кофе растворимый carte noire 190г+чашка с блюдцем	19729	Продукты питания (folder)/Чай и кофе/Кофе растворимый	19709	Carte Noire
2237892	7622210081612	Кофе растворимый carte noire millicano натуральный сублимированный 95г ст/б	19729	Продукты питания (folder)/Чай и кофе/Кофе растворимый	19709	Carte Noire
2237891	7622210081650	Кофе растворимый carte noire millicano с молотым 150г мяг/уп	19729	Продукты питания (folder)/Чай и кофе/Кофе растворимый	19709	Carte Noire
2883207	4607001777304	Кофе растворимый carte noire Original натуральный 150г мяг/уп	19716	Продукты питания (folder)/Чай и кофе/Кофе	19709	Carte Noire
740607	7622300594381	Кофе растворимый carte noire Original натуральный 2г мяг/уп	19729	Продукты питания (folder)/Чай и кофе/Кофе растворимый	19709	Carte Noire
3372943	4607001777397	Кофе растворимый carte noire Original натуральный 47.5г ст/б	19729	Продукты питания (folder)/Чай и кофе/Кофе растворимый	19709	Carte Noire
2883209	4607001777007	Кофе растворимый carte noire Original натуральный 75г м/у	19716	Продукты питания (folder)/Чай и кофе/Кофе	19709	Carte Noire
550124	7622210044297	Кофе растворимый carte noire натуральный сублимированный 75г мяг/уп	19716	Продукты питания (folder)/Чай и кофе/Кофе	19709	Carte Noire
2786499	4607001777199	Кофе растворимый carte noire натуральный сублимированный 95г ст/б	1	Неклассифицированные/default	19709	Carte Noire
2734161	4607001776536	Кофе растворимый carte noire оригинал сублимированный 38г м/у	19716	Продукты питания (folder)/Чай и кофе/Кофе	19709	Carte Noire
30334	7622300248758	Кофе растворимый carte noire сублимированный, 95г, стеклянная банка, ш/к 48758	19716	Продукты питания (folder)/Чай и кофе/Кофе	19709	Carte Noire
550123	7622210044273	Кофе растворимый carte noire, сублимированный, 150г, мягкая упаковка, 37802	19729	Продукты питания (folder)/Чай и кофе/Кофе растворимый	19709	Carte Noire
30329	7622300248840	Кофе растворимый carte noire, сублимированный, 190г, стеклянная банка, 22513	19729	Продукты питания (folder)/Чай и кофе/Кофе растворимый	19709	Carte Noire
2883527	4660013683933	Кофе растворимый casa latina Max Mild порошкообразный 65г ст/б	19716	Продукты питания (folder)/Чай и кофе/Кофе	3631957	CASA LATINA (GRAND-NN/N.NOVGOROD)
2883530	4660013683360	Кофе растворимый casa latina сублимированный 85г ст/б	19716	Продукты питания (folder)/Чай и кофе/Кофе	3631957	CASA LATINA (GRAND-NN/N.NOVGOROD)
1238139	8032872605030	Кофе растворимый cellini порционное 20шт	19729	Продукты питания (folder)/Чай и кофе/Кофе растворимый	0	
3372944	4607003046682	Кофе растворимый cofelle натуральный 100г м/у	19729	Продукты питания (folder)/Чай и кофе/Кофе растворимый	3637069	COFELLE (CHAYNIY MIR GK/OMSK)
2883563	4607123912171	Кофе растворимый coffeeclub Classic 100г мяг/уп	19716	Продукты питания (folder)/Чай и кофе/Кофе	3637101	COFFEE CLUB
3372945	4607123911969	Кофе растворимый coffeeclub Classic 2в1 12.5г мяг/уп	19729	Продукты питания (folder)/Чай и кофе/Кофе растворимый	3637101	COFFEE CLUB
2883562	4607123912690	Кофе растворимый coffeeclub Classic гранулированный жб 100г	19716	Продукты питания (folder)/Чай и кофе/Кофе	0	
1674812	4607123912683	Кофе растворимый coffeeclub Classic гранулированный жб 50г	19716	Продукты питания (folder)/Чай и кофе/Кофе	3637101	COFFEE CLUB
287390	4607123912188	Кофе растворимый coffeeclub Classic натуральный гранулированный 2г мяг/уп	19716	Продукты питания (folder)/Чай и кофе/Кофе	30578	ЯКОБС
3372946	4607123914243	Кофе растворимый coffeeclub Diamond premium натуральный 100г ст/б	19729	Продукты питания (folder)/Чай и кофе/Кофе растворимый	3637101	COFFEE CLUB
3372947	4607123913826	Кофе растворимый coffeeclub Diamond premium натуральный сублимированный 95г	19729	Продукты питания (folder)/Чай и кофе/Кофе растворимый	3637101	COFFEE CLUB
1238799	4607123913840	Кофе растворимый coffeeclub fire espesso 95г мяг/уп	19716	Продукты питания (folder)/Чай и кофе/Кофе	3637101	COFFEE CLUB
3372948	4607123914236	Кофе растворимый coffeeclub fire espresso 100г ст/б	19729	Продукты питания (folder)/Чай и кофе/Кофе растворимый	3637101	COFFEE CLUB
1238800	4607123913857	Кофе растворимый coffeeclub fire espresso сублимированный 170г м/у	19716	Продукты питания (folder)/Чай и кофе/Кофе	3637101	COFFEE CLUB
3372949	4607123912836	Кофе растворимый coffeeclub selected натуральный гранулированный 100г мяг/уп	19729	Продукты питания (folder)/Чай и кофе/Кофе растворимый	3637101	COFFEE CLUB
3372950	4607123912829	Кофе растворимый coffeeclub selekted гранулированный жб 100г	19729	Продукты питания (folder)/Чай и кофе/Кофе растворимый	3637101	COFFEE CLUB
3372951	4607123912812	Кофе растворимый coffeeclub selekted гранулированный жб 50г	19729	Продукты питания (folder)/Чай и кофе/Кофе растворимый	3637101	COFFEE CLUB
3372952	4607123914229	Кофе растворимый coffeeclub Sunshine Gold натуральный 100г ст/б	19729	Продукты питания (folder)/Чай и кофе/Кофе растворимый	3637101	COFFEE CLUB
1238797	4607123913819	Кофе растворимый coffeeclub Sunshine Gold натуральный сублимированный 170г	19716	Продукты питания (folder)/Чай и кофе/Кофе	3637101	COFFEE CLUB
1674745	4607123912270	Кофе растворимый coffeeclub айриш крим 3в1 20г мяг/уп	19716	Продукты питания (folder)/Чай и кофе/Кофе	3637101	COFFEE CLUB
2883557	4607123912119	Кофе растворимый coffeeclub амаретто 3в1 20г мяг/уп	19716	Продукты питания (folder)/Чай и кофе/Кофе	3637101	COFFEE CLUB
2883558	4607123912140	Кофе растворимый coffeeclub карамель 3в1 20г мяг/уп	19716	Продукты питания (folder)/Чай и кофе/Кофе	3637101	COFFEE CLUB
2883555	4607123911792	Кофе растворимый coffeeclub классик 3в1 20г мяг/уп	19716	Продукты питания (folder)/Чай и кофе/Кофе	3637101	COFFEE CLUB
3372953	4607123911853	Кофе растворимый coffeeclub классик 3в1 20г мяг/уп #2	19729	Продукты питания (folder)/Чай и кофе/Кофе растворимый	3637101	COFFEE CLUB
1674751	4607123911891	Кофе растворимый coffeeclub крепкий 3в1 20г мяг/уп	19716	Продукты питания (folder)/Чай и кофе/Кофе	3637101	COFFEE CLUB
2883556	4607123912058	Кофе растворимый coffeeclub лесной орех 3в1 20г мяг/уп	19716	Продукты питания (folder)/Чай и кофе/Кофе	3637101	COFFEE CLUB
3372954	4607123912072	Кофе растворимый coffeeclub лесной орех 3в1 20г мяг/уп #2	19729	Продукты питания (folder)/Чай и кофе/Кофе растворимый	0	
287391	4607123911860	Кофе растворимый coffeeclub мягкий 3в1 20г мяг/уп	19716	Продукты питания (folder)/Чай и кофе/Кофе	3637101	COFFEE CLUB
