ID	UPCEAN	Name	CategoryID	CategoryName	BrandID	BrandName
1759899	8002235473552	Вино Merlot венето терре палладиане зонин красн сух 12% 700мл	22133	Продукты питания (folder)/Алкогольные напитки/Вино (folder)/Вино	3790214	САРТОРИ
3791579	8004300252659	Вино Merlot венетт. красн сух 12% 750мл	22133	Продукты питания (folder)/Алкогольные напитки/Вино (folder)/Вино	3791578	МЕРЛО
2426248	8007880215809	Вино Merlot венец. красн сух 12%750мл геогр.указ.	22133	Продукты питания (folder)/Алкогольные напитки/Вино (folder)/Вино	0	
3289597	4620016190920	Вино Merlot вечерний Крым красное полусладк 10-12% 750мл ст/б	22133	Продукты питания (folder)/Алкогольные напитки/Вино (folder)/Вино	0	
1958063	4840463007569	Вино Merlot вин.натур. красное п/сухое 750мл	22133	Продукты питания (folder)/Алкогольные напитки/Вино (folder)/Вино	0	
1958064	4840463006852	Вино Merlot вин.натур. красное полусладк 750мл	22133	Продукты питания (folder)/Алкогольные напитки/Вино (folder)/Вино	0	
151114	4606651000985	Вино Merlot винелла красн полусладк 10.5% 700мл	22133	Продукты питания (folder)/Алкогольные напитки/Вино (folder)/Вино	150299	винелла 921
2854279	4607125540891	Вино Merlot винелла красн полусладк 3.0	22133	Продукты питания (folder)/Алкогольные напитки/Вино (folder)/Вино	0	
151115	4606651002095	Вино Merlot винелла красн сух 9.5-11.5 3.0	22133	Продукты питания (folder)/Алкогольные напитки/Вино (folder)/Вино	0	
2854280	4607159663283	Вино Merlot винникоф красн полусладк 700мл	22133	Продукты питания (folder)/Алкогольные напитки/Вино (folder)/Вино	0	
2227249	4670015950353	Вино Merlot винный дом фотисаль красн/сух 0.75 11% 1/6	22133	Продукты питания (folder)/Алкогольные напитки/Вино (folder)/Вино	0	
2854281	3800204430743	Вино Merlot виноградец красн полусладк 1.0	1759169	Продукты питания (folder)/Алкогольные напитки/Вино (folder)/Вина Болгарии	0	
2854282	3800204430798	Вино Merlot виноградец красн полусладк 2.0	1759169	Продукты питания (folder)/Алкогольные напитки/Вино (folder)/Вина Болгарии	0	
1194491	3800003413633	Вино Merlot винтегра красн сух 1л 9% /болгария/	1759169	Продукты питания (folder)/Алкогольные напитки/Вино (folder)/Вина Болгарии	0	
1194492	4840454004317	Вино Merlot вльс цветов красн полусладк 11% 750мл	22133	Продукты питания (folder)/Алкогольные напитки/Вино (folder)/Вино	0	
151160	4840526003682	Вино Merlot выдержанное, географического наименования южного региона, каушанского района красное сухое (молдова) 750мл	22133	Продукты питания (folder)/Алкогольные напитки/Вино (folder)/Вино	150380	ВЕДА МАРКЕТ
2227250	3531380033922	Вино Merlot вэн де франс красн/полусладк 0.75 15% 1/6	22133	Продукты питания (folder)/Алкогольные напитки/Вино (folder)/Вино	0	
3289599	4630017483068	Вино Merlot гарлинг п сл красное 750мл	22133	Продукты питания (folder)/Алкогольные напитки/Вино (folder)/Вино	0	
3289600	4840044004963	Вино Merlot гарлинг п сл красное 750мл #2	22133	Продукты питания (folder)/Алкогольные напитки/Вино (folder)/Вино	0	
2720612	4630017481262	Вино Merlot географического наименования красное сухое 12.5% 750мл ст/б	22133	Продукты питания (folder)/Алкогольные напитки/Вино (folder)/Вино	0	
1194493	4670000686694	Вино Merlot гранд бокал красн полусладк 10-12% графин 0.800	22133	Продукты питания (folder)/Алкогольные напитки/Вино (folder)/Вино	0	
151118	4840068001924	Вино Merlot гранд/хаус красн сух 2.0	22133	Продукты питания (folder)/Алкогольные напитки/Вино (folder)/Вино	150508	ЛЯ ВИНЧИ
151117	4840090001435	Вино Merlot гранд/хаус красн сух 700мл	22133	Продукты питания (folder)/Алкогольные напитки/Вино (folder)/Вино	150508	ЛЯ ВИНЧИ
283025	4600446001324	Вино Merlot грапелабел красн сух 0.7л 10-12% /ммвз/Россия/	22133	Продукты питания (folder)/Алкогольные напитки/Вино (folder)/Вино	3791578	МЕРЛО
3289601	4670005100485	Вино Merlot даглар красное сухое 12% 750мл	22133	Продукты питания (folder)/Алкогольные напитки/Вино (folder)/Вино	0	
44986	5029188003820	Вино Merlot даймонд грув красн сух 13% 750мл	22133	Продукты питания (folder)/Алкогольные напитки/Вино (folder)/Вино	0	
3289602	4650064810266	Вино Merlot де пассио красное полусладк 10-12% 0.7л стекло	22133	Продукты питания (folder)/Алкогольные напитки/Вино (folder)/Вино	0	
44987	8002645539060	Вино Merlot дел венето красн сух 11.5% 750мл	22470	Продукты питания (folder)/Алкогольные напитки/Вино (folder)/Вина Италии	0	
1760161	8000160613319	Вино Merlot делле венец. красн сух 12.5% 750мл	22133	Продукты питания (folder)/Алкогольные напитки/Вино (folder)/Вино	3791580	ЛАМБЕРТИ
3289603	8008820152437	Вино Merlot делле венецие ронзони красное сухое 11.5% 750мл стекло	22133	Продукты питания (folder)/Алкогольные напитки/Вино (folder)/Вино	0	
151119	8005357041296	Вино Merlot делле венеция красн сух Италия 750мл	22133	Продукты питания (folder)/Алкогольные напитки/Вино (folder)/Вино	150315	МБГ
2854283	5990500777166	Вино Merlot джулианис красн сух 750мл	22133	Продукты питания (folder)/Алкогольные напитки/Вино (folder)/Вино	0	
2426171	4840155002544	Вино Merlot дикая роза красн полусладк 11% 750мл	22133	Продукты питания (folder)/Алкогольные напитки/Вино (folder)/Вино	0	
2854284	4610001601128	Вино Merlot Дионис красн полусладк 2.0	22133	Продукты питания (folder)/Алкогольные напитки/Вино (folder)/Вино	0	
2854285	4610001601227	Вино Merlot Дионис красн сух 2.0	22133	Продукты питания (folder)/Алкогольные напитки/Вино (folder)/Вино	0	
44999	7804414381594	Вино Merlot Долина колчагуа резерва красн сух 750мл 14% /Чили/	282291	Продукты питания (folder)/Алкогольные напитки/Вино (folder)/Вина Чили	3736375	ЛУИС ФЕЛИПЕ ЭДВАРДС
2854072	3800016680022	Вино Merlot домашнее столов красное полусладк 10-12% 750мл стбут	1759169	Продукты питания (folder)/Алкогольные напитки/Вино (folder)/Вина Болгарии	0	
3289604	4620018473632	Вино Merlot душа кавказа столов сухое красное 11% 750мл ст/б	22133	Продукты питания (folder)/Алкогольные напитки/Вино (folder)/Вино	0	
2426172	3120580802089	Вино Merlot дюк де монфлори 12% 750мл	22133	Продукты питания (folder)/Алкогольные напитки/Вино (folder)/Вино	0	
1194495	4699301415413	Вино Merlot дюльбер красн сух 750мл 11-13% /Россия/	22133	Продукты питания (folder)/Алкогольные напитки/Вино (folder)/Вино	0	
1194496	4699301415406	Вино Merlot дюльберг красн полусладк 750мл 10-12% /Россия/	22133	Продукты питания (folder)/Алкогольные напитки/Вино (folder)/Вино	0	
2426173	4840358007131	Вино Merlot евровин красн сл 10-12% 750мл	22133	Продукты питания (folder)/Алкогольные напитки/Вино (folder)/Вино	0	
151120	3800024903779	Вино Merlot евровин красн сух т/п 9-11% 2.0	1759169	Продукты питания (folder)/Алкогольные напитки/Вино (folder)/Вина Болгарии	150257	ЭКСПО ВИН 207
2854286	3800008360024	Вино Merlot зол кувшин красн полусладк 0.700	1759169	Продукты питания (folder)/Алкогольные напитки/Вино (folder)/Вина Болгарии	0	
151122	4602828004442	Вино Merlot зол/кол красн сух 10-12% 0.700	22133	Продукты питания (folder)/Алкогольные напитки/Вино (folder)/Вино	0	
1194497	460282800444	Вино Merlot зол/кол красн/сух 10-12% 0.700	22133	Продукты питания (folder)/Алкогольные напитки/Вино (folder)/Вино	0	
2426174	4840267003705	Вино Merlot зол/фонд красн сух 11% 750мл	22133	Продукты питания (folder)/Алкогольные напитки/Вино (folder)/Вино	0	
2426175	380008220090	Вино Merlot и памид красн полусладк 11-12% 1.500	1759169	Продукты питания (folder)/Алкогольные напитки/Вино (folder)/Вина Болгарии	0	
44988	3192371011734	Вино Merlot ивон мо красн сух 12.5% 750мл	22133	Продукты питания (folder)/Алкогольные напитки/Вино (folder)/Вино	0	
151123	4840084001427	Вино Merlot изумрудный город красн псух 750мл	22133	Продукты питания (folder)/Алкогольные напитки/Вино (folder)/Вино	0	
1818356	4840403004061	Вино Merlot империал вин полусладк красн 12% 0.7л стекло	688533	Продукты питания (folder)/Алкогольные напитки/Вино (folder)/Вина России и ближнего зарубежья	0	
44989	4840363001162	Вино Merlot инвеком красн сух 9-12% 750мл	22133	Продукты питания (folder)/Алкогольные напитки/Вино (folder)/Вино	0	
2426176	4840364000423	Вино Merlot исирлиана красн полусладк лавина 9% 0.700	22133	Продукты питания (folder)/Алкогольные напитки/Вино (folder)/Вино	0	
2426249	3120580801921	Вино Merlot каб-сов дюк де монфлори 12% 750мл	22133	Продукты питания (folder)/Алкогольные напитки/Вино (folder)/Вино	0	
3791581	3500610033674	Вино Merlot каберне шене п.с.с 9-15 750мл	22133	Продукты питания (folder)/Алкогольные напитки/Вино (folder)/Вино	382491	J.P.Chenet
2426177	4840045000797	Вино Merlot казанова красн полусладк 9.5% 1.500	22133	Продукты питания (folder)/Алкогольные напитки/Вино (folder)/Вино	0	
3289605	4607116234617	Вино Merlot камон сава красное полусладк 10-11% 1л	22133	Продукты питания (folder)/Алкогольные напитки/Вино (folder)/Вино	0	
690383	8437007139785	Вино Merlot кастилья. каса дель тиемпо красн сух (Испания) 750мл	22133	Продукты питания (folder)/Алкогольные напитки/Вино (folder)/Вино	3631937	CASA DEL TIEMPO
3289606	4623721180996	Вино Merlot качинское красное сухое 11.5-13.5% 750мл стекло	22133	Продукты питания (folder)/Алкогольные напитки/Вино (folder)/Вино	0	
151146	4840254000595	Вино Merlot классик красн п/сух 10-12% 750мл	22133	Продукты питания (folder)/Алкогольные напитки/Вино (folder)/Вино	0	
3289607	4840463004766	Вино Merlot классик красное полусладк 10-12% 750мл стекло	22133	Продукты питания (folder)/Алкогольные напитки/Вино (folder)/Вино	0	
3289608	4630017482009	Вино Merlot классик сухое красное гн 12.9% 750мл стбут	22133	Продукты питания (folder)/Алкогольные напитки/Вино (folder)/Вино	0	
2426178	4840249003570	Вино Merlot Коллекция виста красн п/сух 11.5% 750мл	22133	Продукты питания (folder)/Алкогольные напитки/Вино (folder)/Вино	0	
3289609	4840342015715	Вино Merlot комплимент столов красн полусл 10% 750мл	22133	Продукты питания (folder)/Алкогольные напитки/Вино (folder)/Вино	0	
1193875	4820013071349	Вино Merlot контари красное полусладк столов 10.5-12% 750мл ст/б	22133	Продукты питания (folder)/Алкогольные напитки/Вино (folder)/Вино	0	
1191638	3800007812630	Вино Merlot красн полусладк 0.7 (болгария)	1759169	Продукты питания (folder)/Алкогольные напитки/Вино (folder)/Вина Болгарии	0	
283036	4607168070522	Вино Merlot красн полусладк 0.7л 10% /Россия/афанасов/	22133	Продукты питания (folder)/Алкогольные напитки/Вино (folder)/Вино	0	
3289619	4840013006677	Вино Merlot красн полусладк 0.7л 11%	22133	Продукты питания (folder)/Алкогольные напитки/Вино (folder)/Вино	0	
3289613	4840044004512	Вино Merlot красн полусладк 0.7л гарлинг/сп унгень-вин АО/молдова 400	22133	Продукты питания (folder)/Алкогольные напитки/Вино (folder)/Вино	0	
2854290	4607136134782	Вино Merlot красн полусладк 1.0	22133	Продукты питания (folder)/Алкогольные напитки/Вино (folder)/Вино	0	
2854293	4605528001285	Вино Merlot красн полусладк 10-12% 0.700	22133	Продукты питания (folder)/Алкогольные напитки/Вино (folder)/Вино	0	
2854294	4605654005324	Вино Merlot красн полусладк 10-12% 0.700 #2	22133	Продукты питания (folder)/Алкогольные напитки/Вино (folder)/Вино	0	
1194499	4600632055605	Вино Merlot красн полусладк 10-12% 0.75 Коллекция старых вин	22133	Продукты питания (folder)/Алкогольные напитки/Вино (folder)/Вино	0	
1194502	4840403001336	Вино Merlot красн полусладк 10-12% 0.7л империал вин	22133	Продукты питания (folder)/Алкогольные напитки/Вино (folder)/Вино	0	
3289615	4602451011985	Вино Merlot красн полусладк 10-12% 0.7л ишимбай	22133	Продукты питания (folder)/Алкогольные напитки/Вино (folder)/Вино	0	
3289618	4603110090785	Вино Merlot красн полусладк 10-12% 0.7л Россия	22133	Продукты питания (folder)/Алкогольные напитки/Вино (folder)/Вино	0	
3289616	4670000683518	Вино Merlot красн полусладк 10-12% 0.7л Россия #2	22133	Продукты питания (folder)/Алкогольные напитки/Вино (folder)/Вино	0	
1194503	3800008344222	Вино Merlot красн полусладк 10-12% 0.7л фракия виньярдс	1759169	Продукты питания (folder)/Алкогольные напитки/Вино (folder)/Вина Болгарии	0	
2854295	4610001600695	Вино Merlot красн полусладк 10-12% 1.0	22133	Продукты питания (folder)/Алкогольные напитки/Вино (folder)/Вино	0	
2720605	4660003843873	Вино Merlot красн полусладк 10-12% 1.0 втд	22133	Продукты питания (folder)/Алкогольные напитки/Вино (folder)/Вино	0	
2426183	4840463004636	Вино Merlot красн полусладк 10-12% 1л 7люб. розов	22133	Продукты питания (folder)/Алкогольные напитки/Вино (folder)/Вино	0	
1194508	4601129405453	Вино Merlot красн полусладк 10-12% 1л крымский винный завод 400	22133	Продукты питания (folder)/Алкогольные напитки/Вино (folder)/Вино	0	
151134	3800003407021	Вино Merlot красн полусладк 10-12% 2.025	1759169	Продукты питания (folder)/Алкогольные напитки/Вино (folder)/Вина Болгарии	150765	ЕВРОСЕРВИС
2426186	3800008359257	Вино Merlot красн полусладк 10-12% 2.025 #2	1759169	Продукты питания (folder)/Алкогольные напитки/Вино (folder)/Вина Болгарии	0	
2426229	4660003840209	Вино Merlot красн полусладк 10-12% 2л винный тд	22133	Продукты питания (folder)/Алкогольные напитки/Вино (folder)/Вино	0	
175218	4607154480267	Вино Merlot красн полусладк 10-12% 700мл	22133	Продукты питания (folder)/Алкогольные напитки/Вино (folder)/Вино	175214	ПКФ Северский/Виноградная гроздь
2854296	4601784000567	Вино Merlot красн полусладк 10-12% 700мл #2	22133	Продукты питания (folder)/Алкогольные напитки/Вино (folder)/Вино	0	
2426230	4605883003689	Вино Merlot красн полусладк 10-12% 750мл (зебра)	22133	Продукты питания (folder)/Алкогольные напитки/Вино (folder)/Вино	0	
2854297	4840042010881	Вино Merlot красн полусладк 10-12% 750мл кувш.	22133	Продукты питания (folder)/Алкогольные напитки/Вино (folder)/Вино	0	
1194509	4620002050290	Вино Merlot красн полусладк 10-12% 750мл кшв	22133	Продукты питания (folder)/Алкогольные напитки/Вино (folder)/Вино	0	
3289620	4841451000432	Вино Merlot красн полусладк 10-12% 750мл стбут	22133	Продукты питания (folder)/Алкогольные напитки/Вино (folder)/Вино	0	
175004	4601129402032	Вино Merlot красн полусладк 10.5% 0.7л краснодарский край 400	22133	Продукты питания (folder)/Алкогольные напитки/Вино (folder)/Вино	174997	Крымский винзавод
2854292	4840358007186	Вино Merlot красн полусладк 10.5% 750мл	22133	Продукты питания (folder)/Алкогольные напитки/Вино (folder)/Вино	0	
151143	3800003406413	Вино Merlot красн полусладк 10.5-12% 750мл	1759169	Продукты питания (folder)/Алкогольные напитки/Вино (folder)/Вина Болгарии	149724	Т.Д. АРОМА
3289621	4840454006786	Вино Merlot красн полусладк 11% 750мл стбут	22133	Продукты питания (folder)/Алкогольные напитки/Вино (folder)/Вино	0	
3289610	4840044006226	Вино Merlot красн полусладк 12% 0.7л стекло	22133	Продукты питания (folder)/Алкогольные напитки/Вино (folder)/Вино	0	
2854298	4840267003903	Вино Merlot красн полусладк 3.0	22133	Продукты питания (folder)/Алкогольные напитки/Вино (folder)/Вино	0	
1194510	3800127811599	Вино Merlot красн полусладк 3.0л 10-12% златен склон /болгария/	1759169	Продукты питания (folder)/Алкогольные напитки/Вино (folder)/Вина Болгарии	0	
283038	4840454005994	Вино Merlot красн полусладк 3.0л 11% /молдова/дк-интертрейд/	22133	Продукты питания (folder)/Алкогольные напитки/Вино (folder)/Вино	0	
283037	4840042006174	Вино Merlot красн полусладк 700мл	1759450	Продукты питания (folder)/Алкогольные напитки/Вино (folder)/Вина Молдовы	0	
283034	4840454007462	Вино Merlot красн полусладк 750мл 11% /лоза молдавии/	22133	Продукты питания (folder)/Алкогольные напитки/Вино (folder)/Вино	0	
283035	5949475000465	Вино Merlot красн полусладк 750мл 11% /Румыния/	22133	Продукты питания (folder)/Алкогольные напитки/Вино (folder)/Вино	0	
2426187	4840368000412	Вино Merlot красн полусладк 9-11% развин пак 0.700	22133	Продукты питания (folder)/Алкогольные напитки/Вино (folder)/Вино	0	
3289617	3800082701126	Вино Merlot красн полусладк 9-11%.0.7л София	1759169	Продукты питания (folder)/Алкогольные напитки/Вино (folder)/Вина Болгарии	0	
2426231	4814370000098	Вино Merlot красн полусладк 9-13% 750мл (бут)	22133	Продукты питания (folder)/Алкогольные напитки/Вино (folder)/Вино	0	
173718	3800008333516	Вино Merlot красн полусладк s10-12% 750мл 12шт	1759169	Продукты питания (folder)/Алкогольные напитки/Вино (folder)/Вина Болгарии	173675	Винекс Преслав АД
173719	3800008333592	Вино Merlot красн полусладк s10-12% 750мл 6шт	1759169	Продукты питания (folder)/Алкогольные напитки/Вино (folder)/Вина Болгарии	173675	Винекс Преслав АД
1194518	4670007930035	Вино Merlot красн полусладк алк. 10-12% лазурный 1.000	22133	Продукты питания (folder)/Алкогольные напитки/Вино (folder)/Вино	0	
2426188	4840358005854	Вино Merlot красн полусладк бокал аскони 9-11% 1.000	22133	Продукты питания (folder)/Алкогольные напитки/Вино (folder)/Вино	0	
151135	3800008270286	Вино Merlot красн полусладк болг/ст.изба 10-12% 2.025	1759169	Продукты питания (folder)/Алкогольные напитки/Вино (folder)/Вина Болгарии	0	
2426189	3800049514158	Вино Merlot красн полусладк болгария 10.5-12% 750мл	1759169	Продукты питания (folder)/Алкогольные напитки/Вино (folder)/Вина Болгарии	0	
2426190	380011113143	Вино Merlot красн полусладк булгара 10-12% 750мл	1759169	Продукты питания (folder)/Алкогольные напитки/Вино (folder)/Вина Болгарии	0	
2426191	4840363003210	Вино Merlot красн полусладк бутояш 9% 750мл	22133	Продукты питания (folder)/Алкогольные напитки/Вино (folder)/Вино	0	
2426192	4840358004307	Вино Merlot красн полусладк вертикаль 9-11% 750мл	22133	Продукты питания (folder)/Алкогольные напитки/Вино (folder)/Вино	0	
151127	4606651002552	Вино Merlot красн полусладк винелла 11% 3.0	22133	Продукты питания (folder)/Алкогольные напитки/Вино (folder)/Вино	0	
2426193	4840234000669	Вино Merlot красн полусладк виниа барх 9-12% 750мл	22133	Продукты питания (folder)/Алкогольные напитки/Вино (folder)/Вино	0	
