ID	UPCEAN	Name	CategoryID	CategoryName	BrandID	BrandName
1672741	4770959440764	Колбаса сырокопченая деликатесная 220г	265594	Продукты питания (folder)/Колбасные изделия (folder)/Колбаса сырокопченая	0	
67552	4606456002153	Колбаса сырокопченая деликатесная 350г компо	265594	Продукты питания (folder)/Колбасные изделия (folder)/Колбаса сырокопченая	67487	Компо
2956454	8424944600171	Колбаса сырокопченая деликатесная 350г компо #2	265594	Продукты питания (folder)/Колбасные изделия (folder)/Колбаса сырокопченая	67487	Компо
2874753	4605025008282	Колбаса сырокопченая деликатесная по-черкизовски б/о вак уп 0.38кг черкизово к2.28	265594	Продукты питания (folder)/Колбасные изделия (folder)/Колбаса сырокопченая	0	
2731157	4610009511153	Колбаса сырокопченая деликатесная по-черкизовски б/о вак уп шт 0.3кг*8 черкизово	265594	Продукты питания (folder)/Колбасные изделия (folder)/Колбаса сырокопченая	0	
2874754	4605025018731	Колбаса сырокопченая деликатесная по-черкизовски бо ву шт 0.38кг черкизово k2.28	265594	Продукты питания (folder)/Колбасные изделия (folder)/Колбаса сырокопченая	0	
2731155	4610009511177	Колбаса сырокопченая деликатесная по-черкизовски нарез фиб з/а шт 0.1кг п1 черкизово	265594	Продукты питания (folder)/Колбасные изделия (folder)/Колбаса сырокопченая	0	
2874755	4680039990020	Колбаса сырокопченая деликатесная. мясной продукт катег а охлажденный	265594	Продукты питания (folder)/Колбасные изделия (folder)/Колбаса сырокопченая	0	
729734	4770118401957	Колбаса сырокопченая деревенская газ 200г биовела	265594	Продукты питания (folder)/Колбасные изделия (folder)/Колбаса сырокопченая	67498	Биовела
2916401	4603802053258	Колбаса сырокопченая деревенский завтрак провинциальная 1 сорт вак уп 250г	1	Неклассифицированные/default	0	
3354574	4606511091153	Колбаса сырокопченая диетпродукт салями фестивальная вак уп 200г	265594	Продукты питания (folder)/Колбасные изделия (folder)/Колбаса сырокопченая	0	
2861226	4660016022081	Колбаса сырокопченая дмитровская (нарезка) 100г	1	Неклассифицированные/default	0	
3354575	4607046563733	Колбаса сырокопченая дмитрогорская салями венгерская 250г вак/упак	265594	Продукты питания (folder)/Колбасные изделия (folder)/Колбаса сырокопченая	0	
3354576	4607046565805	Колбаса сырокопченая дмитрогорский продукт Престиж вак уп 250г	265594	Продукты питания (folder)/Колбасные изделия (folder)/Колбаса сырокопченая	0	
3354577	4607046565713	Колбаса сырокопченая дмитрогорский продукт сервилат элитный вак уп 250г	265594	Продукты питания (folder)/Колбасные изделия (folder)/Колбаса сырокопченая	0	
3354578	4607046565645	Колбаса сырокопченая дмитрогорский продукт юбилейная вак уп 250г	265594	Продукты питания (folder)/Колбасные изделия (folder)/Колбаса сырокопченая	0	
3354579	4670009952370	Колбаса сырокопченая доброгост брауншвейгская 200г	265594	Продукты питания (folder)/Колбасные изделия (folder)/Колбаса сырокопченая	0	
3354580	4670009955128	Колбаса сырокопченая доброгост Знатный гостинец 200г	265594	Продукты питания (folder)/Колбасные изделия (folder)/Колбаса сырокопченая	0	
3354581	4670009955135	Колбаса сырокопченая доброгост итальянская по-русски 200г	265594	Продукты питания (folder)/Колбасные изделия (folder)/Колбаса сырокопченая	0	
3354582	4670009955111	Колбаса сырокопченая доброгост краса урала салями вак уп 200г	265594	Продукты питания (folder)/Колбасные изделия (folder)/Колбаса сырокопченая	0	
3354583	4670009955449	Колбаса сырокопченая доброгост купеческая 200г	265594	Продукты питания (folder)/Колбасные изделия (folder)/Колбаса сырокопченая	0	
3354584	4670009955227	Колбаса сырокопченая доброгост миланская 150г	265594	Продукты питания (folder)/Колбасные изделия (folder)/Колбаса сырокопченая	0	
3354585	4670009952783	Колбаса сырокопченая доброгост миланская вак уп 150г	265594	Продукты питания (folder)/Колбасные изделия (folder)/Колбаса сырокопченая	0	
3354586	4670009955166	Колбаса сырокопченая доброгост москвичка вак уп 200г	265594	Продукты питания (folder)/Колбасные изделия (folder)/Колбаса сырокопченая	0	
3354587	4670009955159	Колбаса сырокопченая доброгост праздничное застолье вак уп 200г	265594	Продукты питания (folder)/Колбасные изделия (folder)/Колбаса сырокопченая	0	
3354588	4670009955142	Колбаса сырокопченая доброгост элитная вак уп 200г	265594	Продукты питания (folder)/Колбасные изделия (folder)/Колбаса сырокопченая	0	
3354589	4630003223791	Колбаса сырокопченая доброе дело алтайская 200г	265594	Продукты питания (folder)/Колбасные изделия (folder)/Колбаса сырокопченая	0	
3354590	4630003223753	Колбаса сырокопченая доброе дело монреаль+анталия 400г	265594	Продукты питания (folder)/Колбасные изделия (folder)/Колбаса сырокопченая	0	
3354591	4630003223746	Колбаса сырокопченая доброе дело Русская 300г м/у	265594	Продукты питания (folder)/Колбасные изделия (folder)/Колбаса сырокопченая	0	
3354592	4630003223913	Колбаса сырокопченая доброе дело сервелат находка 250г	265594	Продукты питания (folder)/Колбасные изделия (folder)/Колбаса сырокопченая	0	
265596	4606283006515	Колбаса сырокопченая добрый продукт брауншвейгская Золотая	265594	Продукты питания (folder)/Колбасные изделия (folder)/Колбаса сырокопченая	261185	Добрый Продукт
265597	4606283006966	Колбаса сырокопченая добрый продукт брауншвейгская Золотая кусок вак уп 175г	265594	Продукты питания (folder)/Колбасные изделия (folder)/Колбаса сырокопченая	261185	Добрый Продукт
265601	4606283008274	Колбаса сырокопченая добрый продукт вестфалия	265594	Продукты питания (folder)/Колбасные изделия (folder)/Колбаса сырокопченая	261185	Добрый Продукт
265620	4606283007291	Колбаса сырокопченая добрый продукт зернистая Золотая в декоративных специях.	265594	Продукты питания (folder)/Колбасные изделия (folder)/Колбаса сырокопченая	261185	Добрый Продукт
265621	4606283006980	Колбаса сырокопченая добрый продукт зернистая Золотая кусок вак уп 175г	265594	Продукты питания (folder)/Колбасные изделия (folder)/Колбаса сырокопченая	261185	Добрый Продукт
265633	4606283006522	Колбаса сырокопченая добрый продукт московская Золотая	265594	Продукты питания (folder)/Колбасные изделия (folder)/Колбаса сырокопченая	261185	Добрый Продукт
265634	4606283006959	Колбаса сырокопченая добрый продукт московская Золотая кусок вак уп 175г	265594	Продукты питания (folder)/Колбасные изделия (folder)/Колбаса сырокопченая	261185	Добрый Продукт
265635	4606283006997	Колбаса сырокопченая добрый продукт московская Золотая нарезка вак уп 100г	265594	Продукты питания (folder)/Колбасные изделия (folder)/Колбаса сырокопченая	261185	Добрый Продукт
2873158	4607007278492	Колбаса сырокопченая домашняя из свинины н/о кольцо з/а 300г шт	265594	Продукты питания (folder)/Колбасные изделия (folder)/Колбаса сырокопченая	54111	Иней
3354593	4606511743021	Колбаса сырокопченая домашняя линия зернистая вак уп 200г	265594	Продукты питания (folder)/Колбасные изделия (folder)/Колбаса сырокопченая	0	
3354594	4606511741126	Колбаса сырокопченая домашняя линия пикантная вак уп 200г	265594	Продукты питания (folder)/Колбасные изделия (folder)/Колбаса сырокопченая	0	
3354595	4606511745032	Колбаса сырокопченая домашняя линия престижная вак уп 200г	265594	Продукты питания (folder)/Колбасные изделия (folder)/Колбаса сырокопченая	0	
2873161	4606979029248	Колбаса сырокопченая домашняя пресс б/б	265594	Продукты питания (folder)/Колбасные изделия (folder)/Колбаса сырокопченая	0	
3354596	15388346	Колбаса сырокопченая домашняя романова вес.	265594	Продукты питания (folder)/Колбасные изделия (folder)/Колбаса сырокопченая	0	
2874802	4610005170071	Колбаса сырокопченая дым дымыч нежная вак уп 100г	265594	Продукты питания (folder)/Колбасные изделия (folder)/Колбаса сырокопченая	0	
2725307	4610005171245	Колбаса сырокопченая дым дымыч нежная с коньяком вак уп 200г	265594	Продукты питания (folder)/Колбасные изделия (folder)/Колбаса сырокопченая	0	
2874818	4610005172402	Колбаса сырокопченая дым дымыч салями вак уп 200г	265594	Продукты питания (folder)/Колбасные изделия (folder)/Колбаса сырокопченая	0	
3354597	4630006262582	Колбаса сырокопченая дымки султанская из говядины 235г амифлекс	265594	Продукты питания (folder)/Колбасные изделия (folder)/Колбаса сырокопченая	0	
37351	4607022167764	Колбаса сырокопченая дымов ассорти брауншвейгская+сервелат нарезка вак уп 90г	1183382	Продукты питания (folder)/Мясные продукты	37350	Дымов
37503	4607022167771	Колбаса сырокопченая дымов ассорти пепперони+салями итальянская нарезка вак уп 90г	1183382	Продукты питания (folder)/Мясные продукты	37350	Дымов
67635	4607022167788	Колбаса сырокопченая дымов зернистая полусухая 90г нарезка	265594	Продукты питания (folder)/Колбасные изделия (folder)/Колбаса сырокопченая	37350	Дымов
3354598	4680003502310	Колбаса сырокопченая дымов коньячная 300г	265594	Продукты питания (folder)/Колбасные изделия (folder)/Колбаса сырокопченая	0	
2235873	4680003503294	Колбаса сырокопченая дымов коньячная нарезка вак уп 90г	265594	Продукты питания (folder)/Колбасные изделия (folder)/Колбаса сырокопченая	37350	Дымов
1774476	4607022167801	Колбаса сырокопченая дымов свиная нар.90г	265594	Продукты питания (folder)/Колбасные изделия (folder)/Колбаса сырокопченая	0	
67970	4607022167818	Колбаса сырокопченая дымов сервелат полусухой 90г нарезка	265594	Продукты питания (folder)/Колбасные изделия (folder)/Колбаса сырокопченая	37350	Дымов
2873170	4606979029408	Колбаса сырокопченая еврейская в/с	265594	Продукты питания (folder)/Колбасные изделия (folder)/Колбаса сырокопченая	0	
3354599	4650062433894	Колбаса сырокопченая европейская 290г лама	265594	Продукты питания (folder)/Колбасные изделия (folder)/Колбаса сырокопченая	0	
2443703	4607104811097	Колбаса сырокопченая егорьевская белотта нарезка вак уп 70г	265594	Продукты питания (folder)/Колбасные изделия (folder)/Колбаса сырокопченая	2443701	Егорьевская Фабрика
3354600	4607104819178	Колбаса сырокопченая егорьевская браунгшвейская 100г нарезка	265594	Продукты питания (folder)/Колбасные изделия (folder)/Колбаса сырокопченая	0	
3354601	4640020591254	Колбаса сырокопченая егорьевская палермо нарезка вак уп 100г	265594	Продукты питания (folder)/Колбасные изделия (folder)/Колбаса сырокопченая	0	
3354602	4640020591902	Колбаса сырокопченая егорьевская савилья нарезка 150г вак/упак	265594	Продукты питания (folder)/Колбасные изделия (folder)/Колбаса сырокопченая	0	
3354603	4607104810496	Колбаса сырокопченая егорьевская свиная полусухая 270г	265594	Продукты питания (folder)/Колбасные изделия (folder)/Колбаса сырокопченая	0	
2443780	4607104815125	Колбаса сырокопченая егорьевская сервелат имбирный нарезка вак уп 150г	265594	Продукты питания (folder)/Колбасные изделия (folder)/Колбаса сырокопченая	2443701	Егорьевская Фабрика
1226531	4751002209903	Колбаса сырокопченая елгавская юбилейная елгавский гк 0.280	265594	Продукты питания (folder)/Колбасные изделия (folder)/Колбаса сырокопченая	0	
1226532	4607089698447	Колбаса сырокопченая елисеевская черкиз 0.300	265594	Продукты питания (folder)/Колбасные изделия (folder)/Колбаса сырокопченая	0	
3354604	1070929306506	Колбаса сырокопченая естъ миланская вес	265594	Продукты питания (folder)/Колбасные изделия (folder)/Колбаса сырокопченая	0	
3354605	1070929306537	Колбаса сырокопченая естъ мускатный вес	265594	Продукты питания (folder)/Колбасные изделия (folder)/Колбаса сырокопченая	0	
3354606	1070929306223	Колбаса сырокопченая естъ праздничная вес	265594	Продукты питания (folder)/Колбасные изделия (folder)/Колбаса сырокопченая	0	
1226534	4770369211930	Колбаса сырокопченая жальгтрис говяжья 140г	265594	Продукты питания (folder)/Колбасные изделия (folder)/Колбаса сырокопченая	1226533	Жальгтрис
1226535	4770369211954	Колбаса сырокопченая жальгтрис кабанья 140г	265594	Продукты питания (folder)/Колбасные изделия (folder)/Колбаса сырокопченая	1226533	Жальгтрис
1226536	4770369211978	Колбаса сырокопченая жальгтрис оленья 140г	265594	Продукты питания (folder)/Колбасные изделия (folder)/Колбаса сырокопченая	1226533	Жальгтрис
1226538	4770369211985	Колбаса сырокопченая жальгтрис с можжев.ягодами 210г	265594	Продукты питания (folder)/Колбасные изделия (folder)/Колбаса сырокопченая	1226533	Жальгтрис
3354607	4690411012349	Колбаса сырокопченая заказная вак уп 200г тавр	265594	Продукты питания (folder)/Колбасные изделия (folder)/Колбаса сырокопченая	0	
2873190	4607139760452	Колбаса сырокопченая заполярная (оболочка фиброуз) 0.5	265594	Продукты питания (folder)/Колбасные изделия (folder)/Колбаса сырокопченая	0	
3354608	4650062970832	Колбаса сырокопченая зернистая 100г м/у	265594	Продукты питания (folder)/Колбасные изделия (folder)/Колбаса сырокопченая	0	
1672750	4607056732297	Колбаса сырокопченая зернистая 150г #2	265594	Продукты питания (folder)/Колбасные изделия (folder)/Колбаса сырокопченая	0	
3354609	4610005170132	Колбаса сырокопченая зернистая 150г 1шт	265594	Продукты питания (folder)/Колбасные изделия (folder)/Колбаса сырокопченая	0	
3354610	4607012241115	Колбаса сырокопченая зернистая 200г г/уп советский мк	265594	Продукты питания (folder)/Колбасные изделия (folder)/Колбаса сырокопченая	0	
2731176	4606420002707	Колбаса сырокопченая зернистая 200г кд	265594	Продукты питания (folder)/Колбасные изделия (folder)/Колбаса сырокопченая	0	
729742	4770118401964	Колбаса сырокопченая зернистая 200грлитва	265594	Продукты питания (folder)/Колбасные изделия (folder)/Колбаса сырокопченая	67498	Биовела
67633	4607040362813	Колбаса сырокопченая зернистая 250г газ/у кмк	265594	Продукты питания (folder)/Колбасные изделия (folder)/Колбаса сырокопченая	37472	Ничико
3354611	4606609361380	Колбаса сырокопченая зернистая 300г	265594	Продукты питания (folder)/Колбасные изделия (folder)/Колбаса сырокопченая	0	
3354612	4606609361519	Колбаса сырокопченая зернистая 300г #2	265594	Продукты питания (folder)/Колбасные изделия (folder)/Колбаса сырокопченая	0	
3354613	4640004780407	Колбаса сырокопченая зернистая 300г #3	265594	Продукты питания (folder)/Колбасные изделия (folder)/Колбаса сырокопченая	0	
2235831	4680003503331	Колбаса сырокопченая зернистая 300г дымов #2	265594	Продукты питания (folder)/Колбасные изделия (folder)/Колбаса сырокопченая	37350	Дымов
67634	8424944280175	Колбаса сырокопченая зернистая 350г компо	265594	Продукты питания (folder)/Колбасные изделия (folder)/Колбаса сырокопченая	67487	Компо
3354614	4770118401858	Колбаса сырокопченая зернистая 90г биовела	265594	Продукты питания (folder)/Колбасные изделия (folder)/Колбаса сырокопченая	0	
2873201	4601906941730	Колбаса сырокопченая зернистая в/с 0.150	265594	Продукты питания (folder)/Колбасные изделия (folder)/Колбаса сырокопченая	0	
2873195	4607139760285	Колбаса сырокопченая зернистая в/с ГОСТ p 55456-2013	265594	Продукты питания (folder)/Колбасные изделия (folder)/Колбаса сырокопченая	0	
67632	4601906109505	Колбаса сырокопченая зернистая вак уп 120г парнас	265594	Продукты питания (folder)/Колбасные изделия (folder)/Колбаса сырокопченая	38832	Парнас-М
2873202	4680003200261	Колбаса сырокопченая зернистая вак уп 200г охлажд.	265594	Продукты питания (folder)/Колбасные изделия (folder)/Колбаса сырокопченая	0	
2873196	4607036270894	Колбаса сырокопченая зернистая ГОСТ 0.100	265594	Продукты питания (folder)/Колбасные изделия (folder)/Колбаса сырокопченая	0	
2863253	4660011171418	Колбаса сырокопченая зернистая ГОСТ томский 200г	1	Неклассифицированные/default	0	
1226713	4630007392080	Колбаса сырокопченая зернистая деликатесная 200г кр	265594	Продукты питания (folder)/Колбасные изделия (folder)/Колбаса сырокопченая	0	
2874757	4605025008299	Колбаса сырокопченая зернистая Люкс фиб 0.5кг (тм private Label) к3	265594	Продукты питания (folder)/Колбасные изделия (folder)/Колбаса сырокопченая	0	
2873197	4630007393759	Колбаса сырокопченая зернистая московская 0.090 (к)	265594	Продукты питания (folder)/Колбасные изделия (folder)/Колбаса сырокопченая	0	
729743	4770118400363	Колбаса сырокопченая зернистая нар 90грлитва	265594	Продукты питания (folder)/Колбасные изделия (folder)/Колбаса сырокопченая	67498	Биовела
67631	4606452301007	Колбаса сырокопченая зернистая нарезка вак уп 100г	265594	Продукты питания (folder)/Колбасные изделия (folder)/Колбаса сырокопченая	0	
3354615	4607132036387	Колбаса сырокопченая зернистая нарезка вак уп 100г #2	265594	Продукты питания (folder)/Колбасные изделия (folder)/Колбаса сырокопченая	0	
2235832	4607099267688	Колбаса сырокопченая зернистая п/сухая 300г окраина	265594	Продукты питания (folder)/Колбасные изделия (folder)/Колбаса сырокопченая	2226667	Окраина
