ID	UPCEAN	Name	CategoryID	CategoryName	BrandID	BrandName
47168	3416830162011	Вино шартрон бордо аос выдерж красн сух 12% 750мл	41821	Продукты питания (folder)/Алкогольные напитки/Вино (folder)/Вина Франции	47166	Шартрон
47169	3416830171013	Вино шартрон бордо аос красн сух 12% 750мл	41821	Продукты питания (folder)/Алкогольные напитки/Вино (folder)/Вина Франции	47166	Шартрон
47170	3416830183030	Вино шартрон бордо аос муале бел полусладк 11% 750мл	41821	Продукты питания (folder)/Алкогольные напитки/Вино (folder)/Вина Франции	47166	Шартрон
47171	3416830162028	Вино шартрон медок аос красн сух 12.5% 750мл	41821	Продукты питания (folder)/Алкогольные напитки/Вино (folder)/Вина Франции	47166	Шартрон
1760276	4607043171252	Вино шасе сплин2002 к.с13% 750мл	22133	Продукты питания (folder)/Алкогольные напитки/Вино (folder)/Вино	0	
691372	3495330480917	Вино шасс рояль бордо аос красн сух 750мл 13%2009 (Франция)	22133	Продукты питания (folder)/Алкогольные напитки/Вино (folder)/Вино	0	
171329	3263810129096	Вино шасс руайаль руж 750мл 0% красн сух	22133	Продукты питания (folder)/Алкогольные напитки/Вино (folder)/Вино	0	
47172	3473120002631	Вино шассань монраше красн сух 13% 750мл	41821	Продукты питания (folder)/Алкогольные напитки/Вино (folder)/Вина Франции	0	
2227485	3760120321313	Вино шассань монраше лез энсеньер 2010 домен жан-клод бел/сух 0.75 15% 1/12	22133	Продукты питания (folder)/Алкогольные напитки/Вино (folder)/Вино	0	
2227486	7070397021486	Вино шассань монтраше 2007 бел/сух 0.75 12% 1/12	22133	Продукты питания (folder)/Алкогольные напитки/Вино (folder)/Вино	0	
171334	3200007715984	Вино шассань-монраше 750мл 0% белое	22133	Продукты питания (folder)/Алкогольные напитки/Вино (folder)/Вино	0	
2272855	3506128334111	Вино шассань-монраше премье крю ла малтруа 750мл 13.0%, сухое	22133	Продукты питания (folder)/Алкогольные напитки/Вино (folder)/Вино	0	
2272856	3506128337112	Вино шассань-монраше премье крю моржо 750мл 13.0%, сухое	22133	Продукты питания (folder)/Алкогольные напитки/Вино (folder)/Вино	0	
2272857	3506128336115	Вино шассань-монраше премье крю шомэ 750мл 13.0%, сухое	22133	Продукты питания (folder)/Алкогольные напитки/Вино (folder)/Вино	0	
171330	3200007716011	Вино шассань-монраше премьер крю верже 750мл 0% белое	22133	Продукты питания (folder)/Алкогольные напитки/Вино (folder)/Вино	0	
171331	3200007715991	Вино шассань-монраше премьер крю кло де ля мальтруа 750мл 0% белое	22133	Продукты питания (folder)/Алкогольные напитки/Вино (folder)/Вино	0	
171332	3200007716028	Вино шассань-монраше премьер крю кло де ля мальтруа 750мл 0% красное	22133	Продукты питания (folder)/Алкогольные напитки/Вино (folder)/Вино	0	
171333	3200007716004	Вино шассань-монраше премьер крю кло сен-жан 750мл 0% белое	22133	Продукты питания (folder)/Алкогольные напитки/Вино (folder)/Вино	0	
3794698	3249381052797	Вино шатан дежуа бож.вил. красн сух 750мл	3615777	Продукты питания (folder)/Алкогольные напитки/Вино (folder)/Вино тихое красное	3792885	UCCOAR
3794699	3249381052780	Вино шатан дежуа божоле красн сух 750мл	3615777	Продукты питания (folder)/Алкогольные напитки/Вино (folder)/Вино тихое красное	3792885	UCCOAR
3292286	3760205903328	Вино шателен Принц франсуа белое сухое столов 11% 750мл ст/б	22133	Продукты питания (folder)/Алкогольные напитки/Вино (folder)/Вино	0	
3292287	3760205903380	Вино шателен Принц франсуа красное полусладк столов 10% 750мл ст/б	22133	Продукты питания (folder)/Алкогольные напитки/Вино (folder)/Вино	0	
3292295	3760205903342	Вино шателен Принц франсуа красное сухое 11% 750мл стекло	22133	Продукты питания (folder)/Алкогольные напитки/Вино (folder)/Вино	0	
3292288	3760205903366	Вино шателен Принц француа столов полусладк белое 10% 750мл ст/б	22133	Продукты питания (folder)/Алкогольные напитки/Вино (folder)/Вино	0	
3292289	3112729056491	Вино шателье жустин столов красное полусладк 11% 750мл с/б	22133	Продукты питания (folder)/Алкогольные напитки/Вино (folder)/Вино	0	
3292290	3077051202964	Вино шательен жульен белое полусладк 11% 750мл ст/б	22133	Продукты питания (folder)/Алкогольные напитки/Вино (folder)/Вино	0	
3292291	3077051202988	Вино шательен жульен красное полусладк 11% 750мл	22133	Продукты питания (folder)/Алкогольные напитки/Вино (folder)/Вино	0	
3292292	3120581440181	Вино шательен жустин столов белое полусладк 10.5% 750мл ст/б	22133	Продукты питания (folder)/Алкогольные напитки/Вино (folder)/Вино	0	
3292293	3112729056477	Вино шательен жустин столов белое полусладк 11% 750мл ст/б	22133	Продукты питания (folder)/Алкогольные напитки/Вино (folder)/Вино	0	
3292294	3120581440211	Вино шательен жустин столов красное полусладк 10.5% 750мл ст/б	22133	Продукты питания (folder)/Алкогольные напитки/Вино (folder)/Вино	0	
3794700	3378634320427	Вино шатен блан муэлё бел полусладк 11.5%	3615781	Продукты питания (folder)/Алкогольные напитки/Вино (folder)/Вино тихое белое	0	
3794701	3378634320625	Вино шатен руж муэлё крас полусладк 11.5%	3615777	Продукты питания (folder)/Алкогольные напитки/Вино (folder)/Вино тихое красное	0	
3794703	3378634320120	Вино шатене блан столов бел сух 12% 750мл	3615781	Продукты питания (folder)/Алкогольные напитки/Вино (folder)/Вино тихое белое	3794702	ШАТЕНЕ
3794705	3378634320229	Вино шатене руж ст. красн сух 12% 750мл	3615777	Продукты питания (folder)/Алкогольные напитки/Вино (folder)/Вино тихое красное	3794704	ШАТЕНЕ РУЖ
3292296	3182520158106	Вино шатлен барон ле саж белое полусладк 11.5% 750мл ст/б	22133	Продукты питания (folder)/Алкогольные напитки/Вино (folder)/Вино	0	
3292297	3298020460998	Вино шатлен барон ле саж красное сухое 750мл	22133	Продукты питания (folder)/Алкогольные напитки/Вино (folder)/Вино	0	
3292298	3298020461018	Вино шатлен барон ле саж столов белое сухое 10.5% 750мл ст/б	22133	Продукты питания (folder)/Алкогольные напитки/Вино (folder)/Вино	0	
3292299	3182520158045	Вино шатлен барон ле саж столов белое сухое 12% 750мл ст/б	22133	Продукты питания (folder)/Алкогольные напитки/Вино (folder)/Вино	0	
3292300	3182520158083	Вино шатлен барон ле саж столов красное полусладк 11.5% 750мл ст/б	22133	Продукты питания (folder)/Алкогольные напитки/Вино (folder)/Вино	0	
3292301	3182520158069	Вино шатлен барон ле саж столов красное сухое 12% 750мл ст/б	22133	Продукты питания (folder)/Алкогольные напитки/Вино (folder)/Вино	0	
175165	3495332440513	Вино шато де ромэн бордо 2005 красн сух 13% 750мл	22133	Продукты питания (folder)/Алкогольные напитки/Вино (folder)/Вино	175164	МЭ-Мезон Ривьер/Вино (Франция)
3794707	3259354199107	Вино шато ле морин бордо красн сух 750мл	3615777	Продукты питания (folder)/Алкогольные напитки/Вино (folder)/Вино тихое красное	3794706	ШАТО ЛЕ МОРИН
3794708	3259354199800	Вино шато ле морин бордо красн сух 750мл #2	3615777	Продукты питания (folder)/Алкогольные напитки/Вино (folder)/Вино тихое красное	3794706	ШАТО ЛЕ МОРИН
3794709	3259354199909	Вино шато ле морин бордо красн сух 750мл #3	3615777	Продукты питания (folder)/Алкогольные напитки/Вино (folder)/Вино тихое красное	3794706	ШАТО ЛЕ МОРИН
1192260	3295890159403	Вино шато фенелон бордо аос красн сух 750мл 13% /Франция/	22133	Продукты питания (folder)/Алкогольные напитки/Вино (folder)/Вино	0	
47435	3760112052317	Вино шатонеф дю пап домен де шанссо бел сух 14% 750мл	41821	Продукты питания (folder)/Алкогольные напитки/Вино (folder)/Вина Франции	47434	Шатонеф дю Пап
47436	3760112051112	Вино шатонеф дю пап домен де шанссо красн сух 15% 750мл	41821	Продукты питания (folder)/Алкогольные напитки/Вино (folder)/Вина Франции	47434	Шатонеф дю Пап
47437	3174368848219	Вино шатонеф дю пап домен рише красн 750мл	22133	Продукты питания (folder)/Алкогольные напитки/Вино (folder)/Вино	0	
47438	3174368856863	Вино шатонеф дю пап ж.г красн сух 13% 750мл	22133	Продукты питания (folder)/Алкогольные напитки/Вино (folder)/Вино	0	
47439	3179074591343	Вино шатонеф дю пап кл де лега 13.5% 750мл	22133	Продукты питания (folder)/Алкогольные напитки/Вино (folder)/Вино	0	
47440	3510804131130	Вино шатонеф дю пап кло де л'оратуар бел сух 13.5% 750мл	41821	Продукты питания (folder)/Алкогольные напитки/Вино (folder)/Вина Франции	47434	Шатонеф дю Пап
47441	3510804130379	Вино шатонеф дю пап кло де л'оратуар красн сух 14.5% 750мл	41821	Продукты питания (folder)/Алкогольные напитки/Вино (folder)/Вина Франции	47434	Шатонеф дю Пап
47442	3174368846987	Вино шатонеф дю пап ле дюманиаль красн 750мл	22133	Продукты питания (folder)/Алкогольные напитки/Вино (folder)/Вино	0	
47443	3174368862062	Вино шатонеф дю пап ле дюманиаль красн сух 13.5% 750мл	41821	Продукты питания (folder)/Алкогольные напитки/Вино (folder)/Вина Франции	47434	Шатонеф дю Пап
47444	3296180000139	Вино шатонеф дю пап ле с.2000 14% 750мл	22133	Продукты питания (folder)/Алкогольные напитки/Вино (folder)/Вино	0	
283655	3274034611007	Вино шатонеф дю пап мон флери красн сух 750мл 14% /Франция/	22133	Продукты питания (folder)/Алкогольные напитки/Вино (folder)/Вино	0	
47445	3263810122080	Вино шатонеф дю пап ст.клементин красн сух 14% 750мл	41821	Продукты питания (folder)/Алкогольные напитки/Вино (folder)/Вина Франции	47434	Шатонеф дю Пап
47446	3217661012519	Вино шатонеф дю пап шарль брют красн сух 13.5% 750мл	22133	Продукты питания (folder)/Алкогольные напитки/Вино (folder)/Вино	0	
171370	3105712650059	Вино шатонеф-дю-пап ле сэдр 750мл 14% красн сух	22133	Продукты питания (folder)/Алкогольные напитки/Вино (folder)/Вино	0	
2855240	4623720871208	Вино шатонеф-дю-пап феро-брюнель красн сух 750мл	22133	Продукты питания (folder)/Алкогольные напитки/Вино (folder)/Вино	3794224	ФЕРО-БРЮНЕЛЬ
171371	3760098130146	Вино шатонеф-дю-пап шато лез отелье 750мл 13% красн сух	41821	Продукты питания (folder)/Алкогольные напитки/Вино (folder)/Вина Франции	0	
3292302	3531380052329	Вино шатранж белое полусладк 10.5% 750мл	22133	Продукты питания (folder)/Алкогольные напитки/Вино (folder)/Вино	0	
2855241	4760039401921	Вино шах мадраса красн сух 12% 750мл	22133	Продукты питания (folder)/Алкогольные напитки/Вино (folder)/Вино	0	
2855242	4760039401907	Вино шах шемаха красн полусладк 12% 750мл	22133	Продукты питания (folder)/Алкогольные напитки/Вино (folder)/Вино	0	
2855243	4760039400290	Вино шахдаг кра/пс 11% 750мл	22133	Продукты питания (folder)/Алкогольные напитки/Вино (folder)/Вино	0	
3292303	4760039402829	Вино шахдаг красное сладкое 10-12% 750мл стекло	22133	Продукты питания (folder)/Алкогольные напитки/Вино (folder)/Вино	0	
3292304	4760142900021	Вино шахназ столов красное сухое 13% 750мл ст/б	22133	Продукты питания (folder)/Алкогольные напитки/Вино (folder)/Вино	0	
261759	4650055690341	Вино шашлычное бел полусладк 10-12% 3	22133	Продукты питания (folder)/Алкогольные напитки/Вино (folder)/Вино	45789	Русский Азов
261760	4650055690471	Вино шашлычное бел сух 10-12% 3	22133	Продукты питания (folder)/Алкогольные напитки/Вино (folder)/Вино	45789	Русский Азов
261761	4650055690334	Вино шашлычное красн полусладк 10-12% 3	22133	Продукты питания (folder)/Алкогольные напитки/Вино (folder)/Вино	45789	Русский Азов
261762	4650055690488	Вино шашлычное красн сух 10-12% 3	22133	Продукты питания (folder)/Алкогольные напитки/Вино (folder)/Вино	45789	Русский Азов
2166970	20005924	Вино шварце медхентраубе красн полусладк 11.5% 750мл	22133	Продукты питания (folder)/Алкогольные напитки/Вино (folder)/Вино	2166969	Lidl
1760318	4011869004326	Вино шварцер монк красное полусладк 8.5% 750мл ст/б	22133	Продукты питания (folder)/Алкогольные напитки/Вино (folder)/Вино	0	
3292305	4003301039447	Вино шварцер пантер белое полусладк 9% 750мл ст/б	22133	Продукты питания (folder)/Алкогольные напитки/Вино (folder)/Вино	0	
1760319	3429671169026	Вино шг шевал.блан к.с12% 750мл	22133	Продукты питания (folder)/Алкогольные напитки/Вино (folder)/Вино	0	
1196084	3112729047161	Вино ше десентандре жан десалиньи бордо ружкр. сух 750мл	22133	Продукты питания (folder)/Алкогольные напитки/Вино (folder)/Вино	1196083	Ше де Сент Андре
1196085	3112729047079	Вино ше десентандре жан десалиньи сент-эмильон красн сух 750мл	22133	Продукты питания (folder)/Алкогольные напитки/Вино (folder)/Вино	1196083	Ше де Сент Андре
2272901	7790975018492	Вино шеваль дес андес мендоса 750мл 14.0%, сухое	22133	Продукты питания (folder)/Алкогольные напитки/Вино (folder)/Вино	0	
1195853	3176480275249	Вино шеваль канкар марго красн сух 750мл/бордо/aoc	22133	Продукты питания (folder)/Алкогольные напитки/Вино (folder)/Вино	1195852	Шеваль Канкар
1195854	3176481002608	Вино шеваль канкар сент-эмильон красн сух 750мл/бордо/aoc	22133	Продукты питания (folder)/Алкогольные напитки/Вино (folder)/Вино	1195852	Шеваль Канкар
1195855	3297770010026	Вино шеваль канкар шато вимон грав бел сух 750мл/бордо/aoc	22133	Продукты питания (folder)/Алкогольные напитки/Вино (folder)/Вино	1195852	Шеваль Канкар
1195856	3297770010019	Вино шеваль канкар шато вимон грав красн сух 750мл/бордо/aoc	22133	Продукты питания (folder)/Алкогольные напитки/Вино (folder)/Вино	1195852	Шеваль Канкар
1195857	3176481012713	Вино шеваль канкар шато монлабер грас дье красн сух 750мл/бордо/aoc	22133	Продукты питания (folder)/Алкогольные напитки/Вино (folder)/Вино	1195852	Шеваль Канкар
47448	3274039226022	Вино шевалье д'олер бел полусладк 11% 750мл	22133	Продукты питания (folder)/Алкогольные напитки/Вино (folder)/Вино	47447	Шевалье Д`Олер
47449	3274039237028	Вино шевалье д'олер бел сух 11% 750мл	22133	Продукты питания (folder)/Алкогольные напитки/Вино (folder)/Вино	47447	Шевалье Д`Олер
47450	3274039226008	Вино шевалье д'олер красн полусладк 12% 750мл	22133	Продукты питания (folder)/Алкогольные напитки/Вино (folder)/Вино	47447	Шевалье Д`Олер
47451	3274039237004	Вино шевалье д'олер красн сух 12% 750мл	22133	Продукты питания (folder)/Алкогольные напитки/Вино (folder)/Вино	47447	Шевалье Д`Олер
173777	3322720679401	Вино шевалье де бур бел полусладк s10% 750мл 6шт	22133	Продукты питания (folder)/Алкогольные напитки/Вино (folder)/Вино	173738	CORBET SAS
173778	3322720679388	Вино шевалье де бур бел сух s11% 750мл 6шт	22133	Продукты питания (folder)/Алкогольные напитки/Вино (folder)/Вино	173738	CORBET SAS
173779	3322720679364	Вино шевалье де бур красн полусладк s10% 750мл 6шт	22133	Продукты питания (folder)/Алкогольные напитки/Вино (folder)/Вино	173738	CORBET SAS
173780	3322720679340	Вино шевалье де бур красн сух s11% 750мл 6шт	22133	Продукты питания (folder)/Алкогольные напитки/Вино (folder)/Вино	173738	CORBET SAS
3292306	3249381032225	Вино шевалье де грэз красное полусладк 10% 750мл стбут	22133	Продукты питания (folder)/Алкогольные напитки/Вино (folder)/Вино	0	
2274382	3295890188922	Вино шевалье де дюн каберне совиньон столов красное сухое 0.375л 12% Франция	22133	Продукты питания (folder)/Алкогольные напитки/Вино (folder)/Вино	0	
2274396	3295890188939	Вино шевалье де дюн шардоне столов белое сухое 0.375л 12.5% Франция	22133	Продукты питания (folder)/Алкогольные напитки/Вино (folder)/Вино	0	
2274381	3295890187758	Вино шевалье де дюн шардоне столов белое сухое 750мл 12.5% Франция	22133	Продукты питания (folder)/Алкогольные напитки/Вино (folder)/Вино	0	
47452	3438910561309	Вино шевалье де ласкомб красн сух 12.5% 750мл	22133	Продукты питания (folder)/Алкогольные напитки/Вино (folder)/Вино	0	
3794711	3259353143200	Вино шевалье де сент андре красн сух 750мл	3615777	Продукты питания (folder)/Алкогольные напитки/Вино (folder)/Вино тихое красное	3794710	ШЕВАЛЬЕ ДЕ СЕНТ АНДРЕ
3794712	3259353321301	Вино шевалье де сент андрероз. сух 750мл	3789983	Продукты питания (folder)/Алкогольные напитки/Вино (folder)/Вино тихое розовое	3794710	ШЕВАЛЬЕ ДЕ СЕНТ АНДРЕ
1196088	3259353143002	Вино шевалье де сэнт андре аос бордо красн/сух 13% 750мл	22133	Продукты питания (folder)/Алкогольные напитки/Вино (folder)/Вино	3794710	ШЕВАЛЬЕ ДЕ СЕНТ АНДРЕ
1196089	3259353321004	Вино шевалье де сэнт андре аос бордо розов/сух 13% 750мл	22133	Продукты питания (folder)/Алкогольные напитки/Вино (folder)/Вино	3794710	ШЕВАЛЬЕ ДЕ СЕНТ АНДРЕ
1196090	325935324800	Вино шевалье де сэнт андре бел/сух 12% 750мл	22133	Продукты питания (folder)/Алкогольные напитки/Вино (folder)/Вино	0	
171384	4605654000732	Вино шевалье девинет 0.700л 11% бел полусладк	22133	Продукты питания (folder)/Алкогольные напитки/Вино (folder)/Вино	0	
171385	4605654000718	Вино шевалье девинет 0.700л 11% бел сух	22133	Продукты питания (folder)/Алкогольные напитки/Вино (folder)/Вино	0	
171386	4605654000725	Вино шевалье девинет 0.700л 11% красн полусладк	22133	Продукты питания (folder)/Алкогольные напитки/Вино (folder)/Вино	0	
171387	4605654000701	Вино шевалье девинет 0.700л 11% красн сух	22133	Продукты питания (folder)/Алкогольные напитки/Вино (folder)/Вино	0	
2720802	3295890190567	Вино шевалье депьер столов бел полусладк 750мл 11% Франция	22133	Продукты питания (folder)/Алкогольные напитки/Вино (folder)/Вино	0	
1196091	3760205901683	Вино шевалье дю валь столов полусладк белое 10% 750мл Франция	41821	Продукты питания (folder)/Алкогольные напитки/Вино (folder)/Вина Франции	0	
1196093	3760205901706	Вино шевалье дю валь столов полусладк красное 10% 750мл Франция	41821	Продукты питания (folder)/Алкогольные напитки/Вино (folder)/Вина Франции	0	
