ID	UPCEAN	Name	CategoryID	CategoryName	BrandID	BrandName
3686761	4607102800338	Kuvaka Cream soda 1.5l bo p	17371	Продукты питания (folder)/Напитки безалкогольные/Напитки	0	
3686762	4607102800345	Kuvaka Cream soda 1.5l bo p #2	17371	Продукты питания (folder)/Напитки безалкогольные/Напитки	0	
3686763	4607102800437	Kuvaka duchesse 1.5l bo p	17371	Продукты питания (folder)/Напитки безалкогольные/Напитки	0	
3686764	4607102800673	Kuvaka Extra sitro 1.5l bo p	17371	Продукты питания (folder)/Напитки безалкогольные/Напитки	0	
3686765	4607102800680	Kuvaka Extra sitro 1.5l bo p #2	17371	Продукты питания (folder)/Напитки безалкогольные/Напитки	0	
3686766	4607102800376	Kuvaka lemonade 1.5l bo p	17371	Продукты питания (folder)/Напитки безалкогольные/Напитки	0	
3686767	4607102800383	Kuvaka lemonade 1.5l bo p #2	17371	Продукты питания (folder)/Напитки безалкогольные/Напитки	0	
3686768	4607102800192	Kuvaka Orange 1.5l bo p	17371	Продукты питания (folder)/Напитки безалкогольные/Напитки	0	
3686769	4607102800253	Kuvaka pear 1.5l bo p	17371	Продукты питания (folder)/Напитки безалкогольные/Напитки	0	
3686770	4607102800451	Kuvaka pear 1.5l bo p #2	17371	Продукты питания (folder)/Напитки безалкогольные/Напитки	0	
3686771	4607102800055	Kuvaka s i 0.5l bo p us	17388	Продукты питания (folder)/Напитки безалкогольные/Вода питьевая	3686756	KUVAKA
3686772	4607102800062	Kuvaka s i 0.5l bo p us #2	17388	Продукты питания (folder)/Напитки безалкогольные/Вода питьевая	3686756	KUVAKA
3686773	4607102801052	Kuvaka s i 0.5l bo p us #3	17388	Продукты питания (folder)/Напитки безалкогольные/Вода питьевая	3686756	KUVAKA
3686774	4607102800031	Kuvaka s i 1.5l bo p us	17388	Продукты питания (folder)/Напитки безалкогольные/Вода питьевая	3686756	KUVAKA
3686775	4607102800048	Kuvaka s i 1.5l bo p us #2	17388	Продукты питания (folder)/Напитки безалкогольные/Вода питьевая	3686756	KUVAKA
3686776	4607102801267	Kuvaka s i 10l bo p us	17388	Продукты питания (folder)/Напитки безалкогольные/Вода питьевая	3686756	KUVAKA
3686777	4607102801274	Kuvaka s i 19l bo p us	17388	Продукты питания (folder)/Напитки безалкогольные/Вода питьевая	3686756	KUVAKA
3686778	4607102801236	Kuvaka s i 1l bo p us	17388	Продукты питания (folder)/Напитки безалкогольные/Вода питьевая	3686756	KUVAKA
3686779	4607102800017	Kuvaka s i 5l bo p us	17388	Продукты питания (folder)/Напитки безалкогольные/Вода питьевая	3686756	KUVAKA
3686780	4607102800024	Kuvaka s i 5l bo p us #2	17388	Продукты питания (folder)/Напитки безалкогольные/Вода питьевая	3686756	KUVAKA
3686781	4607102800475	Kuvaka tarragon 1.5l bo p	17371	Продукты питания (folder)/Напитки безалкогольные/Напитки	0	
3686782	4607102800215	Kuvaka буратино 1.5l bo p	17371	Продукты питания (folder)/Напитки безалкогольные/Напитки	0	
3686783	4607102800222	Kuvaka буратино 1.5l bo p #2	17371	Продукты питания (folder)/Напитки безалкогольные/Напитки	0	
1033982	368135300021	Kuvan tab 100mg 120 ds	1	Неклассифицированные/default	0	
2617104	730127100771	Kuvzat cucumber brine	1	Неклассифицированные/default	2617103	Kuvzat
2617105	730127101136	Kuvzat cucumber brine 20%	1	Неклассифицированные/default	2617103	Kuvzat
2617106	730127100023	Kuvzat cucumber in brine 13-17	1	Неклассифицированные/default	2617103	Kuvzat
2617107	730127100030	Kuvzat cucumber in brine 18-25	1	Неклассифицированные/default	2617103	Kuvzat
2617109	730127100085	Kuvzat eggplant Mini	1	Неклассифицированные/default	2617103	Kuvzat
2617110	730127100573	Kuvzat eggplant Mini #2	1	Неклассифицированные/default	2617103	Kuvzat
2617111	730127100146	Kuvzat olive Black sliced	1	Неклассифицированные/default	2617103	Kuvzat
2617112	730127100153	Kuvzat olive blk bd&oup	1	Неклассифицированные/default	2617103	Kuvzat
2617113	730127100689	Kuvzat olive grn crckd spicy bdz	1	Неклассифицированные/default	2617103	Kuvzat
2617114	730127100658	Kuvzat olive grn giant	1	Неклассифицированные/default	2617103	Kuvzat
2617115	730127100290	Kuvzat olive grn large bdz	1	Неклассифицированные/default	2617103	Kuvzat
2617116	730127100122	Kuvzat olive grn large bdz oup	1	Неклассифицированные/default	2617103	Kuvzat
2617117	730127100306	Kuvzat olive grn ptd	1	Неклассифицированные/default	2617103	Kuvzat
2617118	730127100139	Kuvzat olive grn slcd	1	Неклассифицированные/default	2617103	Kuvzat
2617119	730127100634	Kuvzat olive grn slice bdz ou	1	Неклассифицированные/default	2617103	Kuvzat
2617120	730127100559	Kuvzat olive Wine vngr bdz	1	Неклассифицированные/default	2617103	Kuvzat
2617121	730127101105	Kuvzat olive yavne mixed	1	Неклассифицированные/default	2617103	Kuvzat
2617122	730127101143	Kuvzat olive yavne suri	1	Неклассифицированные/default	2617103	Kuvzat
2617123	730127100092	Kuvzat pepper Hot	1	Неклассифицированные/default	2617103	Kuvzat
2617124	730127100399	Kuvzat pepper strip Red	1	Неклассифицированные/default	2617103	Kuvzat
4466122	6271003045044	Kuwait flour mills New Fresh Mini bread 300g	1	Неклассифицированные/default	0	
615515	6271003052240	Kuwait macaroni no24 500g	1	Неклассифицированные/default	0	
615516	6271003014019	Kuwait patent flour 1kg	1	Неклассифицированные/default	0	
615517	6271003014026	Kuwait patent flour 5kg	1	Неклассифицированные/default	0	
384998	089540451930	Kuya Fusion Rum 1000ml	111587	Продукты питания (folder)/Алкогольные напитки/Ром	0	
4466123	895404519308	Kuya Fusion Rum 1000ml #2	1	Неклассифицированные/default	0	
384999	089540451954	Kuya Fusion Rum 50ml	111587	Продукты питания (folder)/Алкогольные напитки/Ром	0	
4466124	895404519544	Kuya Fusion Rum 50ml #2	1	Неклассифицированные/default	0	
385000	089540451947	Kuya Fusion Rum 750ml	111587	Продукты питания (folder)/Алкогольные напитки/Ром	0	
4466125	895404519476	Kuya Fusion Rum 750ml #2	1	Неклассифицированные/default	0	
3686786	4600682001515	Kuybyshevskoe светлое 0.47l j bo l x	22186	Продукты питания (folder)/Алкогольные напитки/Пиво	3686785	KUYBYSHEVSKOE (BALTIKA)
3686789	4600682001218	Kuybyshevskoe светлое 1l nf l x	22186	Продукты питания (folder)/Алкогольные напитки/Пиво	3686785	KUYBYSHEVSKOE (BALTIKA)
385001	7809590500005	Kuyen Red Wine glass 750ml	22133	Продукты питания (folder)/Алкогольные напитки/Вино (folder)/Вино	0	
4466126	074867789040	Kuza Coconut Oil Conditioner&Hair dressing	1	Неклассифицированные/default	0	
4466127	074867781075	Kuza Hair Food	1	Неклассифицированные/default	0	
4466128	074867784144	Kuza Hair Food #2	1	Неклассифицированные/default	0	
615518	074867770369	Kuza indian hemp Hair&scalp	1	Неклассифицированные/default	0	
4466129	074867793184	Kuza indian sage Hair Conditioner	1	Неклассифицированные/default	0	
3297200	4607110290121	Kuzbass lvz Extra traditsii kachestva vd 0.5l	22581	Продукты питания (folder)/Алкогольные напитки/Водка	3686790	KUZBASS LVZ
3686792	4601872050450	Kuzbass vd 0.5l	22581	Продукты питания (folder)/Алкогольные напитки/Водка	3686791	KUZBASS (SIBIRSKIY DELOVOY SOYUZ)
2888145	4660019630566	Kuzbasskiy pk livrn.po-dmshnm kolb. offal bol. bl 0.3kg	1	Неклассифицированные/default	3686794	KUZBASSKIY PK (ROST POZITIV IMPULS APKH)
2942261	4607060775389	Kuzbasskiy pk домашний farsh minced bef&prk 0.7kg	1	Неклассифицированные/default	3686794	KUZBASSKIY PK (ROST POZITIV IMPULS APKH)
4466130	677662361925	Kuzmama music CD Kim kuzma: contradictions	1	Неклассифицированные/default	0	
4466131	677662772721	Kuzmama music CD tim hughes: reverence	1	Неклассифицированные/default	0	
3686796	3585802000672	Kuzmichev набор чая дневной с сит.5x 25г	21794	Продукты питания (folder)/Чай и кофе/Чай	3686795	KUZMICHEV
3686797	3585802000474	Kuzmichev набор чая зеленый 5x 25г	21794	Продукты питания (folder)/Чай и кофе/Чай	3686795	KUZMICHEV
3686798	3585802000290	Kuzmichev набор чая мгновен.с сит.5x 25г	21794	Продукты питания (folder)/Чай и кофе/Чай	3686795	KUZMICHEV
3297155	4601351002048	Kuznetskaya (obyed.penz.vod.z.) vd 0.25l	22581	Продукты питания (folder)/Алкогольные напитки/Водка	3686799	KUZNETSKAYA (OBYEDINYONNYE PENZ.VOD.ZAVODY/PENZA)
3686800	4601351000679	Kuznetskaya (obyed.penz.vod.z.) vd 0.5l	22581	Продукты питания (folder)/Алкогольные напитки/Водка	3686799	KUZNETSKAYA (OBYEDINYONNYE PENZ.VOD.ZAVODY/PENZA)
3686802	4607127550973	Kuznetskaya mol.komp./kemer.o. bilberry n 0.4kg gm p 2.5% f	144938	Продукты питания (folder)/Молочные продукты (folder)/Молочные продукты	3686801	KUZNETSKAYA MOL.KOMP./KEMEROVSK.OBL.
3686803	4607127550997	Kuznetskaya mol.komp./kemer.o. Cherry n 0.4kg gm p 2.5% f	144938	Продукты питания (folder)/Молочные продукты (folder)/Молочные продукты	3686801	KUZNETSKAYA MOL.KOMP./KEMEROVSK.OBL.
3686804	4607127550966	Kuznetskaya mol.komp./kemer.o. pas.fr&Peach n 0.4kg gm p 2.5% f	144938	Продукты питания (folder)/Молочные продукты (folder)/Молочные продукты	3686801	KUZNETSKAYA MOL.KOMP./KEMEROVSK.OBL.
3686805	4607127550959	Kuznetskaya mol.komp./kemer.o. premim n 0.4kg gm p 2.5% pl	144938	Продукты питания (folder)/Молочные продукты (folder)/Молочные продукты	3686801	KUZNETSKAYA MOL.KOMP./KEMEROVSK.OBL.
3686806	4607127550980	Kuznetskaya mol.komp./kemer.o. strawberry n 0.4kg gm p 2.5% f	144938	Продукты питания (folder)/Молочные продукты (folder)/Молочные продукты	3686801	KUZNETSKAYA MOL.KOMP./KEMEROVSK.OBL.
3686807	4607127550751	Kuznetskaya mol.komp./kemer.o. крестьянское but 0.18kg f wp 72.5%	1240988	Продукты питания (folder)/Масложировая продукция (folder)/Масложировая продукция	3686801	KUZNETSKAYA MOL.KOMP./KEMEROVSK.OBL.
217120	4958325221135	Kuzu musa org 100g	205988	Продукты питания (folder)/Национальная кухня/Japanese Foods	0	
3414619	4607041651442	Kuzya (yanus gk/chel) plm ws 0.07kg	30752	Продукты питания (folder)/Мороженое	3686809	KUZYA (YANUS GK/CHELYABINSK)
1472712	625034203168	Kv bar frt grape 0.7 z	1	Неклассифицированные/default	0	
1517672	625034203175	Kv bar frt strawberr	1	Неклассифицированные/default	0	
1033986	346094004006	Kv imports chateau antugnac aux bons hommes 750ml /12	1	Неклассифицированные/default	0	
1033987	895246001047	Kv imports chateau beauchene chateauneuf du pape 750ml /12	1	Неклассифицированные/default	0	
1033988	895246001030	Kv imports chateau beauchene Premier terroir cotes du rhone 750ml /12	1	Неклассифицированные/default	0	
1033989	8985190010959	Kv imports confrerie des domains cremant de bourgogne 750ml /12	1	Неклассифицированные/default	0	
1033990	784068020759	Kv imports domaine de joy Sauvignon gros mansent 750ml /6	22133	Продукты питания (folder)/Алкогольные напитки/Вино (folder)/Вино	0	
1033991	898519001058	Kv imports domaine vrignaud chablis 750ml /12	1	Неклассифицированные/default	0	
1033992	898020001028	Kv imports La terre du pape terre des papes cotes du rhone blanc 750ml /12	22133	Продукты питания (folder)/Алкогольные напитки/Вино (folder)/Вино	0	
1033993	898020001011	Kv imports La terre du pape terre des papes cotes du rhone Rouge 750ml /12	22133	Продукты питания (folder)/Алкогольные напитки/Вино (folder)/Вино	0	
1033994	877594000187	Kv imports masion tramier cuvee Grand blanc 1/3l	1	Неклассифицированные/default	0	
1033995	877594000101	Kv imports masion tramier cuvee Grand blanc 750ml /12	1	Неклассифицированные/default	0	
1517674	025034203142	Kv Raspberry frt snk	1	Неклассифицированные/default	0	
1517675	025034203128	Kv strawberry snck	1	Неклассифицированные/default	0	
1517676	025034203135	Kv Tropical frt snck	1	Неклассифицированные/default	0	
1517677	025034203104	Kv wildbry frt snk	1	Неклассифицированные/default	0	
4466132	6939319248121	Kv-1	1	Неклассифицированные/default	0	
4466133	841020002755	Kv7-v socket a motherboard	1	Неклассифицированные/default	0	
1793605	4820009830028	Kvant nectar de rodii 1l	17371	Продукты питания (folder)/Напитки безалкогольные/Напитки	0	
3686812	4607034542061	Kvantserver/biysk sweet s 0.4kg	77	Продукты питания (folder)/Кондитерские изделия (folder)/Кондитерские изделия	3686811	KVANTSERVER/BIYSK
3686814	4860008661728	Kvarel'skiy pogreb s/s w 0.75l	296061	Продукты питания (folder)/Алкогольные напитки/Вино (folder)/Вино игристое	3686813	KVAREL'SKIY POGREB (KVAREL'SKIY POGREB/GEORGIA)
3686815	4860008661735	Kvarel'skiy pogreb s/s w 0.75l #2	296061	Продукты питания (folder)/Алкогольные напитки/Вино (folder)/Вино игристое	3686813	KVAREL'SKIY POGREB (KVAREL'SKIY POGREB/GEORGIA)
3686818	4680006331535	Kvashenka традиционный sauce khrenodyor m p v 0.2kg	545856	Продукты питания (folder)/Соус	3686817	KVASHENKA (AGROPROD)
3340356	4810392005684	Kvasovar belorus.Original. квас 1.5l bo p	1772558	Продукты питания (folder)/Напитки безалкогольные/Квас	3686819	KVASOVAR (MARKETING TSENTR/BELARUS)
3340358	4810392005691	Kvasovar belorusskiy tyomniy квас 1.5l bo p	1772558	Продукты питания (folder)/Напитки безалкогольные/Квас	3686819	KVASOVAR (MARKETING TSENTR/BELARUS)
4466134	083227000589	Kvc entertainment 1lb his girl friday	1	Неклассифицированные/default	0	
4466135	083227010960	Kvc entertainment Black orchid - vhs videotape	1	Неклассифицированные/default	0	
4466136	083227010724	Kvc entertainment botany Bay - vhs videotape	1	Неклассифицированные/default	0	
4466137	083227800271	Kvc entertainment DVD candles and Champagne	1	Неклассифицированные/default	0	
4466138	083227800080	Kvc entertainment DVD Care for your lawn	1	Неклассифицированные/default	0	
4466139	083227800226	Kvc entertainment DVD chinese cuisine	1	Неклассифицированные/default	0	
4466140	083227800134	Kvc entertainment DVD Cool weather vegetables	1	Неклассифицированные/default	0	
4466141	083227801162	Kvc entertainment DVD crete and mycenae	1	Неклассифицированные/default	0	
4466142	083227800011	Kvc entertainment DVD cubist epoch	1	Неклассифицированные/default	0	
4466143	083227800097	Kvc entertainment DVD design a Flower Garden	1	Неклассифицированные/default	0	
4466144	083227800288	Kvc entertainment DVD dishes to go	1	Неклассифицированные/default	0	
4466145	083227800295	Kvc entertainment DVD fun meals for kids	1	Неклассифицированные/default	0	
4466146	083227800028	Kvc entertainment DVD germany Da Da	1	Неклассифицированные/default	0	
4466147	083227800035	Kvc entertainment DVD giotto	1	Неклассифицированные/default	0	
4466148	083227800042	Kvc entertainment DVD goya	1	Неклассифицированные/default	0	
4466149	083227800059	Kvc entertainment DVD greek temple	1	Неклассифицированные/default	0	
4466150	083227800110	Kvc entertainment DVD grow and cook herbs	1	Неклассифицированные/default	0	
4466151	083227800141	Kvc entertainment DVD grow flowers	1	Неклассифицированные/default	0	
4466152	083227800189	Kvc entertainment DVD grow roses	1	Неклассифицированные/default	0	
4466153	083227800158	Kvc entertainment DVD healthy houseplants	1	Неклассифицированные/default	0	
4466154	083227800233	Kvc entertainment DVD italian cuisine	1	Неклассифицированные/default	0	
4466155	083227800066	Kvc entertainment DVD le corbusier	1	Неклассифицированные/default	0	
4466156	083227800240	Kvc entertainment DVD mexican cuisine	1	Неклассифицированные/default	0	
4466157	083227800257	Kvc entertainment DVD middle eastern cuisine	1	Неклассифицированные/default	0	
4466158	083227800264	Kvc entertainment DVD New orleans cuisine	1	Неклассифицированные/default	0	
4466159	083227800127	Kvc entertainment DVD nurture seedlings	1	Неклассифицированные/default	0	
4466160	083227800073	Kvc entertainment DVD picasso	1	Неклассифицированные/default	0	
4466161	083227800165	Kvc entertainment DVD plants in a greenhouse	1	Неклассифицированные/default	0	
4466162	083227800172	Kvc entertainment DVD plants in a sunspace	1	Неклассифицированные/default	0	
4466163	083227800196	Kvc entertainment DVD warm weather vegetables	1	Неклассифицированные/default	0	
4466164	083227110899	Kvc entertainment giotto and the pre-renaissance	1	Неклассифицированные/default	0	
4466165	083227010441	Kvc entertainment the cubist epoch videocassete	1	Неклассифицированные/default	0	
4466166	083227012353	Kvc entertainment this Happy feeling-vhs videotape	1	Неклассифицированные/default	0	
4466167	083227110691	Kvc entertainment vhs Good grief, charlie brown	1	Неклассифицированные/default	0	
4466168	083227012667	Kvc entertainment vhs Happy New year charlie brown	1	Неклассифицированные/default	0	
4466169	083227060583	Kvc entertainment vhs his girl friday (video film classics)	1	Неклассифицированные/default	0	
4466170	083227006260	Kvc entertainment vhs nurse edith cavell	1	Неклассифицированные/default	0	
4466171	083227008851	Kvc entertainment vhs thanksgiving dinner	1	Неклассифицированные/default	0	
4466172	083227013305	Kvc entertainment vhs the egg and i (claudette colbert, fred macmurray)	1	Неклассифицированные/default	0	
4466173	083227002316	Kvc entertainment vhs the ranger and the Lady	1	Неклассифицированные/default	0	
4466174	083227013275	Kvc entertainment vhs very funny, charlie brown	1	Неклассифицированные/default	0	
4466175	083227013268	Kvc entertainment vhs what next, charlie brown?	1	Неклассифицированные/default	0	
4466176	083227013220	Kvc entertainment vhs you can't win, charlie brown	1	Неклассифицированные/default	0	
4466177	083227012605	Kvc entertainment vhs you're a Good Sport, charlie brown	1	Неклассифицированные/default	0	
4466178	083227010434	Kvc entertainment video le corbusier (museum without walls)	1	Неклассифицированные/default	0	
4466179	083227009117	Kvc entertainment video: the rebels: marlon brando	1	Неклассифицированные/default	0	
4466180	037514000073	Kvcfhfcdhdch	1	Неклассифицированные/default	0	
2883075	4612739460152	Kven нежные fish cakes 0.4kg v	1	Неклассифицированные/default	3686820	KVEN (KVEN/NAKHODKA)
2228873	4603552010174	Kvest on palochka humpb.Salmon s stock. 0.05kg	37056	Продукты питания (folder)/Снэки рыбные и мясные	2221399	Квест Он
3686822	4603552015421	Kvest on pistachio salt s 0.035kg	19	Продукты питания (folder)/Орехи	3686821	KVEST ON (SI-PROJEKT/SPB)
3686823	4603552012598	Kvest on pistachio salt s 0.1kg	19	Продукты питания (folder)/Орехи	3686821	KVEST ON (SI-PROJEKT/SPB)
3686824	4603552015520	Kvest on pistachio salt s 0.1kg #2	19	Продукты питания (folder)/Орехи	3686821	KVEST ON (SI-PROJEKT/SPB)
3686825	5604572008782	Kvest on squid shredded fish dr.0.03kg	37056	Продукты питания (folder)/Снэки рыбные и мясные	3686821	KVEST ON (SI-PROJEKT/SPB)
3686827	4630012563512	Kvest новогодний 0.4kg	271328	Товары для праздников (folder)/Подарок новогодний	3686826	KVEST новогодний (SLADKAYA ZHIZN/NIZHNIY NOVGOROD)
2164631	85911161	Kvet fialka 50ml kolinska voda	1	Неклассифицированные/default	0	
2164632	85911192	Kvet karafiat 50ml kolinska voda	1	Неклассифицированные/default	0	
2164633	85911185	Kvet konvalinka 50ml kolinska voda	1	Неклассифицированные/default	0	
2617125	9771335555008	Kvety a zahrada 2m	3300794	Полиграфия (folder)/Периодические издания	0	
4466181	7622400974434	Kvikk lunsj freia kjekssjokolade 47g	1	Неклассифицированные/default	0	
3686829	4601757001867	Kvilli milli lemonade 0.5l bo p	17371	Продукты питания (folder)/Напитки безалкогольные/Напитки	3686828	KVILLI MILLI (MOLOKO/ROSSOSH VORONEZHSKAYA OBL.)
3686830	4601757001911	Kvilli milli lemonade 1.5l bo p	17371	Продукты питания (folder)/Напитки безалкогольные/Напитки	3686828	KVILLI MILLI (MOLOKO/ROSSOSH VORONEZHSKAYA OBL.)
3686831	4601757002055	Kvilli milli mojito 1.5l bo p	17371	Продукты питания (folder)/Напитки безалкогольные/Напитки	3686828	KVILLI MILLI (MOLOKO/ROSSOSH VORONEZHSKAYA OBL.)
3686832	4601757001881	Kvilli milli Orange 0.5l bo p	17371	Продукты питания (folder)/Напитки безалкогольные/Напитки	3686828	KVILLI MILLI (MOLOKO/ROSSOSH VORONEZHSKAYA OBL.)
3686833	4601757001935	Kvilli milli Orange 1.5l bo p	17371	Продукты питания (folder)/Напитки безалкогольные/Напитки	3686828	KVILLI MILLI (MOLOKO/ROSSOSH VORONEZHSKAYA OBL.)
3686834	4601757001874	Kvilli milli pear 0.5l bo p	17371	Продукты питания (folder)/Напитки безалкогольные/Напитки	3686828	KVILLI MILLI (MOLOKO/ROSSOSH VORONEZHSKAYA OBL.)
3686835	4601757001928	Kvilli milli pear 1.5l bo p	17371	Продукты питания (folder)/Напитки безалкогольные/Напитки	3686828	KVILLI MILLI (MOLOKO/ROSSOSH VORONEZHSKAYA OBL.)
3686836	4601757001843	Kvilli milli буратино 0.5l bo p	17371	Продукты питания (folder)/Напитки безалкогольные/Напитки	3686828	KVILLI MILLI (MOLOKO/ROSSOSH VORONEZHSKAYA OBL.)
3686837	4601757001898	Kvilli milli буратино 1.5l bo p	17371	Продукты питания (folder)/Напитки безалкогольные/Напитки	3686828	KVILLI MILLI (MOLOKO/ROSSOSH VORONEZHSKAYA OBL.)
3686838	4601757001904	Kvilli milli колокольчик 1.5l bo p	17371	Продукты питания (folder)/Напитки безалкогольные/Напитки	3686828	KVILLI MILLI (MOLOKO/ROSSOSH VORONEZHSKAYA OBL.)
3368074	4600521002895	Kvint (sheriff gk/moldova) 3y b 0.25l	22210	Продукты питания (folder)/Алкогольные напитки/Коньяк	39805	Kvint
3686840	4840709002778	Kvint (sheriff gk/moldova) 3y b 0.25l #2	3607395	Продукты питания (folder)/Алкогольные напитки/Бренди	3686839	KVINT (SHERIFF GK/MOLDOVA)
3686841	4600521101000	Kvint (sheriff gk/moldova) 3y b 0.5l	3607395	Продукты питания (folder)/Алкогольные напитки/Бренди	3686839	KVINT (SHERIFF GK/MOLDOVA)
