ID	UPCEAN	Name	CategoryID	CategoryName	BrandID	BrandName
283654	3423290045907	Вино chateau шобинэ bordeaux красн сух 750мл 12.5% /Франция/	22133	Продукты питания (folder)/Алкогольные напитки/Вино (folder)/Вино	3791033	ШАТО ШОБИНЭ
1760316	3423290026821	Вино chateau шобинэ красн сух 750мл	22133	Продукты питания (folder)/Алкогольные напитки/Вино (folder)/Вино	3791033	ШАТО ШОБИНЭ
3791034	3423290056255	Вино chateau шобинэ красн сух 750мл #2	22133	Продукты питания (folder)/Алкогольные напитки/Вино (folder)/Вино	3791033	ШАТО ШОБИНЭ
3791035	3423290071449	Вино chateau шобинэ красн сух 750мл #3	22133	Продукты питания (folder)/Алкогольные напитки/Вино (folder)/Вино	3791033	ШАТО ШОБИНЭ
2720970	3423290150953	Вино chateau шобинэ. bordeaux совиньон бел сух 750мл 12.5%	22133	Продукты питания (folder)/Алкогольные напитки/Вино (folder)/Вино	0	
2227521	3335200004631	Вино chateau шовеле красное сухое 12% 750мл стекло	22133	Продукты питания (folder)/Алкогольные напитки/Вино (folder)/Вино	0	
2427520	4601897005008	Вино chateau эжен каберне красн сух 10.5-12.5% 2.000	22133	Продукты питания (folder)/Алкогольные напитки/Вино (folder)/Вино	0	
170928	4601897004650	Вино chateau эжен мерло 0.700л 10% красн полусладк	22133	Продукты питания (folder)/Алкогольные напитки/Вино (folder)/Вино	0	
283055	4601897005015	Вино chateau эжен мерло красн сух 2.0л 10.5-12.5% /Россия/	22133	Продукты питания (folder)/Алкогольные напитки/Вино (folder)/Вино	0	
283056	4601897003141	Вино chateau эжен мерло красн сух 3.0л 10.5-12.5% /Коллекция фр.вин/	22133	Продукты питания (folder)/Алкогольные напитки/Вино (folder)/Вино	0	
2427521	4601897003158	Вино chateau эжен ренессанс красн полусладк 10-12% 3.000	22133	Продукты питания (folder)/Алкогольные напитки/Вино (folder)/Вино	0	
171324	4601897004698	Вино chateau эжен шардоне 10% бел полусладк 700мл	22133	Продукты питания (folder)/Алкогольные напитки/Вино (folder)/Вино	0	
283570	4601897003110	Вино chateau эжен шардоне бел сух 3.0л 10.5-12.5% /Коллекция фр.вин/	22133	Продукты питания (folder)/Алкогольные напитки/Вино (folder)/Вино	0	
688686	3380310000509	Вино chateau элизе красн сух 750мл/помероль	688367	Продукты питания (folder)/Алкогольные напитки/Вино (folder)/Вина Франции Бордо	688685	Шато Элизе
47428	3438910621430	Вино chateau эммануэль 01г красн сух 12% 750мл	41821	Продукты питания (folder)/Алкогольные напитки/Вино (folder)/Вина Франции	0	
3791037	4630015890660	Вино chateau эрк.анчелотта красн сух 10-12% 750мл	22133	Продукты питания (folder)/Алкогольные напитки/Вино (folder)/Вино	3791036	ШАТО ЭРКЕН
3791038	4630015890684	Вино chateau эрк.Кристалл бел сух 10-12% 750мл	22133	Продукты питания (folder)/Алкогольные напитки/Вино (folder)/Вино	3791036	ШАТО ЭРКЕН
3791039	4630015890394	Вино chateau эрк.мерло к.полусладк 10-12% 700мл	22133	Продукты питания (folder)/Алкогольные напитки/Вино (folder)/Вино	3791036	ШАТО ЭРКЕН
3791040	4630015890417	Вино chateau эрк.пино нуар к.полусладк 10-12% 700мл	22133	Продукты питания (folder)/Алкогольные напитки/Вино (folder)/Вино	3791036	ШАТО ЭРКЕН
3791041	4630015890370	Вино chateau эрк.сов.блан б.полусладк 10-12% 700мл	22133	Продукты питания (folder)/Алкогольные напитки/Вино (folder)/Вино	3791036	ШАТО ЭРКЕН
3791042	4630015890356	Вино chateau эрк.шардоне б.полусладк 10-12% 700мл	22133	Продукты питания (folder)/Алкогольные напитки/Вино (folder)/Вино	3791036	ШАТО ЭРКЕН
2227522	3303291803402	Вино chateau эрмитаж мазейрес помероль 2009 красн/сух 0.75 13% 1/6	22133	Продукты питания (folder)/Алкогольные напитки/Вино (folder)/Вино	0	
1759829	3536650000055	Вино chateaun.du pape красн сух 13.5% 750мл	22133	Продукты питания (folder)/Алкогольные напитки/Вино (folder)/Вино	351796	CHATEAU
3791043	4600001250013	Вино chateaun.du pape красн сух 13.5% 750мл #2	22133	Продукты питания (folder)/Алкогольные напитки/Вино (folder)/Вино	351796	CHATEAU
3791044	4600201520015	Вино chateaun.du pape красн сух 13.5% 750мл #3	22133	Продукты питания (folder)/Алкогольные напитки/Вино (folder)/Вино	351796	CHATEAU
3791045	4607090122825	Вино chateaun.du pape красн сух 13.5% 750мл #4	22133	Продукты питания (folder)/Алкогольные напитки/Вино (folder)/Вино	351796	CHATEAU
3791046	4607090123877	Вино chateaun.du pape красн сух 13.5% 750мл #5	22133	Продукты питания (folder)/Алкогольные напитки/Вино (folder)/Вино	351796	CHATEAU
2427414	3760205900808	Вино chatelain du roi белое полусладк 10% 750мл стекло	22133	Продукты питания (folder)/Алкогольные напитки/Вино (folder)/Вино	0	
3292284	3760205900983	Вино chatelain du roi красное полусладк 10% 1л пэт	22133	Продукты питания (folder)/Алкогольные напитки/Вино (folder)/Вино	0	
2427416	3760205900822	Вино chatelain du roi красное полусладк 10% 750мл стекло	22133	Продукты питания (folder)/Алкогольные напитки/Вино (folder)/Вино	0	
3292285	3760205900969	Вино chatelain du roi полусладк белое 10% tetrapak 1л	22133	Продукты питания (folder)/Алкогольные напитки/Вино (folder)/Вино	0	
2427415	3760205900785	Вино chatelain du roi столов красное сухое 11% 750мл стбут	22133	Продукты питания (folder)/Алкогольные напитки/Вино (folder)/Вино	0	
3284119	3077051202957	Вино chatelain julien белое сухое 11% 750мл ст/б	22133	Продукты питания (folder)/Алкогольные напитки/Вино (folder)/Вино	0	
3284120	3760205900228	Вино chatelain louis белое сухое 11% 750мл ст/б	22133	Продукты питания (folder)/Алкогольные напитки/Вино (folder)/Вино	0	
3284121	3760205900242	Вино chatelain louis красное сухое 11% 750мл ст/б	22133	Продукты питания (folder)/Алкогольные напитки/Вино (folder)/Вино	0	
3284122	3760205900280	Вино chatelain louis столов красное полусладк 10% 750мл стбут	22133	Продукты питания (folder)/Алкогольные напитки/Вино (folder)/Вино	0	
1191565	3540528446029	Вино chatelain rocailles 11.5% красн сух 750мл (Франция)	22133	Продукты питания (folder)/Алкогольные напитки/Вино (folder)/Вино	0	
1191566	3540528446012	Вино chatelain rocailles 12% белое сух 750мл (Франция)	22133	Продукты питания (folder)/Алкогольные напитки/Вино (folder)/Вино	0	
3284123	3760205900266	Вино chatelian louis белое полусладк 10% 750мл ст/б	22133	Продукты питания (folder)/Алкогольные напитки/Вино (folder)/Вино	0	
3284124	3760205900761	Вино chateline du roi столов белое сухое 11% 750мл стбут	22133	Продукты питания (folder)/Алкогольные напитки/Вино (folder)/Вино	0	
2720477	4620015670683	Вино chateu du soleil каберне красн сух 12% 700мл	22133	Продукты питания (folder)/Алкогольные напитки/Вино (folder)/Вино	3790363	ВИНА ЛИВАДИИ
3791047	3300599138342	Вино chav.moel. красн полусладк 11% 750мл	22133	Продукты питания (folder)/Алкогольные напитки/Вино (folder)/Вино	3634009	CHAVRON
1759836	3250390108146	Вино chav.moel.бел полусладк 9-14% 750мл	22133	Продукты питания (folder)/Алкогольные напитки/Вино (folder)/Вино	45847	Сан Марко
3791048	4602665000317	Вино chav.moel.бел полусладк 9-14% 750мл #2	22133	Продукты питания (folder)/Алкогольные напитки/Вино (folder)/Вино	45847	Сан Марко
1195213	3180280450676	Вино chavron cuvee speciale красное сухое 11% 750мл ст/б	22133	Продукты питания (folder)/Алкогольные напитки/Вино (folder)/Вино	0	
3284125	3326262035398	Вино chavron cuvee speciale красное сухое 11% 750мл ст/б #2	22133	Продукты питания (folder)/Алкогольные напитки/Вино (folder)/Вино	0	
2720953	3300299282789	Вино chavron Rose moelleux розовое полусладк 11% 750мл ст/б	22133	Продукты питания (folder)/Алкогольные напитки/Вино (folder)/Вино	0	
2057046	8712100200366	Вино chavron бел сух 11% 750мл	1	Неклассифицированные/default	2057023	Calv?
47137	3300299142533	Вино chavron блан бел сух 3.0л 11% /русьимпорт/Франция	41821	Продукты питания (folder)/Алкогольные напитки/Вино (folder)/Вина Франции	47136	Шаврон
47138	3300299138352	Вино chavron блан бел сух 750мл 11% /Франция/	41821	Продукты питания (folder)/Алкогольные напитки/Вино (folder)/Вина Франции	47136	Шаврон
47139	3300299138338	Вино chavron блан муалле бел полусладк столов 750мл 11% /Франция/	41821	Продукты питания (folder)/Алкогольные напитки/Вино (folder)/Вина Франции	47136	Шаврон
1195910	3198129249756	Вино chavron бочковое белое полусладк 11% 750мл	22133	Продукты питания (folder)/Алкогольные напитки/Вино (folder)/Вино	0	
1195911	3198129249787	Вино chavron бочковое белое сухое 11% 750мл	22133	Продукты питания (folder)/Алкогольные напитки/Вино (folder)/Вино	0	
1195912	3198129249817	Вино chavron бочковое красное полусладк 11% 750мл	22133	Продукты питания (folder)/Алкогольные напитки/Вино (folder)/Вино	0	
1195913	3198129249848	Вино chavron бочковое красное сухое 11% 750мл	22133	Продукты питания (folder)/Алкогольные напитки/Вино (folder)/Вино	0	
151813	3300299141611	Вино chavron каберне совиньон красн сух 750мл 13% /Франция/русьимпорт/	41821	Продукты питания (folder)/Алкогольные напитки/Вино (folder)/Вина Франции	149689	Русьимпорт
2057047	8712100200380	Вино chavron красн сух 11% 750мл	1	Неклассифицированные/default	2057023	Calv?
151814	3300299141604	Вино chavron мерло красн сух 750мл 13% /Франция/	41821	Продукты питания (folder)/Алкогольные напитки/Вино (folder)/Вина Франции	149689	Русьимпорт
47140	3300299142540	Вино chavron руж красн сух 3.0л 11% /русьимпорт/Франция/	41821	Продукты питания (folder)/Алкогольные напитки/Вино (folder)/Вина Франции	47136	Шаврон
47141	3300299138369	Вино chavron руж красн сух 750мл 11% /Франция/	41821	Продукты питания (folder)/Алкогольные напитки/Вино (folder)/Вина Франции	47136	Шаврон
47142	3300299138345	Вино chavron руж муалле красн полусладк 750мл 11% /Франция/	41821	Продукты питания (folder)/Алкогольные напитки/Вино (folder)/Вина Франции	47136	Шаврон
151815	3300299141628	Вино chavron совиньон бел сух 750мл 12% /Франция/русьимпорт/	41821	Продукты питания (folder)/Алкогольные напитки/Вино (folder)/Вина Франции	149689	Русьимпорт
3284126	6921847627936	Вино cheng shu фруктовое сливовое с плодами сливы белое полусладк 13% 750мл стекло	22133	Продукты питания (folder)/Алкогольные напитки/Вино (folder)/Вино	0	
3284127	4660132801706	Вино cherri фруктовое красное полусладк 12% 750мл	22133	Продукты питания (folder)/Алкогольные напитки/Вино (folder)/Вино	0	
3284128	8410492003472	Вино cherubino valsangiacomo s.a. масиа дэ лос кабальерос полусладк белое 11.5% 0.7л стекло	22133	Продукты питания (folder)/Алкогольные напитки/Вино (folder)/Вино	0	
3284129	8410492003489	Вино cherubino valsangiacomo s.a. масиа дэ лос кабальерос полусладк красное 11.5% 750мл стекло	22133	Продукты питания (folder)/Алкогольные напитки/Вино (folder)/Вино	0	
1759837	7790975017877	Вино chev.d.andes красн с13% 750мл	22133	Продукты питания (folder)/Алкогольные напитки/Вино (folder)/Вино	0	
2853937	3500610035258	Вино chevalier alexis lichine bordeaux superieur красное сухое 750мл	22133	Продукты питания (folder)/Алкогольные напитки/Вино (folder)/Вино	0	
2853946	3500610041662	Вино chevalier alexis lichine Cabernet Sauvignon красное сухое 750мл	22133	Продукты питания (folder)/Алкогольные напитки/Вино (folder)/Вино	0	
2853121	3500610042102	Вино chevalier alexis lichine Chardonnay белое сухое 750мл	22133	Продукты питания (folder)/Алкогольные напитки/Вино (folder)/Вино	0	
2853947	3500610041655	Вино chevalier alexis lichine Merlot красное сухое 750мл	22133	Продукты питания (folder)/Алкогольные напитки/Вино (folder)/Вино	0	
41945	3500610034909	Вино chevalier alexis lichine бордо бел полусладк 750мл 11% /Франция/	41821	Продукты питания (folder)/Алкогольные напитки/Вино (folder)/Вина Франции	41944	Алексис Лишин
182037	3500610030352	Вино chevalier alexis lichine бордо красн сух 750мл	22133	Продукты питания (folder)/Алкогольные напитки/Вино (folder)/Вино	22455	Alexis Lichine
1196086	3700569800116	Вино chevalier de bur белое полусладк 10% 750мл ст/б	22133	Продукты питания (folder)/Алкогольные напитки/Вино (folder)/Вино	0	
691373	3700569800123	Вино chevalier de bur белое сухое столов, 11%, 750мл ст/б	22133	Продукты питания (folder)/Алкогольные напитки/Вино (folder)/Вино	0	
691374	3700569800130	Вино chevalier de bur крас. полусладк.10% 750мл (Франция)	22133	Продукты питания (folder)/Алкогольные напитки/Вино (folder)/Вино	0	
1196087	3700569800147	Вино chevalier de bur красное сухое 11% 750мл стекло	22133	Продукты питания (folder)/Алкогольные напитки/Вино (folder)/Вино	0	
3284130	3295890190550	Вино chevalier de Pierre белое сухое 11.5% 750мл ст/б	22133	Продукты питания (folder)/Алкогольные напитки/Вино (folder)/Вино	0	
3284131	3295890190604	Вино chevalier de Pierre каберне совиньон красное сухое 12% 750мл	22133	Продукты питания (folder)/Алкогольные напитки/Вино (folder)/Вино	0	
2720971	3295890190611	Вино chevalier de Pierre мерло красное сухое 12.5% 750мл ст/б	22133	Продукты питания (folder)/Алкогольные напитки/Вино (folder)/Вино	0	
2720803	3295890190581	Вино chevalier de Pierre столов красное полусладк 11.5% 750мл стекло	22133	Продукты питания (folder)/Алкогольные напитки/Вино (folder)/Вино	0	
3284132	3295890190574	Вино chevalier de Pierre столов красное сухое 12% 750мл ст/б	22133	Продукты питания (folder)/Алкогольные напитки/Вино (folder)/Вино	0	
2720972	3295890190598	Вино chevalier de Pierre шардоне белое сухое 12.5% 750мл ст/б	22133	Продукты питания (folder)/Алкогольные напитки/Вино (folder)/Вино	0	
3284133	3760205903540	Вино chevalier du val белое полусладк 10%, tetrapak 1л	22133	Продукты питания (folder)/Алкогольные напитки/Вино (folder)/Вино	0	
1196091	3760205901683	Вино chevalier du val столов полусладк белое 10% 750мл Франция	41821	Продукты питания (folder)/Алкогольные напитки/Вино (folder)/Вина Франции	0	
1196093	3760205901706	Вино chevalier du val столов полусладк красное 10% 750мл Франция	41821	Продукты питания (folder)/Алкогольные напитки/Вино (folder)/Вина Франции	0	
1196092	3760205901645	Вино chevalier du val столов сухое белое 11% 750мл Франция	41821	Продукты питания (folder)/Алкогольные напитки/Вино (folder)/Вина Франции	0	
1196094	3760205901669	Вино chevalier du val столов сухое красное 11% 750мл Франция	41821	Продукты питания (folder)/Алкогольные напитки/Вино (folder)/Вина Франции	0	
3284134	3308440057903	Вино chevalier Grand coeur белое столов сухое 11% 1л ст/б	22133	Продукты питания (folder)/Алкогольные напитки/Вино (folder)/Вино	0	
3284135	3308440057927	Вино chevalier Grand coeur красное столов сухое 11% 1л ст/б	22133	Продукты питания (folder)/Алкогольные напитки/Вино (folder)/Вино	0	
1760322	1000002667965	Вино chevalier lacassan 750мл шар	22133	Продукты питания (folder)/Алкогольные напитки/Вино (folder)/Вино	691375	Шевалье Лакассан
151895	3300299114639	Вино chevalier lacassan бел полусладк 750мл 11% /Франция/	41821	Продукты питания (folder)/Алкогольные напитки/Вино (folder)/Вина Франции	149706	РАД22
151896	3300299114622	Вино chevalier lacassan белое сухое 11% 750мл стекло	41821	Продукты питания (folder)/Алкогольные напитки/Вино (folder)/Вина Франции	149706	РАД22
283656	3300299146319	Вино chevalier lacassan бордо бел полусладк 750мл 11% /Франция/	41821	Продукты питания (folder)/Алкогольные напитки/Вино (folder)/Вина Франции	0	
283657	3300299157605	Вино chevalier lacassan бордо бел сух 750мл 12% /Франция/	41821	Продукты питания (folder)/Алкогольные напитки/Вино (folder)/Вина Франции	0	
283658	3300299146296	Вино chevalier lacassan бордо красн сух 750мл 13% /Франция/	41821	Продукты питания (folder)/Алкогольные напитки/Вино (folder)/Вина Франции	0	
691376	3300299157599	Вино chevalier lacassan бордо муалле бел полусладк 750мл	688367	Продукты питания (folder)/Алкогольные напитки/Вино (folder)/Вина Франции Бордо	691375	Шевалье Лакассан
2272906	3300299282574	Вино chevalier lacassan брют 10% 750мл	296061	Продукты питания (folder)/Алкогольные напитки/Вино (folder)/Вино игристое	3634590	CHEVALIER LACASSAN
2272902	3300299145398	Вино chevalier lacassan деми-сек 750мл 10.0%, полусухое	296061	Продукты питания (folder)/Алкогольные напитки/Вино (folder)/Вино игристое	0	
1760320	1000002687963	Вино chevalier lacassan каб.сов. красн сух 750мл	22133	Продукты питания (folder)/Алкогольные напитки/Вино (folder)/Вино	691375	Шевалье Лакассан
2272903	3300299158046	Вино chevalier lacassan каберне совиньон 750мл 14.0%, сухое, местное	41821	Продукты питания (folder)/Алкогольные напитки/Вино (folder)/Вина Франции	691375	Шевалье Лакассан
151897	3300299114615	Вино chevalier lacassan красн полусладк 750мл 11% /Франция/	41821	Продукты питания (folder)/Алкогольные напитки/Вино (folder)/Вина Франции	149706	РАД22
151898	3300299114608	Вино chevalier lacassan красн сух 11% 750мл /Франция/	41821	Продукты питания (folder)/Алкогольные напитки/Вино (folder)/Вина Франции	149706	РАД22
1196095	330029911460	Вино chevalier lacassan красн/сух 11% 750мл	41821	Продукты питания (folder)/Алкогольные напитки/Вино (folder)/Вина Франции	149706	РАД22
283659	3300299146289	Вино chevalier lacassan медок красн сух 12.5% 750мл /Франция/	41821	Продукты питания (folder)/Алкогольные напитки/Вино (folder)/Вина Франции	691375	Шевалье Лакассан
2272904	3300299158190	Вино chevalier lacassan мерло 14% сухое местное 750мл	41821	Продукты питания (folder)/Алкогольные напитки/Вино (folder)/Вина Франции	691375	Шевалье Лакассан
1760321	1000002677964	Вино chevalier lacassan мерло красн сух 750мл	22133	Продукты питания (folder)/Алкогольные напитки/Вино (folder)/Вино	691375	Шевалье Лакассан
2272905	3300299158053	Вино chevalier lacassan шардоне 14% сухое местное 750мл	41821	Продукты питания (folder)/Алкогольные напитки/Вино (folder)/Вина Франции	691375	Шевалье Лакассан
3284136	3531380065312	Вино chevalier белое сухое 11% 750мл стекло	22133	Продукты питания (folder)/Алкогольные напитки/Вино (folder)/Вино	0	
47448	3274039226022	Вино chevalier д'олер бел полусладк 11% 750мл	22133	Продукты питания (folder)/Алкогольные напитки/Вино (folder)/Вино	47447	Шевалье Д`Олер
47449	3274039237028	Вино chevalier д'олер бел сух 11% 750мл	22133	Продукты питания (folder)/Алкогольные напитки/Вино (folder)/Вино	47447	Шевалье Д`Олер
47450	3274039226008	Вино chevalier д'олер красн полусладк 12% 750мл	22133	Продукты питания (folder)/Алкогольные напитки/Вино (folder)/Вино	47447	Шевалье Д`Олер
