ID	UPCEAN	Name	CategoryID	CategoryName	BrandID	BrandName
3351347	4607007338110	Коктейль молочный топтыжка ванильное мороженое 3.2-2% 0.5л	1	Неклассифицированные/default	3923345	топтыжка (KOMOS GROUP GK/UDMURTIYA)
3351348	4607007337687	Коктейль молочный топтыжка горячий шоколад 3.2% tetrapak 1л	1	Неклассифицированные/default	0	
3351349	4607007338134	Коктейль молочный топтыжка ириска 2% 0.5л т/п	1	Неклассифицированные/default	0	
2871578	4607007337663	Коктейль молочный топтыжка карамельная ириска 200г tetrapak	1	Неклассифицированные/default	3923345	топтыжка (KOMOS GROUP GK/UDMURTIYA)
2871579	4607007338035	Коктейль молочный топтыжка карамельная ириска 3.2% 200г	1	Неклассифицированные/default	0	
2871582	4607007338233	Коктейль молочный топтыжка клубника со сливками 2.0% жир. 500г	1	Неклассифицированные/default	0	
2871581	4640017350710	Коктейль молочный топтыжка клубника со сливками 3.2% 0.5л	1	Неклассифицированные/default	3923345	топтыжка (KOMOS GROUP GK/UDMURTIYA)
1963644	4607007338530	Коктейль молочный топтыжка клубника со сливками 3.2% 200мл тв/уп	1	Неклассифицированные/default	3923345	топтыжка (KOMOS GROUP GK/UDMURTIYA)
729657	4607007332491	Коктейль молочный топтыжка клубника со сливками 3.2% жир. 200г	144938	Продукты питания (folder)/Молочные продукты (folder)/Молочные продукты	3923345	топтыжка (KOMOS GROUP GK/UDMURTIYA)
2731078	4607007338578	Коктейль молочный топтыжка клубника со сливками 950г	330591	Продукты питания (folder)/Продукты питания	0	
1963645	4607007338059	Коктейль молочный топтыжка шоколад 3.2% 500мл тв/уп	1	Неклассифицированные/default	0	
1963650	4607007332507	Коктейль молочный топтыжка шоколадный 3.2% 200мл тв/уп	1	Неклассифицированные/default	2714064	ВПП(Эколин)
3351351	4607007338271	Коктейль молочный топтыжко клубника со сливками 950г	1	Неклассифицированные/default	0	
1226295	4820003483237	Коктейль молочный тотоша карамель 2% 200г	1	Неклассифицированные/default	0	
1226296	4820003483213	Коктейль молочный тотоша клубничный 2% 200г	1	Неклассифицированные/default	0	
1226297	4820003483244	Коктейль молочный тотоша манго-апелисин 2% 200г	1	Неклассифицированные/default	0	
1226298	4820003483220	Коктейль молочный тотоша шоколад 2% 200г	1	Неклассифицированные/default	0	
3351352	4607047610696	Коктейль молочный три коровы два кота банан 3.2% tetrapak 200мл	1	Неклассифицированные/default	3923887	Три коровы два кота (MOLOCHNIY KIT/EKATERINBURG)
2774625	4607047610771	Коктейль молочный три коровы, два кота банан 2.5% 0.2л тба *27 гофра	1	Неклассифицированные/default	3923887	Три коровы два кота (MOLOCHNIY KIT/EKATERINBURG)
2774567	4607047610788	Коктейль молочный три коровы, два кота ванильное мороженое 2.5% 0.2л тба *27 гофра	1	Неклассифицированные/default	3923887	Три коровы два кота (MOLOCHNIY KIT/EKATERINBURG)
2774600	4607047610795	Коктейль молочный три коровы, два кота клубника 2.5% 0.2л тба *27 гофра	1	Неклассифицированные/default	3923887	Три коровы два кота (MOLOCHNIY KIT/EKATERINBURG)
2774644	4607047610801	Коктейль молочный три коровы, два кота шоколад 2.5% 0.2л тба *27 гофра	1	Неклассифицированные/default	3923887	Три коровы два кота (MOLOCHNIY KIT/EKATERINBURG)
2871533	4607029700759	Коктейль молочный ультрапаст с ароматом ванили мэджик милк 2.5% 0.2л тва (новая)	1	Неклассифицированные/default	3901401	село VOROSHILOVA AGROFIRMA/STAVROPOL.KRAY
2871534	4607029700681	Коктейль молочный ультрапаст с ароматом клубники мэджик милк 2.5% 0.2л тва (новая)	1	Неклассифицированные/default	3901401	село VOROSHILOVA AGROFIRMA/STAVROPOL.KRAY
2871535	4607029700841	Коктейль молочный ультрапаст с шоколадом мэджик милк 2.5% 0.2л тва	1	Неклассифицированные/default	3901401	село VOROSHILOVA AGROFIRMA/STAVROPOL.KRAY
2458273	4607060501384	Коктейль молочный ультрапастер авишка ваниль 2.5% мид	67200	Продукты питания (folder)/Молочные продукты (folder)/Молоко, сливки	3617604	AVISHKA (AVIDA MOL.KOMB./G.STAR.OSKOL BELG.OBL)
2458275	4607060501353	Коктейль молочный ультрапастер авишка клубника 2.5% мид	67200	Продукты питания (folder)/Молочные продукты (folder)/Молоко, сливки	3617604	AVISHKA (AVIDA MOL.KOMB./G.STAR.OSKOL BELG.OBL)
2871536	4607060501940	Коктейль молочный ультрапастер авишка шоколад 2.5% мид	1	Неклассифицированные/default	3617604	AVISHKA (AVIDA MOL.KOMB./G.STAR.OSKOL BELG.OBL)
2871537	4606068241582	Коктейль молочный ультрапастеризованный ванилька с ароматом ванильного мороженого мдж 3.2% тм дисней, тва, 0.2кг, 5.4кг	1	Неклассифицированные/default	0	
2871538	4606068241599	Коктейль молочный ультрапастеризованный земляничка с ароматом земляники мдж 3.2% тм дисней, тва, 0.2кг, 5.4кг	1	Неклассифицированные/default	0	
2871539	4640017351939	Коктейль молочный ультрапастеризованный клубника со сливками мдж 2% молочная речка edge, 0.2кг, 4.8кг	1	Неклассифицированные/default	0	
2871540	4690363012466	Коктейль молочный ультрапастеризованный с ароматом банана мдж 3.2% тм лакомо, tba, 0.2л, 5.4кг	1	Неклассифицированные/default	3948210	Лакомо
2871541	4640017350734	Коктейль молочный ультрапастеризованный с ароматом банана мдж 3.2% тм топтыжка edge 0.5кг, 6кг	1	Неклассифицированные/default	3923345	топтыжка (KOMOS GROUP GK/UDMURTIYA)
2871542	4690363043293	Коктейль молочный ультрапастеризованный с ароматом ванили мдж 3.2% тм лакомо, tba, 0.2л, 5.4кг	1	Неклассифицированные/default	3948210	Лакомо
2731100	4640017350758	Коктейль молочный ультрапастеризованный с ароматом ванильное мороженое мдж 3.2% тм топтыжка edge 0.5кг, 6кг	144938	Продукты питания (folder)/Молочные продукты (folder)/Молочные продукты	2714064	ВПП(Эколин)
2871543	4640017351434	Коктейль молочный ультрапастеризованный с ароматом земляники мдж 3.2% тм Fine Life, тва sq, 0.95кг, 11.4кг	1	Неклассифицированные/default	0	
2871544	4640017350796	Коктейль молочный ультрапастеризованный с ароматом карамельная ириска мдж 3.2% тм топтыжка edge 0.5кг, 6кг	1	Неклассифицированные/default	3923345	топтыжка (KOMOS GROUP GK/UDMURTIYA)
2443670	4607007337656	Коктейль молочный ультрапастеризованный с ароматом карамельной ириски мдж 3.2% топтыжка tba sq, 0.5кг, 6кг	1	Неклассифицированные/default	3923345	топтыжка (KOMOS GROUP GK/UDMURTIYA)
2871545	4690363012190	Коктейль молочный ультрапастеризованный с ароматом клубники мдж 3.2% тм лакомо, tba, 0.2л, 5.4	1	Неклассифицированные/default	3948210	Лакомо
2871546	4680320000735	Коктейль молочный ультрапастеризованный с ароматом клубники со сливками мдж 3.2% тм милкимоны, edge, 0.2кг, 4.8кг	1	Неклассифицированные/default	0	
2871547	4640017351922	Коктейль молочный ультрапастеризованный со вкусом банана мдж 2% молочная речка edge, 0.2кг, 4.8кг	1	Неклассифицированные/default	0	
2871548	4640017351960	Коктейль молочный ультрапастеризованный со вкусом ванильного мороженого мдж 2% молочная речка edge, 0.2кг, 4.8кг	1	Неклассифицированные/default	0	
2871549	4640017352004	Коктейль молочный ультрапастеризованный со вкусом карамельной ириски мдж 2% молочная речка edge, 0.2кг, 4.8кг	1	Неклассифицированные/default	0	
2871550	4640017351984	Коктейль молочный ультрапастеризованный шоколадный мдж 2% молочная речка edge, 0.2кг, 4.8кг	1	Неклассифицированные/default	0	
2871551	4640017351410	Коктейль молочный ультрапастеризованный шоколадный мдж 3.2% тм Fine Life, тва sq, 0.95кг, 11.4кг	1	Неклассифицированные/default	0	
1789969	4607007333474	Коктейль молочный ультрапастеризованный шоколадный мдж 3.2% тм ледниковый период, tba, 0.2л, 5.4кг	67200	Продукты питания (folder)/Молочные продукты (folder)/Молоко, сливки	3776806	ЛЕДНИКОВЫЙ ПЕРИОД
2871552	4606068021993	Коктейль молочный ультрапастеризованный шоколадный мдж 3.2% тм лента, tba, 0.2кг, 5.4кг	1	Неклассифицированные/default	0	
2871553	4680320000742	Коктейль молочный ультрапастеризованный шоколадный мдж 3.2% тм милкимоны, edge, 0.2кг, 4.8кг	1	Неклассифицированные/default	0	
2443611	4607007339582	Коктейль молочный ультрапастеризованный шоколадный мдж 3.2% тм миньоны edge 0.2кг, 4.8кг	144938	Продукты питания (folder)/Молочные продукты (folder)/Молочные продукты	3705969	MIN'ONY (KOMOS GROUP GK/UDMURTIYA)
2731110	4640017350772	Коктейль молочный ультрапастеризованный шоколадный мдж 3.2% тм топтыжка edge 0.5кг, 6кг	38894	Продукты питания (folder)/Молочные продукты (folder)/Молочные десерты	3923345	топтыжка (KOMOS GROUP GK/UDMURTIYA)
2871554	4606068241605	Коктейль молочный ультрапастеризованный шоколадный шоколадка мдж 3.2% тм дисней, тва, 0.2кг, 5.4кг	1	Неклассифицированные/default	0	
2871555	4640017351502	Коктейль молочный ультрапастеризованный, обогащенный белком, клубника со сливками мдж 0.1% тм to be, edge, 0.25кг, 6кг	1	Неклассифицированные/default	0	
2871556	4640017351489	Коктейль молочный ультрапастеризованный, обогащенный белком, со вкусом ванильного мороженого мдж 0.1% тм to be, edge, 0.25кг, 6	1	Неклассифицированные/default	0	
2871557	4640017351526	Коктейль молочный ультрапастеризованный, обогащенный белком, шоколадный мдж 0.2% тм to be, edge, 0.25кг, 6кг	1	Неклассифицированные/default	0	
2871559	4660043800096	Коктейль молочный фисташка 1000г тва #2	1	Неклассифицированные/default	0	
3351353	4610025950035	Коктейль молочный фрау му ваниль tetrapak 200г	1	Неклассифицированные/default	3660630	FRAU MU (AZBUKA KACHESTVA)
3351354	4610025950011	Коктейль молочный фрау му клубника tetrapak 200г	1	Неклассифицированные/default	3660630	FRAU MU (AZBUKA KACHESTVA)
2731129	4603380066800	Коктейль молочный Фрутоняня 200мл	23326	Продукты питания (folder)/Молочные продукты (folder)/Йогурт	0	
3351355	4600338008356	Коктейль молочный Фрутоняня клубника-земляника tetrapak 200мл	1	Неклассифицированные/default	777657	Фрутоняня
2871560	5054603001426	Коктейль молочный фундук	1	Неклассифицированные/default	0	
2871561	5054603011425	Коктейль молочный фундук с сиропом	1	Неклассифицированные/default	0	
67469	4600949010212	Коктейль молочный чудо 2% фруктовое 0.2л	67200	Продукты питания (folder)/Молочные продукты (folder)/Молоко, сливки	52873	Чудо
2956446	4600949246512	Коктейль молочный чудо 2% фруктовое 0.2л #2	67200	Продукты питания (folder)/Молочные продукты (folder)/Молоко, сливки	52873	Чудо
2956447	4600949146270	Коктейль молочный чудо 2% фруктовое 0.2л #3	67200	Продукты питания (folder)/Молочные продукты (folder)/Молоко, сливки	52873	Чудо
67470	4600949010151	Коктейль молочный чудо 2% фруктовое 1л	67200	Продукты питания (folder)/Молочные продукты (folder)/Молоко, сливки	52873	Чудо
2956448	4600949010311	Коктейль молочный чудо 2% фруктовое 1л #2	67200	Продукты питания (folder)/Молочные продукты (folder)/Молоко, сливки	52873	Чудо
1257746	4690228007330	Коктейль молочный чудо банан-карамель 2% 200г tetrapak	67200	Продукты питания (folder)/Молочные продукты (folder)/Молоко, сливки	52873	Чудо
1226301	4690228020025	Коктейль молочный чудо белый шоколад 3% 200г tetrapak	144938	Продукты питания (folder)/Молочные продукты (folder)/Молочные продукты	52873	Чудо
729687	4690228006876	Коктейль молочный чудо ваниль для взбивания 5% 950г tetrapak	67200	Продукты питания (folder)/Молочные продукты (folder)/Молоко, сливки	52873	Чудо
67472	4600949146706	Коктейль молочный чудо ваниль для взбивания 5% tetrapak 1л	67200	Продукты питания (folder)/Молочные продукты (folder)/Молоко, сливки	52873	Чудо
2458248	4690228026195	Коктейль молочный чудо гляссе кофе-пломбир 2% tetrapak 200г	67200	Продукты питания (folder)/Молочные продукты (folder)/Молоко, сливки	52873	Чудо
2443615	4690228026577	Коктейль молочный чудо детки 2.5% 200мл шоколад	144938	Продукты питания (folder)/Молочные продукты (folder)/Молочные продукты	3942942	Чудо детки
2731105	4690228026911	Коктейль молочный чудо детки с клубникой 3.2% 200мл тв/уп	23326	Продукты питания (folder)/Молочные продукты (folder)/Йогурт	52873	Чудо
2731106	4690228026843	Коктейль молочный чудо детки с шоколадом 2.5% 255мл пл/б	23326	Продукты питания (folder)/Молочные продукты (folder)/Йогурт	52873	Чудо
2948890	4690228032202	Коктейль молочный чудо детки со вкусом ванильный пломбир 2.5% 200мл тв/уп	1	Неклассифицированные/default	52873	Чудо
2731107	4690228026935	Коктейль молочный чудо детки со вкусом клубники 2.5% 260мл пэт	23326	Продукты питания (folder)/Молочные продукты (folder)/Йогурт	52873	Чудо
2731108	4690228026867	Коктейль молочный чудо детки шоколад 2.5% 900мл т/п	23326	Продукты питания (folder)/Молочные продукты (folder)/Йогурт	52873	Чудо
159481	4600949010182	Коктейль молочный чудо мдж 2% 0.2л ассортим	67200	Продукты питания (folder)/Молочные продукты (folder)/Молоко, сливки	52873	Чудо
67466	4600949010137	Коктейль молочный чудо мдж 2% 0.95л ассортим бум.пак.	67200	Продукты питания (folder)/Молочные продукты (folder)/Молоко, сливки	52873	Чудо
1226302	4690228019166	Коктейль молочный чудо молочное клубника мдж 2% 0.95л бут пэт	144938	Продукты питания (folder)/Молочные продукты (folder)/Молочные продукты	52873	Чудо
2731092	4690228026218	Коктейль молочный чудо обезжиренный со вкусом капучино tetrapak 200мл	38894	Продукты питания (folder)/Молочные продукты (folder)/Молочные десерты	52873	Чудо
1226303	4690228006869	Коктейль молочный чудо стерилизован банан/карамель 2% 960г	144938	Продукты питания (folder)/Молочные продукты (folder)/Молочные продукты	52873	Чудо
67465	4600949010199	Коктейль молочный чудо стерилизован ваниль 2% 200мл	67200	Продукты питания (folder)/Молочные продукты (folder)/Молоко, сливки	52873	Чудо
67467	4600949010205	Коктейль молочный чудо стерилизован клубника 2% 200мл	67200	Продукты питания (folder)/Молочные продукты (folder)/Молоко, сливки	52873	Чудо
729689	4690228006845	Коктейль молочный чудо стерилизован клубника 2% 960г	67200	Продукты питания (folder)/Молочные продукты (folder)/Молоко, сливки	52873	Чудо
23168	4600949140018	Коктейль молочный чудо стерилизован шоколад 3% 200мл	1	Неклассифицированные/default	52873	Чудо
67477	4607025396147	Коктейль молочный чудо шейк клубника-малина 285г	67200	Продукты питания (folder)/Молочные продукты (folder)/Молоко, сливки	52873	Чудо
67476	4607025395874	Коктейль молочный чудо шейк мдж 2% 0.285мл ассортим бум.	67200	Продукты питания (folder)/Молочные продукты (folder)/Молоко, сливки	52873	Чудо
1226305	7640145770012	Коктейль молочный шакериа банан мдж 1.5% 0.25л	144938	Продукты питания (folder)/Молочные продукты (folder)/Молочные продукты	0	
1226309	7640145770111	Коктейль молочный шакериа макиато мдж 3.0% 0.25л	144938	Продукты питания (folder)/Молочные продукты (folder)/Молочные продукты	0	
1226310	7640145770036	Коктейль молочный шакериа пино-колада мдж 1.5% 0.25л	144938	Продукты питания (folder)/Молочные продукты (folder)/Молочные продукты	0	
2731109	460700733958	Коктейль молочный шоколад 0.2л 3.2% добрый кашалот	38894	Продукты питания (folder)/Молочные продукты (folder)/Молочные десерты	0	
2731121	4600765026152	Коктейль молочный шоколад 1.5% 200мл тба приключения джови	23326	Продукты питания (folder)/Молочные продукты (folder)/Йогурт	3734865	PRIKLYUCHENIYA DZHOVI (LAKTIKA GK/VELIKIY NOVGOROD)
2871563	4660043800102	Коктейль молочный шоколад 1000г тва #2	1	Неклассифицированные/default	0	
2871565	4699301456256	Коктейль молочный шоколад-ваниль 2.5% 450г кор	1	Неклассифицированные/default	0	
3351357	4640009493616	Коктейль молочный шоколадный кубанский молочник 220г пл/бан	1	Неклассифицированные/default	3604524	Кубанский Молочник
3351358	4607007337953	Коктейль молочный шоколодный топтыжка	1	Неклассифицированные/default	0	
1226344	4820019693002	Коктейль молочный щодня 2.5% ваниль 300мл	1	Неклассифицированные/default	0	
1226345	4820019692982	Коктейль молочный щодня 2.5% клубника 300мл	1	Неклассифицированные/default	0	
1226346	4820019692999	Коктейль молочный щодня 2.5% шоколад 300мл	1	Неклассифицированные/default	0	
2951741	4610008504255	Коктейль молочный экомарк легкий мультифруктовый 1030г ст/б	1	Неклассифицированные/default	0	
3351359	4610008504248	Коктейль молочный экомарк легкий персик-маракуйя 1030г ст/б	1	Неклассифицированные/default	0	
3351360	4610008504262	Коктейль молочный экомарк легкий пинаколада 1030г ст/б	1	Неклассифицированные/default	0	
2871476	4610008505665	Коктейль молочный экопродукт ванильный вкус 1000г	1	Неклассифицированные/default	0	
2871491	4610008505672	Коктейль молочный экопродукт клубничный вкус 1000г	1	Неклассифицированные/default	0	
2871558	4610008505696	Коктейль молочный экопродукт фисташковый вкус 1000г	1	Неклассифицированные/default	0	
2871562	4610008505689	Коктейль молочный экопродукт шоколадный вкус 1000г	1	Неклассифицированные/default	0	
2731111	460677953120	Коктейль молочный эрмигурт ваниль 4% 290г	330591	Продукты питания (folder)/Продукты питания	2714064	ВПП(Эколин)
729632	4607161628973	Коктейль молочный юнимилк дисней карамель банан 2.5% tetrapak 260г	67200	Продукты питания (folder)/Молочные продукты (folder)/Молоко, сливки	719584	Дисней (гастр)
2741136	4607048481448	Коктейль молочный ясный луг ваниль 200мл т/п	144938	Продукты питания (folder)/Молочные продукты (folder)/Молочные продукты	38966	Danone
2741137	4607048481424	Коктейль молочный ясный луг клубника 200мл т/п	144938	Продукты питания (folder)/Молочные продукты (folder)/Молочные продукты	38966	Danone
3351361	4607048481707	Коктейль молочный ясный луг шоколад 3.2% tetrapak 200мл	1	Неклассифицированные/default	3332055	ясный луг
