ID	UPCEAN	Name	CategoryID	CategoryName	BrandID	BrandName
3812539	4690401361785	Игрушка button Blue мячик-корова 73-1011 7см	148621	Игрушки (folder)/Игрушка мягкая	1405259	Button Blue
3812540	4690401431785	Игрушка button Blue мячик-кот розов.73-1001 7см	148621	Игрушки (folder)/Игрушка мягкая	1405259	Button Blue
3812541	4690401501785	Игрушка button Blue мячик-лев коричн 73-1004 7см	148621	Игрушки (folder)/Игрушка мягкая	1405259	Button Blue
3812542	4690401671785	Игрушка button Blue мячик-лиса 73-1005 7см	148621	Игрушки (folder)/Игрушка мягкая	1405259	Button Blue
3812543	4690401741785	Игрушка button Blue мячик-роз.сова 73-1006 7см	148621	Игрушки (folder)/Игрушка мягкая	1405259	Button Blue
3812544	4690401811785	Игрушка button Blue мячик-серый кот 73-1002 7см	148621	Игрушки (folder)/Игрушка мягкая	1405259	Button Blue
3812545	4690462308859	Игрушка button Blue пес хаски 18см	148621	Игрушки (folder)/Игрушка мягкая	1405259	Button Blue
3812546	4690462615612	Игрушка button Blue подвеска 73-2092 20см	148621	Игрушки (folder)/Игрушка мягкая	1405259	Button Blue
3812555	4690462615704	Игрушка button Blue подвеска 73-2092 20см #10	148621	Игрушки (folder)/Игрушка мягкая	1405259	Button Blue
3812556	4690462615711	Игрушка button Blue подвеска 73-2092 20см #11	148621	Игрушки (folder)/Игрушка мягкая	1405259	Button Blue
3812557	4690462615728	Игрушка button Blue подвеска 73-2092 20см #12	148621	Игрушки (folder)/Игрушка мягкая	1405259	Button Blue
3812558	4690462615735	Игрушка button Blue подвеска 73-2092 20см #13	148621	Игрушки (folder)/Игрушка мягкая	1405259	Button Blue
3812559	4690462615742	Игрушка button Blue подвеска 73-2092 20см #14	148621	Игрушки (folder)/Игрушка мягкая	1405259	Button Blue
3812560	4690462615759	Игрушка button Blue подвеска 73-2092 20см #15	148621	Игрушки (folder)/Игрушка мягкая	1405259	Button Blue
3812547	4690462615629	Игрушка button Blue подвеска 73-2092 20см #2	148621	Игрушки (folder)/Игрушка мягкая	1405259	Button Blue
3812548	4690462615636	Игрушка button Blue подвеска 73-2092 20см #3	148621	Игрушки (folder)/Игрушка мягкая	1405259	Button Blue
3812549	4690462615643	Игрушка button Blue подвеска 73-2092 20см #4	148621	Игрушки (folder)/Игрушка мягкая	1405259	Button Blue
3812550	4690462615650	Игрушка button Blue подвеска 73-2092 20см #5	148621	Игрушки (folder)/Игрушка мягкая	1405259	Button Blue
3812551	4690462615667	Игрушка button Blue подвеска 73-2092 20см #6	148621	Игрушки (folder)/Игрушка мягкая	1405259	Button Blue
3812552	4690462615674	Игрушка button Blue подвеска 73-2092 20см #7	148621	Игрушки (folder)/Игрушка мягкая	1405259	Button Blue
3812553	4690462615681	Игрушка button Blue подвеска 73-2092 20см #8	148621	Игрушки (folder)/Игрушка мягкая	1405259	Button Blue
3812554	4690462615698	Игрушка button Blue подвеска 73-2092 20см #9	148621	Игрушки (folder)/Игрушка мягкая	1405259	Button Blue
3812561	4690462616107	Игрушка button Blue собака бас м/наб.20см	148621	Игрушки (folder)/Игрушка мягкая	1405259	Button Blue
3812562	4690462307869	Игрушка button Blue щенок 25см	148621	Игрушки (folder)/Игрушка мягкая	1405259	Button Blue
3812563	4690462615766	Игрушка button Blue щенок 73-25164 23см	148621	Игрушки (folder)/Игрушка мягкая	1405259	Button Blue
3812572	4690462615957	Игрушка button Blue щенок 73-25164 23см #10	148621	Игрушки (folder)/Игрушка мягкая	1405259	Button Blue
3812564	4690462615773	Игрушка button Blue щенок 73-25164 23см #2	148621	Игрушки (folder)/Игрушка мягкая	1405259	Button Blue
3812565	4690462615780	Игрушка button Blue щенок 73-25164 23см #3	148621	Игрушки (folder)/Игрушка мягкая	1405259	Button Blue
3812566	4690462615797	Игрушка button Blue щенок 73-25164 23см #4	148621	Игрушки (folder)/Игрушка мягкая	1405259	Button Blue
3812567	4690462615803	Игрушка button Blue щенок 73-25164 23см #5	148621	Игрушки (folder)/Игрушка мягкая	1405259	Button Blue
3812568	4690462615810	Игрушка button Blue щенок 73-25164 23см #6	148621	Игрушки (folder)/Игрушка мягкая	1405259	Button Blue
3812569	4690462615827	Игрушка button Blue щенок 73-25164 23см #7	148621	Игрушки (folder)/Игрушка мягкая	1405259	Button Blue
3812570	4690462615834	Игрушка button Blue щенок 73-25164 23см #8	148621	Игрушки (folder)/Игрушка мягкая	1405259	Button Blue
3812571	4690462615841	Игрушка button Blue щенок 73-25164 23см #9	148621	Игрушки (folder)/Игрушка мягкая	1405259	Button Blue
3812573	4690462286102	Игрушка button Blue щенок Афанасий 20см	148621	Игрушки (folder)/Игрушка мягкая	1405259	Button Blue
2273964	4690462286058	Игрушка button Blue щенок олег 18см	980	Игрушки (folder)/Игрушка	1405259	Button Blue
3812574	4690462308866	Игрушка button Blue ягненок 16см	148621	Игрушки (folder)/Игрушка мягкая	1405259	Button Blue
147854	4001167764534	Игрушка bаby annabell коляска для близнецов закр. кор.	712606	Игрушки (folder)/Куклы	147679	ZAPF
1768451	8019808108803	Игрушка camon косточка, латекс 12см	313226	Товары для животных (folder)/Игрушки для животных	1760430	Camon
1768452	8019808068619	Игрушка camon куриная ножка 12-17см (цена за 1шт)	313226	Товары для животных (folder)/Игрушки для животных	1760430	Camon
1768453	8019808044002	Игрушка camon мышонок интерактивный с микрочипом для кошек	451333	Товары для животных (folder)/Игрушки для кошек	1760430	Camon
1768454	8019808081731	Игрушка camon мышь на шарике, 11см для кошек	451333	Товары для животных (folder)/Игрушки для кошек	1760430	Camon
1768461	8019808043302	Игрушка camon мяч мягкий, резина d=50мм	313226	Товары для животных (folder)/Игрушки для животных	1760430	Camon
1768463	8019808112473	Игрушка camon мяч теннис.на веревке с петлей d=9.5см, х/б 40см	313226	Товары для животных (folder)/Игрушки для животных	1760430	Camon
229442	5903407022673	Игрушка Canpol развивающая на ножках	337649	Уход за детьми (folder)/Уход за детьми	225970	Canpol
3323336	7777773090028	Игрушка cappuci хомяк говорящий	1	Неклассифицированные/default	0	
57336	4891965004808	Игрушка cararama аварийная машина с прицепом 480	980	Игрушки (folder)/Игрушка	1980156	Cararama
57337	4891965004822	Игрушка cararama аварийный грузовик с прицепом 482	980	Игрушки (folder)/Игрушка	1980156	Cararama
57338	4891965048406	Игрушка cararama аварийный грузовик юнимог 484	980	Игрушки (folder)/Игрушка	1980156	Cararama
57339	4891965002026	Игрушка cararama автогараж 202/52183	980	Игрушки (folder)/Игрушка	1980156	Cararama
57341	4891965046808	Игрушка cararama автотранспортная серия 468	980	Игрушки (folder)/Игрушка	1980156	Cararama
57342	4891965004341	Игрушка cararama грузовики 434	980	Игрушки (folder)/Игрушка	1980156	Cararama
57343	4891965250007	Игрушка cararama Золотая серия 250d	980	Игрушки (folder)/Игрушка	1980156	Cararama
57345	4891965004327	Игрушка cararama Коллекция Премиум 432d	980	Игрушки (folder)/Игрушка	1980156	Cararama
771620	4891965004419	Игрушка Cararama машина + набор из	360621	Сувениры и подарки (folder)/Подарочный набор	0	
82974	4891965250083	Игрушка cararama машина 1:43	980	Игрушки (folder)/Игрушка	1980156	Cararama
57347	4891965004815	Игрушка cararama машина с фургоном 481	980	Игрушки (folder)/Игрушка	1980156	Cararama
57348	4891965250267	Игрушка cararama машинка 1:43 250nd	980	Игрушки (folder)/Игрушка	1980156	Cararama
2955482	4891965250090	Игрушка Cararama машинка 1:43 250nd #2	980	Игрушки (folder)/Игрушка	1980156	Cararama
715365	4891965017211	Игрушка cararama машинка 1:72 172х	980	Игрушки (folder)/Игрушка	1980156	Cararama
57349	4891965017204	Игрушка cararama машины 172	980	Игрушки (folder)/Игрушка	1980156	Cararama
57350	4891965017303	Игрушка cararama машины 3шт 173	980	Игрушки (folder)/Игрушка	1980156	Cararama
57351	4891965017518	Игрушка cararama машины 5шт 175х	980	Игрушки (folder)/Игрушка	1980156	Cararama
57352	4891965173900	Игрушка cararama машины экстр.помощь 3шт 173d	980	Игрушки (folder)/Игрушка	1980156	Cararama
57353	4891965017310	Игрушка cararama машины экстр.помощь 3шт 173х	980	Игрушки (folder)/Игрушка	1980156	Cararama
57354	4891965004310	Игрушка cararama микроавтобусы 431d	980	Игрушки (folder)/Игрушка	1980156	Cararama
1214674	4891965431024	Игрушка Cararama микроавтобусы 431d #2	980	Игрушки (folder)/Игрушка	1980156	Cararama
2955483	4891965431000	Игрушка Cararama микроавтобусы 431d #3	980	Игрушки (folder)/Игрушка	1980156	Cararama
57369	4891965001814	Игрушка cararama модель автом. спе	980	Игрушки (folder)/Игрушка	57335	Карарама
716600	4891965014395	Игрушка cararama модель машинка 143 tnd	980	Игрушки (folder)/Игрушка	0	
2979644	4891965143149	Игрушка Cararama модель машинка 143 tnd #2	980	Игрушки (folder)/Игрушка	1980156	Cararama
2979645	4891965143019	Игрушка Cararama модель машинка 143 tnd #3	980	Игрушки (folder)/Игрушка	1980156	Cararama
716601	4891965021904	Игрушка cararama модель машинка автопогрузчик 1:43 219	980	Игрушки (folder)/Игрушка	0	
60697	4891965210070	Игрушка cararama модель машины 1:43	980	Игрушки (folder)/Игрушка	0	
716996	4891965832005	Игрушка cararama набор автомобилей спасат.службы 1:72 832с	980	Игрушки (folder)/Игрушка	0	
717097	4891965173078	Игрушка cararama набор из 3-х машинок 1:72lc 173	980	Игрушки (folder)/Игрушка	0	
57357	4891965013008	Игрушка cararama набор юниор 130	980	Игрушки (folder)/Игрушка	1980156	Cararama
57358	4891965001319	Игрушка cararama набор юниор 131	980	Игрушки (folder)/Игрушка	1980156	Cararama
57359	4891965008325	Игрушка cararama набор юниор спасат.службы 832	980	Игрушки (folder)/Игрушка	1980156	Cararama
57360	4891965013107	Игрушка cararama набор юниор экспл.131	980	Игрушки (folder)/Игрушка	1980156	Cararama
57361	4891965004303	Игрушка cararama серия америка 430	980	Игрушки (folder)/Игрушка	1980156	Cararama
57362	4891965210001	Игрушка cararama спецтехника 210d	980	Игрушки (folder)/Игрушка	1980156	Cararama
57363	4891965002408	Игрушка cararama спецтехника 240	980	Игрушки (folder)/Игрушка	1980156	Cararama
57364	4891965017105	Игрушка cararama спецтехника в блист.171х	980	Игрушки (folder)/Игрушка	1980156	Cararama
57365	4891965100005	Игрушка cararama спецтехника в дисплее 100d	980	Игрушки (folder)/Игрушка	1980156	Cararama
57367	4891965003009	Игрушка cararama строительная техника 300	980	Игрушки (folder)/Игрушка	1980156	Cararama
57368	4891965004662	Игрушка cararama транспорт 466	980	Игрушки (folder)/Игрушка	1980156	Cararama
2460385	6438240475977	Игрушка cararama транспортная арт.420nd-009 тв/уп	980	Игрушки (folder)/Игрушка	0	
3812575	4605885673569	Игрушка carline машина волга 1:22 инерц.	461826	Игрушки (folder)/Игрушечный транспорт	2547934	Carline
3812576	4605885673583	Игрушка carline машина волга 1:22 инерц. #2	461826	Игрушки (folder)/Игрушечный транспорт	2547934	Carline
3323337	6982303010044	Игрушка cars 2 машинка	1	Неклассифицированные/default	0	
58362	4606471838201	Игрушка cars toon машина инерционная арт.46172 тв/уп	439735	Игрушки (folder)/Игрушка инерционная	56882	Мульти-Пульти
3323338	4000000026686	Игрушка cartoon deer лось музыкальный развивающий	1	Неклассифицированные/default	0	
3323339	8339299539703	Игрушка carzone с конфетой 5г	1	Неклассифицированные/default	0	
3323340	6902138576805	Игрушка cash register касса на батарейках тв/уп	1	Неклассифицированные/default	0	
1213842	4602010336450	Игрушка cast ring, 43x20 x6.5см, Box, арт.qq-1255h	452526	Игрушки (folder)/Игры развлекательные	0	
56417	4606471851989	Игрушка castorland паззл 2000 арт.48153 тв/уп	98188	Игрушки (folder)/Паззл	0	
56319	4606471828325	Игрушка catch ball Game пистолет-ловушка 3+	980	Игрушки (folder)/Игрушка	0	
3323341	6900000041246	Игрушка cbary машинка инерционная	1	Неклассифицированные/default	0	
3323342	4602010384758	Игрушка cdr вертолет на батарейках	1	Неклассифицированные/default	0	
3323343	4602010384772	Игрушка cdr вертолет на батарейках полиция	1	Неклассифицированные/default	0	
3812577	877799008551	Игрушка cepia аксессуары для собачек	712606	Игрушки (folder)/Куклы	3633219	CEPIA
3812578	877799006984	Игрушка cepia дворик собачий	712606	Игрушки (folder)/Куклы	3633219	CEPIA
3812579	877799006977	Игрушка cepia домики для собачек	712606	Игрушки (folder)/Куклы	3633219	CEPIA
772975	877799003594	Игрушка cepia набор базовый с хомячком	980	Игрушки (folder)/Игрушка	3633219	CEPIA
3812580	877799004843	Игрушка cepia набор дополнительный	148621	Игрушки (folder)/Игрушка мягкая	3633219	CEPIA
3812581	877799005505	Игрушка cepia ниндзя защитная броня	148621	Игрушки (folder)/Игрушка мягкая	3633219	CEPIA
3812582	877799005512	Игрушка cepia ниндзя плолоса препятствий	148621	Игрушки (folder)/Игрушка мягкая	3633219	CEPIA
3812583	877799004980	Игрушка cepia предметы игрового обихода	148621	Игрушки (folder)/Игрушка мягкая	3633219	CEPIA
3812584	877799006991	Игрушка cepia собачки	148621	Игрушки (folder)/Игрушка мягкая	3633219	CEPIA
3812585	877799007127	Игрушка cepia хом.наб.Del.мал/конв.для сна	712606	Игрушки (folder)/Куклы	3633219	CEPIA
3812586	877799002245	Игрушка cepia хомячки	148621	Игрушки (folder)/Игрушка мягкая	3633219	CEPIA
3812587	877799004133	Игрушка cepia хомячки #2	148621	Игрушки (folder)/Игрушка мягкая	3633219	CEPIA
3812588	877799004751	Игрушка cepia хомячки #3	148621	Игрушки (folder)/Игрушка мягкая	3633219	CEPIA
3812589	877799005628	Игрушка cepia хомячки кунг жу ниндзя	148621	Игрушки (folder)/Игрушка мягкая	3633219	CEPIA
146200	086947144403	Игрушка cesar двойной кинжал	146199	Игрушки (folder)/Игрушечное оружие	145901	Cesar
149080	3700263169649	Игрушка cesar домик клуб микки мауса дисней каркасный	458886	Игрушки (folder)/Игровые домики	145901	Cesar
149081	3700263159329	Игрушка cesar домик корабль пиратов карибского моря самораскрывающийся	458886	Игрушки (folder)/Игровые домики	145901	Cesar
149082	3700263164088	Игрушка cesar домик медвежонка Винни дисней каркасный	458886	Игрушки (folder)/Игровые домики	145901	Cesar
149083	3700263137693	Игрушка cesar домик микки мауса дисней каркасный	458886	Игрушки (folder)/Игровые домики	145901	Cesar
149084	3700263164057	Игрушка cesar домик невероятный халк самораскрывающийся	458886	Игрушки (folder)/Игровые домики	145901	Cesar
149085	3700263168567	Игрушка cesar домик приключения человека-паука каркасный	458886	Игрушки (folder)/Игровые домики	145901	Cesar
149086	3700263156342	Игрушка cesar домик ресторанчик рататуй дисней каркасный	458886	Игрушки (folder)/Игровые домики	145901	Cesar
149087	3700263132766	Игрушка cesar домик тачки дисней каркасный	458886	Игрушки (folder)/Игровые домики	145901	Cesar
149088	3700263167829	Игрушка cesar домик тачки с игровыми элементами дисней каркасный	458886	Игрушки (folder)/Игровые домики	145901	Cesar
149089	3700263156373	Игрушка cesar домик феи дисней каркасный	458886	Игрушки (folder)/Игровые домики	145901	Cesar
149090	3700263137808	Игрушка cesar домик ферма самораскрывающийся	458886	Игрушки (folder)/Игровые домики	145901	Cesar
149091	3700263154591	Игрушка cesar домик человека-паука каркасный	458886	Игрушки (folder)/Игровые домики	145901	Cesar
149092	3700263138706	Игрушка cesar домик человека-паука каркасный, со свет. эф.	458886	Игрушки (folder)/Игровые домики	145901	Cesar
149093	3700263142192	Игрушка cesar домик черепашек-ниндзя самораскрывающийся	458886	Игрушки (folder)/Игровые домики	145901	Cesar
146201	086947144397	Игрушка cesar египетский кинжал	146199	Игрушки (folder)/Игрушечное оружие	145901	Cesar
145904	3700263168598	Игрушка cesar игровой комплекс человек-паук	713265	Игрушки (folder)/Игровой набор	145901	Cesar
145905	3700263170560	Игрушка cesar игровой комплекс-тир дора	713265	Игрушки (folder)/Игровой набор	145901	Cesar
145906	3700263168574	Игрушка cesar игровой комплекс-тир пираты карибского моря	713265	Игрушки (folder)/Игровой набор	145901	Cesar
145907	3700263168581	Игрушка cesar игровой комплекс-тир тачки дисней	713265	Игрушки (folder)/Игровой набор	145901	Cesar
146202	086947144410	Игрушка cesar кинжал с цепью	146199	Игрушки (folder)/Игрушечное оружие	145901	Cesar
146203	086947141167	Игрушка cesar королевский скипетр	146199	Игрушки (folder)/Игрушечное оружие	145901	Cesar
146204	086947102328	Игрушка cesar секира викинга	146199	Игрушки (folder)/Игрушечное оружие	145901	Cesar
146205	086947145950	Игрушка cesar секира воина тьмы	146199	Игрушки (folder)/Игрушечное оружие	145901	Cesar
146206	086947145936	Игрушка cesar секира оруженосца	146199	Игрушки (folder)/Игрушечное оружие	145901	Cesar
146208	086947145967	Игрушка cesar серп людоеда	146199	Игрушки (folder)/Игрушечное оружие	145901	Cesar
146209	032692103592	Игрушка cesar тамагавк	146199	Игрушки (folder)/Игрушечное оружие	145901	Cesar
1213843	741811151016	Игрушка chap mei crazitop-2 капсулы с фигурками 001	980	Игрушки (folder)/Игрушка	146631	CHAP MEI
1213844	741811100083	Игрушка chap mei crazitop-2 юлы + 2 фигурки (в асс 4 набора) 008	980	Игрушки (folder)/Игрушка	146631	CHAP MEI
1213845	741811100045	Игрушка chap mei crazitop-7 фигурок + 1 секретная карсула с фигуркой (в асс 3 набора) 004	980	Игрушки (folder)/Игрушка	146631	CHAP MEI
1213846	741811100038	Игрушка chap mei crazitop-capsule-брелок-накопитель с 2 фигурками (в асс 4 набора) 003	980	Игрушки (folder)/Игрушка	146631	CHAP MEI
1213847	741811100021	Игрушка chap mei crazitop-машинка с 2 фигурками (ассортим 4 набора) 002	980	Игрушки (folder)/Игрушка	146631	CHAP MEI
1213848	741811100052	Игрушка chap mei crazitop-трон-накопитель + 4 фигурки 005	980	Игрушки (folder)/Игрушка	146631	CHAP MEI
1213849	741811100069	Игрушка chap mei crazitop-череп-накопитель + 4 фигурки 006	980	Игрушки (folder)/Игрушка	146631	CHAP MEI
146632	741811920018	Игрушка chap mei z-расер 01 (3 вида) эл/механич	980	Игрушки (folder)/Игрушка	146631	CHAP MEI
146633	741811710015	Игрушка chap mei викинги 01 (4 вида)	980	Игрушки (folder)/Игрушка	146631	CHAP MEI
146634	741811710022	Игрушка chap mei викинги 02 (3 вида)	980	Игрушки (folder)/Игрушка	146631	CHAP MEI
146635	741811710039	Игрушка chap mei викинги 03 (2 вида)	980	Игрушки (folder)/Игрушка	146631	CHAP MEI
146636	741811710046	Игрушка chap mei викинги 04	980	Игрушки (folder)/Игрушка	146631	CHAP MEI
146637	741811710060	Игрушка chap mei викинги 06	980	Игрушки (folder)/Игрушка	146631	CHAP MEI
146638	741811710077	Игрушка chap mei викинги 07	980	Игрушки (folder)/Игрушка	146631	CHAP MEI
146639	741811710084	Игрушка chap mei викинги 08	980	Игрушки (folder)/Игрушка	146631	CHAP MEI
1213850	741811080019	Игрушка chap mei водный пистолет 001	980	Игрушки (folder)/Игрушка	146631	CHAP MEI
1213851	741811080026	Игрушка chap mei водный пистолет 002	980	Игрушки (folder)/Игрушка	146631	CHAP MEI
146640	741811280013	Игрушка chap mei военный набор 4 01 4 вида	980	Игрушки (folder)/Игрушка	146631	CHAP MEI
146641	741811280037	Игрушка chap mei военный набор 4 03 4 вида	980	Игрушки (folder)/Игрушка	146631	CHAP MEI
146642	741811280044	Игрушка chap mei военный набор 4 04 2 вида	980	Игрушки (folder)/Игрушка	146631	CHAP MEI
146643	741811280082	Игрушка chap mei военный набор 4 08 2 вида	980	Игрушки (folder)/Игрушка	146631	CHAP MEI
146644	741811280099	Игрушка chap mei военный набор 4 09 2 вида	980	Игрушки (folder)/Игрушка	146631	CHAP MEI
280480	741811931038	Игрушка chap mei военный набор 4 103 393-103	980	Игрушки (folder)/Игрушка	146631	CHAP MEI
146645	741811281096	Игрушка chap mei военный набор 4 109 2 вида	980	Игрушки (folder)/Игрушка	146631	CHAP MEI
146646	741811281447	Игрушка chap mei военный набор 4 144 2 вида	980	Игрушки (folder)/Игрушка	146631	CHAP MEI
