ID	UPCEAN	Name	CategoryID	CategoryName	BrandID	BrandName
3334677	8801204307122	Карамель с малиновой вытяжкой 100г м/у	37145	Продукты питания (folder)/Кондитерские изделия (folder)/Карамель	0	
330624	4600495511874	Карамель с молочн. начин.вес.гранд-конти молоко 4кг	37145	Продукты питания (folder)/Кондитерские изделия (folder)/Карамель	3476704	Konti
2867951	4600495518460	Карамель с молочн. начин.вес.Золотая птичка 5кг	1	Неклассифицированные/default	0	
2867952	4600495518439	Карамель с молочн. начин.вес.конти молочная 5кг	1	Неклассифицированные/default	0	
2867953	4600495518408	Карамель с молочн. начин.вес.конти сливочная 5кг	1	Неклассифицированные/default	0	
2771219	4600495520791	Карамель с молочн. начин.вес.сеньорита клубника со вк.сливок 5кг	1	Неклассифицированные/default	0	
2867954	4823077618994	Карамель с начинкой cola pop рц 1кг/8пак	1	Неклассифицированные/default	0	
156156	4607019323906	Карамель с начинкой roshen-джус-микс 0.300	22145	Продукты питания (folder)/Кондитерские изделия (folder)/Конфеты	38604	Roshen
1234974	460701932497	Карамель с начинкой roshen-клубника со сливками 0.300	22145	Продукты питания (folder)/Кондитерские изделия (folder)/Конфеты	1189826	Рошен
2439715	4607157390624	Карамель с начинкой вишня 200г	37145	Продукты питания (folder)/Кондитерские изделия (folder)/Карамель	0	
2867853	4607087222293	Карамель с начинкой микс ассорти 300г	1	Неклассифицированные/default	0	
3334678	4607157398378	Карамель с начинкой милео шоколад невский весовой	37145	Продукты питания (folder)/Кондитерские изделия (folder)/Карамель	0	
3334679	4810067043379	Карамель с начинкой речной усач завертка вес. Спартак	37145	Продукты питания (folder)/Кондитерские изделия (folder)/Карамель	0	
2867955	6921571189069	Карамель с сюрп лекка ламп 0.007	1	Неклассифицированные/default	0	
1219170	4820046864345	Карамель с шокол/начинкой рачки-дружки 250г липецк	37145	Продукты питания (folder)/Кондитерские изделия (folder)/Карамель	1189826	Рошен
549108	5900238583151	Карамель с ябл/фр. нач. шипучая 0.100	37145	Продукты питания (folder)/Кондитерские изделия (folder)/Карамель	0	
2896041	4660008130503	Карамель сахарoff монпансье барбарисовое на изомальте 100г м/у	1	Неклассифицированные/default	3604477	Сахарoff
314455	4600717041530	Карамель свежесть 92г /ассортим./	37145	Продукты питания (folder)/Кондитерские изделия (folder)/Карамель	0	
3334680	6957342924713	Карамель светлячок Помада леденцовая 8г	37145	Продукты питания (folder)/Кондитерские изделия (folder)/Карамель	0	
2867956	6921078506161	Карамель светящаяся 6г	1	Неклассифицированные/default	0	
2867957	6921571189113	Карамель светящаяся 6г #2	1	Неклассифицированные/default	0	
2867958	6921078503566	Карамель светящаяся клоун 0.008	1	Неклассифицированные/default	0	
2867959	4680018437126	Карамель свит бокс елочка на палочке 17г	1	Неклассифицированные/default	0	
2867961	8034120401357	Карамель свит клаб вкус жвачки looney tunes 250г	1	Неклассифицированные/default	0	
2867962	8034120401418	Карамель свит клаб вкус колы looney tunes 250г	1	Неклассифицированные/default	0	
2867963	6943304700020	Карамель свит-дог на палочке 50г мир детства	1	Неклассифицированные/default	0	
3334681	4630000931576	Карамель свитэксим фруктовые нотки мини леденцовая 200г м/уп	37145	Продукты питания (folder)/Кондитерские изделия (folder)/Карамель	0	
3334682	4607087221180	Карамель свитэкстрим пиксель мини 150г м/у	37145	Продукты питания (folder)/Кондитерские изделия (folder)/Карамель	0	
2867964	4607157390181	Карамель сгущенка в карамели 6кг	1	Неклассифицированные/default	0	
2867965	4610000217436	Карамель сгущенное молочко 0.200	1	Неклассифицированные/default	0	
1219171	4823003105697	Карамель сгущеное молочко 1кг (житомир)	37145	Продукты питания (folder)/Кондитерские изделия (folder)/Карамель	0	
3334683	4602073070292	Карамель семе4ки микс 5 вкусов 250г м/у	37145	Продукты питания (folder)/Кондитерские изделия (folder)/Карамель	0	
3334684	4600495518712	Карамель сеньорита клубника со вкусом сливок 270г мяг/уп	37145	Продукты питания (folder)/Кондитерские изделия (folder)/Карамель	0	
3334685	4650062480249	Карамель сердечки 7г	37145	Продукты питания (folder)/Кондитерские изделия (folder)/Карамель	0	
3334686	4608078340217	Карамель сердечки леденцовая со вкусом клубники на палочке 12г мяг/уп	37145	Продукты питания (folder)/Кондитерские изделия (folder)/Карамель	0	
3334687	4650056574039	Карамель сердечки на палочке 12.5г	37145	Продукты питания (folder)/Кондитерские изделия (folder)/Карамель	0	
3334688	4650056574046	Карамель сердечки на палочке 12.5г #2	37145	Продукты питания (folder)/Кондитерские изделия (folder)/Карамель	0	
2867829	4670013491049	Карамель сердечко леденец 40г мяг/уп	1	Неклассифицированные/default	0	
3334689	4812324000026	Карамель сердце Love на палочке со вкусом манго 65г	37145	Продукты питания (folder)/Кондитерские изделия (folder)/Карамель	0	
2867886	4670013498772	Карамель сердце леденцовая со вкусом клубники на палочке 16г	1	Неклассифицированные/default	0	
3334690	4829898062527	Карамель сердце на палочке	37145	Продукты питания (folder)/Кондитерские изделия (folder)/Карамель	0	
3334691	4627124950118	Карамель сердце на палочке 14г мяг/уп	37145	Продукты питания (folder)/Кондитерские изделия (folder)/Карамель	0	
3334692	4626015330060	Карамель си си стик prop top мягкая в соломинке с игрушкой 11г мяг/уп	37145	Продукты питания (folder)/Кондитерские изделия (folder)/Карамель	0	
3334693	4626015335065	Карамель си си стик prop top мягкая в соломинке с игрушкой 11г мяг/уп #2	37145	Продукты питания (folder)/Кондитерские изделия (folder)/Карамель	0	
3334694	6920344802006	Карамель си си стик prop top мягкая в соломинке с игрушкой 11г мяг/уп #3	37145	Продукты питания (folder)/Кондитерские изделия (folder)/Карамель	0	
3334695	4626015330817	Карамель си си стик апельсин мягкая в соломке 7г мяг/уп	37145	Продукты питания (folder)/Кондитерские изделия (folder)/Карамель	0	
3334696	4626015335812	Карамель си си стик апельсин мягкая в соломке 7г мяг/уп #2	37145	Продукты питания (folder)/Кондитерские изделия (folder)/Карамель	0	
3334697	4626015330855	Карамель си си стик ваниль мягкая в соломке 7г мяг/уп	37145	Продукты питания (folder)/Кондитерские изделия (folder)/Карамель	0	
3334698	4626015335850	Карамель си си стик ваниль мягкая в соломке 7г мяг/уп #2	37145	Продукты питания (folder)/Кондитерские изделия (folder)/Карамель	0	
3334699	4626015330848	Карамель си си стик виноград мягкая в соломке 7г мяг/уп	37145	Продукты питания (folder)/Кондитерские изделия (folder)/Карамель	0	
3334700	4626015335843	Карамель си си стик виноград мягкая в соломке 7г мяг/уп #2	37145	Продукты питания (folder)/Кондитерские изделия (folder)/Карамель	0	
3334701	4626015330800	Карамель си си стик клубника мягкая в соломке 7г мяг/уп	37145	Продукты питания (folder)/Кондитерские изделия (folder)/Карамель	0	
3334702	4626015335805	Карамель си си стик клубника мягкая в соломке 7г мяг/уп #2	37145	Продукты питания (folder)/Кондитерские изделия (folder)/Карамель	0	
3334703	4626015330831	Карамель си си стик манго мягкая в соломке 7г мяг/уп	37145	Продукты питания (folder)/Кондитерские изделия (folder)/Карамель	0	
3334704	4626015335836	Карамель си си стик манго мягкая в соломке 7г мяг/уп #2	37145	Продукты питания (folder)/Кондитерские изделия (folder)/Карамель	0	
3334705	4626015330305	Карамель си си стик мультифрукт микс мягкая в соломке 2г мяг/уп	37145	Продукты питания (folder)/Кондитерские изделия (folder)/Карамель	0	
3334706	4626015335300	Карамель си си стик мультифрукт микс мягкая в соломке 2г мяг/уп #2	37145	Продукты питания (folder)/Кондитерские изделия (folder)/Карамель	0	
3334707	4626015330077	Карамель си си стик мультифрукт мягкая в соломке 7г мяг/уп	37145	Продукты питания (folder)/Кондитерские изделия (folder)/Карамель	0	
3334708	4626015335072	Карамель си си стик мультифрукт мягкая в соломке 7г мяг/уп #2	37145	Продукты питания (folder)/Кондитерские изделия (folder)/Карамель	0	
3334709	6920344802280	Карамель си си стик мягкая 7г м/у	37145	Продукты питания (folder)/Кондитерские изделия (folder)/Карамель	0	
3334710	4626015330824	Карамель си си стик яблоко мягкая в соломке 7г мяг/уп	37145	Продукты питания (folder)/Кондитерские изделия (folder)/Карамель	0	
3334711	4626015335829	Карамель си си стик яблоко мягкая в соломке 7г мяг/уп #2	37145	Продукты питания (folder)/Кондитерские изделия (folder)/Карамель	0	
3334712	4627082270075	Карамель сибирские леденцы петушок на палочке леденцовая 45г	37145	Продукты питания (folder)/Кондитерские изделия (folder)/Карамель	0	
3334713	6270822700752	Карамель сибирские леденцы петушок на палочке леденцовая 45г #2	37145	Продукты питания (folder)/Кондитерские изделия (folder)/Карамель	0	
2439686	4627082270037	Карамель сибирские леденцы фигурная на палочке 15г	37145	Продукты питания (folder)/Кондитерские изделия (folder)/Карамель	0	
3334714	4627079300174	Карамель сибирский леденец на палочке с витамином с 40г м/у	37145	Продукты питания (folder)/Кондитерские изделия (folder)/Карамель	0	
1776094	4607027976361	Карамель сибирский петушок леденцовая 60г мяг/уп	22145	Продукты питания (folder)/Кондитерские изделия (folder)/Конфеты	0	
3334715	4607027976323	Карамель сибирский петушок леденцовая на палочке 18г	37145	Продукты питания (folder)/Кондитерские изделия (folder)/Карамель	0	
2729044	4607027976392	Карамель сибирский петушок петушок на палочке 52г пэт	77	Продукты питания (folder)/Кондитерские изделия (folder)/Кондитерские изделия	0	
2439685	4607027978242	Карамель сибирский петушок фигурная леденцовая 8г м/у	37145	Продукты питания (folder)/Кондитерские изделия (folder)/Карамель	0	
3334716	1460700610944	Карамель сидреро леденцовая микс 250г м/у	37145	Продукты питания (folder)/Кондитерские изделия (folder)/Карамель	0	
3334717	4607006109445	Карамель сидреро леденцовая микс 250г м/у #2	37145	Продукты питания (folder)/Кондитерские изделия (folder)/Карамель	0	
3334718	6904986141518	Карамель сияющий череп на светящей палочке 6г мяг/уп	37145	Продукты питания (folder)/Кондитерские изделия (folder)/Карамель	0	
721069	4600823345058	Карамель сказка 250г кр.октябрь	37145	Продукты питания (folder)/Кондитерские изделия (folder)/Карамель	84	Красный Октябрь
3334719	4870036002202	Карамель сказка вес рахат	37145	Продукты питания (folder)/Кондитерские изделия (folder)/Карамель	0	
3334720	4601513010843	Карамель сказка гусятки 300г м/у	37145	Продукты питания (folder)/Кондитерские изделия (folder)/Карамель	0	
3334721	4605516015829	Карамель сказка рачки-добрячки 300г м/у	37145	Продукты питания (folder)/Кондитерские изделия (folder)/Карамель	0	
2439716	4600508715206	Карамель сказка со вкусом ванильное молоко 200г м/уп	37145	Продукты питания (folder)/Кондитерские изделия (folder)/Карамель	0	
3334722	4603720233077	Карамель сказочный герой леденцовая на палочке 25г мяг/уп	37145	Продукты питания (folder)/Кондитерские изделия (folder)/Карамель	0	
3334723	6957342909413	Карамель скелет светящийся в темноте 12г м/уп	37145	Продукты питания (folder)/Кондитерские изделия (folder)/Карамель	0	
2867721	6957342906771	Карамель скелет хлопающая с вырастающей игрушкой 1г т/у	1	Неклассифицированные/default	0	
2862435	6958482111162	Карамель скелетики жидкая 23г	1	Неклассифицированные/default	0	
2867966	5000159411400	Карамель скитлз 0.075	1	Неклассифицированные/default	0	
3334724	6957342913595	Карамель скиф хлопающая с тату для красавиц 1г	37145	Продукты питания (folder)/Кондитерские изделия (folder)/Карамель	0	
3334725	6957342913557	Карамель скиф хлопующая для пацанов с тату 1г мяг/уп	37145	Продукты питания (folder)/Кондитерские изделия (folder)/Карамель	0	
550074	4605142015026	Карамель славянка карамельный микс 1000г*7 хст/8375	22145	Продукты питания (folder)/Кондитерские изделия (folder)/Конфеты	0	
3334726	4640011947282	Карамель славянка лимонадный джо микс леденцовая 270г мяг/уп	37145	Продукты питания (folder)/Кондитерские изделия (folder)/Карамель	0	
3334727	4640011947770	Карамель славянка очень молочная 270г мяг/уп	37145	Продукты питания (folder)/Кондитерские изделия (folder)/Карамель	0	
3334728	4690454001850	Карамель славянка рачки-чудаки 150г м/уп	37145	Продукты питания (folder)/Кондитерские изделия (folder)/Карамель	0	
3334729	6921571188987	Карамель слад зубная щетка 12г	37145	Продукты питания (folder)/Кондитерские изделия (folder)/Карамель	0	
3334730	4607087221203	Карамель слада гаечка микс леденцовая 150г мяг/уп	37145	Продукты питания (folder)/Кондитерские изделия (folder)/Карамель	0	
3334731	4607087220749	Карамель слада леденцовая со вкусом барбариса 300г м/у	37145	Продукты питания (folder)/Кондитерские изделия (folder)/Карамель	0	
3334732	4607087229650	Карамель слада микс леденцовая 250г мяг/уп	37145	Продукты питания (folder)/Кондитерские изделия (folder)/Карамель	0	
2867876	4607087223832	Карамель слада муви с начинкой 250г	1	Неклассифицированные/default	0	
3334733	4607087221166	Карамель слада с фруктово-ягодной начинкой микс 250г мяг/уп	37145	Продукты питания (folder)/Кондитерские изделия (folder)/Карамель	0	
3334734	4607087224440	Карамель слада фруктово-ягодный букет 300г мяг/уп	37145	Продукты питания (folder)/Кондитерские изделия (folder)/Карамель	0	
3334735	4607087224310	Карамель слада черная смородина 300г мяг/уп	37145	Продукты питания (folder)/Кондитерские изделия (folder)/Карамель	0	
3334736	4607087224273	Карамель слада яблоко 300г мяг/уп	37145	Продукты питания (folder)/Кондитерские изделия (folder)/Карамель	0	
2867967	6929309770763	Карамель сладкая бутылочка 7г п/б	1	Неклассифицированные/default	0	
3334737	4650062487491	Карамель сладкая звездочка на палочке 15г м/у	37145	Продукты питания (folder)/Кондитерские изделия (folder)/Карамель	0	
314457	4607134832154	Карамель сладкая копилка 30/60г /ассорт./	37145	Продукты питания (folder)/Кондитерские изделия (folder)/Карамель	0	
3334738	6943304706787	Карамель сладкая обезьянка на палочке 50г м/у	37145	Продукты питания (folder)/Кондитерские изделия (folder)/Карамель	0	
3334739	4812354863127	Карамель сладкая семейка леденцов с игрушкой 8г м/у	37145	Продукты питания (folder)/Кондитерские изделия (folder)/Карамель	0	
3334740	4600416021277	Карамель сладкая сказка леденцовая спинер 26г м/уп	37145	Продукты питания (folder)/Кондитерские изделия (folder)/Карамель	0	
3334741	8697595881576	Карамель сладкая соска 12г	37145	Продукты питания (folder)/Кондитерские изделия (folder)/Карамель	0	
2728993	6957229000868	Карамель сладкая трость со вкусом клубники 50г кор/уп	77	Продукты питания (folder)/Кондитерские изделия (folder)/Кондитерские изделия	0	
2444762	6929309709930	Карамель сладкая шипучка хлопающая с татуировкой 2г м/у	77	Продукты питания (folder)/Кондитерские изделия (folder)/Кондитерские изделия	0	
3334742	6009699762675	Карамель сладкие лапки леденцовая на палочке 13г	37145	Продукты питания (folder)/Кондитерские изделия (folder)/Карамель	0	
3334743	6941439695730	Карамель сладкий арбуз на палочке 45г мяг/уп	37145	Продукты питания (folder)/Кондитерские изделия (folder)/Карамель	0	
3334744	4650069880196	Карамель сладкий бар жидкая 22г	37145	Продукты питания (folder)/Кондитерские изделия (folder)/Карамель	0	
3334745	4601614012852	Карамель сладкий секрет мандарин 1000г	37145	Продукты питания (folder)/Кондитерские изделия (folder)/Карамель	0	
3334746	4670013498185	Карамель сладкий слон леденцовая на палочке 30г мяг/уп	37145	Продукты питания (folder)/Кондитерские изделия (folder)/Карамель	0	
3334747	4630004630888	Карамель сладкий череп на палочке 14г	37145	Продукты питания (folder)/Кондитерские изделия (folder)/Карамель	0	
3334748	4607146110288	Карамель сладко анисоментоловая 270г м/у	37145	Продукты питания (folder)/Кондитерские изделия (folder)/Карамель	0	
549452	4600717046306	Карамель сладко клубника со сливками 200г мяг/уп	1	Неклассифицированные/default	0	
3334749	4607146110363	Карамель сладко клубника со сливками в шоколаде 270г мяг/уп	37145	Продукты питания (folder)/Кондитерские изделия (folder)/Карамель	0	
1670070	4600717052093	Карамель сладко кофе со сливками 200г мяг/уп	37145	Продукты питания (folder)/Кондитерские изделия (folder)/Карамель	0	
3334750	4600717056831	Карамель сладко лим-по-по леденцовая ягодный микс+мороженое 200 пак.	37145	Продукты питания (folder)/Кондитерские изделия (folder)/Карамель	0	
63345	4600717037151	Карамель сладко фрукко 90г	37145	Продукты питания (folder)/Кондитерские изделия (folder)/Карамель	41233	Сладко
2955918	4600603021301	Карамель сладко фрукко 90г #2	37145	Продукты питания (folder)/Кондитерские изделия (folder)/Карамель	41233	Сладко
2955919	4600603019728	Карамель сладко фрукко 90г #3	37145	Продукты питания (folder)/Кондитерские изделия (folder)/Карамель	41233	Сладко
2955920	4600603021615	Карамель сладко фрукко 90г #4	37145	Продукты питания (folder)/Кондитерские изделия (folder)/Карамель	41233	Сладко
2955921	4600603021639	Карамель сладко фрукко 90г #5	37145	Продукты питания (folder)/Кондитерские изделия (folder)/Карамель	41233	Сладко
