ID	UPCEAN	Name	CategoryID	CategoryName	BrandID	BrandName
1846503	071463015528	Tomy the first years Disney pooh velcro bib	1	Неклассифицированные/default	1714631	Tomy The First Years
1846504	071463015269	Tomy the first years Disney pooh vinyl bib	1	Неклассифицированные/default	1714631	Tomy The First Years
1625988	071463010608	Tomy the first years disposable nursing pads	1	Неклассифицированные/default	1714631	Tomy The First Years
881344	071463017676	Tomy the first years ez grp fork spoon	1	Неклассифицированные/default	1714631	Tomy The First Years
644007	071463020492	Tomy the first years first keys	1	Неклассифицированные/default	1714631	Tomy The First Years
4734502	071463027026	Tomy the first years Flash&sounds tv remote 1ct	1	Неклассифицированные/default	0	
1473877	071463020294	Tomy the first years floating ducky - Soft small	1	Неклассифицированные/default	1714631	Tomy The First Years
659376	071463052882	Tomy the first years floating stars teether	1	Неклассифицированные/default	1714631	Tomy The First Years
881345	071463025077	Tomy the first years fn hamr	1	Неклассифицированные/default	1714631	Tomy The First Years
1473871	071463025183	Tomy the first years funny snd wigler	1	Неклассифицированные/default	1714631	Tomy The First Years
881346	071463025084	Tomy the first years girratle	1	Неклассифицированные/default	1714631	Tomy The First Years
881347	071463032006	Tomy the first years grooming	1	Неклассифицированные/default	1714631	Tomy The First Years
2694316	071463047680	Tomy the first years gumdrop newborn pacifiers - 2 ct	1	Неклассифицированные/default	1714631	Tomy The First Years
2696336	071463060078	Tomy the first years gumdrop orthodontic pacifiers 6m+ - 2ct	1	Неклассифицированные/default	1714631	Tomy The First Years
2696337	071463047666	Tomy the first years gumdrop pacifier clip - 0m+	1	Неклассифицированные/default	1714631	Tomy The First Years
1728914	071463036004	Tomy the first years hands free gate	337649	Уход за детьми (folder)/Уход за детьми	1714631	Tomy The First Years
1728915	071463071906	Tomy the first years Home di??cor Extra tall gate	337649	Уход за детьми (folder)/Уход за детьми	1714631	Tomy The First Years
1728916	071463111404	Tomy the first years ignite stroller	337649	Уход за детьми (folder)/Уход за детьми	1714631	Tomy The First Years
1728917	071463112005	Tomy the first years ignite stroller #2	337649	Уход за детьми (folder)/Уход за детьми	1714631	Tomy The First Years
1728918	071463112210	Tomy the first years indigo stroller, Black/Green	337649	Уход за детьми (folder)/Уход за детьми	1714631	Tomy The First Years
1625989	071463043750	Tomy the first years infant pacifiers	1	Неклассифицированные/default	1714631	Tomy The First Years
2839258	071463014798	Tomy the first years massaging Action teether 1ct	1	Неклассифицированные/default	1714631	Tomy The First Years
881348	071463033072	Tomy the first years med dispenser sft tp	1	Неклассифицированные/default	1714631	Tomy The First Years
881343	071463033140	Tomy the first years medicine dropper * 1ct	1	Неклассифицированные/default	0	
1625991	071463012435	Tomy the first years mickey mouse pacifiers-3+ months	1	Неклассифицированные/default	1714631	Tomy The First Years
2694317	071463098927	Tomy the first years minnie mouse bow-tique trainer cup - 18m+	1	Неклассифицированные/default	1714631	Tomy The First Years
881350	071463010264	Tomy the first years mltm tots	1	Неклассифицированные/default	1714631	Tomy The First Years
1625992	071463024711	Tomy the first years my first rattle - from birth	1	Неклассифицированные/default	1714631	Tomy The First Years
881351	071463035151	Tomy the first years n/lite	1	Неклассифицированные/default	1714631	Tomy The First Years
1473872	071463042937	Tomy the first years Nail clip mgnfify	1	Неклассифицированные/default	1714631	Tomy The First Years
1473873	071463033058	Tomy the first years nasal aspirator	1	Неклассифицированные/default	1714631	Tomy The First Years
881352	071463014286	Tomy the first years nbby tethr	1	Неклассифицированные/default	1714631	Tomy The First Years
4734503	071463037001	Tomy the first years no scratch Baby mitt 2ct	1	Неклассифицированные/default	0	
881349	071463032174	Tomy the first years no sct bby mitts	1	Неклассифицированные/default	1714631	Tomy The First Years
881353	071463010783	Tomy the first years nrsr 5oz	1	Неклассифицированные/default	1714631	Tomy The First Years
881356	071463012268	Tomy the first years pacifier #2	1	Неклассифицированные/default	1714631	Tomy The First Years
881357	071463012312	Tomy the first years pacifier #3	1	Неклассифицированные/default	1714631	Tomy The First Years
881358	071463012367	Tomy the first years pacifier #4	1	Неклассифицированные/default	1714631	Tomy The First Years
881359	071463012459	Tomy the first years pacifier #5	1	Неклассифицированные/default	1714631	Tomy The First Years
881360	071463012466	Tomy the first years pacifier #6	1	Неклассифицированные/default	1714631	Tomy The First Years
881361	071463012640	Tomy the first years pacifier attacher - Disney Baby	1	Неклассифицированные/default	1714631	Tomy The First Years
1625993	071463027316	Tomy the first years Play&discover silly sounds racer	1	Неклассифицированные/default	1714631	Tomy The First Years
4734504	071463010462	Tomy the first years pooh bottles 1ct	1	Неклассифицированные/default	0	
881335	071463017218	Tomy the first years pooh Bowl deco w/lid 1ct	1	Неклассифицированные/default	1714631	Tomy The First Years
1473874	071463032624	Tomy the first years pooh bth scrubbyz	1	Неклассифицированные/default	1714631	Tomy The First Years
881362	071463017713	Tomy the first years pooh cup	1	Неклассифицированные/default	1714631	Tomy The First Years
881364	071463035410	Tomy the first years pooh Light	1	Неклассифицированные/default	1714631	Tomy The First Years
1473875	071463021918	Tomy the first years pooh playpals	1	Неклассифицированные/default	1714631	Tomy The First Years
881365	071463032181	Tomy the first years pooh puppt	1	Неклассифицированные/default	1714631	Tomy The First Years
1846502	071463021345	Tomy the first years pooh rattle	1	Неклассифицированные/default	1714631	Tomy The First Years
881366	071463021413	Tomy the first years pooh rttle	1	Неклассифицированные/default	1714631	Tomy The First Years
1473876	071463010882	Tomy the first years pooh slim One btl	1	Неклассифицированные/default	1714631	Tomy The First Years
881355	071463012251	Tomy the first years pooh ulkp pac nw	1	Неклассифицированные/default	1714631	Tomy The First Years
1473883	071463010950	Tomy the first years quick serve bottle warmer 1ct	1	Неклассифицированные/default	1714631	Tomy The First Years
881367	071463020157	Tomy the first years rattle	1	Неклассифицированные/default	1714631	Tomy The First Years
881368	071463021512	Tomy the first years rattle #2	1	Неклассифицированные/default	1714631	Tomy The First Years
881369	071463021642	Tomy the first years rattle #3	1	Неклассифицированные/default	1714631	Tomy The First Years
881370	071463021840	Tomy the first years rattle #4	1	Неклассифицированные/default	1714631	Tomy The First Years
881371	071463024506	Tomy the first years rattle #5	1	Неклассифицированные/default	1714631	Tomy The First Years
881372	071463027200	Tomy the first years rattle #6	1	Неклассифицированные/default	1714631	Tomy The First Years
2839257	071463028085	Tomy the first years rolling giggle puppy 1 ct	1	Неклассифицированные/default	1714631	Tomy The First Years
881373	071463033492	Tomy the first years safety cp	1	Неклассифицированные/default	1714631	Tomy The First Years
1465765	071463093199	Tomy the first years sesame street - take and toss trainer cup	1	Неклассифицированные/default	1714631	Tomy The First Years
997538	071463010622	Tomy the first years sesme strt nrsr	1	Неклассифицированные/default	1714631	Tomy The First Years
881374	071463034055	Tomy the first years sft brstl toothbrush	7694	Гигиена (folder)/Уход за зубами и ртом (folder)/Зубная щетка	1714631	Tomy The First Years
881375	071463033324	Tomy the first years sfty bmpr	1	Неклассифицированные/default	1714631	Tomy The First Years
2696338	796714230986	Tomy the first years shakin' shell rattle - 3+m	1	Неклассифицированные/default	2694313	The First Years
1629326	071463072972	Tomy the first years slim Line safety gate (p/n y7297)	1	Неклассифицированные/default	1714631	Tomy The First Years
4734505	071463040063	Tomy the first years Soft toilet trainer seat 1ct	1	Неклассифицированные/default	0	
2694318	071463073511	Tomy the first years sound machine sounds for silence	1	Неклассифицированные/default	1714631	Tomy The First Years
881339	071463016556	Tomy the first years spill proof cup	1	Неклассифицированные/default	1714631	Tomy The First Years
1473878	071463017607	Tomy the first years spillprf big drin	1	Неклассифицированные/default	1714631	Tomy The First Years
881377	071463022052	Tomy the first years squeakers	1	Неклассифицированные/default	1714631	Tomy The First Years
881378	071463033522	Tomy the first years sunshade	1	Неклассифицированные/default	1714631	Tomy The First Years
881379	071463010257	Tomy the first years supr scrub	1	Неклассифицированные/default	1714631	Tomy The First Years
1625987	071463010325	Tomy the first years take&toss bowls with lids 9+ months - 6 ct	1	Неклассифицированные/default	1714631	Tomy The First Years
1473880	071463013005	Tomy the first years take&toss cup s/prf7z 6 ct	1	Неклассифицированные/default	1714631	Tomy The First Years
2694319	071463092949	Tomy the first years take&toss Disney Baby cars sippy cups 9m+ - 3pcs	1	Неклассифицированные/default	1714631	Tomy The First Years
2694320	071463092956	Tomy the first years take&toss Disney pixar cars straw cups 18m+ - 3 ct	1	Неклассифицированные/default	1714631	Tomy The First Years
658037	071463010332	Tomy the first years take&toss forks and spoons 9+ months - 12 ct	1	Неклассифицированные/default	1714631	Tomy The First Years
658035	071463013012	Tomy the first years take&toss snack cup 1ct	1	Неклассифицированные/default	0	
1625994	071463011766	Tomy the first years take&toss spill-proof sippy cups 9+ months - 4 ct	1	Неклассифицированные/default	1714631	Tomy The First Years
1625995	071463011575	Tomy the first years take&toss spill-proof straw cups 18+ months - 4 ct	1	Неклассифицированные/default	1714631	Tomy The First Years
1625990	071463012343	Tomy the first years take&toss spoons 12oz	1	Неклассифицированные/default	1714631	Tomy The First Years
4734506	071463001934	Tomy the first years take/toss 7oz ins sproof 2ct	1	Неклассифицированные/default	0	
4734507	071463011933	Tomy the first years take/toss 7oz ins sproof 2ct #2	1	Неклассифицированные/default	0	
881380	071463020324	Tomy the first years teeth key	1	Неклассифицированные/default	1714631	Tomy The First Years
881381	071463014026	Tomy the first years teether	1	Неклассифицированные/default	1714631	Tomy The First Years
881382	071463014705	Tomy the first years teether #2	1	Неклассифицированные/default	1714631	Tomy The First Years
881383	071463014736	Tomy the first years teether #3	1	Неклассифицированные/default	1714631	Tomy The First Years
881384	071463014804	Tomy the first years teether #4	1	Неклассифицированные/default	1714631	Tomy The First Years
881385	071463024186	Tomy the first years teether #5	1	Неклассифицированные/default	1714631	Tomy The First Years
881386	071463014194	Tomy the first years teethers	1	Неклассифицированные/default	1714631	Tomy The First Years
881387	071463014309	Tomy the first years teethers #2	1	Неклассифицированные/default	1714631	Tomy The First Years
658868	071463014750	Tomy the first years teethng beads soothng 13oz	1	Неклассифицированные/default	1714631	Tomy The First Years
881389	071463017928	Tomy the first years tmblmt cup	1	Неклассифицированные/default	1714631	Tomy The First Years
881390	071463032402	Tomy the first years toy bag	1	Неклассифицированные/default	1714631	Tomy The First Years
881391	071463016167	Tomy the first years trainer cp	1	Неклассифицированные/default	1714631	Tomy The First Years
881392	071463017669	Tomy the first years travel set	1	Неклассифицированные/default	1714631	Tomy The First Years
4734508	071463017782	Tomy the first years travel spoon set	1	Неклассифицированные/default	0	
1473881	071463014385	Tomy the first years tri teether handl	1	Неклассифицированные/default	1714631	Tomy The First Years
1473882	071463016648	Tomy the first years tumbler w/lids	1	Неклассифицированные/default	1714631	Tomy The First Years
881393	071463030040	Tomy the first years visor	1	Неклассифицированные/default	1714631	Tomy The First Years
881394	071463031030	Tomy the first years washcloths	1	Неклассифицированные/default	1714631	Tomy The First Years
1625997	071463025145	Tomy the first years wiggles	1	Неклассифицированные/default	1714631	Tomy The First Years
1465764	071463090471	Tomy the first years winnie the pooh - take and toss	1	Неклассифицированные/default	1714631	Tomy The First Years
881395	071463015610	Tomy the first years wpe cln Disney pooh bib	1	Неклассифицированные/default	1714631	Tomy The First Years
881396	071463022083	Tomy the first years wrst rttle	1	Неклассифицированные/default	1714631	Tomy The First Years
881397	071463025053	Tomy the first years wshbls rtl	1	Неклассифицированные/default	1714631	Tomy The First Years
1629340	5011666853058	Tomy tomica гараж honda с машинками 85305	1	Неклассифицированные/default	1629339	TOMY TOMICA
1629341	5011666852006	Tomy tomica железнодорожный мост 85200	1	Неклассифицированные/default	1629339	TOMY TOMICA
1629342	5011666853065	Tomy tomica заправочная станция с машинками 85306	1	Неклассифицированные/default	1629339	TOMY TOMICA
1629343	5011666854031	Tomy tomica набор city express set ж/д, трасса, ж/д станция, машина, поезд, фигурка 85403	1	Неклассифицированные/default	1629339	TOMY TOMICA
1629344	5011666852105	Tomy tomica набор из рельсов и стрелок для развода путей 85210	1	Неклассифицированные/default	1629339	TOMY TOMICA
1629345	5011666852037	Tomy tomica панели для строительства тротуара малый набор 85203	1	Неклассифицированные/default	1629339	TOMY TOMICA
717537	5011666851016	Tomy tomica пожарная техника в к-те 4 транспортных средства 85101	980	Игрушки (folder)/Игрушка	237804	ГУЛЛИВЕР
717538	5011666851030	Tomy tomica полицейская техника в к-те 4 транспортных средства 85103	980	Игрушки (folder)/Игрушка	237804	ГУЛЛИВЕР
4734509	079844076014	Tomy tron vfd Game (1981)	1	Неклассифицированные/default	0	
4734510	053941047498	Tomy Water tower steam set	1	Неклассифицированные/default	0	
1629347	5011666015814	Tomy игра найди пищащее яйцо от 12мес 1581	1	Неклассифицированные/default	1629346	TOMY
717193	5011666711624	Tomy игровой набор для ванны полярные медведи-сноубордисты от 12мес 71162	980	Игрушки (folder)/Игрушка	237804	ГУЛЛИВЕР
1629350	5011666711617	Tomy игрушечная катапульта 71161	980	Игрушки (folder)/Игрушка	1629346	TOMY
661077	5011666700352	Tomy игрушка для малышей веселый паровозик	980	Игрушки (folder)/Игрушка	0	
661079	5011666046139	Tomy игрушка семейство уточек 4613	980	Игрушки (folder)/Игрушка	1629346	TOMY
716045	5011666020375	Tomy игрушка-транспортное средство ассортим (автомобиль, вертолет, самолет ассортим)	980	Игрушки (folder)/Игрушка	237804	ГУЛЛИВЕР
1629355	5011666020740	Tomy игрушка-фотоальбом бабочка звук 2074	980	Игрушки (folder)/Игрушка	1629346	TOMY
2840285	036881430193	Tomy машинка джонни и его друзья 43019	1	Неклассифицированные/default	0	
1629356	5011666010123	Tomy машинки push n go ассортим 1012t	1	Неклассифицированные/default	1629346	TOMY
1629357	5011666044029	Tomy моя первая железная дорога 4402t	1	Неклассифицированные/default	1629346	TOMY
661078	5011666700369	Tomy набор веселые зверушки музыкальные (цыпленок, коровка овечка)	1	Неклассифицированные/default	1629346	TOMY
1629358	5011666020085	Tomy ночник звездочка желтая свет и звук 2008	1	Неклассифицированные/default	1629346	TOMY
1629359	5011666020139	Tomy ночник звездочка розовая свет и звук 2013to	1	Неклассифицированные/default	1629346	TOMY
1629360	5011666038769	Tomy паровозик с рельсами# 3876	1	Неклассифицированные/default	1629346	TOMY
1629361	5011666066342	Tomy пирамидка 6634	1	Неклассифицированные/default	1629346	TOMY
661080	5011666066335	Tomy сортер 6633	1	Неклассифицированные/default	1629346	TOMY
661081	5011666715004	Tomy стучалка гонщики 71500	1	Неклассифицированные/default	1629346	TOMY
661082	5011666716049	Tomy стучалка музыкальный молоток	1	Неклассифицированные/default	0	
1629362	5011666716001	Tomy щенок со свистком 71600	1	Неклассифицированные/default	1629346	TOMY
661083	059527601597	Ton brazilian nut fiesta 16x 40g	1	Неклассифицированные/default	0	
661084	059527401593	Ton California almond Valley 16x 40g	1	Неклассифицированные/default	0	
661085	059527171489	Ton canadian maple forest 16x 40g	1	Неклассифицированные/default	0	
4734511	880242722188	Ton koopman-mozart&cimarosa (DVD)	1	Неклассифицированные/default	0	
3761863	4607008943832	Ton l 0.275kg	146	Гигиена (folder)/Мыло	3761862	TON (TON/PAVLOVSKIY POSAD)
3761864	4607008943849	Ton l 0.275kg #2	146	Гигиена (folder)/Мыло	3761862	TON (TON/PAVLOVSKIY POSAD)
3761865	4607135670854	Ton l 0.275kg #3	146	Гигиена (folder)/Мыло	3761862	TON (TON/PAVLOVSKIY POSAD)
3761866	4607135670892	Ton l 0.275kg #4	146	Гигиена (folder)/Мыло	3761862	TON (TON/PAVLOVSKIY POSAD)
3761867	4607135670908	Ton l 0.275kg #5	146	Гигиена (folder)/Мыло	3761862	TON (TON/PAVLOVSKIY POSAD)
3761868	4607135670939	Ton l 0.275kg #6	146	Гигиена (folder)/Мыло	3761862	TON (TON/PAVLOVSKIY POSAD)
3761869	4607135670946	Ton l 0.275kg #7	146	Гигиена (folder)/Мыло	3761862	TON (TON/PAVLOVSKIY POSAD)
3761870	4607135676931	Ton l 1.2kg bo	6693	Хозяйственные товары (folder)/Бытовая химия (folder)/Чистящие моющие средства	3761862	TON (TON/PAVLOVSKIY POSAD)
661086	059527171472	Ton mediterranean pistachio Passion 16x40	1	Неклассифицированные/default	0	
661087	059527101592	Ton niagara Apple country 16x 40g	1	Неклассифицированные/default	0	
661088	059527501590	Ton quebec cranberrycarnival 16x 40g	1	Неклассифицированные/default	0	
3761871	4607135670984	Ton s floterami Lemon glycerin g 5l bo	274405	Хозяйственные товары (folder)/Бытовая химия (folder)/Средство для мытья посуды	3761862	TON (TON/PAVLOVSKIY POSAD)
4734512	4607135670403	Ton sanitarnyi 530g	1	Неклассифицированные/default	0	
3761872	4607135671226	Ton wc sanit.techn. pine mu.cl. g 0.75kg bo	6693	Хозяйственные товары (folder)/Бытовая химия (folder)/Чистящие моющие средства	3761862	TON (TON/PAVLOVSKIY POSAD)
4734670	4901998371065	Ton's brand mixed nuts 15g	1	Неклассифицированные/default	0	
1156056	059527201599	Ton-argentina peanutplains 16x 40g	1	Неклассифицированные/default	0	
1156057	059527171441	Ton-caribbean gingerisland 16x 40g	1	Неклассифицированные/default	0	
1156067	059527701594	Ton-go ontario! bar 16x 40g	1	Неклассифицированные/default	0	
1156080	059527171434	Ton-himalayan goji summim 16x 40g	1	Неклассифицированные/default	0	
3242669	074410161736	Ton-katsu sauce	330591	Продукты питания (folder)/Продукты питания	0	
1156095	059527171410	Ton-Nova scotia Blueberry fields 16x 40g	1	Неклассифицированные/default	0	
1156100	059527171465	Ton-persian pomegranate Garden 16x 40g	1	Неклассифицированные/default	0	
3761896	4607135671851	Ton-ton l 5l	146	Гигиена (folder)/Мыло	3761895	TON-TON (TON/PAVLOVSKIY POSAD)
3761897	4607135671875	Ton-ton l 5l #2	146	Гигиена (folder)/Мыло	3761895	TON-TON (TON/PAVLOVSKIY POSAD)
3761898	4607135671899	Ton-ton l 5l #3	146	Гигиена (folder)/Мыло	3761895	TON-TON (TON/PAVLOVSKIY POSAD)
3761899	4607135672926	Ton-ton l 5l #4	146	Гигиена (folder)/Мыло	3761895	TON-TON (TON/PAVLOVSKIY POSAD)
3761900	4607135671172	Ton-ton яблоко u 1kg p	1412	Уход за волосами (folder)/Шампунь	3761895	TON-TON (TON/PAVLOVSKIY POSAD)
3761875	4607135676993	Ton/pavlovskiy posad g 0.5kg bo	274405	Хозяйственные товары (folder)/Бытовая химия (folder)/Средство для мытья посуды	3761874	TON/PAVLOVSKIY POSAD
1156055	702596100040	Tona tona tona 4/6 pk	1	Неклассифицированные/default	0	
2696339	7804606563739	Tonada chilena - varios interpretes CD cdof65637	2275105	Медиа (folder)/Медиа	0	
2696340	610077359125	Tonadas chile lindo - varios artistas CD 765-58289	2275105	Медиа (folder)/Медиа	0	
2696341	4440012772216	Tonadas de oro - volumen ii CD cdm12772	2275105	Медиа (folder)/Медиа	0	
1629363	081240750603	Tonala 100% agave anejo ceramic	1	Неклассифицированные/default	0	
4734513	048107074791	Tonalin	1	Неклассифицированные/default	0	
1629364	021078009498	Tonalin - cla	1	Неклассифицированные/default	0	
1629365	021078070443	Tonalin - cla #2	1	Неклассифицированные/default	0	
1629368	021078070597	Tonalin 1000 cla bns btl	1	Неклассифицированные/default	0	
1629369	787500076123	Tonalin 90sgels	1	Неклассифицированные/default	0	
1629370	068958020464	Tonalin cla 1000mg	1	Неклассифицированные/default	0	
1629371	068958082042	Tonalin cla 120s	1	Неклассифицированные/default	0	
2404833	026664340597	Tonalin cla, 90 capsules, foodscience of vermont	1	Неклассифицированные/default	595766	FoodScience of Vermont
1629372	068958091389	Tonalin/pgx pair pack	1	Неклассифицированные/default	0	
4734514	074312051784	Tonalin1000	1	Неклассифицированные/default	0	
1629373	4807770120732	Tonde Special Cream puffs custard 25g	19677	Продукты питания (folder)/Кондитерские изделия (folder)/Шоколад	12837	Pantene Pro-V
430631	4800130100139	Tonde?a premium Rum 375ml	1	Неклассифицированные/default	0	
