ID	UPCEAN	Name	CategoryID	CategoryName	BrandID	BrandName
2705519	817636012143	Vineyard Hill Naturals Lemon verbena Natural hand&Body Lotion	1	Неклассифицированные/default	2705515	Vineyard Hill Naturals
2705520	817636012150	Vineyard Hill Naturals Lemon verbena Natural hand&Body wash	1	Неклассифицированные/default	2705515	Vineyard Hill Naturals
2705521	817636012129	Vineyard Hill Naturals Milk&Honey Natural hand creme	1	Неклассифицированные/default	2705515	Vineyard Hill Naturals
4767278	601212803207	Vineyard music - dwell (CD&DVD)	1	Неклассифицированные/default	0	
4767279	046142000232	Vineyard pre-made * 1ct	1	Неклассифицированные/default	0	
2214719	6009816930499	Vineyard varieties arabella pinotage glass 750ml	1	Неклассифицированные/default	0	
2778259	6009880059461	Vineyard varieties arabella sparkling White glass 750ml	1	Неклассифицированные/default	0	
1950817	830518000120	Vineyard varieties leatherwood Cabernet Sauvignon glass 750ml	22133	Продукты питания (folder)/Алкогольные напитки/Вино (folder)/Вино	0	
2809916	830518000175	Vineyard varieties leatherwood Red Blend glass 750ml	1	Неклассифицированные/default	0	
1950818	830518000137	Vineyard varieties leatherwood shiraz glass 750ml	22133	Продукты питания (folder)/Алкогольные напитки/Вино (folder)/Вино	0	
1950819	830518000144	Vineyard varieties leatherwood viognier glass 750ml	1	Неклассифицированные/default	0	
4767280	882760425633	Vineyard vines	1	Неклассифицированные/default	0	
1167818	070030541613	Vineyards brands goats do roam in villages Red 750ml /12	1	Неклассифицированные/default	0	
2843212	085000006313	Vinfresco semi Dry White glass 200ml	78617	Продукты питания (folder)/Алкогольные напитки/Алкоголь	0	
3027492	737483221447	Vinh sanh canton ndl 16oz	330591	Продукты питания (folder)/Продукты питания	0	
2843213	5601381001027	Vinha dervideria colheita selecionada Red Wine glass 750ml	1	Неклассифицированные/default	0	
2843214	5601381002024	Vinha dervideria colheita selecionada White Wine glass 750ml	1	Неклассифицированные/default	0	
1167819	5603618211018	Vinha pz colheita glass 750ml	1	Неклассифицированные/default	0	
435027	745118172194	Vinhas do carneiro glass 750ml	1	Неклассифицированные/default	0	
1641596	7896039101824	Vinho almaden gamay rosщ 750ml	1	Неклассифицированные/default	0	
2705522	7898012860094	Vinho bianco mazile 890ml	1	Неклассифицированные/default	0	
2705523	7896037913252	Vinho bordo suave q.morgado 750ml	1	Неклассифицированные/default	0	
2705524	7896243500390	Vinho branco canecao	1	Неклассифицированные/default	0	
2705525	7896072911787	Vinho branco dom bosco 880ml	1	Неклассифицированные/default	0	
2705526	7896072900132	Vinho branco dombosco	1	Неклассифицированные/default	0	
1641597	7896931611605	Vinho branco frisante campo largo	1	Неклассифицированные/default	0	
1641598	7896931612084	Vinho branco frisante Grand festy 660ml	1	Неклассифицированные/default	0	
1641599	7897079400335	Vinho branco lovatel suave 2.92 l	1	Неклассифицированные/default	0	
2705527	7898012860551	Vinho branco moscatel 720ml	1	Неклассифицированные/default	0	
1641600	7898901005070	Vinho branco seco cristalle 1.9 l	1	Неклассифицированные/default	0	
1641601	7897079400304	Vinho branco seco lovatel 1.47 l	1	Неклассифицированные/default	0	
1641602	7897079400281	Vinho branco seco lovatel 2.92 l	1	Неклассифицированные/default	0	
1641603	7898901005087	Vinho branco suave cristalle 1.9 l	1	Неклассифицированные/default	0	
1641604	7897079400359	Vinho branco suave lovatel 1.47 l	1	Неклассифицированные/default	0	
2705528	7896243500468	Vinho branco vermouth bianco reggian	1	Неклассифицированные/default	0	
1641605	7896931611377	Vinho campo largo branco seco 750ml	1	Неклассифицированные/default	0	
1641606	7896931611360	Vinho campo largo branco suave 750ml	1	Неклассифицированные/default	0	
1641607	7896931611384	Vinho campo largo rosado suave 750m	1	Неклассифицированные/default	0	
1641608	7896931611353	Vinho campo largo tinto seco 750ml	1	Неклассифицированные/default	0	
1641609	7896931611346	Vinho campo largo tinto suave 750ml	1	Неклассифицированные/default	0	
1641610	7896780900622	Vinho canчуo branco suave 750ml	1	Неклассифицированные/default	0	
1641611	7896780900196	Vinho canчуo tinto suave 750ml	1	Неклассифицированные/default	0	
1641612	7898080660077	Vinho castelinho tinto suave 4l	1	Неклассифицированные/default	0	
2705529	7896573600203	Vinho catuaba fogosa 920ml	1	Неклассифицированные/default	0	
1641613	50000012	Vinho colonial branco 900ml	1	Неклассифицированные/default	0	
1641614	9000001007108	Vinho colonial branco seco 1l	1	Неклассифицированные/default	0	
1641615	9000001004374	Vinho colonial branco seco 4.6 l	1	Неклассифицированные/default	0	
1641616	9000001007092	Vinho colonial branco suave 1l	1	Неклассифицированные/default	0	
1641618	9000001004381	Vinho colonial tinto seco 4.6 l	1	Неклассифицированные/default	0	
1641617	9000001007085	Vinho colonial tinto seco 900ml	1	Неклассифицированные/default	0	
1641620	9000001004398	Vinho colonial tinto suave 4.6 l	1	Неклассифицированные/default	0	
1641619	9000001007078	Vinho colonial tinto suave 900ml	1	Неклассифицированные/default	0	
1641621	9000001004404	Vinho colonial topanote 4.6 l	1	Неклассифицированные/default	0	
1641622	7896931610196	Vinho do avo campo largo 750ml	1	Неклассифицированные/default	0	
1641623	7891141001161	Vinho espumante conde de foucauld semi-seco	1	Неклассифицированные/default	0	
1641624	7896443000379	Vinho felippe tinto 355ml	1	Неклассифицированные/default	0	
1641625	7896443000058	Vinho felippe tinto seco 720ml	1	Неклассифицированные/default	0	
2705530	7898017310013	Vinho jurubeba 1l	1	Неклассифицированные/default	0	
1641626	7897079400311	Vinho lovatel branco seco 900ml	1	Неклассифицированные/default	0	
1641627	7897079400366	Vinho lovatel branco suave 900ml	1	Неклассифицированные/default	0	
1641628	7897079400052	Vinho lovatel tinto seco 900ml	1	Неклассифицированные/default	0	
1641629	7897079400502	Vinho lovatel tinto seco bordд 900ml	1	Неклассифицированные/default	0	
1641630	7897079401608	Vinho lovatel tinto suave 870ml	1	Неклассифицированные/default	0	
1641631	7898347830564	Vinho nono lilo tinto seco 1.5 l	1	Неклассифицированные/default	0	
1641632	7898347830571	Vinho nono lilo tinto suave 1.5 l	1	Неклассифицированные/default	0	
2705531	7896037913122	Vinho quinta do morgado bco/su	1	Неклассифицированные/default	0	
2705532	7896037913139	Vinho quinta do morgado seco	1	Неклассифицированные/default	0	
1167820	5607645047527	Vinho regional alentejano herdade das albernoas Rouge 2005	22133	Продукты питания (folder)/Алкогольные напитки/Вино (folder)/Вино	0	
4767281	5604236600062	Vinho regional ribatejano terracos do tejo 2007	1	Неклассифицированные/default	0	
2705533	7898012860117	Vinho Rose mazile 890ml	1	Неклассифицированные/default	0	
1641633	7898080660015	Vinho sangуo 2 garafas 720ml	1	Неклассифицированные/default	0	
1641634	7898080660022	Vinho sangуo tinto suave 720ml	1	Неклассифицированные/default	0	
2705534	7896072911053	Vinho t.s d.bosco ed.class 750	1	Неклассифицированные/default	0	
2705535	7896243500123	Vinho tinto canecao	1	Неклассифицированные/default	0	
2705536	7896072900125	Vinho tinto dom bosco 880ml	1	Неклассифицированные/default	0	
2705537	7896072900156	Vinho tinto dom bosco 880ml #2	1	Неклассифицированные/default	0	
1641635	7896931611612	Vinho tinto frisante suave freeze up 660ml	1	Неклассифицированные/default	0	
2705538	7898017310365	Vinho tinto jatoba 4600ml	1	Неклассифицированные/default	0	
2705539	7898017310044	Vinho tinto jatoba 900ml	1	Неклассифицированные/default	0	
2705540	7898012860100	Vinho tinto mazile 890ml	1	Неклассифицированные/default	0	
1641636	7897079400045	Vinho tinto seco lovatel 1.47 l	1	Неклассифицированные/default	0	
1641637	7897079400021	Vinho tinto seco lovatel 2.92 l	1	Неклассифицированные/default	0	
1641638	7897079400014	Vinho tinto seco lovatel 4.6 l	1	Неклассифицированные/default	0	
1641639	7898901005094	Vinho tinto suave cristalle 1.9 l	1	Неклассифицированные/default	0	
2705541	7896072911183	Vinho tinto suave dombosco750m	1	Неклассифицированные/default	0	
1641640	7897079400090	Vinho tinto suave lovatel 1.47 l	1	Неклассифицированные/default	0	
1641641	7897079400076	Vinho tinto suave lovatel 2.92 l	1	Неклассифицированные/default	0	
1641642	7897079400069	Vinho tinto suave lovatel 4.6 l	1	Неклассифицированные/default	0	
2705542	7896072911909	Vinho tinto suave moselle ceres	1	Неклассифицированные/default	0	
2705543	7896037913146	Vinho tt. tinto q. morgado 750ml	1	Неклассифицированные/default	0	
2705544	7896072910971	Vinho tt.seco dombosco 750ml	1	Неклассифицированные/default	0	
2705545	7896037913177	Vinho tt.suave q.morango 250ml	1	Неклассифицированные/default	0	
1641643	7898347830038	Vinho ulian tinto seco 4.6 l	1	Неклассифицированные/default	0	
1641644	7898347830137	Vinho ulian tinto seco 750ml	1	Неклассифицированные/default	0	
4767282	764793241315	Vinho verde, neblina, quinta Da aveleda 750ml	1	Неклассифицированные/default	0	
2412372	9557474018358	Vini rabbit note book	1	Неклассифицированные/default	0	
2705546	9771335751004	Vinic a vino 2m	3300794	Полиграфия (folder)/Периодические издания	0	
1641647	5601110000536	Vinicave branco med Dry 750ml	22133	Продукты питания (folder)/Алкогольные напитки/Вино (folder)/Вино	0	
1641651	5601110000550	Vinicave tinto med Dry 750ml	22133	Продукты питания (folder)/Алкогольные напитки/Вино (folder)/Вино	0	
2705547	605457065123	Vinicius + toquinho - Maria creuza + mar CD CD570651	2275105	Медиа (folder)/Медиа	0	
2705548	7896410612963	Vinicius de moraes - leyendas de brasil CD feni236	2275105	Медиа (folder)/Медиа	0	
1641653	811278000230	Vinieva Merlot	22133	Продукты питания (folder)/Алкогольные напитки/Вино (folder)/Вино	0	
4767283	636981001059	Vinifrance imports, inc 750ml bourgogne blanc	1	Неклассифицированные/default	0	
4767284	697383401823	Vinil industrial glove	1	Неклассифицированные/default	0	
4767285	048419072089	Vinilla cups~ 8 9oz 1ct	1	Неклассифицированные/default	0	
4767286	072000159736	Vinilla sandwich cremes 32oz	1	Неклассифицированные/default	0	
4767287	6002039001687	Vinimark (pty) LTD 750ml kanonkop kadette 2003 (Red Wine)	1	Неклассифицированные/default	0	
1641654	041785001066	Vining straw broom	1	Неклассифицированные/default	0	
2214721	085000021224	Viniq liqueur 40p btl 375ml	1730524	Продукты питания (folder)/Алкогольные напитки/CORDIALS	0	
2214722	085000021231	Viniq liqueur 40p btl 750ml	1730524	Продукты питания (folder)/Алкогольные напитки/CORDIALS	0	
2214723	085000023440	Viniq ruby liqueur 40p btl 375ml	1730524	Продукты питания (folder)/Алкогольные напитки/CORDIALS	0	
2214724	085000023457	Viniq ruby liqueur 40p btl 750ml	1730524	Продукты питания (folder)/Алкогольные напитки/CORDIALS	0	
2705549	085000023815	Viniq shimmery Glow liqueur	78617	Продукты питания (folder)/Алкогольные напитки/Алкоголь	0	
2412373	000850000212	Viniq shimmery Original vodka moscato glass 375ml	1	Неклассифицированные/default	0	
666181	6920754445985	Vinish oxi Action multi 500g	1	Неклассифицированные/default	0	
1641655	1733268003016	Vinisi Baby clams 283g	41409	Продукты питания (folder)/Рыба и морепродукты (folder)/Морепродукты	0	
2214725	1733268801032	Vinisi bumbu 120g*24 tuna bombay	1	Неклассифицированные/default	0	
2214726	1733268801025	Vinisi bumbu 120g*24 tuna chilli	1	Неклассифицированные/default	0	
2214727	1733268801018	Vinisi bumbu 120g*24 tuna gulai	1	Неклассифицированные/default	0	
2214728	1733268801049	Vinisi daging tuna 185g	1	Неклассифицированные/default	0	
2214729	1733268802039	Vinisi nasi goreng 120g*24 rajungan	1	Неклассифицированные/default	0	
2214730	1733268802015	Vinisi nasi goreng 120g*24 seafood	1	Неклассифицированные/default	0	
2214731	1733268802022	Vinisi nasi goreng 120g*24 tuna	1	Неклассифицированные/default	0	
2214732	1733268801063	Vinisi tuna bumbu rendang 140g	1	Неклассифицированные/default	0	
1167821	087396500659	Vinitas Cabernet Sauvignon 1.5 l	22133	Продукты питания (folder)/Алкогольные напитки/Вино (folder)/Вино	0	
1167822	087396500154	Vinitas Chardonnay 1.5 l	22133	Продукты питания (folder)/Алкогольные напитки/Вино (folder)/Вино	0	
1167823	087396500451	Vinitas Merlot 1.5 l	22133	Продукты питания (folder)/Алкогольные напитки/Вино (folder)/Вино	0	
1167824	087396500857	Vinitas Pinot Grigio 1.5 l	22133	Продукты питания (folder)/Алкогольные напитки/Вино (folder)/Вино	0	
1167825	087396500550	Vinitas Pinot Noir 1.5 l	22133	Продукты питания (folder)/Алкогольные напитки/Вино (folder)/Вино	0	
204458	3333780204021	Vinival sav Rose d'anjou 750ml	1	Неклассифицированные/default	0	
1641656	8600074921182	Vinjak Body	1	Неклассифицированные/default	0	
1761472	4606038025853	Vinkom рюкзак полиэстер 26x11 x 40см	596271	Галантерея (folder)/Галантерея	3769012	VINKOM
1761475	4606038025884	Vinkom сумка на пояс 22x8.5x 8см	596271	Галантерея (folder)/Галантерея	0	
1826198	4606038025891	Vinkom таблетки для пмм	6693	Хозяйственные товары (folder)/Бытовая химия (folder)/Чистящие моющие средства	0	
2843215	852930005392	Vinlandic glass 16.9 floz	1	Неклассифицированные/default	0	
4767288	769924022290	Vinly tile	1	Неклассифицированные/default	0	
2214733	8999999277987	Vinnetta selection	1	Неклассифицированные/default	0	
2843216	5010035066655	Vinnie carton 365g	1	Неклассифицированные/default	0	
435028	709965140409	Vinny's East Coast bar&grill glass 12oz	1	Неклассифицированные/default	0	
4767289	547937048618	Vinny/vsm9o vinny barcode album	1	Неклассифицированные/default	0	
2705550	9771337884007	Vino 2m	3300794	Полиграфия (folder)/Периодические издания	0	
4767290	033224510796	Vino 6oz Champagne flute	1	Неклассифицированные/default	0	
2705551	9771801088009	Vino a styl 2m	3300794	Полиграфия (folder)/Периодические издания	0	
1167827	4800220560355	Vino agila chinese mw 350ml x 24	1	Неклассифицированные/default	0	
1641657	716146072022	Vino Da tav redo 750	1	Неклассифицированные/default	0	
1641659	4809015238011	Vino de coco sweet Dry Red Wine 750ml	22133	Продукты питания (folder)/Алкогольные напитки/Вино (folder)/Вино	0	
1641660	4809015238028	Vino de coco sweet Red Wine 750ml	22133	Продукты питания (folder)/Алкогольные напитки/Вино (folder)/Вино	0	
1641661	4809015238035	Vino de coco sweet White Wine 750ml	22133	Продукты питания (folder)/Алкогольные напитки/Вино (folder)/Вино	0	
1167828	091771944402	Vino de eyzaguirre vino de eyzaguirre vino de eyzaguirre Cabernet Sauvignon reserva especial 2000 750ml	22133	Продукты питания (folder)/Алкогольные напитки/Вино (folder)/Вино	0	
1167829	091771000818	Vino de eyzaguirre vino de eyzaguirre vino de eyzaguirre Merlot reserva especial 2000 750ml	22133	Продукты питания (folder)/Алкогольные напитки/Вино (folder)/Вино	0	
1167830	091771013344	Vino de eyzaguirre vino de eyzaguirre vino de eyzaguirre syrah reserva especial 2001 750ml	22133	Продукты питания (folder)/Алкогольные напитки/Вино (folder)/Вино	0	
2705553	895377000414	Vino de milo balsamic&olive Oil dressing	1	Неклассифицированные/default	2705552	Vino De Milo
2705554	895377000438	Vino de milo dressing artchk prmsn	1	Неклассифицированные/default	2705552	Vino De Milo
2705555	895377000445	Vino de milo gorgonzola pear dressing	1	Неклассифицированные/default	2705552	Vino De Milo
435029	899911000786	Vino dei fratelli chianti glass 750ml	22133	Продукты питания (folder)/Алкогольные напитки/Вино (folder)/Вино	0	
435030	899911000939	Vino dei fratelli moscato glass 750ml	22133	Продукты питания (folder)/Алкогольные напитки/Вино (folder)/Вино	0	
435031	899911000809	Vino dei fratelli Pinot Grigio glass 750ml	22133	Продукты питания (folder)/Алкогольные напитки/Вино (folder)/Вино	0	
2843217	9856300020498	Vino divine glass 750ml	1	Неклассифицированные/default	0	
4767291	011381036953	Vino essentials Wine stems, 8pcs italy	1	Неклассифицированные/default	0	
435032	8410028125906	Vino fontana Red Wine med sweet 750ml	22133	Продукты питания (folder)/Алкогольные напитки/Вино (folder)/Вино	0	
2412374	8410028002702	Vino fontana sangria 750ml	1	Неклассифицированные/default	0	
2412375	8410028126002	Vino fontana White Wine	1	Неклассифицированные/default	0	
4767292	7501043703208	Vino generoso tipo jerez tres coronas La madrilena 01l	1	Неклассифицированные/default	0	
4767293	033224513520	Vino grande 21oz Red mag num	1	Неклассифицированные/default	0	
4767294	033220300902	Vino grande 4oz port glass	1	Неклассифицированные/default	0	
4767295	033220668910	Vino grande 50oz Wine decanter	1	Неклассифицированные/default	0	
4767296	033224512530	Vino grande 7oz martini glass	1	Неклассифицированные/default	0	
4767297	094922553577	Vino Jesus CD	1	Неклассифицированные/default	0	
4767298	8042295002514	Vino nobile di montepulciano	1	Неклассифицированные/default	0	
4767299	607672160003	Vino noceto 750ml noceto rosato di sangiovese 2003	1	Неклассифицированные/default	0	
2705556	9771214268005	Vino revue me	3300794	Полиграфия (folder)/Периодические издания	0	
2843218	8240240003467	Vino robles Sauvignon blanc glass 750ml	1	Неклассифицированные/default	0	
4767300	8016033002128	Vino rosso - nero d'avola 2008	1	Неклассифицированные/default	0	
4767301	079466301037	Vino seco para 24oz	1	Неклассифицированные/default	0	
435034	013964262278	Vino solo Chardonnay glass 187ml	22133	Продукты питания (folder)/Алкогольные напитки/Вино (folder)/Вино	0	
435035	013964262285	Vino solo Merlot glass 187ml	22133	Продукты питания (folder)/Алкогольные напитки/Вино (folder)/Вино	0	
1641663	8693722015029	Vino spaghtti 400g	1	Неклассифицированные/default	0	
4767302	892195000404	Vino tinto Red Wine	1	Неклассифицированные/default	0	
4767303	8607000018701	Vino visoka	1	Неклассифицированные/default	0	
4767304	8607000018718	Vino vulkan	1	Неклассифицированные/default	0	
4767305	042629003055	Vino&formiagio roll 16oz	1	Неклассифицированные/default	0	
4767308	032728010870	Vino's make your own Hot sauce set	1	Неклассифицированные/default	0	
174470	4810153008183	Vino-spa бальзам-энергия на белом и красном вине укрепл для всех типов вол 450мл	1	Неклассифицированные/default	174469	Витэкс VINO - SPA
174471	4810153008169	Vino-spa шампунь-энергия на белом и красном вине укрепл для всех типов вол 500мл	1412	Уход за волосами (folder)/Шампунь	174469	Витэкс VINO - SPA
2705557	7896226102566	Vinocard q10 10mg 30cpr	1	Неклассифицированные/default	0	
3769015	7896226102580	Vinocard q10 50mg 20's marjan	1	Неклассифицированные/default	0	
3769016	641586343336	Vinogallia edizione privta Red 750m	22133	Продукты питания (folder)/Алкогольные напитки/Вино (folder)/Вино	0	
3533190	4607112305021	Vinogradniy (konserv.k./ekat.) garmoniya grape 100% v 3l j	17374	Продукты питания (folder)/Напитки безалкогольные/Сок	3769018	VINOGRADNIY (KONSERVNAYA KOMPANIYA/EKATERINBURG)
3769020	4610008503319	Vinogradniy (nachpr.gk) grape 100% v 3l j	17374	Продукты питания (folder)/Напитки безалкогольные/Сок	3769019	VINOGRADNIY (NACHPROD GK)
1824335	4607045855839	Vinogradniy (tikhvinsk.pk/smol) grape 50% n 3l j	17374	Продукты питания (folder)/Напитки безалкогольные/Сок	3769021	VINOGRADNIY (TIKHVINSKIY PK/SMOLENSK)
3769022	4607045856201	Vinogradniy (tikhvinsk.pk/smol) grape 50% n 3l j #2	17374	Продукты питания (folder)/Напитки безалкогольные/Сок	3769021	VINOGRADNIY (TIKHVINSKIY PK/SMOLENSK)
3769025	4606318000723	Vinogradov (vinogradov gk) beryozoviy sok birch&cowber 100% v 0.5l bo p	17374	Продукты питания (folder)/Напитки безалкогольные/Сок	3769024	VINOGRADOV (VINOGRADOV GK)
3769026	4606318000747	Vinogradov (vinogradov gk) beryozoviy sok birch&cranb 100% v 0.5l bo p	17374	Продукты питания (folder)/Напитки безалкогольные/Сок	3769024	VINOGRADOV (VINOGRADOV GK)
3769028	4607962310497	Vinol buckwheat chop. 0.8kg s	22067	Продукты питания (folder)/Крупа и бобовые	3769027	VINOL
3769029	4607962310015	Vinol peas chop&polished 0.9kg s	22067	Продукты питания (folder)/Крупа и бобовые	3769027	VINOL
666183	5290152001382	Vinolia boracic and cold Cream soap 170g	1	Неклассифицированные/default	0	
1167831	8717524070007	Vinolia lelietje v dalen zeep 150g	1	Неклассифицированные/default	0	
1167832	8717524070014	Vinolia tres chic zeep 150g	1	Неклассифицированные/default	0	
1167833	881860110029	Vinology Red vqa 750ml	22133	Продукты питания (folder)/Алкогольные напитки/Вино (folder)/Вино	0	
1167834	881860110012	Vinology White vqa 750ml	22133	Продукты питания (folder)/Алкогольные напитки/Вино (folder)/Вино	0	
4767306	4008005149591	Vinonoire? dornfelderrheinhessen? - 2005 Red Wine 750ml	1	Неклассифицированные/default	0	
4767307	073705073259	Vinopull	1	Неклассифицированные/default	0	
2843219	7896226105406	Vinoq 10 - 30caps	1	Неклассифицированные/default	0	
1167835	364370210019	Vinor 10mg 1ml choice amerinet	1	Неклассифицированные/default	0	
1167836	364370250015	Vinor 10mg 5ml choice amerinet	1	Неклассифицированные/default	0	
1167837	363323148010	Vinorelb inj 10mg/ml app 1ml	1	Неклассифицированные/default	0	
1167838	363323148058	Vinorelb inj 10mg/ml app 5ml	1	Неклассифицированные/default	0	
