ID	UPCEAN	Name	CategoryID	CategoryName	BrandID	BrandName
632969	5010421010545	Noels stoneless Green olives 710g	1	Неклассифицированные/default	0	
632970	5010421010552	Noels stuffed olives Green 720g	1	Неклассифицированные/default	0	
304084	351821050089	Noestrogen (60 caps)	297057	Лекарственные средства (folder)/Health & Personal Care	304083	Powerlab Nutrition
4553792	4964596450310	Noevir sana	1	Неклассифицированные/default	0	
1926200	7891317439354	Noex 100mcg 100ds Euro	1	Неклассифицированные/default	0	
2818203	7891317464004	Noex 100mcg spray nas c/100 dose	1	Неклассифицированные/default	0	
2643452	7891317426958	Noex 32mcg spray 120dose	1	Неклассифицированные/default	0	
2818204	7891317460532	Noex 32mcg spray nas c/120 doses	1	Неклассифицированные/default	0	
1926201	7891317439323	Noex 32mg 120doses	1	Неклассифицированные/default	0	
2818205	7891317460518	Noex 50mcg spray nas c/200 doses	1	Неклассифицированные/default	0	
1926202	7891317426941	Noex 50mg 200doses	1	Неклассифицированные/default	0	
1926203	7891317439347	Noex 64mcg 120ds Euro	1	Неклассифицированные/default	0	
2643453	7891317426934	Noex 64mcg spray 120dose	1	Неклассифицированные/default	0	
2818206	7891317460495	Noex 64mcg spray nas c/120 doses	1	Неклассифицированные/default	0	
1926204	7896004700021	Nofebrin 20ml legrand t	1	Неклассифицированные/default	0	
4553794	751097050170	Nofx - the p.m.r.c. can suck on this	1	Неклассифицированные/default	0	
4553795	751097059098	Nofx-ten years of f#cking up (DVD)	1	Неклассифицированные/default	0	
4553796	7290005305290	Noga burr 3 ng1003 1pcs	1	Неклассифицированные/default	0	
3167059	742906105679	Noga delite, low fat yogurt, mango	330591	Продукты питания (folder)/Продукты питания	0	
3167060	742906125011	Noga, 0% fat greek strained yogurt, strawberry	330591	Продукты питания (folder)/Продукты питания	0	
3167061	742906125004	Noga, greek 0% fat strained plain yogurt	330591	Продукты питания (folder)/Продукты питания	0	
4553797	096786202127	Nogal 0.25oz	1	Неклассифицированные/default	0	
4553798	01373024	Nogales 350ml jcmcode	1	Неклассифицированные/default	0	
2176557	8410429003100	Nogat ratic.(grano) 5x 50g*promo* (ratas resistentes)**promocional	1	Неклассифицированные/default	2176556	NOGAT
2176558	8410429003001	Nogat ratic.***caja de 25 sobres	1	Неклассифицированные/default	2176556	NOGAT
4553799	763788209439	Nogatech, inc deep sea fish Oil	1	Неклассифицированные/default	0	
2643455	185531000603	Noggat bar clsc almond	1	Неклассифицированные/default	2643454	Sperlari
2176559	731794005307	Noggin nuggets Dog treats 10/4oz	337596	Товары для животных (folder)/Pets	0	
2643457	856513002242	Nogii bar dlites choc crml blis	1	Неклассифицированные/default	2643456	Nogii
2643458	856513002822	Nogii bar high prtn choc Coconut	1	Неклассифицированные/default	2643456	Nogii
2643459	856513002808	Nogii bar high prtn cocoa brwni	1	Неклассифицированные/default	2643456	Nogii
2643460	856513002259	Nogii bar paleo berry	1	Неклассифицированные/default	2643456	Nogii
2643461	856513002365	Nogii bar paleo mixed nut	1	Неклассифицированные/default	2643456	Nogii
2643462	856513002266	Nogii bar paleo Tropical Fruit	1	Неклассифицированные/default	2643456	Nogii
2643463	856513002495	Nogii bar protein high choc min	1	Неклассифицированные/default	2643456	Nogii
2643464	856513002075	Nogii bar protein high pbttr&ch	1	Неклассифицированные/default	2643456	Nogii
2643465	856513002099	Nogii bar protein supr choc pbt	1	Неклассифицированные/default	2643456	Nogii
2643466	856513002662	Nogii bar protein supr rocky ro	1	Неклассифицированные/default	2643456	Nogii
4553800	4601377000103	Noginka men's socks	1	Неклассифицированные/default	0	
397673	608782668397	Nogne o 100 glass 16.9oz	22186	Продукты питания (folder)/Алкогольные напитки/Пиво	397672	Nogne O
397674	7090008090892	Nogne o andhrimnir glass 750ml	22186	Продукты питания (folder)/Алкогольные напитки/Пиво	397672	Nogne O
397675	608782668885	Nogne o brown ale glass 16.9oz	22186	Продукты питания (folder)/Алкогольные напитки/Пиво	397672	Nogne O
397676	7090008090595	Nogne o Dark horizon glass 16.9oz	22186	Продукты питания (folder)/Алкогольные напитки/Пиво	397672	Nogne O
397677	7090008090779	Nogne o dobbel ipa glass 16.9oz	22186	Продукты питания (folder)/Алкогольные напитки/Пиво	397672	Nogne O
397678	7090008090533	Nogne o imperial brown ale glass 16.9oz	22186	Продукты питания (folder)/Алкогольные напитки/Пиво	397672	Nogne O
397679	608782668878	Nogne o imperial stout glass 16.9oz	22186	Продукты питания (folder)/Алкогольные напитки/Пиво	397672	Nogne O
397680	608782668403	Nogne o pale ale glass 16.9oz	22186	Продукты питания (folder)/Алкогольные напитки/Пиво	397672	Nogne O
397681	608782668410	Nogne o porter glass 16.9oz	22186	Продукты питания (folder)/Алкогольные напитки/Пиво	397672	Nogne O
397682	7090008091028	Nogne o Red horizon glass 16.9oz	22186	Продукты питания (folder)/Алкогольные напитки/Пиво	397672	Nogne O
397683	7090008090786	Nogne o sahti glass 16.9oz	22186	Продукты питания (folder)/Алкогольные напитки/Пиво	397672	Nogne O
397684	608782668724	Nogne o saison glass 16.9oz	22186	Продукты питания (folder)/Алкогольные напитки/Пиво	397672	Nogne O
397685	7090008090946	Nogne o Special holiday ale glass 16.9oz	22186	Продукты питания (folder)/Алкогольные напитки/Пиво	397672	Nogne O
397686	7090008090830	Nogne o sunturnbrew glass 16.9oz	22186	Продукты питания (folder)/Алкогольные напитки/Пиво	397672	Nogne O
397687	7090008090984	Nogne o sweet horizon glass 16.9oz	22186	Продукты питания (folder)/Алкогольные напитки/Пиво	397672	Nogne O
397688	7090008090915	Nogne o Tiger tripel glass 16.9oz	22186	Продукты питания (folder)/Алкогольные напитки/Пиво	397672	Nogne O
1073754	087826684256	Nogne o winter ale 12/.50s	1	Неклассифицированные/default	0	
397689	608782668427	Nogne o winter ale glass 16.9oz	22186	Продукты питания (folder)/Алкогольные напитки/Пиво	397672	Nogne O
1926205	7896112134190	Nogripe 20drgs t	1	Неклассифицированные/default	0	
1926206	7896112126812	Nogripe 25x6 cpr	1	Неклассифицированные/default	0	
4553801	081492146100	Nogu canister	1	Неклассифицированные/default	0	
3167063	073562001006	Noh chinese roast duck Mix 1.1oz	330591	Продукты питания (folder)/Продукты питания	0	
4553802	073562000504	Noh Coconut pudding mx haupia 2oz	1	Неклассифицированные/default	0	
2643467	073562000559	Noh Foods Mix pudding Coconut haupia	1	Неклассифицированные/default	632972	NOH FOODS
2643468	073562009903	Noh Foods Mix seasoning astd dsp 144pc	1	Неклассифицированные/default	632972	NOH FOODS
109085	073562000207	Noh Foods Mix seasoning chinese bbq 2.5oz	30882	Продукты питания (folder)/Приправы и специи	632972	NOH FOODS
2643469	073562009910	Noh Foods Mix seasoning chinese dsp 144pc	1	Неклассифицированные/default	632972	NOH FOODS
632973	073562003802	Noh Foods Mix seasoning chinese fried Rice 1oz	30882	Продукты питания (folder)/Приправы и специи	632972	NOH FOODS
632975	073562001808	Noh Foods Mix seasoning chinese rstd chicken 1.13oz	30882	Продукты питания (folder)/Приправы и специи	632972	NOH FOODS
2643470	073562006803	Noh Foods Mix seasoning hawaiian poke	1	Неклассифицированные/default	632972	NOH FOODS
632976	073562000900	Noh Foods Mix seasoning korean bbq 1.5oz	30882	Продукты питания (folder)/Приправы и специи	632972	NOH FOODS
632977	073562004007	Noh Foods Mix seasoning oriental stir fry 1oz	30882	Продукты питания (folder)/Приправы и специи	632972	NOH FOODS
632978	073562040074	Noh Foods Mix seasoning spicy chicken hawaiian 2oz	30882	Продукты питания (folder)/Приправы и специи	632972	NOH FOODS
632979	073562001204	Noh Foods Mix seasoning teri-burger hawaiian 1.5oz	30882	Продукты питания (folder)/Приправы и специи	632972	NOH FOODS
2643471	073562000603	Noh Foods Mix tea iced hawaiian	1	Неклассифицированные/default	632972	NOH FOODS
2643472	073562008807	Noh Foods Mix tea iced hawaiian dsp 120p	1	Неклассифицированные/default	632972	NOH FOODS
3167062	073562000108	Noh Foods of hawaii, chinese beef tomato sauce Mix (beef broccoli)	330591	Продукты питания (folder)/Продукты питания	0	
632974	073562002300	Noh Foods of hawaii, chinese Lemon chicken sauce Mix	30882	Продукты питания (folder)/Приправы и специи	632972	NOH FOODS
1073755	073562005103	Noh Foods sauce bbq hawaiian 20oz	1	Неклассифицированные/default	632972	NOH FOODS
2643473	073562049909	Noh Foods sauce bbq hawaiian dsp 24pcs	1	Неклассифицированные/default	632972	NOH FOODS
1073756	073562045109	Noh Foods sauce bbq spicy hawaiian 20oz	1	Неклассифицированные/default	632972	NOH FOODS
2643474	073562007107	Noh Foods sauce hawaiian hula huli	1	Неклассифицированные/default	632972	NOH FOODS
1073757	073562005707	Noh Foods sauce Hot hawaiian 5fo	1	Неклассифицированные/default	632972	NOH FOODS
2643475	073562003406	Noh Foods sauce Hot korean	1	Неклассифицированные/default	632972	NOH FOODS
2643476	073562100303	Noh Foods seasoning sslt all purpose hawaii	1	Неклассифицированные/default	632972	NOH FOODS
2643477	073562100204	Noh Foods seasoning sslt grlc hrb hawai	1	Неклассифицированные/default	632972	NOH FOODS
1557028	073562005004	Noh Foods tea iced rtd hawaiian 6pk	1	Неклассифицированные/default	632972	NOH FOODS
4553804	073562000702	Noh korean Kim chee base Mix 1.12oz	1	Неклассифицированные/default	0	
4553805	073562001105	Noh swt sour rib Mix 1.1oz	1	Неклассифицированные/default	0	
3167065	073562001303	Noh, japanese teriyaki seasoning Mix	330591	Продукты питания (folder)/Продукты питания	0	
2176560	8588000219018	Nohavicky Sandra 52	1	Неклассифицированные/default	0	
3167064	073562002508	Nohfds filipino adobe * 1.2oz	330591	Продукты питания (folder)/Продукты питания	0	
4553803	073562000405	Nohfds hawaiian style curry 1.5oz	1	Неклассифицированные/default	0	
1557029	368047186164	Nohist dm liq 4/15/10mg/5ml	1	Неклассифицированные/default	0	
1073760	368047167019	Nohist dmx tab 80/20/30mg	1	Неклассифицированные/default	0	
1557030	368047185167	Nohist liq 4/15/10mg/5ml	1	Неклассифицированные/default	0	
1073758	368047160010	Nohist tab 100	1	Неклассифицированные/default	0	
1073759	368047162168	Nohist-a sf 5-2.5-	1	Неклассифицированные/default	0	
1073761	368047161017	Nohist-ext 8-2.5mg	1	Неклассифицированные/default	0	
4553806	660200308421	Noi (DVD)	1	Неклассифицированные/default	0	
2368531	3359993602119	Noi missoni EDP 100ml	3068	Парфюмерия (folder)/Парфюмерия	0	
2368532	3359993600115	Noi missoni EDP 50ml	3068	Парфюмерия (folder)/Парфюмерия	0	
2368533	3359993601112	Noi missoni EDP 50ml vapo	3068	Парфюмерия (folder)/Парфюмерия	0	
197139	8012386090317	Noi&voi sale marino fino 1kg	1	Неклассифицированные/default	0	
197140	8012386090324	Noi&voi sale marino grasso 1	1	Неклассифицированные/default	0	
1557031	080480004538	Noilly prat Ambre vermouth glass 750ml	1	Неклассифицированные/default	0	
197141	083300049351	Noilly prat Dry 18% 750ml	22446	Продукты питания (folder)/Алкогольные напитки/Вино (folder)/Вермут	0	
397691	083300049337	Noilly prat Dry vermouth 1000ml	78617	Продукты питания (folder)/Алкогольные напитки/Алкоголь	397690	Noilly Prat
1073763	080480002183	Noilly prat Dry vermouth 12pk 9% 375l	1	Неклассифицированные/default	0	
197142	080480049331	Noilly prat Dry vermouth 18% 1000ml	22446	Продукты питания (folder)/Алкогольные напитки/Вино (folder)/Вермут	0	
632980	3023010003592	Noilly prat Dry vermouth 750ml	1	Неклассифицированные/default	397690	Noilly Prat
397693	080480217006	Noilly prat Dry vermouth glass 1l	78617	Продукты питания (folder)/Алкогольные напитки/Алкоголь	397690	Noilly Prat
397695	080480217013	Noilly prat Dry vermouth glass 750ml	78617	Продукты питания (folder)/Алкогольные напитки/Алкоголь	397690	Noilly Prat
1073762	080480002169	Noilly prat Extra Dry glass 1l	1	Неклассифицированные/default	0	
1073764	080480002176	Noilly prat Extra Dry glass 750ml	1	Неклассифицированные/default	0	
2368534	080480049355	Noilly prat france Dry verm 9% 0.75l	78617	Продукты питания (folder)/Алкогольные напитки/Алкоголь	0	
397694	080480217020	Noilly prat france Dry verm-12/cs 9% 0.375l	78617	Продукты питания (folder)/Алкогольные напитки/Алкоголь	397690	Noilly Prat
632981	080480981105	Noilly prat Original Dry vermouth 750ml	22133	Продукты питания (folder)/Алкогольные напитки/Вино (folder)/Вино	0	
397696	080480217068	Noilly prat Rouge vermouth glass 1l	78617	Продукты питания (folder)/Алкогольные напитки/Алкоголь	397690	Noilly Prat
397698	080480217075	Noilly prat Rouge vermouth glass 750ml	78617	Продукты питания (folder)/Алкогольные напитки/Алкоголь	397690	Noilly Prat
1557032	080480492878	Noilly prat sweet vermouth	1	Неклассифицированные/default	0	
1557033	080480493066	Noilly prat sweet vermouth #2	1	Неклассифицированные/default	0	
397692	083300049269	Noilly prat sweet vermouth 1000ml	78617	Продукты питания (folder)/Алкогольные напитки/Алкоголь	397690	Noilly Prat
397697	080480217082	Noilly prat sweet vermouth 12pk 8% 375l	78617	Продукты питания (folder)/Алкогольные напитки/Алкоголь	397690	Noilly Prat
4553807	083300049375	Noilly pratt Dry vermouth 375ml	1	Неклассифицированные/default	0	
304085	074108234469	Noimageavailablesmall conair babcxpkpp1 combo babyliss Pro straightener Hair dryer (pink)	360487	Уход за волосами (folder)/Парикмахерская	297868	BaByliss
2368535	5998448500303	Noir (nimrod wines) glass 750ml	1	Неклассифицированные/default	0	
3723568	8714858476659	Noir (pelican Rouge/niderlande) bar b 1kg s	19716	Продукты питания (folder)/Чай и кофе/Кофе	3723567	NOIR (PELICAN ROUGE/NIDERLANDE)
3723569	8714858476611	Noir (pelican Rouge/niderlande) forte b 1kg s	19716	Продукты питания (folder)/Чай и кофе/Кофе	3723567	NOIR (PELICAN ROUGE/NIDERLANDE)
3723570	8714858476635	Noir (pelican Rouge/niderlande) tradizione b 1kg s	19716	Продукты питания (folder)/Чай и кофе/Кофе	3723567	NOIR (PELICAN ROUGE/NIDERLANDE)
397699	3760078860254	Noir 46 Malbec glass 750ml	41821	Продукты питания (folder)/Алкогольные напитки/Вино (folder)/Вина Франции	0	
2368536	3596936093430	Noir de reminescence EDT 100ml vapo	3068	Парфюмерия (folder)/Парфюмерия	0	
1629014	888066015509	Noir EDP 3.4floz spray for men by tom ford	3068	Парфюмерия (folder)/Парфюмерия	306504	Tom Ford
1073766	5014697034823	Noir EDT 100ml spray homme	3068	Парфюмерия (folder)/Парфюмерия	1073765	Roberre
3167066	3700134406750	Noir edт 100ml м	1	Неклассифицированные/default	0	
1926207	746480977929	Noir for men 1.7oz EDT spray by st dupont	3068	Парфюмерия (folder)/Парфюмерия	1910437	S.T Dupont
4553808	702727091629	Noir-1-animini (DVD/eng-dub)	1	Неклассифицированные/default	0	
4553809	702727077029	Noir-1hd (DVD)	1	Неклассифицированные/default	0	
4553810	702727090721	Noir-2-animini (DVD/eng-dub)	1	Неклассифицированные/default	0	
4553811	702727195525	Noir-complete collection (DVD)	1	Неклассифицированные/default	0	
4553812	702727127021	Noir-complete collection (DVD/7 disc)	1	Неклассифицированные/default	0	
3723572	4604909000428	Noiro (avia-kos/kazan') 2s 12r	2664	Гигиена (folder)/Бумага туалетная	3723571	NOIRO (AVIA-KOS/KAZAN')
3723573	4627088504877	Noiro (avia-kos/kazan') 2s 12r #2	2664	Гигиена (folder)/Бумага туалетная	3723571	NOIRO (AVIA-KOS/KAZAN')
3723574	4604909000350	Noiro (avia-kos/kazan') 2s 4r	2664	Гигиена (folder)/Бумага туалетная	3723571	NOIRO (AVIA-KOS/KAZAN')
3723575	4627088504853	Noiro (avia-kos/kazan') 2s 4r #2	2664	Гигиена (folder)/Бумага туалетная	3723571	NOIRO (AVIA-KOS/KAZAN')
2818207	4000539307409	Noirs chocolates 200g	1	Неклассифицированные/default	0	
4553814	616892960515	Noise (australian movie)	1	Неклассифицированные/default	0	
4553815	013131615692	Noise (DVD)	1	Неклассифицированные/default	0	
4553816	821575534659	Noise (DVD) #2	1	Неклассифицированные/default	0	
4553817	823107200124	Noise America CD discharge - decontrol - the singles	1	Неклассифицированные/default	0	
4553818	823107200025	Noise America CD g.b.h. - the punk singles	1	Неклассифицированные/default	0	
4553819	823107500125	Noise America CD lewis, jeffrey - the last time i did acid	1	Неклассифицированные/default	0	
4553820	823107200223	Noise America CD pogues, the - streams of whisky	1	Неклассифицированные/default	0	
4553821	823107300022	Noise America CD raven - all systems go!	1	Неклассифицированные/default	0	
4553822	823107400227	Noise America CD Seven witches - xiled to infinity and One	1	Неклассифицированные/default	0	
4553823	823107500026	Noise America CD sodastream - the Hill for company	1	Неклассифицированные/default	0	
4553824	823107000120	Noise America CD superjoint ritual - use once&destroy	1	Неклассифицированные/default	0	
4553825	823107300121	Noise America CD venom - in League with satan	1	Неклассифицированные/default	0	
4553826	823107400128	Noise America CD virgin steele - hymns to Victory	1	Неклассифицированные/default	0	
4553827	823107400029	Noise America CD virgin steele - the book of burning	1	Неклассифицированные/default	0	
4553828	823107600191	Noise America DVD gamma ray: heading for the East	1	Неклассифицированные/default	0	
2689150	823107600092	Noise America DVD superjoint ritual: live in dallas, texas	2275105	Медиа (folder)/Медиа	0	
4553829	823107230527	Noise America lightning to the nations (compact disc) by Diamond head	1	Неклассифицированные/default	0	
4553830	715717717195	Noise cancellation 71700-07	1	Неклассифицированные/default	0	
4553831	057197512786	Noise cancelling headphones	1	Неклассифицированные/default	0	
4553832	837147000019	Noise cancelling headphones #2	1	Неклассифицированные/default	0	
4553833	880198052896	Noise driven ambient audio&visuals (DVD)	1	Неклассифицированные/default	0	
4553834	080529010315	Noise Filter 1 pr display 1ct	1	Неклассифицированные/default	0	
4553835	080529510013	Noise Filter w/case earplug 1ct	1	Неклассифицированные/default	0	
304087	618822200029	Noise machine sound machine alarm clock 12 soothing sounds spa	297057	Лекарственные средства (folder)/Health & Personal Care	304086	Soothing Sounds
4553836	073525118673	Noise maker	1	Неклассифицированные/default	0	
4553837	079948081303	Noise makers 1ct	1	Неклассифицированные/default	0	
4553838	808458100026	Noise Plus music CD collide: chasing the ghost	1	Неклассифицированные/default	0	
4553839	808458600021	Noise Plus music CD collide: live at the el rey	1	Неклассифицированные/default	0	
4553840	808458200023	Noise Plus music CD collide: some kind of strange	1	Неклассифицированные/default	0	
4553841	808458500093	Noise Plus music DVD collide: like the hunted	1	Неклассифицированные/default	0	
4553842	085761097155	Noise putty	1	Неклассифицированные/default	0	
4553843	085761971554	Noise putty #2	1	Неклассифицированные/default	0	
4553844	639277539823	Noise putty 100g	1	Неклассифицированные/default	0	
4553845	780984680411	Noise putty 1ct	1	Неклассифицированные/default	0	
4553846	068888000208	Noise suppressor	1	Неклассифицированные/default	0	
4553847	837101023221	Noise tank (lovesyou) / glee, ad nauseam, and how it all works out	1	Неклассифицированные/default	0	
4553848	741157973426	Noise unit, decoder	1	Неклассифицированные/default	0	
219348	639247153233	Noise-cancelling stereo earphones with hands-free microphone	1	Неклассифицированные/default	205464	iLUV
4553849	790461205365	Noisemaker	1	Неклассифицированные/default	0	
2643478	5028252260596	Noisereducing aux audio cable	1	Неклассифицированные/default	0	
4553850	6111025200192	Noisette chocolat Extra fin - chocolat au lait&noisettes 100g	1	Неклассифицированные/default	0	
3167067	719416204246	Noisina Spread	330591	Продукты питания (folder)/Продукты питания	0	
2176561	077234029060	Noisy fur ferret Cat toy 5inch	337596	Товары для животных (folder)/Pets	0	
4553851	767685985137	Noisy nora (DVD)	1	Неклассифицированные/default	0	
2176562	077234057001	Noisy noses asst 5inch	337596	Товары для животных (folder)/Pets	0	
4553852	827657000999	Noisy-first punkervision comp (DVD)	1	Неклассифицированные/default	0	
4553853	5601887426454	Noiva procura-se chris o'donnel ren??E zellweger	1	Неклассифицированные/default	0	
4553854	3105970001020	Noix de st Jacques 207g	1	Неклассифицированные/default	0	
4553855	025100007520	Noixon watch	1	Неклассифицированные/default	0	
4553856	085214045962	Nojo shopping cart cover / jungle babies 4oz	1	Неклассифицированные/default	0	
4553857	047100001513	Nok kit 1680 Black prepaid cam	1	Неклассифицированные/default	0	
4553858	610214609526	Nok kit 3595 vsw	1	Неклассифицированные/default	0	
4553859	610214611192	Nok kit 6010 vsw tm to go Box	1	Неклассифицированные/default	0	
4553860	730312972121	Nok101	1	Неклассифицированные/default	0	
1924548	8801767631696	Nokchawon, iced mixed grain tea	1	Неклассифицированные/default	0	
2368537	8998838080016	Noki binder clips	1	Неклассифицированные/default	0	
4553861	610214616159	Nokia	1	Неклассифицированные/default	1073768	NOKIA
4553862	6417182713309	Nokia #2	1	Неклассифицированные/default	1073768	NOKIA
4553863	8698510706547	Nokia #3	1	Неклассифицированные/default	1073768	NOKIA
4553864	797553132813	Nokia (Body glove) cell phone case (models 3360, 3361, 1260, 2260)	1	Неклассифицированные/default	1073768	NOKIA
2559572	6907384017706	Nokia - cp-322 - etui pour nokia n86 - gris	1	Неклассифицированные/default	1073768	NOKIA
