ID	UPCEAN	Name	CategoryID	CategoryName	BrandID	BrandName
171293	5998815733372	Вино хунгаровин пазманди каберне совиньон 12% 750мл красн сух	22133	Продукты питания (folder)/Алкогольные напитки/Вино (folder)/Вино	0	
171294	5998815733327	Вино хунгаровин сексарди кекопорто 750мл 11% красн сл	22133	Продукты питания (folder)/Алкогольные напитки/Вино (folder)/Вино	0	
171295	5998815733303	Вино хунгаровин сексарди цвайгельт 750мл 11% красн полусладк	22133	Продукты питания (folder)/Алкогольные напитки/Вино (folder)/Вино	0	
171296	5998815733389	Вино хунгаровин сексардский бикавер 12% 750мл красн сух	22133	Продукты питания (folder)/Алкогольные напитки/Вино (folder)/Вино	0	
171297	5998815733341	Вино хунгаровин сексардский мерло 12% 750мл красн сух	22133	Продукты питания (folder)/Алкогольные напитки/Вино (folder)/Вино	0	
171298	5998815733297	Вино хунгаровин токай фурминт 750мл 11% бел полусладк	22133	Продукты питания (folder)/Алкогольные напитки/Вино (folder)/Вино	0	
171299	5998815733310	Вино хунгаровин толнай кекфранкош 750мл 11% красн сух	22133	Продукты питания (folder)/Алкогольные напитки/Вино (folder)/Вино	0	
171300	5998815733334	Вино хунгаровин этек райн рислинг 12% 750мл бел сух	22133	Продукты питания (folder)/Алкогольные напитки/Вино (folder)/Вино	0	
171301	5998815733358	Вино хунгаровин этек шардоне 12% 750мл бел сух	22133	Продукты питания (folder)/Алкогольные напитки/Вино (folder)/Вино	0	
47001	5601889009044	Вино хустинос мадейра файн Dry 750мл	22133	Продукты питания (folder)/Алкогольные напитки/Вино (folder)/Вино	0	
47002	5601889001017	Вино хустинос мадейра файн рич 19% 750мл	22133	Продукты питания (folder)/Алкогольные напитки/Вино (folder)/Вино	0	
3291969	4670006920693	Вино хутор коржи сливовое плодоягодное 0.7м л с/б	22133	Продукты питания (folder)/Алкогольные напитки/Вино (folder)/Вино	0	
3291970	4670006920655	Вино хутор коржи яблочное плодовоягодное 0.7м л с/б	22133	Продукты питания (folder)/Алкогольные напитки/Вино (folder)/Вино	0	
46996	6935230010113	Вино хэппи панда 750мл 0% сливовое, сладкое со сливами	22133	Продукты питания (folder)/Алкогольные напитки/Вино (folder)/Вино	46987	Хэппи Панда
44154	6902824300233	Вино хэппи панда абрикосовое 750мл 0% сладкое	22133	Продукты питания (folder)/Алкогольные напитки/Вино (folder)/Вино	150518	СВАРОГ ВИНО 248
691289	4607053044300	Вино хюгель гевюрц.селекс.де гран нобль бел сл.750мл	689475	Продукты питания (folder)/Алкогольные напитки/Вино (folder)/Вина Франции Эльзас	691288	Хюгель
691271	5201021637755	Вино цант.халкидики б.с11% 750мл	22133	Продукты питания (folder)/Алкогольные напитки/Вино (folder)/Вино	691270	Халкидики
150702	5201021623703	Вино цантали имигликос вин.нат. красное полусладк 750мл	22133	Продукты питания (folder)/Алкогольные напитки/Вино (folder)/Вино	0	
150701	5201021643701	Вино цантали имигликос вин.нат.белое полусладк 750мл	22133	Продукты питания (folder)/Алкогольные напитки/Вино (folder)/Вино	0	
46635	5201021683509	Вино цантали мускатос оф лимнос высококач. спец.белое десертное 0.5л	22133	Продукты питания (folder)/Алкогольные напитки/Вино (folder)/Вино	46630	Tsantalis
151375	5201021612707	Вино цантали науса вин.нат. высококач.выдерж.красное сухое 750мл	22133	Продукты питания (folder)/Алкогольные напитки/Вино (folder)/Вино	46630	Tsantalis
151382	5201021613759	Вино цантали немеа вин.нат.высококач.выдерж.красное сухое 750мл	22133	Продукты питания (folder)/Алкогольные напитки/Вино (folder)/Вино	0	
1958155	5201021685701	Вино цантали самос высококач.спец.белое десертное 750мл	22133	Продукты питания (folder)/Алкогольные напитки/Вино (folder)/Вино	0	
151767	4823034000251	Вино царица египта бел полусладк 750мл	22133	Продукты питания (folder)/Алкогольные напитки/Вино (folder)/Вино	0	
2427314	4820009931954	Вино царица египта бел полусладк 9-11% 750мл	22133	Продукты питания (folder)/Алкогольные напитки/Вино (folder)/Вино	0	
2855099	094302339029	Вино царица ночи кра/полусладк 10/12% 0.700	22133	Продукты питания (folder)/Алкогольные напитки/Вино (folder)/Вино	0	
3291971	4680016071506	Вино царица ночи столов полусладк белое 10-13% 750мл стекло	22133	Продукты питания (folder)/Алкогольные напитки/Вино (folder)/Вино	0	
3291972	4680016071520	Вино царица ночи столов полусладк красное 10-13% 750мл стекло	22133	Продукты питания (folder)/Алкогольные напитки/Вино (folder)/Вино	0	
283473	4607142240101	Вино царица ночи столов полусладк красное 10.2% 750мл стекло	22133	Продукты питания (folder)/Алкогольные напитки/Вино (folder)/Вино	0	
151769	4840205000704	Вино Царская Изабелла красн полусладк 750мл	22133	Продукты питания (folder)/Алкогольные напитки/Вино (folder)/Вино	0	
151770	4840205000711	Вино Царская лидия красн,полусладк 750мл	22133	Продукты питания (folder)/Алкогольные напитки/Вино (folder)/Вино	0	
3291973	3800024936340	Вино Царская любовь столов красное полусладк 10-12% 750мл стекло	22133	Продукты питания (folder)/Алкогольные напитки/Вино (folder)/Вино	0	
47003	4840205000421	Вино Царская любовь столов полусладк красное 10-12% 750мл стбут	22133	Продукты питания (folder)/Алкогольные напитки/Вино (folder)/Вино	0	
1195776	4840205000995	Вино Царская невеста бел п/ сух 10-12% 750мл	22133	Продукты питания (folder)/Алкогольные напитки/Вино (folder)/Вино	0	
1195775	4840205001008	Вино Царская невеста бел полусладк 10-12% 750мл	22133	Продукты питания (folder)/Алкогольные напитки/Вино (folder)/Вино	0	
2855100	4840205001015	Вино Царская невеста бел/спец 16% 750мл	22133	Продукты питания (folder)/Алкогольные напитки/Вино (folder)/Вино	0	
2855101	4840205001022	Вино Царская невеста бел/спец 750мл	22133	Продукты питания (folder)/Алкогольные напитки/Вино (folder)/Вино	0	
2854458	3800214142711	Вино Царский графин белое полусладк 10-12% 1л	22133	Продукты питания (folder)/Алкогольные напитки/Вино (folder)/Вино	0	
3291974	3800214142780	Вино Царский графин виноградная кровь полусладк 1л	22133	Продукты питания (folder)/Алкогольные напитки/Вино (folder)/Вино	0	
151768	3800111110424	Вино Царский двор красн полусладк цар/двор болг/лудинг 0	22133	Продукты питания (folder)/Алкогольные напитки/Вино (folder)/Вино	1193538	ЛУДИНГ
2227456	3800007815037	Вино Царский дворец Царский дворец красн/полусладк 0.75 12% 1/6	22133	Продукты питания (folder)/Алкогольные напитки/Вино (folder)/Вино	0	
47005	4840205000360	Вино Царский Каприз красное полусладк 10-12% 750мл стекло	22133	Продукты питания (folder)/Алкогольные напитки/Вино (folder)/Вино	0	
47007	4840205000384	Вино Царский мускат белое полусладк 12% 750мл ст/б	22133	Продукты питания (folder)/Алкогольные напитки/Вино (folder)/Вино	0	
1195777	4840205000674	Вино Царский мускат специальное белое 16% 750мл ст/б	22133	Продукты питания (folder)/Алкогольные напитки/Вино (folder)/Вино	0	
47006	4840205000391	Вино Царский мускат столов белое полусладк 10-12% 750мл ст/б	22133	Продукты питания (folder)/Алкогольные напитки/Вино (folder)/Вино	0	
47008	4840205000315	Вино Царский стандарт бел полусладк 12% 750мл	22133	Продукты питания (folder)/Алкогольные напитки/Вино (folder)/Вино	0	
47011	4840205000322	Вино Царский стандарт бел полусладк, красн полусладк 750мл	22133	Продукты питания (folder)/Алкогольные напитки/Вино (folder)/Вино	0	
47009	4840205000292	Вино Царский стандарт бел сух 9% 750мл	22133	Продукты питания (folder)/Алкогольные напитки/Вино (folder)/Вино	0	
47010	4402050003462	Вино Царский стандарт красн п/дес.16% 750мл	22133	Продукты питания (folder)/Алкогольные напитки/Вино (folder)/Вино	0	
47012	4840205000308	Вино Царский стандарт красн сух 9% 750мл	22133	Продукты питания (folder)/Алкогольные напитки/Вино (folder)/Вино	0	
151771	4840205000346	Вино Царский стандарт красн/п/дес 750мл	22133	Продукты питания (folder)/Алкогольные напитки/Вино (folder)/Вино	0	
691290	4250287902290	Вино царте катце бел п.слад. 750мл 9% голуб бут Германия	22133	Продукты питания (folder)/Алкогольные напитки/Вино (folder)/Вино	0	
2855103	4250287900180	Вино царте шмузе катце б/пс 750мл	22133	Продукты питания (folder)/Алкогольные напитки/Вино (folder)/Вино	0	
3291975	4250287903297	Вино царте шмузе катце красное полусладк 10% 750мл стекло	22133	Продукты питания (folder)/Алкогольные напитки/Вино (folder)/Вино	0	
47014	7290001889589	Вино Царь давид мускат бел слад.12.5% 750мл	22133	Продукты питания (folder)/Алкогольные напитки/Вино (folder)/Вино	47013	ЦарьДавид
1195778	4860013080668	Вино Царь ираклий 2 выд. VS 7лет 0.5л (Грузия)	282274	Продукты питания (folder)/Алкогольные напитки/Вино (folder)/Вина Грузии	0	
47015	7290002937210	Вино царьдавид конкорд красн сл.12.5% 750мл	22133	Продукты питания (folder)/Алкогольные напитки/Вино (folder)/Вино	47013	ЦарьДавид
2427315	4630003780225	Вино цв/нектар красн сл, 15% 0.700	22133	Продукты питания (folder)/Алкогольные напитки/Вино (folder)/Вино	0	
1760260	5998249112750	Вино цвайгельт-рубинтош красн сл 750мл	22133	Продукты питания (folder)/Алкогольные напитки/Вино (folder)/Вино	0	
2855104	3800214142186	Вино цвет ночи крас полусладк 700мл	22133	Продукты питания (folder)/Алкогольные напитки/Вино (folder)/Вино	0	
3291976	4840042001957	Вино цвет ночи красное полусладк 10-12% 0.7л стекло	22133	Продукты питания (folder)/Алкогольные напитки/Вино (folder)/Вино	0	
47016	4840249001576	Вино цвет сакуры бел полусладк 11.5% 750мл	22133	Продукты питания (folder)/Алкогольные напитки/Вино (folder)/Вино	0	
47017	4840249001330	Вино цвет сакуры розов полусладк 12% 750мл	22133	Продукты питания (folder)/Алкогольные напитки/Вино (folder)/Вино	0	
47019	6009603662237	Вино цвета африки во вестерн кейп бел п/сух 12.5% 750мл	22169	Продукты питания (folder)/Алкогольные напитки/Вино (folder)/Вина Новый Свет	47018	Цвета Африки
1195779	600960366224	Вино цвета африки во вестерн кейп красн сух 14% 750мл	22133	Продукты питания (folder)/Алкогольные напитки/Вино (folder)/Вино	150518	СВАРОГ ВИНО 248
47020	6009603662220	Вино цвета африки красн псух 14% 750мл	22169	Продукты питания (folder)/Алкогольные напитки/Вино (folder)/Вина Новый Свет	47018	Цвета Африки
47021	6009603662244	Вино цвета африки красн сухсвеча декор 13% 750мл	22169	Продукты питания (folder)/Алкогольные напитки/Вино (folder)/Вина Новый Свет	47018	Цвета Африки
3291977	4840342012653	Вино цветение весны белое столов полусладк 10-12% 0.7л ст/б	22133	Продукты питания (folder)/Алкогольные напитки/Вино (folder)/Вино	0	
3291978	4840342013872	Вино цветение весны Изабелла красное 10-12% 750мл ст/б	22133	Продукты питания (folder)/Алкогольные напитки/Вино (folder)/Вино	0	
3291979	4670000686182	Вино цветок вина столов красное сладкое 8.5-9% tetrapak 1л	22133	Продукты питания (folder)/Алкогольные напитки/Вино (folder)/Вино	0	
2427316	8422795012846	Вино цветок любви белое полусладк 11.5% 750мл ст/б	22133	Продукты питания (folder)/Алкогольные напитки/Вино (folder)/Вино	0	
3291980	4607093544174	Вино цветок любви мускат серебряный белое полусладк 10-12% 0.7л стекло	22133	Продукты питания (folder)/Алкогольные напитки/Вино (folder)/Вино	0	
2427317	8422795011801	Вино цветок любви столов красное полусладк 12% 750мл ст/б	22133	Продукты питания (folder)/Алкогольные напитки/Вино (folder)/Вино	0	
2855105	4607125541157	Вино цветок солнца бел полусладк 750мл	22133	Продукты питания (folder)/Алкогольные напитки/Вино (folder)/Вино	0	
171302	6906673531039	Вино цветочное 750мл 13% белое	22133	Продукты питания (folder)/Алкогольные напитки/Вино (folder)/Вино	0	
227466	3800057218987	Вино цветы болгарии красн полусладк 11% 750мл	22133	Продукты питания (folder)/Алкогольные напитки/Вино (folder)/Вино	0	
3291981	4260012163285	Вино цветы любимой женщины белое полусладк 9.5% 750мл стекло	22133	Продукты питания (folder)/Алкогольные напитки/Вино (folder)/Вино	0	
171303	4250287900128	Вино цезарио палаццо каберне совиньон 12% 750мл красн сух	22133	Продукты питания (folder)/Алкогольные напитки/Вино (folder)/Вино	0	
2720950	4607136135291	Вино цезарио палаццо столов белое полусладк 10-12% 750мл стекло	22133	Продукты питания (folder)/Алкогольные напитки/Вино (folder)/Вино	0	
2720951	4607136135307	Вино цезарио палаццо столов красное полусладк 10-12% 750мл стекло	22133	Продукты питания (folder)/Алкогольные напитки/Вино (folder)/Вино	0	
2855106	4006975026904	Вино целлер шварце кац бел/пс 750мл	22133	Продукты питания (folder)/Алкогольные напитки/Вино (folder)/Вино	0	
691292	8009826202287	Вино цельсус санджовезе Тоскана красн сух 750мл	688763	Продукты питания (folder)/Алкогольные напитки/Вино (folder)/Вина Италии Тоскана	691291	Цельсус
3794637	8436033842379	Вино центум ор.верд.бел сух 12.5% 750мл	3615781	Продукты питания (folder)/Алкогольные напитки/Вино (folder)/Вино тихое белое	3794636	ЦЕНТУМ
3794638	8436033842416	Вино центум ориг. красн красн сух 13.5% 750мл	3615777	Продукты питания (folder)/Алкогольные напитки/Вино (folder)/Вино тихое красное	3794636	ЦЕНТУМ
3794639	8436033842430	Вино центум ориг.робле красн сух 750мл	3615777	Продукты питания (folder)/Алкогольные напитки/Вино (folder)/Вино тихое красное	3794636	ЦЕНТУМ
3291982	4670006920372	Вино церизет вишневое фруктовое красное полусладк 12.5% 0.5л стекло	22133	Продукты питания (folder)/Алкогольные напитки/Вино (folder)/Вино	0	
3291983	4670006920419	Вино церизет сливовое розовое фруктовое полусладк 12% 0.5л стекло	22133	Продукты питания (folder)/Алкогольные напитки/Вино (folder)/Вино	0	
3291984	3800007808510	Вино цигански танц красное п/с 700мл	22133	Продукты питания (folder)/Алкогольные напитки/Вино (folder)/Вино	0	
175156	7790189001822	Вино циклос мальбек мерло 2004 красн сух 13.5% 750мл	22133	Продукты питания (folder)/Алкогольные напитки/Вино (folder)/Вино	175155	МЭ-М.Торино (Аргентина)
175157	7790189001846	Вино циклос совиньон блан фюме 2006 бел сух 13% 750мл	22133	Продукты питания (folder)/Алкогольные напитки/Вино (folder)/Вино	175155	МЭ-М.Торино (Аргентина)
3291985	4600735000618	Вино цимлянские вина Изабелла столов красное полусладк 3л алк. 10-12% сах 30-40	22133	Продукты питания (folder)/Алкогольные напитки/Вино (folder)/Вино	0	
3291986	4600735000786	Вино цимлянские вина мускатный берег столов белое полусладк 3л алк. 10-12% сах 30-40	22133	Продукты питания (folder)/Алкогольные напитки/Вино (folder)/Вино	0	
3291987	4600735003701	Вино цимлянские вина цимлянский резерв гевюрцтраминер белое сухое 12.5% 750мл ст/б	22133	Продукты питания (folder)/Алкогольные напитки/Вино (folder)/Вино	0	
3291988	4600735002742	Вино цимлянские вина цимлянское красное полусладк 11% 3л ст/б	22133	Продукты питания (folder)/Алкогольные напитки/Вино (folder)/Вино	0	
283474	4600735000892	Вино цимлянские вина цимлянское столов белое полусладк 3л алк. 10-12% сах 30-40	22133	Продукты питания (folder)/Алкогольные напитки/Вино (folder)/Вино	0	
3291989	4600735000861	Вино цимлянские вина цимлянское столов красное полусладк 2л алк. 10-12% сах 30-40	22133	Продукты питания (folder)/Алкогольные напитки/Вино (folder)/Вино	0	
3291990	4600735003862	Вино цимлянский резерв ркацители сухое белое 13% 750мл ст/б	22133	Продукты питания (folder)/Алкогольные напитки/Вино (folder)/Вино	0	
3291991	4600735003695	Вино цимлянский резерв шардоне сухое белое 14% 750мл ст/б	22133	Продукты питания (folder)/Алкогольные напитки/Вино (folder)/Вино	0	
3291992	4603040012277	Вино цимлянский черный каберне красное сухое 12.5% 750мл ст/б	22133	Продукты питания (folder)/Алкогольные напитки/Вино (folder)/Вино	3790367	АВТОРСКОЕ ФАНАГОРИЯ
691294	4600735000700	Вино цимлянское 750мл 9% натуральное, полусладк	22133	Продукты питания (folder)/Алкогольные напитки/Вино (folder)/Вино	0	
3291993	4600735003558	Вино цимлянское Золотое, белое сладкое, 12%, 750мл ст/б	22133	Продукты питания (folder)/Алкогольные напитки/Вино (folder)/Вино	3792984	ЦИМЛЯНСКОЕ
283475	4600735000373	Вино цимлянское Изабелла красн полусладк 3.0л 10-12% /цимлян.вина/Россия/	22133	Продукты питания (folder)/Алкогольные напитки/Вино (folder)/Вино	0	
283477	4600735000878	Вино цимлянское красн полусладк 3.0л 10-12% /цимлян.вина/Россия/	22133	Продукты питания (folder)/Алкогольные напитки/Вино (folder)/Вино	0	
283476	4600735000311	Вино цимлянское красн полусладк 750мл 10% /цимлян.вина/Россия/	22133	Продукты питания (folder)/Алкогольные напитки/Вино (folder)/Вино	0	
691295	4600735000670	Вино цимлянское мускат 750мл 9% полусладк	22133	Продукты питания (folder)/Алкогольные напитки/Вино (folder)/Вино	0	
283478	4600735000687	Вино цимлянское мускат бел полусладк 3.0л 12% /цимлян.вина/Россия/	22133	Продукты питания (folder)/Алкогольные напитки/Вино (folder)/Вино	0	
283479	4600735001080	Вино цимлянское натур. вино красн полусладк 750мл 9-11% /Россия/цимлян.вина/	22133	Продукты питания (folder)/Алкогольные напитки/Вино (folder)/Вино	0	
3291994	4600735000854	Вино цимлянское п сл красн 10-12% 750мл	22133	Продукты питания (folder)/Алкогольные напитки/Вино (folder)/Вино	0	
691296	4600735000441	Вино цимлянское резерва 750мл 9% натуральное, сухое	22133	Продукты питания (folder)/Алкогольные напитки/Вино (folder)/Вино	0	
3291995	4600735000946	Вино цимлянское резерва сух красн 11-13% 750мл	22133	Продукты питания (folder)/Алкогольные напитки/Вино (folder)/Вино	0	
