ID	UPCEAN	Name	CategoryID	CategoryName	BrandID	BrandName
310778	8594005570665	Витамины канвит ак для собак активных 250г	298109	Товары для животных (folder)/Витамины, подкормки для животных	0	
310788	8594005570948	Витамины канвит хондро макси для собак 1000г	298109	Товары для животных (folder)/Витамины, подкормки для животных	0	
691944	4607081360021	Витамины катрин для волнистых попугаев йод (1x50) 4102	337596	Товары для животных (folder)/Pets	126268	Катрин
691945	4607081360045	Витамины катрин для волнистых попугаев линька (1x50) 4104	337596	Товары для животных (folder)/Pets	126268	Катрин
691946	4607081360038	Витамины катрин для волнистых попугаев минералы (1x50) 4103	337596	Товары для животных (folder)/Pets	126268	Катрин
691947	4607081360014	Витамины катрин для волнистых попугаев общеукрепляющие (1x50) 4101	337596	Товары для животных (folder)/Pets	126268	Катрин
2427666	4605396108017	Витамины навита проф мкб 50таб	337596	Товары для животных (folder)/Pets	0	
310799	4607029071033	Витамины омега для собак 15т биотин	298109	Товары для животных (folder)/Витамины, подкормки для животных	0	
310800	4607029071040	Витамины омега для собак 15т морские водоросли	298109	Товары для животных (folder)/Витамины, подкормки для животных	0	
310804	4607029071057	Витамины омега для щенков 15т карнитин	298109	Товары для животных (folder)/Витамины, подкормки для животных	0	
691948	4607132560455	Витамины роста волос спрей 150мл	1	Неклассифицированные/default	0	
48035	4607100800026	Витамины роше апельсин 500мг	279339	Продукты питания (folder)/Диетические продукты	48034	Роше (бак)
48036	4607100800200	Витамины роше киви 500мг	279339	Продукты питания (folder)/Диетические продукты	48034	Роше (бак)
48038	4607100800217	Витамины роше черная смородина 500мг	279339	Продукты питания (folder)/Диетические продукты	48034	Роше (бак)
310813	8711908323000	Витамины санал 1000т лецитин сеньор	298109	Товары для животных (folder)/Витамины, подкормки для животных	0	
310816	8711908399708	Витамины санал для кошек 35г Love Mix	298109	Товары для животных (folder)/Витамины, подкормки для животных	0	
310818	8711908106207	Витамины санал для кошек 85т Club cocktail	298109	Товары для животных (folder)/Витамины, подкормки для животных	0	
2427667	4607007021012	Витамины сеvа асс 60шт	337596	Товары для животных (folder)/Pets	0	
2427668	4607007021029	Витамины сеvа асс 60шт #2	337596	Товары для животных (folder)/Pets	0	
2427669	4607007021241	Витамины сеvа асс 60шт #3	337596	Товары для животных (folder)/Pets	0	
2427670	4607007021036	Витамины сеvа для котят асс 60шт	337596	Товары для животных (folder)/Pets	0	
691950	4607140040321	Витамины сева для птиц 40 таб.	337596	Товары для животных (folder)/Pets	0	
310839	8850238019426	Витамины слики 340г бисквит баранина	298109	Товары для животных (folder)/Витамины, подкормки для животных	0	
310840	8850238019228	Витамины слики 340г бисквит говядина	298109	Товары для животных (folder)/Витамины, подкормки для животных	0	
310841	8850238019020	Витамины слики 340г бисквит для щенков	298109	Товары для животных (folder)/Витамины, подкормки для животных	0	
310845	8850238066222	Витамины слики 50г жев.пластины баранина	298109	Товары для животных (folder)/Витамины, подкормки для животных	0	
310846	885038006602	Витамины слики 50г жев.пластины говядина	298109	Товары для животных (folder)/Витамины, подкормки для животных	0	
310847	8850238066123	Витамины слики 50г жев.пластины курица	298109	Товары для животных (folder)/Витамины, подкормки для животных	0	
310848	8850238016845	Витамины слики 630г кальций бекон	298109	Товары для животных (folder)/Витамины, подкормки для животных	0	
3292707	4600056587843	Витамины тетравит раствор для ветеринарного применения 100мл	1	Неклассифицированные/default	0	
3292708	4620767190477	Витамины тривит ade в масле для животных 100мл стбут	1	Неклассифицированные/default	0	
3292709	4603720811046	Витамины тривитамин раствор для ветеринарного применения 50мл	1	Неклассифицированные/default	0	
310849	4751008430301	Витамины уро-урси 14т для кошек собак	298109	Товары для животных (folder)/Витамины, подкормки для животных	0	
317424	4607045060196	Витамины чика лакомые зернышки с анисом для волнистых попугаев 20г м/у	298109	Товары для животных (folder)/Витамины, подкормки для животных	863118	ЧИКА
2227629	4004696503957	Витамишки calcium+витамин d жеват пастилки 2.5г №30	1	Неклассифицированные/default	0	
2227630	4004696503858	Витамишки calcium+витамин d жеват пастилки 2.5г №60+подарок маме леди-с формула	1	Неклассифицированные/default	0	
2427671	4004696503940	Витамишки био+ жеват пастилки пребиотик 2.5г №30	1	Неклассифицированные/default	0	
2427672	4004696503841	Витамишки био+ жеват пастилки пребиотик 2.5г №60+подарок маме леди с формула	1	Неклассифицированные/default	0	
2427674	027917102061	Витамишки иммуно Плюс паст жев. 2500мг №30, санта круз нутришнлс	362345	Лекарственные средства (folder)/БАДы	0	
2855434	279171031988	Витамишки иммуно Плюс паст жев. 2500мг №30, санта круз нутришнлс #2	1	Неклассифицированные/default	0	
1356185	027917103204	Витамишки иммуно Плюс паст жев. 2500мг №60, санта круз нутришнлс	1	Неклассифицированные/default	0	
2855435	279171032046	Витамишки иммуно Плюс паст жев. 2500мг №60, санта круз нутришнлс #2	1	Неклассифицированные/default	0	
2427673	4004696503971	Витамишки иммуно+ жеват пастилки с облепихой 2.5г №30	1	Неклассифицированные/default	0	
2427676	4004696503872	Витамишки иммуно+ жеват пастилки с облепихой 2.5г №60	362345	Лекарственные средства (folder)/БАДы	0	
1356078	027917103198	Витамишки иммуно+ №30 паст	1	Неклассифицированные/default	0	
2427675	027917102078	Витамишки иммуно+ №60 паст	362345	Лекарственные средства (folder)/БАДы	0	
1356224	027917103150	Витамишки кальций+ №30 паст	1	Неклассифицированные/default	0	
2855436	279171031506	Витамишки кальциум Плюс паст жев. 2500мг №30, сапплемент сайенсиз инк	1	Неклассифицированные/default	0	
2012042	027917103167	Витамишки кальциум Плюс паст жев. 2500мг №60, сапплемент сайенсиз инк	1	Неклассифицированные/default	0	
2855437	279171031674	Витамишки кальциум Плюс паст жев. 2500мг №60, сапплемент сайенсиз инк #2	1	Неклассифицированные/default	0	
2855438	027917102092	Витамишки мульти Плюс паст жев. 2.4г №30, сапплемент сайенсиз инк #2	1	Неклассифицированные/default	0	
2855439	279171020852	Витамишки мульти Плюс паст жев. 2.4г №30, сапплемент сайенсиз инк #3	1	Неклассифицированные/default	0	
2855440	279171032114	Витамишки мульти Плюс паст жев. 2.4г №30, сапплемент сайенсиз инк #4	1	Неклассифицированные/default	0	
2855441	279171032282	Витамишки мульти Плюс паст жев. 2.4г №60, сапплемент сайенсиз инк	1	Неклассифицированные/default	0	
2427677	027917103211	Витамишки мульти №30 паст	362345	Лекарственные средства (folder)/БАДы	0	
2427678	4004696503995	Витамишки мульти+ жеват пастилки йод+холин 2.4г №30	362345	Лекарственные средства (folder)/БАДы	0	
2427679	4004696503889	Витамишки мульти+ жеват пастилки йод+холин 2.4г №60	1	Неклассифицированные/default	0	
1356411	027917103228	Витамишки мульти+ №60 таб	1	Неклассифицированные/default	0	
2427680	4004696503964	Витамишки фокус+ жеват пастилки черника 2.5г №30	362345	Лекарственные средства (folder)/БАДы	0	
2012592	4004696503865	Витамишки фокус+ жеват пастилки черника 2.6г №60	1	Неклассифицированные/default	0	
2011451	027917103174	Витамишки фокус+ №30 паст	1	Неклассифицированные/default	0	
452158	4605890000060	Витаон (бальзам караваева) п/воспал средство для кожи 50мл	362341	Лекарственные средства (folder)/Дерматологические средства прочие	0	
452156	4605890000046	Витаон 15мл	362341	Лекарственные средства (folder)/Дерматологические средства прочие	0	
310853	4605890000053	Витаон бальзам караваева 30мл для наружн прим	1	Неклассифицированные/default	0	
1353271	4605890000398	Витаон средство по уходу за полостью рта 30мл	1	Неклассифицированные/default	0	
310854	4605890000213	Витаон-Люкс 25мл флак.	1	Неклассифицированные/default	0	
452163	4601026303531	Витапрост 100мг№20	445515	Лекарственные средства (folder)/Средства для лечения простатита	0	
691988	4601026130816	Витапрост n10 супп	1	Неклассифицированные/default	0	
2427684	4601026307416	Витапрост Плюс суппозиторий ректальный №10, нижфарм ОАО	2416595	Лекарственные средства (folder)/Мужские (потенция, простатит, аденома)	0	
310855	4601026303593	Витапрост Плюс №10 суппозиторий ректальный	210391	Лекарственные средства (folder)/Лекарственные средства	0	
1751009	4601026307560	Витапрост суппозиторий ректальный 10мг в конт.яч.уп. №5 x2	241824	Лекарственные средства (folder)/Аптека	0	
310856	4601026130717	Витапрост суппозиторий ректальный 50мг №10, нижфарм ОАО	210391	Лекарственные средства (folder)/Лекарственные средства	0	
1355318	4601026307355	Витапрост табл. киш-раств. об 20мг х20	1	Неклассифицированные/default	0	
310857	4601026303388	Витапрост форте суппозиторий ректальный 100мг №10, нижфарм ОАО	210391	Лекарственные средства (folder)/Лекарственные средства	0	
1354776	4601026307331	Витапрост форте суппозиторий ректальный 20мг в конт.яч.уп. №5 x2 100мг	1	Неклассифицированные/default	0	
2855442	4620759290307	Витаргол форте 15мл	1	Неклассифицированные/default	0	
452164	4820073160014	Витарон р-р 2% фл. 20мл	1	Неклассифицированные/default	0	
310858	4606696000766	Витарос амп. 2мл пак. (протравитель луковиц) /500 август Россия минимум	1	Неклассифицированные/default	0	
691989	4606696001312	Витарос фл. 10мл (протравитель луковиц) /140 август минимум	561877	Растениеводство/Товары для садоводства	0	
509549	8032745033113	Витасана найт подгузники для взрослых №10 l	458	Гигиена (folder)/Подгузники	20846	Pampers
2855443	8032745032116	Витасана найт подгузники для взрослых №10 m	1	Неклассифицированные/default	0	
2855444	8032745033106	Витасана подгузники для взрослых №10 l	1	Неклассифицированные/default	0	
2855445	8032745032109	Витасана подгузники для взрослых №10 m	1	Неклассифицированные/default	0	
692001	3838989511920	Витаскин refreshing тоник освежающий 200мл	1	Неклассифицированные/default	0	
2855446	3838989618575	Витаскин анти акне увлажняющий против угрей Крем 50мл	1	Неклассифицированные/default	0	
2855447	3838989517496	Витаскин биобаланс питательный Крем вокруг глаз 30мл	1	Неклассифицированные/default	0	
452171	3838989517526	Витаскин биобаланс питательный обогащенный Крем 50мл	1	Неклассифицированные/default	0	
2855448	3838989621940	Витаскин биовитал дневной с эффектом лифтинга Крем 50мл	1	Неклассифицированные/default	0	
2855449	3838989621957	Витаскин биовитал лифт 3 актив ночной Крем 50мл	1	Неклассифицированные/default	0	
2855450	3838989621964	Витаскин биовитал лифт гель вокруг глаз 30мл	1	Неклассифицированные/default	0	
2855451	3838989621971	Витаскин биовитал лифт серум сыворотка 30мл	1	Неклассифицированные/default	0	
2855452	3838989765675	Витаскин бэйсик №15 оптимальный дневной и ночной Крем 50мл	1	Неклассифицированные/default	0	
452172	3838989714291	Витаскин Крем для рук и ногтей 10мл	1438	Косметика (folder)/Крем для рук	0	
452175	3838989624101	Витаскин Крем оптимальный ночь/день 50мл	5586	Косметика (folder)/Косметика	0	
452176	3838989621995	Витаскин Крем увлажняющий для нормальной кожи 50мл	5586	Косметика (folder)/Косметика	0	
452177	3838989621988	Витаскин Крем увлажняющий для чувствительной кожи 50мл	5586	Косметика (folder)/Косметика	0	
2855453	3838989620066	Витаскин Крем-депилятор 100мл	5203	Косметика (folder)/Депиляция	0	
492142	3838989512040	Витаскин очищающее и тоник 2в1 молочко 200мл	1	Неклассифицированные/default	0	
492063	3838989511876	Витаскин очищающее огуречное молочко 200мл	5586	Косметика (folder)/Косметика	0	
452173	3838989621933	Витаскин против старения туба Крем для рук 75мл	1438	Косметика (folder)/Крем для рук	0	
2855454	3838989599287	Витаскин регенератив мульти актив дневной №22 Крем 50мл	1	Неклассифицированные/default	0	
2855455	3838989599195	Витаскин регенератив мульти актив ночной №18 Крем 50мл	1	Неклассифицированные/default	0	
2855456	3838989599201	Витаскин регенератив от морщин №19 Крем вокруг глаз 30мл	1	Неклассифицированные/default	0	
2855457	3838989620035	Витаскин с ромашкой Крем-депилятор 100мл	5203	Косметика (folder)/Депиляция	0	
452178	3838989518875	Витаскин сан молочко после загара 150мл	3702	Косметика (folder)/Загар и защита от солнца	0	
2855458	3838989621469	Витаскин сан охлаждающий гель после загара 100мл	1	Неклассифицированные/default	0	
2855459	3838989518905	Витаскин сан солнцезащит spf25 молочко 150мл	1	Неклассифицированные/default	0	
2855460	3838989531898	Витаскин фарма формула молодости дневной укрепляющий против морщин и пигментных пятен Крем 50мл	1	Неклассифицированные/default	0	
691999	3838989531881	Витаскин фарма формула молодости ночной восстанавливающий против морщин и пигментных пятен Крем 50мл	1	Неклассифицированные/default	0	
2855461	3838989532277	Витаскин фарма чувствительная кожа дневной защитный против покраснений Крем 50мл	1	Неклассифицированные/default	0	
692000	3838989532352	Витаскин фарма чувствительная кожа легкая очищающая эмульсия 200мл	1	Неклассифицированные/default	0	
691998	3838989532253	Витаскин фарма чувствительная кожа ночной успокаивающий против покраснений Крем 50мл	1	Неклассифицированные/default	0	
2855462	3838989598495	Витаскин фитолифт дневной Крем 50мл	1	Неклассифицированные/default	0	
2855463	3838989598501	Витаскин фитолифт Крем вокруг глаз 30мл	1	Неклассифицированные/default	0	
2855464	3838989598518	Витаскин фитолифт ночной Крем 50мл	1	Неклассифицированные/default	0	
452181	4602930004132	Витаспектрум n 30 табл покр обол	204841	Лекарственные средства (folder)/Витамины и минералы	0	
2721022	4607097012655	Витастарс мультивитаминный комплекс клубника пастил. жеват №30	1	Неклассифицированные/default	0	
2721023	4607097012662	Витастарс мультивитаминный комплексс холином цитрусовый микс паст.жеват №30	1	Неклассифицированные/default	0	
2011520	4607082852686	Витатека бальзам для кожи противоаллерг 30мл	1	Неклассифицированные/default	0	
1356331	4607082852723	Витатека Крем от синяков и ушибов с бадягой и арникой 50мл	1	Неклассифицированные/default	0	
2012720	4607086566602	Витатека Крем-бальзам для суставов 75мл окопник	1	Неклассифицированные/default	0	
2012561	4607086566626	Витатека Крем-бальзам для тела разогр 75мл	1	Неклассифицированные/default	0	
2012719	4607086566619	Витатека Крем-бальзам для тела регенерирующий 75мл подорожник/пантенол	1	Неклассифицированные/default	0	
1356458	4607082852679	Витатека Крем-бальзам с дозатором 20мл	1	Неклассифицированные/default	0	
2012818	4607086566664	Витатека набор нежная забота (бальзам для рук,Крем для ног) 75мл*2шт	1	Неклассифицированные/default	0	
2766497	4607013792555	Витатека подсластитель №1200 таб	1	Неклассифицированные/default	0	
2013221	4607013792692	Витатека стевия подсластитель №150 таб	1	Неклассифицированные/default	0	
2013220	4607086566589	Витатека фито-гель рассасывающий 75мл бадяга и арника	1	Неклассифицированные/default	0	
2012567	4607086566596	Витатека фито-Крем для ног охлаждающий 75мл конский каштан	1	Неклассифицированные/default	0	
2012568	4607086566633	Витатека фито-Крем для ног смягчающий 75мл чистотел/мочевина	1	Неклассифицированные/default	0	
2766530	4607045500166	Витатека фитоворонка ушная Люкс № 2шт	1	Неклассифицированные/default	0	
1356330	4607082852662	Витатека фитогель для ног при отеках и капил сетке ролик 50мл	1	Неклассифицированные/default	0	
2012718	4607086566671	Витатека шампунь дегтярный о/перхоти/жирности волос 200мл	1	Неклассифицированные/default	0	
452182	4602930002343	Витатресс табл покр обол №30	204841	Лекарственные средства (folder)/Витамины и минералы	0	
1758087	4660011740072	Витафел-с сыворотка для кошек	1758065	Товары для животных (folder)/Ветеринарные препараты (folder)/Ветеринарные вакцины, сыворотки, иммуномодуляторы	1758086	Линия альба
452183	4602887000010	Витафон аппарат виброаккустический	1	Неклассифицированные/default	0	
452184	4602887000041	Витафон виброакустич.аппарат цифровой	333710	Изделия медицинского назначения (folder)/Медицинские приборы и аппараты	0	
452185	4602887000034	Витафон-ик виброакустич.аппарат	333710	Изделия медицинского назначения (folder)/Медицинские приборы и аппараты	0	
452186	4820022240910	Витафтор табл для сос. №30	1	Неклассифицированные/default	0	
452187	4602930002459	Виташарм табл покр обол №30, верофарм ОАО	204841	Лекарственные средства (folder)/Витамины и минералы	0	
1196421	4607177997681	Витая пара ftp 4x2 x0.5 5е ASD	1	Неклассифицированные/default	0	
1196422	4607177997704	Витая пара utp 4x2 x0.5 5е ASD	1	Неклассифицированные/default	0	
452188	5012335585409	Витзим актив 30 таб.	204841	Лекарственные средства (folder)/Витамины и минералы	0	
452189	5012335640306	Витзим гарлик/с чесноком/ 240 таб.	204841	Лекарственные средства (folder)/Витамины и минералы	0	
452190	5012335585201	Витзим флекси джойнт 30 таб.	204841	Лекарственные средства (folder)/Витамины и минералы	0	
452191	7640118193138	Витирон капс №30	1	Неклассифицированные/default	0	
