ID	UPCEAN	Name	CategoryID	CategoryName	BrandID	BrandName
151687	4867113200088	Вино телиани красн сух груз/иберия 750мл	282274	Продукты питания (folder)/Алкогольные напитки/Вино (folder)/Вина Грузии	0	
22491	4860001680191	Вино телиани красное сухое 12% 750мл	282274	Продукты питания (folder)/Алкогольные напитки/Вино (folder)/Вина Грузии	0	
2854949	4860065014758	Вино телури ркацители бел сух 750мл	282274	Продукты питания (folder)/Алкогольные напитки/Вино (folder)/Вина Грузии	0	
2854950	4860065010231	Вино телури саперави красн сух 750мл	282274	Продукты питания (folder)/Алкогольные напитки/Вино (folder)/Вина Грузии	0	
1195506	8606100294381	Вино тема, 750мл 13.0% сухое	22133	Продукты питания (folder)/Алкогольные напитки/Вино (folder)/Вино	0	
3291605	4607050322500	Вино темные глаза 1л т пак	22133	Продукты питания (folder)/Алкогольные напитки/Вино (folder)/Вино	0	
2854951	4607050324320	Вино темные глаза 8.5% 1.0	22133	Продукты питания (folder)/Алкогольные напитки/Вино (folder)/Вино	0	
2854952	4607050322449	Вино темные глаза крас полусладк 2.0	22133	Продукты питания (folder)/Алкогольные напитки/Вино (folder)/Вино	0	
3794471	8429531005063	Вино темплум сов.блан бел сух 750мл	3615781	Продукты питания (folder)/Алкогольные напитки/Вино (folder)/Вино тихое белое	3794470	ТЕМПЛУМ
3794472	8429531004318	Вино темплум темп. красн сух п.с.с.9-15 750мл	3615777	Продукты питания (folder)/Алкогольные напитки/Вино (folder)/Вино тихое красное	3794470	ТЕМПЛУМ
3794473	3500610109829	Вино темпр.-мер.моцарт хаус красн сух 0.187л	3615777	Продукты питания (folder)/Алкогольные напитки/Вино (folder)/Вино тихое красное	0	
3794474	3500610109812	Вино темпран.моцарт хаус к.полусладк 0.187л	3615777	Продукты питания (folder)/Алкогольные напитки/Вино (folder)/Вино тихое красное	0	
283406	8430676000912	Вино темпранийо ла донселла красн сух 750мл 12.5% /вайндом/Испания/	22133	Продукты питания (folder)/Алкогольные напитки/Вино (folder)/Вино	0	
3291606	8436541011014	Вино темпранийо сира символ испании крсное сухое 12% 750мл ст/б	22133	Продукты питания (folder)/Алкогольные напитки/Вино (folder)/Вино	0	
283407	083029031101	Вино темпранилло gandia красн сух 750мл 12.5% /Испания/	22133	Продукты питания (folder)/Алкогольные напитки/Вино (folder)/Вино	3791984	TEMPRANILLO
2854953	7798055688221	Вино темпранилльо танго на двоих 750мл	22133	Продукты питания (folder)/Алкогольные напитки/Вино (folder)/Вино	0	
170330	8424258111110	Вино темпранильо альозо красн сух 750мл 13% /Испания/	22133	Продукты питания (folder)/Алкогольные напитки/Вино (folder)/Вино	0	
691036	7794068001255	Вино темпранильо бодегас кротта 750мл 14% сухое	22133	Продукты питания (folder)/Алкогольные напитки/Вино (folder)/Вино	0	
2854954	4607125541614	Вино темпранильо крас. сх. 11% 750мл стекло	22133	Продукты питания (folder)/Алкогольные напитки/Вино (folder)/Вино	0	
175236	8410492001898	Вино темпранильо красн сух 12% 750мл	22133	Продукты питания (folder)/Алкогольные напитки/Вино (folder)/Вино	47060	Черубино
1195507	8410702015882	Вино темпранильо красн сух 13.5% 750мл	41484	Продукты питания (folder)/Алкогольные напитки/Вино (folder)/Вина Испании	0	
3291607	7798147370058	Вино темпранильо красное сухое 13.5% 750мл ст/б	22133	Продукты питания (folder)/Алкогольные напитки/Вино (folder)/Вино	0	
175237	8410492001904	Вино темпранильо мерло красн сух 12% 750мл	22133	Продукты питания (folder)/Алкогольные напитки/Вино (folder)/Вино	47060	Черубино
691201	8410702015646	Вино темпранильо пеньясол столов красное сухое 12.5% tetrapak 1л	41484	Продукты питания (folder)/Алкогольные напитки/Вино (folder)/Вина Испании	46716	Феликс Соликс
2720899	8412176010509	Вино темпранильо риоха капитан элькано красн сух 0.75 13%	22133	Продукты питания (folder)/Алкогольные напитки/Вино (folder)/Вино	0	
2261257	8420209012376	Вино темпранильо санта круз 750мл 11.0%, столов,полусладк	22133	Продукты питания (folder)/Алкогольные напитки/Вино (folder)/Вино	0	
2261258	8420209012369	Вино темпранильо санта круз 750мл 11.0%, столов,сухое	22133	Продукты питания (folder)/Алкогольные напитки/Вино (folder)/Вино	0	
691202	8437001172122	Вино темпранильо столов п\сл красное 12% tetrapak 3л	22133	Продукты питания (folder)/Алкогольные напитки/Вино (folder)/Вино	0	
283408	8412276903183	Вино темпранильо-москатель карабела бланка красн сл. 750мл 11.5% /Испания/	22133	Продукты питания (folder)/Алкогольные напитки/Вино (folder)/Вино	0	
171181	764253950559	Вино темпус ту вэйл шираз 750мл 13% красн сух	22133	Продукты питания (folder)/Алкогольные напитки/Вино (folder)/Вино	0	
171182	9315743500757	Вино темпус ту каберне совиньон 750мл 13% красн сух	22133	Продукты питания (folder)/Алкогольные напитки/Вино (folder)/Вино	0	
171183	9310415010763	Вино темпус ту мерло 750мл 13% красн сух	22133	Продукты питания (folder)/Алкогольные напитки/Вино (folder)/Вино	0	
171184	9310415010756	Вино темпус ту шардоне 12% 750мл бел сух	22133	Продукты питания (folder)/Алкогольные напитки/Вино (folder)/Вино	0	
2854955	4607159663702	Вино темрюкская Долина бел/полусладк 700мл	22133	Продукты питания (folder)/Алкогольные напитки/Вино (folder)/Вино	0	
2854956	4607159663696	Вино темрюкская Долина крас/полусладк 700мл	22133	Продукты питания (folder)/Алкогольные напитки/Вино (folder)/Вино	0	
3291608	4620012631946	Вино темрюкский погреб Изабелла столов красное полусладк 12% 0.7л стекло	22133	Продукты питания (folder)/Алкогольные напитки/Вино (folder)/Вино	0	
3291609	4620012631076	Вино темрюкский погреб мускат белое полусладк 10-12% 0.7мл ст\бут	22133	Продукты питания (folder)/Алкогольные напитки/Вино (folder)/Вино	0	
3291610	4620012631083	Вино темрюкский погреб саперави красное полусладк 10-12% 0.7л ст\б	22133	Продукты питания (folder)/Алкогольные напитки/Вино (folder)/Вино	0	
3794475	8033765259767	Вино тен.мар.неро д ав. красн сух 13% 750мл	3615777	Продукты питания (folder)/Алкогольные напитки/Вино (folder)/Вино тихое красное	0	
2854957	7804320423333	Вино тента бел п/сух 12.5% 1.0	22133	Продукты питания (folder)/Алкогольные напитки/Вино (folder)/Вино	0	
1195508	8002235014120	Вино тента ка весково мерло фриули акилеа красное 750мл Италия	22133	Продукты питания (folder)/Алкогольные напитки/Вино (folder)/Вино	0	
2854958	7804320405438	Вино тента красн п/сух 12% 1.0	22133	Продукты питания (folder)/Алкогольные напитки/Вино (folder)/Вино	0	
1195509	8002235276351	Вино тенуа ка весково токай фриулано аквилеа фриули 2004 бел сух 0.7л Италия	22133	Продукты питания (folder)/Алкогольные напитки/Вино (folder)/Вино	0	
3291611	8011510010351	Вино тенута Del Monte кьянти красное сухое 12.5% 750мл стекло	22133	Продукты питания (folder)/Алкогольные напитки/Вино (folder)/Вино	36678	Del Monte
3759697	8002645091179	Вино тенута арн.пр.док игр.бел бр.750мл	296061	Продукты питания (folder)/Алкогольные напитки/Вино (folder)/Вина игристые	3759696	TENUTE ARNACES (CAMPAGNOLA GUISEPPE SPA/ITALY)
1660168	8033182050978	Вино тенута делла терра этна россо красн сух 750мл	688746	Продукты питания (folder)/Алкогольные напитки/Вино (folder)/Вина Италии Сицилия и Сардиния	1660167	Тенута делла Терра
1195510	727760507555	Вино тенута ди триноро ле куполе, 1.500л 13.0% сухое	22133	Продукты питания (folder)/Алкогольные напитки/Вино (folder)/Вино	0	
46444	8002487017504	Вино тенута дилиллиано лилиано кьянти кл красн сух 14% 750мл	22470	Продукты питания (folder)/Алкогольные напитки/Вино (folder)/Вина Италии	46443	Тенута ди Лиллиано
2227414	4607115842196	Вино тенута кампо ди сассо маунт нельсон бел сух 750мл	688350	Продукты питания (folder)/Алкогольные напитки/Вино (folder)/Вина Новая Зеландия	2227413	Тенута Кампо ди Сассо
691038	8025174000078	Вино тенута кантагало джовето красн сух 750мл/Тоскана	688763	Продукты питания (folder)/Алкогольные напитки/Вино (folder)/Вина Италии Тоскана	691037	Тенута Кантагола
691040	8012165003811	Вино тенута курецца мальваз.бьянка-шард. бел псух 750мл	22470	Продукты питания (folder)/Алкогольные напитки/Вино (folder)/Вина Италии	691039	Тенута Курецца
691042	8009825001034	Вино тенута поджио мондорли кьянти клас. красн сух 750мл	688763	Продукты питания (folder)/Алкогольные напитки/Вино (folder)/Вина Италии Тоскана	691041	Тенута Поджио
691043	8009825000419	Вино тенута поджио мондорли кьянти клас.рез. красн сух 750мл	688763	Продукты питания (folder)/Алкогольные напитки/Вино (folder)/Вина Италии Тоскана	691041	Тенута Поджио
2977160	8009825001041	Вино тенута поджио мондорли кьянти клас.рез. красн сух 750мл #2	688763	Продукты питания (folder)/Алкогольные напитки/Вино (folder)/Вина Италии Тоскана	691041	Тенута Поджио
46357	8002010689635	Вино тенута рапитала катаратто шардоне бел сух 13% 750мл	22470	Продукты питания (folder)/Алкогольные напитки/Вино (folder)/Вина Италии	46356	Тенута Рапитала
46358	8002010002427	Вино тенута рапитала неро д'авола красн сух 13% 750мл	22470	Продукты питания (folder)/Алкогольные напитки/Вино (folder)/Вина Италии	46356	Тенута Рапитала
1195429	8002010689420	Вино тенута рапитала нерод'авола пинонеро красн п/ сух 750мл/сицилия/igt	22133	Продукты питания (folder)/Алкогольные напитки/Вино (folder)/Вино	46356	Тенута Рапитала
46359	8002010003424	Вино тенута рапитала розато розов сух 12.5% 750мл	22470	Продукты питания (folder)/Алкогольные напитки/Вино (folder)/Вина Италии	46356	Тенута Рапитала
691011	8002010689222	Вино тенута рапитала угонис красн сух 750мл	688746	Продукты питания (folder)/Алкогольные напитки/Вино (folder)/Вина Италии Сицилия и Сардиния	46356	Тенута Рапитала
691012	8002010689208	Вино тенута рапитала шардонне бел сух 750мл	688746	Продукты питания (folder)/Алкогольные напитки/Вино (folder)/Вина Италии Сицилия и Сардиния	46356	Тенута Рапитала
46446	8032841820402	Вино тенута с.антонио скайа бьянка 2007 бел сух 12.5% 750мл	22470	Продукты питания (folder)/Алкогольные напитки/Вино (folder)/Вина Италии	46445	Тенута Сан Антонио
2227415	4640013683591	Вино тенута с.антонио скайа бьянка бел сух 750мл/венето	688778	Продукты питания (folder)/Алкогольные напитки/Вино (folder)/Вина Италии Венето	46445	Тенута Сан Антонио
2427109	8032841823007	Вино тенута с.антонио скайа розато розов п/ сух 750мл/венето	22133	Продукты питания (folder)/Алкогольные напитки/Вино (folder)/Вино	46445	Тенута Сан Антонио
1195511	8027603001021	Вино тенута сан гуидо ле дефесе 2006 красн сух 750мл Италия	22133	Продукты питания (folder)/Алкогольные напитки/Вино (folder)/Вино	0	
1195512	8033829960004	Вино тенута улиссе унико монтепульчано д'абруццо, 750мл 14.0% полусухое	22133	Продукты питания (folder)/Алкогольные напитки/Вино (folder)/Вино	0	
1195514	8033829960103	Вино тенута улиссе унико пекорино терре ди кьети, 1.500л 13.0% полусухое	22133	Продукты питания (folder)/Алкогольные напитки/Вино (folder)/Вино	0	
1195513	8033829960233	Вино тенута улиссе унико пекорино терре ди кьети, 750мл 13.0% полусухое	22133	Продукты питания (folder)/Алкогольные напитки/Вино (folder)/Вино	0	
1195515	8033829960011	Вино тенута улиссе унико черазуоло д'абруццо, 750мл 13.0% полусухое	22133	Продукты питания (folder)/Алкогольные напитки/Вино (folder)/Вино	0	
1195516	3760053115591	Вино тер де фонтэн мускат бел полусладк 12.5% 750мл	41821	Продукты питания (folder)/Алкогольные напитки/Вино (folder)/Вина Франции	0	
1195517	3760053115577	Вино тер де фонтэн шардоне бел сух 12.5% 750мл	41821	Продукты питания (folder)/Алкогольные напитки/Вино (folder)/Вина Франции	0	
3794477	8008900007688	Вино тер.ал.треб.ап.б.полусладк 4.5-15% 750мл	3615781	Продукты питания (folder)/Алкогольные напитки/Вино (folder)/Вино тихое белое	3789982	ТЕРРЕ АЛЛЕГРЕ
3794479	8423513004433	Вино тер.де алмас темпр.doc красн сух 750мл	3615777	Продукты питания (folder)/Алкогольные напитки/Вино (folder)/Вино тихое красное	3794478	TIERRA DE ALMAS
3794480	8436014671271	Вино тер.де алмас темпр.doc красн сух 750мл #2	3615777	Продукты питания (folder)/Алкогольные напитки/Вино (folder)/Вино тихое красное	3794478	TIERRA DE ALMAS
1414652	3500610007736	Вино тер.мул.сент эм.гр.крю красн сух 750мл	1	Неклассифицированные/default	0	
3794481	8010719006226	Вино тер.сер.гран кюв.эк.драй бел сух 750мл	3660352	Продукты питания (folder)/Алкогольные напитки/Вино (folder)/Вино игристое белое	0	
3794484	5601012051469	Вино тер.франк.ст. красн п/ сух 10-15% 750мл	3615777	Продукты питания (folder)/Алкогольные напитки/Вино (folder)/Вино тихое красное	3794483	ТЕРРА ФРАНКА
2427110	8437007370768	Вино тереза айрен бел сух 11.5% 750мл	22133	Продукты питания (folder)/Алкогольные напитки/Вино (folder)/Вино	0	
2427111	8437007370751	Вино тереза темпранильо гарнача красн сух 13% 750мл	22133	Продукты питания (folder)/Алкогольные напитки/Вино (folder)/Вино	0	
1759931	7791540120558	Вино термидор бел полусладк к/у 10-13% 1.000	22133	Продукты питания (folder)/Алкогольные напитки/Вино (folder)/Вино	3791990	TERMIDOR
46448	7791540070129	Вино термидор бел сух 1.0л 10-13% /аргентина/	282251	Продукты питания (folder)/Алкогольные напитки/Вино (folder)/Вина Аргентины	46447	Термидор
1195518	7791540140693	Вино термидор красн полусладк 1.0л 13% /аргентина/	282251	Продукты питания (folder)/Алкогольные напитки/Вино (folder)/Вина Аргентины	3791990	TERMIDOR
1195519	779154007011	Вино термидор красн сух к/у 10-13% 1.000	282251	Продукты питания (folder)/Алкогольные напитки/Вино (folder)/Вина Аргентины	0	
2427112	4044551013757	Вино терн стоун зинфандель красн сух алк:13.5% 750мл	22133	Продукты питания (folder)/Алкогольные напитки/Вино (folder)/Вино	0	
2427113	4044551013764	Вино терн стоун шардоне бел сух алк:13.5% 750мл	22133	Продукты питания (folder)/Алкогольные напитки/Вино (folder)/Вино	0	
43183	4001486680621	Вино терновое красн полусладк 750мл 8.5% Германия	22133	Продукты питания (folder)/Алкогольные напитки/Вино (folder)/Вино	43178	Доктор Демут
46351	7804426000384	Вино терра андина валле сентрал розов п/ сух 750мл 12.5% Чили/	282291	Продукты питания (folder)/Алкогольные напитки/Вино (folder)/Вина Чили	46344	Терра Андина
46345	7804426000001	Вино терра андина каберне совиньон красн сух 13.5% 0.187л	282291	Продукты питания (folder)/Алкогольные напитки/Вино (folder)/Вина Чили	46344	Терра Андина
46346	7804426100008	Вино терра андина каберне совиньон красн сух 750мл 13.5% /велли сентрал/Чили/	282291	Продукты питания (folder)/Алкогольные напитки/Вино (folder)/Вина Чили	46344	Терра Андина
46347	7804426700000	Вино терра андина каберне совиньон мерло красн псух 750мл 13.5% /Чили/	282291	Продукты питания (folder)/Алкогольные напитки/Вино (folder)/Вина Чили	46344	Терра Андина
46353	7804426000063	Вино терра андина совиньон блан бел сух 13% 0.187л	282291	Продукты питания (folder)/Алкогольные напитки/Вино (folder)/Вина Чили	46344	Терра Андина
46354	7804426300002	Вино терра андина шардоне бел псух 750мл 13.5% /велли централ/Чили/	282291	Продукты питания (folder)/Алкогольные напитки/Вино (folder)/Вина Чили	46344	Терра Андина
171186	8410775002635	Вино терра байкса 12% 750мл красн полусладк	22133	Продукты питания (folder)/Алкогольные напитки/Вино (folder)/Вино	0	
171187	8410775002628	Вино терра байкса 12% 750мл красн сух	22133	Продукты питания (folder)/Алкогольные напитки/Вино (folder)/Вино	0	
171185	8410775002642	Вино терра байкса 750мл 11% бел сух	22133	Продукты питания (folder)/Алкогольные напитки/Вино (folder)/Вино	0	
171188	853065000528	Вино терра баросса каберне совиньон 750мл 0% красн сух	22133	Продукты питания (folder)/Алкогольные напитки/Вино (folder)/Вино	0	
2427114	4840267002739	Вино терра верде Изабелла красн полусладк 9.5% 750мл	22133	Продукты питания (folder)/Алкогольные напитки/Вино (folder)/Вино	0	
2427115	4840267002487	Вино терра верде каберне красн п/сух 9.5% 750мл	22133	Продукты питания (folder)/Алкогольные напитки/Вино (folder)/Вино	0	
2427116	4840267002517	Вино терра верде шардоне бел п/сух 9.5% 750мл	22133	Продукты питания (folder)/Алкогольные напитки/Вино (folder)/Вино	0	
691044	8410302850005	Вино терра д'оуро белое 750мл 0%	22133	Продукты питания (folder)/Алкогольные напитки/Вино (folder)/Вино	0	
283409	8003030008772	Вино терра нове сира красн псух 750мл 13% /каудаль Италия	22133	Продукты питания (folder)/Алкогольные напитки/Вино (folder)/Вино	0	
1195520	8008863028188	Вино терра ностра бел полусладк 11% 750мл	22133	Продукты питания (folder)/Алкогольные напитки/Вино (folder)/Вино	0	
1195521	8008863028201	Вино терра ностра красн полусладк 11% 750мл	22133	Продукты питания (folder)/Алкогольные напитки/Вино (folder)/Вино	0	
1195522	8008863028195	Вино терра ностра красн сух 11% 750мл	22133	Продукты питания (folder)/Алкогольные напитки/Вино (folder)/Вино	0	
3291612	4670000688469	Вино терра петра шардоне белое сухое 10-12% 0.7л стбут	22133	Продукты питания (folder)/Алкогольные напитки/Вино (folder)/Вино	0	
691045	5949475000571	Вино терра ромена блэк мэйден 750мл 0% псух	22133	Продукты питания (folder)/Алкогольные напитки/Вино (folder)/Вино	0	
691046	5949475000564	Вино терра ромена каберне совиньон 750мл 0% псух	22133	Продукты питания (folder)/Алкогольные напитки/Вино (folder)/Вино	0	
691047	5949475000557	Вино терра ромена мерло 750мл 0% псух	22133	Продукты питания (folder)/Алкогольные напитки/Вино (folder)/Вино	0	
