ID	UPCEAN	Name	CategoryID	CategoryName	BrandID	BrandName
1238660	7611604942516	Кофе бадилатти шале зерно 250г дер.п/у #2	19716	Продукты питания (folder)/Чай и кофе/Кофе	1238643	Бадилатти
1238661	7611604992504	Кофе бадилатти шале молот.250г	19716	Продукты питания (folder)/Чай и кофе/Кофе	1238643	Бадилатти
1238662	7611604502505	Кофе бадилатти энгадин зерно 250г	19716	Продукты питания (folder)/Чай и кофе/Кофе	1238643	Бадилатти
1238663	7611604631700	Кофе бадилатти эспрессо раств.100г	19716	Продукты питания (folder)/Чай и кофе/Кофе	1238643	Бадилатти
287357	3108440002107	Кофе байя вабре мол. гватем. 250г пак./имп./	19716	Продукты питания (folder)/Чай и кофе/Кофе	0	
287358	3108440002114	Кофе байя вабре мол. папайен 250г пак./имп./	19716	Продукты питания (folder)/Чай и кофе/Кофе	0	
2883391	4610007270038	Кофе бариста №11 молот.250г	19716	Продукты питания (folder)/Чай и кофе/Кофе	3620072	BARISTA
2883438	4606323091693	Кофе беан эксклюзив сублимированный 100г	19716	Продукты питания (folder)/Чай и кофе/Кофе	0	
2883393	8034049840121	Кофе белл экстра крепк.вкус молот.250г	19716	Продукты питания (folder)/Чай и кофе/Кофе	0	
2883394	4603607001072	Кофе белый арап 3в1 класический 18г м/у	19716	Продукты питания (folder)/Чай и кофе/Кофе	3783080	белый ARAP
3372733	4603607001300	Кофе белый арап 3в1 шоколадный с сахаром сливки 18г м/у	19716	Продукты питания (folder)/Чай и кофе/Кофе	3783080	белый ARAP
3372734	4603607002499	Кофе белый арап 3в1 шоколадный с сахаром сливки 18г м/у #2	19716	Продукты питания (folder)/Чай и кофе/Кофе	3783080	белый ARAP
2883398	4603607001461	Кофе белый арап асс раз #5	19716	Продукты питания (folder)/Чай и кофе/Кофе	0	
3372735	4603607001089	Кофе белый арап классический 18г	19716	Продукты питания (folder)/Чай и кофе/Кофе	0	
3372736	4603607002024	Кофе белый арап Люкс натур раств гранул, 100г м/у	19716	Продукты питания (folder)/Чай и кофе/Кофе	3783080	белый ARAP
3372737	4603607001980	Кофе белый арап Премиум раств сублим. 100г м/у	19716	Продукты питания (folder)/Чай и кофе/Кофе	3783080	белый ARAP
3372738	4603607002048	Кофе белый арап Премиум раств сублим. 50г м/у	19716	Продукты питания (folder)/Чай и кофе/Кофе	3783080	белый ARAP
1238666	6036070019356	Кофе белый арап с/б 95г	19716	Продукты питания (folder)/Чай и кофе/Кофе	0	
3372739	4603607001935	Кофе белый арап, натур раств сублим. 100г ст/б	19716	Продукты питания (folder)/Чай и кофе/Кофе	3783080	белый ARAP
3372740	4603607001942	Кофе белый арап, раств порошк. 100г м/у	19716	Продукты питания (folder)/Чай и кофе/Кофе	3783080	белый ARAP
74083	4607041470081	Кофе бертис гринвич зерно 0.100	74065	Продукты питания (folder)/Чай и кофе/Кофе зерно	74082	Бертис
74088	4607041470098	Кофе бертис гринвич зерно 0.250	74065	Продукты питания (folder)/Чай и кофе/Кофе зерно	74082	Бертис
74084	4607041470067	Кофе бертис гринвич зерно 250г	74065	Продукты питания (folder)/Чай и кофе/Кофе зерно	74082	Бертис
2447840	460704147003	Кофе бертис гринвич мол 0.100	74063	Продукты питания (folder)/Чай и кофе/Кофе молотый	0	
74085	4607041470036	Кофе бертис гринвич молот 100г	74063	Продукты питания (folder)/Чай и кофе/Кофе молотый	74082	Бертис
74086	4607041470029	Кофе бертис гринвич молот 250г	74063	Продукты питания (folder)/Чай и кофе/Кофе молотый	74082	Бертис
2447841	4607041470241	Кофе бертис гринвич нат мол жб 0.100	74063	Продукты питания (folder)/Чай и кофе/Кофе молотый	0	
2447842	4607041470289	Кофе бертис ричмонд нат мол жб 0.100	74063	Продукты питания (folder)/Чай и кофе/Кофе молотый	0	
74087	4607041470050	Кофе бертис терри зерно 0.100	74065	Продукты питания (folder)/Чай и кофе/Кофе зерно	74082	Бертис
74089	4607041470012	Кофе бертис терри молот 100г	74063	Продукты питания (folder)/Чай и кофе/Кофе молотый	74082	Бертис
2447843	4607041470265	Кофе бертис терри нат мол жб 0.100	74063	Продукты питания (folder)/Чай и кофе/Кофе молотый	0	
2447844	8887290172004	Кофе бесаме классик 3в1 0.018	19729	Продукты питания (folder)/Чай и кофе/Кофе растворимый	0	
2883399	7610443569113	Кофе блазер кафе мелодия зерно 250г	19716	Продукты питания (folder)/Чай и кофе/Кофе	0	
74092	4901201102790	Кофе бленд стандарт n114 раств 100г стбан	19729	Продукты питания (folder)/Чай и кофе/Кофе растворимый	74091	Бленд
74093	49888119	Кофе бленд стандарт n114 раств 50г стбан	19729	Продукты питания (folder)/Чай и кофе/Кофе растворимый	74091	Бленд
74094	49888126	Кофе бленд стандарт n117 раств 50г стбан	19729	Продукты питания (folder)/Чай и кофе/Кофе растворимый	74091	Бленд
74095	4901201102806	Кофе бленд стандарт n17 раств 100г стбан	19729	Продукты питания (folder)/Чай и кофе/Кофе растворимый	74091	Бленд
74097	890888001028	Кофе блэк дат голд зерно 283г	74065	Продукты питания (folder)/Чай и кофе/Кофе зерно	74096	Блэк Дат
74098	890888001219	Кофе блэк дат Престиж зерно 283г	74065	Продукты питания (folder)/Чай и кофе/Кофе зерно	74096	Блэк Дат
74099	890888001110	Кофе блэк дат эспрессо зерно 283г	74065	Продукты питания (folder)/Чай и кофе/Кофе зерно	74096	Блэк Дат
1238681	4901201103438	Кофе блю маунтин с/б 50г	19716	Продукты питания (folder)/Чай и кофе/Кофе	0	
3372741	4600696621013	Кофе блюз кофе натуральный зеленый молотый 200г м/уп	19716	Продукты питания (folder)/Чай и кофе/Кофе	3784456	блюз (BLUES LTD.)
3372742	4607055763537	Кофе бомбей натуральный гранулированный 150г м/у	19716	Продукты питания (folder)/Чай и кофе/Кофе	0	
3372743	4607055763520	Кофе бомбей натуральный гранулированный 75г м/у	19716	Продукты питания (folder)/Чай и кофе/Кофе	0	
156894	8901030080609	Кофе бон brooke Bond аггло Премиум раст жб 0.1	19716	Продукты питания (folder)/Чай и кофе/Кофе	31642	Brooke Bond
1238682	890103008061	Кофе бон brooke Bond аггло Премиум раст жб 0.2	19716	Продукты питания (folder)/Чай и кофе/Кофе	31642	Brooke Bond
156895	8901030080616	Кофе бон brooke Bond аггло Премиум раст жб 0.2 #2	19716	Продукты питания (folder)/Чай и кофе/Кофе	31642	Brooke Bond
1238683	890103008078	Кофе бон brooke Bond классик раст жб 0.2	19716	Продукты питания (folder)/Чай и кофе/Кофе	31642	Brooke Bond
156897	8901030080784	Кофе бон brooke Bond классик раст жб 0.2 #2	19716	Продукты питания (folder)/Чай и кофе/Кофе	31642	Brooke Bond
2447845	4620760140110	Кофе бон кафе 18г 3в1 крепкий	19716	Продукты питания (folder)/Чай и кофе/Кофе	0	
3372744	4603290003513	Кофе бонди лайт натур. раствор. 2.5г	19716	Продукты питания (folder)/Чай и кофе/Кофе	0	
2447846	4620760140097	Кофе бонкафе 18г 3в1	19716	Продукты питания (folder)/Чай и кофе/Кофе	0	
740534	8013238000089	Кофе брави арабика 100% зерно 1кг	74065	Продукты питания (folder)/Чай и кофе/Кофе зерно	740533	Брави
740535	8013238000041	Кофе брави арабика-95% робуста-5% зерно 1кг	74065	Продукты питания (folder)/Чай и кофе/Кофе зерно	740533	Брави
287359	8013238000133	Кофе брави кафе арабика 500г зерно	19716	Продукты питания (folder)/Чай и кофе/Кофе	0	
287360	8013238000065	Кофе брави кафе арабика мол. 250г карт./уп.	19716	Продукты питания (folder)/Чай и кофе/Кофе	0	
287361	8013238000157	Кофе брави кафе бар 500г зерно	19716	Продукты питания (folder)/Чай и кофе/Кофе	0	
287362	8013238000140	Кофе брави кафе бар мол. 250г карт./уп.	19716	Продукты питания (folder)/Чай и кофе/Кофе	0	
287363	8013238000119	Кофе брави кафе крема 500г зерно	19716	Продукты питания (folder)/Чай и кофе/Кофе	0	
287364	8013238000072	Кофе брави кафе крема мол. 250г карт./уп.	19716	Продукты питания (folder)/Чай и кофе/Кофе	0	
2447847	590064900885	Кофе браз/плантация раств жб 0.100	19729	Продукты питания (folder)/Чай и кофе/Кофе растворимый	0	
2447848	6411300000616	Кофе бразил нат мол 0.500	74063	Продукты питания (folder)/Чай и кофе/Кофе молотый	30148	Paulig
2447849	7897331400110	Кофе бразилиан бест классик раств жб 0.100	19729	Продукты питания (folder)/Чай и кофе/Кофе растворимый	0	
2447850	7898035790019	Кофе бразилиан голд раств жб 0.100	19729	Продукты питания (folder)/Чай и кофе/Кофе растворимый	0	
2883400	8410121011861	Кофе бразилия 1.0	19716	Продукты питания (folder)/Чай и кофе/Кофе	0	
287365	22117601	Кофе бразилия желтый бурбон в зерн.	19716	Продукты питания (folder)/Чай и кофе/Кофе	0	
2447851	7896027124019	Кофе бразилия раств жб 0.100	19729	Продукты питания (folder)/Чай и кофе/Кофе растворимый	0	
1238684	8410121084964	Кофе бразилия с/б 200г	19716	Продукты питания (folder)/Чай и кофе/Кофе	3628227	BRASILIA
1238685	8410121084957	Кофе бразилия ст/б 100г	19716	Продукты питания (folder)/Чай и кофе/Кофе	3628227	BRASILIA
287366	22117595	Кофе бразильский самба в зерн.	19716	Продукты питания (folder)/Чай и кофе/Кофе	0	
740537	4605978023103	Кофе бриллони гватемала жарен.молот.200г	74063	Продукты питания (folder)/Чай и кофе/Кофе молотый	740536	Бриллони
740538	4605978021949	Кофе бриллони гурме жарен.зерно 1кг	74065	Продукты питания (folder)/Чай и кофе/Кофе зерно	740536	Бриллони
740539	4605978021932	Кофе бриллони индонезия жарен.зерно 200г	74065	Продукты питания (folder)/Чай и кофе/Кофе зерно	740536	Бриллони
740540	4605978023080	Кофе бриллони индонезия жарен.молот.200г	74063	Продукты питания (folder)/Чай и кофе/Кофе молотый	740536	Бриллони
740541	4605978021970	Кофе бриллони кения жарен.зерно 200г	74065	Продукты питания (folder)/Чай и кофе/Кофе зерно	740536	Бриллони
740542	4605978023127	Кофе бриллони кения жарен.молот.200г	74063	Продукты питания (folder)/Чай и кофе/Кофе молотый	740536	Бриллони
740543	4605978023257	Кофе бриллони колумбия жарен.молот.200г	74063	Продукты питания (folder)/Чай и кофе/Кофе молотый	740536	Бриллони
740544	4605978023028	Кофе бриллони коста-рика жарен.молот.200г	74063	Продукты питания (folder)/Чай и кофе/Кофе молотый	740536	Бриллони
740545	4605978021987	Кофе бриллони никарагуа марагоджайп жарен.зерно 200г	74065	Продукты питания (folder)/Чай и кофе/Кофе зерно	740536	Бриллони
740546	4605978023134	Кофе бриллони никарагуа марагоджайп жарен.молотый 200г	74063	Продукты питания (folder)/Чай и кофе/Кофе молотый	740536	Бриллони
740547	4605978021918	Кофе бриллони супер бар жарен.зерно 1кг	74065	Продукты питания (folder)/Чай и кофе/Кофе зерно	740536	Бриллони
740548	4605978021963	Кофе бриллони танзания жарен.зерно 200г	74065	Продукты питания (folder)/Чай и кофе/Кофе зерно	740536	Бриллони
740549	4605978021956	Кофе бриллони энерджи жарен.зерно 1кг	74065	Продукты питания (folder)/Чай и кофе/Кофе зерно	740536	Бриллони
740550	4605978021925	Кофе бриллони эспрессо жарен.зерно 1кг	74065	Продукты питания (folder)/Чай и кофе/Кофе зерно	740536	Бриллони
1238688	7707206653629	Кофе брисаль зерно 340г	19716	Продукты питания (folder)/Чай и кофе/Кофе	1238687	Брисаль
1238689	7707206654466	Кофе брисаль молотый 340г	19716	Продукты питания (folder)/Чай и кофе/Кофе	1238687	Брисаль
740555	645860002223	Кофе бритт с вулкана поас зерно 340г	74065	Продукты питания (folder)/Чай и кофе/Кофе зерно	706038	Бритт
740556	645860002216	Кофе бритт с вулкана поас молот. 340г	74063	Продукты питания (folder)/Чай и кофе/Кофе молотый	706038	Бритт
740557	645860001677	Кофе бритт с обл.тарразу зерно 340г	74065	Продукты питания (folder)/Чай и кофе/Кофе зерно	706038	Бритт
740558	645860001462	Кофе бритт с обл.тарразу молот. 340г	74063	Продукты питания (folder)/Чай и кофе/Кофе молотый	706038	Бритт
740559	645860001707	Кофе бритт с обл.трех рек зерно 340г	74065	Продукты питания (folder)/Чай и кофе/Кофе зерно	706038	Бритт
740560	645860001714	Кофе бритт с обл.трех рек молот. 340г	74063	Продукты питания (folder)/Чай и кофе/Кофе молотый	706038	Бритт
1674785	645860000113	Кофе бритт темн.обжарки зерно 908г	74065	Продукты питания (folder)/Чай и кофе/Кофе зерно	706038	Бритт
740561	645860000014	Кофе бритт темн.обжарки молот. 340г	74063	Продукты питания (folder)/Чай и кофе/Кофе молотый	706038	Бритт
1238690	4820135900053	Кофе бруно в зернах декаф в кор. 500г	19716	Продукты питания (folder)/Чай и кофе/Кофе	0	
1238691	4820135900060	Кофе бруно в зернах рикко в кор. 500г	19716	Продукты питания (folder)/Чай и кофе/Кофе	0	
1238692	4820148520323	Кофе бруно жар.в зернах 100% арабика френч дарк роаст 250г	19716	Продукты питания (folder)/Чай и кофе/Кофе	0	
1238693	4820148520347	Кофе бруно жар.в зернах 100%арабика туркиш лайт роаст 250г	19716	Продукты питания (folder)/Чай и кофе/Кофе	0	
1238694	4820148520330	Кофе бруно жар.в зернах 100%экспрессо медиум роаст 250г	19716	Продукты питания (folder)/Чай и кофе/Кофе	0	
1238695	4820135900121	Кофе бруно молотый турецкая традиция в кор. 125г	19716	Продукты питания (folder)/Чай и кофе/Кофе	0	
1238696	4820135900015	Кофе бруно молотый турецкая традиция в кор. 250г	19716	Продукты питания (folder)/Чай и кофе/Кофе	0	
1238697	4820148520545	Кофе бруно молотый френч прес в кор. 125г	19716	Продукты питания (folder)/Чай и кофе/Кофе	0	
1238698	4820135900039	Кофе бруно молотый френч-пресс в кор. 250г	19716	Продукты питания (folder)/Чай и кофе/Кофе	0	
1238699	4820148520538	Кофе бруно молотый экспрессо итальяно в кор. 125г	19716	Продукты питания (folder)/Чай и кофе/Кофе	0	
1238700	4820135900022	Кофе бруно молотый экспрессо итальяно в кор. 250г	19716	Продукты питания (folder)/Чай и кофе/Кофе	0	
477119	4607142231413	Кофе бурбон колумбийская арабика, зерно живой кофе 200г Россия	19716	Продукты питания (folder)/Чай и кофе/Кофе	740588	Живой кофе
477120	4607142231420	Кофе бурбон колумбийская арабика, молотый живой кофе 200г Россия	19716	Продукты питания (folder)/Чай и кофе/Кофе	740588	Живой кофе
30194	7612654000034	Кофе в зернах ambassador Blue Label, натуральный, вак уп 1000г, ш/к 00034	19716	Продукты питания (folder)/Чай и кофе/Кофе	30182	Ambassador
740563	748325003008	Кофе в зернах Aroma 453.6г 1/16	19716	Продукты питания (folder)/Чай и кофе/Кофе	0	
30220	4600946000636	Кофе в зернах attache french roast (куппо), натуральный, 250г, вак уп, ш/к 00636	19716	Продукты питания (folder)/Чай и кофе/Кофе	30180	КУППО
30181	4600946000643	Кофе в зернах attache italian roast (куппо), натуральный, 250г, вак уп, ш/к 00643	19716	Продукты питания (folder)/Чай и кофе/Кофе	30180	КУППО
30332	3117341654018	Кофе в зернах carte noire, натуральный, 250г, вак уп, 4053	19716	Продукты питания (folder)/Чай и кофе/Кофе	19709	Carte Noire
2734243	01674576	Кофе в зернах delsenzo crema 1кг	19716	Продукты питания (folder)/Чай и кофе/Кофе	0	
2734244	01674569	Кофе в зернах delsenzo lungo 1кг	19716	Продукты питания (folder)/Чай и кофе/Кофе	0	
477121	8003753918198	Кофе в зернах illy (100% арабика), длительная обжарка, жб 250г	19716	Продукты питания (folder)/Чай и кофе/Кофе	74230	Illy
74232	8003753900520	Кофе в зернах illy (100% арабика), нормальная обжарка, жб 250г	74065	Продукты питания (folder)/Чай и кофе/Кофе зерно	74230	Illy
3372746	8005883999993	Кофе в зернах ionia arabica, натуральный, арабика 100%, вак уп 1000г, i 1005	19716	Продукты питания (folder)/Чай и кофе/Кофе	3372745	IONIA
3372747	8005883200020	Кофе в зернах ionia gran crema, натурал. арабики 80% робусты 20%,вак уп 1000г,i 1003	19716	Продукты питания (folder)/Чай и кофе/Кофе	3372745	IONIA
30583	7622300201715	Кофе в зернах Jacobs Monarch вак уп 250г, ш/к 01715	19716	Продукты питания (folder)/Чай и кофе/Кофе	2734181	Jacobs Monarch
477124	7610244121251	Кофе в зернах La semeuse brezil. sul de minas (100% aрабика Pure origine) 250г п/у	19716	Продукты питания (folder)/Чай и кофе/Кофе	477115	La Semeuse
477125	7610244002635	Кофе в зернах La semeuse classiq 250г п/у	19716	Продукты питания (folder)/Чай и кофе/Кофе	477115	La Semeuse
477126	7610244001638	Кофе в зернах La semeuse colombie/ bukaramanga (100% aрабика Pure origine) 250г п/у	19716	Продукты питания (folder)/Чай и кофе/Кофе	477115	La Semeuse
477127	7610244151258	Кофе в зернах La semeuse costa rica. tres rios 250г п/у	19716	Продукты питания (folder)/Чай и кофе/Кофе	477115	La Semeuse
477128	7610244002628	Кофе в зернах La semeuse espresso 250г п/у	19716	Продукты питания (folder)/Чай и кофе/Кофе	477115	La Semeuse
477129	7610244141259	Кофе в зернах La semeuse ethiopia. sidamo 250г п/у	19716	Продукты питания (folder)/Чай и кофе/Кофе	477115	La Semeuse
477130	76402234	Кофе в зернах La semeuse nocturne без кофеина (100% арабика), 250г п/у	19716	Продукты питания (folder)/Чай и кофе/Кофе	477115	La Semeuse
477131	76402241	Кофе в зернах La semeuse версаль (100% арабика), 250г п/у	19716	Продукты питания (folder)/Чай и кофе/Кофе	477115	La Semeuse
477132	76406386	Кофе в зернах La semeuse Дон Марко (20% робуста, 80% арабика), 250г п/у	19716	Продукты питания (folder)/Чай и кофе/Кофе	477115	La Semeuse
477133	76402203	Кофе в зернах La semeuse мокка (100% арабика), 250г п/у	19716	Продукты питания (folder)/Чай и кофе/Кофе	477115	La Semeuse
477134	76402197	Кофе в зернах La semeuse паризьен (35% робуста, 65% арабика), 250г п/у	19716	Продукты питания (folder)/Чай и кофе/Кофе	477115	La Semeuse
477135	7610244111252	Кофе в зернах La semeuse солей леван (100% арабика bio Max havelaar), 250г п/у	19716	Продукты питания (folder)/Чай и кофе/Кофе	477115	La Semeuse
740485	8000070018747	Кофе в зернах lavazza caffe espresso, вак уп 1000г, 1874	19716	Продукты питания (folder)/Чай и кофе/Кофе	19720	Lavazza
2165917	8000070018754	Кофе в зернах lavazza caffe espresso, натуральный, вак уп 500г, 1875	1	Неклассифицированные/default	19720	Lavazza
2160966	8000070024908	Кофе в зернах lavazza crema Aroma espresso, натуральный, вак уп 1000г, 2490	1	Неклассифицированные/default	19720	Lavazza
740477	8000070024441	Кофе в зернах lavazza crema E Aroma, натуральный, 1000г, вак уп, 2444	74065	Продукты питания (folder)/Чай и кофе/Кофе зерно	19720	Lavazza
30399	8000070042025	Кофе в зернах lavazza espresso Super crema, натуральный, вак уп 1000г, 4202	19716	Продукты питания (folder)/Чай и кофе/Кофе	19720	Lavazza
740486	8000070018860	Кофе в зернах lavazza espresso, натуральный, арабика 100%, 250г, вак уп, 1886	74065	Продукты питания (folder)/Чай и кофе/Кофе зерно	19720	Lavazza
3372751	8000070043206	Кофе в зернах lavazza Gold selection, натуральный, вак уп 1000г, 4320	19716	Продукты питания (folder)/Чай и кофе/Кофе	19720	Lavazza
