ID	UPCEAN	Name	CategoryID	CategoryName	BrandID	BrandName
2908243	8025386000125	Паштет дж.тортюфи из белгрибов с бел трюфелем 80г с/б	1	Неклассифицированные/default	0	
2908244	8025386001320	Паштет дж.тортюфи из грибов с летн.трюфелем 80г с/б	1	Неклассифицированные/default	0	
2908245	8025386002846	Паштет дж.тортюфи овощной с летн.трюфелем 80г с/б	1	Неклассифицированные/default	0	
2908246	8025386000989	Паштет джулиано тартюфо из артишоков с летн.трюфелем 130г с/б	1	Неклассифицированные/default	0	
789181	4612732050060	Паштет диво из говяжьей печени 200г п/б	24427	Продукты питания (folder)/Паштет	34407	Диво
789182	4612732050077	Паштет диво из индюшиной печени 200г п/б	24427	Продукты питания (folder)/Паштет	34407	Диво
789183	4612732050053	Паштет диво из куриной печени 200г п/б	24427	Продукты питания (folder)/Паштет	34407	Диво
789184	4612732050084	Паштет диво с грибами 200г п/б	24427	Продукты питания (folder)/Паштет	34407	Диво
2466781	4680016050709	Паштет диковинка мясо кабана с суш.ябл.200г с/б	24427	Продукты питания (folder)/Паштет	2466780	Диковинка
2466782	4680016050426	Паштет диковинка мясо косули с лес.гриб.200г с/б	24427	Продукты питания (folder)/Паштет	2466780	Диковинка
99929	5902310005018	Паштет дилли ду луппо телячий 150г	24427	Продукты питания (folder)/Паштет	41568	Дилли Ду
99930	5902310003403	Паштет дилли ду мазовецкий жб ключ 180г	24427	Продукты питания (folder)/Паштет	41568	Дилли Ду
99931	5902310004059	Паштет дилли ду свиной жб ключ 360г	24427	Продукты питания (folder)/Паштет	41568	Дилли Ду
3460892	4607118810925	Паштет дисней говяжий 190г	24427	Продукты питания (folder)/Паштет	0	
3460893	4607118810895	Паштет дисней печеночный 190г	24427	Продукты питания (folder)/Паштет	0	
3460894	4606420000314	Паштет для завтрака 150г кд	24427	Продукты питания (folder)/Паштет	0	
2908247	4680037030476	Паштет для завтрака из мяса птицы цб	1	Неклассифицированные/default	0	
3460895	4600993007985	Паштет для завтрака по-тихорецки 75г мк тихорецкий	24427	Продукты питания (folder)/Паштет	0	
3460896	4607046563764	Паштет дмитрогорский продукт мясной с грибами в полиамидной оболочке 200г	24427	Продукты питания (folder)/Паштет	0	
3460897	4607046563771	Паштет дмитрогорский продукт печеночный в полиамидной оболочке 200г	24427	Продукты питания (folder)/Паштет	0	
3460898	4607046563788	Паштет дмитрогорский продукт сливочный 200г в полиамидной обол.	24427	Продукты питания (folder)/Паштет	0	
3460899	4670009951915	Паштет доброгост грибной 150г	24427	Продукты питания (folder)/Паштет	0	
3460900	4670009951908	Паштет доброгост классический 150г	24427	Продукты питания (folder)/Паштет	0	
3460901	4640007140673	Паштет добродево утка с черносливом 100г	24427	Продукты питания (folder)/Паштет	0	
3460902	4640007140659	Паштет добродедово с куриной печенью 100г	24427	Продукты питания (folder)/Паштет	0	
3460903	4640007140666	Паштет добродедово с печенью индейки 100г	24427	Продукты питания (folder)/Паштет	0	
3460904	4630003224620	Паштет доброе дело домашний с грибами 130г мяг/уп	24427	Продукты питания (folder)/Паштет	0	
2466783	4640007140314	Паштет доброедово говяжья печень 250г	1229537	Продукты питания (folder)/Консервы (folder)/Консервы	0	
2466784	4640007140321	Паштет доброедово гусиная печень 250г	1229537	Продукты питания (folder)/Консервы (folder)/Консервы	0	
3460905	4640007140680	Паштет доброедово нежный печеночный с шампиньонами 100г	24427	Продукты питания (folder)/Паштет	0	
2466785	4640007140345	Паштет доброедово печень индейки 250г	1229537	Продукты питания (folder)/Консервы (folder)/Консервы	0	
3460906	4640007140642	Паштет доброедово с говяжьей печенью жб 100г	24427	Продукты питания (folder)/Паштет	0	
3460907	4640007140635	Паштет доброедово с гусиной печенью жб 100г	24427	Продукты питания (folder)/Паштет	0	
3460908	4607061354149	Паштет добрый продукт к чаю мяг/уп	24427	Продукты питания (folder)/Паштет	0	
270498	4606283008069	Паштет добрый продукт нежный с ветчиной шт 150г	24427	Продукты питания (folder)/Паштет	261185	Добрый Продукт
270499	4606283007437	Паштет добрый продукт нежный с зеленью шт 150г	24427	Продукты питания (folder)/Паштет	261185	Добрый Продукт
270500	4606283008052	Паштет добрый продукт нежный с луком шт 150г	24427	Продукты питания (folder)/Паштет	261185	Добрый Продукт
270501	4606283008045	Паштет добрый продукт нежный с паприкой шт 150г	24427	Продукты питания (folder)/Паштет	261185	Добрый Продукт
270502	4606283007420	Паштет добрый продукт нежный шт 150г	24427	Продукты питания (folder)/Паштет	261185	Добрый Продукт
270503	4606283006188	Паштет добрый продукт сливочный с ветчиной шт 150г	24427	Продукты питания (folder)/Паштет	261185	Добрый Продукт
270504	4606283006249	Паштет добрый продукт сливочный с вишней шт 150г	24427	Продукты питания (folder)/Паштет	261185	Добрый Продукт
270505	4606283006171	Паштет добрый продукт сливочный с зеленью шт 150г	24427	Продукты питания (folder)/Паштет	261185	Добрый Продукт
270506	4606283006201	Паштет добрый продукт сливочный с луком шт 150г	24427	Продукты питания (folder)/Паштет	261185	Добрый Продукт
270507	4606283006232	Паштет добрый продукт сливочный с маслинами шт 150г	24427	Продукты питания (folder)/Паштет	261185	Добрый Продукт
270508	4606283006218	Паштет добрый продукт сливочный с оливками шт 150г	24427	Продукты питания (folder)/Паштет	261185	Добрый Продукт
270509	4606283006164	Паштет добрый продукт сливочный с паприкой шт 150г	24427	Продукты питания (folder)/Паштет	261185	Добрый Продукт
270510	4606283006195	Паштет добрый продукт сливочный с чесноком шт 150г	24427	Продукты питания (folder)/Паштет	261185	Добрый Продукт
270511	4606283006256	Паштет добрый продукт сливочный шт 150г	24427	Продукты питания (folder)/Паштет	261185	Добрый Продукт
3460909	460705859882	Паштет домашний 120г	24427	Продукты питания (folder)/Паштет	0	
2908248	4810022020933	Паштет домашний 200г с/б белорусская традиция	1	Неклассифицированные/default	0	
1726214	4750579002863	Паштет домашний 350г ардекс	142954	Продукты питания (folder)/Колбасные изделия (folder)/Колбасные изделия	2506037	Агромикс
99932	4601657020975	Паштет домашний грибной 200г царицыно	24427	Продукты питания (folder)/Паштет	37823	Царицыно
162224	4607026982011	Паштет домашний кроншт.мк 0.100	142954	Продукты питания (folder)/Колбасные изделия (folder)/Колбасные изделия	0	
1280378	460702698026	Паштет домашний кроншт.мк 0.200	24427	Продукты питания (folder)/Паштет	0	
162225	4607026980260	Паштет домашний кроншт.мк 0.200 #2	142954	Продукты питания (folder)/Колбасные изделия (folder)/Колбасные изделия	0	
99933	4607026983179	Паштет домашний мясной 200г эверест	24427	Продукты питания (folder)/Паштет	14120	Эверест
3460910	4607082743731	Паштет домашний мясной 250г	24427	Продукты питания (folder)/Паштет	0	
2908249	4680017780353	Паштет домашний с зеленью 180г (иск/об)	1	Неклассифицированные/default	0	
99934	4601906117036	Паштет домашний с луком 200г парнас	24427	Продукты питания (folder)/Паштет	38832	Парнас-М
3460911	4640004788076	Паштет домашняя марка натуральный печеночный 150г в пленке	24427	Продукты питания (folder)/Паштет	0	
1690724	8033100276176	Паштет Дон антонио бел грибы/чер.трюфеля 180г с/б	22680	Продукты питания (folder)/Консервы (folder)/Консервы грибные	1675780	Дон Антонио
99936	4006276012309	Паштет драйштерн печеночный 160г стбан фаворит	24427	Продукты питания (folder)/Паштет	37847	Русский стол
2908250	4680320002562	Паштет дружина из гусиной печени 2x 90г (кв.лам)	1	Неклассифицированные/default	0	
2908251	4680320002555	Паштет дружина из индейки 2x 90г (кв.лам)	1	Неклассифицированные/default	0	
2908252	4607076131384	Паштет дс со свин/жиром 0.250	1	Неклассифицированные/default	0	
2908253	4607076131377	Паштет дс со слив/маслом 0.250	1	Неклассифицированные/default	0	
99938	4607022163162	Паштет дымов с грибами 125г	24427	Продукты питания (folder)/Паштет	37350	Дымов
2908254	3382562920192	Паштет дюк де гасконь гурмэ из свин.артишок/сидр 65г с/б в кор.	1	Неклассифицированные/default	3647791	DUCS DE GASCOGNE
2908255	3382562360196	Паштет дюк де гасконь гурмэ из свин.рокфор/виноград 65г с/б в кор.	1	Неклассифицированные/default	3647791	DUCS DE GASCOGNE
2908256	3382562930191	Паштет дюк де гасконь гурмэ из свин.ябл/кальвадос 65г с/б в кор.	1	Неклассифицированные/default	3647791	DUCS DE GASCOGNE
3460912	4607104814500	Паштет егорьевск жареный из говяжьей печени 150г	24427	Продукты питания (folder)/Паштет	0	
2908257	4607104816214	Паштет егорьевская деревенский 150г	1	Неклассифицированные/default	0	
3460913	4640007140840	Паштет елецкий нежный с печенью индейки жб 240г	24427	Продукты питания (folder)/Паштет	0	
3460914	4640007140819	Паштет елецкий с говяжьей печенью 240г	24427	Продукты питания (folder)/Паштет	0	
3460915	4640007140826	Паштет елецкий с гусиной печенью 240г	24427	Продукты питания (folder)/Паштет	0	
3460916	4640007140833	Паштет елецкий с куриной печенью 240г	24427	Продукты питания (folder)/Паштет	0	
2908258	4607090510417	Паштет елино асс 0.135	1	Неклассифицированные/default	0	
2908259	4607090510424	Паштет елино асс 0.135 #2	1	Неклассифицированные/default	0	
2908260	4607090510448	Паштет елино асс 0.135 #3	1	Неклассифицированные/default	0	
2908266	4607090510394	Паштет елино гус печень 0.135	1	Неклассифицированные/default	0	
2908265	4607090510776	Паштет елинский из говяжей печени жб 240г	1	Неклассифицированные/default	0	
2908281	4607090510790	Паштет елинский из гусиной печени 240г ж б	1	Неклассифицированные/default	3799286	ЕЛИНСКИЙ
789185	4607090510806	Паштет елинский из куриной печени 240г ж б	24427	Продукты питания (folder)/Паштет	3799286	ЕЛИНСКИЙ
789186	4607090510820	Паштет елинский из печени индейки 240г ж б	24427	Продукты питания (folder)/Паштет	0	
2908264	4607090510080	Паштет елинский печеночный с оливками 250г ж б	1	Неклассифицированные/default	0	
2908262	4607090510066	Паштет елинский печеночный с шампиньонами 250г ж б	1	Неклассифицированные/default	3799286	ЕЛИНСКИЙ
2908261	4607090510059	Паштет елинский утка с черносливом 250г ж б	1	Неклассифицированные/default	3799286	ЕЛИНСКИЙ
3460917	1070929308111	Паштет естъ печеночный 180г мяг/уп	24427	Продукты питания (folder)/Паштет	0	
3460918	1070929309118	Паштет естъ чиполлино 180г	24427	Продукты питания (folder)/Паштет	0	
2252033	3382562898613	Паштет ж.вейпак из свинины по-дерев с гриб.соусом 130г с/б	24427	Продукты питания (folder)/Паштет	2252032	Жан дэ Вейрак
2252034	3382562078619	Паштет ж.вейрак из индейки с базил/кервил.130г с/б	24427	Продукты питания (folder)/Паштет	2252032	Жан дэ Вейрак
2252035	3382552808615	Паштет ж.вейрак из индейки с каштанами 130г с/б	24427	Продукты питания (folder)/Паштет	2252032	Жан дэ Вейрак
2252036	3382562068610	Паштет ж.вейрак из свинины гаскон.с арманьяком 130г с/б	24427	Продукты питания (folder)/Паштет	2252032	Жан дэ Вейрак
2252037	3382562028614	Паштет ж.вейрак из утки по стар.рецепту 130г с/б	24427	Продукты питания (folder)/Паштет	2252032	Жан дэ Вейрак
2252038	3382562828610	Паштет ж.вейрак из утки с оливками 130г с/б	24427	Продукты питания (folder)/Паштет	2252032	Жан дэ Вейрак
2466787	460517219096	Паштет закусон асс жб 0.255	23172	Продукты питания (folder)/Консервы (folder)/Консервы мясные	0	
2466788	460517219102	Паштет закусон асс жб 0.255 #2	23172	Продукты питания (folder)/Консервы (folder)/Консервы мясные	0	
2466789	4605172190717	Паштет закусон асс жб 0.255 #3	23172	Продукты питания (folder)/Консервы (folder)/Консервы мясные	0	
2466790	4605172190984	Паштет закусон асс жб 0.255 #4	23172	Продукты питания (folder)/Консервы (folder)/Консервы мясные	0	
3460919	4606420000802	Паштет закусочный 250г кд	24427	Продукты питания (folder)/Паштет	0	
99978	4605916002009	Паштет закусочный Золотое кольцо 0.325	24427	Продукты питания (folder)/Паштет	0	
99966	4605916002030	Паштет закусочный посадский 0.325	24427	Продукты питания (folder)/Паштет	37472	NICHIKO
99967	4605916002047	Паштет закусочный Русский 0.325	24427	Продукты питания (folder)/Паштет	0	
100129	4605916002023	Паштет закусочный советский 0.325	24427	Продукты питания (folder)/Паштет	0	
2908267	4610001902027	Паштет замоскворецкий 0.130 (шт)	1	Неклассифицированные/default	0	
2908268	4607100105619	Паштет запеченный датский. изделие колбасное из термически обработанных ингредиентов, мясной продукт (вак уп, шт)	142954	Продукты питания (folder)/Колбасные изделия (folder)/Колбасные изделия	0	
2908269	4607056955641	Паштет запеченный, датский, 160г	1	Неклассифицированные/default	0	
2908270	4607056950028	Паштет запеченный, трюфель, 160г	1	Неклассифицированные/default	0	
2908271	4607056950042	Паштет запеченный, Французский, 160г	1	Неклассифицированные/default	0	
99970	4063500002574	Паштет зимбо баварский ливерный 300г	24427	Продукты питания (folder)/Паштет	41580	Зимбо
3460920	4660017760456	Паштет знаток печеночный жб 230г	24427	Продукты питания (folder)/Паштет	0	
3460921	4660017761323	Паштет знаток печеночный со сливочным маслом 100г	24427	Продукты питания (folder)/Паштет	0	
3460922	4660017761125	Паштет знаток пражский 100г	24427	Продукты питания (folder)/Паштет	0	
3460923	4660017760449	Паштет знаток пражский жб 230г	24427	Продукты питания (folder)/Паштет	0	
3460924	4660017760432	Паштет знаток эстонский жб 230г	24427	Продукты питания (folder)/Паштет	0	
99972	4005489640170	Паштет Золотой стандарт нежный говяжий 100г	24427	Продукты питания (folder)/Паштет	99971	Золотой стандарт
99973	4005489640187	Паштет Золотой стандарт нежный грибной 100г	24427	Продукты питания (folder)/Паштет	99971	Золотой стандарт
99974	4005489640132	Паштет Золотой стандарт нежный гусиный 100г	24427	Продукты питания (folder)/Паштет	99971	Золотой стандарт
99975	4005489640156	Паштет Золотой стандарт нежный куриный 100г	24427	Продукты питания (folder)/Паштет	99971	Золотой стандарт
99976	4005489640149	Паштет Золотой стандарт нежный свиной 100г	24427	Продукты питания (folder)/Паштет	99971	Золотой стандарт
99977	4005489640163	Паштет Золотой стандарт печеночный 100г	24427	Продукты питания (folder)/Паштет	99971	Золотой стандарт
3460925	4607050464736	Паштет зтм печеночный из гусиной печени жб 100г	24427	Продукты питания (folder)/Паштет	0	
504934	8003267900320	Паштет из вяленых томатов, villa reale, 180г Италия	24427	Продукты питания (folder)/Паштет	0	
2746216	4650065572873	Паштет из гов.крестьянский с чесноком 70г старш	24427	Продукты питания (folder)/Паштет	0	
2908272	4607090512800	Паштет из говьяжей печени 325г ту елинский	1	Неклассифицированные/default	0	
789188	4607129510760	Паштет из говядины крестьянский с чесноком внмд 70г ламистер 1/20	24427	Продукты питания (folder)/Паштет	0	
2908274	4690363040629	Паштет из говядины мдд ашан 100г с кл	1	Неклассифицированные/default	0	
2908275	4650065572842	Паштет из говядины охотничий 50г	1	Неклассифицированные/default	0	
2746215	4650065572859	Паштет из говядины охотничий 70г	24427	Продукты питания (folder)/Паштет	0	
2908276	4650065572866	Паштет из говядины охотничий 90г	1	Неклассифицированные/default	0	
789189	4607129510746	Паштет из говядины охотничий внмд 70г ламистер 1/20	24427	Продукты питания (folder)/Паштет	0	
2908277	4650065573047	Паштет из говядины охотничий старшина 70г лам	1	Неклассифицированные/default	0	
3460926	4607141562259	Паштет из говяж.печени 250г	24427	Продукты питания (folder)/Паштет	0	
3460927	4607090512671	Паштет из говяжей печени 100г епк	24427	Продукты питания (folder)/Паштет	0	
3460928	4007832156314	Паштет из говяжей печени 240г ж б	24427	Продукты питания (folder)/Паштет	0	
548959	4606180005499	Паштет из говяжей печени мс (мясной Союз №4) (кор.20), 240г	24427	Продукты питания (folder)/Паштет	789207	Мясной Союз
3460929	4007832156321	Паштет из говяжей печени с дымком 240г ж б	24427	Продукты питания (folder)/Паштет	0	
3460930	4610007571319	Паштет из говяжей печени ту 120г мяг/уп хаме	24427	Продукты питания (folder)/Паштет	0	
548942	4607090510035	Паштет из говяжей печени №5 (250грх 30шт) этикетка	24427	Продукты питания (folder)/Паштет	3799286	ЕЛИНСКИЙ
1971487	4606411010131	Паштет из говяжьей печени 0.250 литография лыткарино	1	Неклассифицированные/default	2732260	рузком
2908278	4690363036677	Паштет из говяжьей печени 100г кд	1	Неклассифицированные/default	0	
2908279	4870206630686	Паштет из говяжьей печени 250г ту великан	1	Неклассифицированные/default	0	
2908107	4680011940685	Паштет из говяжьей печени 70г сто beef.on литография	1	Неклассифицированные/default	3621200	BEEF-ON
3460931	4606411010087	Паштет из говяжьей печени рузком 117г ж б	24427	Продукты питания (folder)/Паштет	2732260	рузком
2908280	4650065575362	Паштет из говяжьей печени с винным соусом le pate 100г кв.лам.	1	Неклассифицированные/default	0	
789167	4607078147833	Паштет из гусин печен жб 100г Россия	24427	Продукты питания (folder)/Паштет	23095	Hame
2908282	4690363036660	Паштет из гусин.печени 100г кд	1	Неклассифицированные/default	0	
3460932	4606180008421	Паштет из гусин.печени 185г главпродукт	24427	Продукты питания (folder)/Паштет	50305	Главпродукт
3460933	4607141562235	Паштет из гусин.печени 250г	24427	Продукты питания (folder)/Паштет	0	
789190	4607129513013	Паштет из гусиного мяса нежный внмд 70г ламистер 1/20	24427	Продукты питания (folder)/Паштет	0	
1971488	4606411010155	Паштет из гусиной печени 0.250 литография лыткарино	1	Неклассифицированные/default	0	
2466786	4607090512657	Паштет из гусиной печени 100г епк	23172	Продукты питания (folder)/Консервы (folder)/Консервы мясные	0	
