ID	UPCEAN	Name	CategoryID	CategoryName	BrandID	BrandName
3427846	6934622402437	Набор планета парикмахерская для девоч тв/уп	1	Неклассифицированные/default	0	
1685354	4602010279092	Набор пласт (машина, паровоз,самолет) pac 22.5x16.5x8.5см арт 865 b	461826	Игрушки (folder)/Игрушечный транспорт	0	
495768	4602010241358	Набор пласт Box 36x22 x 17см stellar Force, 12шт космические воины ассортим, арт.095001	534740	Игрушки (folder)/Игрушка трансформер	0	
495769	4607112097520	Набор пласт Box 36x22 x 6см военный гараж 5513-06	439741	Игрушки (folder)/Детали игровой сценической обстановки	0	
1266032	4607112097490	Набор пласт Box 36x22 x 6см газовая заправка 5513-09	439741	Игрушки (folder)/Детали игровой сценической обстановки	0	
495770	4607112097513	Набор пласт Box 36x22 x 6см полицейский участок 5513-07	439741	Игрушки (folder)/Детали игровой сценической обстановки	0	
495771	4607112097506	Набор пласт Box 36x22 x 6см стройка 5513-08	439741	Игрушки (folder)/Детали игровой сценической обстановки	0	
1771470	4605419038024	Набор пласт блис.в вид.книж 12цв	2	Канцелярские товары (folder)/Канцелярские товары	0	
845666	4606088009032	Набор пласт бэк треугольникиков пластмасс 24элем	1	Неклассифицированные/default	439963	Тридевятое царство
1266031	4607056792406	Набор пласт ванна для кукол у609 уфа	980	Игрушки (folder)/Игрушки	0	
1266034	4812501020175	Набор пласт дикие животные т33703 фэнси	980	Игрушки (folder)/Игрушки	0	
495772	4041485196457	Набор пласт для горячего artkey Gold 19645	1	Неклассифицированные/default	0	
1807860	7317670455140	Набор пласт для стр-ва дороги 32предм 4маш+4дор.знака 45514 viking Toys	1768801	Игрушки (folder)/Игрушки пластмассовые	0	
1266039	6937493918267	Набор пласт доктор в рус кор 6121 премьер игрушка	980	Игрушки (folder)/Игрушки	0	
1266041	4812501020168	Набор пласт домашние животные т33702 фэнси	980	Игрушки (folder)/Игрушки	0	
3427847	4607113840651	Набор пласт индустрия посуды одноразовой второе+ м/уп	1	Неклассифицированные/default	0	
3427848	4607113840620	Набор пласт индустрия посуды одноразовой м/уп	1	Неклассифицированные/default	0	
771569	4602010305456	Набор пласт конструкторов в яйце Mini animal. набор 12шт, арт.6601-6606.	693509	Товары для творчества (folder)/Модели для сборки	0	
1266048	4602010221879	Набор пласт корабликов рас 4шт, арт.417.	147523	Игрушки (folder)/Игрушки для малышей	0	
1807861	6927116708085	Набор пласт королевская лодка hwa271167 ми	1768801	Игрушки (folder)/Игрушки пластмассовые	0	
1266049	4602010305449	Набор пласт машин.тракторы с прицепом. набор 6шт, арт.007-1CD.	461826	Игрушки (folder)/Игрушечный транспорт	0	
1266050	4606066110583	Набор пласт мебели габриэлла полипроп.161058 виллаж пипл	1183003	Неклассифицированные/Сезонный товар	1202308	Виллаж Пипл
1266051	4603283004770	Набор пласт мебель гостиная комфорт в коробке с-755 огонек	980	Игрушки (folder)/Игрушки	0	
1266052	4603283004763	Набор пласт мебель гостиная с-754 огонек	980	Игрушки (folder)/Игрушки	0	
759788	4603283004787	Набор пласт мебель жилая комната в коробке с-756 огонек	1	Неклассифицированные/default	0	
759790	4603283004800	Набор пласт мебель кухня в коробке с-758 огонек	1	Неклассифицированные/default	0	
1266053	4603283004848	Набор пласт мебель спальня в коробке с-762 огонек	980	Игрушки (folder)/Игрушки	0	
759794	4603283000192	Набор пласт мебель спальня элегия в коробке с-549 огонек	1	Неклассифицированные/default	0	
759795	4603283004855	Набор пласт мебель столовая в коробке с-763 огонек	1	Неклассифицированные/default	0	
759796	4603283000901	Набор пласт мебель туалетная комната в коробке с-485 огонек	1	Неклассифицированные/default	0	
1807862	4897026581448	Набор пласт мега сити машинки металл+аксесс. в/к 4 вида 710148 батик	1768801	Игрушки (folder)/Игрушки пластмассовые	0	
79679	4601146401728	Набор пласт овощи 1/40 21018 плейдорадо	57	Продукты питания (folder)/Масложировая продукция (folder)/Майонез	73972	Колибри
1266055	4680002570471	Набор пласт овощи 2006 вадер	980	Игрушки (folder)/Игрушки	0	
1266056	4601146401735	Набор пласт овощное ассорти 21016 плейдорадо	980	Игрушки (folder)/Игрушки	0	
1266057	4680002571225	Набор пласт оружия №2 8032 вадер	980	Игрушки (folder)/Игрушки	0	
1807863	6903062010168	Набор пласт пирата 8145-33 вит	1768801	Игрушки (folder)/Игрушки пластмассовые	0	
771570	4620749600352	Набор пласт посуды Happy time	3536	Хозяйственные товары (folder)/Хозяйственные товары	0	
3427849	6933163740022	Набор пласт посуды для пикникана 4перс 20 предм	1	Неклассифицированные/default	0	
1266058	4620749600505	Набор пласт посуды на 2перс бест	1	Неклассифицированные/default	0	
3427850	4660001201347	Набор пласт посуды пикник на 10перс леопак	1	Неклассифицированные/default	0	
1266060	4607056793076	Набор пласт слесарный :Мастер в п/э пакете у618 уфа	980	Игрушки (folder)/Игрушки	0	
1685355	4602010306613	Набор пласт совок и грабли в сетке 30см, арт.hg-476.	332673	Игрушки (folder)/Игрушки для песочницы	0	
1266061	4602010306637	Набор пласт совок и грабли в сетке 38см, арт.hg-493.	332673	Игрушки (folder)/Игрушки для песочницы	0	
1807864	4607056794752	Набор пласт строитель №2 в сетке ведро бол,лей,Мастер,уровень у751 173-232 уфа	1768801	Игрушки (folder)/Игрушки пластмассовые	0	
1266063	4607056794868	Набор пласт фруктов и овощей в корзинке у758 уфа	980	Игрушки (folder)/Игрушки	0	
771571	3000250170017	Набор пластик бусы+серьги 3614	281946	Галантерея (folder)/Бижутерия	0	
838817	4600566785463	Набор пластик ка вилки одноразовые 10шт	327266	Посуда (folder)/Тарелка	0	
3427851	4690231108444	Набор пластик репаблик емкостей для хранения браво 0.9л пластик 1/3шт	1	Неклассифицированные/default	0	
2461674	4607002130412	Набор пластик-центр салатник 3+1шт пластм красн р 1741	38328	Посуда (folder)/Посуда столовая, предметы сервировки	0	
11648	024602806037	Набор пластиковая коробочка муж	360621	Сувениры и подарки (folder)/Подарочный набор	0	
2743421	8411574026341	Набор пластиковая точилка afila, 1 отверстие + ластик 430, блистер	2	Канцелярские товары (folder)/Канцелярские товары	0	
319548	4620749600390	Набор пластиковой посуды Happy time Maxi 1/10	18634	Посуда (folder)/Посуда одноразовая	319547	Happy Time
3427852	4965534722698	Набор пластиковый контейнеров для свч пластиковый 1/2шт 0.4л	1	Неклассифицированные/default	0	
3427853	6900638410018	Набор пластиковый кувшин +4стакана 34559-в1	1	Неклассифицированные/default	0	
3427854	6900638420017	Набор пластиковый кувшин +4стакана 34559-в2	1	Неклассифицированные/default	0	
1685356	4605402320907	Набор пластиковых вешалок 5шт	3536	Хозяйственные товары (folder)/Хозяйственные товары	145147	Полимербыт
3427855	6900013338678	Набор пластиковых контейнеров красные круглых 0.15л/0.3л/0.5л	1	Неклассифицированные/default	0	
3427856	6900013338692	Набор пластиковых контейнеров оранжевые круглые 0.15л/0.3л/ 0.5л	1	Неклассифицированные/default	0	
3427857	6900013338685	Набор пластиковых контейнеров синие круглые 0.15л /0.3л/0.5л	1	Неклассифицированные/default	0	
462055	4712759210390	Набор пластиковых самоклеящихся закладок хопакс стикн 2цв 25лист	462015	Канцелярские товары (folder)/Закладки	226359	Hopax
771573	4001868002102	Набор пластиковых стикеров кругл год - к дню рождения, европодвес	1	Неклассифицированные/default	0	
1685974	4006592606473	Набор пластилин+инструменты, 4x 50г, 12/24	980	Игрушки (folder)/Игрушки	651699	Simba
652044	4006592642792	Набор пластилин+формочки+инструменты, 4 в., 12/48	980	Игрушки (folder)/Игрушки	651699	Simba
148927	5010065079571	Набор пластилина crayola с формочками	90098	Товары для творчества (folder)/Набор для творчества	145210	Crayola
1685357	4006592629021	Набор пластилина парикмахерская, 12/12	980	Игрушки (folder)/Игрушки	651699	Simba
771575	4892401083326	Набор пластилина с формами	980	Игрушки (folder)/Игрушки	0	
1771471	4605419037775	Набор пластилина с формочк.12цв	2	Канцелярские товары (folder)/Канцелярские товары	0	
771576	4892401083548	Набор пластилина фермер/друзья	980	Игрушки (folder)/Игрушки	0	
1685358	4006592629113	Набор пластилина, 3x 26г, 12/24	980	Игрушки (folder)/Игрушки	651699	Simba
495773	4602010006513	Набор пластм посуды pvc 14см арт. sh-88515	1367334	Игрушки (folder)/Профессионально-бытовые игровые наборы	0	
3427858	6920120629018	Набор пластмассовой посуды novel	1	Неклассифицированные/default	0	
3427859	6900018136668	Набор пластмассовых контейнеров для продуктов 1x 3шт мяг/уп	1	Неклассифицированные/default	0	
1262750	4601146401384	Набор пластмастер айболит арт 22013	980	Игрушки (folder)/Игрушки	0	
3427860	4601146401773	Набор пластмастер воинов куликовской битвы	1	Неклассифицированные/default	0	
160977	4601146601388	Набор пластмастер посуды детской хозяюшка большой 21006	980	Игрушки (folder)/Игрушки	439747	Плэйдорадо
3427861	4620006310994	Набор пластмастер рыбалка	1	Неклассифицированные/default	0	
3427862	4620006311335	Набор пластмастер супчик	1	Неклассифицированные/default	0	
3427863	4650059890099	Набор пластмасыч контейнеров круглых	1	Неклассифицированные/default	0	
3427864	4650059894387	Набор пластмасыч мерных ложек 3шт	1	Неклассифицированные/default	0	
3427865	4680015898937	Набор платков носовых детских 18x 18см A6	1	Неклассифицированные/default	0	
1266065	6944312038785	Набор плашек м3-м12 сибртех, 8предм	1	Неклассифицированные/default	0	
1969162	4606373069505	Набор плашек м3-м12+плашкодержатель 8предм Зубр 28128-н8	1	Неклассифицированные/default	0	
2743422	6934522923506	Набор плашек рулевой колонки для снегоката из 2-х частей в кор.54наб	1211675	Спорт и отдых (folder)/Катание по снегу и льду	0	
1266066	460606608718	Набор плед 120x 80см+игрушка hq 58718	17402	Текстиль (folder)/Текстиль для дома	0	
1266067	4606066103448	Набор плед+игрушка трактор 60344	17402	Текстиль (folder)/Текстиль для дома	0	
771578	4606471877392	Набор плеер на батар 51248	980	Игрушки (folder)/Игрушки	675204	Тойс
1263386	4601146602002	Набор плейдорадо кораблик и рыбки для купания	980	Игрушки (folder)/Игрушки	0	
771579	231471212061	Набор пленки упаковочной голография, 70x 50см 100лист 10 видов	1	Неклассифицированные/default	0	
2986128	231471212092	Набор пленки упаковочной голография, 70x 50см 100лист 10 видов #2	1	Неклассифицированные/default	0	
771580	231471212030	Набор пленки упаковочной, 70x 50см 100лист 10 видов	1	Неклассифицированные/default	0	
2986129	231471212047	Набор пленки упаковочной, 70x 50см 100лист 10 видов #2	1	Неклассифицированные/default	0	
3427866	6966720400114	Набор плетение бисером тюльпан кот муар	1	Неклассифицированные/default	0	
2461477	460701271718	Набор плетение из фольги	980	Игрушки (folder)/Игрушки	0	
3427867	4606900541047	Набор плетенка горшков для цветов керамика 1x 3шт	1	Неклассифицированные/default	0	
3427868	8697422301314	Набор плетеный для ванной комнаты 3предм	1	Неклассифицированные/default	0	
771581	6904567035250	Набор плечиков арти-м ароматизир.6шт 3525	3536	Хозяйственные товары (folder)/Хозяйственные товары	36881	Арти-М
771582	6904567035120	Набор плечиков арти-м сатин 5шт 3512	3536	Хозяйственные товары (folder)/Хозяйственные товары	36881	Арти-М
771583	6904567035137	Набор плечиков арти-м сатин 5шт 3513	3536	Хозяйственные товары (folder)/Хозяйственные товары	36881	Арти-М
91344	5000458731551	Набор плечиков бархат 2шт	3536	Хозяйственные товары (folder)/Хозяйственные товары	0	
1685359	4814940007281	Набор плечиков из пластмассы 5шт	1	Неклассифицированные/default	0	
91345	6410411833663	Набор плечиков шелк 3шт 183366	3536	Хозяйственные товары (folder)/Хозяйственные товары	0	
771585	4894356265932	Набор плит fluerelle эвкалипт 30x2.5x 30см	1	Неклассифицированные/default	771584	Fluerelle
495774	4602010258608	Набор плита с кухонн.утварью Box 24x24 x 20см cooking, арт.1060	1367334	Игрушки (folder)/Профессионально-бытовые игровые наборы	0	
3427869	6934624756408	Набор плита с посудой 3x35 x 26см	1	Неклассифицированные/default	0	
1685360	6906926629155	Набор плоских терок 4шт /62915/	1	Неклассифицированные/default	0	
1832679	4607066100147	Набор плоскогубцев №1 6inch	1831951	Строительные и отделочные материалы (folder)/Товары для ремонта	0	
3427870	4606900484320	Набор плющ керамических горшков для цветов 1x 3шт	1	Неклассифицированные/default	0	
1969163	4650057629271	Набор пляж 59x15 x42.5, (6шт/кор)/sfl	1	Неклассифицированные/default	0	
771587	4792412140493	Набор пляжный (2 ракетки+2 мяч	980	Игрушки (folder)/Игрушки	0	
771588	4664056707120	Набор пляжный 2 ракетки+волан	550638	Спорт и отдых (folder)/Спорт	0	
771589	4013331440236	Набор пляжный 5в1 упак рюкзак	550638	Спорт и отдых (folder)/Спорт	0	
332674	4810344028518	Набор пляжный кораблик 4шт арт.-8518	332673	Игрушки (folder)/Игрушки для песочницы	41335	Полесье
3427871	8888882052261	Набор пляжный ракетки с мячом	1	Неклассифицированные/default	0	
771590	4012208440232	Набор пляжных игр	550638	Спорт и отдых (folder)/Спорт	0	
771591	4607056707127	Набор пляжных игр у712	550638	Спорт и отдых (folder)/Спорт	0	
1969164	6944312011399	Набор пневмоинструмента 5предм быстросъем. matrix 57302	1	Неклассифицированные/default	0	
1969165	6944312011382	Набор пневмоинструмента 5предм быстросъем. matrix 57304	1	Неклассифицированные/default	0	
1969166	4670004901922	Набор пневмоинструментов набор из 20позиций, шланг, разъемы, пистолет, aiken mma 012/093-1	1	Неклассифицированные/default	0	
2743423	6908605730008	Набор по выжиганию арт 605751	980	Игрушки (folder)/Игрушки	0	
2743424	6908605820006	Набор по выжиганию арт 605751 #2	980	Игрушки (folder)/Игрушки	0	
91346	4892505062715	Набор по секрету anc 203r	360621	Сувениры и подарки (folder)/Подарочный набор	0	
31339	4600702045468	Набор по уходу за нормальной и комбинированной кожей сто рецептов красоты	5586	Косметика (folder)/Косметика	633	Сто Рецептов Красоты
91347	1692325969101	Набор по уходу за обувью 969101	594	Хозяйственные товары (folder)/Уход за обувью	0	
91348	1692525969109	Набор по уходу за обувью 969109	594	Хозяйственные товары (folder)/Уход за обувью	0	
31340	4600702045451	Набор по уходу за сухой и нормальной кожей сто рецептов красоты	5586	Косметика (folder)/Косметика	633	Сто Рецептов Красоты
289716	4607012290854	Набор по-вкусу классика в кухонной полочке 200г	30882	Продукты питания (folder)/Приправы и специи	101091	По-вкусу
289717	4607012291431	Набор по-вкусу морская соль и черный перец 115г	30882	Продукты питания (folder)/Приправы и специи	101091	По-вкусу
289718	4607012290762	Набор по-вкусу перец красный и перец черный 65г	30882	Продукты питания (folder)/Приправы и специи	101091	По-вкусу
289719	4607012290861	Набор по-вкусу фаворит в кухонной полочке 165г	30882	Продукты питания (folder)/Приправы и специи	101091	По-вкусу
3427872	6904737847553	Набор повар игрушек посудка для кукол пластмасса 9953	1	Неклассифицированные/default	0	
3427873	6933143180015	Набор повар подставка, лопатки 3шт ca 1096 тв/уп	1	Неклассифицированные/default	0	
3427874	6933143250015	Набор повар подставка, лопатки 3шт qv 9083 тв/уп	1	Неклассифицированные/default	0	
3427875	9120028900425	Набор поварежек на 7предм	1	Неклассифицированные/default	0	
3427876	4605885558798	Набор поваренок 2005	1	Неклассифицированные/default	0	
1969167	4680002571331	Набор поваренок арт. 2005	1	Неклассифицированные/default	0	
3427877	9859332108301	Набор поваренок посуды	1	Неклассифицированные/default	0	
3427878	6907779070002	Набор поваренок посуды 10предм	1	Неклассифицированные/default	0	
91349	6901230214783	Набор поварята для соли/перца 8066а80-Al	2420630	Посуда (folder)/Посуда кухонная	38291	Синогласс
771594	4603299129436	Набор поводков 72шт бел металл 1шт	562237	Спорт и отдых (folder)/Рыбалка (folder)/Рыбалка	0	
771595	4603299129443	Набор поводков 72шт зелен	562237	Спорт и отдых (folder)/Рыбалка (folder)/Рыбалка	0	
1969168	4660006823698	Набор повязка + резинки ,арт.м1566	1	Неклассифицированные/default	0	
3427879	6900000056653	Набор погремушек	1	Неклассифицированные/default	0	
3427880	6967410250194	Набор погремушек #2	1	Неклассифицированные/default	0	
1266068	4606471852979	Набор погремушек 11шт 48367	980	Игрушки (folder)/Игрушки	705119	Джой Тойс
771596	4606471881467	Набор погремушек 11шт 51450	980	Игрушки (folder)/Игрушки	675204	Тойс
771597	4605885420446	Набор погремушек 201lb счастливое детск	980	Игрушки (folder)/Игрушки	0	
771598	4605885420422	Набор погремушек 203lb счастливое детск	980	Игрушки (folder)/Игрушки	0	
771599	4605885627586	Набор погремушек 205lb счастливое детск	980	Игрушки (folder)/Игрушки	0	
771600	4605885627562	Набор погремушек 207lb счастливое детск	980	Игрушки (folder)/Игрушки	0	
771601	4605885420606	Набор погремушек 235lb счастливое дет	980	Игрушки (folder)/Игрушки	0	
771602	4605885420620	Набор погремушек 248lb счастливое дет	980	Игрушки (folder)/Игрушки	0	
771603	4605885411451	Набор погремушек 250lb счастливое детск	980	Игрушки (folder)/Игрушки	0	
2743425	6934611544179	Набор погремушек 2шт на карт./а051-н25056	980	Игрушки (folder)/Игрушки	0	
3427881	6900300821685	Набор погремушек 326-429 (с537-н25231)	1	Неклассифицированные/default	0	
771604	4605885626350	Набор погремушек 382 3шт в коробке 32.5	980	Игрушки (folder)/Игрушки	0	
651950	4006592445270	Набор погремушек 6шт, 2 вида, 6/36	980	Игрушки (folder)/Игрушки	651699	Simba
771605	4605885628538	Набор погремушек 838-7 музыкальный, на б	980	Игрушки (folder)/Игрушки	0	
3427882	6968876250285	Набор погремушек 8605	1	Неклассифицированные/default	0	
771606	4605885409984	Набор погремушек 978u в коробке 31x5 x18	980	Игрушки (folder)/Игрушки	0	
1685361	4602010143171	Набор погремушек Box 36x24 x 6см арт. 2927-2932	147523	Игрушки (folder)/Игрушки для малышей	0	
