ID	UPCEAN	Name	CategoryID	CategoryName	BrandID	BrandName
3355172	4610000661307	Колбаски с сыром полукопченые вик вак уп 260г	1	Неклассифицированные/default	0	
3355173	4606639033356	Колбаски с чесноком полукопченые вак уп 100г	1	Неклассифицированные/default	0	
1226926	4770961162760	Колбаски с/в браворо из баранины з/с 70г агровет	142954	Продукты питания (folder)/Колбасные изделия (folder)/Колбасные изделия	0	
1226927	4770961162753	Колбаски с/в браворо из говядины з/с 70г агровет	142954	Продукты питания (folder)/Колбасные изделия (folder)/Колбасные изделия	0	
1725905	4770645031832	Колбаски с/в тай топ в/с (защ.ср.) 50г петербурженка	142954	Продукты питания (folder)/Колбасные изделия (folder)/Колбасные изделия	0	
2875536	4607033365838	Колбаски с/к smachos чибаско 70г	1	Неклассифицированные/default	0	
155594	4607022164053	Колбаски с/к дымов пиколини бекон 70г	142954	Продукты питания (folder)/Колбасные изделия (folder)/Колбасные изделия	0	
155595	4607022164060	Колбаски с/к дымов пиколини чеснок 70г	142954	Продукты питания (folder)/Колбасные изделия (folder)/Колбасные изделия	0	
1774453	4607022163483	Колбаски с/к дымов пиколини Чили 70г	142954	Продукты питания (folder)/Колбасные изделия (folder)/Колбасные изделия	0	
2875537	4630018370114	Колбаски с/к снэки классика 100г мгс	1	Неклассифицированные/default	0	
2875538	4630018370107	Колбаски с/к снэки пепперони 100г мгс	1	Неклассифицированные/default	0	
2875539	4607964092087	Колбаски с/к спагетти	1	Неклассифицированные/default	0	
2875540	4607964090960	Колбаски с/к спагетти 0.05кг	1	Неклассифицированные/default	0	
3355174	4610004168390	Колбаски сава венгерские сырокопченые 80г мяг/уп	1	Неклассифицированные/default	0	
3355175	4610004166235	Колбаски сава чешские сырокопченые 100г мяг/уп	1	Неклассифицированные/default	0	
3355176	4640015400080	Колбаски сальма жгучие сырокопченые вак уп 75г	1	Неклассифицированные/default	0	
3355177	4640015400073	Колбаски сальма пряные сырокопченые вак уп 75г	1	Неклассифицированные/default	0	
3355178	4640015400097	Колбаски сальма с беконом сырокопченые вак уп 75г	1	Неклассифицированные/default	0	
3355179	4640015400134	Колбаски сальма салямки баварские сырокопченые 35г мяг/уп	1	Неклассифицированные/default	0	
3355180	4640015400035	Колбаски сальма салямки острые сырокопченые 35г мяг/уп	1	Неклассифицированные/default	0	
729880	5410916047771	Колбаски салями аперитив из свинины маркассу вак уп 100г	24427	Продукты питания (folder)/Паштет	729805	Маркассу
729881	5410916070649	Колбаски салями аперитив пиколлини маркассу вак уп 170г	142954	Продукты питания (folder)/Колбасные изделия (folder)/Колбасные изделия	729805	Маркассу
68146	8007660235010	Колбаски салями беретта 4 гномика 150г	1183382	Продукты питания (folder)/Мясные продукты	37345	Беретта
68147	4607056731627	Колбаски салями мини брауншвейгские 35г	37056	Продукты питания (folder)/Снэки рыбные и мясные	14120	Эверест
68148	4607056731825	Колбаски салями мини классич 35г	37056	Продукты питания (folder)/Снэки рыбные и мясные	14120	Эверест
68149	4607056731818	Колбаски салями мини острые 35г	37056	Продукты питания (folder)/Снэки рыбные и мясные	14120	Эверест
3355181	4606420001472	Колбаски салями мини сыровяленные 50г	1	Неклассифицированные/default	0	
68150	4607150530140	Колбаски салямки брауншвейгские с/к кронштадт 0.035	37056	Продукты питания (folder)/Снэки рыбные и мясные	14120	Эверест
1226928	4630007390048	Колбаски салямки брауншвейгские сырокопченые 35г мяг/уп	142954	Продукты питания (folder)/Колбасные изделия (folder)/Колбасные изделия	14120	Эверест
68151	4607150530102	Колбаски салямки классич 35г эверест	37056	Продукты питания (folder)/Снэки рыбные и мясные	14120	Эверест
1226931	460715053010	Колбаски салямки классич с/к кронштадт 0.035	142954	Продукты питания (folder)/Колбасные изделия (folder)/Колбасные изделия	0	
68152	4607150530126	Колбаски салямки острые с/к 35г эверест	37056	Продукты питания (folder)/Снэки рыбные и мясные	14120	Эверест
729882	4630007390062	Колбаски салямки с/к 0.035 классические	37056	Продукты питания (folder)/Снэки рыбные и мясные	14120	Эверест
3355182	4607039388862	Колбаски свинокомплекс томский по-немецки с картофелем для жарки и гриля 500г тв/уп	1	Неклассифицированные/default	0	
3355183	4607039388879	Колбаски свинокомплекс томский свиные для жарки 500г тв/уп	1	Неклассифицированные/default	0	
2875542	4601374007563	Колбаски свиные 0.6	1	Неклассифицированные/default	0	
2875543	4607049746614	Колбаски свиные барбекю	1	Неклассифицированные/default	0	
2875544	4670002943313	Колбаски свиные к пиву охл лоток 400г Белгород	1	Неклассифицированные/default	746353	Мираторг
2875545	4670002943320	Колбаски свиные тирольские охл лоток 400г Белгород	1	Неклассифицированные/default	746353	Мираторг
2875165	4670020870738	Колбаски северо-запад гриль из свиного окорока полукопчные 400г	1	Неклассифицированные/default	0	
3355184	4670020870707	Колбаски северо-запад зальцбургские с перцем Чили полукопчные 400г	1	Неклассифицированные/default	0	
3355185	4631136292999	Колбаски северо-запад пикарди сырокопченые 150г	1	Неклассифицированные/default	0	
3355186	4631136293156	Колбаски северо-запад полянские полукопчные 270г	1	Неклассифицированные/default	0	
2875546	4631136292760	Колбаски северо-запад с сыром п/к 360г северо-запад	1	Неклассифицированные/default	0	
3355187	4670020870721	Колбаски северо-запад франкфурские полукопченые для гриля вак уп 400г	1	Неклассифицированные/default	0	
2875547	4607943496387	Колбаски северянка (охлажденное, 60)	1	Неклассифицированные/default	0	
3355188	4607164497521	Колбаски серышевский спасские 300г м/у	1	Неклассифицированные/default	0	
2875592	4607068322806	Колбаски сибмясо шашлычные для гриля из мяса птицы 400г м/уп	1	Неклассифицированные/default	0	
1226930	4751002200429	Колбаски сигары с/к елгавский гк 0.140	142954	Продукты питания (folder)/Колбасные изделия (folder)/Колбасные изделия	0	
3355189	4650062844119	Колбаски славянский швейцарские полукопченые вак уп 300г	1	Неклассифицированные/default	0	
2875548	4607100106982	Колбаски снедики из конины. изделие колбасное полукопченое, мясной продукт (газомодифицированная среда)	142954	Продукты питания (folder)/Колбасные изделия (folder)/Колбасные изделия	0	
2875549	4607100108566	Колбаски снедики с перчиком. изделие колбасное полукопченое из мяса птицы 1 сорта (газомодифицированная среда)	142954	Продукты питания (folder)/Колбасные изделия (folder)/Колбасные изделия	0	
2875550	4607100108559	Колбаски снедики с перчиком. изделие колбасное полукопченое из мяса птицы 1 сорта отличная закуска (газомодифицированная среда)	142954	Продукты питания (folder)/Колбасные изделия (folder)/Колбасные изделия	0	
2875551	4607100108580	Колбаски снедики с сыром. изделие колбасное полукопченое из мяса птицы 1 сорта (газомодифицированная среда)	142954	Продукты питания (folder)/Колбасные изделия (folder)/Колбасные изделия	0	
2875552	4607100108573	Колбаски снедики с сыром. изделие колбасное полукопченое из мяса птицы 1 сорта отличная закуска (газомодифицированная среда)	142954	Продукты питания (folder)/Колбасные изделия (folder)/Колбасные изделия	0	
2875553	4620767512729	Колбаски снеки с/к	1	Неклассифицированные/default	0	
3355190	5900562487002	Колбаски соколов к пиву французские 120г	1	Неклассифицированные/default	0	
3355191	4607024889640	Колбаски сочинский мк крымские полукопченые 200г	1	Неклассифицированные/default	0	
3355192	4630018740436	Колбаски сочинский мк пражские 200г м/у	1	Неклассифицированные/default	0	
3355193	4610011171338	Колбаски спагетти сырокопченые острые вак уп 100г	1	Неклассифицированные/default	0	
2875554	4670017633261	Колбаски станичные утиные п/к, монолит охлажденные	1	Неклассифицированные/default	0	
3355194	4670020870745	Колбаски старый пит кабаносы полукопченые вак уп 450г	1	Неклассифицированные/default	0	
2875555	4640012827644	Колбаски столичные полукопченые,мясной продукт катег в (газ)(н/о)	1	Неклассифицированные/default	0	
1226934	4770190066174	Колбаски суримия vici с сыром 100г	142954	Продукты питания (folder)/Колбасные изделия (folder)/Колбасные изделия	37382	VICI
2875556	4607083084208	Колбаски сызрань чоризо с\к, 160г	1	Неклассифицированные/default	0	
2761799	4640004761246	Колбаски сырокопченые кнуты с кунжутом 80г	142954	Продукты питания (folder)/Колбасные изделия (folder)/Колбасные изделия	0	
2761800	4640004761239	Колбаски сырокопченые кнуты с паприкой 80г	142954	Продукты питания (folder)/Колбасные изделия (folder)/Колбасные изделия	0	
2875557	4630033510014	Колбаски сырокопченые пикник, вак уп	1	Неклассифицированные/default	0	
2875558	4640012408645	Колбаски сырокопченые с дымком . мясной продукт. гусарские традиции	1	Неклассифицированные/default	0	
2875559	4670026481419	Колбаски сырокопченые с дымком тм гусарские традиции	1	Неклассифицированные/default	0	
2875560	4604800005010	Колбаски сырокопченые цыпочка, в вак. уп	1	Неклассифицированные/default	0	
2875561	4604800005027	Колбаски сырокопченые цыпочка, вал.	1	Неклассифицированные/default	0	
2875562	4670026481082	Колбаски сырокопченые чоризо. мясной продукт doypack 150г	1	Неклассифицированные/default	0	
2875563	4670026481105	Колбаски сырокопченые чоризо. мясной продукт. 150г	1	Неклассифицированные/default	0	
2875564	4607075155084	Колбаски сырые для пикника	1	Неклассифицированные/default	0	
3355195	4690411012936	Колбаски тавр чесночные полукопченные вак уп 250г	1	Неклассифицированные/default	0	
3355196	4680008711779	Колбаски таврия альпийские для жарки 600г пл/уп	1	Неклассифицированные/default	0	
3355197	4680008716941	Колбаски таврия венские для жарки 950г пл/ван	1	Неклассифицированные/default	0	
3355198	4680008713131	Колбаски таврия гриль из свинины 840г пл/ван	1	Неклассифицированные/default	0	
3355199	4680008711786	Колбаски таврия на углях из куриной грудки 600г пл/уп	1	Неклассифицированные/default	0	
3355200	4680008717153	Колбаски таврия октоберфест для жарки 840г пл/ван	1	Неклассифицированные/default	0	
3355201	4680008717146	Колбаски таврия чиполатта для жарки 840г пл/ван	1	Неклассифицированные/default	0	
2875565	4770645032112	Колбаски тай топ с/в в/с асс 0.050	1	Неклассифицированные/default	0	
2443843	4607139765969	Колбаски тарея из оленины с/к вак уп 60г норильский мпк	265594	Продукты питания (folder)/Колбасные изделия (folder)/Колбаса сырокопченая	2235851	Норильский МПК
3355202	4610008606836	Колбаски телец барбекю с копченой грудкой и сыром 370г	1	Неклассифицированные/default	0	
3355203	4680018883732	Колбаски телец барбекю с копченой грудкой и сыром вак уп 320г	1	Неклассифицированные/default	0	
3355204	4680018880304	Колбаски телец для гриля свиные 550г	1	Неклассифицированные/default	0	
3355205	4680018880274	Колбаски телец шашлычные 550г	1	Неклассифицированные/default	0	
729884	4751001132295	Колбаски телячьи н/о газ 460г гравендале	55924	Продукты питания (folder)/Колбасные изделия (folder)/Колбаса вареная	729883	Гравендале
2939447	4630013940183	Колбаски Тещины п/к	1	Неклассифицированные/default	0	
2875567	4607030204406	Колбаски тирольские полукопченые (10шт x 130г шт) зам чм	1	Неклассифицированные/default	0	
2875568	4607030200507	Колбаски тирольские полукопченые (3шт x 100г вес) зам	1	Неклассифицированные/default	0	
2875569	4606639032496	Колбаски тюрингские 100г вак уп зам	1	Неклассифицированные/default	0	
2875571	4606639032885	Колбаски тюрингские 240г охл мга	1	Неклассифицированные/default	0	
2875572	4607030200606	Колбаски тюрингские для жарки и гриля (2шт x 100г вес) зам	1	Неклассифицированные/default	0	
68153	4016826517109	Колбаски тюрингские ориг 500г хандшумахер	142954	Продукты питания (folder)/Колбасные изделия (folder)/Колбасные изделия	37472	Ничико
2875573	4670020870684	Колбаски тюрингские п/к с пикантным сыром 400г северо-запад	1	Неклассифицированные/default	0	
2875574	4680021252266	Колбаски тюрингские. мясные колбасные изделия вареные, катег б замороженные, 3шт по 100г	142954	Продукты питания (folder)/Колбасные изделия (folder)/Колбасные изделия	0	
2875575	4607162207801	Колбаски уикенд окраина. мясное колбасное изделие вареное катег а 400г шт	142954	Продукты питания (folder)/Колбасные изделия (folder)/Колбасные изделия	0	
2875576	4607162207818	Колбаски уикенд окраина. мясное колбасное изделие вареное катег а вес	142954	Продукты питания (folder)/Колбасные изделия (folder)/Колбасные изделия	0	
2875577	4680021250842	Колбаски уикенд окраина. мясное колбасное изделие вареное катег а замороженные, вес	142954	Продукты питания (folder)/Колбасные изделия (folder)/Колбасные изделия	0	
2875578	4680021252259	Колбаски улитка. мясные колбасные изделия вареные, катег б замороженные, 4шт по 100г	142954	Продукты питания (folder)/Колбасные изделия (folder)/Колбасные изделия	0	
2875579	4680021252242	Колбаски улитка. мясные колбасные изделия вареные, катег б замороженные, 8шт по 50г	142954	Продукты питания (folder)/Колбасные изделия (folder)/Колбасные изделия	0	
3355206	4607046340662	Колбаски уральская метелица для жарки 500г пл/уп	1	Неклассифицированные/default	0	
3355207	4607025432142	Колбаски уральские пельмени из рубленного мяса свинина говядина 600г мяг/уп	1	Неклассифицированные/default	0	
3355208	4607025438441	Колбаски уральские пельмени фермерские из говядины и свинины 500г на подложке	1	Неклассифицированные/default	0	
2731271	4640004763660	Колбаски филеево кнуты с/к 40г вак уп	142954	Продукты питания (folder)/Колбасные изделия (folder)/Колбасные изделия	0	
2761820	4640004760744	Колбаски филеево туристские с/к в/с вак уп 100г	330591	Продукты питания (folder)/Продукты питания	0	
2875580	4607030201252	Колбаски филейные (10шт x 100г вес) н/о зам	1	Неклассифицированные/default	0	
2875581	4607030204819	Колбаски филейные улитка (6шт x 130г шт) н/о зам чм	1	Неклассифицированные/default	0	
3355209	4607060943108	Колбаски филимонов элитные с сыром полукопченые 340г	1	Неклассифицированные/default	0	
2875582	4630005553247	Колбаски финские п/к вак уп 0.5кг шт привоз	1	Неклассифицированные/default	0	
3355210	4607098663504	Колбаски финские ягодки вак уп 300г	1	Неклассифицированные/default	0	
2731272	4607044667518	Колбаски фома лукич сырокоп бекон 60г	260335	Продукты питания (folder)/Снэки	0	
2731273	4607044667525	Колбаски фома лукич сырокоп перец Чили 60г	260335	Продукты питания (folder)/Снэки	0	
2716050	4607044667501	Колбаски фома лукич сырокоп сыр 60г	142954	Продукты питания (folder)/Колбасные изделия (folder)/Колбасные изделия	0	
2875583	4680021252235	Колбаски франконские (подкопченные). мясные колбасные изделия вареные, катег б замороженные, 5шт по 50г	142954	Продукты питания (folder)/Колбасные изделия (folder)/Колбасные изделия	0	
2875584	4607030200514	Колбаски франконские полукопченые (4шт x 50г вес) зам	1	Неклассифицированные/default	0	
2875585	4607030204635	Колбаски французские с дижонской горчицей вак уп кор. (шт. 360г)	1	Неклассифицированные/default	0	
68154	4008262070034	Колбаски харейко для жарки карри 375г вак уп	142954	Продукты питания (folder)/Колбасные изделия (folder)/Колбасные изделия	68055	Харейко
68155	4008262070003	Колбаски харейко для жарки по-американски 360г вак уп	142954	Продукты питания (folder)/Колбасные изделия (folder)/Колбасные изделия	68055	Харейко
68156	4008262070010	Колбаски харейко для жарки по-мексикански 360г вак уп	142954	Продукты питания (folder)/Колбасные изделия (folder)/Колбасные изделия	68055	Харейко
68157	4008262070058	Колбаски харейко для жарки по-немецки 360г вак уп	142954	Продукты питания (folder)/Колбасные изделия (folder)/Колбасные изделия	68055	Харейко
2875586	4607139765983	Колбаски хатыстах с/кв/у 0.06	1	Неклассифицированные/default	0	
2875587	4606979031654	Колбаски хворост мясной в/к защ.сред	1	Неклассифицированные/default	0	
3355211	4603802050974	Колбаски царицино грандэ пикантэ сырокопченые 1 сорт вак уп 250г	1	Неклассифицированные/default	0	
3355212	4670027700694	Колбаски чебаркульская птица купеческие для гриля 600г подложка	1	Неклассифицированные/default	0	
3355213	4670027700670	Колбаски чебаркульская птица по-крестьянски для гриля 600г подложка	1	Неклассифицированные/default	0	
3355214	4670027700687	Колбаски чебаркульская птица филейные для гриля 600г подложка	1	Неклассифицированные/default	0	
3355215	4607089698355	Колбаски черкизовские охотничьи полукопченые 230г	1	Неклассифицированные/default	0	
3355216	4680008710185	Колбаски чесночные полукопченые вес таврия	1	Неклассифицированные/default	0	
2875588	4650055438899	Колбаски чешские кмк 370г (зам.упак.коробка),1шт	1	Неклассифицированные/default	0	
2443845	4607139765952	Колбаски чибичете из оленины с/к вак уп 60г норильский мпк	265594	Продукты питания (folder)/Колбасные изделия (folder)/Колбаса сырокопченая	2235851	Норильский МПК
1827476	4601558028759	Колбаски чики-Чили с/к 180г	265594	Продукты питания (folder)/Колбасные изделия (folder)/Колбаса сырокопченая	0	
