ID	UPCEAN	Name	CategoryID	CategoryName	BrandID	BrandName
200438	5010102110199	Robinsons frt&bar org pm119	17371	Продукты питания (folder)/Напитки безалкогольные/Напитки	409801	Robinsons
200439	5010102110212	Robinsons frt&bar pea pm119	17371	Продукты питания (folder)/Напитки безалкогольные/Напитки	409801	Robinsons
200440	5010102110205	Robinsons frt&bar s/f pm119	17371	Продукты питания (folder)/Напитки безалкогольные/Напитки	409801	Robinsons
409817	5010102101791	Robinsons Fruit barley Grapefruit no added sugar 1l	17371	Продукты питания (folder)/Напитки безалкогольные/Напитки	409801	Robinsons
200277	5000147030583	Robinsons Fruit barley Orange no added sugar 1l	1	Неклассифицированные/default	409801	Robinsons
200280	5000147030699	Robinsons Fruit barley Peach no added sugar 1l	1	Неклассифицированные/default	409801	Robinsons
409818	5010102107403	Robinsons Fruit barley strawberry kiwi 1l	17371	Продукты питания (folder)/Напитки безалкогольные/Напитки	409801	Robinsons
409819	5010102102248	Robinsons Fruit barley summerfruits 2l	17371	Продукты питания (folder)/Напитки безалкогольные/Напитки	409801	Robinsons
1590983	5010693603179	Robinsons Fruit shoo	30752	Продукты питания (folder)/Мороженое	0	
190120	5010102110984	Robinsons Fruit shoot 100% Apple	17374	Продукты питания (folder)/Напитки безалкогольные/Сок	409801	Robinsons
190121	5010102110977	Robinsons Fruit shoot 100% blk&app	17374	Продукты питания (folder)/Напитки безалкогольные/Сок	409801	Robinsons
190122	5010102110960	Robinsons Fruit shoot 100% Juice Orange 250ml	17374	Продукты питания (folder)/Напитки безалкогольные/Сок	409801	Robinsons
646252	5010102111493	Robinsons Fruit shoot 4pk org&pea 4x 200ml	1	Неклассифицированные/default	409801	Robinsons
646333	5010102111509	Robinsons Fruit shoot 4pk pm b/crt&ap 4x 200ml	17374	Продукты питания (folder)/Напитки безалкогольные/Сок	409801	Robinsons
1590979	5010102112087	Robinsons Fruit shoot aardbei/framboos 4st	1	Неклассифицированные/default	409801	Robinsons
409821	5010102109353	Robinsons Fruit shoot ap/bkct ls24 24x 200ml	17371	Продукты питания (folder)/Напитки безалкогольные/Напитки	409801	Robinsons
646334	5010102108660	Robinsons Fruit shoot app/blkc pm60 300ml	17374	Продукты питания (folder)/Напитки безалкогольные/Сок	409801	Robinsons
190124	5010102107564	Robinsons Fruit shoot Apple bottle 300ml	17371	Продукты питания (folder)/Напитки безалкогольные/Напитки	409801	Robinsons
996427	50412730	Robinsons Fruit shoot Apple low sugar 275ml	1	Неклассифицированные/default	409801	Robinsons
2669051	5010102148895	Robinsons Fruit shoot Apple low sugar 275ml #2	17371	Продукты питания (folder)/Напитки безалкогольные/Напитки	409801	Robinsons
190123	5010102107571	Robinsons Fruit shoot Apple low sugar 300ml	17371	Продукты питания (folder)/Напитки безалкогольные/Напитки	409801	Robinsons
409822	5010102107618	Robinsons Fruit shoot Apple low sugar 4pk 4x 200ml	17371	Продукты питания (folder)/Напитки безалкогольные/Напитки	409801	Robinsons
2669052	5010102135031	Robinsons Fruit shoot Apple low sugar 4pk 4x 200ml #2	17371	Продукты питания (folder)/Напитки безалкогольные/Напитки	409801	Robinsons
409823	5010102107632	Robinsons Fruit shoot Apple low sugar 8x 200ml	17371	Продукты питания (folder)/Напитки безалкогольные/Напитки	409801	Robinsons
2669053	5010102132467	Robinsons Fruit shoot Apple&blackcurant low sugar 8pk 8x 200ml	17371	Продукты питания (folder)/Напитки безалкогольные/Напитки	409801	Robinsons
1116559	50412716	Robinsons Fruit shoot Apple/blackcurrant low sugar 275ml	894382	Продукты питания (folder)/Hot Food	409801	Robinsons
2669054	5010102148871	Robinsons Fruit shoot Apple/blackcurrant low sugar 275ml #2	17371	Продукты питания (folder)/Напитки безалкогольные/Напитки	409801	Robinsons
2669055	5010102132429	Robinsons Fruit shoot Apple/blackcurrant low sugar 4pk 4x 200ml	17371	Продукты питания (folder)/Напитки безалкогольные/Напитки	409801	Robinsons
2669114	5010102220720	Robinsons Fruit shoot Apple/blackcurrant ls pm69p 275ml #2	17371	Продукты питания (folder)/Напитки безалкогольные/Напитки	409801	Robinsons
409824	5010102105409	Robinsons Fruit shoot Black Apple 4x 200ml	17371	Продукты питания (folder)/Напитки безалкогольные/Напитки	409801	Robinsons
409825	5010102105447	Robinsons Fruit shoot blackcurrant and Apple 8x 200ml	17371	Продукты питания (folder)/Напитки безалкогольные/Напитки	409801	Robinsons
190126	5010102105379	Robinsons Fruit shoot blackcurrant and Apple no added sugar 300ml	17371	Продукты питания (folder)/Напитки безалкогольные/Напитки	409801	Robinsons
409847	5010102105416	Robinsons Fruit shoot blackcurrant and Apple no added sugar 4x 200ml	17371	Продукты питания (folder)/Напитки безалкогольные/Напитки	409801	Robinsons
409826	5010102105454	Robinsons Fruit shoot blackcurrant and Apple no added sugar 8x 200ml	17371	Продукты питания (folder)/Напитки безалкогольные/Напитки	409801	Robinsons
596818	5010102113541	Robinsons Fruit shoot blk&ap l/s pm	1	Неклассифицированные/default	409801	Robinsons
996428	50412761	Robinsons Fruit shoot blk/app 275ml	1	Неклассифицированные/default	409801	Robinsons
409827	5010102115446	Robinsons Fruit shoot h apl/rby 4 4x 350ml	17371	Продукты питания (folder)/Напитки безалкогольные/Напитки	409801	Robinsons
409828	5010102115439	Robinsons Fruit shoot h bkcrnt 4pk 4x 350ml	17371	Продукты питания (folder)/Напитки безалкогольные/Напитки	409801	Robinsons
409829	5010102115422	Robinsons Fruit shoot h org/Pap 4 4x 350ml	17371	Продукты питания (folder)/Напитки безалкогольные/Напитки	409801	Robinsons
369383	5010102112858	Robinsons Fruit shoot h20 Apple 4 pack	17371	Продукты питания (folder)/Напитки безалкогольные/Напитки	409801	Robinsons
646335	5010102111769	Robinsons Fruit shoot h20 b/crt pm60 300ml	17374	Продукты питания (folder)/Напитки безалкогольные/Сок	409801	Robinsons
369384	5010102112841	Robinsons Fruit shoot h20 blackcurrant 4 pack	17371	Продукты питания (folder)/Напитки безалкогольные/Напитки	409801	Robinsons
369385	5010102112834	Robinsons Fruit shoot h20 Orange 4 pack	17371	Продукты питания (folder)/Напитки безалкогольные/Напитки	409801	Robinsons
409830	5010102115415	Robinsons Fruit shoot hydr ap/rbry 350ml	17371	Продукты питания (folder)/Напитки безалкогольные/Напитки	409801	Robinsons
409831	5010102115392	Robinsons Fruit shoot hydr org/Pap 350ml	17371	Продукты питания (folder)/Напитки безалкогольные/Напитки	409801	Robinsons
409832	5010102115408	Robinsons Fruit shoot Hydro bkcrnt 350ml	17371	Продукты питания (folder)/Напитки безалкогольные/Напитки	409801	Robinsons
190125	5010102105362	Robinsons Fruit shoot Juice drink - blackcurrant&Apple 300ml	17371	Продукты питания (folder)/Напитки безалкогольные/Напитки	409801	Robinsons
190133	5010102109131	Robinsons Fruit shoot Juice drink - Tropical 300ml	17371	Продукты питания (folder)/Напитки безалкогольные/Напитки	409801	Robinsons
1590874	50412815	Robinsons Fruit shoot l/s summer Fruit pm69p 275ml	1	Неклассифицированные/default	2669113	Robs
905865	5010693603148	Robinsons Fruit shoot lollies	1	Неклассифицированные/default	0	
1590875	50412792	Robinsons Fruit shoot ls Orange pm69p 275ml	1	Неклассифицированные/default	2669113	Robs
409833	5010102112988	Robinsons Fruit shoot my-5 Apple and Black-currant 4x 200ml	17371	Продукты питания (folder)/Напитки безалкогольные/Напитки	409801	Robinsons
369386	5010102112971	Robinsons Fruit shoot my-5 Apple and pear 4x 200ml	17371	Продукты питания (folder)/Напитки безалкогольные/Напитки	409801	Robinsons
409837	5010102112964	Robinsons Fruit shoot my-5 Orange&pineapple 4x 200ml	17371	Продукты питания (folder)/Напитки безалкогольные/Напитки	409801	Robinsons
409834	5010102112957	Robinsons Fruit shoot my5 ap/bkcrt 200ml	17371	Продукты питания (folder)/Напитки безалкогольные/Напитки	409801	Robinsons
409835	5010102112940	Robinsons Fruit shoot my5 ap/pear 200ml	17371	Продукты питания (folder)/Напитки безалкогольные/Напитки	409801	Robinsons
409836	5010102112933	Robinsons Fruit shoot my5 or/pine 200ml	17371	Продукты питания (folder)/Напитки безалкогольные/Напитки	409801	Robinsons
190127	5010102110175	Robinsons Fruit shoot Natural blackcurrant 300ml	17371	Продукты питания (folder)/Напитки безалкогольные/Напитки	409801	Robinsons
190128	5010102110168	Robinsons Fruit shoot Natural Orange 300ml	17371	Продукты питания (folder)/Напитки безалкогольные/Напитки	409801	Robinsons
1472700	699632001112	Robinsons Fruit shoot no added sugar Apple	1	Неклассифицированные/default	409801	Robinsons
1472698	699632001136	Robinsons Fruit shoot no added sugar strawberry&Raspberry	1	Неклассифицированные/default	409801	Robinsons
996429	50412754	Robinsons Fruit shoot Orange 275ml	1	Неклассифицированные/default	409801	Robinsons
646337	5010102112001	Robinsons Fruit shoot Orange 300ml	1	Неклассифицированные/default	409801	Robinsons
409838	5010102111950	Robinsons Fruit shoot Orange 8x 200ml	17371	Продукты питания (folder)/Напитки безалкогольные/Напитки	409801	Robinsons
646338	5010102112254	Robinsons Fruit shoot Orange drink 300ml	17374	Продукты питания (folder)/Напитки безалкогольные/Сок	409801	Robinsons
996430	5010102113534	Robinsons Fruit shoot Orange l/sgr	17371	Продукты питания (folder)/Напитки безалкогольные/Напитки	409801	Robinsons
409839	5010102111998	Robinsons Fruit shoot Orange low sugar 24pk 24x 200ml	17371	Продукты питания (folder)/Напитки безалкогольные/Напитки	409801	Robinsons
996431	50412709	Robinsons Fruit shoot Orange low sugar 275ml	1	Неклассифицированные/default	409801	Robinsons
2669056	5010102148178	Robinsons Fruit shoot Orange low sugar 275ml #2	17371	Продукты питания (folder)/Напитки безалкогольные/Напитки	409801	Robinsons
409840	5010102112018	Robinsons Fruit shoot Orange low sugar 300ml	17371	Продукты питания (folder)/Напитки безалкогольные/Напитки	409801	Robinsons
409841	5010102111929	Robinsons Fruit shoot Orange low sugar 4pk 4x 200ml	17371	Продукты питания (folder)/Напитки безалкогольные/Напитки	409801	Robinsons
2669057	5010102142862	Robinsons Fruit shoot Orange low sugar 4pk 4x 200ml #2	17371	Продукты питания (folder)/Напитки безалкогольные/Напитки	409801	Robinsons
409842	5010102111967	Robinsons Fruit shoot Orange low sugar 8pk 8x 200ml	17371	Продукты питания (folder)/Напитки безалкогольные/Напитки	409801	Robinsons
2669058	5010102142916	Robinsons Fruit shoot Orange low sugar 8pk 8x 200ml #2	17371	Продукты питания (folder)/Напитки безалкогольные/Напитки	409801	Robinsons
2669115	5010102220713	Robinsons Fruit shoot Orange ls pm69p 275ml	17371	Продукты питания (folder)/Напитки безалкогольные/Напитки	409801	Robinsons
646336	5010102108653	Robinsons Fruit shoot Orange Peach pm60 300ml	17374	Продукты питания (folder)/Напитки безалкогольные/Сок	409801	Robinsons
3196722	699632002812	Robinsons Fruit shoot Orange&mango	330591	Продукты питания (folder)/Продукты питания	409801	Robinsons
190129	5010102105348	Robinsons Fruit shoot Orange&Peach bottle 300ml	17371	Продукты питания (folder)/Напитки безалкогольные/Напитки	409801	Robinsons
190130	5010102105355	Robinsons Fruit shoot Orange+Peach sf 300ml	17371	Продукты питания (folder)/Напитки безалкогольные/Напитки	409801	Robinsons
2669049	5010102118188	Robinsons Fruit shoot Peach&mango 4pk 4x 200ml	17371	Продукты питания (folder)/Напитки безалкогольные/Напитки	409801	Robinsons
2669050	5010102222007	Robinsons Fruit shoot Peach&mango 4pk 4x 200ml #2	17371	Продукты питания (folder)/Напитки безалкогольные/Напитки	409801	Robinsons
2669059	50413607	Robinsons Fruit shoot Peach&mango low sugar 275ml	17371	Продукты питания (folder)/Напитки безалкогольные/Напитки	409801	Robinsons
2669060	5010102221987	Robinsons Fruit shoot Peach&mango low sugar 275ml #2	17371	Продукты питания (folder)/Напитки безалкогольные/Напитки	409801	Robinsons
1590980	5010102112070	Robinsons Fruit shoot sinaasappel 4st	1	Неклассифицированные/default	409801	Robinsons
190132	5010102107144	Robinsons Fruit shoot strawberry bottle 300ml	17371	Продукты питания (folder)/Напитки безалкогольные/Напитки	409801	Robinsons
190131	5010102107151	Robinsons Fruit shoot strawberry nas 300ml	17371	Продукты питания (folder)/Напитки безалкогольные/Напитки	409801	Robinsons
646339	5010102112261	Robinsons Fruit shoot strawberry&Raspberry 300ml	17374	Продукты питания (folder)/Напитки безалкогольные/Сок	409801	Robinsons
2669117	5010102118270	Robinsons Fruit shoot strawbrainy 4x 200ml	17371	Продукты питания (folder)/Напитки безалкогольные/Напитки	409801	Robinsons
2669118	5010102222397	Robinsons Fruit shoot strawbrainy 4x 200ml #2	17371	Продукты питания (folder)/Напитки безалкогольные/Напитки	409801	Robinsons
996432	50412723	Robinsons Fruit shoot summer fruits low sugar 275ml	1	Неклассифицированные/default	409801	Robinsons
2669061	5010102148888	Robinsons Fruit shoot summer fruits low sugar 275ml #2	17371	Продукты питания (folder)/Напитки безалкогольные/Напитки	409801	Robinsons
409844	5010102111936	Robinsons Fruit shoot summer fruits low sugar 4pk 4x 200ml	17371	Продукты питания (folder)/Напитки безалкогольные/Напитки	409801	Robinsons
2669062	5010102142879	Robinsons Fruit shoot summer fruits low sugar 4pk 4x 200ml #2	17371	Продукты питания (folder)/Напитки безалкогольные/Напитки	409801	Robinsons
2669116	5010102220737	Robinsons Fruit shoot summerfruit ls pm69p 275ml	17371	Продукты питания (folder)/Напитки безалкогольные/Напитки	409801	Robinsons
409843	5010102112025	Robinsons Fruit shoot summerfruits low sugar 300ml	17371	Продукты питания (folder)/Напитки безалкогольные/Напитки	409801	Robinsons
409845	5010102111974	Robinsons Fruit shoot summerfruits low sugar 8pk 8x 200ml	17371	Продукты питания (folder)/Напитки безалкогольные/Напитки	409801	Robinsons
996433	50412747	Robinsons Fruit shoot Tropical low sugar 275ml	1	Неклассифицированные/default	409801	Robinsons
2669063	5010102148901	Robinsons Fruit shoot Tropical low sugar 275ml #2	17371	Продукты питания (folder)/Напитки безалкогольные/Напитки	409801	Robinsons
409846	5010102109155	Robinsons Fruit shoot Tropical no added sugar 8x 200ml	17371	Продукты питания (folder)/Напитки безалкогольные/Напитки	409801	Robinsons
2086197	699632002478	Robinsons Fruit shoot Wild berry grape plastic 10.1floz	1	Неклассифицированные/default	409801	Robinsons
3196723	699632002744	Robinsons Fruit shoot, flavored Juice drink, berry burst	330591	Продукты питания (folder)/Продукты питания	409801	Robinsons
2086195	699632002263	Robinsons Fruit shoot, Juice drink, strawberry and grape plastic 10.1floz	1	Неклассифицированные/default	409801	Robinsons
3196724	699632002997	Robinsons Fruit shoot, Juice drink, strawberry&Raspberry	330591	Продукты питания (folder)/Продукты питания	409801	Robinsons
190112	5010102109346	Robinsons Fruit Spring app/cranberry 440ml	17371	Продукты питания (folder)/Напитки безалкогольные/Напитки	409801	Robinsons
646340	5010102112391	Robinsons Fruit squash app&blkpm119	17374	Продукты питания (folder)/Напитки безалкогольные/Сок	409801	Robinsons
1590977	5010102117075	Robinsons Fruit squash Orange pm1.49 1l	1	Неклассифицированные/default	409801	Robinsons
646341	5010102112384	Robinsons Fruit squash Orange pm119	17374	Продукты питания (folder)/Напитки безалкогольные/Сок	409801	Robinsons
200437	5010102107397	Robinsons Fruit squash s/fruits	17371	Продукты питания (folder)/Напитки безалкогольные/Напитки	409801	Robinsons
1116424	5000147927050	Robinsons Fruit&barley Orange 1l	1	Неклассифицированные/default	409801	Robinsons
2669064	5000147927081	Robinsons Fruit&barley Peach 1l	17371	Продукты питания (folder)/Напитки безалкогольные/Напитки	409801	Robinsons
2669065	5010102127173	Robinsons Fruit&barley pink Grapefruit nas 1l	17371	Продукты питания (folder)/Напитки безалкогольные/Напитки	409801	Robinsons
2669066	5000147927074	Robinsons Fruit&barley summer fruits 1l	17371	Продукты питания (folder)/Напитки безалкогольные/Напитки	409801	Robinsons
4629564	736899110321	Robinsons Garden (DVD) (ws)	1	Неклассифицированные/default	0	
1590984	5015759001111	Robinsons great british ginger	22186	Продукты питания (folder)/Алкогольные напитки/Пиво	0	
2827200	5015759004877	Robinsons hallowed glass 11.2 floz	1	Неклассифицированные/default	0	
200441	5010102103412	Robinsons high Juice Orange	17371	Продукты питания (folder)/Напитки безалкогольные/Напитки	409801	Robinsons
2827201	5015759004754	Robinsons iron maiden trooper metal 500ml	1	Неклассифицированные/default	0	
2669067	699632000665	Robinsons Juice aple blckcrrnt squash	1	Неклассифицированные/default	409801	Robinsons
3196725	699632003024	Robinsons Juice drink Blend	17371	Продукты питания (folder)/Напитки безалкогольные/Напитки	409801	Robinsons
2669068	5010102118034	Robinsons kids toffee/Apple nas 1l	17371	Продукты питания (folder)/Напитки безалкогольные/Напитки	409801	Robinsons
2669069	5010102221499	Robinsons kids toffee/Apple nas 1l #2	17371	Продукты питания (folder)/Напитки безалкогольные/Напитки	409801	Robinsons
2669070	5010102118058	Robinsons kids Tropical twister nas 1l	17371	Продукты питания (folder)/Напитки безалкогольные/Напитки	409801	Robinsons
2669071	5010102221512	Robinsons kids Tropical twister nas 1l #2	17371	Продукты питания (folder)/Напитки безалкогольные/Напитки	409801	Robinsons
2669072	5000147927463	Robinsons Lemon nas 1l	17371	Продукты питания (folder)/Напитки безалкогольные/Напитки	409801	Robinsons
2669073	5010102118300	Robinsons Lemon&mango nas 1l	17371	Продукты питания (folder)/Напитки безалкогольные/Напитки	409801	Robinsons
2669074	5010102222250	Robinsons Lemon&mango nas 1l #2	17371	Продукты питания (folder)/Напитки безалкогольные/Напитки	409801	Robinsons
2669075	5010102118324	Robinsons mango/pineapple&passionfruit nas 1l	17371	Продукты питания (folder)/Напитки безалкогольные/Напитки	409801	Robinsons
2669076	5010102222274	Robinsons mango/pineapple&passionfruit nas 1l #2	17371	Продукты питания (folder)/Напитки безалкогольные/Напитки	409801	Robinsons
4629565	5010102109643	Robinsons n added sugar Fruit&barley Apple&pear 1l	1	Неклассифицированные/default	0	
200443	5010102103931	Robinsons nas Orange pm	17371	Продукты питания (folder)/Напитки безалкогольные/Напитки	409801	Robinsons
1472701	699632000856	Robinsons naturally berry flavored Juice plastic 10.1oz	1	Неклассифицированные/default	409801	Robinsons
646343	5010102112414	Robinsons no added sugar app&blk pm119	17374	Продукты питания (folder)/Напитки безалкогольные/Сок	409801	Robinsons
646344	5000147030941	Robinsons no added sugar app/blk 3l	17374	Продукты питания (folder)/Напитки безалкогольные/Сок	409801	Robinsons
646345	01825436	Robinsons no added sugar Apple&blackcurrant 1l	17374	Продукты питания (folder)/Напитки безалкогольные/Сок	409801	Robinsons
646346	01303511	Robinsons no added sugar Apple&blackcurrant 4l	17374	Продукты питания (folder)/Напитки безалкогольные/Сок	409801	Robinsons
409820	5010102109636	Robinsons no added sugar Fruit&barley Tropical 1l	17371	Продукты питания (folder)/Напитки безалкогольные/Напитки	409801	Robinsons
646347	5000147031092	Robinsons no added sugar Lemon 4l	17374	Продукты питания (folder)/Напитки безалкогольные/Сок	409801	Robinsons
200272	5000147030651	Robinsons no added sugar Lemon drink 1l	1	Неклассифицированные/default	409801	Robinsons
646348	5000147030996	Robinsons no added sugar Orange 4l	17374	Продукты питания (folder)/Напитки безалкогольные/Сок	409801	Robinsons
200273	5000147030262	Robinsons no added sugar Orange and mango drink 1l	1	Неклассифицированные/default	409801	Robinsons
200279	5000147030125	Robinsons no added sugar Orange drink 1l	1	Неклассифицированные/default	409801	Robinsons
409848	5000147030934	Robinsons no added sugar Orange drink 3 litre	17371	Продукты питания (folder)/Напитки безалкогольные/Напитки	409801	Robinsons
409849	5010102110410	Robinsons no added sugar Orange pineapple 3l	17371	Продукты питания (folder)/Напитки безалкогольные/Напитки	409801	Robinsons
200274	5000147030002	Robinsons no added sugar Orange pineapple drink 1l	1	Неклассифицированные/default	409801	Robinsons
646349	5010102112407	Robinsons no added sugar Orange pm119	17374	Продукты питания (folder)/Напитки безалкогольные/Сок	409801	Robinsons
1590985	5015759000824	Robinsons Old tom chocolate glass 11.2floz	1	Неклассифицированные/default	0	
1590986	5015759000626	Robinsons Old tom ginger glass 11.2floz	1	Неклассифицированные/default	0	
1590987	5015759000237	Robinsons Old tom glass 11.2floz	1	Неклассифицированные/default	0	
646350	5010102116450	Robinsons Orange 1l pm139	17374	Продукты питания (folder)/Напитки безалкогольные/Сок	409801	Robinsons
200276	5000147030408	Robinsons Orange Fruit squash 2l	1	Неклассифицированные/default	409801	Robinsons
1590981	5010102113886	Robinsons Orange nas + 25% 1.25l	1	Неклассифицированные/default	409801	Robinsons
