ID	UPCEAN	Name	CategoryID	CategoryName	BrandID	BrandName
3128439	688267041372	Harvest pumpkin Butter Spread	330591	Продукты питания (folder)/Продукты питания	3001844	Ahold
4408543	725140605020	Harvest pumpkin scarecrow 1ct	1	Неклассифицированные/default	0	
3128441	815712012926	Harvest pumpkin Spread	330591	Продукты питания (folder)/Продукты питания	0	
4408544	011546419249	Harvest pumpkn pot shippr 1ct	1	Неклассифицированные/default	0	
4408545	012495817964	Harvest rattan basket large	1	Неклассифицированные/default	0	
4408546	012495817957	Harvest rattan basket medium	1	Неклассифицированные/default	0	
4408547	012495817940	Harvest rattan basket small	1	Неклассифицированные/default	0	
4408548	034000445776	Harvest reese's pb cups 19.75oz	1	Неклассифицированные/default	0	
4408549	034000445769	Harvest reese's pb cups 19.75oz 24ct	1	Неклассифицированные/default	0	
603563	6251085000124	Harvest Rice 1kgm	1	Неклассифицированные/default	0	
603564	6251085000056	Harvest Rice medium grain 5kg	1	Неклассифицированные/default	0	
4408550	038459929832	Harvest road ?? pretzel minis (lunch pack) 1oz	1	Неклассифицированные/default	0	
4408551	038459020959	Harvest road baked crunchy curls made with real Cheese 12oz	1	Неклассифицированные/default	0	
3128442	038459000418	Harvest road, Peanut Butter filled pretzels	330591	Продукты питания (folder)/Продукты питания	0	
3128443	038459000494	Harvest road, Peanut Butter filled pretzels #2	330591	Продукты питания (folder)/Продукты питания	0	
3128444	765888122250	Harvest roast Green chile	330591	Продукты питания (folder)/Продукты питания	0	
3128445	898488000014	Harvest roast, slow roasted pumpkin seed, sea salt	330591	Продукты питания (folder)/Продукты питания	0	
3128446	898488000038	Harvest roast, slow roasted pumpkin seeds, chili Lime	330591	Продукты питания (folder)/Продукты питания	0	
3128447	898488000021	Harvest roast, slow roasted pumpkin seeds, garlic herb	330591	Продукты питания (folder)/Продукты питания	0	
3128448	898488000045	Harvest roast, slow roasted pumpkin seeds, Honey sesame	330591	Продукты питания (folder)/Продукты питания	0	
2332773	50226689	Harvest rolling machine	1	Неклассифицированные/default	0	
2332774	4006396021809	Harvest rolling papers	1	Неклассифицированные/default	0	
1488794	8906020460232	Harvest rusk 300g	1	Неклассифицированные/default	0	
3128449	021130062782	Harvest salad	330591	Продукты питания (folder)/Продукты питания	0	
4408552	011546419218	Harvest salt&pepper asst 1ct	1	Неклассифицированные/default	0	
3128450	078742111278	Harvest sandwich cookies	330591	Продукты питания (folder)/Продукты питания	0	
551194	060107896777	Harvest scarecrow 12inch	1	Неклассифицированные/default	0	
552830	060107138396	Harvest scarecrow broom 23.5inch	1	Неклассифицированные/default	0	
551714	060107138273	Harvest scarecrow on stand 16inch	1	Неклассифицированные/default	0	
4408553	011546171864	Harvest scarecrow/wreath asst 1ct	1	Неклассифицированные/default	0	
4408554	637596009829	Harvest scents 982 pumpkin 5inch ring	1	Неклассифицированные/default	0	
4408555	637596005494	Harvest scents bg549	1	Неклассифицированные/default	0	
4408556	023075087035	Harvest seeds lettuce Black seeded simspon 1g	1	Неклассифицированные/default	0	
4408557	755046105157	Harvest select catfish 15/lb p l catfish nuggets	1	Неклассифицированные/default	0	
2598517	829101000517	Harvest sensations french beans 16oz	2058983	Продукты питания (folder)/Fruits and Vegetables	0	
4408558	9300462041803	Harvest shepherd's pie 425g	1	Неклассифицированные/default	0	
1488822	708971904906	Harvest shortbread cookie platter	1	Неклассифицированные/default	0	
4408559	011546659393	Harvest slt/ppr shkrs pdq 1ct	1	Неклассифицированные/default	0	
4408560	639277872821	Harvest snacks Cheese puffs 9oz	1	Неклассифицированные/default	0	
4408561	639277194107	Harvest snacks chill'n ranch tortilla chips 9oz	1	Неклассифицированные/default	0	
3128451	071146002647	Harvest snaps, cinnamon&brown sugar, Green tea&lentil snaps	330591	Продукты питания (folder)/Продукты питания	0	
3128452	071146002852	Harvest snaps, Original Green pea crisps, lightly slated	330591	Продукты питания (folder)/Продукты питания	0	
4408562	875516005036	Harvest Spice fragranced botanical potpourri 12oz	1	Неклассифицированные/default	0	
4408563	047223404123	Harvest Spice jar 20oz	1	Неклассифицированные/default	0	
4408564	047223414955	Harvest Spice jar 3.5oz	1	Неклассифицированные/default	0	
4408565	062338795065	Harvest Spice scntd Oil strt 1ct	1	Неклассифицированные/default	0	
3670174	4012922847249	Harvest ssl sw,vanil, 100's h bevel f 20	116798	Табакокурение (folder)/Сигареты	375871	HARVEST
3670175	4012922847270	Harvest ssl sweet Cherry 100's h bevel f 20	116798	Табакокурение (folder)/Сигареты	375871	HARVEST
4408566	098552090358	Harvest stock theatre	1	Неклассифицированные/default	0	
3128453	853358000914	Harvest Stone, brown Rice, sesame&flax crackers, Original	330591	Продукты питания (folder)/Продукты питания	0	
3128454	853358000136	Harvest Stone, crispy Mix	330591	Продукты питания (folder)/Продукты питания	0	
3128455	853358000587	Harvest Stone, crispy Mix, Cheese	330591	Продукты питания (folder)/Продукты питания	0	
3128456	853358000570	Harvest Stone, crispy Mix, Original	330591	Продукты питания (folder)/Продукты питания	0	
2332775	4006396146175	Harvest strawberry roll tobaco 40g	1	Неклассифицированные/default	0	
1416771	709554905600	Harvest Sun chicken bouillon cubes 2.5oz 72g	1	Неклассифицированные/default	0	
1491057	709554905105	Harvest Sun Herbal bouillon cubes 66g	1	Неклассифицированные/default	0	
4408567	7095549056062	Harvest Sun Organic chicken bouillon cubes 66g	1	Неклассифицированные/default	0	
551530	060107138228	Harvest sunflower pick 15.5inch	1	Неклассифицированные/default	0	
3128457	709351000522	Harvest supreme	330591	Продукты питания (folder)/Продукты питания	0	
603565	612681249014	Harvest sweet banana truffles 3oz	1	Неклассифицированные/default	0	
603566	612681247010	Harvest sweet Blueberry truffles 3o	1	Неклассифицированные/default	0	
603567	612681242015	Harvest sweet key Lime truffles 3oz	1	Неклассифицированные/default	0	
603568	612681240011	Harvest sweet Lemon truffles 3oz	1	Неклассифицированные/default	0	
603569	612681246013	Harvest sweet Orange truffles 3oz	1	Неклассифицированные/default	0	
603570	612681245016	Harvest sweet Peach truffles 3oz	1	Неклассифицированные/default	0	
603571	612681243012	Harvest sweet rasp truffles 3oz	1	Неклассифицированные/default	0	
603572	612681244019	Harvest sweet strawberry truffles 3oz	1	Неклассифицированные/default	0	
2598519	612681221010	Harvest sweets choc drk cvrd cranberries	1	Неклассифицированные/default	2598518	Harvest Sweets
2598520	612681222024	Harvest sweets choc drk cvrd ky lm mango	1	Неклассифицированные/default	2598518	Harvest Sweets
2598521	612681224035	Harvest sweets choc drk cvrd strawberry	1	Неклассифицированные/default	2598518	Harvest Sweets
2598522	612681211011	Harvest sweets choc mlk cvrd cranberries	1	Неклассифицированные/default	2598518	Harvest Sweets
2598523	612681218188	Harvest sweets choc mlk hlday cherries	1	Неклассифицированные/default	2598518	Harvest Sweets
2598524	612681247027	Harvest sweets truffle drk blubrry	1	Неклассифицированные/default	2598518	Harvest Sweets
2598525	612681246020	Harvest sweets truffle drk Orange	1	Неклассифицированные/default	2598518	Harvest Sweets
2598526	612681243029	Harvest sweets truffle drk Raspberry	1	Неклассифицированные/default	2598518	Harvest Sweets
2598527	612681242022	Harvest sweets truffle mlk keylime	1	Неклассифицированные/default	2598518	Harvest Sweets
2598528	612681244026	Harvest sweets truffle mlk strawberry	1	Неклассифицированные/default	2598518	Harvest Sweets
3128458	612681317034	Harvest sweets, cookie snaps, Blueberry	330591	Продукты питания (folder)/Продукты питания	0	
3128459	612681328535	Harvest sweets, cookie snaps, chocolate Cherry almond	330591	Продукты питания (folder)/Продукты питания	0	
3128460	612681447533	Harvest sweets, Dark chocolate covered blueberries&almonds	330591	Продукты питания (folder)/Продукты питания	0	
3128461	612681442590	Harvest sweets, Dark chocolate, Milk chocolate, yogurt covered cranberries	330591	Продукты питания (folder)/Продукты питания	0	
3128462	612681448028	Harvest sweets, Milk chocolate, cherries	330591	Продукты питания (folder)/Продукты питания	0	
1488795	8906020460164	Harvest swt bun	1	Неклассифицированные/default	0	
4408568	012495818954	Harvest tab burner	1	Неклассифицированные/default	0	
4408569	820924018598	Harvest tablecloth	1	Неклассифицированные/default	0	
4408570	738329051228	Harvest time (DVD/1.33/eng-sub)	1	Неклассифицированные/default	0	
3128463	010995305622	Harvest time cupcakes	330591	Продукты питания (folder)/Продукты питания	0	
3128464	010995307602	Harvest time cupcakes #2	330591	Продукты питания (folder)/Продукты питания	0	
3128465	010995305479	Harvest time, 6 chocolate cup cakes, Butter Cream	330591	Продукты питания (folder)/Продукты питания	0	
3128466	010995305462	Harvest time, Gold cupcakes	330591	Продукты питания (folder)/Продукты питания	0	
375886	9300462042404	Harvest tortellini bolognese 425g	1	Неклассифицированные/default	0	
3128467	637480041188	Harvest trail bar	330591	Продукты питания (folder)/Продукты питания	0	
3128468	637480041287	Harvest trail bar #2	330591	Продукты питания (folder)/Продукты питания	0	
3128469	637480041812	Harvest trail bar #3	330591	Продукты питания (folder)/Продукты питания	0	
3128470	637480045803	Harvest trail bar #4	330591	Продукты питания (folder)/Продукты питания	0	
3128471	637480045810	Harvest trail bar #5	330591	Продукты питания (folder)/Продукты питания	0	
3128472	637480045841	Harvest trail bar #6	330591	Продукты питания (folder)/Продукты питания	0	
3128473	637480045872	Harvest trail bars	330591	Продукты питания (folder)/Продукты питания	0	
3128474	637480045834	Harvest trail Dark chocolate Cherry&nuts bar	330591	Продукты питания (folder)/Продукты питания	0	
3128475	637480045827	Harvest trail vanilla Fruit&nut bar	330591	Продукты питания (folder)/Продукты питания	0	
3128476	086854046487	Harvest treats	330591	Продукты питания (folder)/Продукты питания	0	
1488823	5014673551702	Harvest Turkey crown	144932	Продукты питания (folder)/Полуфабрикаты	0	
2598529	023967024438	Harvest Twist napkin rings (set of 12)	1	Неклассифицированные/default	0	
3128477	031774386137	Harvest Valley Black beans	330591	Продукты питания (folder)/Продукты питания	0	
603574	031774353450	Harvest Valley creamed style corn exp 10/12	1	Неклассифицированные/default	0	
3128478	031774353108	Harvest Valley cut Green beans	330591	Продукты питания (folder)/Продукты питания	0	
3128479	031774353153	Harvest Valley cut wax beans	330591	Продукты питания (folder)/Продукты питания	0	
3128480	031774353252	Harvest Valley diced beets	330591	Продукты питания (folder)/Продукты питания	0	
3128481	031774353368	Harvest Valley seasoned Green beans	330591	Продукты питания (folder)/Продукты питания	0	
3128482	031774353146	Harvest Valley whole Green beans	330591	Продукты питания (folder)/Продукты питания	0	
3128483	031774358141	Harvest Valley whole Green beans #2	330591	Продукты питания (folder)/Продукты питания	0	
2332776	4006396144171	Harvest vanilla roll.tobacco 40g	1	Неклассифицированные/default	0	
4408571	021130156221	Harvest veg beef soup 8/25oz 25oz	1	Неклассифицированные/default	0	
191508	5350902006316	Harvest vegetable Oil 2l	1	Неклассифицированные/default	0	
1488824	207303000007	Harvest vegetable so	1	Неклассифицированные/default	0	
3670176	4006396078339	Harvest White ks h o f 20	116798	Табакокурение (folder)/Сигареты	375871	HARVEST
1488825	8906020460027	Harvest White small	1	Неклассифицированные/default	0	
4408572	300833049246	Harvest wildflower bush a/3 1ct	1	Неклассифицированные/default	0	
4408573	300833049314	Harvest wildflower bush a/3 1ct #2	1	Неклассифицированные/default	0	
603575	060107998136	Harvest window clings 12asst	1	Неклассифицированные/default	0	
4408574	047475875788	Harvest wreath assortm w/rack 1ct	1	Неклассифицированные/default	0	
603576	060107138235	Harvest wreath with scarecrow	1	Неклассифицированные/default	0	
552022	060107138419	Harvest wreath with scarecrow 17inch	1	Неклассифицированные/default	0	
1488826	785099074087	Harvest yam patties	1	Неклассифицированные/default	0	
4408575	034000047468	Harvest york miniatures 12oz	1	Неклассифицированные/default	0	
4408576	736680600123	Harvest your own gourmet mushrooms button mushrooms 5g	1	Неклассифицированные/default	0	
1488827	8906020460607	Harvest zo brd	1	Неклассифицированные/default	0	
1827541	4006396167750	Harvest табак фон айкен сигарет.кофе 40г	336038	Табакокурение (folder)/Табак	375871	HARVEST
4408580	028081006827	Harvest's best all Natural granola 16oz	1	Неклассифицированные/default	0	
3128484	709972505628	Harvest, all Natural beef jerky	330591	Продукты питания (folder)/Продукты питания	0	
1593790	033383536101	Harvest, idaho russet potatoes	1	Неклассифицированные/default	0	
3128485	023300401391	Harvest, Oyster crackers	330591	Продукты питания (folder)/Продукты питания	0	
3128486	039677613176	Harvest, sandwich bread	330591	Продукты питания (folder)/Продукты питания	0	
4408577	072087520207	Harvest26cntshri	1	Неклассифицированные/default	0	
3128487	856810006288	Harvested for you, Organic roasted and salted watermelon seeds	330591	Продукты питания (folder)/Продукты питания	0	
3670178	4607022745078	Harvester Wheat 0.5l j bo l z x	22186	Продукты питания (folder)/Алкогольные напитки/Пиво	3670177	HARVESTER (TOMSKOE PIVO)
375887	4809010955463	Harvester's brown Rice 5kg	1	Неклассифицированные/default	0	
375888	4809010955487	Harvester's jasmine Rice 5kg	1	Неклассифицированные/default	0	
1909598	4809010955456	Harvester's Rice brown 2kg/1	1	Неклассифицированные/default	0	
1909599	4809010955197	Harvester's Rice congee 5kg/1	1	Неклассифицированные/default	0	
1909600	4809010955258	Harvester's Rice dinorado sp 2kg/1	1	Неклассифицированные/default	0	
1909601	4809010955272	Harvester's Rice dnordo sp 10kg/1	1	Неклассифицированные/default	0	
1909602	4809010955265	Harvester's Rice dnordo spcl 5kg/1	1	Неклассифицированные/default	0	
1909603	4809010955944	Harvester's Rice dnrdo spcl 25kg/1	1	Неклассифицированные/default	0	
1909604	4809010955074	Harvester's Rice lng grain 10kg/1	1	Неклассифицированные/default	0	
1909605	4809010955357	Harvester's Rice lng grain 1kg/1	1	Неклассифицированные/default	0	
1909606	4809010955050	Harvester's Rice lng grain 2kg/1	1	Неклассифицированные/default	0	
1909607	4809010955067	Harvester's Rice lng grain 5kg/1	1	Неклассифицированные/default	0	
1909608	4809010955906	Harvester's Rice Long grn 25kg/1	1	Неклассифицированные/default	0	
1909609	4809010955036	Harvester's Rice premium 10kg/1	1	Неклассифицированные/default	0	
1909610	4809010955012	Harvester's Rice premium 2kg/1	1	Неклассифицированные/default	0	
1909611	4809010955029	Harvester's Rice premium 5kg/1	1	Неклассифицированные/default	0	
1909612	4809010955203	Harvester's Rice Red 5kg/4	1	Неклассифицированные/default	0	
1909613	4809010955708	Harvester's Rice samurice 2kg/1	1	Неклассифицированные/default	0	
1909614	4809010955661	Harvester's Rice samurice 5kg/1	1	Неклассифицированные/default	0	
1909624	4809010955715	Harvester's Rice shrt grn jap 2kg/1	1	Неклассифицированные/default	0	
1909615	4809010955722	Harvester's Rice shrtgrain jap 5kg/1	1	Неклассифицированные/default	0	
1909616	4809010955975	Harvester's Rice sndmng pr 800g/1	1	Неклассифицированные/default	0	
1909617	4809010955111	Harvester's Rice snndmng 10kg/1	1	Неклассифицированные/default	0	
1909618	4809010955593	Harvester's Rice snndmng 25kg/1	1	Неклассифицированные/default	0	
1909619	4809010955098	Harvester's Rice snndmng 2kg/1	1	Неклассифицированные/default	0	
1909620	4809010955104	Harvester's Rice snndmng 5kg/1	1	Неклассифицированные/default	0	
1909621	4809010955951	Harvester's Rice thai jasm 25kg/1	1	Неклассифицированные/default	0	
1909622	4809010955470	Harvester's Rice thai Jasmin 2kg/1	1	Неклассифицированные/default	0	
1909623	4809010955494	Harvester's Rice thai jsmn 10kg/1	1	Неклассифицированные/default	0	
4408578	751937106128	Harvester: camper van landingman	1	Неклассифицированные/default	0	
1488828	5010217095572	Harvestime w/bread 800g	622408	Продукты питания (folder)/Бакалея	0	
4408579	9780140230277	Harvesting the heart: a novel (paperback)	1	Неклассифицированные/default	0	
2803245	072745548291	Harvestla bnls breast indwrp 1.2 lb	1	Неклассифицированные/default	0	
2803246	072745548659	Harvestla bnls thighs 1.6 lb	1	Неклассифицированные/default	0	
2803247	072745549366	Harvestla chicken brst tenders 1 lb	1	Неклассифицированные/default	0	
2803248	072745548086	Harvestla chicken drumsticks 1.8 lb	1	Неклассифицированные/default	0	
2803249	072745546457	Harvestla chicken thighs 2.2 lb	1	Неклассифицированные/default	0	
2803250	072745548109	Harvestla chicken wings 2.1 lb	1	Неклассифицированные/default	0	
2803251	072745548055	Harvestla whole chicken 3.6 lb	1	Неклассифицированные/default	0	
3128489	205323005583	Harvestland chicken breast tenderloins	330591	Продукты питания (folder)/Продукты питания	3128488	Harvestland
3128490	205322808703	Harvestland chicken breasts	330591	Продукты питания (folder)/Продукты питания	3128488	Harvestland
3128491	205320105767	Harvestland chicken thighs, chicken	330591	Продукты питания (folder)/Продукты питания	3128488	Harvestland
3128492	203487318037	Harvestland Fresh chicken breasts	330591	Продукты питания (folder)/Продукты питания	3128488	Harvestland
3128493	205322909158	Harvestland Fresh chicken breasts, boneless, skinless	330591	Продукты питания (folder)/Продукты питания	3128488	Harvestland
3128494	205319405304	Harvestland Fresh chicken drumsticks	330591	Продукты питания (folder)/Продукты питания	3128488	Harvestland
3128495	205368011150	Harvestland Fresh Organic chicken	330591	Продукты питания (folder)/Продукты питания	3128488	Harvestland
3128496	205371109394	Harvestland Fresh Organic chicken #2	330591	Продукты питания (folder)/Продукты питания	3128488	Harvestland
1488829	067953010579	Harvestmoon conditio	1	Неклассифицированные/default	0	
4408581	078864180107	Harvey	1	Неклассифицированные/default	0	
4408582	096009286897	Harvey (DVD)	1	Неклассифицированные/default	0	
4408583	096009455095	Harvey (DVD/w/CD-greatest movie classics v02)	1	Неклассифицированные/default	0	
4408584	013388350049	Harvey birdman attorney at law (wii)	1	Неклассифицированные/default	0	
4408585	053939765922	Harvey birdman-attorney at law v02 (DVD/2 disc)	1	Неклассифицированные/default	0	
4408586	053939793024	Harvey birdman-attorney at law v03 (DVD/2 disc)	1	Неклассифицированные/default	0	
4408587	053939766424	Harvey birdman-attorney at law vols 1&2 (DVD/4 disc)-nla	1	Неклассифицированные/default	0	
4408588	883929025022	Harvey birdman-attorney at law vols 1-3 (DVD/3pk/6 disc)	1	Неклассифицированные/default	0	
1488830	4806509471312	Harvey bnna ross sft cndy 30's	23131	Продукты питания (folder)/Кондитерские изделия (folder)/Конфеты жевательные	0	
2803252	080686741022	Harvey bristol Cream shry 8.5% 1.00l	1	Неклассифицированные/default	0	
375890	080686741039	Harvey bristol Cream shry 8.5% 1.50l	78617	Продукты питания (folder)/Алкогольные напитки/Алкоголь	375889	Harveys Bristol
1488831	4806509471336	Harvey corn ross Soft candy 30's	23131	Продукты питания (folder)/Кондитерские изделия (folder)/Конфеты жевательные	0	
4408589	731455600025	Harvey danger - where have all the merrymakers gone?	1	Неклассифицированные/default	0	
4408590	643443114325	Harvey danger CD	1	Неклассифицированные/default	0	
4408591	9311697939575	Harvey Fresh 35% Apple&guava Juice drink 500ml	1	Неклассифицированные/default	0	
4408592	9311697590998	Harvey Fresh 35% Orange&passionfruit Juice drink 500ml	1	Неклассифицированные/default	0	
4408593	012569534834	Harvey girls (Classic musicals	1	Неклассифицированные/default	0	
4408594	793807002000	Harvey imports Lion lager	1	Неклассифицированные/default	0	
1909579	9311697103167	Harvey Juice Fresh 100%aplept 1l/12	1	Неклассифицированные/default	0	
1909580	9311697101309	Harvey Juice Fresh 100%Apple 2l/6	1	Неклассифицированные/default	0	
1909581	9311697103808	Harvey Juice Fresh 100%Grapefruit 1l/12	1	Неклассифицированные/default	0	
1909582	9311697100128	Harvey Juice Fresh 100%Orange 1l/12	1	Неклассифицированные/default	0	
1909583	9311697100159	Harvey Juice Fresh carrot 1l/12	1	Неклассифицированные/default	0	
1909584	9311697102092	Harvey Juice Fresh Grapefruit 2l/6	1	Неклассифицированные/default	0	
1909585	9311697100104	Harvey Juice Fresh100%Apple 1l/12	1	Неклассифицированные/default	0	
1909586	9311697101279	Harvey Juice Fresh100%Orange 2l/6	1	Неклассифицированные/default	0	
1909587	9311697101316	Harvey Juice Fresh100%Tropical 1l/12	1	Неклассифицированные/default	0	
1909588	9311697101293	Harvey Juice freshapple&blkc 2l/6	1	Неклассифицированные/default	0	
1909589	9311697102061	Harvey Juice freshorange&p/a 2l/6	1	Неклассифицированные/default	0	
1909590	9311697103150	Harvey Juice freshorangepet 1l/12	1	Неклассифицированные/default	0	
1909591	9311697102054	Harvey Juice freshornge&mango 2l/6	1	Неклассифицированные/default	0	
