ID	UPCEAN	Name	CategoryID	CategoryName	BrandID	BrandName
3333461	4620759083251	Капуста Золотой выбор с морковью по-корейски 350г	1	Неклассифицированные/default	0	
3333462	4607157380168	Капуста из погребка в маринаде с морковью и клюквой 500г пл/ст	1	Неклассифицированные/default	0	
3333463	4650056890948	Капуста кадушка по-корейски со сладким перцем 300г	1	Неклассифицированные/default	0	
3333464	4603003020448	Капуста каменная голова 0.3г	1	Неклассифицированные/default	0	
2867572	4620752481160	Капуста кваш по-гурийски 0.300	1	Неклассифицированные/default	0	
3333465	4607127591044	Капуста кваш с клюквой 0.5кг	1	Неклассифицированные/default	0	
2867574	4620752480187	Капуста кваш с морковью 0.300	1	Неклассифицированные/default	0	
3333466	4607127591051	Капуста кваш с яблоком 0.5кг	1	Неклассифицированные/default	0	
3333467	4607127591280	Капуста кваш сладкая 0.5кг	1	Неклассифицированные/default	0	
3333468	4607127590511	Капуста кваш со свеклой 0.5кг	1	Неклассифицированные/default	0	
2867575	4620752480804	Капуста квашен с морк 1.0	1	Неклассифицированные/default	0	
1219008	4820101790091	Капуста квашеная (ведро) 1000г	1	Неклассифицированные/default	0	
1670035	4670000570894	Капуста квашеная (мистер) б/к классическая 300г	988413	Продукты питания (folder)/Фрукты и овощи	0	
3333469	4607127590535	Капуста квашеная 0.5кг	1	Неклассифицированные/default	0	
2867576	4605974000221	Капуста квашеная 0.600	1	Неклассифицированные/default	0	
2867579	4607140560126	Капуста квашеная 0.800 #3	1	Неклассифицированные/default	0	
2867580	4607170540259	Капуста квашеная 0.800 #4	1	Неклассифицированные/default	0	
63157	4612729470017	Капуста квашеная 0.9кг ведро	37536	Продукты питания (folder)/Овощи соленые и квашеные	63156	Фабрика Домашних Солений
2867581	4620014090031	Капуста квашеная 10кг	1	Неклассифицированные/default	0	
3333470	4620003490125	Капуста квашеная 1кг	1	Неклассифицированные/default	0	
3333471	4607179351108	Капуста квашеная 1кг пл/вед	1	Неклассифицированные/default	0	
3333472	4612748371555	Капуста квашеная 200г	1	Неклассифицированные/default	0	
2728957	4607112481008	Капуста квашеная 250г	37536	Продукты питания (folder)/Овощи соленые и квашеные	0	
2867582	4665271751080	Капуста квашеная 450г п/б сила традиции	1	Неклассифицированные/default	0	
720967	4607015814217	Капуста квашеная 500г	37536	Продукты питания (folder)/Овощи соленые и квашеные	0	
3333473	4607127591006	Капуста квашеная 500г #2	1	Неклассифицированные/default	0	
3333474	4612748371562	Капуста квашеная 500г #3	1	Неклассифицированные/default	0	
3819119	4620016920695	Капуста квашеная 500г #4	273176	Продукты питания (folder)/Салат	0	
3819120	4680001890020	Капуста квашеная 500г #5	37536	Продукты питания (folder)/Овощи соленые и квашеные	0	
3333475	4607179351283	Капуста квашеная 500г с клюквой	1	Неклассифицированные/default	0	
3333476	4607179351276	Капуста квашеная 500г с яблоками	1	Неклассифицированные/default	0	
3333477	4607179351054	Капуста квашеная 500г слад перец	1	Неклассифицированные/default	0	
2728958	4620014090055	Капуста квашеная 700г /яблоко	37536	Продукты питания (folder)/Овощи соленые и квашеные	0	
3333478	4607127590580	Капуста квашеная 850г	1	Неклассифицированные/default	0	
3333479	4630012470018	Капуста квашеная 850г #2	1	Неклассифицированные/default	0	
720969	4607015814200	Капуста квашеная 950г	37536	Продукты питания (folder)/Овощи соленые и квашеные	0	
3333480	5901713003546	Капуста квашеная dawtona с морковью 900г с/б	1	Неклассифицированные/default	0	
3333481	4770583201755	Капуста квашеная kedainiu домашняя бочковая 900г	1	Неклассифицированные/default	3681044	KKF
3333482	4770583219088	Капуста квашеная kedainiu домашняя бочковая 900г #2	1	Неклассифицированные/default	0	
222061	5011424200056	Капуста квашеная krakus 460г ст/б	65	Продукты питания (folder)/Консервы (folder)/Консервы овощные	193881	KRAKUS
3333483	5902296001097	Капуста квашеная pszczolka 830г ст/б	1	Неклассифицированные/default	0	
3333484	5904645371097	Капуста квашеная zakuska острая 900г ст/б	1	Неклассифицированные/default	0	
3333485	4640016020065	Капуста квашеная агрин с клюквой 900г пл/в	1	Неклассифицированные/default	0	
3333486	4640016020164	Капуста квашеная агрин с хреном 900г пл/в	1	Неклассифицированные/default	0	
3333487	4607106577885	Капуста квашеная азия пикантная 500г пл/бан	1	Неклассифицированные/default	0	
3333488	4607106577922	Капуста квашеная азия пикантная с клюквой 500г пл/бан	1	Неклассифицированные/default	0	
3333489	4607106577892	Капуста квашеная азия пикантная с яблоками 500г пл/бан	1	Неклассифицированные/default	0	
3333490	4650000721069	Капуста квашеная аргаяшский продукт с морковью 350г пл/бан	1	Неклассифицированные/default	0	
3333491	4640016020119	Капуста квашеная армконсерв острая со свеклой 900г ст/б	1	Неклассифицированные/default	0	
3333492	4607103340239	Капуста квашеная арсеньевское подворье с морковью 500г пл/у	1	Неклассифицированные/default	0	
3333493	4607103341199	Капуста квашеная арсеньевское подворье с морковью и корнишонами 300г пл/у	1	Неклассифицированные/default	0	
3333494	4607179351023	Капуста квашеная ассорти 500г	1	Неклассифицированные/default	0	
3333495	4620755790856	Капуста квашеная Бабушкин секрет 750г	1	Неклассифицированные/default	0	
3819121	4650056520067	Капуста квашеная белокачанная рубл.900г	37536	Продукты питания (folder)/Овощи соленые и квашеные	0	
3333496	4607136272330	Капуста квашеная белоручка острая 500г пл/б	1	Неклассифицированные/default	0	
3333497	4607136272354	Капуста квашеная белоручка по-деревенски рубленая 500г пл/б	1	Неклассифицированные/default	0	
3333498	4607136273009	Капуста квашеная белоручка шинкованная с морковью 500г пл/б	1	Неклассифицированные/default	0	
3333499	4607136271241	Капуста квашеная белоручка шинкованная с морковью и дикой ягодой 500г пл/б	1	Неклассифицированные/default	0	
3819147	4607137161152	Капуста квашеная в ведерке 1кг	37536	Продукты питания (folder)/Овощи соленые и квашеные	0	
3819148	4607137161169	Капуста квашеная в ведерке 1кг #2	37536	Продукты питания (folder)/Овощи соленые и квашеные	0	
2439621	460714056012	Капуста квашеная ведро 0.900	37536	Продукты питания (folder)/Овощи соленые и квашеные	0	
2439622	4606471125080	Капуста квашеная ведро 0.900 #2	37536	Продукты питания (folder)/Овощи соленые и квашеные	0	
3819122	4630007475677	Капуста квашеная ведро 0.95кг	37536	Продукты питания (folder)/Овощи соленые и квашеные	0	
2728959	4620014090017	Капуста квашеная д-алмиров 700г	37536	Продукты питания (folder)/Овощи соленые и квашеные	0	
3333500	4627098270014	Капуста квашеная дары природы классическая 500г	1	Неклассифицированные/default	0	
3333501	4627098270021	Капуста квашеная дары природы классическая 500г пл/уп	1	Неклассифицированные/default	0	
3333502	4627098270052	Капуста квашеная дары природы с хреном 500г пл/у	1	Неклассифицированные/default	0	
3819113	4605558001774	Капуста квашеная деревенская 500г	37536	Продукты питания (folder)/Овощи соленые и квашеные	0	
3819114	4680006330774	Капуста квашеная деревенская 500г #2	37536	Продукты питания (folder)/Овощи соленые и квашеные	0	
720957	4751001621294	Капуста квашеная димдини классич.850г	37536	Продукты питания (folder)/Овощи соленые и квашеные	720956	Димдини
720958	4751001621300	Капуста квашеная димдини с клюквой 850г	37536	Продукты питания (folder)/Овощи соленые и квашеные	720956	Димдини
720959	4751001620594	Капуста квашеная димдини с морковью 850г	37536	Продукты питания (folder)/Овощи соленые и квашеные	720956	Димдини
3333503	4640018930010	Капуста квашеная дмитровские овощи с морковью 800г	1	Неклассифицированные/default	0	
3333504	4610002409020	Капуста квашеная домашние разносолы 500г ведро	1	Неклассифицированные/default	0	
3333505	4610002409099	Капуста квашеная домашние разносолы с клюквой 500г ведро	1	Неклассифицированные/default	0	
3333506	4610002409082	Капуста квашеная домашние разносолы с клюквой 800г	1	Неклассифицированные/default	0	
3333507	4610002409068	Капуста квашеная домашние разносолы с яблоками 500г ведро	1	Неклассифицированные/default	0	
3333508	4610002409051	Капуста квашеная домашние разносолы с яблоком 800г	1	Неклассифицированные/default	0	
3333509	4610002409181	Капуста квашеная домашние разносолы со сладким перцем 500г ведро	1	Неклассифицированные/default	0	
3333510	3900000188876	Капуста квашеная зангиров балтийская 500г пл/б	1	Неклассифицированные/default	0	
720966	4607112481046	Капуста квашеная захаровская шинкованная с морковью 700г пл/б	37536	Продукты питания (folder)/Овощи соленые и квашеные	63156	Фабрика Домашних Солений
3333511	4607112484733	Капуста квашеная захаровские продукты с морковью 700г тв/уп	1	Неклассифицированные/default	0	
3333512	4607049271260	Капуста квашеная Золотая фишка с морковью 750г пл/бан	1	Неклассифицированные/default	3808572	Золотая Фишка
2728962	4620014090093	Капуста квашеная кисло-сладкая 700г пл/ведро	37536	Продукты питания (folder)/Овощи соленые и квашеные	0	
3333513	4660003700770	Капуста квашеная кисло-сладкая 700г пл/ведро #2	1	Неклассифицированные/default	0	
2867594	4630003070067	Капуста квашеная кисло-сладкая 700г пл/ведро картышов	1	Неклассифицированные/default	0	
1800449	4607043401236	Капуста квашеная контейнер 450г	37536	Продукты питания (folder)/Овощи соленые и квашеные	0	
3819151	4607115069555	Капуста квашеная красная цена по-дерев 500г	37536	Продукты питания (folder)/Овощи соленые и квашеные	3391836	красная цена
3333514	4607050661043	Капуста квашеная красногорский шинкованная с морковью 800г ведро	1	Неклассифицированные/default	0	
3819152	4607115064024	Капуста квашеная круглый год аппетитно по-дерев 500г	37536	Продукты питания (folder)/Овощи соленые и квашеные	3795503	Круглый год аппетитно
3819153	4607115064031	Капуста квашеная круглый год аппетитно по-дерев 900г	37536	Продукты питания (folder)/Овощи соленые и квашеные	3795503	Круглый год аппетитно
3819154	4607115064055	Капуста квашеная круглый год аппетитно с морк/клюк.500г	37536	Продукты питания (folder)/Овощи соленые и квашеные	3795503	Круглый год аппетитно
3819155	4607115064147	Капуста квашеная круглый год аппетитно с морковью 700г	37536	Продукты питания (folder)/Овощи соленые и квашеные	3795503	Круглый год аппетитно
3819149	4607137161213	Капуста квашеная кусочками 500г	37536	Продукты питания (folder)/Овощи соленые и квашеные	0	
720970	4607062672075	Капуста квашеная лукашинские по-деревенски с брусн.670г	1	Неклассифицированные/default	1689029	Лукашинские
720971	4607062672082	Капуста квашеная лукашинские по-домашнему с морковью 670г ст/банка	1	Неклассифицированные/default	1689029	Лукашинские
3333515	4603720294078	Капуста квашеная любимые соленья шинкованная с морковью 800г пл/ведро	1	Неклассифицированные/default	0	
3333516	4620026280093	Капуста квашеная меркурий по-деревенски 500г пл/уп	1	Неклассифицированные/default	0	
3333517	4620026280086	Капуста квашеная меркурий с клюквой 500г пл/уп	1	Неклассифицированные/default	0	
3333518	4620026280079	Капуста квашеная меркурий с морковью 500г пл/уп	1	Неклассифицированные/default	0	
3333519	4670000570832	Капуста квашеная мистер салат с морковью 500г п/б	1	Неклассифицированные/default	0	
3333520	4670000572508	Капуста квашеная мистер салат с морковью и хреном 500г пл/б	1	Неклассифицированные/default	0	
3333521	4670000571907	Капуста квашеная мистер салат с морковью и яблоком 500г пл/б	1	Неклассифицированные/default	0	
3333522	4670000570955	Капуста квашеная мистер салат шинкованная с морковью 2кг пл/в	1	Неклассифицированные/default	0	
3333523	4607179351566	Капуста квашеная натурово балтийская 0.5кг в банке	1	Неклассифицированные/default	0	
3333524	4607179350293	Капуста квашеная натурово деревенская 1кг пл/ведро	1	Неклассифицированные/default	0	
3333525	4607179350194	Капуста квашеная натурово деревенская с клюквой 0.5кг пл/б	1	Неклассифицированные/default	0	
3333526	4607179350446	Капуста квашеная натурово деревенская с яблоками кислая 500г пл/б	1	Неклассифицированные/default	0	
3333527	4607179351597	Капуста квашеная натурово китайская острая 0.5кг пл/уп	1	Неклассифицированные/default	0	
3333528	4607179350477	Капуста квашеная оригинальная 500г	1	Неклассифицированные/default	0	
3333529	4607062672099	Капуста квашеная от души с морковью 670г ст/б	1	Неклассифицированные/default	0	
1219003	4612733190215	Капуста квашеная пак 0.500	1229537	Продукты питания (folder)/Консервы (folder)/Консервы	0	
2439625	4770583216568	Капуста квашеная палангас меню 880мл с/б	65	Продукты питания (folder)/Консервы (folder)/Консервы овощные	2430480	Палангас Меню
3819123	4630007479583	Капуста квашеная пелюсками 0.8кг	37536	Продукты питания (folder)/Овощи соленые и квашеные	0	
3819124	4690674008264	Капуста квашеная пелюсками с/свекл.0.4кг	37536	Продукты питания (folder)/Овощи соленые и квашеные	0	
3333530	4650068533314	Капуста квашеная петровна солила с клюквой 1кг пл/в	1	Неклассифицированные/default	0	
2867571	4605974000238	Капуста квашеная по-грузински 0.600	1	Неклассифицированные/default	0	
3819125	4607115063768	Капуста квашеная по-грузински 1000г	37536	Продукты питания (folder)/Овощи соленые и квашеные	0	
1800441	4607115060132	Капуста квашеная по-грузински 500г	37536	Продукты питания (folder)/Овощи соленые и квашеные	0	
3819126	4680006330781	Капуста квашеная по-грузински 500г #2	37536	Продукты питания (folder)/Овощи соленые и квашеные	0	
2439626	4607115060439	Капуста квашеная по-деревенски 500г	23559	Продукты питания (folder)/Рыба и морепродукты (folder)/Пресервы	0	
1800442	4603381550186	Капуста квашеная по-деревенски 900г	37536	Продукты питания (folder)/Овощи соленые и квашеные	0	
3819127	4607115060118	Капуста квашеная по-деревенски 900г #2	37536	Продукты питания (folder)/Овощи соленые и квашеные	0	
3819128	4680006330767	Капуста квашеная по-деревенски 900г #3	37536	Продукты питания (folder)/Овощи соленые и квашеные	0	
1219004	4605558001903	Капуста квашеная по-деревенски 900г бочковой засол	65	Продукты питания (folder)/Консервы (folder)/Консервы овощные	0	
3333539	4660003700022	Капуста квашеная по-домашнему 700г тв/уп	1	Неклассифицированные/default	0	
2867573	4605974000214	Капуста квашеная по-кор с шафраном 0.600	1	Неклассифицированные/default	0	
2439627	4607115062310	Капуста квашеная по-московски 500г фэг	23559	Продукты питания (folder)/Рыба и морепродукты (folder)/Пресервы	0	
3333531	4626014600034	Капуста квашеная погребок	1	Неклассифицированные/default	0	
3333532	4626014600041	Капуста квашеная погребок #2	1	Неклассифицированные/default	0	
3333533	4626014600065	Капуста квашеная погребок #3	1	Неклассифицированные/default	0	
3333534	4626014600232	Капуста квашеная погребок #4	1	Неклассифицированные/default	0	
3333535	4626014600249	Капуста квашеная погребок #5	1	Неклассифицированные/default	0	
3333536	4626014600263	Капуста квашеная погребок #6	1	Неклассифицированные/default	0	
3333537	4626014600010	Капуста квашеная погребок 1000г пл/ведро	1	Неклассифицированные/default	0	
3333538	4626014600218	Капуста квашеная погребок 500г пл/ведро	1	Неклассифицированные/default	0	
3333540	4603724000330	Капуста квашеная приневское 900г	1	Неклассифицированные/default	0	
3333541	4603724000347	Капуста квашеная приневское 900г мяг/уп	1	Неклассифицированные/default	0	
3333542	4603724000859	Капуста квашеная приневское с клюквой 900г тв/уп	1	Неклассифицированные/default	0	
3333543	4603724001047	Капуста квашеная приневское с лавровым листом 900г тв/уп	1	Неклассифицированные/default	0	
3333544	4603724001030	Капуста квашеная приневское с можжевеловой ягодой 900г тв/уп	1	Неклассифицированные/default	0	
3333545	4603724001054	Капуста квашеная приневское с тмином 900г тв/уп	1	Неклассифицированные/default	0	
3333546	4603724001092	Капуста квашеная приневское с хреном 900г пл/б	1	Неклассифицированные/default	0	
1798020	4606471510008	Капуста квашеная пять баллов с морковь 700г пл/уп	37536	Продукты питания (folder)/Овощи соленые и квашеные	0	
154770	4607073290015	Капуста квашеная разносол 0.450	37536	Продукты питания (folder)/Овощи соленые и квашеные	0	
154771	4607073290022	Капуста квашеная разносол 0.900	37536	Продукты питания (folder)/Овощи соленые и квашеные	0	
3333547	4607114760774	Капуста квашеная разносол 900г пл/ведро	1	Неклассифицированные/default	0	
3333548	4607114760781	Капуста квашеная разносол с клюквой 900г пл/ведро	1	Неклассифицированные/default	0	
154772	4606471125073	Капуста квашеная рф 0.900	37536	Продукты питания (folder)/Овощи соленые и квашеные	0	
1800444	4607043402097	Капуста квашеная с брусник.700г	37536	Продукты питания (folder)/Овощи соленые и квашеные	0	
3819129	4690674008271	Капуста квашеная с брусникой 0.4кг	37536	Продукты питания (folder)/Овощи соленые и квашеные	0	
2867583	4665271750861	Капуста квашеная с брусникой 900г п/б сила традиции	1	Неклассифицированные/default	0	
2867584	4665271750960	Капуста квашеная с брусникой 900г п/б сила традиции #2	1	Неклассифицированные/default	0	
2867585	4612729470963	Капуста квашеная с брусникой 900г фдс п/б	1	Неклассифицированные/default	0	
3333549	4640016020010	Капуста квашеная с грядки в кадку с морковью 900г пл/в	1	Неклассифицированные/default	0	
