ID	UPCEAN	Name	CategoryID	CategoryName	BrandID	BrandName
496004	4250167219005	Набор ручек Silwerhof experte (ручка шар+ручка пер.) корпус лак.черный	20596	Канцелярские товары (folder)/Писчие принадлежности (folder)/Ручки	40228	Silwerhof
496005	4250167210743	Набор ручек Silwerhof faktor (ручка шар+ручка пер.) корпус со вставкой из натуральной кожи коричневого цвета	20596	Канцелярские товары (folder)/Писчие принадлежности (folder)/Ручки	40228	Silwerhof
496006	4250167210705	Набор ручек Silwerhof faktor (ручка шар+ручка пер.) корпус со вставкой из натуральной кожи песочного цвета	20596	Канцелярские товары (folder)/Писчие принадлежности (folder)/Ручки	40228	Silwerhof
496007	4250167209433	Набор ручек Silwerhof fata morgana (ручка шар+ручка пер.) корпус лак. с красной полосой	20596	Канцелярские товары (folder)/Писчие принадлежности (folder)/Ручки	40228	Silwerhof
496008	4250167209457	Набор ручек Silwerhof fata morgana (ручка шар+ручка пер.) корпус лак. с серой полосой	20596	Канцелярские товары (folder)/Писчие принадлежности (folder)/Ручки	40228	Silwerhof
496009	4250167209471	Набор ручек Silwerhof fata morgana (ручка шар+ручка пер.) корпус лак. с синей полосой	20596	Канцелярские товары (folder)/Писчие принадлежности (folder)/Ручки	40228	Silwerhof
496010	4250167200553	Набор ручек Silwerhof grossmeister (ручка шар+ручка пер.) корпус лак.черный с серебристой отделкой	20596	Канцелярские товары (folder)/Писчие принадлежности (folder)/Ручки	40228	Silwerhof
496011	4250167209334	Набор ручек Silwerhof karbon (ручка шар+ручка пер.) корпус карбоновый красный	20596	Канцелярские товары (folder)/Писчие принадлежности (folder)/Ручки	40228	Silwerhof
496012	4250167209310	Набор ручек Silwerhof karbon (ручка шар+ручка пер.) корпус карбоновый черный	20596	Канцелярские товары (folder)/Писчие принадлежности (folder)/Ручки	40228	Silwerhof
496013	4250167205473	Набор ручек Silwerhof magister (ручка шар+ручка пер.) корпус из натуральной коричневой кожи	20596	Канцелярские товары (folder)/Писчие принадлежности (folder)/Ручки	40228	Silwerhof
496014	4250167205466	Набор ручек Silwerhof magister (ручка шар+ручка пер.) корпус из натуральной черной кожи	20596	Канцелярские товары (folder)/Писчие принадлежности (folder)/Ручки	40228	Silwerhof
496015	4250167205350	Набор ручек Silwerhof meister (ручка шар+ручка пер.) корпус матов.черный	20596	Канцелярские товары (folder)/Писчие принадлежности (folder)/Ручки	40228	Silwerhof
496016	4250167205343	Набор ручек Silwerhof meister (ручка шар+ручка пер.) корпус серебристый	20596	Канцелярские товары (folder)/Писчие принадлежности (folder)/Ручки	40228	Silwerhof
496017	4250167207064	Набор ручек Silwerhof meridian (ручка шар+ручка.пер.) корпус из серебра 925 пробы в подар.футляре из нат.дерева	20596	Канцелярские товары (folder)/Писчие принадлежности (folder)/Ручки	40228	Silwerhof
496018	4250167219715	Набор ручек Silwerhof mystik (ручка шар+ручка пер.) корпус из серебра 925 пробы в подар.футляре из натур.дерева	20596	Канцелярские товары (folder)/Писчие принадлежности (folder)/Ручки	40228	Silwerhof
496019	4250167209372	Набор ручек Silwerhof nautilus (ручка шар+ручка пер.) корпус лак.черный	20596	Канцелярские товары (folder)/Писчие принадлежности (folder)/Ручки	40228	Silwerhof
496020	4250167219692	Набор ручек Silwerhof orient (ручка шар+ручка пер.) корпус из серебра 925 пробы в подар.футляре из натур.дерева	20596	Канцелярские товары (folder)/Писчие принадлежности (folder)/Ручки	40228	Silwerhof
496021	4250167209273	Набор ручек Silwerhof prototyp (ручка шар+ ручка пер.) корпус лак.синий	20596	Канцелярские товары (folder)/Писчие принадлежности (folder)/Ручки	40228	Silwerhof
496022	4250167209259	Набор ручек Silwerhof prototyp (ручка шар+ручка пер.) корпус лак. черный	20596	Канцелярские товары (folder)/Писчие принадлежности (folder)/Ручки	40228	Silwerhof
496023	4250167209297	Набор ручек Silwerhof prototyp (ручка шар+ручка пер.) корпус лак.красный	20596	Канцелярские товары (folder)/Писчие принадлежности (folder)/Ручки	40228	Silwerhof
496024	4250167205435	Набор ручек Silwerhof sieger (ручка шар+ручка пер.) корпус серебристый	20596	Канцелярские товары (folder)/Писчие принадлежности (folder)/Ручки	40228	Silwerhof
496025	4250167205428	Набор ручек Silwerhof sieger (ручка шар+ручка пер.) корпус черный	20596	Канцелярские товары (folder)/Писчие принадлежности (folder)/Ручки	40228	Silwerhof
496026	4250167219739	Набор ручек Silwerhof symphonie (ручка шар+ручка пер.) корпус из серебра 925 пробы,в подар.футляре из нат.дерева	20596	Канцелярские товары (folder)/Писчие принадлежности (folder)/Ручки	40228	Silwerhof
496027	4606325000426	Набор ручек Stabilo tropicana в бл.4цв	179066	Канцелярские товары (folder)/Писчие принадлежности (folder)/Ручки шариковые	63484	Stabilo
3428523	046200043232	Набор ручек tukzar 10цв	1	Неклассифицированные/default	237416	Tukzar
3428524	4670006994120	Набор ручек tukzar гелевые 3цв	1	Неклассифицированные/default	237416	Tukzar
3428525	4670006994168	Набор ручек tukzar гелевые 5цв	1	Неклассифицированные/default	237416	Tukzar
3428526	4607117887577	Набор ручек tukzar гелевые 6цв	1	Неклассифицированные/default	237416	Tukzar
812858	4607117884408	Набор ручек tukzar офис 6шт артикул 2019-6	179066	Канцелярские товары (folder)/Писчие принадлежности (folder)/Ручки шариковые	237416	Tukzar
91806	070530695557	Набор ручек uni-ball 4шт 69555	20596	Канцелярские товары (folder)/Писчие принадлежности (folder)/Ручки	0	
91807	070530603552	Набор ручек uni-ball 5шт 60355	20596	Канцелярские товары (folder)/Писчие принадлежности (folder)/Ручки	0	
268415	4606998178651	Набор ручек автомат 03шт 02 син черн laknock 0.5мм с прозрачным корпусом и резиновым держателем в полиэтиленовом пакете u	179066	Канцелярские товары (folder)/Писчие принадлежности (folder)/Ручки шариковые	264160	Uni-Ball
268416	4606998178606	Набор ручек автомат 2шт син черн Power tank 0.7мм с полупрозрачным корпусом и резиновым держателем в полиэтиленовом пакет	179066	Канцелярские товары (folder)/Писчие принадлежности (folder)/Ручки шариковые	264160	Uni-Ball
268417	4606998061366	Набор ручек автомат proff с резиновым держателем и прозрачным корпусом 4шт 2син. 2черн. в пластиковой упаковке с европодвесом	179066	Канцелярские товары (folder)/Писчие принадлежности (folder)/Ручки шариковые	39419	Proff
3428527	4670006994205	Набор ручек алингар 10цв	1	Неклассифицированные/default	0	
772808	6904567034543	Набор ручек арти-м шарик 2шт 03-454	2	Канцелярские товары (folder)/Канцелярские товары	36881	Арти-М
2249123	6927973347144	Набор ручек гел. 6цв g805-6/wsr европодв. 0.7мм tm Winx (50/300)	2	Канцелярские товары (folder)/Канцелярские товары	0	
1771473	4605419048078	Набор ручек гел.iceberg авт.5шт	2	Канцелярские товары (folder)/Канцелярские товары	0	
3428528	4690219093717	Набор ручек гелевые 4цв 4шт	1	Неклассифицированные/default	0	
3428529	5069208880109	Набор ручек гелевые 4цв 4шт #2	1	Неклассифицированные/default	0	
3428530	4260107473749	Набор ручек гелевых	1	Неклассифицированные/default	0	
234092	4606998035695	Набор ручек гелевых 0.5мм proff 4шт /в пластиковой упаковке	20582	Канцелярские товары (folder)/Писчие принадлежности (folder)/Ручки гелевые	39419	Proff
234091	4606998006909	Набор ручек гелевых 02шт (син черн) 0.5мм/в блистерной упаковке proff	20582	Канцелярские товары (folder)/Писчие принадлежности (folder)/Ручки гелевые	39419	Proff
772846	4606998247388	Набор ручек гелевых 06шт (06цв флуоресцентных) 0.5мм/в пластиковой упаковке европодвес boom fizzy moon	20582	Канцелярские товары (folder)/Писчие принадлежности (folder)/Ручки гелевые	0	
772847	4606998247395	Набор ручек гелевых 06шт (06цв флуоресцентных) 0.5мм/в пластиковой упаковке европодвес boom волшебные принцессы	20582	Канцелярские товары (folder)/Писчие принадлежности (folder)/Ручки гелевые	0	
772848	4606998247371	Набор ручек гелевых 06шт (06цв флуоресцентных) 0.5мм/в пластиковой упаковке европодвес boom Смешарики романтика	20582	Канцелярские товары (folder)/Писчие принадлежности (folder)/Ручки гелевые	0	
772849	4606998261254	Набор ручек гелевых 06шт (06цв флуоресцентных) 0.5мм/в пластиковой упаковке европодвес boom феечки	20582	Канцелярские товары (folder)/Писчие принадлежности (folder)/Ручки гелевые	39419	Proff
1685561	9540728109728	Набор ручек гелевых 5цв белый/корпус с европодвес/Китай/96	20582	Канцелярские товары (folder)/Писчие принадлежности (folder)/Ручки гелевые	0	
772809	4813674004283	Набор ручек гелевых 6цв darvish с блеском для девоч dv-1400а-6	20582	Канцелярские товары (folder)/Писчие принадлежности (folder)/Ручки гелевые	1353104	Darvish
2743483	4645615616060	Набор ручек гелевых 6штук	2	Канцелярские товары (folder)/Канцелярские товары	0	
496057	9555078900048	Набор ручек гелевых Easy 888j 4цв металл	20582	Канцелярские товары (folder)/Писчие принадлежности (folder)/Ручки гелевые	496055	EASY
234082	4041485042556	Набор ручек гелевых Erich Krause metallic 6шт (ассорти) бл.	20582	Канцелярские товары (folder)/Писчие принадлежности (folder)/Ручки гелевые	348877	Erich Krause
516731	4041485282969	Набор ручек гелевых g-base Plus и 1 стержень, прозр корпус синяя 0.5мм в пакете европодвес	20582	Канцелярские товары (folder)/Писчие принадлежности (folder)/Ручки гелевые	348877	Erich Krause
234085	4041485176305	Набор ручек гелевых g-point Erich Krause синяя с 2 стержнями 17630	20582	Канцелярские товары (folder)/Писчие принадлежности (folder)/Ручки гелевые	348877	Erich Krause
1771474	4605419048085	Набор ручек гелевых iceberg цв.	2	Канцелярские товары (folder)/Канцелярские товары	0	
772850	4024526630714	Набор ручек гелевых laco manuscript 2шт 0.5мм пвх пенал	20582	Канцелярские товары (folder)/Писчие принадлежности (folder)/Ручки гелевые	459856	LACO
1685564	4606998104339	Набор ручек гелевых proff 0.5мм 4шт п/у	20582	Канцелярские товары (folder)/Писчие принадлежности (folder)/Ручки гелевые	39419	Proff
1685566	4606998308492	Набор ручек гелевых proff веселые паровозики из чаггингтона 0.5мм 6шт п/у	20582	Канцелярские товары (folder)/Писчие принадлежности (folder)/Ручки гелевые	39419	Proff
1685567	4606998308348	Набор ручек гелевых proff хроники драконов 0.5мм 6шт п/у	20582	Канцелярские товары (folder)/Писчие принадлежности (folder)/Ручки гелевые	39419	Proff
517089	4041485199489	Набор ручек гелевых robogel синяя черная красная 0.5мм 3шт блистер	20582	Канцелярские товары (folder)/Писчие принадлежности (folder)/Ручки гелевые	348877	Erich Krause
772851	6943575810060	Набор ручек гелевых Winx-6 супермет. х-810-6 канцелярик	20582	Канцелярские товары (folder)/Писчие принадлежности (folder)/Ручки гелевые	0	
1266364	9073215122219	Набор ручек гелевых адвокат 2шт igp139/2 index	20582	Канцелярские товары (folder)/Писчие принадлежности (folder)/Ручки гелевые	456932	Index
1685563	4000030888889	Набор ручек гелевых для егэ черн.	20582	Канцелярские товары (folder)/Писчие принадлежности (folder)/Ручки гелевые	442854	EXPERT COMPLETE
1266365	9073215122196	Набор ручек гелевых мажестик 2шт igp234/2 index	20582	Канцелярские товары (folder)/Писчие принадлежности (folder)/Ручки гелевые	456932	Index
1685562	6920128008969	Набор ручек гелевых нежность 8цв цв/корпус с рис/Китай/30	20582	Канцелярские товары (folder)/Писчие принадлежности (folder)/Ручки гелевые	0	
91732	041540643241	Набор ручек гелевых профф 4шт 64324	20582	Канцелярские товары (folder)/Писчие принадлежности (folder)/Ручки гелевые	39419	Proff
3428531	4680211011918	Набор ручек девочки гелевые 12цв	1	Неклассифицированные/default	0	
1266366	4603008089471	Набор ручек дисней бен 10 шарик.автомат.2шт	2	Канцелярские товары (folder)/Канцелярские товары	299664	Disney
1266367	4603008088719	Набор ручек дисней принцессы шарик.автомат.2шт	2	Канцелярские товары (folder)/Канцелярские товары	299664	Disney
2901840	8711295760389	Набор ручек купман капиллярных 12шт	1	Неклассифицированные/default	0	
2901841	8711295840906	Набор ручек купман шариковых 2шт (синяя+черная)	1	Неклассифицированные/default	0	
2901842	8711295761010	Набор ручек купман шариковых 2шт син.	1	Неклассифицированные/default	0	
2901843	8901069066599	Набор ручек люксор рио гель пен гелев.2шт син 7812/2bc	1	Неклассифицированные/default	0	
2901844	8901069807734	Набор ручек люксор стик шарик.0.8мм син 4шт 1232/4c	1	Неклассифицированные/default	0	
2901845	8901069015368	Набор ручек люксор финлинер 3шт цв 7140/3bc	1	Неклассифицированные/default	0	
2901846	8901069705245	Набор ручек люксор фокус 9шт 1760/9bc	1	Неклассифицированные/default	0	
3428532	4680211011932	Набор ручек машинки гелевые 12цв	1	Неклассифицированные/default	0	
3428533	4607117884866	Набор ручек на масляной основе белый корпус 4цв	1	Неклассифицированные/default	0	
3428534	4670006994144	Набор ручек оптима шариковые 4цв	1	Неклассифицированные/default	0	
772852	4607121534177	Набор ручек Союз шарик 4шт 126-03	2	Канцелярские товары (folder)/Канцелярские товары	0	
772854	4607124536345	Набор ручек стингер син 2шт рш524-01	2	Канцелярские товары (folder)/Канцелярские товары	772853	Стингер
772855	4607121536355	Набор ручек стингер син 3шт рш524-02	2	Канцелярские товары (folder)/Канцелярские товары	772853	Стингер
772856	4607121536331	Набор ручек стингер син/черн 4шт рш524-02	2	Канцелярские товары (folder)/Канцелярские товары	772853	Стингер
3428535	8003511402594	Набор ручек сщcorvina 91 4цв	1	Неклассифицированные/default	0	
2901847	4010070232436	Набор ручек топ модел гелевых неоновых цветов	1	Неклассифицированные/default	0	
91816	071641229525	Набор ручек шарик 5шт 22952	179066	Канцелярские товары (folder)/Писчие принадлежности (folder)/Ручки шариковые	0	
91820	041540640349	Набор ручек шарик цв.3шт az-4/64034	179066	Канцелярские товары (folder)/Писчие принадлежности (folder)/Ручки шариковые	0	
517428	8003511420697	Набор ручек шарик. carioka fruity,10цв, ароматизированные, блистер арт 42069 ед.изм.набор 200-1698	179066	Канцелярские товары (folder)/Писчие принадлежности (folder)/Ручки шариковые	21718	Carioca
91808	8003511402204	Набор ручек шарик. fiorella, 6цв, корпус флуор. арт 40220 ед.изм.набор упак. (24) 200-0526	179066	Канцелярские товары (folder)/Писчие принадлежности (folder)/Ручки шариковые	0	
234120	4605565045099	Набор ручек шариковых 04цв gmv 982а цвет.прозр. корп. 100097-50/GP982а-4	1	Неклассифицированные/default	0	
772861	4606998264392	Набор ручек шариковых 06шт (06цв)/в блистерной упаковке европодвес boom africa	1	Неклассифицированные/default	0	
772862	4606998247425	Набор ручек шариковых 06шт (06цв)/в блистерной упаковке европодвес boom fizzy moon	1	Неклассифицированные/default	0	
772863	4606998264408	Набор ручек шариковых 06шт (06цв)/в блистерной упаковке европодвес boom мишель	1	Неклассифицированные/default	0	
268447	4606998227595	Набор ручек шариковых 06шт (06цв)/в блистерной упаковке европодвес boom ну, погоди	1	Неклассифицированные/default	0	
772864	4606998264385	Набор ручек шариковых 06шт (06цв)/в блистерной упаковке европодвес boom рори	1	Неклассифицированные/default	0	
268449	4606998209621	Набор ручек шариковых 06шт (06цв)/в блистерной упаковке европодвес boom Смешарики	179066	Канцелярские товары (folder)/Писчие принадлежности (folder)/Ручки шариковые	0	
772865	4606998247418	Набор ручек шариковых 06шт (06цв)/в блистерной упаковке европодвес boom Смешарики веселые приключения	1	Неклассифицированные/default	0	
772866	4606998247401	Набор ручек шариковых 06шт (06цв)/в блистерной упаковке европодвес boom спайдермен	1	Неклассифицированные/default	0	
2249124	4650062493591	Набор ручек шариковых 10цв в блистере, officespace, арт.178875 3591	1	Неклассифицированные/default	0	
268413	6924246179211	Набор ручек шариковых 4цв beifa, AA 927 (w)-4, арт.0405534 9211	20596	Канцелярские товары (folder)/Писчие принадлежности (folder)/Ручки	0	
1969336	8029173002415	Набор ручек шариковых 4цв linc, Corona, арт.066272 2415	1	Неклассифицированные/default	0	
268458	4606998125921	Набор ручек шариковых proff с прозрачным корпусом 04шт (2син 2черн)/в пластиковой упаковке европодвес	179066	Канцелярские товары (folder)/Писчие принадлежности (folder)/Ручки шариковые	39419	Proff
268459	4606998125914	Набор ручек шариковых proff с прозрачным корпусом 04шт (син черн зел кр)/в пластиковой упаковке европодвес	179066	Канцелярские товары (folder)/Писчие принадлежности (folder)/Ручки шариковые	39419	Proff
268460	4606998125907	Набор ручек шариковых синих proff с прозрачным корпусом 04шт /в пластиковой упаковке европодвес	179066	Канцелярские товары (folder)/Писчие принадлежности (folder)/Ручки шариковые	39419	Proff
496095	4603322058771	Набор ручк.+брел. бордо j.otten	360621	Сувениры и подарки (folder)/Подарочный набор	442856	Josef Otten
3428536	6936071050016	Набор ручка + брелок с фонариком рц восток	1	Неклассифицированные/default	0	
20599	4715995207728	Набор ручка автомат шар+авт каранд eastar esb2077 (в блистере)	20596	Канцелярские товары (folder)/Писчие принадлежности (folder)/Ручки	19395	EASTAR
91834	6918501870135	Набор ручка и брелок 87013	36619	Сувениры и подарки (folder)/Сувениры и подарки	0	
91835	6905508701180	Набор ручка и брелок 87115/87116/87118	36619	Сувениры и подарки (folder)/Сувениры и подарки	0	
2959664	6905508701159	Набор ручка и брелок 87115/87116/87118 #2	36619	Сувениры и подарки (folder)/Сувениры и подарки	0	
2959665	6905508701166	Набор ручка и брелок 87115/87116/87118 #3	36619	Сувениры и подарки (folder)/Сувениры и подарки	0	
91836	6905508701173	Набор ручка и брелок 87117	36619	Сувениры и подарки (folder)/Сувениры и подарки	0	
