ID	UPCEAN	Name	CategoryID	CategoryName	BrandID	BrandName
482659	4606445001662	Kudo ku-6001 грунт-эмаль для пластика серая (ral 7031) аэрозоль, 520мл/ 12	482588	Строительные и отделочные материалы (folder)/Эмаль	615484	KUDO
482660	4606445001686	Kudo ku-6002 грунт-эмаль для пластика черная (ral 9005), аэрозоль, 520мл/ 12	482588	Строительные и отделочные материалы (folder)/Эмаль	615484	KUDO
482661	4606445001709	Kudo ku-6003 грунт-эмаль для пластика белая (ral 9003), аэрозоль, 520мл/ 12	482588	Строительные и отделочные материалы (folder)/Эмаль	615484	KUDO
482662	4606445001877	Kudo ku-6004 грунт-эмаль для пластика графит (ral 7021), аэрозоль, 520мл/ 6	482588	Строительные и отделочные материалы (folder)/Эмаль	615484	KUDO
1243628	4606445019568	Kudo ku-6005 грунт-эмаль для пластика светло-серая (ral 7035), аэрозоль, 520мл/ 12	482588	Строительные и отделочные материалы (folder)/Эмаль	615484	KUDO
1243629	4606445019582	Kudo ku-6006 грунт-эмаль для пластика красная (ral 3020), аэрозоль, 520мл/ 6	482588	Строительные и отделочные материалы (folder)/Эмаль	615484	KUDO
1243630	4606445019605	Kudo ku-6007 грунт-эмаль для пластика желтая (ral 1021), аэрозоль, 520мл/ 6	482588	Строительные и отделочные материалы (folder)/Эмаль	615484	KUDO
1243631	4606445019629	Kudo ku-6008 грунт-эмаль для пластика зеленая (ral 6005), аэрозоль, 520мл/ 6	482588	Строительные и отделочные материалы (folder)/Эмаль	615484	KUDO
1243632	4606445019643	Kudo ku-6009 грунт-эмаль для пластика синяя (ral 5005), аэрозоль, 520мл/ 6	482588	Строительные и отделочные материалы (folder)/Эмаль	615484	KUDO
1243633	4606445019667	Kudo ku-6010 грунт-эмаль для пластика бордовая (ral 3005), аэрозоль, 520мл/ 6	482588	Строительные и отделочные материалы (folder)/Эмаль	615484	KUDO
1243634	4606445019681	Kudo ku-6011 грунт-эмаль для пластика коричневая (ral 8017), аэрозоль, 520мл/ 6	482588	Строительные и отделочные материалы (folder)/Эмаль	615484	KUDO
1243635	4606445019704	Kudo ku-6012 грунт-эмаль для пластика серебристая (ral 9006), аэрозоль, 520мл/ 12	482588	Строительные и отделочные материалы (folder)/Эмаль	615484	KUDO
482663	4606445016420	Kudo ku-6101 эмаль для пвх профиля (белая), аэрозоль, 520мл/ 6	482588	Строительные и отделочные материалы (folder)/Эмаль	615484	KUDO
3686081	4606445014877	Kudo ku-70000 лак автомобильный ремонтный с кисточкой, 15мл/ 6	260388	Эксплуатация и ремонт автомобилей/Автохимия	615484	KUDO
3686082	4606445021868	Kudo ku-70005 преобразователь ржавчины со структурным модификатором (гель-формула) во флаконе с кист./6	260388	Эксплуатация и ремонт автомобилей/Автохимия	615484	KUDO
3686084	4606445022186	Kudo ku-70090 эмаль автомобильная ремонтная с кисточкой 1к черная матовая, 15мл/ 6	296462	Строительные и отделочные материалы (folder)/Эмаль алкидная	615484	KUDO
3686085	4606445006230	Kudo ku-70100 эмаль ремонтная с кисточкой триумф 100 (металлик), 15мл/ 6	296462	Строительные и отделочные материалы (folder)/Эмаль алкидная	615484	KUDO
3686086	4606445015119	Kudo ku-70102 эмаль ремонтная с кисточкой абрикос 102, 15мл/ 6	296462	Строительные и отделочные материалы (folder)/Эмаль алкидная	615484	KUDO
3686087	4606445012224	Kudo ku-70104 эмаль ремонтная с кисточкой калина 104 (металлик), 15мл/ 12	296462	Строительные и отделочные материалы (folder)/Эмаль алкидная	615484	KUDO
3686088	4606445006254	Kudo ku-70105 эмаль ремонтная с кисточкой франкония 105 (металлик), 15мл/ 12	296462	Строительные и отделочные материалы (folder)/Эмаль алкидная	615484	KUDO
3686089	4606445002881	Kudo ku-70107 эмаль ремонтная с кисточкой баклажан 107, 15мл/ 12	296462	Строительные и отделочные материалы (folder)/Эмаль алкидная	615484	KUDO
3686090	4606445015171	Kudo ku-70108 эмаль ремонтная с кисточкой лилия 108, 15мл/ 12	296462	Строительные и отделочные материалы (folder)/Эмаль алкидная	615484	KUDO
3686091	4606445002898	Kudo ku-70110 эмаль ремонтная с кисточкой рубин 110, 15мл/ 12	296462	Строительные и отделочные материалы (folder)/Эмаль алкидная	615484	KUDO
3686092	4606445012545	Kudo ku-70115 эмаль ремонтная с кисточкой феерия 115 (металлик), 15мл/ 12	296462	Строительные и отделочные материалы (folder)/Эмаль алкидная	615484	KUDO
3686093	4606445012293	Kudo ku-70116 эмаль ремонтная с кисточкой коралл 116 (металлик), 15мл/ 12	296462	Строительные и отделочные материалы (folder)/Эмаль алкидная	615484	KUDO
3686094	4606445002904	Kudo ku-70118 эмаль ремонтная с кисточкой кармен 118, 15мл/ 12	296462	Строительные и отделочные материалы (folder)/Эмаль алкидная	615484	KUDO
3686095	4606445002911	Kudo ku-70121 эмаль ремонтная с кисточкой реклама 121, 15мл/ 12	296462	Строительные и отделочные материалы (folder)/Эмаль алкидная	615484	KUDO
3686096	4606445002928	Kudo ku-70127 эмаль ремонтная с кисточкой вишня 127, 15мл/ 12	296462	Строительные и отделочные материалы (folder)/Эмаль алкидная	615484	KUDO
3686097	4606445015614	Kudo ku-70128 эмаль ремонтная с кисточкой искра 128 (металлик), 15мл/ 12	296462	Строительные и отделочные материалы (folder)/Эмаль алкидная	615484	KUDO
3686098	4606445006261	Kudo ku-70129 эмаль ремонтная с кисточкой Виктория 129 (металлик), 15мл/ 12	296462	Строительные и отделочные материалы (folder)/Эмаль алкидная	615484	KUDO
3686099	4606445002935	Kudo ku-70132 эмаль ремонтная с кисточкой вишневый Сад 132 (металлик), 15мл/ 12	296462	Строительные и отделочные материалы (folder)/Эмаль алкидная	615484	KUDO
3686100	4606445012033	Kudo ku-70145 эмаль ремонтная с кисточкой аметист 145 (металлик), 15мл/ 12	296462	Строительные и отделочные материалы (folder)/Эмаль алкидная	615484	KUDO
3686101	4606445012095	Kudo ku-70152 эмаль ремонтная с кисточкой паприка 152 (металлик), 15мл/ 12	296462	Строительные и отделочные материалы (folder)/Эмаль алкидная	615484	KUDO
3686102	4606445002959	Kudo ku-70165 эмаль ремонтная с кисточкой коррида 165, 15мл/ 12	296462	Строительные и отделочные материалы (folder)/Эмаль алкидная	615484	KUDO
3686103	4606445015621	Kudo ku-70170 эмаль ремонтная с кисточкой торнадо 170, 15мл/ 12	296462	Строительные и отделочные материалы (folder)/Эмаль алкидная	615484	KUDO
3686104	4606445002966	Kudo ku-70180 эмаль ремонтная с кисточкой гранат 180, 15мл/ 12	296462	Строительные и отделочные материалы (folder)/Эмаль алкидная	615484	KUDO
3686105	4606445014273	Kudo ku-70190 эмаль ремонтная с кисточкой калифорнийский мак 190 (металлик), 15мл/ 12	296462	Строительные и отделочные материалы (folder)/Эмаль алкидная	615484	KUDO
3686106	4606445002973	Kudo ku-70201 эмаль ремонтная с кисточкой белая 201, 15мл/ 12	296462	Строительные и отделочные материалы (folder)/Эмаль алкидная	615484	KUDO
3686107	4606445002980	Kudo ku-70202 эмаль ремонтная с кисточкой снежно-белая 202, 15мл/ 12	296462	Строительные и отделочные материалы (folder)/Эмаль алкидная	615484	KUDO
3686108	4606445015041	Kudo ku-70203 эмаль ремонтная с кисточкой жасмин 203, 15мл/ 12	296462	Строительные и отделочные материалы (folder)/Эмаль алкидная	615484	KUDO
3686109	4606445018547	Kudo ku-70204 эмаль ремонтная с кисточкой айсберг 204, 15мл/ 12	296462	Строительные и отделочные материалы (folder)/Эмаль алкидная	615484	KUDO
3686110	4606445011814	Kudo ku-70206 эмаль ремонтная с кисточкой талая вода 206 (металлик), 15мл/ 12	296462	Строительные и отделочные материалы (folder)/Эмаль алкидная	615484	KUDO
3686111	4606445002997	Kudo ku-70208 эмаль ремонтная с кисточкой охра золотистая 208, 15мл/ 12	296462	Строительные и отделочные материалы (folder)/Эмаль алкидная	615484	KUDO
3686112	4606445003000	Kudo ku-70210 эмаль ремонтная с кисточкой примула 210, 15мл/ 12	296462	Строительные и отделочные материалы (folder)/Эмаль алкидная	615484	KUDO
3686113	4606445003017	Kudo ku-70215 эмаль ремонтная с кисточкой сафари 215, 15мл/ 12	296462	Строительные и отделочные материалы (folder)/Эмаль алкидная	615484	KUDO
3686114	4606445005493	Kudo ku-70223 эмаль ремонтная с кисточкой нарцисс 223, 15мл/ 12	296462	Строительные и отделочные материалы (folder)/Эмаль алкидная	615484	KUDO
3686115	4606445003024	Kudo ku-70225 эмаль ремонтная с кисточкой желтая 225, 15мл/ 12	296462	Строительные и отделочные материалы (folder)/Эмаль алкидная	615484	KUDO
3686116	4606445003031	Kudo ku-70228 эмаль ремонтная с кисточкой чайная роза 228, 15мл/ 12	296462	Строительные и отделочные материалы (folder)/Эмаль алкидная	615484	KUDO
3686117	4606445006278	Kudo ku-70230 эмаль ремонтная с кисточкой Жемчуг 230 (металлик), 15мл/ 12	296462	Строительные и отделочные материалы (folder)/Эмаль алкидная	615484	KUDO
3686118	4606445003048	Kudo ku-70233 эмаль ремонтная с кисточкой белая 233, 15мл/ 12	296462	Строительные и отделочные материалы (folder)/Эмаль алкидная	615484	KUDO
3686119	4606445003055	Kudo ku-70235 эмаль ремонтная с кисточкой бежевый 235, 15мл/ 12	296462	Строительные и отделочные материалы (folder)/Эмаль алкидная	615484	KUDO
3686120	4606445003062	Kudo ku-70236 эмаль ремонтная с кисточкой серо-бежевый 236, 15мл/ 12	296462	Строительные и отделочные материалы (folder)/Эмаль алкидная	615484	KUDO
3686121	4606445012903	Kudo ku-70239 эмаль ремонтная с кисточкой бежевый 239, 15мл/ 12	296462	Строительные и отделочные материалы (folder)/Эмаль алкидная	615484	KUDO
3686122	4606445006285	Kudo ku-70245 эмаль ремонтная с кисточкой Золотая Нива 245 (металлик), 15мл/ 12	296462	Строительные и отделочные материалы (folder)/Эмаль алкидная	615484	KUDO
3686123	4606445012576	Kudo ku-70257 эмаль ремонтная с кисточкой звездная пыль 257 (металлик), 15мл/ 12	296462	Строительные и отделочные материалы (folder)/Эмаль алкидная	615484	KUDO
3686124	4606445014266	Kudo ku-70262 эмаль ремонтная с кисточкой бронзовый век 262 (металлик), 15мл/ 6	296462	Строительные и отделочные материалы (folder)/Эмаль алкидная	615484	KUDO
3686125	4606445012286	Kudo ku-70270 эмаль ремонтная с кисточкой нефертити 270 (металлик), 15мл/ 12	296462	Строительные и отделочные материалы (folder)/Эмаль алкидная	615484	KUDO
3686126	4606445003086	Kudo ku-70276 эмаль ремонтная с кисточкой приз 276 (металлик), 15мл/ 12	296462	Строительные и отделочные материалы (folder)/Эмаль алкидная	615484	KUDO
3686127	4606445013115	Kudo ku-70277 эмаль ремонтная с кисточкой антилопа 277 (металлик), 15мл/ 12	296462	Строительные и отделочные материалы (folder)/Эмаль алкидная	615484	KUDO
3686128	4606445003093	Kudo ku-70280 эмаль ремонтная с кисточкой мираж 280 (металлик), 15мл/ 12	296462	Строительные и отделочные материалы (folder)/Эмаль алкидная	615484	KUDO
3686129	4606445007442	Kudo ku-70281 эмаль ремонтная с кисточкой Кристалл 281 (металлик), 15мл/ 12	296462	Строительные и отделочные материалы (folder)/Эмаль алкидная	615484	KUDO
3686130	4606445007459	Kudo ku-70286 эмаль ремонтная с кисточкой опатия 286 (металлик), 15мл/ 12	296462	Строительные и отделочные материалы (folder)/Эмаль алкидная	615484	KUDO
3686131	4606445014297	Kudo ku-70290 эмаль ремонтная с кисточкой южный крест 290 (металлик), 15мл/ 12	296462	Строительные и отделочные материалы (folder)/Эмаль алкидная	615484	KUDO
3686132	4606445015058	Kudo ku-70295 эмаль ремонтная с кисточкой сливочно-белая 295, 15мл/ 12	296462	Строительные и отделочные материалы (folder)/Эмаль алкидная	615484	KUDO
3686133	4606445012118	Kudo ku-70301 эмаль ремонтная с кисточкой серебристая ива 301 (металлик), 15мл/ 12	296462	Строительные и отделочные материалы (folder)/Эмаль алкидная	615484	KUDO
3686134	4606445005516	Kudo ku-70302 эмаль ремонтная с кисточкой лиана 302, 15мл/ 12	296462	Строительные и отделочные материалы (folder)/Эмаль алкидная	615484	KUDO
3686135	4606445003109	Kudo ku-70303 эмаль ремонтная с кисточкой хаки 303, 15мл/ 12	296462	Строительные и отделочные материалы (folder)/Эмаль алкидная	615484	KUDO
3686136	4606445011838	Kudo ku-70305 эмаль ремонтная с кисточкой аспарагус 305 (металлик), 15мл/ 12	296462	Строительные и отделочные материалы (folder)/Эмаль алкидная	615484	KUDO
3686137	4606445003116	Kudo ku-70307 эмаль ремонтная с кисточкой зеленый Сад 307, 15мл/ 12	296462	Строительные и отделочные материалы (folder)/Эмаль алкидная	615484	KUDO
3686138	4606445012101	Kudo ku-70308 эмаль ремонтная с кисточкой осока 308 (металлик), 15мл/ 12	296462	Строительные и отделочные материалы (folder)/Эмаль алкидная	615484	KUDO
3686139	4606445003123	Kudo ku-70309 эмаль ремонтная с кисточкой гренадер 309, 15мл/ 12	296462	Строительные и отделочные материалы (folder)/Эмаль алкидная	615484	KUDO
3686140	4606445006292	Kudo ku-70310 эмаль ремонтная с кисточкой валюта 310 (металлик), 15мл/ 12	296462	Строительные и отделочные материалы (folder)/Эмаль алкидная	615484	KUDO
3686141	4606445003130	Kudo ku-70311 эмаль ремонтная с кисточкой игуана 311 (металлик), 15мл/ 12	296462	Строительные и отделочные материалы (folder)/Эмаль алкидная	615484	KUDO
3686142	4606445012583	Kudo ku-70313 эмаль ремонтная с кисточкой водолей 313 (металлик), 15мл/ 12	296462	Строительные и отделочные материалы (folder)/Эмаль алкидная	615484	KUDO
3686143	4606445014303	Kudo ku-70322 эмаль ремонтная с кисточкой колумбийская зелень 322 (металлик), 15мл/ 12	296462	Строительные и отделочные материалы (folder)/Эмаль алкидная	615484	KUDO
3686144	4606445005448	Kudo ku-70325 эмаль ремонтная с кисточкой липа зеленая 325, 15мл/ 12	296462	Строительные и отделочные материалы (folder)/Эмаль алкидная	615484	KUDO
3686145	4606445015065	Kudo ku-70330 эмаль ремонтная с кисточкой зеленая 330, 15мл/ 12	296462	Строительные и отделочные материалы (folder)/Эмаль алкидная	615484	KUDO
3686146	4606445015072	Kudo ku-70331 эмаль ремонтная с кисточкой Золотой лист 331 (металлик), 15мл/ 12	296462	Строительные и отделочные материалы (folder)/Эмаль алкидная	615484	KUDO
3686147	4606445015089	Kudo ku-70340 эмаль ремонтная с кисточкой олива 340, 15мл/ 12	296462	Строительные и отделочные материалы (folder)/Эмаль алкидная	615484	KUDO
3686148	4606445007411	Kudo ku-70347 эмаль ремонтная с кисточкой Золото инков (металлик), 15мл/ 12	296462	Строительные и отделочные материалы (folder)/Эмаль алкидная	615484	KUDO
3686149	4606445012279	Kudo ku-70360 эмаль ремонтная с кисточкой Сочи 360 (металлик), 15мл/ 12	296462	Строительные и отделочные материалы (folder)/Эмаль алкидная	615484	KUDO
3686150	4606445012248	Kudo ku-70363 эмаль ремонтная с кисточкой цунами 363 (металлик), 15мл/ 12	296462	Строительные и отделочные материалы (folder)/Эмаль алкидная	615484	KUDO
3686151	4606445015713	Kudo ku-70370 эмаль ремонтная с кисточкой корсика 370 (металлик), 15мл/ 12	296462	Строительные и отделочные материалы (folder)/Эмаль алкидная	615484	KUDO
3686152	4606445003147	Kudo ku-70371 эмаль ремонтная с кисточкой амулет 371 (металлик), 15мл/ 12	296462	Строительные и отделочные материалы (folder)/Эмаль алкидная	615484	KUDO
3686153	4606445003161	Kudo ku-70377 эмаль ремонтная с кисточкой мурена 377, 15мл/ 12	296462	Строительные и отделочные материалы (folder)/Эмаль алкидная	615484	KUDO
3686154	4606445014310	Kudo ku-70381 эмаль ремонтная с кисточкой кентавр 381 (металлик), 15мл/ 12	296462	Строительные и отделочные материалы (folder)/Эмаль алкидная	615484	KUDO
3686155	4606445003178	Kudo ku-70383 эмаль ремонтная с кисточкой ниагара 383 (металлик), 15мл/ 12	296462	Строительные и отделочные материалы (folder)/Эмаль алкидная	615484	KUDO
3686156	4606445003185	Kudo ku-70385 эмаль ремонтная с кисточкой изумруд 385 (металлик), 15мл/ 12	296462	Строительные и отделочные материалы (folder)/Эмаль алкидная	615484	KUDO
3686157	4606445003192	Kudo ku-70387 эмаль ремонтная с кисточкой папирус 387 (металлик), 15мл/ 12	296462	Строительные и отделочные материалы (folder)/Эмаль алкидная	615484	KUDO
3686158	4606445014327	Kudo ku-70391 эмаль ремонтная с кисточкой робин гуд 391, 15мл/ 12	296462	Строительные и отделочные материалы (folder)/Эмаль алкидная	615484	KUDO
3686159	4606445003208	Kudo ku-70394 эмаль ремонтная с кисточкой темно-зеленый 394, 15мл/ 12	296462	Строительные и отделочные материалы (folder)/Эмаль алкидная	615484	KUDO
3686160	4606445003215	Kudo ku-70399 эмаль ремонтная с кисточкой табачная 399 (металлик), 15мл/ 12	296462	Строительные и отделочные материалы (folder)/Эмаль алкидная	615484	KUDO
3686161	4606445003222	Kudo ku-70400 эмаль ремонтная с кисточкой босфор 400, 15мл/ 12	296462	Строительные и отделочные материалы (folder)/Эмаль алкидная	615484	KUDO
3686162	4606445003239	Kudo ku-70403 эмаль ремонтная с кисточкой монте-карло 403, 15мл/ 12	296462	Строительные и отделочные материалы (folder)/Эмаль алкидная	615484	KUDO
3686163	4606445005486	Kudo ku-70404 эмаль ремонтная с кисточкой петергоф 404, 15мл/ 12	296462	Строительные и отделочные материалы (folder)/Эмаль алкидная	615484	KUDO
3686164	4606445003246	Kudo ku-70408 эмаль ремонтная с кисточкой чароит 408 (металлик), 15мл/ 12	296462	Строительные и отделочные материалы (folder)/Эмаль алкидная	615484	KUDO
3686165	4606445012125	Kudo ku-70412 эмаль ремонтная с кисточкой регата 412 (металлик), 15мл/ 12	296462	Строительные и отделочные материалы (folder)/Эмаль алкидная	615484	KUDO
3686166	4606445013054	Kudo ku-70415 эмаль ремонтная с кисточкой электрон 415 (металлик), 15мл/ 12	296462	Строительные и отделочные материалы (folder)/Эмаль алкидная	615484	KUDO
3686167	4606445003253	Kudo ku-70416 эмаль ремонтная с кисточкой Фея 416 (металлик), 15мл/ 12	296462	Строительные и отделочные материалы (folder)/Эмаль алкидная	615484	KUDO
3686168	4606445003260	Kudo ku-70417 эмаль ремонтная с кисточкой пицунда 417, 15мл/ 12	296462	Строительные и отделочные материалы (folder)/Эмаль алкидная	615484	KUDO
3686169	4606445003277	Kudo ku-70419 эмаль ремонтная с кисточкой опал 419 (металлик), 15мл/ 12	296462	Строительные и отделочные материалы (folder)/Эмаль алкидная	615484	KUDO
3686170	4606445003284	Kudo ku-70420 эмаль ремонтная с кисточкой Балтика 420, 15мл/ 12	296462	Строительные и отделочные материалы (folder)/Эмаль алкидная	615484	KUDO
