ID	UPCEAN	Name	CategoryID	CategoryName	BrandID	BrandName
711257	4620002031268	Играем вместе змея 58см на дисплее арт h382r поштучно /24	980	Игрушки (folder)/Игрушка	1791899	Играем Вместе
2232463	4690590042984	Играем вместе зонт Hello Kitty, диам. 73см	980	Игрушки (folder)/Игрушка	1791899	Играем Вместе
2232473	4690590039793	Играем вместе зонт Винни-пух прозрачный 73см	980	Игрушки (folder)/Игрушка	1791899	Играем Вместе
2727043	4690590090718	Играем вместе зонт дет.прозрачный дисней принцессы диам. 73см в пак. арт dc1014-prs	1	Неклассифицированные/default	1791899	Играем Вместе
2232474	4690590039809	Играем вместе зонт леопольд прозрачный 73см	980	Игрушки (folder)/Игрушка	1791899	Играем Вместе
2232475	4690590039854	Играем вместе зонт львенок и черепаха, 73см	980	Игрушки (folder)/Игрушка	1791899	Играем Вместе
2232476	4690590039762	Играем вместе зонт паровозик из ромашкова прозрачный 73см	980	Игрушки (folder)/Игрушка	1791899	Играем Вместе
2232477	4690590042922	Играем вместе зонт прозрачный Hello Kitty, в пакете	980	Игрушки (folder)/Игрушка	1791899	Играем Вместе
2232478	4690590067826	Играем вместе зонт прозрачный дисней мини, в пакете	980	Игрушки (folder)/Игрушка	1791899	Играем Вместе
2232479	4690590039816	Играем вместе зонт с ушами, леопольд, 73см	980	Игрушки (folder)/Игрушка	1791899	Играем Вместе
2232488	4690590039847	Играем вместе зонт чебурашка 73см	980	Игрушки (folder)/Игрушка	1791899	Играем Вместе
1213323	4610007430081	Играем вместе зонт-автомат Маша и медведь со свистком арт.w090-pr	980	Игрушки (folder)/Игрушка	0	
3811488	4690590042618	Играем вместе игра рыбал.Маша и медв.10рыб.2уд.	56347	Игрушки (folder)/Игра настольная	1791899	Играем Вместе
2727044	4690590088982	Играем вместе игра рыбалка кот леопольд на батар песенка арт b1184461-r	1	Неклассифицированные/default	1791899	Играем Вместе
3811489	4620002038489	Играем вместе игра рыбалка Простоквашино	980	Игрушки (folder)/Игрушка	1791899	Играем Вместе
2727045	4690590068144	Играем вместе игрушка Disney мэтр с кр. колесами, свет и звук, на блист. арт 4r-wls	1	Неклассифицированные/default	1791899	Играем Вместе
1961131	4690590051924	Играем вместе игрушка для купания my Little pony в сетке арт.47rus	980	Игрушки (folder)/Игрушка	0	
2727049	4690590071144	Играем вместе игрушка для купания my Little pony на блистере. арт 1bls	1	Неклассифицированные/default	1791899	Играем Вместе
2263552	4690590051894	Играем вместе игрушка для купания pet shop в сетке арт 44r	980	Игрушки (folder)/Игрушка	1791899	Играем Вместе
1961132	4690590052587	Играем вместе игрушка для купания айболит в сетке арт.37rus	980	Игрушки (folder)/Игрушка	0	
2436380	4690590057322	Играем вместе игрушка для купания барабоскины м/ф-гена арт. LG-10r свет. на блистере	1	Неклассифицированные/default	0	
2233096	4690590052167	Играем вместе игрушка для купания кот в сапогах в сетке арт.36r	980	Игрушки (folder)/Игрушка	0	
1961134	4690590052150	Играем вместе игрушка для купания Маша-снегурочка (м/ф Маша и медведь) в сетке арт.34r	980	Игрушки (folder)/Игрушка	0	
2233097	4690590060599	Играем вместе игрушка для купания мэтр свет и звук арт.5r-ls	980	Игрушки (folder)/Игрушка	1791899	Играем Вместе
2248050	4690590067703	Играем вместе игрушка для купания паровозик тишка арт 12r-ls	980	Игрушки (folder)/Игрушка	1791899	Играем Вместе
2233098	4690590068137	Играем вместе игрушка маккуин с колесами арт.3r-wls на блистере свет и звук	980	Игрушки (folder)/Игрушка	0	
2727050	4690590080177	Играем вместе игрушка пвх Hot wheels, свет и звук, крутятся колеса, на блистере. арт 7r-wls	1	Неклассифицированные/default	1791899	Играем Вместе
2727051	4690590080238	Играем вместе игрушка пвх бычок, свет и звук на блистере арт 19r-ls	1	Неклассифицированные/default	1791899	Играем Вместе
2727052	4690590080269	Играем вместе игрушка пвх зайка, свет и звук на блистере арт 21r-ls	1	Неклассифицированные/default	1791899	Играем Вместе
2727053	4690590080245	Играем вместе игрушка пвх кораблик, свет и звук на блистере арт 20r-ls	1	Неклассифицированные/default	1791899	Играем Вместе
2727054	4690590080214	Играем вместе игрушка пвх мишка, свет и звук на блистере арт 17r-ls	1	Неклассифицированные/default	1791899	Играем Вместе
2727055	4690590080221	Играем вместе игрушка пвх уточка, свет и звук на блистере арт 18r-ls	1	Неклассифицированные/default	1791899	Играем Вместе
3811490	4690590113639	Играем вместе игрушки изображ.жив.	337649	Уход за детьми (folder)/Уход за детьми	1791899	Играем Вместе
3811491	4690590113646	Играем вместе игрушки изображ.жив. #2	337649	Уход за детьми (folder)/Уход за детьми	1791899	Играем Вместе
3811492	4690590113653	Играем вместе игрушки изображ.жив. #3	337649	Уход за детьми (folder)/Уход за детьми	1791899	Играем Вместе
3811493	4690590113677	Играем вместе игрушки изображ.жив. #4	337649	Уход за детьми (folder)/Уход за детьми	1791899	Играем Вместе
2436381	4690590071328	Играем вместе касса Winx интерактивная на батар . свет и звук, арт.hk600364	1	Неклассифицированные/default	0	
1961136	4690590063842	Играем вместе катер спайдермен радупр радиус действия 15-20м, арт.r/c-16	451123	Игрушки (folder)/Игрушка радиоуправляемая	0	
2727056	4690590091913	Играем вместе катер человек паук арт b1224941-r (на батарейках)	1	Неклассифицированные/default	1791899	Играем Вместе
1666663	4640001715099	Играем вместе кларнет львенок и черепаха в кор. арт.в323586	1	Неклассифицированные/default	0	
2727057	4690590087244	Играем вместе кларнет тачки Disney на блистере арт b46570-r3	1	Неклассифицированные/default	1791899	Играем Вместе
1666664	4690590000700	Играем вместе коврик-паззл Winx 8элем арт.fs-Winx	98188	Игрушки (folder)/Паззл	0	
1666665	4690590012307	Играем вместе коврик-паззл Винни-пух 54 дет. в сумке арт.st01	98188	Игрушки (folder)/Паззл	0	
1666667	4690590012314	Играем вместе коврик-паззл Маша и медведь 54 дет. в сумке арт.st02	98188	Игрушки (folder)/Паззл	0	
2233099	4690590048641	Играем вместе коврик-паззл Маша и медведь с вырезанными буквами арт.fs-abc-03-mm	980	Игрушки (folder)/Игрушка	0	
2436382	4690590048634	Играем вместе коврик-паззл Маша и медведь с вырезанными цифрами арт.fs-num-03-mm	1	Неклассифицированные/default	0	
1961137	4690590001240	Играем вместе коврик-паззл ну, погоди 8элем арт.fs-np-01	1	Неклассифицированные/default	0	
1961138	4690590048597	Играем вместе коврик-паззл поезд динозавров 8элем арт.fs-dino	1	Неклассифицированные/default	0	
2235774	4690590048658	Играем вместе коврик-паззл тачки с вырезанными цифрами арт fs-num-04-cars	980	Игрушки (folder)/Игрушка	1791899	Играем Вместе
1666668	4690590027745	Играем вместе копилка-матрешка Маша и медведь арт.3599-masha	1	Неклассифицированные/default	0	
2436383	4690590053317	Играем вместе кофемашина Winx нна бат. озвуч с аксессуарами арт.16274-r	1	Неклассифицированные/default	1791899	Играем Вместе
2436384	4690590045398	Играем вместе кошка мари интерактивная с бутылочкой 7 функций арт.jx-2408	1	Неклассифицированные/default	0	
1666673	4690590027738	Играем вместе кружка керамическая с рис. Winx (краски+кисточка) арт. 1271-14 /48	1	Неклассифицированные/default	0	
2233101	4690590055083	Играем вместе кружка керамическая с рис. Винни-пух (краски+кисточка) арт. 1271-21	980	Игрушки (folder)/Игрушка	0	
1961139	4690590055069	Играем вместе кружка керамическая с рис. Золушка (краски+кисточка) арт. 1271-19	1	Неклассифицированные/default	0	
2436385	4610007437745	Играем вместе кружка керамическая с рис. леопольд (краски+кисточка) арт.1271-1	1	Неклассифицированные/default	1791899	Играем Вместе
1666674	4690590017623	Играем вместе кружка керамическая с рис. Маша и медведь (краски+кисточка) арт. 1271-3	1	Неклассифицированные/default	0	
2233102	4690590038932	Играем вместе кружка керамическая с рис. Мой маленький пони (краски+кисточка) арт. 1271-17 /48	980	Игрушки (folder)/Игрушка	0	
1961140	4690590055076	Играем вместе кружка керамическая с рис. русалочка (краски+кисточка) арт. 1271-20	1	Неклассифицированные/default	0	
1666676	4690590017647	Играем вместе кружка керамическая с рис. чебурашка (краски+кисточка) арт. 1271-5	1	Неклассифицированные/default	0	
2436387	4690590071779	Играем вместе кухня Winx свет и звук с водой и аксесс-ми арт.fxg1010-r	1	Неклассифицированные/default	1791899	Играем Вместе
2727060	4690590083864	Играем вместе кухня принцессы на батар свет и звук	1	Неклассифицированные/default	1791899	Играем Вместе
2727061	4640001716928	Играем вместе лошадь с аксессуарами 13см, флокирован. покрытие арт 37r	1	Неклассифицированные/default	1791899	Играем Вместе
1213325	4670005960010	Играем вместе лошадь с аксессуарами в мире животных 14см арт 3061pdqr	980	Игрушки (folder)/Игрушка	1791899	Играем Вместе
2233108	4690590060636	Играем вместе Лунтик свет и звук пвх арт.9r-ls	980	Игрушки (folder)/Игрушка	0	
2727062	4690590092200	Играем вместе магнитная доска для рисования дисней холодное сердце на блист. арт hs105-rf	1	Неклассифицированные/default	1791899	Играем Вместе
2727063	4690590092217	Играем вместе магнитная доска для рисования фиксики, 2 печати на блист. арт hs8006kfix	1	Неклассифицированные/default	1791899	Играем Вместе
1961146	4690590048405	Играем вместе магнитная доска тачки арт.hm1115a-rc (с русск. буквами,цифрами) в коробке	1	Неклассифицированные/default	0	
1666684	4610007435871	Играем вместе маракасы львенок и черепаха на карт. арт.в409790	1	Неклассифицированные/default	0	
2244601	4690590043523	Играем вместе маракасы Маша и медведь на карт. арт b409790-r2	980	Игрушки (folder)/Игрушка	1791899	Играем Вместе
1961147	4690590051955	Играем вместе машина бетономешалка арт.8766-g	1	Неклассифицированные/default	0	
1961148	4690590034958	Играем вместе машина бетономешалка арт.ft6079 (пластик.,инерц.)	1	Неклассифицированные/default	0	
1961149	4690590051962	Играем вместе машина самосвал арт.8866-g	1	Неклассифицированные/default	0	
2233109	4690590034903	Играем вместе машина самосвал поднимается кузов арт.d02-3	980	Игрушки (folder)/Игрушка	0	
2727064	4690590012635	Играем вместе машина-перевертыш на батар свет и звук, арт b877621-r	1	Неклассифицированные/default	1791899	Играем Вместе
2436388	4690590035610	Играем вместе медведь озвуч арт.ic86+129	1	Неклассифицированные/default	1791899	Играем Вместе
1666687	4690590024027	Играем вместе мелки для ванной Маша и медведь (4цв по 16г) арт.soap01	1	Неклассифицированные/default	0	
1666688	4690590024041	Играем вместе мелки для ванной Маша и медведь выдвижные (5цв+ штамп-уточка) арт.soap11	1	Неклассифицированные/default	0	
760215	4640001710698	Играем вместе мелодика львенок и черепаха арт.в48077	980	Игрушки (folder)/Игрушка	0	
1666359	4690590048924	Играем вместе металлофон Маша и медведь с часами арт b362755-r2	980	Игрушки (folder)/Игрушка	1791899	Играем Вместе
2436389	4690590074183	Играем вместе мешок для обуви marvell, мстители в пак. арт.15sb-01-mave	1	Неклассифицированные/default	0	
2436390	4690590079362	Играем вместе мешок для обуви Винни дисней, в пак. арт.15sb-01-dwin	1	Неклассифицированные/default	1791899	Играем Вместе
2436391	4690590056431	Играем вместе микрофон Маша и медведь на бат, со светом, 3 песни арт.838-31	1	Неклассифицированные/default	1791899	Играем Вместе
1961150	4690590053201	Играем вместе миксер Маша и медведь со светом арт.xs-502-r	1	Неклассифицированные/default	1791899	Играем Вместе
2727066	4690590068458	Играем вместе молоток фиксики арт kt1301. на батар свет и звук.	1	Неклассифицированные/default	1791899	Играем Вместе
2727067	4690590090725	Играем вместе мыльные пузыри дисней принцессы: волшебная палочка (боится хол.) арт 60281b-prs	1	Неклассифицированные/default	1791899	Играем Вместе
2727068	4690590090732	Играем вместе мыльные пузыри дисней София первая: волшебная палочка (боится хол.) арт 60281b-stf	1	Неклассифицированные/default	1791899	Играем Вместе
1666689	6934614438109	Играем вместе мяч littlest petshop 23см арт.fpb-9 (lps)	1	Неклассифицированные/default	0	
1666690	4690590029459	Играем вместе мяч my Little pony 15см арт.fpb-6 (mlp)	1	Неклассифицированные/default	0	
713130	4690590007495	Играем вместе мяч Winx 45см с рожками арт.sj-18 (wx)	1	Неклассифицированные/default	0	
2727069	4690590072691	Играем вместе мяч барби 23см арт ds-9 (brb)	1	Неклассифицированные/default	1791899	Играем Вместе
713129	4690590007464	Играем вместе мяч барбоскины 23см арт.fpb-9 (bo)	1	Неклассифицированные/default	0	
1666691	4690590039441	Играем вместе мяч бэмби.Disney Classic 23см арт.fpb-9 (dc)	1	Неклассифицированные/default	0	
2727070	4690590072646	Играем вместе мяч Винни-пух пвх 23см в сетке арт ds-9 (vn)	1	Неклассифицированные/default	1791899	Играем Вместе
2436392	4690590072592	Играем вместе мяч Винни.дисней 23см (в сетке) арт.ds-9 (wtp)	1	Неклассифицированные/default	1791899	Играем Вместе
2436393	4690590071441	Играем вместе мяч джейк и пираты.дисней 23см (в сетке) арт.ds-9 (pir)	1	Неклассифицированные/default	0	
2727071	4690590072578	Играем вместе мяч король лев 23см арт ds-9 (lk)	1	Неклассифицированные/default	1791899	Играем Вместе
713131	4610007431682	Играем вместе мяч Маша и медведь 55см арт.sh-22 (ma)	1	Неклассифицированные/default	0	
2436394	4690590072660	Играем вместе мяч Мой маленький пони 23см hasbro арт.ds-9 (mlp) в сетке	1	Неклассифицированные/default	0	
2436395	4690590072639	Играем вместе мяч паровозик из ромашково 23см (в сетке) арт.ds-9 (pa)	1	Неклассифицированные/default	0	
2727072	4690590039496	Играем вместе мяч принцессы дисней ассортим 23см в сетке. арт ad-9 (prs)	1	Неклассифицированные/default	1791899	Играем Вместе
2436396	6934614437027	Играем вместе мяч прыгающий Маша и медведь 5.5см арт.e03-1355-masha and the bear	1	Неклассифицированные/default	1791899	Играем Вместе
2436397	4690590072585	Играем вместе мяч русалочка.дисней 23см (в сетке) арт.ds-9 (mrm)	1	Неклассифицированные/default	0	
1666692	6934614438222	Играем вместе мяч с рожками littlest petshop 45см арт.sj-18 (lps)	1	Неклассифицированные/default	0	
1961151	4690590007549	Играем вместе мяч с рожками Winx 55см арт.sj-22 (wx)	1	Неклассифицированные/default	0	
1666693	4690590038994	Играем вместе мяч с рожками Винни-пух 55см арт.sj-22 (wtp)	1	Неклассифицированные/default	0	
2436398	4610007431811	Играем вместе мяч с рожками Маша и медведь 45см арт.sj-18 (ma)	1	Неклассифицированные/default	0	
2727073	6934556025214	Играем вместе мяч с рожками мультфильмы 45см ассортим. арт e03-3170Mix	1	Неклассифицированные/default	1791899	Играем Вместе
1666694	6934614438253	Играем вместе мяч с рожками трансформеры 45см арт.sj-18 (tr)	1	Неклассифицированные/default	0	
1666695	6934614438468	Играем вместе мяч с ручкой my Little pony 45см арт.sh-18 (mlp)	1	Неклассифицированные/default	0	
2727074	6934556025245	Играем вместе мяч с ручкой мультфильмыы 45см ассортим. арт e03-3172Mix	1	Неклассифицированные/default	1791899	Играем Вместе
1666696	4690590037430	Играем вместе мяч с ручкой тачки 45см арт.sh-18 (са)	1	Неклассифицированные/default	0	
2727075	4690590072479	Играем вместе мяч София прекрасная 23см арт ad-9 (stf)	1	Неклассифицированные/default	1791899	Играем Вместе
2727076	4690590071458	Играем вместе мяч София прекрасная 23см в сетке арт ds-9 (stf)	1	Неклассифицированные/default	1791899	Играем Вместе
2727077	4690590071465	Играем вместе мяч тачки 23см (в сетке) арт ds-9 (car)	1	Неклассифицированные/default	1791899	Играем Вместе
2436399	4690590072677	Играем вместе мяч трансформеры 23см hasbro арт.ds-9 (trf) в сетке	1	Неклассифицированные/default	0	
1666697	4690590029473	Играем вместе мяч трансформеры 23см арт.fpb-9 (tr)	1	Неклассифицированные/default	0	
1666698	6934614438086	Играем вместе мяч турбо 23см арт.fpb-9 (tu)	1	Неклассифицированные/default	0	
1666699	4690590029497	Играем вместе мяч фиксики 23см арт.ad-9 (fi) #2	1	Неклассифицированные/default	0	
2436400	4690590042748	Играем вместе набор аксессуаров для волос Winx на батар (10предм) арт.be042-r	1	Неклассифицированные/default	1791899	Играем Вместе
2436401	4690590070079	Играем вместе набор военный с самолетом/вертолетом,машиной,фигуркой,оружием арт.l33310-r	1	Неклассифицированные/default	1791899	Играем Вместе
2436402	4690590054086	Играем вместе набор дикие животные 6шт арт.hcd335-6 (на блистере)	1	Неклассифицированные/default	0	
2727078	4690590089415	Играем вместе набор дикие животные 9шт 10см в пакете арт ph040909a15	1	Неклассифицированные/default	1791899	Играем Вместе
713136	4690383001440	Играем вместе набор динозавров 2шт по 13см арт.р2511-2	1	Неклассифицированные/default	0	
2436403	4690590052228	Играем вместе набор для купания 3в1 Маша+медведь+тигр в пакете . арт 168rus-pvc	1	Неклассифицированные/default	1791899	Играем Вместе
2727079	4690590060681	Играем вместе набор для купания арт 144-145rus м/ф 38 попугаев в пакете	1	Неклассифицированные/default	1791899	Играем Вместе
1968611	4690590052426	Играем вместе набор для купания арт 162r-163r-164r-pvc ассортим тачки Disney в пакете	1	Неклассифицированные/default	1791899	Играем Вместе
2248436	4690590051832	Играем вместе набор для купания арт 170r бэмби (олененок+зайка)	980	Игрушки (folder)/Игрушка	1791899	Играем Вместе
2248040	4690590051863	Играем вместе набор для купания арт 172r белоснежка и гномы в сетке	980	Игрушки (folder)/Игрушка	1791899	Играем Вместе
