ID	UPCEAN	Name	CategoryID	CategoryName	BrandID	BrandName
43216	3258691160955	Вино dourthe леклоше с.эмильон красн сух 12.5% 750мл	41821	Продукты питания (folder)/Алкогольные напитки/Вино (folder)/Вина Франции	43192	Dourthe
2954248	3258691256320	Вино dourthe леклоше с.эмильон красн сух 12.5% 750мл #2	41821	Продукты питания (folder)/Алкогольные напитки/Вино (folder)/Вина Франции	43192	Dourthe
2954249	3258691226927	Вино dourthe леклоше с.эмильон красн сух 12.5% 750мл #3	41821	Продукты питания (folder)/Алкогольные напитки/Вино (folder)/Вина Франции	43192	Dourthe
150592	3258691209357	Вино dourthe мерло красн 750мл	22133	Продукты питания (folder)/Алкогольные напитки/Вино (folder)/Вино	43192	Dourthe
43219	3258691107691	Вино dourthe о медок шато ланессан крю буржуа 12% 750мл красн сух	41821	Продукты питания (folder)/Алкогольные напитки/Вино (folder)/Вина Франции	43192	Dourthe
689487	3258691238616	Вино dourthe эссанс де дурт бордо красн сух 750мл	688367	Продукты питания (folder)/Алкогольные напитки/Вино (folder)/Вина Франции Бордо	43192	Dourthe
1759853	3333780203000	Вино dr&eat.s.seaf.с.б12% 750мл	22133	Продукты питания (folder)/Алкогольные напитки/Вино (folder)/Вино	0	
1517575	40804415	Вино dr.zen.Gold heav.бел полусладк 9.5% 750мл	1	Неклассифицированные/default	193921	KUHNE
3791239	40804378	Вино dr.zen.Red heav. красн полусладк 750мл	22133	Продукты питания (folder)/Алкогольные напитки/Вино (folder)/Вино	3791238	DR.ZENZEN
3791241	1000018002415	Вино dr.изаб.молд. красн полусладк 9% 1.5л	22133	Продукты питания (folder)/Алкогольные напитки/Вино (folder)/Вино	3791240	DRIADA
1194864	4840526003668	Вино driada Pinot Noir марочное красное сухое 11-13% 750мл стбут	22133	Продукты питания (folder)/Алкогольные напитки/Вино (folder)/Вино	0	
3284281	3800007814757	Вино driada Wine каберне красное сухое 13% 750мл стекло	1759169	Продукты питания (folder)/Алкогольные напитки/Вино (folder)/Вина Болгарии	0	
3284282	3800007814788	Вино driada Wine пино-нуар красное сухое 11-13% 750мл стекло	1759169	Продукты питания (folder)/Алкогольные напитки/Вино (folder)/Вина Болгарии	0	
3284283	3800007814771	Вино driada Wine совиньон белое сухое 11-13% 750мл стекло	1759169	Продукты питания (folder)/Алкогольные напитки/Вино (folder)/Вина Болгарии	0	
3284284	3800007814764	Вино driada Wine шардоне белое сухое 10-13% 750мл стекло	1759169	Продукты питания (folder)/Алкогольные напитки/Вино (folder)/Вина Болгарии	0	
689845	4840526000568	Вино driada домашнее каберне столов красное полусладк 10-12% 1.5л стекло	22133	Продукты питания (folder)/Алкогольные напитки/Вино (folder)/Вино	0	
2853695	4840254001745	Вино driada каберне столов красное полусладк 10-12% 750мл стекло	22133	Продукты питания (folder)/Алкогольные напитки/Вино (folder)/Вино	0	
45001	012086341014	Вино drouhin meursault бел сух 13% 750мл	41821	Продукты питания (folder)/Алкогольные напитки/Вино (folder)/Вина Франции	362565	Drouhin
3791242	4690491015902	Вино drouhin лаф.бург.шар.13% б.с.0.375л	22133	Продукты питания (folder)/Алкогольные напитки/Вино (folder)/Вино	362565	Drouhin
3791243	4690491024713	Вино drouhin лаф.бург.шар.13% б.с.0.375л #2	22133	Продукты питания (folder)/Алкогольные напитки/Вино (folder)/Вино	362565	Drouhin
3791244	4690491057438	Вино drouhin лаф.бург.шар.13% б.с.0.375л #3	22133	Продукты питания (folder)/Алкогольные напитки/Вино (folder)/Вино	362565	Drouhin
3791245	4690491063187	Вино drouhin лаф.бург.шар.13% б.с.0.375л #4	22133	Продукты питания (folder)/Алкогольные напитки/Вино (folder)/Вино	362565	Drouhin
3284285	3800003415408	Вино drugar старый знахарь столов красное полусладк 11% 750мл стекло	1759169	Продукты питания (folder)/Алкогольные напитки/Вино (folder)/Вина Болгарии	0	
3284286	3416830530476	Вино duc de laroche белое столов полусладк 11% 0.7л стекло	22133	Продукты питания (folder)/Алкогольные напитки/Вино (folder)/Вино	0	
3284287	3416830530452	Вино duc de laroche белое столов сухое 11.5% 750мл стекло	22133	Продукты питания (folder)/Алкогольные напитки/Вино (folder)/Вино	0	
3284288	3416830530445	Вино duc de laroche красное столов полусладк 11% 0.7л стекло	22133	Продукты питания (folder)/Алкогольные напитки/Вино (folder)/Вино	0	
3284289	3249381048264	Вино duc de roche красное полусладк 10.5% 750мл стекло	22133	Продукты питания (folder)/Алкогольные напитки/Вино (folder)/Вино	0	
3284290	3249381048288	Вино duc de roches белое полусладк 10.5% 750мл ст/б	22133	Продукты питания (folder)/Алкогольные напитки/Вино (folder)/Вино	0	
3284291	3249381048271	Вино duc de roches белое сухое 11% 750мл ст/б	22133	Продукты питания (folder)/Алкогольные напитки/Вино (folder)/Вино	0	
3284292	3249381048257	Вино duc de roches красное сухое 11% 750мл ст/б	22133	Продукты питания (folder)/Алкогольные напитки/Вино (folder)/Вино	0	
3284293	8008863047912	Вино duca matteo primo bardolino красное сухое 12% 750мл ст/б	22133	Продукты питания (folder)/Алкогольные напитки/Вино (folder)/Вино	0	
3284294	8008863047905	Вино duca matteo primo chianti красное сухое 12% 750мл ст/б	22133	Продукты питания (folder)/Алкогольные напитки/Вино (folder)/Вино	0	
3284295	8008863047899	Вино duca matteo primo montepulciano dabruzzo красное сухое 12% 750мл ст/б	22133	Продукты питания (folder)/Алкогольные напитки/Вино (folder)/Вино	0	
3284296	8008863047882	Вино duca matteo primo nero davola красное сухое 12% 750мл ст/б	22133	Продукты питания (folder)/Алкогольные напитки/Вино (folder)/Вино	0	
3284297	8008863047936	Вино duca matteo primo trebbiano белое сухое 12% 750мл ст/б	22133	Продукты питания (folder)/Алкогольные напитки/Вино (folder)/Вино	0	
3284298	8008863047929	Вино duca matteo primo veneto Chardonnay белое сухое 12% 750мл ст/б	22133	Продукты питания (folder)/Алкогольные напитки/Вино (folder)/Вино	0	
3647684	8009620822322	Вино ducento вальполичелла красн сух 12% 750мл	22133	Продукты питания (folder)/Алкогольные напитки/Вино (folder)/Вино	3647683	DUCENTO
2425310	3249381045492	Вино duk de ceyrac blanc moelleux белое полусладк 10.5% 750мл стекло	22133	Продукты питания (folder)/Алкогольные напитки/Вино (folder)/Вино	0	
3284299	3249381045485	Вино duk de ceyrac blanc sec белое cухое 10.5% 750мл стекло	22133	Продукты питания (folder)/Алкогольные напитки/Вино (folder)/Вино	0	
2425309	3249381045478	Вино duk de ceyrac Rouge moelleux красное полусладк 10.5% 750мл стекло	22133	Продукты питания (folder)/Алкогольные напитки/Вино (folder)/Вино	0	
3284300	3249381045461	Вино duk de ceyrac Rouge sec красное сухое 11% 750мл стекло	22133	Продукты питания (folder)/Алкогольные напитки/Вино (folder)/Вино	0	
3284301	4607062867136	Вино Duo aligote saperavi розовое сухое 12% 750мл стекло	22133	Продукты питания (folder)/Алкогольные напитки/Вино (folder)/Вино	0	
3284302	4607062867129	Вино Duo aligote traminer белое сухое 12% 750мл ст/б	22133	Продукты питания (folder)/Алкогольные напитки/Вино (folder)/Вино	0	
227388	3291890001360	Вино duprat Gold каберне совиньон красн сух 750мл 11%	22133	Продукты питания (folder)/Алкогольные напитки/Вино (folder)/Вино	0	
227389	3291890001926	Вино duprat Gold мерло красн сух 750мл 11%	22133	Продукты питания (folder)/Алкогольные напитки/Вино (folder)/Вино	0	
227390	3291890001476	Вино duprat Gold сира красн сух 750мл 11%	22133	Продукты питания (folder)/Алкогольные напитки/Вино (folder)/Вино	0	
227391	3291890001513	Вино duprat Gold совиньон бел сух 750мл 11%	22133	Продукты питания (folder)/Алкогольные напитки/Вино (folder)/Вино	0	
227392	3291890001131	Вино duprat Gold шардоне бел сух 750мл 11%	22133	Продукты питания (folder)/Алкогольные напитки/Вино (folder)/Вино	0	
227393	3291890010836	Вино duprat мерло красн сух 750мл 11%	22133	Продукты питания (folder)/Алкогольные напитки/Вино (folder)/Вино	0	
227394	3291890010843	Вино duprat сира красн сух 750мл 11%	22133	Продукты питания (folder)/Алкогольные напитки/Вино (folder)/Вино	0	
227395	3291890010829	Вино duprat совиньон бел сух 750мл 11%	22133	Продукты питания (folder)/Алкогольные напитки/Вино (folder)/Вино	0	
227396	3291890010867	Вино duprat шардоне бел сух 750мл 11%	22133	Продукты питания (folder)/Алкогольные напитки/Вино (folder)/Вино	0	
42858	4600201910014	Вино e.guigal cotes du rhone бел сух 13.5% 750мл	41821	Продукты питания (folder)/Алкогольные напитки/Вино (folder)/Вина Франции	42856	E.Guigal
42859	3536650501002	Вино e.guigal cotes du rhone красн сух 13.5% 750мл	41821	Продукты питания (folder)/Алкогольные напитки/Вино (folder)/Вина Франции	42856	E.Guigal
2954222	4600202590017	Вино e.guigal cotes du rhone красн сух 13.5% 750мл #2	41821	Продукты питания (folder)/Алкогольные напитки/Вино (folder)/Вина Франции	42856	E.Guigal
689319	3536650502009	Вино e.guigal cotes du rhone руж красн сух 0.375л	689282	Продукты питания (folder)/Алкогольные напитки/Вино (folder)/Вина Франции Долина Роны	42856	E.Guigal
42857	4600201990023	Вино e.guigal жигонда красн сух 13.5% 750мл	41821	Продукты питания (folder)/Алкогольные напитки/Вино (folder)/Вина Франции	42856	E.Guigal
689318	3536650601009	Вино e.guigal жигондас красн сух 750мл	689282	Продукты питания (folder)/Алкогольные напитки/Вино (folder)/Вина Франции Долина Роны	42856	E.Guigal
1659764	3536650711005	Вино e.guigal кондрие ла дорьян бел сух 750мл	689282	Продукты питания (folder)/Алкогольные напитки/Вино (folder)/Вина Франции Долина Роны	42856	E.Guigal
42860	4600200630012	Вино e.guigal кроз эрмитаж бел сух 12.5% 750мл	41821	Продукты питания (folder)/Алкогольные напитки/Вино (folder)/Вина Франции	42856	E.Guigal
2954223	4600201380015	Вино e.guigal кроз эрмитаж бел сух 12.5% 750мл #2	41821	Продукты питания (folder)/Алкогольные напитки/Вино (folder)/Вина Франции	42856	E.Guigal
42861	3536650801003	Вино e.guigal кроз эрмитаж красн сух 13% 750мл	41821	Продукты питания (folder)/Алкогольные напитки/Вино (folder)/Вина Франции	42856	E.Guigal
42862	4600201980017	Вино e.guigal сен-жозеф красн сух 12.5% 750мл	41821	Продукты питания (folder)/Алкогольные напитки/Вино (folder)/Вина Франции	42856	E.Guigal
689321	3536650931007	Вино e.guigal сен-жозеф красн сух 750мл	689282	Продукты питания (folder)/Алкогольные напитки/Вино (folder)/Вина Франции Долина Роны	42856	E.Guigal
42863	4600200510017	Вино e.guigal эрмитаж красн сух 14% 750мл	41821	Продукты питания (folder)/Алкогольные напитки/Вино (folder)/Вина Франции	42856	E.Guigal
2954224	3536650201001	Вино e.guigal эрмитаж красн сух 14% 750мл #2	41821	Продукты питания (folder)/Алкогольные напитки/Вино (folder)/Вина Франции	42856	E.Guigal
1659765	1000034857969	Вино e.guigal эрмитаж руж красн сух 750мл	689282	Продукты питания (folder)/Алкогольные напитки/Вино (folder)/Вина Франции Долина Роны	42856	E.Guigal
1193004	4003301016974	Вино Eagle Creek руби каберне 2005 красн сух 750мл (США)	22133	Продукты питания (folder)/Алкогольные напитки/Вино (folder)/Вино	0	
451637	4003301016950	Вино Eagle Creek цинфандель красн сухое 750мл виноградное натуральное США	22133	Продукты питания (folder)/Алкогольные напитки/Вино (folder)/Вино	0	
1193005	4003301030185	Вино Eagle Creek шардоне белое сухое 13% 750мл ст/б	22133	Продукты питания (folder)/Алкогольные напитки/Вино (folder)/Вино	0	
1759854	4100060002856	Вино echezeaux gc к.с.12% 750мл	22133	Продукты питания (folder)/Алкогольные напитки/Вино (folder)/Вино	0	
363718	5010186017162	Вино Echo falls Pinot Grigio белое сухое 750мл	22133	Продукты питания (folder)/Алкогольные напитки/Вино (folder)/Вино	589883	Echo Falls
589896	5010186014574	Вино Echo falls White бел п/ сух 11.5% 750мл	22133	Продукты питания (folder)/Алкогольные напитки/Вино (folder)/Вино	589883	Echo Falls
3284303	4607116234105	Вино eco Wine Изабелла красное полусладк 10% 0.7л стбут	22133	Продукты питания (folder)/Алкогольные напитки/Вино (folder)/Вино	0	
3284304	4607116235706	Вино eco Wine Изабелла красное серия лоза 10% 0.7л стбут	22133	Продукты питания (folder)/Алкогольные напитки/Вино (folder)/Вино	0	
3284305	4607116234129	Вино eco Wine кабарне 700мл	22133	Продукты питания (folder)/Алкогольные напитки/Вино (folder)/Вино	0	
3284306	4607136393639	Вино eco Wine каберне полусл красн 10-12% 0.7 стекло	22133	Продукты питания (folder)/Алкогольные напитки/Вино (folder)/Вино	0	
3284307	4607136396128	Вино eco Wine мускат лазурный 0.7л п/с крас	22133	Продукты питания (folder)/Алкогольные напитки/Вино (folder)/Вино	0	
3284308	4607136397880	Вино eco Wine мускат лазурный столов красное полусладк 10-12% 0.7л ст/б	22133	Продукты питания (folder)/Алкогольные напитки/Вино (folder)/Вино	0	
3284309	4607136396074	Вино eco Wine мускат нежный столов белое полусладк 10-12% 0.7л ст/б	22133	Продукты питания (folder)/Алкогольные напитки/Вино (folder)/Вино	0	
3284310	4607136396111	Вино eco Wine мускат полусл бел 10-12% 0.75 стекло	22133	Продукты питания (folder)/Алкогольные напитки/Вино (folder)/Вино	0	
3284311	4607116235720	Вино eco Wine мускат столов полусладк белое 10-12% 0.7л ст/б	22133	Продукты питания (folder)/Алкогольные напитки/Вино (folder)/Вино	0	
3284312	4630030840213	Вино eco Wine мускат столов полусладк белое 10-12% 0.7л ст/б #2	22133	Продукты питания (folder)/Алкогольные напитки/Вино (folder)/Вино	0	
3284313	4607136393783	Вино eco Wine черноморский вальс полусладк красное 10-12% 0.7л ст/б	22133	Продукты питания (folder)/Алкогольные напитки/Вино (folder)/Вино	0	
3284314	4607136393721	Вино eco Wine шардоне полусл бел 10-12% 0.7 стекло	22133	Продукты питания (folder)/Алкогольные напитки/Вино (folder)/Вино	0	
3284315	4607116235690	Вино eco Wine шардоне столов сухое белое 10-12% 0.7л ст/б	22133	Продукты питания (folder)/Алкогольные напитки/Вино (folder)/Вино	0	
3284316	4039208170433	Вино edle wienglocke белое столов полусладк 9.5% 750мл ст/б	22133	Продукты питания (folder)/Алкогольные напитки/Вино (folder)/Вино	0	
3284317	4039208170532	Вино edle wienglocke красное столов полусладк 9.5% 750мл ст/б	22133	Продукты питания (folder)/Алкогольные напитки/Вино (folder)/Вино	0	
3284318	4600785000149	Вино eko, мускат лазурный, красное полусладк 12%, 750мл ст/б	22133	Продукты питания (folder)/Алкогольные напитки/Вино (folder)/Вино	0	
2855263	8427894001043	Вино el anhello de espana белое сухое 10-12% 750мл стбут	22133	Продукты питания (folder)/Алкогольные напитки/Вино (folder)/Вино	0	
2855262	8427894001036	Вино el anhello de espana столов белое полусладк 11% 750мл стекло	22133	Продукты питания (folder)/Алкогольные напитки/Вино (folder)/Вино	0	
2855264	8427894001012	Вино el anhello de espana столов красное сухое 11% 750мл ст/б	22133	Продукты питания (folder)/Алкогольные напитки/Вино (folder)/Вино	0	
2855265	8427894001029	Вино el anhello красн сух 11% 750мл	22133	Продукты питания (folder)/Алкогольные напитки/Вино (folder)/Вино	0	
2855266	8427894008202	Вино el cante flamenco белое полусладк алк.11% 750мл стекло	22133	Продукты питания (folder)/Алкогольные напитки/Вино (folder)/Вино	0	
3284319	8412075700839	Вино el cirko garnacha Rose розовое сухое 13% 750мл стбут	22133	Продукты питания (folder)/Алкогольные напитки/Вино (folder)/Вино	3791248	GRANDOS VINOS
3284320	8412075700921	Вино el cirko macabeo белое сухое 12.5% 750мл стбут	22133	Продукты питания (folder)/Алкогольные напитки/Вино (folder)/Вино	3791248	GRANDOS VINOS
3284321	8412075700914	Вино el cirko tempranillo красное сухое 13% 750мл стбут	22133	Продукты питания (folder)/Алкогольные напитки/Вино (folder)/Вино	3791249	EL CIRKO
3284322	8410775554226	Вино el corazon белое сухое 9% 750мл ст/б	22133	Продукты питания (folder)/Алкогольные напитки/Вино (folder)/Вино	0	
3284323	8422795001956	Вино el corazon сухое красное 9% 750мл стекло	22133	Продукты питания (folder)/Алкогольные напитки/Вино (folder)/Вино	0	
691392	8410537600628	Вино el coto blanco бел сух 12.5% 750мл	22133	Продукты питания (folder)/Алкогольные напитки/Вино (folder)/Вино	3791250	EL COTO
3791251	8410537640020	Вино el coto blanco бел сух 12.5% 750мл #2	22133	Продукты питания (folder)/Алкогольные напитки/Вино (folder)/Вино	3791250	EL COTO
691393	8410537200422	Вино el coto crian. красн сух выдерж.13% 750мл	22133	Продукты питания (folder)/Алкогольные напитки/Вино (folder)/Вино	3791250	EL COTO
47546	7804304000116	Вино el descanso кармернер эстейт централ в красн сух 13.5% 750мл	282291	Продукты питания (folder)/Алкогольные напитки/Вино (folder)/Вина Чили	47529	Эрразурис
188455	3263289993051	Вино el emperador reserve 2x 750ml	22133	Продукты питания (folder)/Алкогольные напитки/Вино (folder)/Вино	47500	El Emperador
47501	3263286325978	Вино el emperador валлесен.совин бел сух 13.5% 750мл	22169	Продукты питания (folder)/Алкогольные напитки/Вино (folder)/Вина Новый Свет	47500	El Emperador
43804	3263286325961	Вино el emperador каберне совиньон красн сух 13% 750мл	22133	Продукты питания (folder)/Алкогольные напитки/Вино (folder)/Вино	47500	El Emperador
1196136	8420209010211	Вино el Matador semidulche blanco белое полусладк 11% tetrapak 1л	22133	Продукты питания (folder)/Алкогольные напитки/Вино (folder)/Вино	0	
3284324	8436541018235	Вино el misionero airen белое сухое 12% 750мл ст/б	22133	Продукты питания (folder)/Алкогольные напитки/Вино (folder)/Вино	0	
3284325	8436541018204	Вино el misionero reserva красное сухое 13% 750мл ст/б	22133	Продукты питания (folder)/Алкогольные напитки/Вино (folder)/Вино	0	
3284326	8410702022743	Вино el misterio Del fuego, белое полусладк 10.5%, 750мл ст/б	22133	Продукты питания (folder)/Алкогольные напитки/Вино (folder)/Вино	0	
3284327	8410702022392	Вино el misterio Del fuego, столов белое сухое, 11%, 750мл ст/б	22133	Продукты питания (folder)/Алкогольные напитки/Вино (folder)/Вино	0	
3284328	4602476003569	Вино el mustango шардоне белое сухое 11% 0.7л стекло	22133	Продукты питания (folder)/Алкогольные напитки/Вино (folder)/Вино	0	
3284329	4602476003576	Вино el mustango, белое полусладк 12%, 0.7л ст/б	22133	Продукты питания (folder)/Алкогольные напитки/Вино (folder)/Вино	0	
3284330	4602476003606	Вино el mustango, мускат, белое полусладк столов, 12%, 0.7л ст/б	22133	Продукты питания (folder)/Алкогольные напитки/Вино (folder)/Вино	0	
3284331	4600632056107	Вино el paso Merlot столов красное полусладк 10-12% 1.5л м/уп	22133	Продукты питания (folder)/Алкогольные напитки/Вино (folder)/Вино	3791252	el paso
151593	4600632015517	Вино el paso Sauvignon, белое столов сухое, 11%, 750мл ст/б	22133	Продукты питания (folder)/Алкогольные напитки/Вино (folder)/Вино	150785	ШАМПАНСКОЕ СПБ 385
