ID	UPCEAN	Name	CategoryID	CategoryName	BrandID	BrandName
1174450	829696000701	Wild Planet tuna skipjack Wild Light 5oz	48	Продукты питания (folder)/Рыба и морепродукты (folder)/Консервы рыбные	668997	WILD PLANET
2709772	829696001203	Wild Planet White anchovies in olive Oil Extra virgin	48	Продукты питания (folder)/Рыба и морепродукты (folder)/Консервы рыбные	668997	WILD PLANET
2709773	829696001210	Wild Planet White anchovies in Water	48	Продукты питания (folder)/Рыба и морепродукты (folder)/Консервы рыбные	668997	WILD PLANET
668998	829696000473	Wild Planet Wild alaska pink Salmon boneless&skinless	48	Продукты питания (folder)/Рыба и морепродукты (folder)/Консервы рыбные	668997	WILD PLANET
1174444	829696000497	Wild Planet Wild alaska sockeye Salmon boneless&skinless	48	Продукты питания (folder)/Рыба и морепродукты (folder)/Консервы рыбные	668997	WILD PLANET
2709774	829696000732	Wild Planet Wild albacore tuna	48	Продукты питания (folder)/Рыба и морепродукты (folder)/Консервы рыбные	668997	WILD PLANET
2709775	829696000749	Wild Planet Wild albacore tuna #2	48	Продукты питания (folder)/Рыба и морепродукты (folder)/Консервы рыбные	668997	WILD PLANET
2709776	829696000565	Wild Planet Wild albacore tuna fillets packed in spanish olive Oil	48	Продукты питания (folder)/Рыба и морепродукты (folder)/Консервы рыбные	668997	WILD PLANET
669000	829696000572	Wild Planet Wild albacore tuna in olive Oil Extra virgin	48	Продукты питания (folder)/Рыба и морепродукты (folder)/Консервы рыбные	668997	WILD PLANET
669002	829696000541	Wild Planet Wild albacore tuna no salt added	48	Продукты питания (folder)/Рыба и морепродукты (folder)/Консервы рыбные	668997	WILD PLANET
1174445	829696000800	Wild Planet Wild sardines in olive Oil Extra virgin	48	Продукты питания (folder)/Рыба и морепродукты (folder)/Консервы рыбные	668997	WILD PLANET
1174447	829696000817	Wild Planet Wild sardines in olive Oil Extra virgin with Lemon	48	Продукты питания (folder)/Рыба и морепродукты (folder)/Консервы рыбные	668997	WILD PLANET
1174448	829696000831	Wild Planet Wild sardines in Spring Water 4.375oz	48	Продукты питания (folder)/Рыба и морепродукты (folder)/Консервы рыбные	668997	WILD PLANET
2844548	788668950058	Wild Planet игровой набор аэропорт 95005	1	Неклассифицированные/default	0	
2844549	788668950041	Wild Planet игровой набор строительная площадка 95004	1	Неклассифицированные/default	0	
1174446	829696000824	Wild Planet, Wild sardines in marinara sauce	48	Продукты питания (folder)/Рыба и морепродукты (folder)/Консервы рыбные	668997	WILD PLANET
2709778	793573940285	Wild poppy Juice blood oran chili or	1	Неклассифицированные/default	2709777	Wild Poppy
2709779	793573940292	Wild poppy Juice Grapefruit gngr org	1	Неклассифицированные/default	2709777	Wild Poppy
2709780	793573940216	Wild poppy Juice Peach vnla org	1	Неклассифицированные/default	2709777	Wild Poppy
2709781	793573940308	Wild poppy Juice peppermint lemonade org	1	Неклассифицированные/default	2709777	Wild Poppy
4782871	685682340011	Wild pre zander pike perch fil 16oz	1	Неклассифицированные/default	0	
3256498	853240004143	Wild prickly pear	330591	Продукты питания (folder)/Продукты питания	0	
3256499	853240004020	Wild prickly pear cactus Water	330591	Продукты питания (folder)/Продукты питания	0	
3256500	072392319190	Wild purple smash drink Mix	330591	Продукты питания (folder)/Продукты питания	0	
1981230	735380463502	Wild rabbit pink	363351	Adult/Sex-Shop	0	
1981231	735380463519	Wild rabbit purple	363351	Adult/Sex-Shop	0	
4782872	04741438	Wild rain Gillette series Deo	1	Неклассифицированные/default	0	
3772732	839728008865	Wild range ipa 4x6 btl 12oz	22186	Продукты питания (folder)/Алкогольные напитки/Пиво	0	
4782873	470306330222	Wild raspberries 4 4.20oz 12ct	1	Неклассифицированные/default	0	
4782874	470306000019	Wild raspberries 4 4.2oz	1	Неклассифицированные/default	0	
4782875	041220025190	Wild Red	1	Неклассифицированные/default	0	
3256501	082318103512	Wild Red shrimp	330591	Продукты питания (folder)/Продукты питания	0	
4782876	041201000086	Wild Red soda	1	Неклассифицированные/default	0	
4782877	720917012315	Wild reeds (french w/englih	1	Неклассифицированные/default	0	
4782878	092389787337	Wild republic audubon birds, eastern bluebird	1	Неклассифицированные/default	0	
3256502	099482450656	Wild Rice	330591	Продукты питания (folder)/Продукты питания	0	
4782879	074178100831	Wild Rice #2	1	Неклассифицированные/default	0	
4782880	074178110038	Wild Rice #3	1	Неклассифицированные/default	0	
4782881	074178420502	Wild Rice #4	1	Неклассифицированные/default	0	
4782882	055983000011	Wild Rice #5	1	Неклассифицированные/default	0	
669003	5028869106508	Wild Rice - 2.5kg Organic 2.5kg	1	Неклассифицированные/default	0	
4782883	011110816597	Wild Rice 4oz	1	Неклассифицированные/default	0	
3256503	041130592676	Wild Rice gourmet bratwurst	330591	Продукты питания (folder)/Продукты питания	0	
2709782	5028869106607	Wild Rice Mix - 2.5kg Organic 2.5kg	1	Неклассифицированные/default	0	
2709783	5028869106577	Wild Rice Mix Organic 25kg	1	Неклассифицированные/default	0	
3256504	018169802144	Wild Rice with ham chef-crafted soup	330591	Продукты питания (folder)/Продукты питания	0	
4782884	773200014039	Wild Rice&cran w/squash 4.40lb 2ct	1	Неклассифицированные/default	0	
3256505	786832820428	Wild Rice, onion&dill dinner rolls	330591	Продукты питания (folder)/Продукты питания	0	
2668123	037578616005	Wild riceworks, gourmet Rice snacks, sea salt&Black sesame	1	Неклассифицированные/default	2668122	Riceworks
4782885	600000440228	Wild ride	1	Неклассифицированные/default	0	
1649123	814337001414	Wild ride beef jerky - tender hoppin' hickory	1	Неклассифицированные/default	0	
1981130	735380301521	Wild ride Blue	363351	Adult/Sex-Shop	0	
1981128	735380301507	Wild ride pink	363351	Adult/Sex-Shop	0	
1981129	735380301514	Wild ride purple	363351	Adult/Sex-Shop	0	
2414351	085946500418	Wild ridge Pinot Noir sonoma Coast annapolis California 2013 6/7 750ml	22133	Продукты питания (folder)/Алкогольные напитки/Вино (folder)/Вино	0	
4782886	648009112227	Wild river productions 5oz katie pruitt: go back	1	Неклассифицированные/default	0	
437304	690300550451	Wild Rock cupids arrow Pinot Noir glass 750ml	22133	Продукты питания (folder)/Алкогольные напитки/Вино (folder)/Вино	0	
437305	690300551021	Wild Rock elevation Sauvignon blanc glass 750ml	22133	Продукты питания (folder)/Алкогольные напитки/Вино (folder)/Вино	0	
437306	690300550314	Wild Rock vin gris Rose glass 750ml	1	Неклассифицированные/default	0	
4782887	053039112510	Wild roomies	1	Неклассифицированные/default	0	
4782888	723952076885	Wild roomies (DVD)	1	Неклассифицированные/default	0	
4782889	835640000000	Wild rooster sauces, LLC 16oz fiery vinegar bbq sauce	1	Неклассифицированные/default	0	
2709784	085859440160	Wild roots marionberry flavored vodka	1	Неклассифицированные/default	0	
2709785	858594004009	Wild roots Red Raspberry flavored vodka	1	Неклассифицированные/default	0	
3256506	859480003076	Wild roots, milled Golden flaxseed	330591	Продукты питания (folder)/Продукты питания	0	
3256507	041449470511	Wild roots, real Food for real people, toasted Wheat germ	330591	Продукты питания (folder)/Продукты питания	0	
1174451	017854043176	Wild Rose 4pcs Box set	1	Неклассифицированные/default	0	
4782890	5013455198463	Wild Rose Body Care gift Box	1	Неклассифицированные/default	0	
4782891	892540000905	Wild Rose Cherry porter 1l	1	Неклассифицированные/default	0	
4782892	5013455198043	Wild Rose christmas gift - replaced by 671305	1	Неклассифицированные/default	0	
1649124	067953010982	Wild Rose conditione	1	Неклассифицированные/default	0	
2414352	782932220373	Wild Rose dropper, 0.25oz, Flower essence services	1	Неклассифицированные/default	2278637	Flower Essence Services
2414353	782932210374	Wild Rose dropper, 1oz, Flower essence services	1	Неклассифицированные/default	2278637	Flower Essence Services
1649125	4001638093002	Wild Rose moist cr	1	Неклассифицированные/default	0	
2000955	654367550687	Wild Rose ribbed lubricated condoms 3pk	108335	Гигиена (folder)/Презервативы	0	
1649126	067953010937	Wild Rose Shampoo	1	Неклассифицированные/default	0	
2009774	799613881167	Wild Rose vibe kit	363351	Adult/Sex-Shop	0	
4782893	088677732134	Wild roses tablcloth	1	Неклассифицированные/default	0	
4782894	088677732158	Wild roses table runner	1	Неклассифицированные/default	0	
4782895	088677351045	Wild rush	1	Неклассифицированные/default	0	
4782896	050000570553	Wild salmn/whpd egg sf 3oz 24ct	1	Неклассифицированные/default	0	
3256508	015292207075	Wild Salmon	330591	Продукты питания (folder)/Продукты питания	0	
3256509	035493015224	Wild Salmon #2	330591	Продукты питания (folder)/Продукты питания	0	
3256510	099482415990	Wild Salmon #3	330591	Продукты питания (folder)/Продукты питания	0	
3256511	074947972898	Wild Salmon burger	330591	Продукты питания (folder)/Продукты питания	0	
2217695	655464042341	Wild Salmon canned Dog Food 12/13oz	337596	Товары для животных (folder)/Pets	0	
2217696	655464762317	Wild Salmon Cat Food 4/12lb	337596	Товары для животных (folder)/Pets	0	
2217697	655464872313	Wild Salmon Cat Food 5/3lb	337596	Товары для животных (folder)/Pets	0	
2217698	655464892311	Wild Salmon Cat Food 5/7lb	337596	Товары для животных (folder)/Pets	0	
2217699	655464391210	Wild Salmon Dog Food 17lb	337596	Товары для животных (folder)/Pets	0	
2217700	655464392231	Wild Salmon Dog Food 33lb	337596	Товары для животных (folder)/Pets	0	
2217701	655464391616	Wild Salmon Dog Food 5/8lb	337596	Товары для животных (folder)/Pets	0	
3256512	015292204494	Wild Salmon fillets	330591	Продукты питания (folder)/Продукты питания	0	
3256513	015292204623	Wild Salmon fillets #2	330591	Продукты питания (folder)/Продукты питания	0	
3256514	815261010312	Wild Salmon fillets #3	330591	Продукты питания (folder)/Продукты питания	0	
1649127	021245310785	Wild Salmon Oil/flaxseed oills	1	Неклассифицированные/default	0	
2414354	019917000225	Wild Salmon Organic pale ale 6/pk 2.75% 0.355l	78617	Продукты питания (folder)/Алкогольные напитки/Алкоголь	0	
3256515	074947968129	Wild Salmon pinwheel with floretine stuffing	330591	Продукты питания (folder)/Продукты питания	0	
3256516	074947968105	Wild Salmon pinwheel with lobster stuffing	330591	Продукты питания (folder)/Продукты питания	0	
3256517	074947968112	Wild Salmon pinwheel with seafood stuffing	330591	Продукты питания (folder)/Продукты питания	0	
3256518	015292204616	Wild Salmon seasoned grill	330591	Продукты питания (folder)/Продукты питания	0	
4782897	681131714761	Wild Salmon, frozen, walmat 16oz	1	Неклассифицированные/default	0	
1429595	037071121037	Wild salt cod/Wood-canada 16oz	1	Неклассифицированные/default	0	
4782898	037071400019	Wild salted pollock-china 16oz	1	Неклассифицированные/default	0	
3256519	829696001715	Wild sardines	330591	Продукты питания (folder)/Продукты питания	0	
3256520	085239214718	Wild sardines in olive Oil Extra virgin	330591	Продукты питания (folder)/Продукты питания	0	
3256521	086600750507	Wild sardines in olive Oil Extra virgin #2	330591	Продукты питания (folder)/Продукты питания	0	
3256522	812410000590	Wild sardines in Spring Water	330591	Продукты питания (folder)/Продукты питания	0	
3256523	829696000893	Wild sardines in Water	330591	Продукты питания (folder)/Продукты питания	0	
3256524	829696001708	Wild sardines, skinless&boneless fillets in olive Oil Extra virgin	330591	Продукты питания (folder)/Продукты питания	0	
1649129	751063323307	Wild sarsparilla root discoed	1	Неклассифицированные/default	0	
1649130	187706000692	Wild scotsman Black Label	1	Неклассифицированные/default	0	
3256525	853197004234	Wild seafood risotto	330591	Продукты питания (folder)/Продукты питания	0	
4782899	744775166393	Wild secretaries exposed contest (DVD)	1	Неклассифицированные/default	0	
3256526	086600275208	Wild selections, lightly smoked sardine fillets	330591	Продукты питания (folder)/Продукты питания	0	
3256527	086600275000	Wild selections, Salmon fillets in olive Oil	330591	Продукты питания (folder)/Продукты питания	0	
3256528	086600275307	Wild selections, sardine fillets in zesty mango sauce	330591	Продукты питания (folder)/Продукты питания	0	
3256529	086600275109	Wild selections, smoke flavored Salmon fillets in olive Oil	330591	Продукты питания (folder)/Продукты питания	0	
3256530	086600270203	Wild selections, solid Light tuna in olive Oil	330591	Продукты питания (folder)/Продукты питания	0	
2709787	086600270005	Wild selections, solid Light tuna in Water	1	Неклассифицированные/default	2709786	Wild Selections
2709789	086600260204	Wild selections, solid White albacore tuna in olive Oil	1	Неклассифицированные/default	2709786	Wild Selections
2709788	086600260006	Wild selections, solid White albacore tuna in Water	1	Неклассифицированные/default	2709786	Wild Selections
3256531	086600260105	Wild selections, solid White albacore tuna in Water, no salt added	330591	Продукты питания (folder)/Продукты питания	0	
3256532	086600265001	Wild selections, tiny pink shrimp	330591	Продукты питания (folder)/Продукты питания	0	
669004	9417651002573	Wild sesame&balsamic 150ml	1	Неклассифицированные/default	0	
2009510	051021341276	Wild sex Oil Wild strawberry (d)	363351	Adult/Sex-Shop	0	
4782900	077802350114	Wild Shine	1	Неклассифицированные/default	0	
4782901	077802340344	Wild Shine clear Nail protctr 0.43oz	1	Неклассифицированные/default	0	
1647651	077802350343	Wild Shine clear Nail protctr 0.43oz 1ct	5586	Косметика (folder)/Косметика	1173206	Wet n Wild
1647649	077802350404	Wild Shine Nail burgundy fros 0.43oz	5586	Косметика (folder)/Косметика	1173206	Wet n Wild
1647650	077802350565	Wild Shine Nail caribbean bl 0.43oz	5586	Косметика (folder)/Косметика	1173206	Wet n Wild
4782902	077802350534	Wild Shine Nail Color sparke 0.43oz	1	Неклассифицированные/default	0	
4782903	077802350503	Wild Shine Nail dreamy poppy 0.43oz	1	Неклассифицированные/default	0	
4782904	077802350442	Wild Shine Nail eggplant fro 0.43oz	1	Неклассифицированные/default	0	
4782905	077802350459	Wild Shine Nail Lavender pearl 0.43oz	1	Неклассифицированные/default	0	
4782906	077802350398	Wild Shine Nail mauve Frost 0.43oz	1	Неклассифицированные/default	0	
1647653	077802350428	Wild Shine Nail Red Red 0.43oz	5586	Косметика (folder)/Косметика	1173206	Wet n Wild
4782907	077802350626	Wild Shine Nail Wild orchid 0.43oz	1	Неклассифицированные/default	0	
4782908	077802350350	Wild Shine no chip top coat 0.43oz	1	Неклассифицированные/default	0	
437307	088320580006	Wild shot mezcal reposado teq 6pk 43% 750l	78617	Продукты питания (folder)/Алкогольные напитки/Алкоголь	0	
2844550	7503002871454	Wild shot mezcal Silver teq 6pk 43% 750l	1	Неклассифицированные/default	0	
437308	088320580013	Wild shot Silver 86.8p 43.4% btl 750ml	78617	Продукты питания (folder)/Алкогольные напитки/Алкоголь	0	
4782909	806923009294	Wild shots-oldies&goodies (DVD) ff/eng	1	Неклассифицированные/default	0	
3256533	015585001564	Wild shrimp	330591	Продукты питания (folder)/Продукты питания	0	
4782910	011301675637	Wild side (DVD)	1	Неклассифицированные/default	0	
2217702	684346000209	Wild side kangaroo Dog treat 3oz	337596	Товары для животных (folder)/Pets	0	
2217703	684346000216	Wild side kangaroo Dog treat 6oz	337596	Товары для животных (folder)/Pets	0	
2217704	684346000605	Wild side lamb'n crunchy Dog treat 3oz	337596	Товары для животных (folder)/Pets	0	
2217705	684346000612	Wild side lamb'n crunchy Dog treat 6oz	337596	Товары для животных (folder)/Pets	0	
2217706	684346000063	Wild side lamb'n Dog treat 4oz	337596	Товары для животных (folder)/Pets	0	
2217707	684346000094	Wild side lobster gift Box for Dog&Cat 2/.705oz pch	337596	Товары для животных (folder)/Pets	0	
2217708	684346000407	Wild side lobster senior Cat treats 1.4oz	337596	Товары для животных (folder)/Pets	0	
2217709	684346000308	Wild side Salmon crunchy Dog treat 3oz	337596	Товары для животных (folder)/Pets	0	
2217710	684346000315	Wild side Salmon crunchy Dog treat 6oz	337596	Товары для животных (folder)/Pets	0	
2217711	684346000131	Wild side Salmon Oil 16oz	337596	Товары для животных (folder)/Pets	0	
1992634	9781881943228	Wild side sex (net)	1981649	Adult/Adult Books	0	
4782911	823998114067	Wild silverfish 16oz 16oz	1	Неклассифицированные/default	0	
4782912	882468503008	Wild silverfish 16oz 16oz #2	1	Неклассифицированные/default	0	
4782913	018595288901	Wild sip assorted 1ct	1	Неклассифицированные/default	0	
3256534	085239214749	Wild skipjack solid Light tuna in Water and sea salt	330591	Продукты питания (folder)/Продукты питания	0	
3256535	810757003892	Wild skipjack tuna chunk in Water with sea salt	330591	Продукты питания (folder)/Продукты питания	0	
4782914	780787179426	Wild sky records CD John niems: from here to there	1	Неклассифицированные/default	0	
4782915	780787179327	Wild sky records CD John niems: One off the top	1	Неклассифицированные/default	0	
4782916	780787990120	Wild sky records CD John niems: open up the Power within	1	Неклассифицированные/default	0	
4782917	780787630323	Wild sky records CD John niems: try this on	1	Неклассифицированные/default	0	
4782918	780787569920	Wild sky records CD John niems: twelve tracks	1	Неклассифицированные/default	0	
4782919	780787179525	Wild sky records CD John niems: you've got to	1	Неклассифицированные/default	0	
3256536	659204825034	Wild sockeye Salmon	330591	Продукты питания (folder)/Продукты питания	0	
3256537	659204835194	Wild sockeye Salmon #2	330591	Продукты питания (folder)/Продукты питания	0	
3256538	766572227701	Wild sockeye Salmon #3	330591	Продукты питания (folder)/Продукты питания	0	
3256539	829696000596	Wild sockeye Salmon #4	330591	Продукты питания (folder)/Продукты питания	0	
3256540	853197004432	Wild sockeye Salmon #5	330591	Продукты питания (folder)/Продукты питания	0	
3256541	888670017951	Wild sockeye Salmon #6	330591	Продукты питания (folder)/Продукты питания	0	
3256542	781857005164	Wild sockeye Salmon fillets	330591	Продукты питания (folder)/Продукты питания	0	
3256543	781857005171	Wild sockeye Salmon fillets #2	330591	Продукты питания (folder)/Продукты питания	0	
3256544	630557197344	Wild sockeye Salmon portions	330591	Продукты питания (folder)/Продукты питания	0	
3256545	752047923018	Wild sockeye smoked Salmon	330591	Продукты питания (folder)/Продукты питания	0	
3256546	752047926392	Wild sockeye smoked Salmon #2	330591	Продукты питания (folder)/Продукты питания	0	
4782920	014381271027	Wild sorority girls-campuss hottest student bodies (DVD)	1	Неклассифицированные/default	0	
437309	747736288226	Wild south Pinot Noir marlborough glass 750ml	22133	Продукты питания (folder)/Алкогольные напитки/Вино (folder)/Вино	0	
437310	747736288219	Wild south Sauvignon blanc marlborough glass 750ml	22133	Продукты питания (folder)/Алкогольные напитки/Вино (folder)/Вино	0	
4782921	786306100858	Wild spin Cat toy	1	Неклассифицированные/default	0	
4782922	733807687821	Wild Spirit (DVD)	1	Неклассифицированные/default	0	
4782926	084380360541	Wild Spirit liq-w/mugs 750ml	1	Неклассифицированные/default	0	
4782923	084380360688	Wild Spirit liqueur 375ml	1	Неклассифицированные/default	0	
4782924	843803606402	Wild Spirit liqueur 750ml	1	Неклассифицированные/default	0	
4782925	084380360640	Wild Spirit liquor 750ml	1	Неклассифицированные/default	0	
2217712	8904006301180	Wild ston talc 100g	1	Неклассифицированные/default	0	
437312	8904006302392	Wild Stone after shave Lotion 50ml	130	Гигиена (folder)/После бритья	437311	Wild Stone
2414355	8904006305294	Wild Stone Aqua-f Deo 150ml	1	Неклассифицированные/default	0	
2414380	8904006305584	Wild Stone bronze perfume	1	Неклассифицированные/default	437311	Wild Stone
2414356	8904006305997	Wild Stone burst Deo 120ml	1	Неклассифицированные/default	0	
2414381	8904006305614	Wild Stone chrome perfume	1	Неклассифицированные/default	437311	Wild Stone
2414382	8904006305621	Wild Stone copper perfume	1	Неклассифицированные/default	437311	Wild Stone
437313	8904006303399	Wild Stone Deo Aqua Fresh 150ml	407	Парфюмерия (folder)/Дезодорант	437311	Wild Stone
437314	8904006302750	Wild Stone Deo forest Spice 150ml	407	Парфюмерия (folder)/Дезодорант	437311	Wild Stone
437315	8904006303610	Wild Stone Deo hunt 150ml	407	Парфюмерия (folder)/Дезодорант	437311	Wild Stone
437316	8904006302743	Wild Stone Deo hydra Energy 150ml	407	Парфюмерия (folder)/Дезодорант	437311	Wild Stone
437317	8904006303627	Wild Stone Deo Juice 150ml	407	Парфюмерия (folder)/Дезодорант	437311	Wild Stone
437318	8904006303603	Wild Stone Deo smoke 150ml	407	Парфюмерия (folder)/Дезодорант	437311	Wild Stone
437329	8904006302729	Wild Stone Deo talc hydra 300g	407	Парфюмерия (folder)/Дезодорант	437311	Wild Stone
437330	8904006303498	Wild Stone Deo talc hydra 50g	407	Парфюмерия (folder)/Дезодорант	437311	Wild Stone
437328	8904006302736	Wild Stone Deo talc hydra Energy 100g	407	Парфюмерия (folder)/Дезодорант	437311	Wild Stone
437331	8904003011808	Wild Stone Deo talc Ultra 100g	407	Парфюмерия (folder)/Дезодорант	437311	Wild Stone
437332	8904006301111	Wild Stone Deo talc Ultra 300g	407	Парфюмерия (folder)/Дезодорант	437311	Wild Stone
