ID	UPCEAN	Name	CategoryID	CategoryName	BrandID	BrandName
778523	4008033481007	Ножницы fackelmann универсальные 13cм нер	34728	Инструменты (folder)/Ножницы	41398	Fackelmann
3444878	4680259410513	Ножницы falco Премиум хозяйственные универсальные 23.5см т/у	34728	Инструменты (folder)/Ножницы	0	
1796360	4260107464587	Ножницы favorite 17см нержав. сталь с титановым покрытием Berlingo в блистере с европодвесом	34728	Инструменты (folder)/Ножницы	176778	BERLINGO
1796361	4260107464594	Ножницы favorite 20см нержав. сталь с титановым покрытием Berlingo в блистере с европодвесом	34728	Инструменты (folder)/Ножницы	176778	BERLINGO
3444879	8404880415701	Ножницы fit по жести l=250мм	34728	Инструменты (folder)/Ножницы	0	
3444880	8404880673200	Ножницы fit хозяйственные 200мм	34728	Инструменты (folder)/Ножницы	594717	FIT
3444881	4680259099503	Ножницы galante для маникюра 9.5см	34728	Инструменты (folder)/Ножницы	0	
3444882	4606080004899	Ножницы gamma g-202 универсальные 215мм	34728	Инструменты (folder)/Ножницы	0	
3444883	4606080332091	Ножницы gamma для шитья и рукоделия 140мм g-203 тв/уп	34728	Инструменты (folder)/Ножницы	0	
3444884	4607040632169	Ножницы gamma закройные 207мм	34728	Инструменты (folder)/Ножницы	0	
3444885	4606080004905	Ножницы gamma портновские 250мм	34728	Инструменты (folder)/Ножницы	0	
3444886	4607040632190	Ножницы gamma универсальные 160мм арт u-9016	34728	Инструменты (folder)/Ножницы	0	
3444887	4606080004882	Ножницы gamma универсальные 200мм арт g-201	34728	Инструменты (folder)/Ножницы	0	
3444888	4607040632213	Ножницы gamma универсальные 210мм арт u-9018	34728	Инструменты (folder)/Ножницы	0	
3444889	4606080332077	Ножницы gamma хозяйственные 180мм	34728	Инструменты (folder)/Ножницы	0	
3444890	4606080004875	Ножницы gamma хозяйственные 180мм арт g-104	34728	Инструменты (folder)/Ножницы	0	
1274432	5069206050511	Ножницы greenwich Line гонки 127мм (блист.)	34728	Инструменты (folder)/Ножницы	494412	Greenwich Line
1274433	5069206050528	Ножницы greenwich Line зайчата 127мм (блист.)	34728	Инструменты (folder)/Ножницы	494412	Greenwich Line
1274434	5069206050542	Ножницы greenwich Line пингвинята 127мм (блист.)	34728	Инструменты (folder)/Ножницы	494412	Greenwich Line
498245	4893925502218	Ножницы grinda уневер. 8-423287	34728	Инструменты (folder)/Ножницы	0	
3444891	8026996000697	Ножницы guang xiong материал нержавеющая сталь т/у	34728	Инструменты (folder)/Ножницы	0	
3444892	6900000002841	Ножницы Happy Home а-2 сталь	34728	Инструменты (folder)/Ножницы	0	
498288	4606782070291	Ножницы Hatber 13.5см в футляре, нерж. ст. динозаврики (упаковка европодвес)	34728	Инструменты (folder)/Ножницы	36916	Hatber
498294	4606782034613	Ножницы Hatber 13.5см нерж.ст с линейк (7113) (12) 8030	34728	Инструменты (folder)/Ножницы	36916	Hatber
778524	4606782070307	Ножницы Hatber 13.5см с усилителем нерж ст мишки (упаковка европодвес)	34728	Инструменты (folder)/Ножницы	36916	Hatber
778585	4606782034620	Ножницы Hatber 13.5см, с линейкой, нерж.ст. (упаковка европодвес)	34728	Инструменты (folder)/Ножницы	442729	ЗХК
3866394	4606782200964	Ножницы Hatber 135мм нерж.ст.	1	Неклассифицированные/default	36916	Hatber
498289	4606782070581	Ножницы Hatber 13см с фигурными ручками панда нерж. ст. (упаковка европодвес)	34728	Инструменты (folder)/Ножницы	36916	Hatber
498302	4606782034644	Ножницы Hatber 13см, нерж. ст., мягк. вставки на ручках (упаковка европодвес)	34728	Инструменты (folder)/Ножницы	36916	Hatber
778525	4606782070314	Ножницы Hatber 14см безопасные с усилителем, пластик покрытие, нерж ст ежик (упаковка европодвес)	34728	Инструменты (folder)/Ножницы	36916	Hatber
778527	4606782034590	Ножницы Hatber 14см с рисунком треугольник нерж ст мягк. вставки на ручках (упаковка европодв	34728	Инструменты (folder)/Ножницы	36916	Hatber
498306	4606782034606	Ножницы Hatber 14см, с рисунком Звезда ,нерж.ст., мягк. вставки на ручках	34728	Инструменты (folder)/Ножницы	36916	Hatber
3444893	4606782204221	Ножницы Hatber stainless steel 18см	34728	Инструменты (folder)/Ножницы	36916	Hatber
498281	4606782053423	Ножницы Hatber для левшей 12.5см, нерж. сталь далматинцы (упаковка европодвес)	34728	Инструменты (folder)/Ножницы	36916	Hatber
498407	4606782053430	Ножницы Hatber зигзагообразные 14см, нерж. сталь пчелки (упаковка европодвес)	34728	Инструменты (folder)/Ножницы	36916	Hatber
498246	4620001679560	Ножницы haus frau 14см черно-орнаж.	34728	Инструменты (folder)/Ножницы	375915	Haus Frau
498247	4620001679553	Ножницы haus frau 21.6см черно-оранж	34728	Инструменты (folder)/Ножницы	375915	Haus Frau
498248	4630006538328	Ножницы haus frau 5см черн	34728	Инструменты (folder)/Ножницы	0	
96131	5029138900001	Ножницы Home accessories s90000	3536	Хозяйственные товары (folder)/Хозяйственные товары	77239	Home Accessories
2960084	5029138954257	Ножницы Home accessories s90000 #2	3536	Хозяйственные товары (folder)/Хозяйственные товары	77239	Home Accessories
3673516	4605413013096	Ножницы iceberg офисн.ос.прочные 205мм	34728	Инструменты (folder)/Ножницы	692423	Iceberg
3673517	4605419013090	Ножницы iceberg офисн.ос.прочные 205мм #2	34728	Инструменты (folder)/Ножницы	692423	Iceberg
3673518	4605419048290	Ножницы iceberg офисн.ос.прочные 205мм #3	34728	Инструменты (folder)/Ножницы	692423	Iceberg
778743	9073215014521	Ножницы index isc422 цельнометаллические 15.6см	34728	Инструменты (folder)/Ножницы	456932	Index
3674261	9073215103065	Ножницы index titanium Gold пласт ручки 140мм	34728	Инструменты (folder)/Ножницы	456932	Index
3444894	6942800004281	Ножницы intelligent bg-428	34728	Инструменты (folder)/Ножницы	0	
3444895	6900801990705	Ножницы intelligent scissors at-70	34728	Инструменты (folder)/Ножницы	0	
3444896	6942500004253	Ножницы intelligent scissors bg-425	34728	Инструменты (folder)/Ножницы	0	
3444897	6900801991528	Ножницы intelligent бабочки арт 152	34728	Инструменты (folder)/Ножницы	0	
3444898	6900801990750	Ножницы intelligent овальные ручки 18см ат-75	34728	Инструменты (folder)/Ножницы	0	
3444899	6900801990743	Ножницы intelligent овальные ручки 19см ат-74	34728	Инструменты (folder)/Ножницы	0	
3444900	6955123567746	Ножницы intelligent пластиковые ручки ах-74 190мм	34728	Инструменты (folder)/Ножницы	0	
3444901	6955123567753	Ножницы intelligent пластиковые ручки ах-75 170мм	34728	Инструменты (folder)/Ножницы	0	
3444902	6955123567760	Ножницы intelligent пластиковые ручки ах-76 210мм	34728	Инструменты (folder)/Ножницы	0	
3444903	6900801990774	Ножницы intelligent резиновые овальные ручки 22см	34728	Инструменты (folder)/Ножницы	0	
3444904	6900801990736	Ножницы intelligent резиновые ручки 160мм ат-73	34728	Инструменты (folder)/Ножницы	0	
3444905	6936434710250	Ножницы intelligent с овальной ручкой 135мм	34728	Инструменты (folder)/Ножницы	3604479	Intelligent
3444906	6900801990729	Ножницы intelligent усиленные ручки 16см	34728	Инструменты (folder)/Ножницы	0	
3444907	6900801990767	Ножницы intelligent усиленные ручки 19см	34728	Инструменты (folder)/Ножницы	0	
3444908	6900801990927	Ножницы intelligent цветные арт 92	34728	Инструменты (folder)/Ножницы	0	
3444909	6955123567722	Ножницы intelligent цельнометаллические ах-72 190мм	34728	Инструменты (folder)/Ножницы	0	
608893	3031449510598	Ножницы inter-vion безопасные	34728	Инструменты (folder)/Ножницы	442955	Inter-Vion
1688275	4650001016843	Ножницы irit с лазерным прицелом пл/уп	1	Неклассифицированные/default	1749375	Irit Home
2250335	4030363006735	Ножницы j2 11.1 прямые 5.5 jay-2 111550	360487	Уход за волосами (folder)/Парикмахерская	2013485	Yagyar
2015300	20693091	Ножницы jaguar 2кл pastell Plus chili 5.5inch слайсинг красные 4756-4	360487	Уход за волосами (folder)/Парикмахерская	2013485	Yagyar
2015301	4030363006841	Ножницы jaguar 2кл pastell Plus chili 5.5inch слайсинг красные 4756-4 #2	360487	Уход за волосами (folder)/Парикмахерская	2013485	Yagyar
2014936	20693039	Ножницы jaguar 2кл pastell Plus es 40 chili 5.0inch филиров 40 зубцов красные 3053-4	360487	Уход за волосами (folder)/Парикмахерская	2013485	Yagyar
2014937	4030363006902	Ножницы jaguar 2кл pastell Plus es 40 chili 5.0inch филиров 40 зубцов красные 3053-4 #2	360487	Уход за волосами (folder)/Парикмахерская	2013485	Yagyar
2014934	20013967	Ножницы jaguar 2кл pastell Plus es 40 viola 5.0 филиров 40 зубц фиолетовые 3053-1	360487	Уход за волосами (folder)/Парикмахерская	2013485	Yagyar
2014935	4030363102390	Ножницы jaguar 2кл pastell Plus es 40 viola 5.0 филиров 40 зубц фиолетовые 3053-1 #2	360487	Уход за волосами (folder)/Парикмахерская	2013485	Yagyar
2015298	20014001	Ножницы jaguar 2кл pastell Plus viola 5.5inch слайсинг фиолетовые 4756-1	360487	Уход за волосами (folder)/Парикмахерская	2013485	Yagyar
2015299	4030363102420	Ножницы jaguar 2кл pastell Plus viola 5.5inch слайсинг фиолетовые 4756-1 #2	360487	Уход за волосами (folder)/Парикмахерская	2013485	Yagyar
36341	4030363100518	Ножницы jaguar 5 5	34728	Инструменты (folder)/Ножницы	0	
36342	4030363101287	Ножницы jaguar Comfort 4760	34728	Инструменты (folder)/Ножницы	0	
36325	4030363101003	Ножницы jaguar es 32 фил. 5	34728	Инструменты (folder)/Ножницы	0	
2250337	20064907	Ножницы jaguar pre style relax p 5.5 '' филиров 28 зубц, эргоном, глянцев 83455	360487	Уход за волосами (folder)/Парикмахерская	2013485	Yagyar
2250339	4030363106398	Ножницы jaguar pre style relax р 5.5 1-стор микронасечка, эргоном, глянц 82755 #2	360487	Уход за волосами (folder)/Парикмахерская	2013485	Yagyar
36343	4030363100167	Ножницы jaguar profi 5.5	34728	Инструменты (folder)/Ножницы	0	
36340	4030363101768	Ножницы jaguar profi 91650	34728	Инструменты (folder)/Ножницы	0	
36344	4030363101775	Ножницы jaguar profi 91658, 5.5	34728	Инструменты (folder)/Ножницы	0	
36326	4030363101270	Ножницы jaguar пр.	34728	Инструменты (folder)/Ножницы	0	
96064	3031449400752	Ножницы Jean l.david 3144940075	461	Косметика (folder)/Маникюр и педикюр (folder)/Маникюр и педикюр	38848	Jean Louis David
96065	3031449400769	Ножницы Jean l.david классич средн.	461	Косметика (folder)/Маникюр и педикюр (folder)/Маникюр и педикюр	38848	Jean Louis David
96063	3031449400608	Ножницы Jean louis david классич	461	Косметика (folder)/Маникюр и педикюр (folder)/Маникюр и педикюр	38848	Jean Louis David
3444910	6923527007137	Ножницы kaibo 15.5см	34728	Инструменты (folder)/Ножницы	0	
3444911	4680259028145	Ножницы kaibo арт.350-014	34728	Инструменты (folder)/Ножницы	0	
3444912	6150579644458	Ножницы kaibo кулинарные	34728	Инструменты (folder)/Ножницы	0	
3444913	4017863182497	Ножницы kaizer для маникюра безопасные т/у	34728	Инструменты (folder)/Ножницы	38676	KAIZER
778528	4016002027248	Ножницы karl weiss для резки зелени 15914	34728	Инструменты (folder)/Ножницы	675874	Karl Weiss
2986489	4010411159149	Ножницы karl weiss для резки зелени 15914 #2	34728	Инструменты (folder)/Ножницы	675874	Karl Weiss
3444914	6944306300348	Ножницы kitchen f-096	34728	Инструменты (folder)/Ножницы	0	
3444915	4810217021431	Ножницы kramer портновские 215мм	34728	Инструменты (folder)/Ножницы	0	
3444916	4810217021417	Ножницы kramet закройные 250мм	34728	Инструменты (folder)/Ножницы	0	
2250351	4690462290123	Ножницы kuso бабочка	980	Игрушки (folder)/Игрушки	2244900	KUSO
2250385	4690462290130	Ножницы kuso черепашки-ниндзя с чехлом	980	Игрушки (folder)/Игрушки	2244900	KUSO
3444917	4714218200911	Ножницы kw trio металл с мягкой вставкой 17.1см	34728	Инструменты (folder)/Ножницы	0	
177940	4024526001101	Ножницы laco (Германия) 215мм черные, в карт. упак. с европодвесом, s800	34728	Инструменты (folder)/Ножницы	459856	LACO
177939	4024526001118	Ножницы laco (лако, Германия) 155мм черные, в карт. упак. с европодвесом, s 801	34728	Инструменты (folder)/Ножницы	459856	LACO
1796355	4024526001125	Ножницы laco s802 255мм арт.1301814 1125	34728	Инструменты (folder)/Ножницы	459856	LACO
96083	4024526001224	Ножницы laco киндер 135мм s-806	34728	Инструменты (folder)/Ножницы	459856	LACO
3444918	4650060885862	Ножницы ladina 14cм	34728	Инструменты (folder)/Ножницы	0	
3444919	4603299277458	Ножницы libaijin арт.350010	34728	Инструменты (folder)/Ножницы	0	
3444920	4603299277441	Ножницы libaijin портновские Премиум	34728	Инструменты (folder)/Ножницы	0	
3444921	4620754174756	Ножницы limbio полипропилен металл арт.se-174	34728	Инструменты (folder)/Ножницы	0	
3444922	4606033092751	Ножницы Lotus professional lp-16-6010 парикмахрские 5	34728	Инструменты (folder)/Ножницы	0	
1274440	5060240303038	Ножницы Lumme lu-526	34728	Инструменты (folder)/Ножницы	89275	Lumme
3444923	4690408039441	Ножницы mallony ks-03 для зелени нержавеющая сталь 19см м/уп	34728	Инструменты (folder)/Ножницы	0	
1688209	3154146841106	Ножницы Maped (Франция) expert titanium 170мм, титановое покрытие, карт.упак.с европодвесом,684110	1	Неклассифицированные/default	3	Maped
778529	3154144765107	Ножницы Maped (Франция) shape 3D 160мм, для левши, ассорти, карт. упак. с европодвесом, 476510	34728	Инструменты (folder)/Ножницы	3	Maped
778530	3154144630108	Ножницы Maped (Франция) start 120мм, закругленные, ассорти, карт. упак. с европодвесом, 463010	34728	Инструменты (folder)/Ножницы	3	Maped
778531	3154144670104	Ножницы Maped (Франция) start 170мм, черные, карт. упак. с европодвесом, 467010	34728	Инструменты (folder)/Ножницы	3	Maped
778532	3154144690102	Ножницы Maped (Франция) start 210мм, черные, карт. упак. с европодвесом, 469010	34728	Инструменты (folder)/Ножницы	3	Maped
778533	3154144645102	Ножницы Maped (Франция) start Soft 130мм, прорезиненные ручки, карт. упак. с европодвесом, 464510	34728	Инструменты (folder)/Ножницы	3	Maped
778534	3154144672108	Ножницы Maped (Франция) start Soft 170мм, черно-красные, карт. упак. с европодвесом, 467210	34728	Инструменты (folder)/Ножницы	3	Maped
778535	3154144692106	Ножницы Maped (Франция) start Soft 210мм, черно-красные, карт. упак. с европодвесом, 469210	34728	Инструменты (folder)/Ножницы	3	Maped
778536	3154146955100	Ножницы Maped (Франция) ultimate 180мм, повышен. прочность лезвий, карт.упак.с европодвесом,695510	34728	Инструменты (folder)/Ножницы	3	Maped
778537	3154144725101	Ножницы Maped (Франция) vivo 3D 120мм, для левши, ассорти, карт. упак. с европодвесом, 472510	34728	Инструменты (folder)/Ножницы	3	Maped
3444924	6930317600041	Ножницы Maped 12см	34728	Инструменты (folder)/Ножницы	3	Maped
3444925	3154144980104	Ножницы Maped 18см 498010	34728	Инструменты (folder)/Ножницы	3	Maped
96087	3154144790208	Ножницы Maped 210мм 047920	34728	Инструменты (folder)/Ножницы	3	Maped
3444926	3154144681100	Ножницы Maped essentials Green, 210мм черные, эргоном ручки, карт.упак.с европод,468110	34728	Инструменты (folder)/Ножницы	3	Maped
3444927	3154144682107	Ножницы Maped essentials Soft, 170мм прорезин.ручки, чер-син, европодвес,467210.468210	34728	Инструменты (folder)/Ножницы	3	Maped
3444928	3154144683104	Ножницы Maped essentials Soft, 210мм прорезин.ручки, черно-син, европодв, 469210.468310	34728	Инструменты (folder)/Ножницы	3	Maped
498304	3154144740104	Ножницы Maped kid 3D 130мм с линейкой, ассорти карт. упак европодвес 474010	34728	Инструменты (folder)/Ножницы	3	Maped
1274449	3154140378004	Ножницы Maped kidicut, 120мм безопасные лезвия, ассорти карт.упак. с европодв, 037800	34728	Инструменты (folder)/Ножницы	3	Maped
161546	3154143840201	Ножницы Maped tatoo 006 160мм 413294	34728	Инструменты (folder)/Ножницы	3	Maped
161549	3154140367008	Ножницы Maped tatoo univer. 120мм 413301	34728	Инструменты (folder)/Ножницы	3	Maped
161550	3154140316006	Ножницы Maped tatoo univer. 170мм 413341	34728	Инструменты (folder)/Ножницы	3	Maped
1274441	315414067120	Ножницы Maped tatoo zenoa 150мм 413294	34728	Инструменты (folder)/Ножницы	3	Maped
1796453	3154146701103	Ножницы Maped zenoa fit, 130мм прорезин.ручки, с цв.печатью, ассорти европодвес,670110	34728	Инструменты (folder)/Ножницы	3	Maped
3444929	6939789303030	Ножницы Maped zenoa Sensitive 170мм	34728	Инструменты (folder)/Ножницы	3	Maped
778538	3154145960105	Ножницы Maped zenoa Sensitive 170мм ассорти карт. упак европодвес 596010	34728	Инструменты (folder)/Ножницы	3	Maped
778539	3154145990102	Ножницы Maped zenoa Sensitive 210мм ассорти карт. упак европодвес 599010	34728	Инструменты (folder)/Ножницы	3	Maped
96088	3154140580506	Ножницы Maped для левшей 13см блист.0580506	34728	Инструменты (folder)/Ножницы	3	Maped
3444930	6939789302736	Ножницы Maped овальные ручки 170мм	34728	Инструменты (folder)/Ножницы	3	Maped
96089	3154140671204	Ножницы Maped с рис.15см блист.05671204	34728	Инструменты (folder)/Ножницы	3	Maped
96090	3154145800203	Ножницы Maped тату 13см 580020	34728	Инструменты (folder)/Ножницы	3	Maped
1274509	5060102716235	Ножницы Marta mt-2724	34728	Инструменты (folder)/Ножницы	39114	Marta
3444932	4044996095936	Ножницы matrix для резки изделий из пластика d-до 42мм	34728	Инструменты (folder)/Ножницы	297592	Matrix
3444931	6944312016462	Ножницы matrix для резки изделий из пластика d= до 42мм	34728	Инструменты (folder)/Ножницы	297592	Matrix
3444933	6953888560248	Ножницы matrix для резки изделий из пластика арт 784105	34728	Инструменты (folder)/Ножницы	297592	Matrix
3444934	6953888567919	Ножницы matrix для резки плиты 235мм	34728	Инструменты (folder)/Ножницы	297592	Matrix
3444935	6953888567896	Ножницы matrix хозяйственные двухкомпонентные рукоятки 250мм пл/упак	34728	Инструменты (folder)/Ножницы	297592	Matrix
3444936	6953888567889	Ножницы matrix хозяйственные двухкомпонентные рукоятки 280мм пл/упак	34728	Инструменты (folder)/Ножницы	297592	Matrix
3444937	6953888567902	Ножницы matrix хозяйственные многофункциональные 200мм пл/упак	34728	Инструменты (folder)/Ножницы	297592	Matrix
3444938	4712780580769	Ножницы matrix хозяйственные обрезиненные рукоятки 250мм пл/упак	34728	Инструменты (folder)/Ножницы	297592	Matrix
234382	4823056612043	Ножницы maxtool для стрижки травы с поворотными лезвиями на 360 град	41797	Инструменты (folder)/Инструмент	225652	MaxTool
3444939	4680318117575	Ножницы maxwell портновские 205мм	34728	Инструменты (folder)/Ножницы	0	
3444940	4680019396187	Ножницы mazari длина 180мм	34728	Инструменты (folder)/Ножницы	0	
1796362	4260107472018	Ножницы mega Soft 18см нерж. сталь Berlingo в блистере с европодвесом	34728	Инструменты (folder)/Ножницы	176778	BERLINGO
1796363	4260107472049	Ножницы mega Soft 18см нерж. сталь Berlingo в блистере с европодвесом #2	34728	Инструменты (folder)/Ножницы	176778	BERLINGO
1796364	4260107472025	Ножницы mega Soft 20см нерж. сталь Berlingo в блистере с европодвесом	34728	Инструменты (folder)/Ножницы	176778	BERLINGO
1796365	4260107472056	Ножницы mega Soft 20см нерж. сталь Berlingo в блистере с европодвесом #2	34728	Инструменты (folder)/Ножницы	176778	BERLINGO
1796366	4260107472032	Ножницы mega Soft 23см нерж. сталь Berlingo в блистере с европодвесом	34728	Инструменты (folder)/Ножницы	176778	BERLINGO
1796367	4260107472063	Ножницы mega Soft 23см нерж. сталь Berlingo в блистере с европодвесом #2	34728	Инструменты (folder)/Ножницы	176778	BERLINGO
