ID	UPCEAN	Name	CategoryID	CategoryName	BrandID	BrandName
1370832	050924007920	Roche accu-chek safe-t-Pro+ lancet	353410	Изделия медицинского назначения (folder)/Клинико-диагностические приборы и наборы	555943	Accu-Chek
2827362	4015630007769	Roche accu-chek Sensor Comfort control 2x 4ml	353410	Изделия медицинского назначения (folder)/Клинико-диагностические приборы и наборы	555943	Accu-Chek
2827363	4015630009961	Roche accu-chek Sensor Comfort glucose 1x50	353410	Изделия медицинского назначения (folder)/Клинико-диагностические приборы и наборы	555943	Accu-Chek
2827364	4015630005468	Roche accu-chek Sensor Comfort Pro kontrolle 2x 4ml	353410	Изделия медицинского назначения (folder)/Клинико-диагностические приборы и наборы	555943	Accu-Chek
2827365	4015630019106	Roche accu-chek Sensor mg/dl	353410	Изделия медицинского назначения (folder)/Клинико-диагностические приборы и наборы	555943	Accu-Chek
2827366	4015630019045	Roche accu-chek Sensor mmol/l	353410	Изделия медицинского назначения (folder)/Клинико-диагностические приборы и наборы	555943	Accu-Chek
885987	075537000311	Roche accu-chek simplicity	353410	Изделия медицинского назначения (folder)/Клинико-диагностические приборы и наборы	555943	Accu-Chek
885988	075537302507	Roche accu-chek simplicity Care kit 1ct	353410	Изделия медицинского назначения (folder)/Клинико-диагностические приборы и наборы	555943	Accu-Chek
885989	075537302682	Roche accu-chek simplicity sol	353410	Изделия медицинского назначения (folder)/Клинико-диагностические приборы и наборы	555943	Accu-Chek
2827367	4015630006618	Roche accu-chek smart pix 1 stuck	353410	Изделия медицинского назначения (folder)/Клинико-диагностические приборы и наборы	555943	Accu-Chek
2827368	4015630058563	Roche accu-chek softclix (schwarz)	353410	Изделия медицинского назначения (folder)/Клинико-диагностические приборы и наборы	555943	Accu-Chek
205846	4015630018284	Roche accu-chek softclix 100 lancet	297057	Лекарственные средства (folder)/Health & Personal Care	555943	Accu-Chek
885990	365702156104	Roche accu-chek softclix hn 100	353410	Изделия медицинского назначения (folder)/Клинико-диагностические приборы и наборы	555943	Accu-Chek
205849	4015630011384	Roche accu-chek softclix ii 200 lancet (na)	297057	Лекарственные средства (folder)/Health & Personal Care	555943	Accu-Chek
885991	4015630002795	Roche accu-chek softclix lan/device	353410	Изделия медицинского назначения (folder)/Клинико-диагностические приборы и наборы	555943	Accu-Chek
885992	9318955234458	Roche accu-chek softclix lan/device #2	353410	Изделия медицинского назначения (folder)/Клинико-диагностические приборы и наборы	555943	Accu-Chek
2827369	4015630006656	Roche accu-chek softclix lanzetten 1x200	353410	Изделия медицинского назначения (folder)/Клинико-диагностические приборы и наборы	555943	Accu-Chek
1849251	4015630004225	Roche accu-chek softclix p lan	353410	Изделия медицинского назначения (folder)/Клинико-диагностические приборы и наборы	555943	Accu-Chek
297347	075537009888	Roche accu-chek softclix sterile lancets (200 lancets)	297057	Лекарственные средства (folder)/Health & Personal Care	555943	Accu-Chek
205851	4015630011551	Roche accu-chek softclix xl 50 lancet (can)	297057	Лекарственные средства (folder)/Health & Personal Care	555943	Accu-Chek
205850	4015630018291	Roche accu-chek softclix xl lanzetten 1x50	297057	Лекарственные средства (folder)/Health & Personal Care	555943	Accu-Chek
2827370	4015630882908	Roche accu-chek Spirit 3.15ml ampullen-System 25 stuck	353410	Изделия медицинского назначения (folder)/Клинико-диагностические приборы и наборы	555943	Accu-Chek
2827372	4015630047420	Roche accu-chek Spirit adapter 2 stuck	353410	Изделия медицинского назначения (folder)/Клинико-диагностические приборы и наборы	555943	Accu-Chek
2827373	4015630046102	Roche accu-chek Spirit batteriefachdeckel 2 stuck	353410	Изделия медицинского назначения (folder)/Клинико-диагностические приборы и наборы	555943	Accu-Chek
2827374	4015630885015	Roche accu-chek Spirit combo clip case 1 st	353410	Изделия медицинского назначения (folder)/Клинико-диагностические приборы и наборы	555943	Accu-Chek
2827375	4015630046652	Roche accu-chek tenderlink 13/110 10 kanulen, 10 schlauche	353410	Изделия медицинского назначения (folder)/Клинико-диагностические приборы и наборы	555943	Accu-Chek
2827376	4015630046669	Roche accu-chek tenderlink 13/30 10 kanulen, 10 schlauche	353410	Изделия медицинского назначения (folder)/Клинико-диагностические приборы и наборы	555943	Accu-Chek
2827377	4015630046676	Roche accu-chek tenderlink 13/60 10 kanulen, 10 schlauche	353410	Изделия медицинского назначения (folder)/Клинико-диагностические приборы и наборы	555943	Accu-Chek
2827378	4015630046683	Roche accu-chek tenderlink 13/80 10 kanulen, 10 schlauche	353410	Изделия медицинского назначения (folder)/Клинико-диагностические приборы и наборы	555943	Accu-Chek
2827379	4015630046690	Roche accu-chek tenderlink 17/110 10 kanulen, 10 schlauche	353410	Изделия медицинского назначения (folder)/Клинико-диагностические приборы и наборы	555943	Accu-Chek
2827380	4015630047307	Roche accu-chek tenderlink 17/30 10 kanulen, 10 schlauche	353410	Изделия медицинского назначения (folder)/Клинико-диагностические приборы и наборы	555943	Accu-Chek
2827381	4015630047314	Roche accu-chek tenderlink 17/60 10 kanulen, 10 schlauche	353410	Изделия медицинского назначения (folder)/Клинико-диагностические приборы и наборы	555943	Accu-Chek
2827382	4015630047321	Roche accu-chek tenderlink 17/80 10 kanulen, 10 schlauche	353410	Изделия медицинского назначения (folder)/Клинико-диагностические приборы и наборы	555943	Accu-Chek
2827383	4015630882823	Roche accu-chek tenderlink kanulen 13 mm 10 stuck	353410	Изделия медицинского назначения (folder)/Клинико-диагностические приборы и наборы	555943	Accu-Chek
2827384	4015630882816	Roche accu-chek tenderlink kanulen 17 mm 10 stuck	353410	Изделия медицинского назначения (folder)/Клинико-диагностические приборы и наборы	555943	Accu-Chek
885994	075537008775	Roche accu-chek tes inst glc	353410	Изделия медицинского назначения (folder)/Клинико-диагностические приборы и наборы	555943	Accu-Chek
885995	075537009130	Roche accu-chek tes inst glc #2	353410	Изделия медицинского назначения (folder)/Клинико-диагностические приборы и наборы	555943	Accu-Chek
885996	075537302767	Roche accu-chek tes simplici	353410	Изделия медицинского назначения (folder)/Клинико-диагностические приборы и наборы	555943	Accu-Chek
885997	075537303146	Roche accu-chek tes simplici #2	353410	Изделия медицинского назначения (folder)/Клинико-диагностические приборы и наборы	555943	Accu-Chek
885998	064562312124	Roche accu-chek test strp	353410	Изделия медицинского назначения (folder)/Клинико-диагностические приборы и наборы	555943	Accu-Chek
885999	064562312155	Roche accu-chek test strp #2	353410	Изделия медицинского назначения (folder)/Клинико-диагностические приборы и наборы	555943	Accu-Chek
886000	064562312162	Roche accu-chek test strp #3	353410	Изделия медицинского назначения (folder)/Клинико-диагностические приборы и наборы	555943	Accu-Chek
886001	064562312179	Roche accu-chek test strp #4	353410	Изделия медицинского назначения (folder)/Клинико-диагностические приборы и наборы	555943	Accu-Chek
886002	064562312247	Roche accu-chek tst strps	353410	Изделия медицинского назначения (folder)/Клинико-диагностические приборы и наборы	555943	Accu-Chek
886003	064562312254	Roche accu-chek tst strps #2	353410	Изделия медицинского назначения (folder)/Клинико-диагностические приборы и наборы	555943	Accu-Chek
886004	075537308028	Roche accu-chek voicemate kit	353410	Изделия медицинского назначения (folder)/Клинико-диагностические приборы и наборы	555943	Accu-Chek
2827385	4015630006809	Roche accu-chek voicemate Plus set mg/dl	353410	Изделия медицинского назначения (folder)/Клинико-диагностические приборы и наборы	555943	Accu-Chek
2827386	4015630006816	Roche accu-chek voicemate Plus set mmol/l	353410	Изделия медицинского назначения (folder)/Клинико-диагностические приборы и наборы	555943	Accu-Chek
2827387	4015630004263	Roche acculink kabel 1 stuck	2418507	Изделия медицинского назначения (folder)/Изделия медицинского назначения	0	
2827388	4038377027951	Roche accusnp array processing kit, 96 react.	1	Неклассифицированные/default	3604475	Roche
2827389	4038377028033	Roche accusnp detection kit, 96 reactions	1	Неклассифицированные/default	3604475	Roche
2827390	4038377027968	Roche accusnp dna purification kit, 24 react.	1	Неклассифицированные/default	3604475	Roche
2827391	4038377028026	Roche accusnp enzyme assay kit, 24 rxn	1	Неклассифицированные/default	3604475	Roche
2827392	4038377027982	Roche accusnp sample prep. kit, 96 reactions	1	Неклассифицированные/default	3604475	Roche
2827393	4038377028002	Roche accusnp wga kit, 24 reactions	1	Неклассифицированные/default	3604475	Roche
205852	4015630003778	Roche accutrend alpha set	7943	Неклассифицированные/COSMETIC	297348	Roche Accutrend
886082	064562312094	Roche accutrend cholest	1	Неклассифицированные/default	297348	Roche Accutrend
886083	064562312261	Roche accutrend cholest #2	1	Неклассифицированные/default	297348	Roche Accutrend
2827394	4015630000357	Roche accutrend cholesterol 1x5	2418507	Изделия медицинского назначения (folder)/Изделия медицинского назначения	0	
886084	064562410059	Roche accutrend cholesterol control soln 1.5ml	1	Неклассифицированные/default	297348	Roche Accutrend
886085	4015630000746	Roche accutrend cholesterol control soln 1.5ml #2	2418507	Изделия медицинского назначения (folder)/Изделия медицинского назначения	297348	Roche Accutrend
886086	064562312100	Roche accutrend cholesterol strips 25's	1	Неклассифицированные/default	297348	Roche Accutrend
886087	365702276109	Roche accutrend cholst test str 25	1	Неклассифицированные/default	297348	Roche Accutrend
2827395	4015630004256	Roche accutrend control g 1x 4ml	2418507	Изделия медицинского назначения (folder)/Изделия медицинского назначения	0	
886088	4015630000661	Roche accutrend control g 2x 4ml	2418507	Изделия медицинского назначения (folder)/Изделия медицинского назначения	297348	Roche Accutrend
886089	064562410035	Roche accutrend control solution 2x 4ml	1	Неклассифицированные/default	297348	Roche Accutrend
2827396	4015630001637	Roche accutrend control tg 1x1.5ml	2418507	Изделия медицинского назначения (folder)/Изделия медицинского назначения	0	
886091	064562212141	Roche accutrend gluc mtr	1	Неклассифицированные/default	297348	Roche Accutrend
886092	365702274105	Roche accutrend gluc test strip 50	1	Неклассифицированные/default	297348	Roche Accutrend
2827397	4015630000609	Roche accutrend glucose 1x25 str.	2418507	Изделия медицинского назначения (folder)/Изделия медицинского назначения	0	
555947	064562312490	Roche accutrend glucose 50	1	Неклассифицированные/default	297348	Roche Accutrend
205854	4015630000012	Roche accutrend glucose 50 strips (na)	7943	Неклассифицированные/COSMETIC	297348	Roche Accutrend
886093	064562312056	Roche accutrend glucose test strips 50's	1	Неклассифицированные/default	297348	Roche Accutrend
886090	064562212080	Roche accutrend glucose&cholesterol t each	1	Неклассифицированные/default	297348	Roche Accutrend
297349	365702284104	Roche accutrend Plus blood cholesterol and glucose monitor kit - 1 ea	297057	Лекарственные средства (folder)/Health & Personal Care	297348	Roche Accutrend
2827398	4015630056163	Roche accutrend Plus gerat mg/dl 1 stuck	2418507	Изделия медицинского назначения (folder)/Изделия медицинского назначения	0	
2827399	16965584	Roche accutrend Plus gerat mmol/l 1 stuck	1	Неклассифицированные/default	0	
205855	4015630001620	Roche accutrend triglycerides 25 strips	7943	Неклассифицированные/COSMETIC	297348	Roche Accutrend
2827400	4015630996377	Roche acetaminophen universalpackung 1x 18ml r1, 1x 19ml r2	2418507	Изделия медицинского назначения (folder)/Изделия медицинского назначения	0	
2827401	4038377000022	Roche acetyl-coenzyme a 10mg	1	Неклассифицированные/default	3604475	Roche
2827402	4038377011363	Roche acetyl-coenzyme a 200mg	1	Неклассифицированные/default	3604475	Roche
2827403	4038377000039	Roche acetyl-coenzyme a 50mg	1	Неклассифицированные/default	3604475	Roche
2827404	4038377000978	Roche acid phosphatase 500mg	1	Неклассифицированные/default	3604475	Roche
2827405	4038377021379	Roche actin rna probe, dig-labeled 2 чg	1	Неклассифицированные/default	3604475	Roche
2827406	4015630992935	Roche adapter fur 717/911 univ-kit 30 stuck	2418507	Изделия медицинского назначения (folder)/Изделия медицинского назначения	0	
2827407	8430215012086	Roche adapter set 20ml, flaschenadapter 20ml 20 stuck	1	Неклассифицированные/default	0	
2827408	4015630028313	Roche adapter zur direkten probeneingabe 150 stuck	2418507	Изделия медицинского назначения (folder)/Изделия медицинского назначения	0	
2827409	4038377000060	Roche adenosine deaminase (ada) 10mg (1ml)	1	Неклассифицированные/default	3604475	Roche
2827410	4038377000053	Roche adenosine deaminase (ada) 10mg (2ml)	1	Неклассифицированные/default	3604475	Roche
2827411	4015630932856	Roche adptest 1x 1ml	2418507	Изделия медицинского назначения (folder)/Изделия медицинского назначения	0	
2827412	4015630932870	Roche adptest 3x 1ml	2418507	Изделия медицинского назначения (folder)/Изделия медицинского назначения	0	
2827413	4038377012964	Roche agarose Gel dna extraction kit 1 kit (Max. 100 reactions)	1	Неклассифицированные/default	3604475	Roche
2827414	4038377012827	Roche agarose le 100g	1	Неклассифицированные/default	3604475	Roche
2827415	4038377012834	Roche agarose le 500g	1	Неклассифицированные/default	3604475	Roche
2827416	4038377009698	Roche agarose mp 100g	1	Неклассифицированные/default	3604475	Roche
2827417	4038377009704	Roche agarose mp 500g	1	Неклассифицированные/default	3604475	Roche
2827418	4038377014548	Roche agarose ms 100g	1	Неклассифицированные/default	3604475	Roche
2827419	4038377014555	Roche agarose ms 500g	1	Неклассифицированные/default	3604475	Roche
2827421	8430215045213	Roche Air Filter 549 mm x 157 mm gerateluftfilter sta-r 1 stuck	1	Неклассифицированные/default	0	
2827422	8430215045220	Roche Air Filter fur chromogenic Box photometer luftfilt 1 stuck	1	Неклассифицированные/default	0	
2827423	4015630018642	Roche akku-pack fur cobas h 232 und coaguchek xs Plus 1 stuck	2418507	Изделия медицинского назначения (folder)/Изделия медицинского назначения	0	
2827424	4015630911509	Roche albumin bcg hit 917 / modular p 6x 64ml r1, 6x 16ml r2	2418507	Изделия медицинского назначения (folder)/Изделия медицинского назначения	0	
2827425	4015630911530	Roche albumin bcg modular d r1 4x 641ml	2418507	Изделия медицинского назначения (folder)/Изделия медицинского назначения	0	
2827426	4015630911547	Roche albumin bcg modular d r2 4x 278ml	2418507	Изделия медицинского назначения (folder)/Изделия медицинского назначения	0	
2827427	4015630911516	Roche albumin bcg modular p/d r1 6x 258ml	2418507	Изделия медицинского назначения (folder)/Изделия медицинского назначения	0	
2827428	4015630911523	Roche albumin bcg modular p/d r2 6x 68ml	2418507	Изделия медицинского назначения (folder)/Изделия медицинского назначения	0	
2827429	4015630911370	Roche albumin bcg sys 1 12x 50ml r1, 6x 22ml r2	2418507	Изделия медицинского назначения (folder)/Изделия медицинского назначения	0	
2827430	4015630046805	Roche alcantara schutzhulle blau, fur accu-chek Spirit 1 stuck	2418507	Изделия медицинского назначения (folder)/Изделия медицинского назначения	555943	Accu-Chek
2827431	4015630046195	Roche alcantara schutzhulle schwarz, fur accu-chek spiri 1 stuck	2418507	Изделия медицинского назначения (folder)/Изделия медицинского назначения	555943	Accu-Chek
2827432	4015630882854	Roche alcantara schutzhulle weiss, fur accu-chek Spirit 1 stuck	2418507	Изделия медицинского назначения (folder)/Изделия медицинского назначения	555943	Accu-Chek
2827433	4038377001722	Roche alcohol dehydrogenase (adh) 1g (34ml)	1	Неклассифицированные/default	3604475	Roche
2827434	4038377002279	Roche aldehyde dehydrogenase 250 u	1	Неклассифицированные/default	3604475	Roche
2827435	4015630929986	Roche aliquot tip pre-loaded	2418507	Изделия медицинского назначения (folder)/Изделия медицинского назначения	0	
2827436	4038377000930	Roche alkaline phosphatase (ap) 1.500 u	1	Неклассифицированные/default	3604475	Roche
2827437	4038377000947	Roche alkaline phosphatase (ap) 7.500 u	1	Неклассифицированные/default	3604475	Roche
2827438	4038377010397	Roche alkaline phosphatase (ap), activated 10mg (approx. 40mg lyo.)	1	Неклассифицированные/default	3604475	Roche
2827439	4038377004051	Roche alkaline phosphatase 1.000 u (1 u/чl)	1	Неклассифицированные/default	3604475	Roche
2827440	4038377007427	Roche alkaline phosphatase 1.000 u (20 u/чl)	1	Неклассифицированные/default	3604475	Roche
2827441	4038377003177	Roche alkaline phosphatase 15mg (1.5ml)	1	Неклассифицированные/default	3604475	Roche
2827442	4038377019291	Roche alkaline phosphatase recombinant, highly active 10mg (500 чl)	1	Неклассифицированные/default	3604475	Roche
2827443	4015630916429	Roche alp ifcc hit 917 / modular p 4x 67ml r1, 4x 17ml r2	2418507	Изделия медицинского назначения (folder)/Изделия медицинского назначения	0	
2827444	4015630916450	Roche alp ifcc modular d r1 4x 653ml	2418507	Изделия медицинского назначения (folder)/Изделия медицинского назначения	0	
2827445	4015630916467	Roche alp ifcc modular d r2 4x 146ml	2418507	Изделия медицинского назначения (folder)/Изделия медицинского назначения	0	
2827446	4015630916436	Roche alp ifcc modular p/d r1 6x 267ml	2418507	Изделия медицинского назначения (folder)/Изделия медицинского назначения	0	
2827447	4015630916443	Roche alp ifcc modular p/d r2 6x 71ml	2418507	Изделия медицинского назначения (folder)/Изделия медицинского назначения	0	
2827448	4015630914555	Roche alp ifcc sys 1 12x 50ml r1, 6x 22ml r2	2418507	Изделия медицинского назначения (folder)/Изделия медицинского назначения	0	
2827450	4038377000176	Roche alpha-amylase 50mg (5ml)	1	Неклассифицированные/default	3604475	Roche
2827451	4038377013398	Roche alpha-glucosidase assay 1 kit (for 30 tests and 10 blanks)	1	Неклассифицированные/default	3604475	Roche
2827449	4038377003252	Roche alpha2-macroglobulin 25 inhibitor units	1	Неклассифицированные/default	3604475	Roche
2827452	4038377003573	Roche alu i 2.000 u (10 u/чl)	1	Неклассифицированные/default	3604475	Roche
2827453	4038377002637	Roche alu i 500 u (10 u/чl)	1	Неклассифицированные/default	3604475	Roche
2827454	4015630915224	Roche ammoniak / ethanol / co2 calibrator 2x 4ml	2418507	Изделия медицинского назначения (folder)/Изделия медицинского назначения	0	
2827455	4015630915217	Roche ammoniak / ethanol / co2 control abnormal 5x 4ml	2418507	Изделия медицинского назначения (folder)/Изделия медицинского назначения	0	
2827456	4015630915200	Roche ammoniak / ethanol / co2 control Normal 5x 4ml	2418507	Изделия медицинского назначения (folder)/Изделия медицинского назначения	0	
2827457	4015630990856	Roche ammoniak universalpackung 2x15.8ml r1, 2x4.7ml r2	2418507	Изделия медицинского назначения (folder)/Изделия медицинского назначения	0	
2827461	4038377000114	Roche amp-pnp 25mg	1	Неклассифицированные/default	3604475	Roche
2827458	4015630997626	Roche amphetamine ii online dat universalpackung 2x 16ml r1, 2x 8ml r2	2418507	Изделия медицинского назначения (folder)/Изделия медицинского назначения	0	
2827459	4038377005287	Roche ampicillin 50g	1	Неклассифицированные/default	3604475	Roche
2827460	4038377005270	Roche ampicillin 5g	1	Неклассифицированные/default	3604475	Roche
2827462	4015630016587	Roche ampullenadapter 150 stuck	2418507	Изделия медицинского назначения (folder)/Изделия медицинского назначения	0	
2827463	4038377000183	Roche amyloglucosidase 100mg (10ml)	1	Неклассифицированные/default	3604475	Roche
2827464	4038377008233	Roche amyloglucosidase 3.500 u	1	Неклассифицированные/default	3604475	Roche
2827465	4038377008226	Roche amyloglucosidase 500 u	1	Неклассифицированные/default	3604475	Roche
