ID	UPCEAN	Name	CategoryID	CategoryName	BrandID	BrandName
4556081	018713504227	Nothing sacred (DVD)	1	Неклассифицированные/default	0	
4556082	024266740296	Nothing sacred/made for each other (DVD)	1	Неклассифицированные/default	0	
4556083	741914017769	Nothing sacred/something to sing about (DVD)	1	Неклассифицированные/default	0	
4556084	715278113009	Nothing stickers	1	Неклассифицированные/default	0	
4556085	018713523570	Nothing to declare (DVD)	1	Неклассифицированные/default	0	
1992377	051353139527	Nothing to hide #03&04-DVD	1980351	Adult/Adult DVD	0	
4556086	185483904615	Nothing to something-bob frissell (DVD)	1	Неклассифицированные/default	0	
4556087	096009205898	Nothing too Good for a cowboy (DVD)	1	Неклассифицированные/default	0	
4556088	053039621708	Nothing too loose	1	Неклассифицированные/default	0	
4556090	978068987642	Nothing's sacred by lewis Black	1	Неклассифицированные/default	0	
4556089	081398080164	Nothing, it's fucking emp it's a fucking empty ass Box with a barcode on the bitch	1	Неклассифицированные/default	0	
4556091	079633585291	Notica pillow	1	Неклассифицированные/default	0	
4556092	020103183585	Notifier company 0020103183585 abdalla elsokry	1	Неклассифицированные/default	0	
4556093	783863011252	Notifier frm-1 fire alarm	1	Неклассифицированные/default	0	
3723828	49778212	Notime Classic f 7h 0.033kg wp	19141	Продукты питания (folder)/Жевательная резинка	3723827	NOTIME (LOTTE GROUP)
4556094	073650994593	Notions	1	Неклассифицированные/default	0	
4556095	073650997051	Notions #2	1	Неклассифицированные/default	0	
4556096	073650997174	Notions #3	1	Неклассифицированные/default	0	
4556097	073650997235	Notions #4	1	Неклассифицированные/default	0	
4556098	073650997242	Notions #5	1	Неклассифицированные/default	0	
2368776	077540053117	Notions marketing corp (nsp) cot 8.7ydvdk avocado Green 117-936	2	Канцелярские товары (folder)/Канцелярские товары	2368775	NOTIONS MARKETING CORP (NSP)
2368777	077216002586	Notions marketing corp (nsp) crys french knit med asst 14103	205445	Канцелярские товары (folder)/Бумага (folder)/Бумага	2368775	NOTIONS MARKETING CORP (NSP)
2368778	715627129941	Notions marketing corp (nsp) split rail scroll frame 4x6 2994	2	Канцелярские товары (folder)/Канцелярские товары	2368775	NOTIONS MARKETING CORP (NSP)
369783	5203021110405	Notios peloponnisos regional Wine	1	Неклассифицированные/default	0	
4556099	074472820510	Notita musical 1ct	1	Неклассифицированные/default	0	
4556100	8712346874727	Notitieboek pip A4 roze A4	1	Неклассифицированные/default	0	
397774	97015369	Notix forte Powder 100g	1	Неклассифицированные/default	0	
397775	97015383	Notix Green soap 75g	1	Неклассифицированные/default	0	
397776	97015352	Notix Powder 100g	1	Неклассифицированные/default	0	
4556101	823954000120	Notnice records CD vanishing peoples of the Earth: you might be One of us...	1	Неклассифицированные/default	0	
4556102	883904109877	Notorious (DVD/hitchcock/fs1:33/sac)	1	Неклассифицированные/default	0	
1074362	360597002093	Notorious 1.7floz EDP spray	4385	Парфюмерия (folder)/Парфюмерная вода	302373	Ralph Lauren
1394437	716165171645	Notorious b.i.g blunts	1	Неклассифицированные/default	0	
4556103	823564502199	Notorious b.i.g.-legend unauthorized (DVD)	1	Неклассифицированные/default	0	
4556104	014381415728	Notorious big bigger than Life (DVD) dol dig 5.1/ws/16x9)	1	Неклассифицированные/default	0	
4556105	655690300505	Notorious big-business instead of Game unauthorized (DVD)	1	Неклассифицированные/default	0	
4556106	823564901220	Notorious big-legend lives on (DVD)	1	Неклассифицированные/default	0	
2368779	3605970020194	Notorious by ralph Lauren 2.5 EDP spr tester (women)	3068	Парфюмерия (folder)/Парфюмерия	0	
4556107	750723145327	Notorious colonel steel (DVD)	1	Неклассифицированные/default	0	
4556108	195197039206	Notorious wig, blonde, os	1	Неклассифицированные/default	0	
3167628	858070005018	Notoriously nutty giddy up&go granola	330591	Продукты питания (folder)/Продукты питания	0	
2176833	23068520	Notos	1	Неклассифицированные/default	2176832	Notos
4556109	062539000074	Notpad	1	Неклассифицированные/default	0	
4556110	079784262102	Notr book	1	Неклассифицированные/default	0	
4556111	022143351030	Notra trading, inc White towel	1	Неклассифицированные/default	0	
4556112	806293190509	Notre dame 12pk cooler	1	Неклассифицированные/default	0	
1926446	080175703494	Notre dame chateauneuf du pape glass 750ml	1	Неклассифицированные/default	0	
1926447	080175703296	Notre dame cotes du rhone glass 750ml	1	Неклассифицированные/default	0	
4556113	064027081022	Notre dame de Paris	1	Неклассифицированные/default	0	
4556114	719106817732	Notre dame fitted hat	1	Неклассифицированные/default	0	
1926448	080175703593	Notre dame lirac glass 750ml	1	Неклассифицированные/default	0	
1926449	080175703098	Notre dame luberon Red glass 750ml	1	Неклассифицированные/default	0	
1926450	080175703395	Notre dame luberon White glass 750ml	1	Неклассифицированные/default	0	
1926451	080175703197	Notre dame vacqueyras glass 750ml	1	Неклассифицированные/default	0	
4556115	733961760194	Notre dame-fighting irish collectors edition (DVD/8 disc)	1	Неклассифицированные/default	0	
2818312	097871015332	Notro Blend glass 750ml	1	Неклассифицированные/default	0	
397777	097871009423	Notro Malbec glass 750ml	22133	Продукты питания (folder)/Алкогольные напитки/Вино (folder)/Вино	0	
397778	097871009409	Notro sangiovese/bonarda glass 750ml	1	Неклассифицированные/default	0	
397779	097871009386	Notro torrontes glass 750ml	1	Неклассифицированные/default	0	
4556116	8022647001013	Nots	1	Неклассифицированные/default	0	
3167629	852283004011	Nots, sustenance snack, peppa	330591	Продукты питания (folder)/Продукты питания	0	
633219	070650700520	Notta pasta gluten free Rice linguine	1	Неклассифицированные/default	633217	NOTTA PASTA
633218	070650700537	Notta pasta pasta Rice fetuccine 16oz	1	Неклассифицированные/default	633217	NOTTA PASTA
633220	070650700513	Notta pasta pasta Rice spaghetti 16oz	1	Неклассифицированные/default	633217	NOTTA PASTA
2644022	070650700551	Notta pasta, Rice lasagna	1	Неклассифицированные/default	633217	NOTTA PASTA
3723830	8016729313019	Notte di stelle lugana brut w 0.75l	296061	Продукты питания (folder)/Алкогольные напитки/Вино (folder)/Вино игристое	3723829	NOTTE DI STELLE (FREZZA AZIENDA AGRICOLA/ITALY)
2368780	080516116822	Notte rossa lambrusco glass 1.5l	1	Неклассифицированные/default	0	
2368781	080516116846	Notte rossa lambrusco glass 750ml	1	Неклассифицированные/default	0	
4556118	096898443838	Notting Hill	1	Неклассифицированные/default	0	
2644023	731454642729	Notting Hill - o.s.t. - ost CD 5464272	2275105	Медиа (folder)/Медиа	0	
4556119	025195023603	Notting Hill/erin brockovich 2pk (DVD) (2discs/double feature)	1	Неклассифицированные/default	0	
4556120	4011898060614	Nottingham board Game	1	Неклассифицированные/default	0	
2818313	864891000408	Nottingham glass 500ml	1	Неклассифицированные/default	0	
1557402	9780850396850	Nottingham&derby st atlas	205408	Полиграфия (folder)/Книги	0	
1557403	9781843484387	Nottinghamshire county atlas	205408	Полиграфия (folder)/Книги	0	
397781	859243001172	Notturno Red Wine glass 750ml	22133	Продукты питания (folder)/Алкогольные напитки/Вино (folder)/Вино	0	
2644024	7896007546527	Noturno confort ntimus Gel c/abas	1	Неклассифицированные/default	0	
2644025	7896658001031	Notuss 12 past ache -	1	Неклассифицированные/default	0	
1926452	7896658000782	Notuss ad 120ml ache -	1	Неклассифицированные/default	0	
2368782	045985640162	Notuss liq 16oz	1	Неклассифицированные/default	2288534	SJP
1074363	345985652166	Notuss pd 4-5-2mg/5ml	1	Неклассифицированные/default	0	
1926453	7896658000799	Notuss ped 120ml ache -	1	Неклассифицированные/default	0	
2818314	7896658021381	Notuss tss 1.5mg c/120ml	1	Неклассифицированные/default	0	
2818315	7896658021121	Notuss tss 3.0mg c/120ml	1	Неклассифицированные/default	0	
1074364	324839343160	Notuss-pe 16oz	1	Неклассифицированные/default	0	
1074435	8010573357038	Nouba Earth Powder Пудра компакт-румяна 3	272015	Косметика (folder)/Пудра	1074365	NOUBA
1074398	8010573202017	Nouba корректор с кисточкой staminal concealer 1	961989	Косметика (folder)/Уход за лицом	1074365	NOUBA
1074399	8010573202024	Nouba корректор с кисточкой staminal concealer 2	961989	Косметика (folder)/Уход за лицом	1074365	NOUBA
1074400	8010573202031	Nouba корректор с кисточкой staminal concealer 3	961989	Косметика (folder)/Уход за лицом	1074365	NOUBA
1074401	8010573331090	Nouba Крем-Помада губная nouba 109	1069	Косметика (folder)/Помада губная	1074365	NOUBA
1074407	8010573204011	Nouba маскирующее средство для век 1	5586	Косметика (folder)/Косметика	1074365	NOUBA
1074410	8010573340429	Nouba матирующая стойкая Крем-Пудра с uv-фильтром 42	272015	Косметика (folder)/Пудра	1074365	NOUBA
1074411	8010573340436	Nouba матирующая стойкая Крем-Пудра с uv-фильтром 43	272015	Косметика (folder)/Пудра	1074365	NOUBA
1074412	8010573340443	Nouba матирующая стойкая Крем-Пудра с uv-фильтром 44	272015	Косметика (folder)/Пудра	1074365	NOUBA
1074459	8010573353030	Nouba Пудра-румяна компактные Earth Powder limited edition 3	272015	Косметика (folder)/Пудра	1074365	NOUBA
1074460	8010573353054	Nouba Пудра-румяна компактные Earth Powder limited edition 5	272015	Косметика (folder)/Пудра	1074365	NOUBA
1074461	8010573353528	Nouba Пудра-румяна компактные Earth Powder limited edition 52	272015	Косметика (folder)/Пудра	1074365	NOUBA
1557406	8010573332103	Nouba тени-Крем для век 210	664	Косметика (folder)/Крем для лица	1074365	NOUBA
1074462	8010573332127	Nouba тени-Крем для век 212	1249	Косметика (folder)/Тени для век	1074365	NOUBA
1074464	8010573410016	Nouba универсальный жемчужный Крем 1 Star Gold	961989	Косметика (folder)/Уход за лицом	1074365	NOUBA
1074465	8010573410030	Nouba универсальный жемчужный Крем 3 Star Red	961989	Косметика (folder)/Уход за лицом	1074365	NOUBA
4556121	971505676024	Noufal	1	Неклассифицированные/default	0	
3167630	071403000096	Nougat	330591	Продукты питания (folder)/Продукты питания	0	
4556122	3277860033005	Nougat #2	1	Неклассифицированные/default	0	
633222	8004494313181	Nougat bar wi/citrus&pistacc	1	Неклассифицированные/default	0	
1557407	4806505760052	Nougat candies 40's	22145	Продукты питания (folder)/Кондитерские изделия (folder)/Конфеты	0	
1557408	4806505760069	Nougat candy 60x20 's	22145	Продукты питания (folder)/Кондитерские изделия (folder)/Конфеты	0	
2644026	3289311188783	Nougat din 11 ea	1	Неклассифицированные/default	0	
2368783	5055041815774	Nougat essentials Cherry blossom 4pce	1	Неклассифицированные/default	0	
2368784	5055041815811	Nougat essentials fig&pink cedar 4pce	1	Неклассифицированные/default	0	
4556123	744986020835	Nougat fluffs	1	Неклассифицированные/default	0	
197182	8710486796206	Nougat hazelnut chc gift	22145	Продукты питания (folder)/Кондитерские изделия (folder)/Конфеты	0	
2368785	5055041815767	Nougat helping hands Cherry blossom 4pce	1	Неклассифицированные/default	0	
2368786	5055041815804	Nougat helping hands fig&pink ced 4pce	1	Неклассифицированные/default	0	
2368787	5055041816962	Nougat helping hands peony 4pce	1	Неклассифицированные/default	0	
2818316	5055041816931	Nougat indulge me peony 6pce	1	Неклассифицированные/default	0	
633224	5010511471768	Nougat jumbo 100g	1	Неклассифицированные/default	0	
2368788	5055041812377	Nougat our fab four Cherry blossom 4pce	1	Неклассифицированные/default	0	
197184	8710486798200	Nougat Peanut&Fruit gift	22145	Продукты питания (folder)/Кондитерские изделия (folder)/Конфеты	0	
4556124	010120000644	Nougat pillows cereal	1	Неклассифицированные/default	0	
2818317	4000539307201	Nougat-chocolates 200g	1	Неклассифицированные/default	0	
3167631	625252007159	Nougato belgian Dark chocolate	330591	Продукты питания (folder)/Продукты питания	0	
3167632	041497136391	Nougats	330591	Продукты питания (folder)/Продукты питания	3001562	Weis
3167633	041420017650	Nougats #2	330591	Продукты питания (folder)/Продукты питания	0	
3167634	041420028274	Nougats candy	330591	Продукты питания (folder)/Продукты питания	0	
219385	6281056700906	Nourah 100ml	7943	Неклассифицированные/COSMETIC	0	
1653409	070470008158	Nourich Super smoothie Raspberry 11floz	1	Неклассифицированные/default	1653461	YOPLAIT
1653412	070470008011	Nouriche supersmoothie 11floz	1	Неклассифицированные/default	1653461	YOPLAIT
1074466	8710537702101	Nourilax 30tbl	1	Неклассифицированные/default	0	
3167635	085996005130	Nourish bakery, liberated, beyond paleo mayonnaise	330591	Продукты питания (folder)/Продукты питания	0	
3167636	038000918674	Nourish bars	330591	Продукты питания (folder)/Продукты питания	55587	Kellogg's
2644027	667383103041	Nourish Body btr almond vnla	1	Неклассифицированные/default	304398	Nourish
2644028	667383103058	Nourish Body btr Fresh fig	1	Неклассифицированные/default	304398	Nourish
2644029	667383103034	Nourish Body btr Lavender&mint	1	Неклассифицированные/default	304398	Nourish
2644030	667383103010	Nourish Body btr Pure	1	Неклассифицированные/default	304398	Nourish
2644031	667383103027	Nourish Body btr Wild bry	1	Неклассифицированные/default	304398	Nourish
2644032	667383102044	Nourish Body Lotion almond vnla	1	Неклассифицированные/default	304398	Nourish
2644033	667383102051	Nourish Body Lotion Fresh fig	1	Неклассифицированные/default	304398	Nourish
2644034	667383102037	Nourish Body Lotion Lavender&mint	1	Неклассифицированные/default	304398	Nourish
2644035	667383102013	Nourish Body Lotion Pure unscntd	1	Неклассифицированные/default	304398	Nourish
2644036	667383102075	Nourish Body Lotion Spiced citrus	1	Неклассифицированные/default	304398	Nourish
2644037	667383102020	Nourish Body Lotion Wild berry	1	Неклассифицированные/default	304398	Nourish
2644038	667383104017	Nourish Body polish	1	Неклассифицированные/default	304398	Nourish
2644039	667383101047	Nourish Body wash almond vnla	1	Неклассифицированные/default	304398	Nourish
2644040	667383101054	Nourish Body wash Fresh fig	1	Неклассифицированные/default	304398	Nourish
2644041	667383101030	Nourish Body wash Lavender&mint	1	Неклассифицированные/default	304398	Nourish
2644042	667383101016	Nourish Body wash Pure unscntd	1	Неклассифицированные/default	304398	Nourish
2644043	667383101078	Nourish Body wash spcd citrus	1	Неклассифицированные/default	304398	Nourish
2644044	667383101023	Nourish Body wash Wild berry	1	Неклассифицированные/default	304398	Nourish
2644045	667383105045	Nourish Deo almond vnla	1	Неклассифицированные/default	304398	Nourish
2644046	667383105052	Nourish Deo Fresh fig	1	Неклассифицированные/default	304398	Nourish
2644047	667383105038	Nourish Deo Lavender&mint	1	Неклассифицированные/default	304398	Nourish
2644048	667383105014	Nourish Deo Pure unscntd	1	Неклассифицированные/default	304398	Nourish
2644049	667383105021	Nourish Deo Wild berry	1	Неклассифицированные/default	304398	Nourish
2644050	667383109012	Nourish face cleanser moistrzng	1	Неклассифицированные/default	304398	Nourish
2644051	667383109036	Nourish face crm Ultra hydrtng	1	Неклассифицированные/default	304398	Nourish
2644052	667383109043	Nourish face ltn lightwght moistr	1	Неклассифицированные/default	304398	Nourish
2644053	667383109029	Nourish face serum argan hydrtng	1	Неклассифицированные/default	304398	Nourish
2644054	667383106042	Nourish hand wash almond vnla	1	Неклассифицированные/default	304398	Nourish
2644055	667383106059	Nourish hand wash gresh fig	1	Неклассифицированные/default	304398	Nourish
2644056	667383106035	Nourish hand wash Lavender&mint	1	Неклассифицированные/default	304398	Nourish
2644057	667383106011	Nourish hand wash Pure unscntd	1	Неклассифицированные/default	304398	Nourish
2644058	667383106073	Nourish hand wash Spiced citrus	1	Неклассифицированные/default	304398	Nourish
2644059	667383106028	Nourish hand wash Wild berry	1	Неклассифицированные/default	304398	Nourish
1074467	088634012903	Nourish my Eye pad	1	Неклассифицированные/default	0	
1074468	088634012804	Nourish my lips	1	Неклассифицированные/default	0	
2644060	667383107018	Nourish Oil argan replnsh fce&Body	1	Неклассифицированные/default	304398	Nourish
633235	667383000906	Nourish Organic acai berry and seabuckthorn nighttime renewal face moisturizer - 2oz	1	Неклассифицированные/default	633226	NOURSH
633231	667383002009	Nourish Organic face wash cucumber and watercress - 8.5floz	1380354	Косметика (folder)/FACIAL CLEANER, WASH & SCRUB	633226	NOURSH
2176834	041693309117	Nourish puppy health anchovy/sardine/chicken 15#	337596	Товары для животных (folder)/Pets	0	
4556125	8993347005864	Nourish Skin	1	Неклассифицированные/default	0	
2176835	8993347008001	Nourish Skin 15pcs	1	Неклассифицированные/default	0	
2176836	8993347005055	Nourish Skin 30pcs	1	Неклассифицированные/default	0	
3167638	857931005051	Nourish snacks berry'd treasure granola bites, Blueberry-Apple	330591	Продукты питания (folder)/Продукты питания	3167637	Nourish snacks
3167639	857931005037	Nourish snacks cinn-sational apples&almonds	330591	Продукты питания (folder)/Продукты питания	3167637	Nourish snacks
3167640	857931005174	Nourish snacks Dark chocolate peanuts&chocolate granola, cocoa loco	330591	Продукты питания (folder)/Продукты питания	3167637	Nourish snacks
3167641	857931005211	Nourish snacks holy habanero roasted corn	330591	Продукты питания (folder)/Продукты питания	3167637	Nourish snacks
3167642	857931005228	Nourish snacks just chillin' roasted corn, Mild chili	330591	Продукты питания (folder)/Продукты питания	3167637	Nourish snacks
3167643	857931005273	Nourish snacks Miss popular Half-popped corn kernels	330591	Продукты питания (folder)/Продукты питания	3167637	Nourish snacks
3167644	857931005303	Nourish snacks mocha-mazing, cocoa-dusted almonds, mocha granola	330591	Продукты питания (folder)/Продукты питания	3167637	Nourish snacks
3167645	857931005044	Nourish snacks monkey Love granola bites, chocolate&banana	330591	Продукты питания (folder)/Продукты питания	3167637	Nourish snacks
3167646	857931005013	Nourish snacks mr.popular Half-popped corn kernels	330591	Продукты питания (folder)/Продукты питания	3167637	Nourish snacks
3167647	857931005150	Nourish snacks raise the bar-bq roasted chickpeas&virginia peanuts	330591	Продукты питания (folder)/Продукты питания	3167637	Nourish snacks
1557410	758024003018	Nourishing Cream 1oz	1	Неклассифицированные/default	0	
1557411	792850000643	Nourishing gift set	1	Неклассифицированные/default	0	
2540143	677591000087	Nourishing indulgence frozen dairy dessert	1	Неклассифицированные/default	2540141	Brio
2368790	859825002016	Nourishing massage Oil, ayurveda Skin Care, 4.2oz, bhaktiveda	1	Неклассифицированные/default	2534425	Bhaktiveda
4556126	072785083455	Nourishing Nail polish remover	1	Неклассифицированные/default	0	
3167648	858158005725	Nourishing protein smoothie for daily health&Energy	330591	Продукты питания (folder)/Продукты питания	0	
3167649	858158005732	Nourishing protein smoothie Mix	330591	Продукты питания (folder)/Продукты питания	0	
3167650	858158005954	Nourishing protein smoothie Mix #2	330591	Продукты питания (folder)/Продукты питания	0	
1557412	094717574695	Nourishing traditions cookbook	1	Неклассифицированные/default	0	
4556127	605923631005	Nourishoil	1	Неклассифицированные/default	0	
4556128	099446665614	Nourison 32x20 kitchen flavors washable rug	1	Неклассифицированные/default	0	
4556129	099446055415	Nourison 8' x 5' nourison contempo wool rug	1	Неклассифицированные/default	0	
4556130	099446796202	Nourison 8'x10' embassy gate 100% wool rug	1	Неклассифицированные/default	0	
4556131	099446582034	Nourison 8x10 Star of india hand knotted wool rug	1	Неклассифицированные/default	0	
2644061	099446131591	Nourison graphic illusion gil09 7-foot 9-inch x 10-foot 10-inch area rug in ivory	1	Неклассифицированные/default	0	
2644062	099446154965	Nourison kenya 2-foot x 3-foot accent rug in Black	1	Неклассифицированные/default	0	
4556132	099446808929	Nourison rug	1	Неклассифицированные/default	0	
1074469	049608653034	Nouriva repair 30g	1	Неклассифицированные/default	0	
1074470	734118081025	Nouriva repair 30g #2	1	Неклассифицированные/default	0	
1074471	304960865304	Nouriva repair crm 30g	1	Неклассифицированные/default	0	
2818320	5707725301010	Nourkrin 60's eurofarma	1	Неклассифицированные/default	0	
2818318	5707725302017	Nourkrin c/ 180 comp	1	Неклассифицированные/default	0	
2818319	5707725301102	Nourkrin c/30 comp	1	Неклассифицированные/default	0	
633227	667383000944	Noursh Body Lotion org Wild Green 8.5oz	486634	Косметика (folder)/Лосьон для тела	633226	NOURSH
633228	667383002030	Noursh Body wash og Wild greens 8.5oz	1	Неклассифицированные/default	633226	NOURSH
633229	667383002191	Noursh Deo og citrus Fresh 2oz	1	Неклассифицированные/default	633226	NOURSH
633230	667383002207	Noursh Deo og Wild Fresh Green 2oz	1	Неклассифицированные/default	633226	NOURSH
633232	667383002078	Noursh hand santz og icd mnt/van 2oz	1	Неклассифицированные/default	633226	NOURSH
633233	667383002085	Noursh hand wash og Foam fragrance fr 5.5oz	1	Неклассифицированные/default	633226	NOURSH
633234	667383000708	Noursh mstrzr,face og cucmbr&Water 2oz	1	Неклассифицированные/default	633226	NOURSH
