ID	UPCEAN	Name	CategoryID	CategoryName	BrandID	BrandName
2368689	813635010173	North Bay produce jonathan apples 3lb	2058983	Продукты питания (folder)/Fruits and Vegetables	2368685	North Bay Produce
2368690	813635010128	North Bay produce mcintosh apples 3lb	2058983	Продукты питания (folder)/Fruits and Vegetables	2368685	North Bay Produce
4555144	677880110398	North beach (DVD)	1	Неклассифицированные/default	0	
1737555	724004531079	North by honeywell 105300t co-flex, latex free, 3-inch x 5 yard tan	1737272	Неклассифицированные/Home Improvement	0	
2818261	768675156971	North by northwest Rose 5.16 keg 6.5% 02l	1	Неклассифицированные/default	0	
4555145	012569691599	North by northwest/dial m for murder (DVD/back to/amaray case/2pk)	1	Неклассифицированные/default	0	
4555146	012569588400	North by northwest/dial m for murder (DVD/back to/snapper/2pk)	1	Неклассифицированные/default	0	
4555147	012569691612	North by northwest/dial m for murder (DVD/side x side/amaray/2pk)	1	Неклассифицированные/default	0	
4555148	012569586444	North by northwest/dial m for murder 2pk (DVD/side to side/snapper)	1	Неклассифицированные/default	0	
4555149	751937144427	North by south: Old ways	1	Неклассифицированные/default	0	
4555150	805803053884	North cape international cush500c cushion seat back	1	Неклассифицированные/default	0	
4555151	068022020239	North Carolina	1	Неклассифицированные/default	0	
3167540	850476006118	North Carolina berry Blend	330591	Продукты питания (folder)/Продукты питания	0	
3167541	850476006033	North Carolina blueberries	330591	Продукты питания (folder)/Продукты питания	0	
4555152	842078100233	North Carolina hat	1	Неклассифицированные/default	0	
3167542	040713160301	North Carolina molasses	330591	Продукты питания (folder)/Продукты питания	0	
1557263	214029000006	North Carolina pamlico sound medium shrimp	1	Неклассифицированные/default	2703089	Usda Seafood
2643854	730669498978	North Carolina slate Cheese board	1	Неклассифицированные/default	0	
4555153	844296008940	North Carolina state neon clock - 14inch diameter 112oz	1	Неклассифицированные/default	0	
4555154	075501864017	North castl chs/garlic crsp 5oz	1	Неклассифицированные/default	0	
4555155	075501864000	North castle Cheese crisps 5oz	1	Неклассифицированные/default	0	
4555156	075501063656	North castle hi lo crackers 100g	1	Неклассифицированные/default	0	
4555157	075501063601	North castle Water crackers 100g	1	Неклассифицированные/default	0	
1557264	634608000669	North coase seafoods Super lump crabmeat	1	Неклассифицированные/default	0	
2818262	022014033027	North Coast Apple sauce with berries, 4-3.2oz pouches, Organic 38.40oz	1	Неклассифицированные/default	0	
2818263	022014240425	North Coast Apple sauce, Organic, gravenstein apples 24oz	1	Неклассифицированные/default	0	
4555158	735147000209	North Coast bakery north Coast bakery	1	Неклассифицированные/default	0	
3167543	022014640256	North Coast brewing co, Spiced oragnaic Apple cider	330591	Продукты питания (folder)/Продукты питания	0	
1557265	727344000458	North Coast brewing co. acme ipa	1	Неклассифицированные/default	0	
1557266	727344000137	North Coast brewing co. Blue Star Wheat beer	1	Неклассифицированные/default	0	
1389102	727344000052	North Coast brewing co. Red seal ale	22186	Продукты питания (folder)/Алкогольные напитки/Пиво	0	
408070	727344000045	North Coast brewing co. Red seal ale 12oz	1	Неклассифицированные/default	0	
1074105	027344000770	North Coast brewing company brother thelonious belgium style abbey ale 12/25.4soz	1	Неклассифицированные/default	0	
1074106	027344001043	North Coast brewing company brother thelonious belgium style abbey ale 24/12soz	1	Неклассифицированные/default	0	
1074107	027734400098	North Coast brewing company La merle saison belguium style farmhouse ale 12/25.4soz	1	Неклассифицированные/default	0	
1074108	027344000275	North Coast brewing company north Coast brewing company acme pale ale 12soz	1	Неклассифицированные/default	0	
1074109	027344000343	North Coast brewing company north Coast brewing company brown ale 12soz	1	Неклассифицированные/default	0	
1074110	027344000442	North Coast brewing company north Coast brewing company india pale ale 12soz	1	Неклассифицированные/default	0	
1074111	027344000084	North Coast brewing company north Coast brewing company Old no. 38 stout 12soz	1	Неклассифицированные/default	0	
1074112	027344000220	North Coast brewing company north Coast brewing company Old rasputin russian imperial stout 12soz	1	Неклассифицированные/default	0	
1074113	027344000374	North Coast brewing company north Coast brewing company pranqster belgian style Golden ale 12soz	1	Неклассифицированные/default	0	
1074114	027344000046	North Coast brewing company north Coast brewing company ruedrich's Red seal ale 12soz	1	Неклассифицированные/default	0	
1074115	027344000060	North Coast brewing company north Coast brewing company scrimshaw pilsner 12oz	1	Неклассифицированные/default	0	
1074116	027344000305	North Coast brewing company north Coast brewing company wintertime ale 12soz	1	Неклассифицированные/default	0	
1074117	027344001074	North Coast brewing company pranqster belgian style Golden ale 12/25.4soz	1	Неклассифицированные/default	0	
413576	727344000069	North Coast brewing scrimshaw-single b	1	Неклассифицированные/default	0	
348012	727344000779	North Coast brother thelonious 12/7.50	1	Неклассифицированные/default	0	
2176687	022014480302	North Coast Natural gravenstein Apple Juice 48floz nogmo	17371	Продукты питания (folder)/Напитки безалкогольные/Напитки	2176686	North Coast
1074118	072734400234	North Coast Old rasputin 6/4/12	1	Неклассифицированные/default	0	
1557267	727344001011	North Coast Old stoc	1	Неклассифицированные/default	0	
2176688	022014110407	North Coast Organic Apple Juice 10 fl .oz. nogmo	17371	Продукты питания (folder)/Напитки безалкогольные/Напитки	2176686	North Coast
2176689	022014128402	North Coast Organic Apple Juice 128floz nogmo	17371	Продукты питания (folder)/Напитки безалкогольные/Напитки	2176686	North Coast
2176690	022014640508	North Coast Organic Apple Juice 64floz nogmo	17371	Продукты питания (folder)/Напитки безалкогольные/Напитки	2176686	North Coast
2176692	022014006601	North Coast Organic Apple sauce with apricots 18/4/4oz nogmo	2058983	Продукты питания (folder)/Fruits and Vegetables	2176686	North Coast
2176693	022014240821	North Coast Organic Apple sauce with apricots 24oz nogmo	2058983	Продукты питания (folder)/Fruits and Vegetables	2176686	North Coast
2176694	022014004607	North Coast Organic applesauce cups unsweetened 16oz nogmo	2058983	Продукты питания (folder)/Fruits and Vegetables	2176686	North Coast
2176695	022014007608	North Coast Organic applesauce cups with berry 16oz nogmo	2058983	Продукты питания (folder)/Fruits and Vegetables	2176686	North Coast
2176696	022014005604	North Coast Organic applesauce cups with cinnamon 16oz nogmo	2058983	Продукты питания (folder)/Fruits and Vegetables	2176686	North Coast
2176697	022014240623	North Coast Organic applesauce unsweetened 24oz nogmo	2058983	Продукты питания (folder)/Fruits and Vegetables	2176686	North Coast
2176698	022014240920	North Coast Organic applesauce with berry 24oz nogmo	2058983	Продукты питания (folder)/Fruits and Vegetables	2176686	North Coast
2176699	022014240722	North Coast Organic applesauce with cinnamon 24oz nogmo	2058983	Продукты питания (folder)/Fruits and Vegetables	2176686	North Coast
1557268	634608000126	North Coast seafoods chopped clams	1	Неклассифицированные/default	0	
2818264	727344002759	North Coast stellar ipa glass 12floz	1	Неклассифицированные/default	0	
3167544	022014330522	North Coast, Apple sauce	330591	Продукты питания (folder)/Продукты питания	0	
3167545	022014320608	North Coast, Organic grevenstein Apple Juice	330591	Продукты питания (folder)/Продукты питания	0	
3167546	022014320707	North Coast, Organic honeycrisp Apple Juice	330591	Продукты питания (folder)/Продукты питания	0	
4555159	012569593398	North country (DVD/p&s-2.40/4:3 transfer/eng-fr-sp sub)	1	Неклассифицированные/default	0	
2818265	702038268697	North country bitter brothers Bourbon barrel hard cider glass 500ml	1	Неклассифицированные/default	0	
2818266	707073027346	North country Cheese Cheese curds 16oz	1	Неклассифицированные/default	0	
2818267	859092005352	North country cojack Cheese 8oz	1	Неклассифицированные/default	0	
2818268	859092005093	North country colby Jack shredded Cheese	1	Неклассифицированные/default	0	
2818269	602573185988	North country fire starter hard cider metal 12floz	1	Неклассифицированные/default	0	
4555160	1075703735053	North country Foods inc 24oz kaboo toil bow clnr	1	Неклассифицированные/default	0	
4555161	075703711997	North country Foods inc Wood cleaner	1	Неклассифицированные/default	0	
2818270	602573311523	North country hard cider hopshire metal 12floz	1	Неклассифицированные/default	0	
2818271	602573311516	North country hopshire hard cider glass 500ml	1	Неклассифицированные/default	0	
2818272	859092005376	North country medium cheddar Cheese 8oz	1	Неклассифицированные/default	0	
2818273	859092005079	North country Mild cheddar shredded chee	1	Неклассифицированные/default	0	
2818274	859092005086	North country mozzarella shredded Cheese	1	Неклассифицированные/default	0	
2368691	013964708936	North country Original press hard cider glass 12floz	1	Неклассифицированные/default	0	
2643855	655983700166	North country Rice Wild dsp 48pcs	1	Неклассифицированные/default	2368692	North Country
2818275	707073028466	North country string Cheese 12oz	1	Неклассифицированные/default	0	
2368693	707073032289	North country string Cheese 16oz	142810	Продукты питания (folder)/Молочные продукты (folder)/Сыр	2368692	North Country
4555162	753792002430	North cranberry grape 00243 46floz	1	Неклассифицированные/default	0	
4555163	753792003109	North cranberry guava 46oz	1	Неклассифицированные/default	0	
4555164	753792003116	North cranberry mango j 46oz	1	Неклассифицированные/default	0	
4555165	753792002485	North crnby blckbry 00248 46floz	1	Неклассифицированные/default	0	
4555166	038778820162	North dallas Honey co: naturally raw, unfiltered Honey 16oz	1	Неклассифицированные/default	0	
4555167	074470941101	North East adv 1ct	1	Неклассифицированные/default	0	
4555168	9770958333154	North East auto trader	1	Неклассифицированные/default	0	
2176700	030511400693	North eastern's finest backyard Blend 20 lb	337596	Товары для животных (folder)/Pets	0	
2176701	030511400709	North eastern's finest backyard Blend 40 lb	337596	Товары для животных (folder)/Pets	0	
2176702	030511100111	North eastern's finest cardinal Blend 20 lb	337596	Товары для животных (folder)/Pets	0	
2176703	030511900131	North eastern's finest cardinal Blend 4/10 lb	337596	Товары для животных (folder)/Pets	0	
2176704	030511100326	North eastern's finest cracked corn 20 lb	337596	Товары для животных (folder)/Pets	0	
2176705	030511900339	North eastern's finest cracked corn 4/10 lb	337596	Товары для животных (folder)/Pets	0	
2176706	030511100432	North eastern's finest cracked corn 40 lb	337596	Товары для животных (folder)/Pets	0	
2176707	030511100142	North eastern's finest finch Blend 20 lb	337596	Товары для животных (folder)/Pets	0	
2176708	030511900155	North eastern's finest finch Blend 4/10 lb	337596	Товары для животных (folder)/Pets	0	
2176709	030511100234	North eastern's finest millet 20 lb	337596	Товары для животных (folder)/Pets	0	
2176710	030511900247	North eastern's finest millet 4/10 lb	337596	Товары для животных (folder)/Pets	0	
2176711	030511100401	North eastern's finest millet 40 lb	337596	Товары для животных (folder)/Pets	0	
2176712	030511100395	North eastern's finest nyjer seed 20 lb	337596	Товары для животных (folder)/Pets	0	
2176713	030511901381	North eastern's finest nyjer seed 3/10 lb	337596	Товары для животных (folder)/Pets	0	
2176714	030511900643	North eastern's finest nyjer seed 8/5 lb	337596	Товары для животных (folder)/Pets	0	
2176715	030511101040	North eastern's finest Oil sunflower 25 lb	337596	Товары для животных (folder)/Pets	0	
2176716	030511900445	North eastern's finest Oil sunflower 3/10 lb	337596	Товары для животных (folder)/Pets	0	
2176717	030511101026	North eastern's finest Oil sunflower 50 lb	337596	Товары для животных (folder)/Pets	0	
2176718	030511900070	North eastern's finest Oil sunflower 6/5 lb	337596	Товары для животных (folder)/Pets	0	
2176719	030511100012	North eastern's finest Original Blend 20 lb	337596	Товары для животных (folder)/Pets	0	
2176720	030511900025	North eastern's finest Original Blend 4/10 lb	337596	Товары для животных (folder)/Pets	0	
2176721	030511100005	North eastern's finest Original Blend 40 lb	337596	Товары для животных (folder)/Pets	0	
2176722	030511100425	North eastern's finest Peanut pieces 20 lb	337596	Товары для животных (folder)/Pets	0	
2176723	030511900254	North eastern's finest Peanut pieces 4/10 lb	337596	Товары для животных (folder)/Pets	0	
2176724	030511100418	North eastern's finest Peanut pieces 40 lb	337596	Товары для животных (folder)/Pets	0	
2176725	030511100210	North eastern's finest safflower 20 lb	337596	Товары для животных (folder)/Pets	0	
2176726	030511900223	North eastern's finest safflower 4/10 lb	337596	Товары для животных (folder)/Pets	0	
2176727	030511100203	North eastern's finest safflower 40 lb	337596	Товары для животных (folder)/Pets	0	
2176728	030511100081	North eastern's finest sanctuary Special Blend 20 lb	337596	Товары для животных (folder)/Pets	0	
2176729	030511100098	North eastern's finest sanctuary Special Blend 40 lb	337596	Товары для животных (folder)/Pets	0	
2176730	030511100371	North eastern's finest select Blend 20 lb	337596	Товары для животных (folder)/Pets	0	
2176731	030511900667	North eastern's finest select Blend 4/10 lb	337596	Товары для животных (folder)/Pets	0	
2176732	030511100364	North eastern's finest select Blend 40 lb	337596	Товары для животных (folder)/Pets	0	
2176733	030511900063	North eastern's finest stripe sunflower 6/5 lb	337596	Товары для животных (folder)/Pets	0	
2176734	030511100272	North eastern's finest sunflower heart chips 20 lb	337596	Товары для животных (folder)/Pets	0	
2176735	030511900285	North eastern's finest sunflower heart chips 4/10 lb	337596	Товары для животных (folder)/Pets	0	
2176736	030511100265	North eastern's finest sunflower heart chips 40 lb	337596	Товары для животных (folder)/Pets	0	
2176737	030511100302	North eastern's finest sunflower seeds&hearts 20 lb	337596	Товары для животных (folder)/Pets	0	
2176738	030511900315	North eastern's finest sunflower seeds&hearts 4/10 lb	337596	Товары для животных (folder)/Pets	0	
2176739	030511100296	North eastern's finest sunflower seeds&hearts 40 lb	337596	Товары для животных (folder)/Pets	0	
2176740	030511100166	North eastern's finest woodpecker&chickadee Blend 20 lb	337596	Товары для животных (folder)/Pets	0	
2176741	030511900193	North eastern's finest woodpecker&chickadee Blend 4/10 lb	337596	Товары для животных (folder)/Pets	0	
4555169	032546181578	North face	1	Неклассифицированные/default	0	
4555178	827399617097	North face #10	1	Неклассифицированные/default	0	
4555179	827399680114	North face #11	1	Неклассифицированные/default	0	
4555170	037100001200	North face #2	1	Неклассифицированные/default	0	
4555171	042200001524	North face #3	1	Неклассифицированные/default	0	
4555172	051000005090	North face #4	1	Неклассифицированные/default	0	
4555173	648335996867	North face #5	1	Неклассифицированные/default	0	
4555174	700051283871	North face #6	1	Неклассифицированные/default	0	
4555175	700051366604	North face #7	1	Неклассифицированные/default	0	
4555176	701051134514	North face #8	1	Неклассифицированные/default	0	
4555177	715752919905	North face #9	1	Неклассифицированные/default	0	
4555180	648335729014	North face 1/4 zip zephry vaporwick top	1	Неклассифицированные/default	0	
4555181	058830000059	North face backpack	1	Неклассифицированные/default	0	
4555182	700054173667	North face Blue jaket	1	Неклассифицированные/default	0	
4555183	827399557584	North face boots	1	Неклассифицированные/default	0	
4555184	022200002707	North face coat	1	Неклассифицированные/default	0	
4555185	053000001119	North face coat #2	1	Неклассифицированные/default	0	
4555186	700051374357	North face coat #3	1	Неклассифицированные/default	0	
4555187	827399856434	North face denali jacket	1	Неклассифицированные/default	0	
4555188	700051355004	North face down jacket	1	Неклассифицированные/default	0	
4555189	648335923979	North face hyvent coat	1	Неклассифицированные/default	0	
4555190	884805215711	North face insulated grace jacket vintage White Color	1	Неклассифицированные/default	0	
4555191	827399184421	North face jacket	1	Неклассифицированные/default	0	
4555192	020000091990	North face jacket #2	1	Неклассифицированные/default	0	
4555193	044100000157	North face jacket #3	1	Неклассифицированные/default	0	
4555194	700051128271	North face jacket #4	1	Неклассифицированные/default	0	
4555195	700051378423	North face jacket #5	1	Неклассифицированные/default	0	
4555196	700053967724	North face jacket #6	1	Неклассифицированные/default	0	
4555197	827399194826	North face jacket #7	1	Неклассифицированные/default	0	
4555198	827399635091	North face jester daypack	1	Неклассифицированные/default	0	
4555200	700051398728	North face men's redpoint jacket	1	Неклассифицированные/default	0	
4555199	5050717094705	North face mens jacket	1	Неклассифицированные/default	0	
4555201	648335368961	North face pamir fleece fall 04	1	Неклассифицированные/default	0	
4555202	700051214660	North face recon	1	Неклассифицированные/default	0	
4555203	700051113987	North face sleep tech jacket	1	Неклассифицированные/default	0	
4555204	706420129283	North face w odyssey ii triclimate Black	1	Неклассифицированные/default	0	
4555205	827399721237	North face xsmall 78.00	1	Неклассифицированные/default	0	
4555206	648335996706	North face xxl mcmurdo	1	Неклассифицированные/default	0	
4555207	700051670039	North face youth coat	1	Неклассифицированные/default	0	
4555208	617932986137	North face zipup	1	Неклассифицированные/default	0	
4555209	063399015918	North fire start	1	Неклассифицированные/default	0	
4555210	663705985012	North hollow Farm CD	1	Неклассифицированные/default	0	
4555211	085095700868	North Hollywood Ice company 7lb north Hollywood Ice co. bagged Ice	1	Неклассифицированные/default	0	
4555212	061391327084	North King shrimp ri 10oz	1	Неклассифицированные/default	0	
4555213	736899095420	North korea-Day in the Life (DVD) (eng&korean w/dutch/eng/french or germa	1	Неклассифицированные/default	0	
927711	021296602310	North lake Wine company Paul masson Golden Cream sherry 750ml /12	1	Неклассифицированные/default	401603	Paul Masson
401607	021296602419	North lake Wine company Paul masson madeira 750ml /12	22169	Продукты питания (folder)/Алкогольные напитки/Вино (folder)/Вина Новый Свет	401603	Paul Masson
401608	021296602822	North lake Wine company Paul masson marsala 750ml /12	22169	Продукты питания (folder)/Алкогольные напитки/Вино (folder)/Вина Новый Свет	401603	Paul Masson
401609	021296602617	North lake Wine company Paul masson pale Dry sherry 750ml /12	22169	Продукты питания (folder)/Алкогольные напитки/Вино (folder)/Вина Новый Свет	401603	Paul Masson
401611	021296602716	North lake Wine company Paul masson Rich ruby port 750ml /12	22169	Продукты питания (folder)/Алкогольные напитки/Вино (folder)/Вина Новый Свет	401603	Paul Masson
377526	088232000074	North lake wines Cabernet heritage Cabernet Sauvignon 6/1.5l	22133	Продукты питания (folder)/Алкогольные напитки/Вино (folder)/Вино	301537	Nisa Heritage
377529	088232000081	North lake wines Chardonnay heritage Chardonnay 6/1.5l	22133	Продукты питания (folder)/Алкогольные напитки/Вино (folder)/Вино	301537	Nisa Heritage
357389	083804072565	North lake wines cribari chablis 1/18l	22133	Продукты питания (folder)/Алкогольные напитки/Вино (folder)/Вино	357386	Cribari
927685	080120281626	North lake wines le domaine brut 24/187ml	22133	Продукты питания (folder)/Алкогольные напитки/Вино (folder)/Вино	0	
377558	088232001040	North lake wines Merlot heritage Merlot 6/1.5l	22133	Продукты питания (folder)/Алкогольные напитки/Вино (folder)/Вино	301537	Nisa Heritage
1074119	082100001293	North lake wines Paul Thomas White table Wine 750ml /12	1	Неклассифицированные/default	0	
1074120	082100736355	North lake wines Sauvignon blanc fernleaf Sauvignon blanc 750ml /12	22133	Продукты питания (folder)/Алкогольные напитки/Вино (folder)/Вино	0	
4555214	022899250182	North lights LTD on30	1	Неклассифицированные/default	0	
4555215	843996003279	North lite full supersoft fleece sheet set	1	Неклассифицированные/default	0	
4555216	843996003262	North lite twin supersoft fleece sheet set	1	Неклассифицированные/default	0	
4555217	611226001421	North Pacific music CD david jimerson. baritone: music i heard with you	1	Неклассифицированные/default	0	
4555218	709802000408	North Pacific Naturals north pac Natural alpha clear acne Care	1	Неклассифицированные/default	0	
3167547	854393003090	North Pacific whiting fillets	330591	Продукты питания (folder)/Продукты питания	0	
4555219	687064009530	North pak outdoor, 8' inflatable boat	1	Неклассифицированные/default	0	
4555220	613485584332	North pass LTD hiviz plain barrel shotgun sights model mpb	1	Неклассифицированные/default	0	
4555221	613485584523	North pass LTD hiviz sight System	1	Неклассифицированные/default	0	
4555222	023922187321	North pole 4-4-0 loco	1	Неклассифицированные/default	0	
4555223	070896110367	North pole coki cutter mni	1	Неклассифицированные/default	2567061	Wilton
4555224	023922300409	North pole frt expan set	1	Неклассифицированные/default	0	
2368694	829783046391	North pole jeans EDT 100ml vapo	3068	Парфюмерия (folder)/Парфюмерия	0	
4555225	731427235750	North pole kitchen's smores 15.6oz	1	Неклассифицированные/default	0	
