ID	UPCEAN	Name	CategoryID	CategoryName	BrandID	BrandName
4465665	724504052456	Krylon 5245qt fl Red project paint	1	Неклассифицированные/default	302286	Krylon
4465666	724504052609	Krylon 5260qt Gloss Green door paint	1	Неклассифицированные/default	302286	Krylon
4465667	724504052616	Krylon 5261qt burgandy door paint	1	Неклассифицированные/default	302286	Krylon
4465668	724504052630	Krylon 5263qt Gloss Black door paint	1	Неклассифицированные/default	302286	Krylon
4465669	724504052708	Krylon 5270qt gl White cabinet paint	1	Неклассифицированные/default	302286	Krylon
4465670	724504052722	Krylon 5272 qt gl ivory cabinet paint	1	Неклассифицированные/default	302286	Krylon
4465671	724504052944	Krylon 5294 hp gray latex primer	1	Неклассифицированные/default	302286	Krylon
4465672	724504058496	Krylon 5849 sp 17oz White mark paint	1	Неклассифицированные/default	302286	Krylon
4465673	724504058502	Krylon 5850 sp 17oz Yellow mark paint	1	Неклассифицированные/default	302286	Krylon
4465674	724504058519	Krylon 5851 sp 17oz Red marking paint	1	Неклассифицированные/default	302286	Krylon
4465675	724504058526	Krylon 5852 sp 17oz Green mark paint	1	Неклассифицированные/default	302286	Krylon
4465676	724504058533	Krylon 5853 sp 17oz Orange mark paint	1	Неклассифицированные/default	302286	Krylon
4465677	724504058823	Krylon 5882 sp 17oz Blue mark paint	1	Неклассифицированные/default	302286	Krylon
4465678	724504058830	Krylon 5883 sp 17oz Red/or mark paint	1	Неклассифицированные/default	302286	Krylon
4465679	724504070054	Krylon 7005 sp clear gls polyurethane	1	Неклассифицированные/default	302286	Krylon
4465680	724504070061	Krylon 7006 sp clr Satin polyurethane	1	Неклассифицированные/default	302286	Krylon
4465681	724504970309	Krylon 7030 sp gl Black lacq krylon	1	Неклассифицированные/default	302286	Krylon
4465682	724504970316	Krylon 7031 sp gl White lacq krylon	1	Неклассифицированные/default	302286	Krylon
4465683	724504970323	Krylon 7032 sp clear Gloss	1	Неклассифицированные/default	302286	Krylon
1010598	724504070993	Krylon 7099 snap and spray handle	1	Неклассифицированные/default	302286	Krylon
4465684	724504082019	Krylon 8201 blk granite stoncraft kit	1	Неклассифицированные/default	302286	Krylon
4465685	724504082033	Krylon 8203 travertin tinstonecrf kit	1	Неклассифицированные/default	302286	Krylon
4465686	724504193005	Krylon 8oz 1/2 pt rust tough latex for metal	1	Неклассифицированные/default	302286	Krylon
405088	724504010104	Krylon 8oz krylon Original chrome spray paint	331156	Товары для творчества (folder)/Живопись и рисования (folder)/Товары для художников	302286	Krylon
4465584	724504014027	Krylon : high Heat&radiator : high Heat aluminium 12oz	1	Неклассифицированные/default	302286	Krylon
4465687	724504080435	Krylon bt-43 flat Black	1	Неклассифицированные/default	302286	Krylon
431586	075577005000	Krylon clear glaze spray paint 12oz	331156	Товары для творчества (folder)/Живопись и рисования (folder)/Товары для художников	302286	Krylon
4465688	724504261148	Krylon Color creations Gloss banner Red kdh6114 8floz	1	Неклассифицированные/default	302286	Krylon
4465689	724504031048	Krylon fluorescent indoor/outdoor paint 11oz	1	Неклассифицированные/default	302286	Krylon
4465690	724504431046	Krylon fluorescent paint (Lemon Yellow) 312g	1	Неклассифицированные/default	302286	Krylon
997160	724504244400	Krylon Fusion 12oz clear Gloss	1	Неклассифицированные/default	302286	Krylon
997161	724504023401	Krylon Fusion 12oz espresso	1	Неклассифицированные/default	302286	Krylon
997162	724504023371	Krylon Fusion 12oz safety Orange	1	Неклассифицированные/default	302286	Krylon
997163	724504025313	Krylon Fusion hammered Black	1	Неклассифицированные/default	302286	Krylon
997164	724504025344	Krylon Fusion hammered brown	1	Неклассифицированные/default	302286	Krylon
997165	724504025337	Krylon Fusion hammered copper	1	Неклассифицированные/default	302286	Krylon
997166	724504025320	Krylon Fusion hammered Silver	1	Неклассифицированные/default	302286	Krylon
997167	724504023395	Krylon Fusion metalc 12oz blond	1	Неклассифицированные/default	302286	Krylon
997168	724504023388	Krylon Fusion metalc 12oz nickl	1	Неклассифицированные/default	302286	Krylon
369579	724504023333	Krylon Fusion plastic spray Blue hyacinth 12oz	331156	Товары для творчества (folder)/Живопись и рисования (folder)/Товары для художников	302286	Krylon
369580	724504023258	Krylon Fusion plastic spray burgundy 12oz	331156	Товары для творчества (folder)/Живопись и рисования (folder)/Товары для художников	302286	Krylon
369581	724504023340	Krylon Fusion plastic spray buttercream 12oz	331156	Товары для творчества (folder)/Живопись и рисования (folder)/Товары для художников	302286	Krylon
369582	724504023227	Krylon Fusion plastic spray dover White 12oz	331156	Товары для творчества (folder)/Живопись и рисования (folder)/Товары для художников	302286	Krylon
369583	724504023319	Krylon Fusion plastic spray fairytale pink 12oz	331156	Товары для творчества (folder)/Живопись и рисования (folder)/Товары для художников	302286	Krylon
369584	724504025191	Krylon Fusion plastic spray flat Black 12oz	331156	Товары для творчества (folder)/Живопись и рисования (folder)/Товары для художников	302286	Krylon
369585	724504025184	Krylon Fusion plastic spray flat White 12oz	331156	Товары для творчества (folder)/Живопись и рисования (folder)/Товары для художников	302286	Krylon
369587	724504023203	Krylon Fusion plastic spray Gloss White 12oz	331156	Товары для творчества (folder)/Живопись и рисования (folder)/Товары для художников	302286	Krylon
369588	724504023357	Krylon Fusion plastic spray honeydew 12oz	331156	Товары для творчества (folder)/Живопись и рисования (folder)/Товары для художников	302286	Krylon
369589	724504023241	Krylon Fusion plastic spray Hunter Green 12oz	331156	Товары для творчества (folder)/Живопись и рисования (folder)/Товары для художников	302286	Krylon
369590	724504023265	Krylon Fusion plastic spray navy 12oz	331156	Товары для творчества (folder)/Живопись и рисования (folder)/Товары для художников	302286	Krylon
369591	724504023296	Krylon Fusion plastic spray patriotic Blue 12oz	331156	Товары для творчества (folder)/Живопись и рисования (folder)/Товары для художников	302286	Krylon
369592	724504023289	Krylon Fusion plastic spray Red pepper 12oz	331156	Товары для творчества (folder)/Живопись и рисования (folder)/Товары для художников	302286	Krylon
369593	724504023234	Krylon Fusion plastic spray river Rock 12oz	331156	Товары для творчества (folder)/Живопись и рисования (folder)/Товары для художников	302286	Krylon
369594	724504023272	Krylon Fusion plastic spray Spring Green 12oz	331156	Товары для творчества (folder)/Живопись и рисования (folder)/Товары для художников	302286	Krylon
369595	724504023326	Krylon Fusion plastic spray Sun dried tomato 12oz	331156	Товары для творчества (folder)/Живопись и рисования (folder)/Товары для художников	302286	Krylon
369596	724504023302	Krylon Fusion plastic spray sunbeam 12oz	331156	Товары для творчества (folder)/Живопись и рисования (folder)/Товары для художников	302286	Krylon
997171	724504024378	Krylon Fusion Satin 12oz almond	1	Неклассифицированные/default	302286	Krylon
997172	724504024217	Krylon Fusion Satin 12oz Black	1	Неклассифицированные/default	302286	Krylon
997173	724504024255	Krylon Fusion Satin 12oz burg	1	Неклассифицированные/default	302286	Krylon
997174	724504024224	Krylon Fusion Satin 12oz dvrwht	1	Неклассифицированные/default	302286	Krylon
997175	724504024361	Krylon Fusion Satin 12oz esprso	1	Неклассифицированные/default	302286	Krylon
997176	724504024392	Krylon Fusion Satin 12oz gray	1	Неклассифицированные/default	302286	Krylon
997177	724504024248	Krylon Fusion Satin 12oz hgreen	1	Неклассифицированные/default	302286	Krylon
997178	724504024385	Krylon Fusion Satin 12oz khaki	1	Неклассифицированные/default	302286	Krylon
997179	724504024262	Krylon Fusion Satin 12oz navy	1	Неклассифицированные/default	302286	Krylon
997180	724504024231	Krylon Fusion Satin 12oz rrock	1	Неклассифицированные/default	302286	Krylon
997181	724504024422	Krylon Fusion Satin 12oz tcotta	1	Неклассифицированные/default	302286	Krylon
997182	724504024200	Krylon Fusion Satin 12oz wht	1	Неклассифицированные/default	302286	Krylon
372396	724504038030	Krylon glitter blast 6oz bronze blast	331156	Товары для творчества (folder)/Живопись и рисования (folder)/Товары для художников	302286	Krylon
372397	724504038061	Krylon glitter blast 6oz Cherry bomb	331156	Товары для творчества (folder)/Живопись и рисования (folder)/Товары для художников	302286	Krylon
372398	724504038085	Krylon glitter blast 6oz citrus Dream	331156	Товары для творчества (folder)/Живопись и рисования (folder)/Товары для художников	302286	Krylon
372400	724504038047	Krylon glitter blast 6oz Diamond dust	331156	Товары для творчества (folder)/Живопись и рисования (folder)/Товары для художников	302286	Krylon
372401	724504038016	Krylon glitter blast 6oz Golden Glow	331156	Товары для творчества (folder)/Живопись и рисования (folder)/Товары для художников	302286	Krylon
372402	724504038092	Krylon glitter blast 6oz Lucky Green	331156	Товары для творчества (folder)/Живопись и рисования (folder)/Товары для художников	302286	Krylon
372403	724504038078	Krylon glitter blast 6oz Orange burst	331156	Товары для творчества (folder)/Живопись и рисования (folder)/Товары для художников	302286	Krylon
372404	724504038122	Krylon glitter blast 6oz posh pink	331156	Товары для творчества (folder)/Живопись и рисования (folder)/Товары для художников	302286	Krylon
372406	724504038108	Krylon glitter blast 6oz sparkling waters	331156	Товары для творчества (folder)/Живопись и рисования (folder)/Товары для художников	302286	Krylon
372407	724504038054	Krylon glitter blast 6oz starry Night	331156	Товары для творчества (folder)/Живопись и рисования (folder)/Товары для художников	302286	Krylon
372408	724504038115	Krylon glitter blast 6oz twilight sky	331156	Товары для творчества (folder)/Живопись и рисования (folder)/Товары для художников	302286	Krylon
372399	724504038009	Krylon glitter blast clear sealer аэрозоль лак-силлер для глитерных покрытий 170г, глянцевый	331156	Товары для творчества (folder)/Живопись и рисования (folder)/Товары для художников	302286	Krylon
4465691	724504416012	Krylon Gloss Black spray paint 340g	1	Неклассифицированные/default	302286	Krylon
1033891	724504026105	Krylon h20 almond 12oz	1	Неклассифицированные/default	302286	Krylon
1033894	724504026051	Krylon h20 blk sea 12oz	1	Неклассифицированные/default	302286	Krylon
1033895	724504026044	Krylon h20 Blue 12oz	1	Неклассифицированные/default	302286	Krylon
1033896	724504026082	Krylon h20 brown 12oz	1	Неклассифицированные/default	302286	Krylon
1033897	724504026129	Krylon h20 burgundy 12oz	1	Неклассифицированные/default	302286	Krylon
1033898	724504026037	Krylon h20 Green 12oz	1	Неклассифицированные/default	302286	Krylon
1033899	724504026112	Krylon h20 gulf gray 12oz	1	Неклассифицированные/default	302286	Krylon
1033900	724504026099	Krylon h20 ivrymist 12oz	1	Неклассифицированные/default	302286	Krylon
1033901	724504026013	Krylon h20 Orange 12oz	1	Неклассифицированные/default	302286	Krylon
1033902	724504026075	Krylon h20 purple 12oz	1	Неклассифицированные/default	302286	Krylon
1033903	724504026006	Krylon h20 Red sea 12oz	1	Неклассифицированные/default	302286	Krylon
1033904	724504026143	Krylon h20 White primr 12oz	1	Неклассифицированные/default	302286	Krylon
1033905	724504026020	Krylon h20 Yellow 12oz	1	Неклассифицированные/default	302286	Krylon
1033892	724504026068	Krylon h2o latex spray (2606 Arctic White)	1	Неклассифицированные/default	302286	Krylon
1033893	724504026136	Krylon h2o latex spray (2613 panama canal beige)	1	Неклассифицированные/default	302286	Krylon
4465692	724504026174	Krylon h2o latex spray (2617 Black sea Satin)	1	Неклассифицированные/default	302286	Krylon
4465693	724504026198	Krylon h2o latex spray (2619 Blue danuba river)	1	Неклассифицированные/default	302286	Krylon
4465694	724504518013	Krylon indoor/outdoor spray paint (bauhaus Gold) 12oz	1	Неклассифицированные/default	302286	Krylon
4465695	724504020035	Krylon interior-exterior spray paint 2003 jade Green Gloss	1	Неклассифицированные/default	302286	Krylon
4465696	724504423249	Krylon k02324 sp hu gr plastic Fusion	1	Неклассифицированные/default	302286	Krylon
4465697	724504111108	Krylon krylon crafter's metallic	1	Неклассифицированные/default	302286	Krylon
4465698	724504423331	Krylon krylon Fusion spray paint - Blue	1	Неклассифицированные/default	302286	Krylon
372405	724504038023	Krylon krylon glitter blast аэрозоль 3D глиттер 163г, серебренная вспышка	331156	Товары для творчества (folder)/Живопись и рисования (folder)/Товары для художников	302286	Krylon
4465699	724504071631	Krylon krylon upside down marking paint 7163 caution Blue	1	Неклассифицированные/default	302286	Krylon
389710	724504031512	Krylon magnetic spray 13oz	331156	Товары для творчества (folder)/Живопись и рисования (folder)/Товары для художников	302286	Krylon
636282	724504092421	Krylon paint spray charcoal gry	1	Неклассифицированные/default	302286	Krylon
636287	724504032069	Krylon paint spray epoxy Black 12oz	1	Неклассифицированные/default	302286	Krylon
378887	724504020011	Krylon paint spray int ext hunt Green	331156	Товары для творчества (folder)/Живопись и рисования (folder)/Товары для художников	302286	Krylon
396104	724504019077	Krylon paint spray int ext prime navy	331156	Товары для творчества (folder)/Живопись и рисования (folder)/Товары для художников	302286	Krylon
636301	724504013167	Krylon paint spray int ext primer Black	1	Неклассифицированные/default	302286	Krylon
352176	724504021018	Krylon paint spray int ext primer chr	331156	Товары для творчества (folder)/Живопись и рисования (folder)/Товары для художников	302286	Krylon
405473	724504013181	Krylon paint spray int ext primer gra	331156	Товары для творчества (folder)/Живопись и рисования (folder)/Товары для художников	302286	Krylon
636302	724504016083	Krylon paint spray int ext primer gry	1	Неклассифицированные/default	302286	Krylon
420638	724504018063	Krylon paint spray int ext primer ylw	331156	Товары для творчества (folder)/Живопись и рисования (folder)/Товары для художников	302286	Krylon
636303	724504043003	Krylon paint spray int/ext stain fix	1	Неклассифицированные/default	302286	Krylon
636304	724504073208	Krylon paint spray invertd Orange 15oz	1	Неклассифицированные/default	302286	Krylon
636305	724504073246	Krylon paint spray invertd Red 12oz	1	Неклассифицированные/default	302286	Krylon
636309	724504034018	Krylon paint spray non skid Black 12oz	1	Неклассифицированные/default	302286	Krylon
406820	724504024118	Krylon paint spray pumpkn Orange glossy	331156	Товары для творчества (folder)/Живопись и рисования (folder)/Товары для художников	302286	Krylon
636319	724504092551	Krylon paint spray rust primer galvnz	1	Неклассифицированные/default	302286	Krylon
636320	724504024163	Krylon paint spray safety Blue 12oz	1	Неклассифицированные/default	302286	Krylon
636321	724504020127	Krylon paint spray safety Green 12oz	1	Неклассифицированные/default	302286	Krylon
636322	724504024101	Krylon paint spray safety Orange 12oz	1	Неклассифицированные/default	302286	Krylon
636328	724504092339	Krylon paint spray Silver gray 12oz	1	Неклассифицированные/default	302286	Krylon
636332	724504058625	Krylon paint spray strip Blue 12oz	1	Неклассифицированные/default	302286	Krylon
636333	724504073420	Krylon paint spray strip fire lne blu	1	Неклассифицированные/default	302286	Krylon
636334	724504073406	Krylon paint spray strip White 12oz	1	Неклассифицированные/default	302286	Krylon
636335	724504073413	Krylon paint spray strip Yellow 12oz	1	Неклассифицированные/default	302286	Krylon
4465700	724504892007	Krylon roust tough	1	Неклассифицированные/default	302286	Krylon
4465701	724504092001	Krylon rta9200 win wht rust tough sp	1	Неклассифицированные/default	302286	Krylon
4465702	724504092018	Krylon rta9201 sp semi-fl wht rstough	1	Неклассифицированные/default	302286	Krylon
4465703	724504092025	Krylon rta9202 mid blk rust tough sp	1	Неклассифицированные/default	302286	Krylon
4465704	724504092032	Krylon rta9203sp se-fl blk rusttough	1	Неклассифицированные/default	302286	Krylon
4465705	724504092049	Krylon rta9204 brn prmr rust tough sp	1	Неклассифицированные/default	302286	Krylon
4465706	724504092056	Krylon rta9205 gry prmr rust tough sp	1	Неклассифицированные/default	302286	Krylon
4465707	724504092063	Krylon rta9206 bat gray rust tough sp	1	Неклассифицированные/default	302286	Krylon
4465708	724504092070	Krylon rta9207 almond rust tough sp	1	Неклассифицированные/default	302286	Krylon
4465709	724504092100	Krylon rta9210 rad Red tough sp	1	Неклассифицированные/default	302286	Krylon
4465710	724504092124	Krylon rta9212 mah brn rust tough sp	1	Неклассифицированные/default	302286	Krylon
4465711	724504092131	Krylon rta9213 sp aluminium paint	1	Неклассифицированные/default	302286	Krylon
4465712	724504092155	Krylon rta9215sp forest grn rusttough	1	Неклассифицированные/default	302286	Krylon
4465713	724504092186	Krylon rta9218 fl blk rust tough sp	1	Неклассифицированные/default	302286	Krylon
4465714	724504092193	Krylon rta9219 fl wht rust tough sp	1	Неклассифицированные/default	302286	Krylon
4465715	724504092209	Krylon rta9220 sp rt ivory gl krylon	1	Неклассифицированные/default	302286	Krylon
4465716	724504092216	Krylon rta9221 sp rt burgundy krylon	1	Неклассифицированные/default	302286	Krylon
4465717	724504092230	Krylon rta9223 sp Hunter Green rust	1	Неклассифицированные/default	302286	Krylon
4465718	724504092254	Krylon rta9225 sp true Blue rusttough	1	Неклассифицированные/default	302286	Krylon
4465719	724504092261	Krylon rta9226 sp rt navy krylon	1	Неклассифицированные/default	302286	Krylon
4465720	724504092315	Krylon rta9231 sp Gold metallic paint	1	Неклассифицированные/default	302286	Krylon
4465721	724504092322	Krylon rta9232 sp Silver metallic pnt	1	Неклассифицированные/default	302286	Krylon
4465722	724504092346	Krylon rta9234 sp rt ivory stn krylon	1	Неклассифицированные/default	302286	Krylon
4465723	724504092353	Krylon rta9235 sp rt huntr gr stn kry	1	Неклассифицированные/default	302286	Krylon
4465724	724504092407	Krylon rta9240 sp zinc Rich rusttough	1	Неклассифицированные/default	302286	Krylon
636318	724504092506	Krylon rta9250 sp rt rust fix krylon	1	Неклассифицированные/default	302286	Krylon
415585	724504002697	Krylon short cuts antique bronze 3oz	331156	Товары для творчества (folder)/Живопись и рисования (folder)/Товары для художников	302286	Krylon
415586	724504000327	Krylon short cuts chrome 3oz	331156	Товары для творчества (folder)/Живопись и рисования (folder)/Товары для художников	302286	Krylon
415587	724504000792	Krylon short cuts clear Gloss 3oz	331156	Товары для творчества (folder)/Живопись и рисования (folder)/Товары для художников	302286	Krylon
415588	724504000358	Krylon short cuts espresso 3oz	331156	Товары для творчества (folder)/Живопись и рисования (folder)/Товары для художников	302286	Krylon
415589	7255040005635	Krylon short cuts flat Black 3oz	331156	Товары для творчества (folder)/Живопись и рисования (folder)/Товары для художников	302286	Krylon
415590	724504000556	Krylon short cuts flat White 3oz	331156	Товары для творчества (folder)/Живопись и рисования (folder)/Товары для художников	302286	Krylon
415591	724504000730	Krylon short cuts forever Blue 3oz	331156	Товары для творчества (folder)/Живопись и рисования (folder)/Товары для художников	302286	Krylon
415592	724504000549	Krylon short cuts Gloss Black 3oz	331156	Товары для творчества (folder)/Живопись и рисования (folder)/Товары для художников	302286	Krylon
415596	724504002734	Krylon short cuts Golden pear 3oz	331156	Товары для творчества (folder)/Живопись и рисования (folder)/Товары для художников	302286	Krylon
415595	724504000297	Krylon short cuts hobby/craft enamel 3oz	331156	Товары для творчества (folder)/Живопись и рисования (folder)/Товары для художников	302286	Krylon
415597	724504000396	Krylon short cuts Hot pink 3oz	331156	Товары для творчества (folder)/Живопись и рисования (folder)/Товары для художников	302286	Krylon
415598	724504000471	Krylon short cuts Hunter Green 3oz	331156	Товары для творчества (folder)/Живопись и рисования (folder)/Товары для художников	302286	Krylon
415599	7245040007418	Krylon short cuts iris 3oz	331156	Товары для творчества (folder)/Живопись и рисования (folder)/Товары для художников	302286	Krylon
415600	724504000464	Krylon short cuts leaf Green 3oz	331156	Товары для творчества (folder)/Живопись и рисования (folder)/Товары для художников	302286	Krylon
