ID	UPCEAN	Name	CategoryID	CategoryName	BrandID	BrandName
156655	7613031719600	Purina gourmet паучи в подливе с курицей для кошек (gourmet perl) 12222445 0.085	18493	Товары для животных (folder)/Корм для животных (folder)/Корм для кошек	311867	Purina Gourmet
1481947	7613033706301	Purina gourmet паучи в подливе с тунцом для кошек (gourmet perl) 12222523 0.085	21915	Товары для животных (folder)/Корм для животных (folder)/Корм для животных	311867	Purina Gourmet
1481948	7613034190444	Purina gourmet паучи в подливе с ягненком для кошек (gourmet perl) 12215290 0.085	21915	Товары для животных (folder)/Корм для животных (folder)/Корм для животных	311867	Purina Gourmet
600533	7613033449864	Purina gourmet рэд консерв 195г для кошек паштет кролик с печенью 12162851	18493	Товары для животных (folder)/Корм для животных (folder)/Корм для кошек	311867	Purina Gourmet
1582889	017800435208	Purina gravy dg/fd	1	Неклассифицированные/default	199427	Purina
1582890	017800490900	Purina grrravy 699pp	1	Неклассифицированные/default	199427	Purina
1582891	017800417686	Purina healthy morsels	1	Неклассифицированные/default	199427	Purina
1582892	017800422598	Purina hi Pro	1	Неклассифицированные/default	199427	Purina
1582893	017800528252	Purina hi Pro #2	1	Неклассифицированные/default	199427	Purina
1582894	017800429450	Purina hipro Dog Food	19035	Товары для животных (folder)/Корм для животных (folder)/Корм для собак	199427	Purina
2823228	017800136822	Purina hldy Cat treat window 11.4oz	1	Неклассифицированные/default	0	
2823229	017800136839	Purina hldy Dog snack window 24.2oz	1	Неклассифицированные/default	0	
1582895	017800508148	Purina hpy Cat bf/lv/tk	18493	Товары для животных (folder)/Корм для животных (folder)/Корм для кошек	199427	Purina
1582896	017800433846	Purina kibbles&chn	1	Неклассифицированные/default	199427	Purina
1513908	017800512244	Purina kit/kaboodle	1	Неклассифицированные/default	199427	Purina
2162885	017800106252	Purina kitten chow 14 lb	337596	Товары для животных (folder)/Pets	0	
1934016	017800150200	Purina kitten chow 15021 3.15 lb	1	Неклассифицированные/default	199427	Purina
1513857	017800453240	Purina kitten chow 18z Dry !	1	Неклассифицированные/default	199427	Purina
2162886	017800450584	Purina kitten chow 5/7 lb case	337596	Товары для животных (folder)/Pets	0	
2823230	017800150224	Purina kitten chow 6.3 lb	1	Неклассифицированные/default	0	
2162887	017800031394	Purina kitten chow 6/3.5lb case	337596	Товары для животных (folder)/Pets	0	
1582897	017800453370	Purina kitten chow Cat Food - nurturing Formula poultry by-product meal, brewers Rice, corn gluten meal, soy flour, animal fat	18493	Товары для животных (folder)/Корм для животных (folder)/Корм для кошек	199427	Purina
1513858	017800472258	Purina kitten chow kitten Food #2	1	Неклассифицированные/default	0	
1934017	017800127950	Purina kitten chow pouch 12796 16oz	1	Неклассифицированные/default	199427	Purina
2188826	077234600054	Purina Kitty trt ball Cat toy	337596	Товары для животных (folder)/Pets	0	
2188827	077234600078	Purina lil bird brainys Cat toy	337596	Товары для животных (folder)/Pets	0	
1582898	017800423304	Purina mainstay Dog	19035	Товары для животных (folder)/Корм для животных (folder)/Корм для собак	199427	Purina
1582899	017800423694	Purina mainstay Dog #2	19035	Товары для животных (folder)/Корм для животных (folder)/Корм для собак	199427	Purina
1582900	017800502542	Purina mainstay p599	1	Неклассифицированные/default	199427	Purina
1582901	017800422178	Purina mainstay ss	1	Неклассифицированные/default	199427	Purina
1540527	050000572113	Purina mighty Dog butcher block beef tenderloin flavor, savory steak flavor and rotisserie chicken flavor Dog Food - 12 ct	19035	Товары для животных (folder)/Корм для животных (folder)/Корм для собак	199427	Purina
1540508	050000350841	Purina mighty Dog chicken&smoked bacon combo	1	Неклассифицированные/default	199427	Purina
1540507	050000351244	Purina mighty Dog chicken, egg&bacon country platter Dog Food	19035	Товары для животных (folder)/Корм для животных (folder)/Корм для собак	199427	Purina
1539805	050000350544	Purina mighty Dog hearty beef dinner	19035	Товары для животных (folder)/Корм для животных (folder)/Корм для собак	199427	Purina
1540526	050000766789	Purina mighty Dog hearty beef dinner, chicken&smoked bacon combo and lamb&Rice Dog Food - 12 ct	19035	Товары для животных (folder)/Корм для животных (folder)/Корм для собак	199427	Purina
2663781	050000345946	Purina mighty Dog hearty beef dinner, chicken&smoked bacon combo and with lamb&Rice Dog Food - 24 ct	1	Неклассифицированные/default	199427	Purina
1540514	050000362271	Purina mighty Dog hearty pulled-style beef dinner Dog Food	19035	Товары для животных (folder)/Корм для животных (folder)/Корм для собак	199427	Purina
1540515	050000362479	Purina mighty Dog hearty pulled-style chicken dinner Dog Food	19035	Товары для животных (folder)/Корм для животных (folder)/Корм для собак	199427	Purina
1540517	050000363582	Purina mighty Dog hearty pulled-style chicken, beef and pork dinners Dog Food - 12 ct	19035	Товары для животных (folder)/Корм для животных (folder)/Корм для собак	199427	Purina
1540516	050000363063	Purina mighty Dog hearty pulled-style pork dinner Dog Food	19035	Товары для животных (folder)/Корм для животных (folder)/Корм для собак	199427	Purina
1540519	050000570683	Purina mighty Dog porterhouse steak flavor&tenderloin tips flavor in gravy Dog Food - 12 ct	19035	Товары для животных (folder)/Корм для животных (folder)/Корм для собак	199427	Purina
2663782	050000581405	Purina mighty Dog seared beef dinner in gravy with Cheese	1	Неклассифицированные/default	199427	Purina
2663783	050000581429	Purina mighty Dog seared chicken dinner in gravy with Cheese	1	Неклассифицированные/default	199427	Purina
1540512	050000655229	Purina mighty Dog thick-sliced chicken, Turkey and beef dinners Dog Food - 12 ct	19035	Товары для животных (folder)/Корм для животных (folder)/Корм для собак	199427	Purina
305210	878147001194	Purina minerals Color correcting primer 1floz	297057	Лекарственные средства (folder)/Health & Personal Care	305209	Pur Minerals
1582902	038100331748	Purina moist&meaty	1	Неклассифицированные/default	199427	Purina
1582903	038100340474	Purina moist&meaty ch burg/tra	1	Неклассифицированные/default	199427	Purina
1543294	038100330222	Purina moist&meaty Dog Food burger with cheddar Cheese flavor - 12 ct	19035	Товары для животных (folder)/Корм для животных (folder)/Корм для собак	199427	Purina
2663784	038100138712	Purina moist&meaty Dog Food rise&Shine awaken bacon and egg flavor-12 ct	1	Неклассифицированные/default	199427	Purina
2188828	077234600023	Purina mouserific tsr Cat toy	337596	Товары для животных (folder)/Pets	0	
1582904	038100330772	Purina mst&mty che	1	Неклассифицированные/default	199427	Purina
2188829	7613032528591	Purina One	1	Неклассифицированные/default	1714215	Purina One
2188830	7613033153426	Purina One #2	1	Неклассифицированные/default	1714215	Purina One
2188831	7613033295843	Purina One #3	1	Неклассифицированные/default	1714215	Purina One
2188832	8002205351392	Purina One #4	1	Неклассифицированные/default	1714215	Purina One
2188833	8002205351408	Purina One #5	1	Неклассифицированные/default	1714215	Purina One
2188834	8002205871418	Purina One #6	1	Неклассифицированные/default	1714215	Purina One
2188835	8410650899107	Purina One #7	1	Неклассифицированные/default	1714215	Purina One
2823231	7613036556477	Purina One adl Cat chknandwhlg 5x 750g+170gfree ru	1	Неклассифицированные/default	0	
2823233	7613036557573	Purina One Adult Cat bfandwhlg 5x 750g+170gfree ru	1	Неклассифицированные/default	0	
406954	8002205356632	Purina One Adult Cat chickenandri bst 8x 800g n 1gb	18493	Товары для животных (folder)/Корм для животных (folder)/Корм для кошек	1714215	Purina One
2823234	7613035761995	Purina One Adult Cat chickenandwhlg 6x1.5kg n2 ru	1	Неклассифицированные/default	0	
199433	3222270476829	Purina One Adult Cat Food 4x 85g	18493	Товары для животных (folder)/Корм для животных (folder)/Корм для кошек	1714215	Purina One
199434	8002205893229	Purina One Adult Cat manzo&riso 3kg	18493	Товары для животных (folder)/Корм для животных (folder)/Корм для кошек	1714215	Purina One
2823237	7613034584717	Purina One Adult Cat говядиназлаки bst18кгru	1	Неклассифицированные/default	0	
2823238	7613034101600	Purina One Adult Cat курицаandwhlg bst 18кг ru	1	Неклассифицированные/default	0	
1582914	017800592680	Purina One Adult Dog	19035	Товары для животных (folder)/Корм для животных (folder)/Корм для собак	1714215	Purina One
2179087	017800129398	Purina One Adult Dog bf/rce 34lb	337596	Товары для животных (folder)/Pets	1714215	Purina One
199435	8002205871449	Purina One Adult Dog chic.&Rice 3kg	19035	Товары для животных (folder)/Корм для животных (folder)/Корм для собак	1714215	Purina One
199436	8410650893402	Purina One Adult for cats (Green pack) 800g	18493	Товары для животных (folder)/Корм для животных (folder)/Корм для кошек	1714215	Purina One
1582906	017800475716	Purina One Adult form	1	Неклассифицированные/default	1714215	Purina One
156699	3222270494052	Purina One Adult для к с чувпищинд&рис 10x200 гn2ru 12141414	18493	Товары для животных (folder)/Корм для животных (folder)/Корм для кошек	1714215	Purina One
2179088	017800023528	Purina One adv hairball Formula 4/7lb	337596	Товары для животных (folder)/Pets	1714215	Purina One
2179089	017800125956	Purina One beef/brown Rice can Dog 12/13.0oz	337596	Товары для животных (folder)/Pets	1714215	Purina One
1582916	017800464048	Purina One beef/Rice	1	Неклассифицированные/default	1714215	Purina One
1582917	017800464208	Purina One beef/Rice #2	1	Неклассифицированные/default	1714215	Purina One
2663785	017800126939	Purina One beyond Adult Cat Food lamb&whole barley	1	Неклассифицированные/default	199427	Purina
2179090	017800126854	Purina One beyond Cat chicken/oatmeal 12/16oz	337596	Товары для животных (folder)/Pets	1714215	Purina One
2179091	017800126922	Purina One beyond Cat chicken/oatmeal 5/6lb	337596	Товары для животных (folder)/Pets	1714215	Purina One
2179092	017800126892	Purina One beyond Cat chicken/oatmeal 6/3lb	337596	Товары для животных (folder)/Pets	1714215	Purina One
2179093	017800127011	Purina One beyond Cat Salmon/brown Rice 12/16oz	337596	Товары для животных (folder)/Pets	1714215	Purina One
2179094	017800127059	Purina One beyond Cat Salmon/brown Rice 5/6lb	337596	Товары для животных (folder)/Pets	1714215	Purina One
2179095	017800127035	Purina One beyond Cat Salmon/brown Rice 6/3lb	337596	Товары для животных (folder)/Pets	1714215	Purina One
2663786	017800126847	Purina One beyond chicken&whole oat meal recipe Adult Cat Food	1	Неклассифицированные/default	199427	Purina
2663787	017800126885	Purina One beyond chicken&whole oat meal recipe Adult Cat Food #2	1	Неклассифицированные/default	199427	Purina
2179096	017800126830	Purina One beyond Dog chicken/oatmeal 15lb	337596	Товары для животных (folder)/Pets	1714215	Purina One
2179097	017800126809	Purina One beyond Dog chicken/oatmeal 6/3.5lb	337596	Товары для животных (folder)/Pets	1714215	Purina One
2179098	017800126977	Purina One beyond Dog lamb/barley 15lb	337596	Товары для животных (folder)/Pets	1714215	Purina One
2179099	017800126946	Purina One beyond Dog lamb/barley 6/3.5lb	337596	Товары для животных (folder)/Pets	1714215	Purina One
2663788	017800126991	Purina One beyond Salmon&whole brown Rice recipe Adult Cat Food	1	Неклассифицированные/default	199427	Purina
2663789	017800127028	Purina One beyond Salmon&whole brown Rice recipe Adult Cat Food #2	1	Неклассифицированные/default	199427	Purina
2663790	017800126793	Purina One beyond White meat chicken&whole barley recipe Adult Dog Food	1	Неклассифицированные/default	199427	Purina
2663791	017800126915	Purina One beyond White meat chicken&whole oat meal recipe Adult Cat Food	1	Неклассифицированные/default	199427	Purina
406953	8002205870114	Purina One Cat Adult chicken and Rice 300g	18493	Товары для животных (folder)/Корм для животных (folder)/Корм для кошек	1714215	Purina One
406955	7613031296743	Purina One Cat Adult maturity chicken and Rice 300g	18493	Товары для животных (folder)/Корм для животных (folder)/Корм для кошек	1714215	Purina One
406956	7613031294695	Purina One Cat Adult maturity chicken and Rice 800g	18493	Товары для животных (folder)/Корм для животных (folder)/Корм для кошек	1714215	Purina One
406957	8002205870121	Purina One Cat Adult Salmon and Rice 300g	18493	Товары для животных (folder)/Корм для животных (folder)/Корм для кошек	1714215	Purina One
406958	8002205356656	Purina One Cat Adult Salmon and Rice 800g	18493	Товары для животных (folder)/Корм для животных (folder)/Корм для кошек	1714215	Purina One
1582919	017800571050	Purina One Cat Food Adult chicken&Rice	18493	Товары для животных (folder)/Корм для животных (folder)/Корм для кошек	1714215	Purina One
1582920	017800571920	Purina One Cat Food Adult total nutrition chicken&Rice #2	18493	Товары для животных (folder)/Корм для животных (folder)/Корм для кошек	1714215	Purina One
1582921	017800474740	Purina One Cat Food Adult total nutrition Salmon&tuna	18493	Товары для животных (folder)/Корм для животных (folder)/Корм для кошек	1714215	Purina One
1582922	017800117388	Purina One Cat Food Natural blends Adult Cat chicken, corn gluten meal, poultry by-product meal, oat meal, brown Rice, whole	18493	Товары для животных (folder)/Корм для животных (folder)/Корм для кошек	1714215	Purina One
1582923	017800112888	Purina One Cat Food Natural blends chicken&oatmeal	18493	Товары для животных (folder)/Корм для животных (folder)/Корм для кошек	1714215	Purina One
1582970	017800431194	Purina One Cat Food Salmon/tuna 16 lb	1	Неклассифицированные/default	1714215	Purina One
1582925	017800012607	Purina One Cat Food Special Care Adult	18493	Товары для животных (folder)/Корм для животных (folder)/Корм для кошек	1714215	Purina One
1582926	017800012621	Purina One Cat Food Special Care Adult #2	18493	Товары для животных (folder)/Корм для животных (folder)/Корм для кошек	1714215	Purina One
1582928	017800532112	Purina One Cat Food Special Care Adult #4	18493	Товары для животных (folder)/Корм для животных (folder)/Корм для кошек	1714215	Purina One
1582929	017800532280	Purina One Cat Food Special Care Adult #5	18493	Товары для животных (folder)/Корм для животных (folder)/Корм для кошек	1714215	Purina One
1582931	017800032001	Purina One Cat Food Special Care Adult Sensitive systems #2	18493	Товары для животных (folder)/Корм для животных (folder)/Корм для кошек	1714215	Purina One
1582932	017800033893	Purina One Cat Food Special Care advance #2	18493	Товары для животных (folder)/Корм для животных (folder)/Корм для кошек	1714215	Purina One
1582933	017800121149	Purina One Cat Food-Natural Blend Salmon&brown Rice	18493	Товары для животных (folder)/Корм для животных (folder)/Корм для кошек	1714215	Purina One
2179100	017800033855	Purina One Cat healthy wgt hairball 16lb	337596	Товары для животных (folder)/Pets	1714215	Purina One
2179102	017800532617	Purina One Cat healthy wgt mgm 16lb	337596	Товары для животных (folder)/Pets	1714215	Purina One
2179103	017800023542	Purina One Cat healthy wgt mgm 4/7lb	337596	Товары для животных (folder)/Pets	1714215	Purina One
2179104	017800013987	Purina One Cat healthy wgt mgm 6/3.5lb	337596	Товары для животных (folder)/Pets	1714215	Purina One
406959	7613032543679	Purina One Cat indoor Formula Turkey/Rice 800g	18493	Товары для животных (folder)/Корм для животных (folder)/Корм для кошек	1714215	Purina One
1582934	8002205319873	Purina One Cat indoor kalkoen 800g	18493	Товары для животных (folder)/Корм для животных (folder)/Корм для кошек	1714215	Purina One
406960	8002205870169	Purina One Cat Light chicken and Rice 300g	18493	Товары для животных (folder)/Корм для животных (folder)/Корм для кошек	1714215	Purina One
406961	7613031641048	Purina One Cat Natural balance Ocean fish and oats 800g	18493	Товары для животных (folder)/Корм для животных (folder)/Корм для кошек	1714215	Purina One
2179105	017800112925	Purina One Cat Natural Blend chicken/oatmeal 5/6.8lb	337596	Товары для животных (folder)/Pets	1714215	Purina One
2179106	017800112901	Purina One Cat Natural Blend chicken/oatmeal 6/3.3lb	337596	Товары для животных (folder)/Pets	1714215	Purina One
2179107	017800121187	Purina One Cat Natural Blend Salmon/Rice 5/6.8lb	337596	Товары для животных (folder)/Pets	1714215	Purina One
2179108	017800121132	Purina One Cat Natural Blend Salmon/Rice 6/3.3lb	337596	Товары для животных (folder)/Pets	1714215	Purina One
1582936	7613032543204	Purina One Cat sen.kip rijst 800g	18493	Товары для животных (folder)/Корм для животных (folder)/Корм для кошек	1714215	Purina One
406962	3222270494069	Purina One Cat Sensitive Turkey and Rice 300g	18493	Товары для животных (folder)/Корм для животных (folder)/Корм для кошек	1714215	Purina One
1582937	3222270494090	Purina One Cat ster.rund.rijst 800g	18493	Товары для животных (folder)/Корм для животных (folder)/Корм для кошек	1714215	Purina One
1583008	017800549202	Purina One Cat uth Formula 7 lb	18493	Товары для животных (folder)/Корм для животных (folder)/Корм для кошек	199427	Purina
2823239	017800018876	Purina One Cat vibrant maturity 7 lb	1	Неклассифицированные/default	0	
1582938	8002205319842	Purina One Cat zalm/rijst 800g	18493	Товары для животных (folder)/Корм для животных (folder)/Корм для кошек	1714215	Purina One
3736751	7613035142473	Purina One chick&whole grains a Hair Care&hairb.contr s 0.75kg CD	18493	Товары для животных (folder)/Корм для животных (folder)/Корм для кошек	1714215	Purina One
3736752	7613032748678	Purina One chick&whole grains a s 0.2kg CD	18493	Товары для животных (folder)/Корм для животных (folder)/Корм для кошек	1714215	Purina One
3736753	7613034920645	Purina One chick&whole grains a s 0.2kg CD +comb	18493	Товары для животных (folder)/Корм для животных (folder)/Корм для кошек	1714215	Purina One
3736754	7613034920652	Purina One chick&whole grains a s 0.2kg CD +comb #2	18493	Товары для животных (folder)/Корм для животных (folder)/Корм для кошек	1714215	Purina One
3736755	7613034275097	Purina One chick&whole grains a s 0.75kg CD	18493	Товары для животных (folder)/Корм для животных (folder)/Корм для кошек	1714215	Purina One
3736756	7613034412362	Purina One chick&whole grains a s 0.75kg CD #2	18493	Товары для животных (folder)/Корм для животных (folder)/Корм для кошек	1714215	Purina One
1582935	8002205319910	Purina One chick&whole grains a s 0.8kg CD	18493	Товары для животных (folder)/Корм для животных (folder)/Корм для кошек	1714215	Purina One
3736757	7613032748692	Purina One chick&whole grains jun s 0.2kg CD	18493	Товары для животных (folder)/Корм для животных (folder)/Корм для кошек	1714215	Purina One
2179111	017800125987	Purina One chicken/brown Rice can Dog 12/13.0oz	337596	Товары для животных (folder)/Pets	1714215	Purina One
1582939	017800029674	Purina One chicken/Rice	1	Неклассифицированные/default	1714215	Purina One
1582940	017800029711	Purina One chicken/Rice bn	1	Неклассифицированные/default	1714215	Purina One
2823240	7613034585158	Purina One co and hrb Cat курица злаки bst 18кг ru	1	Неклассифицированные/default	0	
2823242	7613036555876	Purina One coandhrbl Cat chicken 5x 750g+170gfree ru	1	Неклассифицированные/default	0	
3736758	7613032748685	Purina One dl.domash.koshek turk&whole grain a s 0.2kg CD	18493	Товары для животных (folder)/Корм для животных (folder)/Корм для кошек	1714215	Purina One
3736759	7613034920713	Purina One dl.domash.koshek turk&whole grain a s 0.2kg CD #2	18493	Товары для животных (folder)/Корм для животных (folder)/Корм для кошек	1714215	Purina One
3736760	8002205216141	Purina One dl.domash.koshek turk&whole grain a s 0.2kg CD #3	18493	Товары для животных (folder)/Корм для животных (folder)/Корм для кошек	1714215	Purina One
2823294	7613034957115	Purina One dl.domash.koshek turk&whole grain a s 1.5kg CD	1	Неклассифицированные/default	1714215	Purina One
3736761	7613035812482	Purina One dl.domash.koshek turk&whole grain a s 1.5kg CD #2	18493	Товары для животных (folder)/Корм для животных (folder)/Корм для кошек	1714215	Purina One
1582915	017800029735	Purina One Dog Food Adult Formula with beef&Rice	19035	Товары для животных (folder)/Корм для животных (folder)/Корм для собак	1714215	Purina One
1582941	017800570534	Purina One Dog Food Adult healthy weight management	19035	Товары для животных (folder)/Корм для животных (folder)/Корм для собак	1714215	Purina One
1582942	017800019002	Purina One Dog Food Adult large breed Formula	19035	Товары для животных (folder)/Корм для животных (folder)/Корм для собак	1714215	Purina One
1582943	017800032032	Purina One Dog Food Adult Sensitive systems	19035	Товары для животных (folder)/Корм для животных (folder)/Корм для собак	1714215	Purina One
1582944	017800464178	Purina One Dog Food Adult total nutrition beef&Rice	19035	Товары для животных (folder)/Корм для животных (folder)/Корм для собак	1714215	Purina One
1582909	017800475686	Purina One Dog Food Adult total nutrition chicken&Rice	19035	Товары для животных (folder)/Корм для животных (folder)/Корм для собак	1714215	Purina One
