ID	UPCEAN	Name	CategoryID	CategoryName	BrandID	BrandName
1670081	4630004630239	Карамель на палочке 20г смартики	337649	Уход за детьми (folder)/Уход за детьми	0	
2729035	4670013490967	Карамель на палочке 40г ассорти #2	77	Продукты питания (folder)/Кондитерские изделия (folder)/Кондитерские изделия	0	
2729038	6957342928216	Карамель на палочке 7г айс шок #2	77	Продукты питания (folder)/Кондитерские изделия (folder)/Кондитерские изделия	0	
3334526	59021827	Карамель на палочке 8г	37145	Продукты питания (folder)/Кондитерские изделия (folder)/Карамель	0	
3334556	4650056572516	Карамель на палочке shrek навсегда с игрушкой 12.5г	37145	Продукты питания (folder)/Кондитерские изделия (folder)/Карамель	0	
1776092	4680003370605	Карамель на палочке smurf 11.4г	22145	Продукты питания (folder)/Кондитерские изделия (folder)/Конфеты	1670056	Chupa Chups
2867893	86933964	Карамель на палочке ассорти 11г	1	Неклассифицированные/default	0	
2439700	6957342901455	Карамель на палочке белка и стрелка, озорная семейка, 1шт м/у	37145	Продукты питания (folder)/Кондитерские изделия (folder)/Карамель	0	
3334527	6929309291336	Карамель на палочке бум 7г	37145	Продукты питания (folder)/Кондитерские изделия (folder)/Карамель	0	
2867895	6957229001421	Карамель на палочке в форме звезды 15г конфитрейд	1	Неклассифицированные/default	3666641	GOODFRUKT (RUSPRODKHOLDING)
2867896	4829898098021	Карамель на палочке веселушки	1	Неклассифицированные/default	0	
2867897	8887856926997	Карамель на палочке ветрячок ну, погоди	1	Неклассифицированные/default	0	
3334528	6942971502081	Карамель на палочке водная помпа	37145	Продукты питания (folder)/Кондитерские изделия (folder)/Карамель	3770757	VODYANAYA POMPA(RUSPRODKHOLDING)
2439712	6923353921546	Карамель на палочке гудфрут 10г роза	37145	Продукты питания (folder)/Кондитерские изделия (folder)/Карамель	3666641	GOODFRUKT (RUSPRODKHOLDING)
2867899	6957342902322	Карамель на палочке динамит 0.007	1	Неклассифицированные/default	0	
3334529	4829898060103	Карамель на палочке забава мультифрут 12г	37145	Продукты питания (folder)/Кондитерские изделия (folder)/Карамель	0	
2867901	6926572519105	Карамель на палочке забавн порос	1	Неклассифицированные/default	0	
2439701	463000463013	Карамель на палочке зайчики 0.030	37145	Продукты питания (folder)/Кондитерские изделия (folder)/Карамель	0	
3334531	4829898040327	Карамель на палочке змейка,миди,Love 7г	37145	Продукты питания (folder)/Кондитерские изделия (folder)/Карамель	0	
3334532	4829898062022	Карамель на палочке змейка,миди,Love 7г #2	37145	Продукты питания (folder)/Кондитерские изделия (folder)/Карамель	0	
2864293	6942971502029	Карамель на палочке игруша 10г	1	Неклассифицированные/default	0	
2867902	6926572519006	Карамель на палочке кабаны	1	Неклассифицированные/default	0	
3334533	4650056571717	Карамель на палочке клубничка	37145	Продукты питания (folder)/Кондитерские изделия (folder)/Карамель	0	
2729040	6957229000165	Карамель на палочке конфитрейд 15г роза	77	Продукты питания (folder)/Кондитерские изделия (folder)/Кондитерские изделия	0	
3334534	4600416007622	Карамель на палочке кручу-верчу 20г	37145	Продукты питания (folder)/Кондитерские изделия (folder)/Карамель	0	
2867889	6957342906795	Карамель на палочке лоли попс с жевательной резинкой	1	Неклассифицированные/default	0	
3334535	4650056570611	Карамель на палочке микс 12.50г	37145	Продукты питания (folder)/Кондитерские изделия (folder)/Карамель	0	
1219126	4650056572325	Карамель на палочке муми-тролли с наклейкой 12.5г	37145	Продукты питания (folder)/Кондитерские изделия (folder)/Карамель	0	
3334536	4650056571656	Карамель на палочке новый год 12.5г	37145	Продукты питания (folder)/Кондитерские изделия (folder)/Карамель	0	
3334537	4650056571694	Карамель на палочке новый год 12.5г #2	37145	Продукты питания (folder)/Кондитерские изделия (folder)/Карамель	0	
1768364	4650056572240	Карамель на палочке панда кунг фу 12.5г	980	Игрушки (folder)/Игрушка	3765886	USG (TONLY KIDIES CANDY WORKSHOP CO.LTD/CHINA)
3334538	4650056571236	Карамель на палочке панда кунг-фу 12.5г	37145	Продукты питания (folder)/Кондитерские изделия (folder)/Карамель	0	
1670083	8698907550036	Карамель на палочке петушки	37145	Продукты питания (folder)/Кондитерские изделия (folder)/Карамель	0	
1776097	4812324000262	Карамель на палочке петушок 0.017	22145	Продукты питания (folder)/Кондитерские изделия (folder)/Конфеты	0	
3334539	4650056573353	Карамель на палочке петушок 12.5г мяг/уп	37145	Продукты питания (folder)/Кондитерские изделия (folder)/Карамель	0	
548821	6939501803305	Карамель на палочке петушок 15г/12x20	1	Неклассифицированные/default	3765837	USG (RUSPRODKHOLDING)
753023	4607068940116	Карамель на палочке петушок малышок 14г	37145	Продукты питания (folder)/Кондитерские изделия (folder)/Карамель	0	
2867881	4630004630673	Карамель на палочке петя петушок 35г 8/20 ux-kl-233	1	Неклассифицированные/default	0	
3334540	6930058460027	Карамель на палочке пират,рыбка	37145	Продукты питания (folder)/Кондитерские изделия (folder)/Карамель	0	
1219127	4650056570031	Карамель на палочке приключения человека-паука 12.5г	37145	Продукты питания (folder)/Кондитерские изделия (folder)/Карамель	0	
3334541	6947070000551	Карамель на палочке рикилолли 10г	37145	Продукты питания (folder)/Кондитерские изделия (folder)/Карамель	0	
3334542	5902020962199	Карамель на палочке рокс фруктовый 30г м/у	37145	Продукты питания (folder)/Кондитерские изделия (folder)/Карамель	0	
3334543	4829898098229	Карамель на палочке рокс, арбуз, 80г м\у	37145	Продукты питания (folder)/Кондитерские изделия (folder)/Карамель	0	
3334544	4829898050326	Карамель на палочке рокс, макси, 12г, м\у	37145	Продукты питания (folder)/Кондитерские изделия (folder)/Карамель	0	
3334545	4829898098328	Карамель на палочке рокс, пираты, 8.5г, м\у	37145	Продукты питания (folder)/Кондитерские изделия (folder)/Карамель	0	
3334546	6943304701089	Карамель на палочке рыбка 40г	37145	Продукты питания (folder)/Кондитерские изделия (folder)/Карамель	0	
721063	6936168702477	Карамель на палочке с игруш. Фея 12г гэлакси	37145	Продукты питания (folder)/Кондитерские изделия (folder)/Карамель	711223	Гэлакси (бак)
721087	4650056570499	Карамель на палочке с игрушкой shrek навсегда 12.5г	37145	Продукты питания (folder)/Кондитерские изделия (folder)/Карамель	721060	Р-Маркет
2729046	6922297300059	Карамель на палочке с кислой пудрой 11г	77	Продукты питания (folder)/Кондитерские изделия (folder)/Кондитерские изделия	3737005	PYATKA (CHAOAN QUNFENG FOODSTUFF PACK.CO/CHINA)
2439702	6910193430048	Карамель на палочке с шипучкой динамит 0.007	37145	Продукты питания (folder)/Кондитерские изделия (folder)/Карамель	0	
2867906	4620002890490	Карамель на палочке свеча 0.020	1	Неклассифицированные/default	0	
2729047	6943304701164	Карамель на палочке свит лав 50г корзиночка с цветами	77	Продукты питания (folder)/Кондитерские изделия (folder)/Кондитерские изделия	0	
3334547	6941439699615	Карамель на палочке сердечко мяг/уп 45г	37145	Продукты питания (folder)/Кондитерские изделия (folder)/Карамель	0	
3334548	6941439699271	Карамель на палочке сладкий арбуз 120г	37145	Продукты питания (folder)/Кондитерские изделия (folder)/Карамель	0	
2867907	6927001923388	Карамель на палочке сладкий кролик 0.015	1	Неклассифицированные/default	0	
3334549	6939501803411	Карамель на палочке со вкусом фруктов с 3-х лет м/у	37145	Продукты питания (folder)/Кондитерские изделия (folder)/Карамель	0	
3334550	4627079300136	Карамель на палочке собаки забияки, с витамином с, 15г, м/у	37145	Продукты питания (folder)/Кондитерские изделия (folder)/Карамель	0	
1219128	8699993512007	Карамель на палочке сосулька 3D футбол с ж/рез и тату 20г	37145	Продукты питания (folder)/Кондитерские изделия (folder)/Карамель	0	
3334551	8690492001177	Карамель на палочке сплеш красящ. язык 8.5г	37145	Продукты питания (folder)/Кондитерские изделия (folder)/Карамель	0	
3334552	8690492201171	Карамель на палочке сплеш красящ. язык 8.5г #2	37145	Продукты питания (folder)/Кондитерские изделия (folder)/Карамель	0	
3334553	4680003370032	Карамель на палочке спокойной ночи малыши 20г	37145	Продукты питания (folder)/Кондитерские изделия (folder)/Карамель	0	
3334554	8699243480018	Карамель на палочке топпи 13г импорт	37145	Продукты питания (folder)/Кондитерские изделия (folder)/Карамель	0	
3334555	4607162785774	Карамель на палочке фанс сливочно-фруктовое ассорти 100шт х 11.4г тв/уп	37145	Продукты питания (folder)/Кондитерские изделия (folder)/Карамель	0	
2867911	4630004630130	Карамель на палочке фигурная 0.030	1	Неклассифицированные/default	0	
2867912	6926572514087	Карамель на палочке фрукты	1	Неклассифицированные/default	0	
2867913	6926572513028	Карамель на палочке цветы	1	Неклассифицированные/default	0	
2439703	4680003370018	Карамель на палочке человек паук 40г	37145	Продукты питания (folder)/Кондитерские изделия (folder)/Карамель	0	
2867914	6939501803497	Карамель на плочке букет	1	Неклассифицированные/default	0	
1812520	6939501803022	Карамель на полочке бабочка 15г	3541537	Сувениры и подарки (folder)/Сувенир	0	
3334557	6957342905064	Карамель насекомые шипучая с игрушкой 1г м/у	37145	Продукты питания (folder)/Кондитерские изделия (folder)/Карамель	0	
3334558	4607020218017	Карамель насладись апельсин ледецовая диетическая без сахара 55г мяг/уп	37145	Продукты питания (folder)/Кондитерские изделия (folder)/Карамель	0	
3334559	4607020218031	Карамель насладись ассорти 55г	37145	Продукты питания (folder)/Кондитерские изделия (folder)/Карамель	0	
2867917	4607020212084	Карамель насладись ассорти без сахара 66г мяг/уп	1	Неклассифицированные/default	0	
3334560	4607020216754	Карамель насладись дюшес изомальта без сахара 66г мяг/уп	37145	Продукты питания (folder)/Кондитерские изделия (folder)/Карамель	0	
314447	4607020212121	Карамель насладись клубника со сливками без сахара 66г мяг/уп	37145	Продукты питания (folder)/Кондитерские изделия (folder)/Карамель	0	
3334561	4607020218024	Карамель насладись клубника со сливками диетическая без сахара 55г мяг/уп	37145	Продукты питания (folder)/Кондитерские изделия (folder)/Карамель	0	
3334562	4607020212046	Карамель насладись мята перечная без сахара 66г мяг/уп	37145	Продукты питания (folder)/Кондитерские изделия (folder)/Карамель	0	
2867918	4823077615023	Карамель нач.на травах Herbina+ бузина с облепихой и вит.с вес	1	Неклассифицированные/default	0	
2867919	4823077615016	Карамель нач.на травах Herbina+ имбирь с соком грейпфрута вес	1	Неклассифицированные/default	0	
2867920	4823077615658	Карамель нач.на травах Herbina+ тимьян с мятой и медом вес	1	Неклассифицированные/default	0	
2867921	4823077615665	Карамель нач.на травах Herbina+ шалфей с соком лимона и черн.смор.вес	1	Неклассифицированные/default	0	
2867922	4823077615030	Карамель нач.на травах Herbina+ эвк.-мент.с мятой и соком вишни вес	1	Неклассифицированные/default	0	
1678081	4607072808426	Карамель невский кондитер 0.080 жб	337649	Уход за детьми (folder)/Уход за детьми	0	
2439677	4607072800840	Карамель невский кондитер барбарис 200г мяг/уп	37145	Продукты питания (folder)/Кондитерские изделия (folder)/Карамель	0	
3334563	4607157395070	Карамель невский кондитер веселые дольки микс леденцовая 200г мяг/уп	37145	Продукты питания (folder)/Кондитерские изделия (folder)/Карамель	3789299	веселые DOLKI (NEVSKIY KONDITER/SPB)
2867924	4607072800116	Карамель невский кондитер вишня 200г	1	Неклассифицированные/default	3795017	вишня (NEVSKIY KONDITER/SPB)
2867923	4607157395728	Карамель невский кондитер вселылые дольки леденцовая 300г мяг/уп	1	Неклассифицированные/default	1725244	Невский Кондитер
549625	0000000000574	Карамель невский кондитер двойные сливки 200г вишня	37145	Продукты питания (folder)/Кондитерские изделия (folder)/Карамель	1725244	Невский Кондитер
548107	4607072805760	Карамель невский кондитер двойные сливки клубника 6кг	37145	Продукты питания (folder)/Кондитерские изделия (folder)/Карамель	1725244	Невский Кондитер
549265	4607072805753	Карамель невский кондитер двойные сливки малина 6кг	37145	Продукты питания (folder)/Кондитерские изделия (folder)/Карамель	1725244	Невский Кондитер
549257	4607157394110	Карамель невский кондитер карамельница золот.3кг	22145	Продукты питания (folder)/Кондитерские изделия (folder)/Конфеты	1725244	Невский Кондитер
549258	4607157394097	Карамель невский кондитер карамельница янтарная 3кг	22145	Продукты питания (folder)/Кондитерские изделия (folder)/Конфеты	1725244	Невский Кондитер
548176	0000000000581	Карамель невский кондитер леденец клас. 200г барбарис	37145	Продукты питания (folder)/Кондитерские изделия (folder)/Карамель	1725244	Невский Кондитер
549293	4607157391836	Карамель невский кондитер леденец клас. 300г микс	37145	Продукты питания (folder)/Кондитерские изделия (folder)/Карамель	1725244	Невский Кондитер
549318	4607072805661	Карамель невский кондитер леденец клас. авиа 6кг	37145	Продукты питания (folder)/Кондитерские изделия (folder)/Карамель	1725244	Невский Кондитер
549262	4607072800956	Карамель невский кондитер леденец клас. барбарис 6кг	37145	Продукты питания (folder)/Кондитерские изделия (folder)/Карамель	1725244	Невский Кондитер
549261	4607072805708	Карамель невский кондитер леденец клас. мятный 6кг	37145	Продукты питания (folder)/Кондитерские изделия (folder)/Карамель	1725244	Невский Кондитер
156061	4607072803100	Карамель невский кондитер лимонная-неугомонная 200г	22145	Продукты питания (folder)/Кондитерские изделия (folder)/Конфеты	3847912	лимонная NEUGOMONNAYA
549429	4607157395056	Карамель невский кондитер луговая му вар.сгущ.3кг	37145	Продукты питания (folder)/Кондитерские изделия (folder)/Карамель	1725244	Невский Кондитер
549428	4607157395032	Карамель невский кондитер луговая му кар.-сл.3кг	37145	Продукты питания (folder)/Кондитерские изделия (folder)/Карамель	1725244	Невский Кондитер
549430	4607157395049	Карамель невский кондитер луговая му Крем-брюле 3кг	37145	Продукты питания (folder)/Кондитерские изделия (folder)/Карамель	1725244	Невский Кондитер
549431	4607157395063	Карамель невский кондитер луговая му шок.3кг	37145	Продукты питания (folder)/Кондитерские изделия (folder)/Карамель	1725244	Невский Кондитер
549317	4607157394387	Карамель невский кондитер луэро шок.3кг	37145	Продукты питания (folder)/Кондитерские изделия (folder)/Карамель	1725244	Невский Кондитер
549259	4607157393823	Карамель невский кондитер молочная му ваниль 3кг	37145	Продукты питания (folder)/Кондитерские изделия (folder)/Карамель	1725244	Невский Кондитер
549260	4607157393847	Карамель невский кондитер молочная му сл.3кг	37145	Продукты питания (folder)/Кондитерские изделия (folder)/Карамель	1725244	Невский Кондитер
3334564	4607157398514	Карамель невский кондитер морошка с фруктово-ягодной начинкой вес	37145	Продукты питания (folder)/Кондитерские изделия (folder)/Карамель	1725244	Невский Кондитер
549266	4607072808969	Карамель невский кондитер снежный лимон 4кг	37145	Продукты питания (folder)/Кондитерские изделия (folder)/Карамель	1725244	Невский Кондитер
549263	4607072806170	Карамель невский кондитер Сочная ягода вишня 6кг	37145	Продукты питания (folder)/Кондитерские изделия (folder)/Карамель	1725244	Невский Кондитер
549264	4607072806279	Карамель невский кондитер Сочная ягода клюква 6кг	37145	Продукты питания (folder)/Кондитерские изделия (folder)/Карамель	1725244	Невский Кондитер
3334565	4607146118833	Карамель невский кондитер ягодня поляна со вкусом черники 270г м/у	37145	Продукты питания (folder)/Кондитерские изделия (folder)/Карамель	0	
2867925	4607117890799	Карамель неженка 0.250	1	Неклассифицированные/default	0	
142799	4600080304263	Карамель неженка ваниль в бел/глаз вес	37145	Продукты питания (folder)/Кондитерские изделия (folder)/Карамель	89	Рот Фронт
142800	4600080304256	Карамель неженка кокос в белой глазури вес	37145	Продукты питания (folder)/Кондитерские изделия (folder)/Карамель	89	Рот Фронт
143201	4600080304287	Карамель неженка Крем ликер в бел гл. вес 7кг	37145	Продукты питания (folder)/Кондитерские изделия (folder)/Карамель	89	Рот Фронт
1674137	4600080461942	Карамель неженка микс 250г рот фронт арт. 04 4501	22145	Продукты питания (folder)/Кондитерские изделия (folder)/Конфеты	0	
142902	4600080304270	Карамель неженка орех белая глазурь вес	37145	Продукты питания (folder)/Кондитерские изделия (folder)/Карамель	89	Рот Фронт
3819263	1000099115615	Карамель неженка с ароматом ванили 250г	37145	Продукты питания (folder)/Кондитерские изделия (folder)/Карамель	89	Рот Фронт
3819264	4607151680929	Карамель неженка с ароматом ванили 250г #2	37145	Продукты питания (folder)/Кондитерские изделия (folder)/Карамель	89	Рот Фронт
2725668	6921898567724	Карамель незванный гость жидкая с игрушкой 10г	77	Продукты питания (folder)/Кондитерские изделия (folder)/Кондитерские изделия	0	
3334566	4607107013511	Карамель нимет нане леденцовая 120г м/уп	37145	Продукты питания (folder)/Кондитерские изделия (folder)/Карамель	0	
3334567	4607107013955	Карамель нимет нане леденцовая 120г м/уп #2	37145	Продукты питания (folder)/Кондитерские изделия (folder)/Карамель	0	
