ID	UPCEAN	Name	CategoryID	CategoryName	BrandID	BrandName
3544039	4660006490975	Сухарики Мастер дизель вкус чеснока, 40г м/у	1202446	Продукты питания (folder)/Сухарики	3544036	Мастер дизель
2490297	4660006490708	Сухарики Мастер дизель вкус шашлыка, 40г м/у	1202446	Продукты питания (folder)/Сухарики	3544036	Мастер дизель
2490296	4660006490715	Сухарики Мастер дизель грибы в сметане, 40г м/у	1202446	Продукты питания (folder)/Сухарики	3544036	Мастер дизель
2490288	4660006490753	Сухарики Мастер дизель рж/пш.вк.бекона 90г	1202446	Продукты питания (folder)/Сухарики	3544036	Мастер дизель
2490290	4660006490609	Сухарики Мастер дизель рж/пш.вк.салями 90г	1202446	Продукты питания (folder)/Сухарики	3544036	Мастер дизель
2490291	4660006490623	Сухарики Мастер дизель рж/пш.вк.сыра 90г	1202446	Продукты питания (folder)/Сухарики	3544036	Мастер дизель
2490292	4660006490784	Сухарики Мастер дизель рж/пш.вк.том/зелен 90г	1202446	Продукты питания (folder)/Сухарики	3544036	Мастер дизель
2490294	4660006490593	Сухарики Мастер дизель рж/пш.вк.чеснока 90г	1202446	Продукты питания (folder)/Сухарики	3544036	Мастер дизель
2490295	4660006490777	Сухарики Мастер дизель рж/пш.вк.шашлыка 90г	1202446	Продукты питания (folder)/Сухарики	3544036	Мастер дизель
2490289	4660006490760	Сухарики Мастер дизель сметана грибы, 90г м/у	1202446	Продукты питания (folder)/Сухарики	3544036	Мастер дизель
2490285	4660006490517	Сухарики Мастер дизель томат зелень, 40г м/у	1202446	Продукты питания (folder)/Сухарики	3544036	Мастер дизель
2490287	4660006490692	Сухарики Мастер дизель чеснок, 40г м/у	1202446	Продукты питания (folder)/Сухарики	3544036	Мастер дизель
2490286	4660006490500	Сухарики Мастер дизер холодец с хреном 40г мяг/уп	1202446	Продукты питания (folder)/Сухарики	3544036	Мастер дизель
1316466	4820047461284	Сухарики мачо Флинт со вкусом сыра 100г	1202446	Продукты питания (folder)/Сухарики	0	
2932456	4620757013007	Сухарики мегафишка 300г чеснок	1202446	Продукты питания (folder)/Сухарики	3658455	FISHKA (FORTUNA PROIZV.KOMP./KOSTROMSKAYA OBL.)
2932457	4620757011508	Сухарики мегафишка 500г сметана и лук	1202446	Продукты питания (folder)/Сухарики	0	
2758582	4620757011638	Сухарики мегафишка ржаные с натуральным чесноком 300г мяг/уп	1202446	Продукты питания (folder)/Сухарики	3658455	FISHKA (FORTUNA PROIZV.KOMP./KOSTROMSKAYA OBL.)
2758580	4620757011362	Сухарики мегафишка ржаные со вкусом сыра 300г мяг/уп	1202446	Продукты питания (folder)/Сухарики	0	
2758581	4620757011386	Сухарики мегафишка ржаные со вкусом холодца с хреном 300г мяг/уп	1202446	Продукты питания (folder)/Сухарики	0	
3544040	4606838003587	Сухарики миксар ржаные с арахисом вкус бекона 35г мяг/уп	1202446	Продукты питания (folder)/Сухарики	0	
3544041	4606838003624	Сухарики миксар ржаные с арахисом вкус краба 35г мяг/уп	1202446	Продукты питания (folder)/Сухарики	0	
3544042	4606838001347	Сухарики миксар ржаные с арахисом вкус сметаны и зелени 35г мяг/уп	1202446	Продукты питания (folder)/Сухарики	0	
3544043	4606838003648	Сухарики миксар ржаные с арахисом вкус холодца и хрена 35г мяг/уп	1202446	Продукты питания (folder)/Сухарики	0	
1316467	4820005023400	Сухарики мрия решка крабы 40г	1202446	Продукты питания (folder)/Сухарики	0	
1316468	4820005023356	Сухарики мрия решка красная икра 40г	1202446	Продукты питания (folder)/Сухарики	0	
1316469	4820005023370	Сухарики мрия решка с беконом и горчицей 40г	1202446	Продукты питания (folder)/Сухарики	0	
1316470	4820005023394	Сухарики мрия решка сметана-зелень 40г	1202446	Продукты питания (folder)/Сухарики	0	
1316471	4602041005950	Сухарики мягкие 0.040	1202446	Продукты питания (folder)/Сухарики	0	
1316472	4602041005967	Сухарики мягкие 40г #2	1202446	Продукты питания (folder)/Сухарики	0	
1316474	460204100447	Сухарики мягкие бекон 0.050	1202446	Продукты питания (folder)/Сухарики	0	
1316475	460204100287	Сухарики мягкие красн икра 0.020 +	1202446	Продукты питания (folder)/Сухарики	0	
166509	4602041003192	Сухарики мягкие красн икра 0.047	1202446	Продукты питания (folder)/Сухарики	0	
1316473	4602041005981	Сухарики мягкие ржаные 0.047	1202446	Продукты питания (folder)/Сухарики	0	
166507	4602041003130	Сухарики мягкие ржаные бекон 50г	1202446	Продукты питания (folder)/Сухарики	0	
166508	4602041003147	Сухарики мягкие ржаные колбаска 50г	1202446	Продукты питания (folder)/Сухарики	0	
166510	4602041003154	Сухарики мягкие ржаные смет.50г	1202446	Продукты питания (folder)/Сухарики	0	
124545	4602041001327	Сухарики мягкие сухарики вкус колбаски 20г мяг/уп	1202446	Продукты питания (folder)/Сухарики	124537	Русская Картошка
124540	4602041004489	Сухарики мягкие сухарики вкус колбаски 47г мяг/уп	1202446	Продукты питания (folder)/Сухарики	124537	Русская Картошка
2932461	4602041009316	Сухарики мягкие сухарики ржаные со вкусом сметанки 38г мяг/уп	1202446	Продукты питания (folder)/Сухарики	3857415	мягкие Сухарики (RUSSKART)
2758586	4602041009309	Сухарики мягкие сухарики сметанка 20г мяг/уп	1202446	Продукты питания (folder)/Сухарики	3857415	мягкие Сухарики (RUSSKART)
124543	4602041001310	Сухарики мягкие сухарики, ржаные с беконом, 20г м/у	1202446	Продукты питания (folder)/Сухарики	124537	Русская Картошка
3544044	4602041009262	Сухарики мягкие сухарики, ржаные с беконом, 20г м/у #2	1202446	Продукты питания (folder)/Сухарики	3857415	мягкие Сухарики (RUSSKART)
124544	4602041000375	Сухарики мягкие черн.икра 0.020	1202446	Продукты питания (folder)/Сухарики	124537	Русская Картошка
166512	4602041003215	Сухарики мягкие черн.икра 0.050	1202446	Продукты питания (folder)/Сухарики	0	
3544045	4607120990141	Сухарики наффаня сыр	1202446	Продукты питания (folder)/Сухарики	0	
3544046	4600631003737	Сухарики невская сушка невские 250г м/у	1202446	Продукты питания (folder)/Сухарики	0	
1775299	4600631003744	Сухарики невские ванилин 0.25кг	1202446	Продукты питания (folder)/Сухарики	0	
1775300	4600631003751	Сухарики невские ванилин 0.25кг #2	1202446	Продукты питания (folder)/Сухарики	0	
1316478	4601540000978	Сухарики невские ванильные 250г	1202446	Продукты питания (folder)/Сухарики	0	
2260542	4607041441692	Сухарики невские с арахисом 280г каравай	1202446	Продукты питания (folder)/Сухарики	37627	Каравай
2260543	4607041441715	Сухарики невские с изюмом 280г каравай	1202446	Продукты питания (folder)/Сухарики	37627	Каравай
2932463	4610019451654	Сухарики невские с изюмом 280г каравай #2	1202446	Продукты питания (folder)/Сухарики	0	
2260544	4607041441722	Сухарики невские с маком 280г каравай	1202446	Продукты питания (folder)/Сухарики	37627	Каравай
2932464	4610019451647	Сухарики невские с маком 280г каравай #2	1202446	Продукты питания (folder)/Сухарики	0	
3544047	4607154980897	Сухарики ого аджика 40г мяг/уп	1202446	Продукты питания (folder)/Сухарики	0	
3544048	4607154980484	Сухарики ого бекон 40г мяг/уп	1202446	Продукты питания (folder)/Сухарики	0	
3544049	4607154980460	Сухарики ого лук 40г мяг/уп	1202446	Продукты питания (folder)/Сухарики	0	
3544050	4607154980453	Сухарики ого томат чеснок 40г мяг/уп	1202446	Продукты питания (folder)/Сухарики	3724843	OGO! (RUSPOT/VLADIMIRSKAYA OBL.)
3544051	4607154980439	Сухарики ого холодец и хрен 40г мяг/уп	1202446	Продукты питания (folder)/Сухарики	0	
2932390	4607019503629	Сухарики ого! ванильные 250г м/у	1	Неклассифицированные/default	0	
2932392	4607019503636	Сухарики ого! с изюмом 250г м/у	1	Неклассифицированные/default	0	
1827074	4607041230401	Сухарики ого! с маком 250г мяг/уп	676644	Продукты питания (folder)/Сухари, сушки, баранки	0	
1827075	4607041230845	Сухарики ого! сахарные с изюмом 300г мяг/уп	1202446	Продукты питания (folder)/Сухарики	0	
3544052	4606471502072	Сухарики от каролины ванильные 200г м/у	1202446	Продукты питания (folder)/Сухарики	0	
3544053	4606471502089	Сухарики от каролины с маком 200г мяг/уп	1202446	Продукты питания (folder)/Сухарики	0	
2490298	460701235178	Сухарики от мартина 0.06	1202446	Продукты питания (folder)/Сухарики	3260147	От Мартина
2490300	4607012351807	Сухарики от мартина 60г*24шт с беконом	1202446	Продукты питания (folder)/Сухарики	3260147	От Мартина
2490301	4607012351821	Сухарики от мартина 60г*24шт с зеленью и сметаной	1202446	Продукты питания (folder)/Сухарики	3260147	От Мартина
2490299	4607012351791	Сухарики от мартина, пшенично кукурузные, сыр, 60г м/у	1202446	Продукты питания (folder)/Сухарики	3260147	От Мартина
2490302	4607012351784	Сухарики от мартина, пшенично кукурузные, томат зелень, 60г м/у	1202446	Продукты питания (folder)/Сухарики	3260147	От Мартина
3544054	5601560112100	Сухарики пано мини 120г	1202446	Продукты питания (folder)/Сухарики	0	
2490303	4607003150341	Сухарики пантера асс 0.035	1202446	Продукты питания (folder)/Сухарики	0	
1827291	4607010749040	Сухарики перекресток рж.вк.бекона 50г	1202446	Продукты питания (folder)/Сухарики	1980103	Перекресток
1827292	4607010749033	Сухарики перекресток рж.вк.сыра/сем.50г	1202446	Продукты питания (folder)/Сухарики	1980103	Перекресток
1827293	4607010749057	Сухарики перекресток рж.с дымком 50г	1202446	Продукты питания (folder)/Сухарики	1980103	Перекресток
1827294	4607010749071	Сухарики перекресток рж.томат/зелен 50г	1202446	Продукты питания (folder)/Сухарики	1980103	Перекресток
1827295	4607010749064	Сухарики перекресток ржаные с солью 50г	1202446	Продукты питания (folder)/Сухарики	1980103	Перекресток
3544055	4605820008401	Сухарики перекусики ароматные грибы ржано-пшеничные 50г м/уп	1202446	Продукты питания (folder)/Сухарики	0	
3544056	4605820008388	Сухарики перекусики бекон ржано-пшеничные 50г м/уп	1202446	Продукты питания (folder)/Сухарики	0	
3544057	4605820008432	Сухарики перекусики сыр и ветчина ржано-пшеничные 50г м/уп	1202446	Продукты питания (folder)/Сухарики	0	
3544058	4607096064402	Сухарики переславский хз ванильные 250г м/у	1202446	Продукты питания (folder)/Сухарики	0	
3544059	4607096064419	Сухарики переславский хз горчичные 250г м/у	1202446	Продукты питания (folder)/Сухарики	0	
3544060	4607096064440	Сухарики переславский хз классические 250г м/у	1202446	Продукты питания (folder)/Сухарики	0	
3544061	4607096064457	Сухарики переславский хз с изюмом и сахаром 250г м/у	1202446	Продукты питания (folder)/Сухарики	0	
3544062	4607096064433	Сухарики переславский хз с орехами 250г м/у	1202446	Продукты питания (folder)/Сухарики	0	
3544063	4607096064426	Сухарики переславский хлебозавод с маком 250г мяг/уп	1202446	Продукты питания (folder)/Сухарики	0	
2490304	4870063000011	Сухарики пикантные 50г	1202446	Продукты питания (folder)/Сухарики	0	
3544064	4607032060888	Сухарики пилотские 50г ассорти	1202446	Продукты питания (folder)/Сухарики	0	
3917860	4605581005060	Сухарики по-русски холодец хрен 40г	40119	Продукты питания (folder)/Хлебо-булочные изделия	0	
3917861	4605581005039	Сухарики по-сахалински красная икра 40г	40119	Продукты питания (folder)/Хлебо-булочные изделия	0	
3544065	4610002740567	Сухарики поболтушки маринованные огурчики 40г мяг/уп	1202446	Продукты питания (folder)/Сухарики	0	
3544066	4610002743889	Сухарики поболтушки ржаные с чесноком 40г мяг/уп	1202446	Продукты питания (folder)/Сухарики	0	
3544067	4610002740543	Сухарики поболтушки семга сыр 40г мяг/уп	1202446	Продукты питания (folder)/Сухарики	0	
3544068	4610002743858	Сухарики поболтушки семга сыр 40г мяг/уп #2	1202446	Продукты питания (folder)/Сухарики	0	
3544069	4610002740529	Сухарики поболтушки томат зелень 40г мяг/уп	1202446	Продукты питания (folder)/Сухарики	0	
3544070	4610002743865	Сухарики поболтушки томат зелень 40г мяг/уп #2	1202446	Продукты питания (folder)/Сухарики	0	
3544072	4610002743872	Сухарики поболтушки холодец и хрен 40г мяг/уп #2	1202446	Продукты питания (folder)/Сухарики	3733496	POBOLTUSHKI (RODNYE PROSTORY)
3544073	4610002740536	Сухарики поболтушки, бекон, 40г м/у	1202446	Продукты питания (folder)/Сухарики	0	
3544074	4610002743834	Сухарики поболтушки, бекон, 40г м/у #2	1202446	Продукты питания (folder)/Сухарики	0	
3544075	4610002740574	Сухарики поболтушки, сало с чесноком, 40г м/у	1202446	Продукты питания (folder)/Сухарики	0	
3544076	4610002743841	Сухарики поболтушки, сало с чесноком, 40г м/у #2	1202446	Продукты питания (folder)/Сухарики	0	
3544077	4607122230603	Сухарики полесские вкусняшки 100г	1202446	Продукты питания (folder)/Сухарики	0	
3544078	4660006491330	Сухарики правильный выбор ржано-пшеничные со вкусом бекона 40г мяг/уп	1202446	Продукты питания (folder)/Сухарики	0	
3544079	4660006491347	Сухарики правильный выбор ржано-пшеничные со вкусом сыра 40г мяг/уп	1202446	Продукты питания (folder)/Сухарики	0	
3544080	4660006491354	Сухарики правильный выбор ржано-пшеничные со вкусом томата и зелени 40г мяг/уп	1202446	Продукты питания (folder)/Сухарики	0	
3544081	4660006491361	Сухарики правильный выбор ржано-пшеничные со вкусом холодца с хреном 40г мяг/уп	1202446	Продукты питания (folder)/Сухарики	0	
2859328	4607934961290	Сухарики Премиум гренки барбекю 40г	1	Неклассифицированные/default	0	
2859329	4607934961283	Сухарики Премиум гренки холодец с хреном 40г	1	Неклассифицированные/default	0	
3544082	4665296820617	Сухарики Премиум гренки чеснок 40г #2	1202446	Продукты питания (folder)/Сухарики	0	
2490305	460702942020	Сухарики прик/хавки 0.035	1202446	Продукты питания (folder)/Сухарики	0	
2490306	4607029420190	Сухарики прик/хавки 0.035 #2	1202446	Продукты питания (folder)/Сухарики	0	
2490307	4607029420220	Сухарики прик/хавки 0.035 #3	1202446	Продукты питания (folder)/Сухарики	0	
2490308	4607029420237	Сухарики прик/хавки 0.035 #4	1202446	Продукты питания (folder)/Сухарики	0	
2490309	4607029420244	Сухарики прик/хавки 0.035 #5	1202446	Продукты питания (folder)/Сухарики	0	
2490310	4607029420251	Сухарики прик/хавки 0.035 #6	1202446	Продукты питания (folder)/Сухарики	0	
2490311	4607029420268	Сухарики прик/хавки 0.035 #7	1202446	Продукты питания (folder)/Сухарики	0	
1316481	4607030771205	Сухарики Принцесса Золушка	1202446	Продукты питания (folder)/Сухарики	0	
3544083	4665296820600	Сухарики прусское застолье с чесноком 100г пл/у	1202446	Продукты питания (folder)/Сухарики	0	
3544084	4665296820624	Сухарики прусское застолье с чесноком и соусом 100г пл/у	1202446	Продукты питания (folder)/Сухарики	0	
2932466	4640026591180	Сухарики пшенично-ржаные гренки по-домашнему с натуральным чесноком 80г	1202446	Продукты питания (folder)/Сухарики	0	
2932467	4640026591203	Сухарики пшенично-ржаные гренки по-домашнему холодец с хреном 80г	1202446	Продукты питания (folder)/Сухарики	0	
2932468	4640026590961	Сухарики пшенично-ржаные гренки со вкусом аджики 50г	1202446	Продукты питания (folder)/Сухарики	3773345	WORLD OF TANKS (UNITED FOOD GROUP)
2932469	4640026590978	Сухарики пшенично-ржаные гренки со вкусом с натуральным чесноком 50г	1202446	Продукты питания (folder)/Сухарики	3773345	WORLD OF TANKS (UNITED FOOD GROUP)
2932470	4640026590954	Сухарики пшенично-ржаные гренки со вкусом холодца с хреном 50г	1202446	Продукты питания (folder)/Сухарики	3773345	WORLD OF TANKS (UNITED FOOD GROUP)
2490312	4607024894125	Сухарики пшеничные 5 золотых асс 0.060	1202446	Продукты питания (folder)/Сухарики	0	
1827086	5201360644841	Сухарики пшеничные 7days Mini bake rolls барбекю 80г х 12 Польша	1202446	Продукты питания (folder)/Сухарики	0	
1316234	5201360644742	Сухарики пшеничные 7days Mini bake rolls пицца 80г х 12 Польша	1202446	Продукты питания (folder)/Сухарики	68529	Бейк Ролз
1827085	5201360644445	Сухарики пшеничные 7days Mini bake rolls чеснок/пармезан 80г х 12 Польша	1202446	Продукты питания (folder)/Сухарики	3606820	7 DAYS
1316512	4820111950614	Сухарики пшеничные необходимый запас бекон 27г	1202446	Продукты питания (folder)/Сухарики	0	
1316513	4820111950607	Сухарики пшеничные необходимый запас сало и часнок 27г	1202446	Продукты питания (folder)/Сухарики	0	
2490316	4605581003219	Сухарики пшеничные со вкусом красной икры 50г	1202446	Продукты питания (folder)/Сухарики	3822124	Клины
2490317	4605581003783	Сухарики пшеничные со вкусом сливочного масла 50г	1202446	Продукты питания (folder)/Сухарики	3822124	Клины
3544085	4690329007796	Сухарики пшеничные со вкусом сметаны и зелени 400г м/уп	1202446	Продукты питания (folder)/Сухарики	0	
3544086	4690329008281	Сухарики пшеничные со вкусом чеснока 400г м/уп	1202446	Продукты питания (folder)/Сухарики	0	
835941	4690388008062	Сухарики пшеничные хрусteam багет сырное ассорти 60г	1202446	Продукты питания (folder)/Сухарики	124557	ХрусTeam
835942	4690388008079	Сухарики пшеничные хрусteam багет томат/зелень 60г	1202446	Продукты питания (folder)/Сухарики	124557	ХрусTeam
3544087	4815105000765	Сухарики рень ассортим 30г	1202446	Продукты питания (folder)/Сухарики	0	
3544088	4815105000789	Сухарики рень ассортим 30г #2	1202446	Продукты питания (folder)/Сухарики	0	
1316514	4820005023363	Сухарики решка ржаные буженина 40г	1202446	Продукты питания (folder)/Сухарики	0	
1316515	4820005023349	Сухарики решка ржаные охотничьи колбаски 40г	1202446	Продукты питания (folder)/Сухарики	0	
1316516	4820005023387	Сухарики решка ржаные холодец с хреном 40г	1202446	Продукты питания (folder)/Сухарики	0	
2932431	4607166780065	Сухарики ржано-пшеничные с аром. сала с чесноком 1/40г	1202446	Продукты питания (folder)/Сухарики	0	
2758563	4605362007900	Сухарики ржаные бабкины семечки буженина 45г мяг/уп	676644	Продукты питания (folder)/Сухари, сушки, баранки	0	
547787	4601159073639	Сухарики ржаные вологодские ассорти 40г	1202446	Продукты питания (folder)/Сухарики	0	
2932475	4607004164064	Сухарики ржаные с солью 45г chaka	1202446	Продукты питания (folder)/Сухарики	3633563	CHAKA
2932476	4607004164071	Сухарики ржаные со вкусом бекона 45г chaka	1202446	Продукты питания (folder)/Сухарики	0	
