ID	UPCEAN	Name	CategoryID	CategoryName	BrandID	BrandName
4782547	4460031269634	Wii-hnt for treasure wal-mart	1	Неклассифицированные/default	0	
3772688	4894096050973	Wiiix USB-кабель 8 pin White 1м	300445	Эксплуатация и ремонт автомобилей/Автомобильные принадлежности	3772687	WIIIX
3772689	4894096017723	Wiiix держатель для планшета/ipad kds-1	300445	Эксплуатация и ремонт автомобилей/Автомобильные принадлежности	3772687	WIIIX
3772690	4894096066134	Wiiix держатель магн.для тел/смар.ht-16vmg	300445	Эксплуатация и ремонт автомобилей/Автомобильные принадлежности	3772687	WIIIX
3772691	4894096066257	Wiiix держатель тел/смар.ht-23v	300445	Эксплуатация и ремонт автомобилей/Автомобильные принадлежности	3772687	WIIIX
3772692	4894096017686	Wiiix держатель тел/смар.ht-s3s-n	300445	Эксплуатация и ремонт автомобилей/Автомобильные принадлежности	3772687	WIIIX
3772693	4894096066080	Wiiix держатель тел/смарт.ht-14v	300445	Эксплуатация и ремонт автомобилей/Автомобильные принадлежности	3772687	WIIIX
3772694	4894096017716	Wiiix держатель тел/смарт.ht-s3s	300445	Эксплуатация и ремонт автомобилей/Автомобильные принадлежности	3772687	WIIIX
3772695	4894096066219	Wiiix держатель тел/смарт.на рульht-20rr	300445	Эксплуатация и ремонт автомобилей/Автомобильные принадлежности	3772687	WIIIX
3772696	4894096018720	Wiiix держатель телефона/смартфона ht-s3	300445	Эксплуатация и ремонт автомобилей/Автомобильные принадлежности	3772687	WIIIX
3772697	4894096051215	Wiiix кабель-пер.3в1 8pin/мик/type-c 1.3м	300445	Эксплуатация и ремонт автомобилей/Автомобильные принадлежности	3772687	WIIIX
3772698	4894096051284	Wiiix кабель-пер.USB-microusb Black 1м	300445	Эксплуатация и ремонт автомобилей/Автомобильные принадлежности	3772687	WIIIX
3772699	4894096051079	Wiiix кабель-пер.св.USB-microusb Blue 1м	300445	Эксплуатация и ремонт автомобилей/Автомобильные принадлежности	3772687	WIIIX
3772700	4894096051239	Wiiix кабель-пер.свет.USB-8pin бел 1м	300445	Эксплуатация и ремонт автомобилей/Автомобильные принадлежности	3772687	WIIIX
3772701	4894096051260	Wiiix кабель-перех.USB-type-c silv.1.5м	300445	Эксплуатация и ремонт автомобилей/Автомобильные принадлежности	3772687	WIIIX
3772702	4894096019758	Wiiix коврик липкий sp-04b маленький	300445	Эксплуатация и ремонт автомобилей/Автомобильные принадлежности	3772687	WIIIX
3772703	4894096020105	Wiiix коврик липкий силик.мал.sp-001	300445	Эксплуатация и ремонт автомобилей/Автомобильные принадлежности	3772687	WIIIX
3772704	4894096027821	Wiiix разветв.прик.с 2 USB-порт.tr-11u2	300445	Эксплуатация и ремонт автомобилей/Автомобильные принадлежности	3772687	WIIIX
3772705	4894096024653	Wiiix разветвитель прикурив.2гн.tr-01c	300445	Эксплуатация и ремонт автомобилей/Автомобильные принадлежности	3772687	WIIIX
3772706	4894096046334	Wiiix устройст.зар.с 2 USB-порт.ucc-2-14	300445	Эксплуатация и ремонт автомобилей/Автомобильные принадлежности	3772687	WIIIX
3772707	4894096045986	Wiiix устройство заряд.в авто ucc-1-4b	300445	Эксплуатация и ремонт автомобилей/Автомобильные принадлежности	3772687	WIIIX
3772708	4894096044569	Wiiix устройство зарядное автом.ch-u6-1	300445	Эксплуатация и ремонт автомобилей/Автомобильные принадлежности	3772687	WIIIX
3772709	4894096084022	Wiiix элемент светоотражающий ls-1	300445	Эксплуатация и ремонт автомобилей/Автомобильные принадлежности	3772687	WIIIX
3772710	4894096084053	Wiiix элемент светоотражающий ls-1 #2	300445	Эксплуатация и ремонт автомобилей/Автомобильные принадлежности	3772687	WIIIX
3772711	4894096084060	Wiiix элемент светоотражающий ls-1 #3	300445	Эксплуатация и ремонт автомобилей/Автомобильные принадлежности	3772687	WIIIX
3772712	4894096084206	Wiiix элемент светоотражающий ls-2	300445	Эксплуатация и ремонт автомобилей/Автомобильные принадлежности	3772687	WIIIX
3772713	4894096084404	Wiiix элемент светоотражающий ls-3	300445	Эксплуатация и ремонт автомобилей/Автомобильные принадлежности	3772687	WIIIX
3772714	4894096084909	Wiiix элемент светоотражающий ls-7	300445	Эксплуатация и ремонт автомобилей/Автомобильные принадлежности	3772687	WIIIX
3772715	4894096084916	Wiiix элемент светоотражающий ls-7 #2	300445	Эксплуатация и ремонт автомобилей/Автомобильные принадлежности	3772687	WIIIX
4782548	045496364755	Wiiplay	1	Неклассифицированные/default	0	
4782549	050000000500	Wiiw Game	1	Неклассифицированные/default	0	
2217590	8718053070155	Wijko	1	Неклассифицированные/default	2217589	Wijko
2217591	8718053070209	Wijko #2	1	Неклассифицированные/default	2217589	Wijko
2217592	8718053070254	Wijko #3	1	Неклассифицированные/default	2217589	Wijko
2217593	8718053070285	Wijko #4	1	Неклассифицированные/default	2217589	Wijko
1649046	8710624031480	Wijn avondmaal wijn 750ml	1	Неклассифицированные/default	1649045	WIJN
1649047	3436730002972	Wijn beaujolais-villages 750ml	1	Неклассифицированные/default	1649045	WIJN
1649048	3192371045081	Wijn bergerac Rouge 750ml	1	Неклассифицированные/default	1649045	WIJN
1649049	3263280106535	Wijn bordeaux blanc moelleux 750ml	1	Неклассифицированные/default	1649045	WIJN
1649050	3179071004006	Wijn cotes du ventoux 750ml	1	Неклассифицированные/default	1649045	WIJN
1649051	8710102444443	Wijn gluhwein 1000ml	1	Неклассифицированные/default	1649045	WIJN
1649052	3211209932581	Wijn graves superieur 750ml	1	Неклассифицированные/default	1649045	WIJN
1649053	3176780030746	Wijn muscadet aoc 750ml	1	Неклассифицированные/default	1649045	WIJN
1649054	8710624029951	Wijn Rose d'anjou 750ml	1	Неклассифицированные/default	1649045	WIJN
1649055	4033624032931	Wijn sangria 1500ml	1	Неклассифицированные/default	1649045	WIJN
3772717	046260152806	Wike ginger mar. v 0.1kg	65	Продукты питания (folder)/Консервы (folder)/Консервы овощные	3772716	WIKE (TD URAL'SKIY PRODUKT)
3772718	4631111103890	Wike ginger mar. v 0.1kg #2	65	Продукты питания (folder)/Консервы (folder)/Консервы овощные	3772716	WIKE (TD URAL'SKIY PRODUKT)
3772720	4655299893237	Wike приправа васаби 10г	143343	Продукты питания (folder)/Хрен	3772719	WIKE
1649057	4010142035958	Wikinger Hot dogs	330591	Продукты питания (folder)/Продукты питания	0	
4782550	8711253001202	Wikipedia article http://en.wikipedia.org/wiki/european_article_number	1	Неклассифицированные/default	0	
4782551	732204006037	Wikki stix	1	Неклассифицированные/default	0	
2414311	732204008031	Wikki stix wikki stix orig primary 48-ct wkx803	1	Неклассифицированные/default	2414310	Wikki Stix
2414312	732204008048	Wikki stix wikki stix Original neon 48-ct wkx804	1	Неклассифицированные/default	2414310	Wikki Stix
4782552	4041464000584	Wiko Super glue 2000, hochviskos	1	Неклассифицированные/default	0	
1649058	031400804493	Wil af chopped ham	1	Неклассифицированные/default	0	
1649059	031400714327	Wil af cooked ham	1	Неклассифицированные/default	0	
1649060	031400061049	Wil af roast beef	1	Неклассифицированные/default	0	
4782553	073913017618	Wil banana cmb 5 in vlu pk ast 4ct	1	Неклассифицированные/default	0	
4782554	073913017649	Wil banana comb 7in vlu pk ast 3ct	1	Неклассифицированные/default	0	
4782555	073913497588	Wil bby pns/plstc Box brown 80ct	1	Неклассифицированные/default	0	
4782556	073913029765	Wil brrtt ntrs friends 14ct	1	Неклассифицированные/default	0	
4782557	073913029536	Wil brtte/shll slps asrtd 6ct	1	Неклассифицированные/default	0	
4782558	073913081343	Wil brush fll rnd brst grp-tt 1ct	1	Неклассифицированные/default	0	
4782559	073913084047	Wil brush large fll rnd mld brstl 1ct	1	Неклассифицированные/default	0	
4782560	073913081015	Wil brush/smltd Wood vent 1ct	1	Неклассифицированные/default	0	
4782561	073913077414	Wil cmb/rnbw cont with handle 1ct	1	Неклассифицированные/default	0	
4782562	073913007220	Wil cmb/trtse shell all purpse 1ct	1	Неклассифицированные/default	0	
4782563	073913007206	Wil cmb/trtse shell dresser 1ct	1	Неклассифицированные/default	0	
4782564	073913007855	Wil comb/fmly assorted pack 6ct	1	Неклассифицированные/default	0	
4782565	073913007756	Wil comb/large styler 1ct	1	Неклассифицированные/default	0	
4782566	073913078404	Wil combs poly Pro unbreakable 12ct	1	Неклассифицированные/default	0	
4782567	070922231400	Wil garbage disposal cleanr 6pk 401	1	Неклассифицированные/default	0	
4782568	073913012859	Wil hdwrp knttd assrtd 1ct	1	Неклассифицированные/default	0	
4782569	073913012842	Wil headwrap reversible 2 tone 1ct	1	Неклассифицированные/default	0	
1649061	031400452113	Wil Honey cured ham	1	Неклассифицированные/default	0	
4782570	073913019247	Wil hrbnd/Classic Touch tortse 1ct	1	Неклассифицированные/default	0	
4782571	073913098044	Wil instant hold rollers jumbo 4ct	1	Неклассифицированные/default	0	
4782572	073913098020	Wil instant hold rollers large 5ct	1	Неклассифицированные/default	0	
4782573	073913098037	Wil instant hold rollers x-large 4ct	1	Неклассифицированные/default	0	
1649062	031400060172	Wil isp bf pastrami	1	Неклассифицированные/default	0	
1649063	031400060189	Wil isp corned beef	1	Неклассифицированные/default	0	
1649064	031400062077	Wil isp roast beef	1	Неклассифицированные/default	0	
4782574	218003000006	Wil lite ckd hm 10% 2/15#71335 16oz	1	Неклассифицированные/default	0	
1649066	031400304153	Wil lt hickory ham	1	Неклассифицированные/default	0	
4782575	070922211310	Wil moth balls 5.0oz 1ct	1	Неклассифицированные/default	0	
4782576	073913057911	Wil o bobby pins blk 80ct	1	Неклассифицированные/default	0	
1649068	031400016261	Wil pk/bf smmer saus	1	Неклассифицированные/default	0	
4782577	073913046069	Wil pnytlr/jrsy knit ponywrap 2ct	1	Неклассифицированные/default	0	
4782578	073913069037	Wil pnytlr/large bead gion 6ct	1	Неклассифицированные/default	0	
4782579	073913046038	Wil pnywrp lcy Natural fbr asrtd 1ct	1	Неклассифицированные/default	0	
4782580	215873000006	Wil pre slice pepperoni 2/5# 16oz	1	Неклассифицированные/default	0	
4782581	215665000009	Wil pre-sli genoa 2/5# 4441 16oz	1	Неклассифицированные/default	0	
4782582	215662000002	Wil pre-sli hard sal 2/5# 4445 16oz	1	Неклассифицированные/default	0	
4782583	073913096057	Wil rls/mag w/pin x-large lilac 6ct	1	Неклассифицированные/default	0	
4782584	073913090840	Wil rls/snap-on boufant pink 10ct	1	Неклассифицированные/default	0	
4782585	073913000481	Wil Satin hairdo adj bnnt cap 1ct	1	Неклассифицированные/default	0	
4782586	073913017717	Wil sd comb/ct tortoise w/Gold 2ct	1	Неклассифицированные/default	0	
4782587	053700042580	Wil sl peprn 1ct	1	Неклассифицированные/default	0	
1649069	031400044455	Wil slc hard salami	1	Неклассифицированные/default	0	
1649070	031400049856	Wil smoked sausage	1	Неклассифицированные/default	0	
1649071	031400858373	Wil souse loaf	1	Неклассифицированные/default	0	
4782588	053700052909	Wil st peprn 1ct	1	Неклассифицированные/default	0	
1649072	031400711593	Wil virginia bkd ham	1	Неклассифицированные/default	0	
3772722	720696991634	Wil&mag чай ассам дардж.кен.3x41.6г	21794	Продукты питания (folder)/Чай и кофе/Чай	3772721	WILLIAMSON&MAGOR
1649492	4809012072236	Wil's Oyster sauce	545856	Продукты питания (folder)/Соус	0	
437692	4809012072250	Wil's sweet chilli sauce 330g	545856	Продукты питания (folder)/Соус	0	
4782589	826801846896	Wiland-Bell productions DVD and thou shalt honor...	1	Неклассифицированные/default	0	
4782590	826801846834	Wiland-Bell productions vhs and thou shalt honor...	1	Неклассифицированные/default	0	
1649073	011218611216	Wilbert's Lemon Oil	1	Неклассифицированные/default	0	
4782591	053700012309	Wilbfffranks 1ct	1	Неклассифицированные/default	0	
4782592	030001055846	Wilbur chocolate company 8.42oz quak chewy cookie Cream	1	Неклассифицированные/default	0	
4782593	030001301455	Wilbur chocolate company recon Lemon shipper	1	Неклассифицированные/default	0	
4782594	829567022429	Wilbur wants to kill himself (DVD)	1	Неклассифицированные/default	0	
4782595	014381317725	Wilbur&Baby factory/tanya (DVD)	1	Неклассифицированные/default	0	
3255678	813213003252	Wilbur's of maine all Natural Dark chocolate cranberries	330591	Продукты питания (folder)/Продукты питания	3255677	Wilbur's of maine
3255679	813213003726	Wilbur's of maine all Natural Dark chocolate sugar-n-Spice almonds	330591	Продукты питания (folder)/Продукты питания	3255677	Wilbur's of maine
3255680	813213007540	Wilbur's of maine all Natural pretzel balls, Milk chocolate	330591	Продукты питания (folder)/Продукты питания	3255677	Wilbur's of maine
1174410	037773881697	Wilbur's of maine chocolate confections plastic 16.9oz	1	Неклассифицированные/default	0	
3255681	813213003856	Wilbur's of maine chocolate confections, Dark chocolate, ginger	330591	Продукты питания (folder)/Продукты питания	3255677	Wilbur's of maine
3255682	813213004686	Wilbur's of maine Dark chocolate raisins	330591	Продукты питания (folder)/Продукты питания	3255677	Wilbur's of maine
3255683	813213006604	Wilbur's of maine Milk chocolate raisins	330591	Продукты питания (folder)/Продукты питания	3255677	Wilbur's of maine
2709621	683318814295	Wilburs plastic 16.9floz	1	Неклассифицированные/default	0	
4782596	027616901507	Wilby conspiracy (1975/DVD/ws 1.66/eng-fren-span-sub)	1	Неклассифицированные/default	0	
4782597	616892633020	Wilby wonderful (DVD)	1	Неклассифицированные/default	0	
4782598	070992333813	Wilcats	1	Неклассифицированные/default	0	
2709622	075597954456	Wilco - what's your 20? 2CD CD 795445	4093300	Медиа (folder)/Media	0	
2709623	075597966916	Wilco - yankee hotel foxtrot-vinilo-vinilo 7966911	4093300	Медиа (folder)/Media	0	
1737225	038687653653	Wilco imports bejeweled peace sign wall votive candleholder, 25-1/4-inch by 4-1/2-inch by 14-3/4-inc	1735683	Неклассифицированные/Home	0	
1782147	4600949020129	Wilco кукла дев.тинейдж.кар.4в.	712606	Игрушки (folder)/Куклы	0	
4782599	786311813149	Wilcor international wilderness collection postcard	1	Неклассифицированные/default	0	
4782600	074483510141	Wilcox Family farms 1/2 pint 236ml wilcox vitamin a&d fat free Milk	1	Неклассифицированные/default	0	
3040830	074483901277	Wilcox Family farms 10ct wilcox eggs dino Super jumbo	330591	Продукты питания (folder)/Продукты питания	0	
4782601	074483900997	Wilcox Family farms 12 wilcox Family farms Extra large eggs	1	Неклассифицированные/default	0	
4782602	074483410137	Wilcox Family farms 16oz wilcox Milk chocolate	1	Неклассифицированные/default	0	
4782603	074483410281	Wilcox Family farms 16oz wilcox Milk mocha latt'e	1	Неклассифицированные/default	0	
4782604	074483410274	Wilcox Family farms 16oz wilcox Milk strawberry	1	Неклассифицированные/default	0	
4782605	074483410328	Wilcox Family farms 16oz wilcox Milk vanilla low fat	1	Неклассифицированные/default	0	
4782606	074483110402	Wilcox Family farms 1gal wilcox fat free Milk	1	Неклассифицированные/default	0	
4782607	074483510127	Wilcox Family farms 236ml wilcox 2% Milk	1	Неклассифицированные/default	0	
4782608	074483510455	Wilcox Family farms 236ml wilcox 2% Milk chocolate	1	Неклассифицированные/default	0	
4782609	074483316002	Wilcox Family farms 48oz (1.35kg) cottage Cheese - wilcox Family Farm	1	Неклассифицированные/default	0	
4782610	074483902953	Wilcox Family farms 6ct wilcox eggs 100% Organic brown large	1	Неклассифицированные/default	0	
4782611	074483902908	Wilcox Family farms 6ct wilcox eggs omega 3 fortified brown large	1	Неклассифицированные/default	0	
2675661	074483900881	Wilcox Family farms dozen wilcox eggs AA	142624	Продукты питания (folder)/Яйцо	2386943	Save-a-Lot
4782612	074483510257	Wilcox Family farms wilcox Family farms sour Cream 8oz	1	Неклассифицированные/default	0	
3255684	074483901345	Wilcox Family farms, Organic brown jumbo grade a eggs	330591	Продукты питания (folder)/Продукты питания	0	
3255685	074483902724	Wilcox, 12 large grade AA eggs	330591	Продукты питания (folder)/Продукты питания	0	
3255686	074483990004	Wilcox, Family farms, hard cooked peeled eggs	330591	Продукты питания (folder)/Продукты питания	0	
3255687	074483990011	Wilcox, Organic hard-boiled eggs	330591	Продукты питания (folder)/Продукты питания	0	
3255688	074483990103	Wilcox, Organic hard-cooked eggs	330591	Продукты питания (folder)/Продукты питания	0	
3256453	780994790209	Wild 'n spicy texas-style salsa	330591	Продукты питания (folder)/Продукты питания	0	
4782613	786936724813	Wild (br)	1	Неклассифицированные/default	0	
2414314	4026813280206	Wild *fish sticks 0.18kg	1	Неклассифицированные/default	2414313	WILD
4782614	799615659559	Wild 19	1	Неклассифицированные/default	0	
1835760	8011530995850	Wild 3.4 EDT spr (m) dsquared2	1039	Парфюмерия (folder)/Туалетная вода	973001	Dsquared2
1649074	798028205179	Wild 7s bingo	1	Неклассифицированные/default	0	
3255690	819893023504	Wild about it, gummy candy	330591	Продукты питания (folder)/Продукты питания	0	
668962	022735371118	Wild about Jesus	1	Неклассифицированные/default	0	
4782615	5014503723422	Wild africa	1	Неклассифицированные/default	0	
3772724	6009600220027	Wild africa Cream 0.75l	23975	Продукты питания (folder)/Алкогольные напитки/Ликер	3772723	WILD AFRICA
4782616	628261033294	Wild africa-wildlifes survival of the fittest (DVD/tin/5 disc)	1	Неклассифицированные/default	0	
4782617	206306000007	Wild alas King crablegs (14-17) 16oz	1	Неклассифицированные/default	0	
3255691	728575999597	Wild alaska battered fish fillets	330591	Продукты питания (folder)/Продукты питания	0	
3255692	728575999641	Wild alaska breaded pollock	330591	Продукты питания (folder)/Продукты питания	0	
3255693	826504824061	Wild alaska cod fillets	330591	Продукты питания (folder)/Продукты питания	0	
3255694	826504824795	Wild alaska coho Salmon fillets	330591	Продукты питания (folder)/Продукты питания	0	
3255695	728575999634	Wild alaska crispy panko breaded pollock	330591	Продукты питания (folder)/Продукты питания	0	
3255696	078742046365	Wild alaska flounder	330591	Продукты питания (folder)/Продукты питания	0	
3255697	630557598806	Wild alaska halibut portions	330591	Продукты питания (folder)/Продукты питания	0	
3255698	728575202031	Wild alaska halibut portions #2	330591	Продукты питания (folder)/Продукты питания	0	
3255699	036800143074	Wild alaska keta Salmon fillets	330591	Продукты питания (folder)/Продукты питания	0	
3255700	826504824733	Wild alaska King crab legs&claws	330591	Продукты питания (folder)/Продукты питания	0	
3255701	826504824153	Wild alaska King Salmon fillets	330591	Продукты питания (folder)/Продукты питания	0	
3255702	728575202758	Wild alaska King solmon	330591	Продукты питания (folder)/Продукты питания	0	
3255703	630557610041	Wild alaska marinated sockeye Salmon	330591	Продукты питания (folder)/Продукты питания	0	
3255704	071960005206	Wild alaska pink Salmon	330591	Продукты питания (folder)/Продукты питания	0	
3255705	074445002950	Wild alaska pink Salmon #2	330591	Продукты питания (folder)/Продукты питания	0	
3255706	074445002967	Wild alaska pink Salmon #3	330591	Продукты питания (folder)/Продукты питания	0	
3255707	829696000466	Wild alaska pink Salmon #4	330591	Продукты питания (folder)/Продукты питания	0	
3255708	082318904492	Wild alaska pollock	330591	Продукты питания (folder)/Продукты питания	0	
3255709	858640002843	Wild alaska pollock #2	330591	Продукты питания (folder)/Продукты питания	0	
3255711	086600007786	Wild alaska Red Salmon #2	330591	Продукты питания (folder)/Продукты питания	0	
3255712	826504824412	Wild alaska rockfish fillets	330591	Продукты питания (folder)/Продукты питания	0	
3255713	029714908020	Wild alaska Salmon	330591	Продукты питания (folder)/Продукты питания	0	
3255714	029714908037	Wild alaska Salmon #2	330591	Продукты питания (folder)/Продукты питания	0	
3255715	079300014918	Wild alaska Salmon strips	330591	Продукты питания (folder)/Продукты питания	0	
2671122	072900002156	Wild alaska skinless&boneless pink Salmon	48	Продукты питания (folder)/Рыба и морепродукты (folder)/Консервы рыбные	0	
3255716	826504824689	Wild alaska snow crab legs&claws fully cooked	330591	Продукты питания (folder)/Продукты питания	0	
1455281	048313774041	Wild alaska sockeye smoked Salmon	1	Неклассифицированные/default	0	
3255717	028029369519	Wild alaskan battered halibut	330591	Продукты питания (folder)/Продукты питания	0	
3255718	812410000538	Wild alaskan cod	330591	Продукты питания (folder)/Продукты питания	0	
3255719	854319005573	Wild alaskan cod fillet	330591	Продукты питания (folder)/Продукты питания	0	
