ID	UPCEAN	Name	CategoryID	CategoryName	BrandID	BrandName
3135227	075450016369	Hy-vee southren style sweet tea	330591	Продукты питания (folder)/Продукты питания	2157123	Hy-Vee
3135228	075450016826	Hy-vee southwest trail Mix	330591	Продукты питания (folder)/Продукты питания	2157123	Hy-Vee
3135229	075450041101	Hy-vee southwest trail Mix #2	330591	Продукты питания (folder)/Продукты питания	2157123	Hy-Vee
3135230	075450036435	Hy-vee soy sauce	330591	Продукты питания (folder)/Продукты питания	2157123	Hy-Vee
3135231	075450126969	Hy-vee spaghetti	24086	Продукты питания (folder)/Макароны	2157123	Hy-Vee
3135232	075450041729	Hy-vee spaghetti multigrain pasta	330591	Продукты питания (folder)/Продукты питания	2157123	Hy-Vee
3135233	075450017854	Hy-vee spaghetti rings with meatballs pasta in tomato sauce	330591	Продукты питания (folder)/Продукты питания	2157123	Hy-Vee
3135234	075450122886	Hy-vee spaghetti veggie pasta	330591	Продукты питания (folder)/Продукты питания	2157123	Hy-Vee
3135235	075450017847	Hy-vee spaghetti with meatballs in tomato sauce	330591	Продукты питания (folder)/Продукты питания	2157123	Hy-Vee
3135236	075450063943	Hy-vee sparkling Water Beverage	17388	Продукты питания (folder)/Напитки безалкогольные/Вода питьевая	2157123	Hy-Vee
3135245	075450064193	Hy-vee sparkling Water Beverage #10	17388	Продукты питания (folder)/Напитки безалкогольные/Вода питьевая	2157123	Hy-Vee
3135246	075450167221	Hy-vee sparkling Water Beverage #11	17388	Продукты питания (folder)/Напитки безалкогольные/Вода питьевая	2157123	Hy-Vee
3135247	075450167238	Hy-vee sparkling Water Beverage #12	17388	Продукты питания (folder)/Напитки безалкогольные/Вода питьевая	2157123	Hy-Vee
3135248	075450167245	Hy-vee sparkling Water Beverage #13	17388	Продукты питания (folder)/Напитки безалкогольные/Вода питьевая	2157123	Hy-Vee
3135249	075450167252	Hy-vee sparkling Water Beverage #14	17388	Продукты питания (folder)/Напитки безалкогольные/Вода питьевая	2157123	Hy-Vee
3135250	075450172201	Hy-vee sparkling Water Beverage #15	17388	Продукты питания (folder)/Напитки безалкогольные/Вода питьевая	2157123	Hy-Vee
3135251	075450172218	Hy-vee sparkling Water Beverage #16	17388	Продукты питания (folder)/Напитки безалкогольные/Вода питьевая	2157123	Hy-Vee
3135252	075450172225	Hy-vee sparkling Water Beverage #17	17388	Продукты питания (folder)/Напитки безалкогольные/Вода питьевая	2157123	Hy-Vee
3135253	075450229516	Hy-vee sparkling Water Beverage #18	17388	Продукты питания (folder)/Напитки безалкогольные/Вода питьевая	2157123	Hy-Vee
3135237	075450063974	Hy-vee sparkling Water Beverage #2	17388	Продукты питания (folder)/Напитки безалкогольные/Вода питьевая	2157123	Hy-Vee
3135238	075450063981	Hy-vee sparkling Water Beverage #3	17388	Продукты питания (folder)/Напитки безалкогольные/Вода питьевая	2157123	Hy-Vee
3135239	075450063998	Hy-vee sparkling Water Beverage #4	17388	Продукты питания (folder)/Напитки безалкогольные/Вода питьевая	2157123	Hy-Vee
3135240	075450064124	Hy-vee sparkling Water Beverage #5	17388	Продукты питания (folder)/Напитки безалкогольные/Вода питьевая	2157123	Hy-Vee
3135243	075450064179	Hy-vee sparkling Water Beverage #8	17388	Продукты питания (folder)/Напитки безалкогольные/Вода питьевая	2157123	Hy-Vee
3135244	075450064186	Hy-vee sparkling Water Beverage #9	17388	Продукты питания (folder)/Напитки безалкогольные/Вода питьевая	2157123	Hy-Vee
3135254	075450172232	Hy-vee sparkling Water Beverage, citrus	330591	Продукты питания (folder)/Продукты питания	2157123	Hy-Vee
3135255	075450140088	Hy-vee speculoos cookie Butter	330591	Продукты питания (folder)/Продукты питания	2157123	Hy-Vee
3135256	075450227277	Hy-vee Spice drops	330591	Продукты питания (folder)/Продукты питания	2157123	Hy-Vee
3135257	075450229455	Hy-vee spicy breaded pickle slices	330591	Продукты питания (folder)/Продукты питания	2157123	Hy-Vee
3135258	075450036930	Hy-vee spicy brown mustard	330591	Продукты питания (folder)/Продукты питания	2157123	Hy-Vee
3135259	075450018691	Hy-vee spicy refried beans	330591	Продукты питания (folder)/Продукты питания	2157123	Hy-Vee
2157200	075450016680	Hy-vee spinach 13.5oz	1	Неклассифицированные/default	2157123	Hy-Vee
2157201	075450016666	Hy-vee spinach 7.75oz	1	Неклассифицированные/default	2157123	Hy-Vee
3135260	075450230840	Hy-vee spinach artichoke dip, spinach and artichokes in a creamy sauce	330591	Продукты питания (folder)/Продукты питания	2157123	Hy-Vee
3135261	075450168969	Hy-vee spinach&herb flour tortillas	330591	Продукты питания (folder)/Продукты питания	2157123	Hy-Vee
2805142	075450057317	Hy-vee spiral string Cheese mozzarella Cheese with added cheddar Cheese	1	Неклассифицированные/default	2157123	Hy-Vee
3135262	075450098549	Hy-vee split top enriched bread	330591	Продукты питания (folder)/Продукты питания	2157123	Hy-Vee
3135263	075450140071	Hy-vee Spread	330591	Продукты питания (folder)/Продукты питания	2157123	Hy-Vee
2343872	075450120561	Hy-vee Spring Mix 5oz	2058983	Продукты питания (folder)/Fruits and Vegetables	2157123	Hy-Vee
3135264	075450134858	Hy-vee sprouted brown Rice	330591	Продукты питания (folder)/Продукты питания	2157123	Hy-Vee
3135265	075450134865	Hy-vee sprouted Red Rice	330591	Продукты питания (folder)/Продукты питания	2157123	Hy-Vee
3135266	075450023701	Hy-vee squeezable concord grape jelly	330591	Продукты питания (folder)/Продукты питания	2157123	Hy-Vee
3135267	075450023718	Hy-vee squeezable strawberry Spread	330591	Продукты питания (folder)/Продукты питания	2157123	Hy-Vee
3135268	075450016895	Hy-vee squeezable tartar sauce	330591	Продукты питания (folder)/Продукты питания	2157123	Hy-Vee
3135269	075450021288	Hy-vee squeeze mayonnaise	330591	Продукты питания (folder)/Продукты питания	2157123	Hy-Vee
3135270	075450016888	Hy-vee squeeze whipped dressing	330591	Продукты питания (folder)/Продукты питания	2157123	Hy-Vee
3135271	075450036411	Hy-vee sqyeezable sweet relish	330591	Продукты питания (folder)/Продукты питания	2157123	Hy-Vee
3135272	075450139761	Hy-vee sriracha mayonnaise sandwich Spread	330591	Продукты питания (folder)/Продукты питания	2157123	Hy-Vee
3135273	075450163834	Hy-vee sriracha mustard with sriracha chili sauce	330591	Продукты питания (folder)/Продукты питания	2157123	Hy-Vee
3135274	075450172133	Hy-vee sriracha sauce	330591	Продукты питания (folder)/Продукты питания	2157123	Hy-Vee
3135275	075450163889	Hy-vee sriracha tomato ketchup	330591	Продукты питания (folder)/Продукты питания	2157123	Hy-Vee
3135276	075450129045	Hy-vee steak and egg breakfast Bowl	330591	Продукты питания (folder)/Продукты питания	2157123	Hy-Vee
3135277	075450138597	Hy-vee steak&burger seasoning grinder	330591	Продукты питания (folder)/Продукты питания	2157123	Hy-Vee
2343873	075450131543	Hy-vee steam quick broccoli florets 12oz	2058983	Продукты питания (folder)/Fruits and Vegetables	2157123	Hy-Vee
2157202	075450131611	Hy-vee steam quick cut Golden corn 12oz	1	Неклассифицированные/default	2157123	Hy-Vee
2343874	075450131574	Hy-vee steam quick cut Green beans 12oz	2058983	Продукты питания (folder)/Fruits and Vegetables	2157123	Hy-Vee
2157203	075450131604	Hy-vee steam quick french cut Green beans 12oz	1	Неклассифицированные/default	2157123	Hy-Vee
2157204	075450131581	Hy-vee steam quick mixed vegetables 12oz	1	Неклассифицированные/default	2157123	Hy-Vee
2343875	075450131536	Hy-vee steam quick petite peas 12oz	2058983	Продукты питания (folder)/Fruits and Vegetables	2157123	Hy-Vee
2343876	075450131550	Hy-vee steam quick petite whole Green beans 12oz	2058983	Продукты питания (folder)/Fruits and Vegetables	2157123	Hy-Vee
2157205	075450131598	Hy-vee steam quick sweet peas 12oz	1	Неклассифицированные/default	2157123	Hy-Vee
3135278	075450134353	Hy-vee steamable asian vegetables in a premium citrus sauce	330591	Продукты питания (folder)/Продукты питания	2157123	Hy-Vee
3135279	075450134360	Hy-vee steamable northwest vegetables	330591	Продукты питания (folder)/Продукты питания	2157123	Hy-Vee
2343879	075450131529	Hy-vee steamable supr swt wh corn 12oz	2058983	Продукты питания (folder)/Fruits and Vegetables	2157123	Hy-Vee
3135280	075450134346	Hy-vee steamable vegetable medley	330591	Продукты питания (folder)/Продукты питания	2157123	Hy-Vee
3135281	075450003642	Hy-vee steel cut oats 100% whole grain cereal	330591	Продукты питания (folder)/Продукты питания	2157123	Hy-Vee
2805139	075450136968	Hy-vee stew vegetables with potatoes, carrots, onions&celery	1	Неклассифицированные/default	2157123	Hy-Vee
4429812	075450017489	Hy-vee stewed canned tomatoes	1	Неклассифицированные/default	2157123	Hy-Vee
3135282	075450174632	Hy-vee stewed tomatoes	330591	Продукты питания (folder)/Продукты питания	2157123	Hy-Vee
2343877	075450017397	Hy-vee stewed tomatoes italian style 14.5oz	2058983	Продукты питания (folder)/Fruits and Vegetables	2157123	Hy-Vee
3135283	075450092868	Hy-vee sticks Cheese snacks	330591	Продукты питания (folder)/Продукты питания	2157123	Hy-Vee
3135284	075450136890	Hy-vee stir fry for chow mein	330591	Продукты питания (folder)/Продукты питания	2157123	Hy-Vee
2157163	075450137002	Hy-vee stir fry vegetables with broccoli, sugar snap peas, Green beans, carrots, celery, Water chesnuts, onions&Red peppers	1	Неклассифицированные/default	2157123	Hy-Vee
2343878	075450136845	Hy-vee stir fry w/ sugar snap peas 16oz	2058983	Продукты питания (folder)/Fruits and Vegetables	2157123	Hy-Vee
3135285	075450137033	Hy-vee stir fry with noodles	330591	Продукты питания (folder)/Продукты питания	2157123	Hy-Vee
3135286	075450078459	Hy-vee Stone ground dijon mustard	330591	Продукты питания (folder)/Продукты питания	2157123	Hy-Vee
3135287	075450078473	Hy-vee Stone ground Honey dijon mustard	330591	Продукты питания (folder)/Продукты питания	2157123	Hy-Vee
3135288	075450174243	Hy-vee strawberry Apple sauce	330591	Продукты питания (folder)/Продукты питания	2157123	Hy-Vee
3135289	075450060843	Hy-vee strawberry banana gelatin dessert	330591	Продукты питания (folder)/Продукты питания	2157123	Hy-Vee
3135290	075450137606	Hy-vee strawberry banana smoothie	330591	Продукты питания (folder)/Продукты питания	2157123	Hy-Vee
3135291	075450222401	Hy-vee strawberry cheesecake Ice Cream with strawberry flavored revel and graham crunch	330591	Продукты питания (folder)/Продукты питания	2157123	Hy-Vee
3135292	075450096163	Hy-vee strawberry Cream Cheese Spread	330591	Продукты питания (folder)/Продукты питания	2157123	Hy-Vee
4429813	075450097252	Hy-vee strawberry flavored low fat yogurt 8oz	1	Неклассифицированные/default	2157123	Hy-Vee
3135293	075450227055	Hy-vee strawberry Fruit bar	330591	Продукты питания (folder)/Продукты питания	2157123	Hy-Vee
3135294	075450081473	Hy-vee strawberry Fruit&grain cereal bars	330591	Продукты питания (folder)/Продукты питания	2157123	Hy-Vee
3135295	075450060799	Hy-vee strawberry gelatin dessert	330591	Продукты питания (folder)/Продукты питания	2157123	Hy-Vee
3135296	075450060904	Hy-vee strawberry gelatin dessert #2	330591	Продукты питания (folder)/Продукты питания	2157123	Hy-Vee
3135297	075450228526	Hy-vee strawberry greek strained non fat yogurt	330591	Продукты питания (folder)/Продукты питания	2157123	Hy-Vee
3135298	075450094442	Hy-vee strawberry Ice Cream	330591	Продукты питания (folder)/Продукты питания	2157123	Hy-Vee
3135299	075450102062	Hy-vee strawberry Ice Cream #2	330591	Продукты питания (folder)/Продукты питания	2157123	Hy-Vee
3135300	075450008487	Hy-vee strawberry kiwi flavored Juice drink	330591	Продукты питания (folder)/Продукты питания	2157123	Hy-Vee
3135301	075450163872	Hy-vee strawberry lemonade flavored sparkling Water Beverage	330591	Продукты питания (folder)/Продукты питания	2157123	Hy-Vee
3135302	075450174007	Hy-vee strawberry muffin Mix	330591	Продукты питания (folder)/Продукты питания	2157123	Hy-Vee
3135303	075450006186	Hy-vee strawberry pie filling or topping	330591	Продукты питания (folder)/Продукты питания	2157123	Hy-Vee
3135304	075450030051	Hy-vee strawberry preserves	330591	Продукты питания (folder)/Продукты питания	2157123	Hy-Vee
3135305	075450173758	Hy-vee strawberry preserves #2	330591	Продукты питания (folder)/Продукты питания	2157123	Hy-Vee
3135306	075450100181	Hy-vee strawberry shortcake and banana Ice creams with strawberries and cake pieces	330591	Продукты питания (folder)/Продукты питания	2157123	Hy-Vee
3135307	075450002157	Hy-vee strawberry toaster pastries	330591	Продукты питания (folder)/Продукты питания	2157123	Hy-Vee
3135308	075450230796	Hy-vee strawberry vanilla frozen greek yogurt bars	330591	Продукты питания (folder)/Продукты питания	2157123	Hy-Vee
3135309	075450076738	Hy-vee strawberry vanilla Ice Cream sandwiches	330591	Продукты питания (folder)/Продукты питания	2157123	Hy-Vee
3135310	075450094183	Hy-vee string Cheese	330591	Продукты питания (folder)/Продукты питания	2157123	Hy-Vee
2805140	075450127218	Hy-vee string Cheese 16oz	1	Неклассифицированные/default	2157123	Hy-Vee
3135311	075450037210	Hy-vee stuffed with minced pimiento queens olives	330591	Продукты питания (folder)/Продукты питания	2157123	Hy-Vee
3135312	075450068818	Hy-vee stuffing Mix	330591	Продукты питания (folder)/Продукты питания	2157123	Hy-Vee
3135313	075450163537	Hy-vee sugar free hard candy	330591	Продукты питания (folder)/Продукты питания	2157123	Hy-Vee
3135314	075450163568	Hy-vee sugar free hard candy, caramel creme	330591	Продукты питания (folder)/Продукты питания	2157123	Hy-Vee
3135315	075450163544	Hy-vee sugar free hard candy, cinnamon	330591	Продукты питания (folder)/Продукты питания	2157123	Hy-Vee
3135316	075450060867	Hy-vee sugar free Lime gelatin dessert	330591	Продукты питания (folder)/Продукты питания	2157123	Hy-Vee
3135317	075450163551	Hy-vee sugar free peppermint hard candy	330591	Продукты питания (folder)/Продукты питания	2157123	Hy-Vee
3135318	075450062151	Hy-vee sugar free, low calorie drink Mix	330591	Продукты питания (folder)/Продукты питания	2157123	Hy-Vee
3135319	075450101355	Hy-vee summer sausage	330591	Продукты питания (folder)/Продукты питания	2157123	Hy-Vee
3135320	075450101362	Hy-vee summer sausage #2	330591	Продукты питания (folder)/Продукты питания	2157123	Hy-Vee
3135321	075450102390	Hy-vee summer sausage #3	330591	Продукты питания (folder)/Продукты питания	2157123	Hy-Vee
3135322	075450102413	Hy-vee summer sausage #4	330591	Продукты питания (folder)/Продукты питания	2157123	Hy-Vee
3135323	075450079296	Hy-vee sunflower kernels	330591	Продукты питания (folder)/Продукты питания	2157123	Hy-Vee
3135324	075450152982	Hy-vee sunflower kernels #2	330591	Продукты питания (folder)/Продукты питания	2157123	Hy-Vee
3135325	075450079364	Hy-vee sunflower kernels roasted&salted	330591	Продукты питания (folder)/Продукты питания	2157123	Hy-Vee
3135326	075450132922	Hy-vee sunflower seeds	330591	Продукты питания (folder)/Продукты питания	2157123	Hy-Vee
3135327	075450089783	Hy-vee Super sweet White and Gold corn	330591	Продукты питания (folder)/Продукты питания	2157123	Hy-Vee
3135328	075450162707	Hy-vee supreme pizza	330591	Продукты питания (folder)/Продукты питания	2157123	Hy-Vee
3135329	075450152838	Hy-vee swai fillets	330591	Продукты питания (folder)/Продукты питания	2157123	Hy-Vee
3135330	075450106107	Hy-vee sweet cinnamon Spice Herbal tea	330591	Продукты питания (folder)/Продукты питания	2157123	Hy-Vee
3135331	075450085167	Hy-vee sweet Cream Butter	330591	Продукты питания (folder)/Продукты питания	2157123	Hy-Vee
3135332	075450085143	Hy-vee sweet Cream salted Butter	330591	Продукты питания (folder)/Продукты питания	2157123	Hy-Vee
3135333	075450085112	Hy-vee sweet Cream spreadable Butter with canola Oil	330591	Продукты питания (folder)/Продукты питания	2157123	Hy-Vee
3135334	075450085136	Hy-vee sweet Cream spreadable Butter with canola Oil #2	330591	Продукты питания (folder)/Продукты питания	2157123	Hy-Vee
3135335	075450085181	Hy-vee sweet Cream whipped Butter	330591	Продукты питания (folder)/Продукты питания	2157123	Hy-Vee
3135336	075450015270	Hy-vee sweet peas	330591	Продукты питания (folder)/Продукты питания	2157123	Hy-Vee
3135337	075450174151	Hy-vee sweet peas #2	330591	Продукты питания (folder)/Продукты питания	2157123	Hy-Vee
2343880	075450015461	Hy-vee sweet peas 15oz	2058983	Продукты питания (folder)/Fruits and Vegetables	2157123	Hy-Vee
2343881	075450015423	Hy-vee sweet peas 8.5oz	2058983	Продукты питания (folder)/Fruits and Vegetables	2157123	Hy-Vee
2343882	075450015324	Hy-vee sweet peas no salt 15oz	2058983	Продукты питания (folder)/Fruits and Vegetables	2157123	Hy-Vee
3135338	075450137415	Hy-vee sweet potato popped potato crisps	330591	Продукты питания (folder)/Продукты питания	2157123	Hy-Vee
3135339	075450036756	Hy-vee sweet relish	330591	Продукты питания (folder)/Продукты питания	2157123	Hy-Vee
3135340	075450098983	Hy-vee sweet smoked bacon	330591	Продукты питания (folder)/Продукты питания	2157123	Hy-Vee
3135341	075450099003	Hy-vee sweet smoked bacon #2	330591	Продукты питания (folder)/Продукты питания	2157123	Hy-Vee
3135342	075450036947	Hy-vee sweet whole gherkins	330591	Продукты питания (folder)/Продукты питания	2157123	Hy-Vee
3135343	075450036985	Hy-vee sweet whole pickles	330591	Продукты питания (folder)/Продукты питания	2157123	Hy-Vee
3135344	075450036329	Hy-vee sweet&Hot mustard	330591	Продукты питания (folder)/Продукты питания	2157123	Hy-Vee
3135345	075450229004	Hy-vee sweet&salty cashew chewy granola bars	330591	Продукты питания (folder)/Продукты питания	2157123	Hy-Vee
3135346	075450013269	Hy-vee sweet&sour sauce	330591	Продукты питания (folder)/Продукты питания	2157123	Hy-Vee
3135347	075450060652	Hy-vee sweetened Coconut flakes	330591	Продукты питания (folder)/Продукты питания	2157123	Hy-Vee
3135348	075450060669	Hy-vee sweetened Coconut flakes #2	330591	Продукты питания (folder)/Продукты питания	2157123	Hy-Vee
3135349	075450022889	Hy-vee sweetened condensed Milk	330591	Продукты питания (folder)/Продукты питания	2157123	Hy-Vee
3135350	075450050295	Hy-vee sweetened corn&oat cereal	330591	Продукты питания (folder)/Продукты питания	2157123	Hy-Vee
3135351	075450041156	Hy-vee sweetened dried Fruit	330591	Продукты питания (folder)/Продукты питания	2157123	Hy-Vee
3135352	075450041255	Hy-vee sweetened dried Fruit #2	330591	Продукты питания (folder)/Продукты питания	2157123	Hy-Vee
3135353	075450227536	Hy-vee sweetened Fruit cocktail packed in Water	330591	Продукты питания (folder)/Продукты питания	2157123	Hy-Vee
3135354	075450176650	Hy-vee sweetened Ice tea	330591	Продукты питания (folder)/Продукты питания	2157123	Hy-Vee
3135355	075450135718	Hy-vee sweetened multigrain cereal	330591	Продукты питания (folder)/Продукты питания	2157123	Hy-Vee
3135356	075450061390	Hy-vee sweetened oat cereal with marshmallows	330591	Продукты питания (folder)/Продукты питания	2157123	Hy-Vee
3135357	075450050288	Hy-vee sweetened Rice cereal	330591	Продукты питания (folder)/Продукты питания	2157123	Hy-Vee
2805143	075450093131	Hy-vee swiss block 16oz	1	Неклассифицированные/default	2157123	Hy-Vee
2805144	075450062496	Hy-vee swiss Cheese block 8oz	1	Неклассифицированные/default	2157123	Hy-Vee
3135358	075450132748	Hy-vee swiss Cheese slices	330591	Продукты питания (folder)/Продукты питания	2157123	Hy-Vee
3135359	075450127515	Hy-vee swiss Natural Cheese	330591	Продукты питания (folder)/Продукты питания	2157123	Hy-Vee
3135360	075450093391	Hy-vee swiss pasteurized process Cheese product	330591	Продукты питания (folder)/Продукты питания	2157123	Hy-Vee
3135361	075450061239	Hy-vee syrup	330591	Продукты питания (folder)/Продукты питания	2157123	Hy-Vee
3135362	075450061246	Hy-vee syrup #2	330591	Продукты питания (folder)/Продукты питания	2157123	Hy-Vee
3135363	075450061277	Hy-vee syrup #3	330591	Продукты питания (folder)/Продукты питания	2157123	Hy-Vee
3135364	075450018219	Hy-vee taco sauce	330591	Продукты питания (folder)/Продукты питания	2157123	Hy-Vee
3135365	075450018172	Hy-vee taco shells	330591	Продукты питания (folder)/Продукты питания	2157123	Hy-Vee
3135366	075450018189	Hy-vee taco shells #2	330591	Продукты питания (folder)/Продукты питания	2157123	Hy-Vee
3135367	075450173680	Hy-vee taco shells #3	330591	Продукты питания (folder)/Продукты питания	2157123	Hy-Vee
3135368	075450134186	Hy-vee take&bake artisan, asiago garlic	330591	Продукты питания (folder)/Продукты питания	2157123	Hy-Vee
3135369	075450126600	Hy-vee tapioca pudding cups	330591	Продукты питания (folder)/Продукты питания	2157123	Hy-Vee
2805145	075450169454	Hy-vee tasteeos 12oz	1	Неклассифицированные/default	0	
2343884	075450074260	Hy-vee tasteeos toasted oat cereal 14oz	24389	Продукты питания (folder)/Каши, хлопья, сухие завтраки	2157123	Hy-Vee
2805146	075450081879	Hy-vee tasteeos toasted oat cereal 15oz	1	Неклассифицированные/default	0	
3135370	075450149593	Hy-vee tender pasta stuffed with ricotta&romano cheeses	330591	Продукты питания (folder)/Продукты питания	2157123	Hy-Vee
4429814	260008702898	Hy-vee tenderloin buns, 6 count	1	Неклассифицированные/default	2157123	Hy-Vee
3135371	075450003628	Hy-vee teriyaki beef jerky	330591	Продукты питания (folder)/Продукты питания	2157123	Hy-Vee
