ID	UPCEAN	Name	CategoryID	CategoryName	BrandID	BrandName
4735132	071720434505	Tootsie roll junior caramels 4.5oz	1	Неклассифицированные/default	0	
1652477	071720530702	Tootsie roll junior mints	1	Неклассифицированные/default	661246	Tootsie
1459951	071720530818	Tootsie roll junior mints #2	1	Неклассифицированные/default	661246	Tootsie
1629602	071720009345	Tootsie roll King size 3oz	1	Неклассифицированные/default	661246	Tootsie
2404873	847311070502	Tootsie roll kitchen towel pothilder set	1	Неклассифицированные/default	0	
3242801	071720615164	Tootsie roll lollipops	330591	Продукты питания (folder)/Продукты питания	661246	Tootsie
4735133	071724500084	Tootsie roll mason dots 8.5oz	1	Неклассифицированные/default	0	
1629614	071720006269	Tootsie roll mega Mix sup 23.5	1	Неклассифицированные/default	661246	Tootsie
1156244	062851526085	Tootsie roll midge	1	Неклассифицированные/default	0	
1629616	077449498026	Tootsie roll midgees #2	1	Неклассифицированные/default	0	
2697631	071720416228	Tootsie roll midgees #4	1	Неклассифицированные/default	2697624	Tootsie Roll
3242802	713733107884	Tootsie roll midgees #5	330591	Продукты питания (folder)/Продукты питания	2564409	Meijer
3242803	041497132560	Tootsie roll midgees #6	330591	Продукты питания (folder)/Продукты питания	3001562	Weis
3242804	023637461532	Tootsie roll midgees #7	330591	Продукты питания (folder)/Продукты питания	0	
3242734	071720002179	Tootsie roll midgees 13.8oz	330591	Продукты питания (folder)/Продукты питания	661246	Tootsie
661258	071720078068	Tootsie roll midgees 360 piece 110986	1	Неклассифицированные/default	661246	Tootsie
4735134	071720008775	Tootsie roll midgees 760ct 5lb (80oz) (2.27kg.) 80oz	1	Неклассифицированные/default	0	
1629615	071720006115	Tootsie roll midgees bag 12oz	1	Неклассифицированные/default	661246	Tootsie
3242805	071720052174	Tootsie roll midgees candy	330591	Продукты питания (folder)/Продукты питания	661246	Tootsie
4735135	071720006238	Tootsie roll midgees dot 16oz	1	Неклассифицированные/default	0	
1629613	071720009420	Tootsie roll midgees King 3.73	1	Неклассифицированные/default	661246	Tootsie
2697632	071720006634	Tootsie roll midgees vanilla flavored limited edition	1	Неклассифицированные/default	2697624	Tootsie Roll
3242807	071720552704	Tootsie roll midgees, candy	330591	Продукты питания (folder)/Продукты питания	661246	Tootsie
3242808	071720416167	Tootsie roll midgees, chocolatey holiday	330591	Продукты питания (folder)/Продукты питания	661246	Tootsie
3761990	071720060513	Tootsie roll Mini bites 5.5oz	1	Неклассифицированные/default	0	
3761991	071720060537	Tootsie roll Mini Fruit bites 6oz	1	Неклассифицированные/default	0	
4735136	071720059555	Tootsie roll movietime Mini bx 23.8oz	1	Неклассифицированные/default	0	
4735137	071720005958	Tootsie roll movietime Mini bx 23.8oz 12ct	1	Неклассифицированные/default	0	
4735138	071720010785	Tootsie roll pallet display 1ct	1	Неклассифицированные/default	0	
661261	07172746	Tootsie roll pop 17g	1	Неклассифицированные/default	661246	Tootsie
661262	071720015803	Tootsie roll pop bunch display	1	Неклассифицированные/default	661246	Tootsie
4735139	071720007280	Tootsie roll pop mins holiday 17.8oz	1	Неклассифицированные/default	0	
2404874	847311070427	Tootsie roll pop oven mitt potholder set	1	Неклассифицированные/default	0	
4735140	071720007822	Tootsie roll pop val bag 22.5oz	1	Неклассифицированные/default	0	
3242809	071720009796	Tootsie roll pops #2	330591	Продукты питания (folder)/Продукты питания	661246	Tootsie
3242810	071720077696	Tootsie roll pops #3	330591	Продукты питания (folder)/Продукты питания	661246	Tootsie
1629617	071720007693	Tootsie roll pops - assorted flavors	1	Неклассифицированные/default	661246	Tootsie
4735141	071720007808	Tootsie roll pops 13.20oz 12ct	1	Неклассифицированные/default	0	
3242789	071720015100	Tootsie roll pops 272g	330591	Продукты питания (folder)/Продукты питания	661246	Tootsie
4735142	071720007525	Tootsie roll pops 28.66oz	1	Неклассифицированные/default	0	
1497148	071720007792	Tootsie roll pops assorted flavors	1	Неклассифицированные/default	661246	Tootsie
1629618	15420756	Tootsie roll pops asst	1	Неклассифицированные/default	0	
4735143	071720408131	Tootsie roll pops bns 11.64oz	1	Неклассифицированные/default	0	
4735144	071214081352	Tootsie roll pops bns 11.64oz #2	1	Неклассифицированные/default	0	
4735145	071720007174	Tootsie roll pops bns 11.64oz 24ct	1	Неклассифицированные/default	0	
4735146	071210071784	Tootsie roll pops bns 11.64oz 24ct #2	1	Неклассифицированные/default	0	
1652480	071720007716	Tootsie roll pops seasonal	1	Неклассифицированные/default	661246	Tootsie
3242811	071720357477	Tootsie roll pops, assorted	330591	Продукты питания (folder)/Продукты питания	661246	Tootsie
3242812	071720548523	Tootsie roll pops, assorted #2	330591	Продукты питания (folder)/Продукты питания	661246	Tootsie
1156242	062851526900	Tootsie roll re-usable bank 184g	1	Неклассифицированные/default	0	
3242813	071720036938	Tootsie roll re-usable bank filled with bite size midgees	330591	Продукты питания (folder)/Продукты питания	661246	Tootsie
1459953	071720007105	Tootsie roll re-usable bank filled with bite size midgees 5oz	1	Неклассифицированные/default	661246	Tootsie
4735147	071720018583	Tootsie roll snack bag 60ct 31.02oz	1	Неклассифицированные/default	0	
4735148	071720006962	Tootsie roll snack bars 14.5oz 12ct	1	Неклассифицированные/default	0	
1497147	071720006986	Tootsie roll snack bars 15oz	1	Неклассифицированные/default	661246	Tootsie
4735149	071720003909	Tootsie roll snack size 10-pack 5oz	1	Неклассифицированные/default	0	
1459956	071720006887	Tootsie roll snk #2	1	Неклассифицированные/default	661246	Tootsie
3242814	071720547526	Tootsie roll tootsie pop, lollipop, assorted	330591	Продукты питания (folder)/Продукты питания	661246	Tootsie
4735150	071720011072	Tootsie roll twin bar pack 2oz	1	Неклассифицированные/default	0	
4735151	071720006825	Tootsie roll val mdgee b 25oz	1	Неклассифицированные/default	0	
4735152	071720006252	Tootsie roll van midgee 15oz	1	Неклассифицированные/default	0	
4735153	071720006610	Tootsie roll vanilla midgee 12oz	1	Неклассифицированные/default	0	
1497149	071720008584	Tootsie roll variety snkba	1	Неклассифицированные/default	661246	Tootsie
2210475	091141406042	Tootsie roll, chocolate, low-fat, individually wrapped, 17-ounce bowls	1	Неклассифицированные/default	0	
3242815	810683022172	Tootsie roll, premium Hot cocoa	330591	Продукты питания (folder)/Продукты питания	0	
3242816	071720036969	Tootsie roll, re-usable bank filled with bite size midgees	330591	Продукты питания (folder)/Продукты питания	661246	Tootsie
1459952	071720006993	Tootsie roll, re-usable bank filled with tootsie snack bars 12oz	1	Неклассифицированные/default	661246	Tootsie
4735154	071720002599	Tootsie rolls	1	Неклассифицированные/default	0	
4735155	071720005880	Tootsie rolls #2	1	Неклассифицированные/default	0	
4735156	071720080931	Tootsie rolls #3	1	Неклассифицированные/default	0	
661268	071720009314	Tootsie rolls 36 ct 2.25oz	1	Неклассифицированные/default	661246	Tootsie
4735157	071720008010	Tootsie rolls grape 480ct	1	Неклассифицированные/default	0	
4735158	011000007920	Tootsie rolls in a can	1	Неклассифицированные/default	0	
3242806	071720416259	Tootsie rolls vanilla flavored midgees 12oz	330591	Продукты питания (folder)/Продукты питания	661246	Tootsie
4735159	071720447345	Tootsie rool	1	Неклассифицированные/default	0	
4735160	071720003480	Tootsie shpr 1cs bbunch pop * 1ct	1	Неклассифицированные/default	0	
4735161	071720006702	Tootsie snack valentin 12oz	1	Неклассифицированные/default	0	
3242817	071720534939	Tootsie Soft caramels covered in Milk chocolate	330591	Продукты питания (folder)/Продукты питания	661246	Tootsie
3242818	071720870068	Tootsie sour dots candy, grape, Orange, Lemon, Green Apple&Cherry	330591	Продукты питания (folder)/Продукты питания	661246	Tootsie
661264	071720850060	Tootsie sour dots theater Box 7oz	1	Неклассифицированные/default	661246	Tootsie
1629620	071720787908	Tootsie spy stix pop	1	Неклассифицированные/default	661246	Tootsie
661265	071720531204	Tootsie strawberry charleston chew 1.88oz	1	Неклассифицированные/default	661246	Tootsie
4735162	070908028673	Tootsie street cycle 1ct	1	Неклассифицированные/default	0	
4735163	071720007051	Tootsie strs&stripes shpr 5oz	1	Неклассифицированные/default	0	
4735164	071720007112	Tootsie strs&stripes shpr 5oz 96ct	1	Неклассифицированные/default	0	
1626736	071720850022	Tootsie thtr dots	1	Неклассифицированные/default	661246	Tootsie
1545344	070908001034	Tootsie toy - mr.bubbles bubbles with wand 8oz	1	Неклассифицированные/default	0	
4735165	070908084259	Tootsie toy animal bubble wand	1	Неклассифицированные/default	0	
4735166	070908001713	Tootsie toy bubble pinwheel	1	Неклассифицированные/default	0	
4735167	070908001744	Tootsie toy bubble plunger	1	Неклассифицированные/default	0	
4735168	070908084242	Tootsie toy Easy needle point	1	Неклассифицированные/default	0	
4735169	070908004080	Tootsie toy elmos bubble boat	1	Неклассифицированные/default	0	
4735170	070908006862	Tootsie toy giant bubble set asst 4	1	Неклассифицированные/default	0	
4735171	070908074267	Tootsie toy gun set	1	Неклассифицированные/default	0	
4735172	070908001614	Tootsie toy lotsa ways bubble ast	1	Неклассифицированные/default	0	
4735173	070908043010	Tootsie toy mcky bth tm bubbl rg	1	Неклассифицированные/default	0	
4735174	070908036500	Tootsie toy mega mtrzd dmp trck	1	Неклассифицированные/default	0	
4735175	070908001799	Tootsie toy mickeys big bble wand	1	Неклассифицированные/default	0	
4735176	070908001355	Tootsie toy mr.bubbles flr dsply	1	Неклассифицированные/default	0	
4735177	070908001447	Tootsie toy mr.bubbles flr dsply #2	1	Неклассифицированные/default	0	
4735178	070908001607	Tootsie toy mr.bubbles flr dsply #3	1	Неклассифицированные/default	0	
4735179	070908084341	Tootsie toy musical friends	1	Неклассифицированные/default	0	
4735180	070908004103	Tootsie toy sesame st bbl tub ast 2	1	Неклассифицированные/default	0	
4735181	070908033523	Tootsie toy spcl toy as pwr panel	1	Неклассифицированные/default	0	
4735182	070908033530	Tootsie toy spcl toy as pwr panel #2	1	Неклассифицированные/default	0	
4735183	070908033547	Tootsie toy spcl toy as pwr panel #3	1	Неклассифицированные/default	0	
4735184	070908033554	Tootsie toy spcl toy as pwr panel #4	1	Неклассифицированные/default	0	
4735185	070908103202	Tootsie toy table for four	1	Неклассифицированные/default	0	
4735186	070908001003	Tootsie toy wonder bubbles 4oz	1	Неклассифицированные/default	0	
4735187	070908001010	Tootsie toy wonder bubbles 4oz #2	1	Неклассифицированные/default	0	
4735188	070908001027	Tootsie toy wonder bubbles 8oz	1	Неклассифицированные/default	0	
4735189	070908084280	Tootsie toy yo-yo 1ct	1	Неклассифицированные/default	0	
4735190	071720025741	Tootsie treat pops	1	Неклассифицированные/default	0	
1632852	071720050019	Tootsie trp dots 9oz	1	Неклассифицированные/default	661246	Tootsie
3242819	071720397824	Tootsie valentine pops	330591	Продукты питания (folder)/Продукты питания	661246	Tootsie
661269	071720531303	Tootsie vanilla charleston chew 1.88oz	1	Неклассифицированные/default	661246	Tootsie
1629597	071720000076	Tootsie Wild berry pops	1	Неклассифицированные/default	661246	Tootsie
1947797	071720304259	Tootsie Wild berry pops 0.6oz	1	Неклассифицированные/default	661246	Tootsie
1650647	071720050026	Tootsie wld bry dots 9oz	1	Неклассифицированные/default	661246	Tootsie
4735191	071720850053	Tootsie yogurt dots 7.5oz	1	Неклассифицированные/default	0	
4735192	043396191716	Tootsie-25th anniversary edition (DVD/ws 2.40 a/5.0/5.1/mono/eng-sub/fr-bot	1	Неклассифицированные/default	0	
4735193	071720007198	Tootsieroll pops	1	Неклассифицированные/default	0	
4735194	032031172890	Tootsies orchid lounge (DVD)	1	Неклассифицированные/default	0	
4735195	070908001133	Tootsietoy bubbles 64oz	1	Неклассифицированные/default	0	
4735196	070908048466	Tootsietoy colored Wood blocks	1	Неклассифицированные/default	0	
4735197	070908040460	Tootsietoy colored wooden blocks	1	Неклассифицированные/default	0	
4735198	077897006996	Tootsietoy hdbdy	1	Неклассифицированные/default	0	
4735199	071720717233	Tootsy roll bunch pops 3.1oz	1	Неклассифицированные/default	0	
4735200	9771321787048	Toowoomba chrn wday	1	Неклассифицированные/default	0	
4735201	080264027340	Top	1	Неклассифицированные/default	0	
4735202	884485446818	Top #2	1	Неклассифицированные/default	0	
3761993	4810168010133	Top (sp Santa bremor) bilber.jam ws 0.07kg	30752	Продукты питания (folder)/Мороженое	3761992	TOP (SP SANTA BREMOR/BREST)
3761994	4810168015985	Top (sp Santa bremor) strawberry ws 0.07kg	30752	Продукты питания (folder)/Мороженое	3761992	TOP (SP SANTA BREMOR/BREST)
4735203	6908714100280	Top 10 famous chinese tea	1	Неклассифицированные/default	0	
4735204	778399990607	Top 10 great kid's arcade games 89g	1	Неклассифицированные/default	0	
4735205	96618066	Top 10 job flyers (50ct) 50ct	1	Неклассифицированные/default	0	
4735206	96618134	Top 10 job poster (1ct)	1	Неклассифицированные/default	0	
4735207	4043002190337	Top 100 classics	1	Неклассифицированные/default	0	
4735208	829727132425	Top 100 toddler learning sogns	1	Неклассифицированные/default	0	
2210476	077170260084	Top 100mm strong bx cig.case 12'	1	Неклассифицированные/default	0	
2210479	079245241325	Top 2 bottom, 9мл, базовое и верхн покрытие 44132 #2	461	Косметика (folder)/Маникюр и педикюр (folder)/Маникюр и педикюр	35802	ORLY
4735209	779994820009	Top 2000 pain control Cream 100ml	1	Неклассифицированные/default	0	
1629622	17023610	Top 236, светильник подвесной/накладной с зеркальной параболической решеткой световые технологии	1	Неклассифицированные/default	0	
4735210	796401201107	Top 25 Adult stars of all time	1	Неклассифицированные/default	0	
4735211	738597183690	Top 25 praise songs (DVD/2 disc/various artists)	1	Неклассифицированные/default	0	
4735212	738597189029	Top 25-Modern praise&worship (DVD)	1	Неклассифицированные/default	0	
4735213	803355486389	Top 30 30-minute meals: Comfort Food - rachael ray	1	Неклассифицированные/default	0	
2697633	9788096996919	Top 37 zien slovenska in	3300794	Полиграфия (folder)/Периодические издания	0	
1629623	8888300303012	Top 3l	163	Хозяйственные товары (folder)/Бытовая химия (folder)/Средство для стирки	0	
1629968	036800187207	Top 3x3 steril pad 25ct	1	Неклассифицированные/default	1629630	Top Care
1629624	4809011825109	Top 40 hits song magazine	3300794	Полиграфия (folder)/Периодические издания	0	
4735214	731975061429	Top 4inch sq. bottom 2inch sq. transparent Blue glass vase	1	Неклассифицированные/default	0	
1629625	771704692722	Top 6oz can 1 ea	1	Неклассифицированные/default	0	
4735215	036800670525	Top a Baby Powder 4oz	1	Неклассифицированные/default	0	
4735216	036800096295	Top a Day/nite combo 10oz	1	Неклассифицированные/default	0	
4735217	075755411265	Top a legal yel 8x14 50ct	1	Неклассифицированные/default	0	
430654	4017505134778	Top Acryl synthetic bristle Long handle Bright 10	349745	Товары для творчества (folder)/Живопись и рисования (folder)/Кисть художественная	0	
430655	4017505134785	Top Acryl synthetic bristle Long handle Bright 12	349745	Товары для творчества (folder)/Живопись и рисования (folder)/Кисть художественная	0	
430656	4017505134792	Top Acryl synthetic bristle Long handle Bright 14	349745	Товары для творчества (folder)/Живопись и рисования (folder)/Кисть художественная	0	
430657	4017505134808	Top Acryl synthetic bristle Long handle Bright 16	349745	Товары для творчества (folder)/Живопись и рисования (folder)/Кисть художественная	0	
430658	4017505134815	Top Acryl synthetic bristle Long handle Bright 18	349745	Товары для творчества (folder)/Живопись и рисования (folder)/Кисть художественная	0	
430659	4017505134730	Top Acryl synthetic bristle Long handle Bright 2	349745	Товары для творчества (folder)/Живопись и рисования (folder)/Кисть художественная	0	
430660	4017505134822	Top Acryl synthetic bristle Long handle Bright 20	349745	Товары для творчества (folder)/Живопись и рисования (folder)/Кисть художественная	0	
430661	4017505134839	Top Acryl synthetic bristle Long handle Bright 22	349745	Товары для творчества (folder)/Живопись и рисования (folder)/Кисть художественная	0	
430662	4017505134846	Top Acryl synthetic bristle Long handle Bright 24	349745	Товары для творчества (folder)/Живопись и рисования (folder)/Кисть художественная	0	
430663	4017505134853	Top Acryl synthetic bristle Long handle Bright 26	349745	Товары для творчества (folder)/Живопись и рисования (folder)/Кисть художественная	0	
430664	4017505134860	Top Acryl synthetic bristle Long handle Bright 28	349745	Товары для творчества (folder)/Живопись и рисования (folder)/Кисть художественная	0	
430665	4017505134877	Top Acryl synthetic bristle Long handle Bright 30	349745	Товары для творчества (folder)/Живопись и рисования (folder)/Кисть художественная	0	
430666	4017505134884	Top Acryl synthetic bristle Long handle Bright 35	349745	Товары для творчества (folder)/Живопись и рисования (folder)/Кисть художественная	0	
430667	4017505134747	Top Acryl synthetic bristle Long handle Bright 4	349745	Товары для творчества (folder)/Живопись и рисования (folder)/Кисть художественная	0	
430668	4017505134891	Top Acryl synthetic bristle Long handle Bright 40	349745	Товары для творчества (folder)/Живопись и рисования (folder)/Кисть художественная	0	
430669	4017505134907	Top Acryl synthetic bristle Long handle Bright 50	349745	Товары для творчества (folder)/Живопись и рисования (folder)/Кисть художественная	0	
430670	4017505134754	Top Acryl synthetic bristle Long handle Bright 6	349745	Товары для творчества (folder)/Живопись и рисования (folder)/Кисть художественная	0	
430671	4017505134761	Top Acryl synthetic bristle Long handle Bright 8	349745	Товары для творчества (folder)/Живопись и рисования (folder)/Кисть художественная	0	
430672	4017505202668	Top Acryl synthetic bristle Long handle filbert 10	349745	Товары для творчества (folder)/Живопись и рисования (folder)/Кисть художественная	0	
430673	4017505202675	Top Acryl synthetic bristle Long handle filbert 12	349745	Товары для творчества (folder)/Живопись и рисования (folder)/Кисть художественная	0	
430674	4017505202682	Top Acryl synthetic bristle Long handle filbert 14	349745	Товары для творчества (folder)/Живопись и рисования (folder)/Кисть художественная	0	
430675	4017505202699	Top Acryl synthetic bristle Long handle filbert 16	349745	Товары для творчества (folder)/Живопись и рисования (folder)/Кисть художественная	0	
430676	4017505202705	Top Acryl synthetic bristle Long handle filbert 20	349745	Товары для творчества (folder)/Живопись и рисования (folder)/Кисть художественная	0	
430677	4017505202712	Top Acryl synthetic bristle Long handle filbert 24	349745	Товары для творчества (folder)/Живопись и рисования (folder)/Кисть художественная	0	
430678	4017505202729	Top Acryl synthetic bristle Long handle filbert 30	349745	Товары для творчества (folder)/Живопись и рисования (folder)/Кисть художественная	0	
430679	4017505202743	Top Acryl synthetic bristle Long handle filbert 4	349745	Товары для творчества (folder)/Живопись и рисования (folder)/Кисть художественная	0	
430680	4017505202644	Top Acryl synthetic bristle Long handle filbert 6	349745	Товары для творчества (folder)/Живопись и рисования (folder)/Кисть художественная	0	
430681	4017505202651	Top Acryl synthetic bristle Long handle filbert 8	349745	Товары для творчества (folder)/Живопись и рисования (folder)/Кисть художественная	0	
430682	4017505150655	Top Acryl synthetic bristle Long handle round 1	349745	Товары для творчества (folder)/Живопись и рисования (folder)/Кисть художественная	0	
430683	4017505150556	Top Acryl synthetic bristle Long handle round 10	349745	Товары для творчества (folder)/Живопись и рисования (folder)/Кисть художественная	0	
430684	4017505150563	Top Acryl synthetic bristle Long handle round 12	349745	Товары для творчества (folder)/Живопись и рисования (folder)/Кисть художественная	0	
430685	4017505150648	Top Acryl synthetic bristle Long handle round 14	349745	Товары для творчества (folder)/Живопись и рисования (folder)/Кисть художественная	0	
430686	4017505150570	Top Acryl synthetic bristle Long handle round 16	349745	Товары для творчества (folder)/Живопись и рисования (folder)/Кисть художественная	0	
430687	4017505150587	Top Acryl synthetic bristle Long handle round 20	349745	Товары для творчества (folder)/Живопись и рисования (folder)/Кисть художественная	0	
