ID	UPCEAN	Name	CategoryID	CategoryName	BrandID	BrandName
1970049	6923410710229	Наушники Philips shp8000/10 проводные, hi-fi, 1.6м/1.4 м, стерео,полноразм c оголов, эргоном амбушюры	1	Неклассифицированные/default	39898	PHILIPS
1686731	8712581497668	Наушники Philips shs3200/10, проводные, 1.2 м, стерео, держатель крючок, черные	210556	Техника (folder)/Электротехника/Цифровая техника (folder)/Наушники микрофоны	39898	PHILIPS
3864458	8712581531041	Наушники Philips shs390	210556	Техника (folder)/Электротехника/Цифровая техника (folder)/Наушники микрофоны	39898	PHILIPS
2463007	8712581497996	Наушники Philips shs5200/10, проводные, 1.5м, стерео, накладные, с шейным ободом, черный с красным	210556	Техника (folder)/Электротехника/Цифровая техника (folder)/Наушники микрофоны	39898	PHILIPS
2250080	681326928805	Наушники plants VS zombies	980	Игрушки (folder)/Игрушка	2250079	Jaswares
777156	6958458540002	Наушники pumar pm-315mp	210556	Техника (folder)/Электротехника/Цифровая техника (folder)/Наушники микрофоны	0	
2463008	6909723190354	Наушники qumo tribal soul, фиолетовые с принтом. накладные закрытые разъём 3.5мм Jack. 20-20000hz сменные мягкие амбюшуры. регу	210556	Техника (folder)/Электротехника/Цифровая техника (folder)/Наушники микрофоны	0	
1686733	4660004544137	Наушники ritmix rh-005 черные вкладыши. 20-20000hz 32ohm Jack 3.5mm l:1.2м /400 15115855	210556	Техника (folder)/Электротехника/Цифровая техника (folder)/Наушники микрофоны	627940	RITMIX
1686732	4660004544144	Наушники ritmix rh-005, проводные, 1.2м, стерео, вкладыши, белый	210556	Техника (folder)/Электротехника/Цифровая техника (folder)/Наушники микрофоны	627940	RITMIX
1270866	4660004544106	Наушники ritmix rh-010 белые внутриканал 20-20000hz 32ohm разъём 3.5мм l:1.2м /400 15115854	210556	Техника (folder)/Электротехника/Цифровая техника (folder)/Наушники микрофоны	627940	RITMIX
1270865	4660004544120	Наушники ritmix rh-010 черные внутриканал 20-20000hz 32ohm разъём 3.5мм l:1.2м /400 15115852	210556	Техника (folder)/Электротехника/Цифровая техника (folder)/Наушники микрофоны	627940	RITMIX
2463009	4610015950113	Наушники ritmix rh-012 зелёные внутриканал 20-20000hz 32ohm разъём 3.5мм l:1.2м /400 15117392	210556	Техника (folder)/Электротехника/Цифровая техника (folder)/Наушники микрофоны	627940	RITMIX
2463010	4610015950120	Наушники ritmix rh-012 красные внутриканал 20-20000hz 32ohm разъём 3.5мм l:1.2м /400 15117400	210556	Техника (folder)/Электротехника/Цифровая техника (folder)/Наушники микрофоны	627940	RITMIX
2463011	4610015950106	Наушники ritmix rh-012, оранжевые внутриканал 20-20000hz 32ohm разъём 3.5мм l:1.2м /400 15117391	210556	Техника (folder)/Электротехника/Цифровая техника (folder)/Наушники микрофоны	627940	RITMIX
2463012	4610015950090	Наушники ritmix rh-012, синие внутриканал 20-20000hz 32ohm разъём 3.5мм l:1.2м /400 15117390	210556	Техника (folder)/Электротехника/Цифровая техника (folder)/Наушники микрофоны	627940	RITMIX
2463013	4610015954142	Наушники ritmix rh-013, белые/красные. внутриканал 20-20000hz 32ohm разъём 3.5мм l:1.2м /400 15118132	210556	Техника (folder)/Электротехника/Цифровая техника (folder)/Наушники микрофоны	627940	RITMIX
2463014	4610015954135	Наушники ritmix rh-013, белые/серые. внутриканал 20-20000hz 32ohm разъём 3.5мм l:1.2м /400 15118134	210556	Техника (folder)/Электротехника/Цифровая техника (folder)/Наушники микрофоны	627940	RITMIX
2463015	4610015954159	Наушники ritmix rh-013, зелёные/жёлтые. внутриканал 20-20000hz 32ohm разъём 3.5мм l:1.2м /400 15118133	210556	Техника (folder)/Электротехника/Цифровая техника (folder)/Наушники микрофоны	627940	RITMIX
2463016	4610015954166	Наушники ritmix rh-013, оранжевые/красные. внутриканал 20-20000hz 32ohm разъём 3.5мм l:1.2м /400 15118135	210556	Техника (folder)/Электротехника/Цифровая техника (folder)/Наушники микрофоны	627940	RITMIX
2463017	4610015954128	Наушники ritmix rh-013, чёрные/красные. внутриканал 20-20000hz 32ohm разъём 3.5мм l:1.2м /400 15118131	210556	Техника (folder)/Электротехника/Цифровая техника (folder)/Наушники микрофоны	627940	RITMIX
2463018	4610015954197	Наушники ritmix rh-014, зелёные/жёлтые. внутриканал 20-20000hz 32ohm разъём 3.5мм l:1.2м /400 15118136	210556	Техника (folder)/Электротехника/Цифровая техника (folder)/Наушники микрофоны	627940	RITMIX
2463019	4610015954180	Наушники ritmix rh-014, серые/белые. внутриканал 20-20000hz 32ohm разъём 3.5мм l:1.2м /400 15118139	210556	Техника (folder)/Электротехника/Цифровая техника (folder)/Наушники микрофоны	627940	RITMIX
2463020	4610015954173	Наушники ritmix rh-014, чёрные/красные. внутриканал 20-20000hz 32ohm разъём 3.5мм l:1.2м /400 15118137	210556	Техника (folder)/Электротехника/Цифровая техника (folder)/Наушники микрофоны	627940	RITMIX
2463021	4610015954203	Наушники ritmix rh-014, чёрные/фиолетовые. внутриканал 20-20000hz 32ohm разъём 3.5мм l:1.2м /400 15118138	210556	Техника (folder)/Электротехника/Цифровая техника (folder)/Наушники микрофоны	627940	RITMIX
1270867	4660004545004	Наушники ritmix rh-015 белые внутриканал 20-20000hz 32ohm разъём 3.5мм оригинальные шарообразные чашки. l:1.2м /400 15115873	210556	Техника (folder)/Электротехника/Цифровая техника (folder)/Наушники микрофоны	627940	RITMIX
1686734	4660004544991	Наушники ritmix rh-015, проводные, 1.2м, стерео, вкладыши, с шумоподавлением, черный	210556	Техника (folder)/Электротехника/Цифровая техника (folder)/Наушники микрофоны	627940	RITMIX
1270869	4660004545035	Наушники ritmix rh-017 черные внутриканал 20-20000hz 32ohm разъём 3.5мм пассивное шумоподавление. l:1.2м /400 15115875	210556	Техника (folder)/Электротехника/Цифровая техника (folder)/Наушники микрофоны	627940	RITMIX
1270868	4660004545028	Наушники ritmix rh-017, проводные, 1.2м, стерео, вкладыши, с шумоподавлением, белый	210556	Техника (folder)/Электротехника/Цифровая техника (folder)/Наушники микрофоны	627940	RITMIX
497277	4607162190011	Наушники ritmix rh-100, проводные, 1.2 м, стерео, вкладыши	210556	Техника (folder)/Электротехника/Цифровая техника (folder)/Наушники микрофоны	627940	RITMIX
497278	4607162190028	Наушники ritmix rh-101, проводные, 1.2 м, стерео, вкладыши	210556	Техника (folder)/Электротехника/Цифровая техника (folder)/Наушники микрофоны	627940	RITMIX
497279	4607162190035	Наушники ritmix rh-102, проводные, 1.2 м, стерео, вкладыши	210556	Техника (folder)/Электротехника/Цифровая техника (folder)/Наушники микрофоны	627940	RITMIX
777157	4607162190042	Наушники ritmix rh-110 вкладыши /120	210556	Техника (folder)/Электротехника/Цифровая техника (folder)/Наушники микрофоны	627940	RITMIX
497280	4607162190684	Наушники ritmix rh-115 Sport, проводные, 1.2 м, стерео, вкладыши	210556	Техника (folder)/Электротехника/Цифровая техника (folder)/Наушники микрофоны	627940	RITMIX
1686735	4660004540603	Наушники ritmix rh-117, проводные, 1.2м, стерео, вкладыши черный	210556	Техника (folder)/Электротехника/Цифровая техника (folder)/Наушники микрофоны	627940	RITMIX
1686736	4660004540597	Наушники ritmix rh-117, проводные, 1.2м, стерео, вкладыши, медные	210556	Техника (folder)/Электротехника/Цифровая техника (folder)/Наушники микрофоны	627940	RITMIX
1686737	4660004540610	Наушники ritmix rh-117, проводные, 1.2м, стерео, вкладыши, серебристые	210556	Техника (folder)/Электротехника/Цифровая техника (folder)/Наушники микрофоны	627940	RITMIX
777158	4660004540269	Наушники ritmix rh-118 (вкладыши) позолоченный штекер, серые	210556	Техника (folder)/Электротехника/Цифровая техника (folder)/Наушники микрофоны	627940	RITMIX
1686738	4660004540283	Наушники ritmix rh-118 белые внутриканал 20-20000hz 32ohm разъём 3.5мм пассивное шумоподавление. l:1.2м /200 *** 15115707	210556	Техника (folder)/Электротехника/Цифровая техника (folder)/Наушники микрофоны	627940	RITMIX
777159	4660004540276	Наушники ritmix rh-118 черные внутриканал 20-20000hz 32ohm разъём 3.5мм пассивное шумоподавление. l:1.2м /200 15115706	210556	Техника (folder)/Электротехника/Цифровая техника (folder)/Наушники микрофоны	627940	RITMIX
1686739	4660004540306	Наушники ritmix rh-119 черные внутриканал 20-20000hz 32ohm разъём 3.5мм пассивное шумоподавление. l:1.2м /200 15115710	210556	Техника (folder)/Электротехника/Цифровая техника (folder)/Наушники микрофоны	627940	RITMIX
1270870	4660004540290	Наушники ritmix rh-119, проводные, 1.2м, стерео, вкладыши с шумоподавлением, серебристые	210556	Техника (folder)/Электротехника/Цифровая техника (folder)/Наушники микрофоны	627940	RITMIX
497281	4607162190066	Наушники ritmix rh-120, проводные, 1.2 м, стерео, вкладыши с шумоподавлением	210556	Техника (folder)/Электротехника/Цифровая техника (folder)/Наушники микрофоны	627940	RITMIX
777160	4607162190080	Наушники ritmix rh-121 красные вкладыши /24	210556	Техника (folder)/Электротехника/Цифровая техника (folder)/Наушники микрофоны	627940	RITMIX
497282	4607162190073	Наушники ritmix rh-121, проводные, 1.2 м, стерео, вкладыши с шумоподавлением, черные	210556	Техника (folder)/Электротехника/Цифровая техника (folder)/Наушники микрофоны	627940	RITMIX
497283	4607162190714	Наушники ritmix rh-122 Sport, проводные, 0.63 м, стерео, вкладыши с шумоподавлением, белые	210556	Техника (folder)/Электротехника/Цифровая техника (folder)/Наушники микрофоны	627940	RITMIX
497284	4607162190783	Наушники ritmix rh-123 Black/Silver (вкладыши) вакуумные	210556	Техника (folder)/Электротехника/Цифровая техника (folder)/Наушники микрофоны	627940	RITMIX
497285	4607162191254	Наушники ritmix rh-124 (вкладыши) вакуумные, сменные насадки	210556	Техника (folder)/Электротехника/Цифровая техника (folder)/Наушники микрофоны	627940	RITMIX
777161	4607162191285	Наушники ritmix rh-124 зеленые вкладыши, силикон /1/80	210556	Техника (folder)/Электротехника/Цифровая техника (folder)/Наушники микрофоны	627940	RITMIX
777162	4607162191346	Наушники ritmix rh-125, проводные, 1.2 м, стерео, вкладыши с шумоподавлением	210556	Техника (folder)/Электротехника/Цифровая техника (folder)/Наушники микрофоны	627940	RITMIX
777163	4607162191353	Наушники ritmix rh-126, проводные, 1.2 м, стерео, вкладыши с шумоподавлением	210556	Техника (folder)/Электротехника/Цифровая техника (folder)/Наушники микрофоны	627940	RITMIX
777164	4607162191384	Наушники ritmix rh-128, проводные, 1.2 м, стерео, вкладыши с шумоподавлением, серебристые	210556	Техника (folder)/Электротехника/Цифровая техника (folder)/Наушники микрофоны	627940	RITMIX
497286	4607162191377	Наушники ritmix rh-128, проводные, 1.2 м, стерео, вкладыши с шумоподавлением, черные	210556	Техника (folder)/Электротехника/Цифровая техника (folder)/Наушники микрофоны	627940	RITMIX
1970050	4660004540320	Наушники ritmix rh-131 (вкладыши) вакуумные, Золото, провод 1.2м	210556	Техника (folder)/Электротехника/Цифровая техника (folder)/Наушники микрофоны	627940	RITMIX
1970051	4660004540245	Наушники ritmix rh-131 (вкладыши) вакуумные, черные, провод 1.2м	210556	Техника (folder)/Электротехника/Цифровая техника (folder)/Наушники микрофоны	627940	RITMIX
1270871	4660004540634	Наушники ritmix rh-133, проводные, 1.2м, стерео, вкладыши с шумоподавлением, металлик	210556	Техника (folder)/Электротехника/Цифровая техника (folder)/Наушники микрофоны	627940	RITMIX
497287	4660004540382	Наушники ritmix rh-133, проводные, 1.2м, стерео, вкладыши с шумоподавлением, черные	210556	Техника (folder)/Электротехника/Цифровая техника (folder)/Наушники микрофоны	627940	RITMIX
2463022	4610015952681	Наушники ritmix rh-134 metal, чёрные/красные. внутриканал 20-22000hz 16ohm разъём 3.5мм доп амбушюры l:1.2м /90 15117694	210556	Техника (folder)/Электротехника/Цифровая техника (folder)/Наушники микрофоны	627940	RITMIX
2463023	4610015952698	Наушники ritmix rh-134 metal, чёрные/титан. внутриканал 20-22000hz 16ohm разъём 3.5мм доп амбушюры l:1.2м /90 15117695	210556	Техника (folder)/Электротехника/Цифровая техника (folder)/Наушники микрофоны	627940	RITMIX
1270872	4660004540832	Наушники ritmix rh-135 (вкладыши) Gold	210556	Техника (folder)/Электротехника/Цифровая техника (folder)/Наушники микрофоны	627940	RITMIX
1686740	4660004542195	Наушники ritmix rh-137, 1.2м, стерео, вкладыши с шумоподавлением	210556	Техника (folder)/Электротехника/Цифровая техника (folder)/Наушники микрофоны	627940	RITMIX
1686741	4660004542201	Наушники ritmix rh-140 Pro, 1.3м, стерео, вкладыши с шумоподавлением	210556	Техника (folder)/Электротехника/Цифровая техника (folder)/Наушники микрофоны	627940	RITMIX
1686742	4660004542218	Наушники ritmix rh-145 Pro dual drivers, 1.3м, стерео, вкладыши с шумоподавлением	210556	Техника (folder)/Электротехника/Цифровая техника (folder)/Наушники микрофоны	627940	RITMIX
1686743	4660004544151	Наушники ritmix rh-155 zipper, проводные, 1.1м, стерео, вкладыши с шумоподавлен, провод-молния, черн	210556	Техника (folder)/Электротехника/Цифровая техника (folder)/Наушники микрофоны	627940	RITMIX
1686744	4660004544168	Наушники ritmix rh-155 zipper, проводные, 1.1м, стерео, вкладыши с шумоподавлен, провод-молния,белые	210556	Техника (folder)/Электротехника/Цифровая техника (folder)/Наушники микрофоны	627940	RITMIX
2463024	4610015952674	Наушники ritmix rh-159 wooden. внутриканальные, корпус из вишнёвого дерева. 20-22000hz 16ohm разъём 3.5мм l:1.2м /90 15117696	210556	Техника (folder)/Электротехника/Цифровая техника (folder)/Наушники микрофоны	627940	RITMIX
2463025	4610015952872	Наушники ritmix rh-160 wooden. внутриканальные, корпус из вишнёвого дерева. 20-22000hz 16ohm разъём 3.5мм l:1.2м /90 15117946	210556	Техника (folder)/Электротехника/Цифровая техника (folder)/Наушники микрофоны	627940	RITMIX
2463026	4660004549187	Наушники ritmix rh-181 зелёные внутриканал 20-22000hz 16ohm разъём 3.5мм доп амбушюры l:1.2м /90 15116809	210556	Техника (folder)/Электротехника/Цифровая техника (folder)/Наушники микрофоны	627940	RITMIX
2463027	4660004549163	Наушники ritmix rh-181 красные внутриканал 20-22000hz 16ohm разъём 3.5мм доп амбушюры l:1.2м /90 15116808	210556	Техника (folder)/Электротехника/Цифровая техника (folder)/Наушники микрофоны	627940	RITMIX
1970052	4660004549170	Наушники ritmix rh-181 черные внутриканал 20-22000hz 16ohm разъём 3.5мм доп амбушюры l:1.2м /90 15116807	210556	Техника (folder)/Электротехника/Цифровая техника (folder)/Наушники микрофоны	627940	RITMIX
1970053	4660004549156	Наушники ritmix rh-183, синие/белые. внутриканал 20-22000hz 16ohm разъём 3.5мм доп амбушюры l:1.2м /90 15116805	210556	Техника (folder)/Электротехника/Цифровая техника (folder)/Наушники микрофоны	627940	RITMIX
1970054	4660004549149	Наушники ritmix rh-183, чёрные/белые. внутриканал 20-22000hz 16ohm разъём 3.5мм доп амбушюры l:1.2м /90 15116804	210556	Техника (folder)/Электротехника/Цифровая техника (folder)/Наушники микрофоны	627940	RITMIX
1970055	4660004549118	Наушники ritmix rh-183, чёрные/красные. внутриканал 20-22000hz 16ohm разъём 3.5мм доп амбушюры l:1.2м /90 15116803	210556	Техника (folder)/Электротехника/Цифровая техника (folder)/Наушники микрофоны	627940	RITMIX
2463028	4660004549125	Наушники ritmix rh-185, чёрные/красные. внутриканал 20-22000hz 16ohm разъём 3.5мм доп амбушюры l:1.2м /90 15116806	210556	Техника (folder)/Электротехника/Цифровая техника (folder)/Наушники микрофоны	627940	RITMIX
1970056	4660004549132	Наушники ritmix rh-185, чёрные/синие. внутриканал 20-22000hz 16ohm разъём 3.5мм доп амбушюры l:1.2м /90 15116802	210556	Техника (folder)/Электротехника/Цифровая техника (folder)/Наушники микрофоны	627940	RITMIX
777165	4607162190110	Наушники ritmix rh-300 Black (клипсы) позолоч. джек 3.5мм шнур 0.8 м 24ом	210556	Техника (folder)/Электротехника/Цифровая техника (folder)/Наушники микрофоны	627940	RITMIX
777166	4607162190127	Наушники ritmix rh-300 красные клипсы /60	210556	Техника (folder)/Электротехника/Цифровая техника (folder)/Наушники микрофоны	627940	RITMIX
777167	4607162190134	Наушники ritmix rh-300, проводные, 0.8 м, стерео, полноразмерные, с креплением-клипсой, серебристые	210556	Техника (folder)/Электротехника/Цифровая техника (folder)/Наушники микрофоны	627940	RITMIX
777168	4607162190196	Наушники ritmix rh-500 джек 3.5мм+адаптер 6.5мм шнур 2м 32ом [190196]	210556	Техника (folder)/Электротехника/Цифровая техника (folder)/Наушники микрофоны	627940	RITMIX
1686745	4660004542560	Наушники ritmix rh-501. накладные 20-20000hz 32ohm разъём 3.5мм Mini Jack l:2м /40 15115843	210556	Техника (folder)/Электротехника/Цифровая техника (folder)/Наушники микрофоны	627940	RITMIX
1686746	4607162190202	Наушники ritmix rh-502 накладные, складная конструкция, черные, 3.5мм/6.3мм	210556	Техника (folder)/Электротехника/Цифровая техника (folder)/Наушники микрофоны	627940	RITMIX
2463029	4610015950045	Наушники ritmix rh-502. мониторные, закрыт типа 20-22000hz 32ohm разъём 3.5мм складная конструкция. l:1.2м /40 15117386	210556	Техника (folder)/Электротехника/Цифровая техника (folder)/Наушники микрофоны	627940	RITMIX
497288	4607162190219	Наушники ritmix rh-503, проводные, 2.5 м, стерео, полноразмерные c оголовьем, вращающиеся чашки	210556	Техника (folder)/Электротехника/Цифровая техника (folder)/Наушники микрофоны	627940	RITMIX
777169	4607162190226	Наушники ritmix rh-504 закрытые, позолоч джек 3.5мм+переходник 6.5мм, регулятор громк [190226]	210556	Техника (folder)/Электротехника/Цифровая техника (folder)/Наушники микрофоны	627940	RITMIX
1970057	4660004548326	Наушники ritmix rh-505 черные накладные 20-20000hz 32ohm разъём 3.5мм Mini Jack складная конструкция. прорезиненное покрытие (s	210556	Техника (folder)/Электротехника/Цифровая техника (folder)/Наушники микрофоны	627940	RITMIX
1970058	4660004548319	Наушники ritmix rh-506 черные накладные 20-20000hz 32ohm разъём 3.5мм Mini Jack складная конструкция. прорезиненное покрытие (s	210556	Техника (folder)/Электротехника/Цифровая техника (folder)/Наушники микрофоны	627940	RITMIX
