ID	UPCEAN	Name	CategoryID	CategoryName	BrandID	BrandName
3948105	4601015238677	Яшкино var.sgutsh. boil.cond.Milk wr 0.3kg fw	25	Продукты питания (folder)/Кондитерские изделия (folder)/Вафли	6	Яшкино
3948106	4690329003590	Яшкино yagody&frukty asr. j 1kg	22145	Продукты питания (folder)/Кондитерские изделия (folder)/Конфеты	6	Яшкино
3948107	4690329003729	Яшкино yagody&frukty asr. j 1kg #2	22145	Продукты питания (folder)/Кондитерские изделия (folder)/Конфеты	6	Яшкино
2449100	460329000219	Яшкино крекер визит нежности 350г	21865	Продукты питания (folder)/Кондитерские изделия (folder)/Печенье	6	Яшкино
321776	4603290002646	Яшкино печенье варен.сгущ.затяжное 182г	21865	Продукты питания (folder)/Кондитерские изделия (folder)/Печенье	6	Яшкино
3948108	4607015232226	Яшкино поляна skazok pb 0.4kg s	21865	Продукты питания (folder)/Кондитерские изделия (folder)/Печенье	6	Яшкино
322711	4607015235302	Яшкино пряники с вишневой начинкой 350г	5	Продукты питания (folder)/Пряники	6	Яшкино
550150	4607112707702	Яшкино с арахисом Peanut g 0.14kg wp	1	Неклассифицированные/default	6	Яшкино
2765652	469032900540	Яшкино шоколад молочный 90г	77	Продукты питания (folder)/Кондитерские изделия (folder)/Кондитерские изделия	6	Яшкино
1711833	4690329003309	Яшкино шоколад молочный с кусочками ананаса 100г	19677	Продукты питания (folder)/Кондитерские изделия (folder)/Шоколад	6	Яшкино
2274331	9789666793853	Ящер - 3D-паззл на изолоне	36536	Полиграфия (folder)/Печатная продукция	0	
871401	4605885302421	Ящерица 28см k93009a plush Apple	980	Игрушки (folder)/Игрушка	0	
871402	4605885298113	Ящерица 4511gt ассортим 33см 12 ш	980	Игрушки (folder)/Игрушка	0	
1346786	4602010341003	Ящерица геккон 138x 91см от 3 лет	2228566	Игрушки (folder)/Игрушки надувные	309610	Intex
2765653	4690590011881	Ящерица играем вместе 20см цвет ассортим в дисплее уп-60шт в кор.24уп	980	Игрушки (folder)/Игрушка	1791899	Играем Вместе
2765654	6934522969467	Ящерица играем вместе пищалка, ассортим 23-42см в дисплее уп-12шт в кор.18уп	980	Игрушки (folder)/Игрушка	1791899	Играем Вместе
2765655	6934614435276	Ящерица надувная 138x 91см в кор. (боится холода) в кор.6шт	1793353	Спорт и отдых (folder)/Надувные изделия	0	
149241	6925654023080	Ящерица тянущаяся, 4 вида	1364437	Игрушки (folder)/Фигурки, роботы, животные	59447	Rinzo
545746	4602010233223	Ящерица увеличив. 600%, crd 22x 15см, 4 вида, арт.w6328-g129.	1364437	Игрушки (folder)/Фигурки, роботы, животные	0	
2765656	4690383001082	Ящерица-тянучка играем вместе ассортим на карт. (русс. уп.) 28x 17см в кор.2x 72шт	1	Неклассифицированные/default	1791899	Играем Вместе
3604277	4627105058987	Ящик 100 мелочей для инструментов 415x210 x 210см	1	Неклассифицированные/default	0	
3604278	4627105059069	Ящик 100 мелочей для инструментов 585x255 x 250см	1	Неклассифицированные/default	0	
871506	8711295627088	Ящик 16л	3536	Хозяйственные товары (folder)/Хозяйственные товары	0	
871403	8412497037902	Ящик 26л	3536	Хозяйственные товары (folder)/Хозяйственные товары	0	
871404	4811221000030	Ящик 40л б/н	1	Неклассифицированные/default	0	
871405	4605244020812	Ящик 600x400 x300 хоз	3536	Хозяйственные товары (folder)/Хозяйственные товары	0	
871507	8711295627064	Ящик 80x40 x 17см	3536	Хозяйственные товары (folder)/Хозяйственные товары	0	
3604279	6907001421015	Ящик arti-m для хранения сталь арт.142-101	1	Неклассифицированные/default	0	
3604280	6907001421206	Ящик arti-m для хранения сталь арт.142-120	1	Неклассифицированные/default	0	
3604281	6907001421312	Ящик arti-m для хранения сталь арт.142-131	1	Неклассифицированные/default	0	
344017	4607128310033	Ящик biber iso 9001 пластиковый для инструмента 50см*22см*24см м/у	344013	Инструменты (folder)/Ящик для инструментов	343624	BIBER
805248	4690231007266	Ящик blocker expert professional №22 пластиковый для инструментов 560x280 x 235мм	344013	Инструменты (folder)/Ящик для инструментов	54493	Пластик-Центр
805246	4607177049083	Ящик blocker master tour №24 пластиковый 610x320 x 300мм	344013	Инструменты (folder)/Ящик для инструментов	54493	Пластик-Центр
3604282	4690231188705	Ящик blocker гладиатор для инструментов пластмассовый 480x268 x 236мм	1	Неклассифицированные/default	0	
3604283	4607023590936	Ящик blocker для инструментов	1	Неклассифицированные/default	0	
3604284	4690231086414	Ящик blocker для инструментов #2	1	Неклассифицированные/default	0	
1980068	4607023590974	Ящик blocker для инструментов с блоками для мелочи	344013	Инструменты (folder)/Ящик для инструментов	0	
3604285	4690231086421	Ящик blocker для инструментов с блоками для мелочи #2	1	Неклассифицированные/default	0	
3604286	4680014231339	Ящик bubble boom универсальный 400x335 x 85мм	1	Неклассифицированные/default	0	
871406	5996093388949	Ящик craft house	1	Неклассифицированные/default	0	
330467	3253924706214	Ящик curver pets кошка deco madrid s декоративный для аксессуаров	1	Неклассифицированные/default	315707	Curver Pets
330468	3253920035059	Ящик curver pets кошка оптима хобби для аксессуаров для животных 15л	1	Неклассифицированные/default	315707	Curver Pets
3604287	3253922924016	Ящик curver для инструментов	1	Неклассифицированные/default	0	
3604288	5901110613164	Ящик curver складной красный	1	Неклассифицированные/default	0	
3604289	5901110613133	Ящик curver складной синий	1	Неклассифицированные/default	0	
871479	4607097620058	Ящик darel с крышкой на колесах 56л 61x40 x 31см	3536	Хозяйственные товары (folder)/Хозяйственные товары	0	
3604290	4601532810554	Ящик Disney 10л 81055	1	Неклассифицированные/default	0	
1712972	4601532810776	Ящик Disney тачки 10л c81077	3536	Хозяйственные товары (folder)/Хозяйственные товары	145147	Полимербыт
278354	4607110960123	Ящик ekko plast тарный 0.13 куб.м. непищевой	3536	Хозяйственные товары (folder)/Хозяйственные товары	260754	Ekko Plast
1346815	4607146490403	Ящик Eva вензель складной для хранения 43x35 x 16см	3536	Хозяйственные товары (folder)/Хозяйственные товары	1260240	Арт де Лис
1346816	4607146490380	Ящик Eva вензель складной для хранения 60x50 x 30см	3536	Хозяйственные товары (folder)/Хозяйственные товары	1260240	Арт де Лис
3604291	8404880654964	Ящик fit для инструмента 12 30x13 x 10см	1	Неклассифицированные/default	0	
1832144	8404880655008	Ящик fit для инструментов 13 33x17.5x12.5см	344013	Инструменты (folder)/Ящик для инструментов	594717	FIT
3604292	8404880656456	Ящик fit для крепежа 10 17.5x10.6x4.6см	1	Неклассифицированные/default	0	
3604293	5901110614130	Ящик form складной синий	1	Неклассифицированные/default	0	
3604294	4612734973152	Ящик handle design почтовый металлический 18x6 x 26см цвет винно-красный т/у	1	Неклассифицированные/default	0	
3604295	4607137104180	Ящик helios зимний рыболовный 19л	1	Неклассифицированные/default	0	
3948109	4607137039154	Ящик helios рыболова двухполоч.красный	562237	Спорт и отдых (folder)/Рыбалка (folder)/Рыбалка	0	
3604296	4607023590868	Ящик idea атлант 18 для инструментов пластиковый 430x235 x 250мм м/у	1	Неклассифицированные/default	299129	idea
3604297	4605196015140	Ящик idea балконный пластиковый 40см белый арт.м3225	1	Неклассифицированные/default	3673575	М-Пластика Idea
2765658	4605196014716	Ящик idea балконный пластиковый 60см коричневый арт.м3226	1	Неклассифицированные/default	3673575	М-Пластика Idea
3604298	4605196012996	Ящик idea балконный пластиковый с поддоном цвет терракотовый 400мм	1	Неклассифицированные/default	3673575	М-Пластика Idea
1980059	4607023592312	Ящик idea детский для мелочей	476072	Хозяйственные товары (folder)/Контейнер для игрушек	0	
3604300	4605196022742	Ящик idea м2352 с крышкой прозрачный 370x250 x 140мм 10л	1	Неклассифицированные/default	0	
3604302	4605196013009	Ящик idea пластиковый балконный с поддоном цвет мраморный 400мм	1	Неклассифицированные/default	3673575	М-Пластика Idea
3604303	4605196022728	Ящик idea прозрачный полипропиленовый 2л	1	Неклассифицированные/default	0	
3604304	4605196015133	Ящик idea ротанг балконный с поддоном коричневый 60cм	1	Неклассифицированные/default	3673575	М-Пластика Idea
3604305	4605196013016	Ящик idea терракотовый балконный пластмассовый с поддоном 600мм	1	Неклассифицированные/default	3673575	М-Пластика Idea
3604306	4605196013030	Ящик idea терракотовый балконный пластмассовый с поддоном 800мм	1	Неклассифицированные/default	3673575	М-Пластика Idea
545762	4607023590929	Ящик idea титан 18 для инструментов 430x235 x 250мм арт м 2932	344013	Инструменты (folder)/Ящик для инструментов	299129	idea
545750	4607023590844	Ящик idea титан 18 для инструментов 430x235 x 250мм арт м2922	344013	Инструменты (folder)/Ящик для инструментов	0	
545754	4607023590981	Ящик idea титан-18 для инструментов пластиковый 430x235 x 250мм	344013	Инструменты (folder)/Ящик для инструментов	0	
608668	4690231022009	Ящик ingreen балконный 60см ing1802	3536	Хозяйственные товары (folder)/Хозяйственные товары	3674504	INGREEN
3604307	4690290004411	Ящик junior дино на роликах с крышкой 30л	1	Неклассифицированные/default	0	
3604310	4630017900510	Ящик martika для инструментов и мелочей	1	Неклассифицированные/default	0	
3604311	4607049786146	Ящик martika массимо для инструментов 490x288 x 254мм	1	Неклассифицированные/default	0	
3604312	4630017901067	Ящик martika массимо пластмассовый для медикаментов	1	Неклассифицированные/default	0	
3604313	4607049784388	Ящик martika фелиция для растений с поддоном пластиковый желтый 40см	1	Неклассифицированные/default	3279457	martika
3604314	4690231102596	Ящик master economy 12 для инструментов	1	Неклассифицированные/default	0	
3604316	4690603006705	Ящик master economy 16 для инструментов #2	1	Неклассифицированные/default	0	
3604317	4690231094969	Ящик master solid 12 для инструментов	1	Неклассифицированные/default	0	
3604318	4690231131084	Ящик master solid 12 для инструментов #2	1	Неклассифицированные/default	0	
3604319	4690231097717	Ящик master tour камуфляж 19inch для инструмента 485x250 x 245мм	1	Неклассифицированные/default	3625198	BLOCKER
3604320	4690231093023	Ящик mybok для хранения 5.1л	1	Неклассифицированные/default	0	
3604321	4690231139325	Ящик optima брызги для хранения 57л	1	Неклассифицированные/default	0	
3604322	8711252454436	Ящик paragon балконный на перила 29x29 x 20см ш45443	1	Неклассифицированные/default	0	
1575220	5701922200428	Ящик plast Team (п) hobby Box jumbo 43x35 x 20см	3536	Хозяйственные товары (folder)/Хозяйственные товары	1575181	Plast Team
1575221	5701922221300	Ящик plast Team (п) hobby Box turn &stac 11.5л	3536	Хозяйственные товары (folder)/Хозяйственные товары	1575181	Plast Team
1575222	5706773221400	Ящик plast Team (п) hobby Box turn &stac 20л	3536	Хозяйственные товары (folder)/Хозяйственные товары	1575181	Plast Team
330475	5701922201128	Ящик plast Team (п) pirate на роликах с крышкой 30л	3536	Хозяйственные товары (folder)/Хозяйственные товары	1575181	Plast Team
1575223	5706773228010	Ящик plast Team (п) pirate с крышкой и ручкой 4.5л	3536	Хозяйственные товары (folder)/Хозяйственные товары	1575181	Plast Team
1575224	5706773227204	Ящик plast Team (п) premium Maxi 55.0л	3536	Хозяйственные товары (folder)/Хозяйственные товары	1575181	Plast Team
1575227	5701922239909	Ящик plast Team (п) с крышкой bedroller 70x39.4x15.5см	3536	Хозяйственные товары (folder)/Хозяйственные товары	1575181	Plast Team
1575228	5701922239008	Ящик plast Team (п) с крышкой tagstore 1.5л	3536	Хозяйственные товары (folder)/Хозяйственные товары	1575181	Plast Team
1575229	5701922239404	Ящик plast Team (п) с крышкой tagstore 12.0л	3536	Хозяйственные товары (folder)/Хозяйственные товары	1575181	Plast Team
1575230	5701922239107	Ящик plast Team (п) с крышкой tagstore 3.0л	3536	Хозяйственные товары (folder)/Хозяйственные товары	1575181	Plast Team
1575231	5701922239800	Ящик plast Team (п) с крышкой tagstore 70.0л	3536	Хозяйственные товары (folder)/Хозяйственные товары	1575181	Plast Team
1575232	5701922239305	Ящик plast Team (п) с крышкой tagstore 8.0л	3536	Хозяйственные товары (folder)/Хозяйственные товары	1575181	Plast Team
1575257	4607126319014	Ящик plast Team (р) junior на роликах с крышкой 30л	3536	Хозяйственные товары (folder)/Хозяйственные товары	1575181	Plast Team
1575258	4607126319045	Ящик plast Team (р) junior на роликах с крышкой 60л	3536	Хозяйственные товары (folder)/Хозяйственные товары	1575181	Plast Team
1575259	4607126316013	Ящик plast Team (р) pirate на роликах с крышкой 60л	3536	Хозяйственные товары (folder)/Хозяйственные товары	1575181	Plast Team
330512	4690290198110	Ящик plast Team (р) для хранения мелочей 8.5л	3536	Хозяйственные товары (folder)/Хозяйственные товары	309375	ООО Пи энд Си
1575260	4690290198011	Ящик plast Team (р) для хранения обуви 8.5л	3536	Хозяйственные товары (folder)/Хозяйственные товары	1575181	Plast Team
1840783	5701922201234	Ящик plast Team pir.дет.на рол. 80л	3536	Хозяйственные товары (folder)/Хозяйственные товары	0	
1840790	5706773229000	Ящик plast Team pirat Премиум 4.5л	3536	Хозяйственные товары (folder)/Хозяйственные товары	0	
330507	4690231023174	Ящик plast-cent.ibox для хран.CD	3536	Хозяйственные товары (folder)/Хозяйственные товары	309375	ООО Пи энд Си
330508	4690231023198	Ящик plast-cent.ibox для хран.DVD	3536	Хозяйственные товары (folder)/Хозяйственные товары	309375	ООО Пи энд Си
3604323	4690231093160	Ящик plastik centre универсальный 5.1л	1	Неклассифицированные/default	0	
3604324	5707672229566	Ящик poland с крышкой 13л	1	Неклассифицированные/default	0	
1832927	3253561920653	Ящик stan.series2000 16inch 192065	41797	Инструменты (folder)/Инструмент	0	
1832928	3253561929052	Ящик stanley jumbo16 мет.замки 192905	41797	Инструменты (folder)/Инструмент	306099	Stanley
1832929	3253561929069	Ящик stanley jumbo19 мет.замки 192906	41797	Инструменты (folder)/Инструмент	306099	Stanley
1346803	4606800033857	Ящик stels для инструментов 590x300 x300 24шт	344013	Инструменты (folder)/Ящик для инструментов	0	
3604325	4603010025580	Ящик sturm! модель tbprof16 пластиковый для инструментов 410x215 x 197мм	1	Неклассифицированные/default	0	
3604326	4627105059007	Ящик toolbox для инструментов пластик 415x210 x210	1	Неклассифицированные/default	0	
330470	5701922202415	Ящик twin двухсторон для мелочей	3536	Хозяйственные товары (folder)/Хозяйственные товары	1575181	Plast Team
3604327	4690231108505	Ящик x-Box для хранения 12л	1	Неклассифицированные/default	0	
3604328	4690231027813	Ящик x-Box для хранения на роликах пластик 57л 610x406 x 330мм	1	Неклассифицированные/default	0	
142754	8013183758639	Ящик абм фанни на колесиках 60л ab008630	3536	Хозяйственные товары (folder)/Хозяйственные товары	41308	АБМ
142755	8013183208646	Ящик абм фанни на колесиках 80л ab008640	3536	Хозяйственные товары (folder)/Хозяйственные товары	41308	АБМ
3948110	4607156360581	Ящик агро ассорти складной	33235	Растениеводство/Садовый инвентарь	0	
3604334	4627096319432	Ящик альтернатива изюминка прямоуг коричневый 12л	1	Неклассифицированные/default	149661	АЛЬТЕРНАТИВА
3604335	4627105059021	Ящик альтернатива мечта рыбалка 415x210 x210	1	Неклассифицированные/default	149661	АЛЬТЕРНАТИВА
3604336	4627122729112	Ящик альтернатива почтовый с замком пластиковый цвет ассортим м/уп	1	Неклассифицированные/default	149661	АЛЬТЕРНАТИВА
3604337	4627122729136	Ящик альтернатива почтовый с замком пластиковый цвет ассортим м/уп #2	1	Неклассифицированные/default	149661	АЛЬТЕРНАТИВА
2505999	4623720907129	Ящик альтернатива рассадный 150x500 x 100мм	561877	Растениеводство/Товары для садоводства	149661	АЛЬТЕРНАТИВА
3604338	4627114775486	Ящик альтернатива сине-желтый раздвижной 425x224 x 200мм	1	Неклассифицированные/default	149661	АЛЬТЕРНАТИВА
3604343	4607049785491	Ящик астело универсальный на колесиках 600x400 x 180мм	1	Неклассифицированные/default	0	
871407	4811221000535	Ящик балконный	3536	Хозяйственные товары (folder)/Хозяйственные товары	0	
2505986	4607016671123	Ящик балконный (мраморный) с поддоном 500x130 x 160мм	3536	Хозяйственные товары (folder)/Хозяйственные товары	0	
330471	4607002130542	Ящик балконный 100см	3536	Хозяйственные товары (folder)/Хозяйственные товары	309375	ООО Пи энд Си
330472	4607002130511	Ящик балконный 40см	3536	Хозяйственные товары (folder)/Хозяйственные товары	309375	ООО Пи энд Си
3604346	4607115265964	Ящик балконный 40см #2	1	Неклассифицированные/default	0	
1822234	4607065070335	Ящик балконный 45см 7л	3536	Хозяйственные товары (folder)/Хозяйственные товары	0	
3604347	4607027580483	Ящик балконный 50см с поддоном ассортим у31850	1	Неклассифицированные/default	0	
1346787	4605196006391	Ящик балконный 60см	3536	Хозяйственные товары (folder)/Хозяйственные товары	0	
3604349	4607027582456	Ящик балконный 75см уз 1875 #2	1	Неклассифицированные/default	0	
3604350	5907474320465	Ящик балконный 75см уз 1875 #3	1	Неклассифицированные/default	0	
1346791	5900791008719	Ящик балконный 80x20 x17	3536	Хозяйственные товары (folder)/Хозяйственные товары	0	
1346792	5900791008757	Ящик балконный 80x30 x32	3536	Хозяйственные товары (folder)/Хозяйственные товары	0	
330474	4607002130535	Ящик балконный 80см	3536	Хозяйственные товары (folder)/Хозяйственные товары	309375	ООО Пи энд Си
3604351	5907474320540	Ящик балконный 80см #2	1	Неклассифицированные/default	0	
1346789	4605196006407	Ящик балконный 80см зелен	3536	Хозяйственные товары (folder)/Хозяйственные товары	0	
1346790	4605196005271	Ящик балконный 80см мраморн.	3536	Хозяйственные товары (folder)/Хозяйственные товары	0	
2505987	4690227002442	Ящик балконный c поддоном,25см, глина	3536	Хозяйственные товары (folder)/Хозяйственные товары	0	
608667	4690231021996	Ящик балконный ing1801 тзл 40см	3536	Хозяйственные товары (folder)/Хозяйственные товары	3674504	INGREEN
608669	4690231022047	Ящик балконный ing1803 мр 80см	3536	Хозяйственные товары (folder)/Хозяйственные товары	3674504	INGREEN
608670	4690231022085	Ящик балконный ing1804 тзл 100см	3536	Хозяйственные товары (folder)/Хозяйственные товары	0	
1822232	4606100147865	Ящик балконный ingreen 40см	3536	Хозяйственные товары (folder)/Хозяйственные товары	3674504	INGREEN
1822233	4606100147872	Ящик балконный ingreen 60см	3536	Хозяйственные товары (folder)/Хозяйственные товары	3674504	INGREEN
