ID	UPCEAN	Name	CategoryID	CategoryName	BrandID	BrandName
95824	4016002015542	Нож culinario для тонкой нарезки 32.2см #2	2420630	Посуда (folder)/Посуда кухонная	36947	Culinario
95836	4016002015511	Нож culinario поварской 30.7см	2420630	Посуда (folder)/Посуда кухонная	36947	Culinario
778250	4016002019656	Нож culinario поварской с бамбук.ручкой 32см 050845	38328	Посуда (folder)/Посуда столовая, предметы сервировки	36947	Culinario
778251	4016002019601	Нож culinario с бамбук.ручкой 19см 050840	38328	Посуда (folder)/Посуда столовая, предметы сервировки	36947	Culinario
778252	4016002019625	Нож culinario сантоку с бамбук.ручкой 30см 050842	38328	Посуда (folder)/Посуда столовая, предметы сервировки	36947	Culinario
95837	4016002015436	Нож culinario титан для очистки 19см	2420630	Посуда (folder)/Посуда кухонная	36947	Culinario
95839	4016002015450	Нож culinario титан.поварской 30.7см	2420630	Посуда (folder)/Посуда кухонная	36947	Culinario
95840	4016002015474	Нож culinario титан.универс. 33см	2420630	Посуда (folder)/Посуда кухонная	36947	Culinario
95842	4016002015504	Нож culinario универс 22см	2420630	Посуда (folder)/Посуда кухонная	36947	Culinario
95841	4016002015535	Нож culinario универс 33см	2420630	Посуда (folder)/Посуда кухонная	36947	Culinario
778253	4016002022533	Нож culinario универс. 33см	2420630	Посуда (folder)/Посуда кухонная	36947	Culinario
778254	4016002022502	Нож culinario универс.22см	2420630	Посуда (folder)/Посуда кухонная	36947	Culinario
778255	4016002019618	Нож culinario универс.с бамбук.ручкой 22см 050841	38328	Посуда (folder)/Посуда столовая, предметы сервировки	36947	Culinario
3444007	6948570620874	Нож cutter knife концелярский для бумаг 18мм	1	Неклассифицированные/default	0	
3444008	4690408073988	Нож damas irise mal-05di лезвие 12.5см универсал	1	Неклассифицированные/default	0	
3444009	6935500011123	Нож de luxe вк-1051 для тонкой нарезки	1	Неклассифицированные/default	0	
3444010	4627072874450	Нож deco bk05-abs универсальный 12.5см	1	Неклассифицированные/default	0	
3444011	4627072874436	Нож deco bk06-abc разделочный сталь 11.5см	1	Неклассифицированные/default	0	
3444012	4627072874443	Нож deco bk07-abc для мяса сталь 12см	1	Неклассифицированные/default	0	
3444013	4627072874610	Нож deco pp-02k разделочный 18см	1	Неклассифицированные/default	0	
3444014	4690408118405	Нож ecos sr081 многофункциональный зеленый тв/уп	1	Неклассифицированные/default	0	
3444015	4690408118436	Нож ecos sr084 многофункциональный милитари тв/уп	1	Неклассифицированные/default	0	
3444016	5905912673357	Нож ega обойный18мv	1	Неклассифицированные/default	0	
96025	4041485033653	Нож Erich Krause 3365	2	Канцелярские товары (folder)/Канцелярские товары	348877	Erich Krause
96026	4041485014874	Нож Erich Krause автолок ек1487	2	Канцелярские товары (folder)/Канцелярские товары	348877	Erich Krause
1782923	4607127271540	Нож essa 6шт	2420630	Посуда (folder)/Посуда кухонная	3654183	ESSA
778007	4008033405645	Нож fackelmann Comfort для чист овощей 19см	3536	Хозяйственные товары (folder)/Хозяйственные товары	41398	Fackelmann
1838756	4008033271042	Нож fackelmann Happy для чистки овощей с чехлом, 8\20см	2420630	Посуда (folder)/Посуда кухонная	41398	Fackelmann
1838757	4008033271011	Нож fackelmann Happy разделочный с чехлом, 20\34см	2420630	Посуда (folder)/Посуда кухонная	41398	Fackelmann
1838758	4008033271059	Нож fackelmann Happy с широким лезвием с чехлом, 20\33см	2420630	Посуда (folder)/Посуда кухонная	41398	Fackelmann
1838759	4008033271028	Нож fackelmann Happy универсальный с чехлом, 12\24см	2420630	Посуда (folder)/Посуда кухонная	41398	Fackelmann
1783152	4008033433907	Нож fackelmann mega для овощей 18см	2420630	Посуда (folder)/Посуда кухонная	41398	Fackelmann
3866135	5907445218470	Нож fackelmann polonia для пиццы	279943	Посуда (folder)/Нож кухонный	41398	Fackelmann
3866136	5907445218234	Нож fackelmann polonia универ.с чехл.	279943	Посуда (folder)/Нож кухонный	41398	Fackelmann
1783154	1000000202342	Нож fackelmann rustika для овощей 17.5см	2420630	Посуда (folder)/Посуда кухонная	41398	Fackelmann
3866137	4027867417136	Нож fackelmann rustika для овощей 17.5см #2	279943	Посуда (folder)/Нож кухонный	41398	Fackelmann
3866138	4607020530409	Нож fackelmann rustika для овощей 17.5см #3	279943	Посуда (folder)/Нож кухонный	41398	Fackelmann
96637	4008033419819	Нож fackelmann tr.для чис.ов.с пл.л.в ас	2420630	Посуда (folder)/Посуда кухонная	41398	Fackelmann
95915	4008033432665	Нож fackelmann азиатский 16см 43266	2420630	Посуда (folder)/Посуда кухонная	41398	Fackelmann
95916	4008033432672	Нож fackelmann азиатский 22см 43267	2420630	Посуда (folder)/Посуда кухонная	41398	Fackelmann
95917	4008033432658	Нож fackelmann азиатский 9см 43265	2420630	Посуда (folder)/Посуда кухонная	41398	Fackelmann
95918	4008033420877	Нож fackelmann для бананов 42087	2420630	Посуда (folder)/Посуда кухонная	41398	Fackelmann
3866139	4008033407168	Нож fackelmann для вырезан.сердц.ябл.	279943	Посуда (folder)/Нож кухонный	41398	Fackelmann
3866140	6416884191644	Нож fackelmann для вырезан.сердц.ябл. #2	279943	Посуда (folder)/Нож кухонный	41398	Fackelmann
3866141	8006416720404	Нож fackelmann для вырезан.сердц.ябл. #3	279943	Посуда (folder)/Нож кухонный	41398	Fackelmann
95934	4008033490214	Нож fackelmann для вырезания сердцевины ябл	2420630	Посуда (folder)/Посуда кухонная	41398	Fackelmann
778008	4008033490160	Нож fackelmann для декорир.овощей/фруктов 23см 49016	2420630	Посуда (folder)/Посуда кухонная	41398	Fackelmann
3444225	4008033489904	Нож fackelmann для зелени пластик.30см	1	Неклассифицированные/default	41398	Fackelmann
95920	4008033419444	Нож fackelmann для овощей 15см 41944	2420630	Посуда (folder)/Посуда кухонная	41398	Fackelmann
95925	4008033490146	Нож fackelmann для овощей фигурн.нерж.49014	2420630	Посуда (folder)/Посуда кухонная	41398	Fackelmann
3444017	4008033243742	Нож fackelmann для пиццы	1	Неклассифицированные/default	0	
3866142	4008033407144	Нож fackelmann для пиццы #2	279943	Посуда (folder)/Нож кухонный	41398	Fackelmann
95927	4008033626316	Нож fackelmann для пиццы 626031	2420630	Посуда (folder)/Посуда кухонная	41398	Fackelmann
95928	4008033432306	Нож fackelmann для помидоров 43230	2420630	Посуда (folder)/Посуда кухонная	41398	Fackelmann
3866143	4008033407076	Нож fackelmann для сыра	279943	Посуда (folder)/Нож кухонный	41398	Fackelmann
95932	4008033458610	Нож fackelmann для сыра индивид,упак.	2420630	Посуда (folder)/Посуда кухонная	41398	Fackelmann
3866144	8006416727403	Нож fackelmann для сыра индивид,упак. #2	279943	Посуда (folder)/Нож кухонный	41398	Fackelmann
96638	4008033482288	Нож fackelmann для чистки овощ. нерж ст	2420630	Посуда (folder)/Посуда кухонная	41398	Fackelmann
3866145	4008033407120	Нож fackelmann для чистки овощей	279943	Посуда (folder)/Нож кухонный	41398	Fackelmann
95937	4008033433945	Нож fackelmann мега кух.21см 43394	2420630	Посуда (folder)/Посуда кухонная	41398	Fackelmann
95938	4008033433990	Нож fackelmann мега кух.25см 43399	2420630	Посуда (folder)/Посуда кухонная	41398	Fackelmann
95939	4008033433952	Нож fackelmann мега кух.30см 43395	2420630	Посуда (folder)/Посуда кухонная	41398	Fackelmann
778010	4008033404044	Нож fackelmann нироста для мяса 23.5см 40404	2420630	Посуда (folder)/Посуда кухонная	41398	Fackelmann
95941	4008033417136	Нож fackelmann рустика для овощей 41713	2420630	Посуда (folder)/Посуда кухонная	41398	Fackelmann
95942	4008033417235	Нож fackelmann рустика кух.21.5см 41723	2420630	Посуда (folder)/Посуда кухонная	41398	Fackelmann
95943	4008033417518	Нож fackelmann рустика кух.25см 41751	2420630	Посуда (folder)/Посуда кухонная	41398	Fackelmann
95944	4008033417310	Нож fackelmann рустика кух.29см 41731	2420630	Посуда (folder)/Посуда кухонная	41398	Fackelmann
95946	4008033420464	Нож fackelmann тренд для овощей 42046	2420630	Посуда (folder)/Посуда кухонная	41398	Fackelmann
95947	4008033417709	Нож fackelmann ультра для овощей 18см 41770	2420630	Посуда (folder)/Посуда кухонная	41398	Fackelmann
95948	4008033417723	Нож fackelmann ультра для овощей 24см 41772	2420630	Посуда (folder)/Посуда кухонная	41398	Fackelmann
95950	4008033420273	Нож fackelmann фанни для масла 18.5см 42027	2420630	Посуда (folder)/Посуда кухонная	41398	Fackelmann
95951	4008033420037	Нож fackelmann фанни для фруктов 42003	2420630	Посуда (folder)/Посуда кухонная	41398	Fackelmann
3444018	4680259008222	Нож falco универсальный усиленный фикстатор сегментированные лезвия м/у	1	Неклассифицированные/default	0	
320203	5710844020854	Нож fissman fuji 20см	279943	Посуда (folder)/Нож кухонный	310511	GIPFEL
320204	5710844020892	Нож fissman fuji 9см	279943	Посуда (folder)/Нож кухонный	310511	GIPFEL
320299	5710844020663	Нож fissman tropico 9см в чехле	279943	Посуда (folder)/Нож кухонный	310511	GIPFEL
320300	5710844021066	Нож fissman typhoon 9см	279943	Посуда (folder)/Нож кухонный	310511	GIPFEL
320301	5710844020779	Нож fissman Ultra 15см	279943	Посуда (folder)/Нож кухонный	310511	GIPFEL
320302	5710844020809	Нож fissman Ultra 9см	279943	Посуда (folder)/Нож кухонный	310511	GIPFEL
3444019	8404880103752	Нож fit для напольных покрытий арт.10375 пл/упак	1	Неклассифицированные/default	0	
3444020	8404880102533	Нож fit технический вращающийся 18мм	1	Неклассифицированные/default	0	
3444021	8404880102281	Нож fit технический усиленный 18мм	1	Неклассифицированные/default	0	
95982	9007861050800	Нож fortuna для нарезки мяса 15см	279943	Посуда (folder)/Нож кухонный	53548	Фортуна
95984	9007861051005	Нож fortuna для нарезки мяса 20см	279943	Посуда (folder)/Нож кухонный	53548	Фортуна
96011	9007861031168	Нож fortuna столовый 2шт вs03-в	2420630	Посуда (folder)/Посуда кухонная	53548	Фортуна
96012	9007861030376	Нож fortuna столовый 3шт вs03-в	2420630	Посуда (folder)/Посуда кухонная	53548	Фортуна
3444022	8809355850207	Нож Fruit knife перочинный с открывашкой тв/уп	1	Неклассифицированные/default	0	
3444023	4606900921795	Нож funny Home для сыра нержавеющая сталь пластик 24см	1	Неклассифицированные/default	0	
778316	4603299116818	Нож gd-225 a2 пистолетный с круглым фиксатором 18мм блистер	41797	Инструменты (folder)/Инструмент	0	
3444024	8807775100209	Нож giantдля овощей, пластмассовая ручка м/уп	1	Неклассифицированные/default	0	
320202	4250195169211	Нож gipfel Corona 9cм	279943	Посуда (folder)/Нож кухонный	310511	GIPFEL
320298	4250195168559	Нож gipfel trend 9см	279943	Посуда (folder)/Нож кухонный	310511	GIPFEL
3444025	3830000834582	Нож glaretti для томатов	1	Неклассифицированные/default	0	
3444026	6900000059395	Нож globus сталь	1	Неклассифицированные/default	0	
3444027	6900000059388	Нож globus сталь+пластик	1	Неклассифицированные/default	0	
3444028	6900576570010	Нож globus сталь+пластик 3шт 16557-7	1	Неклассифицированные/default	0	
3444029	6933131520014	Нож Golden Star керамический универсальный	1	Неклассифицированные/default	0	
3444030	8692531002473	Нож gondol для удаления сердцевины	1	Неклассифицированные/default	0	
3444031	6918341310297	Нож gotoff 10см керам/лезвие	1	Неклассифицированные/default	0	
3444032	6918341310310	Нож gotoff 12.5см керам/лезвие	1	Неклассифицированные/default	0	
3444033	6919940478579	Нож gotoff 12.5см с керам.лезв черный	1	Неклассифицированные/default	0	
3444034	6918341310334	Нож gotoff 15см керам/лезвие	1	Неклассифицированные/default	0	
3444035	6919940478548	Нож gotoff 17.5см с керам.лезв алый	1	Неклассифицированные/default	0	
3444036	6919940478500	Нож gotoff 7.5 cm c керам. лезв алый	1	Неклассифицированные/default	0	
3444037	6918341310273	Нож gotoff 7.5см керам/лезвие	1	Неклассифицированные/default	0	
3444038	6919341110276	Нож gotoff для пиццы	1	Неклассифицированные/default	0	
320205	5413821399652	Нож gourmet Line berghoff	279943	Посуда (folder)/Нож кухонный	308727	BergHOFF
2969486	5413821399539	Нож gourmet Line berghoff #2	279943	Посуда (folder)/Нож кухонный	308727	BergHOFF
320206	5413821399584	Нож gourmet Line большой шинков. 26см berghoff	279943	Посуда (folder)/Нож кухонный	308727	BergHOFF
320207	5413821399720	Нож gourmet Line для булочек berghoff	279943	Посуда (folder)/Нож кухонный	308727	BergHOFF
320208	5413821399553	Нож gourmet Line для мяса 18см berghoff	279943	Посуда (folder)/Нож кухонный	308727	BergHOFF
320209	5413821399744	Нож gourmet Line для нарезки ошейка 12см berghoff	279943	Посуда (folder)/Нож кухонный	308727	BergHOFF
320210	5413821399782	Нож gourmet Line для разделки 15см berghoff	279943	Посуда (folder)/Нож кухонный	308727	BergHOFF
1688003	5413821399775	Нож gourmet Line для разделки berghoff	1	Неклассифицированные/default	308727	BergHOFF
320211	5413821399836	Нож gourmet Line для рыбы и птицы 20см berghoff	279943	Посуда (folder)/Нож кухонный	308727	BergHOFF
320212	5413821399638	Нож gourmet Line для срезки мяса 10см berghoff	279943	Посуда (folder)/Нож кухонный	308727	BergHOFF
320213	5413821399812	Нож gourmet Line для срезки мяса 15см berghoff	279943	Посуда (folder)/Нож кухонный	308727	BergHOFF
320214	5413821399737	Нож gourmet Line для срезки мяса с костей berghoff	279943	Посуда (folder)/Нож кухонный	308727	BergHOFF
320215	5413821399713	Нож gourmet Line для сыра berghoff	279943	Посуда (folder)/Нож кухонный	308727	BergHOFF
320216	5413821399607	Нож gourmet Line для тонкой нарез. мяса 18см berghoff	279943	Посуда (folder)/Нож кухонный	308727	BergHOFF
320217	5413821399805	Нож gourmet Line для тонкой срезки мяса 13см berghoff	279943	Посуда (folder)/Нож кухонный	308727	BergHOFF
320218	5413821399829	Нож gourmet Line для тонкой срезки мяса 15см berghoff	279943	Посуда (folder)/Нож кухонный	308727	BergHOFF
320219	5413821399508	Нож gourmet Line для фруктов berghoff	279943	Посуда (folder)/Нож кухонный	308727	BergHOFF
320221	5413821399621	Нож gourmet Line овощн. berghoff	279943	Посуда (folder)/Нож кухонный	308727	BergHOFF
320222	5413821399614	Нож gourmet Line овощн. шинков. 9см berghoff	279943	Посуда (folder)/Нож кухонный	308727	BergHOFF
778011	5413821399515	Нож gourmet Line овощн. шинков. 9см berghoff #2	2420630	Посуда (folder)/Посуда кухонная	308727	BergHOFF
320223	5413821399768	Нож gourmet Line поварской 15см berghoff	279943	Посуда (folder)/Нож кухонный	308727	BergHOFF
320224	5413821399546	Нож gourmet Line поварской 20см berghoff	279943	Посуда (folder)/Нож кухонный	308727	BergHOFF
2969487	5413821399522	Нож gourmet Line поварской 20см berghoff #2	279943	Посуда (folder)/Нож кухонный	308727	BergHOFF
320225	5413821399751	Нож gourmet Line разделочный 18см berghoff	279943	Посуда (folder)/Нож кухонный	308727	BergHOFF
320226	5413821399560	Нож gourmet Line разделочный мясн. 18см berghoff	279943	Посуда (folder)/Нож кухонный	308727	BergHOFF
320227	5413821399669	Нож gourmet Line разделочный мясн. 26см berghoff	279943	Посуда (folder)/Нож кухонный	308727	BergHOFF
1688004	5413821399799	Нож gourmet Line универсальный berghoff	1	Неклассифицированные/default	308727	BergHOFF
320228	5413821399485	Нож gourmet Line японский 18см berghoff	279943	Посуда (folder)/Нож кухонный	308727	BergHOFF
3444039	4603001077376	Нож Green top керам. универсал. 150мм	1	Неклассифицированные/default	0	
3444040	6900000005101	Нож Happy Family для пиццы сталь	1	Неклассифицированные/default	0	
3444041	6900502190015	Нож Happy favily для чистки картофеля металл	1	Неклассифицированные/default	0	
3443926	8435764131790	Нож Happy Home #5	1	Неклассифицированные/default	0	
3443928	8435764131561	Нож Happy Home 14131-д56	1	Неклассифицированные/default	0	
3443929	8435764131592	Нож Happy Home 14131-д59	1	Неклассифицированные/default	0	
3443930	8435764131646	Нож Happy Home 14131-д64	1	Неклассифицированные/default	0	
3443931	8435764131653	Нож Happy Home 14131-д65	1	Неклассифицированные/default	0	
3443932	8435764131677	Нож Happy Home 14131-д67	1	Неклассифицированные/default	0	
3443933	8435764131707	Нож Happy Home 14131-д70	1	Неклассифицированные/default	0	
3443934	8435764131714	Нож Happy Home 14131-д71	1	Неклассифицированные/default	0	
3444042	6900288994449	Нож Happy Home декоративный сталь	1	Неклассифицированные/default	0	
3444278	8435764131684	Нож Happy Home Золотая комета 14131-д68	1	Неклассифицированные/default	0	
3444043	6900608190018	Нож Happy Home складной 8шт	1	Неклассифицированные/default	0	
3444044	6900000046029	Нож Happy Home сталь	1	Неклассифицированные/default	0	
3444045	6900608260018	Нож Happy Home сталь #2	1	Неклассифицированные/default	0	
3444046	6902586921936	Нож Happy Home сталь #3	1	Неклассифицированные/default	0	
3444047	7862006263994	Нож Happy Home сталь #4	1	Неклассифицированные/default	0	
3444048	8435764131578	Нож Happy Home сталь #5	1	Неклассифицированные/default	0	
3444049	8435764131585	Нож Happy Home сталь #6	1	Неклассифицированные/default	0	
3444050	6900000018316	Нож Happy Home сталь а-1 7 дюймов	1	Неклассифицированные/default	0	
3444051	6900000045909	Нож Happy homeсталь	1	Неклассифицированные/default	0	
3444052	5905061014261	Нож hardy универсальный 18мм 0510-261800	1	Неклассифицированные/default	0	
3866146	4623722077271	Нож hausmade chief кух.повар.20см	279943	Посуда (folder)/Нож кухонный	0	
3866147	4623722077318	Нож hausmade chiefpro кух.повар.20см	279943	Посуда (folder)/Нож кухонный	0	
3866148	4623722077301	Нож hausmade paring кух.для овощ/фрукт.9см	279943	Посуда (folder)/Нож кухонный	0	
3866149	4623722077349	Нож hausmade paringpro кух.для ов/фр.9см	279943	Посуда (folder)/Нож кухонный	0	
3866150	4623722077288	Нож hausmade santoku кух.18см	279943	Посуда (folder)/Нож кухонный	0	
3866151	4623722077325	Нож hausmade santokupro кух.18см	279943	Посуда (folder)/Нож кухонный	0	
3866152	4623722077295	Нож hausmade utility кух.унив.12.5см	279943	Посуда (folder)/Нож кухонный	0	
3866153	4623722077332	Нож hausmade utilitypro кух.унив.12.5см	279943	Посуда (folder)/Нож кухонный	0	
778199	6946472110240	Нож hausmann для хлеба 200мм м/уп	279943	Посуда (folder)/Нож кухонный	0	
777981	8711155244257	Нож Helena 2шт	3536	Хозяйственные товары (folder)/Хозяйственные товары	0	
3866154	5602294562223	Нож herdmar milano навеска	38328	Посуда (folder)/Посуда столовая, предметы сервировки	3671500	HERDMAR
3866155	5605244295929	Нож herdmar milano навеска #2	38328	Посуда (folder)/Посуда столовая, предметы сервировки	3671500	HERDMAR
149374	4009803036052	Нож hobby knife w breakoff blade с отламываемыми лезвиями	693509	Товары для творчества (folder)/Модели для сборки	145234	Revell
96019	5029138900452	Нож Home accessories поварск.s90045	2420630	Посуда (folder)/Посуда кухонная	77239	Home Accessories
96020	5029138900445	Нож Home accessories универс s90044	2420630	Посуда (folder)/Посуда кухонная	77239	Home Accessories
608153	4018093050396	Нож ideal для тонкой нарезки 20с	3536	Хозяйственные товары (folder)/Хозяйственные товары	0	
608154	4018093051096	Нож ideal для чистки 9см	3536	Хозяйственные товары (folder)/Хозяйственные товары	0	
608155	4018093050990	Нож ideal овощной-универсал 13	3536	Хозяйственные товары (folder)/Хозяйственные товары	0	
608156	4018093050495	Нож ideal поварской 15см 1 шту	3536	Хозяйственные товары (folder)/Хозяйственные товары	0	
608157	4018093050198	Нож ideal разделочный 20см 1 ш	3536	Хозяйственные товары (folder)/Хозяйственные товары	0	
608158	4018093054097	Нож ideal сырный 13см 1 штука	3536	Хозяйственные товары (folder)/Хозяйственные товары	0	
608159	4018093050891	Нож ideal универсальный 13см	3536	Хозяйственные товары (folder)/Хозяйственные товары	0	
608160	4018093053090	Нож ideal филейный 15см 1 штук	3536	Хозяйственные товары (folder)/Хозяйственные товары	0	
