ID	UPCEAN	Name	CategoryID	CategoryName	BrandID	BrandName
3293807	4607069765930	Вода минеральная завьяловская газированная 0.5л пл/бут	48140	Продукты питания (folder)/Напитки безалкогольные/Вода минеральная	3775115	ZAV'YALOVSKAYA (BOCHKARYOVSKIY PIVZD/S.BOCHKARI ALTA)
3293808	4607069765893	Вода минеральная завьяловская газированная 1.5л	48140	Продукты питания (folder)/Напитки безалкогольные/Вода минеральная	3775115	ZAV'YALOVSKAYA (BOCHKARYOVSKIY PIVZD/S.BOCHKARI ALTA)
3293809	4607069765879	Вода минеральная завьяловская лечебно-столовая газированная 0.5л пл/бут	48140	Продукты питания (folder)/Напитки безалкогольные/Вода минеральная	3775115	ZAV'YALOVSKAYA (BOCHKARYOVSKIY PIVZD/S.BOCHKARI ALTA)
1196852	4820071280059	Вода минеральная закарпатская высокогорная негаз 0.5л	48140	Продукты питания (folder)/Напитки безалкогольные/Вода минеральная	0	
1196853	4820071280035	Вода минеральная закарпатская высокогорная сл/газ 0.5л	48140	Продукты питания (folder)/Напитки безалкогольные/Вода минеральная	0	
1196854	4820071280042	Вода минеральная закарпатская высокогорная сл/газ. 1.5л	48140	Продукты питания (folder)/Напитки безалкогольные/Вода минеральная	0	
1196855	4820071280011	Вода минеральная закарпатская высокогорон.негаз 6л	48140	Продукты питания (folder)/Напитки безалкогольные/Вода минеральная	0	
1196856	4820071280028	Вода минеральная закарпатская высокогороная негаз 1.5л	48140	Продукты питания (folder)/Напитки безалкогольные/Вода минеральная	0	
1196857	4820080410027	Вода минеральная закарпатья лужанская 1.5л	48140	Продукты питания (folder)/Напитки безалкогольные/Вода минеральная	0	
1196858	4820009490093	Вода минеральная закарпатья полоскивська негаз 1.5л	48140	Продукты питания (folder)/Напитки безалкогольные/Вода минеральная	0	
879215	4820080410010	Вода минеральная закарпатья поляна квасовая 1.5л	48140	Продукты питания (folder)/Напитки безалкогольные/Вода минеральная	0	
1196859	4820080410034	Вода минеральная закарпатья поляна купель 1.5л	48140	Продукты питания (folder)/Напитки безалкогольные/Вода минеральная	0	
1196860	4820009490062	Вода минеральная закарпатья поляна полоскивська 1.5л	48140	Продукты питания (folder)/Напитки безалкогольные/Вода минеральная	0	
2855872	4626016310115	Вода минеральная заповедная карелия 0.500 газ	48140	Продукты питания (folder)/Напитки безалкогольные/Вода минеральная	0	
2855873	4626016310122	Вода минеральная заповедная карелия 0.500 негаз	48140	Продукты питания (folder)/Напитки безалкогольные/Вода минеральная	0	
2855874	4626016310139	Вода минеральная заповедная карелия 1.5 газ	48140	Продукты питания (folder)/Напитки безалкогольные/Вода минеральная	0	
2855875	4626016310146	Вода минеральная заповедная карелия 1.5 негаз	48140	Продукты питания (folder)/Напитки безалкогольные/Вода минеральная	0	
452429	1019178683839	Вода минеральная заповедник 5л	48140	Продукты питания (folder)/Напитки безалкогольные/Вода минеральная	0	
48381	4607042720048	Вода минеральная заповедник газ 0.500	48140	Продукты питания (folder)/Напитки безалкогольные/Вода минеральная	48379	Заповедник
48382	4607042720031	Вода минеральная заповедник газ 1.500	48140	Продукты питания (folder)/Напитки безалкогольные/Вода минеральная	48379	Заповедник
2721154	4640001853920	Вода минеральная заповедник здоровья Ессентуки №17 газированная 1.5л пл/бут	48140	Продукты питания (folder)/Напитки безалкогольные/Вода минеральная	94032	Ессентуки
2427966	4640001853982	Вода минеральная заповедник здоровья Ессентуки №4 газированная 0.5л стбут	17388	Продукты питания (folder)/Напитки безалкогольные/Вода питьевая	94032	Ессентуки
2427994	460704272002	Вода минеральная заповедник негаз 0.500	17388	Продукты питания (folder)/Напитки безалкогольные/Вода питьевая	0	
48384	4607042720017	Вода минеральная заповедник негаз 1.500	48140	Продукты питания (folder)/Напитки безалкогольные/Вода минеральная	48379	Заповедник
2427995	4605674000422	Вода минеральная заповедник негаз 5.000	17388	Продукты питания (folder)/Напитки безалкогольные/Вода питьевая	0	
2721223	460083110193	Вода минеральная заповедный источник негазированная 1.5л	48140	Продукты питания (folder)/Напитки безалкогольные/Вода минеральная	0	
3293810	1939097237022	Вода минеральная зеленоградская 0.5л	48140	Продукты питания (folder)/Напитки безалкогольные/Вода минеральная	0	
3293811	4607046360028	Вода минеральная зеленоградская 0.5л #2	48140	Продукты питания (folder)/Напитки безалкогольные/Вода минеральная	3809314	зеленоградская (ZELENOGRADSKIY KOOPERATOR/KALININGRAD)
3293813	4607046360103	Вода минеральная зеленоградская 2л	48140	Продукты питания (folder)/Напитки безалкогольные/Вода минеральная	3809314	зеленоградская (ZELENOGRADSKIY KOOPERATOR/KALININGRAD)
3293814	4620006890571	Вода минеральная зеленоградская 2л дом	48140	Продукты питания (folder)/Напитки безалкогольные/Вода минеральная	0	
3293815	4620006890038	Вода минеральная зеленоградская 2л парус	48140	Продукты питания (folder)/Напитки безалкогольные/Вода минеральная	0	
3293816	4620006890991	Вода минеральная зеленоградская газированная 0.5л	48140	Продукты питания (folder)/Напитки безалкогольные/Вода минеральная	0	
3293818	4605022000012	Вода минеральная зеленоградская лечебная 0.5л ст/б	48140	Продукты питания (folder)/Напитки безалкогольные/Вода минеральная	3809312	зеленоградская (BALTIYSKIE AVUARI/KALININGRAD)
3293819	4620006890014	Вода минеральная зеленоградская лечебная 0.6л пл/б	48140	Продукты питания (folder)/Напитки безалкогольные/Вода минеральная	0	
3293822	4607046360110	Вода минеральная зеленоградская негазированная 3л пл/б	48140	Продукты питания (folder)/Напитки безалкогольные/Вода минеральная	0	
3293824	4620006890021	Вода минеральная зеленоградская природная газированная 1.5л пл/б	48140	Продукты питания (folder)/Напитки безалкогольные/Вода минеральная	0	
1196861	4820022950178	Вода минеральная Золотой колодец газ 0.5л	48140	Продукты питания (folder)/Напитки безалкогольные/Вода минеральная	0	
1196862	4820022950017	Вода минеральная Золотой колодец газ. 1.5л	48140	Продукты питания (folder)/Напитки безалкогольные/Вода минеральная	0	
1196863	4820022951014	Вода минеральная Золотой колодец газ. 2л	48140	Продукты питания (folder)/Напитки безалкогольные/Вода минеральная	0	
1196864	4820022950208	Вода минеральная Золотой колодец негаз 0.5л	48140	Продукты питания (folder)/Напитки безалкогольные/Вода минеральная	0	
1196865	4820022951649	Вода минеральная Золотой колодец негаз 0.5л #2	48140	Продукты питания (folder)/Напитки безалкогольные/Вода минеральная	0	
1196866	4820022950239	Вода минеральная Золотой колодец негаз 1.5л	48140	Продукты питания (folder)/Напитки безалкогольные/Вода минеральная	0	
1196867	4820022950819	Вода минеральная Золотой колодец негаз 1.5л #2	48140	Продукты питания (folder)/Напитки безалкогольные/Вода минеральная	0	
1196868	4820022950826	Вода минеральная Золотой колодец очищ. негаз 5л	48140	Продукты питания (folder)/Напитки безалкогольные/Вода минеральная	0	
1196869	4820022951304	Вода минеральная Золотой колодец сл/газ. 1.5л	48140	Продукты питания (folder)/Напитки безалкогольные/Вода минеральная	0	
2855876	4603476000039	Вода минеральная иверская газированная 1.5	48140	Продукты питания (folder)/Напитки безалкогольные/Вода минеральная	3675624	IVERSKAYA (AQUA-DON)
3293825	4607089580629	Вода минеральная ивкинская газированная 1.5л пл/бут	48140	Продукты питания (folder)/Напитки безалкогольные/Вода минеральная	3675651	IVKINSKAYA (MINERALNYE VODY VYATKI/KIROV)
3293826	4607089580650	Вода минеральная ивкинская негазированная 1.5л пл/бут	48140	Продукты питания (folder)/Напитки безалкогольные/Вода минеральная	3675651	IVKINSKAYA (MINERALNYE VODY VYATKI/KIROV)
1196870	4820003810514	Вода минеральная изумруд1 1.5л	48140	Продукты питания (folder)/Напитки безалкогольные/Вода минеральная	0	
1196871	4820003810026	Вода минеральная изумруд1 2л	48140	Продукты питания (folder)/Напитки безалкогольные/Вода минеральная	0	
1196872	4820003810088	Вода минеральная изумруд1 2л #2	48140	Продукты питания (folder)/Напитки безалкогольные/Вода минеральная	0	
1196873	4820003810194	Вода минеральная изумрудная 1 с/газ гидрокарбонатно-хлоридная 0.5л	48140	Продукты питания (folder)/Напитки безалкогольные/Вода минеральная	0	
1196874	4820003810187	Вода минеральная изумрудная с/газ хлоридно-натриевая 0.5л	48140	Продукты питания (folder)/Напитки безалкогольные/Вода минеральная	0	
1196875	4820003810521	Вода минеральная изумрудная-1 1.5л	48140	Продукты питания (folder)/Напитки безалкогольные/Вода минеральная	0	
3293827	4650064980037	Вода минеральная илишевская роса, природная, сторловая, газированная 0.6л, пл/б	48140	Продукты питания (folder)/Напитки безалкогольные/Вода минеральная	0	
3293828	4650064980051	Вода минеральная илишевская роса, природная, сторловая, газированная 1.5л пл/б	48140	Продукты питания (folder)/Напитки безалкогольные/Вода минеральная	0	
3293829	4607067471147	Вода минеральная ильинская 0.5л газированная	48140	Продукты питания (folder)/Напитки безалкогольные/Вода минеральная	0	
3293830	4607067471093	Вода минеральная ильинская 0.5л негазированная	48140	Продукты питания (folder)/Напитки безалкогольные/Вода минеральная	0	
3293831	4690101410004	Вода минеральная ильинская газированная 1.4л пл/бут	48140	Продукты питания (folder)/Напитки безалкогольные/Вода минеральная	3673933	ILYINSKAYA
3293832	4607024870013	Вода минеральная ильменит газированная 1.5л пл/бут	48140	Продукты питания (folder)/Напитки безалкогольные/Вода минеральная	3673929	ILMENIT (ILMENIT/CHEL.OBLAST)
3293833	4607024870563	Вода минеральная ильменит лимон газированная 0.5л пл/бут	48140	Продукты питания (folder)/Напитки безалкогольные/Вода минеральная	0	
3293834	4607024870570	Вода минеральная ильменит лимонад газированная 0.5л пл/бут	48140	Продукты питания (folder)/Напитки безалкогольные/Вода минеральная	0	
3293835	4607024870488	Вода минеральная ильменит негазированная 0.5л пл/бут	48140	Продукты питания (folder)/Напитки безалкогольные/Вода минеральная	3673929	ILMENIT (ILMENIT/CHEL.OBLAST)
3293836	4607024870020	Вода минеральная ильменит негазированная 5л пл/бут	48140	Продукты питания (folder)/Напитки безалкогольные/Вода минеральная	0	
3293837	4607024870556	Вода минеральная ильменит с ароматом ананаса среднегазированная 0.5л пл/бут	48140	Продукты питания (folder)/Напитки безалкогольные/Вода минеральная	0	
3293838	4607024870143	Вода минеральная ильменит с ароматом вишни газированная 1.5л пл/бут	48140	Продукты питания (folder)/Напитки безалкогольные/Вода минеральная	0	
3293839	4607024870129	Вода минеральная ильменит с ароматом груши газированная 1.5л пл/бут	48140	Продукты питания (folder)/Напитки безалкогольные/Вода минеральная	0	
3293840	4607024870099	Вода минеральная ильменит с ароматом черники среднегазированная 1.5л пл/б	48140	Продукты питания (folder)/Напитки безалкогольные/Вода минеральная	0	
3293841	4607024870495	Вода минеральная ильменит среднегазированная 0.5л стбут	48140	Продукты питания (folder)/Напитки безалкогольные/Вода минеральная	3673929	ILMENIT (ILMENIT/CHEL.OBLAST)
3293842	4607024870037	Вода минеральная ильменит столовая негазированная 1.5л пл/бут	48140	Продукты питания (folder)/Напитки безалкогольные/Вода минеральная	3673929	ILMENIT (ILMENIT/CHEL.OBLAST)
3293843	4607024870549	Вода минеральная ильменит яблоко газированная 0.5л пл/бут	48140	Продукты питания (folder)/Напитки безалкогольные/Вода минеральная	0	
3293844	4607127371103	Вода минеральная иремель аква газированная 1.5л пл/б	48140	Продукты питания (folder)/Напитки безалкогольные/Вода минеральная	0	
3293845	4680003300039	Вода минеральная ирендык негазированая 1.5л пл/бут	48140	Продукты питания (folder)/Напитки безалкогольные/Вода минеральная	3613558	AQUA IRENDYK (KIRILLOVA IP/CHELYABINSKAYA OBL.)
2855877	071545100180	Вода минеральная иркутская 0.6л газированная, иркутский завод розлива минеральных вод	48140	Продукты питания (folder)/Напитки безалкогольные/Вода минеральная	0	
2855878	4607154510049	Вода минеральная иркутская 0.6л слабогазированная, иркутский завод розлива минеральных вод	48140	Продукты питания (folder)/Напитки безалкогольные/Вода минеральная	3817955	иркутская (BAIKALSEA GK)
2855879	4607154510070	Вода минеральная иркутская 1.25л слабогазированная, иркутский завод розлива минеральных вод	48140	Продукты питания (folder)/Напитки безалкогольные/Вода минеральная	3817955	иркутская (BAIKALSEA GK)
3293846	4607154510018	Вода минеральная иркутская газированная 600мл пл/б	48140	Продукты питания (folder)/Напитки безалкогольные/Вода минеральная	3817955	иркутская (BAIKALSEA GK)
3293847	4607067472038	Вода минеральная исседония газированная 1.5л пл/б	48140	Продукты питания (folder)/Напитки безалкогольные/Вода минеральная	0	
3293848	4607007030816	Вода минеральная Исток серебряный газированная 0.5л пл/бут	48140	Продукты питания (folder)/Напитки безалкогольные/Вода минеральная	3748448	SEREBRYANNIY ISTOK (ISTOK/PENZA)
3293849	4607007030038	Вода минеральная Исток серебряный газированная 1.5л пл/бут	48140	Продукты питания (folder)/Напитки безалкогольные/Вода минеральная	3748448	SEREBRYANNIY ISTOK (ISTOK/PENZA)
3293850	4607007030809	Вода минеральная Исток хрустальный газированная 0.5л пл/бут	48140	Продукты питания (folder)/Напитки безалкогольные/Вода минеральная	3939621	хрустальный ISTOK (ISTOK/PENZA)
3293851	4607007030069	Вода минеральная Исток хрустальный газированная 1.5л пл/бут	48140	Продукты питания (folder)/Напитки безалкогольные/Вода минеральная	3939621	хрустальный ISTOK (ISTOK/PENZA)
3293852	4607007030090	Вода минеральная Исток целебный газированная 1.5л пл/бут	48140	Продукты питания (folder)/Напитки безалкогольные/Вода минеральная	3763948	TSELEBNIY ISTOK (ISTOK/PENZA)
3293854	4607046490480	Вода минеральная источник жизни газированная 1.5л пл/бут	48140	Продукты питания (folder)/Напитки безалкогольные/Вода минеральная	3818062	источник жизни
3293855	4607046490497	Вода минеральная источник жизни газированная 750мл пл/бут	48140	Продукты питания (folder)/Напитки безалкогольные/Вода минеральная	3818062	источник жизни
1760573	59027133	Вода минеральная источник марии 0.7л ст. остромечко	17388	Продукты питания (folder)/Напитки безалкогольные/Вода питьевая	0	
3293856	4601025114046	Вода минеральная источник столовая 1.5л пл/бут	48140	Продукты питания (folder)/Напитки безалкогольные/Вода минеральная	0	
3293857	4650067780245	Вода минеральная источники кавказа Ессентуки №17 газированная 0.5л стбут	48140	Продукты питания (folder)/Напитки безалкогольные/Вода минеральная	3807187	Ессентуки (AVANT AKVA MINERAL/ZHELEZNOVODSK)
3293858	4650067780054	Вода минеральная источники кавказа Ессентуки №17 газированная 1.5л пл/бут	48140	Продукты питания (folder)/Напитки безалкогольные/Вода минеральная	3818085	источники кавказа
2721211	4650067780542	Вода минеральная источники кавказа Ессентуки №4 0.5л стбут	48140	Продукты питания (folder)/Напитки безалкогольные/Вода минеральная	3818085	источники кавказа
2427985	4650067780016	Вода минеральная источники кавказа Ессентуки №4 газированная 1.5л пл/бут	17388	Продукты питания (folder)/Напитки безалкогольные/Вода питьевая	3807187	Ессентуки (AVANT AKVA MINERAL/ZHELEZNOVODSK)
3293859	4650067780566	Вода минеральная источники кавказа славяновская 0.5л стекло	48140	Продукты питания (folder)/Напитки безалкогольные/Вода минеральная	3818085	источники кавказа
2855880	4607103280092	Вода минеральная кавказ 1.5	48140	Продукты питания (folder)/Напитки безалкогольные/Вода минеральная	0	
3293860	4607038040150	Вода минеральная Кавказ газированная 1.5л пл/бут	48140	Продукты питания (folder)/Напитки безалкогольные/Вода минеральная	3679411	KAVKAZ (TRIERA KORP./BIYSK)
48385	4607025340683	Вода минеральная Кавказ/источник газ 1.500	48140	Продукты питания (folder)/Напитки безалкогольные/Вода минеральная	0	
3293861	4680011710073	Вода минеральная кавказкая здравница газированная 1.5 пл/б	48140	Продукты питания (folder)/Напитки безалкогольные/Вода минеральная	3679417	KAVKAZSKAYA ZDRAVNITSA (AQUA PREMIUM/Ессентуки)
3293862	4660017630391	Вода минеральная кавказская зравница Ессентуки газированная 1.5л пл/бут	48140	Продукты питания (folder)/Напитки безалкогольные/Вода минеральная	3807302	Ессентуки (PYATIGORSKIY ZAVOD MINERAL.VOD/PYATIGORS)
3293863	4600286103745	Вода минеральная кавказская ривьера Ессентуки №4 газировнная 0.5 стбут	48140	Продукты питания (folder)/Напитки безалкогольные/Вода минеральная	3807164	Ессентуки (ABP KHOLDING/STAVROPOLSKIY KRAY)
