ID	UPCEAN	Name	CategoryID	CategoryName	BrandID	BrandName
3293918	4607164850012	Вода минеральная красноусольская 2 газированная 1.5л пл/бут	48140	Продукты питания (folder)/Напитки безалкогольные/Вода минеральная	3795502	КРАСНОУСОЛЬСКАЯ
3293919	4607164850029	Вода минеральная красноусольская 2 негазированная 0.5л пл/бут	48140	Продукты питания (folder)/Напитки безалкогольные/Вода минеральная	3840873	красноусольская (KRASNOUSOLSKIY Z-D PO DOB.I ROZL.MIN.VOD)
3293920	4607116170052	Вода минеральная красноусольская газированная 0.6л пл/бут	48140	Продукты питания (folder)/Напитки безалкогольные/Вода минеральная	3840873	красноусольская (KRASNOUSOLSKIY Z-D PO DOB.I ROZL.MIN.VOD)
3293921	4607164850302	Вода минеральная красноусольская горная №3 негазированная 1.5л пл/б	48140	Продукты питания (folder)/Напитки безалкогольные/Вода минеральная	3795502	КРАСНОУСОЛЬСКАЯ
3293922	4607035420016	Вода минеральная красноусольская живая вода газированная 1.5л пл/б	48140	Продукты питания (folder)/Напитки безалкогольные/Вода минеральная	3840883	красноусольская (ZHIVAYA VODA/GAFUR.R-N/SAN.KRASNOUS.)
3293923	4607116170076	Вода минеральная красноусольская источник №12 негазированная 0.6л пл/бут	48140	Продукты питания (folder)/Напитки безалкогольные/Вода минеральная	3840873	красноусольская (KRASNOUSOLSKIY Z-D PO DOB.I ROZL.MIN.VOD)
3293924	4607127370281	Вода минеральная красноусольская Люкс природная газированная 1.5л пл/б	48140	Продукты питания (folder)/Напитки безалкогольные/Вода минеральная	3840873	красноусольская (KRASNOUSOLSKIY Z-D PO DOB.I ROZL.MIN.VOD)
3293925	4607127370489	Вода минеральная красноусольская Люкс с серебром природная газированная 0.5л пл/б	48140	Продукты питания (folder)/Напитки безалкогольные/Вода минеральная	3840869	красноусольская (ALEKSEEV IP/G.UCHALY BASHKIRIYA)
3293926	4607127370502	Вода минеральная красноусольская Люкс с серебром природная газированная 1.5л пл/б	48140	Продукты питания (folder)/Напитки безалкогольные/Вода минеральная	3840869	красноусольская (ALEKSEEV IP/G.UCHALY BASHKIRIYA)
3293927	4607035420184	Вода минеральная красноусольская негазированная лечебно-столовая №12 0.5л пл/б	48140	Продукты питания (folder)/Напитки безалкогольные/Вода минеральная	3840883	красноусольская (ZHIVAYA VODA/GAFUR.R-N/SAN.KRASNOUS.)
3293928	4607116170113	Вода минеральная красноусольская серебряная газированная 1.5л пл/бут	48140	Продукты питания (folder)/Напитки безалкогольные/Вода минеральная	3840873	красноусольская (KRASNOUSOLSKIY Z-D PO DOB.I ROZL.MIN.VOD)
3293929	4607116170014	Вода минеральная красноусольская среднегазированная 1.5л пл/бут	48140	Продукты питания (folder)/Напитки безалкогольные/Вода минеральная	3795502	КРАСНОУСОЛЬСКАЯ
3293930	4607127370243	Вода минеральная красноусольская целебная газированная 0.5л пл/бут	48140	Продукты питания (folder)/Напитки безалкогольные/Вода минеральная	3840869	красноусольская (ALEKSEEV IP/G.UCHALY BASHKIRIYA)
3293931	4607164850043	Вода минеральная красноусольская целебная газированная 0.5л пл/бут #2	48140	Продукты питания (folder)/Напитки безалкогольные/Вода минеральная	3840873	красноусольская (KRASNOUSOLSKIY Z-D PO DOB.I ROZL.MIN.VOD)
2721235	4607164850036	Вода минеральная красноусольская целебная №12 газированная 1.5л пл/бут	48140	Продукты питания (folder)/Напитки безалкогольные/Вода минеральная	3795502	КРАСНОУСОЛЬСКАЯ
2721234	460716485001	Вода минеральная красноусольская №2 газированная 1.5л целебная	48140	Продукты питания (folder)/Напитки безалкогольные/Вода минеральная	0	
3293932	4607035420023	Вода минеральная красноусольская, живая вода, негазированная 1.5л пл/б	48140	Продукты питания (folder)/Напитки безалкогольные/Вода минеральная	3840883	красноусольская (ZHIVAYA VODA/GAFUR.R-N/SAN.KRASNOUS.)
3293933	4607116170038	Вода минеральная красноусольская, негазированная 1.5л пл/б	48140	Продукты питания (folder)/Напитки безалкогольные/Вода минеральная	3840873	красноусольская (KRASNOUSOLSKIY Z-D PO DOB.I ROZL.MIN.VOD)
3293934	4607116170328	Вода минеральная красноусольская, негазированная, 0.5л пл/б	48140	Продукты питания (folder)/Напитки безалкогольные/Вода минеральная	3840873	красноусольская (KRASNOUSOLSKIY Z-D PO DOB.I ROZL.MIN.VOD)
3293935	4607110460012	Вода минеральная крещенский источник 0.5л газированная	48140	Продукты питания (folder)/Напитки безалкогольные/Вода минеральная	3685213	KRETSHENSKIY источник (KRETSHENSKIY ISTOK ALS/KURGAN. O.)
3293936	4607110460111	Вода минеральная крещенский источник газированная 1.5л пл/бут	48140	Продукты питания (folder)/Напитки безалкогольные/Вода минеральная	3685213	KRETSHENSKIY источник (KRETSHENSKIY ISTOK ALS/KURGAN. O.)
3293937	4607110460036	Вода минеральная крещенский источник лечебно-столовая негазированная 5л пл/б	48140	Продукты питания (folder)/Напитки безалкогольные/Вода минеральная	3685213	KRETSHENSKIY источник (KRETSHENSKIY ISTOK ALS/KURGAN. O.)
3293938	4607143630017	Вода минеральная Кристалл столовая газированная 1.5л пл/б	48140	Продукты питания (folder)/Напитки безалкогольные/Вода минеральная	3685301	KRISTALL (KRISTALL-2000/PRIMORSK.KRAY)
3293939	4607095800476	Вода минеральная кристаллайн газированная 0.5л стбут	48140	Продукты питания (folder)/Напитки безалкогольные/Вода минеральная	3685314	KRISTALLAYN (EKOLOGICHESKIY RESURS/EKATERINBURG)
3293940	4607095800179	Вода минеральная кристаллайн негазированная 0.5л	48140	Продукты питания (folder)/Напитки безалкогольные/Вода минеральная	3685314	KRISTALLAYN (EKOLOGICHESKIY RESURS/EKATERINBURG)
3293941	4607095800155	Вода минеральная кристаллайн негазированная 1.5л пл/бут	48140	Продукты питания (folder)/Напитки безалкогольные/Вода минеральная	3685314	KRISTALLAYN (EKOLOGICHESKIY RESURS/EKATERINBURG)
3293942	4607095800032	Вода минеральная кристаллайн с лимоном газированная 1.5л	48140	Продукты питания (folder)/Напитки безалкогольные/Вода минеральная	0	
3293943	4620009000083	Вода минеральная кристальная Долина газированная 1.5л пэт	48140	Продукты питания (folder)/Напитки безалкогольные/Вода минеральная	3841826	кристальная DOLINA (KRISTALL-TEREK/TEREK KBR)
3293944	4620009000069	Вода минеральная кристальная Долина негазированная 1.5л пэт	48140	Продукты питания (folder)/Напитки безалкогольные/Вода минеральная	3841826	кристальная DOLINA (KRISTALL-TEREK/TEREK KBR)
3795618	4627094870287	Вода минеральная круглый год аппетитно стол.газ.0.5л	48140	Продукты питания (folder)/Напитки безалкогольные/Вода минеральная	3795503	Круглый год аппетитно
3795619	4627094870300	Вода минеральная круглый год аппетитно стол.газ.1.5л	48140	Продукты питания (folder)/Напитки безалкогольные/Вода минеральная	3795503	Круглый год аппетитно
3795620	4627094870225	Вода минеральная круглый год аппетитно стол.негаз.0.5л	48140	Продукты питания (folder)/Напитки безалкогольные/Вода минеральная	3795503	Круглый год аппетитно
3795621	4627094870249	Вода минеральная круглый год аппетитно стол.негаз.1.5л	48140	Продукты питания (folder)/Напитки безалкогольные/Вода минеральная	3795503	Круглый год аппетитно
3795622	4627094870263	Вода минеральная круглый год аппетитно стол.негаз.5л	48140	Продукты питания (folder)/Напитки безалкогольные/Вода минеральная	3795503	Круглый год аппетитно
3293945	4607054600215	Вода минеральная Крым зауральский родник 1.5л пл/бут	48140	Продукты питания (folder)/Напитки безалкогольные/Вода минеральная	0	
1967512	4810355001715	Вода минеральная кстати лечеб.ст. 0.5л	48140	Продукты питания (folder)/Напитки безалкогольные/Вода минеральная	0	
1967513	4810355001708	Вода минеральная кстати лечебно-стол.газ, 1.5л	48140	Продукты питания (folder)/Напитки безалкогольные/Вода минеральная	0	
1284914	4600433600981	Вода минеральная кубай газированная 1.5л пл/бут	48140	Продукты питания (folder)/Напитки безалкогольные/Вода минеральная	3685751	KUBAY (MERKURIY GK/CHERKESK)
2721236	4600433601100	Вода минеральная кубай, спорт, негазированная 0.5л пл/б	48140	Продукты питания (folder)/Напитки безалкогольные/Вода минеральная	3685751	KUBAY (MERKURIY GK/CHERKESK)
2855888	4607058860011	Вода минеральная кука 0.5л курортная лечебно-столовая газированная, забайкальские минеральные воды	48140	Продукты питания (folder)/Напитки безалкогольные/Вода минеральная	3686415	KUKA курортная (KUKA KURORTNAYA/CHITA)
2855889	4610003950057	Вода минеральная кука 0.5л курортная лечебно-столовая газированная, забайкальские минеральные воды #2	48140	Продукты питания (folder)/Напитки безалкогольные/Вода минеральная	3686415	KUKA курортная (KUKA KURORTNAYA/CHITA)
2855887	4607059280030	Вода минеральная кука 0.5л №7 полиэт. упак., читинские ключи	48140	Продукты питания (folder)/Напитки безалкогольные/Вода минеральная	3686420	KUKA-7 (CHITINSKIE KLYUCHI)
3293946	4610003950033	Вода минеральная кука курортная 45 газированная 1л пл/б	48140	Продукты питания (folder)/Напитки безалкогольные/Вода минеральная	3686415	KUKA курортная (KUKA KURORTNAYA/CHITA)
3293947	4610003950156	Вода минеральная кука курортная газированная 1.25л пл/бут	48140	Продукты питания (folder)/Напитки безалкогольные/Вода минеральная	3686415	KUKA курортная (KUKA KURORTNAYA/CHITA)
3293948	4607059282065	Вода минеральная кука-7 лечебно-столовая газированная 1.5л пл/б	48140	Продукты питания (folder)/Напитки безалкогольные/Вода минеральная	3686420	KUKA-7 (CHITINSKIE KLYUCHI)
3293949	4607059280023	Вода минеральная кука-7 лечебно-столовая газированная 1л пл/б	48140	Продукты питания (folder)/Напитки безалкогольные/Вода минеральная	3686420	KUKA-7 (CHITINSKIE KLYUCHI)
3293950	4607038890809	Вода минеральная куказар апельсин газированная 1.5л пл/бут	48140	Продукты питания (folder)/Напитки безалкогольные/Вода минеральная	3892348	Родниковый KUKAZAR (ARKHIMED/NYAZEPETROVSK/CHELYAB.OBL.)
3293951	4601593003711	Вода минеральная куказар газированная 0.5л пл/бут	48140	Продукты питания (folder)/Напитки безалкогольные/Вода минеральная	3892348	Родниковый KUKAZAR (ARKHIMED/NYAZEPETROVSK/CHELYAB.OBL.)
3293952	4601593003759	Вода минеральная куказар газированная 1.5л пл/бут	48140	Продукты питания (folder)/Напитки безалкогольные/Вода минеральная	3892348	Родниковый KUKAZAR (ARKHIMED/NYAZEPETROVSK/CHELYAB.OBL.)
3293953	4601593003735	Вода минеральная куказар негазированная 0.5л пл/бут	48140	Продукты питания (folder)/Напитки безалкогольные/Вода минеральная	3892348	Родниковый KUKAZAR (ARKHIMED/NYAZEPETROVSK/CHELYAB.OBL.)
3293954	4607038890182	Вода минеральная куказар негазированная 0.5л пл/бут #2	48140	Продукты питания (folder)/Напитки безалкогольные/Вода минеральная	3892348	Родниковый KUKAZAR (ARKHIMED/NYAZEPETROVSK/CHELYAB.OBL.)
3293955	4601593003773	Вода минеральная куказар негазированная 1.5л пл/бут	48140	Продукты питания (folder)/Напитки безалкогольные/Вода минеральная	3892348	Родниковый KUKAZAR (ARKHIMED/NYAZEPETROVSK/CHELYAB.OBL.)
3293956	4607038891400	Вода минеральная куказар негазированная 1.5л пл/бут #2	48140	Продукты питания (folder)/Напитки безалкогольные/Вода минеральная	3892348	Родниковый KUKAZAR (ARKHIMED/NYAZEPETROVSK/CHELYAB.OBL.)
3293957	4601593003650	Вода минеральная куказар со вкусом лимона и лайма 1.5л пл/бут	48140	Продукты питания (folder)/Напитки безалкогольные/Вода минеральная	3892348	Родниковый KUKAZAR (ARKHIMED/NYAZEPETROVSK/CHELYAB.OBL.)
3293958	4660021340019	Вода минеральная куказар спорт негазированная 0.5л пл/бут	48140	Продукты питания (folder)/Напитки безалкогольные/Вода минеральная	3892348	Родниковый KUKAZAR (ARKHIMED/NYAZEPETROVSK/CHELYAB.OBL.)
3293959	4601593003599	Вода минеральная куказар среднегазированая со вкусом апельсина 1.5л пл/бут	48140	Продукты питания (folder)/Напитки безалкогольные/Вода минеральная	3892348	Родниковый KUKAZAR (ARKHIMED/NYAZEPETROVSK/CHELYAB.OBL.)
3293960	4660047470172	Вода минеральная куказар среднегазированая со вкусом вишни 1.5л пл/бут	48140	Продукты питания (folder)/Напитки безалкогольные/Вода минеральная	0	
3293961	4601593003636	Вода минеральная куказар среднегазированная со вкусом клубники 1.5л пл/бут	48140	Продукты питания (folder)/Напитки безалкогольные/Вода минеральная	3892348	Родниковый KUKAZAR (ARKHIMED/NYAZEPETROVSK/CHELYAB.OBL.)
3293962	4660047470141	Вода минеральная куказар среднегазированная со вкусом клубники 1.5л пл/бут #2	48140	Продукты питания (folder)/Напитки безалкогольные/Вода минеральная	0	
3293963	4660047470196	Вода минеральная куказар среднегазированная со вкусом лимон-лайма 1.5л пл/бут	48140	Продукты питания (folder)/Напитки безалкогольные/Вода минеральная	0	
3293964	4601593003674	Вода минеральная куказар среднегазированная со вкусом малины 1.5л пл/бут	48140	Продукты питания (folder)/Напитки безалкогольные/Вода минеральная	3892348	Родниковый KUKAZAR (ARKHIMED/NYAZEPETROVSK/CHELYAB.OBL.)
3293965	4607038890403	Вода минеральная куказар среднегазированная со вкусом малины 1.5л пл/бут #2	48140	Продукты питания (folder)/Напитки безалкогольные/Вода минеральная	3892348	Родниковый KUKAZAR (ARKHIMED/NYAZEPETROVSK/CHELYAB.OBL.)
3293966	4660047470158	Вода минеральная куказар среднегазированная со вкусом малины 1.5л пл/бут #3	48140	Продукты питания (folder)/Напитки безалкогольные/Вода минеральная	0	
3293967	4601593003698	Вода минеральная куказар среднегазированная со вкусом черной смородины 1.5л пл/бут	48140	Продукты питания (folder)/Напитки безалкогольные/Вода минеральная	3892348	Родниковый KUKAZAR (ARKHIMED/NYAZEPETROVSK/CHELYAB.OBL.)
3293968	4660047470165	Вода минеральная куказар среднегазированная со вкусом черной смородины 1.5л пл/бут #2	48140	Продукты питания (folder)/Напитки безалкогольные/Вода минеральная	0	
1196899	4870031001842	Вода минеральная кулагер с/г 1л	48140	Продукты питания (folder)/Напитки безалкогольные/Вода минеральная	0	
1196900	4870031000159	Вода минеральная кулагер-арасан с/г 1.5л	48140	Продукты питания (folder)/Напитки безалкогольные/Вода минеральная	3686471	KULAGER-ARASAN (KOKSHETAU MINERALVOD TOO)
1196663	4607082170018	Вода минеральная кургазак газированная 1.5л пл/бут	48140	Продукты питания (folder)/Напитки безалкогольные/Вода минеральная	3733798	POLIPRESS KURGAZ (POLIPRESS/KURGAZAK/P.CHULPAN/BASHK.)
3293970	4607110460159	Вода минеральная кургазак газированная 1.5л пл/бут #2	48140	Продукты питания (folder)/Напитки безалкогольные/Вода минеральная	3686673	KURGAZAK (ARKHIMED/NYAZEPETROVSK/CHELYAB.OBL.)
3293971	4607082170605	Вода минеральная кургазак негазированная 0.5л пл/бут	48140	Продукты питания (folder)/Напитки безалкогольные/Вода минеральная	3686675	KURGAZAK (SANATORIY YANGAN-TAU/SALAVT.R-N/BASHK.)
1196664	4607082170032	Вода минеральная кургазак негазированная 1.5л пл/бут	48140	Продукты питания (folder)/Напитки безалкогольные/Вода минеральная	3686675	KURGAZAK (SANATORIY YANGAN-TAU/SALAVT.R-N/BASHK.)
1196665	4607082170094	Вода минеральная кургазак негазированная 5л пл/бут	48140	Продукты питания (folder)/Напитки безалкогольные/Вода минеральная	0	
1196666	4607082170056	Вода минеральная кургазак с газом 0.5л	48140	Продукты питания (folder)/Напитки безалкогольные/Вода минеральная	0	
1244209	4607082170544	Вода минеральная кургазак с газом 1.1л	48140	Продукты питания (folder)/Напитки безалкогольные/Вода минеральная	0	
1244210	4607082170568	Вода минеральная кургазак, негазированная 1.1л, пл/б	48140	Продукты питания (folder)/Напитки безалкогольные/Вода минеральная	0	
3293972	4607038891585	Вода минеральная кургазар газированная 0.5л пл/бут	48140	Продукты питания (folder)/Напитки безалкогольные/Вода минеральная	3892348	Родниковый KUKAZAR (ARKHIMED/NYAZEPETROVSK/CHELYAB.OBL.)
3293973	4607067650016	Вода минеральная курган 1.5л пл/бут	48140	Продукты питания (folder)/Напитки безалкогольные/Вода минеральная	3729836	PAVA SHADRINSKAYA
3293974	4607067650047	Вода минеральная курган 500мл пл/бут	48140	Продукты питания (folder)/Напитки безалкогольные/Вода минеральная	0	
3293975	4680029460021	Вода минеральная курортный парк Ессентуки №4 1.5л пл/бут	48140	Продукты питания (folder)/Напитки безалкогольные/Вода минеральная	0	
1789831	4602441009442	Вода минеральная куртуа газированная 0.5л	48140	Продукты питания (folder)/Напитки безалкогольные/Вода минеральная	3639187	COURTOIS (AQUALIFE PK/MOSKOVSKAYA OBL.)
1789832	4602441009459	Вода минеральная куртуа негазированная 0.5л	48140	Продукты питания (folder)/Напитки безалкогольные/Вода минеральная	3639187	COURTOIS (AQUALIFE PK/MOSKOVSKAYA OBL.)
1196903	4607010850012	Вода минеральная куртяевская газированная 1.5л пл/б	48140	Продукты питания (folder)/Напитки безалкогольные/Вода минеральная	3686717	KURTYAEVSKAYA (ARKHMINVODY/G.ARKHANGELSK)
3293976	4607010850241	Вода минеральная куртяевская газированная 1.5л пл/б #2	48140	Продукты питания (folder)/Напитки безалкогольные/Вода минеральная	3686717	KURTYAEVSKAYA (ARKHMINVODY/G.ARKHANGELSK)
1196902	4607010850081	Вода минеральная куртяевская газированная 600мл пл/б	48140	Продукты питания (folder)/Напитки безалкогольные/Вода минеральная	3686717	KURTYAEVSKAYA (ARKHMINVODY/G.ARKHANGELSK)
1196904	4820001020625	Вода минеральная куяльник 0.5л	48140	Продукты питания (folder)/Напитки безалкогольные/Вода минеральная	0	
1196905	4820001020182	Вода минеральная куяльник 1л	48140	Продукты питания (folder)/Напитки безалкогольные/Вода минеральная	0	
