ID	UPCEAN	Name	CategoryID	CategoryName	BrandID	BrandName
2370776	070253104749	Our Family steamable broccoli cuts 12oz	2058983	Продукты питания (folder)/Fruits and Vegetables	2179760	Our Family
2650145	070253104824	Our Family steamable broccoli&cauliflower 12oz	2507362	Продукты питания (folder)/Fruits and Vegetables Frozen	2179760	Our Family
2686634	070253104619	Our Family steamable edamame in the pod 10oz	2507362	Продукты питания (folder)/Fruits and Vegetables Frozen	2179760	Our Family
2650147	070253104800	Our Family steamable Green beans cut 12oz	2507362	Продукты питания (folder)/Fruits and Vegetables Frozen	2179760	Our Family
2650148	070253104763	Our Family steamable Green peas 12oz	2507362	Продукты питания (folder)/Fruits and Vegetables Frozen	2179760	Our Family
2370829	070253267383	Our Family stewed mexican tomatoes 14.5oz	2058983	Продукты питания (folder)/Fruits and Vegetables	2179760	Our Family
2370830	070253267321	Our Family stewed tomatoes 14.5oz	2058983	Продукты питания (folder)/Fruits and Vegetables	2179760	Our Family
2370831	070253267338	Our Family stewed tomatoes 28oz	2058983	Продукты питания (folder)/Fruits and Vegetables	2179760	Our Family
2370832	070253267345	Our Family stewed tomatoes italian Blend 14.5oz	2058983	Продукты питания (folder)/Fruits and Vegetables	2179760	Our Family
2819702	070253500770	Our Family stickstwists mozz cheddar 10	1	Неклассифицированные/default	2179760	Our Family
2179810	070253104701	Our Family stir fry oriental 16oz	1	Неклассифицированные/default	2179760	Our Family
2819703	070253101700	Our Family strawberries 64oz	1	Неклассифицированные/default	2179760	Our Family
3177099	070253270185	Our Family strawberry preserves	330591	Продукты питания (folder)/Продукты питания	2179760	Our Family
1564300	070253270161	Our Family strawberry preserves 510g	22284	Продукты питания (folder)/Консервы (folder)/Консервы фруктовые	2179760	Our Family
3177100	070253288739	Our Family strawberry soda strawberry	330591	Продукты питания (folder)/Продукты питания	2179760	Our Family
2819704	070253500718	Our Family string Cheese 10oz	1	Неклассифицированные/default	2179760	Our Family
2819705	070253500282	Our Family string Cheese 12oz	1	Неклассифицированные/default	2179760	Our Family
2819706	070253500701	Our Family string Cheese Light 10oz	1	Неклассифицированные/default	2179760	Our Family
2819707	070253500428	Our Family string Cheese twists mozz w Color 12oz	1	Неклассифицированные/default	2179760	Our Family
3177101	070253272240	Our Family sunflower kernels	330591	Продукты питания (folder)/Продукты питания	2179760	Our Family
3177102	070253730603	Our Family sunflower kernels #2	330591	Продукты питания (folder)/Продукты питания	2179760	Our Family
2555665	070253104527	Our Family Super sweet cob corn	2507362	Продукты питания (folder)/Fruits and Vegetables Frozen	2179760	Our Family
2370833	070253104886	Our Family Super sweet cut corn 28oz	2058983	Продукты питания (folder)/Fruits and Vegetables	2179760	Our Family
2370795	070253104909	Our Family sweet Green peas 28oz	2058983	Продукты питания (folder)/Fruits and Vegetables	2179760	Our Family
3177103	070253161230	Our Family sweet Ice tea	330591	Продукты питания (folder)/Продукты питания	2179760	Our Family
3177104	070253284878	Our Family sweet jalapeno pepper relish	330591	Продукты питания (folder)/Продукты питания	2179760	Our Family
3177105	070253105340	Our Family sweet peas	330591	Продукты питания (folder)/Продукты питания	2179760	Our Family
2819708	070253265136	Our Family sweet peas 15.00oz	1	Неклассифицированные/default	2179760	Our Family
2370834	070253264924	Our Family sweet peas 8.5oz	2058983	Продукты питания (folder)/Fruits and Vegetables	2179760	Our Family
2179823	070253263880	Our Family sweet peas no salt added 15oz	1	Неклассифицированные/default	2179760	Our Family
2650149	070253284489	Our Family sweet relish	1	Неклассифицированные/default	2179760	Our Family
3177106	070253287220	Our Family sweet tea	330591	Продукты питания (folder)/Продукты питания	2179760	Our Family
3177107	070253227127	Our Family sweet&salty granola bars	330591	Продукты питания (folder)/Продукты питания	2179760	Our Family
2650150	070253227103	Our Family sweet&salty nut Peanut chewy granola bars	1	Неклассифицированные/default	2179760	Our Family
3177108	070253222221	Our Family sweetened applesauce	330591	Продукты питания (folder)/Продукты питания	2179760	Our Family
3177109	070253280252	Our Family sweetened corn&oat cereal, mighty berry curnch	330591	Продукты питания (folder)/Продукты питания	2179760	Our Family
3177110	070253180040	Our Family sweetened oat cereal with marshmallows	330591	Продукты питания (folder)/Продукты питания	2179760	Our Family
3177111	070253299506	Our Family sweetened whole Wheat&Rice cereal	330591	Продукты питания (folder)/Продукты питания	2179760	Our Family
2819709	070253501449	Our Family swiss 16oz	1	Неклассифицированные/default	2179760	Our Family
2819710	070253500862	Our Family swiss chunk block 8oz	1	Неклассифицированные/default	2179760	Our Family
3177112	070253291050	Our Family syrup	330591	Продукты питания (folder)/Продукты питания	2179760	Our Family
1564301	070253291005	Our Family syrup w/2% maple syrup 710ml	825927	Продукты питания (folder)/Сироп	2179760	Our Family
3177113	070253107924	Our Family tater puffs	330591	Продукты питания (folder)/Продукты питания	2179760	Our Family
3177114	070253267857	Our Family thick&chunky salsa	330591	Продукты питания (folder)/Продукты питания	2179760	Our Family
3177115	070253102288	Our Family thin crust pizza	330591	Продукты питания (folder)/Продукты питания	2179760	Our Family
3177116	070253102301	Our Family thin crust pizza #2	330591	Продукты питания (folder)/Продукты питания	2179760	Our Family
3177117	070253102264	Our Family thin crust supreme pizza	330591	Продукты питания (folder)/Продукты питания	2179760	Our Family
3177118	070253469947	Our Family thin spaghetti	330591	Продукты питания (folder)/Продукты питания	2179760	Our Family
3177119	070253266669	Our Family thin twists pretzel	330591	Продукты питания (folder)/Продукты питания	2179760	Our Family
2650151	070253281280	Our Family thousand island dressing	1	Неклассифицированные/default	2179760	Our Family
2819711	070253280290	Our Family toasted oats 12oz	1	Неклассифицированные/default	2179760	Our Family
2179824	070253298103	Our Family toasted oats 15oz	1	Неклассифицированные/default	2179760	Our Family
2370835	070253298790	Our Family toasted oats low fat oat cereal	31433	Продукты питания (folder)/Сухие завтраки	2179760	Our Family
2370774	070253298707	Our Family toasted Rice cereal	31433	Продукты питания (folder)/Сухие завтраки	2179760	Our Family
3177120	070253298837	Our Family toaster pastries	330591	Продукты питания (folder)/Продукты питания	2179760	Our Family
3177121	070253298882	Our Family toaster pastries #2	330591	Продукты питания (folder)/Продукты питания	2179760	Our Family
3177122	070253298905	Our Family toaster pastries #3	330591	Продукты питания (folder)/Продукты питания	2179760	Our Family
3177123	070253298943	Our Family toaster pastries #4	330591	Продукты питания (folder)/Продукты питания	2179760	Our Family
3177124	070253298967	Our Family toaster pastries #5	330591	Продукты питания (folder)/Продукты питания	2179760	Our Family
3177125	070253298974	Our Family toaster pastries #6	330591	Продукты питания (folder)/Продукты питания	2179760	Our Family
3177126	070253269400	Our Family tomato basil soup	330591	Продукты питания (folder)/Продукты питания	2179760	Our Family
3177127	070253286322	Our Family tomato ketchup	23472	Продукты питания (folder)/Кетчуп	2179760	Our Family
2370836	070253267710	Our Family tomato paste 12oz	2058983	Продукты питания (folder)/Fruits and Vegetables	2179760	Our Family
2370837	070253267703	Our Family tomato paste 6oz	2058983	Продукты питания (folder)/Fruits and Vegetables	2179760	Our Family
2370838	070253267727	Our Family tomato paste w/ basil, oregano, & garlic 6oz	2058983	Продукты питания (folder)/Fruits and Vegetables	2179760	Our Family
3177128	070253268106	Our Family tomato puree	330591	Продукты питания (folder)/Продукты питания	2179760	Our Family
3177129	070253268021	Our Family tomato sauce	330591	Продукты питания (folder)/Продукты питания	2179760	Our Family
3177130	070253268052	Our Family tomato sauce #2	330591	Продукты питания (folder)/Продукты питания	2179760	Our Family
2370839	070253267581	Our Family tomato sauce 15oz	2058983	Продукты питания (folder)/Fruits and Vegetables	2179760	Our Family
2370840	070253267567	Our Family tomato sauce 29oz	2058983	Продукты питания (folder)/Fruits and Vegetables	2179760	Our Family
2370841	070253267628	Our Family tomato sauce 8oz	2058983	Продукты питания (folder)/Fruits and Vegetables	2179760	Our Family
2370842	070253267611	Our Family tomato sauce no salt added 8oz	2058983	Продукты питания (folder)/Fruits and Vegetables	2179760	Our Family
2819712	070253180118	Our Family tortillas whwheat auth fajita 16oz 8ct	1	Неклассифицированные/default	2179760	Our Family
3177131	070253272172	Our Family trail Mix mountain	330591	Продукты питания (folder)/Продукты питания	2179760	Our Family
3177132	070253272219	Our Family trail Mix nut&berry	330591	Продукты питания (folder)/Продукты питания	2179760	Our Family
3177133	070253272196	Our Family trail Mix, Fruit&nut	330591	Продукты питания (folder)/Продукты питания	2179760	Our Family
3177134	070253226397	Our Family transformers Fruit snacks, Fruit	330591	Продукты питания (folder)/Продукты питания	2179760	Our Family
3176892	070253221453	Our Family triple Cherry mixed Fruit in Light syrup	330591	Продукты питания (folder)/Продукты питания	2179760	Our Family
3177135	070253730498	Our Family Tropical	330591	Продукты питания (folder)/Продукты питания	2179760	Our Family
3177136	070253730306	Our Family Tropical paradise nut Mix	330591	Продукты питания (folder)/Продукты питания	2179760	Our Family
2819713	070253299025	Our Family tuna fish chunk lite 6oz	1	Неклассифицированные/default	2179760	Our Family
3177137	070253106446	Our Family twisted garlic breadsticks	330591	Продукты питания (folder)/Продукты питания	2179760	Our Family
2370843	070253222245	Our Family unsweetened applesauce 23oz	2058983	Продукты питания (folder)/Fruits and Vegetables	2179760	Our Family
2370844	070253221316	Our Family unsweetened applesauce 24oz	2058983	Продукты питания (folder)/Fruits and Vegetables	2179760	Our Family
2179826	070253221163	Our Family unsweetened applesauce 25	1	Неклассифицированные/default	2179760	Our Family
2819714	070253222269	Our Family unsweetened applesauce 46oz	1	Неклассифицированные/default	2179760	Our Family
2650153	070253220852	Our Family vegetable Juice from conc 64floz	17374	Продукты питания (folder)/Напитки безалкогольные/Сок	2179760	Our Family
2650152	070253105043	Our Family vegetable soup Blend 16oz	2507362	Продукты питания (folder)/Fruits and Vegetables Frozen	2179760	Our Family
2704039	070253105036	Our Family vegetable stew Blend 16oz	2507362	Продукты питания (folder)/Fruits and Vegetables Frozen	2179760	Our Family
2370845	070253265099	Our Family very young sweet peas 15oz	2058983	Продукты питания (folder)/Fruits and Vegetables	2179760	Our Family
3177138	070253287572	Our Family vinegar	330591	Продукты питания (folder)/Продукты питания	2179760	Our Family
2370850	070253651007	Our Family vitamin d whole Milk 1 gal	67200	Продукты питания (folder)/Молочные продукты (folder)/Молоко, сливки	2179760	Our Family
1564302	070253466502	Our Family walnut pieces 170g	260335	Продукты питания (folder)/Снэки	2179760	Our Family
3177139	070253466786	Our Family walnuts chopped	330591	Продукты питания (folder)/Продукты питания	2179760	Our Family
3177140	070253466397	Our Family walnuts halves&pieces	330591	Продукты питания (folder)/Продукты питания	2179760	Our Family
2650154	070253279997	Our Family Wheat biscuits cereal	1	Неклассифицированные/default	2179760	Our Family
2819715	070253180200	Our Family White corn tortillas 16 count	1	Неклассифицированные/default	2179760	Our Family
2650155	070253220661	Our Family White grape Juice 64floz	17374	Продукты питания (folder)/Напитки безалкогольные/Сок	2179760	Our Family
2370846	070253223051	Our Family White Grapefruit Juice 64floz	17374	Продукты питания (folder)/Напитки безалкогольные/Сок	2179760	Our Family
3177141	070253265846	Our Family White Stone ground round tortilla chips	330591	Продукты питания (folder)/Продукты питания	2179760	Our Family
2370847	070253263378	Our Family whole beets 15oz	2058983	Продукты питания (folder)/Fruits and Vegetables	2179760	Our Family
2179827	070253264825	Our Family whole button mushrooms 7oz/4oz Dry	1	Неклассифицированные/default	2179760	Our Family
3177142	070253272288	Our Family whole cashews snack nuts	330591	Продукты питания (folder)/Продукты питания	2179760	Our Family
2179828	070253260971	Our Family whole Green beans 14.5oz	1	Неклассифицированные/default	2179760	Our Family
2709395	070253104534	Our Family whole Green beans 16oz	2507362	Продукты питания (folder)/Fruits and Vegetables Frozen	2179760	Our Family
2179829	070253104916	Our Family whole kernal corn 16oz	1	Неклассифицированные/default	2179760	Our Family
2179830	070253105401	Our Family whole kernal corn 32oz	1	Неклассифицированные/default	2179760	Our Family
2179831	070253263866	Our Family whole kernal corn no salt added 15.25oz	1	Неклассифицированные/default	2179760	Our Family
1564303	070253264153	Our Family whole kernal sweet corn 15.25oz	65	Продукты питания (folder)/Консервы (folder)/Консервы овощные	2179760	Our Family
2370849	070253104725	Our Family whole kernel corn steamable 12oz	2058983	Продукты питания (folder)/Fruits and Vegetables	2179760	Our Family
2819716	070253651472	Our Family whole Milk 1/2 gallon	1	Неклассифицированные/default	2179760	Our Family
2709420	070253651410	Our Family whole Milk ? gallon	67200	Продукты питания (folder)/Молочные продукты (folder)/Молоко, сливки	2179760	Our Family
3177143	070253283574	Our Family whole peppers pepperoncini	330591	Продукты питания (folder)/Продукты питания	2179760	Our Family
2709405	070253102202	Our Family whole strawberries 40oz	2507362	Продукты питания (folder)/Fruits and Vegetables Frozen	2179760	Our Family
2179833	070253267222	Our Family whole tomatoes 14.5oz	1	Неклассифицированные/default	2179760	Our Family
2179834	070253267246	Our Family whole tomatoes 28oz	1	Неклассифицированные/default	2179760	Our Family
2819717	070253469879	Our Family whole Wheat penne rigate 16oz	1	Неклассифицированные/default	2179760	Our Family
2819718	070253469886	Our Family whole Wheat rotini 16oz	1	Неклассифицированные/default	2179760	Our Family
2819719	070253469855	Our Family whole Wheat spaghetti 16oz	1	Неклассифицированные/default	2179760	Our Family
2819720	070253469862	Our Family whole Wheat thin spaghetti 16oz	1	Неклассифицированные/default	2179760	Our Family
2819721	070253180149	Our Family whole Wheat tortillas 16oz	1	Неклассифицированные/default	2179760	Our Family
1564304	070253226106	Our Family Yellow cling peaches 248g	22284	Продукты питания (folder)/Консервы (folder)/Консервы фруктовые	2179760	Our Family
2819722	070253180194	Our Family Yellow corn tortillas 24 coun	1	Неклассифицированные/default	2179760	Our Family
3177144	070253285219	Our Family Yellow mustard	28300	Продукты питания (folder)/Горчица	2179760	Our Family
3177145	070253285226	Our Family Yellow mustard #2	28300	Продукты питания (folder)/Горчица	2179760	Our Family
3177146	070253720000	Our Family yogurt pretzels	330591	Продукты питания (folder)/Продукты питания	2179760	Our Family
3177147	070253283550	Our Family zesty garlic chips pickles	330591	Продукты питания (folder)/Продукты питания	2179760	Our Family
1564305	737780031466	Our favorite coffee cake	1	Неклассифицированные/default	0	
1564306	736211543943	Our finest regards glass 22oz	1	Неклассифицированные/default	0	
2002344	716770047724	Our g Blue (d)	1980180	Adult/Discontinued (Manufactures)	0	
2002343	716770047731	Our g Red (d)	1980180	Adult/Discontinued (Manufactures)	0	
3727585	062243251144	Our generation dolls игровой набор походный	712606	Игрушки (folder)/Куклы	3727584	GENERATION DOLLS
3727586	062243250963	Our generation dolls игровой набор с ванной для кукл.46см	712606	Игрушки (folder)/Куклы	3727584	GENERATION DOLLS
1748573	062243243439	Our generation pink camping set for 18inch dolls	980	Игрушки (folder)/Игрушки	0	
2370851	4800073910093	Our god+ Shampoo oatml&bksoda 500ml	337596	Товары для животных (folder)/Pets	0	
3177148	180855000469	Our house salsa	330591	Продукты питания (folder)/Продукты питания	0	
3177149	180855000476	Our house salsa #2	330591	Продукты питания (folder)/Продукты питания	0	
3177150	073484295132	Our house, all purpose baking Mix	330591	Продукты питания (folder)/Продукты питания	0	
3177151	073484293015	Our house, all purpose flour	330591	Продукты питания (folder)/Продукты питания	0	
3177152	073484298010	Our house, cookie Mix	330591	Продукты питания (folder)/Продукты питания	0	
3177153	073484293800	Our house, cornbread Mix	330591	Продукты питания (folder)/Продукты питания	0	
2650156	5099750878026	Our Lady peace - gravity CD sony508780	2275105	Медиа (folder)/Медиа	0	
1928383	746480038767	Our moment for women 1.0oz EDP spray by One direction	3068	Парфюмерия (folder)/Парфюмерия	1803328	One Direction
1928384	746480052336	Our moment for women 2pcs gift set by One direction	1	Неклассифицированные/default	1803328	One Direction
3177154	077387801155	Our Old italian brand, pepperoni pizza	330591	Продукты питания (folder)/Продукты питания	0	
3177155	087848064296	Our Original pork skins	330591	Продукты питания (folder)/Продукты питания	0	
3177156	087848064937	Our Original puffs	330591	Продукты питания (folder)/Продукты питания	0	
3177157	076310440034	Our Original recipe featuring Classic vanilla Ice Cream loaded with real oreo cookies	330591	Продукты питания (folder)/Продукты питания	0	
3177158	648036001938	Our premium meatballs in gravy	330591	Продукты питания (folder)/Продукты питания	0	
1564307	799953075202	Our pride chewing tobacco	1	Неклассифицированные/default	0	
1564308	799953076209	Our pride chewing tobacco #2	1	Неклассифицированные/default	0	
1564309	799953076308	Our pride Peach chew tobacco	1	Неклассифицированные/default	0	
1564310	799953075301	Our pride sweet chew tobacco	1	Неклассифицированные/default	0	
3177159	076310440010	Our signature Family recipe featuring Butter-roasted pecans and brown sugar	330591	Продукты питания (folder)/Продукты питания	0	
2602123	076310080025	Our signature homemade chocolate chips swirled into madagascar vanilla Ice Cream	1	Неклассифицированные/default	2154386	HomeMade
400044	072783000591	Our Special ale glass 50.7oz	1	Неклассифицированные/default	0	
3177160	049800143326	Our speciality, strawberry frosted sugar cookies	330591	Продукты питания (folder)/Продукты питания	0	
2650158	049800132535	Our specialty frz cookie choc chip	1	Неклассифицированные/default	2650157	Our Specialty
2650159	049800124394	Our specialty frz cookie frosted Blue	1	Неклассифицированные/default	2650157	Our Specialty
2650160	049800124424	Our specialty frz cookie frosted White	1	Неклассифицированные/default	2650157	Our Specialty
2650161	049800124417	Our specialty frz cookie frosted Yellow	1	Неклассифицированные/default	2650157	Our Specialty
2650162	049800124431	Our specialty frz cookie frstd pink	1	Неклассифицированные/default	2650157	Our Specialty
2650163	049800132368	Our specialty frz cookie fudge brwnie	1	Неклассифицированные/default	2650157	Our Specialty
2650164	049800132504	Our specialty frz cookie oatmeal raisin	1	Неклассифицированные/default	2650157	Our Specialty
2650165	049800132290	Our specialty frz cookie snickrddle	1	Неклассифицированные/default	2650157	Our Specialty
2650166	049800132337	Our specialty frz cookie sugar	1	Неклассифицированные/default	2650157	Our Specialty
3177161	049800061453	Our specialty, cookies, chocolate chip	330591	Продукты питания (folder)/Продукты питания	0	
3177162	049800124516	Our specialty, frosted sugar cookies	330591	Продукты питания (folder)/Продукты питания	0	
3177163	049800124523	Our specialty, frosted sugar cookies #2	330591	Продукты питания (folder)/Продукты питания	0	
3177164	049800142299	Our specialty, Original naan	330591	Продукты питания (folder)/Продукты питания	0	
3177165	049800141346	Our specialty, Red Velvet frosted cookies	330591	Продукты питания (folder)/Продукты питания	0	
3177166	049800143333	Our specialty, sugar cookies, key Lime frosted	330591	Продукты питания (folder)/Продукты питания	0	
3177167	049800143319	Our specialty, sugar cookies, Lemon frosted	330591	Продукты питания (folder)/Продукты питания	0	
3177168	049800162792	Our specialty, thumbprint cookies	330591	Продукты питания (folder)/Продукты питания	0	
3177169	049800076433	Our specialty, Yellow cupcake	330591	Продукты питания (folder)/Продукты питания	0	
3177170	745758142205	Our stadium style skinless polish smoked sausage	330591	Продукты питания (folder)/Продукты питания	0	
1084292	070974005059	Our very own Water	1	Неклассифицированные/default	0	
2650168	5060125831762	Ouse Valley elderflower jelly 6x 227g	1	Неклассифицированные/default	2650167	Ouse Valley
2650169	5060125837672	Ouse Valley gooseberry jam with elderflower 6x 227g	1	Неклассифицированные/default	2650167	Ouse Valley
2650170	5060125835036	Ouse Valley Lemon marmalade with Lavender 6x 340g	1	Неклассифицированные/default	2650167	Ouse Valley
2650171	5060125830819	Ouse Valley Orange marmalade 6x 340g	1	Неклассифицированные/default	2650167	Ouse Valley
2650172	5060125830291	Ouse Valley Red chilli jelly 6x 227g	1	Неклассифицированные/default	2650167	Ouse Valley
2650173	5060125837634	Ouse Valley Rose petal jelly 6x 227g	1	Неклассифицированные/default	2650167	Ouse Valley
