ID	UPCEAN	Name	CategoryID	CategoryName	BrandID	BrandName
406872	049022403444	Pure american vitamin h2o kiwi strawberry brainpower pet 20oz	17388	Продукты питания (folder)/Напитки безалкогольные/Вода питьевая	0	
406873	049022403468	Pure american vitamin h2o lemonade daily v pet 20oz	17388	Продукты питания (folder)/Напитки безалкогольные/Вода питьевая	0	
406874	049022329591	Pure american vitamin h2o Mix berry pet 24oz	17388	Продукты питания (folder)/Напитки безалкогольные/Вода питьевая	0	
406875	049022329584	Pure american vitamin h2o pet 24oz	17388	Продукты питания (folder)/Напитки безалкогольные/Вода питьевая	0	
2188735	854210004323	Pure ancient grains berry 35g nogmo	2022661	Продукты питания (folder)/Snack Foods & Bars	1582433	PURE
2188736	854210004316	Pure ancient grains chocolate 35g nogmo	2022661	Продукты питания (folder)/Snack Foods & Bars	1582433	PURE
642768	074092031020	Pure and basic anti-dandruff Natural Shampoo tea tree and rosemary - 12floz	1412	Уход за волосами (folder)/Шампунь	642725	Pure&Basic
642729	074092067067	Pure and basic bar soap - White tea echinacea - case of 6 - 6.4oz	146	Гигиена (folder)/Мыло	642725	Pure&Basic
642730	074092067081	Pure and basic bar soap - Wild banana vanilla - case of 6 - 6.4oz	146	Гигиена (folder)/Мыло	642725	Pure&Basic
642767	074092021182	Pure and basic bar soap assorted Mini gift pack 5pcs	146	Гигиена (folder)/Мыло	642725	Pure&Basic
642747	074092011411	Pure and basic Bath and Body wash Grapefruit verbena - 12floz	1	Неклассифицированные/default	642725	Pure&Basic
642744	074092011435	Pure and basic Body wash - Cherry almond - 12oz	1	Неклассифицированные/default	642725	Pure&Basic
642749	074092011398	Pure and basic Body wash - passionate pear - 12oz	1	Неклассифицированные/default	642725	Pure&Basic
642769	074092011015	Pure and basic clarifying Shampoo citrus - 12floz	1412	Уход за волосами (folder)/Шампунь	642725	Pure&Basic
642760	074092041227	Pure and basic Extra cleasing - Green tea Naturals Liquid hand soap - 12.5floz	366	Гигиена (folder)/Мыло жидкое	642725	Pure&Basic
642735	074092777720	Pure and basic glitter-up Gold Natural shimmering Body Lotion - 6.3floz	486634	Косметика (folder)/Лосьон для тела	642725	Pure&Basic
642738	074092777737	Pure and basic glitter-up opalescent Natural shimmering Body Lotion - 6.3floz	486634	Косметика (folder)/Лосьон для тела	642725	Pure&Basic
642765	074092041234	Pure and basic Green tea Naturals Liquid hand soap unscented - 12.5floz	366	Гигиена (folder)/Мыло жидкое	642725	Pure&Basic
642733	074092088406	Pure and basic hand and Body Lotion - Fresh fig - 12oz	486634	Косметика (folder)/Лосьон для тела	642725	Pure&Basic
2822883	074092021205	Pure and basic Liquid soap floor display 44pcs	1	Неклассифицированные/default	0	
642772	074092121035	Pure and basic lite vitamin E Oil - 21000 iu - 1.62floz	1	Неклассифицированные/default	642725	Pure&Basic
2822884	074092021212	Pure and basic Lotion&Body wash display 44pcs	1	Неклассифицированные/default	0	
642763	074092041210	Pure and basic moisturizing Green tea Naturals Liquid hand soap - 12.5floz	366	Гигиена (folder)/Мыло жидкое	642725	Pure&Basic
642754	074092031075	Pure and basic moisturizing Natural Conditioner Cherry almond - 12floz	1	Неклассифицированные/default	642725	Pure&Basic
642753	074092031051	Pure and basic Natural anti-dandruff Conditioner - tea tree and rosemary - 12oz	1	Неклассифицированные/default	642725	Pure&Basic
642731	074092088338	Pure and basic Natural Bath and Body Lotion caribbean Heat - 12floz	486634	Косметика (folder)/Лосьон для тела	642725	Pure&Basic
642732	074092088390	Pure and basic Natural Bath and Body Lotion Cherry almond - 12floz	486634	Косметика (folder)/Лосьон для тела	642725	Pure&Basic
642734	074092088369	Pure and basic Natural Bath and Body Lotion fuji Apple berry - 12floz	486634	Косметика (folder)/Лосьон для тела	642725	Pure&Basic
642736	074092088376	Pure and basic Natural Bath and Body Lotion Grapefruit verbena - 12floz	486634	Косметика (folder)/Лосьон для тела	642725	Pure&Basic
642737	074092088383	Pure and basic Natural Bath and Body Lotion Lavender rosemary - 12floz	486634	Косметика (folder)/Лосьон для тела	642725	Pure&Basic
642739	074092088352	Pure and basic Natural Bath and Body Lotion passionate pear - 12floz	486634	Косметика (folder)/Лосьон для тела	642725	Pure&Basic
642740	074092088413	Pure and basic Natural Bath and Body Lotion pomegranate ginger - 12floz	486634	Косметика (folder)/Лосьон для тела	642725	Pure&Basic
642743	074092011374	Pure and basic Natural Bath and Body wash caribbean Heat - 12floz	1	Неклассифицированные/default	642725	Pure&Basic
642745	074092011442	Pure and basic Natural Bath and Body wash Fresh fig - 12floz	1	Неклассифицированные/default	642725	Pure&Basic
642746	074092011404	Pure and basic Natural Bath and Body wash fuji Apple berry - 12floz	1	Неклассифицированные/default	642725	Pure&Basic
642748	074092011428	Pure and basic Natural Bath and Body wash Lavender rosemary - 12floz	1	Неклассифицированные/default	642725	Pure&Basic
642750	074092011466	Pure and basic Natural Bath and Body wash pomegranate ginger - 12floz	1	Неклассифицированные/default	642725	Pure&Basic
642752	074092011381	Pure and basic Natural Bath and Body wash Wild banana vanilla - 12floz	1	Неклассифицированные/default	642725	Pure&Basic
642726	074092067074	Pure and basic Natural Deo bar soap - Fresh fig - case of 6 - 6.4oz	146	Гигиена (folder)/Мыло	642725	Pure&Basic
642727	074092067012	Pure and basic Natural Deo bar soap - Green tea - case of 6 - 6.4oz	146	Гигиена (folder)/Мыло	642725	Pure&Basic
642728	074092067098	Pure and basic Natural Deo bar soap - Honey shea Butter - case of 6 - 6.4oz	146	Гигиена (folder)/Мыло	642725	Pure&Basic
642742	074092088345	Pure and basic Natural hand and Body Lotion Wild banana vanilla - 12floz	486634	Косметика (folder)/Лосьон для тела	642725	Pure&Basic
642761	074092041265	Pure and basic Natural Liquid hand soap fuji Apple berry - 12.5floz	366	Гигиена (folder)/Мыло жидкое	642725	Pure&Basic
642762	074092041272	Pure and basic Natural Liquid hand soap Grapefruit verbena - 12.5floz	366	Гигиена (folder)/Мыло жидкое	642725	Pure&Basic
642764	074092041258	Pure and basic Natural Liquid hand soap Green tea and Aloe Vera - 12.5floz	366	Гигиена (folder)/Мыло жидкое	642725	Pure&Basic
642766	074092041241	Pure and basic Natural Liquid hand soap Wild banana vanilla - 12.5floz	366	Гигиена (folder)/Мыло жидкое	642725	Pure&Basic
642770	074092031037	Pure and basic Natural moisturizing Shampoo Cherry almond - 12floz	1412	Уход за волосами (folder)/Шампунь	642725	Pure&Basic
642741	074092088321	Pure and basic Natural revitalizing hand and Body Lotion - 12oz	486634	Косметика (folder)/Лосьон для тела	642725	Pure&Basic
642756	074092031044	Pure and basic Natural volumizing Conditioner Cool peppermint - 12floz	1	Неклассифицированные/default	642725	Pure&Basic
642771	074092031082	Pure and basic Natural volumizing Shampoo Cool peppermint - 12floz	1412	Уход за волосами (folder)/Шампунь	642725	Pure&Basic
642773	074092111036	Pure and basic Pure vitamin E Oil - 30000 iu - 1floz	1	Неклассифицированные/default	642725	Pure&Basic
642755	074092031068	Pure and basic reconstructing Coconut Natural Conditioner - 12floz	1	Неклассифицированные/default	642725	Pure&Basic
642751	074092011367	Pure and basic revitalizing Natural Bath and Body wash - 12floz	1	Неклассифицированные/default	642725	Pure&Basic
2822885	074092021199	Pure and basic Shampoo&Conditioner floor display 44pcs	1	Неклассифицированные/default	0	
1582422	659670280115	Pure antioxidant 30s	1	Неклассифицированные/default	0	
3190564	681094000161	Pure Apple Butter	330591	Продукты питания (folder)/Продукты питания	0	
3190565	032251018442	Pure Apple cider vinegar	330591	Продукты питания (folder)/Продукты питания	0	
3190566	854208004168	Pure Apple cider vinegar #2	330591	Продукты питания (folder)/Продукты питания	0	
1105673	854210001025	Pure Apple cinnamon bar 1.7oz nogmo	1	Неклассифицированные/default	305213	Pure Bar
2822886	50248186	Pure Apple Juice from concentrate 1l	1	Неклассифицированные/default	0	
3190567	832655008519	Pure Apricot jam	330591	Продукты питания (folder)/Продукты питания	0	
642664	6281100710011	Pure aquawater 600ml	1	Неклассифицированные/default	0	
642665	6292410079699	Pure auto chenille microfiber	1	Неклассифицированные/default	0	
2663368	722868522042	Pure av - cable de haut-parleur - 15 awg - broche (m) - broche (m) - 9.14 m - blanc	1	Неклассифицированные/default	0	
2532702	722868631027	Pure av - cable video/audio - hdmi - hdmi 19 broches (m) - Mini hdmi 19 broches (m) - 1.8 m - double blindage	1	Неклассифицированные/default	2014126	Belkin
2532596	722868631454	Pure av Blue series - cable audio numerique (coaxial) - rca (m) - rca (m) - 1.8 m - cable coaxial a double blindage	1	Неклассифицированные/default	2014126	Belkin
2510947	722868604960	Pure av Blue series - cavo audio / video - 1.8 m	1	Неклассифицированные/default	0	
2532588	722868632079	Pure av Blue series - cavo audio digitale (ottico) - 1.8 m	1	Неклассифицированные/default	2014126	Belkin
2532589	722868631010	Pure av Blue series - video/audio-kabel - 19-pens hdmi (m) - 19-pens hdmi (m) - 1.8 m - drievoudig afgeschermd gevlochten paar	1	Неклассифицированные/default	2014126	Belkin
2663369	722868631003	Pure av Blue series - video/audio-kabel - 19-pens hdmi (m) - 19-pens hdmi (m) - 91 cm - drievoudig afgeschermd gevlochten paar	1	Неклассифицированные/default	0	
2663370	722868556801	Pure av razorvision - cable video/audio - hdmi 19 broches (m) - hdmi 19 broches (m) - 2.4 m - cable a quartes blinde	1	Неклассифицированные/default	0	
2663371	722868631102	Pure av Silver series - cable video/audio - hdmi - hdmi 19 broches (m) - hdmi 19 broches (m) - 2.4 m - recouvert de cinq couche	1	Неклассифицированные/default	0	
2526307	722868631096	Pure av Silver series - video/audio-kabel - hdmi - 19-pens hdmi (m) - 19-pens hdmi (m) - 1.2 m - vijf beschermlagen	1	Неклассифицированные/default	0	
2532387	722868631133	Pure av Silver series - videoadapter - hdmi / dvi - 19-pens hdmi (v) - dvi-d (m) - beschermd	1	Неклассифицированные/default	2014126	Belkin
406876	4017505018061	Pure badger Fan blender 1	331156	Товары для творчества (folder)/Живопись и рисования (folder)/Товары для художников	0	
406877	4017505018078	Pure badger Fan blender 2	331156	Товары для творчества (folder)/Живопись и рисования (folder)/Товары для художников	0	
406878	4017505018085	Pure badger Fan blender 3	331156	Товары для творчества (folder)/Живопись и рисования (folder)/Товары для художников	0	
406879	4017505018092	Pure badger Fan blender 4	331156	Товары для творчества (folder)/Живопись и рисования (folder)/Товары для художников	0	
406880	4017505018108	Pure badger Fan blender 5	331156	Товары для творчества (folder)/Живопись и рисования (folder)/Товары для художников	0	
3190568	726984030504	Pure baking soda	330591	Продукты питания (folder)/Продукты питания	2596487	Haggen
3190569	713733107235	Pure baking soda #2	330591	Продукты питания (folder)/Продукты питания	2564409	Meijer
3190570	713733107242	Pure baking soda #3	330591	Продукты питания (folder)/Продукты питания	2564409	Meijer
3190571	018894703037	Pure baking soda #4	330591	Продукты питания (folder)/Продукты питания	0	
3190572	036800207608	Pure baking soda #5	330591	Продукты питания (folder)/Продукты питания	0	
3190573	036800248168	Pure baking soda #6	330591	Продукты питания (folder)/Продукты питания	0	
3190574	049022554894	Pure baking soda #7	330591	Продукты питания (folder)/Продукты питания	0	
3190575	071923357823	Pure baking soda #8	330591	Продукты питания (folder)/Продукты питания	0	
2663372	602498281680	Pure ballads - varios interpretes CD cdf982816	2275105	Медиа (folder)/Медиа	0	
2188737	854210001155	Pure banana Coconut bar 1.7oz nogmo	2022661	Продукты питания (folder)/Snack Foods & Bars	1582433	PURE
305214	854210001100	Pure bar cranberry Orange -- 12 bars	297057	Лекарственные средства (folder)/Health & Personal Care	305213	Pure Bar
1582423	074092077011	Pure bar soap Lotus scrub 6.4oz	146	Гигиена (folder)/Мыло	0	
2663374	891230991233	Pure base garlic sprd cncntrt rack dsp 2	1	Неклассифицированные/default	2663373	Pure Base
2663375	891230991141	Pure base garlic sprd&rack dsp 24pcs	1	Неклассифицированные/default	2663373	Pure Base
221142	6281041233815	Pure bee Honey bears	7943	Неклассифицированные/COSMETIC	0	
2663376	807000132812	Pure beech 100% modal jersey knit King sheet set in White	1	Неклассифицированные/default	0	
2663377	807000132942	Pure beech 100% modal jersey knit Queen sheet set in Light Blue	1	Неклассифицированные/default	0	
2663378	807000133369	Pure beech 100% modal jersey knit Queen sheet set in purple	1	Неклассифицированные/default	0	
2663379	807000132997	Pure beech 100% modal jersey knit twin sheet set in navy	1	Неклассифицированные/default	0	
2663380	807000153350	Pure beech 100% modal sateen King pillowcase pair in White	1	Неклассифицированные/default	0	
2663381	807000153626	Pure beech 100% modal sateen King sheet set in plum	1	Неклассифицированные/default	0	
2663382	807000153329	Pure beech 100% modal sateen King sheet set in White	1	Неклассифицированные/default	0	
3190576	683866195044	Pure belgian chocolate biscuit selection	330591	Продукты питания (folder)/Продукты питания	0	
2663383	022099185543	Pure belly 3in1 pregnancy&postpartum medium belly support wrap in White	1	Неклассифицированные/default	0	
2003212	716770058744	Pure bendie pink 10 function	1980172	Adult/All Novelties	0	
2003213	716770058751	Pure bendie purple 10 function	1980172	Adult/All Novelties	0	
2188738	878968000383	Pure bit bf/lv fd Cat tr 0.85oz	337596	Товары для животных (folder)/Pets	0	
2188739	878968000055	Pure bit bf/lvr fd trt 16.6oz	337596	Товары для животных (folder)/Pets	0	
2188740	878968000024	Pure bit bf/lvr fd trt 2oz	337596	Товары для животных (folder)/Pets	0	
2188741	878968000031	Pure bit bf/lvr fd trt 4.2oz	337596	Товары для животных (folder)/Pets	0	
2188742	878968000048	Pure bit bf/lvr fd trt 8.8oz	337596	Товары для животных (folder)/Pets	0	
2188743	878968000253	Pure bit chd chs fd trt 10.8oz	337596	Товары для животных (folder)/Pets	0	
2188744	878968000239	Pure bit chd chs fd trt 2.5oz	337596	Товары для животных (folder)/Pets	0	
2188745	878968000260	Pure bit chd chs fd trt 20.4oz	337596	Товары для животных (folder)/Pets	0	
2188746	878968000246	Pure bit chd chs fd trt 5.2oz	337596	Товары для животных (folder)/Pets	0	
2188747	878968000390	Pure bit ckn brst fd Cat tr 0.6 z	337596	Товары для животных (folder)/Pets	0	
2188748	878968001021	Pure bit ckn brst fd trt 1.4oz	337596	Товары для животных (folder)/Pets	0	
2188749	878968001052	Pure bit ckn brst fd trt 11.6oz	337596	Товары для животных (folder)/Pets	0	
2188750	878968001038	Pure bit ckn brst fd trt 3oz	337596	Товары для животных (folder)/Pets	0	
2188751	878968001045	Pure bit ckn brst fd trt 6.2oz	337596	Товары для животных (folder)/Pets	0	
2188752	878968000406	Pure bit ofish fd Cat trt 0.39oz	337596	Товары для животных (folder)/Pets	0	
2188753	878968000505	Pure bit shrmp fd trt 0.28oz	337596	Товары для животных (folder)/Pets	0	
2188754	878968000550	Pure bit trl Mix fd trt 1.55oz	337596	Товары для животных (folder)/Pets	0	
2188755	878968000567	Pure bit trl Mix fd trt 3.25oz	337596	Товары для животных (folder)/Pets	0	
2379407	3700134404398	Pure Black 3.4 EDT spr (m)	3068	Парфюмерия (folder)/Парфюмерия	0	
2822887	813636020652	Pure Black cold brew coffee - lightly sweetened plastic 48floz	1	Неклассифицированные/default	0	
2822888	813636020645	Pure Black cold brew coffee - unsweetened plastic 48floz	1	Неклассифицированные/default	0	
1933860	746480054200	Pure blanc 3.4oz for men by karen low	1	Неклассифицированные/default	882463	KAREN LOW
1582424	7001344044791	Pure blank 3.4floz EDT spray	1039	Парфюмерия (folder)/Туалетная вода	882463	KAREN LOW
3190577	810387021532	Pure blended Fruit	330591	Продукты питания (folder)/Продукты питания	0	
3190578	810387022317	Pure blended Fruit #2	330591	Продукты питания (folder)/Продукты питания	0	
3190579	011115000175	Pure blends, avocado Oil buttery Spread 45% vegetable Oil	330591	Продукты питания (folder)/Продукты питания	0	
1105679	7001344054493	Pure bleu 3.4floz EDT spray	1039	Парфюмерия (folder)/Туалетная вода	882463	KAREN LOW
1105680	7001344055933	Pure bleu intense 3.4floz EDT spray	1039	Парфюмерия (folder)/Туалетная вода	882463	KAREN LOW
3190580	897363001504	Pure bliss organics, Energy bites, acai Coconut	330591	Продукты питания (folder)/Продукты питания	0	
3190581	897363001283	Pure bliss organics, Organic Energy bar, Lemon cranberry	330591	Продукты питания (folder)/Продукты питания	0	
3190582	897363001382	Pure bliss organics, Organic Energy bar, naughty but nice	330591	Продукты питания (folder)/Продукты питания	0	
3190583	897363001016	Pure bliss organics, Organic granola	330591	Продукты питания (folder)/Продукты питания	0	
3190584	897363001863	Pure bliss organics, Organic hemp Energy bar, chocolate Coconut	330591	Продукты питания (folder)/Продукты питания	0	
3190585	897363001931	Pure bliss organics, Organic hemp Energy bar, Peanut Butter	330591	Продукты питания (folder)/Продукты питания	0	
3190586	897363001870	Pure bliss organics, sprouted seed bar, Green smoothie	330591	Продукты питания (folder)/Продукты питания	0	
3190587	897363001320	Pure bliss organics, White chocolate Raspberry	330591	Продукты питания (folder)/Продукты питания	0	
2003629	716770048868	Pure bliss pink (d)	1980180	Adult/Discontinued (Manufactures)	0	
2003630	716770048875	Pure bliss purple (d)	1980180	Adult/Discontinued (Manufactures)	0	
1105681	079679000604	Pure blk pep grnd	1	Неклассифицированные/default	0	
2188756	9320000113861	Pure blonde 375ml	22186	Продукты питания (folder)/Алкогольные напитки/Пиво	0	
2188757	9320000115919	Pure blonde 700ml	22186	Продукты питания (folder)/Алкогольные напитки/Пиво	0	
2188758	9320000112017	Pure blonde can	22186	Продукты питания (folder)/Алкогольные напитки/Пиво	0	
2188759	9320000112031	Pure blonde naked	22186	Продукты питания (folder)/Алкогольные напитки/Пиво	0	
2188760	9320000117869	Pure blonde White stubby	22186	Продукты питания (folder)/Алкогольные напитки/Пиво	0	
3190588	799256221405	Pure blossom Honey	330591	Продукты питания (folder)/Продукты питания	0	
3190589	8413524004324	Pure blossom Honey #2	330591	Продукты питания (folder)/Продукты питания	0	
1105682	4146660032923	Pure Blue in poutch 3.4floz EDT spray	1039	Парфюмерия (folder)/Туалетная вода	300077	Unknown
1994763	782631019711	Pure Blue silicone #71 (d)	1980180	Adult/Discontinued (Manufactures)	0	
1994764	782631019728	Pure Blue silicone #72 (d)	1980180	Adult/Discontinued (Manufactures)	0	
3190590	854127005017	Pure Blue Water, vapor Distilled + alkaline Water	330591	Продукты питания (folder)/Продукты питания	0	
3190591	854127005048	Pure Blue Water, vapor Distilled+electrolytes Water	330591	Продукты питания (folder)/Продукты питания	0	
2379408	9556123185816	Pure bnf25 double twin warmer +9oz bot	1	Неклассифицированные/default	0	
305216	094922479501	Pure Body instant slim wrap	1742887	Неклассифицированные/Personal Care Appliances	305215	Pure Body
3190592	022644006378	Pure brazilian ground coffee	330591	Продукты питания (folder)/Продукты питания	0	
2188761	5055566918080	Pure breed beef segments 160g	1	Неклассифицированные/default	0	
3190593	039047015760	Pure Butter Mini christmas trees shortbread	330591	Продукты питания (folder)/Продукты питания	0	
3190594	039047010215	Pure Butter shortbread	330591	Продукты питания (folder)/Продукты питания	0	
3190595	039047010222	Pure Butter shortbread #2	330591	Продукты питания (folder)/Продукты питания	0	
3190596	039047010239	Pure Butter shortbread #3	330591	Продукты питания (folder)/Продукты питания	0	
3190597	039047010277	Pure Butter shortbread assortment	330591	Продукты питания (folder)/Продукты питания	0	
2706924	039047018044	Pure Butter shortbread chocolate scottie dogs	1	Неклассифицированные/default	38690	Walkers
2706910	039047015418	Pure Butter shortbread festive shapes	1	Неклассифицированные/default	38690	Walkers
3190598	039047001459	Pure Butter shortbread highlanders	330591	Продукты питания (folder)/Продукты питания	0	
3190599	039047013421	Pure Butter vanilla shortbread	330591	Продукты питания (folder)/Продукты питания	0	
1582427	040647005082	Pure c crystals 4oz ls	1	Неклассифицированные/default	0	
3190600	05852539	Pure canadian clover Honey	330591	Продукты питания (folder)/Продукты питания	0	
1408756	659670009013	Pure candex 40s	1	Неклассифицированные/default	0	
3190601	036800509245	Pure cane confectioners sugar	330591	Продукты питания (folder)/Продукты питания	0	
3190602	717067230102	Pure cane cubes	330591	Продукты питания (folder)/Продукты питания	0	
3190603	070784434193	Pure cane Dark brown sugar	330591	Продукты питания (folder)/Продукты питания	2405323	TOPS
3190604	070784434247	Pure cane Dark brown sugar #2	330591	Продукты питания (folder)/Продукты питания	2405323	TOPS
3190605	041497398201	Pure cane Dark brown sugar #3	330591	Продукты питания (folder)/Продукты питания	3001562	Weis
3190606	015800064510	Pure cane Dark brown sugar #4	330591	Продукты питания (folder)/Продукты питания	0	
3190607	036800460669	Pure cane Dark brown sugar #5	330591	Продукты питания (folder)/Продукты питания	0	
3190608	049200009710	Pure cane Dark brown sugar #6	330591	Продукты питания (folder)/Продукты питания	0	
3190609	092825107903	Pure cane Dark brown sugar #7	330591	Продукты питания (folder)/Продукты питания	0	
1894397	049200009703	Pure cane Golden Light brown sugar	1	Неклассифицированные/default	0	
3190610	049200009802	Pure cane Golden Light brown sugar #2	330591	Продукты питания (folder)/Продукты питания	0	
3190611	049200903865	Pure cane gourmet syrup	330591	Продукты питания (folder)/Продукты питания	0	
