ID	UPCEAN	Name	CategoryID	CategoryName	BrandID	BrandName
2390663	078073300686	Scholastic teaching math picture puzzles gr prek-k sc530068	1	Неклассифицированные/default	2390009	Scholastic Teaching Resources
2390664	078073459520	Scholastic teaching math prob-solv packets grade 1 sc545952	1	Неклассифицированные/default	2390009	Scholastic Teaching Resources
2390665	078073459537	Scholastic teaching math prob-solv packets grade 2 sc545953	1	Неклассифицированные/default	2390009	Scholastic Teaching Resources
2390666	078073459544	Scholastic teaching math prob-solv packets grade 3 sc545954	1	Неклассифицированные/default	2390009	Scholastic Teaching Resources
2390667	078073459551	Scholastic teaching math prob-solv packets grade 4 sc545955	1	Неклассифицированные/default	2390009	Scholastic Teaching Resources
2390668	078073459568	Scholastic teaching math prob-solv packets grade 5 sc545956	1	Неклассифицированные/default	2390009	Scholastic Teaching Resources
2390669	078073459575	Scholastic teaching math prob-solv packets grade 6 sc545957	1	Неклассифицированные/default	2390009	Scholastic Teaching Resources
2390670	078073653713	Scholastic teaching Mini bbs colorful caps sc565371	1	Неклассифицированные/default	2390009	Scholastic Teaching Resources
2390671	078073530939	Scholastic teaching Mini bbs fractions in photos sc553093	1	Неклассифицированные/default	2390009	Scholastic Teaching Resources
2390672	078073653706	Scholastic teaching Mini bbs handy pockets sc565370	1	Неклассифицированные/default	2390009	Scholastic Teaching Resources
2390673	078073442775	Scholastic teaching Mini book word Family riddle sc544277	1	Неклассифицированные/default	2390009	Scholastic Teaching Resources
2390674	078073438365	Scholastic teaching Mini lssns: pnt of view/fac&op sc943836	1	Неклассифицированные/default	2390009	Scholastic Teaching Resources
2676331	078073438334	Scholastic teaching Mini lssns: sqncng&context sc943833	1	Неклассифицированные/default	2676131	Scholastic Teaching
2390676	078073387809	Scholastic teaching Mini-books 100 sight word sc938780	1	Неклассифицированные/default	2390009	Scholastic Teaching Resources
2390677	078073438341	Scholastic teaching Mini-lssns: infrnc&cause&effect sc943834	1	Неклассифицированные/default	2390009	Scholastic Teaching Resources
2390675	078073155873	Scholastic teaching minibook that teach wrd Family sc915587	1	Неклассифицированные/default	2390009	Scholastic Teaching Resources
2390678	078073609680	Scholastic teaching monster multiplication skills sc960968	1	Неклассифицированные/default	2390009	Scholastic Teaching Resources
2676332	078073574070	Scholastic teaching my 1st lil readers book gr k-1 sc957407	1	Неклассифицированные/default	2676131	Scholastic Teaching
2390679	078073531462	Scholastic teaching name plate jingle jungle sc553146	1	Неклассифицированные/default	2390009	Scholastic Teaching Resources
2390680	078073417742	Scholastic teaching name plates chameleons sc541774	1	Неклассифицированные/default	2390009	Scholastic Teaching Resources
2390681	078073531479	Scholastic teaching name plates think tanks sc553147	1	Неклассифицированные/default	2390009	Scholastic Teaching Resources
2390682	078073590186	Scholastic teaching nonfic passages w/organzer 2-4 sc959018	1	Неклассифицированные/default	2390009	Scholastic Teaching Resources
2676333	078073365982	Scholastic teaching nonfiction in focus book sc936598	1	Неклассифицированные/default	2676131	Scholastic Teaching
2390683	078073067732	Scholastic teaching number tales Box set gr pk-1 sc506773	1	Неклассифицированные/default	2390009	Scholastic Teaching Resources
2390684	078073513826	Scholastic teaching nursery rhyme flip chart sc951382	1	Неклассифицированные/default	2390009	Scholastic Teaching Resources
2390685	078073250202	Scholastic teaching nursery rhyme readers sc525020	1	Неклассифицированные/default	2390009	Scholastic Teaching Resources
2390686	078073314751	Scholastic teaching One page math games grades 2-3 sc531475	1	Неклассифицированные/default	2390009	Scholastic Teaching Resources
2676334	078073445127	Scholastic teaching overhead teaching kit sc944512	1	Неклассифицированные/default	2676131	Scholastic Teaching
2390630	078073309610	Scholastic teaching ovhd tchng kits gr 2-4 reading sc930361	1	Неклассифицированные/default	2390009	Scholastic Teaching Resources
2676335	078073385270	Scholastic teaching ovhd tchng kits gr 2-4 spllng sc938527	1	Неклассифицированные/default	2676131	Scholastic Teaching
2676336	078073086795	Scholastic teaching ovhd tchng kits gr k-2 math sc908679	1	Неклассифицированные/default	2676131	Scholastic Teaching
2676337	078073086801	Scholastic teaching ovhd tchng kits gr k-2 phonics sc908680	1	Неклассифицированные/default	2676131	Scholastic Teaching
2676338	078073387724	Scholastic teaching ovhd tchng kits gr2-4 grmmr sc938772	1	Неклассифицированные/default	2676131	Scholastic Teaching
2676339	078073303625	Scholastic teaching ovhd tchng kits gr2-4 writting sc930362	1	Неклассифицированные/default	2676131	Scholastic Teaching
2390687	078073222599	Scholastic teaching ovhd wrtng lssns stng sntcs 4u sc922259	1	Неклассифицированные/default	2390009	Scholastic Teaching Resources
2390688	078073222582	Scholastic teaching ovrhd wrtg lssns essays gr4&up sc922258	1	Неклассифицированные/default	2390009	Scholastic Teaching Resources
2390689	078073231935	Scholastic teaching ovrhd wrtg lssns paragr gr4&up sc923193	1	Неклассифицированные/default	2390009	Scholastic Teaching Resources
2390690	078073024209	Scholastic teaching parent guide readng w/young ch sc902420	1	Неклассифицированные/default	2390009	Scholastic Teaching Resources
2676340	078073517855	Scholastic teaching pctr book:tchng about thanksgi sc951785	1	Неклассифицированные/default	2676131	Scholastic Teaching
2390691	078073285129	Scholastic teaching persuasive writing sb lessons sc528512	1	Неклассифицированные/default	2390009	Scholastic Teaching Resources
2390692	078073220601	Scholastic teaching phonics bingo ladders sc522060	1	Неклассифицированные/default	2390009	Scholastic Teaching Resources
2390693	078073223046	Scholastic teaching phonics packets week-by-week sc522304	1	Неклассифицированные/default	2390009	Scholastic Teaching Resources
2390694	078073248704	Scholastic teaching phonics poetry pages sc524870	1	Неклассифицированные/default	2390009	Scholastic Teaching Resources
2390695	078073104352	Scholastic teaching phonics sing-along flipchrt/CD sc510435	1	Неклассифицированные/default	2390009	Scholastic Teaching Resources
2390696	078073914234	Scholastic teaching photo tiles lrtb ini/fn consnt sc991423	1	Неклассифицированные/default	2390009	Scholastic Teaching Resources
2390697	078073914241	Scholastic teaching photo tiles lrtb shrt/lng vowl sc991424	1	Неклассифицированные/default	2390009	Scholastic Teaching Resources
2390698	078073914258	Scholastic teaching photo tiles lrtb word families sc991425	1	Неклассифицированные/default	2390009	Scholastic Teaching Resources
2676341	078073249879	Scholastic teaching Play to teach conflict rsltn sc924987	1	Неклассифицированные/default	2676131	Scholastic Teaching
2390699	078073110827	Scholastic teaching plays 4 begng readrs fam amerc sc511082	1	Неклассифицированные/default	2390009	Scholastic Teaching Resources
2390700	078073425273	Scholastic teaching pocket chart add-on fav songs sc542527	1	Неклассифицированные/default	2390009	Scholastic Teaching Resources
2390701	078073417537	Scholastic teaching pocket chart add-on lang g k-1 sc541753	1	Неклассифицированные/default	2390009	Scholastic Teaching Resources
2390702	078073417544	Scholastic teaching pocket chart add-on lang gr5-6 sc541754	1	Неклассифицированные/default	2390009	Scholastic Teaching Resources
2390703	078073417568	Scholastic teaching pocket chart add-on learng cnt sc541756	1	Неклассифицированные/default	2390009	Scholastic Teaching Resources
2390704	078073417551	Scholastic teaching pocket chart add-on make a wrd sc541755	1	Неклассифицированные/default	2390009	Scholastic Teaching Resources
2390705	078073425266	Scholastic teaching pocket chart add-on nursry rhm sc542526	1	Неклассифицированные/default	2390009	Scholastic Teaching Resources
2676342	078073732760	Scholastic teaching pocket chart file organizer bk sc573276	1	Неклассифицированные/default	2676131	Scholastic Teaching
2676343	078073732784	Scholastic teaching pocket chart Mini Black sc573278	1	Неклассифицированные/default	2676131	Scholastic Teaching
2676344	078073732777	Scholastic teaching pocket chart standard Black sc573277	1	Неклассифицированные/default	2676131	Scholastic Teaching
2390706	078073094394	Scholastic teaching poems 4 teachng vocab prek-1st sc509439	1	Неклассифицированные/default	2390009	Scholastic Teaching Resources
2390707	078073438303	Scholastic teaching poems for bldng fluency gr 1-2 sc943830	1	Неклассифицированные/default	2390009	Scholastic Teaching Resources
2390708	078073438310	Scholastic teaching poems for bldng fluency gr 3-4 sc943831	1	Неклассифицированные/default	2390009	Scholastic Teaching Resources
2390709	078073560219	Scholastic teaching poems for bldng fluency gr 5-6 sc956021	1	Неклассифицированные/default	2390009	Scholastic Teaching Resources
2390710	078073390199	Scholastic teaching poems for teaching phonics k-2 sc39019	1	Неклассифицированные/default	2390009	Scholastic Teaching Resources
2390711	078073531165	Scholastic teaching pop chart afr amer robinson sc553116	1	Неклассифицированные/default	2390009	Scholastic Teaching Resources
2390712	078073531141	Scholastic teaching pop chart afr american carver sc553114	1	Неклассифицированные/default	2390009	Scholastic Teaching Resources
2390713	078073531172	Scholastic teaching pop chart afr american mlk sc553117	1	Неклассифицированные/default	2390009	Scholastic Teaching Resources
2390714	078073531189	Scholastic teaching pop chart afr american obama sc553118	1	Неклассифицированные/default	2390009	Scholastic Teaching Resources
2390715	078073531158	Scholastic teaching pop chart afr american parks sc553115	1	Неклассифицированные/default	2390009	Scholastic Teaching Resources
2390716	078073531134	Scholastic teaching pop chart afr american tubman sc553113	1	Неклассифицированные/default	2390009	Scholastic Teaching Resources
2390717	078073531028	Scholastic teaching pop chart Always believe sc553102	1	Неклассифицированные/default	2390009	Scholastic Teaching Resources
2390718	078073531127	Scholastic teaching pop chart Always do right sc553112	1	Неклассифицированные/default	2390009	Scholastic Teaching Resources
2390719	078073531110	Scholastic teaching pop chart be Original sc553111	1	Неклассифицированные/default	2390009	Scholastic Teaching Resources
2390720	078073653805	Scholastic teaching pop chart be yourself sc565380	1	Неклассифицированные/default	2390009	Scholastic Teaching Resources
2390721	078073653782	Scholastic teaching pop chart believe you can sc565378	1	Неклассифицированные/default	2390009	Scholastic Teaching Resources
2390722	078073653744	Scholastic teaching pop chart celebrate diversity sc565374	1	Неклассифицированные/default	2390009	Scholastic Teaching Resources
2390723	078073531059	Scholastic teaching pop chart create sc553105	1	Неклассифицированные/default	2390009	Scholastic Teaching Resources
2390724	078073653904	Scholastic teaching pop chart creatvty intellgnce sc565390	1	Неклассифицированные/default	2390009	Scholastic Teaching Resources
2390725	078073530991	Scholastic teaching pop chart don't be mean sc553099	1	Неклассифицированные/default	2390009	Scholastic Teaching Resources
2390726	078073653812	Scholastic teaching pop chart Dream big sc565381	1	Неклассифицированные/default	2390009	Scholastic Teaching Resources
2390727	078073531035	Scholastic teaching pop chart Dream sc553103	1	Неклассифицированные/default	2390009	Scholastic Teaching Resources
2390728	078073531004	Scholastic teaching pop chart either write things sc553100	1	Неклассифицированные/default	2390009	Scholastic Teaching Resources
2390729	078073531042	Scholastic teaching pop chart explore sc553104	1	Неклассифицированные/default	2390009	Scholastic Teaching Resources
2390730	078073531073	Scholastic teaching pop chart genius is sc553107	1	Неклассифицированные/default	2390009	Scholastic Teaching Resources
2390731	078073653799	Scholastic teaching pop chart great things happng sc565379	1	Неклассифицированные/default	2390009	Scholastic Teaching Resources
2390732	078073653836	Scholastic teaching pop chart lend a hand sc565383	1	Неклассифицированные/default	2390009	Scholastic Teaching Resources
2390733	078073653775	Scholastic teaching pop chart most beautiful thngs sc565377	1	Неклассифицированные/default	2390009	Scholastic Teaching Resources
2390734	078073653768	Scholastic teaching pop chart muisc is universal sc565376	1	Неклассифицированные/default	2390009	Scholastic Teaching Resources
2390735	078073653829	Scholastic teaching pop chart never lose your snse sc565382	1	Неклассифицированные/default	2390009	Scholastic Teaching Resources
2390736	078073531097	Scholastic teaching pop chart never never sc553109	1	Неклассифицированные/default	2390009	Scholastic Teaching Resources
2390737	078073653720	Scholastic teaching pop chart no dreamer too small sc565372	1	Неклассифицированные/default	2390009	Scholastic Teaching Resources
2390738	078073653867	Scholastic teaching pop chart open yr mind opn bk sc565386	1	Неклассифицированные/default	2390009	Scholastic Teaching Resources
2390739	078073531066	Scholastic teaching pop chart read sc553106	1	Неклассифицированные/default	2390009	Scholastic Teaching Resources
2390740	078073653898	Scholastic teaching pop chart stand up whats right sc565389	1	Неклассифицированные/default	2390009	Scholastic Teaching Resources
2390741	078073531080	Scholastic teaching pop chart the best way sc553108	1	Неклассифицированные/default	2390009	Scholastic Teaching Resources
2390742	078073531103	Scholastic teaching pop chart the future belongs sc553110	1	Неклассифицированные/default	2390009	Scholastic Teaching Resources
2390743	078073531011	Scholastic teaching pop chart the optimist sees sc553101	1	Неклассифицированные/default	2390009	Scholastic Teaching Resources
2390744	078073653874	Scholastic teaching pop chart watch your thoughts sc565387	1	Неклассифицированные/default	2390009	Scholastic Teaching Resources
2390745	078073653751	Scholastic teaching pop chart we are thinkers sc565375	1	Неклассифицированные/default	2390009	Scholastic Teaching Resources
2390746	078073653737	Scholastic teaching pop chart worls is but canvas sc565373	1	Неклассифицированные/default	2390009	Scholastic Teaching Resources
2390747	078073530984	Scholastic teaching pop chart your mind is like sc553098	1	Неклассифицированные/default	2390009	Scholastic Teaching Resources
2676345	078073561124	Scholastic teaching pop charts set 1 sc556112	1	Неклассифицированные/default	2676131	Scholastic Teaching
2676346	078073561131	Scholastic teaching pop charts set 2 sc556113	1	Неклассифицированные/default	2676131	Scholastic Teaching
2390748	078073162789	Scholastic teaching poster reading response gr 3-6 sc516278	1	Неклассифицированные/default	2390009	Scholastic Teaching Resources
2390749	078073162741	Scholastic teaching poster reading response gr k-2 sc516274	1	Неклассифицированные/default	2390009	Scholastic Teaching Resources
2390750	078073209125	Scholastic teaching poster set my timeline gr 3-6 sc520912	1	Неклассифицированные/default	2390009	Scholastic Teaching Resources
2390751	078073209132	Scholastic teaching poster set my timeline gr k-2 sc520913	1	Неклассифицированные/default	2390009	Scholastic Teaching Resources
2390752	078073323234	Scholastic teaching poster set personal bio report sc932323	1	Неклассифицированные/default	2390009	Scholastic Teaching Resources
2390753	078073152919	Scholastic teaching poster st Extra/Extra/read all sc915291	1	Неклассифицированные/default	2390009	Scholastic Teaching Resources
2390754	078073014620	Scholastic teaching poster st robot grphc org gk-2 sc501462	1	Неклассифицированные/default	2390009	Scholastic Teaching Resources
2390755	078073015375	Scholastic teaching poster st web graphc org gr3-6 sc501537	1	Неклассифицированные/default	2390009	Scholastic Teaching Resources
2390756	078073028139	Scholastic teaching practice mats math prob of Day sc502813	1	Неклассифицированные/default	2390009	Scholastic Teaching Resources
2390757	078073417681	Scholastic teaching printer paper chameleon sc541768	1	Неклассифицированные/default	2390009	Scholastic Teaching Resources
2390758	078073011179	Scholastic teaching purposeful conferences sc501117	1	Неклассифицированные/default	2390009	Scholastic Teaching Resources
2390759	078073331765	Scholastic teaching qck tips: how to start sch yr sc36515	1	Неклассифицированные/default	2390009	Scholastic Teaching Resources
2390760	078073267170	Scholastic teaching quick start to writing workshp sc526717	1	Неклассифицированные/default	2390009	Scholastic Teaching Resources
2676347	078073086788	Scholastic teaching rdng minibks initial consonant sc908678	1	Неклассифицированные/default	2676131	Scholastic Teaching
2676348	078073086771	Scholastic teaching rdng minibks shrt/Long vowels sc908677	1	Неклассифицированные/default	2676131	Scholastic Teaching
2676349	078073104406	Scholastic teaching rdng minibks sight words sc910440	1	Неклассифицированные/default	2676131	Scholastic Teaching
2676350	078073104390	Scholastic teaching rdng minibks word families sc910439	1	Неклассифицированные/default	2676131	Scholastic Teaching
2390761	078073047598	Scholastic teaching read aloud anthology sc904759	1	Неклассифицированные/default	2390009	Scholastic Teaching Resources
2676351	078073249855	Scholastic teaching read arnd wrld w/pctr/chptr bk sc924985	1	Неклассифицированные/default	2676131	Scholastic Teaching
2390762	078073529797	Scholastic teaching read&solve math Mini bks k-1 sc952979	1	Неклассифицированные/default	2390009	Scholastic Teaching Resources
2676352	078073415328	Scholastic teaching read&write science Mini-jrnls sc941532	1	Неклассифицированные/default	2676131	Scholastic Teaching
2390763	078073531233	Scholastic teaching read/wrtg infrmtnl text gr k-3 sc953123	1	Неклассифицированные/default	2390009	Scholastic Teaching Resources
2676353	078073651122	Scholastic teaching readers parent pk animal phonc sc565112	1	Неклассифицированные/default	2676131	Scholastic Teaching
2676354	078073651139	Scholastic teaching readers parent pk nonfcn alpha sc565113	1	Неклассифицированные/default	2676131	Scholastic Teaching
2390764	078073234554	Scholastic teaching readg passgs w/graphic org 2-3 sc523455	1	Неклассифицированные/default	2390009	Scholastic Teaching Resources
2390765	078073234561	Scholastic teaching readg passgs w/graphic org 4-5 sc523456	1	Неклассифицированные/default	2390009	Scholastic Teaching Resources
2390766	078073234578	Scholastic teaching readg passgs w/graphic org 6-8 sc523457	1	Неклассифицированные/default	2390009	Scholastic Teaching Resources
2390767	078073251117	Scholastic teaching reading stategies that work sc25111	1	Неклассифицированные/default	2390009	Scholastic Teaching Resources
2390768	078073046348	Scholastic teaching reading&writing grade 1 sc504634	1	Неклассифицированные/default	2390009	Scholastic Teaching Resources
2390769	078073046362	Scholastic teaching reading&writing grade 2 sc504636	1	Неклассифицированные/default	2390009	Scholastic Teaching Resources
2390770	078073046379	Scholastic teaching reading&writing grade 3 sc504637	1	Неклассифицированные/default	2390009	Scholastic Teaching Resources
2390771	078073046386	Scholastic teaching reading&writing grade 4 sc504638	1	Неклассифицированные/default	2390009	Scholastic Teaching Resources
2390772	078073046065	Scholastic teaching reading&writing grade 5 sc504606	1	Неклассифицированные/default	2390009	Scholastic Teaching Resources
2390773	078073046331	Scholastic teaching reading&writing grade k sc504633	1	Неклассифицированные/default	2390009	Scholastic Teaching Resources
2390774	078073290390	Scholastic teaching reading&writing sb grds 2-3 sc529039	1	Неклассифицированные/default	2390009	Scholastic Teaching Resources
2390775	078073290406	Scholastic teaching reading&writing sb grds 4-6 sc529040	1	Неклассифицированные/default	2390009	Scholastic Teaching Resources
2390776	078073290383	Scholastic teaching reading&writing sb grds k-1 sc529038	1	Неклассифицированные/default	2390009	Scholastic Teaching Resources
2390777	078073531417	Scholastic teaching reward tickets jingle j Lion sc553141	1	Неклассифицированные/default	2390009	Scholastic Teaching Resources
2390778	078073531448	Scholastic teaching reward tickets jingle j mrquee sc553144	1	Неклассифицированные/default	2390009	Scholastic Teaching Resources
2390779	078073531424	Scholastic teaching reward tickets jingle j pcock sc553142	1	Неклассифицированные/default	2390009	Scholastic Teaching Resources
2390069	078073531455	Scholastic teaching reward tickets jingle j Rocket sc553145	1	Неклассифицированные/default	2390009	Scholastic Teaching Resources
2390780	078073531431	Scholastic teaching reward tickets jingle j Star sc553143	1	Неклассифицированные/default	2390009	Scholastic Teaching Resources
2390781	078073531400	Scholastic teaching reward tickets jingle j turtle sc553140	1	Неклассифицированные/default	2390009	Scholastic Teaching Resources
2390782	078073556847	Scholastic teaching rprdcble frms f/wrtng traits sc955684	1	Неклассифицированные/default	2390009	Scholastic Teaching Resources
2390783	078073160426	Scholastic teaching rti: assesments&remediations sc516042	1	Неклассифицированные/default	2390009	Scholastic Teaching Resources
2390784	078073201143	Scholastic teaching schol success consonants k-2 sc520114	1	Неклассифицированные/default	2390009	Scholastic Teaching Resources
2390785	078073200887	Scholastic teaching schol success fractions grade4 sc520088	1	Неклассифицированные/default	2390009	Scholastic Teaching Resources
2390786	078073200863	Scholastic teaching schol success mult facts gr3-4 sc520086	1	Неклассифицированные/default	2390009	Scholastic Teaching Resources
2390787	078073200870	Scholastic teaching schol success mult&divsn gr3 sc520087	1	Неклассифицированные/default	2390009	Scholastic Teaching Resources
2390788	078073201037	Scholastic teaching schol success readng tests gr3 sc520103	1	Неклассифицированные/default	2390009	Scholastic Teaching Resources
2390789	078073201105	Scholastic teaching schol success readng tests gr4 sc520110	1	Неклассифицированные/default	2390009	Scholastic Teaching Resources
2390790	078073201099	Scholastic teaching schol success readng tests gr5 sc520109	1	Неклассифицированные/default	2390009	Scholastic Teaching Resources
2390791	078073201082	Scholastic teaching schol success readng tests gr6 sc520108	1	Неклассифицированные/default	2390009	Scholastic Teaching Resources
2390792	078073201129	Scholastic teaching schol success sight words k-2 sc520112	1	Неклассифицированные/default	2390009	Scholastic Teaching Resources
