ID	UPCEAN	Name	CategoryID	CategoryName	BrandID	BrandName
3693330	038859004719	L'oreal Dermo Expertise Pure Zone ozdor.ochitsh. a t 0.2l bo #2	961989	Косметика (folder)/Уход за лицом	388370	L'Oreal Dermo Expertise
3693331	3600520322520	L'oreal Dermo Expertise Pure Zone ozdor.ochitsh. a t 0.2l bo #3	961989	Косметика (folder)/Уход за лицом	388370	L'Oreal Dermo Expertise
3693332	5703147060399	L'oreal Dermo Expertise Pure Zone ozdor.ochitsh. a t 0.2l bo #4	961989	Косметика (folder)/Уход за лицом	388370	L'Oreal Dermo Expertise
2168185	3600521864319	L'oreal Dermo Expertise Pure Zone perf.cist.Gel 150ml	1	Неклассифицированные/default	388370	L'Oreal Dermo Expertise
2168186	3600521864555	L'oreal Dermo Expertise Pure Zone perf.peeling 150ml	1	Неклассифицированные/default	388370	L'Oreal Dermo Expertise
2168187	3600521864432	L'oreal Dermo Expertise Pure Zone perf.plet.voda 200	1	Неклассифицированные/default	388370	L'Oreal Dermo Expertise
3693333	038810011251	L'oreal Dermo Expertise Pure Zone prot.chyor.toch. k&gr a cleans. g 0.15l tu	961989	Косметика (folder)/Уход за лицом	388370	L'Oreal Dermo Expertise
3693334	038819004711	L'oreal Dermo Expertise Pure Zone prot.chyor.toch. k&gr a cleans. g 0.15l tu #2	961989	Косметика (folder)/Уход за лицом	388370	L'Oreal Dermo Expertise
3693335	3600520063409	L'oreal Dermo Expertise Pure Zone prot.chyor.toch. k&gr a cleans. g 0.15l tu #3	961989	Косметика (folder)/Уход за лицом	388370	L'Oreal Dermo Expertise
3693336	3600520387413	L'oreal Dermo Expertise Pure Zone prot.chyor.toch. k&gr a g 0.05l spm	961989	Косметика (folder)/Уход за лицом	388370	L'Oreal Dermo Expertise
1526433	3600521512722	L'oreal Dermo Expertise Pure Zone reiniger 2in1	5586	Косметика (folder)/Косметика	388370	L'Oreal Dermo Expertise
388371	3600521866474	L'oreal Dermo Expertise Pure Zone для лица гель 30сек чистый эффект 150м	5586	Косметика (folder)/Косметика	388370	L'Oreal Dermo Expertise
480233	3600521512678	L'oreal Dermo Expertise Pure Zone для лица Крем маска очищение 2в1 проти	664	Косметика (folder)/Крем для лица	388370	L'Oreal Dermo Expertise
388374	3600521514283	L'oreal Dermo Expertise Pure Zone для лица тон. сужающий поры против чер	5586	Косметика (folder)/Косметика	388370	L'Oreal Dermo Expertise
13283	3600520322506	L'oreal Dermo Expertise Pure Zone очищ. оздорав.тоник для жирной и смешанной кожи 200мл	5586	Косметика (folder)/Косметика	388370	L'Oreal Dermo Expertise
13288	3600520322551	L'oreal Dermo Expertise Pure Zone против черных точек-отшелушивающий гель тюб 150мл	5586	Косметика (folder)/Косметика	388370	L'Oreal Dermo Expertise
13281	3600520387406	L'oreal Dermo Expertise Pure Zone против черных точек-уход увлажняющий против несовершенств кожи 50мл	5586	Косметика (folder)/Косметика	388370	L'Oreal Dermo Expertise
76035	3600521358672	L'oreal Dermo Expertise Pure Zone разогревающий гель-Крем 100мл	5586	Косметика (folder)/Косметика	388370	L'Oreal Dermo Expertise
13287	3600520322650	L'oreal Dermo Expertise Pure Zone увлажняющий Крем против жирности для жирной и смешанной кожи 75мл	664	Косметика (folder)/Крем для лица	388370	L'Oreal Dermo Expertise
210890	3600520183053	L'oreal Dermo Expertise re-nourish Foam wash 150ml	5586	Косметика (folder)/Косметика	388370	L'Oreal Dermo Expertise
302539	071249009789	L'oreal Dermo Expertise refinish micro-dermabrasion kit	5586	Косметика (folder)/Косметика	388370	L'Oreal Dermo Expertise
302540	071249009796	L'oreal Dermo Expertise renoviste anti-aging glycolic peel kit	5586	Косметика (folder)/Косметика	388370	L'Oreal Dermo Expertise
217538	5011408030501	L'oreal Dermo Expertise revitalift (111306) revitalift 50ml	5586	Косметика (folder)/Косметика	388370	L'Oreal Dermo Expertise
13230	3054080019886	L'oreal Dermo Expertise revitalift 15мл б. вокруг глаз	5586	Косметика (folder)/Косметика	388370	L'Oreal Dermo Expertise
1045385	071249025772	L'oreal Dermo Expertise revitalift 4	5586	Косметика (folder)/Косметика	388370	L'Oreal Dermo Expertise
2353644	3600523201617	L'oreal Dermo Expertise revitalift 50мл филлер ночной	1	Неклассифицированные/default	388370	L'Oreal Dermo Expertise
388404	3600521155707	L'oreal Dermo Expertise revitalift cleansing wipes 25	5586	Косметика (folder)/Косметика	388370	L'Oreal Dermo Expertise
1045386	3600521463666	L'oreal Dermo Expertise revitalift dagcreme 50ml	5586	Косметика (folder)/Косметика	388370	L'Oreal Dermo Expertise
217669	3600520564838	L'oreal Dermo Expertise revitalift Day	5586	Косметика (folder)/Косметика	388370	L'Oreal Dermo Expertise
1526434	071249119402	L'oreal Dermo Expertise revitalift double Eye lift	5586	Косметика (folder)/Косметика	388370	L'Oreal Dermo Expertise
620131	3600521012840	L'oreal Dermo Expertise revitalift double Eye lift (542601) revitalift 15ml	32377	Косметика (folder)/Уход за кожей	388370	L'Oreal Dermo Expertise
1045387	3600521013144	L'oreal Dermo Expertise revitalift double eyelift 15ml	5586	Косметика (folder)/Косметика	388370	L'Oreal Dermo Expertise
210891	3600520625034	L'oreal Dermo Expertise revitalift double lifting (694501) revitalift 30ml	5586	Косметика (folder)/Косметика	388370	L'Oreal Dermo Expertise
1045388	3600520625232	L'oreal Dermo Expertise revitalift double lifting 30ml	5586	Косметика (folder)/Косметика	388370	L'Oreal Dermo Expertise
620132	3061376203362	L'oreal Dermo Expertise revitalift Duo cont.: 2x revitalift Day creme 50ml (057301) revitalift 100ml	32377	Косметика (folder)/Уход за кожей	388370	L'Oreal Dermo Expertise
1435532	3600520564913	L'oreal Dermo Expertise revitalift Eye	1	Неклассифицированные/default	388370	L'Oreal Dermo Expertise
1045389	3600521823750	L'oreal Dermo Expertise revitalift Eye 15ml	5586	Косметика (folder)/Косметика	388370	L'Oreal Dermo Expertise
217505	5011408039757	L'oreal Dermo Expertise revitalift eyes (72507) revitalift 15ml	5586	Косметика (folder)/Косметика	388370	L'Oreal Dermo Expertise
1431341	3600521594926	L'oreal Dermo Expertise revitalift face n neck contour	1	Неклассифицированные/default	388370	L'Oreal Dermo Expertise
1045390	3600521594629	L'oreal Dermo Expertise revitalift hals&contour 50ml	5586	Косметика (folder)/Косметика	388370	L'Oreal Dermo Expertise
1045377	3600522249030	L'oreal Dermo Expertise revitalift laser dag 50ml	5586	Косметика (folder)/Косметика	388370	L'Oreal Dermo Expertise
1045378	3600522251996	L'oreal Dermo Expertise revitalift laser oog 15ml	5586	Косметика (folder)/Косметика	388370	L'Oreal Dermo Expertise
1207186	3600522249399	L'oreal Dermo Expertise revitalift laser renew anwr. v 0.03l spm	664	Косметика (folder)/Крем для лица	388370	L'Oreal Dermo Expertise
1045379	3600522249634	L'oreal Dermo Expertise revitalift laser serum 30ml	5586	Косметика (folder)/Косметика	388370	L'Oreal Dermo Expertise
3693337	3600522248996	L'oreal Dermo Expertise revitalift lazer x3 anwr. c 0.05l j	961989	Косметика (folder)/Уход за лицом	388370	L'Oreal Dermo Expertise
1763140	3600522480235	L'oreal Dermo Expertise revitalift lazer x3 anwr. Night c 0.05l j	5586	Косметика (folder)/Косметика	388370	L'Oreal Dermo Expertise
3693338	3600522480501	L'oreal Dermo Expertise revitalift lazer x3 anwr. Night c 0.05l j #2	961989	Косметика (folder)/Уход за лицом	388370	L'Oreal Dermo Expertise
3693339	3600522251750	L'oreal Dermo Expertise revitalift lazer x3 sens anwr. y c 0.015l tu	961989	Косметика (folder)/Уход за лицом	388370	L'Oreal Dermo Expertise
1045332	9312825986997	L'oreal Dermo Expertise revitalift m/Day gift set 2010	5586	Косметика (folder)/Косметика	388370	L'Oreal Dermo Expertise
1045391	3600521153925	L'oreal Dermo Expertise revitalift Milk 200ml	5586	Косметика (folder)/Косметика	388370	L'Oreal Dermo Expertise
1045392	3600521463710	L'oreal Dermo Expertise revitalift nachtcreme 50ml	5586	Косметика (folder)/Косметика	388370	L'Oreal Dermo Expertise
217671	3600520564845	L'oreal Dermo Expertise revitalift Night	5586	Косметика (folder)/Косметика	388370	L'Oreal Dermo Expertise
217539	5011408040791	L'oreal Dermo Expertise revitalift Night (111508) revitalift 50ml	5586	Косметика (folder)/Косметика	388370	L'Oreal Dermo Expertise
620133	3061375292015	L'oreal Dermo Expertise revitalift program cont.: revitalift 50ml revitalift Night 50ml revitalift eyes 15ml (556603) revitalif	32377	Косметика (folder)/Уход за кожей	388370	L'Oreal Dermo Expertise
388405	3600520949925	L'oreal Dermo Expertise revitalift spf15 Day Cream 50ml	5586	Косметика (folder)/Косметика	388370	L'Oreal Dermo Expertise
1045393	3600521155158	L'oreal Dermo Expertise revitalift tonic 200ml	5586	Косметика (folder)/Косметика	388370	L'Oreal Dermo Expertise
1045381	3600522182597	L'oreal Dermo Expertise revitalift total repair 10 bb Cream Light 50ml	5586	Косметика (folder)/Косметика	388370	L'Oreal Dermo Expertise
1045382	3600522182603	L'oreal Dermo Expertise revitalift total repair 10 bb Cream medium 50ml	5586	Косметика (folder)/Косметика	388370	L'Oreal Dermo Expertise
620134	3600521985083	L'oreal Dermo Expertise revitalift total repair 10 Day revitalift 50ml	32377	Косметика (folder)/Уход за кожей	388370	L'Oreal Dermo Expertise
1433693	3600522024675	L'oreal Dermo Expertise revitalift total repair 10 fp50 AA-02	1	Неклассифицированные/default	388370	L'Oreal Dermo Expertise
1045383	3600522087212	L'oreal Dermo Expertise revitalift total repair 10 nachtcreme 50ml	5586	Косметика (folder)/Косметика	388370	L'Oreal Dermo Expertise
1045384	3600522089056	L'oreal Dermo Expertise revitalift total repair 10 serum 30ml	5586	Косметика (folder)/Косметика	388370	L'Oreal Dermo Expertise
1045380	3600521985434	L'oreal Dermo Expertise revitalift total repair dagcr	5586	Косметика (folder)/Косметика	388370	L'Oreal Dermo Expertise
2353646	3600523039197	L'oreal Dermo Expertise revitalift дневной для смешаной кожи	1	Неклассифицированные/default	388370	L'Oreal Dermo Expertise
10571	3600521287651	L'oreal Dermo Expertise revitalift Крем дневной против морщин-заломов+упругость 50мл	5586	Косметика (folder)/Косметика	388370	L'Oreal Dermo Expertise
2353647	3600523042180	L'oreal Dermo Expertise revitalift лазер 15мл дневной уход	1	Неклассифицированные/default	388370	L'Oreal Dermo Expertise
1207185	3600522249191	L'oreal Dermo Expertise revitalift лазер Крем дневной 50мл бан.	664	Косметика (folder)/Крем для лица	388370	L'Oreal Dermo Expertise
1763141	3600522249795	L'oreal Dermo Expertise revitalift лазер сыворотка 30мл	5586	Косметика (folder)/Косметика	388370	L'Oreal Dermo Expertise
388376	4690214051491	L'oreal Dermo Expertise revitalift набор для конт.лица/шеи50+очищ.м-ко200	360621	Сувениры и подарки (folder)/Подарочный набор	388370	L'Oreal Dermo Expertise
620135	4690214070836	L'oreal Dermo Expertise revitalift набор Крем дневной+Крем в/глаз	360621	Сувениры и подарки (folder)/Подарочный набор	388370	L'Oreal Dermo Expertise
620136	4690214038195	L'oreal Dermo Expertise revitalift набор Крем дневной+молочко	360621	Сувениры и подарки (folder)/Подарочный набор	388370	L'Oreal Dermo Expertise
620137	4690214070829	L'oreal Dermo Expertise revitalift набор Крем ночной+Крем в/глаз	360621	Сувениры и подарки (folder)/Подарочный набор	388370	L'Oreal Dermo Expertise
620138	4690214038201	L'oreal Dermo Expertise revitalift набор Крем ночной+молочко	360621	Сувениры и подарки (folder)/Подарочный набор	388370	L'Oreal Dermo Expertise
620139	4690214028325	L'oreal Dermo Expertise revitalift очищение и обновление баркета 11+1	5586	Косметика (folder)/Косметика	388370	L'Oreal Dermo Expertise
492119	3600521153871	L'oreal Dermo Expertise revitalift очищение и обновление очищающее молочко 200мл	5586	Косметика (folder)/Косметика	388370	L'Oreal Dermo Expertise
388375	3600521154724	L'oreal Dermo Expertise revitalift очищение и обновление очищающий тоник 200мл	5586	Косметика (folder)/Косметика	388370	L'Oreal Dermo Expertise
620140	3600521153024	L'oreal Dermo Expertise revitalift очищение и обновление разогревающий Крем для умывания 150мл	5586	Косметика (folder)/Косметика	388370	L'Oreal Dermo Expertise
388378	3600521155950	L'oreal Dermo Expertise revitalift очищение и обновление салфетки	1276	Салфетки	388370	L'Oreal Dermo Expertise
13233	3600010006725	L'oreal Dermo Expertise revitalift плен с наносомами ночной 50мл	5586	Косметика (folder)/Косметика	388370	L'Oreal Dermo Expertise
388377	4690214063692	L'oreal Dermo Expertise revitalift подарочный набор Крем ночной+молочко	360621	Сувениры и подарки (folder)/Подарочный набор	388370	L'Oreal Dermo Expertise
1207187	3600522182917	L'oreal Dermo Expertise revitalift полное восстановление 10 bb-Cream лёгкий	664	Косметика (folder)/Крем для лица	388370	L'Oreal Dermo Expertise
2178039	3600522892557	L'oreal Dermo Expertise revitalift филлер дневной Крем	1	Неклассифицированные/default	388370	L'Oreal Dermo Expertise
6943	3600520950129	L'oreal Dermo Expertise revitalift флюид spf15. дозатор, 50мл	5586	Косметика (folder)/Косметика	388370	L'Oreal Dermo Expertise
1918112	3600522456421	L'oreal Dermo Expertise Skin Perfect bb Cream Light 50ml 6x 50ml	1	Неклассифицированные/default	388370	L'Oreal Dermo Expertise
1918113	3600522454069	L'oreal Dermo Expertise Skin Perfect Day Cream 50ml 6x 50ml	1	Неклассифицированные/default	388370	L'Oreal Dermo Expertise
1918114	3600522455295	L'oreal Dermo Expertise Skin Perfect Eye Cream 15ml 6x 15ml	1	Неклассифицированные/default	388370	L'Oreal Dermo Expertise
1918115	3600522455851	L'oreal Dermo Expertise Skin Perfect instant blur 6x 15ml	1	Неклассифицированные/default	388370	L'Oreal Dermo Expertise
1918116	3600522454731	L'oreal Dermo Expertise Skin Perfect serum 30ml 6x 30ml	1	Неклассифицированные/default	388370	L'Oreal Dermo Expertise
1045394	8710678128426	L'oreal Dermo Expertise Sublime bronze melk 150ml	5586	Косметика (folder)/Косметика	388370	L'Oreal Dermo Expertise
1045395	3600522104421	L'oreal Dermo Expertise Sublime bronze Mousse dor 150ml	5586	Косметика (folder)/Косметика	388370	L'Oreal Dermo Expertise
1045396	3600520888248	L'oreal Dermo Expertise Sublime bronze spray reno 150ml	5586	Косметика (folder)/Косметика	388370	L'Oreal Dermo Expertise
4491123	3600521728642	L'oreal Dermo Expertise triple active 50ml	1	Неклассифицированные/default	2626	L'Oreal
217666	5011408063684	L'oreal Dermo Expertise triple active cleanser Dry / Sensitive 200ml	5586	Косметика (folder)/Косметика	388370	L'Oreal Dermo Expertise
388406	3600521719640	L'oreal Dermo Expertise triple active Day Cream d/sen. 50ml	5586	Косметика (folder)/Косметика	388370	L'Oreal Dermo Expertise
1526435	3600521719596	L'oreal Dermo Expertise triple active Day moisturiser (Normal/comb) 50ml	32377	Косметика (folder)/Уход за кожей	388370	L'Oreal Dermo Expertise
1045404	3600521729694	L'oreal Dermo Expertise triple active droog/gev 50ml	5586	Косметика (folder)/Косметика	388370	L'Oreal Dermo Expertise
1045405	3600521719749	L'oreal Dermo Expertise triple active Dry Skin 50ml	5586	Косметика (folder)/Косметика	388370	L'Oreal Dermo Expertise
1045406	3600522220992	L'oreal Dermo Expertise triple active hydra. normaal 50ml	5586	Косметика (folder)/Косметика	388370	L'Oreal Dermo Expertise
1045398	5410103128511	L'oreal Dermo Expertise triple active Milk confort 200ml	5586	Косметика (folder)/Косметика	388370	L'Oreal Dermo Expertise
1045407	3600521757277	L'oreal Dermo Expertise triple active Night 50ml	5586	Косметика (folder)/Косметика	388370	L'Oreal Dermo Expertise
1045408	3600521719695	L'oreal Dermo Expertise triple active norm/gem 50ml	5586	Косметика (folder)/Косметика	388370	L'Oreal Dermo Expertise
1045409	3600521729649	L'oreal Dermo Expertise triple active norm/gem 50ml #2	5586	Косметика (folder)/Косметика	388370	L'Oreal Dermo Expertise
1045403	3600521936771	L'oreal Dermo Expertise triple active nutrissime x 50ml pss	961989	Косметика (folder)/Уход за лицом	388370	L'Oreal Dermo Expertise
1045397	8710678143849	L'oreal Dermo Expertise triple active rein melk nr	5586	Косметика (folder)/Косметика	388370	L'Oreal Dermo Expertise
1045400	4037900013072	L'oreal Dermo Expertise triple active tiss.confort 25st	5586	Косметика (folder)/Косметика	388370	L'Oreal Dermo Expertise
1045399	3600521857328	L'oreal Dermo Expertise triple active tissues norm	5586	Косметика (folder)/Косметика	388370	L'Oreal Dermo Expertise
1045402	5410103128719	L'oreal Dermo Expertise triple active tonic confort 200ml	5586	Косметика (folder)/Косметика	388370	L'Oreal Dermo Expertise
1045401	8710678143832	L'oreal Dermo Expertise triple active tonic norm hd	5586	Косметика (folder)/Косметика	388370	L'Oreal Dermo Expertise
1045410	5011408061758	L'oreal Dermo Expertise visible results regular 50ml	5586	Косметика (folder)/Косметика	388370	L'Oreal Dermo Expertise
220856	5011408063820	L'oreal Dermo Expertise visible results spf15 50ml	5586	Косметика (folder)/Косметика	388370	L'Oreal Dermo Expertise
1045438	071249077344	L'oreal Dermo Expertise visibly clean cl	5586	Косметика (folder)/Косметика	388370	L'Oreal Dermo Expertise
1045439	071249077351	L'oreal Dermo Expertise visibly clean cl #2	5586	Косметика (folder)/Косметика	388370	L'Oreal Dermo Expertise
1045440	071249077368	L'oreal Dermo Expertise visibly clean to	5586	Косметика (folder)/Косметика	388370	L'Oreal Dermo Expertise
217540	8991380221081	L'oreal Dermo Expertise White Perfect Day Cream 50ml	5586	Косметика (folder)/Косметика	388370	L'Oreal Dermo Expertise
217542	8991380222484	L'oreal Dermo Expertise White Perfect Eye spf15	5586	Косметика (folder)/Косметика	388370	L'Oreal Dermo Expertise
220848	8991380221074	L'oreal Dermo Expertise White Perfect transparent rosy whitening Night Cream 50ml	664	Косметика (folder)/Крем для лица	388370	L'Oreal Dermo Expertise
1526436	071249118252	L'oreal Dermo Expertise wrinkle de-crease collagen filler	5586	Косметика (folder)/Косметика	388370	L'Oreal Dermo Expertise
302541	071249079201	L'oreal Dermo Expertise wrinkle de-crease with boswelox advanced wrinkle corrector&Dermo smoother 50ml/1.7oz	5586	Косметика (folder)/Косметика	388370	L'Oreal Dermo Expertise
1045411	071249003824	L'oreal Dermo Expertise wrinkle de-crease with boswelox Aqua/Water cyclohexasiloxane, glycerin, butyrospermum parkii/shea butt	5586	Косметика (folder)/Косметика	388370	L'Oreal Dermo Expertise
388407	3600521717707	L'oreal Dermo Expertise youth Code anti wrinkle Day Cream 50ml	5586	Косметика (folder)/Косметика	388370	L'Oreal Dermo Expertise
1045413	3600521718100	L'oreal Dermo Expertise youth Code Day 50ml	5586	Косметика (folder)/Косметика	388370	L'Oreal Dermo Expertise
1045414	3600521718902	L'oreal Dermo Expertise youth Code Eye 15ml	5586	Косметика (folder)/Косметика	388370	L'Oreal Dermo Expertise
1045415	3600522084457	L'oreal Dermo Expertise youth Code lumiere Day 50ml	5586	Косметика (folder)/Косметика	388370	L'Oreal Dermo Expertise
1045416	3600522085256	L'oreal Dermo Expertise youth Code lumiere serum 30ml	5586	Косметика (folder)/Косметика	388370	L'Oreal Dermo Expertise
1045417	3600521935675	L'oreal Dermo Expertise youth Code Night 50ml	5586	Косметика (folder)/Косметика	388370	L'Oreal Dermo Expertise
1045418	3600521936313	L'oreal Dermo Expertise youth Code serum intensief 30ml	5586	Косметика (folder)/Косметика	388370	L'Oreal Dermo Expertise
1763147	3600522654582	L'oreal Dermo Expertise абсолютная нежность 125 мицелярный гель для снятия макияжа	5586	Косметика (folder)/Косметика	388370	L'Oreal Dermo Expertise
388396	3600521684085	L'oreal Dermo Expertise абсолютная нежность 200мл для сухой и чувствительной кожи тоник	5586	Косметика (folder)/Косметика	388370	L'Oreal Dermo Expertise
1045419	3600521128855	L'oreal Dermo Expertise автозагар гель-цвет улучшающий кожу Sublime bronze 150мл	5586	Косметика (folder)/Косметика	388370	L'Oreal Dermo Expertise
13303	3600520239491	L'oreal Dermo Expertise визибл ризалтс молочко флакон 200мл	5586	Косметика (folder)/Косметика	388370	L'Oreal Dermo Expertise
13304	3600520239545	L'oreal Dermo Expertise визибл ризалтс тоник-гель флакон 200мл	5586	Косметика (folder)/Косметика	388370	L'Oreal Dermo Expertise
2810854	3600523408917	L'oreal Dermo Expertise возраст Эксперт Крем 65+ ночь бан.50мл	1	Неклассифицированные/default	2626	L'Oreal
2178037	3600522880738	L'oreal Dermo Expertise возраст Эксперт уход-скульптор 45+	1	Неклассифицированные/default	388370	L'Oreal Dermo Expertise
2178038	3600522880721	L'oreal Dermo Expertise возраст Эксперт уход-скульптор 55+	1	Неклассифицированные/default	388370	L'Oreal Dermo Expertise
1837911	3054080074342	L'oreal Dermo Expertise гель Pure Zone глубоко очищающий 200мл	32377	Косметика (folder)/Уход за кожей	388370	L'Oreal Dermo Expertise
13242	3600010013020	L'oreal Dermo Expertise гид.гел.п.з.п/несов.кожи 50мл	5586	Косметика (folder)/Косметика	388370	L'Oreal Dermo Expertise
13240	3600520324166	L'oreal Dermo Expertise гидро-комфорт гель-мусс для нормальной и сухой кожи тюб.150мл	5586	Косметика (folder)/Косметика	388370	L'Oreal Dermo Expertise
13237	3600520239071	L'oreal Dermo Expertise гидро-комфорт молочко флакон 200мл	5586	Косметика (folder)/Косметика	388370	L'Oreal Dermo Expertise
6938	3600521122242	L'oreal Dermo Expertise демак Эксперт молочко-тоник очищающее средство 2в1 150мл	5586	Косметика (folder)/Косметика	388370	L'Oreal Dermo Expertise
6950	3600521122440	L'oreal Dermo Expertise демак Эксперт очищающий эликсир для снятия водостойкого и стойкого макияжа 100мл	1051	Косметика (folder)/Демакияж	388370	L'Oreal Dermo Expertise
6053	4690214014502	L'oreal Dermo Expertise дерма генезис ночной уход 50мл+контур вокруг глаз 15мл	5586	Косметика (folder)/Косметика	388370	L'Oreal Dermo Expertise
620143	4607017270189	L'oreal Dermo Expertise дерма генезис разглаживающий и сужающий поры баркета 10 продуктов	5586	Косметика (folder)/Косметика	388370	L'Oreal Dermo Expertise
388379	4690214063753	L'oreal Dermo Expertise дермо генезис подарочный набор инт.ноч.уход фл.5	360621	Сувениры и подарки (folder)/Подарочный набор	388370	L'Oreal Dermo Expertise
