ID	UPCEAN	Name	CategoryID	CategoryName	BrandID	BrandName
1941711	7891024174180	Palmolive Shampoo Naturals kids cab cach 350ml 17418	1	Неклассифицированные/default	5730	Palmolive
1601602	7891024171639	Palmolive Shampoo Naturals mac/prolon 350ml 17163b	1412	Уход за волосами (folder)/Шампунь	5730	Palmolive
2180665	5900273273208	Palmolive Shampoo Naturals mv 200ml	1	Неклассифицированные/default	5730	Palmolive
1601667	7891024172230	Palmolive Shampoo Naturals neut 350ml 17223a	1412	Уход за волосами (folder)/Шампунь	5730	Palmolive
1601671	7891024161913	Palmolive Shampoo Naturals nutri lis 350m 16191a	1412	Уход за волосами (folder)/Шампунь	5730	Palmolive
2180667	5900273272201	Palmolive Shampoo Naturals nvamv 200ml	1	Неклассифицированные/default	5730	Palmolive
1601685	7891024171486	Palmolive Shampoo Naturals Perfect Long 350ml 17148	1412	Уход за волосами (folder)/Шампунь	5730	Palmolive
2180672	5900273275400	Palmolive Shampoo Naturals pl 400ml	1	Неклассифицированные/default	5730	Palmolive
1941712	7891024171318	Palmolive Shampoo Naturals pont perf 350ml	1	Неклассифицированные/default	5730	Palmolive
12689	5900273270405	Palmolive Shampoo Naturals pre dlhe a leskle vlasy - olive Milk 400ml	1412	Уход за волосами (folder)/Шампунь	5730	Palmolive
1601665	7891024174043	Palmolive Shampoo Naturals queda resist 350ml 17404	1412	Уход за волосами (folder)/Шампунь	5730	Palmolive
1941713	7891024171400	Palmolive Shampoo Naturals rep completa 350ml 17140	1	Неклассифицированные/default	5730	Palmolive
1565772	1480888843101	Palmolive Shampoo Naturals silky s 12ml	1412	Уход за волосами (folder)/Шампунь	5730	Palmolive
1565773	4808888431017	Palmolive Shampoo Naturals silky s 12ml #2	1412	Уход за волосами (folder)/Шампунь	5730	Palmolive
1941714	7891024170731	Palmolive Shampoo Naturals Solar protec 350ml	1	Неклассифицированные/default	5730	Palmolive
1843880	4808888416700	Palmolive Shampoo Naturals Sun prtct 12ml 6s/60	1412	Уход за волосами (folder)/Шампунь	5730	Palmolive
1843879	4808888416403	Palmolive Shampoo Naturals Sun prtct 200ml/24	1412	Уход за волосами (folder)/Шампунь	5730	Palmolive
2180669	5900273274205	Palmolive Shampoo Naturals sv 200ml	1	Неклассифицированные/default	5730	Palmolive
2180673	5900273274403	Palmolive Shampoo Naturals sv 400ml	1	Неклассифицированные/default	5730	Palmolive
2392434	8714789880549	Palmolive Shampoo Naturals Ultra cleansing - nettle 350ml	1	Неклассифицированные/default	5730	Palmolive
2392435	8714789880488	Palmolive Shampoo Naturals vital strong - Apple 350ml	1	Неклассифицированные/default	5730	Palmolive
400497	4808888460109	Palmolive Shampoo Normal 100ml	1412	Уход за волосами (folder)/Шампунь	5730	Palmolive
2651129	8714789894065	Palmolive Shampoo olive 350ml	1412	Уход за волосами (folder)/Шампунь	5730	Palmolive
400498	8003520043061	Palmolive Shampoo olive Milk 400ml	1412	Уход за волосами (folder)/Шампунь	5730	Palmolive
400499	8714789039473	Palmolive Shampoo Original Aloe Vera 400ml	1412	Уход за волосами (folder)/Шампунь	5730	Palmolive
1565888	4808888401874	Palmolive Shampoo pe 200ml+cn pe 200ml/24	1412	Уход за волосами (folder)/Шампунь	5730	Palmolive
1086978	8850006534571	Palmolive Shampoo Perfect ends 200ml/24	1	Неклассифицированные/default	5730	Palmolive
1565874	8850006534557	Palmolive Shampoo Perfect ends 6s 12ml/360	1412	Уход за волосами (folder)/Шампунь	5730	Palmolive
1565873	8850006534564	Palmolive Shampoo perpect ends 100ml	1412	Уход за волосами (folder)/Шампунь	5730	Palmolive
2372518	4808888002514	Palmolive Shampoo pnk/grn/slky 6doz 14ml+ponc	28	Уход за волосами (folder)/Уход за волосами	5730	Palmolive
2651130	7891024170915	Palmolive Shampoo renovacao pos quim. 350ml	1	Неклассифицированные/default	5730	Palmolive
1565806	4808888001326	Palmolive Shampoo s&s 6s 14ml+1pcs ponc ss 14ml	1412	Уход за волосами (folder)/Шампунь	5730	Palmolive
2678800	7891024026113	Palmolive Shampoo sedutor turmal 350ml	1412	Уход за волосами (folder)/Шампунь	5730	Palmolive
400501	4808888433202	Palmolive Shampoo sensual 100ml	1412	Уход за волосами (folder)/Шампунь	5730	Palmolive
1577494	4808888401690	Palmolive Shampoo shin 200ml+con 100ml/24	1360818	Неклассифицированные/PROMO PRODUCTS	5730	Palmolive
1565875	1480888843125	Palmolive Shampoo silky 100ml+pons	1412	Уход за волосами (folder)/Шампунь	5730	Palmolive
1565876	4808888431253	Palmolive Shampoo silky 100ml+pons #2	1412	Уход за волосами (folder)/Шампунь	5730	Palmolive
1565877	4808888400136	Palmolive Shampoo silky straight 100ml+1	1412	Уход за волосами (folder)/Шампунь	5730	Palmolive
1565878	4808888001005	Palmolive Shampoo silky straight 12ml 11+1/30	1412	Уход за волосами (folder)/Шампунь	5730	Palmolive
1565808	4808888002163	Palmolive Shampoo silky straight 14ml 11+1/32	1412	Уход за волосами (folder)/Шампунь	5730	Palmolive
1565880	8850006535103	Palmolive Shampoo silky straight 15ml	1412	Уход за волосами (folder)/Шампунь	5730	Palmolive
2372519	8850006493045	Palmolive Shampoo silky straight 15ml triple	28	Уход за волосами (folder)/Уход за волосами	5730	Palmolive
1565809	4808888001463	Palmolive Shampoo silky straight 180ml b2 save p65	1412	Уход за волосами (folder)/Шампунь	5730	Palmolive
1565807	4808888402154	Palmolive Shampoo silky straight 180ml+ponc ss 90ml	1412	Уход за волосами (folder)/Шампунь	5730	Palmolive
1565882	4808888439082	Palmolive Shampoo silky straight 200ml+c	1412	Уход за волосами (folder)/Шампунь	5730	Palmolive
400503	4808888431468	Palmolive Shampoo silky straight 200ml+pos 70g	1412	Уход за волосами (folder)/Шампунь	5730	Palmolive
1565881	4808888401591	Palmolive Shampoo silky straight 200mlf 100ml/24	1412	Уход за волосами (folder)/Шампунь	5730	Palmolive
2372520	8850006493939	Palmolive Shampoo silky straight 350ml	28	Уход за волосами (folder)/Уход за волосами	5730	Palmolive
400467	4808888431024	Palmolive Shampoo silky straight 6s 12ml/60	1412	Уход за волосами (folder)/Шампунь	5730	Palmolive
1565879	8850006491126	Palmolive Shampoo silky straight 6s 14ml/64	1412	Уход за волосами (folder)/Шампунь	5730	Palmolive
1086995	8850006491102	Palmolive Shampoo smooth&silky 15mlx12	1412	Уход за волосами (folder)/Шампунь	5730	Palmolive
1843881	1111241602034	Palmolive Shampoo ss 11+ pck 12ml/30	1412	Уход за волосами (folder)/Шампунь	5730	Palmolive
2372521	4808888002705	Palmolive Shampoo ss 350ml b1+1@50%off2nd	28	Уход за волосами (folder)/Уход за волосами	5730	Palmolive
1565841	4808888400402	Palmolive Shampoo str n sprk6s 12ml/60	1412	Уход за волосами (folder)/Шампунь	5730	Palmolive
1565840	4808888400419	Palmolive Shampoo strt n sprk 100ml/36	1412	Уход за волосами (folder)/Шампунь	5730	Palmolive
1565883	8850006535592	Palmolive Shampoo Sun protect 12ml	1412	Уход за волосами (folder)/Шампунь	5730	Palmolive
1565884	8850006535608	Palmolive Shampoo Sun protect 200ml	1412	Уход за волосами (folder)/Шампунь	5730	Palmolive
1565885	4808888890579	Palmolive Shampoo Sun protect b 1g 1 200ml	1412	Уход за волосами (folder)/Шампунь	5730	Palmolive
1565810	8850006491973	Palmolive Shampoo vib clr 14ml 6s/64	1412	Уход за волосами (folder)/Шампунь	5730	Palmolive
1565811	8850006491997	Palmolive Shampoo vibrant Color 180ml	1412	Уход за волосами (folder)/Шампунь	5730	Palmolive
1086996	8714789770932	Palmolive Shampoo vitaliteit 400ml	1412	Уход за волосами (folder)/Шампунь	5730	Palmolive
1565819	8714789627366	Palmolive Shampoo vitaliteit 400ml #2	1412	Уход за волосами (folder)/Шампунь	5730	Palmolive
1565820	8714789627304	Palmolive Shampoo volume olijf 400ml	1412	Уход за волосами (folder)/Шампунь	5730	Palmolive
1565892	4808888411880	Palmolive Shampoo+Conditioner an 12ml	1412	Уход за волосами (folder)/Шампунь	5730	Palmolive
400504	4808888429533	Palmolive Shampoo+Conditioner anti-stress 200ml	1412	Уход за волосами (folder)/Шампунь	5730	Palmolive
1565889	4808888442020	Palmolive Shampoo+Conditioner brillianshine 12ml	1412	Уход за волосами (folder)/Шампунь	5730	Palmolive
400506	4808888430539	Palmolive Shampoo+Conditioner Energy 200ml	1412	Уход за волосами (folder)/Шампунь	5730	Palmolive
1565887	4808888401485	Palmolive Shampoo+Conditioner fg 100ml+fd	1412	Уход за волосами (folder)/Шампунь	5730	Palmolive
1565812	4808888401126	Palmolive Shampoo+Conditioner fg 200ml@129	1412	Уход за волосами (folder)/Шампунь	5730	Palmolive
1565890	4808888401133	Palmolive Shampoo+Conditioner fgl&s 200ml	1412	Уход за волосами (folder)/Шампунь	5730	Palmolive
1565891	4808888446011	Palmolive Shampoo+Conditioner Hair repair 12ml	1412	Уход за волосами (folder)/Шампунь	5730	Palmolive
400507	4808888433219	Palmolive Shampoo+Conditioner sensual 100ml	1412	Уход за волосами (folder)/Шампунь	5730	Palmolive
400508	4808888433011	Palmolive Shampoo+Conditioner sensual 12ml	1412	Уход за волосами (folder)/Шампунь	5730	Palmolive
1565886	4808888401423	Palmolive Shampoo+Conditioner silky straight 200ml	1412	Уход за волосами (folder)/Шампунь	5730	Palmolive
2372522	035000815019	Palmolive shave brshls crm 4.4oz	1	Неклассифицированные/default	2345088	CGP
2372523	035000800015	Palmolive shave gntllather crm 4.4oz	1	Неклассифицированные/default	2345088	CGP
400510	4011200136907	Palmolive shaving sticks (3x10)	1	Неклассифицированные/default	5730	Palmolive
4575326	035000058812	Palmolive shipper 1ct	1	Неклассифицированные/default	5730	Palmolive
1566013	8901314005861	Palmolive show Gel Aroma sensual 250ml	1	Неклассифицированные/default	5730	Palmolive
400512	8714789514505	Palmolive Shower absolute relax Shower Gel 250ml	401	Гигиена (folder)/Гель для душа	5730	Palmolive
197844	4011200316903	Palmolive Shower and creme almond Milk 250ml	401	Гигиена (folder)/Гель для душа	5730	Palmolive
197799	8003520010971	Palmolive Shower and creme Milk/Honey 250ml	1	Неклассифицированные/default	5730	Palmolive
2651131	8714789995724	Palmolive Shower Coconut pma?1 250ml	336078	Гигиена (folder)/Personal Hygiene	5730	Palmolive
2651132	8714789995731	Palmolive Shower Coconut pma?1 250ml #2	336078	Гигиена (folder)/Personal Hygiene	5730	Palmolive
636437	50209828	Palmolive Shower Cream Milk&Honey 250ml	1	Неклассифицированные/default	5730	Palmolive
2180687	5996175230777	Palmolive Shower Gel 300+200ml almond Milk	1	Неклассифицированные/default	5730	Palmolive
2180688	5996175230807	Palmolive Shower Gel 300+200ml Milk proteins	1	Неклассифицированные/default	5730	Palmolive
2180689	5996175230784	Palmolive Shower Gel 300+200ml Milk&Honey	1	Неклассифицированные/default	5730	Palmolive
2180690	5996175234041	Palmolive Shower Gel 300+200ml olive Milk	1	Неклассифицированные/default	5730	Palmolive
636438	8003520014207	Palmolive Shower Gel a/s pm	401	Гигиена (folder)/Гель для душа	5730	Palmolive
2180691	3015810647298	Palmolive Shower Gel almond Milk 300ml	1	Неклассифицированные/default	5730	Palmolive
1098246	8714789656076	Palmolive Shower Gel almond pm1	1	Неклассифицированные/default	5730	Palmolive
220061	8850006531723	Palmolive Shower Gel Aroma anti stress 250ml (na)	401	Гигиена (folder)/Гель для душа	5730	Palmolive
2392363	8714789514512	Palmolive Shower Gel aromatherapy absolute relax 500ml	1	Неклассифицированные/default	0	
2180677	8003520044624	Palmolive Shower Gel aromatherapy happyful 250ml	1	Неклассифицированные/default	5730	Palmolive
2180678	8714789487618	Palmolive Shower Gel aromatherapy morning tonic 250ml #2	1	Неклассифицированные/default	5730	Palmolive
1086966	8714789585529	Palmolive Shower Gel aromatherapy warm vanilla 250ml	1	Неклассифицированные/default	5730	Palmolive
2392364	8714789720883	Palmolive Shower Gel ayurituel joyous 500ml	1	Неклассифицированные/default	0	
2392365	8714789853000	Palmolive Shower Gel ayurituel peaceful 250ml	1	Неклассифицированные/default	0	
1086997	8714789671383	Palmolive Shower Gel bergamot 250ml	401	Гигиена (folder)/Гель для душа	5730	Palmolive
2180679	8003520038081	Palmolive Shower Gel bodyogurt bamboo 250ml	1	Неклассифицированные/default	5730	Palmolive
2180676	8003520039668	Palmolive Shower Gel cashmere hydrat 200ml	1	Неклассифицированные/default	5730	Palmolive
2180680	8714789557564	Palmolive Shower Gel cocoa Butter 250ml	1	Неклассифицированные/default	5730	Palmolive
2180681	8003520042880	Palmolive Shower Gel for men activ powe 250ml	1	Неклассифицированные/default	5730	Palmolive
2392366	8714789733104	Palmolive Shower Gel for men Blue refreshing 500ml	1	Неклассифицированные/default	0	
2392367	8714789939834	Palmolive Shower Gel for men brazilian guarana 250ml	1	Неклассифицированные/default	0	
2180683	8714789591339	Palmolive Shower Gel for men Light powe 250ml	1	Неклассифицированные/default	5730	Palmolive
636439	8003520011015	Palmolive Shower Gel m&hn 250mlpm	401	Гигиена (folder)/Гель для душа	5730	Palmolive
2180684	8714789452593	Palmolive Shower Gel madagascar 250ml	1	Неклассифицированные/default	5730	Palmolive
2392374	8714789857596	Palmolive Shower Gel mediterranean moments almond&argan Oil 250ml	1	Неклассифицированные/default	5730	Palmolive
2392375	8714789857602	Palmolive Shower Gel mediterranean moments Apricot&strawberry 250ml	1	Неклассифицированные/default	5730	Palmolive
2392376	8714789857619	Palmolive Shower Gel mediterranean moments Lily&Rose petals 250ml	1	Неклассифицированные/default	5730	Palmolive
1086951	8714789733173	Palmolive Shower Gel Naturals almond Milk 500ml	1	Неклассифицированные/default	5730	Palmolive
2392377	8693495031158	Palmolive Shower Gel Naturals almond Milk pumpa 750ml	1	Неклассифицированные/default	5730	Palmolive
2392378	8714789639963	Palmolive Shower Gel Naturals Black orchid 250ml	1	Неклассифицированные/default	5730	Palmolive
2392379	8714789733180	Palmolive Shower Gel Naturals Black orchid 500ml	1	Неклассифицированные/default	0	
2392380	8714789732909	Palmolive Shower Gel Naturals Cherry blossom 250ml	1	Неклассифицированные/default	0	
2392381	8714789451190	Palmolive Shower Gel Naturals Coconut 250ml	1	Неклассифицированные/default	5730	Palmolive
2392382	8714789732923	Palmolive Shower Gel Naturals Coconut 250ml #2	1	Неклассифицированные/default	0	
2392383	8693495042857	Palmolive Shower Gel Naturals for kids pumpa 750ml	1	Неклассифицированные/default	0	
2392384	8714789939780	Palmolive Shower Gel Naturals macadamia Oil 250ml	1	Неклассифицированные/default	5730	Palmolive
2392385	8714789733159	Palmolive Shower Gel Naturals Milk&Honey 500ml	1	Неклассифицированные/default	0	
400460	8714789526508	Palmolive Shower Gel Naturals Milk&Honey pumpa 750ml	401	Гигиена (folder)/Гель для душа	5730	Palmolive
400475	8714789526478	Palmolive Shower Gel Naturals olive Milk pumpa 750ml	401	Гигиена (folder)/Гель для душа	5730	Palmolive
2180685	8714789553573	Palmolive Shower Gel Orange blossom 250ml	1	Неклассифицированные/default	5730	Palmolive
1565896	8714789431598	Palmolive Shower Gel p/m	1	Неклассифицированные/default	5730	Palmolive
1086998	8714789671390	Palmolive Shower Gel Rose&musk 250ml	401	Гигиена (folder)/Гель для душа	5730	Palmolive
2180692	8003520023827	Palmolive Shower Gel shea Butter 300ml	1	Неклассифицированные/default	5730	Palmolive
2392387	8714789845616	Palmolive Shower Gel thermal spa Aqua calm 250ml	1	Неклассифицированные/default	5730	Palmolive
400462	8714789514635	Palmolive Shower Gel thermal spa mineral massage 250ml	401	Гигиена (folder)/Гель для душа	5730	Palmolive
2392388	8714789846408	Palmolive Shower Gel thermal spa mineral massage 500ml	1	Неклассифицированные/default	0	
2180686	8003520042439	Palmolive Shower Gel ts steam Shower 250ml	1	Неклассифицированные/default	5730	Palmolive
1565897	8714789779119	Palmolive Shower Mild/sen pm1.29 250ml	1	Неклассифицированные/default	5730	Palmolive
1086898	8714789431789	Palmolive Shower Milk Honey&Milk 250ml	1	Неклассифицированные/default	5730	Palmolive
1565898	8714789779010	Palmolive Shower Milk&Honey pm?	336078	Гигиена (folder)/Personal Hygiene	5730	Palmolive
2651133	8714789994772	Palmolive Shower Milk+Honey pma?1 250ml	336078	Гигиена (folder)/Personal Hygiene	5730	Palmolive
2651134	8714789994789	Palmolive Shower Milk+Honey pma?1 250ml #2	336078	Гигиена (folder)/Personal Hygiene	5730	Palmolive
1086999	8003520019042	Palmolive Shower Mousse Energy 200ml	1	Неклассифицированные/default	5730	Palmolive
2372530	4808884021540	Palmolive silky straight buy 1 get	1	Неклассифицированные/default	0	
1761677	4606144008887	Palmolive snezhnaya lavina Menthol m br 0.09kg nab 4606144008887bp1	401	Гигиена (folder)/Гель для душа	5730	Palmolive
4575327	035000469045	Palmolive soap	1	Неклассифицированные/default	5730	Palmolive
220036	6281001332046	Palmolive soap 175g refreshing moisture	146	Гигиена (folder)/Мыло	5730	Palmolive
2372531	8693495033633	Palmolive soap authentic Rose&musk 150g	1	Неклассифицированные/default	5730	Palmolive
1565918	9556031088735	Palmolive soap bty mlk xtr 125g/72	146	Гигиена (folder)/Мыло	5730	Palmolive
1565906	4808888000459	Palmolive soap bty mst cr3s 90g/24	1360818	Неклассифицированные/PROMO PRODUCTS	5730	Palmolive
1565916	9556031085864	Palmolive soap bty nmlk jjb 90g/72	146	Гигиена (folder)/Мыло	5730	Palmolive
1929243	1955603108587	Palmolive soap bty nmlk ms 115g/72	1	Неклассифицированные/default	5730	Palmolive
1929244	9556031087219	Palmolive soap bty nrtr pnk 90g/72	1	Неклассифицированные/default	5730	Palmolive
1565899	8850006492697	Palmolive soap calm&moisture 115g	146	Гигиена (folder)/Мыло	5730	Palmolive
1565900	8850006492703	Palmolive soap calm&moisture 55g	146	Гигиена (folder)/Мыло	5730	Palmolive
2372532	4808888002675	Palmolive soap charcoal 115g buy2+1	146	Гигиена (folder)/Мыло	5730	Palmolive
400514	9556031072116	Palmolive soap citrus Fresh 70g	146	Гигиена (folder)/Мыло	5730	Palmolive
2372533	8850006493885	Palmolive soap f&c (charcoal) 115g	146	Гигиена (folder)/Мыло	5730	Palmolive
2372534	8850006493878	Palmolive soap f&c (charcoal) 55g	146	Гигиена (folder)/Мыло	5730	Palmolive
2372535	4808888002590	Palmolive soap f&c charcoal 55g 5+1	146	Гигиена (folder)/Мыло	5730	Palmolive
400463	9556031084096	Palmolive soap Fresh (pons) citrus Fresh Yellow 60gmx72	336078	Гигиена (folder)/Personal Hygiene	5730	Palmolive
400466	9556031084102	Palmolive soap Fresh (pons) Ocean Fresh White 60gmx72	336078	Гигиена (folder)/Personal Hygiene	5730	Palmolive
1565901	9556031084065	Palmolive soap Fresh&m.Orange 80g	146	Гигиена (folder)/Мыло	5730	Palmolive
1565902	4808888002101	Palmolive soap Glow&moist 3x 55g	146	Гигиена (folder)/Мыло	5730	Palmolive
2372536	4808888002613	Palmolive soap Glow&moist 55g 5+1	146	Гигиена (folder)/Мыло	5730	Palmolive
1565903	8714789700045	Palmolive soap Green 3 pack	1	Неклассифицированные/default	5730	Palmolive
2372537	4808888002545	Palmolive soap Green 55g 5+1 mpk	146	Гигиена (folder)/Мыло	5730	Palmolive
1565905	4808888402468	Palmolive soap Green 80g 3bar	146	Гигиена (folder)/Мыло	5730	Palmolive
2372538	9556031087271	Palmolive soap grn 90g flow wrap	146	Гигиена (folder)/Мыло	5730	Palmolive
1929245	4808888076317	Palmolive soap mga tpd 70g/5	1	Неклассифицированные/default	5730	Palmolive
400516	9556031084126	Palmolive soap moist Care Green 65g	146	Гигиена (folder)/Мыло	5730	Palmolive
2372539	9556031072932	Palmolive soap moisture Care 3x 100g	1	Неклассифицированные/default	5730	Palmolive
1565909	4808888000176	Palmolive soap moisturizer 2bar 90g vp	146	Гигиена (folder)/Мыло	5730	Palmolive
1565911	4808888000169	Palmolive soap moiturize White 65g	1360818	Неклассифицированные/PROMO PRODUCTS	5730	Palmolive
1565920	4808888401249	Palmolive soap n-Milk w/m 90g+candle	1360818	Неклассифицированные/PROMO PRODUCTS	5730	Palmolive
1565921	4808888401270	Palmolive soap n-Milk xf 90g+candle	1360818	Неклассифицированные/PROMO PRODUCTS	5730	Palmolive
400469	9556031084140	Palmolive soap nat (pons) protect&moisture (Yellow) 60gmx72	336078	Гигиена (folder)/Personal Hygiene	5730	Palmolive
400527	9556031079757	Palmolive soap nat (pons) protect&moisture (Yellow) 90g x 72	146	Гигиена (folder)/Мыло	5730	Palmolive
400515	9556031063312	Palmolive soap nat (pons) smooth&moisture (Green) 125g x 72	146	Гигиена (folder)/Мыло	5730	Palmolive
400517	9556031063275	Palmolive soap nat (pons) smooth&moisture (Green) 90gmx72	146	Гигиена (folder)/Мыло	5730	Palmolive
400518	9556031063305	Palmolive soap nat (pons) Soft&moisture (pink) 125gmx72	146	Гигиена (folder)/Мыло	5730	Palmolive
400471	9556031084119	Palmolive soap nat (pons) Soft&moisture (pink) 60gmx72	336078	Гигиена (folder)/Personal Hygiene	5730	Palmolive
400522	9556031076596	Palmolive soap nat (pons) White+protect (Orange papaya) 125 gmx72	146	Гигиена (folder)/Мыло	5730	Palmolive
400524	9556031076589	Palmolive soap nat (pons) White+protect (Orange papaya) 90gmx72	146	Гигиена (folder)/Мыло	5730	Palmolive
1087000	8850006491331	Palmolive soap nat Glow&moisture Red 115gx72	1	Неклассифицированные/default	5730	Palmolive
2372483	8693495034425	Palmolive soap Naturals Black orchid 90g	1	Неклассифицированные/default	5730	Palmolive
2372485	8693495033893	Palmolive soap Naturals citrus Cream 90g	1	Неклассифицированные/default	5730	Palmolive
636440	8003520027801	Palmolive soap Naturals Cream 4x 100g	146	Гигиена (folder)/Мыло	5730	Palmolive
1086980	8850006491355	Palmolive soap Naturals Glow&moisture Red 55gx72	1	Неклассифицированные/default	5730	Palmolive
2372486	8693495034029	Palmolive soap Naturals Green Family pack 4x 90g 360g	1	Неклассифицированные/default	5730	Palmolive
1565914	9556031085840	Palmolive soap Naturals Milk 65g	146	Гигиена (folder)/Мыло	5730	Palmolive
1565774	9556031085055	Palmolive soap Naturals moisture White 12g	146	Гигиена (folder)/Мыло	5730	Palmolive
1565775	9556031085031	Palmolive soap Naturals moisture White 65g	146	Гигиена (folder)/Мыло	5730	Palmolive
1565776	9556031085048	Palmolive soap Naturals moisture White 90g	146	Гигиена (folder)/Мыло	5730	Palmolive
87393	8003520027672	Palmolive soap Naturals Original 4x 100g	146	Гигиена (folder)/Мыло	5730	Palmolive
1565777	4808888401843	Palmolive soap Naturals pink 125g	1360818	Неклассифицированные/PROMO PRODUCTS	5730	Palmolive
400525	9556031079764	Palmolive soap Naturals Sun Care 125g	146	Гигиена (folder)/Мыло	5730	Palmolive
2372492	8693495033817	Palmolive soap Naturals White Family pack 4x 90g 360g	1	Неклассифицированные/default	5730	Palmolive
1565778	9556031084157	Palmolive soap Naturals whitening Care 65g	146	Гигиена (folder)/Мыло	5730	Palmolive
1565917	4808888000749	Palmolive soap nm we 2bar 90g vp	146	Гигиена (folder)/Мыло	5730	Palmolive
400519	9556031076305	Palmolive soap nurturing Care pink 70g	146	Гигиена (folder)/Мыло	5730	Palmolive
1087001	9556031085833	Palmolive soap nutri-Milk w/moisturizing 60gmx72	1	Неклассифицированные/default	5730	Palmolive
400521	9556031072123	Palmolive soap Ocean Fresh 70g	146	Гигиена (folder)/Мыло	5730	Palmolive
