ID	UPCEAN	Name	CategoryID	CategoryName	BrandID	BrandName
3168785	738435184940	Old fashioned cookies #3	330591	Продукты питания (folder)/Продукты питания	0	
3168786	074026999532	Old fashioned country gravy Mix	330591	Продукты питания (folder)/Продукты питания	0	
3150257	039000031288	Old fashioned country sausage gravy - #10 can	330591	Продукты питания (folder)/Продукты питания	618242	Libby's
3168787	045674039987	Old fashioned country White bread	330591	Продукты питания (folder)/Продукты питания	0	
3168788	074534753008	Old fashioned Cream bars	330591	Продукты питания (folder)/Продукты питания	0	
3168789	687652170055	Old fashioned Cream Cheese	330591	Продукты питания (folder)/Продукты питания	871670	Sierra Nevada
4561809	075186054475	Old fashioned creme drops - zachary collections 10oz	1	Неклассифицированные/default	0	
3168790	049646650453	Old fashioned dandelion jelly	330591	Продукты питания (folder)/Продукты питания	0	
3168791	021130119424	Old fashioned dinner rolls	330591	Продукты питания (folder)/Продукты питания	0	
3168792	072220220001	Old fashioned donut holes	330591	Продукты питания (folder)/Продукты питания	0	
3168793	041483040701	Old fashioned eggnog	330591	Продукты питания (folder)/Продукты питания	2347169	Kemps
3168794	041483041012	Old fashioned eggnog #2	330591	Продукты питания (folder)/Продукты питания	2347169	Kemps
3168795	049646500338	Old fashioned elderberry jelly	330591	Продукты питания (folder)/Продукты питания	0	
3168796	072250011259	Old fashioned enriched bread	330591	Продукты питания (folder)/Продукты питания	0	
3168798	072610002019	Old fashioned enriched bread #3	330591	Продукты питания (folder)/Продукты питания	0	
634502	048707441139	Old fashioned fds bacon chz Spread	1	Неклассифицированные/default	0	
634503	048707552101	Old fashioned fds cheddar Cheese snack Stick	1	Неклассифицированные/default	0	
634504	048707441122	Old fashioned fds jalapeno chz Spread	1	Неклассифицированные/default	0	
634505	048707552507	Old fashioned fds mozzarella snack Stick	1	Неклассифицированные/default	0	
634507	048707435619	Old fashioned fds pizza sauce squeeze bottle	1	Неклассифицированные/default	0	
3168799	011212000627	Old fashioned filled candies	330591	Продукты питания (folder)/Продукты питания	0	
4561810	073407000010	Old fashioned Food processors 4 pk. tomatoes	1	Неклассифицированные/default	0	
634509	048707433387	Old fashioned Foods cheddar Cheese dip	1	Неклассифицированные/default	0	
3168800	048707205007	Old fashioned Foods, sharp spreadable Cheese with almonds	330591	Продукты питания (folder)/Продукты питания	0	
3168801	048707205014	Old fashioned Foods, spreadable Cheese with almonds, port Wine	330591	Продукты питания (folder)/Продукты питания	0	
1561008	202361000006	Old fashioned frankf	1	Неклассифицированные/default	0	
3168802	191619576236	Old fashioned franks	330591	Продукты питания (folder)/Продукты питания	0	
3168803	191619576250	Old fashioned franks #2	330591	Продукты питания (folder)/Продукты питания	0	
3168804	072080046100	Old fashioned fried pork skins, chicharrones	330591	Продукты питания (folder)/Продукты питания	0	
3168805	049646505166	Old fashioned frog jam	330591	Продукты питания (folder)/Продукты питания	0	
1561009	048707870137	Old fashioned grated Cheese 3oz	142810	Продукты питания (folder)/Молочные продукты (folder)/Сыр	0	
1561010	048707870113	Old fashioned grated Cheese 8oz	142810	Продукты питания (folder)/Молочные продукты (folder)/Сыр	0	
3168806	832841000082	Old fashioned hand dipped caramel apples	330591	Продукты питания (folder)/Продукты питания	0	
3168807	071632261770	Old fashioned hand dippin kind, Ice Cream, superman	330591	Продукты питания (folder)/Продукты питания	0	
3168808	071632265020	Old fashioned hand dippin kind, non fat frozen yogurt, chocolate	330591	Продукты питания (folder)/Продукты питания	0	
3168809	011212000818	Old fashioned hard candies	330591	Продукты питания (folder)/Продукты питания	0	
3168810	011212000849	Old fashioned hard candies #2	330591	Продукты питания (folder)/Продукты питания	0	
3168811	011212000917	Old fashioned hard candies #3	330591	Продукты питания (folder)/Продукты питания	0	
3168812	076067006156	Old fashioned hard candies #4	330591	Продукты питания (folder)/Продукты питания	0	
3168813	076067006200	Old fashioned hard candies #5	330591	Продукты питания (folder)/Продукты питания	0	
3168814	050428498859	Old fashioned hard candy	330591	Продукты питания (folder)/Продукты питания	0	
634511	876274000455	Old fashioned hard candy lemonade	1	Неклассифицированные/default	0	
3168815	078184339759	Old fashioned hard candy Mix	330591	Продукты питания (folder)/Продукты питания	0	
3168816	086854061879	Old fashioned hardwood smoked center cut bacon	330591	Продукты питания (folder)/Продукты питания	0	
3168817	085629991403	Old fashioned heavenly caramels	330591	Продукты питания (folder)/Продукты питания	0	
3168818	049646916016	Old fashioned horseradish	330591	Продукты питания (folder)/Продукты питания	0	
4561811	082677135353	Old fashioned Hot Dog roller grill	1	Неклассифицированные/default	0	
3168819	850590004427	Old fashioned Hot habanero salsa	330591	Продукты питания (folder)/Продукты питания	0	
3168820	049646144815	Old fashioned Hot salsa	330591	Продукты питания (folder)/Продукты питания	0	
3168822	041483028174	Old fashioned Ice Cream #2	330591	Продукты питания (folder)/Продукты питания	2347169	Kemps
3168823	041483028198	Old fashioned Ice Cream #3	330591	Продукты питания (folder)/Продукты питания	2347169	Kemps
3168825	041483028228	Old fashioned Ice Cream #5	330591	Продукты питания (folder)/Продукты питания	2347169	Kemps
3168826	041483035714	Old fashioned Ice Cream #6	330591	Продукты питания (folder)/Продукты питания	2347169	Kemps
3168827	737094216900	Old fashioned Ice Cream #7	330591	Продукты питания (folder)/Продукты питания	3005825	The Fresh market
1561011	071632260018	Old fashioned Ice Cream - vanilla	30752	Продукты питания (folder)/Мороженое	0	
634512	048707442051	Old fashioned jalapeno Cheese Spread	1	Неклассифицированные/default	0	
3168828	049646650743	Old fashioned jam	330591	Продукты питания (folder)/Продукты питания	0	
3168829	023896696997	Old fashioned kettle corn	330591	Продукты питания (folder)/Продукты питания	0	
3168830	811353000124	Old fashioned kettle style pork cracklins with rinds	330591	Продукты питания (folder)/Продукты питания	0	
3168831	021333050227	Old fashioned kettle style potato chips	330591	Продукты питания (folder)/Продукты питания	0	
2646291	041641604349	Old fashioned kitchen pancake pto 3z-96ct	1	Неклассифицированные/default	2646290	Old Fashioned Kitchen
1561007	041641604226	Old fashioned kitchen pancake pto 4ct	1	Неклассифицированные/default	2646290	Old Fashioned Kitchen
1561014	041641604097	Old fashioned kitchen pierogie pto chs 12ct	1	Неклассифицированные/default	2646290	Old Fashioned Kitchen
1561015	041641604080	Old fashioned kitchen pierogie pto onion 12ct	1	Неклассифицированные/default	2646290	Old Fashioned Kitchen
1561012	041641604325	Old fashioned kitchens Mini pancakes - sweet potato	1	Неклассифицированные/default	0	
628184	092819250448	Old fashioned kluski egg noodles	1	Неклассифицированные/default	628182	Mrs.Miller's
2178724	076344101406	Old fashioned large asst 4/3.5lb	337596	Товары для животных (folder)/Pets	0	
3168832	081867020042	Old fashioned lattice-topped pie	330591	Продукты питания (folder)/Продукты питания	0	
3168833	041282995288	Old fashioned licorice	330591	Продукты питания (folder)/Продукты питания	0	
3168834	041483028402	Old fashioned Light Ice Cream	330591	Продукты питания (folder)/Продукты питания	2347169	Kemps
3168835	011110966674	Old fashioned loaf	330591	Продукты питания (folder)/Продукты питания	2616592	Kroger
3168836	011110974440	Old fashioned loaf #2	330591	Продукты питания (folder)/Продукты питания	2616592	Kroger
3168838	072250013376	Old fashioned loaves	330591	Продукты питания (folder)/Продукты питания	0	
3168839	041220794010	Old fashioned low calorie soda	330591	Продукты питания (folder)/Продукты питания	0	
3168840	011233490292	Old fashioned mango pie	330591	Продукты питания (folder)/Продукты питания	3008999	Table talk pies
3168841	689076672504	Old fashioned marinade	330591	Продукты питания (folder)/Продукты питания	0	
3168842	049646144860	Old fashioned medium salsa	330591	Продукты питания (folder)/Продукты питания	0	
1561013	203966000002	Old fashioned Mild j	1	Неклассифицированные/default	0	
3168843	049646144808	Old fashioned Mild salsa	330591	Продукты питания (folder)/Продукты питания	0	
3168844	026400410232	Old fashioned Milk	330591	Продукты питания (folder)/Продукты питания	1725483	Darigold
3168845	070424001235	Old fashioned Milk #2	330591	Продукты питания (folder)/Продукты питания	0	
2178725	076344100157	Old fashioned min asst bisc 12/5oz	337596	Товары для животных (folder)/Pets	0	
2178726	076344101505	Old fashioned Mini asst 4/3lb 13oz	337596	Товары для животных (folder)/Pets	0	
3168846	636391758314	Old fashioned Mix	330591	Продукты питания (folder)/Продукты питания	0	
3168847	049022802353	Old fashioned Mix Classic hard candies	330591	Продукты питания (folder)/Продукты питания	0	
3168848	045674529853	Old fashioned multigrain bread	330591	Продукты питания (folder)/Продукты питания	0	
3168849	028934006066	Old fashioned mustard	330591	Продукты питания (folder)/Продукты питания	0	
3168850	069593120199	Old fashioned mustard for marinades	330591	Продукты питания (folder)/Продукты питания	0	
3168851	041130592799	Old fashioned Natural casing wieners	330591	Продукты питания (folder)/Продукты питания	0	
3168852	041483028143	Old fashioned New york vanilla	330591	Продукты питания (folder)/Продукты питания	2347169	Kemps
4561812	094805035510	Old fashioned nutcracker	1	Неклассифицированные/default	0	
3168304	021140142153	Old fashioned oatmeal cookies	330591	Продукты питания (folder)/Продукты питания	3001738	Winn-dixie
3168853	041268200740	Old fashioned oats	330591	Продукты питания (folder)/Продукты питания	375311	Hannaford
3168862	060788011704	Old fashioned oats #10	330591	Продукты питания (folder)/Продукты питания	0	
3168863	085239981801	Old fashioned oats #11	330591	Продукты питания (folder)/Продукты питания	0	
3168864	085239981825	Old fashioned oats #12	330591	Продукты питания (folder)/Продукты питания	0	
3168854	042400049531	Old fashioned oats #2	330591	Продукты питания (folder)/Продукты питания	622561	Malt-O-Meal
3168855	041497525294	Old fashioned oats #3	330591	Продукты питания (folder)/Продукты питания	3001562	Weis
3168857	041303002094	Old fashioned oats #5	330591	Продукты питания (folder)/Продукты питания	0	
3168858	041303002117	Old fashioned oats #6	330591	Продукты питания (folder)/Продукты питания	0	
3168859	041380199021	Old fashioned oats #7	330591	Продукты питания (folder)/Продукты питания	0	
3168860	041415021051	Old fashioned oats #8	330591	Продукты питания (folder)/Продукты питания	0	
3168861	051933151901	Old fashioned oats #9	330591	Продукты питания (folder)/Продукты питания	0	
3168865	018894100225	Old fashioned oats 100% whole grain cereal	330591	Продукты питания (folder)/Продукты питания	3018502	Big y
3168866	042400217879	Old fashioned oats 100% whole grain cereals	330591	Продукты питания (folder)/Продукты питания	0	
3168867	036800437036	Old fashioned oats gluten free oatmeal	330591	Продукты питания (folder)/Продукты питания	0	
3168868	041260695759	Old fashioned oven ready meat loaf Mix	330591	Продукты питания (folder)/Продукты питания	0	
3168869	041449050003	Old fashioned pancake&waffle Mix	330591	Продукты питания (folder)/Продукты питания	0	
3168870	850544005593	Old fashioned pea ches	330591	Продукты питания (folder)/Продукты питания	0	
4561813	011233089366	Old fashioned Peach pie by wal-mart 4oz	1	Неклассифицированные/default	0	
3168871	049646144839	Old fashioned Peach salsa	330591	Продукты питания (folder)/Продукты питания	0	
3168872	049646900923	Old fashioned Peach slices	330591	Продукты питания (folder)/Продукты питания	0	
3168873	683639921627	Old fashioned Peanut brittle	330591	Продукты питания (folder)/Продукты питания	0	
3168874	049646550029	Old fashioned Peanut Butter Spread	330591	Продукты питания (folder)/Продукты питания	0	
3168875	041303060834	Old fashioned pecan pie	330591	Продукты питания (folder)/Продукты питания	0	
634513	048707442044	Old fashioned pepper Jack Cheese Spread	1	Неклассифицированные/default	0	
3168876	052548587444	Old fashioned peppermints	330591	Продукты питания (folder)/Продукты питания	0	
1989318	825116016598	Old fashioned photo treasure DVD (sale)	1980351	Adult/Adult DVD	0	
3168877	041303060803	Old fashioned pie	330591	Продукты питания (folder)/Продукты питания	0	
3168878	081867010029	Old fashioned pie #2	330591	Продукты питания (folder)/Продукты питания	0	
3168879	020138133357	Old fashioned pie filling	330591	Продукты питания (folder)/Продукты питания	0	
3168880	075446030010	Old fashioned pimento Cheese	330591	Продукты питания (folder)/Продукты питания	0	
3168881	034877610024	Old fashioned pink lemonade	330591	Продукты питания (folder)/Продукты питания	0	
3168882	691355893623	Old fashioned popcorn	330591	Продукты питания (folder)/Продукты питания	3005988	Hammond's
3168883	691355896907	Old fashioned popcorn #2	330591	Продукты питания (folder)/Продукты питания	3005988	Hammond's
3168884	837654924556	Old fashioned popcorn #3	330591	Продукты питания (folder)/Продукты питания	0	
3168885	074441125004	Old fashioned poppy seed dressing	330591	Продукты питания (folder)/Продукты питания	0	
3168886	071104501199	Old fashioned potato chips	330591	Продукты питания (folder)/Продукты питания	0	
3168887	071104508549	Old fashioned potato chips #2	330591	Продукты питания (folder)/Продукты питания	0	
3168888	011110653567	Old fashioned potato salad	330591	Продукты питания (folder)/Продукты питания	2616592	Kroger
3168889	011110653598	Old fashioned potato salad #2	330591	Продукты питания (folder)/Продукты питания	2616592	Kroger
3168890	021140021755	Old fashioned potato salad #3	330591	Продукты питания (folder)/Продукты питания	3001738	Winn-dixie
3168891	021140021762	Old fashioned potato salad #4	330591	Продукты питания (folder)/Продукты питания	3001738	Winn-dixie
3168892	017839941015	Old fashioned potato salad #5	330591	Продукты питания (folder)/Продукты питания	0	
3168893	030703014165	Old fashioned potato salad #6	330591	Продукты питания (folder)/Продукты питания	0	
3168894	030703014486	Old fashioned potato salad #7	330591	Продукты питания (folder)/Продукты питания	0	
3168895	038259116494	Old fashioned potato salad #8	330591	Продукты питания (folder)/Продукты питания	0	
4561814	071117182484	Old fashioned potato salad 16oz	1	Неклассифицированные/default	0	
4561815	071117183818	Old fashioned potato salad 32oz	1	Неклассифицированные/default	0	
3168896	070892085294	Old fashioned premium bacon	330591	Продукты питания (folder)/Продукты питания	0	
4561816	041415341906	Old fashioned publix bread	1	Неклассифицированные/default	0	
3168898	081867010111	Old fashioned pumpkin pie	330591	Продукты питания (folder)/Продукты питания	0	
3168899	737094211172	Old fashioned raisins&peanuts	330591	Продукты питания (folder)/Продукты питания	3005825	The Fresh market
3168900	041483038913	Old fashioned reduced fat Ice Cream	330591	Продукты питания (folder)/Продукты питания	2347169	Kemps
3168901	041483038951	Old fashioned reduced fat Ice Cream #2	330591	Продукты питания (folder)/Продукты питания	2347169	Kemps
3168902	030243716222	Old fashioned ribbon candy	330591	Продукты питания (folder)/Продукты питания	3006878	Waymouth farms
3168903	042400046516	Old fashioned rolled-oats	330591	Продукты питания (folder)/Продукты питания	622561	Malt-O-Meal
3168904	072410043700	Old fashioned root beer	330591	Продукты питания (folder)/Продукты питания	0	
3168905	636511204035	Old fashioned root beer #2	330591	Продукты питания (folder)/Продукты питания	0	
1401855	075968010019	Old fashioned san francisco style sourdough starter 0.5oz	1	Неклассифицированные/default	0	
3168906	630003713180	Old fashioned sauerkraut #2	330591	Продукты питания (folder)/Продукты питания	0	
3168907	072180565334	Old fashioned sausage pizza	330591	Продукты питания (folder)/Продукты питания	0	
3168908	076609000451	Old fashioned seasoning	330591	Продукты питания (folder)/Продукты питания	0	
2178727	076344102052	Old fashioned sm asst bisc 6/20oz	337596	Товары для животных (folder)/Pets	0	
2178728	076344101307	Old fashioned small asst 4/3.5lb	337596	Товары для животных (folder)/Pets	0	
3168909	649804042320	Old fashioned smoked ham	330591	Продукты питания (folder)/Продукты питания	0	
3168910	090075000180	Old fashioned smoked Salmon	330591	Продукты питания (folder)/Продукты питания	0	
3168911	044900301546	Old fashioned smoked sausage	330591	Продукты питания (folder)/Продукты питания	0	
3168912	191619576229	Old fashioned smoked sausage #2	330591	Продукты питания (folder)/Продукты питания	0	
3168913	746742290377	Old fashioned soda	330591	Продукты питания (folder)/Продукты питания	0	
3168914	713733914697	Old fashioned Soft Apple pie, cookies	330591	Продукты питания (folder)/Продукты питания	2564409	Meijer
3168915	719283328069	Old fashioned Soft cookies	330591	Продукты питания (folder)/Продукты питания	2564409	Meijer
3168916	719283328083	Old fashioned Soft cookies #2	330591	Продукты питания (folder)/Продукты питания	2564409	Meijer
3168917	719283328106	Old fashioned Soft cookies #3	330591	Продукты питания (folder)/Продукты питания	2564409	Meijer
3168918	719283328076	Old fashioned Soft molasses cookies	330591	Продукты питания (folder)/Продукты питания	2564409	Meijer
3168919	836359009599	Old fashioned Soft peppermint sticks	330591	Продукты питания (folder)/Продукты питания	0	
3168920	041497102525	Old fashioned Soft sugar cookies	330591	Продукты питания (folder)/Продукты питания	3001562	Weis
3168921	041497004324	Old fashioned sourdough hard pretzels	330591	Продукты питания (folder)/Продукты питания	3001562	Weis
1636205	041780002402	Old fashioned sourdough hards pretzels	260335	Продукты питания (folder)/Снэки	1636166	Utz
1561016	203967000001	Old fashioned spicy	1	Неклассифицированные/default	0	
3168922	036800264922	Old fashioned split top White bread	330591	Продукты питания (folder)/Продукты питания	0	
3168923	026542084216	Old fashioned spreadable Cheese	330591	Продукты питания (folder)/Продукты питания	3016535	Shullsburg Creamery
1503069	010200227008	Old fashioned Stone ground White corn meal	1	Неклассифицированные/default	0	
1503067	010200231005	Old fashioned Stone ground Yellow corn meal	1	Неклассифицированные/default	2606283	Indian Head
3168924	011233077318	Old fashioned strawberry pie	330591	Продукты питания (folder)/Продукты питания	0	
3168925	850590004977	Old fashioned strawberry poppyseed dressing	330591	Продукты питания (folder)/Продукты питания	0	
3168926	021130111909	Old fashioned stuffing	330591	Продукты питания (folder)/Продукты питания	0	
3168927	018894310983	Old fashioned sugar cones	330591	Продукты питания (folder)/Продукты питания	3018502	Big y
3168929	012778000175	Old fashioned tender cracklins chicharron	330591	Продукты питания (folder)/Продукты питания	0	
3168930	617353708202	Old fashioned thin pretzels	330591	Продукты питания (folder)/Продукты питания	0	
3168931	049646505227	Old fashioned traffic jam	330591	Продукты питания (folder)/Продукты питания	0	
2646292	039091000538	Old fashioned tumblr 20/25 cs20 9oz	1	Неклассифицированные/default	0	
3168932	616973090223	Old fashioned uncured beef franks	330591	Продукты питания (folder)/Продукты питания	3019340	Wellshire
3168933	075186053737	Old fashioned vanilla creme drops	330591	Продукты питания (folder)/Продукты питания	3026256	Zachary
3168934	075186317402	Old fashioned vanilla creme drops #2	330591	Продукты питания (folder)/Продукты питания	3026256	Zachary
3168935	036800264939	Old fashioned White bread	330591	Продукты питания (folder)/Продукты питания	0	
3168936	072220900262	Old fashioned White bread #2	330591	Продукты питания (folder)/Продукты питания	0	
3168937	072220900545	Old fashioned White bread #3	330591	Продукты питания (folder)/Продукты питания	0	
3168938	078742085272	Old fashioned Wild berry orchard pie	330591	Продукты питания (folder)/Продукты питания	0	
1946018	011233077080	Old fashioned, eclair pie, baked chocolate 4inch 4oz	1	Неклассифицированные/default	3008999	Table talk pies
3168939	688267153327	Old fashioned, frosted Lemon cookies	330591	Продукты питания (folder)/Продукты питания	3001844	Ahold
3168940	073652410015	Old fashionfruit cake	330591	Продукты питания (folder)/Продукты питания	0	
4561817	726984050014	Old fashoned oats 42oz	1	Неклассифицированные/default	0	
4561818	4710172030069	Old fisherman roast eel, tong yeng industrial co 110g	1	Неклассифицированные/default	0	
