ID	UPCEAN	Name	CategoryID	CategoryName	BrandID	BrandName
729197	5707119004084	Коврик для мыши игровой steelseries iron Lady qck Mini тряпичный, размер 295mmx210mm, розовый	265563	Техника (folder)/Электротехника/Цифровая техника (folder)/Компьютерные аксессуары	1661324	JABRA
1672602	5707119001793	Коврик для мыши игровой steelseries Mini тряпичный, размер 250mmx210mm, черный [001793]	265563	Техника (folder)/Электротехника/Цифровая техника (folder)/Компьютерные аксессуары	0	
474040	5707119006187	Коврик для мыши игровой steelseries qck starcraft ii kerrigan VS zeratul (le) тряпичн, 320x270 x2 mm 63301	265563	Техника (folder)/Электротехника/Цифровая техника (folder)/Компьютерные аксессуары	0	
474041	813810012107	Коврик для мыши игровой steelseries qck starcraft ii marauder, тряпичный, размер 285mmx320mmx2mm 63303	265563	Техника (folder)/Электротехника/Цифровая техника (folder)/Компьютерные аксессуары	0	
729198	5707119006156	Коврик для мыши игровой steelseries qck starcraft ii marine (le) тряп	265563	Техника (folder)/Электротехника/Цифровая техника (folder)/Компьютерные аксессуары	0	
474042	813810012015	Коврик для мыши игровой steelseries qck starcraft ii marine (le) тряпичн, 320x270 x2 mm 63300	265563	Техника (folder)/Электротехника/Цифровая техника (folder)/Компьютерные аксессуары	0	
474043	813810012091	Коврик для мыши игровой steelseries qck starcraft ii tychus, тряпичный, размер 285mmx320mmx2mm 63302	265563	Техника (folder)/Электротехника/Цифровая техника (folder)/Компьютерные аксессуары	0	
474044	813810010424	Коврик для мыши игровой steelseries qck тряпичный, размер 320x 270мм, резиновая основа [01042]	265563	Техника (folder)/Электротехника/Цифровая техника (folder)/Компьютерные аксессуары	2730554	SteelSeries
231152	4607143270343	Коврик для мыши Коллекция f1	265563	Техника (folder)/Электротехника/Цифровая техника (folder)/Компьютерные аксессуары	0	
474045	4607100121022	Коврик для мыши матерчатый, голубой, 240x190 x1.2мм, buro [121022]	265563	Техника (folder)/Электротехника/Цифровая техника (folder)/Компьютерные аксессуары	473998	BURO
474046	4607100120926	Коврик для мыши матерчатый, зеленый, 220x250 x 4мм, buro [120926]	265563	Техника (folder)/Электротехника/Цифровая техника (folder)/Компьютерные аксессуары	473998	BURO
1672603	4607100120919	Коврик для мыши матерчатый, серый, 220x250 x 4мм, buro [120919]	265563	Техника (folder)/Электротехника/Цифровая техника (folder)/Компьютерные аксессуары	0	
474010	4607100120902	Коврик для мыши матерчатый, синий, 220x250 x 4мм, buro [120902]	265563	Техника (folder)/Электротехника/Цифровая техника (folder)/Компьютерные аксессуары	473998	BURO
474047	4607100120995	Коврик для мыши матерчатый, фигурный авто, 220x250 x 3мм (buro) [120995]	265563	Техника (folder)/Электротехника/Цифровая техника (folder)/Компьютерные аксессуары	473998	BURO
474048	4607100121008	Коврик для мыши матерчатый, фигурный акула, 220x250 x 3мм (buro) [121008]	265563	Техника (folder)/Электротехника/Цифровая техника (folder)/Компьютерные аксессуары	473998	BURO
474049	4607100120971	Коврик для мыши матерчатый, фигурный кролик, 220x250 x 3мм (buro) [120971]	265563	Техника (folder)/Электротехника/Цифровая техника (folder)/Компьютерные аксессуары	473998	BURO
729199	4607100120988	Коврик для мыши матерчатый, фигурный футбол, 220x250 x 3мм (buro)	265563	Техника (folder)/Электротехника/Цифровая техника (folder)/Компьютерные аксессуары	0	
474068	4607100121015	Коврик для мыши матерчатый, фиолетовый, 240x190 x1.2мм, buro [121022]	265563	Техника (folder)/Электротехника/Цифровая техника (folder)/Компьютерные аксессуары	473998	BURO
474052	043859508990	Коврик для мыши нескольз.осн.гольф fs-5881003 fellowes	265563	Техника (folder)/Электротехника/Цифровая техника (folder)/Компьютерные аксессуары	177530	FELLOWES
474054	043859528950	Коврик для мыши нескольз.осн.конфетти fs-58812 fellowes	265563	Техника (folder)/Электротехника/Цифровая техника (folder)/Компьютерные аксессуары	177530	FELLOWES
474055	043859533374	Коврик для мыши нескольз.осн.лилия fs-58829 fellowes	265563	Техника (folder)/Электротехника/Цифровая техника (folder)/Компьютерные аксессуары	177530	FELLOWES
729201	043859547869	Коврик для мыши нескольз.осн.нью-йорк fs-58834 fellowes	265563	Техника (folder)/Электротехника/Цифровая техника (folder)/Компьютерные аксессуары	19395	EASTAR
729202	043859600878	Коврик для мыши нескольз.осн.рябь на воде fs-58017 fellowes	265563	Техника (folder)/Электротехника/Цифровая техника (folder)/Компьютерные аксессуары	19395	EASTAR
474058	043859533398	Коврик для мыши нескольз.осн.страусенок fs-58830 fellowes	265563	Техника (folder)/Электротехника/Цифровая техника (folder)/Компьютерные аксессуары	177530	FELLOWES
474061	043859528998	Коврик для мыши нескольз.осн.яичница fs-5881601 fellowes	265563	Техника (folder)/Электротехника/Цифровая техника (folder)/Компьютерные аксессуары	177530	FELLOWES
1672604	6909723181642	Коврик для мыши персидский neodrive persia nmp-1. узор 1	265563	Техника (folder)/Электротехника/Цифровая техника (folder)/Компьютерные аксессуары	0	
1225953	6909723181659	Коврик для мыши персидский neodrive persia nmp-2. узор 2	265563	Техника (folder)/Электротехника/Цифровая техника (folder)/Компьютерные аксессуары	0	
1672605	6917979181651	Коврик для мыши персидский neodrive persia nmp-2. узор 2 #2	265563	Техника (folder)/Электротехника/Цифровая техника (folder)/Компьютерные аксессуары	0	
1225954	6909723181666	Коврик для мыши персидский neodrive persia nmp-3. узор 3	265563	Техника (folder)/Электротехника/Цифровая техника (folder)/Компьютерные аксессуары	0	
1672606	6917979189978	Коврик для мыши персидский neodrive persia nmp-4. узор 4	265563	Техника (folder)/Электротехника/Цифровая техника (folder)/Компьютерные аксессуары	0	
1672607	6917979189985	Коврик для мыши персидский neodrive persia nmp-5. узор 5	265563	Техника (folder)/Электротехника/Цифровая техника (folder)/Компьютерные аксессуары	0	
474062	043859510719	Коврик для мыши пингвины пластиковая туба	265563	Техника (folder)/Электротехника/Цифровая техника (folder)/Компьютерные аксессуары	177530	FELLOWES
231153	4607100120797	Коврик для мыши пластиковый, автомобиль, 230x180 x 2мм (bu-m90002) [120797]	265563	Техника (folder)/Электротехника/Цифровая техника (folder)/Компьютерные аксессуары	0	
474063	4607100120834	Коврик для мыши пластиковый, антилопы, 230x180 x 2мм (bu-m10053) [120834]	265563	Техника (folder)/Электротехника/Цифровая техника (folder)/Компьютерные аксессуары	473998	BURO
473999	4607100120827	Коврик для мыши пластиковый, дельфины, 230x180 x 2мм (bu-m10053) [120827]	265563	Техника (folder)/Электротехника/Цифровая техника (folder)/Компьютерные аксессуары	473998	BURO
474064	4607100120865	Коврик для мыши пластиковый, закат, 230x180 x 2мм (bu-m10053) [120865]	265563	Техника (folder)/Электротехника/Цифровая техника (folder)/Компьютерные аксессуары	473998	BURO
474065	4607100120810	Коврик для мыши пластиковый, лев, 230x180 x 2мм (bu-m40030) [120810]	265563	Техника (folder)/Электротехника/Цифровая техника (folder)/Компьютерные аксессуары	473998	BURO
474000	4607100120803	Коврик для мыши пластиковый, орел, 230x180 x 2мм (bu-m10053) [120803]	265563	Техника (folder)/Электротехника/Цифровая техника (folder)/Компьютерные аксессуары	473998	BURO
474066	4607100120858	Коврик для мыши пластиковый, Поле подсолнухов, 230x180 x 2мм (bu-m20036)	265563	Техника (folder)/Электротехника/Цифровая техника (folder)/Компьютерные аксессуары	473998	BURO
474067	4607100120841	Коврик для мыши пластиковый, цветы, 230x180 x 2мм (bu-m10053) [120841]	265563	Техника (folder)/Электротехника/Цифровая техника (folder)/Компьютерные аксессуары	473998	BURO
1672608	5055142952750	Коврик для мыши сердце в руках digitex [952750]	265563	Техника (folder)/Электротехника/Цифровая техника (folder)/Компьютерные аксессуары	0	
729207	6936021470017	Коврик для мыши силиконовый там где случаются чудеса	265563	Техника (folder)/Электротехника/Цифровая техника (folder)/Компьютерные аксессуары	0	
474069	5904662043151	Коврик для мыши фотографический	265563	Техника (folder)/Электротехника/Цифровая техника (folder)/Компьютерные аксессуары	177530	FELLOWES
729208	6936020290012	Коврик для мыши фоторамка	265563	Техника (folder)/Электротехника/Цифровая техника (folder)/Компьютерные аксессуары	0	
2443278	5099206048546	Коврик для мышки (943-000044) logitech g240 cloth gaming mouse pad	205800	Техника (folder)/Электротехника/Цифровая техника (folder)/Компьютерная мышь	177646	LOGITECH
2443279	5099206048560	Коврик для мышки (943-000050) logitech g440 hard gaming mouse pad	205800	Техника (folder)/Электротехника/Цифровая техника (folder)/Компьютерная мышь	177646	LOGITECH
2730931	5099206059535	Коврик для мышки (943-000058) logitech g640 cloth gaming mouse pad	205800	Техника (folder)/Электротехника/Цифровая техника (folder)/Компьютерная мышь	177646	LOGITECH
3831024	6438240576254	Коврик для нагрева воды от солнца	1	Неклассифицированные/default	0	
231135	4712279510017	Коврик для оптической мыши Super 220x180 x1 (ассортимент)	265563	Техника (folder)/Электротехника/Цифровая техника (folder)/Компьютерные аксессуары	177638	Defender
474051	043859508976	Коврик для оптической мыши апельсин, fellowes, нескользящее основание, трехслойная технология brite (вечны	265563	Техника (folder)/Электротехника/Цифровая техника (folder)/Компьютерные аксессуары	177530	FELLOWES
1225955	077511587153	Коврик для оптической мыши земля и Луна, fellowes, нескольз.основание, трехслойная техн. brite (вечные),uк	1	Неклассифицированные/default	177530	FELLOWES
1672610	043859528981	Коврик для оптической мыши лягушка, круглый, нескольз. осн.,технол brite, 3мм (fellowes)	1	Неклассифицированные/default	0	
1225956	043859508983	Коврик для оптической мыши футбол, fellowes, нескользящее основание, трехслойная технология brite (вечные)	1	Неклассифицированные/default	177530	FELLOWES
474060	043859508969	Коврик для оптической мыши яблоко, fellowes, пластик, нескольз. основание, трехслойная технология brite	265563	Техника (folder)/Электротехника/Цифровая техника (folder)/Компьютерные аксессуары	177530	FELLOWES
219390	4607143270299	Коврик для оптической мышки Nova luxe	265563	Техника (folder)/Электротехника/Цифровая техника (folder)/Компьютерные аксессуары	0	
219391	3550350003666	Коврик для оптической мышки Nova offset	265563	Техника (folder)/Электротехника/Цифровая техника (folder)/Компьютерные аксессуары	0	
474050	043859509003	Коврик для оптической/лазерной мыши аквариум, fellowes, нескользящее основание, трехслойная техноло	265563	Техника (folder)/Электротехника/Цифровая техника (folder)/Компьютерные аксессуары	177530	FELLOWES
1225957	077511587139	Коврик для оптической/лазерной мыши волна, fellowes, нескользящее основание, трехслойная технология	1	Неклассифицированные/default	177530	FELLOWES
729182	077511587122	Коврик для оптической/лазерной мыши каскад, fellowes, нескользящее основание, технология britet, uk	265563	Техника (folder)/Электротехника/Цифровая техника (folder)/Компьютерные аксессуары	177530	FELLOWES
1225958	043859542819	Коврик для оптической/лазерной мыши листья, Earth series, нескользящее основание, us	1	Неклассифицированные/default	177530	FELLOWES
1225959	077511587504	Коврик для оптической/лазерной мыши пальма, fellowes, нескользящее основание, технология britet, uk	1	Неклассифицированные/default	177530	FELLOWES
1225960	077511587481	Коврик для оптической/лазерной мыши пляж, fellowes, нескользящее основание, технология britet, uk	1	Неклассифицированные/default	177530	FELLOWES
474056	043859600861	Коврик для оптической/лазерной мыши розовые перышки, fellowes, нескользящее основание, технология b	265563	Техника (folder)/Электротехника/Цифровая техника (folder)/Компьютерные аксессуары	177530	FELLOWES
474057	043859547845	Коврик для оптической/лазерной мыши скрепки, fellowes, нескользящее основание, технология britet, u	265563	Техника (folder)/Электротехника/Цифровая техника (folder)/Компьютерные аксессуары	177530	FELLOWES
474059	043859600885	Коврик для оптической/лазерной мыши цветные карандаши, fellowes, нескользящее основание, технология	265563	Техника (folder)/Электротехника/Цифровая техника (folder)/Компьютерные аксессуары	177530	FELLOWES
1225961	043859573769	Коврик для оптической/лазерной мыши цветы и камни, Earth series, нескользящее основание, us	1	Неклассифицированные/default	177530	FELLOWES
764189	4710694541111	Коврик для отдыха и работы 40x 17см 4цв j83-84 /50 мультидом Китай	1	Неклассифицированные/default	448622	МультиДом
3350362	4690222014341	Коврик для пикника	315162	Хозяйственные товары (folder)/Коврик	0	
3831025	6953659351082	Коврик для пикника #2	3605276	Спорт и отдых (folder)/Товары для кемпинга	3691796	LINMARK LIMITED
3831026	4606038035043	Коврик для пикника #3	3605276	Спорт и отдых (folder)/Товары для кемпинга	0	
3831027	4607121282344	Коврик для пикника 130x 150см	329590	Спорт и отдых (folder)/Пикник	0	
3831028	6934620017220	Коврик для пикника 130x 150см #2	315162	Хозяйственные товары (folder)/Коврик	0	
3350363	6935439524220	Коврик для пикника 150x135 са2425-08 флис влагозащ.	315162	Хозяйственные товары (folder)/Коврик	0	
67034	6952188855450	Коврик для пикника 175x 135см	329590	Спорт и отдых (folder)/Пикник	0	
67033	8702533517209	Коврик для пикника 175x135 54804	329590	Спорт и отдых (folder)/Пикник	0	
1761389	4602006002819	Коврик для пикника fun Sun 120x135	596271	Галантерея (folder)/Галантерея	0	
3831029	4606038034961	Коврик для пикника полиуретан р.180x 60см	3605276	Спорт и отдых (folder)/Товары для кемпинга	0	
2730932	4607030882420	Коврик для пикника тх-360 тритон (xl 180x 150см)	300445	Эксплуатация и ремонт автомобилей/Автомобильные принадлежности	0	
3831030	4606038034978	Коврик для пикника циновка р.180x 90см	3605276	Спорт и отдых (folder)/Товары для кемпинга	0	
3831031	4606038034985	Коврик для пикника циновка р.180x 90см #2	3605276	Спорт и отдых (folder)/Товары для кемпинга	0	
67080	4607052391337	Коврик для пляжа 150x60 гс127ф	315162	Хозяйственные товары (folder)/Коврик	0	
67081	4606066026266	Коврик для пляжа 70x 180см /пляжный мат	315162	Хозяйственные товары (folder)/Коврик	18812	Home Queen
1225962	6945989785613	Коврик для пляжа 75x180 ассортим вм1075-0011	145188	Спорт и отдых (folder)/Туризм	0	
67083	4606066026259	Коврик для пляжа 80x 180см /пляжный мат	315162	Хозяйственные товары (folder)/Коврик	67082	Время дачи
3831032	6945986357516	Коврик для пляжа 90x 180см	3605276	Спорт и отдых (folder)/Товары для кемпинга	0	
3831033	6945989784654	Коврик для пляжа в тубе 70x 180см	3605276	Спорт и отдых (folder)/Товары для кемпинга	0	
3831034	6945986541311	Коврик для пляжа в чехле 70x 180см	3605276	Спорт и отдых (folder)/Товары для кемпинга	0	
67084	4606066017912	Коврик для пляжа см5951120	315162	Хозяйственные товары (folder)/Коврик	0	
2956406	8711295508837	Коврик для пляжа см5951120 #2	315162	Хозяйственные товары (folder)/Коврик	0	
1672611	4710694583739	Коврик для прихож 40x 60см 3цв yj38-20/мультидом/30	3536	Хозяйственные товары (folder)/Хозяйственные товары	448622	МультиДом
3350364	4603299251236	Коврик для прихож. welcome 40x 60см 466-021	315162	Хозяйственные товары (folder)/Коврик	0	
3350365	4710694583746	Коврик для прихожей 40x60	315162	Хозяйственные товары (folder)/Коврик	0	
2730933	4811244043441	Коврик для прихожей step Plus мокрый асфальт	1	Неклассифицированные/default	3421478	Berossi
729209	4811244009102	Коврик для прихожей степ ас15613 зелный восток	1	Неклассифицированные/default	3421478	Berossi
315176	4602017001207	Коврик для пыли травка кв 1 штук	315162	Хозяйственные товары (folder)/Коврик	312605	ООО НПФ Квинта
3831035	4605506851079	Коврик для работы в саду 38.5x17 x1.6см	33235	Растениеводство/Садовый инвентарь	0	
1225964	4710694591383	Коврик для раковины 27x 24см 4цв bt38-51 мультидом Китай снято	1	Неклассифицированные/default	448622	МультиДом
1225965	4710694583715	Коврик для раковины 31x 25см 4диз. yj38-10 /16/96 мультидом Китай	1	Неклассифицированные/default	448622	МультиДом
474071	4710694584200	Коврик для раковины 31x 25см 4цв mp38-12 мультидом Китай	1	Неклассифицированные/default	448622	МультиДом
1225966	471069458420	Коврик для раковины 31x25 mp38-12	3536	Хозяйственные товары (folder)/Хозяйственные товары	0	
474073	4607047301914	Коврик для раковины 6802с присоск.31x 25см	1	Неклассифицированные/default	21246	ВИЛИНА
474074	8007633103247	Коврик для раковины d 30см 10324 ротондо (кругл)	1	Неклассифицированные/default	0	
67105	8412955023300	Коврик для раковины rayen 32x32 2330.01-ry	315162	Хозяйственные товары (folder)/Коврик	407808	RAYEN
67106	8412955023317	Коврик для раковины rayen кругл 32см 2331.01-ry	315162	Хозяйственные товары (folder)/Коврик	407808	RAYEN
729009	4607141584527	Коврик для раковины Soft Touch квадр. силикон /58452/	315162	Хозяйственные товары (folder)/Коврик	653256	SOFT TOUCH
729008	4607141584534	Коврик для раковины Soft Touch кругл 58453-7613	315162	Хозяйственные товары (folder)/Коврик	653256	SOFT TOUCH
3350366	4680259115203	Коврик для раковины Vetta геометрия №3028 противоскользящий 4-е цвета 32x 25см м/у	315162	Хозяйственные товары (folder)/Коврик	0	
3350367	4710694578445	Коврик для раковины д.31см	315162	Хозяйственные товары (folder)/Коврик	0	
3350368	4710694578452	Коврик для раковины д.31см #2	315162	Хозяйственные товары (folder)/Коврик	0	
3350369	6936900002445	Коврик для раковины д.31см #3	315162	Хозяйственные товары (folder)/Коврик	0	
1672612	6908370170726	Коврик для раковины дом и все что в нем 32x 25см /837-017/	1	Неклассифицированные/default	0	
1225967	4670003412627	Коврик для раковины камушки 31x25 4цв mt76-14 /40 (мультидом) Россия	1	Неклассифицированные/default	448622	МультиДом
