ID	UPCEAN	Name	CategoryID	CategoryName	BrandID	BrandName
2828705	4015630911936	Roche gldh universalpackung 4x 19ml r1, 4x 5ml r2	2418507	Изделия медицинского назначения (folder)/Изделия медицинского назначения	0	
2828706	4015630924066	Roche glucose hamolysereagenz gen. 2 1000ml fur 2000 best.	2418507	Изделия медицинского назначения (folder)/Изделия медицинского назначения	0	
2828707	4015630991853	Roche glucose hk hit 917 / modular p 6x 66ml r1, 6x 17ml r2	2418507	Изделия медицинского назначения (folder)/Изделия медицинского назначения	0	
2828708	4015630912162	Roche glucose hk modular d r1 4x 653ml	2418507	Изделия медицинского назначения (folder)/Изделия медицинского назначения	0	
2828709	4015630912179	Roche glucose hk modular d r2 4x 283ml	2418507	Изделия медицинского назначения (folder)/Изделия медицинского назначения	0	
2828710	4015630911738	Roche glucose hk modular p/d r1 6x 267ml	2418507	Изделия медицинского назначения (folder)/Изделия медицинского назначения	0	
2828711	4015630911745	Roche glucose hk modular p/d r2 6x 71ml	2418507	Изделия медицинского назначения (folder)/Изделия медицинского назначения	0	
2828712	4015630901456	Roche glucose hk sys 1 12x 50ml r1, 6x 22ml r2	2418507	Изделия медицинского назначения (folder)/Изделия медицинского назначения	0	
2828713	4038377001777	Roche glucose-6-phosphate 5g	1	Неклассифицированные/default	3604475	Roche
2828714	4038377002224	Roche glucose-6-phosphate dehydrogenase (g6p-dh) 1.000 u (1ml)	1	Неклассифицированные/default	3604475	Roche
2828715	4038377001807	Roche glucose-6-phosphate dehydrogenase (g6p-dh) 10mg (2ml)	1	Неклассифицированные/default	3604475	Roche
2828716	4038377004396	Roche glucose-6-phosphate dehydrogenase (g6p-dh) 25mg (5ml)	1	Неклассифицированные/default	3604475	Roche
2828717	4038377001784	Roche glucose-6-phosphate dehydrogenase (g6p-dh) 5mg (1ml)	1	Неклассифицированные/default	3604475	Roche
2828718	4015630018147	Roche glucose-kassette fur cobas b 221 System (roche omn 1 stuck	2418507	Изделия медицинского назначения (folder)/Изделия медицинского назначения	0	
2828719	4015630014736	Roche glucose-kassette fur roche omni 1-9 1 stuck	2418507	Изделия медицинского назначения (folder)/Изделия медицинского назначения	0	
2828720	4015630018130	Roche glucose-lactat-kassette fur cobas b 221 System (ro 1 stuck	2418507	Изделия медицинского назначения (folder)/Изделия медицинского назначения	0	
2828721	4015630014750	Roche glucose-lactat-kassette fur roche omni 1-9 1 stuck	2418507	Изделия медицинского назначения (folder)/Изделия медицинского назначения	0	
2828722	4015630018123	Roche glucose-lactat-urea-kassette fur cobas b 221 syste 1 stuck	2418507	Изделия медицинского назначения (folder)/Изделия медицинского назначения	0	
2828723	4038377002309	Roche glutamate dehydrogenase (gldh) 3.000 u	1	Неклассифицированные/default	3604475	Roche
2828724	4038377000534	Roche glutamate-oxaloacetate transaminase (got) 10mg (1ml)	1	Неклассифицированные/default	3604475	Roche
2828725	4038377004297	Roche glutamate-oxaloacetate transaminase (got) 25mg (2.5ml)	1	Неклассифицированные/default	3604475	Roche
2828726	4038377000527	Roche glutamate-oxaloacetate transaminase (got) 2mg (1ml)	1	Неклассифицированные/default	3604475	Roche
2828727	4038377000558	Roche glutamate-pyruvate transaminase (gpt) 10mg (1ml)	1	Неклассифицированные/default	3604475	Roche
2828728	4038377004327	Roche glutamate-pyruvate transaminase (gpt) 25mg (2.5ml)	1	Неклассифицированные/default	3604475	Roche
2828729	4038377000589	Roche glutathione reductase (gr) 5mg (1ml)	1	Неклассифицированные/default	3604475	Roche
2828730	4038377001876	Roche glycerol-3-phosphate dehydrogenase (gdh) 100mg (10ml)	1	Неклассифицированные/default	3604475	Roche
2828731	4038377001869	Roche glycerol-3-phosphate dehydrogenase (gdh) 10mg (1ml)	1	Неклассифицированные/default	3604475	Roche
2828732	4038377005744	Roche glycogen 20mg (1ml)	1	Неклассифицированные/default	3604475	Roche
2828733	4015630911028	Roche got ifcc hit 917/ modular p 4x 66ml r1, 4x 16ml r2	2418507	Изделия медицинского назначения (folder)/Изделия медицинского назначения	0	
2828734	4015630918713	Roche got ifcc modular d r1 4x 653ml	2418507	Изделия медицинского назначения (folder)/Изделия медицинского назначения	0	
2828735	4015630918331	Roche got ifcc modular d r2 4x 283ml	2418507	Изделия медицинского назначения (folder)/Изделия медицинского назначения	0	
2828736	4015630921201	Roche got ifcc modular p/d r1 6x 250ml	2418507	Изделия медицинского назначения (folder)/Изделия медицинского назначения	0	
2828737	4015630921218	Roche got ifcc modular p/d r2 6x 66ml	2418507	Изделия медицинского назначения (folder)/Изделия медицинского назначения	0	
2828738	4015630900572	Roche got ifcc sys 1 12x 50ml r1, 3x 44ml r2	2418507	Изделия медицинского назначения (folder)/Изделия медицинского назначения	0	
2828739	4015630933150	Roche GP iib/iiia 3x0.5ml	2418507	Изделия медицинского назначения (folder)/Изделия медицинского назначения	0	
2828740	4015630933136	Roche GP iib/iiia antagonist 1x0.5ml	2418507	Изделия медицинского назначения (folder)/Изделия медицинского назначения	0	
2828741	4015630909124	Roche gpt ifcc hit 917 / modular p hico 6x 60ml r1, 6x 38ml r2	2418507	Изделия медицинского назначения (folder)/Изделия медицинского назначения	0	
2828742	4015630911011	Roche gpt ifcc hit 917/ modular p 4x 66ml r1, 4x 16ml r2	2418507	Изделия медицинского назначения (folder)/Изделия медицинского назначения	0	
2828743	4015630918317	Roche gpt ifcc modular d r1 4x 653ml	2418507	Изделия медицинского назначения (folder)/Изделия медицинского назначения	0	
2828744	4015630918324	Roche gpt ifcc modular d r2 4x 283ml	2418507	Изделия медицинского назначения (folder)/Изделия медицинского назначения	0	
2828745	4015630921188	Roche gpt ifcc modular p/d r1 6x 250ml	2418507	Изделия медицинского назначения (folder)/Изделия медицинского назначения	0	
2828746	4015630921195	Roche gpt ifcc modular p/d r2 6x 66ml	2418507	Изделия медицинского назначения (folder)/Изделия медицинского назначения	0	
2828747	4015630900480	Roche gpt ifcc sys 1 12x 50ml r1, 3x 40ml r2	2418507	Изделия медицинского назначения (folder)/Изделия медицинского назначения	0	
2828748	4038377025568	Roche gs flx maintenance wash kit 1 kit (for 1 maintenance run)	1	Неклассифицированные/default	3604475	Roche
2828749	4038377027555	Roche gs gtype hla hr primer set	1	Неклассифицированные/default	3604475	Roche
2828750	4038377027548	Roche gs gtype hla mr.primer set	1	Неклассифицированные/default	3604475	Roche
2828751	4038377028408	Roche gs gtype runx1 primer set 48 best.	1	Неклассифицированные/default	3604475	Roche
2828752	4038377028392	Roche gs gtype tet2/cbl/kras primer set	1	Неклассифицированные/default	3604475	Roche
2828753	4015630982189	Roche gs junior titanium empcr kit (lib a)	2418507	Изделия медицинского назначения (folder)/Изделия медицинского назначения	0	
2828754	4038377000664	Roche gtp 250mg	1	Неклассифицированные/default	3604475	Roche
2828755	4038377007878	Roche gtp 40 чmol (400 чl)	1	Неклассифицированные/default	3604475	Roche
2828756	4038377002439	Roche gtp-gamma-s 10mg	1	Неклассифицированные/default	3604475	Roche
2828757	4038377007557	Roche gtp-gamma-s 20 чmol (200 чl)	1	Неклассифицированные/default	3604475	Roche
2828758	4038377012872	Roche guanidine thiocyanate 500g	1	Неклассифицированные/default	3604475	Roche
2828759	4038377012308	Roche ha peptide 5mg	1	Неклассифицированные/default	3604475	Roche
2828760	4038377003832	Roche hae iii 5.000 u (10 u/чl)	1	Неклассифицированные/default	3604475	Roche
2828761	8430215048351	Roche halogen lamp 1 stuck	1	Неклассифицированные/default	0	
2828762	8430215011980	Roche halogen lamp assy (halogenlampe) 1 stuck	1	Неклассифицированные/default	0	
2828763	4015630910137	Roche hamolysereagenz fur hba1c 1000ml	2418507	Изделия медицинского назначения (folder)/Изделия медицинского назначения	0	
2828764	4015630910519	Roche harnsaure Plus hit 917 / modular p 6x 66ml r1, 6x 16ml r2	2418507	Изделия медицинского назначения (folder)/Изделия медицинского назначения	0	
2828765	4015630916214	Roche harnsaure Plus modular d r1 6x 641ml	2418507	Изделия медицинского назначения (folder)/Изделия медицинского назначения	0	
2828766	4015630916207	Roche harnsaure Plus modular d r2 4x 278ml	2418507	Изделия медицинского назначения (folder)/Изделия медицинского назначения	0	
2828767	4015630911578	Roche harnsaure Plus modular p/d r1 6x 258ml	2418507	Изделия медицинского назначения (folder)/Изделия медицинского назначения	0	
2828768	4015630911585	Roche harnsaure Plus modular p/d r2 6x 68ml	2418507	Изделия медицинского назначения (folder)/Изделия медицинского назначения	0	
2828769	4015630901968	Roche harnsaure Plus sys 1 12x 50ml r1, 6x 22ml r2	2418507	Изделия медицинского назначения (folder)/Изделия медицинского назначения	0	
2828770	4015630991372	Roche harnstoff hit 917 / modular p 6x 66ml r1, 6x 43ml r2	2418507	Изделия медицинского назначения (folder)/Изделия медицинского назначения	0	
2828771	4015630912261	Roche harnstoff modular d r1 4x 470ml	2418507	Изделия медицинского назначения (folder)/Изделия медицинского назначения	0	
2828772	4015630912278	Roche harnstoff modular d r2 4x 293ml	2418507	Изделия медицинского назначения (folder)/Изделия медицинского назначения	0	
2828773	4015630911790	Roche harnstoff modular p/d r1 6x 186ml	2418507	Изделия медицинского назначения (folder)/Изделия медицинского назначения	0	
2828774	4015630911806	Roche harnstoff modular p/d r2 6x 118ml	2418507	Изделия медицинского назначения (folder)/Изделия медицинского назначения	0	
2828775	4015630901500	Roche harnstoff sys 1 6x 40ml r1, 3x 49ml r2	2418507	Изделия медицинского назначения (folder)/Изделия медицинского назначения	0	
2828776	4015630925773	Roche hbq probenset 4x 3ml	2418507	Изделия медицинского назначения (folder)/Изделия медицинского назначения	0	
2828777	4015630921805	Roche hdl-c Plus hit 917 / modular p gro?packung 6x 54ml r1, 6x 20ml r2	2418507	Изделия медицинского назначения (folder)/Изделия медицинского назначения	0	
2828778	4015630921843	Roche hdl-c Plus modular d r1 4x 651ml	2418507	Изделия медицинского назначения (folder)/Изделия медицинского назначения	0	
2828779	4015630921850	Roche hdl-c Plus modular d r2 4x 230ml	2418507	Изделия медицинского назначения (folder)/Изделия медицинского назначения	0	
2828780	4015630921829	Roche hdl-c Plus modular p/d r1 6x 258ml	2418507	Изделия медицинского назначения (folder)/Изделия медицинского назначения	0	
2828781	4015630921836	Roche hdl-c Plus modular p/d r2 6x 99ml	2418507	Изделия медицинского назначения (folder)/Изделия медицинского назначения	0	
2828782	4015630921782	Roche hdl-c Plus sys 1 6x 21ml r1, 3x 15ml r2	2418507	Изделия медицинского назначения (folder)/Изделия медицинского назначения	0	
2828783	4015630908622	Roche hdl-cholesterin fallungsreagenz mpr 2 1x 100ml	2418507	Изделия медицинского назначения (folder)/Изделия медицинского назначения	0	
2828784	4015630000494	Roche hemofec 50x3 testbriefe	2418507	Изделия медицинского назначения (folder)/Изделия медицинского назначения	0	
2828785	4015630926534	Roche hexamate faktor xiii 2x1.7ml r1, 2x2.9ml r2	2418507	Изделия медицинского назначения (folder)/Изделия медицинского назначения	0	
2828786	4015630926541	Roche hexamate faktor xiii calibrator 3x 1ml	2418507	Изделия медицинского назначения (folder)/Изделия медицинского назначения	0	
2828787	4015630926558	Roche hexamate faktor xiii control i/ii je 3x 1ml level i und ii	2418507	Изделия медицинского назначения (folder)/Изделия медицинского назначения	0	
2828788	4038377008882	Roche hexanucleotide Mix 100 чl (50 reactions)	1	Неклассифицированные/default	3604475	Roche
2828789	4038377010021	Roche hexokinase (hk) 1.500 u (1ml) ml)	1	Неклассифицированные/default	3604475	Roche
2828790	4038377001906	Roche hexokinase/glucose-6-phosphate dehydrogenase (hk/g6 15mg (5ml)	1	Неклассифицированные/default	3604475	Roche
2828791	4038377004426	Roche hexokinase/glucose-6-phosphate dehydrogenase (hk/g6 30mg (10ml)	1	Неклассифицированные/default	3604475	Roche
2828792	4038377011592	Roche hgh elisa 1 kit (192 tests)	1	Неклассифицированные/default	3604475	Roche
2828793	4038377016597	Roche high fidelity pcr master 1 kit (for 200 reactions of 50 чl final reaction v	1	Неклассифицированные/default	3604475	Roche
2828794	4038377011448	Roche high prime 200 чl	1	Неклассифицированные/default	3604475	Roche
2828795	4038377011431	Roche high prime dna labeling kit 1 kit (50 labeling reactions)	1	Неклассифицированные/default	3604475	Roche
2828796	4038377020396	Roche high Pure 96 uf cleanup kit 1 kit (2x96 purifications)	1	Неклассифицированные/default	3604475	Roche
2828797	4038377020402	Roche high Pure 96 uf cleanup plates 1 pack (10x96 purifications)	1	Неклассифицированные/default	3604475	Roche
2828798	4038377024196	Roche high Pure ffpe rna micro kit 1 kit (up to 50 isolations)	1	Неклассифицированные/default	3604475	Roche
2828799	4038377028484	Roche high Pure ffpet dna isolation kit	1	Неклассифицированные/default	3604475	Roche
2828800	4038377028491	Roche high Pure ffpet rna isolation kit	1	Неклассифицированные/default	3604475	Roche
2828801	4038377025124	Roche high Pure mirna isolation kit 1 kit (50 isolations)	1	Неклассифицированные/default	3604475	Roche
2828802	4038377024745	Roche high Pure pcr cleanup micro kit 1 kit (up to 200 purifications)	1	Неклассифицированные/default	3604475	Roche
2828803	4038377024752	Roche high Pure pcr cleanup micro kit 1 kit (up to 50 purifications)	1	Неклассифицированные/default	3604475	Roche
2828804	4038377013312	Roche high Pure pcr product purification kit 1 kit (250 purifications)	1	Неклассифицированные/default	3604475	Roche
2828805	4038377013305	Roche high Pure pcr product purification kit 1 kit (50 purifications)	1	Неклассифицированные/default	3604475	Roche
2828806	4038377013985	Roche high Pure pcr template preparation kit 1 kit (100 purifications)	1	Неклассифицированные/default	3604475	Roche
2828807	4038377013565	Roche high Pure plasmid isolation kit 1 kit (250 purifications)	1	Неклассифицированные/default	3604475	Roche
2828808	4038377013558	Roche high Pure plasmid isolation kit 1 kit (50 purifications)	1	Неклассифицированные/default	3604475	Roche
2828809	4038377014593	Roche high Pure rna isolation kit 1 kit (50 reactions)	1	Неклассифицированные/default	3604475	Roche
2828810	4038377018386	Roche high Pure rna paraffin kit 1 kit (up to 100 isolations)	1	Неклассифицированные/default	3604475	Roche
2828811	4038377016542	Roche high Pure rna tissue kit 1 kit (50 isolations)	1	Неклассифицированные/default	3604475	Roche
2828812	4038377020556	Roche high Pure System 48 best.	1	Неклассифицированные/default	3604475	Roche
2828813	4038377025643	Roche high Pure viral na large volume kit	1	Неклассифицированные/default	3604475	Roche
2828814	4038377016283	Roche high Pure viral nucleic acid buffer set 1 set (100 isolations)	1	Неклассифицированные/default	3604475	Roche
2828815	4038377014951	Roche high Pure viral nucleic acid kit 1 kit (for up to 100 purifications)	1	Неклассифицированные/default	3604475	Roche
2828816	4038377014968	Roche high Pure viral rna kit 1 kit (100 purifications)	1	Неклассифицированные/default	3604475	Roche
2828817	4038377003603	Roche hind ii 2.500 u (3 - 10 u/чl)	1	Неклассифицированные/default	3604475	Roche
2828818	4038377003627	Roche hind iii 10.000 u (10 u/чl)	1	Неклассифицированные/default	3604475	Roche
2828819	4038377004990	Roche hind iii 10.000 u (40 u/чl)	1	Неклассифицированные/default	3604475	Roche
2828820	4038377003610	Roche hind iii 5.000 u (10 u/чl)	1	Неклассифицированные/default	3604475	Roche
2828821	4038377008745	Roche hind iii 50.000 u (40 u/чl)	1	Неклассифицированные/default	3604475	Roche
2828822	4038377004853	Roche hinf i 1.000 u (10 u/чl)	1	Неклассифицированные/default	3604475	Roche
2828823	4038377008776	Roche hinf i 20.000 u (40 u/чl)	1	Неклассифицированные/default	3604475	Roche
2828824	4038377004860	Roche hinf i 5.000 u (10 u/чl)	1	Неклассифицированные/default	3604475	Roche
2828825	4038377027371	Roche hires control beads 1e6 30ml (innovatis-bestellnr.: 761000076)	1	Неклассифицированные/default	3604475	Roche
2828826	4038377027388	Roche hires control beads 5e5 30ml (innovatis-bestellnr.: 761000079)	1	Неклассифицированные/default	3604475	Roche
2828827	4038377027364	Roche hires control beads 5e6 30ml (innovatis-bestellnr.: 761000075)	1	Неклассифицированные/default	3604475	Roche
2828828	4038377027395	Roche hires reagent kit (innovatis-bestellnr.: 761500000	1	Неклассифицированные/default	3604475	Roche
2828829	4015630932825	Roche hirudin blood tubes 10x 3ml	2418507	Изделия медицинского назначения (folder)/Изделия медицинского назначения	0	
2828830	4015630932801	Roche hirudin blood tubes 50x 3ml	2418507	Изделия медицинского назначения (folder)/Изделия медицинского назначения	0	
2828831	4015630932849	Roche hirudin micro blood tubes (ruo) 10x1.25ml	2418507	Изделия медицинского назначения (folder)/Изделия медицинского назначения	0	
2828832	4038377002484	Roche histone 10mg	1	Неклассифицированные/default	3604475	Roche
2828833	4038377002477	Roche histone h1 1mg	1	Неклассифицированные/default	3604475	Roche
2828834	4038377006079	Roche histone h1 5mg	1	Неклассифицированные/default	3604475	Roche
2828835	4038377006482	Roche histone h3 1mg	1	Неклассифицированные/default	3604475	Roche
2828836	4015630992829	Roche hit 917 barcode-etk. 901 5x r1, 5x r2, 5x r3	2418507	Изделия медицинского назначения (folder)/Изделия медицинского назначения	0	
2828837	4015630992843	Roche hit 917 barcode-etk. 903 5x r1, 5x r2, 5x r3	2418507	Изделия медицинского назначения (folder)/Изделия медицинского назначения	0	
2828838	4015630992850	Roche hit 917 barcode-etk. 904 5x r1, 5x r2, 5x r3	2418507	Изделия медицинского назначения (folder)/Изделия медицинского назначения	0	
2828839	4015630992867	Roche hit 917 barcode-etk. 905 5x r1, 5x r2, 5x r3	2418507	Изделия медицинского назначения (folder)/Изделия медицинского назначения	0	
2828840	4015630910120	Roche hitergent 1x 1000ml	2418507	Изделия медицинского назначения (folder)/Изделия медицинского назначения	0	
2828841	4015630903047	Roche hitergent 33 10x 100ml	2418507	Изделия медицинского назначения (folder)/Изделия медицинского назначения	0	
2828842	4015630901913	Roche hitergent hit 917,cobas c 501.502 12x 59ml flaschengro?E 70ml	2418507	Изделия медицинского назначения (folder)/Изделия медицинского назначения	0	
2828843	4038377013640	Roche hnpp fluorescent detection set 1 set	1	Неклассифицированные/default	3604475	Roche
2828844	4038377018478	Roche homogeneous caspases assay, fluorimetric 1 kit (1.000 tests on 96-well plates, 4.000 tests	1	Неклассифицированные/default	3604475	Roche
2828845	4038377018560	Roche homogeneous caspases assay, fluorimetric 1 kit (100 tests on 96-well plates, 400 tests on 3	1	Неклассифицированные/default	3604475	Roche
2828846	4038377002835	Roche hpa i 100 u (3 - 10 u/чl)	1	Неклассифицированные/default	3604475	Roche
2828847	4038377003115	Roche hpa i 500 u (3 - 10 u/чl)	1	Неклассифицированные/default	3604475	Roche
2828848	4038377012902	Roche human genomic dna 100 чg	1	Неклассифицированные/default	3604475	Roche
2828849	4038377012162	Roche hybridization bags 50 bags	1	Неклассифицированные/default	3604475	Roche
2828850	4038377013107	Roche hybridization buffer 100ml	1	Неклассифицированные/default	3604475	Roche
2828851	4038377026701	Roche hybridization kit rng	1	Неклассифицированные/default	3604475	Roche
2828852	4038377026718	Roche hybridization ls kit rng	1	Неклассифицированные/default	3604475	Roche
2828853	4038377009322	Roche hybridoma Fusion and cloning supplement 10ml (50x)	1	Неклассифицированные/default	3604475	Roche
2828854	4038377005515	Roche hygromycin b 1g (20ml) sterile-filtered	1	Неклассифицированные/default	3604475	Roche
2828855	4038377013152	Roche immunoprecipitation kit (protein a) 20 reactions	1	Неклассифицированные/default	3604475	Roche
2828856	4038377013145	Roche immunoprecipitation kit (protein g) 20 reactions	1	Неклассифицированные/default	3604475	Roche
2828857	4038377021140	Roche in situ cell death detection kit, ap 1 kit (50 tests)	1	Неклассифицированные/default	3604475	Roche
2828858	4038377021133	Roche in situ cell death detection kit, fluorescein 1 kit (50 tests)	1	Неклассифицированные/default	3604475	Roche
2828859	4038377021157	Roche in situ cell death detection kit, pod 1 kit (50 tests)	1	Неклассифицированные/default	3604475	Roche
2828860	4038377021218	Roche in situ cell death detection kit, tmr Red 1 kit (50 tests)	1	Неклассифицированные/default	3604475	Roche
