ID	UPCEAN	Name	CategoryID	CategoryName	BrandID	BrandName
1317322	4000504132920	Сыр kaserei снеговик камбозола/ружет 70% 330г	142810	Продукты питания (folder)/Молочные продукты (folder)/Сыр	124809	Казерай Шампиньон Хофмастер
125121	4000504413197	Сыр kaserei шамп.де Люкс 150г	76203	Продукты питания (folder)/Молочные продукты (folder)/Сыр мягкий	124809	Казерай Шампиньон Хофмастер
125122	4000504410127	Сыр kaserei шамп.камамбер 28% 125г	76203	Продукты питания (folder)/Молочные продукты (folder)/Сыр мягкий	124809	Казерай Шампиньон Хофмастер
125125	4000504176528	Сыр kaserei шамп.ружет для фондю 320г	76203	Продукты питания (folder)/Молочные продукты (folder)/Сыр мягкий	124809	Казерай Шампиньон Хофмастер
125127	4000504411322	Сыр kaserei шамп.эмменталлер 400г	124690	Продукты питания (folder)/Молочные продукты (folder)/Сыр твердый и полутвердый	124809	Казерай Шампиньон Хофмастер
3545350	5011038134112	Сыр kerrygold чеддер белый 48% 200г	142810	Продукты питания (folder)/Молочные продукты (folder)/Сыр	0	
836729	7622300315733	Сыр kraft philadelphia doppelrahmstufe 68% 175г	76203	Продукты питания (folder)/Молочные продукты (folder)/Сыр мягкий	1317936	Kraft Philadelphia
1317938	7622300756413	Сыр kraft philadelphia баланс с травами 12% 175г	142810	Продукты питания (folder)/Молочные продукты (folder)/Сыр	1317936	Kraft Philadelphia
836731	7622300318147	Сыр kraft philadelphia лайт 12% 175г эмборг	76203	Продукты питания (folder)/Молочные продукты (folder)/Сыр мягкий	1317936	Kraft Philadelphia
836732	7622300340292	Сыр kraft philadelphia мягк. паст. легкий мдж 41% 175г	142810	Продукты питания (folder)/Молочные продукты (folder)/Сыр	1317936	Kraft Philadelphia
836733	7622300340285	Сыр kraft philadelphia мягк. паст. оригинальный мдж 69% 175г	142810	Продукты питания (folder)/Молочные продукты (folder)/Сыр	1317936	Kraft Philadelphia
1317937	7622300756390	Сыр kraft philadelphia мягк. паст. с йогуртом мдж 40.6% 175г	142810	Продукты питания (folder)/Молочные продукты (folder)/Сыр	1317936	Kraft Philadelphia
1317939	7622210065650	Сыр kraft philadelphia мягк. паст. с медом мдж 27.7% 175г	142810	Продукты питания (folder)/Молочные продукты (folder)/Сыр	1317936	Kraft Philadelphia
836737	7622300318123	Сыр kraft philadelphia мягк. паст. с травами мдж 42% 175г	142810	Продукты питания (folder)/Молочные продукты (folder)/Сыр	1317936	Kraft Philadelphia
836738	7622300318116	Сыр kraft philadelphia мягк. паст. с травами мдж 64% 175г	142810	Продукты питания (folder)/Молочные продукты (folder)/Сыр	1317936	Kraft Philadelphia
836735	7622300508661	Сыр kraft philadelphia мягк.альп.мол.шокол.45% 175г крафт	144938	Продукты питания (folder)/Молочные продукты (folder)/Молочные продукты	1317936	Kraft Philadelphia
125702	7622400421730	Сыр kraft philadelphia натур 5% 200г эмборг	76203	Продукты питания (folder)/Молочные продукты (folder)/Сыр мягкий	1317936	Kraft Philadelphia
836736	7622300318154	Сыр kraft philadelphia с йогуртом 12% 175г эмборг	76203	Продукты питания (folder)/Молочные продукты (folder)/Сыр мягкий	1317936	Kraft Philadelphia
1254592	7622300756383	Сыр kraft philadelphia с шоколадом milka 14% 0.175	144938	Продукты питания (folder)/Молочные продукты (folder)/Молочные продукты	1317936	Kraft Philadelphia
125704	7622400015656	Сыр kraft philadelphia слив.с йогуртом 16% 200г эмборг	76203	Продукты питания (folder)/Молочные продукты (folder)/Сыр мягкий	1317936	Kraft Philadelphia
125705	7622400009419	Сыр kraft philadelphia слив.с лососем 51% 150г эмборг	76203	Продукты питания (folder)/Молочные продукты (folder)/Сыр мягкий	1317936	Kraft Philadelphia
3545351	8606003752711	Сыр kuc каймак сербский сливочно-творожный 100г тв/уп	142810	Продукты питания (folder)/Молочные продукты (folder)/Сыр	0	
3545352	8606003752735	Сыр kuc каймак сербский сливочный с маринованным перчиком 400г тв/упк	142810	Продукты питания (folder)/Молочные продукты (folder)/Сыр	3685775	KUC/SERBIYA
3545353	8606003752728	Сыр kuc каймак сербский сливочный-творожный 400г тв/упк	142810	Продукты питания (folder)/Молочные продукты (folder)/Сыр	3685775	KUC/SERBIYA
3545354	8606003752667	Сыр kuc сербская брынза 35% 500г	142810	Продукты питания (folder)/Молочные продукты (folder)/Сыр	0	
1791275	8606003750687	Сыр kuc сербский брынза 35% 250г	76203	Продукты питания (folder)/Молочные продукты (folder)/Сыр мягкий	0	
2932833	8606003752674	Сыр kuc сиртос мягкий 45% 250г пл/бан	142810	Продукты питания (folder)/Молочные продукты (folder)/Сыр	3685775	KUC/SERBIYA
3545356	8606003752681	Сыр kuc сиртос мягкий 45% 500г	142810	Продукты питания (folder)/Молочные продукты (folder)/Сыр	0	
1317070	29007516	Сыр La tourree 200 uh	142810	Продукты питания (folder)/Молочные продукты (folder)/Сыр	0	
2932845	4607037120617	Сыр lactalis President 16 долек 0.280	142810	Продукты питания (folder)/Молочные продукты (folder)/Сыр	3604480	Lactalis President
444987	4600679002020	Сыр lactalis President 45% плав.сливоч.140г	204841	Лекарственные средства (folder)/Витамины и минералы	3604480	Lactalis President
1827495	3222082010037	Сыр lactalis President 55% с шампиньонами 140г	3545748	Продукты питания (folder)/Молочные продукты (folder)/Сыр плавленый	3604480	Lactalis President
1317075	3228021020013	Сыр lactalis President comte 45% 250г (Франция)	142810	Продукты питания (folder)/Молочные продукты (folder)/Сыр	3604480	Lactalis President
125427	3228024020249	Сыр lactalis President meule de campagne 50% 250г (Франция)	124690	Продукты питания (folder)/Молочные продукты (folder)/Сыр твердый и полутвердый	3604480	Lactalis President
125466	3228021990187	Сыр lactalis President rondele 70%ж 80г коробка	124690	Продукты питания (folder)/Молочные продукты (folder)/Сыр твердый и полутвердый	3604480	Lactalis President
125416	3228024006076	Сыр lactalis President бле д'овернь весовой / bleu d'auvergne 50%ж 1300г фольга	142810	Продукты питания (folder)/Молочные продукты (folder)/Сыр	3604480	Lactalis President
836361	3228023006022	Сыр lactalis President бле д'овернь порционный / bleu d'auvergne portion 50%ж 100г ванночка	124690	Продукты питания (folder)/Молочные продукты (folder)/Сыр твердый и полутвердый	3604480	Lactalis President
124815	5906207520073	Сыр lactalis President бри 125г мдж 60% /треуг./ (200215)	76203	Продукты питания (folder)/Молочные продукты (folder)/Сыр мягкий	3604480	Lactalis President
124814	3228020191349	Сыр lactalis President бри в жестяной баночке / petit brie boite metal 50%ж 125г жестяная баночка	76203	Продукты питания (folder)/Молочные продукты (folder)/Сыр мягкий	3604480	Lactalis President
2933029	4607022662313	Сыр lactalis President бри козий snack a La francaise 90г	142810	Продукты питания (folder)/Молочные продукты (folder)/Сыр	3604480	Lactalis President
124816	3228020232028	Сыр lactalis President бри порционный / brie portion 60%ж 200г фольга	76203	Продукты питания (folder)/Молочные продукты (folder)/Сыр мягкий	3604480	Lactalis President
124817	5906207560079	Сыр lactalis President бри с оливками 60% 125г	76203	Продукты питания (folder)/Молочные продукты (folder)/Сыр мягкий	3604480	Lactalis President
124818	5906207530072	Сыр lactalis President бри с орехами 125г мдж 60% /треуг./ (63874)	76203	Продукты питания (folder)/Молочные продукты (folder)/Сыр мягкий	3604480	Lactalis President
1827428	4607037120600	Сыр lactalis President ветчина 280г	142810	Продукты питания (folder)/Молочные продукты (folder)/Сыр	3604480	Lactalis President
125471	5906207440067	Сыр lactalis President воздушный творожный с орехами кор. 100г	76203	Продукты питания (folder)/Молочные продукты (folder)/Сыр мягкий	3604480	Lactalis President
125417	3228020450736	Сыр lactalis President голубое сердце 55% 250г	124690	Продукты питания (folder)/Молочные продукты (folder)/Сыр твердый и полутвердый	3604480	Lactalis President
3918097	3228013481464	Сыр lactalis President камамб.45% порц.250г	76203	Продукты питания (folder)/Молочные продукты (folder)/Сыр мягкий	3604480	Lactalis President
3918098	3228020481464	Сыр lactalis President камамб.45% порц.250г #2	76203	Продукты питания (folder)/Молочные продукты (folder)/Сыр мягкий	3604480	Lactalis President
125418	3228020481426	Сыр lactalis President камамбер / camembert 45%ж 250г коробка	76203	Продукты питания (folder)/Молочные продукты (folder)/Сыр мягкий	3604480	Lactalis President
1317807	322802048142	Сыр lactalis President камамбер 45% 0.250	142810	Продукты питания (folder)/Молочные продукты (folder)/Сыр	3604480	Lactalis President
125419	3228023920090	Сыр lactalis President камамбер 45% порц.250г	76203	Продукты питания (folder)/Молочные продукты (folder)/Сыр мягкий	3604480	Lactalis President
125144	3228020481846	Сыр lactalis President камамбер в жестяной баночке / camembert boite metal 50%ж 125г жестяная баночка President	76203	Продукты питания (folder)/Молочные продукты (folder)/Сыр мягкий	3604480	Lactalis President
125420	3228024010134	Сыр lactalis President камамбер де кампань 250г мдж 45% береста	76203	Продукты питания (folder)/Молочные продукты (folder)/Сыр мягкий	3604480	Lactalis President
125414	3228020260106	Сыр lactalis President камамбер облегченный мдж 28% 250г береста	124690	Продукты питания (folder)/Молочные продукты (folder)/Сыр твердый и полутвердый	3604480	Lactalis President
125162	5906207510050	Сыр lactalis President каре 200г мдж 60% ассорт. /фольга	76203	Продукты питания (folder)/Молочные продукты (folder)/Сыр мягкий	3604480	Lactalis President
125202	5906207050068	Сыр lactalis President корраджио 32% тертый 100г	124690	Продукты питания (folder)/Молочные продукты (folder)/Сыр твердый и полутвердый	3604480	Lactalis President
2490890	460703712011	Сыр lactalis President круг асс 8шт 0.140 #2	142810	Продукты питания (folder)/Молочные продукты (folder)/Сыр	3604480	Lactalis President
2490892	3228022010037	Сыр lactalis President круг асс 8шт 0.140 #4	142810	Продукты питания (folder)/Молочные продукты (folder)/Сыр	3604480	Lactalis President
2490893	3228024000128	Сыр lactalis President круг асс 8шт 0.140 #5	142810	Продукты питания (folder)/Молочные продукты (folder)/Сыр	3604480	Lactalis President
1317405	3228024020034	Сыр lactalis President ле кремье мягкий мдж 60% 200г	142810	Продукты питания (folder)/Молочные продукты (folder)/Сыр	3604480	Lactalis President
1317808	3228020231670	Сыр lactalis President ле пале де шевр 45% 120г (бизнес-групп)	142810	Продукты питания (folder)/Молочные продукты (folder)/Сыр	3604480	Lactalis President
836503	3228020160543	Сыр lactalis President мадригал / madrigal 50%ж 12000г без упаковки	142810	Продукты питания (folder)/Молочные продукты (folder)/Сыр	3604480	Lactalis President
1827496	4600492330270	Сыр lactalis President мал.през.50% 120г	3545748	Продукты питания (folder)/Молочные продукты (folder)/Сыр плавленый	3604480	Lactalis President
2490894	322802107023	Сыр lactalis President Мастер бутерброда 0.150	142810	Продукты питания (folder)/Молочные продукты (folder)/Сыр	3604480	Lactalis President
3546153	4607037122048	Сыр lactalis President Мастер бутерброда 40% 300г карт/уп	142810	Продукты питания (folder)/Молочные продукты (folder)/Сыр	3604480	Lactalis President
125424	3228021070261	Сыр lactalis President Мастер бутерброда ветчина пл.ломт. мдж40-45% 150г	3545748	Продукты питания (folder)/Молочные продукты (folder)/Сыр плавленый	3604480	Lactalis President
125423	3228021070254	Сыр lactalis President Мастер бутерброда мааздам 40% ломтик 150г Россия	3545748	Продукты питания (folder)/Молочные продукты (folder)/Сыр плавленый	3604480	Lactalis President
125425	3228021070278	Сыр lactalis President Мастер бутерброда сливочный ломтик 150г Россия	3545748	Продукты питания (folder)/Молочные продукты (folder)/Сыр плавленый	3604480	Lactalis President
2490895	322802401008	Сыр lactalis President п/э 0.200	142810	Продукты питания (folder)/Молочные продукты (folder)/Сыр	3604480	Lactalis President
125422	3228021070247	Сыр lactalis President плавл. легкий Мастер бутерброда 150г	3545748	Продукты питания (folder)/Молочные продукты (folder)/Сыр плавленый	3604480	Lactalis President
125426	3228021070230	Сыр lactalis President плавл. эмменталь 40% Мастер бутерброда 150г	3545748	Продукты питания (folder)/Молочные продукты (folder)/Сыр плавленый	3604480	Lactalis President
125530	3023260001355	Сыр lactalis President рокфор 52% в пл/уп 150г	124690	Продукты питания (folder)/Молочные продукты (folder)/Сыр твердый и полутвердый	3604480	Lactalis President
1703845	3023260028314	Сыр lactalis President рокфор 52% мдж в с.в.100г	76203	Продукты питания (folder)/Молочные продукты (folder)/Сыр мягкий	125528	Рокфор Сосьете
836641	3228024090167	Сыр lactalis President ронделе творожный 70% 125г	76203	Продукты питания (folder)/Молочные продукты (folder)/Сыр мягкий	3604480	Lactalis President
3918099	3228021990170	Сыр lactalis President рондель с луком 65% 125г	3545748	Продукты питания (folder)/Молочные продукты (folder)/Сыр плавленый	3604480	Lactalis President
3918100	3228021990156	Сыр lactalis President рондель с орехами 70% 125г	76203	Продукты питания (folder)/Молочные продукты (folder)/Сыр мягкий	3604480	Lactalis President
405131	3228021990163	Сыр lactalis President рондель с перцем 70% 125г	142810	Продукты питания (folder)/Молочные продукты (folder)/Сыр	3604480	Lactalis President
125468	4607037120099	Сыр lactalis President с лососем дольки 50% 140г	124690	Продукты питания (folder)/Молочные продукты (folder)/Сыр твердый и полутвердый	3604480	Lactalis President
3918101	3228022015025	Сыр lactalis President с чесн.трав.55% 140г	3545748	Продукты питания (folder)/Молочные продукты (folder)/Сыр плавленый	3604480	Lactalis President
125469	5906207450066	Сыр lactalis President свежий c кайенским перц.70% 100г	76203	Продукты питания (folder)/Молочные продукты (folder)/Сыр мягкий	3604480	Lactalis President
125470	5906207460065	Сыр lactalis President свежий с оливками мдж 70% 100г	76203	Продукты питания (folder)/Молочные продукты (folder)/Сыр мягкий	3604480	Lactalis President
1317809	5906207420069	Сыр lactalis President свежий сливочный 70% 100г	142810	Продукты питания (folder)/Молочные продукты (folder)/Сыр	3604480	Lactalis President
125473	5906207410060	Сыр lactalis President свежий творожный мдж 70% 100г /ассорт/	142810	Продукты питания (folder)/Молочные продукты (folder)/Сыр	3604480	Lactalis President
125441	4607037120297	Сыр lactalis President сливочный Крем мдж 50% 180г ванночка ассортим (57486)	3545748	Продукты питания (folder)/Молочные продукты (folder)/Сыр плавленый	3604480	Lactalis President
3918102	3228024120048	Сыр lactalis President снэк а ля франсез 55% 90г	124690	Продукты питания (folder)/Молочные продукты (folder)/Сыр твердый и полутвердый	3604480	Lactalis President
125475	3228024040308	Сыр lactalis President снэкинг руж мдж55% 180г бум уп.	124690	Продукты питания (folder)/Молочные продукты (folder)/Сыр твердый и полутвердый	3604480	Lactalis President
836678	8000430900262	Сыр lactalis President сулугуни 45% 250г	76203	Продукты питания (folder)/Молочные продукты (folder)/Сыр мягкий	405132	President
836679	8000430900279	Сыр lactalis President сулугуни копченый 45% 250г	76203	Продукты питания (folder)/Молочные продукты (folder)/Сыр мягкий	405132	President
836642	3228024090228	Сыр lactalis President творожный с чесноком и травами 125г мяг/уп	76203	Продукты питания (folder)/Молочные продукты (folder)/Сыр мягкий	3604480	Lactalis President
125472	5906207430068	Сыр lactalis President творожный с чесноком и травами мдж 70% 100г	76203	Продукты питания (folder)/Молочные продукты (folder)/Сыр мягкий	3604480	Lactalis President
125632	3155250007235	Сыр lactalis President терруар 50% 200г	124690	Продукты питания (folder)/Молочные продукты (folder)/Сыр твердый и полутвердый	3604480	Lactalis President
125687	3228024910113	Сыр lactalis President фета маленький шевретин 45% 200г	76203	Продукты питания (folder)/Молочные продукты (folder)/Сыр мягкий	3604480	Lactalis President
836714	8606002110291	Сыр lactalis President фета рассольный салакис 45% 250г	142810	Продукты питания (folder)/Молочные продукты (folder)/Сыр	3604480	Lactalis President
836715	8606002110307	Сыр lactalis President фета рассольный салакис 45% 500г	142810	Продукты питания (folder)/Молочные продукты (folder)/Сыр	3604480	Lactalis President
125697	3228022910030	Сыр lactalis President фета шевретин 45% 200г	76203	Продукты питания (folder)/Молочные продукты (folder)/Сыр мягкий	3604480	Lactalis President
836728	077901292926	Сыр Lactalis President фета шевретин 45% 200г #2	1	Неклассифицированные/default	3604480	Lactalis President
836314	3228021990248	Сыр lactalis President фондю пл.из трех видов сыра 38% 450г	3545748	Продукты питания (folder)/Молочные продукты (folder)/Сыр плавленый	3604480	Lactalis President
2490945	4607022661736	Сыр lactalis President чечил белый косичка 35% 180г тв/уп	2260623	Продукты питания (folder)/Молочные продукты (folder)/Сыр рассольный	3604480	Lactalis President
125476	3228022930052	Сыр lactalis President шевр де белэ 113г	76203	Продукты питания (folder)/Молочные продукты (folder)/Сыр мягкий	3604480	Lactalis President
125478	3228021950280	Сыр lactalis President эмменталь ломт.ваук.уп. 200г	124690	Продукты питания (folder)/Молочные продукты (folder)/Сыр твердый и полутвердый	3604480	Lactalis President
125477	3228023910039	Сыр lactalis President эмменталь порционный / emmental portion 45%ж 250г ванночка	124690	Продукты питания (folder)/Молочные продукты (folder)/Сыр твердый и полутвердый	3604480	Lactalis President
2932834	4607007645102	Сыр laime Original мдж 45% евроблок	142810	Продукты питания (folder)/Молочные продукты (folder)/Сыр	0	
2932835	4607007645119	Сыр laime premium мдж 50.0% евроблок	142810	Продукты питания (folder)/Молочные продукты (folder)/Сыр	0	
2932836	4610014311458	Сыр laime Премиум laime 50% кусок 240 фп	142810	Продукты питания (folder)/Молочные продукты (folder)/Сыр	3687901	LAIME
2932837	4610014311557	Сыр laime Премиум laime 50% кусок 330 фп	142810	Продукты питания (folder)/Молочные продукты (folder)/Сыр	0	
2932838	4610014312134	Сыр laime Премиум laime 50% нарезка 125г	142810	Продукты питания (folder)/Молочные продукты (folder)/Сыр	3687910	LAIME (UNIVITA)
2932839	4610014311373	Сыр laime Премиум laime 50% нарезка 150г	142810	Продукты питания (folder)/Молочные продукты (folder)/Сыр	0	
3918104	4811442006040	Сыр landers gusto 55% 260г	124690	Продукты питания (folder)/Молочные продукты (folder)/Сыр твердый и полутвердый	3918103	LANDER
3545357	4811442005784	Сыр landers Original 50% 260г мяг/уп	142810	Продукты питания (folder)/Молочные продукты (folder)/Сыр	0	
3545358	4811442005579	Сыр landers Original твердый 50% 250г м/у	142810	Продукты питания (folder)/Молочные продукты (folder)/Сыр	3688190	LANDERS (SERVOLYUKS GK/BELARUS')
1827339	3336660012518	Сыр langres chalan.aoc 50% 180г	142810	Продукты питания (folder)/Молочные продукты (folder)/Сыр	0	
1317072	5907070001225	Сыр lazur 30% 100г жемчужный с плесенью	142810	Продукты питания (folder)/Молочные продукты (folder)/Сыр	3918105	LAZUR
1037626	5907070001010	Сыр lazur 50% 100г сапфирный с плесенью	142810	Продукты питания (folder)/Молочные продукты (folder)/Сыр	3918105	LAZUR
