ID	UPCEAN	Name	CategoryID	CategoryName	BrandID	BrandName
3604186	4610027860257	Яйцо пластиковое с хрустящими шариками и сюрпризом 12г #2	1	Неклассифицированные/default	0	
1346717	6920101210587	Яйцо пластиковое ушастик с марм. 20г	980	Игрушки (folder)/Игрушка	0	
3604187	4650056571571	Яйцо пластм Маша и медведь 10г	1	Неклассифицированные/default	3765886	USG (TONLY KIDIES CANDY WORKSHOP CO.LTD/CHINA)
1712963	4607102559427	Яйцо под роспись (без подставки) (умные игры)	1	Неклассифицированные/default	0	
1712964	4607102559434	Яйцо под роспись на подставке 10см (рни)	1	Неклассифицированные/default	0	
2951069	46071910	Яйцо подводный мир шоколадное 20г м/у	19677	Продукты питания (folder)/Кондитерские изделия (folder)/Шоколад	0	
3604188	6909731037412	Яйцо Принцесса пластиковое драже с ирушкой 20г мл/уп	1	Неклассифицированные/default	3765837	USG (RUSPRODKHOLDING)
3604189	8699462605148	Яйцо Принцесса пластиковое с шоколадным кремом и сюрпризом 15г	1	Неклассифицированные/default	0	
3604190	4650085320034	Яйцо птицефабрика приволжская куриное столовое 1категории 10шт тв/уп	1	Неклассифицированные/default	0	
3604191	4650085320089	Яйцо птицефабрика приволжская куриное столовое 1категории 10шт тв/уп #2	1	Неклассифицированные/default	0	
1346718	4820066930075	Яйцо птицефабрика пролетарская отборное белое уп. 6шт	1	Неклассифицированные/default	0	
1346719	4820066930068	Яйцо птицефабрика пролетарская с-1 белое 10шт	1	Неклассифицированные/default	0	
1346720	4820066930136	Яйцо птицефабрика пролетарская с-1 белое 15шт	1	Неклассифицированные/default	0	
1346721	4820066930020	Яйцо птицефабрика пролетарская с-1 белое гофр. 10шт	1	Неклассифицированные/default	0	
1346722	4820066930051	Яйцо птицефабрика пролетарская с-1 коричневое 10шт	1	Неклассифицированные/default	0	
1346723	4820066930143	Яйцо птицефабрика пролетарская с-1 коричневое 15шт	1	Неклассифицированные/default	0	
1346724	4820066930105	Яйцо птицефабрика пролетарская с-1 коричневое 6шт	1	Неклассифицированные/default	0	
3604192	4607071520114	Яйцо птичница-отличница 1 категории 10шт	1	Неклассифицированные/default	3817561	ТЕНДЕР
2952586	4630017340187	Яйцо пятерочка 10шт с1, кор.20	1	Неклассифицированные/default	3817561	ТЕНДЕР
2952587	4630017340156	Яйцо пятерочка 10шт со, кор.20	1	Неклассифицированные/default	3817561	ТЕНДЕР
3604193	4601778441086	Яйцо ралли с сюрпризом 20г шоколадная компания	1	Неклассифицированные/default	0	
3604194	4607178445334	Яйцо рождественские овечки шоколадное 90г	1	Неклассифицированные/default	0	
142719	4602277002075	Яйцо роскар куриное пищевое столовое с1 10шт тв/уп	142624	Продукты питания (folder)/Яйцо	72927	Роскар
2952340	4602277006080	Яйцо роскар куриное пищевое столовое с1 30шт тв/уп	142624	Продукты питания (folder)/Яйцо	0	
3604195	46177551	Яйцо русалки из молочного шоколада с игрушкой 20г мяг/уп	1	Неклассифицированные/default	3640933	DANLI (KENDIPARK)
3604196	4607042521928	Яйцо Русский сюрприз шоколадное 50г	1	Неклассифицированные/default	0	
142708	4607144060028	Яйцо рябушка витамин.отборное 10шт агро	142624	Продукты питания (folder)/Яйцо	120498	Парнас Агро
871357	4607019060122	Яйцо рябушка витамин.отборное 10шт пф невская	142624	Продукты питания (folder)/Яйцо	871327	ПФ Невская
170166	4607019060207	Яйцо рябушка парнас 10шт	142624	Продукты питания (folder)/Яйцо	0	
142709	4607019060030	Яйцо рябушка с1 10шт агро	142624	Продукты питания (folder)/Яйцо	120498	Парнас Агро
2967082	4607144060172	Яйцо рябушка с1 10шт агро #2	142624	Продукты питания (folder)/Яйцо	120498	Парнас Агро
142710	4607019060214	Яйцо рябушка св 10шт агро	142624	Продукты питания (folder)/Яйцо	120498	Парнас Агро
2967083	4607144060011	Яйцо рябушка св 10шт агро #2	142624	Продукты питания (folder)/Яйцо	120498	Парнас Агро
2952588	4811538000624	Яйцо с 1 цвет.фас.златко	1	Неклассифицированные/default	0	
3604197	4600416012831	Яйцо с игрушкой 60г	1	Неклассифицированные/default	0	
3604018	4600416011001	Яйцо с игрушкой scooby doo 20г	1	Неклассифицированные/default	0	
2951115	4607178441213	Яйцо с любовью шоколадное с сюрпризом 15г	19677	Продукты питания (folder)/Кондитерские изделия (folder)/Шоколад	0	
3604198	4607178445853	Яйцо с новым годом шоколадное с сюрпризом 50г	1	Неклассифицированные/default	0	
3604199	46074744	Яйцо с сюпризом безумные гонки 90г	1	Неклассифицированные/default	0	
3604200	46111067	Яйцо с сюрпризом 20г	1	Неклассифицированные/default	0	
3604201	46074720	Яйцо с сюрпризом 90г	1	Неклассифицированные/default	0	
3604202	4607171170912	Яйцо с сюрпризом 90г #2	1	Неклассифицированные/default	0	
330444	4650056570017	Яйцо с сюрпризом человек-паук 10г /пласт/	1	Неклассифицированные/default	0	
1346725	6907728088607	Яйцо с цветоч/стразами серебр.стеклян.7x 10см b1516	36595	Товары для праздников (folder)/Новый Год и Рождество	672703	NVT Traiding
2952551	4630017340248	Яйцо с0 н/ф 360шт	1	Неклассифицированные/default	0	
170169	4601417338296	Яйцо с0 невское фасовка 10шт	142624	Продукты питания (folder)/Яйцо	0	
142682	4602277000033	Яйцо с0 экстра фасован. по 10шт в кор.роскар	142624	Продукты питания (folder)/Яйцо	72927	Роскар
2772901	4607058032876	Яйцо с1	142624	Продукты питания (folder)/Яйцо	0	
2770240	4606068241834	Яйцо с1 (10) селен и йод 360шт 120	1	Неклассифицированные/default	0	
2769680	4606068022396	Яйцо с1 (20) селен и йод 360шт 101	1	Неклассифицированные/default	0	
2772923	4607043105721	Яйцо с1 /фирм уп/ 6шт/ бумаж	1	Неклассифицированные/default	0	
2952589	4610004001772	Яйцо с1 10 штук тп	1	Неклассифицированные/default	0	
2772999	4606068013332	Яйцо с1 365 дней термоупаковка по 30шт	1	Неклассифицированные/default	0	
2772933	4607058031978	Яйцо с1 Life по 10шт 360шт	142624	Продукты питания (folder)/Яйцо	0	
2772934	4630009960157	Яйцо с1 Life по 30шт 300шт	1	Неклассифицированные/default	0	
2773114	4607058032616	Яйцо с1 белое 10 картон 350	142624	Продукты питания (folder)/Яйцо	0	
2952591	4607071500840	Яйцо с1 в термопленке, 30шт	1	Неклассифицированные/default	0	
2773037	4607058032258	Яйцо с1 волжанин broker 30шт	142624	Продукты питания (folder)/Яйцо	0	
2773045	4607058032517	Яйцо с1 волжанин по 10шт подари жизнь (210)	142624	Продукты питания (folder)/Яйцо	0	
2772936	4607058032173	Яйцо с1 волжское утро по 10 /картон/ 210шт	142624	Продукты питания (folder)/Яйцо	3797234	ВОЛЖАНИН
2772937	4607058032210	Яйцо с1 волжское утро т/у по 20 360шт	142624	Продукты питания (folder)/Яйцо	0	
2772938	4607058032197	Яйцо с1 волжское утро т/у по 30 300шт	142624	Продукты питания (folder)/Яйцо	0	
2769745	4607058032227	Яйцо с1 волжское утро Умница по 10 /картон/ 160шт	142624	Продукты питания (folder)/Яйцо	0	
2952592	4607012592941	Яйцо с1 гнездышко 10шт птицефабрика синявинская	1	Неклассифицированные/default	0	
2770150	4680320001114	Яйцо с1 деревенские напевы по 10 /160шт 118	1	Неклассифицированные/default	0	
2770160	4680320003101	Яйцо с1 деревенские напевы по 20 360шт 119	1	Неклассифицированные/default	0	
2769780	4607058032890	Яйцо с1 деревенские узоры 103	142624	Продукты питания (folder)/Яйцо	0	
2770256	4607009877068	Яйцо с1 деревенские узоры пер по 10/160 122	1	Неклассифицированные/default	3786878	МАРКЕТ Перекресток
2769813	4690363042630	Яйцо с1 деревенские узоры по 10шт/mdd 105	1	Неклассифицированные/default	0	
2769889	4607058030834	Яйцо с1 деревенские узоры по 30 термоуп /240шт 109	142624	Продукты питания (folder)/Яйцо	0	
2772953	4607058032036	Яйцо с1 доброе утро по-фински по 10 160шт	142624	Продукты питания (folder)/Яйцо	0	
2773054	4607058032050	Яйцо с1 доброе утро по-фински т/у по 20 180шт	142624	Продукты питания (folder)/Яйцо	0	
2772954	4607058031916	Яйцо с1 картон х 15 волжанин 180шт	142624	Продукты питания (folder)/Яйцо	0	
170170	4602277000040	Яйцо с1 кат фасован. по 10шт в кор.роскар	142624	Продукты питания (folder)/Яйцо	0	
2772956	4607058032340	Яйцо с1 круглый год .апп.по 10 350шт	142624	Продукты питания (folder)/Яйцо	29230	Круглый Год
2772962	4607058032364	Яйцо с1 круглый год, апп.по 30 300шт	142624	Продукты питания (folder)/Яйцо	29230	Круглый Год
2952552	4630017340255	Яйцо с1 н/ф 360шт	1	Неклассифицированные/default	0	
2967997	4607078700038	Яйцо с1 невское фасовка 10шт #2	142624	Продукты питания (folder)/Яйцо	3817561	ТЕНДЕР
2770092	4607058030964	Яйцо с1 омега-3 по 10/ картон / 210шт 112	142624	Продукты питания (folder)/Яйцо	0	
2952593	4607060330069	Яйцо с1 пл/конт 10шт (20 конт.) (опт)	1	Неклассифицированные/default	0	
2773125	4607058032760	Яйцо с1 селяночка 10 картон (200)	142624	Продукты питания (folder)/Яйцо	0	
2952292	4607131550549	Яйцо с1 таганрогское 30 (180) бум	1	Неклассифицированные/default	0	
2773001	4607043101396	Яйцо с1 термоупаковка 30шт/кд	1	Неклассифицированные/default	0	
2952594	4650077390021	Яйцо с1 три несушки в бумажной м/шт упаковке (паллет)	1	Неклассифицированные/default	0	
2770143	4607058031824	Яйцо с1 Умница по 10/ картон/ 210шт 115	142624	Продукты питания (folder)/Яйцо	0	
2773007	4607043101402	Яйцо с1 фирм уп 10шт бумаж	1	Неклассифицированные/default	0	
2770248	4607058032630	Яйцо с1 экояйцо по 10 картон 160шт	142624	Продукты питания (folder)/Яйцо	0	
2773032	4607058032708	Яйцо с1 экояйцо по 20 180шт	142624	Продукты питания (folder)/Яйцо	0	
142747	4602277000026	Яйцо с1 экстра фасован. по 10шт в кор.роскар	142624	Продукты питания (folder)/Яйцо	72927	Роскар
2952595	4610004001789	Яйцо с2 10 штук тп	1	Неклассифицированные/default	0	
2773662	4606068015305	Яйцо с2 365 дней термоупаковка по 30шт	1	Неклассифицированные/default	0	
2952596	4607071500857	Яйцо с2 в термопленке, 30шт	1	Неклассифицированные/default	0	
2773655	4607058032357	Яйцо с2 круглый год .апп.по 10 350шт	142624	Продукты питания (folder)/Яйцо	29230	Круглый Год
2952553	4630017340262	Яйцо с2 н/ф 360шт	1	Неклассифицированные/default	0	
2952597	4607104660404	Яйцо с2 пл/конт 10шт (20 конт.) (опт)	1	Неклассифицированные/default	0	
2773692	4607071501540	Яйцо с2 по 10 /картон/ фирм уп 200шт	1	Неклассифицированные/default	3817561	ТЕНДЕР
2773627	4690363038015	Яйцо с2 по 10шт к/д-дубль	1	Неклассифицированные/default	0	
2952554	4630017340279	Яйцо с3 н/ф 360шт	1	Неклассифицированные/default	0	
2774004	4607058032203	Яйцо с3 почемучка 300шт	142624	Продукты питания (folder)/Яйцо	0	
2764656	46132529	Яйцо самолеты шоколадное с игрушкой 20г м/у	19677	Продукты питания (folder)/Кондитерские изделия (folder)/Шоколад	3695349	LUNTIK (SLADKAYA сказка GK)
2771420	4607058032647	Яйцо св волжское утро по 10шт картон 250шт 202	142624	Продукты питания (folder)/Яйцо	0	
2952550	4630017340231	Яйцо св н/ф 240шт	1	Неклассифицированные/default	0	
871358	4610000240069	Яйцо св особо крупное 10шт фас.ленптицепром	142624	Продукты питания (folder)/Яйцо	142647	Ленптицепром
3947824	4670006380268	Яйцо свеж кур.с1 1кат.10шт	3668495	Продукты питания (folder)/Яйцо куриное	3947823	СВЕЖ
3947825	4680010130193	Яйцо свеж кур.с1 1кат.10шт #2	3668495	Продукты питания (folder)/Яйцо куриное	3947823	СВЕЖ
2952237	4605217000117	Яйцо свердловское куриное с1 10 штук пл/у свердловская пф	142624	Продукты питания (folder)/Яйцо	3817561	ТЕНДЕР
1346726	4870130000067	Яйцо север трейд 1 категории 15шт уп	142624	Продукты питания (folder)/Яйцо	0	
3604204	80664475	Яйцо северная венеция сказка на ладошке шоколадное 20г	1	Неклассифицированные/default	0	
2860574	4607009875309	Яйцо сейма деревенское 1 катег (в контейнере эффект+ по 10шт короб 160)	1	Неклассифицированные/default	0	
2952218	4607009875293	Яйцо сейма деревенское о катег (в контейнере эффект+ по 10шт короб 160)	1	Неклассифицированные/default	0	
2952557	4607009874418	Яйцо сейма-омега о катег (в контейнере эффект+ по 10шт,короб по 160)	1	Неклассифицированные/default	0	
3947826	4607124892120	Яйцо село зеленое с0 10шт вараксино	3668495	Продукты питания (folder)/Яйцо куриное	3901421	СЕЛО ЗЕЛЕНОЕ
3947827	4607124892113	Яйцо село зеленое с1 10шт вараксино	3668495	Продукты питания (folder)/Яйцо куриное	3901421	СЕЛО ЗЕЛЕНОЕ
2952598	4670002160017	Яйцо сельская новь 10шт с0, кор.30 дикси	1	Неклассифицированные/default	3817561	ТЕНДЕР
2952599	4670002160062	Яйцо сельская новь 10шт с1, кор.30 дикси	1	Неклассифицированные/default	3817561	ТЕНДЕР
2952600	4670002160116	Яйцо сельская новь 10шт с2, кор.30 дикси	1	Неклассифицированные/default	3817561	ТЕНДЕР
2952601	4630017340224	Яйцо сельская новь 20шт с3 кор.10	1	Неклассифицированные/default	0	
3947828	4650062350085	Яйцо селяночка кур.с0 10шт	3668495	Продукты питания (folder)/Яйцо куриное	3809755	СЕЛЯНОЧКА
3947829	4650062350078	Яйцо селяночка кур.с1 10шт	3668495	Продукты питания (folder)/Яйцо куриное	3809755	СЕЛЯНОЧКА
3604205	4670010270838	Яйцо символ года шоколадное 20г фольга	1	Неклассифицированные/default	0	
871359	4606383027533	Яйцо синее 4 панорама	3541537	Сувениры и подарки (folder)/Сувенир	0	
170172	4607010070144	Яйцо синявинское 1 кат.фасовка	142624	Продукты питания (folder)/Яйцо	0	
1346727	4607012592224	Яйцо синявинское дерев от мол.несушки 2кат 10шт	142624	Продукты питания (folder)/Яйцо	142658	Синявино
1346728	4607012592200	Яйцо синявинское дерев отборное 10шт	142624	Продукты питания (folder)/Яйцо	142658	Синявино
142713	4607012591074	Яйцо синявинское к завтраку 2кат 10шт	142624	Продукты питания (folder)/Яйцо	142658	Синявино
170156	4607012590480	Яйцо синявинское куриное 2 категория фасованное 10шт тв/уп	142624	Продукты питания (folder)/Яйцо	3817561	ТЕНДЕР
2952602	4607012592552	Яйцо синявинское особо крупное св 20шт	1	Неклассифицированные/default	0	
2764661	46157713	Яйцо сладкая сказка шоколадное поезд динозавров 20г	19677	Продукты питания (folder)/Кондитерские изделия (folder)/Шоколад	0	
2502249	46059321	Яйцо сладкие девочки шоколадное с сюрпризом 20г м/у	19677	Продукты питания (folder)/Кондитерские изделия (folder)/Шоколад	0	
2951096	46044945	Яйцо сладкие фантазии шоколадное 20г м/у	19677	Продукты питания (folder)/Кондитерские изделия (folder)/Шоколад	0	
313420	6939501803152	Яйцо сладкий инкубатор Смешарики с мармеладом растущее 20г пл/у	980	Игрушки (folder)/Игрушка	3765837	USG (RUSPRODKHOLDING)
3604207	4606157003398	Яйцо служу отечеству шоколадное 22г	1	Неклассифицированные/default	0	
2765616	46173768	Яйцо Смешарики шоколадное 20г	19677	Продукты питания (folder)/Кондитерские изделия (folder)/Шоколад	3749857	SHOKI-TOKI (RUSPRODKHOLDING)
1345205	46071897	Яйцо смешутки, шоколадное с сюрпризом, 20г м/у	19677	Продукты питания (folder)/Кондитерские изделия (folder)/Шоколад	0	
3604208	4606157003190	Яйцо снежная королева шоколадное 34г	1	Неклассифицированные/default	0	
2774639	4630009960171	Яйцо со /фирм уп/10шт/картон 200шт	1	Неклассифицированные/default	0	
2774597	4606068013356	Яйцо со 365 дней термоупаковка по 30шт	1	Неклассифицированные/default	0	
2774544	4607058031961	Яйцо со Life по 10шт 360шт	142624	Продукты питания (folder)/Яйцо	0	
2774549	4607058031817	Яйцо со белокурые х10 (картон) 360шт	142624	Продукты питания (folder)/Яйцо	0	
2952603	4607071502028	Яйцо со в контейнере отборное	1	Неклассифицированные/default	0	
2774551	4607058030360	Яйцо со волжанин по 6/ фирм уп/180шт	142624	Продукты питания (folder)/Яйцо	0	
2774624	4607058032500	Яйцо со волжское утро по 10 картон 210шт	142624	Продукты питания (folder)/Яйцо	0	
2774553	4607058032234	Яйцо со гнездовые 10шт, шпон 210шт	142624	Продукты питания (folder)/Яйцо	0	
2774642	4607058032593	Яйцо со гнездовые не фас	142624	Продукты питания (folder)/Яйцо	3786878	МАРКЕТ Перекресток
2774562	4607058031879	Яйцо со гнездовые по 10 картон 160шт	142624	Продукты питания (folder)/Яйцо	0	
2774795	4680320001121	Яйцо со деревенские напевы по 10/160шт 815	1	Неклассифицированные/default	0	
2774763	4607058032906	Яйцо со деревенские узоры 800	142624	Продукты питания (folder)/Яйцо	0	
2774770	4607058031374	Яйцо со деревенские узоры по 10 /картон/ 210шт 802	142624	Продукты питания (folder)/Яйцо	0	
2774779	4690363042623	Яйцо со деревенские узоры по 10шт/mdd 803	1	Неклассифицированные/default	0	
2774796	4606068241827	Яйцо со деревенские узоры по 20/картон 360шт 816	1	Неклассифицированные/default	0	
2774780	4640000101848	Яйцо со деревенское по 10 дом еды 360шт 804	1	Неклассифицированные/default	0	
2774570	4607058032029	Яйцо со доброе утро по-фински по 10 210шт	142624	Продукты питания (folder)/Яйцо	0	
2774583	4607058031145	Яйцо со мировые по 10 фирм уп 360шт	142624	Продукты питания (folder)/Яйцо	0	
2774782	4606068088392	Яйцо со омега-3 и витамин в9 по 6	1	Неклассифицированные/default	0	
2774784	4607058032388	Яйцо со омега-3 по 6шт (360)	142624	Продукты питания (folder)/Яйцо	0	
2774601	4607043105103	Яйцо со термоупаковка 30шт/кд	1	Неклассифицированные/default	0	
2774609	4607043105110	Яйцо со фирмен упак 10шт бумаж	1	Неклассифицированные/default	0	
2774793	4606068018382	Яйцо со яркий желток по 10/картон/фирм уп	1	Неклассифицированные/default	0	
2951092	46175786	Яйцо собака с игрушкой шоколадное с сюрпризом 90г мяг/уп	19677	Продукты питания (folder)/Кондитерские изделия (folder)/Шоколад	0	
3604209	4607178447055	Яйцо собачки шоколадное с сюрпризом 50г мяг/уп	1	Неклассифицированные/default	0	
3604210	4607178447383	Яйцо собачье сердце с сюрпризом из кондитерской глазури 90г	1	Неклассифицированные/default	0	
3604211	4607178447277	Яйцо собачья семейка шоколадное 50г мяг/уп	1	Неклассифицированные/default	0	
2502232	46147097	Яйцо Солнышко в ладошках новогоднее шоколадное с игрушкой 3д 20г	19677	Продукты питания (folder)/Кондитерские изделия (folder)/Шоколад	3808608	забавный SYURPRIZ (SLADKAYA сказка GK)
3604212	46119285	Яйцо Солнышко в ладошках, шоколадное с игрушкой, 20г м/у	1	Неклассифицированные/default	0	
3604213	4600416015573	Яйцо Солнышко в ладошках, шоколадное с игрушкой, 3x 20г кор	1	Неклассифицированные/default	0	
2952389	4607067940315	Яйцо Солнышко куриное 1 категория 10шт	142624	Продукты питания (folder)/Яйцо	0	
