ID	UPCEAN	Name	CategoryID	CategoryName	BrandID	BrandName
1105564	8011607094486	Pupa bdp Flower USA 30ml 05	1	Неклассифицированные/default	18029	PUPA
1105565	8011607094493	Pupa bdp Flower USA 30ml 06	1	Неклассифицированные/default	18029	PUPA
1105566	8011607094332	Pupa bdp Flower USA 50ml 05	1	Неклассифицированные/default	18029	PUPA
1105567	8011607094349	Pupa bdp Flower USA 50ml 06	1	Неклассифицированные/default	18029	PUPA
1105568	8011607076192	Pupa bdp Rose EDP 40ml 21	3068	Парфюмерия (folder)/Парфюмерия	18029	PUPA
1105569	8011607105304	Pupa bdp very Flower fiore di tahiti 50ml	1	Неклассифицированные/default	18029	PUPA
1105570	8011607105335	Pupa bdp very Flower iris 50ml	1	Неклассифицированные/default	18029	PUPA
1105571	8011607105328	Pupa bdp very Flower orchidea 50ml	1	Неклассифицированные/default	18029	PUPA
1105572	8011607105311	Pupa bdp very Flower rosa 50ml	1	Неклассифицированные/default	18029	PUPA
2378778	8011607114993	Pupa beauty bijour bracciale con Lip Gloss	5586	Косметика (folder)/Косметика	18029	PUPA
2378779	8011607115006	Pupa beauty bijour collana con Lip Gloss	5586	Косметика (folder)/Косметика	18029	PUPA
2378780	8011607075584	Pupa blooming fard in polvere fp	5586	Косметика (folder)/Косметика	18029	PUPA
2378781	8011607075621	Pupa blooming Gloss lucente	5586	Косметика (folder)/Косметика	18029	PUPA
2378782	8011607075546	Pupa blooming ombretto compatto fp	5586	Косметика (folder)/Косметика	18029	PUPA
221116	8011607029174	Pupa blush frosted jelly 10ml 549	7943	Неклассифицированные/COSMETIC	18029	PUPA
2378783	8011607031559	Pupa bouquet de parfums de nymphea	5586	Косметика (folder)/Косметика	18029	PUPA
642603	8011607024414	Pupa bouquet de parfums Rose	5586	Косметика (folder)/Косметика	18029	PUPA
2973134	8011607027637	Pupa bouquet de parfums Rose #2	5586	Косметика (folder)/Косметика	18029	PUPA
2378784	8011607024407	Pupa bouquet de parfums Rose 40 vapo	5586	Косметика (folder)/Косметика	18029	PUPA
2378785	8011607016112	Pupa bronze&Shine 02 eff.abbronzante f	5586	Косметика (folder)/Косметика	18029	PUPA
2378786	8011607018031	Pupa bronze&Shine 53 eff.riflessante	5586	Косметика (folder)/Косметика	18029	PUPA
2378787	8011607020737	Pupa Care creamy Foam 150ml	5586	Косметика (folder)/Косметика	18029	PUPA
2378788	8011607020843	Pupa Care Hydro-matting fluid 50ml	5586	Косметика (folder)/Косметика	18029	PUPA
2378789	8011607028450	Pupa Care Oil control notte 50ml	5586	Косметика (folder)/Косметика	18029	PUPA
2378790	8011607031818	Pupa Care Oil free Hydro protec.40fluid	5586	Косметика (folder)/Косметика	18029	PUPA
2378791	8011607020850	Pupa Care Oil free Hydro protec.fluid 50	5586	Косметика (folder)/Косметика	18029	PUPA
2378792	8011607020805	Pupa Care purifying Gel 150ml	5586	Косметика (folder)/Косметика	18029	PUPA
2378793	8011607030774	Pupa Care refreshing mois.Gel 40ml	5586	Косметика (folder)/Косметика	18029	PUPA
2378794	8011607020744	Pupa Care salviettine viso/occhi rosa 25	5586	Косметика (folder)/Косметика	18029	PUPA
2378795	8011607020836	Pupa Care salviettine viso/occhi verdi	5586	Косметика (folder)/Косметика	18029	PUPA
2378796	8011607028443	Pupa Care Ultra mat t-Zone Gel 30ml	5586	Косметика (folder)/Косметика	18029	PUPA
2378797	8011607095841	Pupa cipria cotto luminys	5586	Косметика (folder)/Косметика	18029	PUPA
2378798	8011607110872	Pupa cipria fard luminys baked all over	5586	Косметика (folder)/Косметика	18029	PUPA
2378799	8011607032396	Pupa cipria polvere silk Touch 04 fp	5586	Косметика (folder)/Косметика	18029	PUPA
2378800	8011607032419	Pupa cipria polvere silk Touch 06 fp	5586	Косметика (folder)/Косметика	18029	PUPA
2378801	8011607093946	Pupa cofanetto chic big grande	5586	Косметика (folder)/Косметика	18029	PUPA
2378802	8011607029815	Pupa coffret le favole di pupa cappucc.f	5586	Косметика (folder)/Косметика	18029	PUPA
2378803	8011607052172	Pupa collection beauty bag	5586	Косметика (folder)/Косметика	18029	PUPA
2378804	8011607079377	Pupa Color waves bronzing Power fp	5586	Косметика (folder)/Косметика	18029	PUPA
2378805	8011607079261	Pupa Color waves Eye Shadow fp	5586	Косметика (folder)/Косметика	18029	PUPA
2378806	8011607079223	Pupa Color waves Gloss	5586	Косметика (folder)/Косметика	18029	PUPA
2378807	8011607079322	Pupa Color waves mascara fp	5586	Косметика (folder)/Косметика	18029	PUPA
2378808	8011607079308	Pupa Color waves pencil fp	5586	Косметика (folder)/Косметика	18029	PUPA
1105573	8011607132171	Pupa conf. in case of Love EDT 100ml + puff + col	1039	Парфюмерия (folder)/Туалетная вода	18029	PUPA
1105574	8011607132164	Pupa conf. in case of Love EDT 50ml + puff + col	1039	Парфюмерия (folder)/Туалетная вода	18029	PUPA
221117	8011607008889	Pupa consealer Stick 4ml	7943	Неклассифицированные/COSMETIC	18029	PUPA
221118	8011607019861	Pupa contraries Eye Shadow Stick	1249	Косметика (folder)/Тени для век	18029	PUPA
221119	8011607019588	Pupa contraries glossy all over	7943	Неклассифицированные/COSMETIC	18029	PUPA
221120	8011607019243	Pupa contraries peel off Eye liner	391481	Косметика (folder)/Карандаш для век	18029	PUPA
2663303	8011607227648	Pupa coral island набор для ногтей тон 001 голубая лагуна 2x 5мл	5586	Косметика (folder)/Косметика	18029	PUPA
2663304	8011607227556	Pupa coral island Помада жидкая тон 001 горячий коралл	5586	Косметика (folder)/Косметика	18029	PUPA
2663305	8011607227570	Pupa coral island Помада жидкая тон 003 страстная фуксия	5586	Косметика (folder)/Косметика	18029	PUPA
2378809	8011607034871	Pupa correttore liquido tubo 01 fp	5586	Косметика (folder)/Косметика	18029	PUPA
2378810	8011607035748	Pupa correttore liquido tubo 02 fp	5586	Косметика (folder)/Косметика	18029	PUPA
2378811	8011607034895	Pupa correttore liquido tubo 03 fp	5586	Косметика (folder)/Косметика	18029	PUPA
2378812	8011607093731	Pupa correttore Magic concealer	5586	Косметика (folder)/Косметика	18029	PUPA
2378813	8011607115747	Pupa correttore Stick concealer 02 New	5586	Косметика (folder)/Косметика	18029	PUPA
2378814	8011607084951	Pupa correttore Stick no astuccio	5586	Косметика (folder)/Косметика	18029	PUPA
2378815	8011607107360	Pupa crema compatta illuminante	5586	Косметика (folder)/Косметика	18029	PUPA
642604	8011607031665	Pupa cuore reflex make up kit	5586	Косметика (folder)/Косметика	18029	PUPA
2378816	8011607098217	Pupa diva's kit mascara+multiplay	5586	Косметика (folder)/Косметика	18029	PUPA
221121	8011607015849	Pupa double lips 3.5ml *2	7943	Неклассифицированные/COSMETIC	18029	PUPA
221122	8011607023660	Pupa dual sens fard Stick	7943	Неклассифицированные/COSMETIC	18029	PUPA
221123	8011607015719	Pupa e-Nail enamil e327/ 6ml	7943	Неклассифицированные/COSMETIC	18029	PUPA
3736347	801160723958	Pupa Easy liner 111 brn pencil 1pcs	3615658	Косметика (folder)/Косметика для глаз	18029	PUPA
3736348	8011607239580	Pupa Easy liner 111 brn pencil 1pcs #2	3615658	Косметика (folder)/Косметика для глаз	18029	PUPA
2378817	8011607091300	Pupa Easy Rouge	5586	Косметика (folder)/Косметика	18029	PUPA
221124	8011607029211	Pupa Eye Color flakes 3g 491	7943	Неклассифицированные/COSMETIC	18029	PUPA
221125	8011607029273	Pupa Eye forsted jelly 4ml 492	7943	Неклассифицированные/COSMETIC	18029	PUPA
2378818	8011607043989	Pupa Eye liner and khol softness New2003	5586	Косметика (folder)/Косметика	18029	PUPA
2378819	8011607090037	Pupa Eye liner doppio colore graphic fp	5586	Косметика (folder)/Косметика	18029	PUPA
221126	8011607013142	Pupa face complexion spf14 /25ml	7943	Неклассифицированные/COSMETIC	18029	PUPA
2378820	8011607034284	Pupa fard compatto 03 silk Touch	5586	Косметика (folder)/Косметика	18029	PUPA
2378821	8011607095773	Pupa fard cotto luminys	5586	Косметика (folder)/Косметика	18029	PUPA
2378822	8011607113248	Pupa fard in Mousse Soft blush	5586	Косметика (folder)/Косметика	18029	PUPA
2378823	8011607076321	Pupa fard luminoso disastucciato	5586	Косметика (folder)/Косметика	18029	PUPA
2378824	8011607018581	Pupa fard Stick dual densation 06 f.p.	5586	Косметика (folder)/Косметика	18029	PUPA
2378825	8011607018468	Pupa fard Stick dual sensation 01 f.p.	5586	Косметика (folder)/Косметика	18029	PUPA
2378826	8011607018482	Pupa fard Stick dual sensation 03 f.p.	5586	Косметика (folder)/Косметика	18029	PUPA
2378827	8011607018499	Pupa fard Stick dual sensation 04 f.p.	5586	Косметика (folder)/Косметика	18029	PUPA
2378828	8011607018574	Pupa fard Stick dual sensation 05 f.p.	5586	Косметика (folder)/Косметика	18029	PUPA
2378829	8011607023653	Pupa fard Stick dual sensation 07 f.p.	5586	Косметика (folder)/Косметика	18029	PUPA
2378830	8011607030903	Pupa fio' coffret petit jardin	5586	Косметика (folder)/Косметика	18029	PUPA
1105575	8011607027675	Pupa fio' crema corpo 150ml	1	Неклассифицированные/default	18029	PUPA
642606	8011607094363	Pupa Flower in Red EDT 30ml	5586	Косметика (folder)/Косметика	18029	PUPA
642607	8011607083848	Pupa Flower in Red m up kit	5586	Косметика (folder)/Косметика	18029	PUPA
2378831	8011607114665	Pupa fond.fluido hydra luminys	5586	Косметика (folder)/Косметика	18029	PUPA
2378832	8011607107278	Pupa fond.Hydro absolute crema compatta	5586	Косметика (folder)/Косметика	18029	PUPA
2378833	8011607033515	Pupa fondot.compatto Easy wear 01	5586	Косметика (folder)/Косметика	18029	PUPA
2378834	8011607063857	Pupa fondot.compatto Easy wear 01b	5586	Косметика (folder)/Косметика	18029	PUPA
2378835	8011607033522	Pupa fondot.compatto Easy wear 02	5586	Косметика (folder)/Косметика	18029	PUPA
2378836	8011607033539	Pupa fondot.compatto Easy wear 03	5586	Косметика (folder)/Косметика	18029	PUPA
2378837	8011607033546	Pupa fondot.compatto Easy wear 04	5586	Косметика (folder)/Косметика	18029	PUPA
2378838	8011607063864	Pupa fondot.compatto Easy wear 04a	5586	Косметика (folder)/Косметика	18029	PUPA
2378839	8011607094530	Pupa fondotinta antitraccia	5586	Косметика (folder)/Косметика	18029	PUPA
2378840	8011607030354	Pupa fondotinta Apple extract 04 fp	5586	Косметика (folder)/Косметика	18029	PUPA
2378841	8011607014484	Pupa fondotinta Crystal fluid 01 fp	5586	Косметика (folder)/Косметика	18029	PUPA
2378842	8011607014491	Pupa fondotinta Crystal fluid 02 fp	5586	Косметика (folder)/Косметика	18029	PUPA
2378843	8011607014507	Pupa fondotinta Crystal fluid 03 fp	5586	Косметика (folder)/Косметика	18029	PUPA
2378844	8011607014514	Pupa fondotinta Crystal fluid 04 fp	5586	Косметика (folder)/Косметика	18029	PUPA
2378845	8011607014538	Pupa fondotinta Crystal fluid 06 fp	5586	Косметика (folder)/Косметика	18029	PUPA
2378846	8011607018253	Pupa fondotinta Crystal fluid 2a fp	5586	Косметика (folder)/Косметика	18029	PUPA
2378847	8011607055357	Pupa fondotinta fluido Comfort 3	5586	Косметика (folder)/Косметика	18029	PUPA
2378848	8011607095544	Pupa fondotinta Mousse	5586	Косметика (folder)/Косметика	18029	PUPA
2378849	8011607069767	Pupa fondotinta Natural silk 30ml	5586	Косметика (folder)/Косметика	18029	PUPA
2378850	8011607011308	Pupa fondotinta no transfer 01 fp	5586	Косметика (folder)/Косметика	18029	PUPA
2378851	8011607011315	Pupa fondotinta no transfer 02 fp	5586	Косметика (folder)/Косметика	18029	PUPA
2378852	8011607046089	Pupa fondotinta no transfer 02 fp #2	5586	Косметика (folder)/Косметика	18029	PUPA
2378853	8011607011322	Pupa fondotinta no transfer 03 fp	5586	Косметика (folder)/Косметика	18029	PUPA
2378854	8011607046096	Pupa fondotinta no transfer 03 fp #2	5586	Косметика (folder)/Косметика	18029	PUPA
2378855	8011607030309	Pupa fondotinta no transfer 07 fp	5586	Косметика (folder)/Косметика	18029	PUPA
2378856	8011607046102	Pupa fondotinta no transfer 07 fp #2	5586	Косметика (folder)/Косметика	18029	PUPA
2378857	8011607030316	Pupa fondotinta no transfer 08 fp	5586	Косметика (folder)/Косметика	18029	PUPA
2378858	8011607046119	Pupa fondotinta no transfer 08 fp #2	5586	Косметика (folder)/Косметика	18029	PUPA
2378859	8011607092499	Pupa fondotinta solare abbr spf 4/6-15	5586	Косметика (folder)/Косметика	18029	PUPA
2378860	8011607047321	Pupa french manicure smalto bianco	5586	Косметика (folder)/Косметика	18029	PUPA
642608	8011607063550	Pupa girandola make up kit	5586	Косметика (folder)/Косметика	18029	PUPA
642609	8011607085040	Pupa glam pupart Flower	5586	Косметика (folder)/Косметика	18029	PUPA
2973135	8011607085064	Pupa glam pupart Flower #2	5586	Косметика (folder)/Косметика	18029	PUPA
2973136	8011607085057	Pupa glam pupart Flower #3	5586	Косметика (folder)/Косметика	18029	PUPA
2378861	8011607016020	Pupa glitter viso/corpo 03 topi Mini	5586	Косметика (folder)/Косметика	18029	PUPA
2378862	8011607126699	Pupa Gloss iridescent	5586	Косметика (folder)/Косметика	18029	PUPA
2378863	8011607103263	Pupa glossy tube 15ml	5586	Косметика (folder)/Косметика	18029	PUPA
2378864	8011607042777	Pupa Gold 24 karati foglia oro	5586	Косметика (folder)/Косметика	18029	PUPA
2378865	8011607048700	Pupa Gold creamy total illuminante	5586	Косметика (folder)/Косметика	18029	PUPA
2378866	8011607048588	Pupa Gold liner matita occhi/labbra	5586	Косметика (folder)/Косметика	18029	PUPA
2378867	8011607048793	Pupa Gold ombretto polvere di luce	5586	Косметика (folder)/Косметика	18029	PUPA
2378868	8011607048465	Pupa Gold ombretto Stick luminoso New	5586	Косметика (folder)/Косметика	18029	PUPA
2378869	8011607048724	Pupa Gold smalto lasting	5586	Косметика (folder)/Косметика	18029	PUPA
2378870	8011607048557	Pupa Gold splendor Extreme lucidalabbra	5586	Косметика (folder)/Косметика	18029	PUPA
2378871	8011607049912	Pupa Gold tattoo waterproof	5586	Косметика (folder)/Косметика	18029	PUPA
2378872	8011607066353	Pupa Gold/glittering Body spray 75 fp	5586	Косметика (folder)/Косметика	18029	PUPA
2378873	8011607065769	Pupa Gold/glittering double Gloss	5586	Косметика (folder)/Косметика	18029	PUPA
2378874	8011607066339	Pupa Gold/glittering Eye liner fp	5586	Косметика (folder)/Косметика	18029	PUPA
2378875	8011607065738	Pupa Gold/glittering ombretto Duo polver	5586	Косметика (folder)/Косметика	18029	PUPA
2663306	8011607231201	Pupa Golden infusion хайлайтер для лица тон 001 Золото	5586	Косметика (folder)/Косметика	18029	PUPA
2663307	8011607231218	Pupa Golden infusion хайлайтер для лица тон 002 бронза	5586	Косметика (folder)/Косметика	18029	PUPA
2378876	8011607044382	Pupa Golden Touch polvere viso/corpo 01a	5586	Косметика (folder)/Косметика	18029	PUPA
2378877	8011607079872	Pupa Happy colors ombretto fp	5586	Косметика (folder)/Косметика	18029	PUPA
221127	8011607012961	Pupa high-difinition mascara	2472	Косметика (folder)/Тушь для ресниц	18029	PUPA
2378901	8011607020065	Pupa illumin. pupelles Satin 02 fp	5586	Косметика (folder)/Косметика	18029	PUPA
2378902	8011607059119	Pupa illuminante creamy total luxe	5586	Косметика (folder)/Косметика	18029	PUPA
2378903	8011607051069	Pupa illuminante Gel glittering assortit	5586	Косметика (folder)/Косметика	18029	PUPA
2378904	8011607057047	Pupa illuminante glittering/Gold Powder	5586	Косметика (folder)/Косметика	18029	PUPA
2378905	8011607057085	Pupa illuminante glittering/Gold Touch	5586	Косметика (folder)/Косметика	18029	PUPA
2378906	8011607020058	Pupa illuminante pupelles Mini Satin 01	5586	Косметика (folder)/Косметика	18029	PUPA
2378907	8011607073757	Pupa illuminante viso metal enlighting f	5586	Косметика (folder)/Косметика	18029	PUPA
221128	8011607022007	Pupa intesifeier mascara 10ml 48	2472	Косметика (folder)/Тушь для ресниц	18029	PUPA
2378908	8011607040070	Pupa j coffret EDT30+latte100+bagno100	5586	Косметика (folder)/Косметика	18029	PUPA
2378909	8011607042494	Pupa j EDT 30ml vapo	5586	Косметика (folder)/Косметика	18029	PUPA
1105576	8011607044887	Pupa jeans creamy Shower Gel	401	Гигиена (folder)/Гель для душа	18029	PUPA
1105577	8011607044894	Pupa jeans creamy sprayable Body Lotion	486634	Косметика (folder)/Лосьон для тела	18029	PUPA
2378910	8011607017355	Pupa jolie bouquet 5 EDP 10ml	5586	Косметика (folder)/Косметика	18029	PUPA
2378911	8011607017379	Pupa jolie bouquet 9 EDP 10ml	5586	Косметика (folder)/Косметика	18029	PUPA
2378912	8011607051700	Pupa kit occhi labbra poetry fp	5586	Косметика (folder)/Косметика	18029	PUPA
2378913	8011607116997	Pupa kit occhi scintillanti	5586	Косметика (folder)/Косметика	18029	PUPA
2378914	8011607058747	Pupa kit occhi/labbra Color Extreme	5586	Косметика (folder)/Косметика	18029	PUPA
2378915	8011607055104	Pupa kit occhi/labbra Gold block	5586	Косметика (folder)/Косметика	18029	PUPA
642612	8011607045181	Pupa l ange de pupa	5586	Косметика (folder)/Косметика	18029	PUPA
2378916	8011607033416	Pupa l'azur/ le Rouge Mini coffret Duo	5586	Косметика (folder)/Косметика	18029	PUPA
642613	8011607029808	Pupa le favole di pupa	5586	Косметика (folder)/Косметика	18029	PUPA
2378924	8011607248469	Pupa like a doll loose Пудра расыпчатая т.007 роово-перламутровый	5586	Косметика (folder)/Косметика	18029	PUPA
2378918	8011607212149	Pupa like a doll Пудра компакт тон 02 телесный	5586	Косметика (folder)/Косметика	18029	PUPA
2378919	8011607212156	Pupa like a doll Пудра компакт тон 03 натуральный бежевый	5586	Косметика (folder)/Косметика	18029	PUPA
2378921	8011607248407	Pupa like a doll Пудра рассыпчатая тон 001 светло-бежевый матовый	5586	Косметика (folder)/Косметика	18029	PUPA
2378922	8011607248414	Pupa like a doll Пудра рассыпчатая тон 002 натуральный розовый матовый	5586	Косметика (folder)/Косметика	18029	PUPA
2378923	8011607248438	Pupa like a doll Пудра рассыпчатая тон 004 бежево-розовый матовый	5586	Косметика (folder)/Косметика	18029	PUPA
221129	8011607013586	Pupa Lip Care 4ml all	7943	Неклассифицированные/COSMETIC	18029	PUPA
2968328	8011607017164	Pupa Lip Care 4ml all #2	7943	Неклассифицированные/COSMETIC	18029	PUPA
221130	8011607015467	Pupa Lip pencil	7943	Неклассифицированные/COSMETIC	18029	PUPA
2378925	8011607065387	Pupa Lip Perfect Ultra reflex/splendor	5586	Косметика (folder)/Косметика	18029	PUPA
2378926	8011607090174	Pupa Lip perfection Crystal	5586	Косметика (folder)/Косметика	18029	PUPA
2378927	8011607084258	Pupa Lip&Eye make up remover 150ml	5586	Косметика (folder)/Косметика	18029	PUPA
1105578	8011607050024	Pupa Love Bath&Shower Gel 150ml	401	Гигиена (folder)/Гель для душа	18029	PUPA
1105579	8011607050031	Pupa Love Body Cream 90ml	1	Неклассифицированные/default	18029	PUPA
1105580	8011607050017	Pupa Love Body Lotion 150ml	486634	Косметика (folder)/Лосьон для тела	18029	PUPA
1105581	8011607050000	Pupa Love EDT 15ml	1039	Парфюмерия (folder)/Туалетная вода	18029	PUPA
1105582	8011607049998	Pupa Love EDT 30ml	1039	Парфюмерия (folder)/Туалетная вода	18029	PUPA
1105583	8011607057849	Pupa Love kit 15ml + Body Cream	1	Неклассифицированные/default	18029	PUPA
1105584	8011607057832	Pupa Love kit 15ml + Shower Gel	401	Гигиена (folder)/Гель для душа	18029	PUPA
1105585	8011607061532	Pupa Love kit 30ml + le Rouge mini'	1	Неклассифицированные/default	18029	PUPA
1105586	8011607050048	Pupa Love kit big	1	Неклассифицированные/default	18029	PUPA
642611	8011607050055	Pupa Love kit small	5586	Косметика (folder)/Косметика	18029	PUPA
642614	8011607076628	Pupa Love n colours make up kit	5586	Косметика (folder)/Косметика	18029	PUPA
2378928	8011607049226	Pupa lucidalabbra glittering ass.fp	5586	Косметика (folder)/Косметика	18029	PUPA
2378929	8011607063024	Pupa lucidalabbra Ice lolly Gloss fp	5586	Косметика (folder)/Косметика	18029	PUPA
2378930	8011607043576	Pupa lucidalabbra softness 2003 fp	5586	Косметика (folder)/Косметика	18029	PUPA
2378931	8011607068432	Pupa lucido metal Gloss fp	5586	Косметика (folder)/Косметика	18029	PUPA
2378932	8011607077014	Pupa luminous eyecolor ombretto	5586	Косметика (folder)/Косметика	18029	PUPA
2378933	8011607087952	Pupa luminous lipcolor lucidalabbra	5586	Косметика (folder)/Косметика	18029	PUPA
2378934	8011607088003	Pupa luminous Magic Powder	5586	Косметика (folder)/Косметика	18029	PUPA
2378935	8011607088027	Pupa luminous stars polvere	5586	Косметика (folder)/Косметика	18029	PUPA
1669111	8011607160976	Pupa luminys Touch иллюминатор для лица тон 01 слоновая кость	1	Неклассифицированные/default	18029	PUPA
1105588	8011607160983	Pupa luminys Touch иллюминатор для лица тон 02 песочный	961989	Косметика (folder)/Уход за лицом	18029	PUPA
2378936	8011607047178	Pupa mani base idratante unghie secche	5586	Косметика (folder)/Косметика	18029	PUPA
2378937	8011607047192	Pupa mani base levigante anti strie	5586	Косметика (folder)/Косметика	18029	PUPA
2378938	8011607047185	Pupa mani base rinforzante unghie deboli	5586	Косметика (folder)/Косметика	18029	PUPA
2378939	8011607047598	Pupa mani Gel esfoliante per pellicine	5586	Косметика (folder)/Косметика	18029	PUPA
2378940	8011607017324	Pupa marguerite EDP 40ml	5586	Косметика (folder)/Косметика	18029	PUPA
2378941	8011607122103	Pupa mascara diva's Color kit	5586	Косметика (folder)/Косметика	18029	PUPA
2378942	8011607130559	Pupa mascara diva's kit+Mini multiplay	5586	Косметика (folder)/Косметика	18029	PUPA
2378944	8011607017232	Pupa mascara flex up 01 astucciato fp	5586	Косметика (folder)/Косметика	18029	PUPA
2378945	8011607026449	Pupa mascara logup 01 superblack fp	5586	Косметика (folder)/Косметика	18029	PUPA
2378946	8011607115624	Pupa mascara Maxi volume diva's Color	5586	Косметика (folder)/Косметика	18029	PUPA
2378947	8011607058624	Pupa mascara senza astuccio	5586	Косметика (folder)/Косметика	18029	PUPA
2378949	8011607130566	Pupa mascara ultraflex kit+Mini multipla	5586	Косметика (folder)/Косметика	18029	PUPA
2378950	8011607085811	Pupa matita french manicure bianca	5586	Косметика (folder)/Косметика	18029	PUPA
2378951	8011607062317	Pupa matita labbra Gloss chic liner fp	5586	Косметика (folder)/Косметика	18029	PUPA
2378952	8011607026586	Pupa matita labbra true lips 01	5586	Косметика (folder)/Косметика	18029	PUPA
2378953	8011607026661	Pupa matita labbra true lips 09	5586	Косметика (folder)/Косметика	18029	PUPA
2378954	8011607026685	Pupa matita labbra true lips 11	5586	Косметика (folder)/Косметика	18029	PUPA
