ID	UPCEAN	Name	CategoryID	CategoryName	BrandID	BrandName
3439603	4607044610507	Напиток сокосодержащий аквадар лимонад газированный 2л пл/б	17371	Продукты питания (folder)/Напитки безалкогольные/Напитки	3777942	аквадар
3439604	4607044610538	Напиток сокосодержащий аквадар лимонад газированный 2л пл/б #2	17371	Продукты питания (folder)/Напитки безалкогольные/Напитки	3777942	аквадар
3439605	4607121694710	Напиток сокосодержащий Алтай облепиха-манго 0.5л ст/б	17371	Продукты питания (folder)/Напитки безалкогольные/Напитки	3617501	AVEO (ALSU/BARNAUL)
3439606	4607121694727	Напиток сокосодержащий Алтай облепиха-персик 0.5л ст/б	17371	Продукты питания (folder)/Напитки безалкогольные/Напитки	3617501	AVEO (ALSU/BARNAUL)
3439607	4607121694734	Напиток сокосодержащий Алтай облепихово-абрикосовый 0.5л ст/б	17371	Продукты питания (folder)/Напитки безалкогольные/Напитки	3617501	AVEO (ALSU/BARNAUL)
3439608	4607121694550	Напиток сокосодержащий Алтай облепихово-абрикосовый 750мл ст/б	17371	Продукты питания (folder)/Напитки безалкогольные/Напитки	3617501	AVEO (ALSU/BARNAUL)
3439609	4607121694703	Напиток сокосодержащий Алтай облепихово-яблочный 0.5л ст/б	17371	Продукты питания (folder)/Напитки безалкогольные/Напитки	3617501	AVEO (ALSU/BARNAUL)
3439425	4606547000235	Напиток сокосодержащий ананас sovlit 1.25	17371	Продукты питания (folder)/Напитки безалкогольные/Напитки	0	
3439426	4606547001065	Напиток сокосодержащий ананас sovlit 2л	17371	Продукты питания (folder)/Напитки безалкогольные/Напитки	3753728	SOVLIT (SOVLIT/G.SOVETSK)
3439610	4680011980094	Напиток сокосодержащий армада фруктовый осветленный грушевый 3л ст/б	17371	Продукты питания (folder)/Напитки безалкогольные/Напитки	0	
3439611	4680011980131	Напиток сокосодержащий армада фруктовый осветленный мультифруктовый 3л ст/б	17371	Продукты питания (folder)/Напитки безалкогольные/Напитки	0	
3439612	4612752312407	Напиток сокосодержащий баринофф меркурий мультифрукт с мякотью 3л с/б	17371	Продукты питания (folder)/Напитки безалкогольные/Напитки	3620022	Barinoff
3439613	4612752312506	Напиток сокосодержащий баринофф со вкусом винограда 3л	17371	Продукты питания (folder)/Напитки безалкогольные/Напитки	3620022	Barinoff
776123	4250271810037	Напиток сокосодержащий биоамазон из ягоды асаи 330мл	17371	Продукты питания (folder)/Напитки безалкогольные/Напитки	737648	Био Амазон
776122	4250271810013	Напиток сокосодержащий биоамазон оригинал из ягоды асаи 330мл	17371	Продукты питания (folder)/Напитки безалкогольные/Напитки	737648	Био Амазон
1268360	4820010890813	Напиток сокосодержащий биола ананас 0.5л	17371	Продукты питания (folder)/Напитки безалкогольные/Напитки	142943	Биола
143285	4820010890301	Напиток сокосодержащий биола апельсин 0.5л	17371	Продукты питания (folder)/Напитки безалкогольные/Напитки	142943	Биола
3439614	4601158021693	Напиток сокосодержащий бородино, мохито, клубничный, жб 0.5л	17371	Продукты питания (folder)/Напитки безалкогольные/Напитки	0	
3439615	4620006890397	Напиток сокосодержащий будьте здоровы! лесные ягоды 1.0л	17371	Продукты питания (folder)/Напитки безалкогольные/Напитки	0	
2902305	4607055566527	Напиток сокосодержащий варюша брусника и черника 0.5л пл/бут	1	Неклассифицированные/default	3788275	варюша (ALTAYSIBMED/Новосибирск)
3439616	4607055566534	Напиток сокосодержащий варюша вишня и шиповник 0.5л пл/бут	17371	Продукты питания (folder)/Напитки безалкогольные/Напитки	3788275	варюша (ALTAYSIBMED/Новосибирск)
3439617	4607055566541	Напиток сокосодержащий варюша клубника 0.5л пл/бут	17371	Продукты питания (folder)/Напитки безалкогольные/Напитки	3788275	варюша (ALTAYSIBMED/Новосибирск)
2902306	4605169208814	Напиток сокосодержащий веселый круг белый виноград газированный яблочно-виноградный 750мл ст/б	1	Неклассифицированные/default	0	
1686345	4605169208838	Напиток сокосодержащий веселый круг газированый яблочно-земляничный 750мл стбут	17371	Продукты питания (folder)/Напитки безалкогольные/Напитки	776143	Веселый Круг
1686344	4605169208821	Напиток сокосодержащий веселый круг груша-дюшес фруктовый газированный 750мл стбут	17371	Продукты питания (folder)/Напитки безалкогольные/Напитки	776143	Веселый Круг
2462303	460701705282	Напиток сокосодержащий вип чери-кола 1.000	17371	Продукты питания (folder)/Напитки безалкогольные/Напитки	0	
24506	4601201011367	Напиток сокосодержащий вита микс мультифруктовый 2л	17371	Продукты питания (folder)/Напитки безалкогольные/Напитки	0	
24507	4601201011374	Напиток сокосодержащий вита микс яблочно-ягодный 2л	17371	Продукты питания (folder)/Напитки безалкогольные/Напитки	0	
3439618	4607177080383	Напиток сокосодержащий витамикс апельсин персик негазированный 1л пл/бут	17371	Продукты питания (folder)/Напитки безалкогольные/Напитки	0	
3439619	4607177080246	Напиток сокосодержащий витамикс вишня негазированный 1л пл/бут	17371	Продукты питания (folder)/Напитки безалкогольные/Напитки	0	
3439620	4607177080260	Напиток сокосодержащий витамикс лесная ягода негазированный 1л пл/бут	17371	Продукты питания (folder)/Напитки безалкогольные/Напитки	0	
3439621	4607177080406	Напиток сокосодержащий витамикс мультифрукт негазированный 1л пл/бут	17371	Продукты питания (folder)/Напитки безалкогольные/Напитки	0	
3439622	4607177080222	Напиток сокосодержащий витамикс яблоко негазированный 1л пл/бут	17371	Продукты питания (folder)/Напитки безалкогольные/Напитки	0	
24688	4601201011398	Напиток сокосодержащий витамикс яблочно-клубничный осветл витамин 2.0л	17371	Продукты питания (folder)/Напитки безалкогольные/Напитки	691929	ВитаМикс
776157	4012982043308	Напиток сокосодержащий витахаус овощной кваш.кап.750мл с/б	17374	Продукты питания (folder)/Напитки безалкогольные/Сок	776154	Витахаус
3439623	4670024800571	Напиток сокосодержащий вишня детское питание 1л пл/бут	17371	Продукты питания (folder)/Напитки безалкогольные/Напитки	0	
2462495	4612752312483	Напиток сокосодержащий вишнёвый 3.000	17374	Продукты питания (folder)/Напитки безалкогольные/Сок	3620022	Barinoff
3439624	4607109824078	Напиток сокосодержащий вкусника абрикос персик яблоко tetrapak 0.2л	17371	Продукты питания (folder)/Напитки безалкогольные/Напитки	3770464	VKUSNIKA (BAKALEYA KOMPANIYA/SAMARA)
2744351	460710982308	Напиток сокосодержащий вкусника грушевый 1л	17374	Продукты питания (folder)/Напитки безалкогольные/Сок	0	
3439625	4607109823286	Напиток сокосодержащий вкусника мультифруктовый tetrapak 0.2л	17371	Продукты питания (folder)/Напитки безалкогольные/Напитки	3770464	VKUSNIKA (BAKALEYA KOMPANIYA/SAMARA)
2743780	4607109822876	Напиток сокосодержащий вкусника яблоко абрикос tetrapak 1л	17374	Продукты питания (folder)/Напитки безалкогольные/Сок	3770464	VKUSNIKA (BAKALEYA KOMPANIYA/SAMARA)
2744031	4607109822869	Напиток сокосодержащий вкусника яблочно-грушевый tetrapak 1л	17374	Продукты питания (folder)/Напитки безалкогольные/Сок	0	
3439626	4660028370347	Напиток сокосодержащий вкусносок абрикосовый 1л тв/уп	17371	Продукты питания (folder)/Напитки безалкогольные/Напитки	0	
3439627	4660028370378	Напиток сокосодержащий вкусносок апельсин 1л п/пак	17371	Продукты питания (folder)/Напитки безалкогольные/Напитки	0	
2902324	4660028370361	Напиток сокосодержащий вкусносок мультифрукт tetrapak 1л	1	Неклассифицированные/default	3770519	VKUSNOSOK (EXPRESS KUBAN/P.YABLONEVSKIY KRASNODAR)
3439628	4660028370453	Напиток сокосодержащий вкусносок мультифруктовый 0.2л тв/уп	17371	Продукты питания (folder)/Напитки безалкогольные/Напитки	3770519	VKUSNOSOK (EXPRESS KUBAN/P.YABLONEVSKIY KRASNODAR)
3439629	4660028370422	Напиток сокосодержащий вкусносок персиковый 0.2л тв/уп	17371	Продукты питания (folder)/Напитки безалкогольные/Напитки	0	
3439630	4660028370071	Напиток сокосодержащий вкусносок персиковый 3л ст/б	17371	Продукты питания (folder)/Напитки безалкогольные/Напитки	3770519	VKUSNOSOK (EXPRESS KUBAN/P.YABLONEVSKIY KRASNODAR)
3439631	4660028370231	Напиток сокосодержащий вкусносок тыквенный 3л ст/б	17371	Продукты питания (folder)/Напитки безалкогольные/Напитки	0	
3439632	4660028370446	Напиток сокосодержащий вкусносок яблоко вишня tetrapak 0.2л	17371	Продукты питания (folder)/Напитки безалкогольные/Напитки	0	
3439633	4660028370354	Напиток сокосодержащий вкусносок яблоко вишня tetrapak 1л	17371	Продукты питания (folder)/Напитки безалкогольные/Напитки	3770519	VKUSNOSOK (EXPRESS KUBAN/P.YABLONEVSKIY KRASNODAR)
3439634	4660028370323	Напиток сокосодержащий вкусносок яблочно-виноградный tetrapak 1л	17371	Продукты питания (folder)/Напитки безалкогольные/Напитки	3770519	VKUSNOSOK (EXPRESS KUBAN/P.YABLONEVSKIY KRASNODAR)
3439635	4660028370392	Напиток сокосодержащий вкусносок яблочный 0.2л тв/уп	17371	Продукты питания (folder)/Напитки безалкогольные/Напитки	3770519	VKUSNOSOK (EXPRESS KUBAN/P.YABLONEVSKIY KRASNODAR)
2902325	4660028370309	Напиток сокосодержащий вкусносок яблочный 1л тв/уп	1	Неклассифицированные/default	3770519	VKUSNOSOK (EXPRESS KUBAN/P.YABLONEVSKIY KRASNODAR)
3439636	4670002100815	Напиток сокосодержащий вкусы юга персиковый 0.2л	17371	Продукты питания (folder)/Напитки безалкогольные/Напитки	0	
24509	4810285002653	Напиток сокосодержащий все витамины грейпфрут/ананас/ябл 1.0	17371	Продукты питания (folder)/Напитки безалкогольные/Напитки	0	
24510	4810285003650	Напиток сокосодержащий все витамины ябл./анан./апел/мор.0.5л	17371	Продукты питания (folder)/Напитки безалкогольные/Напитки	0	
24511	4810285003681	Напиток сокосодержащий все витамины ябл./апел. 0.5 н/г	17371	Продукты питания (folder)/Напитки безалкогольные/Напитки	0	
24512	4810285003711	Напиток сокосодержащий все витамины ябл./перс. 0.5л	17371	Продукты питания (folder)/Напитки безалкогольные/Напитки	0	
24513	4810285003704	Напиток сокосодержащий все витамины ябл/персик 1.0 н/г	17371	Продукты питания (folder)/Напитки безалкогольные/Напитки	0	
24514	4810285004176	Напиток сокосодержащий все ябл./лимон 1.5	17371	Продукты питания (folder)/Напитки безалкогольные/Напитки	0	
2764162	4605169208807	Напиток сокосодержащий газ красный апельсин 750мл	17371	Продукты питания (folder)/Напитки безалкогольные/Напитки	0	
153013	4607017212936	Напиток сокосодержащий голд персик-яблоко 0.95л	17374	Продукты питания (folder)/Напитки безалкогольные/Сок	2757307	100% Gold
3439638	4607109243879	Напиток сокосодержащий грин брим, виноград 3л, ст/б	17371	Продукты питания (folder)/Напитки безалкогольные/Напитки	0	
3439639	4607109243930	Напиток сокосодержащий грин брим, груша яблоко 3л, ст/б	17371	Продукты питания (folder)/Напитки безалкогольные/Напитки	0	
3439640	4607109243978	Напиток сокосодержащий грин брим, персик, 3л, ст/б	17371	Продукты питания (folder)/Напитки безалкогольные/Напитки	0	
3439641	4620000903956	Напиток сокосодержащий гурмастер ананасовый tetrapak 1000мл	17371	Продукты питания (folder)/Напитки безалкогольные/Напитки	3668876	GURMASTER (MAYONEZNIY ZAVOD/BARNAUL)
3439642	4620000903932	Напиток сокосодержащий гурмастер апельсиновый tetrapak 1л	17371	Продукты питания (folder)/Напитки безалкогольные/Напитки	3668876	GURMASTER (MAYONEZNIY ZAVOD/BARNAUL)
3439643	4620000903949	Напиток сокосодержащий гурмастер мультифруктовы tetrapak 1000мл	17371	Продукты питания (folder)/Напитки безалкогольные/Напитки	3668876	GURMASTER (MAYONEZNIY ZAVOD/BARNAUL)
3439644	4620000903963	Напиток сокосодержащий гурмастер яблочный осветленый 1л	17371	Продукты питания (folder)/Напитки безалкогольные/Напитки	3668876	GURMASTER (MAYONEZNIY ZAVOD/BARNAUL)
3439645	4606976002107	Напиток сокосодержащий дарина со вкусом груши 2л	17371	Продукты питания (folder)/Напитки безалкогольные/Напитки	0	
2860308	4601248013652	Напиток сокосодержащий дары кубани 1.5л /яблочно-виноградный	1	Неклассифицированные/default	81886	Дары Кубани
3439646	4601248013256	Напиток сокосодержащий дары кубани вишневый, 0.2л, т/пак	17371	Продукты питания (folder)/Напитки безалкогольные/Напитки	3801174	дары кубани (YUZHNAYA SOKOVAYA KOMPANIYA/KRASNOD.KRAY)
2927937	4601248013300	Напиток сокосодержащий дары кубани мультифруктовый, tetrapak 1л	17374	Продукты питания (folder)/Напитки безалкогольные/Сок	3801174	дары кубани (YUZHNAYA SOKOVAYA KOMPANIYA/KRASNOD.KRAY)
3439647	4601248013324	Напиток сокосодержащий дары кубани яблоко виноград 0.95л, т/пак	17371	Продукты питания (folder)/Напитки безалкогольные/Напитки	3801174	дары кубани (YUZHNAYA SOKOVAYA KOMPANIYA/KRASNOD.KRAY)
2927940	4601248013294	Напиток сокосодержащий дары кубани яблоко вишня, 0.95л, т/пак	17374	Продукты питания (folder)/Напитки безалкогольные/Сок	3801174	дары кубани (YUZHNAYA SOKOVAYA KOMPANIYA/KRASNOD.KRAY)
2927941	4601248013317	Напиток сокосодержащий дары кубани яблоко персик, 0.95л, т/пак	17374	Продукты питания (folder)/Напитки безалкогольные/Сок	3801174	дары кубани (YUZHNAYA SOKOVAYA KOMPANIYA/KRASNOD.KRAY)
3439648	4601248013287	Напиток сокосодержащий дары кубани яблочно виноградный, 0.2л, т/пак	17371	Продукты питания (folder)/Напитки безалкогольные/Напитки	3801174	дары кубани (YUZHNAYA SOKOVAYA KOMPANIYA/KRASNOD.KRAY)
3439649	4607027991821	Напиток сокосодержащий демигут с молоком со вкусом груша-манго 1л пл/бут	17371	Продукты питания (folder)/Напитки безалкогольные/Напитки	3804524	Добрый кашалот (NACHPROD GK)
3439650	4660028371191	Напиток сокосодержащий дивный Сад ананасовый 200мл тв/уп	17371	Продукты питания (folder)/Напитки безалкогольные/Напитки	0	
3439651	4660028371207	Напиток сокосодержащий дивный Сад апельсин 0.2л т/у	17371	Продукты питания (folder)/Напитки безалкогольные/Напитки	0	
3439652	4660028371177	Напиток сокосодержащий дивный Сад апельсин 1л т/у	17371	Продукты питания (folder)/Напитки безалкогольные/Напитки	0	
3439653	4660028371221	Напиток сокосодержащий дивный Сад персик 0.2л т/у	17371	Продукты питания (folder)/Напитки безалкогольные/Напитки	0	
1268650	4607174577343	Напиток сокосодержащий добрый pulpy апельсин 0.9л пл/бут	17374	Продукты питания (folder)/Напитки безалкогольные/Сок	86343	Добрый
2462338	4607174574922	Напиток сокосодержащий добрый pulpy грейпфрут 0.9л пл/бут	17374	Продукты питания (folder)/Напитки безалкогольные/Сок	86343	Добрый
2757352	4607174575004	Напиток сокосодержащий добрый клюква апельсин корица 1л пл/бут	2952748	Продукты питания (folder)/Напитки безалкогольные/Морс	86343	Добрый
3439654	4607174575042	Напиток сокосодержащий добрый клюква апельсин корица 1л пл/бут #2	17371	Продукты питания (folder)/Напитки безалкогольные/Напитки	0	
3439655	4680018330014	Напиток сокосодержащий Добрыня апельсин 0.95л т/п	17371	Продукты питания (folder)/Напитки безалкогольные/Напитки	3804595	Добрыня AMURSKIY (ZOLOTOY YUG/KHABAROVSK)
3439656	4680018330052	Напиток сокосодержащий Добрыня персик 0.95л т/п	17371	Продукты питания (folder)/Напитки безалкогольные/Напитки	3804595	Добрыня AMURSKIY (ZOLOTOY YUG/KHABAROVSK)
3439657	4680018330038	Напиток сокосодержащий Добрыня яблоко 0.95л т/п	17371	Продукты питания (folder)/Напитки безалкогольные/Напитки	3804595	Добрыня AMURSKIY (ZOLOTOY YUG/KHABAROVSK)
3439658	4607006034211	Напиток сокосодержащий Долина свежести виноград яблоко tetrapak 0.2л	17371	Продукты питания (folder)/Напитки безалкогольные/Напитки	0	
3439659	4607006034198	Напиток сокосодержащий Долина свежести виноград яблоко tetrapak 1л	17371	Продукты питания (folder)/Напитки безалкогольные/Напитки	0	
3439660	4607006034204	Напиток сокосодержащий Долина свежести вишня tetrapak 1л	17371	Продукты питания (folder)/Напитки безалкогольные/Напитки	0	
3439661	4620000600572	Напиток сокосодержащий донской привоз виноградный 3л ст/б	17371	Продукты питания (folder)/Напитки безалкогольные/Напитки	3890695	Радуга (DONSKOY PRIVOZ KHOLDING)
3439662	4620000600459	Напиток сокосодержащий донской привоз яблоко 3л ст/б	17371	Продукты питания (folder)/Напитки безалкогольные/Напитки	3890695	Радуга (DONSKOY PRIVOZ KHOLDING)
3439663	4620000600541	Напиток сокосодержащий донской привоз яблоко вишня 3л ст/б	17371	Продукты питания (folder)/Напитки безалкогольные/Напитки	3890695	Радуга (DONSKOY PRIVOZ KHOLDING)
1336409	8801128542388	Напиток сокосодержащий доширак Fruit4u апельсин 238мл	17371	Продукты питания (folder)/Напитки безалкогольные/Напитки	3661306	FRUIT 4U
1336410	8801128542401	Напиток сокосодержащий доширак Fruit4u виноград 238мл	17371	Продукты питания (folder)/Напитки безалкогольные/Напитки	3661306	FRUIT 4U
1686383	4820138680051	Напиток сокосодержащий живой сок 100% яблоко вишня 250мл	17371	Продукты питания (folder)/Напитки безалкогольные/Напитки	1686380	Др.Савински
3439664	4820138680044	Напиток сокосодержащий живой сок 100% яблоко/бузина 250мл	17371	Продукты питания (folder)/Напитки безалкогольные/Напитки	0	
3439665	4610008503296	Напиток сокосодержащий зеленое ранчо лесная ягода 0.93л пл/б	17371	Продукты питания (folder)/Напитки безалкогольные/Напитки	0	
3439666	4610008502114	Напиток сокосодержащий зеленое ранчо мультифруктовый 3л ст/б	17371	Продукты питания (folder)/Напитки безалкогольные/Напитки	0	
