ID	UPCEAN	Name	CategoryID	CategoryName	BrandID	BrandName
1619123	9770307268854	Sun #5	1366305	Полиграфия (folder)/News & Mags Unit	0	
1619124	9770307268960	Sun #6	1366305	Полиграфия (folder)/News & Mags Unit	0	
2206790	3601690092114	Sun #7	1	Неклассифицированные/default	656540	SUN
2206791	4008601002047	Sun #8	1	Неклассифицированные/default	656540	SUN
2206792	8711600589254	Sun #9	1	Неклассифицированные/default	656540	SUN
2688547	5032044502405	Sun + fun - CD plan50040	2275105	Медиа (folder)/Медиа	0	
3219269	708820948785	Sun - dried raisins	330591	Продукты питания (folder)/Продукты питания	2564409	Meijer
3219270	708820948792	Sun - dried raisins #2	330591	Продукты питания (folder)/Продукты питания	2564409	Meijer
1619125	028018000027	Sun - ni american string Cheese pasteurized whole Milk, vinegar, enzymes, Black nigella seeds, salt. 9091	1	Неклассифицированные/default	2688872	Sun-ni
1619126	028018000409	Sun - ni smoked string Cheese	1	Неклассифицированные/default	0	
656537	072613011421	Sun 2x liq mountain 6/78oz	1	Неклассифицированные/default	0	
656538	072613011445	Sun 2x liq vanilla Lavender 6/78oz	1	Неклассифицированные/default	0	
656539	072613011483	Sun 2x liq with fs cuddle Soft 6/78oz	1	Неклассифицированные/default	0	
2837837	072613459865	Sun 2x mixed Half pallet 45.4oz	1	Неклассифицированные/default	0	
1619127	072613708147	Sun 2x Original softner 24ld !	1	Неклассифицированные/default	0	
2837839	4660018602229	Sun active эколла-био спрей для безопасного загара 120мл spf20	1	Неклассифицированные/default	0	
2837840	4660018602236	Sun active эколла-био спрей для безопасного загара 120мл spf30	1	Неклассифицированные/default	0	
2398855	728315007797	Sun after Sun Gel, 4.22oz, borlind of germany	1	Неклассифицированные/default	2281789	Borlind of Germany
1619129	8711600942103	Sun all in One Gel prot lem 480ml	1	Неклассифицированные/default	656540	SUN
1619130	8711600941922	Sun all in One Gel prot regulier 480ml	1	Неклассифицированные/default	656540	SUN
2688548	028367842002	Sun all mineral 4vrty flr 36pcs	1	Неклассифицированные/default	302242	Kiss My Face
1619131	8718114382760	Sun all-in-1 Magic Shine 28st	1	Неклассифицированные/default	656540	SUN
3757060	4605922014621	Sun all-in1 Lemon ds 56tbltx 18g 1.008kg k	181424	Хозяйственные товары (folder)/Бытовая химия (folder)/Средство для посудомоечных машин	3757059	SUN (UNILEVER)
2398856	728315007735	Sun anti-aging Cream spf30 sunscreen, 2.53oz, borlind of germany	1	Неклассифицированные/default	2281789	Borlind of Germany
1619132	617104223411	Sun Aqua Fresh basil	1	Неклассифицированные/default	0	
2837841	072613710454	Sun auto dish pacs citrus 20 ct	1	Неклассифицированные/default	0	
2837842	072613160228	Sun auto dish Powder 20oz	1	Неклассифицированные/default	0	
2398857	4806500800111	Sun Baby diaper small	1	Неклассифицированные/default	0	
2398858	4806500800319	Sun Baby diapers large	1	Неклассифицированные/default	0	
2398859	4806500800210	Sun Baby diapers medium	1	Неклассифицированные/default	0	
2398860	4806500800418	Sun Baby diapers xlarge	1	Неклассифицированные/default	0	
1619133	717477543236	Sun beauty microwavable sweet potatoes	1	Неклассифицированные/default	0	
1923616	081899401017	Sun believable Black corinth grapes 1lb	1	Неклассифицированные/default	2398861	Sun Believable
656543	6253501340043	Sun Bell Light meat tuna 170g	1	Неклассифицированные/default	0	
2688549	761635202008	Sun belle blackberries 12oz	2058983	Продукты питания (folder)/Fruits and Vegetables	2398862	Sun Belle
2688550	761635202107	Sun belle blackberries 18oz	2058983	Продукты питания (folder)/Fruits and Vegetables	2398862	Sun Belle
2688551	761635202305	Sun belle blackberries 5.6oz	2058983	Продукты питания (folder)/Fruits and Vegetables	2398862	Sun Belle
2398923	761635202602	Sun belle blackberries 6oz	2058983	Продукты питания (folder)/Fruits and Vegetables	2398922	SunBelle
2688552	761635203609	Sun belle blueberries 1 pint	2058983	Продукты питания (folder)/Fruits and Vegetables	2398862	Sun Belle
2688553	761635203005	Sun belle blueberries 18oz	2058983	Продукты питания (folder)/Fruits and Vegetables	2398862	Sun Belle
2688554	761635203159	Sun belle blueberries 18oz #2	2058983	Продукты питания (folder)/Fruits and Vegetables	2398862	Sun Belle
2688555	761635203708	Sun belle blueberries 24oz	2058983	Продукты питания (folder)/Fruits and Vegetables	2398862	Sun Belle
2688556	761635203807	Sun belle blueberries 32oz	2058983	Продукты питания (folder)/Fruits and Vegetables	2398862	Sun Belle
2688557	761635203401	Sun belle blueberries 4.4oz	2058983	Продукты питания (folder)/Fruits and Vegetables	2398862	Sun Belle
2688558	761635203302	Sun belle blueberries 6oz	2058983	Продукты питания (folder)/Fruits and Vegetables	2398862	Sun Belle
2398924	761635103008	Sun belle Cherry tomatoes 1ctr	2058983	Продукты питания (folder)/Fruits and Vegetables	2398922	SunBelle
2688559	761635160001	Sun belle cucumbers Hot house Long English each	2058983	Продукты питания (folder)/Fruits and Vegetables	2398862	Sun Belle
2688560	761635204200	Sun belle currants Red 6oz	2058983	Продукты питания (folder)/Fruits and Vegetables	2398862	Sun Belle
2688561	761635202404	Sun belle Organic blackberries 6oz	2058983	Продукты питания (folder)/Fruits and Vegetables	2398862	Sun Belle
2688562	761635203951	Sun belle Organic blueberries 6oz	2058983	Продукты питания (folder)/Fruits and Vegetables	2398862	Sun Belle
2688563	761635201100	Sun belle raspberries Red 6oz	2058983	Продукты питания (folder)/Fruits and Vegetables	2398862	Sun Belle
2688564	761635201209	Sun belle raspberries Red 6oz #2	2058983	Продукты питания (folder)/Fruits and Vegetables	2398862	Sun Belle
2688565	761635201605	Sun belle raspberries Red 6oz #3	2058983	Продукты питания (folder)/Fruits and Vegetables	2398862	Sun Belle
2688566	761635205009	Sun belle strawberries 16oz	2058983	Продукты питания (folder)/Fruits and Vegetables	2398862	Sun Belle
2398863	761635101004	Sun belle tomatoes Hot house 4 count bag	2058983	Продукты питания (folder)/Fruits and Vegetables	2398862	Sun Belle
1619134	761934012254	Sun bird jasmine Rice 10kg	23967	Продукты питания (folder)/Рис	0	
1619135	761934012117	Sun bird jasmine Rice 5kg	23967	Продукты питания (folder)/Рис	0	
1619136	072613730315	Sun bleach detergent	1	Неклассифицированные/default	0	
1619137	6165858300079	Sun block-uva&uvb protector spf-5	1	Неклассифицированные/default	0	
656546	072538000159	Sun brand chutney major greys mango	1	Неклассифицированные/default	2688567	Sun Brand
656544	072538000098	Sun brand chutney, Peach	1	Неклассифицированные/default	0	
656545	072538000104	Sun brand cranberry chutne	1	Неклассифицированные/default	0	
656547	072538000043	Sun brand mj grey mangochu	1	Неклассифицированные/default	0	
2688568	072538000074	Sun brand Original major grey's mango chutney	1	Неклассифицированные/default	2688567	Sun Brand
656666	072538000050	Sun brand seasoning curry Powder	1	Неклассифицированные/default	2688567	Sun Brand
3219271	072538000081	Sun brand, tandoori Power	330591	Продукты питания (folder)/Продукты питания	0	
1144197	078905455607	Sun bskt bndbles	1	Неклассифицированные/default	0	
1144198	078905253609	Sun bunny basket	1	Неклассифицированные/default	0	
1144199	078905337200	Sun bunny egg holder	1	Неклассифицированные/default	0	
1144200	078905387601	Sun bunny eggs	1	Неклассифицированные/default	0	
1619138	7942130002307	Sun burger bbq 8oz	1	Неклассифицированные/default	0	
1619139	782758800025	Sun burger portabella 10oz	1	Неклассифицированные/default	0	
2206809	072613012138	Sun burst Tropical 75loads	1	Неклассифицированные/default	0	
1144201	072613011414	Sun burst ult lq w/blch 78oz 6	1	Неклассифицированные/default	0	
3219272	853009004414	Sun Butter&jelly protein bar	330591	Продукты питания (folder)/Продукты питания	0	
3757061	030768017217	Sun c 1000mg 100's sundown	1	Неклассифицированные/default	0	
1619140	4800592070308	Sun call card ctu 100	1394138	E-Pay	0	
1619141	4800592081397	Sun call card ctu 150	1394138	E-Pay	0	
1619142	4800592070117	Sun call card ctu 350	1394138	E-Pay	0	
1619143	4800592081403	Sun call card ctu 450	1394138	E-Pay	0	
1619144	4800592081410	Sun call card dctu 100	1394138	E-Pay	0	
1619145	4800592070414	Sun call card tu 150	1394138	E-Pay	0	
1619146	4800592070407	Sun call card tu 50	1394138	E-Pay	0	
1944856	4800607100167	Sun card 24/7 call&text p100/1	1	Неклассифицированные/default	0	
1944857	4800607100303	Sun card 24/7 call&text p150/1	1	Неклассифицированные/default	0	
1944858	4800607100839	Sun card 24/7 txt unli p200/1	1	Неклассифицированные/default	0	
1944859	4800607100228	Sun card 24/7 txt unlmtd p50/1	1	Неклассифицированные/default	0	
1944860	4800607100174	Sun card 24/7 txt unlmtdp150/1	1	Неклассифицированные/default	0	
1944861	4800607100020	Sun card p150/1	1	Неклассифицированные/default	0	
1944862	4800607100136	Sun card p50/1	1	Неклассифицированные/default	0	
1944863	4800607100396	Sun card todo tawagidd p100/1	1	Неклассифицированные/default	0	
1944864	4800607100389	Sun card todo tawagidd p50/1	1	Неклассифицированные/default	0	
656548	6866551396641	Sun Care monella Sun Lotion 60ml	1	Неклассифицированные/default	0	
2398864	4800607200812	Sun cellular prepaid sim	1	Неклассифицированные/default	0	
1144202	078905524402	Sun chalk eggs	1	Неклассифицированные/default	0	
1619147	748144308001	Sun charmers	1	Неклассифицированные/default	0	
1144203	060410005941	Sun chips	1	Неклассифицированные/default	0	
1144204	060410007259	Sun chips #2	1	Неклассифицированные/default	0	
1144205	060410017166	Sun chips #3	1	Неклассифицированные/default	0	
1144206	060410022788	Sun chips #4	1	Неклассифицированные/default	0	
1144207	060410023013	Sun chips #5	1	Неклассифицированные/default	0	
1144208	060410039441	Sun chips #6	1	Неклассифицированные/default	0	
1144209	060410039458	Sun chips #7	1	Неклассифицированные/default	0	
1144210	060410039465	Sun chips #8	1	Неклассифицированные/default	0	
656688	028400034746	Sun chips #9	1	Неклассифицированные/default	0	
2688569	028400006903	Sun chips 6 grain medley creamy roasted garlic chips	1	Неклассифицированные/default	2680955	Sun Chips
2688570	028400039635	Sun chips 6 grain medley parmesan&herb chips	1	Неклассифицированные/default	2680955	Sun Chips
1609174	028400040846	Sun chips chdr 3oz	1	Неклассифицированные/default	2680955	Sun Chips
1609175	028400040884	Sun chips chdr 3oz #2	1	Неклассифицированные/default	2680955	Sun Chips
1144211	060410033593	Sun chips cheddar	1	Неклассифицированные/default	0	
1619513	028400157360	Sun chips cheddar 3.2	1	Неклассифицированные/default	2680955	Sun Chips
1942852	028400017404	Sun chips chip fr onion 6.5oz/8	1	Неклассифицированные/default	2680955	Sun Chips
1942854	028400065979	Sun chips chip Garden slsa 6.5oz/8	1	Неклассифицированные/default	2680955	Sun Chips
1144212	060410022580	Sun chips fnrch on	1	Неклассифицированные/default	0	
1609176	028400020114	Sun chips fr oni 3oz	1	Неклассифицированные/default	2680955	Sun Chips
1144213	060410033609	Sun chips fr/onion	1	Неклассифицированные/default	0	
1609417	028400079006	Sun chips frchon 2oz	1	Неклассифицированные/default	2680955	Sun Chips
1619148	028400021425	Sun chips french onio	1	Неклассифицированные/default	2680955	Sun Chips
2688571	028400152242	Sun chips french onion	1	Неклассифицированные/default	2680955	Sun Chips
2837883	028400412315	Sun chips french onion #2	1	Неклассифицированные/default	0	
2688572	028400162173	Sun chips french onion multigrain snacks	1	Неклассифицированные/default	2680955	Sun Chips
1609416	028400097529	Sun chips french onion multigrain snacks 2 ounces	1	Неклассифицированные/default	2680955	Sun Chips
1609418	028400018173	Sun chips frnc	1	Неклассифицированные/default	2680955	Sun Chips
1609419	028400029445	Sun chips frnc #2	1	Неклассифицированные/default	2680955	Sun Chips
1619150	028400021418	Sun chips har ched	1	Неклассифицированные/default	2680955	Sun Chips
1619149	028400048385	Sun chips harvest che	1	Неклассифицированные/default	2680955	Sun Chips
3757062	028400036924	Sun chips harvest cheddar 3.25oz	1	Неклассифицированные/default	0	
2688709	028400234405	Sun chips harvest Mini bites four Cheese tomato&herb - 5ct	1	Неклассифицированные/default	2680955	Sun Chips
2688710	028400234634	Sun chips harvest Mini bites Spring veggie medley 5ct	1	Неклассифицированные/default	2680955	Sun Chips
1609177	028400079013	Sun chips hrvchdr	1	Неклассифицированные/default	2680955	Sun Chips
1609420	028400021050	Sun chips hrve	1	Неклассифицированные/default	2680955	Sun Chips
1472080	028400012652	Sun chips multigrain snack - french onion	1	Неклассифицированные/default	2680955	Sun Chips
1415460	028400012669	Sun chips multigrain snack - harvest cheddar	1	Неклассифицированные/default	2680955	Sun Chips
1619151	028400068482	Sun chips multigrain snack - harvest cheddar #2	1	Неклассифицированные/default	2680955	Sun Chips
1619152	028400068420	Sun chips multigrain snack - Original	1	Неклассифицированные/default	2680955	Sun Chips
1619153	028400053525	Sun chips multigrain snacks - 100 calorie harvest cheddar	1	Неклассифицированные/default	2680955	Sun Chips
1619154	028400065375	Sun chips multigrain snacks - Apple n caramel	1	Неклассифицированные/default	2680955	Sun Chips
1619155	028400065313	Sun chips multigrain snacks - cinnamon	1	Неклассифицированные/default	2680955	Sun Chips
1619156	028400065634	Sun chips multigrain snacks - cinnamon #2	1	Неклассифицированные/default	2680955	Sun Chips
656549	028400061636	Sun chips multigrain snacks - cinnamon #3	1	Неклассифицированные/default	2680955	Sun Chips
1419443	028400064996	Sun chips multigrain snacks - cinnamon flavor	1	Неклассифицированные/default	2680955	Sun Chips
1415478	028400048286	Sun chips multigrain snacks - french onion	1	Неклассифицированные/default	2680955	Sun Chips
1619157	028400064972	Sun chips multigrain snacks - french onion #2	1	Неклассифицированные/default	2680955	Sun Chips
1619158	028400066631	Sun chips multigrain snacks - french onion #3	1	Неклассифицированные/default	2680955	Sun Chips
1619159	028400073615	Sun chips multigrain snacks - french onion #4	1	Неклассифицированные/default	2680955	Sun Chips
1362935	028400048378	Sun chips multigrain snacks - french onion flavored	1	Неклассифицированные/default	2680955	Sun Chips
1483157	028400048019	Sun chips multigrain snacks - Garden salsa	1	Неклассифицированные/default	2680955	Sun Chips
1619160	028400048064	Sun chips multigrain snacks - Garden salsa #2	1	Неклассифицированные/default	2680955	Sun Chips
1619161	028400073639	Sun chips multigrain snacks - Garden salsa #3	1	Неклассифицированные/default	2680955	Sun Chips
1415477	028400064989	Sun chips multigrain snacks - harvest cheddar	1	Неклассифицированные/default	2680955	Sun Chips
1619162	028400048330	Sun chips multigrain snacks - harvest cheddar #2	1	Неклассифицированные/default	2680955	Sun Chips
1619163	028400073622	Sun chips multigrain snacks - harvest cheddar #3	1	Неклассифицированные/default	2680955	Sun Chips
1415479	028400048293	Sun chips multigrain snacks - harvest cheddar flavor	1	Неклассифицированные/default	2680955	Sun Chips
1619164	028400067645	Sun chips multigrain snacks - harvest cheddar singles	1	Неклассифицированные/default	2680955	Sun Chips
1619165	028400065320	Sun chips multigrain snacks - Honey graham	1	Неклассифицированные/default	2680955	Sun Chips
1619166	028400048309	Sun chips multigrain snacks - Original	1	Неклассифицированные/default	2680955	Sun Chips
1619169	028400058919	Sun chips multigrain snacks - Original whole corn, sunflower Oil, whole Wheat, Rice flour, whole oat flour, sugar, and salt. #2	1	Неклассифицированные/default	2680955	Sun Chips
1619167	028400051651	Sun chips multigrain snacks - Original whole corn, sunflower Oil, whole Wheat, Rice flour, whole oat flour, sugar, and salt. 15	1	Неклассифицированные/default	2680955	Sun Chips
1619168	028400073257	Sun chips multigrain snacks - Original whole corn, sunflower Oil, whole Wheat, Rice flour, whole oat flour, sugar, and salt. 51	1	Неклассифицированные/default	2680955	Sun Chips
1587886	028400048361	Sun chips multigrain snacks - Original whole corn, sunflower Oil, whole Wheat, Rice flour, whole pat flour, sugar, and salt. 15	1	Неклассифицированные/default	2680955	Sun Chips
1619170	028400056403	Sun chips multigrain snacks - variety	1	Неклассифицированные/default	2680955	Sun Chips
1619514	028400073578	Sun chips multigrain snacks Original	1	Неклассифицированные/default	2680955	Sun Chips
1609421	028400018166	Sun chips orgi	1	Неклассифицированные/default	2680955	Sun Chips
1619171	028400021432	Sun chips Original	1	Неклассифицированные/default	2680955	Sun Chips
2688575	028400147415	Sun chips Original #2	1	Неклассифицированные/default	2680955	Sun Chips
1619515	028400444255	Sun chips Original lss 1.5z !	1	Неклассифицированные/default	2680955	Sun Chips
1587885	028400012645	Sun chips snack	1	Неклассифицированные/default	2680955	Sun Chips
2688576	028400149686	Sun chips sweet&spicy bbq	1	Неклассифицированные/default	2680955	Sun Chips
2688577	028400194808	Sun chips sweet&spicy bbq #2	1	Неклассифицированные/default	2680955	Sun Chips
1144214	029918024113	Sun chlor-Sun eleuthero tea 25 bags	1	Неклассифицированные/default	0	
1619173	029918012516	Sun chlorella a granules - 100 packets	1	Неклассифицированные/default	2688578	Sun Chlorella
1619172	029918012110	Sun chlorella a granules - 20 individually wrapped packs	1	Неклассифицированные/default	2688578	Sun Chlorella
656550	029918011519	Sun chlorella a tablets - 200mg - 1500 tablets	1	Неклассифицированные/default	2688578	Sun Chlorella
656551	029918011113	Sun chlorella a tablets - 200mg - 300 tablets	1	Неклассифицированные/default	2688578	Sun Chlorella
306179	029918015111	Sun chlorella a tablets - 500mg - 120 tablets	297057	Лекарственные средства (folder)/Health & Personal Care	306178	Sun Chlorella Products
2688579	029918015128	Sun chlorella a tablets - 500mg - 600 tablets	1	Неклассифицированные/default	2688578	Sun Chlorella
2688580	029918013131	Sun chlorella chlorella Sun wakasa Gold - 17floz	1	Неклассифицированные/default	2688578	Sun Chlorella
2837844	029918013971	Sun chlorella products Organic Sun eleuthero 1200 tab	1	Неклассифицированные/default	0	
2837845	029918013964	Sun chlorella products Organic Sun eleuthero 240 tab	1	Неклассифицированные/default	0	
2837846	029918000070	Sun chlorella products Sun chlorella Powder 30 individual packets 30pcs	1	Неклассифицированные/default	0	
2688581	029918034105	Sun chlorella rejuv-a-wafers superfood supplement for dogs and cats - 60 wafers	1	Неклассифицированные/default	2688578	Sun Chlorella
2688582	029918014169	Sun chlorella Skin Cream - 1.58oz	1	Неклассифицированные/default	2688578	Sun Chlorella
2688583	029918013155	Sun chlorella Sun wakasa Honey Plus - 17oz	1	Неклассифицированные/default	2688578	Sun Chlorella
2688584	029918021518	Sun chlorella Wild Sun eleuthero - 200mg - 1500 tablets	1	Неклассифицированные/default	2688578	Sun Chlorella
2688585	029918021112	Sun chlorella Wild Sun eleuthero - 200mg - 300 tablets	1	Неклассифицированные/default	2688578	Sun Chlorella
2688586	029918023222	Sun chlorella Wild Sun eleuthero extract drink - 33.3oz	1	Неклассифицированные/default	2688578	Sun Chlorella
202556	077241920466	Sun choc Earth balls ft 5oz	22145	Продукты питания (folder)/Кондитерские изделия (folder)/Конфеты	0	
2398865	9556350388257	Sun city King longan in syrup 565g	1	Неклассифицированные/default	0	
1144215	078905186402	Sun cl mcky/frends	1	Неклассифицированные/default	0	
2206811	1002429180294	Sun cl vato asst #80294 12.99 pk 6	1	Неклассифицированные/default	0	
1144216	078905388707	Sun clr kt dalm	1	Неклассифицированные/default	0	
1144217	078905560301	Sun clr wndr web	1	Неклассифицированные/default	0	
1144218	078905560400	Sun clr wndr web #2	1	Неклассифицированные/default	0	
1144219	078905560608	Sun clr wndr web #3	1	Неклассифицированные/default	0	
1619174	030000070802	Sun cntry quick oats	1	Неклассифицированные/default	0	
2688588	793573659675	Sun coffee roasters Cafe decaf freshly roasted coffee	1	Неклассифицированные/default	2688587	Sun Coffee Roasters
2688589	793573659712	Sun coffee roasters french roast freshly roasted coffee	1	Неклассифицированные/default	2688587	Sun Coffee Roasters
2688590	793573659699	Sun coffee roasters heavenly hazelnut freshly roasted coffee	1	Неклассифицированные/default	2688587	Sun Coffee Roasters
2688591	793573659750	Sun coffee roasters nicaraguan freshly roasted coffee	1	Неклассифицированные/default	2688587	Sun Coffee Roasters
2688592	793573659729	Sun coffee roasters peruvian freshly roasted coffee	1	Неклассифицированные/default	2688587	Sun Coffee Roasters
2688593	793573659774	Sun coffee roasters sumatran freshly roasted coffee	1	Неклассифицированные/default	2688587	Sun Coffee Roasters
2688594	793573659682	Sun coffee roasters vanilla nut freshly roasted coffee	1	Неклассифицированные/default	2688587	Sun Coffee Roasters
1144220	078905536108	Sun Color kit	1	Неклассифицированные/default	0	
1144221	078905536306	Sun Color kit #2	1	Неклассифицированные/default	0	
1144222	078905521104	Sun colour kit	1	Неклассифицированные/default	0	
1144223	078905450701	Sun colour kt sesm	1	Неклассифицированные/default	0	
2688596	818158015001	Sun country toasted Wheat germ	1	Неклассифицированные/default	2688595	Sun Country
1944865	4800607100198	Sun crd 24/7 c&t unli100/1	1	Неклассифицированные/default	0	
1144224	078905461004	Sun crinkled paper	1	Неклассифицированные/default	0	
1144225	078905466108	Sun crshng wtch	1	Неклассифицированные/default	0	
1619175	072613730339	Sun cuddle fab softe	1	Неклассифицированные/default	0	
2206812	895444001474	Sun cups caramel cups 0.75oz nogmo	2020974	Продукты питания (folder)/Кондитерские изделия (folder)/Candy, Chocolate & Sweeteners	656553	SUN CUPS
1619180	895444001436	Sun cups carmel cups Milk chocolate - 2 ct	1	Неклассифицированные/default	656553	SUN CUPS
656554	895444001832	Sun cups choc cup Dark mint 1.5oz	1	Неклассифицированные/default	656553	SUN CUPS
