ID	UPCEAN	Name	CategoryID	CategoryName	BrandID	BrandName
2864133	4812501044959	Игровой набор вылечи питомца 122	1	Неклассифицированные/default	0	
464419	4895136008107	Игровой набор гараж bondibon стиль города Box, с аксессуарами и 3 металл машинками, арт. 2113	439741	Игрушки (folder)/Детали игровой сценической обстановки	439738	Bondibon
1213496	4895136008138	Игровой набор гараж bondibon стиль города Box, с аксессуарами и 3 металл машинками, арт. 9913в	713265	Игрушки (folder)/Игровой набор	439738	Bondibon
1213497	4602010243994	Игровой набор гараж Box 40x31 x 7см, арт. р1588.p1588	713265	Игрушки (folder)/Игровой набор	0	
464420	4602010072617	Игровой набор гараж многоуровн. 6929	439741	Игрушки (folder)/Детали игровой сценической обстановки	0	
89339	4892493102080	Игровой набор голодный пеликан ка208	713265	Игрушки (folder)/Игровой набор	0	
1213498	4602010264234	Игровой набор гольф 41см (3клюшки,3мяча, лунка), арт.022-114	713265	Игрушки (folder)/Игровой набор	0	
713340	4602010264012	Игровой набор гольф pvc 80см (клюшка,2мяча, лунка) арт.17012/1-3	278582	Спорт и отдых (folder)/Спорт и отдых	0	
713341	4602010263916	Игровой набор гольф в сумке 68см (3клюшки,3мяча, 3лунки), арт.17881a	278582	Спорт и отдых (folder)/Спорт и отдых	0	
1213499	4602010291773	Игровой набор гонки (2маш) Box 50x35 x 11см, raceway,арт.a39-7.	713265	Игрушки (folder)/Игровой набор	0	
3811670	4620006317818	Игровой набор гонки песочный арт.70131	332673	Игрушки (folder)/Игрушки для песочницы	0	
1666797	065541917002	Игровой набор гонщики 91700 мега блок	980	Игрушки (folder)/Игрушка	147551	Mega Bloks
713344	8001444409208	Игровой набор горм с 4-мя героями+постер gph00643	713265	Игрушки (folder)/Игровой набор	713342	Горм
2864134	5010994942816	Игровой набор город.житель и питомец b3411	1	Неклассифицированные/default	0	
713347	8001444402612	Игровой набор гриб-грибок с домиком-грибом и фигур.живот.gph01154	713265	Игрушки (folder)/Игровой набор	713346	Сильвания Фемили
2247939	4607056795773	Игровой набор гриль гриль курица сосиски 2шт сетка	980	Игрушки (folder)/Игрушка	496181	СОВТЕХСТРОМ
1213639	028503050537	Игровой набор грузовик с инстр 25x20 x12	713265	Игрушки (folder)/Игровой набор	0	
3323026	4892401021403	Игровой набор д купания 2140	1	Неклассифицированные/default	0	
3323027	5102681360024	Игровой набор д купания водный мир 11837	1	Неклассифицированные/default	0	
3323028	5102681360086	Игровой набор д купания водный мир 14517	1	Неклассифицированные/default	0	
3323029	5102681360017	Игровой набор д купания транспорт 11836	1	Неклассифицированные/default	0	
3323030	5102681360093	Игровой набор д купания уточка 14520	1	Неклассифицированные/default	0	
2864135	5010993327522	Игровой набор два пета b9389 лпс	1	Неклассифицированные/default	0	
2233210	032281899523	Игровой набор две птички, ассортимент №1	2074200	Неклассифицированные/РОСМЭН	2233205	Intertoy, Англия
713224	8033576212593	Игровой набор двойной геолога	713265	Игрушки (folder)/Игровой набор	0	
146143	843625030270	Игровой набор деви джонс на лодке 4+	1364437	Игрушки (folder)/Фигурки, роботы, животные	142759	ZIZZLE
1666798	4602010376043	Игровой набор детск бадминтон с 2 волан., crd 54x 27см, арт. by9806b/9801-9802	278582	Спорт и отдых (folder)/Спорт и отдых	0	
464421	4602010260984	Игровой набор детская гигиена для куклы девилон 4614	712606	Игрушки (folder)/Куклы	332162	Девилон
464422	4602010264227	Игровой набор детский бадминтон в сетке 36см ракетки, 2мяча, fanny racket, арт.6688-2	443599	Игрушки (folder)/Игры для детей активные	0	
713349	4602010264043	Игровой набор детский бадминтон в сетке 61см ракетки, 2мяча, волан Sport fun, арт.2766f	443587	Спорт и отдых (folder)/Бадминтон	0	
713350	4602010263787	Игровой набор детский бадминтон в сетке ракетки, 2мяча и волан, арт.aj1075rk	443587	Спорт и отдых (folder)/Бадминтон	0	
713351	4602010263961	Игровой набор детский бадминтон рас 37x 13см ракетки, мяч, волан Sport fun, арт.10003	443587	Спорт и отдых (folder)/Бадминтон	0	
713352	4602010263800	Игровой набор детский бадминтон рас 38x 27см ракетки и мяч, арт.aj1043rk	443587	Спорт и отдых (folder)/Бадминтон	0	
3323031	4892401022387	Игровой набор детский игровой столик 2238	1	Неклассифицированные/default	0	
464423	4602010260861	Игровой набор детский развивающий центр музыкальный, 60x24 x 9см девилон 5216	331286	Игрушки (folder)/Игры обучающие и развивающие	332162	Девилон
713353	4602010263909	Игровой набор детский теннис в сумке 41.5x23.5см ракетки, 2мяча, арт.10881a	278582	Спорт и отдых (folder)/Спорт и отдых	0	
713354	4602010263992	Игровой набор детский теннис в сумке 57см ракетки, 2мяча, арт.10881h	278582	Спорт и отдых (folder)/Спорт и отдых	0	
713355	4602010264050	Игровой набор детский теннис в сумке 57см ракетки, мяч, арт.2788a	278582	Спорт и отдых (folder)/Спорт и отдых	0	
713356	4602010263930	Игровой набор детский теннис рас 23см ракетки и мяч Sport fun, арт.10881e/1	278582	Спорт и отдых (folder)/Спорт и отдых	0	
146144	843625001317	Игровой набор джек спарроу в гробу 4+	1364437	Игрушки (folder)/Фигурки, роботы, животные	142759	ZIZZLE
146145	843625003410	Игровой набор джек спарроу и кракен 4+	1364437	Игрушки (folder)/Фигурки, роботы, животные	142759	ZIZZLE
146146	843625030263	Игровой набор джек спарроу на лодке 4+	1364437	Игрушки (folder)/Фигурки, роботы, животные	142759	ZIZZLE
3323032	4603283007818	Игровой набор джунгли 3шт в сетке	1	Неклассифицированные/default	0	
713357	085210400178	Игровой набор дикая жизнь сафари 14003	713265	Игрушки (folder)/Игровой набор	0	
89340	008521040017	Игровой набор дикая жизнь сафари 14003 #2	713265	Игрушки (folder)/Игровой набор	0	
2864137	4812501031980	Игровой набор дикие животные b27006/6	1	Неклассифицированные/default	0	
89341	4892900880471	Игровой набор дикие животные африки 88047	713265	Игрушки (folder)/Игровой набор	0	
3811671	8718158899309	Игровой набор динозавр арт.w28200010	980	Игрушки (folder)/Игрушка	0	
89342	672552401873	Игровой набор динозавр-воин 4018т	713265	Игрушки (folder)/Игровой набор	0	
89344	672552402276	Игровой набор динозавр-воин 4022т	713265	Игрушки (folder)/Игровой набор	0	
713358	8001444407655	Игровой набор динозаврики	713265	Игрушки (folder)/Игровой набор	0	
89345	4892900880501	Игровой набор динозавры 88050	713265	Игрушки (folder)/Игровой набор	0	
1213500	4602010091878	Игровой набор динозавры Box 28см арт. 233	713265	Игрушки (folder)/Игровой набор	0	
2864138	4812501020182	Игровой набор динозавры t33704	1	Неклассифицированные/default	0	
1961255	4600797000069	Игровой набор для боди-арт.эльфм.ушу панда	1	Неклассифицированные/default	331287	Эльф Маркет
713359	018876667203	Игровой набор для ванной	337649	Уход за детьми (folder)/Уход за детьми	0	
551665	6934610533778	Игровой набор для ванной веселая компания на присосках в русс. кор. 26x8x 37см в кор.2x 18шт	713265	Игрушки (folder)/Игровой набор	0	
2727186	6934610533785	Игровой набор для ванной маленький пингвин на присосках в русс. кор. 32x9x 25см в кор.2x 18шт	1726592	Игрушки (folder)/Игрушки развивающие	0	
2727187	6934610533761	Игровой набор для ванной Остров сокровищ на присосках, с аксессуарами в русс. кор 28x17x 25см в кор.2x 9шт	1726592	Игрушки (folder)/Игрушки развивающие	0	
2727188	6934610533792	Игровой набор для ванной пингвин и друзья на присосках, с аксессуарами в русс кор 41x9x 30см в кор.2x 12шт	1726592	Игрушки (folder)/Игрушки развивающие	0	
149130	019287895308	Игровой набор для ванны tolo Toys водные горки	149128	Игрушки (folder)/Игрушка для ванны	145266	Tolo Toys
2233211	6914051681511	Игровой набор для ванны арт.1811/eq80137r	980	Игрушки (folder)/Игрушка	2506056	S+S Toys
713360	021105032918	Игровой набор для ванны горка+подарок	713265	Игрушки (folder)/Игровой набор	301506	Hello Kitty
1213501	4602010326420	Игровой набор для девоч (расчески, заколки, бигуди, фен), 31x9.5x 30см, Box, арт.zyc-0901-1	713265	Игрушки (folder)/Игровой набор	735259	ZHORYA
1213502	4602010326437	Игровой набор для девоч (расчески, заколки, бигуди, фен), 31x9.5x 30см, Box, арт.zyc-0901-5	713265	Игрушки (folder)/Игровой набор	735259	ZHORYA
3811672	4630005541992	Игровой набор для девоч ksl376729 8предм	980	Игрушки (folder)/Игрушка	3733811	BETTER PARTNER
3811673	4630005541756	Игровой набор для девоч арт.ksl349088 7пред	980	Игрушки (folder)/Игрушка	3733811	BETTER PARTNER
1213503	4602010344905	Игровой набор для девоч красотка ,свет и звук,49x35 x72.5см, Box, арт.zyb-b0093	713265	Игрушки (folder)/Игровой набор	735259	ZHORYA
3323033	4606089117736	Игровой набор для девоч помогаю маме	1	Неклассифицированные/default	0	
3811674	4006592776596	Игровой набор для игры в бадминтон а	550638	Спорт и отдых (folder)/Спорт	0	
3811675	8718158574374	Игровой набор для игры в песок	3605276	Спорт и отдых (folder)/Товары для кемпинга	0	
3811676	8718158952998	Игровой набор для игры в песок #2	3605276	Спорт и отдых (folder)/Товары для кемпинга	0	
3811677	8718158251374	Игровой набор для игры в песок 11предм	3605276	Спорт и отдых (folder)/Товары для кемпинга	0	
3811678	8718158003157	Игровой набор для игры в песок 2предм	3605276	Спорт и отдых (folder)/Товары для кемпинга	0	
3811679	8718158517616	Игровой набор для игры в песок 2предм #2	3605276	Спорт и отдых (folder)/Товары для кемпинга	0	
3811680	8711295753282	Игровой набор для игры в песок 3предм	3605276	Спорт и отдых (folder)/Товары для кемпинга	0	
3811681	8718158252289	Игровой набор для игры в песок 4 форм.	3605276	Спорт и отдых (folder)/Товары для кемпинга	0	
3811682	8718158574312	Игровой набор для игры в песок 5предм	332673	Игрушки (folder)/Игрушки для песочницы	0	
3811683	8718158574282	Игровой набор для игры в песок 7предм	3605276	Спорт и отдых (folder)/Товары для кемпинга	0	
3811684	8718158574398	Игровой набор для игры в песок 8предм	332673	Игрушки (folder)/Игрушки для песочницы	0	
3811685	8718158574343	Игровой набор для игры в песок формочки 2шт	3605276	Спорт и отдых (folder)/Товары для кемпинга	0	
1776033	065541037137	Игровой набор для констр.и творч. го	980	Игрушки (folder)/Игрушка	0	
3811686	065541010567	Игровой набор для констр.и творч. че	147541	Игрушки (folder)/Игрушка конструктор	147551	Mega Bloks
3811687	065541010574	Игровой набор для констр.и творч. че #2	147541	Игрушки (folder)/Игрушка конструктор	147551	Mega Bloks
3811688	065541010796	Игровой набор для констр.и творч. че #3	147541	Игрушки (folder)/Игрушка конструктор	147551	Mega Bloks
2233212	065541057395	Игровой набор для констр.могучий рейнджер-герой 05739 мега блок	980	Игрушки (folder)/Игрушка	147551	Mega Bloks
2864139	065541084162	Игровой набор для констр.сумка с деталями эко 60дет 08415 маттел	1	Неклассифицированные/default	147551	Mega Bloks
2864140	065541084179	Игровой набор для констр.сумка с деталями эко 60дет 08415 маттел #2	1	Неклассифицированные/default	147551	Mega Bloks
2233213	065541084155	Игровой набор для констр.сумка с деталями эко 60дет 08415 мега блок	980	Игрушки (folder)/Игрушка	147551	Mega Bloks
464424	4602010214925	Игровой набор для крикета в сетке 55см арт.jy2220b1.	443599	Игрушки (folder)/Игры для детей активные	0	
4840799	4630039084311	Игровой набор для кукол бокси герл 6посылок с сюрпризом	4832631	Игрушки (folder)/Игры, игровые наборы	2013655	1Toy
1213504	4602010304138	Игровой набор для купания Box 33x9 x28.5см арт zyk-0768	713265	Игрушки (folder)/Игровой набор	735259	ZHORYA
1213505	4602010304145	Игровой набор для купания Box 46x9 x 31см арт zyk-0769	713265	Игрушки (folder)/Игровой набор	735259	ZHORYA
1684393	4006592411305	Игровой набор для купания simba корабль	980	Игрушки (folder)/Игрушка	651699	Simba
464425	4602010261028	Игровой набор для купания водный мир сачок + 6 игрушек, пвх сумка, размеры: сачок-24x14 x 4см игр	149128	Игрушки (folder)/Игрушка для ванны	332162	Девилон
1213506	4602010304077	Игровой набор для купания инопланетянин Box 29.5x8 x 24см арт zyk-0797	713265	Игрушки (folder)/Игровой набор	735259	ZHORYA
1213507	4602010304084	Игровой набор для купания инопланетянин Box 40x8 x26.5см арт zyk-0798	713265	Игрушки (folder)/Игровой набор	735259	ZHORYA
1213508	4602010279443	Игровой набор для купания кит Box 26.5x20 x 8см арт zyc-0297	713265	Игрушки (folder)/Игровой набор	735259	ZHORYA
1213509	4602010304169	Игровой набор для купания кит Box 28x20 x20.5см арт zyk-0773	713265	Игрушки (folder)/Игровой набор	735259	ZHORYA
1213510	4602010279429	Игровой набор для купания кит Box 37x25.5x 8см арт zyc-0295-b	713265	Игрушки (folder)/Игровой набор	735259	ZHORYA
1213511	4602010304152	Игровой набор для купания краб crd 20x7.5x34.5см арт zyk-0770	713265	Игрушки (folder)/Игровой набор	735259	ZHORYA
464426	4602010260526	Игровой набор для купания морская звзда сачок + 3 морских звездочки, на блистере, размеры:сачок 2	149128	Игрушки (folder)/Игрушка для ванны	332162	Девилон
3323034	5102681360697	Игровой набор для купания музыкальные бегемотики y7964 1	1	Неклассифицированные/default	0	
464427	4602010261141	Игровой набор для купания насекомые размеры: сетка-14x14x 7см насекомые-6.5x5.5x 2см девилон y98	149128	Игрушки (folder)/Игрушка для ванны	332162	Девилон
1213512	4602010279436	Игровой набор для купания пингвин Box 32x24.5x 8см арт zyc-0296	713265	Игрушки (folder)/Игровой набор	735259	ZHORYA
1213513	4602010279412	Игровой набор для купания пингвин Box 40.5x30 x 9см арт zyc-0294	713265	Игрушки (folder)/Игровой набор	735259	ZHORYA
1213514	4602010279450	Игровой набор для купания пиратский корабль Box 28x25 x16.5см арт zyc-0298	713265	Игрушки (folder)/Игровой набор	735259	ZHORYA
1213515	5102681360062	Игровой набор для купания рыбка в блист	713265	Игрушки (folder)/Игровой набор	0	
464428	4602010262353	Игровой набор для купания рыбка сачок + 2рыбки, пвх сумка, размеры: сачок-24x14 x 4см	149128	Игрушки (folder)/Игрушка для ванны	332162	Девилон
464429	4602010260625	Игровой набор для купания транспорт сачок, машинка+лодка, пвх сумка, размеры: сачок-24x14 x 4см м	149128	Игрушки (folder)/Игрушка для ванны	332162	Девилон
1213516	4602010304091	Игровой набор для купания утенок Box 31x9.5x 24см арт zyk-0800	713265	Игрушки (folder)/Игровой набор	735259	ZHORYA
1213517	4602010304107	Игровой набор для купания утенок Box 39x10 x27.5см арт zyk-0801	713265	Игрушки (folder)/Игровой набор	735259	ZHORYA
1213518	4602010304114	Игровой набор для купания утка Box 22.5x11 x 32см арт zyk-0765	713265	Игрушки (folder)/Игровой набор	735259	ZHORYA
1213519	4602010304121	Игровой набор для купания утка Box 40.5x10.5x 31см арт zyk-0767	713265	Игрушки (folder)/Игровой набор	735259	ZHORYA
1213520	5102681360055	Игровой набор для купания уточка y12415	713265	Игрушки (folder)/Игровой набор	0	
464430	4602010260786	Игровой набор для купания, варежка+2уточки, размеры: варежка - 10x 16см уточки-8x8 x 8см девилон fs139	149128	Игрушки (folder)/Игрушка для ванны	332162	Девилон
3323035	6901172419178	Игровой набор для ловли бабочек	1	Неклассифицированные/default	0	
2864141	4812501084283	Игровой набор для мальч Мой город 8963189631	1	Неклассифицированные/default	0	
1666799	3296580309856	Игровой набор для моделирования одежды harumika свадебная Коллекция 30985hb	1	Неклассифицированные/default	0	
713361	808986372803	Игровой набор для песка	713265	Игрушки (folder)/Игровой набор	0	
3811689	4600459091688	Игровой набор для песка Солнышко арт	332673	Игрушки (folder)/Игрушки для песочницы	0	
713362	085213031058	Игровой набор для песочницы 10предм 30310	713265	Игрушки (folder)/Игровой набор	1511433	Keenway
89346	008521303105	Игровой набор для песочницы 10предм 30310 #2	713265	Игрушки (folder)/Игровой набор	0	
89347	008521303129	Игровой набор для песочницы 16предм 30312 #2	713265	Игрушки (folder)/Игровой набор	0	
1769046	4607115165615	Игровой набор для песочницы смешар	1768801	Игрушки (folder)/Игрушки пластмассовые	0	
1769047	4607115166117	Игровой набор для песочницы смешар #2	1768801	Игрушки (folder)/Игрушки пластмассовые	0	
583628	4897021797301	Игровой набор для раскр d&m кукла мальвина объемная.+краск.4цв+кисть.к/у	1356639	Товары для творчества (folder)/Творчество	457203	D&M
1961256	4897021796441	Игровой набор для раскр d&m кукла Фея объемная.+краск.6цв+кисть.к/у	1356639	Товары для творчества (folder)/Творчество	457203	D&M
583627	4897021797325	Игровой набор для раскр.d&m.кукла красная шапочка объемн+краск.4цв+кисть.к/у	1356639	Товары для творчества (folder)/Творчество	457203	D&M
1961258	4607017154052	Игровой набор для раскр.плц.паззл дерев автобус .п/у.	1	Неклассифицированные/default	1961257	ООО Полноцвет
3811690	4607953322010	Игровой набор для раскрашивания 7777471	542785	Товары для праздников (folder)/Новогодние украшения	0	
3811691	4620006315302	Игровой набор для стирки пл.детский	980	Игрушки (folder)/Игрушка	0	
1213521	113509080616	Игровой набор для стрельбы арбалет dfg09014	713265	Игрушки (folder)/Игровой набор	0	
1791607	4024526645800	Игровой набор для творчества Action.аппликация из фольги.4 дизайна.ассорти.к/бл	90098	Товары для творчества (folder)/Набор для творчества	20714	ACTION
1263853	4024526645787	Игровой набор для творчества Action.веревочная кукла.3 дизайна.ассорти.к/бл	90098	Товары для творчества (folder)/Набор для творчества	20714	ACTION
1263855	4024526645626	Игровой набор для творчества Action.веселые гонки.3 дизайна.ассорти.к/бл	90098	Товары для творчества (folder)/Набор для творчества	20714	ACTION
1204370	4024526645763	Игровой набор для творчества Action.объемная аппликация из бумаги.3 дизайна.к/бл	90098	Товары для творчества (folder)/Набор для творчества	20714	ACTION
869144	6937493915419	Игровой набор для творчества d&m шьем тапочки морская Звезда 23.5см арт 3190	90098	Товары для творчества (folder)/Набор для творчества	457203	D&M
1888904	8710302568161	Игровой набор для творчества d&m. бижутерия из печки .браслеты.кольца.к/у.	90098	Товары для творчества (folder)/Набор для творчества	457203	D&M
