ID	UPCEAN	Name	CategoryID	CategoryName	BrandID	BrandName
2461351	6927710888985	Набор оружия пистолет и аксес. #4	980	Игрушки (folder)/Игрушки	0	
2461352	6927711138980	Набор оружия пистолет и аксес. #5	980	Игрушки (folder)/Игрушки	0	
2461348	6927710737887	Набор оружия пистолет и аксессуары rx918-34	980	Игрушки (folder)/Игрушки	0	
1265856	4602010053937	Набор оружия пистолет с прицелом, нож, дубинка, наручники рас 28x 18см 911	146199	Игрушки (folder)/Игрушечное оружие	0	
3427518	6900121316513	Набор оружия пластмассовый арт 40438	1	Неклассифицированные/default	0	
552407	6934521200561	Набор оружия полиция	980	Игрушки (folder)/Игрушки	0	
2461353	6927078145850	Набор оружия полиция #2	980	Игрушки (folder)/Игрушки	0	
2461354	6927078159680	Набор оружия полиция #3	980	Игрушки (folder)/Игрушки	0	
1265857	6934527766603	Набор оружия полиция 1031	980	Игрушки (folder)/Игрушки	0	
1265858	4690401047337	Набор оружия полиция a789-h16035 вельт	980	Игрушки (folder)/Игрушки	0	
1265859	4690401048495	Набор оружия полиция a789-h16038 вельт	980	Игрушки (folder)/Игрушки	0	
1265860	4690401048488	Набор оружия полиция a789-h16041 вельт	980	Игрушки (folder)/Игрушки	0	
1265861	4602010269543	Набор оружия полиция crd 42x 28см, police Force, арт.2006a	146199	Игрушки (folder)/Игрушечное оружие	0	
2461355	6927711112904	Набор оружия полиция, винтовка, пули на присосках, наручники, аксесс.	980	Игрушки (folder)/Игрушки	0	
2461356	6927711012075	Набор оружия полиция, пистолет и аксес.	980	Игрушки (folder)/Игрушки	0	
2461357	6927711012099	Набор оружия полиция, пистолет и аксес. #2	980	Игрушки (folder)/Игрушки	0	
2461358	6927711055249	Набор оружия полиция, пистолет и аксес. #3	980	Игрушки (folder)/Игрушки	0	
2461359	6927710386177	Набор оружия полиция, пистолет, аксесс.	980	Игрушки (folder)/Игрушки	0	
2461360	6927710868512	Набор оружия полиция, пистолет, наручники, аксесс.	980	Игрушки (folder)/Игрушки	0	
2461361	6927711359569	Набор оружия полиция, пистолет, стреляет шариками, наручники, жетон	980	Игрушки (folder)/Игрушки	0	
2461362	6927711359590	Набор оружия полиция, пистолет, стреляет шариками, рация, нож	980	Игрушки (folder)/Игрушки	0	
2248834	6913103120084	Набор оружия рыцари тамплиеры	980	Игрушки (folder)/Игрушки	2506056	S+S Toys
1969111	4690401013707	Набор оружия рыцарские доспехи j377-h31060 вельт	1	Неклассифицированные/default	0	
2461363	6927710624002	Набор оружия рыцарь, доспехи	980	Игрушки (folder)/Игрушки	0	
2461364	6927710623937	Набор оружия рыцарь, доспехи, щит	980	Игрушки (folder)/Игрушки	0	
2461365	6927710623944	Набор оружия рыцарь, доспехи, щит #2	980	Игрушки (folder)/Игрушки	0	
2461366	6927710623951	Набор оружия рыцарь, щит	980	Игрушки (folder)/Игрушки	0	
2461367	6927710623982	Набор оружия рыцарь, щит #2	980	Игрушки (folder)/Игрушки	0	
1685305	4602010318524	Набор оружия с биноклем, рацией, часами, гранатой, звук, Box, арт. 33860	146199	Игрушки (folder)/Игрушечное оружие	0	
3427519	4606083408441	Набор оружия с маской	1	Неклассифицированные/default	0	
1685306	4606083356230	Набор оружия с маской /35623/	1	Неклассифицированные/default	0	
1685307	4606083358913	Набор оружия с наручниками /35891/	1	Неклассифицированные/default	0	
3427520	4606083408120	Набор оружия с очками	1	Неклассифицированные/default	0	
1685308	4606083356094	Набор оружия с очками /35609/	1	Неклассифицированные/default	0	
1969112	6913052880183	Набор оружия стражи закана русифиц.2900 ek12067r s+s	1	Неклассифицированные/default	0	
2248835	6913103010088	Набор оружия стражи закона	980	Игрушки (folder)/Игрушки	2506056	S+S Toys
2461368	6913103060045	Набор оружия стражи закона #2	980	Игрушки (folder)/Игрушки	0	
2461369	6913103060052	Набор оружия стражи закона #3	980	Игрушки (folder)/Игрушки	0	
2461370	6913090390194	Набор оружия стрелы-прицелы	980	Игрушки (folder)/Игрушки	0	
2461371	4690590036945	Набор оружия три богатыря (лук+щит+меч) на карт., 175691	1	Неклассифицированные/default	0	
2461372	4690590087398	Набор оружия три богатыря (меч, щит) озвуч на карт. 197779	1	Неклассифицированные/default	0	
1969109	4680002571232	Набор оружия №3, арт.8033	1	Неклассифицированные/default	0	
1969110	4680002571249	Набор оружия №4, арт.8034	1	Неклассифицированные/default	0	
2461373	6927077285502	Набор оружия, меч со щитом, картон.	980	Игрушки (folder)/Игрушки	0	
91077	4892505063392	Набор орхидея 101орд	360621	Сувениры и подарки (folder)/Подарочный набор	0	
20976	4892505079850	Набор орхидея 3предм	360621	Сувениры и подарки (folder)/Подарочный набор	0	
91078	4892505074008	Набор орхидея 4предм wte-013	360621	Сувениры и подарки (folder)/Подарочный набор	0	
3427521	4606900634138	Набор орхидея банок для сыпучих 3 штуки 2520178	1	Неклассифицированные/default	0	
3427522	4810242131594	Набор орхидея для воды 8предм на подносе	1	Неклассифицированные/default	0	
771344	4900067610012	Набор орхидея из 2чайных пар 3049-сс02y	38328	Посуда (folder)/Посуда столовая, предметы сервировки	738858	Никко
91080	4892505078129	Набор орхидея мыло/мыльница wte-701	360621	Сувениры и подарки (folder)/Подарочный набор	0	
2959578	4892505074183	Набор орхидея мыло/мыльница wte-701 #2	360621	Сувениры и подарки (folder)/Подарочный набор	0	
91081	4607026284368	Набор освежителей бэст для шкафов и полок	25023	Хозяйственные товары (folder)/Бытовая химия (folder)/Бытовая химия	0	
771345	6961862250023	Набор осень	3536	Хозяйственные товары (folder)/Хозяйственные товары	0	
3427523	4609818040763	Набор осз кря-кря посуды для завтрака 1x 3шт тв/уп	1	Неклассифицированные/default	0	
2901659	3301042570726	Набор осметич для кукол 21639	1	Неклассифицированные/default	0	
160764	4607014953474	Набор особая серия (скр-суфле для тела+Крем для тела+часы) 3474	397231	Парфюмерия (folder)/Парфюмерный набор	12489	Особая серия
160765	4607014952330	Набор особая серия (шампунь хлеб+бальз хлеб+гель для душа)	397231	Парфюмерия (folder)/Парфюмерный набор	0	
12507	4607014952323	Набор особая серия (шампунь+бальзам кефирный) 2323	360621	Сувениры и подарки (folder)/Подарочный набор	0	
2905876	4640011154611	Набор особая серия брусничный мед шампунь 250мл+гель для душа 250мл тв/уп	1	Неклассифицированные/default	0	
2905877	4640011158909	Набор особая серия восточная Гармония черный тмин шампунь 250мл+гель для душа 250мл тв/уп	1	Неклассифицированные/default	0	
3427525	4640011151504	Набор особая серия гель для д+Крем-мыло	1	Неклассифицированные/default	0	
2901660	4607014951715	Набор особая серия гель/ж-мыло/мочалка	1	Неклассифицированные/default	0	
3427526	4640011155687	Набор особая серия кефирный дрожжи шампунь+бальзам 2x 250г	1	Неклассифицированные/default	0	
3427527	4640011158176	Набор особая серия нежный уход шампунь-бальзам 250мл Крем-гель для душа 250мл	1	Неклассифицированные/default	0	
3427528	4640011155694	Набор особая серия яичный дрожжи шампунь+бальзам 2x 250г	1	Неклассифицированные/default	0	
3427524	4607014957229	Набор особая серия №9 Крем мыло + Крем бальзам д рук	1	Неклассифицированные/default	0	
2901661	4607014957205	Набор особоя серия шампунь/бальзам	1	Неклассифицированные/default	0	
2248836	4008789054562	Набор Остров принцессы и гондола 5456pm	980	Игрушки (folder)/Игрушки	1575551	PLAYMOBIL
3427529	4660015370916	Набор от курочки рябы пасхальных термоэтикеток 14шт мяг/уп	1	Неклассифицированные/default	0	
11779	4607068331679	Набор от сердца к сердцу 2шт блистер	360621	Сувениры и подарки (folder)/Подарочный набор	0	
11780	4607068331655	Набор от сердца к сердцу 2шт в кор	360621	Сувениры и подарки (folder)/Подарочный набор	0	
2743403	4710694609064	Набор отбойников для дверей 2шт	1	Неклассифицированные/default	0	
495742	4034229071424	Набор отвертка с с битами 25556-н27 27предм kraftol	1	Неклассифицированные/default	0	
495743	4034229020484	Набор отвертка с с битами 26141-н32 32предм kraftol	1	Неклассифицированные/default	0	
495744	4034229020408	Набор отвертка с с битами 26141-н6 6предм kraftol	1	Неклассифицированные/default	0	
3427530	6933700470016	Набор отверток 2шт 6x 45мм в блистере арт. 370-047	344583	Инструменты (folder)/Отвертка	0	
3427531	6944312002731	Набор отверток 2шт sparta ст ph 1, sl 5.0 100мм арт 135425	344583	Инструменты (folder)/Отвертка	0	
771346	4607066100741	Набор отверток 2шт vira	344583	Инструменты (folder)/Отвертка	0	
771365	6937618360360	Набор отверток 31шт пирамида	344583	Инструменты (folder)/Отвертка	0	
1265862	5906083640407	Набор отверток 4шт	1	Неклассифицированные/default	0	
771347	4607066100758	Набор отверток 5 штук vira	344583	Инструменты (folder)/Отвертка	0	
3427532	7897323381533	Набор отверток 6предм	344583	Инструменты (folder)/Отвертка	0	
1969113	4034229043537	Набор отверток 6предм Max-grip stayer 25844-н6	1	Неклассифицированные/default	447542	Stayer
1969114	6944312002700	Набор отверток 6предм sparta 13307	1	Неклассифицированные/default	0	
234031	4606800008350	Набор отверток 6шт с дерев ручкой	41797	Инструменты (folder)/Инструмент	0	
771350	5903874174264	Набор отверток 7шт	344583	Инструменты (folder)/Отвертка	0	
1265863	5906083640803	Набор отверток 7шт #2	1	Неклассифицированные/default	0	
771351	4260024752569	Набор отверток 7шт dsb-7 defort	344583	Инструменты (folder)/Отвертка	312871	DEFORT
2743404	842404041537	Набор отверток 8предм 8рс рм4153	300445	Эксплуатация и ремонт автомобилей/Автомобильные принадлежности	0	
1969116	6944312002748	Набор отверток 8предм sparta 135435	1	Неклассифицированные/default	0	
2743405	842404051031	Набор отверток 8предм рм5103	300445	Эксплуатация и ремонт автомобилей/Автомобильные принадлежности	0	
1265864	5903874174271	Набор отверток 8шт с электроиз.рукояткой	41797	Инструменты (folder)/Инструмент	0	
771352	4260024756765	Набор отверток defort 10предм 10предм в блистере	344583	Инструменты (folder)/Отвертка	312871	DEFORT
3427533	4034229161415	Набор отверток dexx 4предм	344583	Инструменты (folder)/Отвертка	0	
3427534	4034229153151	Набор отверток dexx 6предм	344583	Инструменты (folder)/Отвертка	0	
771353	4260024756796	Набор отверток hander 42предм в кейсе	344583	Инструменты (folder)/Отвертка	0	
3427535	6949639100290	Набор отверток jackly Mini тв/уп	344583	Инструменты (folder)/Отвертка	0	
3427536	6944144175016	Набор отверток m&s универсальные пластиковой рукоятки 9шт пл/упак	344583	Инструменты (folder)/Отвертка	0	
1265866	4712780137765	Набор отверток matrix svcm professinal, 6шт	1	Неклассифицированные/default	0	
1969125	4712780580639	Набор отверток matrix Профи 6шт 13303	1	Неклассифицированные/default	297592	Matrix
771354	5906757271999	Набор отверток modeco 2шт	41797	Инструменты (folder)/Инструмент	681001	Modeco
771355	5906757271982	Набор отверток modeco 5шт	41797	Инструменты (folder)/Инструмент	681001	Modeco
771356	5906757161849	Набор отверток modeco 6шт	41797	Инструменты (folder)/Инструмент	681001	Modeco
771357	5906757904712	Набор отверток modeco 7шт	41797	Инструменты (folder)/Инструмент	681001	Modeco
3427537	4690408067208	Набор отверток park магнитное жало 2 штуки	344583	Инструменты (folder)/Отвертка	0	
3427538	4690408052549	Набор отверток park ударных с усилением 4предм тв/уп	344583	Инструменты (folder)/Отвертка	0	
3427539	6944312002724	Набор отверток sparta 10предм	344583	Инструменты (folder)/Отвертка	0	
3427540	6944312095146	Набор отверток sparta 2шт 134053	344583	Инструменты (folder)/Отвертка	0	
1832313	6944312002670	Набор отверток sparta 5шт деревянные рукоятки	344583	Инструменты (folder)/Отвертка	0	
3427541	6944312002687	Набор отверток sparta 6шт деревянные рукоятки	344583	Инструменты (folder)/Отвертка	0	
3427542	4034229030476	Набор отверток stayer 2 штуки	344583	Инструменты (folder)/Отвертка	447542	Stayer
3427543	4034229013462	Набор отверток stayer 4 штуки	344583	Инструменты (folder)/Отвертка	447542	Stayer
3427544	4034229158002	Набор отверток stayer 6предм	344583	Инструменты (folder)/Отвертка	447542	Stayer
1969118	4034229137441	Набор отверток stayer диэлектр. 6предм	1	Неклассифицированные/default	447542	Stayer
1969119	4034229137458	Набор отверток stayer диэлектр. 8предм	1	Неклассифицированные/default	447542	Stayer
3427545	4034229018504	Набор отверток stayer для точных работ	344583	Инструменты (folder)/Отвертка	447542	Stayer
1969120	4606373046261	Набор отверток stayer Мастер. 5предм	1	Неклассифицированные/default	0	
3427546	4607080019449	Набор отверток strum 8предм	344583	Инструменты (folder)/Отвертка	0	
3427547	4607080019463	Набор отверток strum в кейсе 21 предмет	344583	Инструменты (folder)/Отвертка	0	
3427548	4607113260527	Набор отверток sturm! (6 штук) модель 1040-01-ss3	344583	Инструменты (folder)/Отвертка	0	
3427549	4034229015923	Набор отверток styer master	344583	Инструменты (folder)/Отвертка	447542	Stayer
3427550	5902062398888	Набор отверток topex 4шлиц.=4крест.	344583	Инструменты (folder)/Отвертка	0	
1832674	4607066100772	Набор отверток vira комби 7шт	344583	Инструменты (folder)/Отвертка	0	
1969122	4712780137086	Набор отверток гросс 3шт 12166	1	Неклассифицированные/default	0	
1969123	4712780137093	Набор отверток гросс sl 3шт 3х компонентная рукоятка 12167	1	Неклассифицированные/default	0	
1969115	4712780580622	Набор отверток диэлект.до 1000в, проб.эл. - до 250в, двухкомп.рукоятки 7шт// matrix professional 13355	1	Неклассифицированные/default	0	
1969117	6944312002762	Набор отверток для точной механики 1/11шт 133605 sparta	1	Неклассифицированные/default	0	
771349	6944312002755	Набор отверток для точной механики 1/6шт 133445 sparta	344583	Инструменты (folder)/Отвертка	0	
1969124	4712780583869	Набор отверток для точной механики 6шт, бокс-трансформер gross 13346	344583	Инструменты (folder)/Отвертка	0	
1265867	6944312032547	Набор отверток для точных работ Fusion, 2-компонентная рукоятка, 6шт, в пласт пенале// matrix 13361	1	Неклассифицированные/default	297592	Matrix
3427551	4603299004009	Набор отверток Ермак 2предм 9986	344583	Инструменты (folder)/Отвертка	280122	ЕРМАК
3427552	4603299001329	Набор отверток Ермак 2предм 9988	344583	Инструменты (folder)/Отвертка	280122	ЕРМАК
3427553	4603299001336	Набор отверток Ермак 4предм	344583	Инструменты (folder)/Отвертка	280122	ЕРМАК
3427554	4603299001398	Набор отверток Ермак 6предм	344583	Инструменты (folder)/Отвертка	280122	ЕРМАК
708336	4603299001343	Набор отверток Ермак арт.651061 4предм пл/упак	41797	Инструменты (folder)/Инструмент	280122	ЕРМАК
3427555	4603299001367	Набор отверток Ермак универсальные 6шт пл/упак	344583	Инструменты (folder)/Отвертка	280122	ЕРМАК
771358	4607164311889	Набор отверток и бит vira 29предм Премиум	344583	Инструменты (folder)/Отвертка	0	
771359	4607164311896	Набор отверток и бит vira 32предм Премиум	344583	Инструменты (folder)/Отвертка	0	
771360	4607164311858	Набор отверток и бит vira многоцелевой 39 предмет.	344583	Инструменты (folder)/Отвертка	0	
771361	4607066100949	Набор отверток и ручного инструмента vira 25шт	344583	Инструменты (folder)/Отвертка	0	
771362	4607066100864	Набор отверток комби 8 штук vira	344583	Инструменты (folder)/Отвертка	0	
771363	5906757904729	Набор отверток коротких modeco 2шт	41797	Инструменты (folder)/Инструмент	681001	Modeco
3427556	4607079497050	Набор отверток металлист 4шт пластмассовые ручки	344583	Инструменты (folder)/Отвертка	0	
2743406	842404041520	Набор отверток рм4152 5ш	300445	Эксплуатация и ремонт автомобилей/Автомобильные принадлежности	0	
1265868	5903874167440	Набор отверток ручн.плоских 4шт coval Plus	41797	Инструменты (folder)/Инструмент	1353184	Coval
1265869	5903874167426	Набор отверток ручн.плоских 6шт coval Plus	41797	Инструменты (folder)/Инструмент	1353184	Coval
1265870	5903874167433	Набор отверток ручн.плоских 9шт coval Plus	41797	Инструменты (folder)/Инструмент	1353184	Coval
1969126	4034229018115	Набор отверток с двухсторонними битами для точныхработ stayer 4предм	1	Неклассифицированные/default	447542	Stayer
3427557	4630014580821	Набор отверток стержневых basic, 8предм 950008	344583	Инструменты (folder)/Отвертка	0	
1508387	4607079333167	Набор отверток стержневых round grip, 6предм 975006	1	Неклассифицированные/default	610818	Jonnesway
1508388	4607079333174	Набор отверток стержневых round grip, 8предм 975008	1	Неклассифицированные/default	610818	Jonnesway
771364	4607080019500	Набор отверток стурм . 1040-02	344583	Инструменты (folder)/Отвертка	0	
234032	4606800001733	Набор отверток т-образн.+11наконечников	41797	Инструменты (folder)/Инструмент	0	
306708	5902062050380	Набор отверток топтулс прецизионных	344583	Инструменты (folder)/Отвертка	0	
1969127	795609321884	Набор отверток ударных 6 пред (крест и шлиц) в блист. упаковке ampro t32188	1	Неклассифицированные/default	0	
3427558	4690416026679	Набор отверток универсальный Управдом (6в1)	344583	Инструменты (folder)/Отвертка	0	
1832675	4607066100895	Набор отверток часовых vira 6шт	344583	Инструменты (folder)/Отвертка	0	
495745	4680000603973	Набор отверток шток 09902/6шт	1	Неклассифицированные/default	0	
771366	4607164311872	Набор отверток, головок и бит vira 40предм	344583	Инструменты (folder)/Отвертка	0	
771367	4607164314293	Набор отверток-тестеров kroft, 2шт	344583	Инструменты (folder)/Отвертка	0	
1969121	4710591935693	Набор отвёрток в коробке 5предм kingtony 30115mr	1	Неклассифицированные/default	0	
2461375	4607028183980	Набор отдохни ложки 10шт	38328	Посуда (folder)/Посуда столовая, предметы сервировки	0	
2461376	460702818394	Набор отдохни ножи 10шт	38328	Посуда (folder)/Посуда столовая, предметы сервировки	0	
2461377	4607028183737	Набор отдохни тарелки 2-х секц 10шт	38328	Посуда (folder)/Посуда столовая, предметы сервировки	0	
2461378	4607028183836	Набор отдохни чай/ложки 10шт	38328	Посуда (folder)/Посуда столовая, предметы сервировки	0	
3427559	8000147852458	Набор отдых классик Тарелка, стакан 0.2,вилка,нож,салфетки, мешки для мусора 35л-6шт	1	Неклассифицированные/default	0	
771368	6903514025788	Набор отдых у бассейна - Water fun summer resort set (2578) gloria	1	Неклассифицированные/default	0	
91082	4607069633659	Набор открыв.экспедиция складн.ecs-02	329590	Спорт и отдых (folder)/Пикник	53599	Экспедиция
