ID	UPCEAN	Name	CategoryID	CategoryName	BrandID	BrandName
4429889	032031441491	I caesar-rise&fall of the roman empire (DVD)	1	Неклассифицированные/default	0	
4429890	040406002154	I can	1	Неклассифицированные/default	0	
4429891	712692952290	I can be a dinosaur finder CD rom	1	Неклассифицированные/default	0	
607858	022735300569	I can count to ten	1	Неклассифицированные/default	0	
4429892	824921022381	I can draw...by terry longhurst	1	Неклассифицированные/default	0	
607859	022735300484	I can dress myself	1	Неклассифицированные/default	0	
607860	758606321134	I can fix ... travel mug	1	Неклассифицированные/default	0	
4429893	092388050197	I can go potty (DVD)	1	Неклассифицированные/default	0	
4429894	8782392404094	I can has cheezburger? book	1	Неклассифицированные/default	0	
4429895	074646590720	I can hear it now/the sixties CD sound recording	1	Неклассифицированные/default	0	
4429896	691159009909	I can learn to count to 10	1	Неклассифицированные/default	0	
4429897	805219011218	I can learn with pooh, early skills	1	Неклассифицированные/default	0	
607861	022735300491	I can make my bed	1	Неклассифицированные/default	0	
4429898	027084438550	I can Play guitar	1	Неклассифицированные/default	0	
4429899	027084459005	I can Play guitar sw Hot wheels road tunes	1	Неклассифицированные/default	0	
607862	022735300590	I can ride my bike	1	Неклассифицированные/default	0	
4429900	795762196640	I can t ever Fine Price when i go to store and scan barcode	1	Неклассифицированные/default	0	
607863	022735300477	I can tie my shoes	1	Неклассифицированные/default	0	
4429903	059950300104	I can't believe it's not Butter margarine 16oz	1	Неклассифицированные/default	0	
379178	5000241007139	I can't believe it's not Butter! 1kg	1	Неклассифицированные/default	1498634	ICBINB
192241	5000241007320	I can't believe it's not Butter! 250g	330591	Продукты питания (folder)/Продукты питания	0	
3135661	040600000055	I can't believe it's not Butter! 45% vegetable Oil Spread, it's vegan	330591	Продукты питания (folder)/Продукты питания	2605208	I Can't Believe It's Not Butter
3135662	040600721394	I can't believe it's not Butter! 45% vegetable Oil Spread, it's vegan #2	330591	Продукты питания (folder)/Продукты питания	2605208	I Can't Believe It's Not Butter
1498360	040600221993	I can't believe it's not Butter! 45% vegetable Oil Spread, olive Oil	1	Неклассифицированные/default	2605208	I Can't Believe It's Not Butter
3135663	040600043328	I can't believe it's not Butter! 45% vegetable Oil Spread, Original	330591	Продукты питания (folder)/Продукты питания	2605208	I Can't Believe It's Not Butter
3135664	040600345125	I can't believe it's not Butter! 45% vegetable Oil Spread, Original #2	330591	Продукты питания (folder)/Продукты питания	2605208	I Can't Believe It's Not Butter
3135665	040600361439	I can't believe it's not Butter! 45% vegetable Oil Spread, Original #3	330591	Продукты питания (folder)/Продукты питания	2605208	I Can't Believe It's Not Butter
2157214	040600034166	I can't believe it's not Butter! 79% vegetable Oil Spread, Original	1	Неклассифицированные/default	2605208	I Can't Believe It's Not Butter
1498359	040600222532	I can't believe it's not Butter! Butter Blend - Light mediterranean	1	Неклассифицированные/default	2605208	I Can't Believe It's Not Butter
2605209	040600152167	I can't believe it's not Butter! cooking spray, olive Oil	1	Неклассифицированные/default	2605208	I Can't Believe It's Not Butter
3135666	040600215893	I can't believe it's not Butter! cooking spray, Original	330591	Продукты питания (folder)/Продукты питания	2605208	I Can't Believe It's Not Butter
2605210	040600327800	I can't believe it's not Butter! deliciously simple 70% vegetable Oil Spread	1	Неклассифицированные/default	2605208	I Can't Believe It's Not Butter
2805161	040600470018	I can't believe it's not Butter! ff Soft margarine 16oz	1	Неклассифицированные/default	2605208	I Can't Believe It's Not Butter
1498356	040600347006	I can't believe it's not Butter! grlc&hrb spray 8oz	1	Неклассифицированные/default	2605208	I Can't Believe It's Not Butter
3003556	040600224239	I can't believe it's not Butter! Light 45oz	330591	Продукты питания (folder)/Продукты питания	2605208	I Can't Believe It's Not Butter
1498361	040600388207	I can't believe it's not Butter! Light Spread #2	1	Неклассифицированные/default	2605208	I Can't Believe It's Not Butter
1405593	040600911207	I can't believe it's not Butter! lt 48oz	1	Неклассифицированные/default	2605208	I Can't Believe It's Not Butter
3135667	040600715010	I can't believe it's not Butter! Organic buttery Spread, 79% vegetable oils	330591	Продукты питания (folder)/Продукты питания	2605208	I Can't Believe It's Not Butter
1498358	040600224253	I can't believe it's not Butter! Original 58% vegetable Oil Spread	1	Неклассифицированные/default	2605208	I Can't Believe It's Not Butter
1498357	040600341004	I can't believe it's not Butter! Original vegetable Oil Spread - twin tubs	1	Неклассифицированные/default	2605208	I Can't Believe It's Not Butter
2805162	040600345248	I can't believe it's not Butter! Soft margarine 15oz	1	Неклассифицированные/default	2605208	I Can't Believe It's Not Butter
2805163	040600340007	I can't believe it's not Butter! spr shp 8oz	1	Неклассифицированные/default	2605208	I Can't Believe It's Not Butter
1409480	040600341226	I can't believe it's not Butter! spray Original	1	Неклассифицированные/default	2605208	I Can't Believe It's Not Butter
192242	5000241007009	I can't believe it's not Butter! Spread 500g	330591	Продукты питания (folder)/Продукты питания	1498634	ICBINB
379179	8722700198130	I can't believe it's not Butter! Spread 500g Light	1	Неклассифицированные/default	1498636	ICBINC
1498362	040600341189	I can't believe it's not Butter! sweet Cream buttermilk Spread	1	Неклассифицированные/default	2605208	I Can't Believe It's Not Butter
1409482	040600387002	I can't believe it's not Butter! sweet Cream&calcium Spread	1	Неклассифицированные/default	2605208	I Can't Believe It's Not Butter
1405592	040600387187	I can't believe it's not Butter! vegetable Oil Spread Light	1	Неклассифицированные/default	2605208	I Can't Believe It's Not Butter
1498355	040600389181	I can't believe it's not Butter! vegetable Oil Spread Light - 2 ct	1	Неклассифицированные/default	2605208	I Can't Believe It's Not Butter
1409481	040600345002	I can't believe it's not Butter! vegetable Oil Spread Original	1	Неклассифицированные/default	2605208	I Can't Believe It's Not Butter
1498363	040600390125	I can't believe it's not Butter! vegetable Oil Spread \n	1	Неклассифицированные/default	2605208	I Can't Believe It's Not Butter
1405594	040600346009	I can't believe it's not Butter! whipped vegetable Oil Spread	1	Неклассифицированные/default	2605208	I Can't Believe It's Not Butter
2605211	040600152181	I can't believe it's not Butter! whipped&creamy taste vegetable Oil Spread	1	Неклассифицированные/default	2605208	I Can't Believe It's Not Butter
1995291	782631227017	I candy pink	363351	Adult/Sex-Shop	0	
1995292	782631227024	I candy purple	363351	Adult/Sex-Shop	0	
4429901	028906039153	I cant believe im crocheting (DVD)	1	Неклассифицированные/default	0	
4429902	028906039146	I cant believe im knitting (DVD)	1	Неклассифицированные/default	0	
4429904	754703762399	I cant marry you (DVD)	1	Неклассифицированные/default	0	
4429905	717119062637	I cant sleep (french w/English	1	Неклассифицированные/default	0	
4429906	043396025943	I capture the castle (DVD/p&s 1.33/ws 2.35/dd 5.1/eng-sub)	1	Неклассифицированные/default	0	
4429907	089262007002	I Care Baby boop infant sngls 1ct	1	Неклассифицированные/default	0	
4429908	089262007101	I Care Baby boop toddler sngls 1ct	1	Неклассифицированные/default	0	
4429909	089262077012	I Care baywatch preteen sngls 1ct	1	Неклассифицированные/default	0	
4429910	801061803025	I Care because you.. - aphex twin (CD)	1	Неклассифицированные/default	0	
4429911	089262013409	I Care betty boop preteen single 1ct	1	Неклассифицированные/default	0	
4429912	089262029509	I Care playskiil toddler sngls 1ct	1	Неклассифицированные/default	0	
4429913	089262028502	I Care playskool infant sngls 1ct	1	Неклассифицированные/default	0	
4429914	089262006135	I Care popsicle preteen sngls 1ct	1	Неклассифицированные/default	0	
4429915	089262006029	I Care popsicle toddler sngls 1ct	1	Неклассифицированные/default	0	
4429916	089262007156	I Care sunglasses 1ct	1	Неклассифицированные/default	0	
4429917	089262028007	I Care sunglasses 1ct #2	1	Неклассифицированные/default	0	
4429918	089262030000	I Care sunglasses 1ct #3	1	Неклассифицированные/default	0	
4429919	089262035005	I Care sunglasses 1ct #4	1	Неклассифицированные/default	0	
4429920	089262036002	I Care sunglasses 1ct #5	1	Неклассифицированные/default	0	
4429921	089262037009	I Care sunglasses 1ct #6	1	Неклассифицированные/default	0	
1020120	309980209152	I carpine 8% 15ml opth	1	Неклассифицированные/default	0	
4429922	088677350499	I carried you	1	Неклассифицированные/default	0	
4429923	076171035356	I casa Lavender Air freshener 14.4oz	1	Неклассифицированные/default	0	
2157215	5391511530823	I charge USB car charger (el53082)	1	Неклассифицированные/default	0	
2157216	5391511532148	I charge USB charger (el53214)	1	Неклассифицированные/default	0	
1498364	075830262980	I charger	1	Неклассифицированные/default	0	
1498365	758302629879	I charger #2	1	Неклассифицированные/default	0	
4429924	708857736614	I ching - book of change by shambhala classics	1	Неклассифицированные/default	0	
4429925	014381510126	I claudius-epic that never was (DVD) (remastered/4discs)	1	Неклассифицированные/default	0	
4429926	070394000702	I clean shelf tray 1ct	1	Неклассифицированные/default	0	
4429927	685387081554	I clear i pod Classic case	1	Неклассифицированные/default	0	
1020121	5391511500376	I clip Mini fm radio with ear phones	1	Неклассифицированные/default	0	
1020122	021331691521	I cocepts /69152/ web cam 2 go kit *USB connection *small size* (clr2)	210851	Техника (folder)/Электротехника/Цифровая техника (folder)/Фотография и киносъемка/Digital Camera	0	
1020123	021331109484	I cocepts 10948 universal wireless pda keybord	278696	Техника (folder)/Электротехника/Цифровая техника (folder)/Аксессуары для мобильных устройств	0	
1020124	021331112477	I cocepts 11247 3in1 metal styli for ipaq 3800/3900 series	278696	Техника (folder)/Электротехника/Цифровая техника (folder)/Аксессуары для мобильных устройств	0	
1020125	021331130471	I cocepts 13047 thumb board for ipaq 3800/3900	278696	Техника (folder)/Электротехника/Цифровая техника (folder)/Аксессуары для мобильных устройств	0	
1020126	021331191472	I cocepts 19147 delax kit for Palm m500/m505/m515	278696	Техника (folder)/Электротехника/Цифровая техника (folder)/Аксессуары для мобильных устройств	0	
1020127	021331196477	I cocepts 19647 ipaq 3800/3900 series	278696	Техника (folder)/Электротехника/Цифровая техника (folder)/Аксессуары для мобильных устройств	0	
1020128	021331197474	I cocepts 19747 pda thaumb board for Palm m500/m505/m515 series	278696	Техника (folder)/Электротехника/Цифровая техника (folder)/Аксессуары для мобильных устройств	0	
1020129	021331198471	I cocepts 19847 pda thaumb board for ipaq 3800/3900 series	278696	Техника (folder)/Электротехника/Цифровая техника (folder)/Аксессуары для мобильных устройств	0	
1020130	021331199478	I cocepts 19947 de luxe kit for ipaq 3800/3900	278696	Техника (folder)/Электротехника/Цифровая техника (folder)/Аксессуары для мобильных устройств	0	
1020131	021331684462	I cocepts 68446 metal case for sony nx series	894266	Техника (folder)/Электротехника/Цифровая техника (folder)/ZCASES	0	
1020132	4082800012656	I coloniali conf. reg. chang mai	1	Неклассифицированные/default	0	
1020133	8032625390169	I coloniali conf. reg. magica forza	1	Неклассифицированные/default	0	
1020134	8032625390121	I coloniali conf. reg. sintonia degli elementi	1	Неклассифицированные/default	0	
1020135	8002135078284	I coloniali conf. reg. the empire cr. barba em. 10	1	Неклассифицированные/default	0	
4429928	086112275239	I come in peace video	1	Неклассифицированные/default	0	
4429929	089218432391	I cover the waterfront (DVD)	1	Неклассифицированные/default	0	
4429930	053039122618	I Cream of genie	1	Неклассифицированные/default	0	
4429931	4260134643030	I cum in your face	1	Неклассифицированные/default	0	
4429932	024543432869	I deal in danger 1966 (DVD/sensormatic)	1	Неклассифицированные/default	0	
607864	022735201873	I did it!	1	Неклассифицированные/default	0	
2972788	022735500334	I did it! #2	1	Неклассифицированные/default	0	
2972789	022735301771	I did it! #3	1	Неклассифицированные/default	0	
4429933	617258003136	I didn't know that came from the bible 6oz	1	Неклассифицированные/default	0	
4429934	617258002337	I didn't know that vol 1 revised	1	Неклассифицированные/default	0	
4429935	012236100645	I do (DVD) (ws/eng sub/frenspan sub/2.0)	1	Неклассифицированные/default	0	
1731419	012569589988	I do but i dont-lifetime (DVD-1.33)	2275105	Медиа (folder)/Медиа	0	
4429936	822333001987	I do i do bkl&wht gogocams	1	Неклассифицированные/default	0	
4429937	822333001857	I do i do Color gogocams	1	Неклассифицированные/default	0	
4429938	033700000162	I do know	1	Неклассифицированные/default	0	
4429939	653569356776	I Dog ampd	1	Неклассифицированные/default	0	
4429940	082860000024	I Dog Soft	1	Неклассифицированные/default	0	
2605213	085927875801	I dolci di montagna sfogliatine zuccherate sugar topped puff pastry	1	Неклассифицированные/default	2605212	I Dolci Di Montagna
4429941	601215826920	I don't believe you (single) by joee (universal music)	1	Неклассифицированные/default	0	
4429942	088677650438	I don't do mornings!	1	Неклассифицированные/default	0	
4429946	745889095142	I don't know how much it brian's son butch doesn't know what happened to the Code!!!	1	Неклассифицированные/default	0	
4429948	038775042086	I don't know Water gremlin round split shot sinkers	1	Неклассифицированные/default	0	
4429950	060072160095	I don't now t-mobile	1	Неклассифицированные/default	0	
4429944	047100001117	I dont know	1	Неклассифицированные/default	0	
4429945	681131385398	I dont know #2	1	Неклассифицированные/default	0	
4429947	826507077297	I dont know Jack (david lynch presents) (DVD)	1	Неклассифицированные/default	0	
4429949	736899096922	I dont know what your eyes have done to me (DVD)	1	Неклассифицированные/default	0	
4429951	029502954956	I dont want to be born (DVD)	1	Неклассифицированные/default	0	
4429952	712267271320	I dont want to sleep alone (DVD)	1	Неклассифицированные/default	0	
4429943	017153308259	I dont' give a damn (lo sam zayin)	1	Неклассифицированные/default	0	
4429953	833250001134	I dot connect model # 1134 pcmcia to compact Flash adapter	1	Неклассифицированные/default	0	
4429954	039414581430	I downloaded a ghost (DVD)	1	Неклассифицированные/default	0	
1498369	053137005318	I Dream of jeanie	1	Неклассифицированные/default	0	
4429955	089218450692	I Dream of jeanie (DVD)	1	Неклассифицированные/default	0	
4429956	096882060805	I Dream of jeannie Play set	1	Неклассифицированные/default	0	
4429957	043396129498	I Dream of jeannie-complete 1st season (DVD/4 disc/ff 1.33/mono/b&w)	1	Неклассифицированные/default	0	
4429958	043396136953	I Dream of jeannie-complete 1st season (DVD/4 disc/ff 1.33/mono/Color/sp-po	1	Неклассифицированные/default	0	
4429959	043396147751	I Dream of jeannie-complete 2nd season (DVD/4 disc/ff 1.33/mono/po-sp-both)	1	Неклассифицированные/default	0	
4429960	043396176522	I Dream of jeannie-complete 3rd season (DVD/4 disc/ff 1.33/mono/po-sp-both)	1	Неклассифицированные/default	0	
1731420	043396212282	I Dream of jeannie-complete 4th season (DVD/4 disc/ff 1.33/mono/en-sub/sp-p	2275105	Медиа (folder)/Медиа	0	
4429961	043396263024	I Dream of jeannie-complete series Box set (DVD/20 disc)	1	Неклассифицированные/default	0	
2010124	000732277459	I Dream of jenna #02-DVD	1980351	Adult/Adult DVD	0	
4429962	742617210525	I Dream of mimi (DVD/dolby digital stereo/eng-sub)	1	Неклассифицированные/default	0	
4429963	796401213490	I Dream of weenie	1	Неклассифицированные/default	0	
4429964	886975982929	I dreamed a Dream CD - susan biyle	1	Неклассифицированные/default	0	
4429965	043396041523	I dreamed of afroca vhs	1	Неклассифицированные/default	0	
4429966	807839003697	I dreamt under the Water (DVD/ws-1.78/french w/eng-sub)	1	Неклассифицированные/default	0	
4429967	797679000225	I drink your blood (DVD)	1	Неклассифицированные/default	0	
3135668	858701005134	I drink, multi-vitamin alkaline Water ph 9.0	330591	Продукты питания (folder)/Продукты питания	0	
1909981	013964459777	I ecko 2gb Blue USB drive ea	1	Неклассифицированные/default	0	
2157217	013964129991	I ecko 2gb eco frdly micro sd card ea	1	Неклассифицированные/default	0	
1909982	013964459692	I ecko 4gb Black USB drive ea	1	Неклассифицированные/default	0	
2157218	817710010713	I ecko 4gb Black USB drive ea #2	1	Неклассифицированные/default	0	
1909983	013961299840	I ecko 4gb eco frdly micro sd card ea	1	Неклассифицированные/default	0	
1909984	9177100100105	I ecko 4gb navy swivel USB drive ea	1	Неклассифицированные/default	0	
2157219	817710010010	I ecko 4gb navy swivel USB drive ea #2	1	Неклассифицированные/default	0	
1909985	013964459708	I ecko 8gb Silver USB drive ea	1	Неклассифицированные/default	0	
2157220	013964129816	I ecko alloy earbuds Black ea	1	Неклассифицированные/default	0	
2157221	817710010553	I ecko alloy earbuds pods Blue ea	1	Неклассифицированные/default	0	
2157222	817710010522	I ecko alloy earbuds pods Green ea	1	Неклассифицированные/default	0	
2157223	837654990889	I ecko budeez w/vol control Black ea	1	Неклассифицированные/default	0	
2157224	013964077803	I ecko budeez w/vol control Blue ea	1	Неклассифицированные/default	0	
2157225	013964077810	I ecko budeez w/vol control White ea	1	Неклассифицированные/default	0	
1909986	817710010195	I ecko essentals earphones Blue ea	1	Неклассифицированные/default	0	
1909987	817710010188	I ecko essentials earphones Black ea	1	Неклассифицированные/default	0	
1909988	817710010171	I ecko essentials earphones Green ea	1	Неклассифицированные/default	0	
1909989	8177400101711	I ecko essentials earphones Green ea #2	1	Неклассифицированные/default	0	
1909990	817710010201	I ecko essentials earphones pink ea	1	Неклассифицированные/default	0	
4429968	024726000090	I f i international inc cosmic Baby - kinetik CD	1	Неклассифицированные/default	0	
1909991	608940546444	I fancy you 7.5ml EDP splash Mini for women by Jessica simpson	3068	Парфюмерия (folder)/Парфюмерия	306285	Jessica Simpson
4429969	8809107330049	I floz Power Plus	1	Неклассифицированные/default	0	
2001072	820891607696	I fuck myself #2 DVD (sale)	1980351	Adult/Adult DVD	0	
4429970	098262111282	I gallon industrial pail Orange Color	1	Неклассифицированные/default	0	
4429971	8000139004063	I garofalo La pasta di gragnano fettucce	1	Неклассифицированные/default	0	
4429972	159001280123	I go 2000 series	1	Неклассифицированные/default	0	
4429973	040293010218	I go Power tips	1	Неклассифицированные/default	0	
1498370	6927964578175	I Gold mackerel 425g	1229537	Продукты питания (folder)/Консервы (folder)/Консервы	0	
602059	041457842522	I goody lycra Hair wrap 3ct	1	Неклассифицированные/default	301036	Goody
4429974	014381268522	I got five on it (DVD) dol dig/1.78:1	1	Неклассифицированные/default	0	
4429975	014381283099	I got five on it (umd/psp)	1	Неклассифицированные/default	0	
4429976	804869888997	I gotta go (DVD w/CD)	1	Неклассифицированные/default	0	
4429977	804869888898	I gotta go (DVD)	1	Неклассифицированные/default	0	
4429978	049489956149	I hate four letter words	1	Неклассифицированные/default	0	
4429979	032031133396	I hate to exercise i Love to tap (DVD)	1	Неклассифицированные/default	0	
4429980	751355458021	I have a bar Code	1	Неклассифицированные/default	0	
4429981	738329039523	I have found it (DVD/ltbx 2.35/eng-sub)	1	Неклассифицированные/default	0	
607865	022735308060	I have Jesus in my heart	1	Неклассифицированные/default	0	
2972790	022735371019	I have Jesus in my heart #2	1	Неклассифицированные/default	0	
4429982	9780613178112	I have lived a thousand years: growing up in t...	1	Неклассифицированные/default	0	
4429983	013131525694	I have never forgotton you-Life&legacy of simon wiesenthal (DVD/ws)	1	Неклассифицированные/default	0	
1498371	5060215330021	I heart Chardonnay	22133	Продукты питания (folder)/Алкогольные напитки/Вино (folder)/Вино	0	
2605215	736211845184	I heart keenwah quinoa clstr 3vrty dsp 36pcs	1	Неклассифицированные/default	2605214	I Heart Keenwah
2605216	736211802347	I heart keenwah quinoa clstr almond	1	Неклассифицированные/default	2605214	I Heart Keenwah
2605217	736211802446	I heart keenwah quinoa clstr choc seasl	1	Неклассифицированные/default	2605214	I Heart Keenwah
2605218	736211802545	I heart keenwah quinoa clstr cranberry cashe	1	Неклассифицированные/default	2605214	I Heart Keenwah
2605219	736211802644	I heart keenwah quinoa clstr gngr pnut	1	Неклассифицированные/default	2605214	I Heart Keenwah
2605220	736211884442	I heart keenwah quinoa clstr Peanut Butter	1	Неклассифицированные/default	2605214	I Heart Keenwah
1498372	5060215330007	I heart Rose	22133	Продукты питания (folder)/Алкогольные напитки/Вино (folder)/Вино	0	
1498373	5060215330014	I heart shiraz	22133	Продукты питания (folder)/Алкогольные напитки/Вино (folder)/Вино	0	
1020136	358790021010	I Heat Eye mask 02101	1	Неклассифицированные/default	0	
1020137	358790022109	I Heat Eye warming pads 10	1	Неклассифицированные/default	0	
