ID	UPCEAN	Name	CategoryID	CategoryName	BrandID	BrandName
2883705	4607138710021	Кофе ретро 0.090	19716	Продукты питания (folder)/Чай и кофе/Кофе	0	
1238962	5904277113843	Кофе ринкафе сублемир 200г	19716	Продукты питания (folder)/Чай и кофе/Кофе	0	
1238963	5904277113850	Кофе ринкофе агломер 200г	19716	Продукты питания (folder)/Чай и кофе/Кофе	0	
30509	4607048240069	Кофе риосан 3/1 20x 18г пакет 50	19716	Продукты питания (folder)/Чай и кофе/Кофе	30508	РИО-САН
74636	4607008570038	Кофе рк аромат зерно 100г	74065	Продукты питания (folder)/Чай и кофе/Кофе зерно	74635	Роскафе
74640	4607008570083	Кофе рк нектар зерно 100г	74065	Продукты питания (folder)/Чай и кофе/Кофе зерно	74635	Роскафе
74642	4607008570069	Кофе рк нектар молот 100г	74063	Продукты питания (folder)/Чай и кофе/Кофе молотый	74635	Роскафе
74644	4607008570182	Кофе рк нектар Премиум молот 300г	74063	Продукты питания (folder)/Чай и кофе/Кофе молотый	74635	Роскафе
74645	4607008570137	Кофе рк Престиж зерно 100г	74065	Продукты питания (folder)/Чай и кофе/Кофе зерно	74635	Роскафе
74647	4607008570113	Кофе рк Престиж молот 100г	74063	Продукты питания (folder)/Чай и кофе/Кофе молотый	74635	Роскафе
74649	4607008570199	Кофе рк Престиж Премиум молот 300г	74063	Продукты питания (folder)/Чай и кофе/Кофе молотый	74635	Роскафе
74650	4607008570168	Кофе рк эспрессо зерно 100г	74065	Продукты питания (folder)/Чай и кофе/Кофе зерно	74635	Роскафе
74651	4607008570175	Кофе рк эспрессо зерно 250г	74065	Продукты питания (folder)/Чай и кофе/Кофе зерно	74635	Роскафе
74653	4607008570212	Кофе рк эспрессо молот 250г	74063	Продукты питания (folder)/Чай и кофе/Кофе молотый	74635	Роскафе
1238964	541019301912	Кофе роберто тотти nobile мол пак 0.250	19716	Продукты питания (folder)/Чай и кофе/Кофе	0	
156965	4009041101901	Кофе роберто тотти nobile раств Mild с/б 0.10	19716	Продукты питания (folder)/Чай и кофе/Кофе	3740749	ROBERTO TOTTI
3373409	8003012101064	Кофе роберто тотти эспрэссо молотый 250г	19716	Продукты питания (folder)/Чай и кофе/Кофе	0	
287467	22124159	Кофе ромовое масло в зернах	19716	Продукты питания (folder)/Чай и кофе/Кофе	0	
74637	4607008570045	Кофе роскафе аромат зерно 0.250	74065	Продукты питания (folder)/Чай и кофе/Кофе зерно	74635	Роскафе
74639	4607008570021	Кофе роскафе аромат молотый 0.250	74063	Продукты питания (folder)/Чай и кофе/Кофе молотый	74635	Роскафе
156966	4607008570236	Кофе роскафе голд арабика 95г пластик	19716	Продукты питания (folder)/Чай и кофе/Кофе	0	
74641	4607008570090	Кофе роскафе нектар зерно 0.250	74065	Продукты питания (folder)/Чай и кофе/Кофе зерно	74635	Роскафе
74643	4607008570076	Кофе роскафе нектар молотый 0.250	74063	Продукты питания (folder)/Чай и кофе/Кофе молотый	74635	Роскафе
74646	4607008570144	Кофе роскафе Престиж зерно 0.25	74065	Продукты питания (folder)/Чай и кофе/Кофе зерно	74635	Роскафе
74648	4607008570120	Кофе роскафе Престиж молотый 0.25	74063	Продукты питания (folder)/Чай и кофе/Кофе молотый	74635	Роскафе
1238965	460700857012	Кофе роскафе эспрессо молотый 0.25	19716	Продукты питания (folder)/Чай и кофе/Кофе	0	
2883707	4750416000366	Кофе роял плантейшн жб 0.100	19716	Продукты питания (folder)/Чай и кофе/Кофе	3742083	ROYAL PLANTATION (FAVORIT/ SPB)
2883711	4602112500667	Кофе рускафе 0.100	19716	Продукты питания (folder)/Чай и кофе/Кофе	0	
2883712	4602112000075	Кофе рускафе арабика 0.100	19716	Продукты питания (folder)/Чай и кофе/Кофе	0	
2448064	4602112000068	Кофе рускафе классик нат раств с/б 0.100	19729	Продукты питания (folder)/Чай и кофе/Кофе растворимый	0	
2448065	4602112000082	Кофе рускафе лайт нат раств с/б 0.100	19729	Продукты питания (folder)/Чай и кофе/Кофе растворимый	0	
1238966	4820060140012	Кофе Русская кофейня 3в1 айриш Крем 20г	19716	Продукты питания (folder)/Чай и кофе/Кофе	0	
1238967	4820060140227	Кофе Русская кофейня 3в1 карамель 20г	19716	Продукты питания (folder)/Чай и кофе/Кофе	0	
1238968	4820060140272	Кофе Русская кофейня 3в1 классический 20г	19716	Продукты питания (folder)/Чай и кофе/Кофе	0	
1238969	4820060140166	Кофе Русская кофейня 3в1 крепкий 20г	19716	Продукты питания (folder)/Чай и кофе/Кофе	0	
1238970	4820060140234	Кофе Русская кофейня 3в1 легкий 20г	19716	Продукты питания (folder)/Чай и кофе/Кофе	0	
1238971	4820060140050	Кофе Русская кофейня 3в1 лесной орех 20г	19716	Продукты питания (folder)/Чай и кофе/Кофе	0	
1238972	4820060140074	Кофе Русская кофейня 3в1 мягкий 20г	19716	Продукты питания (folder)/Чай и кофе/Кофе	0	
1238973	4820060140159	Кофе Русская кофейня 3в1 мягкий 20г #2	19716	Продукты питания (folder)/Чай и кофе/Кофе	0	
1238974	8901030081026	Кофе Русская кофейня жб 100г	19716	Продукты питания (folder)/Чай и кофе/Кофе	0	
1238975	8901030081033	Кофе Русская кофейня жб 200г	19716	Продукты питания (folder)/Чай и кофе/Кофе	0	
1238976	8901030081415	Кофе Русская кофейня жб 50г	19716	Продукты питания (folder)/Чай и кофе/Кофе	0	
1238977	4820060140142	Кофе Русская кофейня крепкий 2.5г	19716	Продукты питания (folder)/Чай и кофе/Кофе	0	
1238978	4820060140104	Кофе Русская кофейня мягкий 2.5г	19716	Продукты питания (folder)/Чай и кофе/Кофе	0	
3373410	4600946001442	Кофе Русский кураж арабика жареный молотый французской обжарки 190г м/у	19716	Продукты питания (folder)/Чай и кофе/Кофе	3844799	кураж (KUPPO AO)
287468	4602112100300	Кофе Русский продукт 95/100г раствор. жесть ассортим	19716	Продукты питания (folder)/Чай и кофе/Кофе	3923711	традиция VKUSA
2883708	4602112100287	Кофе Русский продукт arabica, натур жарен. в зернах, 200г м/у	19716	Продукты питания (folder)/Чай и кофе/Кофе	88	Русский Продукт
2883710	4602112100294	Кофе Русский продукт arabica, натур жарен. в зернах, 500г м/у	19716	Продукты питания (folder)/Чай и кофе/Кофе	30357	Черная Карта
2447831	460211210122	Кофе Русский продукт амаретто ликер нат мол 0.200	74063	Продукты питания (folder)/Чай и кофе/Кофе молотый	0	
3373411	4602112101222	Кофе Русский продукт амаретто, молот 200г м/у	19716	Продукты питания (folder)/Чай и кофе/Кофе	0	
1780542	4600669150076	Кофе Русский продукт арабика жар.в зерн.в/с 200г	19716	Продукты питания (folder)/Чай и кофе/Кофе	88	Русский Продукт
2883709	4602112100263	Кофе Русский продукт арабика зер.1сорт 200г	19716	Продукты питания (folder)/Чай и кофе/Кофе	88	Русский Продукт
74240	4602112100713	Кофе Русский продукт ирландский ликер нат мол 0.200	74063	Продукты питания (folder)/Чай и кофе/Кофе молотый	0	
2447919	4602112101581	Кофе Русский продукт калимантан жб 0.100	19729	Продукты питания (folder)/Чай и кофе/Кофе растворимый	3678523	KALIMANTAN
2448063	460211210030	Кофе Русский продукт нат раств жб 0.100	330591	Продукты питания (folder)/Продукты питания	0	
3839480	4602112500780	Кофе Русский продукт традиция вкуса 3г	19729	Продукты питания (folder)/Чай и кофе/Кофе растворимый	88	Русский Продукт
3839481	4602112500919	Кофе Русский продукт традиция вкуса 3г #2	19729	Продукты питания (folder)/Чай и кофе/Кофе растворимый	88	Русский Продукт
1238979	4606855900029	Кофе Русский цикорий еремеево растворим 200г	19716	Продукты питания (folder)/Чай и кофе/Кофе	0	
3373412	4607084303087	Кофе сава классический 3в1 16г м/уп	19716	Продукты питания (folder)/Чай и кофе/Кофе	0	
2448066	6420101440521	Кофе салудо молот 0.500	74063	Продукты питания (folder)/Чай и кофе/Кофе молотый	0	
2883713	8034049840411	Кофе сантеа 100%арабика молот.мягк.обжарка жб 250г	19716	Продукты питания (folder)/Чай и кофе/Кофе	0	
74655	7898910074036	Кофе санто антонио голд зерно 1000г	74065	Продукты питания (folder)/Чай и кофе/Кофе зерно	74654	Санто Антонио
74656	7898910074043	Кофе санто антонио декафенат зерно 500г	74065	Продукты питания (folder)/Чай и кофе/Кофе зерно	74654	Санто Антонио
74657	7898910074012	Кофе санто антонио платинум зерно 500г	74065	Продукты питания (folder)/Чай и кофе/Кофе зерно	74654	Санто Антонио
74658	7898910074029	Кофе санто антонио Премиум зерно 1000г	74065	Продукты питания (folder)/Чай и кофе/Кофе зерно	74654	Санто Антонио
740692	748350000607	Кофе сантодоминго индубан молот.283г	19716	Продукты питания (folder)/Чай и кофе/Кофе	740688	Санто Доминго
2448068	4607001830412	Кофе сантос раств жб 0.100	19729	Продукты питания (folder)/Чай и кофе/Кофе растворимый	0	
2883714	3149330001817	Кофе сати био перу молотый вак уп 0.250	19716	Продукты питания (folder)/Чай и кофе/Кофе	2386856	SATI
2883715	3149330003088	Кофе сати бразилия молотый вак уп 0.250	19716	Продукты питания (folder)/Чай и кофе/Кофе	0	
2883717	3149330001725	Кофе сати ньюр экскьюзе зерновой 0.250	19716	Продукты питания (folder)/Чай и кофе/Кофе	2386856	SATI
2237941	3149330001985	Кофе сати онкл ханси зерно 1кг	74065	Продукты питания (folder)/Чай и кофе/Кофе зерно	2237940	Сати
2237942	3149330001978	Кофе сати онкл ханси молотый 250г	74063	Продукты питания (folder)/Чай и кофе/Кофе молотый	2237940	Сати
2883719	3149330001930	Кофе сати экспрессо зерновой вак уп 0.250	19716	Продукты питания (folder)/Чай и кофе/Кофе	0	
74659	4602026001953	Кофе себастиан альгаро лейенда молот 250г	74063	Продукты питания (folder)/Чай и кофе/Кофе молотый	0	
74660	4602026001946	Кофе себастиан альгаро мистерио молот 250г	74063	Продукты питания (folder)/Чай и кофе/Кофе молотый	0	
74661	4602026001960	Кофе себастиан альгаро хисториа молот 250г	74063	Продукты питания (folder)/Чай и кофе/Кофе молотый	0	
156967	4602026001144	Кофе себастьян нат раств гран жб 0.090	19716	Продукты питания (folder)/Чай и кофе/Кофе	0	
1238982	8003410344315	Кофе сегафредо интермеццо молот.250г	19716	Продукты питания (folder)/Чай и кофе/Кофе	1238981	Сегафредо
1238983	8003410311041	Кофе сегафредо эспрессо каза зерно 250г	19716	Продукты питания (folder)/Чай и кофе/Кофе	1238981	Сегафредо
3373413	4602076000166	Кофе серенада натуральный жареный в зернах 1сорт 100г м/у	19716	Продукты питания (folder)/Чай и кофе/Кофе	3748465	SERENADA (PRODUKT-SERVIS/LYUBERTSY)
74666	4009041100270	Кофе сильвер лайбл раств 100г	19729	Продукты питания (folder)/Чай и кофе/Кофе растворимый	0	
74668	8436017451443	Кофе сильвестре бразиль туркеса зерно 0.25кг	74065	Продукты питания (folder)/Чай и кофе/Кофе зерно	74667	Сильвестре
74669	8436017450163	Кофе сильвестре карибана зерно 1кг	74065	Продукты питания (folder)/Чай и кофе/Кофе зерно	74667	Сильвестре
74670	8436017451412	Кофе сильвестре колумбия декаф.зерно 0.25кг	74065	Продукты питания (folder)/Чай и кофе/Кофе зерно	74667	Сильвестре
74671	8436017451450	Кофе сильвестре колумбия органическ.зерно 0.25кг	74065	Продукты питания (folder)/Чай и кофе/Кофе зерно	74667	Сильвестре
74672	8436017451009	Кофе сильвестре натуральная смесь зерно 0.25кг	74065	Продукты питания (folder)/Чай и кофе/Кофе зерно	74667	Сильвестре
74673	8436017450057	Кофе сильвестре смесь арабика зерно 1кг	74065	Продукты питания (folder)/Чай и кофе/Кофе зерно	74667	Сильвестре
74674	8436017451467	Кофе сильвестре эфиопия лиму зерно 0.25кг	74065	Продукты питания (folder)/Чай и кофе/Кофе зерно	74667	Сильвестре
740681	4605498002756	Кофе скз натуральный со сгущенным молоком и сахаром 7% doypack 100г	24323	Продукты питания (folder)/Молочные продукты (folder)/Молоко сгущенное	720093	СКЗ
2741074	4605498000813	Кофе скз со сщеным молоком 7% 300г м/у	67200	Продукты питания (folder)/Молочные продукты (folder)/Молоко, сливки	0	
2734285	4607039974447	Кофе слим фоpм эффект натуальный 10 саше по 2.5г	19716	Продукты питания (folder)/Чай и кофе/Кофе	0	
2734286	4607039974362	Кофе слим фоpм эффект натуальный 100г	19716	Продукты питания (folder)/Чай и кофе/Кофе	0	
2734287	4607039974416	Кофе слим фоpм эффект с аpоматом капучино 10 саше по 2.5г	19716	Продукты питания (folder)/Чай и кофе/Кофе	0	
2734288	4607039972757	Кофе слим фоpм эффект с аpоматом капучино 100г	19716	Продукты питания (folder)/Чай и кофе/Кофе	0	
84499	4603274000682	Кофе со сгущен молоком и сах густияр 380г х 20 союзконсервмолоко (ту)	24323	Продукты питания (folder)/Молочные продукты (folder)/Молоко сгущенное	40749	Алексеевский МКК
549399	4603406001822	Кофе со сгущен молоком и сах молочная страна doypack 270г х 12 промконсервы	19716	Продукты питания (folder)/Чай и кофе/Кофе	0	
74676	4603301000302	Кофе софи 3в1 18г	19729	Продукты питания (folder)/Чай и кофе/Кофе растворимый	0	
2957471	4603301345908	Кофе софи 3в1 18г #2	19729	Продукты питания (folder)/Чай и кофе/Кофе растворимый	0	
2957472	4603301345809	Кофе софи 3в1 18г #3	19729	Продукты питания (folder)/Чай и кофе/Кофе растворимый	0	
3839482	4660011280349	Кофе среднеобж молот арабика Gold amber	74063	Продукты питания (folder)/Чай и кофе/Кофе молотый	0	
3839483	4660011280189	Кофе среднеобжар арабика, помол для турки	74063	Продукты питания (folder)/Чай и кофе/Кофе молотый	0	
3839484	4660011280356	Кофе среднеобжаренный молотый арабика 1	74063	Продукты питания (folder)/Чай и кофе/Кофе молотый	0	
74677	4602112102809	Кофе старая мельница раств 100г	19729	Продукты питания (folder)/Чай и кофе/Кофе растворимый	0	
287478	22018441	Кофе старые английские сливки в зерн.	19716	Продукты питания (folder)/Чай и кофе/Кофе	0	
74679	8032680060052	Кофе стефан 100% арабика молот 250г	74063	Продукты питания (folder)/Чай и кофе/Кофе молотый	74678	Стефан
74680	8032680060083	Кофе стефан 100% арабика молот б/коф.250г	74063	Продукты питания (folder)/Чай и кофе/Кофе молотый	74678	Стефан
74681	8032680060168	Кофе стефан 100% арабика топ бизнес раств 150г	19729	Продукты питания (folder)/Чай и кофе/Кофе растворимый	74678	Стефан
74682	8032680060076	Кофе стефан 100% арабика чалды 25x 7г	19729	Продукты питания (folder)/Чай и кофе/Кофе растворимый	74678	Стефан
74683	8032680060045	Кофе стефан 60% арабика молот 250г	74063	Продукты питания (folder)/Чай и кофе/Кофе молотый	74678	Стефан
74684	8032680060069	Кофе стефан 60% арабика чалды 25x 7г	74063	Продукты питания (folder)/Чай и кофе/Кофе молотый	74678	Стефан
2883721	6411300160549	Кофе стокманн ориджинал молот.500г	19716	Продукты питания (folder)/Чай и кофе/Кофе	0	
2883722	4607051541344	Кофе сублимированный columbian мягкая упаковка 140г 140г	19716	Продукты питания (folder)/Чай и кофе/Кофе	3703570	MAXIMUS (DOBRYNYA GK)
2883723	4607051541351	Кофе сублимированный columbian мягкая упаковка 230г ложка в подарок 230г	19716	Продукты питания (folder)/Чай и кофе/Кофе	3703570	MAXIMUS (DOBRYNYA GK)
2734167	4607051541696	Кофе сублимированный в стеклянной кружке columbian 70г 75г	19716	Продукты питания (folder)/Чай и кофе/Кофе	3703570	MAXIMUS (DOBRYNYA GK)
2883727	4607051543003	Кофе сублимированный в стеклянной кружке d'oro 70г 70г	19716	Продукты питания (folder)/Чай и кофе/Кофе	3703570	MAXIMUS (DOBRYNYA GK)
1780453	4607051541689	Кофе сублимированный в стеклянной кружке Gold 70г 75г	19716	Продукты питания (folder)/Чай и кофе/Кофе	3703570	MAXIMUS (DOBRYNYA GK)
2883728	4607051542990	Кофе сублимированный в стеклянной кружке nero 70г 70г	19716	Продукты питания (folder)/Чай и кофе/Кофе	3703570	MAXIMUS (DOBRYNYA GK)
3373414	4006581171838	Кофе сублимированный моцарт кофе 100г	19716	Продукты питания (folder)/Чай и кофе/Кофе	0	
1238984	4810278002509	Кофе сублимированый т.м. Cafe brazza Diamond м/у (doypack) 90г страна ввоза-литва расфасована в белорусии уп макбор оо белои	19716	Продукты питания (folder)/Чай и кофе/Кофе	0	
287479	22068460	Кофе суматра в зернах	19716	Продукты питания (folder)/Чай и кофе/Кофе	0	
2448071	888824005131	Кофе супер 3в1 0.020	19729	Продукты питания (folder)/Чай и кофе/Кофе растворимый	0	
3373415	8006066001045	Кофе супер крема espresso натуральный молотый обжареный 250г ст/б	19716	Продукты питания (folder)/Чай и кофе/Кофе	0	
2237943	4680016090231	Кофе супергринфуд зерна обжар.в сыром шок.100г	74065	Продукты питания (folder)/Чай и кофе/Кофе зерно	2234227	СуперГринФуд
2448073	789601920169	Кофе супремо раств жб 0.100	19729	Продукты питания (folder)/Чай и кофе/Кофе растворимый	0	
2448074	7892222110031	Кофе супремо раств жб 0.100 #2	19729	Продукты питания (folder)/Чай и кофе/Кофе растворимый	0	
74686	8008282001007	Кофе таза д'оро бар де Люкс эспрессо зерно 1000г	74065	Продукты питания (folder)/Чай и кофе/Кофе зерно	74685	Таза Д'Оро
74687	696354001307	Кофе таза д'оро глобал эспрессо зерно 1000г	74065	Продукты питания (folder)/Чай и кофе/Кофе зерно	74685	Таза Д'Оро
74688	8008282001311	Кофе таза д'оро оро бланко эспрессо зерно 1000г	74065	Продукты питания (folder)/Чай и кофе/Кофе зерно	74685	Таза Д'Оро
74689	696354001284	Кофе таза д'оро регина аква дек молот жб 250г	74063	Продукты питания (folder)/Чай и кофе/Кофе молотый	74685	Таза Д'Оро
74690	696354001086	Кофе таза д'оро регина блю г.фильтер молот жб 250г	74063	Продукты питания (folder)/Чай и кофе/Кофе молотый	74685	Таза Д'Оро
74691	696354001147	Кофе таза д'оро регина вайт голд молот вак уп 250г	74063	Продукты питания (folder)/Чай и кофе/Кофе молотый	74685	Таза Д'Оро
74692	696354001055	Кофе таза д'оро регина мока молот жб 250г	74063	Продукты питания (folder)/Чай и кофе/Кофе молотый	74685	Таза Д'Оро
74693	8008282001168	Кофе таза д'оро регина пур платинум молот вак уп 250г	74063	Продукты питания (folder)/Чай и кофе/Кофе молотый	74685	Таза Д'Оро
74694	696354001093	Кофе таза д'оро регина ред голд фильтр молот жб 250г	74063	Продукты питания (folder)/Чай и кофе/Кофе молотый	74685	Таза Д'Оро
74695	696354001154	Кофе таза д'оро регина солид голд молот вак уп 250г	74063	Продукты питания (folder)/Чай и кофе/Кофе молотый	74685	Таза Д'Оро
74696	096354001039	Кофе таза д'оро регина эспрессо молот.жб 250г	74063	Продукты питания (folder)/Чай и кофе/Кофе молотый	74685	Таза Д'Оро
