ID	UPCEAN	Name	CategoryID	CategoryName	BrandID	BrandName
1105773	060245401130	Purell w/Aloe refill 591ml	1382000	Гигиена (folder)/HAND SANITIZER	305240	Purell
2663551	073852041644	Purell wipes personal pak 15 ct	1	Неклассифицированные/default	305240	Purell
1741141	073852013214	Purell,oceanmist,8oz,Blue 3012-12-cmr	1	Неклассифицированные/default	0	
1741142	073852013221	Purell,springbloom pink,8oz 3014-12-cmr	1	Неклассифицированные/default	0	
3191026	033776017712	Purely better buttery Spread	330591	Продукты питания (folder)/Продукты питания	0	
3191027	033776017767	Purely better buttery Spread #2	330591	Продукты питания (folder)/Продукты питания	0	
1105776	065279100240	Purely bulk arrowroot flour 300g	330591	Продукты питания (folder)/Продукты питания	1105775	Purely Bulk
1105777	065279100011	Purely bulk baking Powder non aluminium 475g	330591	Продукты питания (folder)/Продукты питания	1105775	Purely Bulk
1105778	065279100646	Purely bulk bee pollen granules 150g	330591	Продукты питания (folder)/Продукты питания	1105775	Purely Bulk
1105779	065279100035	Purely bulk carob chips no sugar/dairy 200g	330591	Продукты питания (folder)/Продукты питания	1105775	Purely Bulk
1105780	065279101018	Purely bulk carob Powder 250g	330591	Продукты питания (folder)/Продукты питания	1105775	Purely Bulk
1105781	065279101117	Purely bulk flaked nutritional yeast 180g	330591	Продукты питания (folder)/Продукты питания	1105775	Purely Bulk
1105782	065279120118	Purely bulk gf all purpose flour 1kg	330591	Продукты питания (folder)/Продукты питания	1105775	Purely Bulk
1105783	065279120019	Purely bulk gf banana bread Mix 634g	330591	Продукты питания (folder)/Продукты питания	1105775	Purely Bulk
1105784	065279120026	Purely bulk gf brownie Mix 500g	330591	Продукты питания (folder)/Продукты питания	1105775	Purely Bulk
1105785	065279120033	Purely bulk gf cookie Mix 674g	330591	Продукты питания (folder)/Продукты питания	1105775	Purely Bulk
1105786	065279120057	Purely bulk gf pancake Mix 542g	330591	Продукты питания (folder)/Продукты питания	1105775	Purely Bulk
1105787	065279120064	Purely bulk gf pizza crust Mix 560g	330591	Продукты питания (folder)/Продукты питания	1105775	Purely Bulk
1105788	065279101179	Purely bulk lecithin granules 375g	330591	Продукты питания (folder)/Продукты питания	1105775	Purely Bulk
1105789	065279100431	Purely bulk oat bran 200g	330591	Продукты питания (folder)/Продукты питания	1105775	Purely Bulk
1105790	065279100622	Purely bulk psyllium husks 150g	330591	Продукты питания (folder)/Продукты питания	1105775	Purely Bulk
1105791	065279100455	Purely bulk Rice bran 200g	330591	Продукты питания (folder)/Продукты питания	1105775	Purely Bulk
1105792	065279100639	Purely bulk soya protein Powder 350g	330591	Продукты питания (folder)/Продукты питания	1105775	Purely Bulk
1105793	065279101360	Purely bulk steel cut oats 700g	330591	Продукты питания (folder)/Продукты питания	1105775	Purely Bulk
1105794	065279101650	Purely bulk supreme seeds 330g	330591	Продукты питания (folder)/Продукты питания	1105775	Purely Bulk
1105795	065279100523	Purely bulk textured vegetable protein 300g	330591	Продукты питания (folder)/Продукты питания	1105775	Purely Bulk
560134	852244003008	Purely chocolate Rich fudgy chocolate	30752	Продукты питания (folder)/Мороженое	560133	ARCTIC ZERO
642827	744473470464	Purely decadent frozen dessert ccntmlk cookie dough 16oz	1	Неклассифицированные/default	642824	Purely Decadent
2002764	716770061393	Purely decadent pink	1980172	Adult/All Novelties	0	
2002765	716770061409	Purely decadent purple	1980172	Adult/All Novelties	0	
1612765	744473480739	Purely decadent soy Milk non dairy frozen dessert Cherry nirvana pint One pint (473ml) nogmo	1	Неклассифицированные/default	642824	Purely Decadent
1418162	744473480586	Purely decadent soy Milk non dairy frozen dessert chocolate brownie almond pint One pint (473ml) nogmo	1	Неклассифицированные/default	642824	Purely Decadent
2188797	744473260218	Purely decadent soy Milk non dairy frozen dessert chocolate Obsession pint us/ca 500ml nogmo	2056975	Продукты питания (folder)/Alternative Dairy Products	642824	Purely Decadent
642830	744473480210	Purely decadent soy Milk non dairy frozen dessert chocolate Obsession pint us/ca One pint (473ml) nogmo	1	Неклассифицированные/default	642824	Purely Decadent
2188798	744473260300	Purely decadent soy Milk non dairy frozen dessert cookie avalanche pint us/ca 500ml nogmo	2056975	Продукты питания (folder)/Alternative Dairy Products	642824	Purely Decadent
642832	744473480463	Purely decadent soy Milk non dairy frozen dessert cookie dough pint One pint (473ml) nogmo	30752	Продукты питания (folder)/Мороженое	642824	Purely Decadent
1612881	744473480555	Purely decadent soy Milk non dairy frozen dessert mint chocolate chip pint One pint (473ml) nogmo	1	Неклассифицированные/default	642824	Purely Decadent
1542959	744473480234	Purely decadent soy Milk non dairy frozen dessert mocha almond fudge pint 1 pint nogmo	1	Неклассифицированные/default	642824	Purely Decadent
2188799	744473260621	Purely decadent soy Milk non dairy frozen dessert Peanut Butter zig zag pint us/ca 500ml nogmo	2056975	Продукты питания (folder)/Alternative Dairy Products	642824	Purely Decadent
1576749	744473480166	Purely decadent soy Milk non dairy frozen dessert pomegranate chip pint One pint (473ml) nogmo	30752	Продукты питания (folder)/Мороженое	642824	Purely Decadent
1578361	744473480661	Purely decadent soy Milk non dairy frozen dessert praline pecan pint One pint (473ml) nogmo	1	Неклассифицированные/default	642824	Purely Decadent
1612889	744473480920	Purely decadent soy Milk non dairy frozen dessert purely vanilla bars 3 bars/net 9.0floz (266ml) nogmo	1	Неклассифицированные/default	642824	Purely Decadent
2188800	744473260119	Purely decadent soy Milk non dairy frozen dessert purely vanilla pint us/ca 500ml nogmo	2056975	Продукты питания (folder)/Alternative Dairy Products	642824	Purely Decadent
2188801	744473260010	Purely decadent soy Milk non dairy frozen dessert turtle trails pint us/ca 500ml nogmo	2056975	Продукты питания (folder)/Alternative Dairy Products	642824	Purely Decadent
642834	744473480012	Purely decadent soy Milk non dairy frozen dessert turtle trails pint us/ca One pint (473ml) nogmo	1	Неклассифицированные/default	642824	Purely Decadent
2188802	744473480937	Purely decadent soy Milk non dairy frozen dessert vanilla almond bars 3 bars/net 9.0floz (266ml) nogmo	2056975	Продукты питания (folder)/Alternative Dairy Products	642824	Purely Decadent
2188804	855140002144	Purely elizabeth ancient grain granola cereal cranberry pecan 12.5oz nogmo	2025787	Продукты питания (folder)/Cereal & Breakfast Foods	2188803	Purely Elizabeth
2188805	855140002205	Purely elizabeth ancient grain granola cereal cranberry pecan 2oz nogmo	2025787	Продукты питания (folder)/Cereal & Breakfast Foods	2188803	Purely Elizabeth
2188806	855140002175	Purely elizabeth ancient grain granola cereal Original 12.5 nogmo	2025787	Продукты питания (folder)/Cereal & Breakfast Foods	2188803	Purely Elizabeth
2188807	855140002212	Purely elizabeth ancient grain granola cereal Original 2oz nogmo	2025787	Продукты питания (folder)/Cereal & Breakfast Foods	2188803	Purely Elizabeth
2188808	855140002151	Purely elizabeth ancient grain granola cereal pumpkin fig 12.5oz nogmo	2025787	Продукты питания (folder)/Cereal & Breakfast Foods	2188803	Purely Elizabeth
2188809	855140002229	Purely elizabeth ancient grain granola cereal pumpkin fig 2oz nogmo	2025787	Продукты питания (folder)/Cereal & Breakfast Foods	2188803	Purely Elizabeth
2188810	855140002168	Purely elizabeth Blueberry hemp ancient grain granola cereal 12.5oz nogmo	2025787	Продукты питания (folder)/Cereal & Breakfast Foods	2188803	Purely Elizabeth
2188811	855140002199	Purely elizabeth Blueberry hemp ancient grain granola cereal 2oz nogmo	2025787	Продукты питания (folder)/Cereal & Breakfast Foods	2188803	Purely Elizabeth
2663552	855140002311	Purely elizabeth cereal 6grain Hot org	1	Неклассифицированные/default	2188803	Purely Elizabeth
2188812	855140002045	Purely elizabeth chocolate chip cookie Mix 15.5oz nogmo	40119	Продукты питания (folder)/Хлебо-булочные изделия	2188803	Purely Elizabeth
2663553	855140002298	Purely elizabeth oatmeal aple cnnmn org	1	Неклассифицированные/default	2188803	Purely Elizabeth
2188813	855140002052	Purely elizabeth oatmeal Cherry chocolate chip cookie Mix 1 lb. nogmo	40119	Продукты питания (folder)/Хлебо-булочные изделия	2188803	Purely Elizabeth
2188814	855140002069	Purely elizabeth oatmeal cinnamon raisin cookie Mix 15.5oz nogmo	40119	Продукты питания (folder)/Хлебо-булочные изделия	2188803	Purely Elizabeth
2663554	855140002281	Purely elizabeth oatmeal cranberry pmpkn org	1	Неклассифицированные/default	2188803	Purely Elizabeth
2663555	855140002304	Purely elizabeth oatmeal Original org	1	Неклассифицированные/default	2188803	Purely Elizabeth
3191028	855140002502	Purely elizabeth, ancient granola + puffs cereal, pumpkin fig	330591	Продукты питания (folder)/Продукты питания	0	
2663557	631656604764	Purely inspired 100% Pure garcinia cambogia+ - 100 ct	1	Неклассифицированные/default	2663556	Purely Inspired
2663558	631656603514	Purely inspired weight loss Green coffee bean - 60 ct	1	Неклассифицированные/default	2663556	Purely Inspired
2663559	631656603491	Purely inspired weight loss Raspberry ketones+ - 60 ct	1	Неклассифицированные/default	2663556	Purely Inspired
1582752	857794001047	Purely Juice 100% Juice - pomegranate Blueberry pomegranate Juice from concentrate, Blueberry Juice concentrate and other natur	1	Неклассифицированные/default	0	
1582753	857794001023	Purely Juice Cherry pomegranate Juice	1	Неклассифицированные/default	0	
1582754	857794001030	Purely Juice Juice - 100% pomegranate	1	Неклассифицированные/default	0	
1582755	857794001009	Purely Juice Juice - pomegranate	1	Неклассифицированные/default	0	
1582756	857794001184	Purely Juice Juice - pomegranate #2	1	Неклассифицированные/default	0	
1582757	857794001016	Purely Juice Juice - pomegranate Blueberry	1	Неклассифицированные/default	0	
1582758	857794001191	Purely Juice pomegranate delight	1	Неклассифицированные/default	0	
3191029	046567031002	Purely made almonds	330591	Продукты питания (folder)/Продукты питания	3001883	Raley's
3191030	046567506678	Purely made applewood smoked uncured bacon	330591	Продукты питания (folder)/Продукты питания	3001883	Raley's
3191031	046567032238	Purely made Black tea	330591	Продукты питания (folder)/Продукты питания	3001883	Raley's
3191032	046567030975	Purely made cashews halves&pieces	330591	Продукты питания (folder)/Продукты питания	3001883	Raley's
3191033	046567030746	Purely made chunk skipjack tuna in Water pole&Line caught	330591	Продукты питания (folder)/Продукты питания	3001883	Raley's
3191034	046567037400	Purely made Dark chocolate bar	330591	Продукты питания (folder)/Продукты питания	3001883	Raley's
3191035	046567030647	Purely made fat free spicy refried beans	330591	Продукты питания (folder)/Продукты питания	3001883	Raley's
3191036	046567029887	Purely made freeze dried apples	330591	Продукты питания (folder)/Продукты питания	3001883	Raley's
3191037	046567031613	Purely made hemp seed	330591	Продукты питания (folder)/Продукты питания	3001883	Raley's
3156127	046567030876	Purely made marinara pasta sauce	330591	Продукты питания (folder)/Продукты питания	3001883	Raley's
3191038	046567031064	Purely made spanish peanuts	330591	Продукты питания (folder)/Продукты питания	3001883	Raley's
3191039	046567029948	Purely made sweetened banana chips	330591	Продукты питания (folder)/Продукты питания	3001883	Raley's
3191040	046567031026	Purely made whole cashews	330591	Продукты питания (folder)/Продукты питания	3001883	Raley's
1582759	021245367666	Purely magnesium	1	Неклассифицированные/default	0	
1105797	5060103810055	Purely organics Lemon tea 12x25 bags	21794	Продукты питания (folder)/Чай и кофе/Чай	1105796	Purely Organics
3191041	054100000637	Purely pickles	330591	Продукты питания (folder)/Продукты питания	0	
3191042	054100005632	Purely pickles #2	330591	Продукты питания (folder)/Продукты питания	0	
406943	5027497043438	Purely scottish Fruit and vits blackcurrant 4x 250ml	1	Неклассифицированные/default	0	
406944	5027497045432	Purely scottish Fruit and vits Orange and tangerine 4x 250ml	1	Неклассифицированные/default	0	
3191043	819944010828	Purely simple salad topper	330591	Продукты питания (folder)/Продукты питания	0	
3191044	819944010729	Purely simple trail Mix	330591	Продукты питания (folder)/Продукты питания	0	
1582760	021245134619	Purely vitamins	1	Неклассифицированные/default	0	
1582761	087239968776	Purelyhandsan	1	Неклассифицированные/default	0	
642836	804879106678	Purem acne Formula 2oz	1	Неклассифицированные/default	642835	PUREM
642837	804879106685	Purem animal f/aid&wound Care 2oz	1	Неклассифицированные/default	642835	PUREM
642838	804879106708	Purem Baby Skin 2oz	1	Неклассифицированные/default	642835	PUREM
642839	804879106715	Purem burn Formula 2oz	1	Неклассифицированные/default	642835	PUREM
642840	804879106739	Purem face Cream&Skin repair 2oz	664	Косметика (folder)/Крем для лица	642835	PUREM
642841	804879106746	Purem first aid Formula 2oz	1	Неклассифицированные/default	642835	PUREM
642842	804879106753	Purem infection Formula 2oz	1	Неклассифицированные/default	642835	PUREM
642843	804879106760	Purem personal lubricant 2oz	1	Неклассифицированные/default	642835	PUREM
642844	070163850200	Puremaid saltine crackers	1	Неклассифицированные/default	0	
2379617	014126066086	Puremco dominoes to go prmdomtogo	1	Неклассифицированные/default	2379616	Puremco
2379618	014126012083	Puremco mexican train chickenfoot comb prmcmd12	1	Неклассифицированные/default	2379616	Puremco
2188815	071287858462	Puren Gentle Baby wipes 88	1	Неклассифицированные/default	0	
1582767	079441009033	Pureness 25-pound Food container with wheels	1	Неклассифицированные/default	0	
1743341	079441004564	Pureness large translucent enclosed Cat litter pan, assorted colors	337596	Товары для животных (folder)/Pets	0	
305242	812595003904	Pureology anti-fade complex hydracure intensive moisture Hair masque, 5.2 ounce	5586	Косметика (folder)/Косметика	303168	Pureology
305243	812595006950	Pureology anti-fade complex Super straight serum, 5.1 ounce	5586	Косметика (folder)/Косметика	303168	Pureology
305244	090174417940	Pureology by pureology: hydrate Conditioner 8.5oz	5586	Косметика (folder)/Косметика	303168	Pureology
305245	812595002891	Pureology by pureology: nanoworks Shampoo 10.1oz	1412	Уход за волосами (folder)/Шампунь	303168	Pureology
305246	812595003553	Pureology by pureology: purevolume Shampoo 2oz	1412	Уход за волосами (folder)/Шампунь	303168	Pureology
305247	812595009036	Pureology dandruff scalp cure Conditioner 8.5oz	5586	Косметика (folder)/Косметика	303168	Pureology
305248	812595002518	Pureology hydrate Shampoo 10.1oz	1412	Уход за волосами (folder)/Шампунь	303168	Pureology
305249	884486000934	Pureology instant repair leave-in Hair condition 8.5oz (250ml)	5586	Косметика (folder)/Косметика	303168	Pureology
305250	812595002877	Pureology nanoworks restorative Hair treatment, 5.2 ounce	5586	Косметика (folder)/Косметика	303168	Pureology
305251	884486027832	Pureology Perfect 4 Platinum Shampoo for blondes (10.1oz)	1412	Уход за волосами (folder)/Шампунь	303168	Pureology
2663560	884486076212	Pureology precious Oil	1	Неклассифицированные/default	303168	Pureology
305252	884486004406	Pureology Super smooth smoothing elixir, 2.5 ounce	5586	Косметика (folder)/Косметика	303168	Pureology
3191045	809125063071	Pureplus, Aloe Vera drink, pomegranate	330591	Продукты питания (folder)/Продукты питания	0	
406946	50512355	Purepotions Chamomile Baby Oil 6x 100ml	1	Неклассифицированные/default	406945	purepotions
389461	50076895	Purepotions Chamomile Baby Oil Organic 6x 200ml	1	Неклассифицированные/default	389460	M?dara
389462	50076888	Purepotions Lavender nappy salve (not! inc 15ml tester) 6x 60ml	1	Неклассифицированные/default	389460	M?dara
406947	50512317	Purepotions rescue salve - arnica 6x 15ml	1	Неклассифицированные/default	406945	purepotions
2663561	50078875	Purepotions rescue salve - arnica 6x 15ml #2	1	Неклассифицированные/default	406945	purepotions
386161	50078851	Purepotions rescue salve - Lavender 6x 15ml	1	Неклассифицированные/default	406945	purepotions
218544	50028597	Purepotions rescue salve - tea tree 6x 15ml	897047	Косметика (folder)/Уход за телом	406945	purepotions
2663562	50078868	Purepotions rescue salve - tea tree 6x 15ml #2	1	Неклассифицированные/default	406945	purepotions
2663563	5060129420306	Purepotions single 400ml Skin salvation daily moisturiser 1x 400ml	1	Неклассифицированные/default	406945	purepotions
406948	50076857	Purepotions Skin salvation (not! inc 15ml tester) 6x 60ml	1	Неклассифицированные/default	406945	purepotions
642849	50076864	Purepotions Skin salvation - moisturising ointment 6x 120ml	1	Неклассифицированные/default	406945	purepotions
386173	50076659	Purepotions Skin salvation - moisturising ointment 6x 30ml	1	Неклассифицированные/default	37974	Lavera
386159	50076871	Purepotions Skin salvation Bath Oil Organic 6x 200ml	1	Неклассифицированные/default	37974	Lavera
2663564	5060129420290	Purepotions Skin salvation daily moisturiser 6x 100ml	1	Неклассифицированные/default	406945	purepotions
2663565	96120460	Purepotions Skin salvation intensive hand Cream 6x 50ml	1	Неклассифицированные/default	406945	purepotions
406949	50512331	Purepotions Skin salvation point of sale display pack 1x1 p	1	Неклассифицированные/default	406945	purepotions
2663566	96119228	Purepotions Skin salvation scalp Oil - with borage 6x 50ml	1	Неклассифицированные/default	406945	purepotions
2663567	5060129420191	Purepotions Skin salvation scar Oil - with rosehip 6x 50ml	1	Неклассифицированные/default	406945	purepotions
221176	4030806540130	Purer glycerin Cream tube 75ml	7943	Неклассифицированные/COSMETIC	0	
3191046	859220005056	Purerepublic, Milk chocolate nut&seed bark	330591	Продукты питания (folder)/Продукты питания	0	
3191047	859220005032	Purerepublic, pretzel bark, Milk chocolate	330591	Продукты питания (folder)/Продукты питания	0	
1105798	8717953080134	Puresenz dagcreme gekl. Golden Honey 50ml	1	Неклассифицированные/default	0	
1105799	8717953080127	Puresenz dagcreme gekl. ivory beige 50ml	1	Неклассифицированные/default	0	
1105800	8717953080141	Puresenz dagcreme gekl. warm bronze 50ml	1	Неклассифицированные/default	0	
1105801	8717953080110	Puresenz styling Cream wax 100ml	1	Неклассифицированные/default	0	
1105802	8717953080103	Puresenz styling Mousse 200ml	1	Неклассифицированные/default	0	
221178	4809010430205	Pureskin 3x1 papaya soap 135g	146	Гигиена (folder)/Мыло	221177	PURESKIN
221179	4809010760906	Pureskin 4x1 papaya soap 135g (na)	146	Гигиена (folder)/Мыло	221177	PURESKIN
221180	9908784728619	Pureskin 5x1 papaya soap 135g (na)	146	Гигиена (folder)/Мыло	221177	PURESKIN
221181	6210723403017	Pureskin almond h/treat Cream 1500ml (na)	7943	Неклассифицированные/COSMETIC	221177	PURESKIN
221182	6210723420083	Pureskin almond Hair Cream 175ml (na)	7943	Неклассифицированные/COSMETIC	221177	PURESKIN
221183	4809010760708	Pureskin Aloe Vera face Lotion 250ml (na)	7943	Неклассифицированные/COSMETIC	221177	PURESKIN
221184	6210723404014	Pureskin Aloe Vera h/treat Cream 1500ml (na)	7943	Неклассифицированные/COSMETIC	221177	PURESKIN
221185	6210723421080	Pureskin Aloe Vera Hair Cream 175ml (na)	7943	Неклассифицированные/COSMETIC	221177	PURESKIN
221186	6291100953127	Pureskin apples Skin Cream 500ml	7943	Неклассифицированные/COSMETIC	221177	PURESKIN
221187	4809010760715	Pureskin avocado face Lotion 250ml (na)	7943	Неклассифицированные/COSMETIC	221177	PURESKIN
2001848	716770065520	Pureskin bendie brown	1980172	Adult/All Novelties	0	
2001847	716770065513	Pureskin bendie ivory	1980172	Adult/All Novelties	0	
221188	4809010760173	Pureskin bleaching Black soap 135g (na)	146	Гигиена (folder)/Мыло	221177	PURESKIN
221189	6210723436121	Pureskin Blue Hair Gel 600+100ml Pro (na)	225	Уход за волосами (folder)/Моделирование прически	221177	PURESKIN
221190	6210723430129	Pureskin Blue Hair Gel 600ml (na)	225	Уход за волосами (folder)/Моделирование прически	221177	PURESKIN
221191	6210723430082	Pureskin Blue nor Hair Gel 175ml (na)	225	Уход за волосами (folder)/Моделирование прически	221177	PURESKIN
221192	6210723430051	Pureskin Blue nor Hair Gel 300ml (na)	225	Уход за волосами (folder)/Моделирование прически	221177	PURESKIN
221193	6210723431089	Pureskin brilliant Hair Gel 175ml (na)	225	Уход за волосами (folder)/Моделирование прически	221177	PURESKIN
221194	6210723431058	Pureskin brilliant Hair Gel 300ml (na)	225	Уход за волосами (folder)/Моделирование прически	221177	PURESKIN
221195	6210723431126	Pureskin brilliant Hair Gel 600ml (na)	225	Уход за волосами (folder)/Моделирование прически	221177	PURESKIN
221196	4809010760746	Pureskin brust firmig Cream 15g (na)	7943	Неклассифицированные/COSMETIC	221177	PURESKIN
221197	6210723408012	Pureskin bull spinal h/treat Cream 1500ml (na)	7943	Неклассифицированные/COSMETIC	221177	PURESKIN
221198	6210723412019	Pureskin cobra Oil h/treat Cream 1500ml (na)	7943	Неклассифицированные/COSMETIC	221177	PURESKIN
221199	6210723407015	Pureskin Coconut h/treat Cream 1500ml (na)	7943	Неклассифицированные/COSMETIC	221177	PURESKIN
221200	6210723422087	Pureskin Coconut Hair Cream 175ml (na)	7943	Неклассифицированные/COSMETIC	221177	PURESKIN
221201	6291100950621	Pureskin cristal serum 55ml	7943	Неклассифицированные/COSMETIC	221177	PURESKIN
221202	4809010760739	Pureskin cucumber face Lotion 250ml (na)	7943	Неклассифицированные/COSMETIC	221177	PURESKIN
221203	6210723423084	Pureskin egg Hair Cream 175ml (na)	7943	Неклассифицированные/COSMETIC	221177	PURESKIN
221204	6210723401013	Pureskin fruits h/treat Cream 1500ml (na)	7943	Неклассифицированные/COSMETIC	221177	PURESKIN
221205	6210723410015	Pureskin garlic h/treat Cream 1500ml (na)	7943	Неклассифицированные/COSMETIC	221177	PURESKIN
221206	6210723428089	Pureskin hardest Hair Gel 175ml (na)	225	Уход за волосами (folder)/Моделирование прически	221177	PURESKIN
