ID	UPCEAN	Name	CategoryID	CategoryName	BrandID	BrandName
635631	053390050025	Ostrich ground patt ies retail	1	Неклассифицированные/default	0	
2179693	829546721138	Ostrich neck/meat/liver 2lb antibiotic free	337596	Товары для животных (folder)/Pets	0	
635633	613911105308	Ostrim natrl beef stk Original 10/1.5oz	1	Неклассифицированные/default	635632	OSTRIM
635634	613911105100	Ostrim natrl beef stk spcy peppr 10/1.5oz	1	Неклассифицированные/default	635632	OSTRIM
635635	613911105209	Ostrim natrl beef stk teriyaki 10/1.5oz	1	Неклассифицированные/default	635632	OSTRIM
635636	613911161076	Ostrim natrl beef&soy Stick org 10/1.5oz	1	Неклассифицированные/default	635632	OSTRIM
1084192	5412569090517	Ostrin Plus gtz 611 30cps	1	Неклассифицированные/default	0	
2714020	4607177090337	Ostrofskiy premim adjika&nut.sauce j 0.12kg	260412	Продукты питания (folder)/Аджика	2714009	острофский
2762878	4607177090399	Ostrofskiy premim horserad&paprik.sauce j 0.12kg	143343	Продукты питания (folder)/Хрен	3727109	OSTROFSKIY
2714028	4607177090351	Ostrofskiy premim yuzhnaya adjika sauce j 0.12kg	260412	Продукты питания (folder)/Аджика	2714009	острофский
2649955	074270676449	Ostrom's sliced crimini 16oz	2058983	Продукты питания (folder)/Fruits and Vegetables	0	
2649948	074270675664	Ostrom's, picked Fresh daily vitamin d crimini 16oz	2058983	Продукты питания (folder)/Fruits and Vegetables	0	
2649949	074270400280	Ostroms mushroom sliced 16oz	2058983	Продукты питания (folder)/Fruits and Vegetables	0	
2649950	074270006499	Ostroms mushroom sliced bbybl 8oz	2058983	Продукты питания (folder)/Fruits and Vegetables	0	
2649951	074270400167	Ostroms mushroom whole 16oz	2058983	Продукты питания (folder)/Fruits and Vegetables	0	
2649952	074270675008	Ostroms mushrooms 8oz	2058983	Продукты питания (folder)/Fruits and Vegetables	0	
2649953	074270676005	Ostroms mushrooms 8oz #2	2058983	Продукты питания (folder)/Fruits and Vegetables	0	
2649954	074270675640	Ostroms mushrooms crimini 8oz	2058983	Продукты питания (folder)/Fruits and Vegetables	0	
635637	5019205001625	Ostron tablets	1	Неклассифицированные/default	0	
635638	5281019902577	Ostrong	1	Неклассифицированные/default	0	
3727111	4670006551279	Ostrov (ostrov tpk/sv.o.) humpb.Salmon f 0.8kg s	3609100	Продукты питания (folder)/Рыба и морепродукты (folder)/Рыба замороженная	3727110	OSTROV(OSTROV TPK/BERYOZOVSKIY SVERDL.OBL.)
3727112	4670006553006	Ostrov (ostrov tpk/sv.o.) humpb.Salmon f 0.8kg s #2	3609100	Продукты питания (folder)/Рыба и морепродукты (folder)/Рыба замороженная	3727110	OSTROV(OSTROV TPK/BERYOZOVSKIY SVERDL.OBL.)
3727113	4670006554485	Ostrov (ostrov tpk/sv.o.) sib.salm.st.i/orig.mar. 0.35kg s	3609098	замороженные рыбные полуфабрикаты	3727110	OSTROV(OSTROV TPK/BERYOZOVSKIY SVERDL.OBL.)
3727117	4607017850015	Ostrov sakhalin far East sal.w/sea cabb. b 0.22kg	3606195	консервированные салаты, готовые к употреблению	3727116	OSTROV SAKHALIN
3727119	4603530193110	Ostrov spetsiy pepper Black pepper p bb 0.05kg	30882	Продукты питания (folder)/Приправы и специи	3727118	OSTROV SPETSIY (AGROIMPORT)
3727121	4670006553372	Ostrov tpk/beryozovsk.sverd.o. herring sal. k/k 0.54kg v	3612234	Продукты питания (folder)/Рыба и морепродукты (folder)/Сельдь	3727120	OSTROV TPK/BERYOZOVSKIY SVERDL.OBL.
3727122	4670006550500	Ostrov tpk/beryozovsk.sverd.o. herring sal. t 1.3kg v	3612234	Продукты питания (folder)/Рыба и морепродукты (folder)/Сельдь	3727120	OSTROV TPK/BERYOZOVSKIY SVERDL.OBL.
3727123	4670006550715	Ostrov tpk/beryozovsk.sverd.o. herring sal. t 1.3kg v #2	3612234	Продукты питания (folder)/Рыба и морепродукты (folder)/Сельдь	3727120	OSTROV TPK/BERYOZOVSKIY SVERDL.OBL.
3727124	6953659359712	Ostrov арка Сад.lno0014874 114x37 x 230см	3607165	Пр. садовый декор	3727093	OSTROV
3727125	6953659359729	Ostrov арка Сад.lno0014875 240x140 x 38см	3607165	Пр. садовый декор	3727093	OSTROV
3727126	6953659359910	Ostrov барбекю на твердом топливе 39см	329590	Спорт и отдых (folder)/Пикник	3727093	OSTROV
3727127	6953659359897	Ostrov барбекю на твердом топливе 41.5см	329590	Спорт и отдых (folder)/Пикник	3727093	OSTROV
3727128	6901698460333	Ostrov бордюр для газона	3607165	Пр. садовый декор	3727093	OSTROV
3727129	6953659301858	Ostrov бордюр для газона #2	33235	Растениеводство/Садовый инвентарь	3727093	OSTROV
3727130	6901688122180	Ostrov ведро 43x32 x31.5см	33235	Растениеводство/Садовый инвентарь	3727093	OSTROV
3727131	6901688800316	Ostrov ведро для воды 12л	289433	Инструменты (folder)/Инструмент садовый	3727093	OSTROV
3727132	6953659301643	Ostrov вилка садовая	289433	Инструменты (folder)/Инструмент садовый	3727093	OSTROV
3727133	6901688121527	Ostrov вилка садово-огородная 23x 7см	289433	Инструменты (folder)/Инструмент садовый	3727093	OSTROV
3727134	6911189680683	Ostrov гамак 260x 70см	3608243	Мебель (folder)/Мебель для сада	3727093	OSTROV
3727135	6901688801467	Ostrov гирлянда китайские фонарики 10ламп	3607165	Пр. садовый декор	3727093	OSTROV
3727136	6901698460074	Ostrov горшок цветочный	3608246	Растениеводство/Кашпо,горшки и держатели	3727093	OSTROV
3727137	6901688121817	Ostrov грабли 24x8.5x 5см	289433	Инструменты (folder)/Инструмент садовый	3727093	OSTROV
3727138	6901688121602	Ostrov грабли садово-огородные 35x8.6см	289433	Инструменты (folder)/Инструмент садовый	3727093	OSTROV
3727139	6911188833684	Ostrov грабли садовые 123x 19см	289433	Инструменты (folder)/Инструмент садовый	3727093	OSTROV
3727140	6953659359828	Ostrov грабли складные 19x 123см/60x 156см	289433	Инструменты (folder)/Инструмент садовый	3727093	OSTROV
3727141	6953659360275	Ostrov держатель для садового зонта	3608243	Мебель (folder)/Мебель для сада	3727093	OSTROV
3727142	6953659359903	Ostrov душ переносной 20л	3605276	Спорт и отдых (folder)/Товары для кемпинга	3727093	OSTROV
3727143	6953659301810	Ostrov забор садовый	3607165	Пр. садовый декор	3727093	OSTROV
3727144	6953659301827	Ostrov забор садовый #2	3607165	Пр. садовый декор	3727093	OSTROV
3727145	6953659301834	Ostrov забор садовый #3	3607165	Пр. садовый декор	3727093	OSTROV
3727146	6911188810739	Ostrov зонт amber садовый 250см	3608243	Мебель (folder)/Мебель для сада	3727093	OSTROV
3727147	6953659360251	Ostrov зонт beach садовый 2м	3608243	Мебель (folder)/Мебель для сада	3727093	OSTROV
3727148	6911188810722	Ostrov зонт breeze пляжный 200см	3608243	Мебель (folder)/Мебель для сада	3727093	OSTROV
3727149	6953659360336	Ostrov зонт King садовый 3м	3608243	Мебель (folder)/Мебель для сада	3727093	OSTROV
3727150	6953659360381	Ostrov зонт Queen садовый 2.25м	3608243	Мебель (folder)/Мебель для сада	3727093	OSTROV
3727151	6901688800880	Ostrov зонт rio садовый с наклоном 1.8м	3608243	Мебель (folder)/Мебель для сада	3727093	OSTROV
3727152	6953659360282	Ostrov зонт siesta садовый 1.8м	3608243	Мебель (folder)/Мебель для сада	3727093	OSTROV
3727153	6901688800873	Ostrov зонт sky садовый 1.8м	3608243	Мебель (folder)/Мебель для сада	3727093	OSTROV
3727154	6953659312960	Ostrov зонт пляжный 150x 190см	3605276	Спорт и отдых (folder)/Товары для кемпинга	3727093	OSTROV
3727155	5901801580744	Ostrov зонт садовый d=250см высота 200см	3605276	Спорт и отдых (folder)/Товары для кемпинга	3727093	OSTROV
3727156	5901801580249	Ostrov зонт садовый купола 250см	3608243	Мебель (folder)/Мебель для сада	3727093	OSTROV
3727157	5901801580683	Ostrov зонт садовый купола 300см	3608243	Мебель (folder)/Мебель для сада	3727093	OSTROV
3727158	6901688800903	Ostrov зонт шанхай садовый 2.6м	3608243	Мебель (folder)/Мебель для сада	3727093	OSTROV
3727159	6953659301803	Ostrov изделие бабочка декоративное	3607165	Пр. садовый декор	3727093	OSTROV
3727160	6911188780148	Ostrov изделие дек.гном 20см	3607165	Пр. садовый декор	3727093	OSTROV
3727161	6911188780094	Ostrov изделие дек.лебедь 36.5x19 x27.5см	3607165	Пр. садовый декор	3727093	OSTROV
3727162	6911188780131	Ostrov изделие дек.лист лотоса 22x21 x9.5	3607165	Пр. садовый декор	3727093	OSTROV
3727163	6911188780087	Ostrov изделие дек.утка 12x6.5x 7см	3607165	Пр. садовый декор	3727093	OSTROV
3727164	6911188780063	Ostrov изделие дек.цапля 68x23 x 78см	3607165	Пр. садовый декор	3727093	OSTROV
3727165	6911188780070	Ostrov изделие дек.цапля 71x16 x 72см	3607165	Пр. садовый декор	3727093	OSTROV
3727166	6911188780124	Ostrov изделие дек.цветок лотоса 10x10 x5	3607165	Пр. садовый декор	3727093	OSTROV
3727167	6953659360145	Ostrov изделие зайчик декорат.21x 16см	3607165	Пр. садовый декор	3727093	OSTROV
3727168	6953659360152	Ostrov изделие заяц декоративное 30см	3607165	Пр. садовый декор	3727093	OSTROV
3727169	6953659359774	Ostrov изделие кормушка для птиц декор.9x9 x 11см	3607165	Пр. садовый декор	3727093	OSTROV
3727170	6953659360121	Ostrov изделие птица декоративное 18.5см	3607165	Пр. садовый декор	3727093	OSTROV
3727171	6953659301797	Ostrov изделие стрекоза декоративное	3607165	Пр. садовый декор	3727093	OSTROV
3727172	6953659360169	Ostrov изделие утка декор.35.5x15 x 16см	3607165	Пр. садовый декор	3727093	OSTROV
3727173	6953659359804	Ostrov изделие утка декоратив.25x11 x 11см	3607165	Пр. садовый декор	3727093	OSTROV
3727174	6953659360176	Ostrov изделие утка декоратив.25x11 x 12см	3607165	Пр. садовый декор	3727093	OSTROV
3727175	6953659360114	Ostrov изделие утка декоративное 27.5см	3607165	Пр. садовый декор	3727093	OSTROV
3727176	6953659360183	Ostrov катушка для шланга поливочного 50м	561877	Растениеводство/Товары для садоводства	3727093	OSTROV
3727182	6901688801078	Ostrov кач-кр.stella трехм.200x120 x164	3608243	Мебель (folder)/Мебель для сада	3727093	OSTROV
3727177	5901801580096	Ostrov качели 220x180 x 190см	3608243	Мебель (folder)/Мебель для сада	3727093	OSTROV
3727178	5901801580447	Ostrov качели barsel.трехмес.217x128 x 165см	3608243	Мебель (folder)/Мебель для сада	3727093	OSTROV
3727179	6911188837361	Ostrov качели rodeo трехм.170x110 x 160см	3608243	Мебель (folder)/Мебель для сада	3727093	OSTROV
3727180	5901801580423	Ostrov качели valen.трехмест.170x110 x 150см	3608243	Мебель (folder)/Мебель для сада	3727093	OSTROV
3727181	6901689908066	Ostrov качели-гамак fiesta 235x152 x 200см	3608243	Мебель (folder)/Мебель для сада	3727093	OSTROV
3727183	6953659301568	Ostrov кашпо для цветов	3608246	Растениеводство/Кашпо,горшки и держатели	3727093	OSTROV
3727184	6953659359736	Ostrov коврик 40x17 x1.8см	3607165	Пр. садовый декор	3727093	OSTROV
3727185	6911186680303	Ostrov коврик для пикника 120x 75см	3605276	Спорт и отдых (folder)/Товары для кемпинга	3727093	OSTROV
3727186	6911188837514	Ostrov коврик для пикника 170x 60см	3605276	Спорт и отдых (folder)/Товары для кемпинга	3727093	OSTROV
3727187	6911188837545	Ostrov коврик для пикника с фол.170x 60см	3605276	Спорт и отдых (folder)/Товары для кемпинга	3727093	OSTROV
3727188	6953659359750	Ostrov коврик для туризма и отдыха 33x 33см	3607165	Пр. садовый декор	3727093	OSTROV
3727189	6953659359880	Ostrov комплект мухобоек 46x10.5см 3шт	3605276	Спорт и отдых (folder)/Товары для кемпинга	3727093	OSTROV
3727190	6953659359675	Ostrov корзина садовая универсал.45x 58см	33235	Растениеводство/Садовый инвентарь	3727093	OSTROV
3727191	6953659359767	Ostrov корнеудалитель 25см	289433	Инструменты (folder)/Инструмент садовый	3727093	OSTROV
3727192	6911188810746	Ostrov кресло asi складное 57x58 x 100см	3608243	Мебель (folder)/Мебель для сада	3727093	OSTROV
3727193	6901688800460	Ostrov кресло Bruno садов.склад.53x 74см	3608243	Мебель (folder)/Мебель для сада	3727093	OSTROV
3727194	6953659360350	Ostrov кресло capri для отдыха иск.ротанг	3608243	Мебель (folder)/Мебель для сада	3727093	OSTROV
3727195	6953659360299	Ostrov кресло coco складное 85x85 x 74см	3608243	Мебель (folder)/Мебель для сада	3727093	OSTROV
3727196	6953659360428	Ostrov кресло elba для отдыха 74x55 x 92см	3608243	Мебель (folder)/Мебель для сада	3727093	OSTROV
3727197	5901801580720	Ostrov кресло faro складное 98x57 x 106см	3605276	Спорт и отдых (folder)/Товары для кемпинга	3727093	OSTROV
3727198	6911188830225	Ostrov кресло friend скл.дет.37x27 x 50см	3608243	Мебель (folder)/Мебель для сада	3727093	OSTROV
3727199	6911188837071	Ostrov кресло fugi скл.32x32 x 45см	3608243	Мебель (folder)/Мебель для сада	3727093	OSTROV
3727200	6911888837661	Ostrov кресло leo садовое 53x57 x 74см	3608243	Мебель (folder)/Мебель для сада	3727093	OSTROV
3727201	6901688800507	Ostrov кресло lima складное 35x 78см	3608243	Мебель (folder)/Мебель для сада	3727093	OSTROV
3727202	6911189810080	Ostrov кресло look складное 79x59 x 80см	3608243	Мебель (folder)/Мебель для сада	3727093	OSTROV
3727203	6901689908004	Ostrov кресло malta складное 49x49 x 80см	3608243	Мебель (folder)/Мебель для сада	3727093	OSTROV
3727204	6901688801016	Ostrov кресло rest для отдыха 53x57 x 74см	3608243	Мебель (folder)/Мебель для сада	3727093	OSTROV
3727205	5901801580317	Ostrov кресло sienna складное 60x53 x 86см	3608243	Мебель (folder)/Мебель для сада	3727093	OSTROV
3727206	6953659360435	Ostrov кресло sissi скл.76x55 x 102см	3608243	Мебель (folder)/Мебель для сада	3727093	OSTROV
3727207	5901801580546	Ostrov кресло verona 75x 70см	3608243	Мебель (folder)/Мебель для сада	3727093	OSTROV
3727208	6911186680624	Ostrov кресло viola скл.85x35 x 80см	3608243	Мебель (folder)/Мебель для сада	3727093	OSTROV
3727209	6911186680679	Ostrov кресло vivien скл.50x23 x 50см	3608243	Мебель (folder)/Мебель для сада	3727093	OSTROV
3727210	6911186680686	Ostrov кресло vona складное 60x30 x 42см	3608243	Мебель (folder)/Мебель для сада	3727093	OSTROV
3727212	6953659360305	Ostrov кресло-шезл.Easy скл.56x140 x 98см	3608243	Мебель (folder)/Мебель для сада	3727093	OSTROV
3727213	6911188837002	Ostrov кресло-шезл.roni скл.160x90 x 66см	3608243	Мебель (folder)/Мебель для сада	3727093	OSTROV
3727214	6901688800552	Ostrov кресло-шезлонг dino 156x60 x 88см	3608243	Мебель (folder)/Мебель для сада	3727093	OSTROV
3727211	5901801580294	Ostrov креслоpapasanскл.51.5x54 x 98см	3608243	Мебель (folder)/Мебель для сада	3727093	OSTROV
3727215	6901688121558	Ostrov культиватор садово-огород.21x 6см	289433	Инструменты (folder)/Инструмент садовый	3727093	OSTROV
3727216	6901688121572	Ostrov культиватор садово-огород.41x 13см	289433	Инструменты (folder)/Инструмент садовый	3727093	OSTROV
3727217	6901688121619	Ostrov культиватор садово-огород.42x 5см	289433	Инструменты (folder)/Инструмент садовый	3727093	OSTROV
3727218	6901689815449	Ostrov лампа керосиновая	3607165	Пр. садовый декор	3727093	OSTROV
3727219	6901698460272	Ostrov леска для триммера	562237	Спорт и отдых (folder)/Рыбалка (folder)/Рыбалка	3727093	OSTROV
3727220	6901698460289	Ostrov леска для триммера #2	562237	Спорт и отдых (folder)/Рыбалка (folder)/Рыбалка	3727093	OSTROV
3727221	6901698460296	Ostrov леска для триммера #3	562237	Спорт и отдых (folder)/Рыбалка (folder)/Рыбалка	3727093	OSTROV
3727222	6953659301759	Ostrov метла садовая	33235	Растениеводство/Садовый инвентарь	3727093	OSTROV
3727223	6901688121329	Ostrov метла садовая с телескоп.ручкой	289433	Инструменты (folder)/Инструмент садовый	3727093	OSTROV
3727224	6901688122746	Ostrov метла садовая с телескоп.ручкой #2	289433	Инструменты (folder)/Инструмент садовый	3727093	OSTROV
3727225	6901688121800	Ostrov мотыжка комбиниров.24x16 x 6см	289433	Инструменты (folder)/Инструмент садовый	3727093	OSTROV
3727226	6901688121589	Ostrov мотыжка комбиниров.41x 20см	289433	Инструменты (folder)/Инструмент садовый	3727093	OSTROV
3727227	6953659360398	Ostrov набор bali меб.скл.стол+зонт+4кресла	3608243	Мебель (folder)/Мебель для сада	3727093	OSTROV
3727228	5901801580560	Ostrov набор bistro мебели 3предм	3608243	Мебель (folder)/Мебель для сада	3727093	OSTROV
3727229	5901801580362	Ostrov набор bistro мебели 3предм #2	3608243	Мебель (folder)/Мебель для сада	3727093	OSTROV
3727230	6953659360374	Ostrov набор bistro мебели скл.стол+2кресла	3608243	Мебель (folder)/Мебель для сада	3727093	OSTROV
3727231	5901801580409	Ostrov набор boden bistro мебели 3предм	3608243	Мебель (folder)/Мебель для сада	3727093	OSTROV
3727232	5901801580416	Ostrov набор cordova мебели 4предм	3608243	Мебель (folder)/Мебель для сада	3727093	OSTROV
3727233	6911186680709	Ostrov набор friviera садовой мебели 6предм	3608243	Мебель (folder)/Мебель для сада	3727093	OSTROV
3727234	6911186680600	Ostrov набор frog дет.скл.мебели 4предм	3608243	Мебель (folder)/Мебель для сада	3727093	OSTROV
3727235	6953659360404	Ostrov набор luigi меб.быт.Сад.стол+2стула	3608243	Мебель (folder)/Мебель для сада	3727093	OSTROV
3727236	5901801580591	Ostrov набор milano мебели 4предм	3608243	Мебель (folder)/Мебель для сада	3727093	OSTROV
3727237	5901801580324	Ostrov набор picnic складной мебели 3предм	3605276	Спорт и отдых (folder)/Товары для кемпинга	3727093	OSTROV
3727238	5901801580379	Ostrov набор Rita bistro мебели 3предм	3608243	Мебель (folder)/Мебель для сада	3727093	OSTROV
3727239	6953659360411	Ostrov набор tanit Сад.меб.тент+стол+2див.	3608243	Мебель (folder)/Мебель для сада	3727093	OSTROV
3727240	6953659360329	Ostrov набор tourist мебели скл.стол+4таб.	3608243	Мебель (folder)/Мебель для сада	3727093	OSTROV
3727241	5901801580270	Ostrov набор varadero мебели 6предм	3608243	Мебель (folder)/Мебель для сада	3727093	OSTROV
3727242	6953659314001	Ostrov набор детской мебели 4предм	3605276	Спорт и отдых (folder)/Товары для кемпинга	3727093	OSTROV
3727245	6953659360084	Ostrov набор для Сад-ог.раб.ковр+сов-гр+перч.	33235	Растениеводство/Садовый инвентарь	3727093	OSTROV
3727243	6953659360060	Ostrov набор для садово-огор.раб.коврик+перч.	33235	Растениеводство/Садовый инвентарь	3727093	OSTROV
3727244	6953659360077	Ostrov набор для садово-огород.работ 5предм	33235	Растениеводство/Садовый инвентарь	3727093	OSTROV
3727246	6911188837132	Ostrov набор кресел chief скл.155x52 x 83см	3608243	Мебель (folder)/Мебель для сада	3727093	OSTROV
3727247	6911188810678	Ostrov набор меб.lona склад.стол+4таб.	3608243	Мебель (folder)/Мебель для сада	3727093	OSTROV
3727248	6953659366093	Ostrov набор меб.sorento склад.1стол+2таб.	3608243	Мебель (folder)/Мебель для сада	3727093	OSTROV
3727249	6911188810609	Ostrov набор мебели nord в кейсе	3608243	Мебель (folder)/Мебель для сада	3727093	OSTROV
3727251	6901688801375	Ostrov набор Сад-огор.лопата грабли совок	289433	Инструменты (folder)/Инструмент садовый	3727093	OSTROV
3727250	6953659360237	Ostrov набор садово-огород.совок+2вилки	289433	Инструменты (folder)/Инструмент садовый	3727093	OSTROV
3727252	6953659359590	Ostrov набор складн.мебели 1 стол и 4 табур.	3608243	Мебель (folder)/Мебель для сада	3727093	OSTROV
3727253	6953659359606	Ostrov набор складн.мебели стол стул 2шт	3608243	Мебель (folder)/Мебель для сада	3727093	OSTROV
3727254	6911188830751	Ostrov насос погружной 250w	3609534	Сад. мототех.,насосы	3727093	OSTROV
3727255	6953659360091	Ostrov насос погружной 250w #2	3609534	Сад. мототех.,насосы	3727093	OSTROV
3727256	6953659360107	Ostrov насос погружной грязев.400w	3609534	Сад. мототех.,насосы	3727093	OSTROV
3727257	6911188830737	Ostrov насос погружной грязевой 400w	3609534	Сад. мототех.,насосы	3727093	OSTROV
3727258	6953659301766	Ostrov ножницы садовые	289433	Инструменты (folder)/Инструмент садовый	3727093	OSTROV
3727259	6953659301773	Ostrov ножницы садовые #2	289433	Инструменты (folder)/Инструмент садовый	3727093	OSTROV
3727260	6953659359743	Ostrov ножницы садовые 51x17 x7.5см	289433	Инструменты (folder)/Инструмент садовый	3727093	OSTROV
3727261	6953659302275	Ostrov опрыскиватель	561877	Растениеводство/Товары для садоводства	3727093	OSTROV
3727262	6901698460357	Ostrov опрыскиватель для растений	561877	Растениеводство/Товары для садоводства	3727093	OSTROV
3727263	6901698460388	Ostrov опрыскиватель для растений 12л	561877	Растениеводство/Товары для садоводства	3727093	OSTROV
3727264	6953659359651	Ostrov опрыскиватель ранцевый пневм.12л	561877	Растениеводство/Товары для садоводства	3727093	OSTROV
