ID	UPCEAN	Name	CategoryID	CategoryName	BrandID	BrandName
2369707	5011995000444	Old st andrews clubhouse premium golf ball whisky 500ml	22172	Продукты питания (folder)/Алкогольные напитки/Виски	2290584	Old St. Andrews Whisky
2369708	5011995000505	Old st andrews clubhouse premium golf ball whisky 700ml	22172	Продукты питания (folder)/Алкогольные напитки/Виски	2290584	Old St. Andrews Whisky
2369709	5011995000086	Old st andrews clubhousegolf ball whisky 50ml&glass	22172	Продукты питания (folder)/Алкогольные напитки/Виски	2290584	Old St. Andrews Whisky
2369710	5011995000383	Old st andrews coopers choice miniature whisky barrel 3x 50ml set	22172	Продукты питания (folder)/Алкогольные напитки/Виски	2290584	Old St. Andrews Whisky
2369711	5011995001328	Old st andrews fireside golf ball 12 year whisky 700ml	22172	Продукты питания (folder)/Алкогольные напитки/Виски	2290584	Old St. Andrews Whisky
4562263	5011995000017	Old st andrews LTD 50ml Old st. andrews scotch whisky 40%vol, golf ball miniature sam snead 1946	1	Неклассифицированные/default	0	
2369712	5011995001274	Old st andrews nightcap golf ball 15 year whisky 700ml	22172	Продукты питания (folder)/Алкогольные напитки/Виски	2290584	Old St. Andrews Whisky
2369713	5011995001014	Old st andrews twilight golf ball 10 year whisky 700ml	22172	Продукты питания (folder)/Алкогольные напитки/Виски	2290584	Old St. Andrews Whisky
2369714	5011995000642	Old st andrews whisky barrel 50ml miniature	22172	Продукты питания (folder)/Алкогольные напитки/Виски	2290584	Old St. Andrews Whisky
3725275	084279249421	Old st John White Rum 1.0l	1	Неклассифицированные/default	0	
3725276	084279249445	Old st John White Rum 1.75l	1	Неклассифицированные/default	0	
4562264	819320527490	Old st nick's egg nog 750ml	1	Неклассифицированные/default	0	
4562266	097485100141	Old st. andrew's scotch 25.4oz	1	Неклассифицированные/default	0	
4562265	974851001588	Old st. andrews clubhouse 50ml	1	Неклассифицированные/default	0	
4562267	081932052718	Old st. nicks	1	Неклассифицированные/default	0	
1999685	603912205978	Old st. prick vibe (d)	363351	Adult/Sex-Shop	0	
4562268	7312350335378	Old steam loco	1	Неклассифицированные/default	0	
398830	727344001400	Old stock 2009 Cellar reserve glass 16.9oz	1	Неклассифицированные/default	0	
398831	727344001097	Old stock ale glass 12oz	1	Неклассифицированные/default	0	
4562269	073360117510	Old style 12floz	1	Неклассифицированные/default	0	
4562270	073360117565	Old style 12oz beer	1	Неклассифицированные/default	0	
2818993	073360113413	Old style 2/12/12 cn 3% l	1	Неклассифицированные/default	0	
2818994	073360119064	Old style 2/12/12 nr 3% l	1	Неклассифицированные/default	0	
4562271	073360971013	Old style bb	1	Неклассифицированные/default	0	
3168954	078700015570	Old style cottage potato bread	330591	Продукты питания (folder)/Продукты питания	0	
4562272	765484000044	Old style coup.	1	Неклассифицированные/default	0	
3168955	078503019058	Old style cracker bologna	330591	Продукты питания (folder)/Продукты питания	0	
3168956	041900084882	Old style heavy Cream	330591	Продукты питания (folder)/Продукты питания	0	
4562273	073360115233	Old style Ice 12pk can 144oz	1	Неклассифицированные/default	0	
2818995	073360973017	Old style Light 24/12 cn 3% l	1	Неклассифицированные/default	0	
1846596	078275020108	Old style motor int 208-277v wg433-10d	1	Неклассифицированные/default	0	
3168957	021140614278	Old style premium draft root beer	330591	Продукты питания (folder)/Продукты питания	3001738	Winn-dixie
3168958	021140617057	Old style premium draft root beer #2	330591	Продукты питания (folder)/Продукты питания	3001738	Winn-dixie
3168959	021140634061	Old style premium draft soda	330591	Продукты питания (folder)/Продукты питания	3001738	Winn-dixie
4562274	071025062526	Old style White bread 16oz	1	Неклассифицированные/default	0	
4562275	070845212326	Old style White Distilled vinegar 32floz	1	Неклассифицированные/default	0	
2369715	022100006904	Old tankard ale metal 16floz	1	Неклассифицированные/default	0	
4562276	073399201242	Old tavern Farm inc tarkett azrock floor tile v-874-3	1	Неклассифицированные/default	0	
4562277	806864102016	Old taylor 1000ml	1	Неклассифицированные/default	0	
4562278	080686410201	Old taylor 1000ml #2	1	Неклассифицированные/default	0	
4562279	806864101026	Old taylor 1750ml	1	Неклассифицированные/default	0	
4562280	080686410102	Old taylor 1750ml #2	1	Неклассифицированные/default	0	
4562281	806864106076	Old taylor 375ml	1	Неклассифицированные/default	0	
4562282	080686410607	Old taylor 375ml #2	1	Неклассифицированные/default	0	
4562283	806864104096	Old taylor 750ml	1	Неклассифицированные/default	0	
4562284	080686410409	Old taylor 750ml #2	1	Неклассифицированные/default	0	
1561238	086259250304	Old taylor straight 6 yr 80 pf	1	Неклассифицированные/default	0	
1561239	088004005238	Old taylor straight 6 yr 80 pf (trav)	1	Неклассифицированные/default	0	
4562285	088677136536	Old teddies	1	Неклассифицированные/default	0	
4562286	088677031855	Old teddies quilt	1	Неклассифицированные/default	0	
1927151	3012997711408	Old tequila ron de cuba 700ml/1	1	Неклассифицированные/default	0	
1561240	654614208316	Old testament	1	Неклассифицированные/default	0	
4562287	759259140769	Old testament (DVD/unrated/china/2002/Mandarin with English subtitles)	1	Неклассифицированные/default	0	
1561241	089000003235	Old thompson	78617	Продукты питания (folder)/Алкогольные напитки/Алкоголь	0	
1561242	089000016488	Old thompson 80 proof 1l	78617	Продукты питания (folder)/Алкогольные напитки/Алкоголь	0	
398833	780369919976	Old thumper glass 22oz	1	Неклассифицированные/default	0	
1561243	081864002607	Old thyme caramel popcorn - fat free	199047	Продукты питания (folder)/Попкорн	2646452	Olde Tyme
4562288	029502450014	Old time comedy classics (DVD)	1	Неклассифицированные/default	0	
4562289	029502450021	Old time comedy classics v02 (DVD)	1	Неклассифицированные/default	0	
4562290	029502450045	Old time comedy classics v04 (DVD)	1	Неклассифицированные/default	0	
4562291	029502450052	Old time comedy classics v05 (DVD)	1	Неклассифицированные/default	0	
4562292	029502450069	Old time comedy classics v06 (DVD)	1	Неклассифицированные/default	0	
4562293	029502450083	Old time comedy classics v08 (DVD)	1	Неклассифицированные/default	0	
4562294	029502450090	Old time comedy classics v09 (DVD)	1	Неклассифицированные/default	0	
2178797	011150302333	Old time crisp Rice 12oz	1	Неклассифицированные/default	2178796	Old Time
4562295	088718100106	Old time haw'n salt 32oz	1	Неклассифицированные/default	0	
4562296	088718100205	Old time haw'n salt 80oz	1	Неклассифицированные/default	0	
4562297	799189000047	Old time quality	1	Неклассифицированные/default	0	
3168960	799189000511	Old time quality Cherry	330591	Продукты питания (folder)/Продукты питания	0	
4562298	756510033716	Old time tank battle mtn	1	Неклассифицированные/default	0	
4562299	756510033648	Old time tank Sun Oil	1	Неклассифицированные/default	0	
3168961	864310000057	Old timey shrubs Drinking vinegar	330591	Продукты питания (folder)/Продукты питания	0	
4562300	050400003606	Old timmey White bread 16oz	1	Неклассифицированные/default	0	
4562301	797776041008	Old town brewery 500ml bushcraft-porter	1	Неклассифицированные/default	0	
4562302	797776040995	Old town brewery 500ml forager-pale ale	1	Неклассифицированные/default	0	
4562303	797776041022	Old town brewery 500ml homegrown-saison	1	Неклассифицированные/default	0	
4562304	797776041015	Old town brewery 500ml provender-Wheat beer	1	Неклассифицированные/default	0	
4562305	797776041039	Old town brewery 7500ml elderflower bubbly	1	Неклассифицированные/default	0	
4562306	759239199275	Old town canoe company 1lb spray skirt for dirigo 140 kayak	1	Неклассифицированные/default	0	
1747535	759239251621	Old town canoes and kayaks 12s vapor recreational kayak, sunrise	550638	Спорт и отдых (folder)/Спорт	0	
1080541	4800557075041	Old town carbon paper Black Long #764x100	1	Неклассифицированные/default	0	
1747536	759239260357	Old town discovery 119 solo canoe suitable for use with kayak paddle, Green, 11-feet 9-inch	550638	Спорт и отдых (folder)/Спорт	0	
4562307	699699000721	Old town pottery pottery	1	Неклассифицированные/default	0	
1080542	4800557130061	Old town typal ribbon Black	1	Неклассифицированные/default	0	
2369716	9555076300611	Old town White coffee 3in1 Classic 240ml	1	Неклассифицированные/default	0	
3168962	680474512003	Old town, popcorn&bucket	330591	Продукты питания (folder)/Продукты питания	0	
634583	079694223026	Old trapper	1	Неклассифицированные/default	0	
634584	079694302141	Old trapper beef n Cheese	1	Неклассифицированные/default	0	
2818996	079694301144	Old trapper bf chs orig	1	Неклассифицированные/default	0	
2818997	079694104400	Old trapper bf Stick	1	Неклассифицированные/default	0	
2819001	079694228045	Old trapper chipotle beef jerky	1	Неклассифицированные/default	0	
2818999	079694273038	Old trapper choice teriy	1	Неклассифицированные/default	0	
1927152	079694702033	Old trapper d Eagle peppered jar	1	Неклассифицированные/default	0	
1927153	079694705034	Old trapper d Eagle spicy jar	1	Неклассифицированные/default	0	
1927154	079694703030	Old trapper d Eagle teriaki jar	1	Неклассифицированные/default	0	
2819000	079694331158	Old trapper deli stk ori	1	Неклассифицированные/default	0	
1927155	079694701036	Old trapper jerky d Eagle Old fash jar	1	Неклассифицированные/default	0	
2819002	079694221046	Old trapper jerky Old Fa	1	Неклассифицированные/default	0	
2819003	079694222043	Old trapper jerky pepper	1	Неклассифицированные/default	0	
2819004	079694251036	Old trapper jerky slab o	1	Неклассифицированные/default	0	
2819005	079694252033	Old trapper jerky slab p	1	Неклассифицированные/default	0	
2819006	079694253030	Old trapper jerky slab t	1	Неклассифицированные/default	0	
565633	079694225044	Old trapper jerky spicy	1	Неклассифицированные/default	0	
2819007	079694262322	Old trapper jerky strip	1	Неклассифицированные/default	0	
1625461	079694223040	Old trapper jerky teriya	1	Неклассифицированные/default	0	
2819008	079694263237	Old trapper jerky teriya #2	1	Неклассифицированные/default	0	
2819009	079694221121	Old trapper jerky trad o	1	Неклассифицированные/default	0	
2819010	079694222128	Old trapper jerky trad p	1	Неклассифицированные/default	0	
2819011	079694225129	Old trapper jerky trad s	1	Неклассифицированные/default	0	
2819012	079694223125	Old trapper jerky trad t	1	Неклассифицированные/default	0	
2819013	079694262438	Old trapper jrky strp rf	1	Неклассифицированные/default	0	
565636	079694401400	Old trapper kipperd jmbo	1	Неклассифицированные/default	0	
2819014	079694402407	Old trapper kipperd jmbo #2	1	Неклассифицированные/default	0	
2819015	079694401011	Old trapper kipperd stea	1	Неклассифицированные/default	0	
2819016	079694402018	Old trapper kipperd stea #2	1	Неклассифицированные/default	0	
2819017	079694403015	Old trapper kipperd stea #3	1	Неклассифицированные/default	0	
2819018	079694801286	Old trapper mtl pwr pnl	1	Неклассифицированные/default	0	
2819019	079694000023	Old trapper saus stk Del	1	Неклассифицированные/default	0	
2819020	079694304244	Old trapper saus stk Del #2	1	Неклассифицированные/default	0	
2819021	079694102406	Old trapper saus stk Hot	1	Неклассифицированные/default	0	
2819022	079694102413	Old trapper saus stk Hot #2	1	Неклассифицированные/default	0	
1559690	079694101409	Old trapper saus stk pep	1	Неклассифицированные/default	0	
2819023	079694101416	Old trapper saus stk pep #2	1	Неклассифицированные/default	0	
1559691	079694103403	Old trapper saus stk ter	1	Неклассифицированные/default	0	
2819024	079694103410	Old trapper saus stk ter #2	1	Неклассифицированные/default	0	
2972420	079694096408	Old trapper smoked products 1oz Soft&tender beef jerky, origional	1	Неклассифицированные/default	0	
4562308	079694000818	Old trapper smoked products 8oz Old trpr Gold lb bf jrky mxpk	1	Неклассифицированные/default	0	
4562309	079694705027	Old trapper smoked products 8oz Old trpr pepprd beef jrky mxpk	1	Неклассифицированные/default	0	
4562310	079694000832	Old trapper smoked products 8oz Old trpr teriyk beef jrky mxpk	1	Неклассифицированные/default	0	
634585	079694403404	Old trapper teryaki beef steak	1	Неклассифицированные/default	0	
4562311	062646005856	Old tyme - bestfoods canada 750ml Old tyme Butter flovoured syrup	1	Неклассифицированные/default	0	
4562312	062646005115	Old tyme best Foods canada inc snap cap Old tyme syrup	1	Неклассифицированные/default	0	
4562313	033165121228	Old tyme btr popcorn 12122 12oz	1	Неклассифицированные/default	0	
4562314	761720005224	Old tyme cinnamon syrup 750ml	1	Неклассифицированные/default	0	
4562315	071010200933	Old tyme grainola bread 24oz	1	Неклассифицированные/default	0	
4562316	071010122969	Old tyme ne Hot Dog rolls 17oz	1	Неклассифицированные/default	0	
4562317	761720005217	Old tyme orginal syrup 750ml	1	Неклассифицированные/default	0	
4562318	761720005118	Old tyme Original 375ml	1	Неклассифицированные/default	0	
3185079	071010120026	Old tyme potato bread 24oz	330591	Продукты питания (folder)/Продукты питания	0	
4562319	071010200094	Old tyme raisin bread 16oz	1	Неклассифицированные/default	0	
4562320	071010310199	Old tyme splt tp dnr roll 18oz	1	Неклассифицированные/default	0	
1617146	071010200957	Old tyme stngrd 100% whea 24oz	1	Неклассифицированные/default	0	
4562321	033165111137	Old tyme wht chd popcrn 1111 12oz	1	Неклассифицированные/default	0	
2819046	033165131333	Old tyme yel ched pcrn 13133 12oz	1	Неклассифицированные/default	0	
3168963	070287631860	Old tyme, manischewitz, seedless rye bread	330591	Продукты питания (folder)/Продукты питания	0	
4562322	036300013129	Old vieanna Red Hot riplets 12oz	1	Неклассифицированные/default	0	
4562323	036300102168	Old vienna	1	Неклассифицированные/default	0	
4562324	070897062146	Old vienna beer 6.5oz rr 6.5oz	1	Неклассифицированные/default	0	
4562325	070897062559	Old vienna lager beer 12ct	1	Неклассифицированные/default	0	
4562326	070897061231	Old vienna lager beer, 12oz 6ct	1	Неклассифицированные/default	0	
398834	037773883110	Old village inn plastic 20oz	1	Неклассифицированные/default	0	
4562327	775788240008	Old village potting soil 320oz	1	Неклассифицированные/default	0	
398835	040267100853	Old vine estate Zinfandel glass 750ml	22133	Продукты питания (folder)/Алкогольные напитки/Вино (folder)/Вино	0	
398837	895089000351	Old vines crianza glass 750ml	1	Неклассифицированные/default	0	
1561245	895089000337	Old vines Grand reserva tempranillo glass 750ml	1	Неклассифицированные/default	0	
1561246	895089000344	Old vines reserva tempranillo glass 750ml	1	Неклассифицированные/default	0	
4562328	663595550512	Old virg candle	1	Неклассифицированные/default	0	
4562329	663595550932	Old virg candle #2	1	Неклассифицированные/default	0	
4562330	663595550963	Old virg candle #3	1	Неклассифицированные/default	0	
4562331	663595560511	Old virg candle #4	1	Неклассифицированные/default	0	
4562332	663595560931	Old virg candle #5	1	Неклассифицированные/default	0	
4562333	663595560962	Old virg candle #6	1	Неклассифицированные/default	0	
4562334	663595550987	Old virgina	1	Неклассифицированные/default	0	
4562335	663595540568	Old virgina can	1	Неклассифицированные/default	0	
4562344	663595560634	Old virgina can #10	1	Неклассифицированные/default	0	
4562345	663595560665	Old virgina can #11	1	Неклассифицированные/default	0	
4562346	063595560984	Old virgina can #12	1	Неклассифицированные/default	0	
4562336	663595540575	Old virgina can #2	1	Неклассифицированные/default	0	
4562337	663595540650	Old virgina can #3	1	Неклассифицированные/default	0	
4562338	663595540759	Old virgina can #4	1	Неклассифицированные/default	0	
4562339	663595540810	Old virgina can #5	1	Неклассифицированные/default	0	
4562340	663595550543	Old virgina can #6	1	Неклассифицированные/default	0	
4562341	663595550949	Old virgina can #7	1	Неклассифицированные/default	0	
4562342	663595560559	Old virgina can #8	1	Неклассифицированные/default	0	
4562343	663595560627	Old virgina can #9	1	Неклассифицированные/default	0	
4562347	663595550529	Old virginia can	1	Неклассифицированные/default	0	
4562356	663595560580	Old virginia can #10	1	Неклассифицированные/default	0	
4562357	663595560597	Old virginia can #11	1	Неклассифицированные/default	0	
4562358	663595560610	Old virginia can #12	1	Неклассифицированные/default	0	
4562359	663595560993	Old virginia can #13	1	Неклассифицированные/default	0	
4562348	663595550574	Old virginia can #2	1	Неклассифицированные/default	0	
4562349	663595550581	Old virginia can #3	1	Неклассифицированные/default	0	
4562350	663595550598	Old virginia can #4	1	Неклассифицированные/default	0	
4562351	663595550611	Old virginia can #5	1	Неклассифицированные/default	0	
4562352	663595550994	Old virginia can #6	1	Неклассифицированные/default	0	
4562353	663595560528	Old virginia can #7	1	Неклассифицированные/default	0	
4562354	663595560542	Old virginia can #8	1	Неклассифицированные/default	0	
4562355	663595560573	Old virginia can #9	1	Неклассифицированные/default	0	
4562360	663595621434	Old virginia candle co wax melts-mcintosh 0.77oz	1	Неклассифицированные/default	0	
4562361	663595581028	Old virginia candle company - collegiate collection virginia tech 26oz	1	Неклассифицированные/default	0	
4562362	663595713597	Old virginia candle shade: winter Magic 32oz	1	Неклассифицированные/default	0	
4562363	071025062557	Old vt split top Wheat brd 24.oz	1	Неклассифицированные/default	0	
4562364	880040256496	Old weller 107 750ml	1	Неклассифицированные/default	0	
4562365	088508242306	Old weller strt Bourbon 107p 25.4oz	1	Неклассифицированные/default	0	
4562366	088508242504	Old weller strt Bourbon 107p 59.2oz	1	Неклассифицированные/default	0	
1080544	025335550181	Old wessex ltd cereal - 5 grain oats, rye, triticale, barley, Golden flax.	1	Неклассифицированные/default	1080543	OLD WESSEX
2178798	025335220152	Old wessex LTD instant oatmeal, 100% whole grain, high fiber cereal 16oz	24389	Продукты питания (folder)/Каши, хлопья, сухие завтраки	1080543	OLD WESSEX
2178800	025335440154	Old wessex LTD Organic creamy oat bran cereal 18.5oz	24389	Продукты питания (folder)/Каши, хлопья, сухие завтраки	1080543	OLD WESSEX
1080546	025335330141	Old wessex LTD porridge oats - scottish style 100 % Natural scottish style porridge oats.	24389	Продукты питания (folder)/Каши, хлопья, сухие завтраки	1080543	OLD WESSEX
1080547	025335220145	Old wessex ltd. instant oatmeal 100% Natural whole grain instant oats.	1	Неклассифицированные/default	1080543	OLD WESSEX
1080548	025335110149	Old wessex ltd. irish-style oatmeal high fiber cereal	1	Неклассифицированные/default	1080543	OLD WESSEX
1559820	025335110156	Old wessex ltd. irish-style oatmeal, 100% whole grain, high fiber cereal	1	Неклассифицированные/default	1080543	OLD WESSEX
1080545	025335440147	Old wessex ltd.all-Natural creamy oat bran high fiber breakfast cereal	1	Неклассифицированные/default	1080543	OLD WESSEX
2178799	025335110309	Old wessex Organic instant oatmeal 7.9oz nogmo	24389	Продукты питания (folder)/Каши, хлопья, сухие завтраки	1080543	OLD WESSEX
4562367	628261007899	Old West collection (DVD/3 films)	1	Неклассифицированные/default	0	
4562368	096009016999	Old West cowboys (DVD)	1	Неклассифицированные/default	0	
1561247	073130003456	Old West outdoor bun	1	Неклассифицированные/default	0	
4562369	967499837046	Old whisky river 750ml	1	Неклассифицированные/default	0	
4562370	062100000526	Old williamsburg c	1	Неклассифицированные/default	0	
4562371	014290000770	Old williamsburgh candle	1	Неклассифицированные/default	0	
4562373	601486457236	Old williamsburgh candle (Blue lagoon) 3oz	1	Неклассифицированные/default	0	
4562372	601486502264	Old williamsburgh candle - Raspberry smoothie	1	Неклассифицированные/default	0	
4562374	601486201464	Old williamsburgh candle, Apple cinnamon	1	Неклассифицированные/default	0	
398838	7617700000501	Old willisauer kirsch 200ml	1	Неклассифицированные/default	0	
4562375	084279906836	Old wiloliamsburg Bourbon whisky 375ml	1	Неклассифицированные/default	0	
4562376	099999818079	Old wis sausage ship	1	Неклассифицированные/default	4529122	Old wsconsin
4562377	999998180408	Old wis sausage ship #2	1	Неклассифицированные/default	4529122	Old wsconsin
1080549	073170035202	Old wisconsin 2-$1 beef Stick cs144	1	Неклассифицированные/default	0	
4562378	073170014030	Old wisconsin 3pcs gft bo 32oz	1	Неклассифицированные/default	4529122	Old wsconsin
4562379	073170014054	Old wisconsin 3pcs gft bo 32oz 6ct	1	Неклассифицированные/default	4529122	Old wsconsin
4562380	073170386519	Old wisconsin 48pcs shipr* 8oz	1	Неклассифицированные/default	4529122	Old wsconsin
3168964	073170124067	Old wisconsin beef bites	330591	Продукты питания (folder)/Продукты питания	2646401	Old Wisconsin
1393494	073170180803	Old wisconsin beef sausage snack bites	1	Неклассифицированные/default	2646401	Old Wisconsin
3168965	073170169808	Old wisconsin beef sausage snack bites #2	330591	Продукты питания (folder)/Продукты питания	2646401	Old Wisconsin
3168966	073170320001	Old wisconsin beef sausage snack sticks	330591	Продукты питания (folder)/Продукты питания	2646401	Old Wisconsin
