ID	UPCEAN	Name	CategoryID	CategoryName	BrandID	BrandName
2744052	4660010750324	Напиток узвар 1л	17374	Продукты питания (folder)/Напитки безалкогольные/Сок	0	
3440156	4607972150090	Напиток узвар груша-дичка tetrapak 1л	1	Неклассифицированные/default	0	
1794015	4601825000303	Напиток узвар шиповник tetrapak 1л	17371	Продукты питания (folder)/Напитки безалкогольные/Напитки	3929530	УДАЧНЫЙ ДЕНЬ
3440157	4607972150113	Напиток узвар шиповник tetrapak 1л #2	1	Неклассифицированные/default	0	
2941581	4660010750560	Напиток узвар шиповник из сухофруктов 5л пэт	1	Неклассифицированные/default	0	
3440158	4660010750584	Напиток узвар яблоко из сухофруктов 5л пэт	1	Неклассифицированные/default	0	
2744053	4660010750386	Напиток узвар, ассорти сухофрукты, 1л кор	17374	Продукты питания (folder)/Напитки безалкогольные/Сок	0	
1794014	4601825000297	Напиток узвар, удачный день круша дичка, 1л кор	17371	Продукты питания (folder)/Напитки безалкогольные/Напитки	3929530	УДАЧНЫЙ ДЕНЬ
3440159	1066950100442	Напиток узвар, удачный день круша дичка, 3л, пл/б	1	Неклассифицированные/default	0	
3440160	1066950100435	Напиток узвар, удачный день круша дичка, 5л пл/б	1	Неклассифицированные/default	0	
3440161	4601825000327	Напиток узвар, удачный день курага, 1л кор	1	Неклассифицированные/default	0	
3440162	4660010750362	Напиток узвар, яблоко сухофрукты, 1л кор	1	Неклассифицированные/default	0	
1199450	5202413002014	Напиток узо пломари исидорос арвантис 0.2л 40% п/у /греция/	22581	Продукты питания (folder)/Алкогольные напитки/Водка	1269944	Поломари
1199451	5202413005015	Напиток узо пломари исидорос арвантис 0.5л 40% /греция/	22581	Продукты питания (folder)/Алкогольные напитки/Водка	0	
1269945	5202413007125	Напиток узо поломари 40% 0.05л	22581	Продукты питания (folder)/Алкогольные напитки/Водка	1269944	Поломари
776454	5201015005195	Напиток узо ромиос 38% 0.7л	22581	Продукты питания (folder)/Алкогольные напитки/Водка	776453	Кавино
3440167	4600685130335	Напиток улыбка вишня газ. 0.5л стбут	1	Неклассифицированные/default	0	
3440168	4600685230257	Напиток улыбка вишня газ. 1.5л пл/бут	1	Неклассифицированные/default	0	
3440169	4600685130359	Напиток улыбка грушевый газированный 0.5л ст/б	1	Неклассифицированные/default	0	
3440170	4600685230097	Напиток улыбка грушевый газированный 1.5л пл/бут	1	Неклассифицированные/default	0	
3440172	4600685130458	Напиток улыбка мохито 0.5л пл/бут	1	Неклассифицированные/default	0	
3440174	4607052432511	Напиток уникола волчиха газ. 1.5л пл/бут	1	Неклассифицированные/default	3765445	UNIKOLA (VOLCHIKHINSKIY PIVZ-D/ALTAYSKIY KRAY)
3440175	4608655311005	Напиток уральские источники апельсин газированный 0.6л пэт	1	Неклассифицированные/default	3809061	звездный парус
3440176	4608655311050	Напиток уральские источники дюшес газированный 0.6л пэт	1	Неклассифицированные/default	0	
3440177	4608655311142	Напиток уральские источники лимонад газированный 0.6л пэт	1	Неклассифицированные/default	3809061	звездный парус
3440178	4608655311173	Напиток уральские источники махито газированный 0.6л пэт	1	Неклассифицированные/default	0	
3440179	4606440006211	Напиток уральский купец десертный 15% 0.5л cтекло	1	Неклассифицированные/default	0	
2462550	4600687001343	Напиток усадеб/квас сил/газ пола 0.700	17371	Продукты питания (folder)/Напитки безалкогольные/Напитки	0	
155048	4600687003453	Напиток усадеб/квас сил/газ пола 2.000	1772558	Продукты питания (folder)/Напитки безалкогольные/Квас	48500	Полюстрово
168037	4607048530061	Напиток услада 1.0л абрикос	17374	Продукты питания (folder)/Напитки безалкогольные/Сок	0	
168038	4607048530030	Напиток услада 1.0л ананас	17374	Продукты питания (folder)/Напитки безалкогольные/Сок	0	
168039	4607048530542	Напиток услада 1.0л апельсин	17374	Продукты питания (folder)/Напитки безалкогольные/Сок	0	
168040	4607048530054	Напиток услада 1.0л виноград	17374	Продукты питания (folder)/Напитки безалкогольные/Сок	0	
168042	4607048530092	Напиток услада 1.0л персик	17374	Продукты питания (folder)/Напитки безалкогольные/Сок	0	
1332752	460704853003	Напиток услада ананас дп 1.0 -	17374	Продукты питания (folder)/Напитки безалкогольные/Сок	0	
1217531	4606779666308	Напиток услада йогуртовый клубника питьевая 1.2% 290г пл/б	23326	Продукты питания (folder)/Молочные продукты (folder)/Йогурт	3650970	Ehrmann услада
3440180	4607125694273	Напиток услада натуральный алоэ tetrapak 1л	1	Неклассифицированные/default	0	
3440181	4607115150185	Напиток успенка колокольчик сильногаз 1.5л пл/бут	1	Неклассифицированные/default	0	
3440182	4670008700231	Напиток успокаивающий чайный 20 пакетов тв/уп	1	Неклассифицированные/default	0	
3440183	4670008701627	Напиток успокаивающий чайный 50г тв/уп	1	Неклассифицированные/default	0	
64610	4606564000911	Напиток усполонь новгородский квасной 1.5л пл/б	1772558	Продукты питания (folder)/Напитки безалкогольные/Квас	0	
2902847	4612729480818	Напиток утренняя свежесть из рассола квашен.капусты 400г фдс п/б	1	Неклассифицированные/default	0	
3440184	4627094890674	Напиток учкудук три колодца среднегаз вкус дюшес 1.5л пл/у	1	Неклассифицированные/default	0	
3440185	4627094890704	Напиток учкудук три колодца среднегаз вкус кола 1.5л пл/у	1	Неклассифицированные/default	0	
3440186	4627094890667	Напиток учкудук три колодца среднегаз вкус Крем-сода 1.5л пл/у	1	Неклассифицированные/default	0	
3440187	4627094890650	Напиток учкудук три колодца среднегаз вкус лимонад 1.5л пл/у	1	Неклассифицированные/default	0	
3440188	4627094890698	Напиток учкудук три колодца среднегаз вкус тархун 1.5л пл/у	1	Неклассифицированные/default	0	
2902848	4605169209668	Напиток файн лайф 0.750 барбарис	1	Неклассифицированные/default	0	
2902849	4605169210374	Напиток файн лайф 0.750 груша/дюшес	1	Неклассифицированные/default	0	
2902850	4605169210398	Напиток файн лайф 0.750 земляника	1	Неклассифицированные/default	0	
3440189	4660009054624	Напиток файр бул айс энргетический газированный витаминизированный 0.5л пл/бут	1	Неклассифицированные/default	3658069	FIRE BULL (EXTRA-MIKS/TOMSK )
3440190	4660009052125	Напиток файр бул, газ. энергетич. 0.33л, пл/б	1	Неклассифицированные/default	0	
3440191	4660009052132	Напиток файр бул, газ. энергетич. 0.5л пл/б	1	Неклассифицированные/default	3658069	FIRE BULL (EXTRA-MIKS/TOMSK )
3440192	4660009052668	Напиток файр бул, газ. энергетич. 1л пл/б	1	Неклассифицированные/default	0	
1969840	4810074005902	Напиток фан-фан б/алкогольный газ 1л пл/бут	17371	Продукты питания (folder)/Напитки безалкогольные/Напитки	0	
3440195	4810074009504	Напиток фан-фан газированный 1.5л пл/бут	1	Неклассифицированные/default	0	
3440193	4607045712323	Напиток фантом, виноград 7%, 0.275л, ст/б	1	Неклассифицированные/default	0	
3440194	4607052432498	Напиток фантория апельсиновый волчиха газ. 1.5л пл/бут	1	Неклассифицированные/default	3656262	FANTORIYA (VOLCHIKHINSKIY PIVZ-D/ALTAYSKIY KRAY)
3440196	4660013281238	Напиток феличита, вермут, белый, 12%, 0.5л ст/б	1	Неклассифицированные/default	0	
94724	9066000766200	Напиток фидус апельсин/морковь 0% 500г	144938	Продукты питания (folder)/Молочные продукты (folder)/Молочные продукты	94723	Фидус
94725	9066000766309	Напиток фидус манго/овощи 0% 500г	144938	Продукты питания (folder)/Молочные продукты (folder)/Молочные продукты	94723	Фидус
94728	4600494000461	Напиток фиеста 2.0л свеча декор Байкал	17371	Продукты питания (folder)/Напитки безалкогольные/Напитки	64611	Фиеста
168388	99500238	Напиток фиеста 2.0л свеча декор квас	1772558	Продукты питания (folder)/Напитки безалкогольные/Квас	0	
94732	4600494000478	Напиток фиеста 2.0л свеча декор клубника	17371	Продукты питания (folder)/Напитки безалкогольные/Напитки	64611	Фиеста
94740	4600494504600	Напиток фиеста 2.0л свеча декор яблоко	17371	Продукты питания (folder)/Напитки безалкогольные/Напитки	64611	Фиеста
3864000	4600494000720	Напиток фиеста Байкал 1.25л	17371	Продукты питания (folder)/Напитки безалкогольные/Напитки	64611	Фиеста
94726	4600494000614	Напиток фиеста Байкал с/г жб 0.33л	17371	Продукты питания (folder)/Напитки безалкогольные/Напитки	64611	Фиеста
24705	4600494000379	Напиток фиеста Байкал сил/газ 1.25	17371	Продукты питания (folder)/Напитки безалкогольные/Напитки	64611	Фиеста
94729	4600494000539	Напиток фиеста дюшес газированный 0.6л пл/бут	17371	Продукты питания (folder)/Напитки безалкогольные/Напитки	64611	Фиеста
24707	4600494000430	Напиток фиеста дюшес сильгазированный 2л пл/б	17371	Продукты питания (folder)/Напитки безалкогольные/Напитки	64611	Фиеста
24706	4600494000348	Напиток фиеста дюшес сильногаз 1.25л пл/бут	17371	Продукты питания (folder)/Напитки безалкогольные/Напитки	64611	Фиеста
1333571	460049400047	Напиток фиеста клубника 2л	17371	Продукты питания (folder)/Напитки безалкогольные/Напитки	0	
94730	4600494000577	Напиток фиеста клубника с/г 0.6л	17371	Продукты питания (folder)/Напитки безалкогольные/Напитки	64611	Фиеста
94731	4600494000386	Напиток фиеста клубника с/г 1.25л	17371	Продукты питания (folder)/Напитки безалкогольные/Напитки	64611	Фиеста
94733	4600494504679	Напиток фиеста Крем-сода с/г 0.6л	17371	Продукты питания (folder)/Напитки безалкогольные/Напитки	64611	Фиеста
94734	4600494504686	Напиток фиеста Крем-сода сильногаз 1.25л пл/бут	17371	Продукты питания (folder)/Напитки безалкогольные/Напитки	64611	Фиеста
94735	4600494504693	Напиток фиеста Крем-сода сильногаз 2л пл/бут	17371	Продукты питания (folder)/Напитки безалкогольные/Напитки	64611	Фиеста
1333572	460049400054	Напиток фиеста лимонад сил/газ 0.600	17371	Продукты питания (folder)/Напитки безалкогольные/Напитки	0	
94736	4600494000546	Напиток фиеста лимонад сильгазированный 0.6л пл/бут	17371	Продукты питания (folder)/Напитки безалкогольные/Напитки	64611	Фиеста
24709	4600494000447	Напиток фиеста лимонад сильгазированный 2л пл/б	17371	Продукты питания (folder)/Напитки безалкогольные/Напитки	64611	Фиеста
24708	4600494000355	Напиток фиеста лимонад сильногаз 1.25л пл/бут	17371	Продукты питания (folder)/Напитки безалкогольные/Напитки	64611	Фиеста
3440197	4600494507809	Напиток фиеста лимонад сильногаз 1.25л пл/бут #2	1	Неклассифицированные/default	0	
94737	4600494000553	Напиток фиеста тархун газированный 0.6л пл/бут	17371	Продукты питания (folder)/Напитки безалкогольные/Напитки	64611	Фиеста
24711	4600494000454	Напиток фиеста тархун газированный 2л пл/бут	17371	Продукты питания (folder)/Напитки безалкогольные/Напитки	64611	Фиеста
24710	4600494000362	Напиток фиеста тархун сильногаз 1.25л пл/бут	17371	Продукты питания (folder)/Напитки безалкогольные/Напитки	64611	Фиеста
94738	4600494504587	Напиток фиеста яблоко с/г 0.6л	17371	Продукты питания (folder)/Напитки безалкогольные/Напитки	64611	Фиеста
94727	4600494000560	Напиток фиеста, Байкал, сильгаз. 0.6л, пл/б	17371	Продукты питания (folder)/Напитки безалкогольные/Напитки	64611	Фиеста
3440198	4603726360210	Напиток фикси газированный со вкусом фруктового лимонада 1л пл/бут	1	Неклассифицированные/default	3657559	FIKSIKI (STORK PLYUS)
2943097	4620036941489	Напиток фиксики смузи молочный с соком киви груша 250г пл/б	1	Неклассифицированные/default	0	
2943099	4620036941496	Напиток фиксики смузи молочный с соком клубника банан 250г пл/б	1	Неклассифицированные/default	0	
2943101	4620036941410	Напиток фиксики смузи молочный с соком клубника банан 930г пл/б	1	Неклассифицированные/default	0	
2249901	6935382611404	Напиток фитобест с кус.алоэ гранат 0.5л п/б	17371	Продукты питания (folder)/Напитки безалкогольные/Напитки	2249900	Фитобест
2249902	6935382611411	Напиток фитобест с кус.алоэ манго 0.5л п/б	17371	Продукты питания (folder)/Напитки безалкогольные/Напитки	2249900	Фитобест
2249903	6935382611381	Напиток фитобест с кус.алоэ оригинал.б/сах.0.5л п/б	17371	Продукты питания (folder)/Напитки безалкогольные/Напитки	2249900	Фитобест
2249904	6935382611398	Напиток фитобест с кус.алоэ оригинал.с сах.0.5л п/б	17371	Продукты питания (folder)/Напитки безалкогольные/Напитки	2249900	Фитобест
2902852	4680006470524	Напиток фитогуру анти стресс груша 0.33л с/б	1	Неклассифицированные/default	0	
2249905	4680006470012	Напиток фитогуру вижн черника/черная смородина/бархатцы 0.28л с/б	17371	Продукты питания (folder)/Напитки безалкогольные/Напитки	776458	Фитогуру
2902856	4680006470517	Напиток фитогуру мэнс форс тыква 0.33л с/б	1	Неклассифицированные/default	0	
3440200	4600090016781	Напиток фитодар лесная ягода сухой быстрорастворимый 100г	1	Неклассифицированные/default	0	
3440201	4610009001647	Напиток фитодар с женьшенем сухой быстрорастворимый 100г	1	Неклассифицированные/default	0	
3440202	4610009001661	Напиток фитодар, шиповник, 100г м/у	1	Неклассифицированные/default	0	
94741	4607046311631	Напиток фитомилк соевый стерил.2% 1л	38982	Продукты питания (folder)/Соевые продукты	0	
3864001	4607154565797	Напиток фл.секс на пляж.7% 0.275л	144731	Продукты питания (folder)/Алкогольные напитки/Слабоалкогольные напитки	0	
1269947	4820103370413	Напиток флория апельсин 1.25л	1	Неклассифицированные/default	0	
1269948	4820007170768	Напиток флория апельсин с соком 0.5л	17371	Продукты питания (folder)/Напитки безалкогольные/Напитки	0	
1269949	4820007171147	Напиток флория апельсин с соком 2л	17371	Продукты питания (folder)/Напитки безалкогольные/Напитки	0	
1269950	4820103370420	Напиток флория апельсин с соком 2л #2	17371	Продукты питания (folder)/Напитки безалкогольные/Напитки	0	
1269951	4820103370383	Напиток флория витаминчик 1.25л	1	Неклассифицированные/default	0	
1269952	4820007170683	Напиток флория витаминчик с соком 0.5л	17371	Продукты питания (folder)/Напитки безалкогольные/Напитки	0	
1269953	4820007171062	Напиток флория витаминчик с соком 2л	17371	Продукты питания (folder)/Напитки безалкогольные/Напитки	0	
1269954	4820007172281	Напиток флория витаминчик с соком 2л #2	17371	Продукты питания (folder)/Напитки безалкогольные/Напитки	0	
1269955	4820103370390	Напиток флория витаминчик с соком 2л #3	17371	Продукты питания (folder)/Напитки безалкогольные/Напитки	0	
1269956	4820007170690	Напиток флория дюшес 0.5л	1	Неклассифицированные/default	0	
1269957	4820103370352	Напиток флория дюшес 1.25л	1	Неклассифицированные/default	0	
1269958	4820007171079	Напиток флория дюшес с соком 2л	17371	Продукты питания (folder)/Напитки безалкогольные/Напитки	0	
1269959	4820103370369	Напиток флория дюшес с соком 2л #2	17371	Продукты питания (folder)/Напитки безалкогольные/Напитки	0	
1269960	4820007172113	Напиток флория Каприз 2л	1	Неклассифицированные/default	0	
1269961	4820103370307	Напиток флория лимон лайм 2л	1	Неклассифицированные/default	0	
1269962	4820007171796	Напиток флория лимон лайт 0.5л	1	Неклассифицированные/default	0	
1269963	4820007171130	Напиток флория лимон лайт с соком 2л	17371	Продукты питания (folder)/Напитки безалкогольные/Напитки	0	
1269964	4820007171819	Напиток флория лимон лайт с соком 2л #2	17371	Продукты питания (folder)/Напитки безалкогольные/Напитки	0	
1269965	4820007170744	Напиток флория лимонад 0.5л	1	Неклассифицированные/default	0	
1269966	4820103370321	Напиток флория лимонад 1.25л	1	Неклассифицированные/default	0	
1269967	4820103370338	Напиток флория лимонад 2л	1	Неклассифицированные/default	0	
1269968	4820007171123	Напиток флория лимонад с соком 2л	17371	Продукты питания (folder)/Напитки безалкогольные/Напитки	0	
1269969	4820007171208	Напиток флория пикник 0.5л	1	Неклассифицированные/default	0	
1269970	4820103370260	Напиток флория пикник 1.25л	1	Неклассифицированные/default	0	
1269971	4820103370277	Напиток флория пикник 2л	1	Неклассифицированные/default	0	
1269972	4820007171215	Напиток флория пикник с соком 2л	17371	Продукты питания (folder)/Напитки безалкогольные/Напитки	0	
1269973	4820007172120	Напиток флория цитрус-микс 0.5л	1	Неклассифицированные/default	0	
1269974	4820007172137	Напиток флория цитрус-микс с соком 2л	17371	Продукты питания (folder)/Напитки безалкогольные/Напитки	0	
2462551	460068237013	Напиток флэш энергия 0.500	17371	Продукты питания (folder)/Напитки безалкогольные/Напитки	0	
2902858	5060042981236	Напиток фолкингстон с соком летних ягод 0.25л с/б	1	Неклассифицированные/default	0	
2902859	5060042981076	Напиток фолкингстон традиц английский 0.25л с/б	1	Неклассифицированные/default	0	
1686486	5060042980956	Напиток фолкингтонс все тот же розовый лимонад 0.25л с/б	17371	Продукты питания (folder)/Напитки безалкогольные/Напитки	1686485	Фолкингтонс
3440203	4607031479285	Напиток фрау му мохито сывороточный с соком обезжиренный 930г пэт	1	Неклассифицированные/default	3319900	фрау му
3440204	4610025950073	Напиток фрау му мультифруктовый сывороточный 920мл пл/бут	1	Неклассифицированные/default	0	
2944303	4607031479278	Напиток фрау му мультифруктовый сывороточный с соком обезжиренный 930г пэт	1	Неклассифицированные/default	3319900	фрау му
3440205	4607031479308	Напиток фрау му пина колада сывороточный с соком обезжиренный 930г пэт	1	Неклассифицированные/default	3319900	фрау му
2744054	764015715037	Напиток фреш бар клюква газ 0.48 пэт	17371	Продукты питания (folder)/Напитки безалкогольные/Напитки	0	
