ID	UPCEAN	Name	CategoryID	CategoryName	BrandID	BrandName
3293714	4607031581063	Вода минеральная горячий ключ ручеек 958 столовая газированная 1.5л пл/бут	48140	Продукты питания (folder)/Напитки безалкогольные/Вода минеральная	0	
3293715	4607031580776	Вода минеральная горячий ключ ручеек газированная 0.5л пэт	48140	Продукты питания (folder)/Напитки безалкогольные/Вода минеральная	0	
3293716	4601068000245	Вода минеральная горячий ключ столовая, газированная 0.5л пл/б	48140	Продукты питания (folder)/Напитки безалкогольные/Вода минеральная	0	
3293717	4630003540010	Вода минеральная горячий ключ-2000 газированная 500мл пэт	48140	Продукты питания (folder)/Напитки безалкогольные/Вода минеральная	0	
1196792	4606564001130	Вода минеральная господин вел/новгород газ 0.500	48140	Продукты питания (folder)/Напитки безалкогольные/Вода минеральная	0	
22551	4810112000494	Вода минеральная дарида йод п/э 1.500	17388	Продукты питания (folder)/Напитки безалкогольные/Вода питьевая	0	
1196798	4810112001958	Вода минеральная дарида леч/стол негаз пэт 1.5	48140	Продукты питания (folder)/Напитки безалкогольные/Вода минеральная	0	
1196799	4810112001040	Вода минеральная дарида с селеном газ 1.5	48140	Продукты питания (folder)/Напитки безалкогольные/Вода минеральная	0	
1196754	4820010891148	Вода минеральная два океана газированная 0.5л пл/бут	48140	Продукты питания (folder)/Напитки безалкогольные/Вода минеральная	0	
2721200	4607017990018	Вода минеральная дворцовая 0.5л газ	48140	Продукты питания (folder)/Напитки безалкогольные/Вода минеральная	0	
2721201	4607017990032	Вода минеральная дворцовая 0.5л негаз	48140	Продукты питания (folder)/Напитки безалкогольные/Вода минеральная	0	
2721202	4607017990025	Вода минеральная дворцовая 1.5л газ	48140	Продукты питания (folder)/Напитки безалкогольные/Вода минеральная	0	
2721203	4607017990049	Вода минеральная дворцовая 1.5л негаз	48140	Продукты питания (folder)/Напитки безалкогольные/Вода минеральная	0	
1967510	4811161000015	Вода минеральная дворцовая 1.5л пэт	48140	Продукты питания (folder)/Напитки безалкогольные/Вода минеральная	0	
1660425	4607088910267	Вода минеральная демидовская 0.5л	48140	Продукты питания (folder)/Напитки безалкогольные/Вода минеральная	0	
1660426	4607088910045	Вода минеральная демидовская 1.5л	48140	Продукты питания (folder)/Напитки безалкогольные/Вода минеральная	0	
3293718	4607088910052	Вода минеральная демидовская Люкс негазированная, 0.5л пл/б	48140	Продукты питания (folder)/Напитки безалкогольные/Вода минеральная	0	
3293719	4620017550099	Вода минеральная демидовская целебная 1.5л пл/б	48140	Продукты питания (folder)/Напитки безалкогольные/Вода минеральная	0	
3293720	4607088910038	Вода минеральная демидовская целебная газированная 0.5л пл/б	48140	Продукты питания (folder)/Напитки безалкогольные/Вода минеральная	0	
3293721	4620017550112	Вода минеральная демидовская целебная газированная 0.5л пл/б #2	48140	Продукты питания (folder)/Напитки безалкогольные/Вода минеральная	0	
2855848	4607154510452	Вода минеральная детская жемчужинка байкала 0.5л негазированная, иркутский завод розлива минеральных вод	48140	Продукты питания (folder)/Напитки безалкогольные/Вода минеральная	0	
3293722	4600685240010	Вода минеральная джела газированная 1.5л пл/бут	48140	Продукты питания (folder)/Напитки безалкогольные/Вода минеральная	0	
48304	4850013000032	Вода минеральная джемрук классик газированная 0.5л ст/б	48140	Продукты питания (folder)/Напитки безалкогольные/Вода минеральная	48302	Джермук
1196800	4820015291141	Вода минеральная джерельна 10л (ООО экоильичпродукт)	48140	Продукты питания (folder)/Напитки безалкогольные/Вода минеральная	0	
1196801	4820015291110	Вода минеральная джерельна 19л (ООО экоильичпродукт)	48140	Продукты питания (folder)/Напитки безалкогольные/Вода минеральная	0	
1196802	4820015290991	Вода минеральная джерельна негаз 1.5л (ООО экоильичпродукт)	48140	Продукты питания (folder)/Напитки безалкогольные/Вода минеральная	0	
1196803	4820145600295	Вода минеральная джерельна негаз 1.5л (ООО экоильичпродукт) #2	48140	Продукты питания (folder)/Напитки безалкогольные/Вода минеральная	0	
1196804	4820015291172	Вода минеральная джерельна негаз 5л (ООО экоильичпродукт)	48140	Продукты питания (folder)/Напитки безалкогольные/Вода минеральная	0	
1196805	4820145600301	Вода минеральная джерельна негаз 5л (ООО экоильичпродукт) #2	48140	Продукты питания (folder)/Напитки безалкогольные/Вода минеральная	0	
1196806	48200318	Вода минеральная джерельна с/газ 1.5л (ООО экоилличпродукт)	48140	Продукты питания (folder)/Напитки безалкогольные/Вода минеральная	0	
1196807	4820015290977	Вода минеральная джерельна с/газ 1.5л (ООО экоилличпродукт) #2	48140	Продукты питания (folder)/Напитки безалкогольные/Вода минеральная	0	
1196808	4820145600325	Вода минеральная джерельна с/газ 1.5л (ООО экоилличпродукт) #3	48140	Продукты питания (folder)/Напитки безалкогольные/Вода минеральная	0	
1196809	4820008370846	Вода минеральная джерельна с/газ. 0.5л (ООО экоильичпродукт)	48140	Продукты питания (folder)/Напитки безалкогольные/Вода минеральная	0	
1196810	4820015291011	Вода минеральная джерельна сл/газ. 1.5л (ООО экоильичпродукт)	48140	Продукты питания (folder)/Напитки безалкогольные/Вода минеральная	0	
1196811	4820145600318	Вода минеральная джерельна сл/газ. 1.5л (ООО экоильичпродукт) #2	48140	Продукты питания (folder)/Напитки безалкогольные/Вода минеральная	0	
48306	4850004090011	Вода минеральная джермук газ 425мл стбан	48140	Продукты питания (folder)/Напитки безалкогольные/Вода минеральная	48302	Джермук
48305	4850013000025	Вода минеральная джермук газ п/э 1.500	48140	Продукты питания (folder)/Напитки безалкогольные/Вода минеральная	48302	Джермук
3293723	4850010000059	Вода минеральная джермук газированная лечебно-столовая 1л тв/уп	48140	Продукты питания (folder)/Напитки безалкогольные/Вода минеральная	0	
48303	4850013000018	Вода минеральная джермук классик природная 500мл пл/б	48140	Продукты питания (folder)/Напитки безалкогольные/Вода минеральная	48302	Джермук
2855798	4850013000162	Вода минеральная джермук лечебно-столовая газированная 0.5л ст/б	1	Неклассифицированные/default	0	
1196812	4850010000240	Вода минеральная джермук натур/газ 0.5л ст.	48140	Продукты питания (folder)/Напитки безалкогольные/Вода минеральная	0	
2855849	4607017092774	Вода минеральная джигем негаз 5.0	48140	Продукты питания (folder)/Напитки безалкогольные/Вода минеральная	0	
2855850	4607160011066	Вода минеральная джинал 0.500	48140	Продукты питания (folder)/Напитки безалкогольные/Вода минеральная	0	
2855851	4607160011042	Вода минеральная джинал 1.5	48140	Продукты питания (folder)/Напитки безалкогольные/Вода минеральная	0	
2855852	4607160011080	Вода минеральная джинал 1.5 #2	48140	Продукты питания (folder)/Напитки безалкогольные/Вода минеральная	0	
3293724	4607007392242	Вода минеральная дивеевская газированная 0.6л пл/бут	48140	Продукты питания (folder)/Напитки безалкогольные/Вода минеральная	0	
3293725	4607007392259	Вода минеральная дивеевская газированная 1.5л пл/бут	48140	Продукты питания (folder)/Напитки безалкогольные/Вода минеральная	0	
1196813	4820008370471	Вода минеральная дилайт абсолютная 1.25л	48140	Продукты питания (folder)/Напитки безалкогольные/Вода минеральная	0	
1196814	4820008370419	Вода минеральная дилайт н2о + лимон 2л	48140	Продукты питания (folder)/Напитки безалкогольные/Вода минеральная	0	
1196815	4820008370648	Вода минеральная дилайт столовая абсолютная н2о 0.5л	48140	Продукты питания (folder)/Напитки безалкогольные/Вода минеральная	0	
1196816	4820008370396	Вода минеральная дилайт столовая абсолютная н2о 2л	48140	Продукты питания (folder)/Напитки безалкогольные/Вода минеральная	0	
3293726	4607017095119	Вода минеральная добрый доктор Ессентуки №4 лечебно-столовая 500мл ст/б	48140	Продукты питания (folder)/Напитки безалкогольные/Вода минеральная	0	
2427927	4601593001342	Вода минеральная Долина нартов газ 1.500	17388	Продукты питания (folder)/Напитки безалкогольные/Вода питьевая	0	
1206333	4601593000987	Вода минеральная долины нарзанов лечебно-столовая газированная 0.5л стбут	17388	Продукты питания (folder)/Напитки безалкогольные/Вода питьевая	0	
452420	4601593002172	Вода минеральная долины нарзанов лечебно-столовая негазированная 1.5л пл/бут	48140	Продукты питания (folder)/Напитки безалкогольные/Вода минеральная	452412	VITA
2227701	8033564330469	Вода минеральная доломиа эксклюзив газированная 750мл с/б	17388	Продукты питания (folder)/Напитки безалкогольные/Вода питьевая	2227700	Доломиа
2427907	8033564333286	Вода минеральная доломиа эксклюзив газированная 750мл с/б #2	17388	Продукты питания (folder)/Напитки безалкогольные/Вода питьевая	2227700	Доломиа
2227702	8033564330445	Вода минеральная доломиа эксклюзив негазированная 750мл с/б	17388	Продукты питания (folder)/Напитки безалкогольные/Вода питьевая	2227700	Доломиа
2427908	8033564333279	Вода минеральная доломиа эксклюзив негазированная 750мл с/б #2	17388	Продукты питания (folder)/Напитки безалкогольные/Вода питьевая	2227700	Доломиа
2227703	8033564330551	Вода минеральная доломиа элегант газированная 0.5л п/б	17388	Продукты питания (folder)/Напитки безалкогольные/Вода питьевая	2227700	Доломиа
2227704	8033564333224	Вода минеральная доломиа элегант газированная 0.5л п/б #2	17388	Продукты питания (folder)/Напитки безалкогольные/Вода питьевая	2227700	Доломиа
2855800	8033564333446	Вода минеральная доломиа элегант газированная 0.5л п/б #3	1	Неклассифицированные/default	0	
2227705	8033564330377	Вода минеральная доломиа элегант газированная 1л п/б	17388	Продукты питания (folder)/Напитки безалкогольные/Вода питьевая	2227700	Доломиа
2427910	8033564333248	Вода минеральная доломиа элегант газированная 1л п/б #2	17388	Продукты питания (folder)/Напитки безалкогольные/Вода питьевая	2227700	Доломиа
2227706	8033564330537	Вода минеральная доломиа элегант негазированная 0.5л п/б	17388	Продукты питания (folder)/Напитки безалкогольные/Вода питьевая	2227700	Доломиа
2227707	8033564333217	Вода минеральная доломиа элегант негазированная 0.5л п/б #2	17388	Продукты питания (folder)/Напитки безалкогольные/Вода питьевая	2227700	Доломиа
2855801	8033564333361	Вода минеральная доломиа элегант негазированная 0.5л п/б #3	1	Неклассифицированные/default	0	
2227708	8033564330353	Вода минеральная доломиа элегант негазированная 1л п/б	17388	Продукты питания (folder)/Напитки безалкогольные/Вода питьевая	2227700	Доломиа
2227709	8033564333231	Вода минеральная доломиа элегант негазированная 1л п/б #2	17388	Продукты питания (folder)/Напитки безалкогольные/Вода питьевая	2227700	Доломиа
48312	3838600041157	Вода минеральная донат mg 1л лечебная газированная пласт упаковка, дрога колинска	48140	Продукты питания (folder)/Напитки безалкогольные/Вода минеральная	48310	Донат Мg
452363	3838471015844	Вода минеральная донат mg 1л лечебная газированная стекло, дрога колинска	48140	Продукты питания (folder)/Напитки безалкогольные/Вода минеральная	0	
3293727	3838471018944	Вода минеральная донат мг 0.5л	48140	Продукты питания (folder)/Напитки безалкогольные/Вода минеральная	0	
3293728	3838471018968	Вода минеральная донат мг 1л	48140	Продукты питания (folder)/Напитки безалкогольные/Вода минеральная	0	
2427928	4813313000027	Вода минеральная дубайская леч-столов. хлор-сульф. натр-кальци до 01.02.17	17388	Продукты питания (folder)/Напитки безалкогольные/Вода питьевая	0	
2427929	4813313000065	Вода минеральная дубайская леч-столов. хлор-сульф.натр-кальциев до 01.02.17	17388	Продукты питания (folder)/Напитки безалкогольные/Вода питьевая	0	
2427930	4813313000058	Вода минеральная дубайская леч-столов. хлор-сульф.натр-кальциев до 01.11.16	17388	Продукты питания (folder)/Напитки безалкогольные/Вода питьевая	0	
2427931	4813313000041	Вода минеральная дубайская леч-столов. хлор-сульф.натр-кальциев до 21.03.17	17388	Продукты питания (folder)/Напитки безалкогольные/Вода питьевая	0	
3293729	4607115820439	Вода минеральная дубрава газированная 1.5л	48140	Продукты питания (folder)/Напитки безалкогольные/Вода минеральная	0	
3293730	4607115820446	Вода минеральная дубрава негазированная 1.5л пл/б	48140	Продукты питания (folder)/Напитки безалкогольные/Вода минеральная	0	
3293731	4607084380019	Вода минеральная дупленская газированная 1.5л пл/бут	48140	Продукты питания (folder)/Напитки безалкогольные/Вода минеральная	0	
452467	8003068005323	Вода минеральная еtrusca натуральная газ 0.25л /24 Италия	17388	Продукты питания (folder)/Напитки безалкогольные/Вода питьевая	0	
3293732	4650001910080	Вода минеральная елисеевская лечебно-столовая газированная 1.5л пл/бут	48140	Продукты питания (folder)/Напитки безалкогольные/Вода минеральная	0	
1660427	4607931605272	Вода минеральная емв Ессентуки №17 газированная 500мл ст/б	48140	Продукты питания (folder)/Напитки безалкогольные/Вода минеральная	0	
3293733	4650067780412	Вода минеральная емв Ессентуки №4 азированная 0.5л стбут	48140	Продукты питания (folder)/Напитки безалкогольные/Вода минеральная	0	
3293734	4607931606217	Вода минеральная емв живая столовая газированная 0.5л пл/бут	48140	Продукты питания (folder)/Напитки безалкогольные/Вода минеральная	0	
3293735	4607931606200	Вода минеральная емв живая столовая негазированная 0.5л пл/бут	48140	Продукты питания (folder)/Напитки безалкогольные/Вода минеральная	0	
3293736	4607931605333	Вода минеральная емв нагутская газированная 1.5л пл/бут	48140	Продукты питания (folder)/Напитки безалкогольные/Вода минеральная	0	
1760582	4607931605340	Вода минеральная емв славяновская газированная 1.5л пл/б	17388	Продукты питания (folder)/Напитки безалкогольные/Вода питьевая	0	
1760584	4607931605357	Вода минеральная емв смирновская газированная 1.5л пл/б	17388	Продукты питания (folder)/Напитки безалкогольные/Вода питьевая	0	
3293737	4601261001025	Вода минеральная емв, славяновская, газированная 0.5л ст/б	48140	Продукты питания (folder)/Напитки безалкогольные/Вода минеральная	0	
48328	4605674000033	Вода минеральная Ессентуки 0.54л №17 лечебно-столовая газированная, вимм-биль-данн	48140	Продукты питания (folder)/Напитки безалкогольные/Вода минеральная	48327	ВБД
48356	4605674000026	Вода минеральная Ессентуки 0.54л №4 лечебно-столовая газированная, вимм-биль-данн	48140	Продукты питания (folder)/Напитки безалкогольные/Вода минеральная	48327	ВБД
1660429	4640007531075	Вода минеральная Ессентуки 0.5л №4 лечебно-столовая газированная евро стекло, ессентукские минеральные воды Плюс	48140	Продукты питания (folder)/Напитки безалкогольные/Вода минеральная	0	
48357	4605674000019	Вода минеральная Ессентуки 1.5л №4 лечебно-столовая газированная, вимм-биль-данн	48140	Продукты питания (folder)/Напитки безалкогольные/Вода минеральная	48327	ВБД
1196731	4607035260308	Вода минеральная Ессентуки n1 аллея источников 1.5л	48140	Продукты питания (folder)/Напитки безалкогольные/Вода минеральная	0	
1196732	4607035260247	Вода минеральная Ессентуки n1 аллея источников с/б 0.5л	48140	Продукты питания (folder)/Напитки безалкогольные/Вода минеральная	0	
1660428	4640007531051	Вода минеральная Ессентуки n17 0.5л #3	48140	Продукты питания (folder)/Напитки безалкогольные/Вода минеральная	0	
2427935	4607161970553	Вода минеральная Ессентуки n17 0.5л #4	17388	Продукты питания (folder)/Напитки безалкогольные/Вода питьевая	0	
2427936	4607931605296	Вода минеральная Ессентуки n17 0.5л #5	17388	Продукты питания (folder)/Напитки безалкогольные/Вода питьевая	0	
2427937	4640001850882	Вода минеральная Ессентуки n17 0.5л #6	17388	Продукты питания (folder)/Напитки безалкогольные/Вода питьевая	0	
2427938	4640001850905	Вода минеральная Ессентуки n17 0.5л #7	17388	Продукты питания (folder)/Напитки безалкогольные/Вода питьевая	0	
159178	4601918000227	Вода минеральная Ессентуки n17 1.25л	17388	Продукты питания (folder)/Напитки безалкогольные/Вода питьевая	94032	Ессентуки
2427941	460716197003	Вода минеральная Ессентуки n17 1.500	17388	Продукты питания (folder)/Напитки безалкогольные/Вода питьевая	0	
2427943	4620771330647	Вода минеральная Ессентуки n17 1.500 #3	17388	Продукты питания (folder)/Напитки безалкогольные/Вода питьевая	0	
48324	4607033880041	Вода минеральная Ессентуки n17 1.5л	48140	Продукты питания (folder)/Напитки безалкогольные/Вода минеральная	0	
