ID	UPCEAN	Name	CategoryID	CategoryName	BrandID	BrandName
93902	4620000470151	Коктейль Bacardi breezer вкус троп/лимона 5.6% 0.275	144731	Продукты питания (folder)/Алкогольные напитки/Слабоалкогольные напитки	93895	Bacardi
183071	080480806286	Коктейль Bacardi party mai tai 10% 1750ml	181529	Продукты питания (folder)/Алкогольные напитки/COCKTAILS	93895	Bacardi
183074	080480806163	Коктейль Bacardi party zombie 12.5% 750ml	181529	Продукты питания (folder)/Алкогольные напитки/COCKTAILS	93895	Bacardi
93899	5010677553049	Коктейль Bacardi бризер кр/грейпфрут 5% с/б 0.275	144731	Продукты питания (folder)/Алкогольные напитки/Слабоалкогольные напитки	93895	Bacardi
1182405	462000047018	Коктейль Bacardi бризер кр/грейпфрут 5.6% с/б 0.275	144731	Продукты питания (folder)/Алкогольные напитки/Слабоалкогольные напитки	93895	Bacardi
93896	5010677551311	Коктейль Bacardi бризер троп/апельсин 5% с/б 0.275	144731	Продукты питания (folder)/Алкогольные напитки/Слабоалкогольные напитки	93895	Bacardi
93898	4620000470168	Коктейль Bacardi бризер троп/апельсин 5.6% с/б 0.275	144731	Продукты питания (folder)/Алкогольные напитки/Слабоалкогольные напитки	93895	Bacardi
93901	5010677551397	Коктейль Bacardi бризер троп/лайм 5% с/б 0.275	144731	Продукты питания (folder)/Алкогольные напитки/Слабоалкогольные напитки	93895	Bacardi
183345	084380425011	Коктейль bartenders Hot sex 12.5% 1750ml	181529	Продукты питания (folder)/Алкогольные напитки/COCKTAILS	183344	BARTENDERS
183346	084380425042	Коктейль bartenders Hot sex 12.5% 750ml	181529	Продукты питания (folder)/Алкогольные напитки/COCKTAILS	183344	BARTENDERS
2770294	4601075349962	Коктейль be strong ваниль 0.1% 0.25	1	Неклассифицированные/default	0	
2770293	4601075349955	Коктейль be strong шоколад 0.1% 0.25	1	Неклассифицированные/default	0	
3351050	4640001481369	Коктейль bianco винный белый полусладкий с ароматом муската и груши 6% 750мл стекло	1	Неклассифицированные/default	3623580	BIANCO (GARMONIYA GK)
3351051	4640001481345	Коктейль bianco винный белый полусладкий с ароматом персика и груши 6% 750мл стекло	1	Неклассифицированные/default	3623580	BIANCO (GARMONIYA GK)
67211	7618500941230	Коктейль biotta овощной по ориг рец. 0.5л стбан	17374	Продукты питания (folder)/Напитки безалкогольные/Сок	567655	Biotta
3351052	4602983009320	Коктейль Black mamba слабоалкогольный с коньяком 7% жб 0.5л	1	Неклассифицированные/default	3625259	BLACK MAMBA (MEGAPACK/VIDNOE)
3351053	4602983009368	Коктейль Black mamba слабоалкогольный с ромом 7.2% жб 0.5л	1	Неклассифицированные/default	0	
3351054	4610011220845	Коктейль blazer джин тоник, 4.8% 0.5л пл/б	1	Неклассифицированные/default	1714654	Blazer
3351055	4602441012541	Коктейль blazer дыня, 7%, 1.5л пл/б	1	Неклассифицированные/default	1714654	Blazer
2443479	4601241003308	Коктейль blazer дыня, 8% 1.5л пл/б	144731	Продукты питания (folder)/Алкогольные напитки/Слабоалкогольные напитки	1714654	Blazer
2468811	4601241004404	Коктейль blazer красный виноград 8% 1.5л пл/б	22186	Продукты питания (folder)/Алкогольные напитки/Пиво	1714654	Blazer
2443480	4601241003384	Коктейль blazer лимон п/э 8% 0.500	144731	Продукты питания (folder)/Алкогольные напитки/Слабоалкогольные напитки	1714654	Blazer
1806800	4601241003315	Коктейль blazer лимон п/э 8% 1.500	22186	Продукты питания (folder)/Алкогольные напитки/Пиво	1714654	Blazer
2443481	4601241003353	Коктейль blazer мандарин п/э 8% 0.500	144731	Продукты питания (folder)/Алкогольные напитки/Слабоалкогольные напитки	0	
2443482	4602441001842	Коктейль blazer мандарин п/э 8% 0.500 #2	144731	Продукты питания (folder)/Алкогольные напитки/Слабоалкогольные напитки	0	
2443483	4601241003223	Коктейль blazer мандарин п/э 8% 1.500	144731	Продукты питания (folder)/Алкогольные напитки/Слабоалкогольные напитки	3881641	БЛЕЙЗЕР
3351056	4630011630369	Коктейль bomb, Energy drive 7%, 0.33л, жб	1	Неклассифицированные/default	0	
3351057	4630011630352	Коктейль bomb, марохито, 7%, 0.33л, жб	1	Неклассифицированные/default	0	
3351058	4607041253585	Коктейль bravo Classic винный со вкусом джина и лимона 7.2% 0.5л пл/б	1	Неклассифицированные/default	0	
2431949	4607041253301	Коктейль bravo premium vdk premium isabella винный 8.5% 0.5л пл/бут	23104	Продукты питания (folder)/Алкогольные напитки/Джин	3767152	VDK
2431950	4607041253271	Коктейль bravo premium vdk premium Lemon винный 8.5% 0.5л пл/бут	23104	Продукты питания (folder)/Алкогольные напитки/Джин	3767152	VDK
2431951	4607041253288	Коктейль bravo premium vdk premium plum винный 8.5% 0.5л пл/бут	23104	Продукты питания (folder)/Алкогольные напитки/Джин	0	
2431948	4607041253295	Коктейль bravo premium vdk premium White grape винный 8.5% 0.5л пл/бут	23104	Продукты питания (folder)/Алкогольные напитки/Джин	3767152	VDK
3351059	4607041253783	Коктейль bravo premium джин грейпфрут 0.45л 7.1% жб	1	Неклассифицированные/default	0	
3351060	4607041253691	Коктейль bravo premium джин грейпфрут оригинальный 0.45л 7.1% жб	1	Неклассифицированные/default	0	
3351061	4607041253790	Коктейль bravo premium джин-тоник оригинальный 0.45л 7.1% жб	1	Неклассифицированные/default	23105	GORDON'S
3351062	4607041253592	Коктейль bravo джин-тоник винный газированный со вкусом джина и грейфрукта 7.2% 0.5л пл/б	1	Неклассифицированные/default	3628298	BRAVO (ROUST)
3351063	4607041253608	Коктейль bravo джин-тоник винный газированный со вкусом джина и тоника 7.2% 0.5л пл/б	1	Неклассифицированные/default	0	
53130	4607041251093	Коктейль bravo джин-тоник грин жб 9% 0.500	144731	Продукты питания (folder)/Алкогольные напитки/Слабоалкогольные напитки	53123	Браво
1226237	460704125001	Коктейль bravo джин-тоник жб 8.8% 0.330	144731	Продукты питания (folder)/Алкогольные напитки/Слабоалкогольные напитки	0	
149682	4607041250003	Коктейль bravo классик традиционный джин-тоник кокт. 0.5 ж 8.8-9%	144731	Продукты питания (folder)/Алкогольные напитки/Слабоалкогольные напитки	144732	БРАВО 81
1226210	4870044004267	Коктейль c-jay cosmopolitan 5.5% 0.33мл	551222	Продукты питания (folder)/Напитки безалкогольные/Напиток энергетический	0	
1226211	4870044004304	Коктейль c-jay Long island Ice tea 7% 0.33мл	551222	Продукты питания (folder)/Напитки безалкогольные/Напиток энергетический	0	
1226212	4870044004274	Коктейль c-jay margarita 5.5% 0.33мл	551222	Продукты питания (folder)/Напитки безалкогольные/Напиток энергетический	0	
1226213	4870044004298	Коктейль c-jay mojito 5.5% 0.33мл	551222	Продукты питания (folder)/Напитки безалкогольные/Напиток энергетический	0	
1226214	4870044004281	Коктейль c-jay safari 5.5% 0.33мл	551222	Продукты питания (folder)/Напитки безалкогольные/Напиток энергетический	0	
1226328	4605627004989	Коктейль campina fruttis ананас 0.300	144938	Продукты питания (folder)/Молочные продукты (folder)/Молочные продукты	62625	Campina Fruttis
1226329	4605627005009	Коктейль campina fruttis вишня 0.300	144938	Продукты питания (folder)/Молочные продукты (folder)/Молочные продукты	62625	Campina Fruttis
1226330	4605627004941	Коктейль campina fruttis мультифрукт 0.300	144938	Продукты питания (folder)/Молочные продукты (folder)/Молочные продукты	62625	Campina Fruttis
1226331	4605627004965	Коктейль campina fruttis яблоко/груша 0.300	144938	Продукты питания (folder)/Молочные продукты (folder)/Молочные продукты	62625	Campina Fruttis
185009	082000743507	Коктейль captain morgan Long island tea 17.5% 1750ml	181529	Продукты питания (folder)/Алкогольные напитки/COCKTAILS	111607	Captain Morgan
185010	082000743491	Коктейль captain morgan Long island tea 17.5% 750ml	181529	Продукты питания (folder)/Алкогольные напитки/COCKTAILS	111607	Captain Morgan
185377	082000743903	Коктейль captain morgan parrot Bay mango 12.7% 750ml	181529	Продукты питания (folder)/Алкогольные напитки/COCKTAILS	111607	Captain Morgan
185386	082000743910	Коктейль captain morgan parrot Bay tropic 12.7% 750ml	181529	Продукты питания (folder)/Алкогольные напитки/COCKTAILS	111607	Captain Morgan
2871567	4607004162329	Коктейль chaka из орехов,сушеных ягод и плодов 130г мяг/уп	1	Неклассифицированные/default	0	
3831207	4605720000444	Коктейль cris.clab грейпф.9% 0.275л	144731	Продукты питания (folder)/Алкогольные напитки/Слабоалкогольные напитки	3639646	CRISTALL
3831208	4605720000406	Коктейль cris.clab лимон 9% 0.275л	144731	Продукты питания (folder)/Алкогольные напитки/Слабоалкогольные напитки	0	
1823921	4605720000420	Коктейль cris.clab смород.9% 0.275л	144731	Продукты питания (folder)/Алкогольные напитки/Слабоалкогольные напитки	3639646	CRISTALL
67457	5900288301798	Коктейль cykoria молочн.ваниль 30г	622408	Продукты питания (folder)/Бакалея	37725	Cykoria
67458	5900288301842	Коктейль cykoria молочн.земляника 30г	622408	Продукты питания (folder)/Бакалея	37725	Cykoria
67459	5900288301750	Коктейль cykoria молочн.шоколад 30г	622408	Продукты питания (folder)/Бакалея	37725	Cykoria
2871360	4600605022962	Коктейль Danone danissimo клубничное мороженое йогуртовый 5.2% 260г	1	Неклассифицированные/default	52751	Danone Danissimo
3351065	4600605022955	Коктейль Danone danissimo кокос/шоколад йогуртный 5.7% 260г	1	Неклассифицированные/default	38966	Danone
3351066	4600605023792	Коктейль Danone danissimo лаймово-мятный йогуртный 5.2% 260г пл/бут	1	Неклассифицированные/default	38966	Danone
3351067	4600605023815	Коктейль Danone danissimo со вкусом арахисового мороженого и нуги йогуртный 5.2% 260г	1	Неклассифицированные/default	38966	Danone
3351068	4600605023808	Коктейль Danone danissimo со вкусом вишни шоколада и миндаля йогуртный 5.2% 260г	1	Неклассифицированные/default	38966	Danone
2443431	024000253648	Коктейль Del Monte фруктовый жб 420г	22284	Продукты питания (folder)/Консервы (folder)/Консервы фруктовые	36678	Del Monte
67255	024000009580	Коктейль Del Monte экзотик тропик 425г	22284	Продукты питания (folder)/Консервы (folder)/Консервы фруктовые	36678	Del Monte
3351069	5704025020344	Коктейль delight, морской мороженый, 500г м/у	1	Неклассифицированные/default	3642657	DELIGHT
3351210	4640001480577	Коктейль Dolce Vita вин.газ.п/сух.б.5.5-6% 750мл	1	Неклассифицированные/default	3645545	DOLCE VITA (GARMONIYA GK)
1759742	4640001480553	Коктейль Dolce Vita винный белый полусладкий газированный 6 % 750мл стекло	1759739	Продукты питания (folder)/Алкогольные напитки/Вино (folder)/Винный напиток	3645545	DOLCE VITA (GARMONIYA GK)
3351070	4640001481086	Коктейль Dolce Vita винный белый полусладкий газированный с ароматом вишни 5.5-6% 750мл стекло	1	Неклассифицированные/default	3645545	DOLCE VITA (GARMONIYA GK)
3351071	4640001481048	Коктейль Dolce Vita винный белый полусладкий газированный с ароматом клубники 5.5-6% 750мл стекло	1	Неклассифицированные/default	3645545	DOLCE VITA (GARMONIYA GK)
3351072	4640001481062	Коктейль Dolce Vita винный белый полусладкий газированный с ароматом малины 5.5-6% 750мл стекло	1	Неклассифицированные/default	3645545	DOLCE VITA (GARMONIYA GK)
3351073	4640001480560	Коктейль Dolce Vita винный белый сладкий газированный 5.5% 750мл стбут	1	Неклассифицированные/default	3645545	DOLCE VITA (GARMONIYA GK)
3351074	4640001481284	Коктейль Dolce Vita винный розовый полусладкий газированный 6 % 750мл	1	Неклассифицированные/default	3645545	DOLCE VITA (GARMONIYA GK)
3351080	4606531204731	Коктейль eco world для тела греческий амулет 250мл пл/б	1	Неклассифицированные/default	0	
3351081	4606531204748	Коктейль eco world для тела египетские ночи 250мл пл/б	1	Неклассифицированные/default	0	
3351082	4606531204724	Коктейль eco world для тела Французский поцелуй 250мл пл/б	1	Неклассифицированные/default	0	
155461	4606779036309	Коктейль ehrmann эрми микс апельсин 0.500	144938	Продукты питания (folder)/Молочные продукты (folder)/Молочные продукты	154589	Ehrmann
155462	4606779036101	Коктейль ehrmann эрми микс мульти 0.500	144938	Продукты питания (folder)/Молочные продукты (folder)/Молочные продукты	154589	Ehrmann
1226340	460677903620	Коктейль ehrmann эрми микс тропик 0.500	144938	Продукты питания (folder)/Молочные продукты (folder)/Молочные продукты	0	
94914	4606779036200	Коктейль ehrmann эрми микс тропик 0.500 #2	144938	Продукты питания (folder)/Молочные продукты (folder)/Молочные продукты	94913	Эрми Микс
3351083	4607004164347	Коктейль emarko ореховый соленый 35г	1	Неклассифицированные/default	0	
2746825	4607043891273	Коктейль Energy Club, виноград 8.5%, жб 0.5л	22186	Продукты питания (folder)/Алкогольные напитки/Пиво	3652741	ENERGY CLUB (N,R,G, KOLOS CORPORATION/YAROSLAVL)
2871599	4607043890115	Коктейль Energy Club, тропический апельсин 8.5%, жб 0.5л	1	Неклассифицированные/default	0	
188989	088352124438	Коктейль everclear purple Passion 13% 200ml	144731	Продукты питания (folder)/Алкогольные напитки/Слабоалкогольные напитки	188987	EVERCLEAR
3351084	4660009052200	Коктейль extramix, горький лимон, 6.9%, 0.5л пл/б	1	Неклассифицированные/default	3655246	EXTRA MIX
3351086	4640001481383	Коктейль ferrara винный газированный белый полусладкий 8% 750мл стекло	1	Неклассифицированные/default	3657064	FERRARA (GARMONIYA GK)
3351087	4640001481406	Коктейль ferrara винный газированный красный полусладкий 8% 750мл стекло	1	Неклассифицированные/default	3657064	FERRARA (GARMONIYA GK)
67446	4607154561980	Коктейль Flash, пина колада, 7%, 0.275л, ст/б	144731	Продукты питания (folder)/Алкогольные напитки/Слабоалкогольные напитки	67437	Флэш
547553	4603170003466	Коктейль fmro орехи жаренные подсоленые 40г	260335	Продукты питания (folder)/Снэки	18674	AMRO
1334961	4607050694768	Коктейль fonte дайкири клубничный безалкогольный 0.6л пл/бут	17371	Продукты питания (folder)/Напитки безалкогольные/Напитки	3659768	FONTE (FONTE-AKVA/DMITROV.R-N MOSK.OBL.)
3351088	4607050696786	Коктейль fonte лимончелло безалкогольный сильногаз 0.6л пл/бут	1	Неклассифицированные/default	3659768	FONTE (FONTE-AKVA/DMITROV.R-N MOSK.OBL.)
3351089	4607032230571	Коктейль Fox&dogs вкус меда 35% 0.5л ст/б	1	Неклассифицированные/default	0	
3351090	4607154091661	Коктейль funny fish морской вак уп 1000г	1	Неклассифицированные/default	3655349	FUNNY FISH
763559	4607050081490	Коктейль funny fish морской вак уп 250г	1	Неклассифицированные/default	3655349	FUNNY FISH
1967931	4607154090329	Коктейль funny fish морской свежемороженый 500г мяг/уп	1	Неклассифицированные/default	3655349	FUNNY FISH
3351091	4601351009351	Коктейль Golden joker биттер лемон винный газированный 8.5% жб 0.5л	1	Неклассифицированные/default	0	
3351092	4601351010326	Коктейль Golden joker виски кола винный газированный 8.5% жб 0.5л	1	Неклассифицированные/default	0	
67247	4607034022846	Коктейль Green ray тропический 425г	22284	Продукты питания (folder)/Консервы (folder)/Консервы фруктовые	36971	Green Ray
153414	5010296900385	Коктейль greenall's со вкусом грейпфрута 9% жб 500мл	144731	Продукты питания (folder)/Алкогольные напитки/Слабоалкогольные напитки	53100	Greenall's
1823920	46019646	Коктейль happyland trophy фейхоа7% 0.33л	144731	Продукты питания (folder)/Алкогольные напитки/Слабоалкогольные напитки	3790025	happyland trophy
3831210	4602983000839	Коктейль happyland trophy фейхоа7% 0.33л #2	144731	Продукты питания (folder)/Алкогольные напитки/Слабоалкогольные напитки	3790025	happyland trophy
155340	4607023753386	Коктейль happyland ананас нирвана 8.7% 0.5 жб нов.дизайн	144731	Продукты питания (folder)/Алкогольные напитки/Слабоалкогольные напитки	175224	Хэппилэнд
67271	4607023754482	Коктейль happyland апельсин казанова 8.7% 0.5 жб нов.дизайн	144731	Продукты питания (folder)/Алкогольные напитки/Слабоалкогольные напитки	67267	Казанова
175347	4607023754444	Коктейль happyland апельсин казанова 8.7% 0.5 пэт нов.дизайн	144731	Продукты питания (folder)/Алкогольные напитки/Слабоалкогольные напитки	175224	Хэппилэнд
175348	4607023754703	Коктейль happyland апельсин казанова 8.7% 1.5 пэт	144731	Продукты питания (folder)/Алкогольные напитки/Слабоалкогольные напитки	175224	Хэппилэнд
155384	4607023754710	Коктейль happyland вкус дыни 8.9% 1.500	144731	Продукты питания (folder)/Алкогольные напитки/Слабоалкогольные напитки	0	
155400	4607023754550	Коктейль happyland джин-лед 9.0% пэт 1.5	144731	Продукты питания (folder)/Алкогольные напитки/Слабоалкогольные напитки	0	
2443528	4602983000921	Коктейль happyland джин-тоник 8.7% п/э 0.480	78617	Продукты питания (folder)/Алкогольные напитки/Алкоголь	0	
2443529	4607023753065	Коктейль happyland джин-тоник 8.7% п/э 0.480 #2	78617	Продукты питания (folder)/Алкогольные напитки/Алкоголь	0	
155401	4607023754574	Коктейль happyland джин-тоник 9.0% пэт 1.5	144731	Продукты питания (folder)/Алкогольные напитки/Слабоалкогольные напитки	0	
155406	4607023753430	Коктейль happyland каза.дын/сок 8.7% 0.33л	144731	Продукты питания (folder)/Алкогольные напитки/Слабоалкогольные напитки	175224	Хэппилэнд
2443546	4607023752167	Коктейль happyland казанова водка дыня 8.7% жб 0.330	78617	Продукты питания (folder)/Алкогольные напитки/Алкоголь	3803076	happyland
2443547	4602983000907	Коктейль happyland казанова водка-дыня 8.7% п/э 0.480	78617	Продукты питания (folder)/Алкогольные напитки/Алкоголь	0	
2443548	4607023754413	Коктейль happyland казанова водка-дыня 8.7% п/э 0.500	78617	Продукты питания (folder)/Алкогольные напитки/Алкоголь	0	
1226254	460702375781	Коктейль happyland казанова дыня 7% жб 0.500	144731	Продукты питания (folder)/Алкогольные напитки/Слабоалкогольные напитки	0	
67268	4607023756196	Коктейль happyland казанова дыня 8.7% 0.33 жб нов.дизайн	144731	Продукты питания (folder)/Алкогольные напитки/Слабоалкогольные напитки	67267	Казанова
155387	4607023756202	Коктейль happyland казанова дыня 8.7% 0.5 жб нов.дизайн	144731	Продукты питания (folder)/Алкогольные напитки/Слабоалкогольные напитки	175224	Хэппилэнд
175349	4607023756226	Коктейль happyland казанова дыня 8.7% 0.5 пэт нов.дизайн	144731	Продукты питания (folder)/Алкогольные напитки/Слабоалкогольные напитки	175224	Хэппилэнд
155412	4607023756233	Коктейль happyland казанова дыня 8.7% 1.5 пэт	144731	Продукты питания (folder)/Алкогольные напитки/Слабоалкогольные напитки	175224	Хэппилэнд
2443549	460702375217	Коктейль happyland казанова дыня 8.7% жб 0.500	144731	Продукты питания (folder)/Алкогольные напитки/Слабоалкогольные напитки	0	
