ID	UPCEAN	Name	CategoryID	CategoryName	BrandID	BrandName
2696940	8806358590628	Tony moly floria пилинг-гель для лица осветляющий (скатка) floria brightening peeling Gel 150мл	1	Неклассифицированные/default	1780002	Tony Moly
2696941	8806358578435	Tony moly floria пилинг-скатка пробник [sample]floria peeling Gel pouch 3мл	1	Неклассифицированные/default	1780002	Tony Moly
2696942	8806358571597	Tony moly floria салфетки для снятия макияжа floria all-in-One cleansing Oil tissue 30шт	1	Неклассифицированные/default	1780002	Tony Moly
2696943	8806358532291	Tony moly floria салфетки очищ. floria cleansing tissue 15 15шт	1	Неклассифицированные/default	1780002	Tony Moly
2696944	8806358592912	Tony moly floria салфетки очищающие floria cleansing tissue 50 50шт	1	Неклассифицированные/default	1780002	Tony Moly
2696945	8806358542924	Tony moly floria средство от расширенных пор floria pore spot 20мл	1	Неклассифицированные/default	1780002	Tony Moly
2696946	8806358586072	Tony moly floria стартер для лица увлажняющий floria One veil starter 100мл	1	Неклассифицированные/default	1780002	Tony Moly
2696947	8806358545123	Tony moly floria сыворотка для лица энергетич. floria nutra Energy miracle serum 35мл	1	Неклассифицированные/default	1780002	Tony Moly
2696948	8806358543051	Tony moly floria сыворотка осветляющая для глаз floria whitening Eye serum 25мл	1	Неклассифицированные/default	1780002	Tony Moly
2696949	8806358581299	Tony moly floria сыворотка от расширенных пор floria pore Energy serum 35мл	1	Неклассифицированные/default	1780002	Tony Moly
2696950	8806358585433	Tony moly floria сыворотка подтягивающая для тела floria firming Body serum 300мл	1	Неклассифицированные/default	1780002	Tony Moly
2696951	8806358545222	Tony moly floria сыворотка пробник Flower nutra serum	1	Неклассифицированные/default	1780002	Tony Moly
2696952	8806358545604	Tony moly floria тонер для лица увлажн. энергетич. floria hydra Energy toner2 35мл	1	Неклассифицированные/default	1780002	Tony Moly
2696953	8806358578701	Tony moly floria тонер для лица увлажняющий floria Hydro toner3 155мл	1	Неклассифицированные/default	1780002	Tony Moly
2696954	8806358545079	Tony moly floria тонер для лица энергетический floria nutra Energy-toner 145мл	1	Неклассифицированные/default	1780002	Tony Moly
2696955	8806358545208	Tony moly floria тонер для лица энергетический пробник floria nutra toner 6мл	1	Неклассифицированные/default	1780002	Tony Moly
2696956	8806358577292	Tony moly floria тонер от расширенных пор floria pore Energy toner 155мл	1	Неклассифицированные/default	1780002	Tony Moly
2696957	8806358577261	Tony moly floria тонер отбеливающий floria whitening petal toner 155мл	1	Неклассифицированные/default	1780002	Tony Moly
2696958	8806358586065	Tony moly floria финишер-ночная маска-пленка для лица floria One veil finisher 100мл	1	Неклассифицированные/default	1780002	Tony Moly
2696959	8806358545611	Tony moly floria эмульсия для лица увлажн. энергетич. floria hydra Energy emulsion2 35мл	1	Неклассифицированные/default	1780002	Tony Moly
2696960	8806358578718	Tony moly floria эмульсия для лица увлажняющая floria Hydro emulsion3 130мл	1	Неклассифицированные/default	1780002	Tony Moly
2696961	8806358545093	Tony moly floria эмульсия для лица энергетическая floria nutra Energy-emulsion 145мл	1	Неклассифицированные/default	1780002	Tony Moly
2696962	8806358577308	Tony moly floria эмульсия от расширен. пор floria pore Energy emulsion 130мл	1	Неклассифицированные/default	1780002	Tony Moly
2696963	8806358577278	Tony moly floria эмульсия отбел. floria whitening emulsion 130мл	1	Неклассифицированные/default	1780002	Tony Moly
2696964	8806358545215	Tony moly floria эмульсия пробник floria nutra emulsion 6мл	1	Неклассифицированные/default	1780002	Tony Moly
2696965	8806358543068	Tony moly floria эссенция от расширенных пор floria pore Energy essence 50мл	1	Неклассифицированные/default	1780002	Tony Moly
2696966	8806358580728	Tony moly floria эссенция отбеливающая floria whitening capsule essence 50мл	1	Неклассифицированные/default	1780002	Tony Moly
2696967	8806358545109	Tony moly floria эссенция энергетическая floria nutra Energy-essence 50мл	1	Неклассифицированные/default	1780002	Tony Moly
2696968	8806358545246	Tony moly floria эссенция энергетическая пробник floria nutra essence 1мл	1	Неклассифицированные/default	1780002	Tony Moly
2696969	8806358596576	Tony moly fondante клубничная маска для лица fondante strawberry syrup wash off pack 90мл	1	Неклассифицированные/default	1780002	Tony Moly
2696970	8806358595753	Tony moly fondante увлажняющее двухфазное молочко fondante strawberry Milk all in rizer 150мл	1	Неклассифицированные/default	1780002	Tony Moly
2696971	8806358577711	Tony moly g9 Крем сс увлажняющий. spf30g 9 moisture cc Cream spf30 50г	1	Неклассифицированные/default	1780002	Tony Moly
2696972	8806358587482	Tony moly g9 лосьон мужской увлажняющий g9 moisture Lotion2	1	Неклассифицированные/default	1780002	Tony Moly
2696973	8806358583934	Tony moly g9 маска для лица питательная g9 all in One Power sheet mask 23мл	1	Неклассифицированные/default	1780002	Tony Moly
2696974	8806358587499	Tony moly g9 набор для мужчин g9 moisture Skin Care set (toner+Skin)	1	Неклассифицированные/default	1780002	Tony Moly
2696975	8806358587352	Tony moly g9 пенка для умывания мужская g9 moisture Foam cleaser 150мл	1	Неклассифицированные/default	1780002	Tony Moly
2696976	8806358587475	Tony moly g9 тонер увлажняющий для мужчин g9 moisture Skin	1	Неклассифицированные/default	1780002	Tony Moly
2696977	8806358586423	Tony moly g9 флюид увлажняющий для мужчин g9 dynamic fluid 120мл	1	Неклассифицированные/default	1780002	Tony Moly
2696978	8806358582715	Tony moly galactomyces эликсир для лица на основе фермента galactomyces intense Care galactomyces essence2 150мл	1	Неклассифицированные/default	1780002	Tony Moly
2696979	8806358582296	Tony moly galactomyces эликсир отбеливающий для лица galactomyces whitening essence 50мл	1	Неклассифицированные/default	1780002	Tony Moly
2696980	8806358594060	Tony moly galactomyces эссенция на основе фермента galactomyces, intense Care galactomyces lite essence 150мл	1	Неклассифицированные/default	1780002	Tony Moly
2696981	8806358578770	Tony moly galactomyces эссенция ферментир. пробник [sample]galactomyces essence 5мл	1	Неклассифицированные/default	1780002	Tony Moly
2696982	8806358582319	Tony moly herb Field тонер успокаивающий на экстрактах трав herb Field toner 145мл	1	Неклассифицированные/default	1780002	Tony Moly
2696983	8806358582326	Tony moly herb Field эмульсия успокаивающая на экстрактах трав herb Field emulsion 145мл	1	Неклассифицированные/default	1780002	Tony Moly
3761923	8806358569198	Tony moly i'm real Aloe moist. mz 0.021l tb	961989	Косметика (folder)/Уход за лицом	1780002	Tony Moly
3761924	8806358511210	Tony moly i'm real avocado c 0.09l j	961989	Косметика (folder)/Уход за лицом	1780002	Tony Moly
3761925	8806358569211	Tony moly i'm real avocado nour. mz 0.021l tb	961989	Косметика (folder)/Уход за лицом	1780002	Tony Moly
3761926	8806358569280	Tony moly i'm real broccoli mz 0.021l tb	961989	Косметика (folder)/Уход за лицом	1780002	Tony Moly
3761927	8806358569341	Tony moly i'm real makgeolli cleans. mz 0.021l tb	961989	Косметика (folder)/Уход за лицом	1780002	Tony Moly
3761928	8806358569266	Tony moly i'm real pomegranate mz 0.021l tb	961989	Косметика (folder)/Уход за лицом	1780002	Tony Moly
3761929	8806358569334	Tony moly i'm real Red Wine mz 0.021l tb	961989	Косметика (folder)/Уход за лицом	1780002	Tony Moly
3761930	8806358569235	Tony moly i'm real Rice cleans. mz 0.021l tb	961989	Косметика (folder)/Уход за лицом	1780002	Tony Moly
3761931	8806358569167	Tony moly i'm real tea tree mz 0.021l tb	961989	Косметика (folder)/Уход за лицом	1780002	Tony Moly
3761932	8806358569174	Tony moly i'm real tomato mz 0.021l tb	961989	Косметика (folder)/Уход за лицом	1780002	Tony Moly
2696984	8806358586300	Tony moly i'm real Крем питательный с авокадо для лица i'm real avocado Rich Cream 90мл	1	Неклассифицированные/default	1780002	Tony Moly
1780032	8806358586287	Tony moly i'm real лосьон для проблемной кожи с расш. порами i'm real tea tree sebum&pore Lotion 200мл	5586	Косметика (folder)/Косметика	1780002	Tony Moly
2696985	8806358589943	Tony moly i'm real лосьон для рук молочный i'm real Milk hand Lotion 250мл	1	Неклассифицированные/default	1780002	Tony Moly
1780030	8806358586270	Tony moly i'm real лосьон отбеливающий с экстрактом лимона i'm real Lemon brightening Lotion 200мл	5586	Косметика (folder)/Косметика	1780002	Tony Moly
1780029	8806358586294	Tony moly i'm real лосьон с алоэ для проблемной кожи i'm real Aloe soothing Lotion 200мл	5586	Косметика (folder)/Косметика	1780002	Tony Moly
1780031	8806358586263	Tony moly i'm real лосьон увлажн. с экстрак. морск. водорослей i'm real seaweed Aqua moisture Lotion 200мл	5586	Косметика (folder)/Косметика	1780002	Tony Moly
2696986	8806358587468	Tony moly i'm real пробник Крем авокадо [promo] i'm real avocado Cream 1мл	1	Неклассифицированные/default	1780002	Tony Moly
2696987	8806358587451	Tony moly i'm real пробник лосьон алоэ [promo] i'm real Aloe Lotion 1мл	1	Неклассифицированные/default	1780002	Tony Moly
2696988	8806358587413	Tony moly i'm real пробник лосьон белый рис [promo] i'm real Rice toner 5мл	1	Неклассифицированные/default	1780002	Tony Moly
2696989	8806358587437	Tony moly i'm real пробник лосьон лимон [promo] i'm real Lemon Lotion 1мл	1	Неклассифицированные/default	1780002	Tony Moly
2696990	8806358587420	Tony moly i'm real пробник лосьон морск.водоросл [promo] i'm rea seaweeds Lotion 1мл	1	Неклассифицированные/default	1780002	Tony Moly
2696991	8806358587444	Tony moly i'm real пробник лосьон чайн.дер [promo] i'm real tea tree Lotion 1мл	1	Неклассифицированные/default	1780002	Tony Moly
2696992	8806358586256	Tony moly i'm real тоник для проблемной кожи i'm real Rice soothing toner 250мл	1	Неклассифицированные/default	1780002	Tony Moly
3761933	8806358535629	Tony moly intense Care snail mz 0.025kg tb	961989	Косметика (folder)/Уход за лицом	1780002	Tony Moly
3761934	8806358569358	Tony moly kiss kiss lovely Lip mz 0.01kg cbl	961989	Косметика (folder)/Уход за лицом	1780002	Tony Moly
2696993	8806358590475	Tony moly make hd Крем для укладки волос make hd straight Cream 100г*2шт	1	Неклассифицированные/default	1780002	Tony Moly
2696994	8806358508685	Tony moly make hd маска для волос make hd Hair treatment 200мл	1	Неклассифицированные/default	1780002	Tony Moly
2696995	8806358597689	Tony moly make hd масло аргановое для волос make hd silk argan Oil 85мл	1	Неклассифицированные/default	1780002	Tony Moly
2696996	8806358590352	Tony moly make hd спрей для волос восстанавливающий make hd Hair Mist 150мл	1	Неклассифицированные/default	1780002	Tony Moly
2696997	8806358599225	Tony moly make hd средство для придания блеска make hd Hair glazed 430мл	1	Неклассифицированные/default	1780002	Tony Moly
2696998	8806358596965	Tony moly make hd сухой спрей шампунь make hd Dry Shampoo 60мл	1	Неклассифицированные/default	1780002	Tony Moly
2696999	8806358590321	Tony moly make hd сыворотка для волос make hd Hair serum (s) 200мл	1	Неклассифицированные/default	1780002	Tony Moly
2697000	8806358597757	Tony moly make hd тинт-кисть для волос 01 make hd tint brush 01 20мл	1	Неклассифицированные/default	1780002	Tony Moly
2697001	8806358597764	Tony moly make hd тинт-кисть для волос 02 make hd tint brush 02 20мл	1	Неклассифицированные/default	1780002	Tony Moly
3761935	8806358513351	Tony moly Mini berry Cherry moist. b j 0.007kg	1045095	Косметика (folder)/Уход за губами	1780002	Tony Moly
2697002	8806358591557	Tony moly my sunny гель солнцезащит водостойкий spf30 my sunny watery Sun Gel 45г	1	Неклассифицированные/default	1780002	Tony Moly
2697003	8806358595326	Tony moly my sunny Крем солнцезащит my sunny milky Sun Cream spf35 pa+++ 45г	1	Неклассифицированные/default	1780002	Tony Moly
2697004	8806358589653	Tony moly my sunny Крем солнцезащит my sunny Touch free Sun block spf50+ pa+++ 40г	1	Неклассифицированные/default	1780002	Tony Moly
2697005	8806358590215	Tony moly my sunny Крем солнцезащит spf50 my sunny perfecting Sun block 100мл	1	Неклассифицированные/default	1780002	Tony Moly
2697006	8806358591533	Tony moly my sunny Крем солнцезащит водостойкий spf50 my sunny waterproof Sun block 60г	1	Неклассифицированные/default	1780002	Tony Moly
2697007	8806358591540	Tony moly my sunny Крем солнцезащит для всей семьи spf50 my sunny Body&Family Sun Cream 120мл	1	Неклассифицированные/default	1780002	Tony Moly
2697008	8806358591564	Tony moly my sunny молочко солнцезащит spf47 my sunny powdery finish Sun Milk 100мл	1	Неклассифицированные/default	1780002	Tony Moly
2697009	8806358592981	Tony moly my sunny пенка для умывания [promo] my sunny Foam cleanser 100мл	1	Неклассифицированные/default	1780002	Tony Moly
2697010	8806358595340	Tony moly my sunny Пудра солнцезащит my sunny tok tok Sun Powder spf50+ pa+++ 3г	1	Неклассифицированные/default	1780002	Tony Moly
2697011	8806358591526	Tony moly my sunny спрей солнцезащит my sunny all Sun spray 150мл	1	Неклассифицированные/default	1780002	Tony Moly
2697012	8806358590017	Tony moly my sunny спрей солнцезащит spf50 my sunny clear Sun spray 150мл	1	Неклассифицированные/default	1780002	Tony Moly
2697013	8806358542184	Tony moly oriental bb Крем spf46 №1 the oriental gyeol goun bb Cream 01 50г	1	Неклассифицированные/default	1780002	Tony Moly
2697014	8806358542191	Tony moly oriental bb Крем spf46 №2 the oriental gyeol goun bb Cream 02 50г	1	Неклассифицированные/default	1780002	Tony Moly
2697015	8806358571948	Tony moly oriental кондиционер для волос лечебный the oriental gyeol Conditioner 300мл	1	Неклассифицированные/default	1780002	Tony Moly
2697016	8806358590871	Tony moly oriental Крем для глаз для зрелой кожи the oriental gyeol Eye Cream 30мл	1	Неклассифицированные/default	1780002	Tony Moly
2697017	8806358549220	Tony moly oriental Крем для глаз отбел. для зрел. кожи the oriental gyeol whitening Eye Cream 30мл	1	Неклассифицированные/default	1780002	Tony Moly
2697018	8806358546991	Tony moly oriental Крем для лица для зрелой кожи the oriental gyeol Cream 50мл	1	Неклассифицированные/default	1780002	Tony Moly
2697019	8806358573447	Tony moly oriental Крем для лица ночной premium the oriental gyeol Night Cream 50мл	1	Неклассифицированные/default	1780002	Tony Moly
2697020	8806358547608	Tony moly oriental Крем для умывания для зрелой кожи the oriental gyeol cleansing Cream 200мл	1	Неклассифицированные/default	1780002	Tony Moly
2697021	8806358547622	Tony moly oriental Крем массажный для лица и шеи oriental gyeol massage Cream 200мл	1	Неклассифицированные/default	1780002	Tony Moly
2697022	8806358574772	Tony moly oriental маска для лица сияние the oriental gyeol mask sheet - radiance 25мл	1	Неклассифицированные/default	1780002	Tony Moly
2697023	8806358574789	Tony moly oriental маска для лица упругость the oriental gyeol mask sheet - elasticity 25мл	1	Неклассифицированные/default	1780002	Tony Moly
2697024	8806358547639	Tony moly oriental маска очищающая ферментир. the oriental gyeol purifying mask 140мл	1	Неклассифицированные/default	1780002	Tony Moly
2697025	8806358547592	Tony moly oriental набор отбеливающий тонер+эмульсия the oriental gyeol 2 set 2x 140мл/2x 20мл	1	Неклассифицированные/default	1780002	Tony Moly
2697026	8806358591519	Tony moly oriental набор средств по уходу за зрелой кожей oriental gyeol skincare set 2x 140мл/2x 20мл	1	Неклассифицированные/default	1780002	Tony Moly
2697027	8806358591267	Tony moly oriental пенка для умывания the oriental gyeol cleansing Foam 150мл	1	Неклассифицированные/default	1780002	Tony Moly
2697028	8806358547585	Tony moly oriental пробник Крем oriental gyeol Cream 1мл	1	Неклассифицированные/default	1780002	Tony Moly
2697029	8806358547554	Tony moly oriental пробник тоник антивозрастной [promotion]oriental gyeol toner 6ml 6мл	1	Неклассифицированные/default	1780002	Tony Moly
2697030	8806358547561	Tony moly oriental пробник эмульсия антивозрастная [promotion] the oriental gyeol emulsion 6ml 6мл	1	Неклассифицированные/default	1780002	Tony Moly
2697031	8806358547578	Tony moly oriental пробник эссенция oriental gyeol essence 1мл	1	Неклассифицированные/default	1780002	Tony Moly
2697032	8806358588885	Tony moly oriental Пудра +бб Крем для возрастной кожи №1 gyeol goun two-way pact 01 20г/14г	1	Неклассифицированные/default	1780002	Tony Moly
2697033	8806358588892	Tony moly oriental Пудра +бб Крем для возрастной кожи №2 gyeol goun two-way pact 02 20г/14г	1	Неклассифицированные/default	1780002	Tony Moly
2697034	8806358546120	Tony moly oriental Пудра +бб Крем для возрастной кожи №3 gyeol goun two-way pact 03 20г/14г	1	Неклассифицированные/default	1780002	Tony Moly
2697035	8806358546984	Tony moly oriental сыворотка для зрелой кожи the oriental gyeol serum 50мл	1	Неклассифицированные/default	1780002	Tony Moly
2697036	8806358547103	Tony moly oriental сыворотка интенсивная для зрелой кожи the oriental gyeol booster 50мл	1	Неклассифицированные/default	1780002	Tony Moly
2697037	8806358549213	Tony moly oriental сыворотка отбеливающая для зрелой кожи the oriental gyeol whitening serum 50мл	1	Неклассифицированные/default	1780002	Tony Moly
2697038	8806358547295	Tony moly oriental сыворотка пробник gyeol booster 1ml 1мл	1	Неклассифицированные/default	1780002	Tony Moly
2697039	8806358571955	Tony moly oriental тоник для волос лечебный the oriental gyeol Hair tonic 150мл	1	Неклассифицированные/default	1780002	Tony Moly
2697040	8806358546960	Tony moly oriental тоник для зрелой кожи the oriental gyeol toner 50мл	1	Неклассифицированные/default	1780002	Tony Moly
2697041	8806358571931	Tony moly oriental шампунь лечебный the oriental gyeol Shampoo 300мл	1	Неклассифицированные/default	1780002	Tony Moly
2697042	8806358590857	Tony moly oriental эмульсия для зрелой кожи the oriental gyeol emulsion 140мл	1	Неклассифицированные/default	1780002	Tony Moly
2697043	8806358549206	Tony moly oriental эмульсия отбеливающая для лица зрелой кожи the oriental gyeol whitening emulsion 140мл	1	Неклассифицированные/default	1780002	Tony Moly
2697044	8806358588328	Tony moly panda Крем для лица отбеливающий panda's Dream White Magic Cream 50г	1	Неклассифицированные/default	1780002	Tony Moly
2697045	8806358586522	Tony moly panda Крем для рук отбеливающий panda's Dream White hand Cream 30мл	1	Неклассифицированные/default	1780002	Tony Moly
2697046	8806358590970	Tony moly panda пробник Крем для рук отбелив. (promo) panda's Dream White hand Cream	1	Неклассифицированные/default	1780002	Tony Moly
3761936	8806358511708	Tony moly panda's Dream sens y mz 0.014l tb	961989	Косметика (folder)/Уход за лицом	1780002	Tony Moly
3761937	8806358517458	Tony moly panda's Dream White Cream wh c 0.03kg j	5586	Косметика (folder)/Косметика	1780002	Tony Moly
3761938	8806358511692	Tony moly panda's Dream White sleeping wh Night c 0.05kg j	961989	Косметика (folder)/Уход за лицом	1780002	Tony Moly
2697047	8806358586546	Tony moly panda's база для глаз осветляющая panda's Dream brightening Eye base 9г	1	Неклассифицированные/default	1780002	Tony Moly
2697048	8806358572815	Tony moly panda's корректор макияжа глаз panda's Dream Eye make up eraser 1г	1	Неклассифицированные/default	1780002	Tony Moly
2697049	8806358572808	Tony moly panda's корректор темных кругов под глазами panda's Dream Good bye Dark Eye corrector 20мл	1	Неклассифицированные/default	1780002	Tony Moly
1780018	8806358592172	Tony moly panda's маска ночная осветляющая panda's Dream White sleeping pack 50мл	5586	Косметика (folder)/Косметика	1780002	Tony Moly
2697050	8806358586508	Tony moly panda's патчи от темных кругов под глазами panda's Dream Eye patch 2шт	1	Неклассифицированные/default	1780002	Tony Moly
2697051	8806358586515	Tony moly panda's салфетки для снятия макияжа panda's Dream Eye make up remover pad 40шт	1	Неклассифицированные/default	1780002	Tony Moly
1780065	8806358586539	Tony moly panda's стик от темных кругов под глазами panda's Dream so Cool Eye Stick 9г	5586	Косметика (folder)/Косметика	1780002	Tony Moly
2697052	8806358586911	Tony moly petite filler Крем-филлер для лица увлажн, пит. и подтяг. petite filler volume Cream 40мл	1	Неклассифицированные/default	1780002	Tony Moly
