ID	UPCEAN	Name	CategoryID	CategoryName	BrandID	BrandName
763318	4607067934055	Вм-1038 мороженое эскимо пломбир ванильный в молочно-шоколадной глазури с миндалем и бисквитной крошкой жемчужина россии	30752	Продукты питания (folder)/Мороженое	84861	Айсберри
763315	4607067933133	Вм-1043 мороженое эскимо сливочное с ароматом каппучино с шоколадным топингом в молочно-шоколадной глазури с фундуком и бисквит	30752	Продукты питания (folder)/Мороженое	84861	Айсберри
2741463	4607067935175	Вм-1046 мороженое эскимо сливочное с ароматом фисташки с кешью в молочно-шоколадной глазури с кешью и бисквитной крошкой жемчуж	30752	Продукты питания (folder)/Мороженое	0	
763500	4607067933874	Вм-1052 мороженое молочное с фруктами с наполнителем яблоко-груша	30752	Продукты питания (folder)/Мороженое	84861	Айсберри
2741608	4607067934567	Вм-1053 мороженое молочное с фруктами с наполнителем ананас	30752	Продукты питания (folder)/Мороженое	0	
1259188	4607067935137	Вм-1062 мороженое змж с ароматом клубники с клубничным наполнителем вафельн сахарн рожок с молочно-шоколадной глазурью инстинкт	30752	Продукты питания (folder)/Мороженое	0	
763317	4607067934628	Вм-1066 мороженое эскимо сливочное с ароматом лесной орех с шоколадным топингом в молочно-шоколадной глазури с воздушным рисом	30752	Продукты питания (folder)/Мороженое	84861	Айсберри
2505767	4607067934482	Вм-1067 мороженое эскимо змж ванильное в шоколадной глазури от деда мороза	30752	Продукты питания (folder)/Мороженое	0	
1259472	4607067934772	Вм-1069 мороженое двухслойное змж ванильное и Крем-брюле с мягкой карамелью от деда мороза	30752	Продукты питания (folder)/Мороженое	0	
1259474	4607067934758	Вм-1070 мороженое двухслойное змж ванильное и с ароматом клубники с клубничным наполнителем от деда мороза	30752	Продукты питания (folder)/Мороженое	0	
1259473	4607067934796	Вм-1071 мороженое двухслойное змж ванильное и шоколадное с шоколадным топпингом от деда мороза	30752	Продукты питания (folder)/Мороженое	0	
763323	4607067933935	Вм-1081 мороженое эскимо молочное ванильное с наполнителем яблоко-груша во фруктовой глазури	30752	Продукты питания (folder)/Мороженое	84861	Айсберри
763322	4607067933973	Вм-1082 мороженое эскимо молочное ванильное с наполнителем черная смородина во фруктовой глазури	30752	Продукты питания (folder)/Мороженое	84861	Айсберри
763321	4607067933959	Вм-1084 мороженое эскимо молочное с ароматом персик-папайя-манго с наполнителем ананас во фруктовой глазури	30752	Продукты питания (folder)/Мороженое	84861	Айсберри
2855539	4607067936479	Вм-1089 мороженое молочное с черной смородиной	1	Неклассифицированные/default	0	
2855540	4607067936363	Вм-1090 мороженое пломбир ванильный в вафельном стаканчике с шоколадной глазурью	30752	Продукты питания (folder)/Мороженое	0	
2855541	4607067936387	Вм-1091 мороженое пломбир шоколадный в вафельном стаканчике с шоколадной глазурью	30752	Продукты питания (folder)/Мороженое	0	
2855542	4607067936424	Вм-1092 мороженое пломбир ванильный	30752	Продукты питания (folder)/Мороженое	0	
2855543	4607067936400	Вм-1093 мороженое пломбир шоколадный	30752	Продукты питания (folder)/Мороженое	0	
2855544	4607067936233	Вм-1094 мороженое сливочное ванильное во взбитой шоколадной глазури	1	Неклассифицированные/default	0	
2855545	4607067936257	Вм-1095 мороженое змж ванильное в вафельном стаканчике	30752	Продукты питания (folder)/Мороженое	0	
2855546	4607067936271	Вм-1096 мороженое змж с ароматом фисташки в вафельном стаканчике	30752	Продукты питания (folder)/Мороженое	0	
2855547	4607067936295	Вм-1097 мороженое эскимо змж ванильное в шоколадной глазури	30752	Продукты питания (folder)/Мороженое	0	
2855548	4607067936585	Вм-1100 мороженое пломбир шоколадный с кусочками шоколада	30752	Продукты питания (folder)/Мороженое	0	
2741605	4607067936608	Вм-1102 мороженое пломбир шоколадный с кусочками шоколада	30752	Продукты питания (folder)/Мороженое	82708	Филевское
2855549	4607067936622	Вм-1103 мороженое сливочное с клубникой	1	Неклассифицированные/default	0	
2855551	4607067936660	Вм-1105 мороженое филевское пломбир ванильный ваниль-бурбон	30752	Продукты питания (folder)/Мороженое	0	
2855552	4607067936684	Вм-1106 мороженое филевское сливочное с кленовым сиропом с грецким орехом	1	Неклассифицированные/default	0	
2855553	4607067936707	Вм-1107 мороженое филевское сливочное с ароматом дыни	1	Неклассифицированные/default	0	
2855554	4607067936844	Вм-1110 мороженое пломбир ванильный	30752	Продукты питания (folder)/Мороженое	0	
2855556	4607067936806	Вм-1120 мороженое сливочное ванильное жемчужина россии	1	Неклассифицированные/default	82708	Филевское
2458380	4607067936929	Вм-1121 мороженое эскимо сливочное ванильное в молочно-шоколадной глазури жемчужина россии	30752	Продукты питания (folder)/Мороженое	84861	Айсберри
2458381	4607067936882	Вм-1122 мороженое сливочное ванильное вафельн сахарн рожок с шоколадной глазурью жемчужина россии	30752	Продукты питания (folder)/Мороженое	84861	Айсберри
2458382	4607067936820	Вм-1123 мороженое сливочное ванильное в вафельном стаканчике с шоколадной глазурью жемчужина россии	30752	Продукты питания (folder)/Мороженое	84861	Айсберри
2741351	4607067936745	Вм-1128 мороженое пломбир ванильный вафельн сахарн рожок в шоколадной глазури	30752	Продукты питания (folder)/Мороженое	3847331	ЛЕНИНГРАДСКОЕ
85804	4600625314962	Вм-1131 мороженое пломбир с фисташковой пастой с кешью, декорированное лепестками миндаля вкусландия	30752	Продукты питания (folder)/Мороженое	85768	Сервис Холод
2458483	4600625313880	Вм-1132 мороженое змж ванильное вафельн сахарн рожок с шоколадной глазурью от деда мороза	30752	Продукты питания (folder)/Мороженое	3856369	ГИГАНТ
763329	4607067932143	Вм-1133 мороженое змж ванильное с клюквенным наполнителем вафельн сахарн рожок с шоколадной глазурью от деда мороза	30752	Продукты питания (folder)/Мороженое	84891	АйсФили
2855558	4607067937049	Вм-1137 мороженое филевское пломбир с фисташковой пастой с кешью с кремовой начинкой со вкусом фисташек	30752	Продукты питания (folder)/Мороженое	0	
2855559	4607067937087	Вм-1148 мороженое эскимо сливочное ванильное в шоколадной глазури	30752	Продукты питания (folder)/Мороженое	0	
2855560	4607067937100	Вм-1149 мороженое эскимо сливочное шоколадное в шоколадной глазури	30752	Продукты питания (folder)/Мороженое	0	
84906	4600625307612	Вм-1151 мороженое сливочное шоколадное в шоколадной глазури	30752	Продукты питания (folder)/Мороженое	84891	АйсФили
2741312	4600625311916	Вм-1152 мороженое змж ванильное с клюквенным джемом в шоколадной глазури айсберри	30752	Продукты питания (folder)/Мороженое	82708	Филевское
1258043	4607067932549	Вм-1159 мороженое змж Крем-брюле в вафлях от деда мороза	30752	Продукты питания (folder)/Мороженое	84861	Айсберри
1258091	4607067932532	Вм-1160 мороженое змж ванильное в вафлях от деда мороза	30752	Продукты питания (folder)/Мороженое	0	
1682720	4607067934703	Вм-1163 мороженое трехслойное сливочное ванильное, с ароматом клубники и шоколадное семейное	30752	Продукты питания (folder)/Мороженое	84861	Айсберри
2855561	4607067937124	Вм-1165 мороженое филевское пломбир с ароматом тирамису с кусочками шоколадного печенья с шоколадным топпингом	30752	Продукты питания (folder)/Мороженое	0	
1259200	4607067934406	Вм-1170 мороженое пломбир ванильный вафельн сахарн рожок в шоколадной глазури филевский	30752	Продукты питания (folder)/Мороженое	82708	Филевское
1259199	4607067934420	Вм-1171 мороженое пломбир Крем-брюле вафельн сахарн рожок в шоколадной глазури филевский	30752	Продукты питания (folder)/Мороженое	0	
2855562	4607067936134	Вм-1172 мороженое пломбир ванильный	30752	Продукты питания (folder)/Мороженое	0	
2855563	4607067936172	Вм-1173 мороженое пломбир ванильный с вишней	30752	Продукты питания (folder)/Мороженое	0	
2855564	4607067936196	Вм-1174 мороженое пломбир ванильный с черникой	30752	Продукты питания (folder)/Мороженое	0	
2855565	4607067937353	Вм-1177 мороженое стандарт пломбир ванильный с шоколадной крошкой	30752	Продукты питания (folder)/Мороженое	0	
2855566	4607067937414	Вм-1179 мороженое филевское пломбир с ароматом карамели с карамелизированным кешью с мягкой карамелью	30752	Продукты питания (folder)/Мороженое	0	
2855567	4607067937438	Вм-1181 мороженое филевское сливочное с ароматом жевательной резинки бабл гам голубое небо	1	Неклассифицированные/default	0	
2855571	4607067937490	Вм-1187 мороженое пломбир ванильный	30752	Продукты питания (folder)/Мороженое	0	
2855573	4607067937599	Вм-1190 мороженое филевское сливочное с банановым пюре с ароматом банана с шоколадным топпингом	1	Неклассифицированные/default	0	
2855574	4607067937612	Вм-1191 мороженое филевское сливочное с ароматом йогурта с наполнителем лесная ягода	1	Неклассифицированные/default	0	
2855576	4690363046577	Вм-1193 мороженое эскимо пломбир ванильный в шоколадной глазури с растительным жиром	30752	Продукты питания (folder)/Мороженое	0	
2855577	4607067937537	Вм-1194 мороженое пломбир ванильный в вафельном стаканчике с шоколадной глазурью филевский стаканчик	30752	Продукты питания (folder)/Мороженое	82708	Филевское
2855578	4607067937551	Вм-1195 мороженое пломбир шоколадный в вафельном стаканчике с шоколадной глазурью филевский стаканчик	30752	Продукты питания (folder)/Мороженое	0	
2741439	4607067937698	Вм-1201 мороженое пломбир в вафельном стаканчике вологодский пломбир	30752	Продукты питания (folder)/Мороженое	0	
2741582	4607067937735	Вм-1203 мороженое змж с ароматом дыни в вафельном стаканчике от деда мороза	30752	Продукты питания (folder)/Мороженое	0	
2855581	4607067937759	Вм-1205 мороженое пломбир ванильный	30752	Продукты питания (folder)/Мороженое	0	
2855582	4607067937773	Вм-1206 мороженое сливочное с клубникой	1	Неклассифицированные/default	0	
2855583	4607067937797	Вм-1207 мороженое молочное с черной смородиной	1	Неклассифицированные/default	0	
2741305	4607067937896	Вм-1217 мороженое змж с ароматом жевательной резинки бабл гам в вафельном стаканчике	30752	Продукты питания (folder)/Мороженое	0	
2741469	4607067937902	Вм-1218 мороженое змж с ароматом банана в вафельном стаканчике	30752	Продукты питания (folder)/Мороженое	0	
2855584	4607067937971	Вм-1219 мороженое от деда мороза змж ванильное	30752	Продукты питания (folder)/Мороженое	0	
84900	4600625307568	Вм-1220 мороженое пломбир ванильный во взбитой шоколадной глазури филевская лакомка	30752	Продукты питания (folder)/Мороженое	84891	АйсФили
144005	4600625307551	Вм-1221 мороженое сливочное шоколадное во взбитой шоколадной глазури филевская лакомка	30752	Продукты питания (folder)/Мороженое	82708	Филевское
85793	4600625307407	Вм-1229 мороженое эскимо сливочное ванильное в шоколадной глазури	30752	Продукты питания (folder)/Мороженое	85768	Сервис Холод
763325	4607067934444	Вм-1230 мороженое пломбир ванильный в вафельном стаканчике в шоколадной глазури с арахисом филевский стаканчик	30752	Продукты питания (folder)/Мороженое	84861	Айсберри
2855585	4607067937872	Вм-1234 мороженое змж ванильное от деда мороза	30752	Продукты питания (folder)/Мороженое	0	
1259622	4607067933294	Вм-1237 мороженое пломбир ванильный со взбитой шоколадной глазурью филевская лакомка	30752	Продукты питания (folder)/Мороженое	0	
2855588	4607067938091	Вм-1244 мороженое пломбир шоколадный в вафельном стаканчике	30752	Продукты питания (folder)/Мороженое	0	
2855590	4607067938299	Вм-1246 мороженое стандарт сливочное ванильное с черной смородиной	1	Неклассифицированные/default	0	
2855591	4607067938275	Вм-1250 мороженое эскимо пломбир ванильный в молочно-шоколадной глазури с миндалем и бисквитной крошкой	30752	Продукты питания (folder)/Мороженое	0	
2855592	4607067937957	Вм-1252 мороженое пломбир ванильный во взбитой шоколадной глазури	30752	Продукты питания (folder)/Мороженое	0	
2855593	4607067938015	Вм-1253 мороженое пломбир ванильный в вафлях	30752	Продукты питания (folder)/Мороженое	0	
2855594	4607067937995	Вм-1254 мороженое пломбир ванильный в вафельном сахарном рожке	30752	Продукты питания (folder)/Мороженое	0	
2855595	4607067937933	Вм-1255 мороженое эскимо пломбир ванильный в шоколадной глазури	30752	Продукты питания (folder)/Мороженое	0	
2855596	4607067938176	Вм-1256 мороженое пломбир ванильный в вафельном стаканчике	30752	Продукты питания (folder)/Мороженое	0	
2855597	4607067938190	Вм-1257 мороженое пломбир шоколадный в вафельном стаканчике	30752	Продукты питания (folder)/Мороженое	0	
2855598	4607067938152	Вм-1258 мороженое пломбир ванильный вафельн сахарн рожок в шоколадной глазури	30752	Продукты питания (folder)/Мороженое	0	
2855599	4607067938138	Вм-1259 мороженое эскимо пломбир ванильный в шоколадной глазури	30752	Продукты питания (folder)/Мороженое	0	
2855600	4607067938336	Вм-1260 мороженое филевское сливочное с ароматом мяты с кусочками шоколада	1	Неклассифицированные/default	0	
2855601	4607067938350	Вм-1261 мороженое филевское сливочное с ароматом малины с воздушным зефиром	1	Неклассифицированные/default	0	
2855602	4607067935274	Вм-1263 мороженое пломбир ванильный снежное лакомство	30752	Продукты питания (folder)/Мороженое	0	
2855603	4607067934116	Вм-1264 мороженое эскимо пломбир ванильный в шоколадной глазури	30752	Продукты питания (folder)/Мороженое	0	
2855604	4607067934987	Вм-1265 мороженое эскимо пломбир ванильный в шоколадной глазури снежное лакомство	30752	Продукты питания (folder)/Мороженое	0	
2855605	4607067938374	Вм-1266 мороженое пломбир вафельн сахарн рожок вологодский пломбир	30752	Продукты питания (folder)/Мороженое	0	
2855606	4607067938398	Вм-1267 мороженое пломбир шоколадный с кусочками шоколадного печенья с абрикосовым наполнителем, декорированное шоколадной крош	30752	Продукты питания (folder)/Мороженое	3777823	ВКУСЛАНДИЯ
2855607	4607067938411	Вм-1268 мороженое эскимо пломбир в шоколадной глазури вологодский пломбир	30752	Продукты питания (folder)/Мороженое	0	
2855608	4607067938480	Вм-1269 мороженое пломбир ванильный в вафельном стаканчике	30752	Продукты питания (folder)/Мороженое	0	
2855609	4607067938503	Вм-1270 мороженое пломбир шоколадный в вафельном стаканчике	30752	Продукты питания (folder)/Мороженое	3780070	АРТЕК
2855610	4607067938435	Вм-1271 мороженое пломбир вологодский пломбир	30752	Продукты питания (folder)/Мороженое	0	
2855612	4607067938459	Вм-1274 мороженое пломбир	30752	Продукты питания (folder)/Мороженое	0	
2855613	4607067938671	Вм-1275 мороженое пломбир вологодский пломбир	30752	Продукты питания (folder)/Мороженое	0	
2855614	4607067938770	Вм-1276 мороженое стандарт пломбир ванильный	30752	Продукты питания (folder)/Мороженое	0	
2855615	4607067938695	Вм-1277 мороженое стандарт сливочное ванильное	1	Неклассифицированные/default	0	
2855616	4607067938718	Вм-1278 мороженое стандарт сливочное шоколадное	1	Неклассифицированные/default	0	
2855617	4607067938756	Вм-1279 мороженое стандарт сливочное ванильное с клубникой	1	Неклассифицированные/default	0	
2855618	4607067938817	Вм-1280 мороженое стандарт сливочное с ароматом фисташки	1	Неклассифицированные/default	0	
2855619	4607067938732	Вм-1281 мороженое стандарт сливочное Крем-брюле	1	Неклассифицированные/default	0	
2855620	4665297601727	Вм-1282 мороженое эскимо пломбир ванильный в шоколадной глазури	30752	Продукты питания (folder)/Мороженое	0	
2855621	4607067938893	Вм-1285 мороженое пломбир ванильный	30752	Продукты питания (folder)/Мороженое	0	
2855622	4607067938916	Вм-1286 мороженое пломбир шоколадный	30752	Продукты питания (folder)/Мороженое	0	
2855623	4607067938930	Вм-1288 мороженое вологодский пломбир пломбир	30752	Продукты питания (folder)/Мороженое	0	
2855624	4607067938992	Вм-1289 мороженое вологодский пломбир пломбир шоколадный с кусочками шоколада	30752	Продукты питания (folder)/Мороженое	0	
2855625	4607067938978	Вм-1290 мороженое вологодский пломбир пломбир с брусничным наполнителем	30752	Продукты питания (folder)/Мороженое	0	
2741606	4607067935915	Вм-1295 мороженое пломбир ванильный в вафельном сахарном рожке	30752	Продукты питания (folder)/Мороженое	84861	Айсберри
2855629	4607067939043	Вм-1302 мороженое вологодский пломбир пломбир с клубникой	30752	Продукты питания (folder)/Мороженое	0	
2855630	4607067939128	Вм-1305 мороженое пломбир ванильный с абрикосовым наполнителем в вафельном стаканчике	30752	Продукты питания (folder)/Мороженое	0	
2855631	4607067939142	Вм-1306 мороженое пломбир ванильный с клубничным наполнителем в вафельном стаканчике	30752	Продукты питания (folder)/Мороженое	0	
2850214	4607067938077	Вм-1307 мороженое пломбир ванильный в вафлях снежное лакомство	30752	Продукты питания (folder)/Мороженое	0	
