ID	UPCEAN	Name	CategoryID	CategoryName	BrandID	BrandName
3545181	4610006180673	Счаст дачник биоактиватор для дачн.туалетов 45г	1	Неклассифицированные/default	3917958	СЧАСТЬЕ ДАЧНИКА
3917959	4680020710255	Счаст дачник биоактиватор для дачн.туалетов 45г #2	309084	Растениеводство/Средства защиты растений	3917958	СЧАСТЬЕ ДАЧНИКА
3917960	4610006180093	Счаст дачник биоактиватор для дачн.туалетов 90г	309084	Растениеводство/Средства защиты растений	3917958	СЧАСТЬЕ ДАЧНИКА
3917961	4610006180697	Счаст дачник гидрогель для сада/огорода 100г	276445	Растениеводство/Удобрения	3917958	СЧАСТЬЕ ДАЧНИКА
3302705	4610006180703	Счаст дачник гидрогель для сада/огорода 50г	1	Неклассифицированные/default	3917958	СЧАСТЬЕ ДАЧНИКА
3917962	4607054680743	Счаст дачник подкормка уют.Сад унив.10шт	276445	Растениеводство/Удобрения	0	
3917963	4610006185005	Счаст дачник решет-гриль rs-135 47x23 x 23см	329590	Спорт и отдых (folder)/Пикник	0	
3917964	4610006185029	Счаст дачник решетка стал.унив.50x30 x21	329590	Спорт и отдых (folder)/Пикник	0	
3267504	4610006181434	Счаст дачник ср.прудочист для очис.водоемов 30г	1	Неклассифицированные/default	3917958	СЧАСТЬЕ ДАЧНИКА
3917965	4610006181441	Счаст дачник ср.прудочист для очис.водоемов 90г	309084	Растениеводство/Средства защиты растений	3917958	СЧАСТЬЕ ДАЧНИКА
3917966	4610006180932	Счаст дачник фонарь бим на сол.бат.	2228248	Растениеводство/Садовые предметы интерьера	0	
3917967	4610006180826	Счаст дачник фонарь лабрадор на сол.бат.	2228248	Растениеводство/Садовые предметы интерьера	0	
3917968	4610006184787	Счаст.дач.биокомпостин 45г	276445	Растениеводство/Удобрения	0	
3917969	4610006180772	Счаст.дачник фонарь белка на сол.бат.	2228248	Растениеводство/Садовые предметы интерьера	0	
3917970	4610006180765	Счаст.дачник фонарь ежик на сол.бат.	2228248	Растениеводство/Садовые предметы интерьера	0	
166530	9785944555090	Счастливая курица.логопед. игры ц-з-с	2	Канцелярские товары (folder)/Канцелярские товары	0	
2490525	4607149713660	Счастливая мама. 9 месяцев. расширенное издание pc	1	Неклассифицированные/default	0	
2490526	4607149713684	Счастливая мама. мне годик, и я расту. расширенное	1	Неклассифицированные/default	0	
2490527	4607149713677	Счастливая мама. Мой первый годик. расширенное изд	1	Неклассифицированные/default	0	
239031	4607053526356	Счастливчик	1	Неклассифицированные/default	0	
2932651	4607077171143	Счастливчик зерносмесь для Волн.поп.рацион. питание морск. капуста 0.350x25	1	Неклассифицированные/default	0	
2932652	4607077171150	Счастливчик зерносмесь для Волн.поп.рацион. питание орех +кунжут 0.350x25	1	Неклассифицированные/default	0	
2932653	4607077171136	Счастливчик зерносмесь для Волн.поп.рацион. питание фрукты/овощи 0.350x25	1	Неклассифицированные/default	0	
2932654	4607077171181	Счастливчик зерносмесь для морских свинок. рацион. питание фрукты/овощи 0.300x25	1	Неклассифицированные/default	0	
2932655	4607077171174	Счастливчик зерносмесь для хом. рацион. питание фрукты/овощи 0.300x25	1	Неклассифицированные/default	0	
2932656	4607077174021	Счастливчик корм для активных собак энергия мясное ассорти 15кг	1	Неклассифицированные/default	0	
2932657	4607077174045	Счастливчик корм для активных собак энергия с курицей 15кг	1	Неклассифицированные/default	0	
2932658	4607077174199	Счастливчик корм для активных собак энергия телятина с рисом 15кг	1	Неклассифицированные/default	0	
836195	4602010277258	Счастливы вместе-игра большая б-002	56347	Игрушки (folder)/Игра настольная	673170	ТОП Игрушка
3509166	4660010700053	Счастливые дети сахарная вата 40г	1	Неклассифицированные/default	3917971	СЧАСТЛИВЫЕ ДЕТИ
107344	4008402333357	Счастливые ножки kiwi гелевые подушечки для ступни	15348	Одежда и обувь (folder)/Обувь (folder)/Обувь	8112	KIWI
1316965	4008402333555	Счастливые ножки kiwi гелевые подушечки между пальцами	594	Хозяйственные товары (folder)/Уход за обувью	0	
107345	4008402333333	Счастливые ножки kiwi гелевые подушечки под пятки	15348	Одежда и обувь (folder)/Обувь (folder)/Обувь	8112	KIWI
107346	4008402333234	Счастливые ножки kiwi гелевые подушечки под ступню	15348	Одежда и обувь (folder)/Обувь (folder)/Обувь	8112	KIWI
107348	4008402333227	Счастливые ножки kiwi гелевые подушечки против скольжения	15348	Одежда и обувь (folder)/Обувь (folder)/Обувь	8112	KIWI
2932659	4627122740124	Счастливый пес для взрослых собак с чувствительным пищеварением с ягненком и рисом - 13.0кг	1	Неклассифицированные/default	3604531	Счастливый Пес
2932660	4627122740100	Счастливый пес для взрослых собак с чувствительным пищеварением с ягненком и рисом - 3кг	1	Неклассифицированные/default	3604531	Счастливый Пес
2932661	4627122740094	Счастливый пес для собак крупных пород от 1 года до 7 лет с курицей - 13кг	1	Неклассифицированные/default	3604531	Счастливый Пес
2932662	4627122740070	Счастливый пес для собак крупных пород от 1 года до 7 лет с курицей - 3кг	1	Неклассифицированные/default	3604531	Счастливый Пес
2932663	4627122740230	Счастливый пес для собак мелких пород от 1 года до 7 лет с ягненком и рисом - 10.0кг	1	Неклассифицированные/default	3604531	Счастливый Пес
2932664	4627122740216	Счастливый пес для собак мелких пород от 1 года до 7 лет с ягненком и рисом - 2кг	1	Неклассифицированные/default	3604531	Счастливый Пес
2932665	4627122740193	Счастливый пес для собак мелких пород от 1 года до 7 лет с ягненком и рисом-0.5кг	1	Неклассифицированные/default	3604531	Счастливый Пес
2932666	4627122740063	Счастливый пес для собак средних пород от 1 года до 7 лет с говядиной - 13кг	1	Неклассифицированные/default	3604531	Счастливый Пес
2932667	4627122740049	Счастливый пес для собак средних пород от 1 года до 7 лет с говядиной - 3кг	1	Неклассифицированные/default	3604531	Счастливый Пес
2932668	4627122740186	Счастливый пес для собак старше 7лет с ягненком - 13кг	1	Неклассифицированные/default	3604531	Счастливый Пес
2932669	4627122740162	Счастливый пес для собак старше 7лет с ягненком - 3кг	1	Неклассифицированные/default	3604531	Счастливый Пес
2932670	4627122740032	Счастливый пес для щенков всех пород с 5 недель с ягненком и рисом - 13.0кг	1	Неклассифицированные/default	3604531	Счастливый Пес
2932671	4627122740018	Счастливый пес для щенков всех пород с 5 недель с ягненком и рисом - 3кг	1	Неклассифицированные/default	3604531	Счастливый Пес
2932672	4627122740155	Счастливый пес энергия для взрослых собак с высокой актив.с курицей и говядиной - 13.0кг	1	Неклассифицированные/default	3604531	Счастливый Пес
2932673	4627122740131	Счастливый пес энергия для взрослых собак с высокой активностью с курицей и говядиной - 3кг	1	Неклассифицированные/default	3604531	Счастливый Пес
3917972	4607049642459	Счастье дачника парник in Box 6-секц.чер	33235	Растениеводство/Садовый инвентарь	3917958	СЧАСТЬЕ ДАЧНИКА
2932674	4602121008314	Счастье для рук 2x 7мл	1	Неклассифицированные/default	0	
1848812	4607178600047	Счастья в новом году 90.778.00	1	Неклассифицированные/default	0	
2260575	9789667451158	Счет (н) - трафарет	36536	Полиграфия (folder)/Печатная продукция	0	
2260574	9789660830899	Счет - суперкнижка	36536	Полиграфия (folder)/Печатная продукция	0	
527982	9785353040422	Счет 10 кнопок. говорящая книга 04042-2 росмэн	439832	Полиграфия (folder)/Книги для дошкольников	205409	РОСМЭН
1976487	9789660847293	Счет в стихах, веселые задачки арт.а10804р	1	Неклассифицированные/default	0	
1976488	9789667459789	Счет в стихах, посчитай-ка! арт. а10751р	1	Неклассифицированные/default	0	
1976489	9789667459772	Счет в стихах, складываем и вычитаем арт. а10750р	1	Неклассифицированные/default	0	
2758719	9785431508332	Счет до 20 (мозаика-синтез)	1	Неклассифицированные/default	0	
2260576	9789660819023	Счет от 1 до 10 - вместе с мамой	36536	Полиграфия (folder)/Печатная продукция	0	
1976490	4798033028110	Счет официанта газет 100шт	1	Неклассифицированные/default	0	
1976491	4602723048510	Счет официанта самокоп 2-сл sc-rch	1	Неклассифицированные/default	0	
836202	4607129401280	Счет.1-фаза нева 103	278327	Техника (folder)/Электротехника/Электротовары	0	
527984	4670003463551	Счет.мат. 9675 счеты первокл.абак kinderlinie 670501 Silwerhof	527983	Канцелярские товары (folder)/Школа/Обучающие материалы/Изучение счета и алфавита	40228	Silwerhof
527985	4607056794936	Счет.мат. пластм счеты у311 уфа	527983	Канцелярские товары (folder)/Школа/Обучающие материалы/Изучение счета и алфавита	456001	Уфа
1844167	4670004018729	Счетные материалы стамм геометрическая мозаика прямоуг,квадр. круг,шестиуг. треуг. пл.ведро, дм02	2	Канцелярские товары (folder)/Канцелярские товары	21302	СТАММ
836205	4603322140285	Счетные палочки 14756, 30шт в футляре,пластик j.otten /1 /0 /400	527983	Канцелярские товары (folder)/Школа/Обучающие материалы/Изучение счета и алфавита	442856	Josef Otten
527986	4820119511060	Счетные палочки 20шт	527983	Канцелярские товары (folder)/Школа/Обучающие материалы/Изучение счета и алфавита	75127	Спектр
239032	4607056790907	Счетные палочки 20шт у284 /уфа /0 /0 /70	527983	Канцелярские товары (folder)/Школа/Обучающие материалы/Изучение счета и алфавита	456001	Уфа
3545182	4810159003861	Счетные палочки 30 штук в пакете	1	Неклассифицированные/default	0	
527987	4607692490124	Счетные палочки 30шт пласт в пласт боксе 4цв спк-30 (10%)	527983	Канцелярские товары (folder)/Школа/Обучающие материалы/Изучение счета и алфавита	5785	Пчелка
836206	4813674004191	Счетные палочки 36шт darvish dv-1392	527983	Канцелярские товары (folder)/Школа/Обучающие материалы/Изучение счета и алфавита	1353104	Darvish
527988	4820119511077	Счетные палочки 40шт	527983	Канцелярские товары (folder)/Школа/Обучающие материалы/Изучение счета и алфавита	75127	Спектр
2758720	4810159003236	Счетные палочки 50шт	527983	Канцелярские товары (folder)/Школа/Обучающие материалы/Изучение счета и алфавита	0	
234904	4810037000159	Счетные палочки 50шт 8с39	527983	Канцелярские товары (folder)/Школа/Обучающие материалы/Изучение счета и алфавита	0	
836208	4810037002474	Счетные палочки 50шт двухцветные в евробоксе, 10с173	527983	Канцелярские товары (folder)/Школа/Обучающие материалы/Изучение счета и алфавита	0	
1976492	4601822000207	Счетные палочки 50шт деревян. в пенале, арт. с-21 0207	527983	Канцелярские товары (folder)/Школа/Обучающие материалы/Изучение счета и алфавита	0	
836209	4810037002467	Счетные палочки 50шт многоцветные (по 10шт разных цветов)	527983	Канцелярские товары (folder)/Школа/Обучающие материалы/Изучение счета и алфавита	0	
527989	4607692490131	Счетные палочки 50шт пластмасс. Пчелка, арт.67053 0131	527983	Канцелярские товары (folder)/Школа/Обучающие материалы/Изучение счета и алфавита	5785	Пчелка
239034	4607056790914	Счетные палочки 50шт у285 /уфа /0 /0 /70	527983	Канцелярские товары (folder)/Школа/Обучающие материалы/Изучение счета и алфавита	456001	Уфа
836210	4680009213135	Счетные палочки fancy 30шт в пакете европодвес	527983	Канцелярские товары (folder)/Школа/Обучающие материалы/Изучение счета и алфавита	0	
836211	4680009213159	Счетные палочки fancy 50шт в евробоксе	527983	Канцелярские товары (folder)/Школа/Обучающие материалы/Изучение счета и алфавита	0	
836212	4680009213142	Счетные палочки fancy 50шт в пенале	527983	Канцелярские товары (folder)/Школа/Обучающие материалы/Изучение счета и алфавита	0	
836213	4670003463544	Счетные палочки kinder linie 60шт пластмас евробокс	527983	Канцелярские товары (folder)/Школа/Обучающие материалы/Изучение счета и алфавита	0	
836204	4602078001369	Счетные палочки артикул сч-20	527983	Канцелярские товары (folder)/Школа/Обучающие материалы/Изучение счета и алфавита	20610	ГЛОБУС
3545183	4690219042883	Счетные палочки в пакете по 30 штук tukzar	1	Неклассифицированные/default	0	
3545184	6953675311015	Счетные палочки в футляре лаки болл	1	Неклассифицированные/default	0	
2758721	4810159007357	Счетные палочки пластиковые, 50шт, цв. ассорти, пластиковый пенал (унипласт) 2201061	527983	Канцелярские товары (folder)/Школа/Обучающие материалы/Изучение счета и алфавита	0	
1976493	8693972113087	Счетные палочки пластмасс. rio 3087	527983	Канцелярские товары (folder)/Школа/Обучающие материалы/Изучение счета и алфавита	0	
1844172	4607692901316	Счетные палочки Пчелка.50шт пл/стакан	527983	Канцелярские товары (folder)/Школа/Обучающие материалы/Изучение счета и алфавита	5785	Пчелка
836215	4607093082065	Счетные палочки рантис 20 штук 6-и гранных флуоресцентны	527983	Канцелярские товары (folder)/Школа/Обучающие материалы/Изучение счета и алфавита	40198	Рантис
239033	4620000632573	Счетные палочки стамм 30шт пластмас полиэт/уп сп01	527983	Канцелярские товары (folder)/Школа/Обучающие материалы/Изучение счета и алфавита	21302	СТАММ
177194	4620000639718	Счетные палочки стамм 50шт многоцветные, в пластиковом пенале, сп04	527983	Канцелярские товары (folder)/Школа/Обучающие материалы/Изучение счета и алфавита	21302	СТАММ
98832	4620000636106	Счетные палочки стамм 60шт многоцветные, в евробоксе, сп02	527983	Канцелярские товары (folder)/Школа/Обучающие материалы/Изучение счета и алфавита	21302	СТАММ
1768107	9785904956769	Счетный материал анданте 100дет.палочки+кубики.ведро	527983	Канцелярские товары (folder)/Школа/Обучающие материалы/Изучение счета и алфавита	1768106	АНДАНТЕ
1768108	9785904956875	Счетный материал анданте 10дет.палочки.к/бл.	527983	Канцелярские товары (folder)/Школа/Обучающие материалы/Изучение счета и алфавита	1768106	АНДАНТЕ
1768109	9785904956912	Счетный материал анданте 14дет.часть-целое.к/бл.	527983	Канцелярские товары (folder)/Школа/Обучающие материалы/Изучение счета и алфавита	1768106	АНДАНТЕ
1768110	9785904956868	Счетный материал анданте 24дет.кубики.к/бл.	527983	Канцелярские товары (folder)/Школа/Обучающие материалы/Изучение счета и алфавита	1768106	АНДАНТЕ
1768111	9785904956851	Счетный материал анданте 34дет.палочки+кубики.к/бл.	527983	Канцелярские товары (folder)/Школа/Обучающие материалы/Изучение счета и алфавита	1768106	АНДАНТЕ
1768112	9785904956844	Счетный материал анданте 40дет.палочки.к/бл.	527983	Канцелярские товары (folder)/Школа/Обучающие материалы/Изучение счета и алфавита	1768106	АНДАНТЕ
836219	4607102557850	Счетный материал в помидоре арт.р-45/785 (рни)	527983	Канцелярские товары (folder)/Школа/Обучающие материалы/Изучение счета и алфавита	0	
836220	4607102557843	Счетный материал в яблоке арт.р-45/784 (рни)	527983	Канцелярские товары (folder)/Школа/Обучающие материалы/Изучение счета и алфавита	0	
836221	4607102559229	Счетный материал грибы 10шт без доски р-45/922 (рни)	527983	Канцелярские товары (folder)/Школа/Обучающие материалы/Изучение счета и алфавита	0	
1789170	4690219074297	Счетный материал дерев счеты tz10384 tukzar	527983	Канцелярские товары (folder)/Школа/Обучающие материалы/Изучение счета и алфавита	237416	Tukzar
2758722	4683582530903	Счетный материал дерево яблонька 10шт арт 7838 (рни)	527983	Канцелярские товары (folder)/Школа/Обучающие материалы/Изучение счета и алфавита	0	
836223	4607102559267	Счетный материал матрешки р-45/926 (рни)	527983	Канцелярские товары (folder)/Школа/Обучающие материалы/Изучение счета и алфавита	0	
1789171	4690219073924	Счетный материал набор цифры и время tz10352 tukzar	527983	Канцелярские товары (folder)/Школа/Обучающие материалы/Изучение счета и алфавита	237416	Tukzar
836224	4607102557881	Счетный материал овощи морковка/помидор/огурец 10шт арт.р-45/788 (рни)	527983	Канцелярские товары (folder)/Школа/Обучающие материалы/Изучение счета и алфавита	0	
1316967	4690448082155	Счетный материал палочки счетн.50шт emotions бокс 670610 Silwerhof	527983	Канцелярские товары (folder)/Школа/Обучающие материалы/Изучение счета и алфавита	40228	Silwerhof
552808	4670006995356	Счетный материал пенал ,ассорти 22850	527983	Канцелярские товары (folder)/Школа/Обучающие материалы/Изучение счета и алфавита	0	
2758723	4683582530910	Счетный материал пенечки 10 штук арт 7837 (рни)	527983	Канцелярские товары (folder)/Школа/Обучающие материалы/Изучение счета и алфавита	0	
1789173	4650066300574	Счетный материал пласт геометрическая мозаика супер-эконом дм03 стамм	527983	Канцелярские товары (folder)/Школа/Обучающие материалы/Изучение счета и алфавита	21302	СТАММ
1789174	4607692411822	Счетный материал пласт набор геом.фигур нгф-1 Пчелка	527983	Канцелярские товары (folder)/Школа/Обучающие материалы/Изучение счета и алфавита	5785	Пчелка
1789175	4607692411839	Счетный материал пласт набор учись считать цифры+знаки ус-1 Пчелка	527983	Канцелярские товары (folder)/Школа/Обучающие материалы/Изучение счета и алфавита	5785	Пчелка
1789176	4607692411815	Счетный материал пласт набор эконом цифры+знаки+фигуры см-2 Пчелка	527983	Канцелярские товары (folder)/Школа/Обучающие материалы/Изучение счета и алфавита	5785	Пчелка
