ID	UPCEAN	Name	CategoryID	CategoryName	BrandID	BrandName
3439187	4607044613713	Напиток ситро тархун газ б/а 1.4л пл/б	1	Неклассифицированные/default	0	
3439188	4607044612853	Напиток ситро экстра 0.5л ст/б	1	Неклассифицированные/default	0	
3439189	4607091210262	Напиток ситро экстра-ситро газированный 1.5л пл/бут	1	Неклассифицированные/default	0	
3439190	4607044613751	Напиток ситро экстра-ситро газированый 1.4л п/б	1	Неклассифицированные/default	0	
2888463	4640017371234	Напиток ситрович 0.5л ст/б пять золотых	1	Неклассифицированные/default	3751241	SITROVICH (1-YA VATER KOMPANI/STAVROPOL.KRAY)
2902712	4607167621350	Напиток сицилийский оранж (пэт) 0.5л 0.5л	1	Неклассифицированные/default	3915958	стом
2902713	4607167621398	Напиток сицилийский оранж газированный 1.5л пл/бут	1	Неклассифицированные/default	3915958	стом
3439191	4605096002448	Напиток сказочная страна безалкогольное с/г с ароматом зеленого яблока 1л пл/бут	1	Неклассифицированные/default	3909940	сказочная страна (URALSKIE ISTOCHNIKI/EKATERINBURG)
3439192	4605096002417	Напиток сказочная страна безалкогольное с/г с ароматом персика 1л пэт	1	Неклассифицированные/default	3909940	сказочная страна (URALSKIE ISTOCHNIKI/EKATERINBURG)
2902903	4699300145014	Напиток сказочное шампанетто б а газир 750мл с б	1	Неклассифицированные/default	0	
3439193	4699300145366	Напиток сказочное шампанетто б а газир 750мл с б #2	1	Неклассифицированные/default	0	
3439194	4603726360197	Напиток сказочный патруль арбузный баблгам 1л пл/бут	1	Неклассифицированные/default	3909965	сказочный PATRUL' (STORK PLYUS)
2855906	4607017052129	Напиток скандинавия газированный со вкусом лимона 1.5л пл/бут	48140	Продукты питания (folder)/Напитки безалкогольные/Вода минеральная	3909988	скандинавия (Национальная VODNAYA KOMPANIYA)
3439195	4607017056318	Напиток скандинавия газированный со вкусом лимона 1.5л пл/бут #2	1	Неклассифицированные/default	3909988	скандинавия (Национальная VODNAYA KOMPANIYA)
3439198	4607017160855	Напиток скит клюква и зверобой 0.5л пл/бут	1	Неклассифицированные/default	3918544	таежная RUS' (SLAVDA GK/PRIMORSKIY KRAY)
3439199	4607017160817	Напиток скит черника можжевельник, газ. 0.5л пл/б	1	Неклассифицированные/default	3918544	таежная RUS' (SLAVDA GK/PRIMORSKIY KRAY)
24642	4810130002913	Напиток слабоалк 6 ампер в ассорти-те 1.0л	17371	Продукты питания (folder)/Напитки безалкогольные/Напитки	0	
3439200	4612730930555	Напиток слабоалк absenter Energy газированный 7% жб 0.33л	144731	Продукты питания (folder)/Алкогольные напитки/Слабоалкогольные напитки	3607660	ABSENTER (SOLTEYN/MOSCOW)
3439201	4612730930470	Напиток слабоалк absenter Fusion газированный 7.2% жб 0.5л	144731	Продукты питания (folder)/Алкогольные напитки/Слабоалкогольные напитки	3607660	ABSENTER (SOLTEYN/MOSCOW)
3439202	4607041253738	Напиток слабоалк amore мохито браво газированный 7.1% жб 0.45л	144731	Продукты питания (folder)/Алкогольные напитки/Слабоалкогольные напитки	0	
3439203	4601351009276	Напиток слабоалк bingo медовуха белый виноград 6% 1.5л пл/б	144731	Продукты питания (folder)/Алкогольные напитки/Слабоалкогольные напитки	0	
3439204	4601351009283	Напиток слабоалк bingo медовуха джин-лимон 6% 1.5л пл/б	144731	Продукты питания (folder)/Алкогольные напитки/Слабоалкогольные напитки	0	
3439205	4601351009290	Напиток слабоалк bingo медовуха джин-тоник 6% 1.5л пл/б	144731	Продукты питания (folder)/Алкогольные напитки/Слабоалкогольные напитки	0	
3439206	4602983010562	Напиток слабоалк Black drake виски-кола газированный 7.2% жб 0.5л	144731	Продукты питания (folder)/Алкогольные напитки/Слабоалкогольные напитки	0	
3439207	4602983010586	Напиток слабоалк Black drake коньяк-миндаль газированный 7.2% жб 0.5л	144731	Продукты питания (folder)/Алкогольные напитки/Слабоалкогольные напитки	0	
1269591	4607023758015	Напиток слабоалк Black russian коньяк/миндаль 7% жб 0.5л	144731	Продукты питания (folder)/Алкогольные напитки/Слабоалкогольные напитки	94866	Черный Русский
3439208	4607041253370	Напиток слабоалк bravo bristolls 7.1% жб 0.5л	144731	Продукты питания (folder)/Алкогольные напитки/Слабоалкогольные напитки	3628695	BRISTOLL'S (ROUST)
149681	4607041250027	Напиток слабоалк bravo Classic джин-тоник газированный 9% 0.5л пл/б	144731	Продукты питания (folder)/Алкогольные напитки/Слабоалкогольные напитки	144732	БРАВО 81
3439209	4607041253721	Напиток слабоалк bravo джин грейпфрут газированный 7% 0.5л пл/бут	144731	Продукты питания (folder)/Алкогольные напитки/Слабоалкогольные напитки	0	
153400	4607041250645	Напиток слабоалк bravo джин грейпфрут газированный 7% жб 0.5л	144731	Продукты питания (folder)/Алкогольные напитки/Слабоалкогольные напитки	53123	Браво
3439210	4607041253714	Напиток слабоалк bravo джин-тоник газированный 7% 0.5л пл/бут	144731	Продукты питания (folder)/Алкогольные напитки/Слабоалкогольные напитки	0	
1269592	4820097891864	Напиток слабоалк creamel айриш крим 0.2л	144731	Продукты питания (folder)/Алкогольные напитки/Слабоалкогольные напитки	0	
1269593	4820074181513	Напиток слабоалк creamel дыня 0.2л	144731	Продукты питания (folder)/Алкогольные напитки/Слабоалкогольные напитки	0	
1269594	4820097890287	Напиток слабоалк creamel дыня 0.2л #2	144731	Продукты питания (folder)/Алкогольные напитки/Слабоалкогольные напитки	0	
1269595	4820097891871	Напиток слабоалк creamel каппучино 0.2л	144731	Продукты питания (folder)/Алкогольные напитки/Слабоалкогольные напитки	0	
1269596	4820074180110	Напиток слабоалк creamel клубника 0.2л	144731	Продукты питания (folder)/Алкогольные напитки/Слабоалкогольные напитки	0	
1269597	4820097890546	Напиток слабоалк creamel кокос 0.2л	144731	Продукты питания (folder)/Алкогольные напитки/Слабоалкогольные напитки	0	
1269598	4820074181506	Напиток слабоалк creamel манго 0.2л	144731	Продукты питания (folder)/Алкогольные напитки/Слабоалкогольные напитки	0	
1269599	4820097890270	Напиток слабоалк creamel манго 0.2л #2	144731	Продукты питания (folder)/Алкогольные напитки/Слабоалкогольные напитки	0	
1269600	482009787029	Напиток слабоалк creamel персик 0.2л	144731	Продукты питания (folder)/Алкогольные напитки/Слабоалкогольные напитки	0	
1269601	4820074180127	Напиток слабоалк creamel персик 0.2л #2	144731	Продукты питания (folder)/Алкогольные напитки/Слабоалкогольные напитки	0	
1269602	4820097892281	Напиток слабоалк creamel тоффи 0.2л	144731	Продукты питания (folder)/Алкогольные напитки/Слабоалкогольные напитки	0	
1269603	4820074180134	Напиток слабоалк creamel черная смородина 0.2л	144731	Продукты питания (folder)/Алкогольные напитки/Слабоалкогольные напитки	0	
1269604	4820097892243	Напиток слабоалк cremel айшир крим 0.375л	144731	Продукты питания (folder)/Алкогольные напитки/Слабоалкогольные напитки	0	
1269605	4820097892250	Напиток слабоалк cremel капучино 0.375л	144731	Продукты питания (folder)/Алкогольные напитки/Слабоалкогольные напитки	0	
1269606	4820097892236	Напиток слабоалк cremel клубника 0.375л	144731	Продукты питания (folder)/Алкогольные напитки/Слабоалкогольные напитки	0	
1269607	4820097892229	Напиток слабоалк cremel персик 0.375л	144731	Продукты питания (folder)/Алкогольные напитки/Слабоалкогольные напитки	0	
24670	4870200190872	Напиток слабоалк dizzy абсентер газир.0.33	144731	Продукты питания (folder)/Алкогольные напитки/Слабоалкогольные напитки	0	
24671	4870200190247	Напиток слабоалк dizzy блю гаваи газир. 0.33	144731	Продукты питания (folder)/Алкогольные напитки/Слабоалкогольные напитки	3645281	DIZZY (RIKS/KAZAKHSTAN)
24672	4870200190254	Напиток слабоалк dizzy капакабана газир.0.33	144731	Продукты питания (folder)/Алкогольные напитки/Слабоалкогольные напитки	3645281	DIZZY (RIKS/KAZAKHSTAN)
24673	4870200190179	Напиток слабоалк dizzy коко локо газир.0.33	144731	Продукты питания (folder)/Алкогольные напитки/Слабоалкогольные напитки	0	
24674	4870200190193	Напиток слабоалк dizzy куба либра газир. 0.33	144731	Продукты питания (folder)/Алкогольные напитки/Слабоалкогольные напитки	0	
24675	4870200190216	Напиток слабоалк dizzy махитос газир. 0.33	144731	Продукты питания (folder)/Алкогольные напитки/Слабоалкогольные напитки	0	
24669	4870200190889	Напиток слабоалк dizzy пантера роса газир.0.33	144731	Продукты питания (folder)/Алкогольные напитки/Слабоалкогольные напитки	3645281	DIZZY (RIKS/KAZAKHSTAN)
24676	4870200190162	Напиток слабоалк dizzy саратого газир. 0.33	144731	Продукты питания (folder)/Алкогольные напитки/Слабоалкогольные напитки	0	
24677	4870200190223	Напиток слабоалк dizzy текила карамба 0.33	144731	Продукты питания (folder)/Алкогольные напитки/Слабоалкогольные напитки	0	
24678	4870200190261	Напиток слабоалк dizzy энерджи газир. 0.33	144731	Продукты питания (folder)/Алкогольные напитки/Слабоалкогольные напитки	0	
24679	4870200190186	Напиток слабоалк dizzy ямайка kiss 0.33	144731	Продукты питания (folder)/Алкогольные напитки/Слабоалкогольные напитки	3645281	DIZZY (RIKS/KAZAKHSTAN)
2323171	791863140674	Напиток слабоалк fee brothers aztec chocolate bitters 0.15л (шоколад) 0.15л	2281291	Продукты питания (folder)/Алкогольные напитки/Cocktail Bitters	2323170	Fee Brothers
2323173	791863140681	Напиток слабоалк fee brothers celery bitters 0.15л (сельдерей) 0.15л	2281291	Продукты питания (folder)/Алкогольные напитки/Cocktail Bitters	2323170	Fee Brothers
2323174	791863140667	Напиток слабоалк fee brothers cerry bitters 0.15л (вишня) 0.15л	2281291	Продукты питания (folder)/Алкогольные напитки/Cocktail Bitters	2323170	Fee Brothers
2323178	791863140698	Напиток слабоалк fee brothers cranberry bitters 0.15л (клюква) 0.15л	2281291	Продукты питания (folder)/Алкогольные напитки/Cocktail Bitters	2323170	Fee Brothers
2323184	791863140650	Напиток слабоалк fee brothers rhubarb bitters 0.15л (ревень) 0.15л	2281291	Продукты питания (folder)/Алкогольные напитки/Cocktail Bitters	2323170	Fee Brothers
3439211	4600682006664	Напиток слабоалк gin&Grapefruit газированный со вкусом джина и грейпфрута 8.8% 0.5 жб	144731	Продукты питания (folder)/Алкогольные напитки/Слабоалкогольные напитки	3750988	SINEBRYCHOFF
3439212	4601158022973	Напиток слабоалк gino вкус лимон и можжевельник газированный 5.9% 0.5л	144731	Продукты питания (folder)/Алкогольные напитки/Слабоалкогольные напитки	0	
155391	4607041250911	Напиток слабоалк gordons джин-тоник 7% жб 0.33л	144731	Продукты питания (folder)/Алкогольные напитки/Слабоалкогольные напитки	23105	GORDON'S
155393	4607041250904	Напиток слабоалк gordons джин-тоник назированный 7% жб 0.5л	144731	Продукты питания (folder)/Алкогольные напитки/Слабоалкогольные напитки	144732	БРАВО 81
1662847	5010296001075	Напиток слабоалк greenall's gin tonic oiginal 7.2% жб 500мл	703379	Продукты питания (folder)/Напитки безалкогольные/Коктейли, джин-тоники	1204947	Гриноллз
155392	4607041250928	Напиток слабоалк grodons джин-тоник грейпфрут 7% 500мл	144731	Продукты питания (folder)/Алкогольные напитки/Слабоалкогольные напитки	144732	БРАВО 81
1269610	4820097891451	Напиток слабоалк hartley вишня 0.5л	144731	Продукты питания (folder)/Алкогольные напитки/Слабоалкогольные напитки	0	
1269611	4820097891352	Напиток слабоалк hartley коффе 0.5л	144731	Продукты питания (folder)/Алкогольные напитки/Слабоалкогольные напитки	0	
1269612	4820097891376	Напиток слабоалк hartley яблоко 0.5л	144731	Продукты питания (folder)/Алкогольные напитки/Слабоалкогольные напитки	0	
3439214	4602983009207	Напиток слабоалк hooch супер газированный с соком вишни 7.5% жб 0.5л	144731	Продукты питания (folder)/Алкогольные напитки/Слабоалкогольные напитки	3672696	HOOCH HOOPERS
3439215	4610011226618	Напиток слабоалк i like cocktail джин-тоник газированный 7.2% жб 0.45л	144731	Продукты питания (folder)/Алкогольные напитки/Слабоалкогольные напитки	0	
1269613	4820000194679	Напиток слабоалк icelife грейпфрут жб 0.5л	144731	Продукты питания (folder)/Алкогольные напитки/Слабоалкогольные напитки	0	
1269614	4820000194655	Напиток слабоалк icelife лайм 7% 0.5л	144731	Продукты питания (folder)/Алкогольные напитки/Слабоалкогольные напитки	0	
1269615	4820000194693	Напиток слабоалк icelife экстрим 7% 0.5л	144731	Продукты питания (folder)/Алкогольные напитки/Слабоалкогольные напитки	0	
3439216	4660017420381	Напиток слабоалк iguana виски-кола сидр 5.9% 1.5л пл/б	144731	Продукты питания (folder)/Алкогольные напитки/Слабоалкогольные напитки	3673813	IGUANA (KMV AKVA-LAYF/STAVROPOLSKIY KRAY)
776519	4620001311095	Напиток слабоалк jaguar перфект газированный 7% жб 500мл	551222	Продукты питания (folder)/Напитки безалкогольные/Напиток энергетический	94925	Ягуар
1269616	4820097890379	Напиток слабоалк king's bridge джин с апельсин. 0.33л	144731	Продукты питания (folder)/Алкогольные напитки/Слабоалкогольные напитки	0	
1269624	4820074182114	Напиток слабоалк king's bridge джин с апельсин. соком 0.33л	144731	Продукты питания (folder)/Алкогольные напитки/Слабоалкогольные напитки	0	
1269617	4820097890386	Напиток слабоалк king's bridge джин с апельсин. соком 7% 0.5л	144731	Продукты питания (folder)/Алкогольные напитки/Слабоалкогольные напитки	0	
1269625	4820074182145	Напиток слабоалк king's bridge джин с апельсином жб 0.5л	144731	Продукты питания (folder)/Алкогольные напитки/Слабоалкогольные напитки	0	
1269618	4820097890034	Напиток слабоалк king's bridge джин с грейпфрут 0.33л	144731	Продукты питания (folder)/Алкогольные напитки/Слабоалкогольные напитки	0	
1269626	4820074182268	Напиток слабоалк king's bridge джин с грейпфрутом жб 0.5л	144731	Продукты питания (folder)/Алкогольные напитки/Слабоалкогольные напитки	0	
1269627	4820097890362	Напиток слабоалк king's bridge джин с грейпфрутом жб 0.5л #2	144731	Продукты питания (folder)/Алкогольные напитки/Слабоалкогольные напитки	0	
1269619	4820097890393	Напиток слабоалк king's bridge джин с лимонным соком 7% 0.5л	144731	Продукты питания (folder)/Алкогольные напитки/Слабоалкогольные напитки	0	
1269620	4820097890409	Напиток слабоалк king's bridge джин с тоником 0.33л	144731	Продукты питания (folder)/Алкогольные напитки/Слабоалкогольные напитки	0	
1269621	4820097890416	Напиток слабоалк king's bridge джин с тоником жб 0.5л	144731	Продукты питания (folder)/Алкогольные напитки/Слабоалкогольные напитки	0	
1269628	4820074182732	Напиток слабоалк king's bridge джин с тоником жб 0.5л #2	144731	Продукты питания (folder)/Алкогольные напитки/Слабоалкогольные напитки	0	
1269622	4820097890072	Напиток слабоалк king's bridge дыня 7% 0.5л	144731	Продукты питания (folder)/Алкогольные напитки/Слабоалкогольные напитки	0	
1269629	4820074182701	Напиток слабоалк king's bridge ждин с тоником 0.33л	144731	Продукты питания (folder)/Алкогольные напитки/Слабоалкогольные напитки	0	
1269630	4820097892137	Напиток слабоалк king's bridge лимон/лайм жб 0.5л	144731	Продукты питания (folder)/Алкогольные напитки/Слабоалкогольные напитки	0	
1269623	4820097890027	Напиток слабоалк king's bridge с вишневым соком 7% 0.5л	144731	Продукты питания (folder)/Алкогольные напитки/Слабоалкогольные напитки	0	
1269631	4820097891567	Напиток слабоалк king's bridge ягодный жб 0.5л	144731	Продукты питания (folder)/Алкогольные напитки/Слабоалкогольные напитки	0	
1269632	4820074182206	Напиток слабоалк kings bringe джин с лимоном жб 0.5л	144731	Продукты питания (folder)/Алкогольные напитки/Слабоалкогольные напитки	0	
3439217	4601158023086	Напиток слабоалк Manhattan медовуха лимон-мята 5.9% 1.5л пл/бут	144731	Продукты питания (folder)/Алкогольные напитки/Слабоалкогольные напитки	0	
3439218	4601158023048	Напиток слабоалк Manhattan медовуха со вкусом апельсина 5.9% 1.5л пл/бут	144731	Продукты питания (folder)/Алкогольные напитки/Слабоалкогольные напитки	0	
3439219	4601158023055	Напиток слабоалк Manhattan медовуха со вкусом белого винограда 5.9% 1.5л пл/бут	144731	Продукты питания (folder)/Алкогольные напитки/Слабоалкогольные напитки	0	
3439220	4601158023062	Напиток слабоалк Manhattan медовуха со вкусом лимона 5.9% 1.5л пл/бут	144731	Продукты питания (folder)/Алкогольные напитки/Слабоалкогольные напитки	0	
3439221	4631136271611	Напиток слабоалк mister hipster вкус коньяка и миндаля 6% 1.5л пэт	144731	Продукты питания (folder)/Алкогольные напитки/Слабоалкогольные напитки	0	
3439222	4631136271628	Напиток слабоалк mister hipster со вкусом апельсина 6% 1.5л пэт	144731	Продукты питания (folder)/Алкогольные напитки/Слабоалкогольные напитки	0	
3439223	4631137074945	Напиток слабоалк mister hipster со вкусом апельсина 7% 0.95л пэт	144731	Продукты питания (folder)/Алкогольные напитки/Слабоалкогольные напитки	0	
3439224	4631136271642	Напиток слабоалк mister hipster со вкусом винограда 6% 1.5л пэт	144731	Продукты питания (folder)/Алкогольные напитки/Слабоалкогольные напитки	0	
3439225	4631137074969	Напиток слабоалк mister hipster со вкусом винограда 7% 0.95л пэт	144731	Продукты питания (folder)/Алкогольные напитки/Слабоалкогольные напитки	0	
3439226	4631136271659	Напиток слабоалк mister hipster со вкусом вишни 6% 1.5л пэт	144731	Продукты питания (folder)/Алкогольные напитки/Слабоалкогольные напитки	0	
3439227	4631137074976	Напиток слабоалк mister hipster со вкусом вишни 7% 0.95л пэт	144731	Продукты питания (folder)/Алкогольные напитки/Слабоалкогольные напитки	0	
