ID	UPCEAN	Name	CategoryID	CategoryName	BrandID	BrandName
1193254	4820003751268	Вино inkerman алиготе крымское Grand reserve 750мл	22133	Продукты питания (folder)/Алкогольные напитки/Вино (folder)/Вино	3284583	Inkerman
2226821	4623720857677	Вино inkerman алиготе крымское бел/сух 0.75 13% 1/12 (Россия)	22133	Продукты питания (folder)/Алкогольные напитки/Вино (folder)/Вино	3284583	Inkerman
1193253	4820003751756	Вино inkerman алиготе крымское, сухое белое, 13%, 750мл ст/б	22133	Продукты питания (folder)/Алкогольные напитки/Вино (folder)/Вино	3284583	Inkerman
3284584	4623722067500	Вино inkerman алиготе сухое белое 12% 0.7л стбут	22133	Продукты питания (folder)/Алкогольные напитки/Вино (folder)/Вино	3284583	Inkerman
43718	4820003750315	Вино inkerman алиди красное полусухое 9-11% 750мл стекло	22133	Продукты питания (folder)/Алкогольные напитки/Вино (folder)/Вино	3284583	Inkerman
2226861	4623720857530	Вино inkerman бастардо красн/сух 0.75 13% 1/6 (Россия)	22133	Продукты питания (folder)/Алкогольные напитки/Вино (folder)/Вино	3284583	Inkerman
2853652	4623721249181	Вино inkerman бастардо красное сухое 11-13% 750мл ст/б	22133	Продукты питания (folder)/Алкогольные напитки/Вино (folder)/Вино	3284583	Inkerman
1193255	4820003751565	Вино inkerman буссо белое полусладк 13% ст/б 750мл	22133	Продукты питания (folder)/Алкогольные напитки/Вино (folder)/Вино	3284583	Inkerman
1193256	4820003751954	Вино inkerman буссо красное полусладк 750мл	22133	Продукты питания (folder)/Алкогольные напитки/Вино (folder)/Вино	3284583	Inkerman
1193257	4820003751619	Вино inkerman буссо розовое полусладк столов 14% 750мл ст/б	22133	Продукты питания (folder)/Алкогольные напитки/Вино (folder)/Вино	3284583	Inkerman
2226974	4623720857554	Вино inkerman древний херсонес красн/полусладк 0.75 12.5% 1/12 (Россия)	22133	Продукты питания (folder)/Алкогольные напитки/Вино (folder)/Вино	3284583	Inkerman
1193258	4820003751251	Вино inkerman жемчужина инкермана Grand reserve бел сух 750мл	22133	Продукты питания (folder)/Алкогольные напитки/Вино (folder)/Вино	3284583	Inkerman
1193259	4820003751312	Вино inkerman жемчужина инкермана б/сух 750мл сув.кор	22133	Продукты питания (folder)/Алкогольные напитки/Вино (folder)/Вино	3284583	Inkerman
2425529	4623721249211	Вино inkerman жемчужина инкермана бел сух 750мл #2	22133	Продукты питания (folder)/Алкогольные напитки/Вино (folder)/Вино	3284583	Inkerman
43712	4820003750254	Вино inkerman жемчужина инкермана бел сух мар. 750мл 12% /украина/	22133	Продукты питания (folder)/Алкогольные напитки/Вино (folder)/Вино	3284583	Inkerman
2227047	4623720857646	Вино inkerman жемчужина инкермана белое сухое 11-13% 750мл стекло	688533	Продукты питания (folder)/Алкогольные напитки/Вино (folder)/Вина России и ближнего зарубежья	3284583	Inkerman
43717	4820003750353	Вино inkerman кагор украинский крас спец 16% 750мл (украина)	22133	Продукты питания (folder)/Алкогольные напитки/Вино (folder)/Вино	3284583	Inkerman
1193263	4820003750223	Вино inkerman кокур качинский бел сух 750мл	22133	Продукты питания (folder)/Алкогольные напитки/Вино (folder)/Вино	3284583	Inkerman
1193265	4820003751657	Вино inkerman крымская ривьера крас полусладк 750мл	22133	Продукты питания (folder)/Алкогольные напитки/Вино (folder)/Вино	3284583	Inkerman
282942	4820003751350	Вино inkerman легенда инкермана бел полусладк.750мл 9-12% (украина)	22133	Продукты питания (folder)/Алкогольные напитки/Вино (folder)/Вино	3284583	Inkerman
2227184	4623720857639	Вино inkerman легенда инкермана бел/полусладк 0.75 12.5% 1/12 (Россия)	22133	Продукты питания (folder)/Алкогольные напитки/Вино (folder)/Вино	3284583	Inkerman
2227254	4623720857585	Вино inkerman мерло каберне красн/сух 0.75 13% 1/12 (Россия)	22133	Продукты питания (folder)/Алкогольные напитки/Вино (folder)/Вино	0	
1193269	4820003750278	Вино inkerman мускат алькадар розов п/ сух 750мл	22133	Продукты питания (folder)/Алкогольные напитки/Вино (folder)/Вино	3284583	Inkerman
3793781	4623721271106	Вино inkerman мускат б.полусладк 10.5-12.5% 750мл	22133	Продукты питания (folder)/Алкогольные напитки/Вино (folder)/Вино	3284583	Inkerman
283135	4820003751374	Вино inkerman мускат бел псух столов 750мл 9-11% /украина/	22133	Продукты питания (folder)/Алкогольные напитки/Вино (folder)/Вино	3284583	Inkerman
689790	4820003751428	Вино inkerman мускат качинский бел полусладк 750мл 9-12% (украина)	22133	Продукты питания (folder)/Алкогольные напитки/Вино (folder)/Вино	3284583	Inkerman
2227281	4623720857479	Вино inkerman мускат качинский бел/полусладк 0.75 12% 1/6 (Россия)	22133	Продукты питания (folder)/Алкогольные напитки/Вино (folder)/Вино	3284583	Inkerman
43714	4820003750261	Вино inkerman мускат осипенко бел псух 750мл 9-11% /украина/	22133	Продукты питания (folder)/Алкогольные напитки/Вино (folder)/Вино	3284583	Inkerman
283136	4820003751282	Вино inkerman мускат розов п/ сух 750мл 9-11% /украина/	22133	Продукты питания (folder)/Алкогольные напитки/Вино (folder)/Вино	3284583	Inkerman
1193270	4820003751879	Вино inkerman мускат, полусладк белое, 13%, 750мл ст/б	22133	Продукты питания (folder)/Алкогольные напитки/Вино (folder)/Вино	3284583	Inkerman
3284588	4623721617492	Вино inkerman мускатное белое полусладк 11% 700мл ст/б	22133	Продукты питания (folder)/Алкогольные напитки/Вино (folder)/Вино	3284583	Inkerman
2853654	4623721382864	Вино inkerman мускатное крымское бел/полусладк 10-14% 750мл	22133	Продукты питания (folder)/Алкогольные напитки/Вино (folder)/Вино	3284583	Inkerman
2853655	4623721382871	Вино inkerman пинно крымское столов красное полусладк 10.5-12.5% 750мл стекло	22133	Продукты питания (folder)/Алкогольные напитки/Вино (folder)/Вино	3284583	Inkerman
3284589	4623721617485	Вино inkerman пинно крымское столов красное полусладк 12.5% 0.7л стекло	22133	Продукты питания (folder)/Алкогольные напитки/Вино (folder)/Вино	3284583	Inkerman
3793866	4623721271083	Вино inkerman пино нуар к.полусладк 11.5-13.5% 750мл	22133	Продукты питания (folder)/Алкогольные напитки/Вино (folder)/Вино	3284583	Inkerman
3793922	4623720857431	Вино inkerman пино нуар к.полусладк 13.5% 750мл	22133	Продукты питания (folder)/Алкогольные напитки/Вино (folder)/Вино	3284583	Inkerman
283215	4820003751466	Вино inkerman пино нуар крымский красн полусладк столов 750мл 9-12% /украина/	22133	Продукты питания (folder)/Алкогольные напитки/Вино (folder)/Вино	3284583	Inkerman
2227325	4623720857462	Вино inkerman пино нуар крымский красн/полусладк 0.75 12.5% 1/6 (Россия)	22133	Продукты питания (folder)/Алкогольные напитки/Вино (folder)/Вино	3284583	Inkerman
2853653	4623720857561	Вино inkerman полусухое белое 10-12% 750мл ст/б	22133	Продукты питания (folder)/Алкогольные напитки/Вино (folder)/Вино	3284583	Inkerman
291762	4820003750094	Вино inkerman портвейн белый крымский бел выд 750мл 17.5% (украина)	172597	Продукты питания (folder)/Алкогольные напитки/Портвейн	3284583	Inkerman
1193271	4820003750773	Вино inkerman портвейн красн ахтир 750мл	22133	Продукты питания (folder)/Алкогольные напитки/Вино (folder)/Вино	3284583	Inkerman
1193272	4820003750346	Вино inkerman рислинг алькадар бел сух 750мл	22133	Продукты питания (folder)/Алкогольные напитки/Вино (folder)/Вино	3284583	Inkerman
3794122	4623720857387	Вино inkerman рислинг б.п/сух 12.5% 750мл	22133	Продукты питания (folder)/Алкогольные напитки/Вино (folder)/Вино	3284583	Inkerman
1193273	4820003751671	Вино inkerman ркацители бел сух 750мл 10-14% /украина/	22133	Продукты питания (folder)/Алкогольные напитки/Вино (folder)/Вино	3284583	Inkerman
151483	4820003750056	Вино inkerman ркацители инкерманское бел сух 750мл 10-12% (украина)	22133	Продукты питания (folder)/Алкогольные напитки/Вино (folder)/Вино	3284583	Inkerman
3290724	4623720857370	Вино inkerman розе сухое розовое столов 11% 750мл ст/б	22133	Продукты питания (folder)/Алкогольные напитки/Вино (folder)/Вино	0	
3794299	4623721180965	Вино inkerman саперави красн сух 13% 750мл	22133	Продукты питания (folder)/Алкогольные напитки/Вино (folder)/Вино	3284583	Inkerman
2227378	4623720857363	Вино inkerman саперави красн/сух 0.75 13% 1/12 (Россия)	22133	Продукты питания (folder)/Алкогольные напитки/Вино (folder)/Вино	0	
1193276	4820003751541	Вино inkerman севастополь 750мл	22133	Продукты питания (folder)/Алкогольные напитки/Вино (folder)/Вино	3284583	Inkerman
1193277	4820003750339	Вино inkerman севастополь бел крепл. 750мл	22133	Продукты питания (folder)/Алкогольные напитки/Вино (folder)/Вино	3284583	Inkerman
2853656	4623720857455	Вино inkerman совиньон белое сухое 11-13% 750мл ст/б	22133	Продукты питания (folder)/Алкогольные напитки/Вино (folder)/Вино	3284583	Inkerman
3284590	4623720857660	Вино inkerman совиньон белое сухое 11-13% 750мл ст/б #2	22133	Продукты питания (folder)/Алкогольные напитки/Вино (folder)/Вино	3284583	Inkerman
689791	4820003750063	Вино inkerman совиньон крымский бел сух 750мл 10-12% (украина)	22133	Продукты питания (folder)/Алкогольные напитки/Вино (folder)/Вино	3284583	Inkerman
2227396	4820003751770	Вино inkerman совиньон крымский бел/сух 0.75 12% 1/12	22133	Продукты питания (folder)/Алкогольные напитки/Вино (folder)/Вино	3284583	Inkerman
283352	4820003751404	Вино inkerman совиньон сортовой бел сух 750мл 10-13% (украина)	22133	Продукты питания (folder)/Алкогольные напитки/Вино (folder)/Вино	3284583	Inkerman
1193278	4820003751695	Вино inkerman совиньон-ркацители инкерман столов сухое белое 750мл 14%	22133	Продукты питания (folder)/Алкогольные напитки/Вино (folder)/Вино	3284583	Inkerman
43716	4820003750162	Вино inkerman Солнце в бокале бел дес.16 % 750мл	22133	Продукты питания (folder)/Алкогольные напитки/Вино (folder)/Вино	3284583	Inkerman
1193279	48204125	Вино inkerman старый нектар бел дес. 750мл	22133	Продукты питания (folder)/Алкогольные напитки/Вино (folder)/Вино	0	
1193280	4820003750117	Вино inkerman старый нектар бел дес. 750мл #2	22133	Продукты питания (folder)/Алкогольные напитки/Вино (folder)/Вино	3284583	Inkerman
43711	4820003750322	Вино inkerman столов красн полусладк древний херсонес (украина) 750мл	22133	Продукты питания (folder)/Алкогольные напитки/Вино (folder)/Вино	3284583	Inkerman
282691	4820003751220	Вино inkerman столов полусухое белое (украина) 750мл	22133	Продукты питания (folder)/Алкогольные напитки/Вино (folder)/Вино	3284583	Inkerman
2227049	4623720857578	Вино inkerman столов полусухое красное 12.5% 750мл ст/б	688533	Продукты питания (folder)/Алкогольные напитки/Вино (folder)/Вина России и ближнего зарубежья	3284583	Inkerman
43709	4820003750032	Вино inkerman столов сух белое алиготе крымское (украина) 750мл	22133	Продукты питания (folder)/Алкогольные напитки/Вино (folder)/Вино	3284583	Inkerman
43710	4820003750230	Вино inkerman столов сух красное бастардо старый Крым (украина) 750мл	22133	Продукты питания (folder)/Алкогольные напитки/Вино (folder)/Вино	3284583	Inkerman
282703	4820003750070	Вино inkerman столов сух красное каберне качинское (украина) 750мл	22133	Продукты питания (folder)/Алкогольные напитки/Вино (folder)/Вино	3284583	Inkerman
43715	4820003750247	Вино inkerman столов сух красное рубин херсонеса (украина) 750мл	22133	Продукты питания (folder)/Алкогольные напитки/Вино (folder)/Вино	3284583	Inkerman
1193281	4820003750155	Вино inkerman тайна херсонеса бел 750мл	22133	Продукты питания (folder)/Алкогольные напитки/Вино (folder)/Вино	3284583	Inkerman
1193282	4820003750124	Вино inkerman Талисман дес. бел 700мл	22133	Продукты питания (folder)/Алкогольные напитки/Вино (folder)/Вино	3284583	Inkerman
1180850	4820003751916	Вино inkerman шардоне белое сухое алк.10-14% 750мл	22133	Продукты питания (folder)/Алкогольные напитки/Вино (folder)/Вино	3284583	Inkerman
1193283	4820003751794	Вино inkerman шардоне качинское бел сух 750мл	22133	Продукты питания (folder)/Алкогольные напитки/Вино (folder)/Вино	3284583	Inkerman
283547	4820003750919	Вино inkerman шардоне качинское бел сух 750мл 10-12% (украина)	22133	Продукты питания (folder)/Алкогольные напитки/Вино (folder)/Вино	3284583	Inkerman
3284591	4623721617461	Вино inkerman шато блан столов белое полусухое 10.5-12.5% 0.7л стекло	22133	Продукты питания (folder)/Алкогольные напитки/Вино (folder)/Вино	3284583	Inkerman
2853657	4623720857516	Вино inkerman шато блан, столов полусухое белое, 12.5%, 750мл ст/б	22133	Продукты питания (folder)/Алкогольные напитки/Вино (folder)/Вино	3284583	Inkerman
2853658	4623721617478	Вино inkerman шато руж столов красное полусухое 10.5-12.5% 0.7л стекло	22133	Продукты питания (folder)/Алкогольные напитки/Вино (folder)/Вино	3284583	Inkerman
1759641	4623720857523	Вино inkerman шато руж столов п/сухое красное 750мл 12%	1759639	Продукты питания (folder)/Алкогольные напитки/Вино (folder)/Вина Украины	0	
3791398	8032754900611	Вино insolia м.монт.бел сух 9-15% 750мл	22133	Продукты питания (folder)/Алкогольные напитки/Вино (folder)/Вино	3791397	INSOLIA
3285151	7804342001472	Вино inspiracion Sauvignon blanc белое сухое категории d.o. 13% 750мл ст/б	22133	Продукты питания (folder)/Алкогольные напитки/Вино (folder)/Вино	3791399	inspiracion
3791400	7804342001465	Вино inspiracion карменер красн сух 750мл	22133	Продукты питания (folder)/Алкогольные напитки/Вино (folder)/Вино	3791399	inspiracion
2853659	4650054792701	Вино interwine 72 столов белое сладкое 13-15% 0.7л стбут	22133	Продукты питания (folder)/Алкогольные напитки/Вино (folder)/Вино	0	
3284592	7791540127151	Вино intis Chardonnay белое сухое 12.5% 750мл ст/б	22133	Продукты питания (folder)/Алкогольные напитки/Вино (folder)/Вино	0	
3284593	7791540090080	Вино intis Merlot Malbec красное 12.5 750мл ст/б	22133	Продукты питания (folder)/Алкогольные напитки/Вино (folder)/Вино	0	
2425096	8016048000317	Вино invetro itg красное сухое 2009г урожая 14% бут 750мл	22133	Продукты питания (folder)/Алкогольные напитки/Вино (folder)/Вино	0	
3791401	8021230052111	Вино inz.piet.Del sole guar. бел сух 750мл	22133	Продукты питания (folder)/Алкогольные напитки/Вино (folder)/Вино	0	
2967216	4860001740383	Вино iosif алазанская Долина красное полусладк 10.5-12.5% 750мл ст/б	282274	Продукты питания (folder)/Алкогольные напитки/Вино (folder)/Вина Грузии	0	
3284594	4860001740406	Вино iosif саперави красное сухое 10-12% 750мл ст/б	282274	Продукты питания (folder)/Алкогольные напитки/Вино (folder)/Вина Грузии	0	
3284595	4860001740413	Вино iosif цинандали белое сухое 10.5-12% 750мл ст/б	282274	Продукты питания (folder)/Алкогольные напитки/Вино (folder)/Вина Грузии	0	
1504397	7804320442273	Вино isl.negr.cab.sauv. красн п/ сух 13% 750мл	78617	Продукты питания (folder)/Алкогольные напитки/Алкоголь	609206	Isla Negra
1193289	7808765706754	Вино isla de pascua совиньон блан белое сухое 13% 750мл ст/б	22133	Продукты питания (folder)/Алкогольные напитки/Вино (folder)/Вино	0	
1659854	7804320184258	Вино isla negra Sauvignon blanc Chardonnay белое п/сух 12.5-13% 750мл ст/б	282291	Продукты питания (folder)/Алкогольные напитки/Вино (folder)/Вина Чили	43724	Исла Негра
2425534	7804320625959	Вино isla negra вест бэй розе розовое п/сух 12% 750мл ст/б	22133	Продукты питания (folder)/Алкогольные напитки/Вино (folder)/Вино	43724	Исла Негра
43725	7804320099880	Вино isla negra каберне совиньон-мерло красное п/сух 12-12.5% 750мл ст/б	282291	Продукты питания (folder)/Алкогольные напитки/Вино (folder)/Вина Чили	43724	Исла Негра
2853669	8437005574052	Вино isla oro tempranillo красное сухое 12.5% 750мл стекло	22133	Продукты питания (folder)/Алкогольные напитки/Вино (folder)/Вино	0	
2853667	8437005574045	Вино isla oro айрен белое сухое 12% 750мл стекло	22133	Продукты питания (folder)/Алкогольные напитки/Вино (folder)/Вино	0	
3287931	8437005574663	Вино isla oro красное сухое 12.5% 750мл ст/б	22133	Продукты питания (folder)/Алкогольные напитки/Вино (folder)/Вино	0	
2853668	8437005574069	Вино isla oro крианса темпранилло сухое красное 13% 750мл ст/б	22133	Продукты питания (folder)/Алкогольные напитки/Вино (folder)/Вино	0	
3284596	8437005574656	Вино isla oro мерло красное сухое 12.5% 750мл стекло	22133	Продукты питания (folder)/Алкогольные напитки/Вино (folder)/Вино	0	
3284597	4860013083232	Вино iveria kindzmarauli красное полусладк 11-12% 750мл ст/б	282274	Продукты питания (folder)/Алкогольные напитки/Вино (folder)/Вина Грузии	0	
3284598	4860038077322	Вино iveriuli тбилиси столов сухое белое 11.5% 0.7л стекло	282274	Продукты питания (folder)/Алкогольные напитки/Вино (folder)/Вина Грузии	0	
3284599	4840044004376	Вино izumrud garling столов белое полусладк 11% 750мл стбут	22133	Продукты питания (folder)/Алкогольные напитки/Вино (folder)/Вино	0	
2424871	4840058002023	Вино j совино бел полусладк 10-12%(Modern) 750мл	22133	Продукты питания (folder)/Алкогольные напитки/Вино (folder)/Вино	0	
46929	7804444001158	Вино j.bouchon carmenere reserva эспесьяль сухое красное 14% 750мл ст/б	282291	Продукты питания (folder)/Алкогольные напитки/Вино (folder)/Вина Чили	46925	J.Bouchon
46930	7804444001240	Вино j.bouchon carmenere syrah reserva красное сухое 14% 750мл ст/б	282291	Продукты питания (folder)/Алкогольные напитки/Вино (folder)/Вина Чили	46925	J.Bouchon
3283856	7804444001684	Вино j.bouchon carmenere syrah reserva красное сухое 14% 750мл ст/б #2	22133	Продукты питания (folder)/Алкогольные напитки/Вино (folder)/Вино	0	
46926	7804444001233	Вино j.bouchon ассамбляж красн сух 13.5% 750мл	282291	Продукты питания (folder)/Алкогольные напитки/Вино (folder)/Вина Чили	46925	J.Bouchon
46928	7804444001172	Вино j.bouchon каберне совиньон красное сухое 750мл 14% ст/б	282291	Продукты питания (folder)/Алкогольные напитки/Вино (folder)/Вина Чили	46925	J.Bouchon
46927	7804444001141	Вино j.bouchon каберне совиньон резерва эспесиаль сухое 14% 750мл	282291	Продукты питания (folder)/Алкогольные напитки/Вино (folder)/Вина Чили	46925	J.Bouchon
1195745	7804444001257	Вино j.bouchon каберне совиньон розе reserva розовое сухое 13.5% 750мл ст/б	282291	Продукты питания (folder)/Алкогольные напитки/Вино (folder)/Вина Чили	0	
46931	7804444001134	Вино j.bouchon мальбек reserva эспесьяль сухое красное 13% 750мл ст/б	282291	Продукты питания (folder)/Алкогольные напитки/Вино (folder)/Вина Чили	46925	J.Bouchon
