ID	UPCEAN	Name	CategoryID	CategoryName	BrandID	BrandName
1685483	4690452007885	Набор посуды дет 3предм котенок по имени гав	1	Неклассифицированные/default	0	
1685484	4690452007878	Набор посуды дет 3предм малыш и карлсон	1	Неклассифицированные/default	0	
1685485	4620003659973	Набор посуды дет 3предм Маша и медведь	1	Неклассифицированные/default	0	
1685486	4620003655111	Набор посуды дет 3предм фиксики	1	Неклассифицированные/default	0	
1685487	4690452007892	Набор посуды дет 3предм чебурашка и крокодил гена	1	Неклассифицированные/default	0	
772576	4814554008926	Набор посуды дет божья коровка 3предм	2420630	Посуда (folder)/Посуда кухонная	0	
772517	4810242110766	Набор посуды детск 3предм . бемби (200.175.200 гл.) 1	2420630	Посуда (folder)/Посуда кухонная	0	
772577	4810242110803	Набор посуды детск 3предм азбука (200.175.200 гл)	2420630	Посуда (folder)/Посуда кухонная	0	
1266231	4810242110681	Набор посуды детск 3предм азбука (200.175.200 гл.) 1	2420630	Посуда (folder)/Посуда кухонная	0	
772578	4810242110827	Набор посуды детск 3предм азбука (200.175.360)	2420630	Посуда (folder)/Посуда кухонная	0	
1266232	4810242110704	Набор посуды детск 3предм азбука (200.175.360) #2	2420630	Посуда (folder)/Посуда кухонная	0	
1266233	4810242110711	Набор посуды детск 3предм азбука (200.175.360) 1	2420630	Посуда (folder)/Посуда кухонная	0	
1266234	4810242110728	Набор посуды детск 3предм далматинцы (200.175.200 гл.) 1	2420630	Посуда (folder)/Посуда кухонная	0	
772579	4810242111022	Набор посуды детск 3предм далматинцы (200.175.360)	2420630	Посуда (folder)/Посуда кухонная	0	
1266235	4810242110742	Набор посуды детск 3предм далматинцы (200.175.360) #2	2420630	Посуда (folder)/Посуда кухонная	0	
772519	4810242110865	Набор посуды детск 3предм лесовичок (200.175.360) 1	2420630	Посуда (folder)/Посуда кухонная	0	
1266236	4810242121236	Набор посуды детск 3предм поиграем (200.175.200 гл) 2	2420630	Посуда (folder)/Посуда кухонная	0	
772580	4810242110889	Набор посуды детск 3предм Прелесть (200.175.200 гл)	2420630	Посуда (folder)/Посуда кухонная	0	
772581	4810242110902	Набор посуды детск 3предм Прелесть (200.175.360) 1	2420630	Посуда (folder)/Посуда кухонная	0	
1266238	4810242119509	Набор посуды детск 3предм пчелы (200.175.200 гл.) 2	2420630	Посуда (folder)/Посуда кухонная	0	
1266239	4810242119585	Набор посуды детск 3предм пчелы (200.175.200 гл.) 2 #2	2420630	Посуда (folder)/Посуда кухонная	0	
1266240	4810242119660	Набор посуды детск 3предм пчелы (200.175.360) 2	2420630	Посуда (folder)/Посуда кухонная	0	
91469	4607141582936	Набор посуды детский	18634	Посуда (folder)/Посуда одноразовая	0	
2959613	4607141582929	Набор посуды детский #2	18634	Посуда (folder)/Посуда одноразовая	0	
3428176	6951119617235	Набор посуды детский #3	1	Неклассифицированные/default	0	
319601	6907070423736	Набор посуды детский bonadi	2420630	Посуда (folder)/Посуда кухонная	309492	BONADI
319602	4814569002025	Набор посуды детский арти-м 3предм	2420630	Посуда (folder)/Посуда кухонная	36881	Арти-М
319603	4607029816986	Набор посуды детский бегемотик	2420630	Посуда (folder)/Посуда кухонная	0	
319604	4607029816962	Набор посуды детский зебренок	2420630	Посуда (folder)/Посуда кухонная	0	
2461575	4810344018502	Набор посуды детский на три персоны	980	Игрушки (folder)/Игрушки	0	
3428177	6904165572720	Набор посуды детский сумка арт.0389ав	1	Неклассифицированные/default	0	
319605	4607029815156	Набор посуды детский я тебя люблю	2420630	Посуда (folder)/Посуда кухонная	0	
3428178	6967336389312	Набор посуды детской	1	Неклассифицированные/default	0	
3428179	6900420480014	Набор посуды детской 4предм	1	Неклассифицированные/default	0	
3428180	6902343700491	Набор посуды детской обеденной gd5240b	1	Неклассифицированные/default	0	
3428181	6904805574961	Набор посуды детской обеденной gd5240b #2	1	Неклассифицированные/default	0	
1685489	4607149275298	Набор посуды джамбо вн1211tf #2	1	Неклассифицированные/default	0	
772582	6950687203567	Набор посуды дисней для детей 3предм ассортим	2420630	Посуда (folder)/Посуда кухонная	0	
772583	8412497314560	Набор посуды для девоч 31456	3536	Хозяйственные товары (folder)/Хозяйственные товары	0	
2249056	4600459092548	Набор посуды для девоч чайная пара милк 6элем	980	Игрушки (folder)/Игрушки	0	
495870	4690434007254	Набор посуды для детей 0835 4предм щенок	2420630	Посуда (folder)/Посуда кухонная	0	
3428182	4606900325333	Набор посуды для детей 3предм	1	Неклассифицированные/default	0	
3428183	4606900395961	Набор посуды для детей 3предм #2	1	Неклассифицированные/default	0	
3428184	4606900396012	Набор посуды для детей 3предм #3	1	Неклассифицированные/default	0	
3428185	4606900191440	Набор посуды для детей 3предм *карусели	1	Неклассифицированные/default	0	
772584	6900004400056	Набор посуды для детей 3предм /ассорт./ elan gallery (44004/5.410095)	2420630	Посуда (folder)/Посуда кухонная	0	
1685490	4690510022119	Набор посуды для детей 3предм /с024-7235-с042-с101-с162/	1	Неклассифицированные/default	0	
3428186	4605423009461	Набор посуды для детей 3предм арт. 3нд01	1	Неклассифицированные/default	0	
772585	4601137002330	Набор посуды для детей 3предм керам (хн 244.245.278) ассортим	2420630	Посуда (folder)/Посуда кухонная	0	
1685491	4606065028520	Набор посуды для детей 3предм Маша и медведь /ассорт./ /CD 02.04/	1	Неклассифицированные/default	0	
1685492	4601137132143	Набор посуды для детей 3предм тар.175см+сал.360г+круж 210мл	1	Неклассифицированные/default	0	
3428187	4606900336360	Набор посуды для детей 4предм	1	Неклассифицированные/default	0	
495871	4606900603929	Набор посуды для детей 9552386 3предм котенок	2420630	Посуда (folder)/Посуда кухонная	0	
495872	4606900603967	Набор посуды для детей 9552393 3предм щенок	2420630	Посуда (folder)/Посуда кухонная	0	
495873	4603001043548	Набор посуды для детей в131-а04858 щенок	2420630	Посуда (folder)/Посуда кухонная	0	
772586	8004360033472	Набор посуды для детей дисней 3предм 6.62580	38328	Посуда (folder)/Посуда столовая, предметы сервировки	38391	Bormioli
772587	8411712752002	Набор посуды для детей том и джерри 3предм 6.62580	38328	Посуда (folder)/Посуда столовая, предметы сервировки	38391	Bormioli
3428188	1060907737378	Набор посуды для завтрака 3предм	1	Неклассифицированные/default	0	
3428189	6973619386527	Набор посуды для кукол чашки с чайником	1	Неклассифицированные/default	0	
772588	8412497310616	Набор посуды для мал 31061	3536	Хозяйственные товары (folder)/Хозяйственные товары	0	
772589	8412497312610	Набор посуды для мал 31261	3536	Хозяйственные товары (folder)/Хозяйственные товары	0	
772590	4607113630818	Набор посуды для окрошки вятская керамика	3536	Хозяйственные товары (folder)/Хозяйственные товары	0	
1713658	4607073270819	Набор посуды для пикник.№3 синий (6 стаканов к-308 6 тарелок s-717)/1 уп/пхт/н-3	1	Неклассифицированные/default	0	
160827	4604691541413	Набор посуды для пикника 4перс в мягком футляре	145188	Спорт и отдых (folder)/Туризм	39575	Техоснастка
2743442	4607049785569	Набор посуды для пикника чезаре на 4перс арт. с68	1	Неклассифицированные/default	0	
289720	4603299040922	Набор посуды для свч 3шт	2420630	Посуда (folder)/Посуда кухонная	0	
289721	4603299104624	Набор посуды для свч 5шт	2420630	Посуда (folder)/Посуда кухонная	0	
319010	4895124426906	Набор посуды для свч Bekker bk-510	309770	Посуда (folder)/Посуда жаропрочная	1207002	Bekker
772591	8693357014473	Набор посуды для свч borcam 2предм	3536	Хозяйственные товары (folder)/Хозяйственные товары	304549	Pasabahce
3428190	8693357192881	Набор посуды для свч боркхам 1л 2л 5л	1	Неклассифицированные/default	0	
495877	4602010007466	Набор посуды для чаепития Box 54x 39см 9992	1367334	Игрушки (folder)/Профессионально-бытовые игровые наборы	0	
1266243	4602010319965	Набор посуды для чаепития, разноцветный, 32x20 x 9см, Box, арт.9798b	1367334	Игрушки (folder)/Профессионально-бытовые игровые наборы	0	
1685494	4602010319958	Набор посуды для чаепития, розовый, 32x20 x 9см, Box, арт.9798a	1367334	Игрушки (folder)/Профессионально-бытовые игровые наборы	0	
772593	4607021011501	Набор посуды дорожный на 3перс (мягк. футляр)	2420630	Посуда (folder)/Посуда кухонная	0	
772594	4607021014601	Набор посуды дуэт 2перс (в футляре) /п5415тх/	2420630	Посуда (folder)/Посуда кухонная	0	
91470	4607021013482	Набор посуды дуэт на 2перс п-54	38328	Посуда (folder)/Посуда столовая, предметы сервировки	39575	Техоснастка
90844	4607030333311	Набор посуды европак Тарелка+стакан 6шт	18634	Посуда (folder)/Посуда одноразовая	39893	Пикник
3428191	4603001081472	Набор посуды ежики детский 3предм	1	Неклассифицированные/default	0	
3428192	4607014716284	Набор посуды жасмин синий	1	Неклассифицированные/default	0	
1264798	4640002753762	Набор посуды забава 4предм	2420630	Посуда (folder)/Посуда кухонная	0	
1266244	4601146401001	Набор посуды завтрак для кукол 21009 плейдорадо	980	Игрушки (folder)/Игрушки	0	
1266245	4820109880251	Набор посуды закусочный однораз 6шт	18634	Посуда (folder)/Посуда одноразовая	0	
2249039	6902014524456	Набор посуды замок 2предм 0.3л ri-rt275b/c-3771-Al	38328	Посуда (folder)/Посуда столовая, предметы сервировки	76586	Ричмонд
495878	4602010011012	Набор посуды и плита в пакете, 21см арт. 808а-1	1367334	Игрушки (folder)/Профессионально-бытовые игровые наборы	0	
495879	4894028854358	Набор посуды из 2-х чашек с блюдцами и ложками на металл подставке роза	38328	Посуда (folder)/Посуда столовая, предметы сервировки	0	
772595	4602063813007	Набор посуды из 3 пред Premier	3536	Хозяйственные товары (folder)/Хозяйственные товары	0	
772596	4601137093864	Набор посуды из 3-х предм. п/у (2017.2018) ассортим	2420630	Посуда (folder)/Посуда кухонная	0	
3428193	6957221217547	Набор посуды из 30предм	1	Неклассифицированные/default	0	
772597	4602063813106	Набор посуды из 4 пред Premier	3536	Хозяйственные товары (folder)/Хозяйственные товары	0	
1685495	6905501774242	Набор посуды из 6чашек с блюдцами 225мл /177424/	1	Неклассифицированные/default	0	
772598	4640000986094	Набор посуды из нерж стали 12	3536	Хозяйственные товары (folder)/Хозяйственные товары	0	
1685496	9120022242118	Набор посуды из нержавеющей стали - kl-4211 (12предм кастрюля с жаропрочной стеклянной крышкой 2.1лкастрюля с жаропрочной стекл	2420630	Посуда (folder)/Посуда кухонная	1660764	Kelli
1265061	9120022242019	Набор посуды из нержавеющей стали 6предм кастрюля с жаропрочной стеклянной крышкой 2лкастрюля с жаропрочной стеклянной крышкой	314257	Посуда (folder)/Кастрюля	1660764	Kelli
1266246	8888883410206	Набор посуды к8925-5	980	Игрушки (folder)/Игрушки	0	
1266247	8888883410121	Набор посуды к8926-2	980	Игрушки (folder)/Игрушки	0	
1262510	4602807578643	Набор посуды калина красная эмалированной	2420630	Посуда (folder)/Посуда кухонная	0	
1266248	8600034079076	Набор посуды картина эксклюзив 6предм	2420630	Посуда (folder)/Посуда кухонная	0	
1782922	8600034054400	Набор посуды кастр.с крыш 1.5+2+3л	2420630	Посуда (folder)/Посуда кухонная	0	
772599	8711295803369	Набор посуды керам 3предм :Тарелка 18см салатник 12см чашка 50мл	323381	Посуда (folder)/Салатник	0	
3428194	1060900258177	Набор посуды керамика 4шт арт wh1914	1	Неклассифицированные/default	0	
495880	4607112099531	Набор посуды керамич. плет.корзина c32403-5	1367334	Игрушки (folder)/Профессионально-бытовые игровые наборы	0	
2901794	8412497463657	Набор посуды керамич.в поисках дори 3предм п/у	1	Неклассифицированные/default	0	
2901795	8412497770557	Набор посуды керамич.миньоны оранжев.3предм п/у	1	Неклассифицированные/default	0	
2901796	8412497467655	Набор посуды керамич.тайная жизнь дом.животн.3предм п/у	1	Неклассифицированные/default	0	
2901797	8412497787685	Набор посуды керамич.холодное сердце.сестры 3предм п/у	1	Неклассифицированные/default	0	
495881	4602010230192	Набор посуды классика в пакете игрушкин 22117	1367334	Игрушки (folder)/Профессионально-бытовые игровые наборы	444289	Игрушкин
3428195	4823077700156	Набор посуды кмк эмаль бытовой кастр 2.0л,3.0л,4.0л бел кон	1	Неклассифицированные/default	0	
3428196	6971108380766	Набор посуды колпак	1	Неклассифицированные/default	0	
3428197	4602807563892	Набор посуды коралловый сталь эмалированная 3предм	1	Неклассифицированные/default	0	
3428198	4603001081526	Набор посуды котенок и щенок детский 4предм	1	Неклассифицированные/default	0	
3428199	4602807004197	Набор посуды красава арт.с-124ап2/4-4 3предм	1	Неклассифицированные/default	0	
91486	6901234568042	Набор посуды красная роза 2предм fr6150-Al	38328	Посуда (folder)/Посуда столовая, предметы сервировки	0	
772600	6903320114973	Набор посуды красный мак 0.1л чашка /d-jy022-2abc-Al/	2420630	Посуда (folder)/Посуда кухонная	0	
495882	4602010230222	Набор посуды кулинар игрушкин 22106	1367334	Игрушки (folder)/Профессионально-бытовые игровые наборы	444289	Игрушкин
772601	4603299193536	Набор посуды кухонной 10предм RW1208-10a	1	Неклассифицированные/default	0	
772602	4603299193505	Набор посуды кухонной 6предм RW1236-6c	1	Неклассифицированные/default	0	
772603	4607006444300	Набор посуды кухонный сервиз волшебная хозяюшка (7 пред) (арт.614)	980	Игрушки (folder)/Игрушки	0	
2249041	4607006445161	Набор посуды кухонный сервиз волшебная хозяюшка 23 прв лукошке +чеснок арт626	980	Игрушки (folder)/Игрушки	439728	Нордпласт
1969227	4607006444263	Набор посуды кухонный сервиз волшебная хозяюшка, (7предм в пакете) 26шт, арт. 610	326170	Посуда (folder)/Сервиз	0	
3428200	4602807564615	Набор посуды лазурит сталь эмалированная 3предм	1	Неклассифицированные/default	0	
2249042	4677765471756	Набор посуды летний луг 2предм im15018b/c-a1895Al	38328	Посуда (folder)/Посуда столовая, предметы сервировки	76841	Имари
1266249	8600034060104	Набор посуды лето эксклюзив 6предм	2420630	Посуда (folder)/Посуда кухонная	0	
1685497	4607061391809	Набор посуды маленькая хозяюшка	980	Игрушки (folder)/Игрушки	0	
3428201	4607153752600	Набор посуды мальвина	1	Неклассифицированные/default	0	
3428202	4607153752549	Набор посуды мальвина №2 12предм	1	Неклассифицированные/default	0	
495883	4602010165838	Набор посуды мальвина №2 12предм гном арт. р6583	1367334	Игрушки (folder)/Профессионально-бытовые игровые наборы	444389	ГНОМ
495884	4602010165852	Набор посуды мальвина №3 18предм гном арт. р6584	1367334	Игрушки (folder)/Профессионально-бытовые игровые наборы	444389	ГНОМ
495885	4602010165821	Набор посуды мальвина №4 10предм гном арт. р6585	1367334	Игрушки (folder)/Профессионально-бытовые игровые наборы	444389	ГНОМ
495886	4602010131765	Набор посуды мальвина №5 12предм гном арт. р6586	1367334	Игрушки (folder)/Профессионально-бытовые игровые наборы	444389	ГНОМ
495887	4602010131741	Набор посуды мальвина №6 24предм гном арт. р6587	1367334	Игрушки (folder)/Профессионально-бытовые игровые наборы	444389	ГНОМ
3428203	4601146402282	Набор посуды малютка игрушкин	1	Неклассифицированные/default	0	
3428204	6438240434523	Набор посуды маруся королевская особа для кукол	1	Неклассифицированные/default	0	
3428205	6438240434677	Набор посуды маруся любовь для кукол	1	Неклассифицированные/default	0	
3428206	6438240434516	Набор посуды маруся сладкая ягодка для кукол	1	Неклассифицированные/default	0	
3428207	6438240434585	Набор посуды маруся спелая ягодка для кукол	1	Неклассифицированные/default	0	
3428208	4690590048771	Набор посуды Маша и медведь nf2886-1	1	Неклассифицированные/default	0	
3428209	4690590014196	Набор посуды Маша и медведь арт b873789-r	1	Неклассифицированные/default	0	
1685498	4605885466789	Набор посуды Маша и медведь арт.6033 14предм в сумке	1	Неклассифицированные/default	0	
3428210	4690590015896	Набор посуды Маша и медведь в797105-r	1	Неклассифицированные/default	0	
2249043	4677765471763	Набор посуды мелисса 2предм im15018b/c-a1901Al	38328	Посуда (folder)/Посуда столовая, предметы сервировки	76841	Имари
2743443	6966193384126	Набор посуды металл /в193-н38412	980	Игрушки (folder)/Игрушки	0	
160828	4606089054581	Набор посуды металл н/к 2293с	980	Игрушки (folder)/Игрушки	0	
2967533	8888881910449	Набор посуды металл н/к 2293с #2	980	Игрушки (folder)/Игрушки	0	
1685499	4991322141075	Набор посуды мидори 10предм ymiset10 яматеру	2420630	Посуда (folder)/Посуда кухонная	1685471	Яматеру
3428211	4607061392998	Набор посуды милк теа	1	Неклассифицированные/default	0	
1969228	6901236984574	Набор посуды мини (9шт в 1 уп./48шт) арт. 8018/698457	1	Неклассифицированные/default	0	
772606	4820122663527	Набор посуды мокко для завтрака 3предм (1591)	2420630	Посуда (folder)/Посуда кухонная	0	
1685500	8412497714001	Набор посуды монстр хай керам.стор	337649	Уход за детьми (folder)/Уход за детьми	1673929	Стор
3428212	4690434017956	Набор посуды морской мир 3предм	1	Неклассифицированные/default	0	
1266250	4409999972354	Набор посуды муха весна сахарница/сливочник	38328	Посуда (folder)/Посуда столовая, предметы сервировки	1186854	Середа
91487	4606048031738	Набор посуды мышата 3предм 017-1286	38328	Посуда (folder)/Посуда столовая, предметы сервировки	0	
2249044	6990000131511	Набор посуды н09 в пакете	2220708	Игрушки (folder)/Tongde	0	
2249045	6990008258920	Набор посуды н10 в пакете	2220708	Игрушки (folder)/Tongde	0	
2249046	6990008259002	Набор посуды н1022 в сумке	2220708	Игрушки (folder)/Tongde	0	
2249047	6990008259019	Набор посуды н1031в сумке	2220708	Игрушки (folder)/Tongde	0	
2249048	6990008258999	Набор посуды н902 в сумке	2220708	Игрушки (folder)/Tongde	0	
91488	4810344020987	Набор посуды на 10перс 49289	38328	Посуда (folder)/Посуда столовая, предметы сервировки	0	
3428213	4660001201071	Набор посуды на 5перс одноразовый маринус	1	Неклассифицированные/default	0	
3428214	4660001201088	Набор посуды на 5перс одноразовый маринус #2	1	Неклассифицированные/default	0	
