ID	UPCEAN	Name	CategoryID	CategoryName	BrandID	BrandName
2227426	3242890001454	Вино фавро пино де шарант бел сл. 750мл	41821	Продукты питания (folder)/Алкогольные напитки/Вино (folder)/Вина Франции	1236513	Фавро
2227427	3242890001478	Вино фавро пино де шарант красн сл. 750мл	41821	Продукты питания (folder)/Алкогольные напитки/Вино (folder)/Вина Франции	1236513	Фавро
3291792	5600202948671	Вино фаина столов сухое белое 10% tetrapak 1л	22133	Продукты питания (folder)/Алкогольные напитки/Вино (folder)/Вино	0	
3291793	5600202948664	Вино фаина столов сухое красное 10% tetrapak 1л	22133	Продукты питания (folder)/Алкогольные напитки/Вино (folder)/Вино	0	
691162	6009613930388	Вино файв хэйрз каберне совиньон 750мл 13% сухое	22133	Продукты питания (folder)/Алкогольные напитки/Вино (folder)/Вино	0	
46747	6009613930722	Вино файв хэйрз мерло красн сух 14.5% 750мл	22133	Продукты питания (folder)/Алкогольные напитки/Вино (folder)/Вино	46746	Файв Хэйрз
46748	6009613930609	Вино файв хэйрз совиньон блан 750мл 14% сухое	22133	Продукты питания (folder)/Алкогольные напитки/Вино (folder)/Вино	46746	Файв Хэйрз
46749	6009613930074	Вино файв хэйрз шардоне бел сух 13.5% 750мл	22133	Продукты питания (folder)/Алкогольные напитки/Вино (folder)/Вино	46746	Файв Хэйрз
691163	6002269000665	Вино файв'с резерв каберне совиньон / мерло 750мл 14% сухое	22133	Продукты питания (folder)/Алкогольные напитки/Вино (folder)/Вино	0	
691164	6002269000689	Вино файв'с резерв мерло розе 750мл 13% сухое	22133	Продукты питания (folder)/Алкогольные напитки/Вино (folder)/Вино	0	
691165	6002269000672	Вино файв'с резерв пинотаж 750мл 14% сухое	22133	Продукты питания (folder)/Алкогольные напитки/Вино (folder)/Вино	0	
691166	6002269000696	Вино файв'с резерв шенен блан 750мл 13% сухое	22133	Продукты питания (folder)/Алкогольные напитки/Вино (folder)/Вино	0	
3291794	8412276488079	Вино файензас белое сухое 11.5% 750мл ст/б	22133	Продукты питания (folder)/Алкогольные напитки/Вино (folder)/Вино	0	
3291795	8412276673758	Вино файензас розовое сухое 12% 750мл ст/б	22133	Продукты питания (folder)/Алкогольные напитки/Вино (folder)/Вино	0	
691167	8022888650018	Вино фалангина дей феуди ди сан грегорио 750мл 0% сухое	22133	Продукты питания (folder)/Алкогольные напитки/Вино (folder)/Вино	0	
2977175	8022888750022	Вино фалангина дей феуди ди сан грегорио 750мл 0% сухое #2	22133	Продукты питания (folder)/Алкогольные напитки/Вино (folder)/Вино	0	
175257	3800009404802	Вино фалерн каберне совиньон красн сух 11-12% 0.75 тоrion	22133	Продукты питания (folder)/Алкогольные напитки/Вино (folder)/Вино	0	
175259	3800009404789	Вино фалерн мавруд красн сух 11-12% 0.75 тоrion	22133	Продукты питания (folder)/Алкогольные напитки/Вино (folder)/Вино	0	
175260	3800009404796	Вино фалерн мерло красн сух 11-12% 0.75 тоrion	22133	Продукты питания (folder)/Алкогольные напитки/Вино (folder)/Вино	0	
46751	4607053045741	Вино фалеско эстмонтефиасконе бел сух 13% 750мл	22470	Продукты питания (folder)/Алкогольные напитки/Вино (folder)/Вина Италии	46750	Фалеско
1958143	4003301038280	Вино фалькенбург дорнфельдер кба нат.красное сухое.750мл	22133	Продукты питания (folder)/Алкогольные напитки/Вино (folder)/Вино	0	
1958144	4003301045349	Вино фалькенбург дорнфельдер кба нат.розовое полусладк 750мл	22133	Продукты питания (folder)/Алкогольные напитки/Вино (folder)/Вино	0	
1951241	3211201046255	Вино фам.каст.кюве де фр. красн сух9-15%750мл	1	Неклассифицированные/default	3794568	ФАМИЛЬ КАСТЕЛЬ
3794569	3211209205852	Вино фам.каст.кюве де фр. красн сух9-15%750мл #2	3615777	Продукты питания (folder)/Алкогольные напитки/Вино (folder)/Вино тихое красное	3794568	ФАМИЛЬ КАСТЕЛЬ
691170	3211209127741	Вино фами кастель мерло красн псух 750мл	41821	Продукты питания (folder)/Алкогольные напитки/Вино (folder)/Вина Франции	691168	Фами Кастель
691171	3211209117841	Вино фами кастель сира гренаж красн полусладк 750мл	41821	Продукты питания (folder)/Алкогольные напитки/Вино (folder)/Вина Франции	691168	Фами Кастель
691172	3211209127659	Вино фами кастель шардоне бел псух 750мл	41821	Продукты питания (folder)/Алкогольные напитки/Вино (folder)/Вина Франции	691168	Фами Кастель
691173	3211209117902	Вино фами кастель шардоне-мускат бел полусладк 750мл	41821	Продукты питания (folder)/Алкогольные напитки/Вино (folder)/Вина Франции	691168	Фами Кастель
3794570	3211209219538	Вино фамиль каст.игр. розов п.с.с.9-15 750мл	3660353	Продукты питания (folder)/Алкогольные напитки/Вино (folder)/Вино игристое розовое	0	
3291796	3211209127864	Вино фамиль кастель кюве де франс vdf бел п сл. 11% 750мл стекло	22133	Продукты питания (folder)/Алкогольные напитки/Вино (folder)/Вино	2081330	Famille Castel
1195639	3211209127895	Вино фамиль кастель кюве де франс vdf крас. п сл. 11.5% 750мл стекло	22133	Продукты питания (folder)/Алкогольные напитки/Вино (folder)/Вино	2081330	Famille Castel
3291797	4630003652140	Вино фамильный погребок белое полусухое 9-11% tetrapak 1.4л	22133	Продукты питания (folder)/Алкогольные напитки/Вино (folder)/Вино	0	
1958145	4630003650634	Вино фамильный погребок Изабелла красн полусладк пэтпак 10-12% 1л	22133	Продукты питания (folder)/Алкогольные напитки/Вино (folder)/Вино	0	
1958146	4630003650641	Вино фамильный погребок каберне красное полусладк 10-12% tetrapak 1л	22133	Продукты питания (folder)/Алкогольные напитки/Вино (folder)/Вино	0	
3291798	4630003652164	Вино фамильный погребок красное полусухое 9-11% tetrapak 1.4л	22133	Продукты питания (folder)/Алкогольные напитки/Вино (folder)/Вино	0	
2855030	8410702045254	Вино фамилья де фелипе бланко бел сух 750мл	22133	Продукты питания (folder)/Алкогольные напитки/Вино (folder)/Вино	0	
2855031	8410702045278	Вино фамилья де фелипе тинто красн сух 750мл	22133	Продукты питания (folder)/Алкогольные напитки/Вино (folder)/Вино	0	
1195640	8429077641008	Вино фан д'оро, 750мл 13.0% сухое	22133	Продукты питания (folder)/Алкогольные напитки/Вино (folder)/Вино	0	
3291811	3416830532029	Вино фан-фан тюльпан красное полусладк 11% 750мл ст/б	22133	Продукты питания (folder)/Алкогольные напитки/Вино (folder)/Вино	0	
3291812	3416830532043	Вино фан-фан тюльпан столов белое полусладк 11% 750мл стбут	22133	Продукты питания (folder)/Алкогольные напитки/Вино (folder)/Вино	0	
3291813	3416830532036	Вино фан-фан тюльпан столов белое сухое 11.5% 750мл стекло	22133	Продукты питания (folder)/Алкогольные напитки/Вино (folder)/Вино	0	
3291814	3416830532012	Вино фан-фан тюльпан столов красное сухое 12% 750мл стбут	22133	Продукты питания (folder)/Алкогольные напитки/Вино (folder)/Вино	0	
3794571	4603040010808	Вино фанаг.крю лерм.рисл. бел сух 750мл	3615781	Продукты питания (folder)/Алкогольные напитки/Вино (folder)/Вино тихое белое	38020	Фанагория
691175	4603040004012	Вино фанагорийская лоза столов полусладк красное 10-12% 0.7л ст/б	688533	Продукты питания (folder)/Алкогольные напитки/Вино (folder)/Вина России и ближнего зарубежья	38020	Фанагория
2226825	4603040010105	Вино фанагория авторское алиготе рислинг белое сухое 12% 0.187л ст/б	22133	Продукты питания (folder)/Алкогольные напитки/Вино (folder)/Вино	0	
2855032	4603040012260	Вино фанагория авторское каб.-саперави. красн сух 750мл #2	22133	Продукты питания (folder)/Алкогольные напитки/Вино (folder)/Вино	0	
3291799	4603040010075	Вино фанагория авторское красное сухое 14% 0.187л ст/б	22133	Продукты питания (folder)/Алкогольные напитки/Вино (folder)/Вино	0	
2855033	4603040011140	Вино фанагория айсвайн каберне красн сл 0.1л	22133	Продукты питания (folder)/Алкогольные напитки/Вино (folder)/Вино	0	
2855034	4603040011164	Вино фанагория айсвайн мускат бел сл 0.1л	22133	Продукты питания (folder)/Алкогольные напитки/Вино (folder)/Вино	0	
691178	4603040009673	Вино фанагория айсвайн мускат бел сл.0.375л туба	688533	Продукты питания (folder)/Алкогольные напитки/Вино (folder)/Вина России и ближнего зарубежья	38020	Фанагория
2427233	4603040010723	Вино фанагория айсвайн рислинг бел сл.0.1л	22133	Продукты питания (folder)/Алкогольные напитки/Вино (folder)/Вино	38020	Фанагория
1660200	4603040010280	Вино фанагория айсвайн рислинг бел сл.0.375л туба #2	688533	Продукты питания (folder)/Алкогольные напитки/Вино (folder)/Вина России и ближнего зарубежья	38020	Фанагория
2855035	4603040011157	Вино фанагория айсвайн саперави красн сл 0.1л	22133	Продукты питания (folder)/Алкогольные напитки/Вино (folder)/Вино	0	
1195642	4603040009109	Вино фанагория айсвайн саперави красн сл.0.375л туба	22133	Продукты питания (folder)/Алкогольные напитки/Вино (folder)/Вино	38020	Фанагория
1660201	4603040010266	Вино фанагория айсвайн саперави красн сл.0.375л туба #2	688533	Продукты питания (folder)/Алкогольные напитки/Вино (folder)/Вина России и ближнего зарубежья	38020	Фанагория
691179	4603040009567	Вино фанагория айсвайн совиньон бел сл.0.375л туба	688533	Продукты питания (folder)/Алкогольные напитки/Вино (folder)/Вина России и ближнего зарубежья	38020	Фанагория
46752	4603040002759	Вино фанагория алиготе столов сухое белое 11-13% 0.7л ст/б	688533	Продукты питания (folder)/Алкогольные напитки/Вино (folder)/Вина России и ближнего зарубежья	38020	Фанагория
2427234	4603040005804	Вино фанагория белый Лекарь белое сладкое 15% 0.7л ст/б	22133	Продукты питания (folder)/Алкогольные напитки/Вино (folder)/Вино	0	
46753	4603040006436	Вино фанагория белый Лекарь белое столов полусладк 9-11% 700мл	688533	Продукты питания (folder)/Алкогольные напитки/Вино (folder)/Вина России и ближнего зарубежья	38020	Фанагория
1958147	4603040007020	Вино фанагория Изабелла красное полусладк tetrapak 2л	22133	Продукты питания (folder)/Алкогольные напитки/Вино (folder)/Вино	0	
3291800	4603040010556	Вино фанагория каберне красное сухое 12-14% 0.375л ст/б	22133	Продукты питания (folder)/Алкогольные напитки/Вино (folder)/Вино	3793842	ФАНАГОРИЯ НОМЕРНОЙ РЕЗЕРВ
171240	4603040007280	Вино фанагория каберне совиньон 1.000л 12% красн сух	688533	Продукты питания (folder)/Алкогольные напитки/Вино (folder)/Вина России и ближнего зарубежья	38020	Фанагория
3291801	4603040010433	Вино фанагория каберне совиньон розовое п/сух 750мл	22133	Продукты питания (folder)/Алкогольные напитки/Вино (folder)/Вино	0	
2227079	4603040006801	Вино фанагория каберне столов сухое красное 11-13% tetrapak 2л	22133	Продукты питания (folder)/Алкогольные напитки/Вино (folder)/Вино	0	
691176	4603040009369	Вино фанагория каберне-саперави авторское крас сухое 750мл стбут	688533	Продукты питания (folder)/Алкогольные напитки/Вино (folder)/Вина России и ближнего зарубежья	38020	Фанагория
150816	4603040003213	Вино фанагория кагор бальзам красн слад ном рез ар бордалеза 750мл	688533	Продукты питания (folder)/Алкогольные напитки/Вино (folder)/Вина России и ближнего зарубежья	38020	Фанагория
46756	4603040002537	Вино фанагория кагор бальзамный красн слад 15% 0.7л Россия	688533	Продукты питания (folder)/Алкогольные напитки/Вино (folder)/Вина России и ближнего зарубежья	38020	Фанагория
46764	4603040007310	Вино фанагория кагор канонический ст красн слад ном рез бордалеза 750мл	688533	Продукты питания (folder)/Алкогольные напитки/Вино (folder)/Вина России и ближнего зарубежья	38020	Фанагория
46758	4603040002551	Вино фанагория кагор красн сл.15% 700мл	688533	Продукты питания (folder)/Алкогольные напитки/Вино (folder)/Вина России и ближнего зарубежья	38020	Фанагория
150854	4603040003343	Вино фанагория кагор фанагории ном резерв спец бордалеза 750мл	688533	Продукты питания (folder)/Алкогольные напитки/Вино (folder)/Вина России и ближнего зарубежья	38020	Фанагория
150948	4603040002957	Вино фанагория коварство и любовь белое полусладк 10-12% 0.7л стбут	688533	Продукты питания (folder)/Алкогольные напитки/Вино (folder)/Вина России и ближнего зарубежья	38020	Фанагория
1659916	4603040003077	Вино фанагория коварство и любовь красное полусладк 10% tetrapak 3л	22133	Продукты питания (folder)/Алкогольные напитки/Вино (folder)/Вино	0	
689992	4603040006450	Вино фанагория коварство и любовь столов белое полусладк 10-12% tetrapak 1л	688533	Продукты питания (folder)/Алкогольные напитки/Вино (folder)/Вина России и ближнего зарубежья	38020	Фанагория
2227146	4603040006849	Вино фанагория коварство и любовь столов красное полусладк 9-12% tetrapak 2л	22133	Продукты питания (folder)/Алкогольные напитки/Вино (folder)/Вино	0	
151735	4603040002841	Вино фанагория красное фанагорийское столов полусладк красное 10-12% 0.7л стекло	688533	Продукты питания (folder)/Алкогольные напитки/Вино (folder)/Вина России и ближнего зарубежья	38020	Фанагория
171243	4603040007136	Вино фанагория ласковые сети красное полусладк tetrapak 1л	688533	Продукты питания (folder)/Алкогольные напитки/Вино (folder)/Вина России и ближнего зарубежья	38020	Фанагория
171242	4603040007143	Вино фанагория ласковые сети столов бел пл сл 12% 1л Россия tetrapak	688533	Продукты питания (folder)/Алкогольные напитки/Вино (folder)/Вина России и ближнего зарубежья	38020	Фанагория
171244	4603040007266	Вино фанагория макабео 1.000л 12% бел полусладк	688533	Продукты питания (folder)/Алкогольные напитки/Вино (folder)/Вина России и ближнего зарубежья	38020	Фанагория
283105	4603040007976	Вино фанагория мускат бархатный столов красн полусладк 750мл	688533	Продукты питания (folder)/Алкогольные напитки/Вино (folder)/Вина России и ближнего зарубежья	38020	Фанагория
171246	4603040007235	Вино фанагория мускат нежный солнечная лоза белое полусладк 10-12% tetrapak 1л	688533	Продукты питания (folder)/Алкогольные напитки/Вино (folder)/Вина России и ближнего зарубежья	38020	Фанагория
3291802	4603040003329	Вино фанагория мускат полусладк белое 750мл ст/б	22133	Продукты питания (folder)/Алкогольные напитки/Вино (folder)/Вино	0	
690944	4603040007792	Вино фанагория мускат столов полусладк бел 2л	688533	Продукты питания (folder)/Алкогольные напитки/Вино (folder)/Вина России и ближнего зарубежья	38020	Фанагория
283166	4603040007655	Вино фанагория мускат янтарн бел полусладк 10-12% 750мл	22133	Продукты питания (folder)/Алкогольные напитки/Вино (folder)/Вино	0	
690489	4603040007969	Вино фанагория мускат янтарный столов бел полусладк бордалеза 750мл	688533	Продукты питания (folder)/Алкогольные напитки/Вино (folder)/Вина России и ближнего зарубежья	38020	Фанагория
3291803	4603040007181	Вино фанагория настоящее вино белое полусладк 10-12% 1л	22133	Продукты питания (folder)/Алкогольные напитки/Вино (folder)/Вино	0	
46763	4603040008850	Вино фанагория номерн.резерв каберне розов п/ сух 12-14% 750мл	688533	Продукты питания (folder)/Алкогольные напитки/Вино (folder)/Вина России и ближнего зарубежья	38020	Фанагория
1195643	4603040010136	Вино фанагория номерн.резерв кагор красн сл.750мл	22133	Продукты питания (folder)/Алкогольные напитки/Вино (folder)/Вино	38020	Фанагория
2855036	4603040012147	Вино фанагория номерн.резерв цимл.черн. красн сух 750мл	22133	Продукты питания (folder)/Алкогольные напитки/Вино (folder)/Вино	3793842	ФАНАГОРИЯ НОМЕРНОЙ РЕЗЕРВ
1195644	4603040009406	Вино фанагория номерной резерв бел полусладк столов 750мл 10-12% /Россия/	22133	Продукты питания (folder)/Алкогольные напитки/Вино (folder)/Вино	3793842	ФАНАГОРИЯ НОМЕРНОЙ РЕЗЕРВ
2227428	4603040009819	Вино фанагория номерной резерв белое сладкое 10% 750мл стекло	22133	Продукты питания (folder)/Алкогольные напитки/Вино (folder)/Вино	0	
1195645	4603040009413	Вино фанагория номерной резерв красн полусладк столов 750мл 11-13% /Россия/	22133	Продукты питания (folder)/Алкогольные напитки/Вино (folder)/Вино	0	
46767	4603040002599	Вино фанагория рубин тамани красн крепл 17% 700мл	688533	Продукты питания (folder)/Алкогольные напитки/Вино (folder)/Вина России и ближнего зарубежья	38020	Фанагория
3291804	4603040009468	Вино фанагория совиньон столов белое сухое 11-13% 1л	22133	Продукты питания (folder)/Алкогольные напитки/Вино (folder)/Вино	0	
2427235	4603040010648	Вино фанагория сотерн совиньон бел сл.0.375л	22133	Продукты питания (folder)/Алкогольные напитки/Вино (folder)/Вино	38020	Фанагория
2427236	460304000401	Вино фанагория фанагорийская лоза красн полусладк 9-11% 0.700	22133	Продукты питания (folder)/Алкогольные напитки/Вино (folder)/Вино	0	
691174	4603040003947	Вино фанагория фанагорийская лоза ст бел полусладк 10-12% 700мл	688533	Продукты питания (folder)/Алкогольные напитки/Вино (folder)/Вина России и ближнего зарубежья	38020	Фанагория
46768	4603040005897	Вино фанагория фанагорийское красн полусладк 10% 700мл	688533	Продукты питания (folder)/Алкогольные напитки/Вино (folder)/Вина России и ближнего зарубежья	38020	Фанагория
691293	4603040007297	Вино фанагория цимлянский черный. номерной резерв столов сухое красное 750мл	688533	Продукты питания (folder)/Алкогольные напитки/Вино (folder)/Вина России и ближнего зарубежья	38020	Фанагория
46769	4603040002834	Вино фанагория черный Лекарь красн полусладк 10% 700мл	688533	Продукты питания (folder)/Алкогольные напитки/Вино (folder)/Вина России и ближнего зарубежья	38020	Фанагория
