ID	UPCEAN	Name	CategoryID	CategoryName	BrandID	BrandName
3688489	3450601016110	L'arbre vert ekologicheskiy an.allergy Natural Aroma con l bo 2l 30	163	Хозяйственные товары (folder)/Бытовая химия (folder)/Средство для стирки	3688483	L'ARBRE VERT (SODALIS GROUP)
3688490	3450601016134	L'arbre vert ekologicheskiy an.allergy Natural Aroma con l hu 2l 30	163	Хозяйственные товары (folder)/Бытовая химия (folder)/Средство для стирки	3688483	L'ARBRE VERT (SODALIS GROUP)
3688491	3450601020377	L'arbre vert u w superconcentrated l 1.25l bo	2260116	Хозяйственные товары (folder)/Бытовая химия (folder)/Средство для мытья полов	3688483	L'ARBRE VERT (SODALIS GROUP)
1915913	3760201940020	L'argentier Cabernet Sauvignon igp pays d'herault glass 750ml	22133	Продукты питания (folder)/Алкогольные напитки/Вино (folder)/Вино	0	
4472709	798929285324	L'art de La mode inc 7 girls coat Black wool&navy trim, stephanie mathews kids	1	Неклассифицированные/default	0	
1520471	8015855001043	L'artig bar choc dk cinn 3.5oz	1	Неклассифицированные/default	0	
1520472	8015855001081	L'artig bar choc dk lic 3.5oz	1	Неклассифицированные/default	0	
1520473	8015855002217	L'artig bar choc dk salt	1	Неклассифицированные/default	0	
254854	3660463002903	L'artisan Ambre Extreme EDP 100ml vapo	4385	Парфюмерия (folder)/Парфюмерная вода	254853	L'artisan Parfumeur
254855	3660463002026	L'artisan Ambre Extreme EDP 50ml vapo	4385	Парфюмерия (folder)/Парфюмерная вода	254853	L'artisan Parfumeur
254856	3660463004358	L'artisan ananas fizz EDT 200ml	1039	Парфюмерия (folder)/Туалетная вода	254853	L'artisan Parfumeur
254857	3660463007830	L'artisan bois farine EDT 100ml vapo.	1039	Парфюмерия (folder)/Туалетная вода	254853	L'artisan Parfumeur
254858	3660463008134	L'artisan bois farine EDT 50ml vapo	1039	Парфюмерия (folder)/Туалетная вода	254853	L'artisan Parfumeur
2350566	3660463020044	L'artisan caligna EDP unisex 100ml	4385	Парфюмерия (folder)/Парфюмерная вода	254853	L'artisan Parfumeur
254860	3660463008899	L'artisan dzongkha EDT 50ml vapo	1039	Парфюмерия (folder)/Туалетная вода	254853	L'artisan Parfumeur
254861	3660463008851	L'artisan fleur de Narcisse EDP 100ml vapo	4385	Парфюмерия (folder)/Парфюмерная вода	254853	L'artisan Parfumeur
254862	3660463007335	L'artisan fou d'absinthe 100ml	1	Неклассифицированные/default	254853	L'artisan Parfumeur
254863	3660463000602	L'artisan int?rieur figuer Home fragance 125 v	1	Неклассифицированные/default	254853	L'artisan Parfumeur
254864	3660463000886	L'artisan int?rieur figuer scented candle	1	Неклассифицированные/default	254853	L'artisan Parfumeur
254865	3660463000985	L'artisan int?rieur figuer scented candle small 35	1	Неклассифицированные/default	254853	L'artisan Parfumeur
2350567	3660463021423	L'artisan l'eau du caporal EDT unisex 100ml	1039	Парфюмерия (folder)/Туалетная вода	254853	L'artisan Parfumeur
254870	3660463007885	L'artisan l'eau EDT 100ml vapo	1039	Парфюмерия (folder)/Туалетная вода	254853	L'artisan Parfumeur
254871	3660463000350	L'artisan l'eau EDT 100ml vapo.	1039	Парфюмерия (folder)/Туалетная вода	254853	L'artisan Parfumeur
254872	3660463008189	L'artisan l'eau EDT 50ml vapo	1039	Парфюмерия (folder)/Туалетная вода	254853	L'artisan Parfumeur
254866	3660463001036	L'artisan La boule d'ambre 100g	1	Неклассифицированные/default	254853	L'artisan Parfumeur
254867	3660463007762	L'artisan La chasse aux papillons EDT 100ml vapo	1039	Парфюмерия (folder)/Туалетная вода	254853	L'artisan Parfumeur
254868	3660463001203	L'artisan La chasse aux papillons EDT 100ml vapo.	1039	Парфюмерия (folder)/Туалетная вода	254853	L'artisan Parfumeur
254869	3660463001197	L'artisan La chasse aux papillons EDT 50ml vapo	1039	Парфюмерия (folder)/Туалетная вода	254853	L'artisan Parfumeur
254878	3660463004457	L'artisan m?re et musc cologne 100 vapo	1	Неклассифицированные/default	254853	L'artisan Parfumeur
254879	3660463001890	L'artisan m?re et musc EDP 100ml vapo	4385	Парфюмерия (folder)/Парфюмерная вода	254853	L'artisan Parfumeur
254881	3660463000138	L'artisan m?re et musc EDT 100ml vapo.	1039	Парфюмерия (folder)/Туалетная вода	254853	L'artisan Parfumeur
254882	3660463000367	L'artisan m?re et musc EDT 250 vapo	1039	Парфюмерия (folder)/Туалетная вода	254853	L'artisan Parfumeur
254884	3660463000022	L'artisan m?re et musc EDT 50ml vapo.	1039	Парфюмерия (folder)/Туалетная вода	254853	L'artisan Parfumeur
254885	3660463000015	L'artisan m?re et musc Extreme EDP 50ml vapo	4385	Парфюмерия (folder)/Парфюмерная вода	254853	L'artisan Parfumeur
254886	3660463000534	L'artisan m?re sauvage EDT 125 vapo Home	1039	Парфюмерия (folder)/Туалетная вода	254853	L'artisan Parfumeur
254887	3660463000824	L'artisan m?re sauvage scented candle	1	Неклассифицированные/default	254853	L'artisan Parfumeur
254888	3660463000923	L'artisan m?re sauvage scented candle small 35g	1	Неклассифицированные/default	254853	L'artisan Parfumeur
254873	3660463007465	L'artisan mandarine EDT 250 vapo luxe	1039	Парфюмерия (folder)/Туалетная вода	254853	L'artisan Parfumeur
254874	3660463000305	L'artisan mechant loup EDT 100ml vapo	1039	Парфюмерия (folder)/Туалетная вода	254853	L'artisan Parfumeur
254875	3660463000121	L'artisan mechant loup EDT 50ml vapo	1039	Парфюмерия (folder)/Туалетная вода	254853	L'artisan Parfumeur
2350568	3660463007694	L'artisan mechant loup EDT homme 100ml	1039	Парфюмерия (folder)/Туалетная вода	254853	L'artisan Parfumeur
254876	3660463000213	L'artisan mimosa pour moi EDT 100ml vapo	1039	Парфюмерия (folder)/Туалетная вода	254853	L'artisan Parfumeur
254877	3660463000077	L'artisan mimosa pour moi EDT 50ml vapo	1039	Парфюмерия (folder)/Туалетная вода	254853	L'artisan Parfumeur
2350569	3660463007731	L'artisan mimosa pour moi EDT femme 100ml	1039	Парфюмерия (folder)/Туалетная вода	254853	L'artisan Parfumeur
2350570	3660463011479	L'artisan Mini refillable spray refillable flacon unisex 4ml	3068	Парфюмерия (folder)/Парфюмерия	254853	L'artisan Parfumeur
2809568	3660463011936	L'artisan mon numero 10 l 3.4 EDP spr	3068	Парфюмерия (folder)/Парфюмерия	0	
254889	3660463000572	L'artisan Parfum de feuille Home fragance 125v	4327	Парфюмерия (folder)/Духи	254853	L'artisan Parfumeur
254890	3660463000855	L'artisan Parfum de feuille scented candle	4327	Парфюмерия (folder)/Духи	254853	L'artisan Parfumeur
254891	3660463000954	L'artisan Parfum de feuille scented candle small	4327	Парфюмерия (folder)/Духи	254853	L'artisan Parfumeur
1836405	3660463012506	L'artisan parfumeur batucada EDT unisex 50ml	1039	Парфюмерия (folder)/Туалетная вода	254853	L'artisan Parfumeur
254859	3660463008905	L'artisan parfumeur dzongkha EDT unisex 100ml	1039	Парфюмерия (folder)/Туалетная вода	254853	L'artisan Parfumeur
1836406	3660463007687	L'artisan parfumeur l?eau d?Ambre EDT women 100ml	1039	Парфюмерия (folder)/Туалетная вода	254853	L'artisan Parfumeur
1836407	3660463008004	L'artisan parfumeur l?eau d?Ambre EDT women 50ml	1039	Парфюмерия (folder)/Туалетная вода	254853	L'artisan Parfumeur
1803235	3660463007649	L'artisan parfumeur l?eau d?Ambre Extreme EDP women 100ml	4385	Парфюмерия (folder)/Парфюмерная вода	254853	L'artisan Parfumeur
1803236	3660463007953	L'artisan parfumeur l?eau d?Ambre Extreme EDP women 50ml	4385	Парфюмерия (folder)/Парфюмерная вода	254853	L'artisan Parfumeur
1836408	3660463009940	L'artisan parfumeur l?ete en douce EDT women 50ml	1039	Парфюмерия (folder)/Туалетная вода	254853	L'artisan Parfumeur
1330397	3660463008066	L'artisan parfumeur La chasse aux papillons EDT women 50ml	1039	Парфюмерия (folder)/Туалетная вода	254853	L'artisan Parfumeur
1803237	3660463011943	L'artisan parfumeur La chasse aux papillons Extreme EDP unisex 100ml	4385	Парфюмерия (folder)/Парфюмерная вода	254853	L'artisan Parfumeur
1280041	3660463007960	L'artisan parfumeur La chasse aux papillons Extreme EDP unisex 50ml	4385	Парфюмерия (folder)/Парфюмерная вода	254853	L'artisan Parfumeur
1836409	3660463008011	L'artisan parfumeur mechant loup EDT men 50ml	1039	Парфюмерия (folder)/Туалетная вода	254853	L'artisan Parfumeur
254880	3660463007663	L'artisan parfumeur mure et musc EDT women 100ml	1039	Парфюмерия (folder)/Туалетная вода	254853	L'artisan Parfumeur
254883	3660463007984	L'artisan parfumeur mure et musc EDT women 50ml	1039	Парфюмерия (folder)/Туалетная вода	254853	L'artisan Parfumeur
1803238	3660463011417	L'artisan parfumeur nuit de tubereuse EDP women 100ml	4385	Парфюмерия (folder)/Парфюмерная вода	254853	L'artisan Parfumeur
1803239	3660463011424	L'artisan parfumeur nuit de tubereuse EDP women 50ml	4385	Парфюмерия (folder)/Парфюмерная вода	254853	L'artisan Parfumeur
4472710	060463007893	L'artisan parfumeur Paris - Premier figuier eau de toilette 100ml	1	Неклассифицированные/default	0	
254896	3660463008110	L'artisan parfumeur patchouli patch EDT women 50ml	1039	Парфюмерия (folder)/Туалетная вода	254853	L'artisan Parfumeur
254899	3660463007892	L'artisan parfumeur Premier figuier EDT women 100ml	1039	Парфюмерия (folder)/Туалетная вода	254853	L'artisan Parfumeur
254901	3660463008196	L'artisan parfumeur Premier figuier EDT women 50ml	1039	Парфюмерия (folder)/Туалетная вода	254853	L'artisan Parfumeur
1803240	3660463007656	L'artisan parfumeur Premier figuier Extreme EDP women 100ml	4385	Парфюмерия (folder)/Парфюмерная вода	254853	L'artisan Parfumeur
1803241	3660463012568	L'artisan parfumeur seville a l?aube EDP unisex 100ml	4385	Парфюмерия (folder)/Парфюмерная вода	254853	L'artisan Parfumeur
254913	3660463008165	L'artisan parfumeur timbuktu EDT unisex 50ml	1039	Парфюмерия (folder)/Туалетная вода	254853	L'artisan Parfumeur
254912	3660463007861	L'artisan parfumeur timbuktu u 3.4 EDT spr (very small qty)	1039	Парфюмерия (folder)/Туалетная вода	254853	L'artisan Parfumeur
1836410	3660463007878	L'artisan parfumeur voleur de roses EDT men 100ml	1039	Парфюмерия (folder)/Туалетная вода	254853	L'artisan Parfumeur
254892	3660463001722	L'artisan passage d'enfer EDT 100ml vapo	1039	Парфюмерия (folder)/Туалетная вода	254853	L'artisan Parfumeur
254893	3660463001715	L'artisan passage d'enfer EDT 50ml vapo	1039	Парфюмерия (folder)/Туалетная вода	254853	L'artisan Parfumeur
254895	3660463002101	L'artisan patch patchouli EDT 100ml vapo.	1039	Парфюмерия (folder)/Туалетная вода	254853	L'artisan Parfumeur
254897	3660463002118	L'artisan patch patchouli EDT 50ml vapo.	1039	Парфюмерия (folder)/Туалетная вода	254853	L'artisan Parfumeur
254894	3660463007816	L'artisan patchouli patch EDT femme 100ml	1039	Парфюмерия (folder)/Туалетная вода	254853	L'artisan Parfumeur
2350571	3660463007915	L'artisan piment brulant EDT unisex 100ml	1039	Парфюмерия (folder)/Туалетная вода	254853	L'artisan Parfumeur
254898	3660463007922	L'artisan poivre piquant EDT 100ml vapo	1039	Парфюмерия (folder)/Туалетная вода	254853	L'artisan Parfumeur
254900	3660463000244	L'artisan Premier figuer EDT 100ml vapo.	1039	Парфюмерия (folder)/Туалетная вода	254853	L'artisan Parfumeur
254902	3660463000107	L'artisan Premier figuer EDT 50ml vapo.	1039	Парфюмерия (folder)/Туалетная вода	254853	L'artisan Parfumeur
254903	3660463002897	L'artisan Premier figuer Extreme EDP 50ml vapo	4385	Парфюмерия (folder)/Парфюмерная вода	254853	L'artisan Parfumeur
254904	3660463008332	L'artisan Premier figuier Gel 150ml	1	Неклассифицированные/default	254853	L'artisan Parfumeur
254905	3660463001081	L'artisan sachet Parfum	4327	Парфюмерия (folder)/Духи	254853	L'artisan Parfumeur
254906	3660463007359	L'artisan safran troublant EDT 50ml vapo	1039	Парфюмерия (folder)/Туалетная вода	254853	L'artisan Parfumeur
254907	3660463000619	L'artisan th? et pain d'epices Home fragance 125v	1	Неклассифицированные/default	254853	L'artisan Parfumeur
254908	3660463001005	L'artisan th? et pain d'epices scented candl small	1	Неклассифицированные/default	254853	L'artisan Parfumeur
254909	3660463000909	L'artisan th? et pain d'epices scented candle	1	Неклассифицированные/default	254853	L'artisan Parfumeur
254910	3660463000312	L'artisan the pour un et? EDT 100ml vapo	1039	Парфюмерия (folder)/Туалетная вода	254853	L'artisan Parfumeur
2350572	3660463007786	L'artisan the pour un ete EDT femme 100ml	1039	Парфюмерия (folder)/Туалетная вода	254853	L'artisan Parfumeur
254911	3660463005317	L'artisan timbuktu EDT 100ml vapo	1039	Парфюмерия (folder)/Туалетная вода	254853	L'artisan Parfumeur
254914	3660463005300	L'artisan timbuktu EDT 50ml vapo.	1039	Парфюмерия (folder)/Туалетная вода	254853	L'artisan Parfumeur
2809569	3660463011752	L'artisan traversee du bosphore l 3.4 EDP spr	3068	Парфюмерия (folder)/Парфюмерия	0	
254915	3660463002156	L'artisan verte violette EDT 100ml vapo	1039	Парфюмерия (folder)/Туалетная вода	254853	L'artisan Parfumeur
254916	3660463008141	L'artisan verte violette EDT 50ml vapo	1039	Парфюмерия (folder)/Туалетная вода	254853	L'artisan Parfumeur
254917	3660463002149	L'artisan verte violette EDT 50ml vapo.	1039	Парфюмерия (folder)/Туалетная вода	254853	L'artisan Parfumeur
254918	3660463000237	L'artisan voleur de roses EDT 100ml vapo	1039	Парфюмерия (folder)/Туалетная вода	254853	L'artisan Parfumeur
254919	3660463000091	L'artisan voleur de roses EDT 50ml vapo	1039	Парфюмерия (folder)/Туалетная вода	254853	L'artisan Parfumeur
1520475	3660463001371	L'artizan amber proucts амбровый шар большой 300г	1	Неклассифицированные/default	1520474	L`ARTIZAN
3688563	3166650953824	L'at.d.v.гермет.гард'в.он/офф+2предм 095382	38328	Посуда (folder)/Посуда столовая, предметы сервировки	0	
3688565	3166650953756	L'atel.du vin шейкер электрический	38328	Посуда (folder)/Посуда столовая, предметы сервировки	0	
3688566	3166650953763	L'atel.du vin штопор гарсон металл 09537	38328	Посуда (folder)/Посуда столовая, предметы сервировки	0	
4473412	3166650951806	L'atelier du vin Soft machine Wine opener	1	Неклассифицированные/default	0	
2165855	892850001364	L'attitude 39 Chardonnay sonoma Coast glass 750ml	22133	Продукты питания (folder)/Алкогольные напитки/Вино (folder)/Вино	0	
2165856	892850001357	L'attitude 39 Pinot Noir los carneros glass 750ml	22133	Продукты питания (folder)/Алкогольные напитки/Вино (folder)/Вино	0	
1520611	4810805000954	L'atuage cosmetic тушь 5d panoramic eyes, т-101. (4) силикон. кисточка	1	Неклассифицированные/default	0	
1520612	4810805000961	L'atuage cosmetic тушь Extreme volume, т-102. 4шт	1	Неклассифицированные/default	0	
1915937	4810805000930	L'atuage cosmetic тушь naturalle look, т-103. 4шт	1	Неклассифицированные/default	0	
1520613	4810805001555	L'atuage cosmetic тушь vertuose effect, т-104. 4шт	1	Неклассифицированные/default	0	
4473597	807581503384	L'auberge espagnole DVD	1	Неклассифицированные/default	0	
4297866	063400050112	L'autentico d'italiano italian style 100% whole Wheat thick slice bread 675g	1	Неклассифицированные/default	0	
2619206	809274147929	L'autentika - La que te arranca La cabez CD 79041479	4093300	Медиа (folder)/Media	0	
2809630	6291100137565	L'aventure femme haramain l 3.4 EDP spr	3068	Парфюмерия (folder)/Парфюмерия	0	
2619305	8437008409764	L'avi arrufi tinto glass 750ml	41484	Продукты питания (folder)/Алкогольные напитки/Вино (folder)/Вина Испании	0	
2165923	719195033259	L'avian plust bean cuisinet 25lb	337596	Товары для животных (folder)/Pets	0	
2165924	7191950330347	L'avian plust bean cuisinet 6/3lb	337596	Товары для животных (folder)/Pets	0	
2165925	7191951210211	L'avian plust canary Food 12/2lb	337596	Товары для животных (folder)/Pets	0	
2165926	719195121253	L'avian plust canary Food 25lb	337596	Товары для животных (folder)/Pets	0	
2165927	7191951890383	L'avian plust chinchilla dust 6/3lb	337596	Товары для животных (folder)/Pets	0	
2165928	7191951880315	L'avian plust chinchilla Food 6/2.5lb	337596	Товары для животных (folder)/Pets	0	
2165929	719195122250	L'avian plust cockatiel Food 25lb	337596	Товары для животных (folder)/Pets	0	
2165930	719195122502	L'avian plust cockatiel Food 50lb	337596	Товары для животных (folder)/Pets	0	
2165931	7191951220425	L'avian plust cockatiel Food 6/4lb	337596	Товары для животных (folder)/Pets	0	
2165932	719195126258	L'avian plust cockatiel Food no sunflower 25lb	337596	Товары для животных (folder)/Pets	0	
2165933	7191951260575	L'avian plust cockatiel Food no sunflower 6/5lb	337596	Товары для животных (folder)/Pets	0	
2165934	719195218069	L'avian plust cuttlebone 6-8inch 5lb	337596	Товары для животных (folder)/Pets	0	
2165935	719195183206	L'avian plust ferret Food 20lb	337596	Товары для животных (folder)/Pets	0	
2165936	7191951830747	L'avian plust ferret Food 6/3.5lb	337596	Товары для животных (folder)/Pets	0	
2165937	7191951230257	L'avian plust finch Food 12/2lb	337596	Товары для животных (folder)/Pets	0	
2165938	719195123257	L'avian plust finch Food 25lb	337596	Товары для животных (folder)/Pets	0	
2165939	7191951820779	L'avian plust gerbil Food 6/5lb	337596	Товары для животных (folder)/Pets	0	
2165940	719195184401	L'avian plust guinea pig Food 40lb	337596	Товары для животных (folder)/Pets	0	
2165941	7191951840715	L'avian plust guinea pig Food 6/5lb	337596	Товары для животных (folder)/Pets	0	
2165942	719195194141	L'avian plust guinea pig treat 14oz	337596	Товары для животных (folder)/Pets	0	
2165943	719195185507	L'avian plust hamster Food 50lb	337596	Товары для животных (folder)/Pets	0	
2165944	7191951850783	L'avian plust hamster Food 6/5lb	337596	Товары для животных (folder)/Pets	0	
2165945	719195191065	L'avian plust hamster/gerbil treat 6oz	337596	Товары для животных (folder)/Pets	0	
2165946	7191952130549	L'avian plust millet sprays 12/5oz	337596	Товары для животных (folder)/Pets	0	
2165947	719195213101	L'avian plust millet sprays 25lb	337596	Товары для животных (folder)/Pets	0	
2165948	719195213064	L'avian plust millet sprays 5lb	337596	Товары для животных (folder)/Pets	0	
2165949	7191951240225	L'avian plust parakeet Food 12/2lb	337596	Товары для животных (folder)/Pets	0	
2165950	719195124254	L'avian plust parakeet Food 25lb	337596	Товары для животных (folder)/Pets	0	
2165951	719195124506	L'avian plust parakeet Food 50lb	337596	Товары для животных (folder)/Pets	0	
2165952	719195022208	L'avian plust parrot 33 Fruit nut&veggie 20lb	337596	Товары для животных (folder)/Pets	0	
2165953	719195125206	L'avian plust parrot Food 20lb	337596	Товары для животных (folder)/Pets	0	
2165954	7191951250361	L'avian plust parrot Food 6/3lb	337596	Товары для животных (folder)/Pets	0	
2165955	719195127255	L'avian plust parrot Food no sunflower 25lb	337596	Товары для животных (folder)/Pets	0	
2165956	7191951270475	L'avian plust parrot Food no sunflower 6/4lb	337596	Товары для животных (folder)/Pets	0	
2165957	719195001234	L'avian plust premium cockatiel fun treat 3oz	337596	Товары для животных (folder)/Pets	0	
2165958	719195003832	L'avian plust premium crunch&fun parrot treat 13oz	337596	Товары для животных (folder)/Pets	0	
2165959	719195003436	L'avian plust premium guinea pig fun treat 3oz	337596	Товары для животных (folder)/Pets	0	
2165960	719195003139	L'avian plust premium hamster/gerbil fun treat 3oz	337596	Товары для животных (folder)/Pets	0	
2165961	719195001432	L'avian plust premium parakeet fun treat 3oz	337596	Товары для животных (folder)/Pets	0	
2165962	719195001531	L'avian plust premium parrot fun treat 3oz	337596	Товары для животных (folder)/Pets	0	
2165963	719195003733	L'avian plust premium rabbit fun treat 3oz	337596	Товары для животных (folder)/Pets	0	
2165964	719195187204	L'avian plust rabbit Food 20lb	337596	Товары для животных (folder)/Pets	0	
2165965	7191951870729	L'avian plust rabbit Food 6/5lb	337596	Товары для животных (folder)/Pets	0	
2165966	719195197135	L'avian plust rabbit treat 13oz	337596	Товары для животных (folder)/Pets	0	
2165967	719195228204	L'avian plust Tropical parrot Food 20lb	337596	Товары для животных (folder)/Pets	0	
2165968	719195005256	L'avian plust tropiktreett for cockatiels 25lb	337596	Товары для животных (folder)/Pets	0	
2165969	719195005201	L'avian plust tropiktreett for cockatiels 5.5oz	337596	Товары для животных (folder)/Pets	0	
2165970	719195005416	L'avian plust tropiktreett for large parrots 14oz	337596	Товары для животных (folder)/Pets	0	
2165971	719195005317	L'avian plust tropiktreett for parrots 14oz	337596	Товары для животных (folder)/Pets	0	
2165972	719195005355	L'avian plust tropiktreett for parrots 20lb	337596	Товары для животных (folder)/Pets	0	
2350936	8011607030637	L'azur Mini rossetto Lip Gloss	1	Неклассифицированные/default	0	
1521322	689423002893	L'chaim Fruit snacks - strawberry	1	Неклассифицированные/default	2588792	L Chaim
1521323	689423002923	L'chaim Fruit snacks - variety	1	Неклассифицированные/default	2588792	L Chaim
4474745	883515446088	L'chayim - to Life - rosh hashanah card	1	Неклассифицированные/default	0	
3689162	4610012492753	L'coffee ароматизатор подвесной кофе (апельсин с шоколадом)	3948159	Эксплуатация и ремонт автомобилей/Ароматизатор автомобильный	0	
3689163	4610012492814	L'coffee ароматизатор подвесной кофе (капучино)	3948159	Эксплуатация и ремонт автомобилей/Ароматизатор автомобильный	0	
3689164	4610012492739	L'coffee ароматизатор подвесной кофе (карамель)	3948159	Эксплуатация и ремонт автомобилей/Ароматизатор автомобильный	0	
3689165	4610012492791	L'coffee ароматизатор подвесной кофе (мандарин)	3948159	Эксплуатация и ремонт автомобилей/Ароматизатор автомобильный	0	
3689166	4610012490056	L'coffee ароматизатор подвесной кофе lc-001 капучино 10/40	3948159	Эксплуатация и ремонт автомобилей/Ароматизатор автомобильный	0	
3689167	4610012490094	L'coffee ароматизатор подвесной кофе lc-002 вишня с миндалем 10/40	3948159	Эксплуатация и ремонт автомобилей/Ароматизатор автомобильный	0	
3689168	4610012490070	L'coffee ароматизатор подвесной кофе lc-003 мёд с молоком 10/40	3948159	Эксплуатация и ремонт автомобилей/Ароматизатор автомобильный	0	
