ID	UPCEAN	Name	CategoryID	CategoryName	BrandID	BrandName
3376164	4600648166364	Акконд крекер калейдоскоп улыбок 300г	316470	Продукты питания (folder)/Крекер	2431628	Акконд
3778014	4600648574480	Акконд набор карам.капелька жев.микс 150г	37145	Продукты питания (folder)/Кондитерские изделия (folder)/Карамель	2431628	Акконд
3774789	4600648571687	Акконд набор конд.нов.под.№57 заб.реб.400г	271328	Товары для праздников (folder)/Подарок новогодний	3774788	ZABAVNYE REBYATA (AKKOND/CHEBOKSARY)
3775493	4600648573667	Акконд набор нов.под.№11/зернушка туб.300г	271328	Товары для праздников (folder)/Подарок новогодний	3775492	ZERNUSHKA (AKKOND/CHEBOKSARY)
3765153	4600648573537	Акконд набор нов.под.№4/улыб.зимы чем.300г	271328	Товары для праздников (folder)/Подарок новогодний	3765151	ULYBKA ZIMY (AKKOND/CHEBOKSARY)
3753806	4600648573544	Акконд набор нов.под.№5/созв.улыбок 350г	271328	Товары для праздников (folder)/Подарок новогодний	3753805	SOZVEZDIE ULYBOK
3778015	4600648157492	Акконд печенье кренделек 280г	21865	Продукты питания (folder)/Кондитерские изделия (folder)/Печенье	2431628	Акконд
3778016	4600648571694	Акконд подар.зима новог.№52 300г	22145	Продукты питания (folder)/Кондитерские изделия (folder)/Конфеты	2431628	Акконд
3778017	4600648571748	Акконд подар.сладк.домик новог.№50 300	22145	Продукты питания (folder)/Кондитерские изделия (folder)/Конфеты	2431628	Акконд
3778018	4600648571755	Акконд подар.феерверк новог.№51 300г	22145	Продукты питания (folder)/Кондитерские изделия (folder)/Конфеты	2431628	Акконд
3778020	4600648566676	Акконд подарок бант новогодний 285г	271328	Товары для праздников (folder)/Подарок новогодний	2431628	Акконд
3778021	4600648574428	Акконд подарок морозк.сны нов.№58 500г	271328	Товары для праздников (folder)/Подарок новогодний	2431628	Акконд
3778022	4600648569509	Акконд подарок новогодние шары №30 500г	271328	Товары для праздников (folder)/Подарок новогодний	2431628	Акконд
3778023	4600648574985	Акконд подарок сказоч.домик №52 под.200г	271328	Товары для праздников (folder)/Подарок новогодний	2431628	Акконд
3778019	4600648570123	Акконд подарок №32 дом деда мороза 700г	271328	Товары для праздников (folder)/Подарок новогодний	2431628	Акконд
2938287	4610006940147	Акконд творог от красули классич.5% 200г	38969	Продукты питания (folder)/Молочные продукты (folder)/Творог и творожные	2431628	Акконд
3778024	4600648190420	Акконд тортинка Плюс 250г	25	Продукты питания (folder)/Кондитерские изделия (folder)/Вафли	2431628	Акконд
2221018	6852122323260	Аккордеон	980	Игрушки (folder)/Игрушки	0	
2417335	6927060637172	Аккордеон #2	980	Игрушки (folder)/Игрушки	0	
3260302	6900120539692	Аккордеон 20233	1	Неклассифицированные/default	0	
2221020	6852122323277	Аккордеон в коробке	980	Игрушки (folder)/Игрушки	0	
2221021	6852122323253	Аккордеон в коробке 107-272	980	Игрушки (folder)/Игрушки	0	
2221022	6852122323239	Аккордеон в коробке 218-270	980	Игрушки (folder)/Игрушки	0	
672870	6990816174085	Аккордеон играем вместе	980	Игрушки (folder)/Игрушки	0	
440954	4602010242799	Аккордеон розовый pvc 19x15 x 5см арт.20133	440953	Игрушки (folder)/Игрушка музыкальный инструмент	0	
2221023	4034541002250	Аккузид 10/12.5 мгтабл. п/о n 10x3 до 01.10.16	1	Неклассифицированные/default	0	
440955	4034541001840	Аккузид табл покр обол 10мг №30	210391	Лекарственные средства (folder)/Лекарственные средства	0	
440956	4034541001857	Аккузид табл покр обол 20мг №30	210391	Лекарственные средства (folder)/Лекарственные средства	0	
440957	4034541002311	Аккузид табл покр обол плен 20мг+12.5мг х30	210391	Лекарственные средства (folder)/Лекарственные средства	0	
309161	4034541002304	Аккузид табл покр обол плен 20мг+25мг х30	210391	Лекарственные средства (folder)/Лекарственные средства	0	
1180677	4602010307245	Аккум квадроцикл желтый, арт. zp5118-3.	470295	Игрушки (folder)/Каталка детская	0	
1180678	4602010307191	Аккум квадроцикл красный арт. zp5118-4	470295	Игрушки (folder)/Каталка детская	0	
1180679	4602010336641	Аккум квадроцикл, арт. zp5353b	470295	Игрушки (folder)/Каталка детская	0	
1180692	4602010249361	Аккум машина Mini голубая, арт. hd6879	470295	Игрушки (folder)/Каталка детская	0	
1180681	4602010307207	Аккум машина для катания ,арт. zp5051a-3.	470295	Игрушки (folder)/Каталка детская	0	
1180682	4602010307214	Аккум машина для катания с дист. упр. арт. zp-v001-3	470295	Игрушки (folder)/Каталка детская	0	
1180680	4602010307184	Аккум машина для катания, 2 вида ,арт.6199	470295	Игрушки (folder)/Каталка детская	0	
1180683	4602010307238	Аккум машина для катания, с дист. упр. арт.zp-v003-1.	470295	Игрушки (folder)/Каталка детская	0	
1180676	4602010163964	Аккум машина с MP3 ,103x62.5x54.5см,арт. qx-7133	470295	Игрушки (folder)/Каталка детская	0	
440959	4602010163933	Аккум мото 78x48 x 48см с бол. фарой, classical style ,красн арт.au305	337649	Уход за детьми (folder)/Уход за детьми	0	
440960	4602010163940	Аккум мото 82x48 x 57см с бол. фарой ,стекл. и зеркал police арт.au308	337649	Уход за детьми (folder)/Уход за детьми	0	
1180684	4602010145854	Аккум мото police Max с мигалк.,черн/красн, zp2019-4	470295	Игрушки (folder)/Каталка детская	0	
1180685	4602010146189	Аккум мото police с мигалк., бордов., zp9991-4	470295	Игрушки (folder)/Каталка детская	0	
1180686	4602010145700	Аккум мото, синий, zp9998-3	470295	Игрушки (folder)/Каталка детская	0	
440968	4602010259353	Аккум мото. police с багаж.,мигалк., 2цв, арт.7398	337649	Уход за детьми (folder)/Уход за детьми	0	
440971	4602010253047	Аккум мото.251	337649	Уход за детьми (folder)/Уход за детьми	0	
1180687	4602010307252	Аккум мотоцикл Red Hawk арт. zp5008-3	470295	Игрушки (folder)/Каталка детская	0	
1180689	4602010307276	Аккум мотоцикл, красный арт. zp5019-3	470295	Игрушки (folder)/Каталка детская	0	
1180690	4602010163957	Аккум на радупр космич.машина, светящ.,120x65 x 60см,серая,арт.7166a	470295	Игрушки (folder)/Каталка детская	0	
440961	4895136008053	Аккум. мотоцикл милиция, белый, с фарой арт. вв0805	337649	Уход за детьми (folder)/Уход за детьми	439738	Bondibon
440962	4895136008046	Аккум. мотоцикл милиция, белый, с фарой, арт. вв0804	337649	Уход за детьми (folder)/Уход за детьми	439738	Bondibon
1180688	4895136008091	Аккум. мотоцикл пожарная служба, красный, с багажниками, мигалкой, фарой, арт. вв0809	470295	Игрушки (folder)/Каталка детская	439738	Bondibon
440963	4895136008077	Аккум. мотоцикл пожарная служба, красный, с фарой, арт. вв0807	337649	Уход за детьми (folder)/Уход за детьми	439738	Bondibon
440964	4895136008084	Аккум. мотоцикл пожарная служба, красный, с фарой, арт. вв0808	337649	Уход за детьми (folder)/Уход за детьми	439738	Bondibon
2417337	4210201383741	Аккум.з.щvitality precisioncleanкоробd12.013	1	Неклассифицированные/default	0	
1180691	4895136002839	Аккум.квадроцикл с багажником, арт.628	470295	Игрушки (folder)/Каталка детская	439738	Bondibon
440965	4895136002877	Аккум.машина джип police, арт.688	337649	Уход за детьми (folder)/Уход за детьми	439738	Bondibon
440966	4895136002853	Аккум.машина джип арт.678	337649	Уход за детьми (folder)/Уход за детьми	439738	Bondibon
440967	4895136002846	Аккум.машина с прозрачным капотом, арт. 668	337649	Уход за детьми (folder)/Уход за детьми	439738	Bondibon
1180693	4895136002792	Аккум.мото. police с багаж.,мигалк.(панель 4звука, поворотн.), арт.2126a	470295	Игрушки (folder)/Каталка детская	439738	Bondibon
440969	4895136002785	Аккум.мото. police с багаж.,мигалк.(панель 4звука, поворотн.,ключ зажиг.и др.), арт.2126	337649	Уход за детьми (folder)/Уход за детьми	439738	Bondibon
1180694	4895136002808	Аккум.мото. с багаж.(панель 4звука, поворотн.), арт.2136	470295	Игрушки (folder)/Каталка детская	439738	Bondibon
440970	4895136002815	Аккум.мото. с багажником, арт. 236	337649	Уход за детьми (folder)/Уход за детьми	439738	Bondibon
1180695	4895136002822	Аккум.мото. с багажником, арт. 238	470295	Игрушки (folder)/Каталка детская	439738	Bondibon
3260303	4895156815846	Аккум.пластик.фонарь supra sfl-plr-1l	1	Неклассифицированные/default	0	
2714278	4627100961220	Аккумулятор 3cott 3c-12120, 12 в, 12 ач	4219	Техника (folder)/Электротехника/Батарейки и аккумуляторы	2714277	3Cott
2714279	4627100961237	Аккумулятор 3cott 3c-12180, 12 в, 18 ач	4219	Техника (folder)/Электротехника/Батарейки и аккумуляторы	2714277	3Cott
2714280	4627100961190	Аккумулятор 3cott 3c-1245, 12 в, 4.5 ач	4219	Техника (folder)/Электротехника/Батарейки и аккумуляторы	2714277	3Cott
2714281	4627100961206	Аккумулятор 3cott 3c-1270, 12 в, 7 ач	4219	Техника (folder)/Электротехника/Батарейки и аккумуляторы	2714277	3Cott
2714282	4627100961213	Аккумулятор 3cott 3c-1290, 12 в, 9 ач	4219	Техника (folder)/Электротехника/Батарейки и аккумуляторы	2714277	3Cott
2714283	4627100961183	Аккумулятор 3cott 3c-645, 6 в, 4.5 ач	4219	Техника (folder)/Электротехника/Батарейки и аккумуляторы	2714277	3Cott
280292	4891199101410	Аккумулятор 40bvh-cr2 GP/2бл/10 для слуховых аппаратов 2шт	4219	Техника (folder)/Электротехника/Батарейки и аккумуляторы	148411	GP
672871	7393173061620	Аккумулятор 6f22 170 ma minamoto 1бл/10	4219	Техника (folder)/Электротехника/Батарейки и аккумуляторы	1720196	Minamoto
672872	7393173062429	Аккумулятор 6f22 250ma minamoto ni-mh bl-1	4219	Техника (folder)/Электротехника/Батарейки и аккумуляторы	1720196	Minamoto
2714284	6934522412765	Аккумулятор 6v 4.5h/4.3 h для a250-h01005,a250-h01016,a250-h01025,a250-h0102,a250-h01026,a250-h08047	4219	Техника (folder)/Электротехника/Батарейки и аккумуляторы	0	
3260304	790920128358	Аккумулятор abro smf-110 90а к/к	4219	Техника (folder)/Электротехника/Батарейки и аккумуляторы	2713932	ABRO
3260305	790920122943	Аккумулятор abro smf-750 65а к/к	4219	Техника (folder)/Электротехника/Батарейки и аккумуляторы	2713932	ABRO
440972	4607117455233	Аккумулятор acmepower en-el11 (3.7v, min 600mah, li-ion, аналог pentax d-li78) nikon en-el11/pentax d-li78	4219	Техника (folder)/Электротехника/Батарейки и аккумуляторы	0	
440973	4607117456186	Аккумулятор acmepower lp-e6 (7.4v, min 1500mah, li-ion) для canon eos 5d mark ii/ eos 7d New	4219	Техника (folder)/Электротехника/Батарейки и аккумуляторы	0	
440974	4607117455073	Аккумулятор acmepower np-140 (7.2v 1100mah, li-ion) для fujifilm np-140	4219	Техника (folder)/Электротехника/Батарейки и аккумуляторы	0	
440975	4607117450108	Аккумулятор acmepower np-40 (3.7v, min 700mah, li-ion) fuji np-40/pan s004e/pen d-li8/sam slb-0737/0837/klic-7005/km-np1	4219	Техника (folder)/Электротехника/Батарейки и аккумуляторы	0	
672873	4607117452034	Аккумулятор acmepower np-bg1 (3.6v 1000mah, li-ion) sony dsc-h9/h7/h3/t100/t25/t20/n2/n1/w200/w90/w85/w80/w55/w35	4219	Техника (folder)/Электротехника/Батарейки и аккумуляторы	0	
672874	4607117455622	Аккумулятор acmepower np-f970 (7.2v 7000mah, li-ion) для sony ccd-tr1100/ tr208/ tr3000/ tr3100/ tr3200/ tr3300/ tr411/	4219	Техника (folder)/Электротехника/Батарейки и аккумуляторы	0	
672875	4607117453734	Аккумулятор acmepower np-fh50 (7.4 v 800 mah, li-ion) для sony dcr-DVD105/ DVD106/ DVD108/ DVD109/ DVD205/ DVD305/ DVD308	4219	Техника (folder)/Электротехника/Батарейки и аккумуляторы	0	
440976	4607117451280	Аккумулятор acmepower s006E (7.2v 800mah, li-ion) для Panasonic fz/ fz50/fz7	4219	Техника (folder)/Электротехника/Батарейки и аккумуляторы	39118	Panasonic
440977	4607117451235	Аккумулятор acmepower vf733 (7.2v 3000mah, li-ion) jvc (bn-vf733/vf714/vf707)	4219	Техника (folder)/Электротехника/Батарейки и аккумуляторы	0	
2417338	4250175821061	Аккумулятор agfaphoto hr06 AA 2100 в2	4219	Техника (folder)/Электротехника/Батарейки и аккумуляторы	0	
2417339	4250175821078	Аккумулятор agfaphoto hr06 AA 2100 в2 #2	4219	Техника (folder)/Электротехника/Батарейки и аккумуляторы	0	
225676	4013674030101	Аккумулятор ansmann (mh800AAA)	4219	Техника (folder)/Электротехника/Батарейки и аккумуляторы	225675	ANSMANN
225677	4013674030477	Аккумулятор ansmann 2100AA 5030472	4219	Техника (folder)/Электротехника/Батарейки и аккумуляторы	225675	ANSMANN
225680	4013674003297	Аккумулятор ansmann 800AA (nc800AA)	4219	Техника (folder)/Электротехника/Батарейки и аккумуляторы	225675	ANSMANN
225678	4013674307227	Аккумулятор ansmann AA 2600mah nimh	4219	Техника (folder)/Электротехника/Батарейки и аккумуляторы	225675	ANSMANN
672876	4013674030835	Аккумулятор ansmann AAA 950mah nimh	4219	Техника (folder)/Электротехника/Батарейки и аккумуляторы	225675	ANSMANN
225681	4013674982028	Аккумулятор ansmann maxe AAA5030982/02 bl	4219	Техника (folder)/Электротехника/Батарейки и аккумуляторы	225675	ANSMANN
1180696	4013674352227	Аккумулятор ansmann R03 nimh 1100 mah	4219	Техника (folder)/Электротехника/Батарейки и аккумуляторы	225675	ANSMANN
225682	4013674030897	Аккумулятор ansmann R03 professional (1000 mah) (2 бл) (2/24) 5200	4219	Техника (folder)/Электротехника/Батарейки и аккумуляторы	225675	ANSMANN
2417340	4013674035236	Аккумулятор ansmann R03 professional (1100 mah) (4 бл) (4/48) 11445	4219	Техника (folder)/Электротехника/Батарейки и аккумуляторы	0	
1180697	4013674350827	Аккумулятор ansmann R06 nimh 2850 mah	4219	Техника (folder)/Электротехника/Батарейки и аккумуляторы	225675	ANSMANN
2417341	4013674030644	Аккумулятор ansmann R20 (10000 mah) (2 бл) (2/12) 6292	4219	Техника (folder)/Электротехника/Батарейки и аккумуляторы	0	
2417342	4013674030859	Аккумулятор ansmann r6 professional (2700 mah) (2 бл) (2/24) 10499	4219	Техника (folder)/Электротехника/Батарейки и аккумуляторы	0	
225679	4013674352128	Аккумулятор ansmann r6 professional (2850 mah) (4 бл) (4/48) 6484	4219	Техника (folder)/Электротехника/Батарейки и аккумуляторы	225675	ANSMANN
672877	4013674030330	Аккумулятор ansmann крона 250mah nimh	4219	Техника (folder)/Электротехника/Батарейки и аккумуляторы	225675	ANSMANN
672878	4260030254033	Аккумулятор arcas ni-mn R03 micro	4219	Техника (folder)/Электротехника/Батарейки и аккумуляторы	0	
2417343	873999001309	Аккумулятор Camelion 6f22 (крона 250 мah) (ni-mh) (1 бл) (1/12/240) 5014	4219	Техника (folder)/Электротехника/Батарейки и аккумуляторы	226050	Camelion
1180698	873999003044	Аккумулятор Camelion c-028 (t-107) 3bmu 600mah bl2 3.6v	4219	Техника (folder)/Электротехника/Батарейки и аккумуляторы	0	
1180699	873999003075	Аккумулятор Camelion c-326 (c-110) 3bmu 600mah 3.6v (аналог GP t110)	4219	Техника (folder)/Электротехника/Батарейки и аккумуляторы	0	
1180700	8739990022427	Аккумулятор Camelion cr20-32	4219	Техника (folder)/Электротехника/Батарейки и аккумуляторы	0	
3260306	873999001132	Аккумулятор Camelion ni-mh AA-2500mah bl-2 пальчиковый	4219	Техника (folder)/Электротехника/Батарейки и аккумуляторы	226050	Camelion
1180701	873999004720	Аккумулятор Camelion R03 nimh 800 mah bl2 alwaysready	4219	Техника (folder)/Электротехника/Батарейки и аккумуляторы	0	
1180702	873999003020	Аккумулятор Camelion t-110 3bmu 1300mah 3.6v	4219	Техника (folder)/Электротехника/Батарейки и аккумуляторы	0	
1655451	4894128018148	Аккумулятор cs AA-pb2nc3b AA-pb2nc6 AA-pb2nc6b (4400mah) для Samsung m60 aura t5450 chartiz, np-R40 Plus	4219	Техника (folder)/Электротехника/Батарейки и аккумуляторы	159110	Samsung
1655452	4894128018841	Аккумулятор cs AA-pb5nc6b (4400mah) для Samsung np-q35, np-q45, np-q70	4219	Техника (folder)/Электротехника/Батарейки и аккумуляторы	159110	Samsung
1655453	4894128031505	Аккумулятор cs AA-pb9nc6b (4400mah) для Samsung np-q318, R510, R710	4219	Техника (folder)/Электротехника/Батарейки и аккумуляторы	159110	Samsung
1655454	4894128032441	Аккумулятор cs as09d31 lc.btp00.052 (6600mah) для Acer Aspire 3810, Aspire 4810	4219	Техника (folder)/Электротехника/Батарейки и аккумуляторы	0	
672883	4894128028703	Аккумулятор cs bcf10 (3.7 v 940mah, li-ion) для Panasonic fx-40/ fx-550/ fx-58/ ft-1/ fs-25/ fs-6	4219	Техника (folder)/Электротехника/Батарейки и аккумуляторы	39118	Panasonic
672884	4894128004615	Аккумулятор cs bn-vf714 ly34647-002b (2200mah, 7.4v) для jvc gr-d290ah, gr-d275, gr-d250us	4219	Техника (folder)/Электротехника/Батарейки и аккумуляторы	0	
672885	4894128004677	Аккумулятор cs bn-vf733 ly34647-002b (3300mah, 7.4v) для jvc gr-d240, gr-d246, gr-d247	4219	Техника (folder)/Электротехника/Батарейки и аккумуляторы	0	
672887	4894128032113	Аккумулятор cs bp-808 (7.4v 890mah, li-ion) для canon fs10 fs100 fs11 fs40 fs400	4219	Техника (folder)/Электротехника/Батарейки и аккумуляторы	0	
672888	4894128006022	Аккумулятор cs bp-90 bp-l40a bp-l60 (4400mah) для sony hdw-790wsp, dsr-300pk, dsr-250	4219	Техника (folder)/Электротехника/Батарейки и аккумуляторы	0	
1655455	4894128011965	Аккумулятор cs btp-amj1 btp-anj1 (4400mah) для Acer Aspire 2920, Aspire 3620	4219	Техника (folder)/Электротехника/Батарейки и аккумуляторы	0	
672889	4894128005810	Аккумулятор cs casio np-20 np-20dba (650mah, 3.7v) для casio exilim ex-s1pm, exilim ex-s770rd, exilim ex-m20	4219	Техника (folder)/Электротехника/Батарейки и аккумуляторы	229640	Casio
672890	4894128004974	Аккумулятор cs cga-du06 cga-du07 (750mah, 7.4v) для Panasonic pv-gs19, vdr-d100eb-s, nv-gs230eb-s	4219	Техника (folder)/Электротехника/Батарейки и аккумуляторы	39118	Panasonic
672891	4894128005490	Аккумулятор cs en-el10 / li-40b/42b (660mah, 3.7v) для nikon coolpix s600, coolpix s700, coolpix s60, olympus mju-700/ m	4219	Техника (folder)/Электротехника/Батарейки и аккумуляторы	0	
672892	4894128039228	Аккумулятор cs en-el19 (3.7 v, 600 ma, li-ion) для nikon coolpix s2500, nikon coolpix s2550, nikon coolpix s3100, nikon	4219	Техника (folder)/Электротехника/Батарейки и аккумуляторы	0	
672893	4894128005032	Аккумулятор cs en-el3E (1500mah, 7.4v) для nikon d100 slr, dslr d700, d50	4219	Техника (folder)/Электротехника/Батарейки и аккумуляторы	0	
672894	4894128005056	Аккумулятор cs en-el5 (3.7v 1200mah, li-ion) для nikon cp3700/4200/5200/5900/7900/p3/p4/s10/p5000/p5100/p6000/p90	4219	Техника (folder)/Электротехника/Батарейки и аккумуляторы	0	
672895	4894128005070	Аккумулятор cs en-el9 en-el9a (1000mah, 7.4v) для nikon dslr-d40, dslr-d40a, dslr-d40c	4219	Техника (folder)/Электротехника/Батарейки и аккумуляторы	0	
1655456	4894128017219	Аккумулятор cs gd761 kd476 0ud260 (4400mah) для dell inspiron 1501, inspiron 6400, vostro 1000	4219	Техника (folder)/Электротехника/Батарейки и аккумуляторы	0	
1655457	4894128027942	Аккумулятор cs GP975 gw252 hp297 (4400mah) для dell inspiron 1525, dell inspiron 1545	4219	Техника (folder)/Электротехника/Батарейки и аккумуляторы	0	
1655458	4894128032366	Аккумулятор cs hstnn-i17c hstnn-xb89 513130-321 (4400mah) для hp Mini 5101, Mini 5102	4219	Техника (folder)/Электротехника/Батарейки и аккумуляторы	0	
1655459	4894128038061	Аккумулятор cs hstnn-ib51 451085-141 (4400mah) для hp 550, business notebook 6720s	4219	Техника (folder)/Электротехника/Батарейки и аккумуляторы	0	
1655460	4894128037286	Аккумулятор cs hstnn-ib89 hstnn-i60c-5 (4400mah) для hp probook 4510s, probook 4515s	4219	Техника (folder)/Электротехника/Батарейки и аккумуляторы	0	
