ID	UPCEAN	Name	CategoryID	CategoryName	BrandID	BrandName
3128324	072036714909	Harris teeter zesty italian dressing	330591	Продукты питания (folder)/Продукты питания	2598209	Harris Teeter
3128325	072036240231	Harris teeter ziti,enriched macaroni product	24086	Продукты питания (folder)/Макароны	2598209	Harris Teeter
3128326	072036883773	Harris teeter zucchini spiral noodles	330591	Продукты питания (folder)/Продукты питания	2598209	Harris Teeter
3128327	072036884039	Harris teeter zucchini spiral noodles #2	330591	Продукты питания (folder)/Продукты питания	2598209	Harris Teeter
4408058	072036110725	Harris teeter, diet ginger ale, 12-can pack 144floz	1	Неклассифицированные/default	2598209	Harris Teeter
3126658	072036639981	Harris tetter reduced fat 2% Milk 128floz	330591	Продукты питания (folder)/Продукты питания	2598209	Harris Teeter
1488301	725274029808	Harris' farmer's almanac	1	Неклассифицированные/default	0	
4408059	079894006252	Harrisburg dairies	1	Неклассифицированные/default	0	
4408060	079894434840	Harrisburg dairies inc the all-time greatest hits of roy orbison cassette	1	Неклассифицированные/default	0	
4408061	079894001363	Harrisburg dairies vitamin d whole Milk	1	Неклассифицированные/default	0	
3126633	079894002391	Harrisburg dairies, cultured whole buttermilk	330591	Продукты питания (folder)/Продукты питания	0	
4408062	079894006818	Harrisburg daries southern brewed tea 16oz	1	Неклассифицированные/default	0	
4408063	070609961644	Harrisburg pa 1ct	1	Неклассифицированные/default	0	
4408064	700689880930	Harrison	1	Неклассифицированные/default	0	
4408065	700689881937	Harrison #2	1	Неклассифицированные/default	0	
4408066	638713290083	Harrison cottage girl votive	1	Неклассифицированные/default	0	
4408067	020021532847	Harrison county popcorn co. 2ct chiquita veg tray/2ct 48oz	1	Неклассифицированные/default	0	
4408068	020021200210	Harrison county popcorn co. 48oz chiquita vegetables	1	Неклассифицированные/default	0	
4408069	080084022020	Harrison farms 1lb fleur de lis crawfish Tail	1	Неклассифицированные/default	0	
4408070	097361231242	Harrison ford triple feature (DVD) (3discs)	1	Неклассифицированные/default	0	
4408071	022891443995	Harrison g-beatle in benton il (DVD)	1	Неклассифицированные/default	0	
4408072	724354410499	Harrison g-Dark horse years 1976-1992 DVD	1	Неклассифицированные/default	0	
4408074	827912017182	Harrison g-George harrison-music video Box documentary (DVD)	1	Неклассифицированные/default	0	
4408075	884088145231	Harrison g-rhythmic horizons (DVD)	1	Неклассифицированные/default	0	
4408073	094637027622	Harrison George-living in the material world (CD with DVD)	1	Неклассифицированные/default	0	
4408076	803281140089	Harrison house productions - a division of tri corp. 1.9oz Lip Stick mixer melts by tyler candle company	1	Неклассифицированные/default	0	
4408077	051933136120	Harrison select Dry roasted peanuts 16oz	1	Неклассифицированные/default	0	
2598232	073490153884	Harrison's Original sweet shoppe, Fruit slices, Raspberry, Orange&Lemon	1	Неклассифицированные/default	2598230	Harrisons Sweet Shoppe
2598233	073490154256	Harrison's Original sweet shoppe, Fruit smiles candies, Raspberry, Orange, Lime&Lemon	1	Неклассифицированные/default	2598230	Harrisons Sweet Shoppe
4408078	031398214069	Harrisons flowers (DVD) (ws/eng/2.0)	1	Неклассифицированные/default	0	
2598231	073490154263	Harrisons sweet shoppe choc chip	1	Неклассифицированные/default	2598230	Harrisons Sweet Shoppe
2598234	073490153877	Harrisons sweet shoppe jelly ring choc cvrd	1	Неклассифицированные/default	2598230	Harrisons Sweet Shoppe
2598235	073490154133	Harrisons sweet shoppe mashmallow Twist	1	Неклассифицированные/default	2598230	Harrisons Sweet Shoppe
2598236	073490154201	Harrisons sweet shoppe soda 4pk citrus Mist	1	Неклассифицированные/default	2598230	Harrisons Sweet Shoppe
2598237	073490154188	Harrisons sweet shoppe soda 4pk cola	1	Неклассифицированные/default	2598230	Harrisons Sweet Shoppe
2598238	073490154249	Harrisons sweet shoppe soda 4pk Cream	1	Неклассифицированные/default	2598230	Harrisons Sweet Shoppe
2598239	073490154225	Harrisons sweet shoppe soda 4pk Orange	1	Неклассифицированные/default	2598230	Harrisons Sweet Shoppe
2598241	603256810104	Harrisons&crosfield Organic Classic earl grey tea 20 English style tea bags	1	Неклассифицированные/default	2598240	Harrisons & Crosfield
2598242	603256810159	Harrisons&crosfield Organic hearty scottish breakfast tea 20 English style tea bags	1	Неклассифицированные/default	2598240	Harrisons & Crosfield
2598243	603256810128	Harrisons&crosfield Organic serene Green tea 20 English style tea bags	1	Неклассифицированные/default	2598240	Harrisons & Crosfield
2598244	603256810111	Harrisons&crosfield Organic traditional English breakfast tea 20 English style tea bags	1	Неклассифицированные/default	2598240	Harrisons & Crosfield
4408083	604619046574	Harrod's Milk chocolate pastilles 120g	1	Неклассифицированные/default	0	
4408079	604619217448	Harrods 20 tea bags empire Blend 50g	1	Неклассифицированные/default	0	
603450	604619401045	Harrods English breakfast 125g	1	Неклассифицированные/default	0	
4408080	604619288189	Harrods heritage shortbread biscuits in tin 200g	1	Неклассифицированные/default	0	
4408081	604619288202	Harrods heritage stem ginger biscuits in tin 200g	1	Неклассифицированные/default	0	
4408082	604619259707	Harrods knightsbridge teddy bear shaped Butter biscuits flavoured with vanilla	1	Неклассифицированные/default	0	
3670127	4650061722913	Harrogate c i 0.33l bo j ts	17388	Продукты питания (folder)/Напитки безалкогольные/Вода питьевая	3670126	Harrogate
3670128	5060042350308	Harrogate c i 0.33l bo j ts #2	17388	Продукты питания (folder)/Напитки безалкогольные/Вода питьевая	3670126	Harrogate
3670129	5060042350124	Harrogate c i 0.33l bo p ts	17388	Продукты питания (folder)/Напитки безалкогольные/Вода питьевая	3670126	Harrogate
4408084	797776062393	Harrogate distillery LTD t/a whittaker\'s gin 500ml whittaker\'s gin	1	Неклассифицированные/default	0	
4408085	797776062386	Harrogate distillery LTD t/a whittaker\'s gin 700ml whittaker\'s gin	1	Неклассифицированные/default	0	
3670130	4650061722920	Harrogate s i 0.33l bo j ts	17388	Продукты питания (folder)/Напитки безалкогольные/Вода питьевая	3670126	Harrogate
3670131	5060042350117	Harrogate s i 0.33l bo p ts	17388	Продукты питания (folder)/Напитки безалкогольные/Вода питьевая	3670126	Harrogate
3670134	5060042350407	Harrogate s i 1l bo p ts	17388	Продукты питания (folder)/Напитки безалкогольные/Вода питьевая	3670126	Harrogate
4408086	19518008	Harrogate spa mineral Water	1	Неклассифицированные/default	0	
3670133	5060042351244	Harrogate вода минеральная пит.негаз.10л	17388	Продукты питания (folder)/Напитки безалкогольные/Вода питьевая	3670126	Harrogate
48670	5060042350025	Harrogate спа вода минер.природ.газ 0.33л	48140	Продукты питания (folder)/Напитки безалкогольные/Вода минеральная	48669	Харрогейт
48673	5060042350018	Harrogate спа вода минер.природ.негаз 0.33л	48140	Продукты питания (folder)/Напитки безалкогольные/Вода минеральная	48669	Харрогейт
48675	5060042350087	Harrogate спа вода минер.природ.негаз 1.5л	48140	Продукты питания (folder)/Напитки безалкогольные/Вода минеральная	48669	Харрогейт
4408087	988029107040	Harrow, nancy - you never know CD	1	Неклассифицированные/default	0	
1488305	9781843485421	Harrow/wembley map	205408	Полиграфия (folder)/Книги	0	
603451	7891035524332	Harrpichygiene pine 2x 26g	1	Неклассифицированные/default	0	
4408088	780994695566	Harry and david	1	Неклассифицированные/default	0	
4408089	780994692503	Harry and david 1.5oz Harry&david Royal riviera Original recipe pear chips	1	Неклассифицированные/default	0	
4408090	780994629516	Harry and david 10oz moose munch - caramel, cashew, almond popcorn	1	Неклассифицированные/default	0	
4408091	780994668997	Harry and david 11.5oz 326g Harry and david pepper&onion relish	1	Неклассифицированные/default	0	
4408092	780994713581	Harry and david 20oz moose munch	1	Неклассифицированные/default	0	
603464	780994654440	Harry and david 2oz /56g Harry and david de luxe Dark chocolate moose munch bar	1	Неклассифицированные/default	603452	Harry and David
4408093	780994699540	Harry and david 32floz (1qt.) (946ml) Apple martini Mix	1	Неклассифицированные/default	0	
4408094	780994697225	Harry and david 4.4oz Harry and david steak&mixed grill	1	Неклассифицированные/default	0	
4408095	780994716049	Harry and david 4.5oz c-h&d mose mnch cnfctn chc&ch	1	Неклассифицированные/default	0	
4408096	780994713567	Harry and david 4.5oz c-h&d peppermint malt balls	1	Неклассифицированные/default	0	
603485	780994700147	Harry and david 4.5oz Harry and david truffles: Dark chocolate	1	Неклассифицированные/default	0	
4408097	780994604551	Harry and david 453g Harry and david bing Cherry chocolates	1	Неклассифицированные/default	0	
4408098	780994722767	Harry and david 5lb 11oz gourmet snack basket	1	Неклассифицированные/default	0	
4408099	780994728240	Harry and david 5lb Box Harry and david: Organic Royal riviera pears	1	Неклассифицированные/default	0	
4408100	780994619272	Harry and david 5oz Honey roasted peanuts	1	Неклассифицированные/default	0	
4408101	780994692138	Harry and david 6oz c-Harry&david pepmint bark	1	Неклассифицированные/default	0	
603483	780994699502	Harry and david Blueberry chocolates Box	1	Неклассифицированные/default	0	
4408102	65308462	Harry and david cachepot, strawberry White	1	Неклассифицированные/default	0	
603453	780994650107	Harry and david caramel cashew&almond moose munch Box 10oz	1	Неклассифицированные/default	603452	Harry and David
603454	780994649965	Harry and david choc bing Cherry Box 8oz	1	Неклассифицированные/default	603452	Harry and David
603455	780994649972	Harry and david choc Blueberry Box 8oz	1	Неклассифицированные/default	603452	Harry and David
603456	780994699472	Harry and david choc cherries impulse Box 4.5oz	1	Неклассифицированные/default	603452	Harry and David
4408103	780994684386	Harry and david chocolate eyeballs 200g	1	Неклассифицированные/default	0	
603457	780994650091	Harry and david Dark chocolate moose munch Box 10oz	1	Неклассифицированные/default	603452	Harry and David
603458	780994650015	Harry and david Dark chocolate truffle Box 8oz	1	Неклассифицированные/default	603452	Harry and David
603484	7809946534401	Harry and david Dark moosemunch bar	1	Неклассифицированные/default	0	
603461	780994674158	Harry and david Milk chocolate maca moose munch Box 10oz	1	Неклассифицированные/default	603452	Harry and David
603462	780994650084	Harry and david Milk chocolate moose munch Box 10oz	1	Неклассифицированные/default	603452	Harry and David
4408104	780994653061	Harry and david Milk chocolate raisins 12oz	1	Неклассифицированные/default	0	
603463	780994650008	Harry and david Milk chocolate truffle Box 8oz	1	Неклассифицированные/default	603452	Harry and David
603459	780994742345	Harry and david Mini Dark chocolate moose munch bars Box 4oz	1	Неклассифицированные/default	603452	Harry and David
603460	780994742741	Harry and david Mini Milk chocolate moose munch bars Box 4oz	1	Неклассифицированные/default	603452	Harry and David
4408105	780994666153	Harry and david Mini mints	1	Неклассифицированные/default	0	
603486	780994700130	Harry and david Mini truffles Milk Box	1	Неклассифицированные/default	0	
603465	780994699410	Harry and david moose munch Dark impulse Box 4.5oz	1	Неклассифицированные/default	603452	Harry and David
603466	780994654457	Harry and david moose munch Milk chocolate bar 2oz	1	Неклассифицированные/default	603452	Harry and David
603467	780994699380	Harry and david moose munch mk impulse Box 4.5oz	1	Неклассифицированные/default	603452	Harry and David
4408106	780994736962	Harry and david net wt 4oz	1	Неклассифицированные/default	0	
603468	780994650022	Harry and david Raspberry truffle Box 8oz	1	Неклассифицированные/default	603452	Harry and David
4408107	780994735996	Harry and david truffles, Milk chocolate, 12oz	1	Неклассифицированные/default	0	
4408108	025195003506	Harry and the hendersons	1	Неклассифицированные/default	0	
4408109	697020120148	Harry b higley&sons inc Glow plug tap	1	Неклассифицированные/default	0	
4408110	873666336024	Harry barker, inc 24 foot extension ladder	1	Неклассифицированные/default	0	
2598245	7619943784309	Harry belafonte - lean on me CD plan7843	2275105	Медиа (folder)/Медиа	0	
2598246	8717423038412	Harry belafonte - scarlet ribbons CD bb2211	2275105	Медиа (folder)/Медиа	0	
2598247	7619943784200	Harry belafonte - smoke gets in your Eye CD plan7842	2275105	Медиа (folder)/Медиа	0	
2598249	634041130831	Harry brand harissa - jar 6x 210g	1	Неклассифицированные/default	2598248	Harry Brand
2598250	634041130848	Harry brand harissa - squeezy bottle 6x 195g	1	Неклассифицированные/default	2598248	Harry Brand
2332724	5060346830018	Harry brompton's alcoholic London Ice tea 24x 275ml	17371	Продукты питания (folder)/Напитки безалкогольные/Напитки	2332723	Harry Bromptons
375804	5060052418753	Harry brown DVD	1	Неклассифицированные/default	0	
3131403	079303016186	Harry c. wenzel sons inc 1lb wenzel's Farm sausage	330591	Продукты питания (folder)/Продукты питания	0	
4408111	634404740127	Harry chapin / the bottom Line encore collection (CD)	1	Неклассифицированные/default	0	
4408112	081227610623	Harry chapin short stories CD	1	Неклассифицированные/default	0	
2598251	074644916898	Harry conik - the New york big band conc DVD 491689	2275105	Медиа (folder)/Медиа	0	
2598252	886971110722	Harry connick, jr. when my heart finds christmas CD	1	Неклассифицированные/default	2519025	Sony Music
603469	021795015123	Harry Dark chocolate fondue	1	Неклассифицированные/default	0	
4408113	4071800000763	Harry das volle korn	1	Неклассифицированные/default	0	
2598253	5300010010378	Harry el sucio - pelicula 1001037	2275105	Медиа (folder)/Медиа	0	
3128328	813715013230	Harry hopalot	330591	Продукты питания (folder)/Продукты питания	0	
3128329	813715013643	Harry hopalot White chocolate egg	330591	Продукты питания (folder)/Продукты питания	0	
4408114	022891206590	Harry knuckles&the pearl necklace (DVD)	1	Неклассифицированные/default	0	
603470	5027952005926	Harry l/l Hot Dog rolls 4s	1	Неклассифицированные/default	0	
4408115	736899113629	Harry langdon collection (DVD) (lost&found)	1	Неклассифицированные/default	0	
4408116	021795008736	Harry londan Dark chocolate Orange baton 1.4oz	1	Неклассифицированные/default	0	
603473	021795016441	Harry London buckeye 4 piece sleeve 1.9oz	1	Неклассифицированные/default	603472	Harry London
2598254	021795003946	Harry London candy bark bite raspbrry	1	Неклассифицированные/default	603472	Harry London
2598255	077420002297	Harry London candy peppermint bark bul	1	Неклассифицированные/default	603472	Harry London
603474	021795003694	Harry London cappucino biscotti joys gable Box 5.5oz	1	Неклассифицированные/default	603472	Harry London
2598256	021795800071	Harry London caramel Soft	1	Неклассифицированные/default	603472	Harry London
2598257	021795003915	Harry London choc hldy gble bx dsp 60p	1	Неклассифицированные/default	603472	Harry London
2598258	021795800088	Harry London choc meltaway pnut btr	1	Неклассифицированные/default	603472	Harry London
2598259	021795800057	Harry London choc mint	1	Неклассифицированные/default	603472	Harry London
2598260	021795003847	Harry London choc mrchndzr gable 60pcs	1	Неклассифицированные/default	603472	Harry London
2598261	021795800064	Harry London choc truffle Raspberry	1	Неклассифицированные/default	603472	Harry London
2598262	021795800095	Harry London chocolate bar frnch vnla mocha	1	Неклассифицированные/default	603472	Harry London
4408117	021795513018	Harry London chocolate peppermint bark	1	Неклассифицированные/default	0	
603475	021795003717	Harry London Milk crispy joys gable Box 5.5oz	1	Неклассифицированные/default	603472	Harry London
603476	021795003724	Harry London Milk pretzel joys gable Box 5.5oz	1	Неклассифицированные/default	603472	Harry London
603477	021795040200	Harry London mint bar 1.762oz	1	Неклассифицированные/default	603472	Harry London
603478	021795003700	Harry London mint cookie joys gable Box 5.5oz	1	Неклассифицированные/default	603472	Harry London
603479	021795003816	Harry London Peanut Butter crispy joys gable Box 5.5oz	335590	Продукты питания (folder)/Масло ореховое	603472	Harry London
603480	021795003731	Harry London White pretzel joys gable Box 5.5oz	1	Неклассифицированные/default	603472	Harry London
3128330	731427450290	Harry London, artisan caramel with mayan sea salt, Dark chocolate	330591	Продукты питания (folder)/Продукты питания	0	
3128331	021795220688	Harry London, biscotti clusters, Milk chocolate	330591	Продукты питания (folder)/Продукты питания	0	
3128332	021795220619	Harry London, Dark chocolate lava cake truffles	330591	Продукты питания (folder)/Продукты питания	0	
3128333	021795220695	Harry London, pretzel clusters, Milk chocolate	330591	Продукты питания (folder)/Продукты питания	0	
4408118	794080235048	Harry monkey 16oz	1	Неклассифицированные/default	0	
1011092	035995952867	Harry p clctbl	1	Неклассифицированные/default	0	
1011093	074299427848	Harry p&the sor	1	Неклассифицированные/default	0	
1011094	742818140317	Harry p/b booster	1	Неклассифицированные/default	0	
1011095	074299431500	Harry p/c s/c Game	1	Неклассифицированные/default	0	
4408119	5030930031190	Harry poo	1	Неклассифицированные/default	0	
1011096	015012667332	Harry potte v/card	1	Неклассифицированные/default	0	
4408120	011200000394	Harry potter	1	Неклассифицированные/default	0	
4408121	074299427534	Harry potter - quidditch Game	1	Неклассифицированные/default	0	
2598263	7796356914940	Harry potter - y el prisionero de azkaba pelicula DVD914940	2275105	Медиа (folder)/Медиа	0	
2598264	085391184720	Harry potter - y La camara secreta blu ray hsbr118472	2275105	Медиа (folder)/Медиа	0	
2598265	7796356977655	Harry potter - y La camara secreta pelicula DVD977655	2275105	Медиа (folder)/Медиа	0	
2598266	7796356915138	Harry potter - y las reliquias de La mue pelicula DVD915138	2275105	Медиа (folder)/Медиа	0	
4408122	085391169840	Harry potter 1-5 gift set (br-DVD/ws/LTD/12 disc/Game/cards/bookmark coll)	1	Неклассифицированные/default	0	
1748445	082686053747	Harry potter accessories kit	980	Игрушки (folder)/Игрушка	0	
4408123	074299526718	Harry potter Action figure: invisibility cloak Harry	1	Неклассифицированные/default	0	
4408124	978155192478	Harry potter and prisoner of azkaban	1	Неклассифицированные/default	0	
4408125	085391173649	Harry potter and the chamber of secrets (DVD/ws/4 collectors cards)	1	Неклассифицированные/default	0	
4408126	085391169543	Harry potter and the chamber of secrets DVD	1	Неклассифицированные/default	0	
4408127	691508929766	Harry potter and the deathly hallows	1	Неклассифицированные/default	0	
3822548	9780545010221	Harry potter and the deathly hallows (book 7) ...	205408	Полиграфия (folder)/Книги	0	
4408128	9780739360385	Harry potter and the deathly hallows [audioboo...	1	Неклассифицированные/default	0	
4408129	012569809963	Harry potter and the goblet of fire	1	Неклассифицированные/default	0	
4408130	012569841345	Harry potter and the goblet of fire #2	1	Неклассифицированные/default	0	
4408131	708449139595	Harry potter and the goblet of fire #3	1	Неклассифицированные/default	0	
4408132	9325336028872	Harry potter and the goblet of fire #4	1	Неклассифицированные/default	0	
4408133	085391156925	Harry potter and the goblet of fire (br-DVD/ws-2.40)	1	Неклассифицированные/default	0	
4408134	012569764545	Harry potter and the goblet of fire (hd-DVD/ws-2.40)-nla	1	Неклассифицированные/default	0	
1011097	014633149883	Harry potter and the goblet of fire (psp Game)	1351406	Медиа (folder)/Компьютерные игры	0	
4408135	076783069954	Harry potter and the goblet of fire (unabridged audio book)	1	Неклассифицированные/default	0	
4408136	7321900593885	Harry potter and the goblet of fire DVD year 4	1	Неклассифицированные/default	0	
4408137	014633156133	Harry potter and the Half blood prince (360)	1	Неклассифицированные/default	0	
4408138	085391200413	Harry potter and the Half blood prince blu-ray	1	Неклассифицированные/default	0	
4408139	3760062463393	Harry potter and the Half-blood prince	1	Неклассифицированные/default	0	
4408140	7321902174921	Harry potter and the order of the pheonix	1	Неклассифицированные/default	0	
4408141	691508925706	Harry potter and the order of the phoenix	1	Неклассифицированные/default	0	
4408142	708449358064	Harry potter and the order of the phoenix #2	1	Неклассифицированные/default	0	
4408143	085391156949	Harry potter and the order of the phoenix (br-DVD)	1	Неклассифицированные/default	0	
4408144	014633153330	Harry potter and the order of the phoenix (nintendo ds, 2007)	1	Неклассифицированные/default	0	
4408145	014633155310	Harry potter and the order of the phoenix (nintendo wii)	1	Неклассифицированные/default	0	
4408146	014633154054	Harry potter and the order of the phoenix (playstation 2, 2007)	1	Неклассифицированные/default	0	
4408147	146331557780	Harry potter and the order of the phoenix (xbox 360, 2007)	1	Неклассифицированные/default	0	
1488306	012569593251	Harry potter and the order of the phoenix DVD warner studios	1	Неклассифицированные/default	0	
1488307	012569593268	Harry potter and the order of the phoenix DVD wide screen - warner studios	1	Неклассифицированные/default	0	
4408148	014633167474	Harry potter and the order of the phoenix Game pc DVD-rom	1	Неклассифицированные/default	0	
4408150	7321900588157	Harry potter and the philosopher's Stone	1	Неклассифицированные/default	0	
4408152	5030930027100	Harry potter and the philosopher's Stone (playstation)(pal version)	1	Неклассифицированные/default	0	
