ID	UPCEAN	Name	CategoryID	CategoryName	BrandID	BrandName
2378668	9556705050013	Puas ej belacan 500g	1	Неклассифицированные/default	0	
2378669	9556705005624	Puas kentucky t.p.serbaguna 1kg	1	Неклассифицированные/default	0	
2378670	9556705056015	Puas kuah rojak 250g	1	Неклассифицированные/default	0	
2188463	9556705005617	Puas tepung kentucky 200grx12 ori	1	Неклассифицированные/default	0	
3189877	071725747150	Pub Blend	330591	Продукты питания (folder)/Продукты питания	0	
3189878	072220101645	Pub buns	330591	Продукты питания (folder)/Продукты питания	0	
3189879	070153290283	Pub Cheese spreadable Cheese cheddar&bacon	330591	Продукты питания (folder)/Продукты питания	0	
3189880	070153292102	Pub Cheese, gourmet spreadable cheddar Cheese with jalapenos	330591	Продукты питания (folder)/Продукты питания	0	
3189881	676181300903	Pub collection Dark chocolate	330591	Продукты питания (folder)/Продукты питания	0	
1999725	603912268003	Pub crawl passport (d)	1980180	Adult/Discontinued (Manufactures)	0	
3189882	030243818209	Pub grub savory snacks	330591	Продукты питания (folder)/Продукты питания	3006878	Waymouth farms
3189883	073848002314	Pub horseradish	330591	Продукты питания (folder)/Продукты питания	0	
1581918	5016765102144	Pub Original pork crunch bag 30g	1	Неклассифицированные/default	0	
642364	5016765102069	Pub Original pork scratching 20g	1	Неклассифицированные/default	0	
642365	5016765100027	Pub pork crunch 42g	1	Неклассифицированные/default	0	
642366	5016765100263	Pub pork scratchings 50g	1	Неклассифицированные/default	0	
406558	788309400225	Pub style ale glass 22oz	1	Неклассифицированные/default	0	
3189884	018582473518	Pub style burgers	330591	Продукты питания (folder)/Продукты питания	0	
3189885	795404151112	Pub style Cheese pizza	330591	Продукты питания (folder)/Продукты питания	0	
3189886	041322395023	Pub style cod burger	330591	Продукты питания (folder)/Продукты питания	0	
3189887	078742064888	Pub style horseradish sauce	330591	Продукты питания (folder)/Продукты питания	0	
3189888	041130389481	Pub style pizza	330591	Продукты питания (folder)/Продукты питания	0	
3189889	041130389498	Pub style pizza #2	330591	Продукты питания (folder)/Продукты питания	0	
3189890	041130389504	Pub style pizza #3	330591	Продукты питания (folder)/Продукты питания	0	
3189891	041130389856	Pub style pizza #4	330591	Продукты питания (folder)/Продукты питания	0	
3189892	011246980605	Pub style pretzel bread Mix	330591	Продукты питания (folder)/Продукты питания	0	
3189893	074624012855	Pub style prime rib burger	330591	Продукты питания (folder)/Продукты питания	0	
3189894	011110008343	Pub style rolls pretzel	330591	Продукты питания (folder)/Продукты питания	2616592	Kroger
2663105	4606065011973	Pub кружка пивная 500мл 2шт (2x6)	1	Неклассифицированные/default	0	
160139	4606065001486	Pub набор 2-х стаканов для пива 500сс/12/168 42477	38328	Посуда (folder)/Посуда столовая, предметы сервировки	305181	ООО Посуда
160136	4606065002407	Pub набор пивных кружек 2шт 300мл 55439b (2x6)	38328	Посуда (folder)/Посуда столовая, предметы сервировки	304549	Pasabahce
3189991	731149393387	Pub-style battered cod	330591	Продукты питания (folder)/Продукты питания	0	
1581919	5060114612594	Pub12594 AA car essentials eme	1359440	Эксплуатация и ремонт автомобилей/Car Care	0	
1988561	878461001542	Public nudity southern style DVD (sale)	1980351	Adult/DVD Blowout Sale	0	
3189896	041415348813	Publix 50/50 lite Blend Ice tea, lemonade	330591	Продукты питания (folder)/Продукты питания	3189895	Publix
3189897	041415226913	Publix bakery, almond bark with cocoa	330591	Продукты питания (folder)/Продукты питания	3189895	Publix
3189898	041415224919	Publix bakery, cinnamon donut holes	330591	Продукты питания (folder)/Продукты питания	3189895	Publix
3189899	041415203914	Publix bakery, White chocolate macadamia nut cookies	330591	Продукты питания (folder)/Продукты питания	3189895	Publix
3189900	041415005365	Publix Black Cherry soda Black Cherry	330591	Продукты питания (folder)/Продукты питания	3189895	Publix
3189901	041415047365	Publix Black Cherry soda Black Cherry #2	330591	Продукты питания (folder)/Продукты питания	3189895	Publix
3189902	041415111530	Publix Black eyed peas	330591	Продукты питания (folder)/Продукты питания	3189895	Publix
3189903	041415338845	Publix brewed Ice tea and real lemonade	330591	Продукты питания (folder)/Продукты питания	3189895	Publix
3189904	041415033160	Publix bridge Mix candy, chocolate covered	330591	Продукты питания (folder)/Продукты питания	3189895	Publix
3189905	041415104532	Publix Butter peas	330591	Продукты питания (folder)/Продукты питания	3189895	Publix
3189906	041415015364	Publix caffeine free cola	330591	Продукты питания (folder)/Продукты питания	3189895	Publix
3189907	041415067363	Publix caffeine free cola #2	330591	Продукты питания (folder)/Продукты питания	3189895	Publix
3189908	041415016361	Publix caffeine free diet cola	330591	Продукты питания (folder)/Продукты питания	3189895	Publix
3189909	041415068360	Publix caffeine free diet cola #2	330591	Продукты питания (folder)/Продукты питания	3189895	Publix
3189910	041415118362	Publix caffeine free diet cola #3	330591	Продукты питания (folder)/Продукты питания	3189895	Publix
3189911	041415017368	Publix Cherry cola, Cherry	330591	Продукты питания (folder)/Продукты питания	3189895	Publix
3189912	041415109537	Publix chopped collard greens	330591	Продукты питания (folder)/Продукты питания	3189895	Publix
3189913	041415050365	Publix cola	330591	Продукты питания (folder)/Продукты питания	3189895	Publix
3189914	041415019324	Publix cooking spray, Butter	330591	Продукты питания (folder)/Продукты питания	3189895	Publix
3189915	041415285651	Publix cracker cut sharp cheddar Cheese	330591	Продукты питания (folder)/Продукты питания	3189895	Publix
3189916	041415056367	Publix Cream soda	330591	Продукты питания (folder)/Продукты питания	3189895	Publix
3189917	041415092532	Publix cut pole beans	330591	Продукты питания (folder)/Продукты питания	3189895	Publix
3189918	041415450622	Publix deli, Black bean hummus, olive Oil and roasted Red peppers	330591	Продукты питания (folder)/Продукты питания	3189895	Publix
3189919	041415358881	Publix deli, brewed Ice tea, Coconut	330591	Продукты питания (folder)/Продукты питания	3189895	Publix
3189920	041415381636	Publix deli, brewed Ice tea, vanilla&Peach	330591	Продукты питания (folder)/Продукты питания	3189895	Publix
3189921	041415178809	Publix deli, Dry salami with Red Wine	330591	Продукты питания (folder)/Продукты питания	3189895	Publix
3189922	041415466623	Publix deli, goat Cheese, cranberry cinnamon	330591	Продукты питания (folder)/Продукты питания	3189895	Publix
3189923	041415487628	Publix deli, greek kalamata hummus	330591	Продукты питания (folder)/Продукты питания	3189895	Publix
3189924	041415458628	Publix deli, shredded parmigiano reggiano Cheese	330591	Продукты питания (folder)/Продукты питания	3189895	Publix
3189925	041415454620	Publix deli, spicy Black bean dip	330591	Продукты питания (folder)/Продукты питания	3189895	Publix
3189926	041415048362	Publix diet Black Cherry soda Black Cherry	330591	Продукты питания (folder)/Продукты питания	3189895	Publix
3189927	041415009363	Publix diet ginger ale	330591	Продукты питания (folder)/Продукты питания	3189895	Publix
3189928	041415010369	Publix diet root beer	330591	Продукты питания (folder)/Продукты питания	3189895	Publix
3189929	041415063365	Publix diet root beer #2	330591	Продукты питания (folder)/Продукты питания	3189895	Publix
3189930	041415119369	Publix diet soda Orange	330591	Продукты питания (folder)/Продукты питания	3189895	Publix
3189931	041415007253	Publix evaporated Milk	330591	Продукты питания (folder)/Продукты питания	3189895	Publix
3189932	041415100367	Publix flavored soda Fruit punch	330591	Продукты питания (folder)/Продукты питания	3189895	Publix
3189933	041415052369	Publix flavored soda Orange	330591	Продукты питания (folder)/Продукты питания	3189895	Publix
3189934	041415083363	Publix flavored soda Orange #2	330591	Продукты питания (folder)/Продукты питания	3189895	Publix
3189935	041415090538	Publix florets cauliflower	330591	Продукты питания (folder)/Продукты питания	3189895	Publix
3189936	041415102538	Publix ford hook lima beans	330591	Продукты питания (folder)/Продукты питания	3189895	Publix
3189937	041415091535	Publix french cut Green beans	330591	Продукты питания (folder)/Продукты питания	3189895	Publix
3189938	041415044098	Publix fudge striped shortbread cookies	330591	Продукты питания (folder)/Продукты питания	3189895	Publix
3189939	041415002364	Publix ginger ale	330591	Продукты питания (folder)/Продукты питания	3189895	Publix
3189940	041415087361	Publix ginger ale #2	330591	Продукты питания (folder)/Продукты питания	3189895	Publix
3189941	041415054363	Publix ginger ale soda	330591	Продукты питания (folder)/Продукты питания	3189895	Publix
3189942	041415091368	Publix ginger ale, ginger	330591	Продукты питания (folder)/Продукты питания	3189895	Publix
1581920	041415004177	Publix glass cleaner - 32oz	1	Неклассифицированные/default	0	
3189943	041415007369	Publix grape soda grape	330591	Продукты питания (folder)/Продукты питания	3189895	Publix
3189944	041415097339	Publix Green wise, Organic Yellow corn tortilla chips	330591	Продукты питания (folder)/Продукты питания	3189895	Publix
3189945	041415100336	Publix greenwise, Organic Blue corn tortilla chips	330591	Продукты питания (folder)/Продукты питания	3189895	Publix
3189946	041415016668	Publix greenwise, Organic cage-free Extra large brown eggs	330591	Продукты питания (folder)/Продукты питания	3189895	Publix
3189947	041415107083	Publix greenwise, Organic roasted garlic sauce	330591	Продукты питания (folder)/Продукты питания	3189895	Publix
3189948	041415155336	Publix greenwise, Organic White corn tortilla chips	330591	Продукты питания (folder)/Продукты питания	3189895	Publix
3189949	041415099050	Publix instant oatmeal, Apple&cinnamon	330591	Продукты питания (folder)/Продукты питания	3189895	Publix
3189950	041415024052	Publix instant oatmeal, apples&cinnamon	330591	Продукты питания (folder)/Продукты питания	3189895	Publix
3189951	041415025059	Publix instant oatmeal, maple&brown sugar	330591	Продукты питания (folder)/Продукты питания	3189895	Publix
3189952	041415098053	Publix instant oatmeal, maple&brown sugar #2	330591	Продукты питания (folder)/Продукты питания	3189895	Publix
3189953	041415026056	Publix instant oatmeal, Original	330591	Продукты питания (folder)/Продукты питания	3189895	Publix
3189954	041415004368	Publix Lemon Lime soda Lemon Lime	330591	Продукты питания (folder)/Продукты питания	3189895	Publix
3189955	041415055360	Publix Lemon Lime soda Lemon Lime #2	330591	Продукты питания (folder)/Продукты питания	3189895	Publix
3189956	041415067080	Publix less sodium soy sauce	330591	Продукты питания (folder)/Продукты питания	3189895	Publix
3189957	041415050655	Publix Light sour Cream	330591	Продукты питания (folder)/Продукты питания	3189895	Publix
3189958	041415413863	Publix marcona almonds roasted&salted	330591	Продукты питания (folder)/Продукты питания	3189895	Publix
3189959	041415176805	Publix mixed Dry salami	330591	Продукты питания (folder)/Продукты питания	3189895	Publix
3189960	041415010468	Publix mixedfruit	330591	Продукты питания (folder)/Продукты питания	3189895	Publix
3189961	041415154056	Publix oat crunch cereal, Original	330591	Продукты питания (folder)/Продукты питания	3189895	Publix
3189962	041415022058	Publix oats	330591	Продукты питания (folder)/Продукты питания	3189895	Publix
3189963	041415329867	Publix okra	330591	Продукты питания (folder)/Продукты питания	3189895	Publix
3189964	041415014138	Publix Original style panko bread crumbs	330591	Продукты питания (folder)/Продукты питания	3189895	Publix
3189965	041415086081	Publix premium marinara pasta sauce	330591	Продукты питания (folder)/Продукты питания	3189895	Publix
3189966	041415039322	Publix premium olive Oil Extra virgin	330591	Продукты питания (folder)/Продукты питания	3189895	Publix
3189967	041415021211	Publix publix Water enhancer, strawberry lemonade	330591	Продукты питания (folder)/Продукты питания	3189895	Publix
3189968	041415051058	Publix raisin, date&walnut instant oatmeal	330591	Продукты питания (folder)/Продукты питания	3189895	Publix
3189969	041415001657	Publix regular sour Cream	330591	Продукты питания (folder)/Продукты питания	3189895	Publix
3189970	041415001367	Publix root beer	330591	Продукты питания (folder)/Продукты питания	3189895	Publix
3189971	041415053366	Publix root beer #2	330591	Продукты питания (folder)/Продукты питания	3189895	Publix
3189972	041415229914	Publix sea salt pretzel cocoa bark	330591	Продукты питания (folder)/Продукты питания	3189895	Publix
3189973	041415323865	Publix snow peas	330591	Продукты питания (folder)/Продукты питания	3189895	Publix
3189974	041415051362	Publix soda grape	330591	Продукты питания (folder)/Продукты питания	3189895	Publix
3189975	041415463622	Publix Soft ripened Cheese	330591	Продукты питания (folder)/Продукты питания	3189895	Publix
3189976	041415322868	Publix sugar snap peas	330591	Продукты питания (folder)/Продукты питания	3189895	Publix
3189977	041415228801	Publix Super markets, Green wise, Turkey breast	330591	Продукты питания (folder)/Продукты питания	3189895	Publix
3189978	041415038080	Publix taco seasoning Mix	330591	Продукты питания (folder)/Продукты питания	3189895	Publix
3189979	041415198807	Publix traditional style mashed potatoes	330591	Продукты питания (folder)/Продукты питания	3189895	Publix
3189980	041415415867	Publix trail Mix, Dark chocolate, cranberry	330591	Продукты питания (folder)/Продукты питания	3189895	Publix
3189981	041415122147	Publix Tropical trail Mix	330591	Продукты питания (folder)/Продукты питания	3189895	Publix
3189982	041415042148	Publix unsweetened Apple sauce	330591	Продукты питания (folder)/Продукты питания	3189895	Publix
3189983	041415052147	Publix unsweetened Apple sauce #2	330591	Продукты питания (folder)/Продукты питания	3189895	Publix
3189984	041415088146	Publix unsweetened applesauce	330591	Продукты питания (folder)/Продукты питания	3189895	Publix
3189985	041415023215	Publix Water enhancer, Black Cherry	330591	Продукты питания (folder)/Продукты питания	3189895	Publix
3189986	041415022218	Publix Water enhancer, Orange tangerine	330591	Продукты питания (folder)/Продукты питания	3189895	Publix
3189987	041415321861	Publix wax beans	330591	Продукты питания (folder)/Продукты питания	3189895	Publix
3189988	041415108097	Publix Wheat snacks baked Wheat crackers	330591	Продукты питания (folder)/Продукты питания	3189895	Publix
3189989	041415107090	Publix wheatsnacks	330591	Продукты питания (folder)/Продукты питания	3189895	Publix
3189990	041415020320	Publix White Distilled vinegar	330591	Продукты питания (folder)/Продукты питания	3189895	Publix
1581921	041415016231	Publix, macaroni&Cheese dinner, 7.25oz	1	Неклассифицированные/default	0	
2663106	7800000003475	Pubs music - varios interpretes CD cdof3475	2275105	Медиа (folder)/Медиа	0	
2663107	813637020422	Pubsof. chapel Hill, north Carolina pint glasses (set of 2)	1	Неклассифицированные/default	0	
2663108	813637020460	Pubsof. cincinnati, ohio pint glasses (set of 2)	1	Неклассифицированные/default	0	
1581922	8809190196645	Pucca pencil cs pu-La-004	2	Канцелярские товары (folder)/Канцелярские товары	0	
1581923	8809190196652	Pucca pencil cs pu-La-005	2	Канцелярские товары (folder)/Канцелярские товары	0	
1581924	8809190196713	Pucca pencil cs pu-La-026	2	Канцелярские товары (folder)/Канцелярские товары	0	
1581925	8809190198380	Pucca pencil cs pu-La-030	2	Канцелярские товары (folder)/Канцелярские товары	0	
642369	4785785890058	Pucchini намордник №1 (пит буль)	319931	Товары для животных (folder)/Намордник	642367	PUCCHINI
642370	4785785890102	Pucchini намордник №2 (амстаф)	319931	Товары для животных (folder)/Намордник	642367	PUCCHINI
642371	4785785890256	Pucchini намордник №5 (овчарка кобель)	319931	Товары для животных (folder)/Намордник	642367	PUCCHINI
642372	4785785890300	Pucchini намордник №6 (кавказец)	319931	Товары для животных (folder)/Намордник	642367	PUCCHINI
642383	4785785899143	Pucchini поводок 12мм строченный	299304	Товары для животных (folder)/Поводки для животных	642367	PUCCHINI
642384	4785785899150	Pucchini поводок 14мм строченный, 2м	299304	Товары для животных (folder)/Поводки для животных	642367	PUCCHINI
642385	4785785899259	Pucchini поводок плетеный формованный (квадратный)	299304	Товары для животных (folder)/Поводки для животных	642367	PUCCHINI
1581926	015789998011	Pucci bait knife	1	Неклассифицированные/default	0	
1581927	015789116002	Pucci chain strngr	1	Неклассифицированные/default	0	
1581928	015789781071	Pucci double bells	1	Неклассифицированные/default	0	
1581929	015789117139	Pucci fld snd spke	1	Неклассифицированные/default	0	
1581930	015789999988	Pucci liberty Bell	1	Неклассифицированные/default	0	
1581931	015789116026	Pucci nln stringer	1	Неклассифицированные/default	0	
1581932	015789997847	Pucci nyln stringr	1	Неклассифицированные/default	0	
1581933	015789997823	Pucci nylon strngr	1	Неклассифицированные/default	0	
2188464	4606206141118	Pucci pups.щенок интерактивный peppy, со звук.эфектами	980	Игрушки (folder)/Игрушки	2180266	Battat
2188465	4606206141071	Pucci pups.щенок/котенок интерактивный, ассортим	980	Игрушки (folder)/Игрушки	2180266	Battat
1581934	015789111618	Pucci sinkr sldrs	1	Неклассифицированные/default	0	
1581935	015789999025	Pucci striper rig	1	Неклассифицированные/default	0	
1581936	015789999049	Pucci tool kit	1	Неклассифицированные/default	0	
1581937	015789115265	Pucci wire basket	1	Неклассифицированные/default	0	
2663109	743216541928	Puccini - famous opera transcription CD clas65419	2275105	Медиа (folder)/Медиа	0	
2663110	724357065825	Puccini - La boheme (highlights) CD disc706582	2275105	Медиа (folder)/Медиа	0	
2663111	028946406021	Puccini - La boheme /bocelli-frittoli CD 4640602	2275105	Медиа (folder)/Медиа	0	
2663112	8712155075780	Puccini - La boheme CD anat6	2275105	Медиа (folder)/Медиа	0	
2663113	8430492204150	Puccini - La boheme CD foli204150	2275105	Медиа (folder)/Медиа	0	
2663114	723723562920	Puccini - manom lescaut CD oro21198	2275105	Медиа (folder)/Медиа	0	
2663115	028944005127	Puccini - tosca (nilsson, corelli,fische CD clad440051	2275105	Медиа (folder)/Медиа	0	
2663116	8430492204167	Puccini - tosca CD foli204167	2275105	Медиа (folder)/Медиа	0	
2663117	8717423034391	Puccini - tosca CD oc205	2275105	Медиа (folder)/Медиа	0	
2663118	724357065924	Puccini - turandot (highlights) CD disc706592	2275105	Медиа (folder)/Медиа	0	
2663119	8430492204198	Puccini - turandot CD cdof204198	2275105	Медиа (folder)/Медиа	0	
2378671	9556893001392	Pucell m.cologne jolly rhythm 150ml + cologne 60ml	1	Неклассифицированные/default	0	
2378672	9556893001347	Pucell m.cologne s.Love 150ml + cologne 60ml	1	Неклассифицированные/default	0	
2378673	9556893001361	Pucell m.cologne wavy Ocean 150ml + cologne 60ml	1	Неклассифицированные/default	0	
406559	4902806011470	Pucelle bouquet cologne 35ml	1	Неклассифицированные/default	0	
1581938	4902806013658	Pucelle character Body spray 150ml	1	Неклассифицированные/default	0	
406560	4902806011456	Pucelle chypre cologne 35ml	1	Неклассифицированные/default	0	
1581943	4902806014808	Pucelle cologne ecce breeze 150ml	1	Неклассифицированные/default	0	
2378674	4902806015980	Pucelle cologne eccen breeze 75ml	1	Неклассифицированные/default	0	
1581940	4902806013634	Pucelle cologne eccen sunrise 150ml	4835	Парфюмерия (folder)/Одеколон	0	
2378675	4902806015966	Pucelle cologne eccen sunrise 75ml	1	Неклассифицированные/default	0	
2378676	4902806015973	Pucelle cologne jolly rhythm 75ml	1	Неклассифицированные/default	0	
2188466	8992222091534	Pucelle cologne Mist 150ml*12 jolly Wave Ocean	1	Неклассифицированные/default	0	
2188467	8992222091961	Pucelle cologne Mist 75ml*12 jolly rithm	1	Неклассифицированные/default	0	
2188468	8992222091923	Pucelle cologne Mist 75ml*12 sparkling Love	1	Неклассифицированные/default	0	
2378677	4902806015935	Pucelle cologne spar Love 75ml	1	Неклассифицированные/default	0	
1581941	4902806013627	Pucelle cologne sparkling Love 150ml	4835	Парфюмерия (folder)/Одеколон	0	
2188469	8992222090490	Pucelle cologne splash 175ml*12 cypre	1	Неклассифицированные/default	0	
2188470	8992222090452	Pucelle cologne splash 175ml*12 Rose	1	Неклассифицированные/default	0	
2188471	8992222090469	Pucelle cologne splash 75ml*12 musk	1	Неклассифицированные/default	0	
1581942	4902806013641	Pucelle cologne trop Spirit 150ml	4835	Парфюмерия (folder)/Одеколон	0	
2378678	4902806015959	Pucelle cologne trop Spirit 75ml	1	Неклассифицированные/default	0	
2378679	4902806015942	Pucelle cologne wavy Ocean 75ml	1	Неклассифицированные/default	0	
