ID	UPCEAN	Name	CategoryID	CategoryName	BrandID	BrandName
4465198	011110732927	Kroger quality guaranteed	1	Неклассифицированные/default	2616592	Kroger
3147465	011110501905	Kroger queso quesadilla finely shredded Cheese	330591	Продукты питания (folder)/Продукты питания	2616592	Kroger
3147466	011110853264	Kroger quick 1 minute 100% whole grain oats	330591	Продукты питания (folder)/Продукты питания	2616592	Kroger
4465199	011110853271	Kroger quick rolled oats	1	Неклассифицированные/default	2616592	Kroger
3147467	011110701770	Kroger rainbow dessert toppings	330591	Продукты питания (folder)/Продукты питания	2616592	Kroger
3147468	011110701879	Kroger rainbow dessert toppings #2	330591	Продукты питания (folder)/Продукты питания	2616592	Kroger
2793210	011110740281	Kroger rainbow parfait gelatins	1	Неклассифицированные/default	2616592	Kroger
4465200	011100853458	Kroger raisin bran cereal 20oz	1	Неклассифицированные/default	2616592	Kroger
4465201	011110802620	Kroger ralphs 1000sheets Bath 12 roll 1000ct	1	Неклассифицированные/default	3948200	Kroger Ralphs
4465202	011110918246	Kroger ralphs 3lb bag Red Del (k) 48oz	1	Неклассифицированные/default	3948200	Kroger Ralphs
4465203	011110828163	Kroger ralphs 8 7/8inch Foam plates - 150ct	1	Неклассифицированные/default	3948200	Kroger Ralphs
2824138	011110877345	Kroger ralphs Apple Juice frozen 12oz	1	Неклассифицированные/default	3948200	Kroger Ralphs
3192015	011110817129	Kroger ralphs authentic recipe soup, minestrone	330591	Продукты питания (folder)/Продукты питания	3948200	Kroger Ralphs
4465204	011110805775	Kroger ralphs auto dish det Lemon 45oz	1	Неклассифицированные/default	3948200	Kroger Ralphs
4465205	011110811912	Kroger ralphs auto dish Gel Lemon 45oz	1	Неклассифицированные/default	3948200	Kroger Ralphs
4465206	011110815736	Kroger ralphs Baby lima beans 16oz	1	Неклассифицированные/default	3948200	Kroger Ralphs
4465207	011110878557	Kroger ralphs Baby lima beans 16oz #2	1	Неклассифицированные/default	3948200	Kroger Ralphs
2827109	011110827647	Kroger ralphs Baby lima beans sub 16oz	1	Неклассифицированные/default	3948200	Kroger Ralphs
4465208	011110820563	Kroger ralphs Black beans 16oz	1	Неклассифицированные/default	3948200	Kroger Ralphs
4465209	011110880949	Kroger ralphs Black sunflower seed 160oz	1	Неклассифицированные/default	3948200	Kroger Ralphs
4465210	011110880956	Kroger ralphs Black sunflower seed 80oz	1	Неклассифицированные/default	3948200	Kroger Ralphs
4465211	011110879493	Kroger ralphs blackeye peas 16oz	1	Неклассифицированные/default	3948200	Kroger Ralphs
2827110	011110827654	Kroger ralphs blackeye peas sub 16oz	1	Неклассифицированные/default	3948200	Kroger Ralphs
4465212	011110815798	Kroger ralphs blackeyed peas 16oz	1	Неклассифицированные/default	3948200	Kroger Ralphs
4465213	011110848246	Kroger ralphs boil in bg inst rce 14oz	1	Неклассифицированные/default	3948200	Kroger Ralphs
4465214	011110857309	Kroger ralphs bran flakes cereal 17.3oz	1	Неклассифицированные/default	3948200	Kroger Ralphs
4465215	011110824080	Kroger ralphs bread flour 80oz	1	Неклассифицированные/default	3948200	Kroger Ralphs
3192016	011110804372	Kroger ralphs british Blend Black tea	330591	Продукты питания (folder)/Продукты питания	3948200	Kroger Ralphs
2827111	011110828026	Kroger ralphs broc/caul/carrot w/Cheese 10oz	1	Неклассифицированные/default	3948200	Kroger Ralphs
2824141	011110870254	Kroger ralphs broccoli chopped 10oz	1	Неклассифицированные/default	3948200	Kroger Ralphs
4465216	011110878601	Kroger ralphs broccoli cuts 16oz	1	Неклассифицированные/default	3948200	Kroger Ralphs
2824112	011110820105	Kroger ralphs broccoli cuts 32oz	1	Неклассифицированные/default	3948200	Kroger Ralphs
2827112	011110827661	Kroger ralphs broccoli cuts sub 16oz	1	Неклассифицированные/default	3948200	Kroger Ralphs
2824142	011110870353	Kroger ralphs broccoli spears 10oz	1	Неклассифицированные/default	3948200	Kroger Ralphs
3123389	011110891068	Kroger ralphs brownie bars 18oz	330591	Продукты питания (folder)/Продукты питания	2616592	Kroger
2824113	011110872463	Kroger ralphs brussel sprouts 10oz	1	Неклассифицированные/default	3948200	Kroger Ralphs
2827114	011110827982	Kroger ralphs brussel sprouts w/Butter 10oz	1	Неклассифицированные/default	3948200	Kroger Ralphs
4465217	011110878694	Kroger ralphs brussels sprouts 16oz	1	Неклассифицированные/default	3948200	Kroger Ralphs
2827113	011110827678	Kroger ralphs brussels sprouts sub 16oz	1	Неклассифицированные/default	3948200	Kroger Ralphs
4465218	011110721396	Kroger ralphs Cafe coffee 100% columbian 11.5oz	1	Неклассифицированные/default	3948200	Kroger Ralphs
4465219	011110814531	Kroger ralphs calrose med grain 32oz	1	Неклассифицированные/default	3948200	Kroger Ralphs
2824117	011110828019	Kroger ralphs cauliflower w/Cheese 10oz	1	Неклассифицированные/default	3948200	Kroger Ralphs
4465220	011110878755	Kroger ralphs cauliflowerets 16oz	1	Неклассифицированные/default	3948200	Kroger Ralphs
2827115	011110827685	Kroger ralphs cauliflowerets 16oz 9ct	1	Неклассифицированные/default	3948200	Kroger Ralphs
4465221	011110916341	Kroger ralphs celery hearts 16oz	1	Неклассифицированные/default	3948200	Kroger Ralphs
2827139	011110285171	Kroger ralphs cheddr chs&bacndip 16oz	1	Неклассифицированные/default	3948200	Kroger Ralphs
4465222	011110878632	Kroger ralphs chopped broccoli 16oz	1	Неклассифицированные/default	3948200	Kroger Ralphs
2827116	011110827692	Kroger ralphs chopped broccoli sub 16oz	1	Неклассифицированные/default	3948200	Kroger Ralphs
4465223	011110807366	Kroger ralphs chopped spinach 16oz	1	Неклассифицированные/default	3948200	Kroger Ralphs
2827118	011110832894	Kroger ralphs chs pizza bites-40ct 20oz	1	Неклассифицированные/default	3948200	Kroger Ralphs
4465224	011110862266	Kroger ralphs cider vinegar 16oz	1	Неклассифицированные/default	3948200	Kroger Ralphs
4465225	011110862297	Kroger ralphs cider vinegar 32oz	1	Неклассифицированные/default	3948200	Kroger Ralphs
3201133	011110881458	Kroger ralphs clear ammonia 64oz	545856	Продукты питания (folder)/Соус	2616592	Kroger
2824121	011110890559	Kroger ralphs cmas tree cookie 18oz	1	Неклассифицированные/default	3948200	Kroger Ralphs
2824122	011110879547	Kroger ralphs cob corn 4 ea	1	Неклассифицированные/default	3948200	Kroger Ralphs
4465226	011110809469	Kroger ralphs corn bitz toasted corn cereal 16oz	1	Неклассифицированные/default	3948200	Kroger Ralphs
2824123	011110879554	Kroger ralphs corn tots 6 Half ears 6ct	1	Неклассифицированные/default	3948200	Kroger Ralphs
2824124	011110827975	Kroger ralphs corn w/Butter sauce 10oz	1	Неклассифицированные/default	3948200	Kroger Ralphs
4465227	011110876362	Kroger ralphs country style hash browns 30oz	1	Неклассифицированные/default	3948200	Kroger Ralphs
2824125	011110827999	Kroger ralphs creamed spinach 9oz	1	Неклассифицированные/default	3948200	Kroger Ralphs
4465228	011110878724	Kroger ralphs crinkle cut carrots 16oz	1	Неклассифицированные/default	3948200	Kroger Ralphs
2827119	011110827715	Kroger ralphs crinkle cut carrots 16oz 9ct	1	Неклассифицированные/default	3948200	Kroger Ralphs
2827140	011110833570	Kroger ralphs crinkle cut potatoe 5lb	1	Неклассифицированные/default	3948200	Kroger Ralphs
4465229	011110876317	Kroger ralphs crinkle cuts 32oz	1	Неклассифицированные/default	3948200	Kroger Ralphs
2824126	011110835512	Kroger ralphs crispy coated fry 24oz	1	Неклассифицированные/default	3948200	Kroger Ralphs
4465230	011110876539	Kroger ralphs cut corn 16oz	1	Неклассифицированные/default	3948200	Kroger Ralphs
2824128	011110820129	Kroger ralphs cut corn 32oz	1	Неклассифицированные/default	3948200	Kroger Ralphs
2827120	011110827722	Kroger ralphs cut corn sub 16oz	1	Неклассифицированные/default	3948200	Kroger Ralphs
4465231	011110876577	Kroger ralphs cut Green beans 16oz	1	Неклассифицированные/default	3948200	Kroger Ralphs
2824168	011110820143	Kroger ralphs cut Green beans 32oz	1	Неклассифицированные/default	3948200	Kroger Ralphs
2824129	011110879561	Kroger ralphs cut Green beans 9oz	1	Неклассифицированные/default	2616592	Kroger
2827121	011110827739	Kroger ralphs cut Green beans sub 16oz	1	Неклассифицированные/default	3948200	Kroger Ralphs
4465232	011110875761	Kroger ralphs cut leaf spinach 16oz	1	Неклассифицированные/default	3948200	Kroger Ralphs
2827122	011110827746	Kroger ralphs cut leaf spinach sub 16oz	1	Неклассифицированные/default	3948200	Kroger Ralphs
4465233	011110879578	Kroger ralphs cut okra 16oz	1	Неклассифицированные/default	3948200	Kroger Ralphs
2827123	011110827753	Kroger ralphs cut okra sub 16oz	1	Неклассифицированные/default	3948200	Kroger Ralphs
4465234	011110880352	Kroger ralphs dec plate 10.25inch 24ct	1	Неклассифицированные/default	3948200	Kroger Ralphs
4465235	011110880338	Kroger ralphs decorated plate 9inch 48ct	1	Неклассифицированные/default	3948200	Kroger Ralphs
2824145	011110806536	Kroger ralphs deep dish pie shells 12oz	1	Неклассифицированные/default	3948200	Kroger Ralphs
4465236	011110862389	Kroger ralphs Distilled vinegar 12oz	1	Неклассифицированные/default	3948200	Kroger Ralphs
4465237	011110862273	Kroger ralphs Distilled vinegar 16oz	1	Неклассифицированные/default	3948200	Kroger Ralphs
3164254	011110862372	Kroger ralphs Distilled vinegar 32oz	330591	Продукты питания (folder)/Продукты питания	2616592	Kroger
4465238	011110883179	Kroger ralphs evaporated Milk 12oz	1	Неклассифицированные/default	3948200	Kroger Ralphs
4465239	011110869364	Kroger ralphs everyday 1000 b/tissue 4r 4000ct	1	Неклассифицированные/default	3948200	Kroger Ralphs
4465240	011110869340	Kroger ralphs everyday Bath tissue 12ro 3360ct	1	Неклассифицированные/default	3948200	Kroger Ralphs
4465241	011110869333	Kroger ralphs everyday Bath tissue 4rl 1120ct	1	Неклассифицированные/default	3948200	Kroger Ralphs
4465242	011110869616	Kroger ralphs everyday napkins 120ct	1	Неклассифицированные/default	3948200	Kroger Ralphs
4465243	011110869630	Kroger ralphs everyday napkins asstd cl 360ct	1	Неклассифицированные/default	3948200	Kroger Ralphs
4465244	011110818713	Kroger ralphs everyday napkins White 500ct	1	Неклассифицированные/default	3948200	Kroger Ralphs
4465245	011110869609	Kroger ralphs everyday paper napkin 60ct	1	Неклассифицированные/default	3948200	Kroger Ralphs
4465246	011110869449	Kroger ralphs everyday paper towels l 150ct	1	Неклассифицированные/default	3948200	Kroger Ralphs
4465247	011110869456	Kroger ralphs everyday towels 6r 300ct	1	Неклассифицированные/default	3948200	Kroger Ralphs
2824133	011110875259	Kroger ralphs f/free whip topping 8oz	1	Неклассифицированные/default	3948200	Kroger Ralphs
4465248	011110854414	Kroger ralphs flour 160oz	1	Неклассифицированные/default	3948200	Kroger Ralphs
4465249	011110854278	Kroger ralphs flour 32oz	1	Неклассифицированные/default	3948200	Kroger Ralphs
4465250	011110854407	Kroger ralphs flour 80oz	1	Неклассифицированные/default	3948200	Kroger Ralphs
4465251	011110884916	Kroger ralphs Foam plates 100ct 100ct	1	Неклассифицированные/default	3948200	Kroger Ralphs
4465252	011110884909	Kroger ralphs Foam plates dinner sz 50ct	1	Неклассифицированные/default	3948200	Kroger Ralphs
4465253	011110878007	Kroger ralphs french sliced Green beans 16oz	1	Неклассифицированные/default	3948200	Kroger Ralphs
2827124	011110827760	Kroger ralphs french sliced Green beans 16oz 9ct	1	Неклассифицированные/default	3948200	Kroger Ralphs
4465254	011110876324	Kroger ralphs fries shoestring 28oz	1	Неклассифицированные/default	3948200	Kroger Ralphs
4465255	011110875662	Kroger ralphs froz soup Mix 16oz	1	Неклассифицированные/default	3948200	Kroger Ralphs
2824131	011110871787	Kroger ralphs frozen cooked squash 12oz	1	Неклассифицированные/default	3948200	Kroger Ralphs
2824153	011110877291	Kroger ralphs frozen Orange juic 12oz	1	Неклассифицированные/default	3948200	Kroger Ralphs
2824132	011110819598	Kroger ralphs frz Cheese valu pizza 6.5oz	1	Неклассифицированные/default	3948200	Kroger Ralphs
2827141	011110819604	Kroger ralphs frz combo valu pizza 6.5oz	1	Неклассифицированные/default	3948200	Kroger Ralphs
2824134	011110819581	Kroger ralphs frz pep valu pizza 6.5oz	1	Неклассифицированные/default	3948200	Kroger Ralphs
2824136	011110875563	Kroger ralphs frz whipped toppng 12oz	1	Неклассифицированные/default	3948200	Kroger Ralphs
2824151	011110876874	Kroger ralphs frzn limeade 12oz	1	Неклассифицированные/default	3948200	Kroger Ralphs
2824137	011110876607	Kroger ralphs fz 100% grape Juice 12oz	1	Неклассифицированные/default	3948200	Kroger Ralphs
2824139	011110871268	Kroger ralphs fz Baby lima beans 10oz	1	Неклассифицированные/default	3948200	Kroger Ralphs
2824140	011110878472	Kroger ralphs fz blueb waf 10ct 12.30oz	1	Неклассифицированные/default	3948200	Kroger Ralphs
2824103	011110874764	Kroger ralphs fz btrmlk pnck 12ct 16.50oz	1	Неклассифицированные/default	3948200	Kroger Ralphs
2824143	011110877567	Kroger ralphs fz c/rbry Juice 12oz	1	Неклассифицированные/default	3948200	Kroger Ralphs
2824144	011110878519	Kroger ralphs fz cin waffle 10ct 12.30oz	1	Неклассифицированные/default	3948200	Kroger Ralphs
2824146	011110876614	Kroger ralphs fz Fruit punch 12oz	1	Неклассифицированные/default	3948200	Kroger Ralphs
2824147	011110876669	Kroger ralphs fz grape Juice 12oz	1	Неклассифицированные/default	3948200	Kroger Ralphs
2824149	011110878496	Kroger ralphs fz homestyle waf 10ct 12.30oz	1	Неклассифицированные/default	3948200	Kroger Ralphs
2824152	011110878502	Kroger ralphs fz multi-grn 10ct 12.30oz	1	Неклассифицированные/default	3948200	Kroger Ralphs
2824156	011110876973	Kroger ralphs fz oj w/add pulp 12oz	1	Неклассифицированные/default	3948200	Kroger Ralphs
2824159	011110876751	Kroger ralphs fz pink lemonade 12oz	1	Неклассифицированные/default	3948200	Kroger Ralphs
2824160	011110879660	Kroger ralphs fz piz bites combo 20oz	1	Неклассифицированные/default	3948200	Kroger Ralphs
2824162	011110883971	Kroger ralphs fz shred hashbrwns 27oz	1	Неклассифицированные/default	3948200	Kroger Ralphs
2824163	011110872258	Kroger ralphs fz spinach chopped 10oz	1	Неклассифицированные/default	3948200	Kroger Ralphs
2824164	011110872241	Kroger ralphs fz spinach leaf 10oz	1	Неклассифицированные/default	3948200	Kroger Ralphs
2824098	011110834287	Kroger ralphs fz sr crst pza 3 meat 30.5oz	1	Неклассифицированные/default	3948200	Kroger Ralphs
2824099	011110834294	Kroger ralphs fz sr crst pza 4 Cheese 28.2oz	1	Неклассифицированные/default	3948200	Kroger Ralphs
2824100	011110834263	Kroger ralphs fz sr crst pza pepprn 29.6oz	1	Неклассифицированные/default	3948200	Kroger Ralphs
4465256	011110815774	Kroger ralphs garbanzo beans 16oz	1	Неклассифицированные/default	3948200	Kroger Ralphs
4465257	011110879455	Kroger ralphs Garden Blend mex vegetabl 16oz	1	Неклассифицированные/default	3948200	Kroger Ralphs
4465258	011110827586	Kroger ralphs Garden Blend mex vegetabl 16oz 9ct	1	Неклассифицированные/default	3948200	Kroger Ralphs
2827143	011110819895	Kroger ralphs Garden Blend stir fry 14oz	1	Неклассифицированные/default	2616592	Kroger
4465259	011110876003	Kroger ralphs Garden Blend/ital style 16oz	1	Неклассифицированные/default	3948200	Kroger Ralphs
2827125	011110827623	Kroger ralphs Garden Blend/ital style 16oz 9ct	1	Неклассифицированные/default	3948200	Kroger Ralphs
4465260	011110878779	Kroger ralphs Garden blnd/calif veg 16oz	1	Неклассифицированные/default	3948200	Kroger Ralphs
2827142	011110827609	Kroger ralphs Garden blnd/calif veg 16oz 9ct	1	Неклассифицированные/default	3948200	Kroger Ralphs
2827127	011110827616	Kroger ralphs Garden blnd/co Mix sub 16oz	1	Неклассифицированные/default	3948200	Kroger Ralphs
4465261	011110879653	Kroger ralphs Garden blnd/rivera blnd 16oz	1	Неклассифицированные/default	3948200	Kroger Ralphs
4465262	011110827593	Kroger ralphs Garden blnd/rivera blnd 16oz 9ct	1	Неклассифицированные/default	3948200	Kroger Ralphs
4465263	011110875921	Kroger ralphs Garden/wntr blnd broc/caul 16oz	1	Неклассифицированные/default	3948200	Kroger Ralphs
2827126	011110827630	Kroger ralphs Garden/wntr blnd broc/caul 16oz 9ct	1	Неклассифицированные/default	3948200	Kroger Ralphs
2824166	011110819925	Kroger ralphs gb stir fry veg w/noodles 14oz	1	Неклассифицированные/default	3948200	Kroger Ralphs
4465264	011110801463	Kroger ralphs granulated sugar 16oz	1	Неклассифицированные/default	3948200	Kroger Ralphs
2824148	011110877161	Kroger ralphs Grapefruit Juice 12oz	1	Неклассифицированные/default	3948200	Kroger Ralphs
2824167	011110819994	Kroger ralphs grd bln/asian styl 16oz	1	Неклассифицированные/default	3948200	Kroger Ralphs
2824181	011110820181	Kroger ralphs Green peas 32oz	1	Неклассифицированные/default	3948200	Kroger Ralphs
2827128	011110827807	Kroger ralphs Green peas sub 16oz	1	Неклассифицированные/default	3948200	Kroger Ralphs
2824169	011110835352	Kroger ralphs Half&Half 64oz	1	Неклассифицированные/default	3948200	Kroger Ralphs
2824170	011110880215	Kroger ralphs hashbrown patties 22.5oz	1	Неклассифицированные/default	3948200	Kroger Ralphs
2824172	011110835253	Kroger ralphs heavy whip Cream 32oz	1	Неклассифицированные/default	3948200	Kroger Ralphs
2824171	011110835246	Kroger ralphs heavy whipping Cream 16oz	1	Неклассифицированные/default	3948200	Kroger Ralphs
2824173	011110835239	Kroger ralphs heavy whipping Cream 8oz	1	Неклассифицированные/default	3948200	Kroger Ralphs
2824175	011110878663	Kroger ralphs i.q.f.broccoli spears 16oz	1	Неклассифицированные/default	3948200	Kroger Ralphs
3113013	011110741295	Kroger ralphs ic garlic Spread tubs 12oz	330591	Продукты питания (folder)/Продукты питания	2616592	Kroger
4465265	011110847119	Kroger ralphs instant brown Rice 14oz	1	Неклассифицированные/default	3948200	Kroger Ralphs
4465266	011110847102	Kroger ralphs instant Rice 28oz	1	Неклассифицированные/default	3948200	Kroger Ralphs
4465267	011110819567	Kroger ralphs iodized salt 26oz	1	Неклассифицированные/default	3948200	Kroger Ralphs
4465268	011110872746	Kroger ralphs italian Green beans 16oz	1	Неклассифицированные/default	3948200	Kroger Ralphs
2827129	011110827777	Kroger ralphs italian Green beans 16oz 9ct	1	Неклассифицированные/default	3948200	Kroger Ralphs
4465269	011110809339	Kroger ralphs jambalaya Rice Mix 8oz	1	Неклассифицированные/default	3948200	Kroger Ralphs
4465270	011110815743	Kroger ralphs large lima beans 16oz	1	Неклассифицированные/default	3948200	Kroger Ralphs
3138386	011110881465	Kroger ralphs Lemon ammonia 64oz	330591	Продукты питания (folder)/Продукты питания	2616592	Kroger
2824161	011110877192	Kroger ralphs lemonade Raspberry 12oz	1	Неклассифицированные/default	3948200	Kroger Ralphs
2824150	011110876805	Kroger ralphs lemonade reg 12oz	1	Неклассифицированные/default	3948200	Kroger Ralphs
4465271	011110815675	Kroger ralphs lentils 16oz	1	Неклассифицированные/default	3948200	Kroger Ralphs
4465272	011110874948	Kroger ralphs lite whip topping 8oz	1	Неклассифицированные/default	3948200	Kroger Ralphs
4465273	011110814555	Kroger ralphs Long grain Rice 32oz	1	Неклассифицированные/default	3948200	Kroger Ralphs
4465274	011110814562	Kroger ralphs Long grain Rice 80oz	1	Неклассифицированные/default	3948200	Kroger Ralphs
2827130	011110831477	Kroger ralphs lt frz whpd topping 16oz	1	Неклассифицированные/default	3948200	Kroger Ralphs
4465275	011110815729	Kroger ralphs lt Red kidney bean 16oz	1	Неклассифицированные/default	3948200	Kroger Ralphs
4465276	011110842787	Kroger ralphs Magic stars cereal 32oz	1	Неклассифицированные/default	3948200	Kroger Ralphs
2827131	011110285195	Kroger ralphs meditrranean sty dip 9oz	1	Неклассифицированные/default	3948200	Kroger Ralphs
2824176	011110285164	Kroger ralphs mesquite barbq dip 9oz	1	Неклассифицированные/default	3948200	Kroger Ralphs
4465277	011110878588	Kroger ralphs mixed vegetables 16oz	1	Неклассифицированные/default	3948200	Kroger Ralphs
2827132	011110827784	Kroger ralphs mixed vegetables 16oz 9ct	1	Неклассифицированные/default	3948200	Kroger Ralphs
2824177	011110820167	Kroger ralphs mixed vegetables 32oz	1	Неклассифицированные/default	3948200	Kroger Ralphs
3164082	011110863294	Kroger ralphs mtn scent fab sftner shts 80ct	330591	Продукты питания (folder)/Продукты питания	2616592	Kroger
4465278	011110869623	Kroger ralphs napkins asst'd colors 250ct	1	Неклассифицированные/default	3948200	Kroger Ralphs
3248212	011110869319	Kroger ralphs nice&Soft b/tiss 2p 2400ct	330591	Продукты питания (folder)/Продукты питания	2616592	Kroger
4465279	011110869586	Kroger ralphs nice'n elegnt dinner npkn 40ct	1	Неклассифицированные/default	3948200	Kroger Ralphs
4465280	011110869593	Kroger ralphs nice'n elegnt lunch napki 100ct	1	Неклассифицированные/default	3948200	Kroger Ralphs
3253392	011110869296	Kroger ralphs nice'n sft ult b/t dbl 4r 1360ct	330591	Продукты питания (folder)/Продукты питания	2616592	Kroger
4465281	011110833761	Kroger ralphs nice'n Soft b/tiss 24rl 1ct	1	Неклассифицированные/default	3948200	Kroger Ralphs
3146996	011110870131	Kroger ralphs nice'n Soft b/tiss dbl 4r 1600ct	330591	Продукты питания (folder)/Продукты питания	2616592	Kroger
4465282	011110833754	Kroger ralphs nice'n Soft b/tiss dbl 6r 2112ct	1	Неклассифицированные/default	3948200	Kroger Ralphs
4465283	011110863201	Kroger ralphs nice'n Soft cllctns fcl t 144ct	1	Неклассифицированные/default	3948200	Kroger Ralphs
3022406	011110869289	Kroger ralphs nice'n Soft dbl 12rl Ultra 4080ct	330591	Продукты питания (folder)/Продукты питания	2616592	Kroger
4465284	011110829993	Kroger ralphs nice'n Soft f/tissue whit 160ct	1	Неклассифицированные/default	3948200	Kroger Ralphs
4465285	011110829832	Kroger ralphs nice'n Soft facial cubw/l 65ct	1	Неклассифицированные/default	3948200	Kroger Ralphs
4465286	011110830005	Kroger ralphs nice'n Soft facial tissue 230ct	1	Неклассифицированные/default	3948200	Kroger Ralphs
4465287	011110829801	Kroger ralphs nice'n Soft facial tissue 75ct	1	Неклассифицированные/default	3948200	Kroger Ralphs
3022405	011110869258	Kroger ralphs nice'n Soft Ultra bth tis 2040ct	330591	Продукты питания (folder)/Продукты питания	2616592	Kroger
4465288	011110829962	Kroger ralphs nns paper towel sas 1ct	1	Неклассифицированные/default	3948200	Kroger Ralphs
