ID	UPCEAN	Name	CategoryID	CategoryName	BrandID	BrandName
3293606	4680000239158	Вода минеральная арджи кавказская природная 1.25л пл/бут	48140	Продукты питания (folder)/Напитки безалкогольные/Вода минеральная	0	
3293607	4680000238007	Вода минеральная арджи кавказская природная вода 750мл ст/б	48140	Продукты питания (folder)/Напитки безалкогольные/Вода минеральная	3614233	ARDZHI (RODNIKI KAVKAZA GK/PYATIGORSK)
48163	4601611003396	Вода минеральная ариана аквафтор газированная 1.5л	48140	Продукты питания (folder)/Напитки безалкогольные/Вода минеральная	48162	Ариана
1196607	4601611003525	Вода минеральная ариана кармадон ГОСТ 0.5л с/б	48140	Продукты питания (folder)/Напитки безалкогольные/Вода минеральная	48162	Ариана
469556	4601611003372	Вода минеральная ариана кармадон ГОСТ газированная пэт 1.5л	48140	Продукты питания (folder)/Напитки безалкогольные/Вода минеральная	48162	Ариана
3293608	846008701156	Вода минеральная ариант газированная 0.5л пл/бут	48140	Продукты питания (folder)/Напитки безалкогольные/Вода минеральная	0	
3293609	4600870115703	Вода минеральная ариант газированная со вкусом лимона 1.5л пл/бут	48140	Продукты питания (folder)/Напитки безалкогольные/Вода минеральная	3614437	ARIANT (ARIANT VINNIY HOLDING/RUSSIA)
3293610	4600870115697	Вода минеральная ариант негазированная 0.5л пл/бут	48140	Продукты питания (folder)/Напитки безалкогольные/Вода минеральная	3614437	ARIANT (ARIANT VINNIY HOLDING/RUSSIA)
3293611	4600870115680	Вода минеральная ариант негазированная 1.5л пл/бут	48140	Продукты питания (folder)/Напитки безалкогольные/Вода минеральная	3614437	ARIANT (ARIANT VINNIY HOLDING/RUSSIA)
3293612	4600870116243	Вода минеральная ариант негазированная 5л пл/бут	48140	Продукты питания (folder)/Напитки безалкогольные/Вода минеральная	3614437	ARIANT (ARIANT VINNIY HOLDING/RUSSIA)
3293613	4600870115727	Вода минеральная ариант радонежская апельсин газированная 1.5л пл/бут	48140	Продукты питания (folder)/Напитки безалкогольные/Вода минеральная	3614437	ARIANT (ARIANT VINNIY HOLDING/RUSSIA)
3293614	4600870115666	Вода минеральная ариант радонежская газированная 1.5л пл/бут	48140	Продукты питания (folder)/Напитки безалкогольные/Вода минеральная	3614437	ARIANT (ARIANT VINNIY HOLDING/RUSSIA)
3293615	4600870115710	Вода минеральная ариант радонежская лимон газированная 0.5л пл/бут	48140	Продукты питания (folder)/Напитки безалкогольные/Вода минеральная	3614437	ARIANT (ARIANT VINNIY HOLDING/RUSSIA)
1660420	4602983004493	Вода минеральная арктик б/г 2.0	48140	Продукты питания (folder)/Напитки безалкогольные/Вода минеральная	3614135	ARCTIC (MEGAPACK/VIDNOE)
25347	4602983004486	Вода минеральная арктик газированная 0.500	48140	Продукты питания (folder)/Напитки безалкогольные/Вода минеральная	3614135	ARCTIC (MEGAPACK/VIDNOE)
22537	4602983004646	Вода минеральная арктик газированная 1.5л пл/б	48140	Продукты питания (folder)/Напитки безалкогольные/Вода минеральная	3614135	ARCTIC (MEGAPACK/VIDNOE)
48167	4602983003496	Вода минеральная арктик негазированная спорт 0.5л	48140	Продукты питания (folder)/Напитки безалкогольные/Вода минеральная	48166	Арктик
25348	4602983004561	Вода минеральная арктик спорт 0.5л	48140	Продукты питания (folder)/Напитки безалкогольные/Вода минеральная	3614135	ARCTIC (MEGAPACK/VIDNOE)
2855828	4602983006756	Вода минеральная арктик фреш спорт 0.5	48140	Продукты питания (folder)/Напитки безалкогольные/Вода минеральная	0	
2427921	096475103018	Вода минеральная арктика 1.5л	48140	Продукты питания (folder)/Напитки безалкогольные/Вода минеральная	0	
2427922	096475103032	Вода минеральная арктика 1.5л йодированная	48140	Продукты питания (folder)/Напитки безалкогольные/Вода минеральная	0	
3614923	4630001591137	Вода минеральная армейская газированная 0.5л	48140	Продукты питания (folder)/Напитки безалкогольные/Вода минеральная	3614922	ARMEYSKAYA (VOENTORG)
452414	4601593002097	Вода минеральная Архыз Vita газированная 1л пл/бут	48140	Продукты питания (folder)/Напитки безалкогольные/Вода минеральная	452412	VITA
159230	4601593000925	Вода минеральная Архыз газированная 0.33л пл/бут	48140	Продукты питания (folder)/Напитки безалкогольные/Вода минеральная	452412	VITA
159232	4601593001038	Вода минеральная Архыз газированная с/б 0.500	48140	Продукты питания (folder)/Напитки безалкогольные/Вода минеральная	3769314	Vita Архыз
692451	4601593000895	Вода минеральная Архыз клубника газированная 1л пл/бут	48140	Продукты питания (folder)/Напитки безалкогольные/Вода минеральная	48168	Архыз
3293616	4605035007381	Вода минеральная Архыз легенда гор газированная 0.5л пл/бут	48140	Продукты питания (folder)/Напитки безалкогольные/Вода минеральная	48168	Архыз
3293617	4605035007145	Вода минеральная Архыз легенда гор газированная столовая 1.5л пл/бут	48140	Продукты питания (folder)/Напитки безалкогольные/Вода минеральная	48168	Архыз
3293618	4605035007350	Вода минеральная Архыз легенда гор негазированная 0.5л пл/бут	48140	Продукты питания (folder)/Напитки безалкогольные/Вода минеральная	48168	Архыз
3795572	4605035007183	Вода минеральная Архыз легенда гор негазированная 5л	48140	Продукты питания (folder)/Напитки безалкогольные/Вода минеральная	48168	Архыз
452413	4601593001755	Вода минеральная Архыз негазированная 0.33л пл/бут	48140	Продукты питания (folder)/Напитки безалкогольные/Вода минеральная	452412	VITA
1196747	4601593001885	Вода минеральная Архыз негазированная 0.5л стекло	48140	Продукты питания (folder)/Напитки безалкогольные/Вода минеральная	3769314	Vita Архыз
3293619	4601593001601	Вода минеральная Архыз негазированная 1.5л пл/бут #2	48140	Продукты питания (folder)/Напитки безалкогольные/Вода минеральная	3769314	Vita Архыз
1181794	4601593002714	Вода минеральная Архыз негазированная 1л пл/бут	48140	Продукты питания (folder)/Напитки безалкогольные/Вода минеральная	3769314	Vita Архыз
48178	4601593001410	Вода минеральная Архыз негазированная 750мл пэт	48140	Продукты питания (folder)/Напитки безалкогольные/Вода минеральная	48168	Архыз
48172	4601593001397	Вода минеральная Архыз негазированная п/э 0.600	48140	Продукты питания (folder)/Напитки безалкогольные/Вода минеральная	48168	Архыз
3293620	4601593003841	Вода минеральная Архыз негаированная 0.5л ст/б	48140	Продукты питания (folder)/Напитки безалкогольные/Вода минеральная	3769314	Vita Архыз
48181	4601593001472	Вода минеральная Архыз спорт 750мл пэт	48140	Продукты питания (folder)/Напитки безалкогольные/Вода минеральная	48168	Архыз
48177	4601593001373	Вода минеральная Архыз спорт негазированная 0.5л пл/бут	48140	Продукты питания (folder)/Напитки безалкогольные/Вода минеральная	48168	Архыз
692448	4601593001212	Вода минеральная Архыз+клубника газированная 0.5л пэт	48140	Продукты питания (folder)/Напитки безалкогольные/Вода минеральная	48168	Архыз
48180	4601593000420	Вода минеральная Архыз, негазированная 5л пл/бс	48140	Продукты питания (folder)/Напитки безалкогольные/Вода минеральная	48168	Архыз
1196748	460159300213	Вода минеральная архызик для детей 5.0+	48140	Продукты питания (folder)/Напитки безалкогольные/Вода минеральная	0	
1196646	4601593002844	Вода минеральная архызик негазированная 1.5л пл/б	48140	Продукты питания (folder)/Напитки безалкогольные/Вода минеральная	3614759	ARKHYZIK
3293621	4607068710108	Вода минеральная аршан лечебно-столовая 1л пл/б	48140	Продукты питания (folder)/Напитки безалкогольные/Вода минеральная	0	
1789849	4620005860018	Вода минеральная ахсау прир.ст.негаз.5л	48140	Продукты питания (folder)/Напитки безалкогольные/Вода минеральная	3618163	AXCAY
3293622	4607040450022	Вода минеральная ачалуки 0.5л ст/б	48140	Продукты питания (folder)/Напитки безалкогольные/Вода минеральная	3608040	ACHALUKI (MINVODA ACHALUKI/INGUSHETIYA)
3293623	4607040450053	Вода минеральная ачалуки 1л пл/бут	48140	Продукты питания (folder)/Напитки безалкогольные/Вода минеральная	3608040	ACHALUKI (MINVODA ACHALUKI/INGUSHETIYA)
2855830	4607040450039	Вода минеральная ачалуки газированная 0.500	48140	Продукты питания (folder)/Напитки безалкогольные/Вода минеральная	3608040	ACHALUKI (MINVODA ACHALUKI/INGUSHETIYA)
2721163	4607040450015	Вода минеральная ачалуки газированная 1.5л пл/бут	48140	Продукты питания (folder)/Напитки безалкогольные/Вода минеральная	3608040	ACHALUKI (MINVODA ACHALUKI/INGUSHETIYA)
3293624	4607040452309	Вода минеральная ачалуки негазированная 1.5л пл/бут	48140	Продукты питания (folder)/Напитки безалкогольные/Вода минеральная	3608040	ACHALUKI (MINVODA ACHALUKI/INGUSHETIYA)
3293625	4607040452408	Вода минеральная ачалуки слабогазированная 1.5л пл/б	48140	Продукты питания (folder)/Напитки безалкогольные/Вода минеральная	3608040	ACHALUKI (MINVODA ACHALUKI/INGUSHETIYA)
3293626	4607017095898	Вода минеральная аш-тау газированная 0.5л пл/бут	48140	Продукты питания (folder)/Напитки безалкогольные/Вода минеральная	3780548	АШТАУ
2721286	4607017094020	Вода минеральная аш-тау газированная 0.5л ст/б	48140	Продукты питания (folder)/Напитки безалкогольные/Вода минеральная	3615851	ASHTAU (Старый источник VK/MINVODY)
2721287	4607017093894	Вода минеральная аш-тау лечебно-столовая газированная 1.5л пл/б	48140	Продукты питания (folder)/Напитки безалкогольные/Вода минеральная	3615851	ASHTAU (Старый источник VK/MINVODY)
2721164	460701709402	Вода минеральная аштау газированная 0.5л стекло старый источек	48140	Продукты питания (folder)/Напитки безалкогольные/Вода минеральная	0	
2721165	460701709389	Вода минеральная аштау газированная 1.5л старый источек	48140	Продукты питания (folder)/Напитки безалкогольные/Вода минеральная	0	
2855831	4607931606040	Вода минеральная б/газ. емв живода 1.5л х 6 пэт	48140	Продукты питания (folder)/Напитки безалкогольные/Вода минеральная	3775902	ZHIVODA (ESSENTUKSKIE MINERALNYE VODY+/Ессентуки)
692454	4603521010099	Вода минеральная багиатти газированная 0.5л с/б	48140	Продукты питания (folder)/Напитки безалкогольные/Вода минеральная	692453	Багиатти
3619145	4603521010020	Вода минеральная багиатти леч/ст.газ.ст/б 0.33л	48140	Продукты питания (folder)/Напитки безалкогольные/Вода минеральная	3619143	BAGIATTI (KEY-T/VLADIKAVKAZ)
1760558	4603521010044	Вода минеральная багиатти лечебно-столовая газированная 1.5л	48140	Продукты питания (folder)/Напитки безалкогольные/Вода минеральная	3619143	BAGIATTI (KEY-T/VLADIKAVKAZ)
1660395	3068320106960	Вода минеральная бадуа 0.33л п/б	48140	Продукты питания (folder)/Напитки безалкогольные/Вода минеральная	48185	Бадуа
2227685	3068320107028	Вода минеральная бадуа 4x0.33л п/б	17388	Продукты питания (folder)/Напитки безалкогольные/Вода питьевая	48185	Бадуа
1196608	3068320106991	Вода минеральная бадуа негазированная 1л п/б	17388	Продукты питания (folder)/Напитки безалкогольные/Вода питьевая	48185	Бадуа
2227686	4670010850382	Вода минеральная Байкал резерв газированная 0.25л с/б	17388	Продукты питания (folder)/Напитки безалкогольные/Вода питьевая	1196609	Байкал Резерв
2855832	4607154510568	Вода минеральная байкальская 0.5л негазированная, иркутский завод розлива минеральных вод	48140	Продукты питания (folder)/Напитки безалкогольные/Вода минеральная	3780926	байкальская (BAIKALSEA GK)
2721166	4601642014941	Вода минеральная без газированная 0.33л дюссо	48140	Продукты питания (folder)/Напитки безалкогольные/Вода минеральная	0	
2721168	4601642014972	Вода минеральная без газированная 1л дюссо	48140	Продукты питания (folder)/Напитки безалкогольные/Вода минеральная	3649421	DYUSSO (RADUGA-BOTTLERS/SARATOV)
3293627	4607160290683	Вода минеральная белебеевская 2 газированная 1.5л пл/б	48140	Продукты питания (folder)/Напитки безалкогольные/Вода минеральная	3782703	белебеевская BELEBEEVS (BASHSPIRT GK/RUSSIA)
3293628	4607160290690	Вода минеральная белебеевская-2 газированная 0.5л	48140	Продукты питания (folder)/Напитки безалкогольные/Вода минеральная	0	
3293629	4607079540060	Вода минеральная белокурихинская восточная-2 газированная 1.5л пл/бут	48140	Продукты питания (folder)/Напитки безалкогольные/Вода минеральная	3621939	BELOKURIKHINSKAYA-VOSTOCHNAYA (AKVA-MASTER/BARNAUL)
3293630	4607079540046	Вода минеральная белокурихинская, негазированная 5л пл/б	48140	Продукты питания (folder)/Напитки безалкогольные/Вода минеральная	3621939	BELOKURIKHINSKAYA-VOSTOCHNAYA (AKVA-MASTER/BARNAUL)
48190	4601949001866	Вода минеральная берегиня газированная пэт 1.5л	48140	Продукты питания (folder)/Напитки безалкогольные/Вода минеральная	48188	Берегиня
143506	4820000130240	Вода минеральная березивська негазированная 0.5л	48140	Продукты питания (folder)/Напитки безалкогольные/Вода минеральная	142930	ВОДА БЕРЕЗОВСКАЯ
143532	4820000130981	Вода минеральная березивська с/газ 1.0л	48140	Продукты питания (folder)/Напитки безалкогольные/Вода минеральная	142930	ВОДА БЕРЕЗОВСКАЯ
1196749	4810497000164	Вода минеральная березинская-1 газированная 1.5	48140	Продукты питания (folder)/Напитки безалкогольные/Вода минеральная	0	
1196750	4810497000188	Вода минеральная березинская-2 газированная 1.5	48140	Продукты питания (folder)/Напитки безалкогольные/Вода минеральная	0	
2427923	4810497000980	Вода минеральная березинская-2 леч.-стол. 0.5л	48140	Продукты питания (folder)/Напитки безалкогольные/Вода минеральная	0	
2427924	4810497000997	Вода минеральная березинская-3 0.5л	48140	Продукты питания (folder)/Напитки безалкогольные/Вода минеральная	0	
1196751	4810497000201	Вода минеральная березинская-3 газированная 1.5	48140	Продукты питания (folder)/Напитки безалкогольные/Вода минеральная	0	
1196752	4810497000607	Вода минеральная березинская-4 газированная 1.5	48140	Продукты питания (folder)/Напитки безалкогольные/Вода минеральная	0	
3293631	4607039221596	Вода минеральная березово-ярская газированная 0.5л пл/бут	48140	Продукты питания (folder)/Напитки безалкогольные/Вода минеральная	0	
3293632	4607039220704	Вода минеральная березово-ярская газированная 1.5л пл/бут	48140	Продукты питания (folder)/Напитки безалкогольные/Вода минеральная	3810130	Золотая SOVA (Золотая SOVA TD/KEMEROVO)
3293633	4630000620081	Вода минеральная березово-ярская газированная 1.5л пл/бут #2	48140	Продукты питания (folder)/Напитки безалкогольные/Вода минеральная	3623012	BERYOZOVOYARSKAYA (KRASNOGORSKOE/KEMEROVO)
143533	4820000130974	Вода минеральная березовская негазированная 1л	48140	Продукты питания (folder)/Напитки безалкогольные/Вода минеральная	142930	ВОДА БЕРЕЗОВСКАЯ
143599	4820000131070	Вода минеральная березовская негазированная 3л	48140	Продукты питания (folder)/Напитки безалкогольные/Вода минеральная	142930	ВОДА БЕРЕЗОВСКАЯ
143607	4820000130516	Вода минеральная березовская негазированная 5л	48140	Продукты питания (folder)/Напитки безалкогольные/Вода минеральная	142930	ВОДА БЕРЕЗОВСКАЯ
143611	4820000131001	Вода минеральная березовская негазированная 6.5л	48140	Продукты питания (folder)/Напитки безалкогольные/Вода минеральная	142930	ВОДА БЕРЕЗОВСКАЯ
143505	4820000130165	Вода минеральная березовская с/газ. 0.5л	48140	Продукты питания (folder)/Напитки безалкогольные/Вода минеральная	142930	ВОДА БЕРЕЗОВСКАЯ
143593	4820000130073	Вода минеральная березовская с/газ. 1.5л	48140	Продукты питания (folder)/Напитки безалкогольные/Вода минеральная	142930	ВОДА БЕРЕЗОВСКАЯ
142945	4820000130257	Вода минеральная березовская с/газ. 2л	48140	Продукты питания (folder)/Напитки безалкогольные/Вода минеральная	142930	ВОДА БЕРЕЗОВСКАЯ
48203	4850012000118	Вода минеральная бжни газированная 1л пл\бут	48140	Продукты питания (folder)/Напитки безалкогольные/Вода минеральная	48202	Бжни
3625139	4850012000514	Вода минеральная бжни газированная ст/б 0.5л	48140	Продукты питания (folder)/Напитки безалкогольные/Вода минеральная	3625138	BJNI (BJNI Z-D MIN.VOD/SIL GROUP/ARMENIA)
1196753	4600433600660	Вода минеральная биба газированная 0.25л	48140	Продукты питания (folder)/Напитки безалкогольные/Вода минеральная	0	
159174	4600433500113	Вода минеральная биба газированная 0.5л пл/бут	48140	Продукты питания (folder)/Напитки безалкогольные/Вода минеральная	0	
159175	4600433500076	Вода минеральная биба газированная 1.5л пл/бут	48140	Продукты питания (folder)/Напитки безалкогольные/Вода минеральная	3623614	BIBA (MERKURIY GK/CHERKESK)
3293634	4600433601667	Вода минеральная биба терминальная газированная 1.5л пэт	48140	Продукты питания (folder)/Напитки безалкогольные/Вода минеральная	3623614	BIBA (MERKURIY GK/CHERKESK)
692457	8594730112314	Вода минеральная билинска кисилка н/г 0.5л п/б	48140	Продукты питания (folder)/Напитки безалкогольные/Вода минеральная	48208	Билинска
2227687	8594730100014	Вода минеральная билинска кисилка н/г 0.5л п/б #2	17388	Продукты питания (folder)/Напитки безалкогольные/Вода питьевая	48208	Билинска
48209	8594730111317	Вода минеральная билинска кисилка н/г пэт 0.5л	48140	Продукты питания (folder)/Напитки безалкогольные/Вода минеральная	48208	Билинска
