ID	UPCEAN	Name	CategoryID	CategoryName	BrandID	BrandName
1384775	7613033561771	Purina bakers complete chick meaty meal pm2.75 1kg	1	Неклассифицированные/default	341308	Purina Bakers
906883	7613033392856	Purina bakers complete chicken&veg pm3.99 1.5kg	622408	Продукты питания (folder)/Бакалея	341308	Purina Bakers
563102	7613031906963	Purina bakers complete chicken/veg pm339 1.5kg	1	Неклассифицированные/default	341308	Purina Bakers
341319	7613031501892	Purina bakers complete gravy bites 2in1 chicken and vegetable 3kg	19035	Товары для животных (folder)/Корм для животных (folder)/Корм для собак	341308	Purina Bakers
341321	7613031391554	Purina bakers complete meaty meals chicken 3kg	19035	Товары для животных (folder)/Корм для животных (folder)/Корм для собак	341308	Purina Bakers
341323	7613032297282	Purina bakers complete meaty meals puppy with beef 950g	19035	Товары для животных (folder)/Корм для животных (folder)/Корм для собак	341308	Purina Bakers
341324	7613032600198	Purina bakers complete meaty meals small Dog beef 950g	19035	Товары для животных (folder)/Корм для животных (folder)/Корм для собак	341308	Purina Bakers
341326	7613031234615	Purina bakers complete puppy chicken and vegetable 3kg	19035	Товары для животных (folder)/Корм для животных (folder)/Корм для собак	341308	Purina Bakers
1384776	7613033392870	Purina bakers complete rabbit&duck pm3.99 1.5kg	1	Неклассифицированные/default	341308	Purina Bakers
563104	7613031907571	Purina bakers complete rbit/duck pm339 1.5kg	1	Неклассифицированные/default	341308	Purina Bakers
341330	7613031863938	Purina bakers complete senior beef Rice and vegetable 3kg	19035	Товары для животных (folder)/Корм для животных (folder)/Корм для собак	341308	Purina Bakers
341333	7613030418313	Purina bakers complete small Dog beef and vegetable 3kg	19035	Товары для животных (folder)/Корм для животных (folder)/Корм для собак	341308	Purina Bakers
341334	7613030415053	Purina bakers complete small Dog beef and vegetable medley 1kg	19035	Товары для животных (folder)/Корм для животных (folder)/Корм для собак	341308	Purina Bakers
341335	7613032467302	Purina bakers complete small Dog chicken and vegetable 3kg	19035	Товары для животных (folder)/Корм для животных (folder)/Корм для собак	341308	Purina Bakers
341342	7613032717841	Purina bakers dental delicious large chicken 270g	19035	Товары для животных (folder)/Корм для животных (folder)/Корм для собак	341308	Purina Bakers
341343	7613032717605	Purina bakers dental delicious medium beef 200g	337596	Товары для животных (folder)/Pets	341308	Purina Bakers
341344	7613032717629	Purina bakers dental delicious medium chicken 200g	337596	Товары для животных (folder)/Pets	341308	Purina Bakers
341345	7613032720162	Purina bakers dental delicious small chicken 110g	19035	Товары для животных (folder)/Корм для животных (folder)/Корм для собак	341308	Purina Bakers
341346	7613031501731	Purina bakers gravy bite 2in1 beef&veg 1kg	337596	Товары для животных (folder)/Pets	341308	Purina Bakers
563084	7613031501878	Purina bakers gravy bite 2in1 beef&veg 3kg	1	Неклассифицированные/default	341308	Purina Bakers
341347	7613031501854	Purina bakers gravy bites 2in1 ckn&veg 1kg	337596	Товары для животных (folder)/Pets	341308	Purina Bakers
341350	7613032706005	Purina bakers healthy delights 150g	19035	Товары для животных (folder)/Корм для животных (folder)/Корм для собак	341308	Purina Bakers
341355	7613033401107	Purina bakers meaty meals beef 1kg	337596	Товары для животных (folder)/Pets	341308	Purina Bakers
341356	7613033401121	Purina bakers meaty meals chicken 1kg	337596	Товары для животных (folder)/Pets	341308	Purina Bakers
341368	7613031440627	Purina bakers rewards chicken 15 sticks 126g	337596	Товары для животных (folder)/Pets	341308	Purina Bakers
341369	7613031440603	Purina bakers rewards mixed 15 sticks 126g	337596	Товары для животных (folder)/Pets	341308	Purina Bakers
341372	7613033021046	Purina bakers treats sizzlers bacon 120g	19035	Товары для животных (folder)/Корм для животных (folder)/Корм для собак	341308	Purina Bakers
341374	7613033020810	Purina bakers whirlers ham and Cheese 150g	19035	Товары для животных (folder)/Корм для животных (folder)/Корм для собак	341308	Purina Bakers
1582828	038100031419	Purina bcn/chs beggi	1	Неклассифицированные/default	199427	Purina
2663604	017800149587	Purina be Happy Adult Dog Food beef flavor	1	Неклассифицированные/default	199427	Purina
2663605	017800149617	Purina be Happy Adult Dog Food chicken flavor	1	Неклассифицированные/default	199427	Purina
2663606	017800149525	Purina be Happy Cat Food deep sea duos	1	Неклассифицированные/default	602731	Happy Cat
2663607	017800149501	Purina be Happy Cat Food poultry pair-adise crunchies	1	Неклассифицированные/default	602731	Happy Cat
2663608	017800149549	Purina be Happy crunchies with chicken&Turkey flavors Cat Food	1	Неклассифицированные/default	199427	Purina
2663609	017800149556	Purina be Happy deep sea duos Cat Food	1	Неклассифицированные/default	199427	Purina
2520739	011132170974	Purina beef t bonz porterhouse 10oz	1	Неклассифицированные/default	0	
2663610	038100151490	Purina beggin colisions bacon&ranch flavors	1	Неклассифицированные/default	199427	Purina
2663617	038100148544	Purina beggin strips brand Dog snack applewood smoked	1	Неклассифицированные/default	199427	Purina
2663611	038100148452	Purina beggin' colisions Dog snack bacon&Peanut Butter	1	Неклассифицированные/default	199427	Purina
2663612	038100147912	Purina beggin' Dog snack thick cut maple flavor	1	Неклассифицированные/default	199427	Purina
2663613	038100147936	Purina beggin' Dog snack thick cut maple flavor #2	1	Неклассифицированные/default	199427	Purina
1389284	038100533036	Purina beggin' littles bacon flavor Dog snack	21915	Товары для животных (folder)/Корм для животных (folder)/Корм для животных	199427	Purina
1389275	038100496218	Purina beggin' strips bacon flavor Dog snack	1	Неклассифицированные/default	199427	Purina
2663614	038100016171	Purina beggin' strips bacon flavor Dog snacks	1	Неклассифицированные/default	199427	Purina
2663615	038100141804	Purina beggin' strips bacon&beef	1	Неклассифицированные/default	199427	Purina
1389277	038100615572	Purina beggin' strips bacon&beef flavors Dog snack	1	Неклассифицированные/default	199427	Purina
2663616	038100111449	Purina beggin' strips bacon&Cheese flavors Dog snacks	1	Неклассифицированные/default	199427	Purina
1389278	038100535788	Purina beggin' strips Dog snack bacon&Cheese flavors	1	Неклассифицированные/default	199427	Purina
2663618	038100143006	Purina beggin' strips thick cut hickory smoked flavor Dog snacks	1	Неклассифицированные/default	199427	Purina
2663619	038100143020	Purina beggin' strips thick cut hickory smoked flavor Dog snacks #2	1	Неклассифицированные/default	199427	Purina
1934007	038100154156	Purina beggn strips party poppers 7oz	1	Неклассифицированные/default	0	
2663620	017800149563	Purina behappy Adult Dog Food beef flavored	1	Неклассифицированные/default	199427	Purina
2663621	017800149570	Purina behappy Adult Dog Food chicken flavor	1	Неклассифицированные/default	199427	Purina
2663622	017800144346	Purina beneful baked delights Dog snacks hugs beef&Cheese	1	Неклассифицированные/default	199427	Purina
2663623	017800151948	Purina beneful baked delights Dog snacks stars with chicken&Cheese	1	Неклассифицированные/default	199427	Purina
2663624	017800144377	Purina beneful baked delights heartfuls with Apple flavored filling and real bacon	1	Неклассифицированные/default	199427	Purina
2663625	017800149778	Purina beneful baked delights hugs with beef and Cheese	1	Неклассифицированные/default	199427	Purina
1934008	017800134767	Purina beneful beef Dog Food 15.5 lb	19035	Товары для животных (folder)/Корм для животных (folder)/Корм для собак	199427	Purina
2027306	017800134774	Purina beneful beef Dog Food 31.1 lb	337596	Товары для животных (folder)/Pets	199427	Purina
2027307	017800134811	Purina beneful beef Dog Food 5/7 lb case	337596	Товары для животных (folder)/Pets	199427	Purina
2027308	017800134859	Purina beneful beef Dog Food 6/3.5 lb case	337596	Товары для животных (folder)/Pets	199427	Purina
1389993	017800014502	Purina beneful Dog Food	19035	Товары для животных (folder)/Корм для животных (folder)/Корм для собак	199427	Purina
1934009	017800134835	Purina beneful Dog Food 3.5 lb	19035	Товары для животных (folder)/Корм для животных (folder)/Корм для собак	199427	Purina
2663626	017800154949	Purina beneful Dog Food chopped blends beef, carrots, peas&barley	1	Неклассифицированные/default	199427	Purina
2663627	017800154963	Purina beneful Dog Food chopped blends chicken, carrots, peas&Wild Rice	1	Неклассифицированные/default	199427	Purina
1389995	017800101639	Purina beneful Dog Food healthy growth for puppies	19035	Товары для животных (folder)/Корм для животных (folder)/Корм для собак	199427	Purina
1389996	017800104500	Purina beneful Dog Food healthy harvest	19035	Товары для животных (folder)/Корм для животных (folder)/Корм для собак	199427	Purina
1389997	017800104517	Purina beneful Dog Food healthy harvest #2	19035	Товары для животных (folder)/Корм для животных (folder)/Корм для собак	199427	Purina
1389998	017800104524	Purina beneful Dog Food healthy harvest #3	19035	Товары для животных (folder)/Корм для животных (folder)/Корм для собак	199427	Purina
1389999	017800029407	Purina beneful Dog Food healthy radiance	19035	Товары для животных (folder)/Корм для животных (folder)/Корм для собак	199427	Purina
1390000	017800029414	Purina beneful Dog Food healthy radiance #2	19035	Товары для животных (folder)/Корм для животных (folder)/Корм для собак	199427	Purina
2663628	017800134736	Purina beneful Dog Food healthy radiance #3	1	Неклассифицированные/default	199427	Purina
1390001	017800024747	Purina beneful Dog Food healthy weight	19035	Товары для животных (folder)/Корм для животных (folder)/Корм для собак	199427	Purina
2663629	017800134620	Purina beneful Dog Food healthy weight #2	1	Неклассифицированные/default	199427	Purina
1390002	017800024716	Purina beneful Dog Food healthy weight Formula	19035	Товары для животных (folder)/Корм для животных (folder)/Корм для собак	199427	Purina
2663630	017800153003	Purina beneful Dog Food mediterranean style medley - 3 ct	1	Неклассифицированные/default	199427	Purina
1390003	017800029391	Purina beneful Dog Food moist chewy chunks healthy radiance ground	19035	Товары для животных (folder)/Корм для животных (folder)/Корм для собак	199427	Purina
1390004	017800024723	Purina beneful Dog Food moist chewy chunks healthy weight	19035	Товары для животных (folder)/Корм для животных (folder)/Корм для собак	199427	Purina
1390005	017800014519	Purina beneful Dog Food moist meaty chunks	19035	Товары для животных (folder)/Корм для животных (folder)/Корм для собак	199427	Purina
1390006	017800014526	Purina beneful Dog Food moist meaty chunks #2	19035	Товары для животных (folder)/Корм для животных (folder)/Корм для собак	199427	Purina
1390007	017800014489	Purina beneful Dog Food Original	19035	Товары для животных (folder)/Корм для животных (folder)/Корм для собак	199427	Purina
2663631	017800134804	Purina beneful Dog Food Original #2	1	Неклассифицированные/default	199427	Purina
2663632	017800149891	Purina beneful Dog Food Original #3	1	Неклассифицированные/default	199427	Purina
1390008	017800126267	Purina beneful Dog Food playful Life	19035	Товары для животных (folder)/Корм для животных (folder)/Корм для собак	199427	Purina
2663633	017800126281	Purina beneful Dog Food playful Life #2	1	Неклассифицированные/default	199427	Purina
1390010	017800109666	Purina beneful Dog Food roasted pork entree	19035	Товары для животных (folder)/Корм для животных (folder)/Корм для собак	199427	Purina
2663634	017800152938	Purina beneful Dog Food tuscan style medley - 3 ct	1	Неклассифицированные/default	199427	Purina
1390012	017800102131	Purina beneful Dog Food-healthy growth for puppies	19035	Товары для животных (folder)/Корм для животных (folder)/Корм для собак	199427	Purina
2663636	017800141970	Purina beneful healthy fiesta with moist chewy chunks	1	Неклассифицированные/default	199427	Purina
2027310	017800102148	Purina beneful healthy growth puppy Food 31.1 lb	337596	Товары для животных (folder)/Pets	199427	Purina
2027311	017800104531	Purina beneful healthy harvest Blend Dog Food 31.1 lb	337596	Товары для животных (folder)/Pets	199427	Purina
2663637	017800134712	Purina beneful healthy radiance	1	Неклассифицированные/default	199427	Purina
2027312	017800134682	Purina beneful healthy radiance Skin/coat 15.5 lb	337596	Товары для животных (folder)/Pets	199427	Purina
2027313	017800134699	Purina beneful healthy radiance Skin/coat 31.1 lb	337596	Товары для животных (folder)/Pets	199427	Purina
2027314	017800134743	Purina beneful healthy radiance Skin/coat 5/7 lb case	337596	Товары для животных (folder)/Pets	199427	Purina
2027315	017800134729	Purina beneful healthy radiance Skin/coat 6/3.5 lb case	337596	Товары для животных (folder)/Pets	199427	Purina
2027309	017800154727	Purina beneful healthy smile dental Dog snacks twists sm/med - 10 ct	1	Неклассифицированные/default	199427	Purina
2663638	017800154666	Purina beneful healthy smile large dental Dog snacks ridges - 7 ct	1	Неклассифицированные/default	199427	Purina
2663639	017800154703	Purina beneful healthy smile large dental Dog snacks twists - 7 ct	1	Неклассифицированные/default	199427	Purina
2663640	017800154680	Purina beneful healthy smile sm/med dental Dog snacks ridges - 10 ct	1	Неклассифицированные/default	199427	Purina
1934010	017800134590	Purina beneful healthy weight Adult Dog Food	1	Неклассифицированные/default	199427	Purina
2663641	017800134651	Purina beneful healthy weight Dog Food	1	Неклассифицированные/default	199427	Purina
2027316	017800134606	Purina beneful healthy weight Dog Food 31.1 lb	337596	Товары для животных (folder)/Pets	199427	Purina
2027317	017800134644	Purina beneful healthy weight Dog Food 5/7 lb case	337596	Товары для животных (folder)/Pets	199427	Purina
2027318	017800134675	Purina beneful healthy weight Dog Food 6/3.5 lb case	337596	Товары для животных (folder)/Pets	199427	Purina
2822929	017800158435	Purina beneful hlthy smi	1	Неклассифицированные/default	0	
1389994	017800024730	Purina beneful hlthy wt	19035	Товары для животных (folder)/Корм для животных (folder)/Корм для собак	199427	Purina
2663642	017800136402	Purina beneful incredibites Dog Food	1	Неклассифицированные/default	199427	Purina
2027319	017800136396	Purina beneful incredibites Dog Food 15.5 lb	337596	Товары для животных (folder)/Pets	199427	Purina
2027320	017800137027	Purina beneful incredibites Dog Food 2/5.25 lb	337596	Товары для животных (folder)/Pets	199427	Purina
2027321	017800126335	Purina beneful playful Life hi protein Dog Food 31.1 lb	337596	Товары для животных (folder)/Pets	199427	Purina
2027322	017800126304	Purina beneful playful Life hi protein Dog Food 5/7 lb case	337596	Товары для животных (folder)/Pets	199427	Purina
2027323	017800126274	Purina beneful playful Life hi protein Dog Food 6/3.5 lb case	337596	Товары для животных (folder)/Pets	199427	Purina
566064	017800109659	Purina beneful prepared meals beef stew Dog Food	19035	Товары для животных (folder)/Корм для животных (folder)/Корм для собак	199427	Purina
183769	017800128599	Purina beneful prepared meals beef&chicken medley Dog Food	19035	Товары для животных (folder)/Корм для животных (folder)/Корм для собак	199427	Purina
2663643	017800128612	Purina beneful prepared meals chicken stew Dog Food	1	Неклассифицированные/default	199427	Purina
2663644	017800144452	Purina beneful prepared meals Dog Food hearty roasters savory beef recipe	1	Неклассифицированные/default	199427	Purina
2663645	017800144476	Purina beneful prepared meals Dog Food hearty roasters savory pork recipe	1	Неклассифицированные/default	199427	Purina
2663646	017800144513	Purina beneful prepared meals Dog Food hearty roasters savory Turkey recipe	1	Неклассифицированные/default	199427	Purina
566065	017800107648	Purina beneful prepared meals roasted chicken recipe Dog Food	19035	Товары для животных (folder)/Корм для животных (folder)/Корм для собак	199427	Purina
2663647	017800109680	Purina beneful prepared meals roasted Turkey medley Dog Food	1	Неклассифицированные/default	199427	Purina
566066	017800109673	Purina beneful prepared meals savory Rice&lamb stew Dog Food	19035	Товары для животных (folder)/Корм для животных (folder)/Корм для собак	199427	Purina
566067	017800109635	Purina beneful prepared meals simmered beef entree Dog Food	19035	Товары для животных (folder)/Корм для животных (folder)/Корм для собак	199427	Purina
1390011	017800109642	Purina beneful prepared meals simmered chicken medley Dog Food	19035	Товары для животных (folder)/Корм для животных (folder)/Корм для собак	199427	Purina
2663648	017800152969	Purina beneful romana style medley - 3 ct	1	Неклассифицированные/default	199427	Purina
2027324	017800134187	Purina beneful snackin slices 4/20oz	337596	Товары для животных (folder)/Pets	199427	Purina
2027325	017800128902	Purina beneful snackin slices 5/11oz	337596	Товары для животных (folder)/Pets	199427	Purina
2822930	017800163873	Purina beyond Cat Food ckn whl oat meal 3 lb	1	Неклассифицированные/default	0	
2822931	017800163811	Purina beyond Cat Food gf ckn bf carrot 3oz	1	Неклассифицированные/default	0	
2822932	017800163774	Purina beyond Cat Food gf ckn swt pot 3oz	1	Неклассифицированные/default	0	
2822933	017800164108	Purina beyond Cat Food gf slm&swt pota 3oz	1	Неклассифицированные/default	0	
2822934	017800164078	Purina beyond Cat Food gf tky pot spnch 3oz	1	Неклассифицированные/default	0	
2822935	017800163965	Purina beyond Cat Food gf tn/mckrl/crt 3oz	1	Неклассифицированные/default	0	
2822936	017800163897	Purina beyond Cat Food gf trout catfish 3oz	1	Неклассифицированные/default	0	
2822937	017800164030	Purina beyond Cat Food gf Wild Salmon 3oz	1	Неклассифицированные/default	0	
2822938	017800163712	Purina beyond Cat Food gf wtfsh spinach 3oz	1	Неклассифицированные/default	0	
2822939	017800163859	Purina beyond Cat Food gf wtfsh&egg 3 lb	1	Неклассифицированные/default	0	
2822940	017800163835	Purina beyond Cat Food grn fr whtfs/eg 5 lb	1	Неклассифицированные/default	0	
2822941	017800163699	Purina beyond Cat Food herng/eg/swt pt 3 lb	1	Неклассифицированные/default	0	
2822942	017800163675	Purina beyond Cat Food hrng/eg/swt pot 6 lb	1	Неклассифицированные/default	0	
2822943	017800163620	Purina beyond Cat Food Salmon brwn Rice 3 lb	1	Неклассифицированные/default	0	
2822944	017800163644	Purina beyond Cat Food slmn/whl brw rc 6 lb	1	Неклассифицированные/default	0	
2822945	017800170697	Purina beyond Cat grn free chicken egg 3 lb	1	Неклассифицированные/default	0	
2822946	017800170710	Purina beyond Cat grn free chicken egg 5 lb	1	Неклассифицированные/default	0	
2822947	017800170253	Purina beyond Dog bf/pot/grn bn 13oz	1	Неклассифицированные/default	0	
2822948	017800170277	Purina beyond Dog chicken/crt/pea 13oz	1	Неклассифицированные/default	0	
2822949	017800163170	Purina beyond Dog ckn/whl barley 15.5 lb	1	Неклассифицированные/default	0	
2822950	017800163149	Purina beyond Dog Food Salmon egg pmpkn 3.7 lb	1	Неклассифицированные/default	0	
2822951	017800164375	Purina beyond Dog grn fre tun egg 13 lb	1	Неклассифицированные/default	0	
2822952	017800172288	Purina beyond Dog grn free chx egg 13 lb	1	Неклассифицированные/default	0	
2822953	017800172257	Purina beyond Dog grn free chx egg 3 lb	1	Неклассифицированные/default	0	
2822954	017800163224	Purina beyond Dog lamb/whl barley 14.5 lb	1	Неклассифицированные/default	0	
2822955	017800163125	Purina beyond Dog slmn/egg/pmpkin 14.5 lb	1	Неклассифицированные/default	0	
2822956	017800170291	Purina beyond Dog slmn/swt pot 13oz	1	Неклассифицированные/default	0	
2663649	017800164399	Purina beyond Natural Dog Food adventure grain free - tuna&egg recipe	1	Неклассифицированные/default	199427	Purina
2188820	077234600085	Purina big bird brainys Cat toy	337596	Товары для животных (folder)/Pets	0	
2188821	077234600108	Purina birdeez tsr Cat toy	337596	Товары для животных (folder)/Pets	0	
1582830	017800598606	Purina bon	1	Неклассифицированные/default	199427	Purina
199428	8711639250873	Purina bon bacon Dog Food 85g	19035	Товары для животных (folder)/Корм для животных (folder)/Корм для собак	199427	Purina
1582831	017800426862	Purina bonz dg snk	1	Неклассифицированные/default	199427	Purina
2029732	4000487225411	Purina bonzo	1	Неклассифицированные/default	1399393	Purina Bonzo
2029741	7613033836336	Purina bonzo #10	1	Неклассифицированные/default	1399393	Purina Bonzo
2029742	7613033836565	Purina bonzo #11	1	Неклассифицированные/default	1399393	Purina Bonzo
2029743	7613033884818	Purina bonzo #12	1	Неклассифицированные/default	1399393	Purina Bonzo
2029744	7613033884832	Purina bonzo #13	1	Неклассифицированные/default	1399393	Purina Bonzo
2029745	7613033918483	Purina bonzo #14	1	Неклассифицированные/default	1399393	Purina Bonzo
2029746	8710421010213	Purina bonzo #15	1	Неклассифицированные/default	1399393	Purina Bonzo
2029747	8710421011029	Purina bonzo #16	1	Неклассифицированные/default	1399393	Purina Bonzo
2029748	8710421011043	Purina bonzo #17	1	Неклассифицированные/default	1399393	Purina Bonzo
2029749	8710421324211	Purina bonzo #18	1	Неклассифицированные/default	1399393	Purina Bonzo
2029750	8712243030448	Purina bonzo #19	1	Неклассифицированные/default	1399393	Purina Bonzo
2029733	5000161031955	Purina bonzo #2	1	Неклассифицированные/default	1399393	Purina Bonzo
2029734	7613033190926	Purina bonzo #3	1	Неклассифицированные/default	1399393	Purina Bonzo
2029735	7613033191312	Purina bonzo #4	1	Неклассифицированные/default	1399393	Purina Bonzo
