ID	UPCEAN	Name	CategoryID	CategoryName	BrandID	BrandName
365076	4045787114935	Schwarzkopf essensity глина текстурирующая 100мл texturising mud	225	Уход за волосами (folder)/Моделирование прически	365073	Schwarzkopf Essensity
983718	4045787145076	Schwarzkopf essensity кондиционер для окрашенных волос 1000мл	28	Уход за волосами (folder)/Уход за волосами	365073	Schwarzkopf Essensity
983719	4045787145069	Schwarzkopf essensity кондиционер для окрашенных волос 200мл	28	Уход за волосами (folder)/Уход за волосами	365073	Schwarzkopf Essensity
983723	4045787144901	Schwarzkopf essensity Крем для объема 100мл	225	Уход за волосами (folder)/Моделирование прически	365073	Schwarzkopf Essensity
365077	4045787114966	Schwarzkopf essensity Крем разглаживающ. мягкий 150мл smoothing Cream	225	Уход за волосами (folder)/Моделирование прически	365073	Schwarzkopf Essensity
983785	4045787145052	Schwarzkopf essensity маска для окрашенных волос несмываемая 200мл	490	Уход за волосами (folder)/Маска для волос	365073	Schwarzkopf Essensity
983786	4045787145045	Schwarzkopf essensity маска для окрашенных волос несмываемая 750мл	490	Уход за волосами (folder)/Маска для волос	365073	Schwarzkopf Essensity
983790	4045787157116	Schwarzkopf essensity набор для химич. завивки 0 100мл*80мл	379625	Уход за волосами (folder)/Химическая завивка	365073	Schwarzkopf Essensity
365085	4045787114331	Schwarzkopf essensity спрей для волос сильной фикс. 200мл Air fix pump sp	225	Уход за волосами (folder)/Моделирование прически	365073	Schwarzkopf Essensity
983791	4045787145007	Schwarzkopf essensity спрей фиксирующий для волос 200мл	225	Уход за волосами (folder)/Моделирование прически	365073	Schwarzkopf Essensity
1837668	4045787237313	Schwarzkopf essensity шампунь восстанав для окрашенных волос 1000мл New	1412	Уход за волосами (folder)/Шампунь	365073	Schwarzkopf Essensity
983794	4045787145038	Schwarzkopf essensity шампунь для окрашенных волос 1000мл	1412	Уход за волосами (folder)/Шампунь	365073	Schwarzkopf Essensity
1124807	9310714465066	Schwarzkopf Extra Care blond toner 200ml	1	Неклассифицированные/default	0	
1124808	9310714209837	Schwarzkopf Extra Care carat shn Gloss lacq 250	1	Неклассифицированные/default	0	
1124809	9310714209844	Schwarzkopf Extra Care carat shn Gloss spray 150	1	Неклассифицированные/default	0	
1124810	9310714209851	Schwarzkopf Extra Care carat shn Gloss wax 100g	1	Неклассифицированные/default	0	
1124811	9310714201787	Schwarzkopf Extra Care compl styl crm 150ml	1	Неклассифицированные/default	0	
1124812	9310714201794	Schwarzkopf Extra Care compl styl lacq 250g	1	Неклассифицированные/default	0	
1124813	9310714100240	Schwarzkopf Extra Care cond col protect 400ml	1	Неклассифицированные/default	0	
1124814	9310714100288	Schwarzkopf Extra Care cond liq silk 400ml	1	Неклассифицированные/default	0	
1124815	9310714100264	Schwarzkopf Extra Care cond moist enrich 400ml	1	Неклассифицированные/default	0	
1124816	9310714205495	Schwarzkopf Extra Care cond Oil ntrv 400ml	1	Неклассифицированные/default	0	
1124817	9310714209523	Schwarzkopf Extra Care cond recharge q10 400ml	1	Неклассифицированные/default	0	
1124818	9310714200568	Schwarzkopf Extra Care cond repair 19 400ml	1	Неклассифицированные/default	0	
1124819	9310714208557	Schwarzkopf Extra Care cond straight&glossy 400ml	1	Неклассифицированные/default	0	
1124820	9310714207468	Schwarzkopf Extra Care cond treat weightless 350ml	1	Неклассифицированные/default	0	
1124821	9310714208717	Schwarzkopf Extra Care curl flex Mousse 150g	1	Неклассифицированные/default	0	
1124822	9310714208724	Schwarzkopf Extra Care curl flex Shine Cream 150ml	1	Неклассифицированные/default	0	
1124823	9310714209752	Schwarzkopf Extra Care d/nour s/cash msk 250ml	1	Неклассифицированные/default	0	
1124824	9310714209745	Schwarzkopf Extra Care d/nutr cond 400ml	1	Неклассифицированные/default	0	
1124825	9310714390436	Schwarzkopf Extra Care frizz free 70g	1	Неклассифицированные/default	0	
1124826	9310714390399	Schwarzkopf Extra Care Gel wax 100g	1	Неклассифицированные/default	0	
1124827	9310714022948	Schwarzkopf Extra Care h spray lacq sup 500g + bon	1	Неклассифицированные/default	0	
1124828	9310714467169	Schwarzkopf Extra Care Hair spray strg 100g	28	Уход за волосами (folder)/Уход за волосами	0	
1124829	9310714467121	Schwarzkopf Extra Care Hair spray strg 250g	28	Уход за волосами (folder)/Уход за волосами	0	
1124830	9310714467381	Schwarzkopf Extra Care Hair spray strg 400g	28	Уход за волосами (folder)/Уход за волосами	0	
1124831	9310714022917	Schwarzkopf Extra Care Hair spray strg 500g + bon	28	Уход за волосами (folder)/Уход за волосами	0	
1124832	9310714468005	Schwarzkopf Extra Care Hair spray strg pump 200ml	28	Уход за волосами (folder)/Уход за волосами	0	
1124833	9310714467411	Schwarzkopf Extra Care hold lacq Super 400g	1	Неклассифицированные/default	0	
1124834	9310714209769	Schwarzkopf Extra Care ins d/treat 150ml	1	Неклассифицированные/default	0	
1124835	9310714390733	Schwarzkopf Extra Care lv/ in cond 200ml	1	Неклассифицированные/default	0	
1124836	9310714465028	Schwarzkopf Extra Care lv/in treat 100ml	1	Неклассифицированные/default	0	
1124837	9310714200599	Schwarzkopf Extra Care mask rescue me 250ml	1	Неклассифицированные/default	0	
1124838	9310714466902	Schwarzkopf Extra Care mouse strg 150g	1	Неклассифицированные/default	0	
1124839	9310714207482	Schwarzkopf Extra Care Night treat spray t/rep 100ml	1	Неклассифицированные/default	0	
1124840	9310714206355	Schwarzkopf Extra Care nutri cond protect 400ml	1	Неклассифицированные/default	0	
1124841	9310714207499	Schwarzkopf Extra Care nutri Heat serum 100ml	1	Неклассифицированные/default	0	
1124842	9310714205518	Schwarzkopf Extra Care Oil ntvr rep Butter 250ml	1	Неклассифицированные/default	0	
1124843	9310714100257	Schwarzkopf Extra Care Shampoo col protect 400ml	1412	Уход за волосами (folder)/Шампунь	0	
1124844	9310714100301	Schwarzkopf Extra Care Shampoo liq silk 400ml	1412	Уход за волосами (folder)/Шампунь	0	
1124845	9310714100332	Schwarzkopf Extra Care Shampoo moist enrich 400ml	1412	Уход за волосами (folder)/Шампунь	0	
1124846	9310714206348	Schwarzkopf Extra Care Shampoo nutri protect 400ml	1412	Уход за волосами (folder)/Шампунь	0	
1124847	9310714205501	Schwarzkopf Extra Care Shampoo Oil ntrv 400ml	1412	Уход за волосами (folder)/Шампунь	0	
1124848	9310714200629	Schwarzkopf Extra Care Shampoo pearl shim 400ml	1412	Уход за волосами (folder)/Шампунь	0	
1124784	9310714210017	Schwarzkopf Extra Care Shampoo recharge q10 400ml	1412	Уход за волосами (folder)/Шампунь	0	
1124849	9310714200551	Schwarzkopf Extra Care Shampoo repair 19 400ml	1412	Уход за волосами (folder)/Шампунь	0	
1124850	9310714208540	Schwarzkopf Extra Care Shampoo straight&glossy 400ml	1412	Уход за волосами (folder)/Шампунь	0	
1124851	9310714207451	Schwarzkopf Extra Care Shampoo treat weightless 400ml	1412	Уход за волосами (folder)/Шампунь	0	
1124852	9310714208571	Schwarzkopf Extra Care straight&glossy a/frizz 50ml	1	Неклассифицированные/default	0	
1124853	9310714208564	Schwarzkopf Extra Care straight&glossy balm 150ml	1	Неклассифицированные/default	0	
1124854	9310714208694	Schwarzkopf Extra Care straight&glossy Hair spray 250g	28	Уход за волосами (folder)/Уход за волосами	0	
1124855	9310714208700	Schwarzkopf Extra Care straight&glossy Mousse 150g	1	Неклассифицированные/default	0	
1124856	9310714208687	Schwarzkopf Extra Care straight&glossy strgt Cream 70g	1	Неклассифицированные/default	0	
1124857	9310714207208	Schwarzkopf Extra Care straight&glossy zero frizz 150ml	1	Неклассифицированные/default	0	
1124858	9310714465455	Schwarzkopf Extra Care styl lacq Super 100g	1	Неклассифицированные/default	0	
1124859	9310714467435	Schwarzkopf Extra Care styl lacq Super 250g	1	Неклассифицированные/default	0	
1124860	9310714207475	Schwarzkopf Extra Care thera mask t/rep 250ml	1	Неклассифицированные/default	0	
1124861	9310714209530	Schwarzkopf Extra Care treat recharge q10 3x 20ml	1	Неклассифицированные/default	0	
1124806	9310714209776	Schwarzkopf Extra Care treat rep shn&prot 150ml	1	Неклассифицированные/default	0	
1124862	9310714206485	Schwarzkopf Extra Care vol Hair thick ltn 150ml	1	Неклассифицированные/default	0	
1124863	9310714206461	Schwarzkopf Extra Care vol Mousse 150g	1	Неклассифицированные/default	0	
1124864	9310714206454	Schwarzkopf Extra Care vol style 250g	1	Неклассифицированные/default	0	
1124865	9310714206478	Schwarzkopf Extra Care vol style b/Dry spray 150g	1	Неклассифицированные/default	0	
1124866	9310714102275	Schwarzkopf Extra Care z/frizz cond 400ml	1	Неклассифицированные/default	0	
1124867	9310714102305	Schwarzkopf Extra Care z/frizz finish pol 100g	1	Неклассифицированные/default	0	
1124868	9310714102268	Schwarzkopf Extra Care z/frizz Shampoo 400ml	1412	Уход за волосами (folder)/Шампунь	0	
1124869	9310714102299	Schwarzkopf Extra Care z/frizz strgt balm 200ml	1	Неклассифицированные/default	0	
1124870	9310714790571	Schwarzkopf Extra Care zero frizz strait 150ml	1	Неклассифицированные/default	0	
201136	4015000817301	Schwarzkopf Fa deodorants Spring Flower	407	Парфюмерия (folder)/Дезодорант	38	Fa
201137	4015000064545	Schwarzkopf Fa Shower Gel sunset mambo	401	Гигиена (folder)/Гель для душа	38	Fa
305722	870013003585	Schwarzkopf flatliner flat iron Hair serum (6.8oz)	5586	Косметика (folder)/Косметика	29	Schwarzkopf
599413	4045787000726	Schwarzkopf glatt 0 средство для перм выпрямл.сильно вьющ вол 80мл&40мл&40мл п/з	28	Уход за волосами (folder)/Уход за волосами	29	Schwarzkopf
419999	4045787000740	Schwarzkopf glatt 2 средство для перм выпрямл. окраш/пористых вол 80мл&40мл&40мл п/з	360487	Уход за волосами (folder)/Парикмахерская	395956	Schwarzkopf Natural Styling
201140	4012800886377	Schwarzkopf glemo Shampoo	1412	Уход за волосами (folder)/Шампунь	213906	GLEMO
2088304	8410436071093	Schwarzkopf Gliss acondic.express rizos 200ml (sin aclarado)	1	Неклассифицированные/default	2059386	Schwarzkopf Gliss
2088305	8410436071123	Schwarzkopf Gliss acondic.nitro-rizos 250ml	1	Неклассифицированные/default	2059386	Schwarzkopf Gliss
2088306	8410436071222	Schwarzkopf Gliss crema definidora rizos 100ml (sin aclarado)(nutre y protege)	1	Неклассифицированные/default	2059386	Schwarzkopf Gliss
2088400	8410020640773	Schwarzkopf Gliss locion acondic.express brillo (normales)	1	Неклассифицированные/default	2059386	Schwarzkopf Gliss
2088401	8410020647949	Schwarzkopf Gliss repairist sistema rep.3 pasos (champu+reestruct.+fluido)	1	Неклассифицированные/default	2059386	Schwarzkopf Gliss
1171	4012900022200	Schwarzkopf Gloss шампунь для прид.блеска 250	360487	Уход за волосами (folder)/Парикмахерская	0	
2150059	5410091641962	Schwarzkopf got2b	1	Неклассифицированные/default	5912	Schwarzkopf Got2b
2150060	8710678168095	Schwarzkopf got2b #2	1	Неклассифицированные/default	5912	Schwarzkopf Got2b
600479	052336332904	Schwarzkopf got2b 2 sexy 4 voluptuous volume Hair spray	28	Уход за волосами (folder)/Уход за волосами	5912	Schwarzkopf Got2b
2593415	052336905061	Schwarzkopf got2b 2 sexy voluptuous volume Hair spray Body 10 Studio size	1	Неклассифицированные/default	5912	Schwarzkopf Got2b
1481839	052336332607	Schwarzkopf got2b 2 sexy voluptuous volume Mousse	1	Неклассифицированные/default	5912	Schwarzkopf Got2b
2150061	9000100587969	Schwarzkopf got2b 4Play-clean cut pomada 100ml	1	Неклассифицированные/default	5912	Schwarzkopf Got2b
2150062	8410020646652	Schwarzkopf got2b brillo magnetico cera definic 50ml	1	Неклассифицированные/default	5912	Schwarzkopf Got2b
1006722	5410091642020	Schwarzkopf got2b chaotic fibre gum 100ml	1	Неклассифицированные/default	5912	Schwarzkopf Got2b
1007921	052336333048	Schwarzkopf got2b Color heads b/thnd	1	Неклассифицированные/default	5912	Schwarzkopf Got2b
1006723	052336393042	Schwarzkopf got2b Color heads Blue thunder 50ml	1	Неклассифицированные/default	5912	Schwarzkopf Got2b
1007922	052336333024	Schwarzkopf got2b Color heads g/envy	1	Неклассифицированные/default	5912	Schwarzkopf Got2b
1007923	052336333055	Schwarzkopf got2b Color heads m/purp	1	Неклассифицированные/default	5912	Schwarzkopf Got2b
1007924	052336333017	Schwarzkopf got2b Color heads rg/Red	1	Неклассифицированные/default	5912	Schwarzkopf Got2b
1007925	052336333031	Schwarzkopf got2b Color heads s/blnd	1	Неклассифицированные/default	5912	Schwarzkopf Got2b
1007926	052336333062	Schwarzkopf got2b Color heads s/Orange	1	Неклассифицированные/default	5912	Schwarzkopf Got2b
1006717	052336341203	Schwarzkopf got2b Conditioner t/	1	Неклассифицированные/default	5912	Schwarzkopf Got2b
1006721	052336331518	Schwarzkopf got2b curl-vacious curled up spray	1	Неклассифицированные/default	5912	Schwarzkopf Got2b
1481840	052336331525	Schwarzkopf got2b curl-vacious shimmer curl Gel	1	Неклассифицированные/default	5912	Schwarzkopf Got2b
600469	052336391512	Schwarzkopf got2b curled-up curling spray	1	Неклассифицированные/default	5912	Schwarzkopf Got2b
1006706	052336331815	Schwarzkopf got2b defiant pomade	1	Неклассифицированные/default	5912	Schwarzkopf Got2b
1006724	052336337183	Schwarzkopf got2b flat iron&blow Dry Lotion - Hot smooth	1	Неклассифицированные/default	5912	Schwarzkopf Got2b
1905528	052336338913	Schwarzkopf got2b ga blow Dry lt 6.8oz	1	Неклассифицированные/default	5912	Schwarzkopf Got2b
1006725	5410091641979	Schwarzkopf got2b Gel glued styling 150ml	1	Неклассифицированные/default	5912	Schwarzkopf Got2b
2150063	9000100535236	Schwarzkopf got2b Gel na vlasy 150ml dripping	1	Неклассифицированные/default	5912	Schwarzkopf Got2b
2150064	9000100366526	Schwarzkopf got2b Gel na vlasy 150ml glued	1	Неклассифицированные/default	5912	Schwarzkopf Got2b
2150065	9000100535182	Schwarzkopf got2b Gel na vlasy 150ml no stop	1	Неклассифицированные/default	5912	Schwarzkopf Got2b
2150066	9000100645409	Schwarzkopf got2b Gel na vlasy 150ml rockin it	1	Неклассифицированные/default	5912	Schwarzkopf Got2b
2150067	9000100464499	Schwarzkopf got2b Gel na vlasy 150ml sex Appeal	1	Неклассифицированные/default	5912	Schwarzkopf Got2b
2150068	9000100535281	Schwarzkopf got2b Gel spray sparkling 150ml	1	Неклассифицированные/default	5912	Schwarzkopf Got2b
2676501	052336351172	Schwarzkopf got2b glossy 4 frizzy Hair anti-frizz Shine serum	1	Неклассифицированные/default	5912	Schwarzkopf Got2b
2676502	052336903029	Schwarzkopf got2b glued 4 blasting freeze spray	1	Неклассифицированные/default	5912	Schwarzkopf Got2b
1006736	052336331952	Schwarzkopf got2b glued 4 blasting hold freeze spray	1	Неклассифицированные/default	5912	Schwarzkopf Got2b
600470	3030057762306	Schwarzkopf got2b glued blow dryspray,ser	1	Неклассифицированные/default	5912	Schwarzkopf Got2b
600471	052336331020	Schwarzkopf got2b glued curling shampo	1	Неклассифицированные/default	5912	Schwarzkopf Got2b
600473	052336331457	Schwarzkopf got2b glued Original 4 screaming hold styling spiking glue	1	Неклассифицированные/default	5912	Schwarzkopf Got2b
2150069	9000100591379	Schwarzkopf got2b Guard.Angel 200ml ochr emul	1	Неклассифицированные/default	5912	Schwarzkopf Got2b
1006726	7610300159471	Schwarzkopf got2b guardian Angel 200ml	1	Неклассифицированные/default	5912	Schwarzkopf Got2b
1905529	052336338920	Schwarzkopf got2b guardian Angel 4 Hot Hair flat iron balm	1	Неклассифицированные/default	5912	Schwarzkopf Got2b
1905535	052336336209	Schwarzkopf got2b h.l condition-ash blo qq	1	Неклассифицированные/default	5912	Schwarzkopf Got2b
1905534	052336336100	Schwarzkopf got2b h.l Shampoo hon-dk bl qq	1	Неклассифицированные/default	5912	Schwarzkopf Got2b
1006727	5410091641948	Schwarzkopf got2b Hair spray 2 sexy 300ml	28	Уход за волосами (folder)/Уход за волосами	5912	Schwarzkopf Got2b
1006728	5410091642075	Schwarzkopf got2b Hair spray glued 300ml	28	Уход за волосами (folder)/Уход за волосами	5912	Schwarzkopf Got2b
1006729	7610300106468	Schwarzkopf got2b Hair spray rockin-it 300ml	28	Уход за волосами (folder)/Уход за волосами	5912	Schwarzkopf Got2b
2676503	052336338425	Schwarzkopf got2b Hair spray smooth operator with cashmere	1	Неклассифицированные/default	5912	Schwarzkopf Got2b
1006730	5410091647254	Schwarzkopf got2b Hair spray sparkling 300ml	28	Уход за волосами (folder)/Уход за волосами	5912	Schwarzkopf Got2b
1905530	052336338937	Schwarzkopf got2b Heat perf curl 6.8oz	1	Неклассифицированные/default	5912	Schwarzkopf Got2b
600474	052336337244	Schwarzkopf got2b hottie Shampoo	1412	Уход за волосами (folder)/Шампунь	5912	Schwarzkopf Got2b
5922	052336335240	Schwarzkopf got2b in 2 spa smoothie Body Lotion	331154	Косметика (folder)/Крем для тела	5912	Schwarzkopf Got2b
1006712	052336331907	Schwarzkopf got2b in control hard-hold Hair spray	28	Уход за волосами (folder)/Уход за волосами	5912	Schwarzkopf Got2b
600475	052336391208	Schwarzkopf got2b instant Conditioner 250ml	1	Неклассифицированные/default	5912	Schwarzkopf Got2b
600468	052336331655	Schwarzkopf got2b kinkier double curling Power curling Mousse	1	Неклассифицированные/default	5912	Schwarzkopf Got2b
2150070	9000100418669	Schwarzkopf got2b lak 200ml straight on	1	Неклассифицированные/default	5912	Schwarzkopf Got2b
2150071	9000100365932	Schwarzkopf got2b lak 300ml megalomania	1	Неклассифицированные/default	5912	Schwarzkopf Got2b
2150072	9000100645485	Schwarzkopf got2b lak 300ml rockin it	1	Неклассифицированные/default	5912	Schwarzkopf Got2b
2150073	9000100366175	Schwarzkopf got2b lak 300ml sparkling	1	Неклассифицированные/default	5912	Schwarzkopf Got2b
1006731	5410091662349	Schwarzkopf got2b Lotion smooth-n chic 200ml	1	Неклассифицированные/default	5912	Schwarzkopf Got2b
1905524	052336338463	Schwarzkopf got2b magnetik stle crm 10.2oz	1	Неклассифицированные/default	5912	Schwarzkopf Got2b
1905523	052336337695	Schwarzkopf got2b magnetik txt pomad 1.7oz	1	Неклассифицированные/default	5912	Schwarzkopf Got2b
1006732	5410091641955	Schwarzkopf got2b Mousse 2 sexy 250ml	1	Неклассифицированные/default	5912	Schwarzkopf Got2b
2150074	9000100417853	Schwarzkopf got2b pasta 100ml beach boy mat.vzhl	1	Неклассифицированные/default	5912	Schwarzkopf Got2b
2150075	9000100366014	Schwarzkopf got2b penove tuzidlo 250ml megalom	1	Неклассифицированные/default	5912	Schwarzkopf Got2b
1006714	052336331822	Schwarzkopf got2b playful texture creme pomade	1	Неклассифицированные/default	5912	Schwarzkopf Got2b
2150076	9000100652896	Schwarzkopf got2b Powder ful 10g mattifyng	1	Неклассифицированные/default	5912	Schwarzkopf Got2b
2150077	9000100652919	Schwarzkopf got2b Powder ful 10g volume	1	Неклассифицированные/default	5912	Schwarzkopf Got2b
1006733	7610300106642	Schwarzkopf got2b Powder ful volumizing 10g	1	Неклассифицированные/default	5912	Schwarzkopf Got2b
2593416	052336905399	Schwarzkopf got2b rise 'n Shine glistening full blow Dry Cream	1	Неклассифицированные/default	5912	Schwarzkopf Got2b
2676504	052336991354	Schwarzkopf got2b rockin 'it encore Fresh 4 Long lasting style Dry Shampoo	1	Неклассифицированные/default	5912	Schwarzkopf Got2b
600472	052336331471	Schwarzkopf got2b rubber spke cement 6oz	1	Неклассифицированные/default	5912	Schwarzkopf Got2b
1006734	052336330337	Schwarzkopf got2b s/c/s&i/g/co	1	Неклассифицированные/default	5912	Schwarzkopf Got2b
1006735	052336330344	Schwarzkopf got2b s/u/gl&d/s/s	1	Неклассифицированные/default	5912	Schwarzkopf Got2b
2150078	8410020646614	Schwarzkopf got2b sakles punta Gel erizante 250	1	Неклассифицированные/default	5912	Schwarzkopf Got2b
2593417	052336999404	Schwarzkopf got2b salt-infusion waving spray beach trippin'	1	Неклассифицированные/default	5912	Schwarzkopf Got2b
1481842	052336338456	Schwarzkopf got2b serum - cosmic shimmering	1	Неклассифицированные/default	5912	Schwarzkopf Got2b
1006720	052336341005	Schwarzkopf got2b Shampoo t/sz	1	Неклассифицированные/default	5912	Schwarzkopf Got2b
1006707	052336331754	Schwarzkopf got2b Shine spray 6oz	1	Неклассифицированные/default	5912	Schwarzkopf Got2b
1905531	052336338432	Schwarzkopf got2b smooth operator lot 6.8oz	1	Неклассифицированные/default	5912	Schwarzkopf Got2b
1905525	052336338449	Schwarzkopf got2b smth sarin drops 3.4oz	1	Неклассифицированные/default	5912	Schwarzkopf Got2b
600476	052336331402	Schwarzkopf got2b spiked-up 4 demanding styles Max-control styling Gel	1	Неклассифицированные/default	5912	Schwarzkopf Got2b
1006737	052336391451	Schwarzkopf got2b spiking glue 150ml	1	Неклассифицированные/default	5912	Schwarzkopf Got2b
1905522	052336341456	Schwarzkopf got2b spiking glue c24 1.25oz	1	Неклассифицированные/default	5912	Schwarzkopf Got2b
2150079	9000100366250	Schwarzkopf got2b spray 200ml sparkling	1	Неклассифицированные/default	5912	Schwarzkopf Got2b
1006738	5410091700300	Schwarzkopf got2b spray beach babe salt 200ml	1	Неклассифицированные/default	5912	Schwarzkopf Got2b
1905526	052336338333	Schwarzkopf got2b styl-tini anti-hmd 4.7oz	1	Неклассифицированные/default	5912	Schwarzkopf Got2b
1905532	052336338326	Schwarzkopf got2b styl-tini Hair strth 6.8oz	1	Неклассифицированные/default	5912	Schwarzkopf Got2b
1481843	052336337732	Schwarzkopf got2b styl/tini Hair silkener - tipsy	1	Неклассифицированные/default	5912	Schwarzkopf Got2b
1006739	052336337763	Schwarzkopf got2b styl/tini Hair spray after hours	28	Уход за волосами (folder)/Уход за волосами	5912	Schwarzkopf Got2b
1481844	052336337725	Schwarzkopf got2b styl/tini spray Gel strong One	1	Неклассифицированные/default	5912	Schwarzkopf Got2b
1905536	052336331556	Schwarzkopf got2b style spike spray 10.1oz	1	Неклассифицированные/default	5912	Schwarzkopf Got2b
1905527	052336337749	Schwarzkopf got2b style&thick Gel 5.1oz	1	Неклассифицированные/default	5912	Schwarzkopf Got2b
1481841	052336337688	Schwarzkopf got2b styling Gel - magnetik	1	Неклассифицированные/default	5912	Schwarzkopf Got2b
1006718	052336341401	Schwarzkopf got2b styling Gel t/	1	Неклассифицированные/default	5912	Schwarzkopf Got2b
