ID	UPCEAN	Name	CategoryID	CategoryName	BrandID	BrandName
310657	8584005053985	Витамин е зентива капс 200мг №30, зентива а.с.	1	Неклассифицированные/default	0	
310658	8584005053992	Витамин е зентива капс 400мг №30, зентива а.с.	1	Неклассифицированные/default	0	
2227605	4607004431470	Витамин е капс 100мг (альфа-токоферола ацетат) х20	1	Неклассифицированные/default	0	
1786032	4810046001215	Витамин е капс 100ме, №20	210391	Лекарственные средства (folder)/Лекарственные средства	0	
1786033	4810046004155	Витамин е капс 200ме, №30	210391	Лекарственные средства (folder)/Лекарственные средства	0	
2855427	4607136740587	Витамин е капс 250мг №20 бад	1	Неклассифицированные/default	0	
2855428	4627074811538	Витамин е капс 340мг №20	1	Неклассифицированные/default	0	
2766981	4607136740617	Витамин е капс 400мг №30 бад	1	Неклассифицированные/default	0	
1786034	4810046004124	Витамин е капс 400ме, №30	210391	Лекарственные средства (folder)/Лекарственные средства	0	
2427657	3800033700512	Витамин е капс. 100мг (масса капс. 240мг) х30	204841	Лекарственные средства (folder)/Витамины и минералы	0	
2427658	4602957000605	Витамин е мелиген 200мг №10 капс	204841	Лекарственные средства (folder)/Витамины и минералы	0	
2721018	4650001793942	Витамин е миррола масляный р-р фл 50мл	1	Неклассифицированные/default	0	
2012417	4650001793706	Витамин е мирролла 200мг капс 0.2г №10 природный	1	Неклассифицированные/default	0	
2721019	4650001793713	Витамин е мирролла 200мг капс 0.2г №20 природный	1	Неклассифицированные/default	0	
691930	4607013860377	Витамин е100 0.1 n60 капс	1	Неклассифицированные/default	0	
1786035	4810910000986	Витамин с 200 №20 табл, №20	210391	Лекарственные средства (folder)/Лекарственные средства	0	
310660	8600097306096	Витамин с 250мг шип.таб.№20	1	Неклассифицированные/default	0	
452114	4820099170394	Витамин с 500мг апельс.табл жеват.500мг в блист.в уп №12x1 табл.жев 500мг, №12	204841	Лекарственные средства (folder)/Витамины и минералы	0	
1786036	4820099170417	Витамин с 500мг апельс.табл жеват.500мг в контейн.№50 в уп №1 табл.жев 500мг, №50	210391	Лекарственные средства (folder)/Лекарственные средства	0	
1786037	4810910000993	Витамин с 900 №20 табл, №20	210391	Лекарственные средства (folder)/Лекарственные средства	0	
691931	4771316306778	Витамин с пролонг+железо для дет n40 капс	210391	Лекарственные средства (folder)/Лекарственные средства	0	
1786038	5999038503230	Витамин с с лимонным вкусом таблетки шипучие №20 шип. табл., №20	210391	Лекарственные средства (folder)/Лекарственные средства	0	
2227606	4812317000101	Витамин с с сахаром апельсин бад 10таб.по 2.9г до 01.02.17	1	Неклассифицированные/default	0	
2227607	4812317001603	Витамин с с сахаром апельсин бад таб.2.9г №14 до 01.02.17	1	Неклассифицированные/default	0	
2227608	4812317000095	Витамин с с сахаром бад 10таб.по 2.9г до 01.02.17	1	Неклассифицированные/default	0	
2227609	4812317001597	Витамин с с сахаром бад таб.по 2.9г №14 до 01.02.17	1	Неклассифицированные/default	0	
2227610	4812317001931	Витамин с с сахаром банан бад 10таб.по 2.9г до 01.02.16	1	Неклассифицированные/default	0	
2227611	4812317001696	Витамин с с сахаром банана бад 14таб.по 2.9г до 01.02.17	1	Неклассифицированные/default	0	
2227612	4812317001672	Витамин с с сахаром вишни бад 14таб.по 2.9г до 01.02.17	1	Неклассифицированные/default	0	
2227613	4812317001917	Витамин с с сахаром вишня бад 10таб.по 2.9г до 01.02.17	1	Неклассифицированные/default	0	
2227614	4812317000149	Витамин с с сахаром земляника бад 10таб.по 2.9г до 01.02.17	1	Неклассифицированные/default	0	
2227615	4812317001641	Витамин с с сахаром земляника бад 14таб.по 2.9г до 01.02.17	1	Неклассифицированные/default	0	
2227616	4812317000118	Витамин с с сахаром киви бад 10таб.по 2.9г до 01.02.17	1	Неклассифицированные/default	0	
2227617	4812317001610	Витамин с с сахаром киви бад 14таб.по 2.9г до 01.02.17	1	Неклассифицированные/default	0	
2227618	4812317000132	Витамин с с сахаром клубника бад 10таб.по 2.9г до 01.02.17	1	Неклассифицированные/default	0	
2227619	4812317001634	Витамин с с сахаром клубника бад 14таб.по 2.9г до 01.02.17	1	Неклассифицированные/default	0	
2227620	4812317000156	Витамин с с сахаром лимон бад 10таб.по 2.9г до 01.02.17	1	Неклассифицированные/default	0	
2227621	4812317001658	Витамин с с сахаром лимон бад 14таб.по 2.9г до 01.02.17	1	Неклассифицированные/default	0	
2227622	4812317001924	Витамин с с сахаром малина бад 10таб.по 2.9г до 01.04.17	1	Неклассифицированные/default	0	
2227623	4812317001689	Витамин с с сахаром малины бад 14таб.по 2.9г до 01.03.17	1	Неклассифицированные/default	0	
2227624	4812317001702	Витамин с с сахаром мята бад 14таб.по 2.9г до 01.02.17	1	Неклассифицированные/default	0	
2227625	4812317000163	Витамин с с сахаром экзотика бад 10таб.по 2.9г до 01.02.17	1	Неклассифицированные/default	0	
2227626	4812317001665	Витамин с с сахаром экзотика бад 14таб.по 2.9г до 01.02.17	1	Неклассифицированные/default	0	
2227627	4812317000125	Витамин с с сахаром яблоко бад 10таб.по 2.9г до 01.03.17	1	Неклассифицированные/default	0	
2227628	4812317001627	Витамин с с сахаром яблоко бад 14таб.по 2.9г до 01.02.17	1	Неклассифицированные/default	0	
2855430	4602242009740	Витамин с таб шип 1200мг 3.8г №10	1	Неклассифицированные/default	0	
452111	8600097301350	Витамин с табл шип. 1000мг №20	204841	Лекарственные средства (folder)/Витамины и минералы	0	
1353279	8606013060011	Витамин с табл шип. 1000мг №20, хемофарм д.д.	1	Неклассифицированные/default	0	
2427659	8606013060028	Витамин с табл шип. 250мг №20, хемофарм д.д.	204841	Лекарственные средства (folder)/Витамины и минералы	0	
691932	4607143990470	Витамин с ультра-с 30табл жев (киви)	1	Неклассифицированные/default	0	
691933	4607143990241	Витамин с ультра-с 30табл жев (черная смородина)	1	Неклассифицированные/default	0	
691934	4607143990067	Витамин с ультра-с 30табл жев б/сахара (киви)	1	Неклассифицированные/default	0	
691935	4607143990425	Витамин с ультра-с n200 драже /дет/	1	Неклассифицированные/default	0	
2427660	8600097423113	Витамин с штада 900мг №20 таб шип	362345	Лекарственные средства (folder)/БАДы	0	
691936	4771316306747	Витамин с-777 n40 капс	210391	Лекарственные средства (folder)/Лекарственные средства	0	
1355317	4620002181635	Витамин ф Крем полужирный 50мл	1	Неклассифицированные/default	0	
452145	4607112720114	Витамин ф-99 250мг №30 капс	204841	Лекарственные средства (folder)/Витамины и минералы	0	
310653	4607010243012	Витамин ф-99 Крем жирный 50мл	1	Неклассифицированные/default	0	
452147	4607010243029	Витамин ф-99 Крем полужирный 50мл	204841	Лекарственные средства (folder)/Витамины и минералы	0	
2766045	4607112720329	Витамин ф99 интра интимный 50мл гель	1	Неклассифицированные/default	0	
452150	4601164000743	Витаминерал аквион 40капс	204841	Лекарственные средства (folder)/Витамины и минералы	0	
2427661	4660014181216	Витаминерал табл. х40	1	Неклассифицированные/default	0	
1751008	4660014180400	Витаминерал таблетки №40 таб. 0.53г, №40	241824	Лекарственные средства (folder)/Аптека	0	
3292703	4607050695260	Витаминизированный напиток лайфлайн клубника-ваниль негаз. 0.5л пл/бут	1	Неклассифицированные/default	0	
1660324	4620003680922	Витаминная корзина (оксва)	1	Неклассифицированные/default	0	
3292704	4620003260544	Витаминная смесь грядкино, 400г м/у	1	Неклассифицированные/default	0	
3292705	4606273003463	Витаминно - минеральная добавка прибавляй-ка 500г	1	Неклассифицированные/default	0	
322523	4603646000388	Витаминно-минеральная добавка (премикс) рябушка для кур-несушек и другой домашней птицы на 30кг 150г	21915	Товары для животных (folder)/Корм для животных (folder)/Корм для животных	1797205	Капитал Прок
261769	4601164000873	Витаминно-минеральный комплекс алфавит диабет №60	204841	Лекарственные средства (folder)/Витамины и минералы	0	
261771	4601164000880	Витаминно-минеральный комплекс алфавит школьник таб. №36	204841	Лекарственные средства (folder)/Витамины и минералы	0	
261772	4601164000897	Витаминно-минеральный комплекс алфавит школьник таб. №60	204841	Лекарственные средства (folder)/Витамины и минералы	0	
261767	4601164000712	Витаминно-минеральный комплекс алфавит №120	204841	Лекарственные средства (folder)/Витамины и минералы	0	
261768	4601164000446	Витаминно-минеральный комплекс алфавит №60	204841	Лекарственные средства (folder)/Витамины и минералы	0	
2721020	4607172372766	Витаминно-минеральный комплекс для женщин от а до zn №30 табл. №30	210391	Лекарственные средства (folder)/Лекарственные средства	0	
1786039	4607172370076	Витаминно-минеральный комплекс для женщин от а до zn №30 табл., №30	210391	Лекарственные средства (folder)/Лекарственные средства	0	
1786040	4607172370083	Витаминно-минеральный комплекс для школьников от а до zn №30 табл., №30	210391	Лекарственные средства (folder)/Лекарственные средства	0	
2855431	4607172374067	Витаминно-минеральный комплекс от а до z №30 таб	1	Неклассифицированные/default	0	
1786042	4607172370090	Витаминно-минеральный комплекс от а до zn для детей 3-7 лет №30 табл., №30	210391	Лекарственные средства (folder)/Лекарственные средства	0	
1786043	4607172371868	Витаминно-минеральный комплекс от а до zn для детей 7-14 лет №30 табл., №30	210391	Лекарственные средства (folder)/Лекарственные средства	0	
1786041	4607172370106	Витаминно-минеральный комплекс от а до zn №30 табл., №30	210391	Лекарственные средства (folder)/Лекарственные средства	0	
261773	4606031390040	Витаминный коктейль для ногтей Cherie ma Cherie vitamin booster тон 004	461	Косметика (folder)/Маникюр и педикюр (folder)/Маникюр и педикюр	260540	Cherie ma Cherie
1786044	5999038503247	Витаминный комплекс для детей с малиновым вкусом шипучие таблетки №20 табл., №20	210391	Лекарственные средства (folder)/Лекарственные средства	0	
32235	4603541009028	Витаминный Крем-микс красный апельсин	1	Неклассифицированные/default	32230	FRUTTI
2427662	4607036729446	Витаминный курс. англ. яз. 5 кл - (russobit-m)	2275105	Медиа (folder)/Медиа	2275054	Russobit-M
2855432	4605543008405	Витаминный шампунь для грызунов, 220мл*12	1	Неклассифицированные/default	0	
2855433	4605543008382	Витаминный шампунь для кроликов, 220мл*12	1	Неклассифицированные/default	0	
310744	4607072120276	Витаминчик для грыз. повышение иммунитета 50т (упак 10шт) зоомир короб-60шт 5710	298109	Товары для животных (folder)/Витамины, подкормки для животных	672146	ЗООМИР
310746	4607072122447	Витаминчик для кроликов 50г (упак 10шт) зоомир короб-60шт 5718	298109	Товары для животных (folder)/Витамины, подкормки для животных	672146	ЗООМИР
310749	4607072120320	Витаминчик для птиц для пера 50г (упак 10шт) зоомир короб-60шт 5715	298109	Товары для животных (folder)/Витамины, подкормки для животных	672146	ЗООМИР
310747	4607072120313	Витаминчик для птиц для повыш.иммунитета 50г (упак 10шт) зоомир короб-60шт 5714	298109	Товары для животных (folder)/Витамины, подкормки для животных	672146	ЗООМИР
1196416	4607072123208	Витаминчик для сухопутных черепах 50т (упак 10шт) зоомир короб-60шт 5724	337596	Товары для животных (folder)/Pets	672146	ЗООМИР
310664	026851707004	Витамины 8in1 daily puppies для щенков 100т минералы	298109	Товары для животных (folder)/Витамины, подкормки для животных	555203	8IN1
310667	026851007111	Витамины 8in1 enervite senior паста витаминная для стареющих собак 120мл	298109	Товары для животных (folder)/Витамины, подкормки для животных	555203	8IN1
310696	8711231107742	Витамины Beaphar для собак 40т сыр	298109	Товары для животных (folder)/Витамины, подкормки для животных	298110	Beaphar
310705	4002064402000	Витамины gimpet 90шт таурин	298109	Товары для животных (folder)/Витамины, подкормки для животных	300951	GIMPET
310710	4002064408071	Витамины gimpet для кошек 180шт индейка	298109	Товары для животных (folder)/Витамины, подкормки для животных	300951	GIMPET
310712	4002064409771	Витамины gimpet для кошек 190т кролик+таурин	298109	Товары для животных (folder)/Витамины, подкормки для животных	300951	GIMPET
310713	4002064407982	Витамины gimpet для кошек 190т молоко+таурин	298109	Товары для животных (folder)/Витамины, подкормки для животных	300951	GIMPET
310720	4002064903590	Витамины gimpet для кошек 650т сердечки кура	298109	Товары для животных (folder)/Витамины, подкормки для животных	300951	GIMPET
310740	4606705070506	Витамины wolmar хондропротектор для собак 180т	298109	Товары для животных (folder)/Витамины, подкормки для животных	0	
3292706	4605630001043	Витамины вака для декоративных птиц 80 таблеток	1	Неклассифицированные/default	0	
310750	4607029071194	Витамины витамины к-м для котят	298109	Товары для животных (folder)/Витамины, подкормки для животных	0	
310751	4607029071200	Витамины витамины с-ш для собак	298109	Товары для животных (folder)/Витамины, подкормки для животных	0	
2721021	4607172374111	Витамины группы в №30 табл. №30	210391	Лекарственные средства (folder)/Лекарственные средства	0	
1786045	4607172370113	Витамины группы в №30 табл., №30	210391	Лекарственные средства (folder)/Лекарственные средства	0	
310755	4002064408750	Витамины джокис для кошек 120шт	298109	Товары для животных (folder)/Витамины, подкормки для животных	0	
310754	4030674001177	Витамины для больных диабетом табл 428мг, новая формула №30	1	Неклассифицированные/default	0	
1356187	4030674004604	Витамины для больных диабетом табл №90, верваг фарма гмбх	1	Неклассифицированные/default	0	
691938	4607041063849	Витамины для глаз 100табл	1	Неклассифицированные/default	0	
691941	4607073107184	Витамины для кошек вака	565204	Товары для животных (folder)/Ветеринарные препараты (folder)/Ветеринарные витамины и минералы для кошек	73165	Вака
2977215	4605630000824	Витамины для кошек вака #2	565204	Товары для животных (folder)/Ветеринарные препараты (folder)/Ветеринарные витамины и минералы для кошек	73165	Вака
2977216	4605630001050	Витамины для кошек вака #3	565204	Товары для животных (folder)/Ветеринарные препараты (folder)/Ветеринарные витамины и минералы для кошек	73165	Вака
2977217	4605630001081	Витамины для кошек вака #4	565204	Товары для животных (folder)/Ветеринарные препараты (folder)/Ветеринарные витамины и минералы для кошек	73165	Вака
2977218	4605630001098	Витамины для кошек вака #5	565204	Товары для животных (folder)/Ветеринарные препараты (folder)/Ветеринарные витамины и минералы для кошек	73165	Вака
2977219	4605630001128	Витамины для кошек вака #6	565204	Товары для животных (folder)/Ветеринарные препараты (folder)/Ветеринарные витамины и минералы для кошек	73165	Вака
2977220	4605630001159	Витамины для кошек вака #7	565204	Товары для животных (folder)/Ветеринарные препараты (folder)/Ветеринарные витамины и минералы для кошек	73165	Вака
2977221	4605630001449	Витамины для кошек вака #8	565204	Товары для животных (folder)/Ветеринарные препараты (folder)/Ветеринарные витамины и минералы для кошек	73165	Вака
691942	4010052368351	Витамины для пруда vital 3	1	Неклассифицированные/default	0	
691943	4607073101830	Витамины для собак вака	555204	Товары для животных (folder)/Ветеринарные препараты (folder)/Ветеринарные витамины и минералы для собак	73165	Вака
2977222	4605630001104	Витамины для собак вака #2	555204	Товары для животных (folder)/Ветеринарные препараты (folder)/Ветеринарные витамины и минералы для собак	73165	Вака
2977223	4605630001111	Витамины для собак вака #3	555204	Товары для животных (folder)/Ветеринарные препараты (folder)/Ветеринарные витамины и минералы для собак	73165	Вака
2977224	4605630001135	Витамины для собак вака #4	555204	Товары для животных (folder)/Ветеринарные препараты (folder)/Ветеринарные витамины и минералы для собак	73165	Вака
2977225	4605630001166	Витамины для собак вака #5	555204	Товары для животных (folder)/Ветеринарные препараты (folder)/Ветеринарные витамины и минералы для собак	73165	Вака
310778	8594005570665	Витамины канвит ак для собак активных 250г	298109	Товары для животных (folder)/Витамины, подкормки для животных	0	
310788	8594005570948	Витамины канвит хондро макси для собак 1000г	298109	Товары для животных (folder)/Витамины, подкормки для животных	0	
691944	4607081360021	Витамины катрин для волнистых попугаев йод (1x50) 4102	337596	Товары для животных (folder)/Pets	126268	Катрин
691945	4607081360045	Витамины катрин для волнистых попугаев линька (1x50) 4104	337596	Товары для животных (folder)/Pets	126268	Катрин
691946	4607081360038	Витамины катрин для волнистых попугаев минералы (1x50) 4103	337596	Товары для животных (folder)/Pets	126268	Катрин
691947	4607081360014	Витамины катрин для волнистых попугаев общеукрепляющие (1x50) 4101	337596	Товары для животных (folder)/Pets	126268	Катрин
2427666	4605396108017	Витамины навита проф мкб 50таб	337596	Товары для животных (folder)/Pets	0	
310799	4607029071033	Витамины омега для собак 15т биотин	298109	Товары для животных (folder)/Витамины, подкормки для животных	0	
310800	4607029071040	Витамины омега для собак 15т морские водоросли	298109	Товары для животных (folder)/Витамины, подкормки для животных	0	
310804	4607029071057	Витамины омега для щенков 15т карнитин	298109	Товары для животных (folder)/Витамины, подкормки для животных	0	
691948	4607132560455	Витамины роста волос спрей 150мл	1	Неклассифицированные/default	0	
