ID	UPCEAN	Name	CategoryID	CategoryName	BrandID	BrandName
68088	4607040362837	Колбаса сырокопченая юбилейная 250г газ/у кмк	265594	Продукты питания (folder)/Колбасные изделия (folder)/Колбаса сырокопченая	37472	Ничико
68089	4005489110017	Колбаса сырокопченая юбилейная 300г компо фаворит	265594	Продукты питания (folder)/Колбасные изделия (folder)/Колбаса сырокопченая	37847	Русский стол
1226826	4770118400516	Колбаса сырокопченая юбилейная 90г биовела	265594	Продукты питания (folder)/Колбасные изделия (folder)/Колбаса сырокопченая	67498	Биовела
3354880	4770959441419	Колбаса сырокопченая юбилейная 90г нар	265594	Продукты питания (folder)/Колбасные изделия (folder)/Колбаса сырокопченая	0	
3354881	4607045796286	Колбаса сырокопченая юбилейная вак уп 200г	265594	Продукты питания (folder)/Колбасные изделия (folder)/Колбаса сырокопченая	0	
3354882	4607164292119	Колбаса сырокопченая юбилейная вак уп 280г светловский мк	265594	Продукты питания (folder)/Колбасные изделия (folder)/Колбаса сырокопченая	0	
1226740	4630007391113	Колбаса сырокопченая юбилейная вак уп кронштадт 0.200	265594	Продукты питания (folder)/Колбасные изделия (folder)/Колбаса сырокопченая	0	
2875048	4606979032583	Колбаса сырокопченая юбилейная европа	265594	Продукты питания (folder)/Колбасные изделия (folder)/Колбаса сырокопченая	0	
2443809	466424000130	Колбаса сырокопченая юбилейная мяс/фантазия нарезка 0.130	265594	Продукты питания (folder)/Колбасные изделия (folder)/Колбаса сырокопченая	0	
2952009	4640012827842	Колбаса сырокопченая юбилейная мясной продукт катег в (вак) 200г (шт)	1	Неклассифицированные/default	0	
2952010	4640012826036	Колбаса сырокопченая юбилейная мясной продукт катег в (д.40)(вак)	1	Неклассифицированные/default	0	
68090	4664240001300	Колбаса сырокопченая юбилейная нар.130г мясн.фантазия	265594	Продукты питания (folder)/Колбасные изделия (folder)/Колбаса сырокопченая	37565	Мясная фантазия
2725312	4610005171641	Колбаса сырокопченая юбилейная шт вак уп 200г россиянка	330591	Продукты питания (folder)/Продукты питания	0	
3354883	4607012241634	Колбаса сырокопченая янтарная 110г м/уп	265594	Продукты питания (folder)/Колбасные изделия (folder)/Колбаса сырокопченая	0	
2952673	4660016025853	Колбаса сырокопченая янтарная вак уп	1	Неклассифицированные/default	0	
155568	4602353004467	Колбаса сытинская шт кампом. 0.400	142954	Продукты питания (folder)/Колбасные изделия (folder)/Колбасные изделия	0	
155569	4601657022252	Колбаса сытная п/а 2с царицыно 0.500	142954	Продукты питания (folder)/Колбасные изделия (folder)/Колбасные изделия	0	
155570	4606979007970	Колбаса сытная пгн микоян 0.400	142954	Продукты питания (folder)/Колбасные изделия (folder)/Колбасные изделия	0	
2874915	4606979032675	Колбаса сытная пгн шт 400г то, что надо	142954	Продукты питания (folder)/Колбасные изделия (folder)/Колбасные изделия	0	
3354885	4601906102384	Колбаса сытое семейство любительская 1шт	142954	Продукты питания (folder)/Колбасные изделия (folder)/Колбасные изделия	0	
3354886	4607141296383	Колбаса тавр ливерная печеночная 1сорт	142954	Продукты питания (folder)/Колбасные изделия (folder)/Колбасные изделия	0	
3354887	4690411009806	Колбаса тавр салями финская с можжевельником вак уп 0.3г	142954	Продукты питания (folder)/Колбасные изделия (folder)/Колбасные изделия	0	
68012	4607025361091	Колбаса таганская 1с 400г пит-продукт	55924	Продукты питания (folder)/Колбасные изделия (folder)/Колбаса вареная	37837	Пит-Продукт
2874917	4665302790064	Колбаса таллинская	142954	Продукты питания (folder)/Колбасные изделия (folder)/Колбасные изделия	0	
155572	4607033730995	Колбаса таллинская вак уп Ладога 0.300	142954	Продукты питания (folder)/Колбасные изделия (folder)/Колбасные изделия	155571	мясные деликатесы
2874919	4620756530826	Колбаса таллинская кат б	142954	Продукты питания (folder)/Колбасные изделия (folder)/Колбасные изделия	0	
2874926	4607100108900	Колбаса таллинская. изделие колбасное полукопченое, мясной продукт катег б (вак уп, мини батон)	142954	Продукты питания (folder)/Колбасные изделия (folder)/Колбасные изделия	0	
2874927	4607100106661	Колбаса таллинская. изделие колбасное полукопченое, мясной продукт катег б (вак уп, мини батон, 0.3кг)	142954	Продукты питания (folder)/Колбасные изделия (folder)/Колбасные изделия	0	
2874928	4607100108917	Колбаса таллинская. изделие колбасное полукопченое, мясной продукт катег б (мини батон)	142954	Продукты питания (folder)/Колбасные изделия (folder)/Колбасные изделия	0	
68018	4607025361183	Колбаса татарская вс 500г пит-продукт	142954	Продукты питания (folder)/Колбасные изделия (folder)/Колбасные изделия	37837	Пит-Продукт
68019	4607025361190	Колбаса татарская с сыром вс 500г пит-продукт	142954	Продукты питания (folder)/Колбасные изделия (folder)/Колбасные изделия	37837	Пит-Продукт
2874932	4610018560081	Колбаса телячья	142954	Продукты питания (folder)/Колбасные изделия (folder)/Колбасные изделия	0	
2874933	4607030200200	Колбаса телячья (синюга) н/о вак уп (300г вес)	142954	Продукты питания (folder)/Колбасные изделия (folder)/Колбасные изделия	0	
2874934	4607030203324	Колбаса телячья (синюга) н/о гмс (1 батон)	142954	Продукты питания (folder)/Колбасные изделия (folder)/Колбасные изделия	0	
2874935	4630033510359	Колбаса телячья в натуральной оболочке, кусок вак уп	142954	Продукты питания (folder)/Колбасные изделия (folder)/Колбасные изделия	0	
2874936	4660001443853	Колбаса телячья вар, вак уп, 400г	142954	Продукты питания (folder)/Колбасные изделия (folder)/Колбасные изделия	0	
3354888	4607088611171	Колбаса телячья высший сорт 400г иркутский мк	142954	Продукты питания (folder)/Колбасные изделия (folder)/Колбасные изделия	0	
1672816	4607091761689	Колбаса телячья ГОСТ 0.400	142954	Продукты питания (folder)/Колбасные изделия (folder)/Колбасные изделия	0	
2938995	4680019001005	Колбаса телячья ГОСТ в/c (цел.об)	1	Неклассифицированные/default	0	
2235885	4607024859766	Колбаса телячья кусок вак уп 500г велком	55924	Продукты питания (folder)/Колбасные изделия (folder)/Колбаса вареная	67882	Велком
2874937	4601374016039	Колбаса телячья н/о в упаковке	142954	Продукты питания (folder)/Колбасные изделия (folder)/Колбасные изделия	0	
2874938	4607030203515	Колбаса телячья н/о вак уп (1/2 батона)	142954	Продукты питания (folder)/Колбасные изделия (folder)/Колбасные изделия	0	
729839	4607025364283	Колбаса телячья нар.300г пит-продукт	55924	Продукты питания (folder)/Колбасные изделия (folder)/Колбаса вареная	37837	Пит-Продукт
155573	4600980007219	Колбаса телячья нежность черкиз. 0.500 +	142954	Продукты питания (folder)/Колбасные изделия (folder)/Колбасные изделия	0	
1226812	4820005461202	Колбаса телячья новая в/с вектор 450г (изобилие вкуса)	142954	Продукты питания (folder)/Колбасные изделия (folder)/Колбасные изделия	0	
68021	4606979015265	Колбаса телячья по микояновски пгн 0.400	55924	Продукты питания (folder)/Колбасные изделия (folder)/Колбаса вареная	37402	Микоян
1226813	4823022600142	Колбаса телячья Премиум вар. в/с шт (Азов-константа)	142954	Продукты питания (folder)/Колбасные изделия (folder)/Колбасные изделия	0	
1226814	4820005461356	Колбаса телячья со сливк. в/с вектор шт 550г фаворит (изобилие вкуса)	142954	Продукты питания (folder)/Колбасные изделия (folder)/Колбасные изделия	0	
1226815	4820112650032	Колбаса телячья со сливками в/с вектор 400г (глобинский мк)	142954	Продукты питания (folder)/Колбасные изделия (folder)/Колбасные изделия	0	
2874939	4607162204619	Колбаса телячья. изделие колбасное вареное мясной продукт катег а вес синюга	142954	Продукты питания (folder)/Колбасные изделия (folder)/Колбасные изделия	0	
2874940	4607162208853	Колбаса телячья. изделие колбасное вареное мясной продукт катег а вес целлофан	142954	Продукты питания (folder)/Колбасные изделия (folder)/Колбасные изделия	0	
2874941	4607162200871	Колбаса телячья. изделие колбасное вареное мясной продукт катег а порц	142954	Продукты питания (folder)/Колбасные изделия (folder)/Колбасные изделия	0	
2874942	4607162208709	Колбаса телячья. изделие колбасное вареное мясной продукт катег а шт 470г	142954	Продукты питания (folder)/Колбасные изделия (folder)/Колбасные изделия	0	
2874943	4670019580358	Колбаса тильзит полусухая из свинины	142954	Продукты питания (folder)/Колбасные изделия (folder)/Колбасные изделия	0	
3354889	4606420001342	Колбаса тильзитская 300г кд	142954	Продукты питания (folder)/Колбасные изделия (folder)/Колбасные изделия	0	
2874944	4607100109297	Колбаса тихорецкая в обсыбке. изделие колбасное сырокопченое полусухое мясной продукт (вак уп, порционная нарезка)	142954	Продукты питания (folder)/Колбасные изделия (folder)/Колбасные изделия	0	
2874945	4600993017717	Колбаса тихорецкая в обсыбке. изделие колбасное сырокопченое полусухое мясной продукт вак уп	142954	Продукты питания (folder)/Колбасные изделия (folder)/Колбасные изделия	0	
2874946	4607100105886	Колбаса тихорецкая пряная. изделие колбасное вареное из мяса птицы, второй сорт	142954	Продукты питания (folder)/Колбасные изделия (folder)/Колбасные изделия	0	
2874947	4607100105893	Колбаса тихорецкая пряная. изделие колбасное вареное из мяса птицы, второй сорт шт 450г	142954	Продукты питания (folder)/Колбасные изделия (folder)/Колбасные изделия	0	
2874948	4600993014402	Колбаса тихорецкая. изделие колбасное сырокопченое полусухое мясной продукт	142954	Продукты питания (folder)/Колбасные изделия (folder)/Колбасные изделия	0	
2874949	4607100106869	Колбаса тихорецкая. изделие колбасное сырокопченое полусухое мясной продукт (вак уп, сервировочная нарезка 0.15кг, скин-эффект)	142954	Продукты питания (folder)/Колбасные изделия (folder)/Колбасные изделия	0	
2874950	4607100105718	Колбаса тихорецкая. изделие колбасное сырокопченое полусухое мясной продукт (вак уп, сервировочная нарезка, шт, 0.15кг)	142954	Продукты питания (folder)/Колбасные изделия (folder)/Колбасные изделия	0	
2874951	4607100109280	Колбаса тихорецкая. изделие колбасное сырокопченое полусухое мясной продукт вак уп	142954	Продукты питания (folder)/Колбасные изделия (folder)/Колбасные изделия	0	
3354890	4600993017649	Колбаса тихорецкий мк ветчина нежная 0.450кг	142954	Продукты питания (folder)/Колбасные изделия (folder)/Колбасные изделия	0	
3354891	4600993016499	Колбаса тихорецкий мк, докторская сливочная, вар. 450г и/о	142954	Продукты питания (folder)/Колбасные изделия (folder)/Колбасные изделия	0	
3354892	7714204002953	Колбаса томский свинокомплекс пермская 500г	142954	Продукты питания (folder)/Колбасные изделия (folder)/Колбасные изделия	0	
3354893	7714204002878	Колбаса томский свинокомплекс сервелат зкстра 500г	142954	Продукты питания (folder)/Колбасные изделия (folder)/Колбасные изделия	0	
3354894	4607098791528	Колбаса торес сельская 1кг	142954	Продукты питания (folder)/Колбасные изделия (folder)/Колбасные изделия	0	
2874952	4630006262322	Колбаса Тоскана с/в 200г спк	142954	Продукты питания (folder)/Колбасные изделия (folder)/Колбасные изделия	0	
3354895	4606639027461	Колбаса Тоскана салями сыровяленая нарезка вак уп 100г	142954	Продукты питания (folder)/Колбасные изделия (folder)/Колбасные изделия	0	
2874955	4606979027909	Колбаса традицион. из курин. грудок подкопчен.пгн шт 500г	142954	Продукты питания (folder)/Колбасные изделия (folder)/Колбасные изделия	0	
2874956	4606979028722	Колбаса традицион.из курин. грудок подкопчен.пгн	142954	Продукты питания (folder)/Колбасные изделия (folder)/Колбасные изделия	0	
2874958	4680019742793	Колбаса традиционная охл 500г/6шт	142954	Продукты питания (folder)/Колбасные изделия (folder)/Колбасные изделия	0	
2874959	4680019742786	Колбаса традиционная охл 6кг	142954	Продукты питания (folder)/Колбасные изделия (folder)/Колбасные изделия	0	
2731239	4606420002738	Колбаса традиционная с/в 200г кд	142954	Продукты питания (folder)/Колбасные изделия (folder)/Колбасные изделия	0	
2874953	4680019742908	Колбаса традиционная со шпиком от приосколье 500г/6шт	142954	Продукты питания (folder)/Колбасные изделия (folder)/Колбасные изделия	0	
2874954	4680019742892	Колбаса традиционная со шпиком от приосколье монолит	142954	Продукты питания (folder)/Колбасные изделия (folder)/Колбасные изделия	0	
2874965	4607091386486	Колбаса традиционная тм вязанка тс вязаная в оболочке вектор 0.5кг ск1. мясной продукт. колбасное изделие вареное охлажд старод	142954	Продукты питания (folder)/Колбасные изделия (folder)/Колбасные изделия	0	
68024	4607142910264	Колбаса трио с паприкой вс п/а 1кг шеф повар	55924	Продукты питания (folder)/Колбасные изделия (folder)/Колбаса вареная	38419	Шеф Повар
68025	4607142910257	Колбаса трио с паприкой вс п/а 500г шеф повар	55924	Продукты питания (folder)/Колбасные изделия (folder)/Колбаса вареная	38419	Шеф Повар
68026	4607142910585	Колбаса трио с паприкой нар.210г шеф повар	55924	Продукты питания (folder)/Колбасные изделия (folder)/Колбаса вареная	38419	Шеф Повар
68027	4607142910233	Колбаса трио с фисташками вс п/а 0.5кг шеф повар	55924	Продукты питания (folder)/Колбасные изделия (folder)/Колбаса вареная	38419	Шеф Повар
68028	4607142910578	Колбаса трио с фисташками нар.210г шеф повар	55924	Продукты питания (folder)/Колбасные изделия (folder)/Колбаса вареная	38419	Шеф Повар
3354896	4607074655523	Колбаса турбаслинские бройлеры гурман ветчинно-рубленная халяль 400г м\у	142954	Продукты питания (folder)/Колбасные изделия (folder)/Колбасные изделия	0	
2731240	8586011170564	Колбаса турист 250г	142954	Продукты питания (folder)/Колбасные изделия (folder)/Колбасные изделия	0	
2443792	5946230003006	Колбаса турист Венгрия 0.300	265594	Продукты питания (folder)/Колбасные изделия (folder)/Колбаса сырокопченая	0	
68029	8411111008922	Колбаса турон чоризо сарта 200г	142954	Продукты питания (folder)/Колбасные изделия (folder)/Колбасные изделия	67848	Турон
3354897	4627097920217	Колбаса тэмле халяль полукопченная с мясом птицы 500г	142954	Продукты питания (folder)/Колбасные изделия (folder)/Колбасные изделия	0	
2874971	4607943494796	Колбаса удачная (замороженное, 60)	142954	Продукты питания (folder)/Колбасные изделия (folder)/Колбасные изделия	0	
2874972	4607943494512	Колбаса удачная (охлажденное, в модифицированной атмосфере, 5)	142954	Продукты питания (folder)/Колбасные изделия (folder)/Колбасные изделия	0	
68030	4607061480015	Колбаса украинская жар.вак уп 500г	55924	Продукты питания (folder)/Колбасные изделия (folder)/Колбаса вареная	37472	Ничико
2874973	4607943495212	Колбаса украинская жареная (охлажденное, под вакуумом, 10)	142954	Продукты питания (folder)/Колбасные изделия (folder)/Колбасные изделия	0	
2874974	4630033510380	Колбаса украинская жареная в/с катег в вак уп	142954	Продукты питания (folder)/Колбасные изделия (folder)/Колбасные изделия	0	
2874975	4650001732910	Колбаса украинская жареная вакум	142954	Продукты питания (folder)/Колбасные изделия (folder)/Колбасные изделия	0	
2874976	4606979029156	Колбаса украинская жареная ГОСТ н/о вак уп	142954	Продукты питания (folder)/Колбасные изделия (folder)/Колбасные изделия	0	
2874977	4640003790704	Колбаса украинская жареная мясной продукт катег в вак уп (0.32кг)	142954	Продукты питания (folder)/Колбасные изделия (folder)/Колбасные изделия	0	
2874978	4607100101932	Колбаса украинская жареная. изделие колбасное, мясной продукт катег в (в пергаменте)	142954	Продукты питания (folder)/Колбасные изделия (folder)/Колбасные изделия	0	
2874979	4607100108931	Колбаса украинская жареная. изделие колбасное, мясной продукт катег в вак уп	142954	Продукты питания (folder)/Колбасные изделия (folder)/Колбасные изделия	0	
2874980	4670026481129	Колбаса украинская жареная. мясной продукт катег в	142954	Продукты питания (folder)/Колбасные изделия (folder)/Колбасные изделия	0	
2874981	4607162200475	Колбаса украинская жареная. мясной продукт катег в охлажденный, вес	142954	Продукты питания (folder)/Колбасные изделия (folder)/Колбасные изделия	0	
2874982	4620756530864	Колбаса украинская кат б	142954	Продукты питания (folder)/Колбасные изделия (folder)/Колбасные изделия	0	
3354898	4607098663511	Колбаса украинская Премиум вак уп 350г	142954	Продукты питания (folder)/Колбасные изделия (folder)/Колбасные изделия	0	
474250	9002077000014	Колбаса улитка для гриля 250г Германия	142954	Продукты питания (folder)/Колбасные изделия (folder)/Колбасные изделия	0	
68031	4602353003637	Колбаса улыбка 400г кампомос	55924	Продукты питания (folder)/Колбасные изделия (folder)/Колбаса вареная	41541	Кампомос
3354899	4607074652829	Колбаса умкк докторская из курочки 400г	142954	Продукты питания (folder)/Колбасные изделия (folder)/Колбасные изделия	0	
3354900	4607061358581	Колбаса умкк курай варенная 450г	142954	Продукты питания (folder)/Колбасные изделия (folder)/Колбасные изделия	0	
