ID	UPCEAN	Name	CategoryID	CategoryName	BrandID	BrandName
3294297	4607053140033	Вода минеральная суздальская, серебряный сокол, газированная 0.5л пл/б	48140	Продукты питания (folder)/Напитки безалкогольные/Вода минеральная	3757633	SUZDAL'SKAYA серебряный SOKOL (ROZHNOVO/VLADIM.OBL.)
3294298	4607053140064	Вода минеральная суздальская, серебряный сокол, негазированная 0.5л пл/б	48140	Продукты питания (folder)/Напитки безалкогольные/Вода минеральная	3757633	SUZDAL'SKAYA серебряный SOKOL (ROZHNOVO/VLADIM.OBL.)
3294299	4626014940567	Вода минеральная суздальские напитки elite негазированная 1.5л пл/бут	48140	Продукты питания (folder)/Напитки безалкогольные/Вода минеральная	0	
3294300	4607056890126	Вода минеральная суздальские напитки негазированная 0.6л пл/бут	48140	Продукты питания (folder)/Напитки безалкогольные/Вода минеральная	3889445	Прозрачная (Суздальские напитки)
3294301	4607056890041	Вода минеральная суздальские напитки слабогазированная 1.5л	48140	Продукты питания (folder)/Напитки безалкогольные/Вода минеральная	3889445	Прозрачная (Суздальские напитки)
3294302	4607056890201	Вода минеральная суздальские напитки элита газированная 1.5л	48140	Продукты питания (folder)/Напитки безалкогольные/Вода минеральная	3889445	Прозрачная (Суздальские напитки)
3294303	4607003710040	Вода минеральная суздальские напитки, 0.5л пл/б	48140	Продукты питания (folder)/Напитки безалкогольные/Вода минеральная	0	
48642	8588000133147	Вода минеральная сулинка 0.33л стбан	48140	Продукты питания (folder)/Напитки безалкогольные/Вода минеральная	48641	Сулинка
48647	4607058300029	Вода минеральная супер Александра негазированная 1л	48140	Продукты питания (folder)/Напитки безалкогольные/Вода минеральная	48645	Супер
692570	8004544006032	Вода минеральная сурджива газированная 0.5л с/б	48140	Продукты питания (folder)/Напитки безалкогольные/Вода минеральная	692569	Сурджива
692571	8004544005059	Вода минеральная сурджива газированная 750мл с/б	48140	Продукты питания (folder)/Напитки безалкогольные/Вода минеральная	692569	Сурджива
692572	8004544006025	Вода минеральная сурджива негазированная 0.5л с/б	48140	Продукты питания (folder)/Напитки безалкогольные/Вода минеральная	692569	Сурджива
692573	8004544005042	Вода минеральная сурджива негазированная 750мл с/б	48140	Продукты питания (folder)/Напитки безалкогольные/Вода минеральная	692569	Сурджива
2856038	8000795000393	Вода минеральная тавина газированная 0.25л с/б	1	Неклассифицированные/default	0	
2856039	8000795000409	Вода минеральная тавина негазированная 0.25л с/б	1	Неклассифицированные/default	0	
2428101	8000795013713	Вода минеральная тавина элегантия газированная 750мл с/б	17388	Продукты питания (folder)/Напитки безалкогольные/Вода питьевая	2428100	Тавина
2428102	8000795004803	Вода минеральная тавина элегантия негазированная 750мл с/б	17388	Продукты питания (folder)/Напитки безалкогольные/Вода питьевая	2428100	Тавина
3294304	4650000850035	Вода минеральная таежная жемчужина газированная 1.5л пл/б	48140	Продукты питания (folder)/Напитки безалкогольные/Вода минеральная	3918545	таежная жемчужина (DALMINVOD TD/PRIMORSKIY KRAY)
3294305	4650000850059	Вода минеральная таежная жемчужина газированная 1.5л пл/б #2	48140	Продукты питания (folder)/Напитки безалкогольные/Вода минеральная	3918545	таежная жемчужина (DALMINVOD TD/PRIMORSKIY KRAY)
3294306	4650000850172	Вода минеральная таежная жемчужина негазированая 0.5л пл/бут	48140	Продукты питания (folder)/Напитки безалкогольные/Вода минеральная	3918545	таежная жемчужина (DALMINVOD TD/PRIMORSKIY KRAY)
3294307	4650000850011	Вода минеральная таежная жемчужина, газированная 0.5л пл/б	48140	Продукты питания (folder)/Напитки безалкогольные/Вода минеральная	3918545	таежная жемчужина (DALMINVOD TD/PRIMORSKIY KRAY)
3294308	4650000850110	Вода минеральная таежная жемчужина, негазированная 0.5л пл/б	48140	Продукты питания (folder)/Напитки безалкогольные/Вода минеральная	3918545	таежная жемчужина (DALMINVOD TD/PRIMORSKIY KRAY)
3294309	4650000850165	Вода минеральная таежная жемчужина, негазированная 1.5л пл/б	48140	Продукты питания (folder)/Напитки безалкогольные/Вода минеральная	3918545	таежная жемчужина (DALMINVOD TD/PRIMORSKIY KRAY)
3294310	4650000850073	Вода минеральная таежная жемчужина, целебная, газированная 0.5л пл/б	48140	Продукты питания (folder)/Напитки безалкогольные/Вода минеральная	3918545	таежная жемчужина (DALMINVOD TD/PRIMORSKIY KRAY)
2428040	4602158000374	Вода минеральная тазалык газированная 1.5	48140	Продукты питания (folder)/Напитки безалкогольные/Вода минеральная	3759132	TAZALYK (SEREBRYANYE KLYUCHI Z-D MIN.VOD/IZHEVSK)
3294311	4607055400777	Вода минеральная талинка 1.5л пл/бут	48140	Продукты питания (folder)/Напитки безалкогольные/Вода минеральная	3758700	TALINKA (KHRUSTALNOE/KEMEROVO)
3294312	4630000620289	Вода минеральная танай газированная 0.5л пл/бут	48140	Продукты питания (folder)/Напитки безалкогольные/Вода минеральная	3918742	танай (KRASNOGORSKOE/KEMEROVO)
3294313	4604715000025	Вода минеральная танып казанчинская лечебно-столовая газированная 1.5л пл/б	48140	Продукты питания (folder)/Напитки безалкогольные/Вода минеральная	3679442	KAZANCHINSKAYA (TANYP GUP SANATORIY/BASHKORTOSTAN)
3294314	4604715000018	Вода минеральная танып, казанчинская №5, лечебно столовая, ср.газ, 0.5л пл/б	48140	Продукты питания (folder)/Напитки безалкогольные/Вода минеральная	0	
3294315	460471500018	Вода минеральная танып, казанчинская №5, лечебно столовая, ср.газ. 1.5л пл/б	48140	Продукты питания (folder)/Напитки безалкогольные/Вода минеральная	0	
3294316	4607026490011	Вода минеральная тараскульская газированная 1.5л пл/бут	48140	Продукты питания (folder)/Напитки безалкогольные/Вода минеральная	0	
3294317	4607026490066	Вода минеральная тараскульская газированная 1л пл/бут	48140	Продукты питания (folder)/Напитки безалкогольные/Вода минеральная	0	
2428041	4600399201581	Вода минеральная тафельквель газированная 0.500	48140	Продукты питания (folder)/Напитки безалкогольные/Вода минеральная	0	
1197194	4607023759852	Вода минеральная тверская чистая артезианская газированная 500мл	48140	Продукты питания (folder)/Напитки безалкогольные/Вода минеральная	3764396	TVERSKAYA CHISTAYA (UNITED BOTTLING GROUP/TVER)
1197197	4607023759906	Вода минеральная тверская чистая артезианская негазированная 1.5л пл/б	48140	Продукты питания (folder)/Напитки безалкогольные/Вода минеральная	3764396	TVERSKAYA CHISTAYA (UNITED BOTTLING GROUP/TVER)
3294318	4603815500190	Вода минеральная теберда-1 столвая газированная 1.5л пэт	48140	Продукты питания (folder)/Напитки безалкогольные/Вода минеральная	3759393	TEBERDA (KARACHAEVSKIY PIV.Z-D)
3294319	4655637092124	Вода минеральная тиб-2 лечебно-столовая среднегазированная 1.5 пл/бут	48140	Продукты питания (folder)/Напитки безалкогольные/Вода минеральная	0	
3294320	4655637092148	Вода минеральная тиб-2 тамирис 0.5л стбут	48140	Продукты питания (folder)/Напитки безалкогольные/Вода минеральная	0	
1197102	4820003310175	Вода минеральная трускавецкая газированная 0.5л	48140	Продукты питания (folder)/Напитки безалкогольные/Вода минеральная	0	
1197103	4820003310182	Вода минеральная трускавецкая газированная 1.5л	48140	Продукты питания (folder)/Напитки безалкогольные/Вода минеральная	0	
1197104	4820006120054	Вода минеральная трускавецкая заповедная 1.5л	48140	Продукты питания (folder)/Напитки безалкогольные/Вода минеральная	0	
1197105	4820022430144	Вода минеральная трускавецкая кристальная негазированная 1.5л	48140	Продукты питания (folder)/Напитки безалкогольные/Вода минеральная	0	
1197106	4820022430045	Вода минеральная трускавецкая кришталева газированная 0.5л	48140	Продукты питания (folder)/Напитки безалкогольные/Вода минеральная	0	
1197107	4820003310205	Вода минеральная трускавецкая негазированная 0.5л	48140	Продукты питания (folder)/Напитки безалкогольные/Вода минеральная	0	
1197108	4820003310229	Вода минеральная трускавецкая негазированная 5л	48140	Продукты питания (folder)/Напитки безалкогольные/Вода минеральная	0	
1197109	4820003310236	Вода минеральная трускавецкая негазированная доз. 0.5л	48140	Продукты питания (folder)/Напитки безалкогольные/Вода минеральная	0	
1197110	4820006120368	Вода минеральная трускавецька заповедная негазированная 0.5л	48140	Продукты питания (folder)/Напитки безалкогольные/Вода минеральная	0	
1197111	4820006120351	Вода минеральная трускавецька заповедная с/газ. 0.5л	48140	Продукты питания (folder)/Напитки безалкогольные/Вода минеральная	0	
48652	4820006120030	Вода минеральная трускавецька заповидна с/газ. 1.5л	48140	Продукты питания (folder)/Напитки безалкогольные/Вода минеральная	48651	Трускавецкая
1197112	4820001820126	Вода минеральная трускавецькая природная 1.5л	48140	Продукты питания (folder)/Напитки безалкогольные/Вода минеральная	0	
1197113	4870031001866	Вода минеральная туран б/г 1.5л	48140	Продукты питания (folder)/Напитки безалкогольные/Вода минеральная	3764215	TURAN (KOKSHETAU MINERALVOD TOO)
1197114	4870031002481	Вода минеральная туран б/г 5л пэт	48140	Продукты питания (folder)/Напитки безалкогольные/Вода минеральная	0	
3294322	4607024871027	Вода минеральная тургояк столовая газированная 0.5л пл/бут	48140	Продукты питания (folder)/Напитки безалкогольные/Вода минеральная	0	
3294323	4607024871003	Вода минеральная тургояк столовая газированная 1.5л пл/бут	48140	Продукты питания (folder)/Напитки безалкогольные/Вода минеральная	0	
3294324	4607024871157	Вода минеральная тургояк столовая негазированная 0.5л пл/бут	48140	Продукты питания (folder)/Напитки безалкогольные/Вода минеральная	0	
3294325	4607024871164	Вода минеральная тургояк столовая негазированная 1.5л пл/бут	48140	Продукты питания (folder)/Напитки безалкогольные/Вода минеральная	0	
3294326	4607018771395	Вода минеральная тэсти Ессентуки №17 0.5л стбут	48140	Продукты питания (folder)/Напитки безалкогольные/Вода минеральная	0	
1197189	4607048910337	Вода минеральная тэсти, славяновская, газированная газированная 1.5л пл/б	48140	Продукты питания (folder)/Напитки безалкогольные/Вода минеральная	3911453	славяновская (TESTI/ZHELEZNOVODSK STAVROPOLSKIY KR)
3294327	4607026490035	Вода минеральная тюменская газированная 1.5л пл/бут	48140	Продукты питания (folder)/Напитки безалкогольные/Вода минеральная	0	
3294328	4607095400010	Вода минеральная тюменская газированная 1.5л пл/бут #2	48140	Продукты питания (folder)/Напитки безалкогольные/Вода минеральная	3929094	тюменская (BEZALKOGOLNYE NAPITKI /TYUMEN)
3294329	4607026490097	Вода минеральная тюменская газированная 1л пл/бут	48140	Продукты питания (folder)/Напитки безалкогольные/Вода минеральная	0	
3294330	4607161820018	Вода минеральная тюменская новая с йодом газированная 1.5л пл/бут	48140	Продукты питания (folder)/Напитки безалкогольные/Вода минеральная	3929109	тюменская NOVAYA (IRYUM/ISETSKOE тюменская OBL.)
3294331	4606386000526	Вода минеральная угличская 0.4л пл/бут	48140	Продукты питания (folder)/Напитки безалкогольные/Вода минеральная	0	
3294332	4607096400231	Вода минеральная угличская 1.5л газированная	48140	Продукты питания (folder)/Напитки безалкогольные/Вода минеральная	3765004	UGLICHSKAYA (VODY UGLICHA)
692578	8008490000021	Вода минеральная уливето сл/газ 1.5л п/б	48140	Продукты питания (folder)/Напитки безалкогольные/Вода минеральная	692577	Уливето
692579	8008490000014	Вода минеральная уливето сл/газ 1л с/б	48140	Продукты питания (folder)/Напитки безалкогольные/Вода минеральная	692577	Уливето
3294333	4601593000239	Вода минеральная урочище долины нарзанов газированная 0.5л пл/бут	48140	Продукты питания (folder)/Напитки безалкогольные/Вода минеральная	0	
3294334	4607115150055	Вода минеральная успеновская газированная 0.5л пл/бут	48140	Продукты питания (folder)/Напитки безалкогольные/Вода минеральная	3932917	успеновская (ISTOCHNIK/PGT KIROVSKIY)
3294335	4607115150062	Вода минеральная успеновская газированная 1.5л пл/бут	48140	Продукты питания (folder)/Напитки безалкогольные/Вода минеральная	3932917	успеновская (ISTOCHNIK/PGT KIROVSKIY)
3294336	4607115150086	Вода минеральная успеновская негазированная 0.5л пл/бут	48140	Продукты питания (folder)/Напитки безалкогольные/Вода минеральная	3932917	успеновская (ISTOCHNIK/PGT KIROVSKIY)
3294337	4607115150116	Вода минеральная успеновская негазированная 6л пл/бут	48140	Продукты питания (folder)/Напитки безалкогольные/Вода минеральная	3932917	успеновская (ISTOCHNIK/PGT KIROVSKIY)
3294338	4607115150109	Вода минеральная успеновская негазированная скв.№25022 2л пл/б	48140	Продукты питания (folder)/Напитки безалкогольные/Вода минеральная	3932917	успеновская (ISTOCHNIK/PGT KIROVSKIY)
48654	4606564001383	Вода минеральная усполонь элитная-1 стол.10л пэт	48140	Продукты питания (folder)/Напитки безалкогольные/Вода минеральная	48653	Усполонь
1197116	4820042980292	Вода минеральная утренняя роса 0.5л (сталкер)	48140	Продукты питания (folder)/Напитки безалкогольные/Вода минеральная	0	
2721278	460708348147	Вода минеральная фабрика качества негазированная 1.0л	48140	Продукты питания (folder)/Напитки безалкогольные/Вода минеральная	0	
2721279	4607083481458	Вода минеральная фабрика качества негазированная 5л	48140	Продукты питания (folder)/Напитки безалкогольные/Вода минеральная	0	
692580	4101090000836	Вода минеральная фахинген медиум газированная 0.25л с/б	48140	Продукты питания (folder)/Напитки безалкогольные/Вода минеральная	48655	Фахинген
48656	4101090000652	Вода минеральная фахинген медиум газированная 750мл	48140	Продукты питания (folder)/Напитки безалкогольные/Вода минеральная	48655	Фахинген
692581	4101090000638	Вода минеральная фахинген медиум газированная 750мл с/б	48140	Продукты питания (folder)/Напитки безалкогольные/Вода минеральная	48655	Фахинген
2977232	4101090000645	Вода минеральная фахинген медиум газированная 750мл с/б #2	48140	Продукты питания (folder)/Напитки безалкогольные/Вода минеральная	48655	Фахинген
692582	4101090000713	Вода минеральная фахинген медиум газированная 750мл с/б рестор	48140	Продукты питания (folder)/Напитки безалкогольные/Вода минеральная	48655	Фахинген
692583	4101090000805	Вода минеральная фахинген штиль 0.25л с/б	48140	Продукты питания (folder)/Напитки безалкогольные/Вода минеральная	48655	Фахинген
692584	4101090000607	Вода минеральная фахинген штиль 750мл с/б	48140	Продукты питания (folder)/Напитки безалкогольные/Вода минеральная	48655	Фахинген
1197198	4101090000614	Вода минеральная фахинген штиль 750мл с/б #2	17388	Продукты питания (folder)/Напитки безалкогольные/Вода питьевая	48655	Фахинген
48657	4101090000621	Вода минеральная фахинген штиль сл/газ.750мл	48140	Продукты питания (folder)/Напитки безалкогольные/Вода минеральная	48655	Фахинген
692585	8006290800780	Вода минеральная феррарелле газированная 0.33л с/б	48140	Продукты питания (folder)/Напитки безалкогольные/Вода минеральная	48658	Феррарелле
48659	8006290800117	Вода минеральная феррарелле газированная 0.33л стбан	48140	Продукты питания (folder)/Напитки безалкогольные/Вода минеральная	48658	Феррарелле
692586	8006290800230	Вода минеральная феррарелле питьев.стекл.750мл	48140	Продукты питания (folder)/Напитки безалкогольные/Вода минеральная	48658	Феррарелле
1660480	8032229000037	Вода минеральная филетте негазированная 750мл с/б	48140	Продукты питания (folder)/Напитки безалкогольные/Вода минеральная	1660479	Филетте
1660481	8032229000051	Вода минеральная филетте сл/газ.750мл с/б	48140	Продукты питания (folder)/Напитки безалкогольные/Вода минеральная	1660479	Филетте
1967521	4810148000208	Вода минеральная фрост Classic фторосодержащая б/г 0.5л пл/б	48140	Продукты питания (folder)/Напитки безалкогольные/Вода минеральная	3661181	FROST (FROST & K)
2856044	4810148000505	Вода минеральная фрост фтор газированная 1л	48140	Продукты питания (folder)/Напитки безалкогольные/Вода минеральная	3661181	FROST (FROST & K)
3672164	4607023759920	Вода минеральная хай скай б/г 1.5 пэт	48140	Продукты питания (folder)/Напитки безалкогольные/Вода минеральная	3672162	ALP SKY (GREENME/SHVEYTSARIYA)
1197205	5010459100072	Вода минеральная хайлэнд спринг газированная ст/б 750мл	48140	Продукты питания (folder)/Напитки безалкогольные/Вода минеральная	47995	Хайленд
191930	5010459005216	Вода минеральная хайлэнд спринг негазированная пэт 0.5л	48140	Продукты питания (folder)/Напитки безалкогольные/Вода минеральная	377783	Highland Spring
191929	5010459005025	Вода минеральная хайлэнд спринг негазированная пэт 1.5л	48140	Продукты питания (folder)/Напитки безалкогольные/Вода минеральная	377783	Highland Spring
