ID	UPCEAN	Name	CategoryID	CategoryName	BrandID	BrandName
3795553	8007885086107	Вода минеральная galvanina Престиж газированная 1.0л	48140	Продукты питания (folder)/Напитки безалкогольные/Вода минеральная	3115664	Galvanina
3662932	8007885086817	Вода минеральная galvanina Престиж негазированная 0.25л	17388	Продукты питания (folder)/Напитки безалкогольные/Вода питьевая	3115664	Galvanina
3795554	8007885086602	Вода минеральная galvanina Престиж негазированная 0.5л	48140	Продукты питания (folder)/Напитки безалкогольные/Вода минеральная	3115664	Galvanina
3795555	8007885086206	Вода минеральная galvanina Престиж негазированная 1.0л	48140	Продукты питания (folder)/Напитки безалкогольные/Вода минеральная	3115664	Galvanina
1789846	8006373033005	Вода минеральная gaudianello газ. 0.33л	48140	Продукты питания (folder)/Напитки безалкогольные/Вода минеральная	0	
1660408	4001513006653	Вода минеральная gerolsteiner naturell негазированная 1л пл/б	48140	Продукты питания (folder)/Напитки безалкогольные/Вода минеральная	1660407	Геролштайнер
3293523	4001513007186	Вода минеральная gerolsteiner sprudel натуральной газации 750мл ст/б	48140	Продукты питания (folder)/Напитки безалкогольные/Вода минеральная	48288	Gerolsteiner
48289	4001513006714	Вода минеральная gerolsteiner газ стбан 0.25л	48140	Продукты питания (folder)/Напитки безалкогольные/Вода минеральная	48288	Gerolsteiner
48290	4001513006738	Вода минеральная gerolsteiner газ стбан 750мл	48140	Продукты питания (folder)/Напитки безалкогольные/Вода минеральная	48288	Gerolsteiner
48293	4001513006219	Вода минеральная gerolsteiner негаз пэт 1.5л	48140	Продукты питания (folder)/Напитки безалкогольные/Вода минеральная	48288	Gerolsteiner
48291	4001513006721	Вода минеральная gerolsteiner негаз стбан 0.25л	48140	Продукты питания (folder)/Напитки безалкогольные/Вода минеральная	48288	Gerolsteiner
48292	4001513006745	Вода минеральная gerolsteiner негаз стбан 750мл	48140	Продукты питания (folder)/Напитки безалкогольные/Вода минеральная	48288	Gerolsteiner
48225	4860019000059	Вода минеральная ggmw Боржоми пэт 0.5л	48140	Продукты питания (folder)/Напитки безалкогольные/Вода минеральная	48222	Боржоми
3293524	4607046360509	Вода минеральная granzwasser 0.5л	48140	Продукты питания (folder)/Напитки безалкогольные/Вода минеральная	3639414	CRANZWASSER (ZELENOGRADSKIY KOOPERATOR/KALININGRAD)
3293525	4607046369557	Вода минеральная granzwasser 1.5л	48140	Продукты питания (folder)/Напитки безалкогольные/Вода минеральная	3639414	CRANZWASSER (ZELENOGRADSKIY KOOPERATOR/KALININGRAD)
3293526	4004870010110	Вода минеральная harzquell classik газированная 0.5л пл/б	48140	Продукты питания (folder)/Напитки безалкогольные/Вода минеральная	0	
3293527	4004870010127	Вода минеральная harzquell classik газированная 1.5л пл/б	48140	Продукты питания (folder)/Напитки безалкогольные/Вода минеральная	0	
3293528	4004870010196	Вода минеральная harzquell classik газированная 1л пл/б	48140	Продукты питания (folder)/Напитки безалкогольные/Вода минеральная	0	
3293529	4004870010172	Вода минеральная harzquell naturelle негазированная 0.5л пл/б	48140	Продукты питания (folder)/Напитки безалкогольные/Вода минеральная	0	
3293530	4004870010189	Вода минеральная harzquell naturelle негазированная 1.5л пл/б	48140	Продукты питания (folder)/Напитки безалкогольные/Вода минеральная	0	
3293531	4004870010202	Вода минеральная harzquell naturelle негазированная 1л пл/б	48140	Продукты питания (folder)/Напитки безалкогольные/Вода минеральная	0	
1196703	4865602000034	Вода минеральная healthy Water бахмаро негаз 0.5л (Грузия)	48140	Продукты питания (folder)/Напитки безалкогольные/Вода минеральная	0	
1196704	4865602000041	Вода минеральная healthy Water бахмаро негазированная 1.5л (Грузия)	48140	Продукты питания (folder)/Напитки безалкогольные/Вода минеральная	3619277	BAKHMARO (HEALTHY WATER LTD)
1196705	4865602000058	Вода минеральная healthy Water набеглави с/газ 0.5л (Грузия)	48140	Продукты питания (folder)/Напитки безалкогольные/Вода минеральная	3709632	NABEGLAVI (HEALTHY WATER LTD)
3293532	4779026980561	Вода минеральная hermis, слаб.газ. 1л пл/б	48140	Продукты питания (folder)/Напитки безалкогольные/Вода минеральная	0	
3677182	4612739640103	Вода минеральная jeyea Crystal прир.газ.0.33л	17388	Продукты питания (folder)/Напитки безалкогольные/Вода питьевая	3677181	JEVEA (AKVA AL'YANS/VICHUGA IVANOVSKAYA OBL.)
3677183	4612739640110	Вода минеральная jeyea Crystal прир.газ.0.5л	17388	Продукты питания (folder)/Напитки безалкогольные/Вода питьевая	3677181	JEVEA (AKVA AL'YANS/VICHUGA IVANOVSKAYA OBL.)
3677184	4612739640127	Вода минеральная jeyea Crystal прир.газ.1л	17388	Продукты питания (folder)/Напитки безалкогольные/Вода питьевая	3677181	JEVEA (AKVA AL'YANS/VICHUGA IVANOVSKAYA OBL.)
3294835	4612739640073	Вода минеральная jeyea Crystal прир.негаз.0.33л	17388	Продукты питания (folder)/Напитки безалкогольные/Вода питьевая	3677181	JEVEA (AKVA AL'YANS/VICHUGA IVANOVSKAYA OBL.)
3294836	4612739640080	Вода минеральная jeyea Crystal прир.негаз.0.5л	17388	Продукты питания (folder)/Напитки безалкогольные/Вода питьевая	3677181	JEVEA (AKVA AL'YANS/VICHUGA IVANOVSKAYA OBL.)
3677185	4612734150317	Вода минеральная jeyea Crystal прир.негаз.1л	17388	Продукты питания (folder)/Напитки безалкогольные/Вода питьевая	3677181	JEVEA (AKVA AL'YANS/VICHUGA IVANOVSKAYA OBL.)
1196901	4870031001552	Вода минеральная kulager-arasan газированная 0.5л пл/бут	48140	Продукты питания (folder)/Напитки безалкогольные/Вода минеральная	3686471	KULAGER-ARASAN (KOKSHETAU MINERALVOD TOO)
48430	8006373033104	Вода минеральная leggera негазир 0.33л	48140	Продукты питания (folder)/Напитки безалкогольные/Вода минеральная	48429	Леджера
1789847	8006373107508	Вода минеральная leggera негазированная 750мл	48140	Продукты питания (folder)/Напитки безалкогольные/Вода минеральная	3689741	LEGGERA (ACQUE MINERALI D'ITALIA/ITALY)
3293533	8801056049881	Вода минеральная lotte icis 0.5л пл/б	48140	Продукты питания (folder)/Напитки безалкогольные/Вода минеральная	3675341	ISIS (LOTTE GROUP)
3293534	8801056087616	Вода минеральная lotte icis 1л пл/б	48140	Продукты питания (folder)/Напитки безалкогольные/Вода минеральная	3675341	ISIS (LOTTE GROUP)
3293535	8801056049904	Вода минеральная lotte icis 2л пл/б	48140	Продукты питания (folder)/Напитки безалкогольные/Вода минеральная	3675341	ISIS (LOTTE GROUP)
48453	8594001021642	Вода минеральная magnesia газированная пл/б 1.5л	48140	Продукты питания (folder)/Напитки безалкогольные/Вода минеральная	48449	Магнезия
3293536	4750042303770	Вода минеральная mangali газированная 1.5л пл/б	48140	Продукты питания (folder)/Напитки безалкогольные/Вода минеральная	0	
3795558	850028000113	Вода минеральная mattoni газированная пл/б 0.5л	48140	Продукты питания (folder)/Напитки безалкогольные/Вода минеральная	3703400	MATTONI
3795559	5903145000070	Вода минеральная mattoni газированная пл/б 1.5л	48140	Продукты питания (folder)/Напитки безалкогольные/Вода минеральная	3703400	MATTONI
3293537	4660010610086	Вода минеральная mever природная 750мл пл/бут	48140	Продукты питания (folder)/Напитки безалкогольные/Вода минеральная	0	
2855807	8600599000911	Вода минеральная mivela mg++газ.0.5л п/б	1	Неклассифицированные/default	3705120	MG MIVELA (AGROKOR/CROATIA)
1660417	8600599000867	Вода минеральная mivela слабогазированная 1.5л пл/б	48140	Продукты питания (folder)/Напитки безалкогольные/Вода минеральная	1660415	МГ Мивела
2855808	8600599000874	Вода минеральная mivela слабогазированная 1л пл/б	1	Неклассифицированные/default	3705120	MG MIVELA (AGROKOR/CROATIA)
2227713	8600599000881	Вода минеральная mivela, сил.газ. 0.5л пл/б	17388	Продукты питания (folder)/Напитки безалкогольные/Вода питьевая	1660415	МГ Мивела
3293538	4607017096413	Вода минеральная mtabi нагутская-26 лечебно-столовая 0.5л пл/бут	48140	Продукты питания (folder)/Напитки безалкогольные/Вода минеральная	0	
2855902	4607017094747	Вода минеральная mtabi нагутская-26 лечебно-столовая 0.5л стбут	48140	Продукты питания (folder)/Напитки безалкогольные/Вода минеральная	3708898	MTABI (RODNYE DALI TPK)
2855900	4607017095904	Вода минеральная mtabi нагутская-26 лечебно-столовая 1.25л пл/бут	48140	Продукты питания (folder)/Напитки безалкогольные/Вода минеральная	3708898	MTABI (RODNYE DALI TPK)
1196969	4820039720269	Вода минеральная Nemiroff Люкс доочишенная 0.5л	48140	Продукты питания (folder)/Напитки безалкогольные/Вода минеральная	0	
1196970	4820039720092	Вода минеральная Nemiroff Люкс доочищенная 1л	48140	Продукты питания (folder)/Напитки безалкогольные/Вода минеральная	0	
1196971	4820039720061	Вода минеральная Nemiroff Люкс доочищенная газ 1.5л	48140	Продукты питания (folder)/Напитки безалкогольные/Вода минеральная	0	
1196972	4820039720030	Вода минеральная Nemiroff Люкс доочищенная газ. 3л	48140	Продукты питания (folder)/Напитки безалкогольные/Вода минеральная	0	
1196973	4820039720023	Вода минеральная Nemiroff Люкс доочищенная негаз 3л	48140	Продукты питания (folder)/Напитки безалкогольные/Вода минеральная	0	
1196974	4820039720085	Вода минеральная Nemiroff Люкс доочищенная негаз 6л	48140	Продукты питания (folder)/Напитки безалкогольные/Вода минеральная	0	
1196975	4820039720016	Вода минеральная Nemiroff Люкс с ароматом лимона 3л	48140	Продукты питания (folder)/Напитки безалкогольные/Вода минеральная	3710179	NATUR BRAVO
2369554	884394000330	Вода минеральная okf Aloe Vera с клубникой 0.5л пл/б	1	Неклассифицированные/default	0	
3293539	4631136691716	Вода минеральная ossetian малогазированная 0.5л пл/бут	48140	Продукты питания (folder)/Напитки безалкогольные/Вода минеральная	0	
3293540	4631136691730	Вода минеральная ossetian малогазированная 0.5л стбут	48140	Продукты питания (folder)/Напитки безалкогольные/Вода минеральная	3727086	OSSETIAN (VLADIMIRSKIY STANDART/VLADIMIR)
3293541	4631136691693	Вода минеральная ossetian малогазированная 1.5л пл/бут	48140	Продукты питания (folder)/Напитки безалкогольные/Вода минеральная	3727086	OSSETIAN (VLADIMIRSKIY STANDART/VLADIMIR)
3293542	4631139759802	Вода минеральная ossetin негазированная 0.5л стекло	48140	Продукты питания (folder)/Напитки безалкогольные/Вода минеральная	0	
3293543	4631139759727	Вода минеральная ossetin негазированная 1.25л пл/бут	48140	Продукты питания (folder)/Напитки безалкогольные/Вода минеральная	0	
452470	4000732002255	Вода минеральная oxy vital негазированная 0.5л	48140	Продукты питания (folder)/Напитки безалкогольные/Вода минеральная	3795560	OXY VITAL
197962	8002270018220	Вода минеральная panna с/б 250мл	48140	Продукты питания (folder)/Напитки безалкогольные/Вода минеральная	48530	Панна
1197009	8002270018237	Вода минеральная panna ст. 750мл Италия	48140	Продукты питания (folder)/Напитки безалкогольные/Вода минеральная	48530	Панна
3293544	5902078004803	Вода минеральная perlage газированная 0.33л пл/бут	48140	Продукты питания (folder)/Напитки безалкогольные/Вода минеральная	0	
1197014	3179730010850	Вода минеральная Perrier 0.330л 0.0%	48140	Продукты питания (folder)/Напитки безалкогольные/Вода минеральная	48518	Perrier
198628	3179730102777	Вода минеральная Perrier 1l	1	Неклассифицированные/default	48518	Perrier
1760580	3179730011352	Вода минеральная Perrier 750мл	17388	Продукты питания (folder)/Напитки безалкогольные/Вода питьевая	48518	Perrier
48521	3179732324818	Вода минеральная Perrier газ пэт 1.0л	48140	Продукты питания (folder)/Напитки безалкогольные/Вода минеральная	48518	Perrier
1197010	3179730013158	Вода минеральная Perrier газ. жб 0.33л (Франция)	48140	Продукты питания (folder)/Напитки безалкогольные/Вода минеральная	0	
1197011	3179730011123	Вода минеральная Perrier газированная с лимоном 750мл (Франция)	48140	Продукты питания (folder)/Напитки безалкогольные/Вода минеральная	48518	Perrier
638856	07478341	Вода минеральная Perrier газированная с/б 0.33л	17388	Продукты питания (folder)/Напитки безалкогольные/Вода питьевая	48518	Perrier
1197151	3179730011369	Вода минеральная Perrier натуральная 0.33л с/б	17388	Продукты питания (folder)/Напитки безалкогольные/Вода питьевая	1197150	Перрье
1660449	3179730010737	Вода минеральная Perrier натуральная 4x0.33л с/б	48140	Продукты питания (folder)/Напитки безалкогольные/Вода минеральная	1197150	Перрье
1660450	3179730012564	Вода минеральная Perrier натуральная 4x0.33л с/б #2	48140	Продукты питания (folder)/Напитки безалкогольные/Вода минеральная	1197150	Перрье
48536	3179732356918	Вода минеральная Perrier натуральная стбан 750мл	48140	Продукты питания (folder)/Напитки безалкогольные/Вода минеральная	48518	Perrier
2954598	3179730110918	Вода минеральная Perrier натуральная стбан 750мл #2	48140	Продукты питания (folder)/Напитки безалкогольные/Вода минеральная	48518	Perrier
2954599	3179730110963	Вода минеральная Perrier натуральная стбан 750мл #3	48140	Продукты питания (folder)/Напитки безалкогольные/Вода минеральная	48518	Perrier
48537	3179730121884	Вода минеральная Perrier п/бут 0.5л	48140	Продукты питания (folder)/Напитки безалкогольные/Вода минеральная	48518	Perrier
1789826	3179730010034	Вода минеральная Perrier прир.пит.стол.газ.750мл	48140	Продукты питания (folder)/Напитки безалкогольные/Вода минеральная	48518	Perrier
692419	3179732348913	Вода минеральная Perrier прир.стол.газ.пэт 1л	48140	Продукты питания (folder)/Напитки безалкогольные/Вода минеральная	48518	Perrier
48519	3179732331014	Вода минеральная Perrier слабогазированная 0.5л	48140	Продукты питания (folder)/Напитки безалкогольные/Вода минеральная	48518	Perrier
1197013	3179730110840	Вода минеральная Perrier ст. 0.2л (Франция)	48140	Продукты питания (folder)/Напитки безалкогольные/Вода минеральная	48518	Perrier
3795561	80531999	Вода минеральная plose высш.кат.газ.0.25л	48140	Продукты питания (folder)/Напитки безалкогольные/Вода минеральная	0	
3795562	80531944	Вода минеральная plose высш.кат.газ.750мл	48140	Продукты питания (folder)/Напитки безалкогольные/Вода минеральная	0	
3795563	80531982	Вода минеральная plose высш.кат.негаз 0.25л	48140	Продукты питания (folder)/Напитки безалкогольные/Вода минеральная	0	
3795564	80531920	Вода минеральная plose высш.кат.негаз 750мл	48140	Продукты питания (folder)/Напитки безалкогольные/Вода минеральная	0	
3293545	4770552224563	Вода минеральная premium б/г 1.5л пл/б	48140	Продукты питания (folder)/Напитки безалкогольные/Вода минеральная	0	
3293546	4770552340119	Вода минеральная rasa active Life столовая негазированная 750мл пл/бут	48140	Продукты питания (folder)/Напитки безалкогольные/Вода минеральная	0	
3293547	4770552224556	Вода минеральная rasa Премиум газированная 1.5л пэт	48140	Продукты питания (folder)/Напитки безалкогольные/Вода минеральная	0	
3293548	4770552223719	Вода минеральная rasa,premium,негаз. 0.33л, ст/б	48140	Продукты питания (folder)/Напитки безалкогольные/Вода минеральная	0	
3293549	4770552223658	Вода минеральная rasa,premium,негаз. 0.5л пл/б	48140	Продукты питания (folder)/Напитки безалкогольные/Вода минеральная	0	
3293550	4770552223610	Вода минеральная rasa,premium,негаз. 1.5л пл/б	48140	Продукты питания (folder)/Напитки безалкогольные/Вода минеральная	0	
692517	8009245020028	Вода минеральная rocchetta негаз 750мл с/б	48140	Продукты питания (folder)/Напитки безалкогольные/Вода минеральная	692516	Рокетта
2428002	4607012100030	Вода минеральная rodnikoff курортная природная столовая 1.5л п/б	17388	Продукты питания (folder)/Напитки безалкогольные/Вода питьевая	3821519	кисловодская (KAVMINPROD/PYATIGORSK)
1660466	4860001590162	Вода минеральная sairme газированная 1л тв/уп	48140	Продукты питания (folder)/Напитки безалкогольные/Вода минеральная	1660461	Саирме
200700	80008811	Вода минеральная san benedetto газ. 0.5л #2	48140	Продукты питания (folder)/Напитки безалкогольные/Вода минеральная	200699	SAN BENEDETTO
1197052	8001620001905	Вода минеральная san benedetto газированная 1.5л	48140	Продукты питания (folder)/Напитки безалкогольные/Вода минеральная	200699	SAN BENEDETTO
1197055	8001620002278	Вода минеральная san benedetto негаз 2л	48140	Продукты питания (folder)/Напитки безалкогольные/Вода минеральная	0	
1197053	80008859	Вода минеральная san benedetto негазированная 0.5л #2	48140	Продукты питания (folder)/Напитки безалкогольные/Вода минеральная	200699	SAN BENEDETTO
1197054	8001620001899	Вода минеральная san benedetto негазированная 1.5л	48140	Продукты питания (folder)/Напитки безалкогольные/Вода минеральная	200699	SAN BENEDETTO
1197056	80007838	Вода минеральная san benedetto пэт газированная 0.5л	48140	Продукты питания (folder)/Напитки безалкогольные/Вода минеральная	200699	SAN BENEDETTO
1197057	80007951	Вода минеральная san benedetto пэт негазирован. 0.5л	48140	Продукты питания (folder)/Напитки безалкогольные/Вода минеральная	200699	SAN BENEDETTO
692532	8002270015373	Вода минеральная san pellegrino газ 0.5л п/б	48140	Продукты питания (folder)/Напитки безалкогольные/Вода минеральная	411648	San Pellegrino
48590	8002270018602	Вода минеральная san pellegrino газ 1л стбан	48140	Продукты питания (folder)/Напитки безалкогольные/Вода минеральная	411648	San Pellegrino
2954605	8002270015564	Вода минеральная san pellegrino газ 1л стбан #2	48140	Продукты питания (folder)/Напитки безалкогольные/Вода минеральная	411648	San Pellegrino
1197170	8002270015991	Вода минеральная san pellegrino газ.0.25л с/б	17388	Продукты питания (folder)/Напитки безалкогольные/Вода питьевая	411648	San Pellegrino
2227729	8002270536472	Вода минеральная san pellegrino газ.0.5л с/б	17388	Продукты питания (folder)/Напитки безалкогольные/Вода питьевая	411648	San Pellegrino
